number,value,datetime_start,datetime_complete,duration,params_base_loss,params_batch_size,params_dropout,params_early_stopping_patience,params_focal_gamma,params_hidden_dim_min,params_huber_delta,params_layers_ACE15,params_layers_ACE18,params_layers_ADHD9,params_layers_ASD9,params_layers_PRS,params_layers_SCZ15,params_layers_SES,params_layers_SEX,params_layers_SUD18,params_learning_rate,params_n_bins,params_num_epochs,params_scheduler_factor,params_scheduler_patience,params_se_reduction,params_weight_decay,state
77,0.15186479668624395,2026-04-27 20:13:00.330296,2026-04-27 20:13:39.555691,0 days 00:00:39.225395,huber,6,0.23193859947703854,4,1.4202142856212807,4,0.16627056512395205,4,5,1,6,3,6,2,5,3,0.0006375356022494405,20,19,0.5035714396657909,5,3,0.00012393411772181642,COMPLETE
78,0.18490586231236822,2026-04-27 20:13:39.556499,2026-04-27 20:13:46.837369,0 days 00:00:07.280870,huber,32,0.2815916007965903,3,1.129555721824689,4,0.15384666509764244,3,5,2,6,3,6,3,5,4,0.0009062174558925488,19,21,0.4605425502467831,5,2,0.0002764535426652408,COMPLETE
79,0.14899411119154607,2026-04-27 20:13:46.838162,2026-04-27 20:15:26.229911,0 days 00:01:39.391749,huber,4,0.2554026434226654,3,0.858463489213486,3,0.1388211963235292,4,5,1,7,4,7,3,5,3,0.00022455256348157083,18,19,0.5181486408644892,5,3,3.9702420519184585e-05,COMPLETE
80,0.16245295412113867,2026-04-27 20:15:26.245685,2026-04-27 20:16:22.823946,0 days 00:00:56.578261,huber,6,0.2534471203469884,3,0.8390357697726913,3,0.13913664150850702,3,6,1,7,4,7,3,6,3,0.00021089015890893468,19,19,0.5677777004780151,5,3,0.00017903422444484726,PRUNED
81,0.14825416838187774,2026-04-27 20:16:22.825126,2026-04-27 20:18:05.731225,0 days 00:01:42.906099,huber,4,0.24233091212431557,4,1.3043544590836897,4,0.17438262633923302,4,5,1,7,4,7,3,5,3,0.0007723851956271341,18,18,0.48602426412499666,5,3,4.029949877032903e-05,COMPLETE
82,0.1521340969413274,2026-04-27 20:18:05.732377,2026-04-27 20:21:46.432120,0 days 00:03:40.699743,huber,4,0.3062965932681278,4,0.9612863986941075,4,0.17381706043149484,4,5,1,7,4,7,3,5,4,9.033073191527853e-05,18,18,0.5197167904872542,5,3,3.862170164839502e-05,COMPLETE
83,0.15536748688909174,2026-04-27 20:21:46.445422,2026-04-27 20:22:48.378374,0 days 00:01:01.932952,huber,4,0.27301788170884345,4,1.2804101119532285,3,0.17632875706690865,4,5,1,7,4,7,3,5,3,0.000350028598119616,18,20,0.4912231846132901,5,2,8.385228754467822e-05,COMPLETE
84,0.15031586683908174,2026-04-27 20:22:48.379133,2026-04-27 20:24:32.038791,0 days 00:01:43.659658,huber,4,0.23959899442722937,3,1.1504245567061715,3,0.19551649497453305,4,6,1,7,4,6,3,6,3,0.0011162264496382556,19,14,0.5400832961270569,5,3,5.16931191482559e-05,COMPLETE
85,0.15029959586579958,2026-04-27 20:24:32.040486,2026-04-27 20:26:14.497156,0 days 00:01:42.456670,huber,4,0.21609430902189056,4,1.315795817032698,4,0.18515119322418827,3,5,1,7,5,7,3,5,2,0.0007725185722606423,17,17,0.587208875432711,5,3,0.0005278415760429501,COMPLETE
86,0.15579347675363953,2026-04-27 20:26:14.498675,2026-04-27 20:27:18.834382,0 days 00:01:04.335707,huber,6,0.22663835177209696,3,0.6165905191124867,6,0.1493547828150098,4,6,2,6,4,7,3,5,2,0.00043100178060055466,18,17,0.4951243360741771,5,3,7.113749082675146e-05,COMPLETE
87,0.14930533523383135,2026-04-27 20:27:18.835331,2026-04-27 20:29:34.770558,0 days 00:02:15.935227,huber,4,0.2578570268412294,5,1.4444036792996884,4,0.13146501758031282,4,5,2,7,3,6,2,5,3,0.0005971610054962349,20,20,0.5156662955896844,5,3,2.119556070878903e-05,COMPLETE
88,0.15404136845514504,2026-04-27 20:29:34.771317,2026-04-27 20:30:30.653455,0 days 00:00:55.882138,huber,8,0.293028394063213,4,1.5243024236813936,13,0.1559896782712897,4,6,1,6,7,7,3,6,4,0.0002884835557222473,16,22,0.5336807838084924,5,2,9.94394966730933e-05,COMPLETE
89,0.1526486268282727,2026-04-27 20:30:30.654214,2026-04-27 20:31:49.041090,0 days 00:01:18.386876,huber,6,0.23837922037185455,5,0.8853347841075395,5,0.1681501716684291,3,4,2,7,4,6,3,6,2,0.002841107989157469,17,18,0.5540804744309578,5,3,3.392050597900145e-05,COMPLETE
90,0.14935298369375447,2026-04-27 20:31:49.041880,2026-04-27 20:33:55.204560,0 days 00:02:06.162680,mse,4,0.24647531733012285,4,0.9914961979427608,3,0.12792008317099135,4,6,1,6,6,6,3,5,2,0.00024154039472806314,19,16,0.4818260891078594,5,4,4.241216079508776e-05,COMPLETE
91,0.15104393436658825,2026-04-27 20:33:55.205352,2026-04-27 20:35:20.974044,0 days 00:01:25.768692,huber,4,0.2657550601065615,5,1.2123116755905246,4,0.13522375321431365,4,5,2,7,3,6,2,5,3,0.0006107406077184827,20,20,0.5134875554214362,5,3,2.23621798808624e-05,COMPLETE
92,0.15202886488397135,2026-04-27 20:35:20.974834,2026-04-27 20:36:33.286812,0 days 00:01:12.311978,huber,4,0.2570083463333829,5,1.389397569263085,4,0.1312193181284654,4,5,2,7,3,6,1,5,3,0.0009527405940116725,20,19,0.5196537723770246,5,3,3.0030703419289422e-05,COMPLETE
93,0.1486369537197671,2026-04-27 20:36:33.287776,2026-04-27 20:38:14.307653,0 days 00:01:41.019877,huber,4,0.2835418893351052,5,1.4414557036406739,5,0.14281472631347678,4,5,2,7,3,7,2,5,3,0.001694279860505864,18,22,0.5026051413687211,5,3,2.1912802522883962e-05,COMPLETE
94,0.14877304624892568,2026-04-27 20:38:14.308435,2026-04-27 20:40:40.483637,0 days 00:02:26.175202,huber,4,0.3358037018104981,3,1.5686792853992921,14,0.12139349967097018,4,4,2,7,5,7,2,5,5,0.0008231480629028033,18,22,0.502908234517018,5,4,1.665139692052123e-05,COMPLETE
95,0.14985916435307237,2026-04-27 20:40:40.496727,2026-04-27 20:41:33.864810,0 days 00:00:53.368083,huber,6,0.2773454206125535,3,1.5830032825175055,11,0.14092834584117514,3,5,2,7,3,7,1,5,5,0.001717554682593893,18,22,0.49905085929962795,5,3,1.577197388461068e-05,COMPLETE
96,0.16174759192973648,2026-04-27 20:41:33.865715,2026-04-27 20:41:44.681976,0 days 00:00:10.816261,huber,32,0.3306286383388887,3,1.6440360646617516,11,0.14679746917665165,4,5,2,7,4,7,2,5,5,0.0014438598287127775,19,21,0.3152871570895518,5,2,5.621754115099269e-05,COMPLETE
97,0.15106241861924366,2026-04-27 20:41:44.682913,2026-04-27 20:43:58.776269,0 days 00:02:14.093356,huber,4,0.3535035056190546,3,1.4842257935893959,13,0.1600837955731437,4,6,1,7,4,7,2,7,4,0.0019406982977724732,17,22,0.504145209010457,5,4,0.0002017394631751699,COMPLETE
98,0.1488755438447975,2026-04-27 20:43:58.777027,2026-04-27 20:44:49.919465,0 days 00:00:51.142438,huber,6,0.3191533916872466,4,1.3489260646721872,15,0.18117651505494553,4,5,2,6,3,7,2,5,2,0.0010849228515486988,18,23,0.5331445823581011,5,3,4.594453739845329e-05,COMPLETE
99,0.1533734114233539,2026-04-27 20:44:49.920252,2026-04-27 20:45:45.814993,0 days 00:00:55.894741,huber,6,0.31245516007911833,3,2.7470057371266385,15,0.1836436627919617,5,6,2,7,4,7,2,6,2,0.00117996517124966,18,21,0.5602417361478913,5,4,4.8129793974872156e-05,COMPLETE
