[I 2026-04-28 00:26:53,056] Trial 48 finished with value: 0.08922223022540936 and parameters: {'learning_rate': 0.0007079949016491374, 'batch_size': 4, 'num_epochs': 29, 'weight_decay': 0.0068137122731384055, 'depth_complex': 3, 'depth_moderate': 3, 'depth_simple': 1, 'dropout': 0.2989321699167964, 'se_reduction': 3, 'hidden_dim_min': 7, 'base_loss': 'huber', 'huber_delta': 0.015830699470540176, 'focal_gamma': 2.822277881414741, 'n_bins': 6, 'scheduler_patience': 2, 'scheduler_factor': 0.6412359612167862, 'early_stopping_patience': 7}. Best is trial 22 with value: 0.08764163086185245.
Train: 2407 rows (1613 IDs),Test: 598 rows (404 IDs) 

n_features_x : 6, n_features_per_modality: [16, 23, 19, 17, 7, 4, 4, 4, 1, 4]

--- ImbalancedRegressionLoss initialized ---
  Bins: 7, Focal gamma: 1.442778505018326, Base loss: huber
  Bin [0.00, 0.14): count= 1370, weight=0.002
  Bin [0.14, 0.29): count=  892, weight=0.003
  Bin [0.29, 0.43): count=  120, weight=0.024
  Bin [0.43, 0.57): count=   23, weight=0.122
  Bin [0.57, 0.71): count=    2, weight=0.978
  Bin [0.71, 0.86): count=    0, weight=2.935
  Bin [0.86, 1.00): count=    0, weight=2.935
-------------------------------------------

  Pred range: [0.0468, 0.3697], std: 0.0480
  RMSE : 0.0955, R2: 0.0996, MAE: 0.0762, Spearman rho: 0.3571, Spearman p: 1.9949e-19, Pearson r: 0.3580, Pearson p: 1.6061e-19
  Pred range: [0.0484, 0.3860], std: 0.0547
  RMSE : 0.0950, R2: 0.1075, MAE: 0.0760, Spearman rho: 0.4072, Spearman p: 2.6993e-25, Pearson r: 0.4128, Pearson p: 5.2825e-26
  Pred range: [0.0455, 0.3679], std: 0.0561
  RMSE : 0.0935, R2: 0.1368, MAE: 0.0746, Spearman rho: 0.4270, Spearman p: 6.7711e-28, Pearson r: 0.4340, Pearson p: 7.2384e-29
  Pred range: [0.0353, 0.3480], std: 0.0559
  RMSE : 0.0908, R2: 0.1847, MAE: 0.0721, Spearman rho: 0.4455, Spearman p: 1.6903e-30, Pearson r: 0.4512, Pearson p: 2.5082e-31
  Pred range: [0.0396, 0.3650], std: 0.0579
  RMSE : 0.0913, R2: 0.1755, MAE: 0.0728, Spearman rho: 0.4523, Spearman p: 1.7452e-31, Pearson r: 0.4586, Pearson p: 1.9581e-32
  Pred range: [0.0448, 0.3802], std: 0.0594
  RMSE : 0.0927, R2: 0.1504, MAE: 0.0743, Spearman rho: 0.4553, Spearman p: 6.1604e-32, Pearson r: 0.4626, Pearson p: 4.7794e-33
  Pred range: [0.0390, 0.3588], std: 0.0566
  RMSE : 0.0899, R2: 0.2011, MAE: 0.0715, Spearman rho: 0.4604, Spearman p: 1.0360e-32, Pearson r: 0.4687, Pearson p: 5.5689e-34
  Pred range: [0.0497, 0.3753], std: 0.0572
  RMSE : 0.0918, R2: 0.1664, MAE: 0.0737, Spearman rho: 0.4616, Spearman p: 6.8750e-33, Pearson r: 0.4705, Pearson p: 2.8382e-34
  Pred range: [0.0431, 0.3672], std: 0.0568
  RMSE : 0.0902, R2: 0.1966, MAE: 0.0720, Spearman rho: 0.4636, Spearman p: 3.4358e-33, Pearson r: 0.4733, Pearson p: 1.0279e-34
  Pred range: [0.0531, 0.3848], std: 0.0576
  RMSE : 0.0926, R2: 0.1535, MAE: 0.0744, Spearman rho: 0.4638, Spearman p: 3.1260e-33, Pearson r: 0.4732, Pearson p: 1.0650e-34
  Pred range: [0.0435, 0.3692], std: 0.0567
  RMSE : 0.0902, R2: 0.1958, MAE: 0.0721, Spearman rho: 0.4648, Spearman p: 2.2421e-33, Pearson r: 0.4742, Pearson p: 7.5055e-35
  Pred range: [0.0506, 0.3908], std: 0.0590
  RMSE : 0.0929, R2: 0.1465, MAE: 0.0747, Spearman rho: 0.4651, Spearman p: 1.9601e-33, Pearson r: 0.4741, Pearson p: 7.6938e-35
  Pred range: [0.0382, 0.3782], std: 0.0578
  RMSE : 0.0908, R2: 0.1851, MAE: 0.0725, Spearman rho: 0.4677, Spearman p: 7.7789e-34, Pearson r: 0.4761, Pearson p: 3.6741e-35
