[I 2026-04-28 01:20:59,131] Trial 42 finished with value: 0.15082863399151403 and parameters: {'learning_rate': 0.00022478113134311817, 'batch_size': 4, 'num_epochs': 12, 'weight_decay': 2.1965163978499552e-05, 'depth_complex': 5, 'depth_moderate': 3, 'depth_simple': 2, 'dropout': 0.27586849868724284, 'se_reduction': 7, 'hidden_dim_min': 7, 'base_loss': 'huber', 'huber_delta': 0.10301383999020815, 'focal_gamma': 1.9836351880896972, 'n_bins': 8, 'scheduler_patience': 3, 'scheduler_factor': 0.4076742537788666, 'early_stopping_patience': 5}. Best is trial 41 with value: 0.14814692842961857.
Train: 2407 rows (1613 IDs),Test: 598 rows (404 IDs) 

n_features_x : 6, n_features_per_modality: [16, 23, 19, 17, 7, 4, 4, 4, 1, 4]

--- ImbalancedRegressionLoss initialized ---
  Bins: 11, Focal gamma: 2.4301841024624267, Base loss: huber
  Bin [0.00, 0.09): count=  585, weight=0.034
  Bin [0.09, 0.18): count=  580, weight=0.034
  Bin [0.18, 0.27): count=  421, weight=0.047
  Bin [0.27, 0.36): count=  312, weight=0.064
  Bin [0.36, 0.45): count=  207, weight=0.096
  Bin [0.45, 0.55): count=  108, weight=0.183
  Bin [0.55, 0.64): count=  125, weight=0.159
  Bin [0.64, 0.73): count=   41, weight=0.476
  Bin [0.73, 0.82): count=   21, weight=0.909
  Bin [0.82, 0.91): count=    4, weight=3.999
  Bin [0.91, 1.00): count=    3, weight=4.998
-------------------------------------------

  Pred range: [0.1615, 0.6716], std: 0.0853
  RMSE : 0.1718, R2: 0.0143, MAE: 0.1460, Spearman rho: 0.4321, Spearman p: 1.3242e-28, Pearson r: 0.4474, Pearson p: 8.9270e-31
  Pred range: [0.1195, 0.6358], std: 0.0867
  RMSE : 0.1550, R2: 0.1976, MAE: 0.1273, Spearman rho: 0.4767, Spearman p: 2.9188e-35, Pearson r: 0.4904, Pearson p: 1.6456e-37
  Pred range: [0.0938, 0.5926], std: 0.0898
  RMSE : 0.1509, R2: 0.2395, MAE: 0.1207, Spearman rho: 0.4849, Spearman p: 1.3657e-36, Pearson r: 0.5013, Pearson p: 2.2501e-39
  Pred range: [0.1312, 0.6971], std: 0.0989
  RMSE : 0.1627, R2: 0.1162, MAE: 0.1359, Spearman rho: 0.4965, Spearman p: 1.5590e-38, Pearson r: 0.5127, Pearson p: 2.1527e-41
  Pred range: [0.1266, 0.6341], std: 0.0963
  RMSE : 0.1636, R2: 0.1067, MAE: 0.1369, Spearman rho: 0.4894, Spearman p: 2.4375e-37, Pearson r: 0.5087, Pearson p: 1.1150e-40
  Pred range: [0.1103, 0.6201], std: 0.0907
  RMSE : 0.1550, R2: 0.1986, MAE: 0.1275, Spearman rho: 0.4831, Spearman p: 2.7215e-36, Pearson r: 0.5070, Pearson p: 2.2604e-40
  Pred range: [0.0718, 0.6313], std: 0.0977
  RMSE : 0.1506, R2: 0.2428, MAE: 0.1200, Spearman rho: 0.4855, Spearman p: 1.0673e-36, Pearson r: 0.5072, Pearson p: 2.1136e-40
  Pred range: [0.0461, 0.6603], std: 0.1010
  RMSE : 0.1530, R2: 0.2189, MAE: 0.1236, Spearman rho: 0.4896, Spearman p: 2.2512e-37, Pearson r: 0.5084, Pearson p: 1.2830e-40
  Pred range: [0.0143, 0.6627], std: 0.0995
  RMSE : 0.1524, R2: 0.2251, MAE: 0.1207, Spearman rho: 0.4761, Spearman p: 3.6983e-35, Pearson r: 0.4927, Pearson p: 6.7317e-38
  Pred range: [0.0662, 0.6890], std: 0.0978
  RMSE : 0.1559, R2: 0.1888, MAE: 0.1277, Spearman rho: 0.4828, Spearman p: 3.0118e-36, Pearson r: 0.5047, Pearson p: 5.6409e-40
  Pred range: [0.0463, 0.6422], std: 0.0929
  RMSE : 0.1530, R2: 0.2184, MAE: 0.1238, Spearman rho: 0.4844, Spearman p: 1.6613e-36, Pearson r: 0.5061, Pearson p: 3.2998e-40
[I 2026-04-28 01:22:19,711] Trial 43 finished with value: 0.1506130876816669 and parameters: {'learning_rate': 0.00041504754129153084, 'batch_size': 4, 'num_epochs': 11, 'weight_decay': 1.663540468385577e-05, 'depth_complex': 4, 'depth_moderate': 2, 'depth_simple': 2, 'dropout': 0.18865519921532808, 'se_reduction': 7, 'hidden_dim_min': 10, 'base_loss': 'huber', 'huber_delta': 0.11205483878683975, 'focal_gamma': 2.4301841024624267, 'n_bins': 11, 'scheduler_patience': 4, 'scheduler_factor': 0.5366893360998788, 'early_stopping_patience': 6}. Best is trial 41 with value: 0.14814692842961857.
Train: 2407 rows (1613 IDs),Test: 598 rows (404 IDs) 

n_features_x : 6, n_features_per_modality: [16, 23, 19, 17, 7, 4, 4, 4, 1, 4]

--- ImbalancedRegressionLoss initialized ---
  Bins: 9, Focal gamma: 1.7157631364350165, Base loss: huber
  Bin [0.00, 0.11): count=  585, weight=0.041
  Bin [0.11, 0.22): count=  746, weight=0.032
  Bin [0.22, 0.33): count=  478, weight=0.050
  Bin [0.33, 0.44): count=  231, weight=0.104
  Bin [0.44, 0.56): count=  215, weight=0.112
  Bin [0.56, 0.67): count=  100, weight=0.239
  Bin [0.67, 0.78): count=   36, weight=0.653
  Bin [0.78, 0.89): count=   13, weight=1.726
  Bin [0.89, 1.00): count=    3, weight=6.041
-------------------------------------------

  Pred range: [0.0865, 0.6352], std: 0.0946
  RMSE : 0.1651, R2: 0.0900, MAE: 0.1367, Spearman rho: 0.4591, Spearman p: 1.6646e-32, Pearson r: 0.4629, Pearson p: 4.2579e-33
  Pred range: [0.0780, 0.6142], std: 0.0924
  RMSE : 0.1519, R2: 0.2300, MAE: 0.1220, Spearman rho: 0.4897, Spearman p: 2.2127e-37, Pearson r: 0.4998, Pearson p: 4.1082e-39
  Pred range: [0.1080, 0.6084], std: 0.0927
  RMSE : 0.1582, R2: 0.1641, MAE: 0.1304, Spearman rho: 0.4921, Spearman p: 8.5464e-38, Pearson r: 0.5045, Pearson p: 6.1551e-40
  Pred range: [0.0484, 0.5785], std: 0.0960
  RMSE : 0.1491, R2: 0.2582, MAE: 0.1174, Spearman rho: 0.4936, Spearman p: 4.7560e-38, Pearson r: 0.5105, Pearson p: 5.2944e-41
  Pred range: [0.0717, 0.5593], std: 0.0982
  RMSE : 0.1495, R2: 0.2540, MAE: 0.1194, Spearman rho: 0.5015, Spearman p: 2.1081e-39, Pearson r: 0.5180, Pearson p: 2.2841e-42
  Pred range: [0.0813, 0.6047], std: 0.0990
  RMSE : 0.1545, R2: 0.2034, MAE: 0.1257, Spearman rho: 0.4920, Spearman p: 8.8276e-38, Pearson r: 0.5080, Pearson p: 1.5084e-40
  Pred range: [0.0573, 0.5985], std: 0.0974
  RMSE : 0.1535, R2: 0.2140, MAE: 0.1242, Spearman rho: 0.4922, Spearman p: 8.3183e-38, Pearson r: 0.5039, Pearson p: 7.9722e-40
  Pred range: [0.0282, 0.6133], std: 0.0953
  RMSE : 0.1537, R2: 0.2117, MAE: 0.1244, Spearman rho: 0.4808, Spearman p: 6.5009e-36, Pearson r: 0.4958, Pearson p: 2.0041e-38
  Pred range: [0.0307, 0.6417], std: 0.1010
  RMSE : 0.1549, R2: 0.1986, MAE: 0.1260, Spearman rho: 0.4855, Spearman p: 1.1055e-36, Pearson r: 0.5034, Pearson p: 9.5515e-40
[I 2026-04-28 01:23:26,210] Trial 44 finished with value: 0.14907796619559957 and parameters: {'learning_rate': 0.0006998933060198174, 'batch_size': 4, 'num_epochs': 13, 'weight_decay': 3.908523983093765e-05, 'depth_complex': 3, 'depth_moderate': 3, 'depth_simple': 2, 'dropout': 0.4182021682122563, 'se_reduction': 8, 'hidden_dim_min': 9, 'base_loss': 'huber', 'huber_delta': 0.07242626035781237, 'focal_gamma': 1.7157631364350165, 'n_bins': 9, 'scheduler_patience': 5, 'scheduler_factor': 0.3201139174170302, 'early_stopping_patience': 5}. Best is trial 41 with value: 0.14814692842961857.
Train: 2407 rows (1613 IDs),Test: 598 rows (404 IDs) 

n_features_x : 6, n_features_per_modality: [16, 23, 19, 17, 7, 4, 4, 4, 1, 4]

--- ImbalancedRegressionLoss initialized ---
  Bins: 5, Focal gamma: 1.7194267200933206, Base loss: huber
  Bin [0.00, 0.20): count= 1165, weight=0.037
  Bin [0.20, 0.40): count=  806, weight=0.054
  Bin [0.40, 0.60): count=  320, weight=0.136
  Bin [0.60, 0.80): count=  107, weight=0.404
  Bin [0.80, 1.00): count=    9, weight=4.368
-------------------------------------------

  Pred range: [0.0129, 0.5583], std: 0.0869
  RMSE : 0.1541, R2: 0.2071, MAE: 0.1217, Spearman rho: 0.4362, Spearman p: 3.5779e-29, Pearson r: 0.4611, Pearson p: 8.2112e-33
  Pred range: [0.1382, 0.7292], std: 0.1052
  RMSE : 0.1699, R2: 0.0360, MAE: 0.1415, Spearman rho: 0.4813, Spearman p: 5.3975e-36, Pearson r: 0.4979, Pearson p: 8.8623e-39
  Pred range: [0.0901, 0.7539], std: 0.1194
  RMSE : 0.1659, R2: 0.0818, MAE: 0.1344, Spearman rho: 0.4681, Spearman p: 6.8762e-34, Pearson r: 0.4926, Pearson p: 6.9666e-38
  Pred range: [0.1468, 0.7098], std: 0.0828
  RMSE : 0.1733, R2: -0.0025, MAE: 0.1470, Spearman rho: 0.4641, Spearman p: 2.8421e-33, Pearson r: 0.4674, Pearson p: 8.5991e-34
  Pred range: [0.1273, 0.5648], std: 0.0906
  RMSE : 0.1585, R2: 0.1615, MAE: 0.1292, Spearman rho: 0.4573, Spearman p: 3.0702e-32, Pearson r: 0.4738, Pearson p: 8.5311e-35
  Pred range: [0.0917, 0.5848], std: 0.0895
  RMSE : 0.1535, R2: 0.2140, MAE: 0.1241, Spearman rho: 0.4739, Spearman p: 8.3822e-35, Pearson r: 0.4918, Pearson p: 9.6435e-38
  Pred range: [0.0385, 0.7321], std: 0.1056
  RMSE : 0.1614, R2: 0.1304, MAE: 0.1311, Spearman rho: 0.4435, Spearman p: 3.3522e-30, Pearson r: 0.4638, Pearson p: 3.1758e-33
  Pred range: [0.1158, 0.6342], std: 0.0897
  RMSE : 0.1537, R2: 0.2109, MAE: 0.1218, Spearman rho: 0.4487, Spearman p: 5.8392e-31, Pearson r: 0.4649, Pearson p: 2.1301e-33
  Pred range: [0.0345, 0.6033], std: 0.0923
  RMSE : 0.1574, R2: 0.1734, MAE: 0.1270, Spearman rho: 0.4224, Spearman p: 2.8352e-27, Pearson r: 0.4482, Pearson p: 6.8089e-31
  Pred range: [0.1265, 0.6784], std: 0.0918
  RMSE : 0.1592, R2: 0.1540, MAE: 0.1308, Spearman rho: 0.4369, Spearman p: 2.9004e-29, Pearson r: 0.4609, Pearson p: 8.6399e-33
  Pred range: [0.0249, 0.5661], std: 0.0970
  RMSE : 0.1545, R2: 0.2031, MAE: 0.1206, Spearman rho: 0.4410, Spearman p: 7.5448e-30, Pearson r: 0.4615, Pearson p: 7.1647e-33
[I 2026-04-28 01:24:53,916] Trial 45 finished with value: 0.1534545577991972 and parameters: {'learning_rate': 0.009391721588203594, 'batch_size': 4, 'num_epochs': 11, 'weight_decay': 4.523283153437707e-05, 'depth_complex': 3, 'depth_moderate': 3, 'depth_simple': 3, 'dropout': 0.37406960208479784, 'se_reduction': 8, 'hidden_dim_min': 8, 'base_loss': 'huber', 'huber_delta': 0.07425768602996831, 'focal_gamma': 1.7194267200933206, 'n_bins': 5, 'scheduler_patience': 4, 'scheduler_factor': 0.3032001557571844, 'early_stopping_patience': 5}. Best is trial 41 with value: 0.14814692842961857.
Train: 2407 rows (1613 IDs),Test: 598 rows (404 IDs) 

n_features_x : 6, n_features_per_modality: [16, 23, 19, 17, 7, 4, 4, 4, 1, 4]

--- ImbalancedRegressionLoss initialized ---
  Bins: 7, Focal gamma: 2.212915503343413, Base loss: huber
  Bin [0.00, 0.14): count=  760, weight=0.038
  Bin [0.14, 0.29): count=  826, weight=0.035
  Bin [0.29, 0.43): count=  454, weight=0.063
  Bin [0.43, 0.57): count=  215, weight=0.133
  Bin [0.57, 0.71): count=  110, weight=0.258
  Bin [0.71, 0.86): count=   38, weight=0.736
  Bin [0.86, 1.00): count=    4, weight=5.738
-------------------------------------------

  Pred range: [0.0929, 0.6323], std: 0.0966
  RMSE : 0.1564, R2: 0.1832, MAE: 0.1276, Spearman rho: 0.4860, Spearman p: 8.9521e-37, Pearson r: 0.5038, Pearson p: 8.3045e-40
  Pred range: [0.0836, 0.6270], std: 0.1026
  RMSE : 0.1509, R2: 0.2400, MAE: 0.1194, Spearman rho: 0.4947, Spearman p: 3.1035e-38, Pearson r: 0.5110, Pearson p: 4.3317e-41
  Pred range: [0.1084, 0.6768], std: 0.1041
  RMSE : 0.1697, R2: 0.0385, MAE: 0.1420, Spearman rho: 0.4960, Spearman p: 1.8365e-38, Pearson r: 0.5113, Pearson p: 3.7701e-41
  Pred range: [0.0431, 0.5964], std: 0.1002
  RMSE : 0.1526, R2: 0.2226, MAE: 0.1228, Spearman rho: 0.4894, Spearman p: 2.4137e-37, Pearson r: 0.5073, Pearson p: 2.0267e-40
  Pred range: [0.0471, 0.6244], std: 0.0978
  RMSE : 0.1603, R2: 0.1422, MAE: 0.1327, Spearman rho: 0.4849, Spearman p: 1.3862e-36, Pearson r: 0.5021, Pearson p: 1.6592e-39
  Pred range: [0.0220, 0.5794], std: 0.0953
  RMSE : 0.1504, R2: 0.2450, MAE: 0.1160, Spearman rho: 0.4811, Spearman p: 5.7994e-36, Pearson r: 0.4985, Pearson p: 6.8526e-39
  Pred range: [0.0247, 0.5580], std: 0.0940
  RMSE : 0.1501, R2: 0.2485, MAE: 0.1175, Spearman rho: 0.4832, Spearman p: 2.5601e-36, Pearson r: 0.5015, Pearson p: 2.0820e-39
  Pred range: [-0.0521, 0.5113], std: 0.0899
  RMSE : 0.1557, R2: 0.1904, MAE: 0.1153, Spearman rho: 0.4737, Spearman p: 8.7977e-35, Pearson r: 0.4923, Pearson p: 8.0264e-38
  Pred range: [0.0028, 0.6254], std: 0.0974
  RMSE : 0.1534, R2: 0.2143, MAE: 0.1231, Spearman rho: 0.4759, Spearman p: 3.9395e-35, Pearson r: 0.4952, Pearson p: 2.5388e-38
  Pred range: [-0.0113, 0.6387], std: 0.1052
  RMSE : 0.1530, R2: 0.2183, MAE: 0.1208, Spearman rho: 0.4855, Spearman p: 1.1061e-36, Pearson r: 0.4932, Pearson p: 5.5494e-38
  Pred range: [0.0421, 0.5985], std: 0.1065
  RMSE : 0.1523, R2: 0.2258, MAE: 0.1203, Spearman rho: 0.4895, Spearman p: 2.3122e-37, Pearson r: 0.5015, Pearson p: 2.1197e-39
  Pred range: [-0.0355, 0.5910], std: 0.0982
  RMSE : 0.1516, R2: 0.2330, MAE: 0.1167, Spearman rho: 0.4733, Spearman p: 1.0427e-34, Pearson r: 0.4902, Pearson p: 1.8210e-37
[I 2026-04-28 01:26:12,677] Trial 46 finished with value: 0.15005052182613066 and parameters: {'learning_rate': 0.0014022638509176935, 'batch_size': 4, 'num_epochs': 13, 'weight_decay': 3.195405102883828e-05, 'depth_complex': 3, 'depth_moderate': 2, 'depth_simple': 2, 'dropout': 0.3180750106789106, 'se_reduction': 8, 'hidden_dim_min': 9, 'base_loss': 'huber', 'huber_delta': 0.08852558231852203, 'focal_gamma': 2.212915503343413, 'n_bins': 7, 'scheduler_patience': 5, 'scheduler_factor': 0.3547688909958346, 'early_stopping_patience': 5}. Best is trial 41 with value: 0.14814692842961857.
Train: 2407 rows (1613 IDs),Test: 598 rows (404 IDs) 

n_features_x : 6, n_features_per_modality: [16, 23, 19, 17, 7, 4, 4, 4, 1, 4]

--- ImbalancedRegressionLoss initialized ---
  Bins: 10, Focal gamma: 2.6914926129952903, Base loss: huber
  Bin [0.00, 0.10): count=  585, weight=0.037
  Bin [0.10, 0.20): count=  580, weight=0.038
  Bin [0.20, 0.30): count=  421, weight=0.052
  Bin [0.30, 0.40): count=  385, weight=0.057
  Bin [0.40, 0.50): count=  191, weight=0.114
  Bin [0.50, 0.60): count=  129, weight=0.168
  Bin [0.60, 0.70): count=   74, weight=0.292
  Bin [0.70, 0.80): count=   33, weight=0.644
  Bin [0.80, 0.90): count=    6, weight=3.127
  Bin [0.90, 1.00): count=    3, weight=5.472
-------------------------------------------

  Pred range: [0.1096, 0.5529], std: 0.0874
  RMSE : 0.1577, R2: 0.1702, MAE: 0.1274, Spearman rho: 0.4520, Spearman p: 1.9218e-31, Pearson r: 0.4624, Pearson p: 5.0941e-33
  Pred range: [0.0976, 0.5625], std: 0.0841
  RMSE : 0.1521, R2: 0.2281, MAE: 0.1212, Spearman rho: 0.4749, Spearman p: 5.7798e-35, Pearson r: 0.4897, Pearson p: 2.1913e-37
  Pred range: [0.0913, 0.6581], std: 0.0941
  RMSE : 0.1561, R2: 0.1864, MAE: 0.1273, Spearman rho: 0.4789, Spearman p: 1.3214e-35, Pearson r: 0.4962, Pearson p: 1.7120e-38
  Pred range: [0.0713, 0.5685], std: 0.0904
  RMSE : 0.1510, R2: 0.2387, MAE: 0.1200, Spearman rho: 0.4837, Spearman p: 2.1597e-36, Pearson r: 0.4974, Pearson p: 1.0762e-38
  Pred range: [0.0995, 0.6043], std: 0.0932
  RMSE : 0.1591, R2: 0.1550, MAE: 0.1316, Spearman rho: 0.4885, Spearman p: 3.4613e-37, Pearson r: 0.5025, Pearson p: 1.4075e-39
  Pred range: [0.0763, 0.6120], std: 0.0930
  RMSE : 0.1545, R2: 0.2032, MAE: 0.1260, Spearman rho: 0.4870, Spearman p: 6.1190e-37, Pearson r: 0.5042, Pearson p: 6.9628e-40
  Pred range: [0.1091, 0.6463], std: 0.0983
  RMSE : 0.1635, R2: 0.1075, MAE: 0.1362, Spearman rho: 0.4949, Spearman p: 2.8391e-38, Pearson r: 0.5130, Pearson p: 1.8654e-41
  Pred range: [0.0765, 0.5801], std: 0.0943
  RMSE : 0.1504, R2: 0.2451, MAE: 0.1193, Spearman rho: 0.4890, Spearman p: 2.8928e-37, Pearson r: 0.5065, Pearson p: 2.7129e-40
  Pred range: [0.0726, 0.6341], std: 0.0929
  RMSE : 0.1652, R2: 0.0895, MAE: 0.1382, Spearman rho: 0.4852, Spearman p: 1.2126e-36, Pearson r: 0.5024, Pearson p: 1.4696e-39
  Pred range: [0.0270, 0.5956], std: 0.0936
  RMSE : 0.1505, R2: 0.2443, MAE: 0.1196, Spearman rho: 0.4878, Spearman p: 4.5718e-37, Pearson r: 0.5057, Pearson p: 3.8507e-40
[I 2026-04-28 01:27:26,459] Trial 47 finished with value: 0.1503839800964368 and parameters: {'learning_rate': 0.0006473885750807607, 'batch_size': 4, 'num_epochs': 10, 'weight_decay': 1.3263666909548937e-05, 'depth_complex': 3, 'depth_moderate': 3, 'depth_simple': 2, 'dropout': 0.35365878880640356, 'se_reduction': 8, 'hidden_dim_min': 10, 'base_loss': 'huber', 'huber_delta': 0.015170486794933935, 'focal_gamma': 2.6914926129952903, 'n_bins': 10, 'scheduler_patience': 4, 'scheduler_factor': 0.3767405280709631, 'early_stopping_patience': 6}. Best is trial 41 with value: 0.14814692842961857.
Train: 2407 rows (1613 IDs),Test: 598 rows (404 IDs) 

n_features_x : 6, n_features_per_modality: [16, 23, 19, 17, 7, 4, 4, 4, 1, 4]

--- ImbalancedRegressionLoss initialized ---
  Bins: 12, Focal gamma: 2.0447702959394, Base loss: huber
  Bin [0.00, 0.08): count=  383, weight=0.051
  Bin [0.08, 0.17): count=  578, weight=0.034
  Bin [0.17, 0.25): count=  499, weight=0.039
  Bin [0.25, 0.33): count=  349, weight=0.055
  Bin [0.33, 0.42): count=  162, weight=0.119
  Bin [0.42, 0.50): count=  191, weight=0.101
  Bin [0.50, 0.58): count=  129, weight=0.149
  Bin [0.58, 0.67): count=   47, weight=0.404
  Bin [0.67, 0.75): count=   41, weight=0.462
  Bin [0.75, 0.83): count=   21, weight=0.882
  Bin [0.83, 0.92): count=    5, weight=3.235
  Bin [0.92, 1.00): count=    2, weight=6.469
-------------------------------------------

  Pred range: [0.1164, 0.5974], std: 0.0827
  RMSE : 0.1727, R2: 0.0049, MAE: 0.1450, Spearman rho: 0.4388, Spearman p: 1.5285e-29, Pearson r: 0.4364, Pearson p: 3.3497e-29
  Pred range: [0.0941, 0.6157], std: 0.0931
  RMSE : 0.1607, R2: 0.1378, MAE: 0.1317, Spearman rho: 0.4711, Spearman p: 2.3028e-34, Pearson r: 0.4721, Pearson p: 1.5815e-34
  Pred range: [0.0919, 0.5898], std: 0.0859
  RMSE : 0.1569, R2: 0.1784, MAE: 0.1287, Spearman rho: 0.4776, Spearman p: 2.0867e-35, Pearson r: 0.4870, Pearson p: 6.2248e-37
  Pred range: [0.0767, 0.5977], std: 0.0913
  RMSE : 0.1514, R2: 0.2354, MAE: 0.1213, Spearman rho: 0.4914, Spearman p: 1.1342e-37, Pearson r: 0.5015, Pearson p: 2.0521e-39
  Pred range: [0.0835, 0.5784], std: 0.0873
  RMSE : 0.1502, R2: 0.2469, MAE: 0.1204, Spearman rho: 0.4986, Spearman p: 6.6450e-39, Pearson r: 0.5119, Pearson p: 3.0016e-41
  Pred range: [0.0774, 0.6122], std: 0.0926
  RMSE : 0.1505, R2: 0.2440, MAE: 0.1209, Spearman rho: 0.4966, Spearman p: 1.4798e-38, Pearson r: 0.5136, Pearson p: 1.4865e-41
  Pred range: [0.0865, 0.6811], std: 0.1027
  RMSE : 0.1599, R2: 0.1468, MAE: 0.1319, Spearman rho: 0.4982, Spearman p: 7.7638e-39, Pearson r: 0.5140, Pearson p: 1.2373e-41
  Pred range: [0.1006, 0.7329], std: 0.1071
  RMSE : 0.1705, R2: 0.0297, MAE: 0.1425, Spearman rho: 0.4966, Spearman p: 1.4668e-38, Pearson r: 0.5155, Pearson p: 6.6394e-42
  Pred range: [0.1042, 0.6815], std: 0.1002
  RMSE : 0.1644, R2: 0.0977, MAE: 0.1372, Spearman rho: 0.4972, Spearman p: 1.1456e-38, Pearson r: 0.5151, Pearson p: 7.7660e-42
  Pred range: [0.0890, 0.6666], std: 0.0987
  RMSE : 0.1576, R2: 0.1705, MAE: 0.1298, Spearman rho: 0.4956, Spearman p: 2.2228e-38, Pearson r: 0.5145, Pearson p: 1.0148e-41
[I 2026-04-28 01:28:17,851] Trial 48 finished with value: 0.15020760633457594 and parameters: {'learning_rate': 0.00042011849356274035, 'batch_size': 6, 'num_epochs': 12, 'weight_decay': 6.78186476662404e-05, 'depth_complex': 3, 'depth_moderate': 3, 'depth_simple': 2, 'dropout': 0.2543117195792463, 'se_reduction': 8, 'hidden_dim_min': 13, 'base_loss': 'huber', 'huber_delta': 0.046910256164887074, 'focal_gamma': 2.0447702959394, 'n_bins': 12, 'scheduler_patience': 3, 'scheduler_factor': 0.33828707337890596, 'early_stopping_patience': 5}. Best is trial 41 with value: 0.14814692842961857.
Train: 2407 rows (1613 IDs),Test: 598 rows (404 IDs) 

n_features_x : 6, n_features_per_modality: [16, 23, 19, 17, 7, 4, 4, 4, 1, 4]

--- ImbalancedRegressionLoss initialized ---
  Bins: 15, Focal gamma: 1.3642003281765203, Base loss: huber
  Bin [0.00, 0.07): count=  383, weight=0.040
  Bin [0.07, 0.13): count=  377, weight=0.041
  Bin [0.13, 0.20): count=  405, weight=0.038
  Bin [0.20, 0.27): count=  295, weight=0.052
  Bin [0.27, 0.33): count=  349, weight=0.044
  Bin [0.33, 0.40): count=  162, weight=0.094
  Bin [0.40, 0.47): count=  134, weight=0.114
  Bin [0.47, 0.53): count=  108, weight=0.141
  Bin [0.53, 0.60): count=   78, weight=0.194
  Bin [0.60, 0.67): count=   47, weight=0.320
  Bin [0.67, 0.73): count=   41, weight=0.365
  Bin [0.73, 0.80): count=   19, weight=0.767
  Bin [0.80, 0.87): count=    5, weight=2.558
  Bin [0.87, 0.93): count=    2, weight=5.116
  Bin [0.93, 1.00): count=    2, weight=5.116
-------------------------------------------

  Pred range: [0.1359, 0.5875], std: 0.0665
  RMSE : 0.1876, R2: -0.1752, MAE: 0.1571, Spearman rho: 0.1956, Spearman p: 1.4448e-06, Pearson r: 0.2098, Pearson p: 2.2393e-07
  Pred range: [0.1704, 0.6941], std: 0.0775
  RMSE : 0.2211, R2: -0.6314, MAE: 0.1915, Spearman rho: 0.2551, Spearman p: 2.4539e-10, Pearson r: 0.2711, Pearson p: 1.5631e-11
  Pred range: [0.1671, 0.6749], std: 0.0782
  RMSE : 0.2145, R2: -0.5358, MAE: 0.1858, Spearman rho: 0.2966, Spearman p: 1.3102e-13, Pearson r: 0.3143, Pearson p: 3.5717e-15
  Pred range: [0.1730, 0.7110], std: 0.0834
  RMSE : 0.2208, R2: -0.6278, MAE: 0.1919, Spearman rho: 0.3316, Spearman p: 8.1773e-17, Pearson r: 0.3492, Pearson p: 1.3772e-18
  Pred range: [0.1527, 0.6612], std: 0.0805
  RMSE : 0.1916, R2: -0.2259, MAE: 0.1644, Spearman rho: 0.3648, Spearman p: 2.9208e-20, Pearson r: 0.3795, Pearson p: 6.3819e-22
  Pred range: [0.1584, 0.7027], std: 0.0870
  RMSE : 0.1990, R2: -0.3215, MAE: 0.1713, Spearman rho: 0.3832, Spearman p: 2.3798e-22, Pearson r: 0.3992, Pearson p: 2.7462e-24
