[I 2026-04-27 19:13:11,326] Trial 35 finished with value: 0.14971828654780245 and parameters: {'learning_rate': 0.0021734376458737185, 'batch_size': 16, 'num_epochs': 27, 'weight_decay': 6.20933441835456e-05, 'layers_PRS': 2, 'layers_SCZ15': 3, 'layers_ADHD9': 2, 'layers_ASD9': 5, 'layers_ACE15': 4, 'layers_ACE18': 7, 'layers_SUD18': 1, 'layers_SES': 5, 'layers_SEX': 2, 'dropout': 0.1626200584190868, 'se_reduction': 4, 'hidden_dim_min': 2, 'base_loss': 'huber', 'huber_delta': 0.12310380727142185, 'focal_gamma': 2.90162346046622, 'n_bins': 15, 'scheduler_patience': 3, 'scheduler_factor': 0.45077258029646255, 'early_stopping_patience': 8}. Best is trial 31 with value: 0.14835994978477499.
Train: 2407 rows (1613 IDs),Test: 598 rows (404 IDs) 

n_features_x : 6, n_features_per_modality: [16, 23, 19, 17, 7, 4, 4, 4, 1, 4]

--- ImbalancedRegressionLoss initialized ---
  Bins: 15, Focal gamma: 2.975972543296807, Base loss: huber
  Bin [0.00, 0.07): count=  383, weight=0.040
  Bin [0.07, 0.13): count=  377, weight=0.041
  Bin [0.13, 0.20): count=  405, weight=0.038
  Bin [0.20, 0.27): count=  295, weight=0.052
  Bin [0.27, 0.33): count=  349, weight=0.044
  Bin [0.33, 0.40): count=  162, weight=0.094
  Bin [0.40, 0.47): count=  134, weight=0.114
  Bin [0.47, 0.53): count=  108, weight=0.141
  Bin [0.53, 0.60): count=   78, weight=0.194
  Bin [0.60, 0.67): count=   47, weight=0.320
  Bin [0.67, 0.73): count=   41, weight=0.365
  Bin [0.73, 0.80): count=   19, weight=0.767
  Bin [0.80, 0.87): count=    5, weight=2.558
  Bin [0.87, 0.93): count=    2, weight=5.116
  Bin [0.93, 1.00): count=    2, weight=5.116
-------------------------------------------

  Pred range: [0.1016, 0.6773], std: 0.1003
  RMSE : 0.1653, R2: 0.0879, MAE: 0.1368, Spearman rho: 0.4671, Spearman p: 9.7375e-34, Pearson r: 0.5025, Pearson p: 1.3893e-39
  Pred range: [0.1262, 0.6435], std: 0.0871
  RMSE : 0.1743, R2: -0.0145, MAE: 0.1481, Spearman rho: 0.4562, Spearman p: 4.5550e-32, Pearson r: 0.4898, Pearson p: 2.0701e-37
  Pred range: [0.0607, 0.7082], std: 0.0990
  RMSE : 0.1954, R2: -0.2751, MAE: 0.1678, Spearman rho: 0.4742, Spearman p: 7.4082e-35, Pearson r: 0.5046, Pearson p: 5.9937e-40
  Pred range: [0.0677, 0.7335], std: 0.1006
  RMSE : 0.1888, R2: -0.1897, MAE: 0.1612, Spearman rho: 0.4607, Spearman p: 9.3359e-33, Pearson r: 0.4931, Pearson p: 5.8785e-38
  Pred range: [-0.0103, 0.6642], std: 0.0959
  RMSE : 0.1604, R2: 0.1414, MAE: 0.1329, Spearman rho: 0.4640, Spearman p: 2.8830e-33, Pearson r: 0.4958, Pearson p: 2.0045e-38
  Pred range: [0.0324, 0.6545], std: 0.0891
  RMSE : 0.1643, R2: 0.0989, MAE: 0.1375, Spearman rho: 0.4555, Spearman p: 5.7420e-32, Pearson r: 0.4874, Pearson p: 5.2698e-37
[I 2026-04-27 19:13:27,448] Trial 36 pruned. 
Train: 2407 rows (1613 IDs),Test: 598 rows (404 IDs) 

n_features_x : 6, n_features_per_modality: [16, 23, 19, 17, 7, 4, 4, 4, 1, 4]

--- ImbalancedRegressionLoss initialized ---
  Bins: 14, Focal gamma: 2.7591550322380294, Base loss: huber
  Bin [0.00, 0.07): count=  383, weight=0.042
  Bin [0.07, 0.14): count=  377, weight=0.043
  Bin [0.14, 0.21): count=  571, weight=0.028
  Bin [0.21, 0.29): count=  255, weight=0.063
  Bin [0.29, 0.36): count=  223, weight=0.072
  Bin [0.36, 0.43): count=  231, weight=0.070
  Bin [0.43, 0.50): count=  122, weight=0.131
  Bin [0.50, 0.57): count=   93, weight=0.172
  Bin [0.57, 0.64): count=   83, weight=0.192
  Bin [0.64, 0.71): count=   27, weight=0.577
  Bin [0.71, 0.79): count=   26, weight=0.598
  Bin [0.79, 0.86): count=   12, weight=1.243
  Bin [0.86, 0.93): count=    2, weight=5.384
  Bin [0.93, 1.00): count=    2, weight=5.384
-------------------------------------------

  Pred range: [0.0810, 0.6663], std: 0.0962
  RMSE : 0.1677, R2: 0.0610, MAE: 0.1409, Spearman rho: 0.4420, Spearman p: 5.3646e-30, Pearson r: 0.4657, Pearson p: 1.6098e-33
  Pred range: [0.0257, 0.5313], std: 0.0888
  RMSE : 0.1520, R2: 0.2289, MAE: 0.1210, Spearman rho: 0.4661, Spearman p: 1.3919e-33, Pearson r: 0.4859, Pearson p: 9.2458e-37
  Pred range: [0.0694, 0.6141], std: 0.0951
  RMSE : 0.1672, R2: 0.0672, MAE: 0.1393, Spearman rho: 0.4783, Spearman p: 1.6379e-35, Pearson r: 0.4916, Pearson p: 1.0447e-37
  Pred range: [0.1168, 0.5858], std: 0.0874
  RMSE : 0.1598, R2: 0.1475, MAE: 0.1327, Spearman rho: 0.4819, Spearman p: 4.2002e-36, Pearson r: 0.5036, Pearson p: 8.8529e-40
  Pred range: [0.0663, 0.5807], std: 0.0880
  RMSE : 0.1557, R2: 0.1904, MAE: 0.1284, Spearman rho: 0.4681, Spearman p: 6.6805e-34, Pearson r: 0.4960, Pearson p: 1.8755e-38
  Pred range: [0.1034, 0.5355], std: 0.0783
  RMSE : 0.1559, R2: 0.1886, MAE: 0.1296, Spearman rho: 0.4772, Spearman p: 2.4623e-35, Pearson r: 0.5088, Pearson p: 1.0894e-40
  Pred range: [0.1204, 0.6306], std: 0.0789
  RMSE : 0.1650, R2: 0.0908, MAE: 0.1399, Spearman rho: 0.4635, Spearman p: 3.5100e-33, Pearson r: 0.5030, Pearson p: 1.1241e-39
  Pred range: [0.1292, 0.6265], std: 0.0850
  RMSE : 0.1596, R2: 0.1497, MAE: 0.1333, Spearman rho: 0.4843, Spearman p: 1.7350e-36, Pearson r: 0.5139, Pearson p: 1.3203e-41
  Pred range: [0.1933, 0.6800], std: 0.0867
  RMSE : 0.2036, R2: -0.3835, MAE: 0.1769, Spearman rho: 0.4731, Spearman p: 1.0992e-34, Pearson r: 0.5045, Pearson p: 6.2335e-40
  Pred range: [0.1625, 0.6660], std: 0.0897
  RMSE : 0.1840, R2: -0.1304, MAE: 0.1587, Spearman rho: 0.4916, Spearman p: 1.0310e-37, Pearson r: 0.5119, Pearson p: 3.0220e-41
[I 2026-04-27 19:13:45,357] Trial 37 finished with value: 0.1519916206178704 and parameters: {'learning_rate': 0.00662054654594446, 'batch_size': 16, 'num_epochs': 30, 'weight_decay': 0.009951589011739698, 'layers_PRS': 2, 'layers_SCZ15': 3, 'layers_ADHD9': 2, 'layers_ASD9': 2, 'layers_ACE15': 3, 'layers_ACE18': 1, 'layers_SUD18': 1, 'layers_SES': 5, 'layers_SEX': 1, 'dropout': 0.1970264299446517, 'se_reduction': 5, 'hidden_dim_min': 3, 'base_loss': 'huber', 'huber_delta': 0.14403178799676125, 'focal_gamma': 2.7591550322380294, 'n_bins': 14, 'scheduler_patience': 2, 'scheduler_factor': 0.6404964216167406, 'early_stopping_patience': 8}. Best is trial 31 with value: 0.14835994978477499.
Train: 2407 rows (1613 IDs),Test: 598 rows (404 IDs) 

n_features_x : 6, n_features_per_modality: [16, 23, 19, 17, 7, 4, 4, 4, 1, 4]

--- ImbalancedRegressionLoss initialized ---
  Bins: 12, Focal gamma: 2.350805635880806, Base loss: huber
  Bin [0.00, 0.08): count=  383, weight=0.051
  Bin [0.08, 0.17): count=  578, weight=0.034
  Bin [0.17, 0.25): count=  499, weight=0.039
  Bin [0.25, 0.33): count=  349, weight=0.055
  Bin [0.33, 0.42): count=  162, weight=0.119
  Bin [0.42, 0.50): count=  191, weight=0.101
  Bin [0.50, 0.58): count=  129, weight=0.149
  Bin [0.58, 0.67): count=   47, weight=0.404
  Bin [0.67, 0.75): count=   41, weight=0.462
  Bin [0.75, 0.83): count=   21, weight=0.882
  Bin [0.83, 0.92): count=    5, weight=3.235
  Bin [0.92, 1.00): count=    2, weight=6.469
-------------------------------------------

  Pred range: [0.1354, 0.5190], std: 0.0636
  RMSE : 0.1568, R2: 0.1792, MAE: 0.1297, Spearman rho: 0.4814, Spearman p: 5.1462e-36, Pearson r: 0.5047, Pearson p: 5.8359e-40
  Pred range: [0.1121, 0.5596], std: 0.0825
  RMSE : 0.1507, R2: 0.2418, MAE: 0.1214, Spearman rho: 0.4908, Spearman p: 1.4476e-37, Pearson r: 0.5108, Pearson p: 4.6361e-41
  Pred range: [0.1504, 0.7010], std: 0.1021
  RMSE : 0.1801, R2: -0.0832, MAE: 0.1526, Spearman rho: 0.4788, Spearman p: 1.3595e-35, Pearson r: 0.5079, Pearson p: 1.5723e-40
  Pred range: [-0.0300, 0.6371], std: 0.1066
  RMSE : 0.1564, R2: 0.1832, MAE: 0.1274, Spearman rho: 0.4940, Spearman p: 4.0555e-38, Pearson r: 0.5162, Pearson p: 4.9578e-42
  Pred range: [0.0808, 0.6879], std: 0.0990
  RMSE : 0.1739, R2: -0.0092, MAE: 0.1467, Spearman rho: 0.4720, Spearman p: 1.6495e-34, Pearson r: 0.4987, Pearson p: 6.4058e-39
  Pred range: [-0.0245, 0.6613], std: 0.1030
  RMSE : 0.1674, R2: 0.0646, MAE: 0.1394, Spearman rho: 0.4637, Spearman p: 3.2690e-33, Pearson r: 0.4845, Pearson p: 1.5823e-36
  Pred range: [0.0504, 0.6920], std: 0.1009
  RMSE : 0.1815, R2: -0.0992, MAE: 0.1540, Spearman rho: 0.4783, Spearman p: 1.6513e-35, Pearson r: 0.5040, Pearson p: 7.7050e-40
  Pred range: [-0.0060, 0.7020], std: 0.1045
  RMSE : 0.1703, R2: 0.0318, MAE: 0.1423, Spearman rho: 0.4767, Spearman p: 2.9712e-35, Pearson r: 0.5010, Pearson p: 2.5177e-39
  Pred range: [0.0541, 0.6950], std: 0.1044
  RMSE : 0.1788, R2: -0.0668, MAE: 0.1507, Spearman rho: 0.4856, Spearman p: 1.0594e-36, Pearson r: 0.5134, Pearson p: 1.6320e-41
  Pred range: [0.0274, 0.6608], std: 0.0995
  RMSE : 0.1609, R2: 0.1361, MAE: 0.1333, Spearman rho: 0.4706, Spearman p: 2.7486e-34, Pearson r: 0.4983, Pearson p: 7.4935e-39
[I 2026-04-27 19:14:14,760] Trial 38 finished with value: 0.15071429683355803 and parameters: {'learning_rate': 0.0023882662049755036, 'batch_size': 16, 'num_epochs': 26, 'weight_decay': 0.00015777447455204117, 'layers_PRS': 3, 'layers_SCZ15': 4, 'layers_ADHD9': 3, 'layers_ASD9': 5, 'layers_ACE15': 4, 'layers_ACE18': 7, 'layers_SUD18': 1, 'layers_SES': 6, 'layers_SEX': 2, 'dropout': 0.16947411697011475, 'se_reduction': 3, 'hidden_dim_min': 2, 'base_loss': 'huber', 'huber_delta': 0.1282377654487553, 'focal_gamma': 2.350805635880806, 'n_bins': 12, 'scheduler_patience': 3, 'scheduler_factor': 0.4516692163370332, 'early_stopping_patience': 8}. Best is trial 31 with value: 0.14835994978477499.
Train: 2407 rows (1613 IDs),Test: 598 rows (404 IDs) 

n_features_x : 6, n_features_per_modality: [16, 23, 19, 17, 7, 4, 4, 4, 1, 4]

--- ImbalancedRegressionLoss initialized ---
  Bins: 16, Focal gamma: 2.9944408571866123, Base loss: huber
  Bin [0.00, 0.06): count=  383, weight=0.041
  Bin [0.06, 0.12): count=  377, weight=0.042
  Bin [0.12, 0.19): count=  405, weight=0.039
  Bin [0.19, 0.25): count=  295, weight=0.053
  Bin [0.25, 0.31): count=  239, weight=0.066
  Bin [0.31, 0.38): count=  199, weight=0.079
  Bin [0.38, 0.44): count=  142, weight=0.111
  Bin [0.44, 0.50): count=  122, weight=0.129
  Bin [0.50, 0.56): count=   93, weight=0.168
  Bin [0.56, 0.62): count=   64, weight=0.243
  Bin [0.62, 0.69): count=   36, weight=0.427
  Bin [0.69, 0.75): count=   24, weight=0.633
  Bin [0.75, 0.81): count=   19, weight=0.791
  Bin [0.81, 0.88): count=    5, weight=2.636
  Bin [0.88, 0.94): count=    2, weight=5.271
  Bin [0.94, 1.00): count=    2, weight=5.271
-------------------------------------------

  Pred range: [0.1556, 0.6850], std: 0.0885
  RMSE : 0.2318, R2: -0.7927, MAE: 0.2025, Spearman rho: 0.3505, Spearman p: 9.9970e-19, Pearson r: 0.3227, Pearson p: 5.8015e-16
  Pred range: [0.1507, 0.5803], std: 0.0765
  RMSE : 0.1892, R2: -0.1950, MAE: 0.1618, Spearman rho: 0.3910, Spearman p: 2.7640e-23, Pearson r: 0.3750, Pearson p: 2.1018e-21
  Pred range: [0.1530, 0.6165], std: 0.0805
  RMSE : 0.1855, R2: -0.1487, MAE: 0.1588, Spearman rho: 0.4260, Spearman p: 9.2228e-28, Pearson r: 0.4143, Pearson p: 3.2844e-26
  Pred range: [0.1552, 0.6699], std: 0.0905
  RMSE : 0.1887, R2: -0.1885, MAE: 0.1617, Spearman rho: 0.4479, Spearman p: 7.6095e-31, Pearson r: 0.4414, Pearson p: 6.5698e-30
  Pred range: [0.1575, 0.6662], std: 0.0924
  RMSE : 0.1870, R2: -0.1669, MAE: 0.1599, Spearman rho: 0.4570, Spearman p: 3.4637e-32, Pearson r: 0.4552, Pearson p: 6.3611e-32
  Pred range: [0.1397, 0.6356], std: 0.0849
  RMSE : 0.1711, R2: 0.0226, MAE: 0.1447, Spearman rho: 0.4598, Spearman p: 1.2884e-32, Pearson r: 0.4673, Pearson p: 8.9344e-34
[I 2026-04-27 19:14:34,190] Trial 39 pruned. 
Train: 2407 rows (1613 IDs),Test: 598 rows (404 IDs) 

n_features_x : 6, n_features_per_modality: [16, 23, 19, 17, 7, 4, 4, 4, 1, 4]

--- ImbalancedRegressionLoss initialized ---
  Bins: 15, Focal gamma: 2.655096963131442, Base loss: huber
  Bin [0.00, 0.07): count=  383, weight=0.040
  Bin [0.07, 0.13): count=  377, weight=0.041
  Bin [0.13, 0.20): count=  405, weight=0.038
  Bin [0.20, 0.27): count=  295, weight=0.052
  Bin [0.27, 0.33): count=  349, weight=0.044
  Bin [0.33, 0.40): count=  162, weight=0.094
  Bin [0.40, 0.47): count=  134, weight=0.114
  Bin [0.47, 0.53): count=  108, weight=0.141
  Bin [0.53, 0.60): count=   78, weight=0.194
  Bin [0.60, 0.67): count=   47, weight=0.320
  Bin [0.67, 0.73): count=   41, weight=0.365
  Bin [0.73, 0.80): count=   19, weight=0.767
  Bin [0.80, 0.87): count=    5, weight=2.558
  Bin [0.87, 0.93): count=    2, weight=5.116
  Bin [0.93, 1.00): count=    2, weight=5.116
-------------------------------------------

  Pred range: [0.1649, 0.6294], std: 0.0736
  RMSE : 0.1748, R2: -0.0197, MAE: 0.1476, Spearman rho: 0.3902, Spearman p: 3.5253e-23, Pearson r: 0.4123, Pearson p: 6.0590e-26
  Pred range: [0.2009, 0.7390], std: 0.0950
  RMSE : 0.2117, R2: -0.4956, MAE: 0.1840, Spearman rho: 0.4462, Spearman p: 1.3594e-30, Pearson r: 0.4644, Pearson p: 2.5165e-33
  Pred range: [0.1753, 0.6881], std: 0.0836
  RMSE : 0.1806, R2: -0.0893, MAE: 0.1544, Spearman rho: 0.4551, Spearman p: 6.6527e-32, Pearson r: 0.4766, Pearson p: 3.0540e-35
  Pred range: [0.1894, 0.7225], std: 0.0917
  RMSE : 0.1967, R2: -0.2917, MAE: 0.1700, Spearman rho: 0.4725, Spearman p: 1.3995e-34, Pearson r: 0.4941, Pearson p: 3.9075e-38
  Pred range: [0.1931, 0.7872], std: 0.0973
  RMSE : 0.2072, R2: -0.4331, MAE: 0.1795, Spearman rho: 0.4766, Spearman p: 3.0727e-35, Pearson r: 0.5028, Pearson p: 1.2166e-39
  Pred range: [0.1671, 0.7067], std: 0.0911
  RMSE : 0.1778, R2: -0.0558, MAE: 0.1518, Spearman rho: 0.4877, Spearman p: 4.6757e-37, Pearson r: 0.5144, Pearson p: 1.0459e-41
[I 2026-04-27 19:14:42,233] Trial 40 pruned. 
Train: 2407 rows (1613 IDs),Test: 598 rows (404 IDs) 

n_features_x : 6, n_features_per_modality: [16, 23, 19, 17, 7, 4, 4, 4, 1, 4]

--- ImbalancedRegressionLoss initialized ---
  Bins: 17, Focal gamma: 2.810290762369726, Base loss: huber
  Bin [0.00, 0.06): count=  172, weight=0.058
  Bin [0.06, 0.12): count=  413, weight=0.024
  Bin [0.12, 0.18): count=  376, weight=0.027
  Bin [0.18, 0.24): count=  370, weight=0.027
  Bin [0.24, 0.29): count=  255, weight=0.039
  Bin [0.29, 0.35): count=  223, weight=0.045
  Bin [0.35, 0.41): count=  162, weight=0.061
  Bin [0.41, 0.47): count=  134, weight=0.074
  Bin [0.47, 0.53): count=  108, weight=0.092
  Bin [0.53, 0.59): count=   78, weight=0.127
  Bin [0.59, 0.65): count=   47, weight=0.208
  Bin [0.65, 0.71): count=   27, weight=0.357
  Bin [0.71, 0.76): count=   26, weight=0.370
  Bin [0.76, 0.82): count=    9, weight=0.999
  Bin [0.82, 0.88): count=    4, weight=1.999
  Bin [0.88, 0.94): count=    3, weight=2.499
  Bin [0.94, 1.00): count=    0, weight=9.995
-------------------------------------------

  Pred range: [0.1171, 0.6102], std: 0.0798
  RMSE : 0.1660, R2: 0.0803, MAE: 0.1391, Spearman rho: 0.4708, Spearman p: 2.5155e-34, Pearson r: 0.4927, Pearson p: 6.7080e-38
  Pred range: [0.0817, 0.5700], std: 0.0833
  RMSE : 0.1488, R2: 0.2613, MAE: 0.1173, Spearman rho: 0.4993, Spearman p: 5.1404e-39, Pearson r: 0.5154, Pearson p: 6.8019e-42
  Pred range: [0.1041, 0.6658], std: 0.0934
  RMSE : 0.1593, R2: 0.1529, MAE: 0.1323, Spearman rho: 0.4924, Spearman p: 7.6824e-38, Pearson r: 0.5118, Pearson p: 3.1426e-41
  Pred range: [0.0966, 0.7105], std: 0.0998
  RMSE : 0.1561, R2: 0.1868, MAE: 0.1278, Spearman rho: 0.4967, Spearman p: 1.4420e-38, Pearson r: 0.5147, Pearson p: 9.4251e-42
  Pred range: [0.0651, 0.6476], std: 0.0938
  RMSE : 0.1520, R2: 0.2291, MAE: 0.1226, Spearman rho: 0.4930, Spearman p: 5.9858e-38, Pearson r: 0.5128, Pearson p: 2.0986e-41
  Pred range: [0.1236, 0.8276], std: 0.1174
  RMSE : 0.1856, R2: -0.1499, MAE: 0.1559, Spearman rho: 0.4927, Spearman p: 6.6721e-38, Pearson r: 0.5149, Pearson p: 8.6965e-42
  Pred range: [0.0702, 0.6628], std: 0.1027
  RMSE : 0.1532, R2: 0.2169, MAE: 0.1238, Spearman rho: 0.4932, Spearman p: 5.4979e-38, Pearson r: 0.5141, Pearson p: 1.1987e-41
  Pred range: [0.0822, 0.6993], std: 0.1066
  RMSE : 0.1572, R2: 0.1749, MAE: 0.1284, Spearman rho: 0.4966, Spearman p: 1.4697e-38, Pearson r: 0.5184, Pearson p: 1.9898e-42
  Pred range: [0.0706, 0.6701], std: 0.1003
  RMSE : 0.1541, R2: 0.2074, MAE: 0.1253, Spearman rho: 0.4919, Spearman p: 9.2782e-38, Pearson r: 0.5168, Pearson p: 3.8648e-42
[I 2026-04-27 19:15:46,114] Trial 41 finished with value: 0.14876103904177582 and parameters: {'learning_rate': 0.0006178358055957849, 'batch_size': 6, 'num_epochs': 28, 'weight_decay': 2.273060036447063e-05, 'layers_PRS': 2, 'layers_SCZ15': 4, 'layers_ADHD9': 2, 'layers_ASD9': 5, 'layers_ACE15': 5, 'layers_ACE18': 7, 'layers_SUD18': 2, 'layers_SES': 4, 'layers_SEX': 3, 'dropout': 0.14204343535313801, 'se_reduction': 4, 'hidden_dim_min': 5, 'base_loss': 'huber', 'huber_delta': 0.10616975944458917, 'focal_gamma': 2.810290762369726, 'n_bins': 17, 'scheduler_patience': 4, 'scheduler_factor': 0.5163531990936758, 'early_stopping_patience': 7}. Best is trial 31 with value: 0.14835994978477499.
Train: 2407 rows (1613 IDs),Test: 598 rows (404 IDs) 

n_features_x : 6, n_features_per_modality: [16, 23, 19, 17, 7, 4, 4, 4, 1, 4]

--- ImbalancedRegressionLoss initialized ---
  Bins: 17, Focal gamma: 2.819840586359179, Base loss: huber
  Bin [0.00, 0.06): count=  172, weight=0.058
  Bin [0.06, 0.12): count=  413, weight=0.024
  Bin [0.12, 0.18): count=  376, weight=0.027
  Bin [0.18, 0.24): count=  370, weight=0.027
  Bin [0.24, 0.29): count=  255, weight=0.039
  Bin [0.29, 0.35): count=  223, weight=0.045
  Bin [0.35, 0.41): count=  162, weight=0.061
  Bin [0.41, 0.47): count=  134, weight=0.074
  Bin [0.47, 0.53): count=  108, weight=0.092
  Bin [0.53, 0.59): count=   78, weight=0.127
  Bin [0.59, 0.65): count=   47, weight=0.208
  Bin [0.65, 0.71): count=   27, weight=0.357
  Bin [0.71, 0.76): count=   26, weight=0.370
  Bin [0.76, 0.82): count=    9, weight=0.999
  Bin [0.82, 0.88): count=    4, weight=1.999
  Bin [0.88, 0.94): count=    3, weight=2.499
  Bin [0.94, 1.00): count=    0, weight=9.995
-------------------------------------------

  Pred range: [0.1619, 0.5942], std: 0.0808
  RMSE : 0.1780, R2: -0.0581, MAE: 0.1519, Spearman rho: 0.4611, Spearman p: 8.0219e-33, Pearson r: 0.4718, Pearson p: 1.7530e-34
  Pred range: [0.0492, 0.5518], std: 0.0896
  RMSE : 0.1499, R2: 0.2504, MAE: 0.1184, Spearman rho: 0.4902, Spearman p: 1.7742e-37, Pearson r: 0.5036, Pearson p: 8.9597e-40
  Pred range: [0.0994, 0.5279], std: 0.0792
  RMSE : 0.1522, R2: 0.2271, MAE: 0.1239, Spearman rho: 0.4876, Spearman p: 4.9554e-37, Pearson r: 0.5133, Pearson p: 1.6636e-41
  Pred range: [0.0476, 0.5495], std: 0.0866
  RMSE : 0.1488, R2: 0.2611, MAE: 0.1172, Spearman rho: 0.4934, Spearman p: 5.1322e-38, Pearson r: 0.5136, Pearson p: 1.4885e-41
  Pred range: [0.0399, 0.5700], std: 0.0880
  RMSE : 0.1503, R2: 0.2461, MAE: 0.1202, Spearman rho: 0.4863, Spearman p: 7.9208e-37, Pearson r: 0.5091, Pearson p: 9.6306e-41
  Pred range: [0.0314, 0.6214], std: 0.0950
  RMSE : 0.1539, R2: 0.2097, MAE: 0.1246, Spearman rho: 0.4849, Spearman p: 1.3417e-36, Pearson r: 0.4991, Pearson p: 5.3747e-39
  Pred range: [0.0449, 0.6602], std: 0.1004
  RMSE : 0.1535, R2: 0.2140, MAE: 0.1240, Spearman rho: 0.4899, Spearman p: 2.0134e-37, Pearson r: 0.5069, Pearson p: 2.3900e-40
  Pred range: [0.0984, 0.7665], std: 0.1092
  RMSE : 0.1693, R2: 0.0428, MAE: 0.1409, Spearman rho: 0.4817, Spearman p: 4.4970e-36, Pearson r: 0.5074, Pearson p: 1.9501e-40
  Pred range: [0.1010, 0.7673], std: 0.1043
  RMSE : 0.1592, R2: 0.1541, MAE: 0.1307, Spearman rho: 0.4819, Spearman p: 4.3251e-36, Pearson r: 0.5036, Pearson p: 9.0282e-40
  Pred range: [0.0994, 0.7727], std: 0.1094
  RMSE : 0.1699, R2: 0.0362, MAE: 0.1410, Spearman rho: 0.4903, Spearman p: 1.6957e-37, Pearson r: 0.5083, Pearson p: 1.3086e-40
  Pred range: [0.0201, 0.7451], std: 0.1130
  RMSE : 0.1576, R2: 0.1712, MAE: 0.1271, Spearman rho: 0.4878, Spearman p: 4.4445e-37, Pearson r: 0.5058, Pearson p: 3.6891e-40
  Pred range: [0.0626, 0.7161], std: 0.1021
  RMSE : 0.1603, R2: 0.1419, MAE: 0.1319, Spearman rho: 0.4823, Spearman p: 3.6726e-36, Pearson r: 0.5061, Pearson p: 3.2351e-40
