[I 2026-04-27 16:40:48,745] Trial 20 pruned. 
Train: 2407 rows (1613 IDs),Test: 598 rows (404 IDs) 

n_features_x : 6, n_features_per_modality: [16, 23, 19, 17, 7, 4, 4, 4, 1, 4]

--- ImbalancedRegressionLoss initialized ---
  Bins: 9, Focal gamma: 1.6006024707227533, Base loss: huber
  Bin [0.00, 0.11): count= 1180, weight=0.003
  Bin [0.11, 0.22): count=  835, weight=0.004
  Bin [0.22, 0.33): count=  312, weight=0.010
  Bin [0.33, 0.44): count=   59, weight=0.054
  Bin [0.44, 0.56): count=   16, weight=0.190
  Bin [0.56, 0.67): count=    4, weight=0.647
  Bin [0.67, 0.78): count=    1, weight=1.618
  Bin [0.78, 0.89): count=    0, weight=3.237
  Bin [0.89, 1.00): count=    0, weight=3.237
-------------------------------------------

  Pred range: [0.0606, 0.3774], std: 0.0567
  RMSE : 0.1012, R2: -0.0121, MAE: 0.0817, Spearman rho: 0.4004, Spearman p: 1.9826e-24, Pearson r: 0.4033, Pearson p: 8.5784e-25
  Pred range: [0.0430, 0.4418], std: 0.0625
  RMSE : 0.0942, R2: 0.1239, MAE: 0.0747, Spearman rho: 0.4355, Spearman p: 4.5616e-29, Pearson r: 0.4440, Pearson p: 2.7547e-30
  Pred range: [0.0474, 0.4108], std: 0.0633
  RMSE : 0.0953, R2: 0.1021, MAE: 0.0762, Spearman rho: 0.4521, Spearman p: 1.8499e-31, Pearson r: 0.4619, Pearson p: 6.1870e-33
  Pred range: [0.0396, 0.3475], std: 0.0514
  RMSE : 0.0892, R2: 0.2144, MAE: 0.0704, Spearman rho: 0.4550, Spearman p: 6.7469e-32, Pearson r: 0.4654, Pearson p: 1.8069e-33
  Pred range: [0.0297, 0.3597], std: 0.0499
  RMSE : 0.0889, R2: 0.2197, MAE: 0.0705, Spearman rho: 0.4602, Spearman p: 1.1155e-32, Pearson r: 0.4713, Pearson p: 2.1180e-34
  Pred range: [0.0429, 0.3720], std: 0.0544
  RMSE : 0.0905, R2: 0.1900, MAE: 0.0723, Spearman rho: 0.4550, Spearman p: 6.7382e-32, Pearson r: 0.4668, Pearson p: 1.0632e-33
  Pred range: [0.0215, 0.3653], std: 0.0510
  RMSE : 0.0890, R2: 0.2178, MAE: 0.0710, Spearman rho: 0.4604, Spearman p: 1.0377e-32, Pearson r: 0.4720, Pearson p: 1.6346e-34
  Pred range: [0.0214, 0.3884], std: 0.0579
  RMSE : 0.0909, R2: 0.1832, MAE: 0.0728, Spearman rho: 0.4690, Spearman p: 4.8360e-34, Pearson r: 0.4797, Pearson p: 9.5687e-36
  Pred range: [0.0208, 0.3728], std: 0.0560
  RMSE : 0.0897, R2: 0.2055, MAE: 0.0715, Spearman rho: 0.4629, Spearman p: 4.3766e-33, Pearson r: 0.4742, Pearson p: 7.4908e-35
[I 2026-04-27 16:41:57,613] Trial 21 finished with value: 0.0888638128960383 and parameters: {'learning_rate': 0.0006227190988121471, 'batch_size': 4, 'num_epochs': 20, 'weight_decay': 0.00015758532040891892, 'layers_PRS': 5, 'layers_SCZ15': 4, 'layers_ADHD9': 1, 'layers_ASD9': 2, 'layers_ACE15': 2, 'layers_ACE18': 1, 'layers_SUD18': 3, 'layers_SES': 6, 'layers_SEX': 1, 'dropout': 0.4301826798943518, 'se_reduction': 6, 'hidden_dim_min': 11, 'base_loss': 'huber', 'huber_delta': 0.08522083911493351, 'focal_gamma': 1.6006024707227533, 'n_bins': 9, 'scheduler_patience': 2, 'scheduler_factor': 0.5446558271409857, 'early_stopping_patience': 4}. Best is trial 9 with value: 0.08803266597627345.
Train: 2407 rows (1613 IDs),Test: 598 rows (404 IDs) 

n_features_x : 6, n_features_per_modality: [16, 23, 19, 17, 7, 4, 4, 4, 1, 4]

--- ImbalancedRegressionLoss initialized ---
  Bins: 8, Focal gamma: 1.0347115334780548, Base loss: huber
  Bin [0.00, 0.12): count= 1180, weight=0.003
  Bin [0.12, 0.25): count=  933, weight=0.003
  Bin [0.25, 0.38): count=  253, weight=0.012
  Bin [0.38, 0.50): count=   30, weight=0.098
  Bin [0.50, 0.62): count=   10, weight=0.277
  Bin [0.62, 0.75): count=    1, weight=1.521
  Bin [0.75, 0.88): count=    0, weight=3.043
  Bin [0.88, 1.00): count=    0, weight=3.043
-------------------------------------------

  Pred range: [0.0459, 0.3900], std: 0.0526
  RMSE : 0.0991, R2: 0.0296, MAE: 0.0800, Spearman rho: 0.3398, Spearman p: 1.2557e-17, Pearson r: 0.3431, Pearson p: 5.8237e-18
  Pred range: [0.0372, 0.3856], std: 0.0559
  RMSE : 0.0927, R2: 0.1504, MAE: 0.0741, Spearman rho: 0.4150, Spearman p: 2.7026e-26, Pearson r: 0.4201, Pearson p: 5.6529e-27
  Pred range: [0.0330, 0.3854], std: 0.0584
  RMSE : 0.0920, R2: 0.1636, MAE: 0.0731, Spearman rho: 0.4342, Spearman p: 6.9146e-29, Pearson r: 0.4371, Pearson p: 2.6652e-29
  Pred range: [0.0272, 0.3732], std: 0.0561
  RMSE : 0.0908, R2: 0.1859, MAE: 0.0722, Spearman rho: 0.4469, Spearman p: 1.0802e-30, Pearson r: 0.4527, Pearson p: 1.4724e-31
  Pred range: [0.0301, 0.3835], std: 0.0586
  RMSE : 0.0909, R2: 0.1838, MAE: 0.0722, Spearman rho: 0.4542, Spearman p: 8.8382e-32, Pearson r: 0.4595, Pearson p: 1.4278e-32
  Pred range: [0.0257, 0.3760], std: 0.0573
  RMSE : 0.0903, R2: 0.1948, MAE: 0.0719, Spearman rho: 0.4636, Spearman p: 3.3898e-33, Pearson r: 0.4694, Pearson p: 4.3048e-34
  Pred range: [0.0236, 0.3688], std: 0.0568
  RMSE : 0.0893, R2: 0.2117, MAE: 0.0708, Spearman rho: 0.4673, Spearman p: 9.0622e-34, Pearson r: 0.4742, Pearson p: 7.4849e-35
  Pred range: [0.0369, 0.3897], std: 0.0588
  RMSE : 0.0918, R2: 0.1669, MAE: 0.0735, Spearman rho: 0.4665, Spearman p: 1.1960e-33, Pearson r: 0.4740, Pearson p: 7.8882e-35
  Pred range: [0.0297, 0.3749], std: 0.0556
  RMSE : 0.0895, R2: 0.2079, MAE: 0.0713, Spearman rho: 0.4682, Spearman p: 6.6607e-34, Pearson r: 0.4763, Pearson p: 3.3889e-35
  Pred range: [0.0246, 0.3697], std: 0.0564
  RMSE : 0.0884, R2: 0.2271, MAE: 0.0695, Spearman rho: 0.4767, Spearman p: 2.9006e-35, Pearson r: 0.4830, Pearson p: 2.8589e-36
  Pred range: [0.0345, 0.3785], std: 0.0565
  RMSE : 0.0899, R2: 0.2021, MAE: 0.0717, Spearman rho: 0.4742, Spearman p: 7.4975e-35, Pearson r: 0.4806, Pearson p: 6.9734e-36
  Pred range: [0.0477, 0.4130], std: 0.0591
  RMSE : 0.0958, R2: 0.0929, MAE: 0.0778, Spearman rho: 0.4709, Spearman p: 2.4550e-34, Pearson r: 0.4796, Pearson p: 1.0122e-35
  Pred range: [0.0410, 0.3921], std: 0.0600
  RMSE : 0.0912, R2: 0.1781, MAE: 0.0728, Spearman rho: 0.4728, Spearman p: 1.2578e-34, Pearson r: 0.4805, Pearson p: 7.1681e-36
  Pred range: [0.0384, 0.3795], std: 0.0589
  RMSE : 0.0897, R2: 0.2046, MAE: 0.0711, Spearman rho: 0.4740, Spearman p: 8.0063e-35, Pearson r: 0.4819, Pearson p: 4.2298e-36
[I 2026-04-27 16:43:45,991] Trial 22 finished with value: 0.08843815119203682 and parameters: {'learning_rate': 0.00035523054813746364, 'batch_size': 4, 'num_epochs': 20, 'weight_decay': 0.0001778880372260891, 'layers_PRS': 5, 'layers_SCZ15': 4, 'layers_ADHD9': 1, 'layers_ASD9': 2, 'layers_ACE15': 2, 'layers_ACE18': 2, 'layers_SUD18': 3, 'layers_SES': 5, 'layers_SEX': 1, 'dropout': 0.4126934404450038, 'se_reduction': 4, 'hidden_dim_min': 9, 'base_loss': 'huber', 'huber_delta': 0.013917952619541322, 'focal_gamma': 1.0347115334780548, 'n_bins': 8, 'scheduler_patience': 2, 'scheduler_factor': 0.6598773345695281, 'early_stopping_patience': 4}. Best is trial 9 with value: 0.08803266597627345.
Train: 2407 rows (1613 IDs),Test: 598 rows (404 IDs) 

n_features_x : 6, n_features_per_modality: [16, 23, 19, 17, 7, 4, 4, 4, 1, 4]

--- ImbalancedRegressionLoss initialized ---
  Bins: 5, Focal gamma: 0.9289513738845689, Base loss: huber
  Bin [0.00, 0.20): count= 1876, weight=0.002
  Bin [0.20, 0.40): count=  497, weight=0.007
  Bin [0.40, 0.60): count=   32, weight=0.111
  Bin [0.60, 0.80): count=    2, weight=1.220
  Bin [0.80, 1.00): count=    0, weight=3.660
-------------------------------------------

  Pred range: [0.0378, 0.4145], std: 0.0481
  RMSE : 0.0944, R2: 0.1195, MAE: 0.0751, Spearman rho: 0.3333, Spearman p: 5.5088e-17, Pearson r: 0.3645, Pearson p: 3.1871e-20
  Pred range: [0.0325, 0.4322], std: 0.0535
  RMSE : 0.0917, R2: 0.1693, MAE: 0.0731, Spearman rho: 0.4082, Spearman p: 2.0124e-25, Pearson r: 0.4330, Pearson p: 1.0039e-28
  Pred range: [0.0280, 0.4226], std: 0.0571
  RMSE : 0.0907, R2: 0.1877, MAE: 0.0718, Spearman rho: 0.4335, Spearman p: 8.6831e-29, Pearson r: 0.4536, Pearson p: 1.1106e-31
  Pred range: [0.0217, 0.4029], std: 0.0569
  RMSE : 0.0899, R2: 0.2013, MAE: 0.0711, Spearman rho: 0.4454, Spearman p: 1.7300e-30, Pearson r: 0.4630, Pearson p: 4.2439e-33
  Pred range: [0.0346, 0.4430], std: 0.0621
  RMSE : 0.0939, R2: 0.1282, MAE: 0.0758, Spearman rho: 0.4555, Spearman p: 5.6374e-32, Pearson r: 0.4727, Pearson p: 1.2905e-34
  Pred range: [0.0176, 0.3913], std: 0.0575
  RMSE : 0.0893, R2: 0.2127, MAE: 0.0707, Spearman rho: 0.4625, Spearman p: 4.9105e-33, Pearson r: 0.4781, Pearson p: 1.7284e-35
  Pred range: [0.0488, 0.4288], std: 0.0599
  RMSE : 0.0983, R2: 0.0444, MAE: 0.0805, Spearman rho: 0.4581, Spearman p: 2.3255e-32, Pearson r: 0.4730, Pearson p: 1.1559e-34
  Pred range: [0.0233, 0.3885], std: 0.0581
  RMSE : 0.0892, R2: 0.2135, MAE: 0.0708, Spearman rho: 0.4684, Spearman p: 5.9980e-34, Pearson r: 0.4834, Pearson p: 2.4006e-36
  Pred range: [0.0095, 0.3805], std: 0.0575
  RMSE : 0.0890, R2: 0.2177, MAE: 0.0706, Spearman rho: 0.4692, Spearman p: 4.5858e-34, Pearson r: 0.4833, Pearson p: 2.4780e-36
  Pred range: [0.0192, 0.4107], std: 0.0620
  RMSE : 0.0916, R2: 0.1717, MAE: 0.0734, Spearman rho: 0.4716, Spearman p: 1.8944e-34, Pearson r: 0.4840, Pearson p: 1.9540e-36
  Pred range: [0.0114, 0.3822], std: 0.0584
  RMSE : 0.0890, R2: 0.2173, MAE: 0.0706, Spearman rho: 0.4725, Spearman p: 1.3791e-34, Pearson r: 0.4855, Pearson p: 1.0733e-36
  Pred range: [-0.0044, 0.3684], std: 0.0589
  RMSE : 0.0892, R2: 0.2136, MAE: 0.0708, Spearman rho: 0.4734, Spearman p: 1.0109e-34, Pearson r: 0.4848, Pearson p: 1.4358e-36
  Pred range: [-0.0110, 0.3492], std: 0.0563
  RMSE : 0.0882, R2: 0.2305, MAE: 0.0696, Spearman rho: 0.4740, Spearman p: 8.0739e-35, Pearson r: 0.4859, Pearson p: 9.4539e-37
  Pred range: [0.0067, 0.3739], std: 0.0584
  RMSE : 0.0904, R2: 0.1930, MAE: 0.0724, Spearman rho: 0.4701, Spearman p: 3.2579e-34, Pearson r: 0.4825, Pearson p: 3.4385e-36
  Pred range: [0.0199, 0.4021], std: 0.0635
  RMSE : 0.0941, R2: 0.1243, MAE: 0.0760, Spearman rho: 0.4713, Spearman p: 2.1664e-34, Pearson r: 0.4824, Pearson p: 3.5147e-36
[I 2026-04-27 16:46:14,159] Trial 23 finished with value: 0.08824124864717961 and parameters: {'learning_rate': 0.00020769019299248642, 'batch_size': 4, 'num_epochs': 15, 'weight_decay': 2.5985040058983145e-05, 'layers_PRS': 6, 'layers_SCZ15': 5, 'layers_ADHD9': 2, 'layers_ASD9': 3, 'layers_ACE15': 4, 'layers_ACE18': 2, 'layers_SUD18': 3, 'layers_SES': 5, 'layers_SEX': 2, 'dropout': 0.47467099223958925, 'se_reduction': 4, 'hidden_dim_min': 8, 'base_loss': 'huber', 'huber_delta': 0.014305087344888107, 'focal_gamma': 0.9289513738845689, 'n_bins': 5, 'scheduler_patience': 3, 'scheduler_factor': 0.6599304877201563, 'early_stopping_patience': 5}. Best is trial 9 with value: 0.08803266597627345.
Train: 2407 rows (1613 IDs),Test: 598 rows (404 IDs) 

n_features_x : 6, n_features_per_modality: [16, 23, 19, 17, 7, 4, 4, 4, 1, 4]

--- ImbalancedRegressionLoss initialized ---
  Bins: 5, Focal gamma: 0.9531724876379422, Base loss: huber
  Bin [0.00, 0.20): count= 1876, weight=0.002
  Bin [0.20, 0.40): count=  497, weight=0.007
  Bin [0.40, 0.60): count=   32, weight=0.111
  Bin [0.60, 0.80): count=    2, weight=1.220
  Bin [0.80, 1.00): count=    0, weight=3.660
-------------------------------------------

  Pred range: [0.0704, 0.3331], std: 0.0448
  RMSE : 0.1034, R2: -0.0571, MAE: 0.0833, Spearman rho: 0.1991, Spearman p: 9.2605e-07, Pearson r: 0.2321, Pearson p: 9.3549e-09
  Pred range: [0.0676, 0.3484], std: 0.0487
  RMSE : 0.1007, R2: -0.0019, MAE: 0.0811, Spearman rho: 0.2780, Spearman p: 4.4631e-12, Pearson r: 0.3035, Pearson p: 3.2991e-14
  Pred range: [0.0566, 0.3505], std: 0.0494
  RMSE : 0.0968, R2: 0.0736, MAE: 0.0775, Spearman rho: 0.3234, Spearman p: 5.0325e-16, Pearson r: 0.3471, Pearson p: 2.2707e-18
  Pred range: [0.0561, 0.3766], std: 0.0528
  RMSE : 0.0963, R2: 0.0833, MAE: 0.0774, Spearman rho: 0.3543, Spearman p: 4.0041e-19, Pearson r: 0.3776, Pearson p: 1.0701e-21
  Pred range: [0.0531, 0.3850], std: 0.0537
  RMSE : 0.0950, R2: 0.1083, MAE: 0.0762, Spearman rho: 0.3768, Spearman p: 1.3107e-21, Pearson r: 0.3977, Pearson p: 4.2074e-24
  Pred range: [0.0534, 0.3858], std: 0.0537
  RMSE : 0.0940, R2: 0.1271, MAE: 0.0754, Spearman rho: 0.3925, Spearman p: 1.8581e-23, Pearson r: 0.4122, Pearson p: 6.1493e-26
[I 2026-04-27 16:47:11,661] Trial 24 pruned. 
Train: 2407 rows (1613 IDs),Test: 598 rows (404 IDs) 

n_features_x : 6, n_features_per_modality: [16, 23, 19, 17, 7, 4, 4, 4, 1, 4]

--- ImbalancedRegressionLoss initialized ---
  Bins: 6, Focal gamma: 0.7612858098063436, Base loss: huber
  Bin [0.00, 0.17): count= 1538, weight=0.002
  Bin [0.17, 0.33): count=  789, weight=0.005
  Bin [0.33, 0.50): count=   69, weight=0.053
  Bin [0.50, 0.67): count=   10, weight=0.339
  Bin [0.67, 0.83): count=    1, weight=1.867
  Bin [0.83, 1.00): count=    0, weight=3.733
-------------------------------------------

  Pred range: [-0.0055, 0.3638], std: 0.0622
  RMSE : 0.0934, R2: 0.1383, MAE: 0.0740, Spearman rho: 0.4227, Spearman p: 2.5483e-27, Pearson r: 0.4356, Pearson p: 4.3411e-29
  Pred range: [0.0268, 0.4517], std: 0.0695
  RMSE : 0.1112, R2: -0.2219, MAE: 0.0919, Spearman rho: 0.4358, Spearman p: 4.1026e-29, Pearson r: 0.4499, Pearson p: 3.8552e-31
  Pred range: [0.0284, 0.4381], std: 0.0618
  RMSE : 0.1039, R2: -0.0663, MAE: 0.0857, Spearman rho: 0.4442, Spearman p: 2.5924e-30, Pearson r: 0.4569, Pearson p: 3.5432e-32
  Pred range: [0.0063, 0.4021], std: 0.0605
  RMSE : 0.0907, R2: 0.1864, MAE: 0.0722, Spearman rho: 0.4575, Spearman p: 2.8365e-32, Pearson r: 0.4701, Pearson p: 3.3043e-34
  Pred range: [0.0115, 0.3656], std: 0.0576
  RMSE : 0.0903, R2: 0.1946, MAE: 0.0719, Spearman rho: 0.4569, Spearman p: 3.4987e-32, Pearson r: 0.4695, Pearson p: 4.0360e-34
  Pred range: [0.0125, 0.3770], std: 0.0585
  RMSE : 0.0902, R2: 0.1964, MAE: 0.0719, Spearman rho: 0.4621, Spearman p: 5.7475e-33, Pearson r: 0.4751, Pearson p: 5.2849e-35
  Pred range: [0.0233, 0.4097], std: 0.0633
  RMSE : 0.0945, R2: 0.1184, MAE: 0.0765, Spearman rho: 0.4654, Spearman p: 1.7597e-33, Pearson r: 0.4760, Pearson p: 3.8318e-35
  Pred range: [0.0332, 0.4201], std: 0.0654
  RMSE : 0.0980, R2: 0.0512, MAE: 0.0798, Spearman rho: 0.4633, Spearman p: 3.7880e-33, Pearson r: 0.4772, Pearson p: 2.4115e-35
  Pred range: [0.0347, 0.4155], std: 0.0644
  RMSE : 0.0931, R2: 0.1429, MAE: 0.0746, Spearman rho: 0.4631, Spearman p: 3.9751e-33, Pearson r: 0.4764, Pearson p: 3.2679e-35
[I 2026-04-27 16:48:14,555] Trial 25 finished with value: 0.09017742948655513 and parameters: {'learning_rate': 0.00040108487374668184, 'batch_size': 6, 'num_epochs': 12, 'weight_decay': 2.666593265580835e-05, 'layers_PRS': 6, 'layers_SCZ15': 5, 'layers_ADHD9': 2, 'layers_ASD9': 4, 'layers_ACE15': 5, 'layers_ACE18': 1, 'layers_SUD18': 2, 'layers_SES': 5, 'layers_SEX': 2, 'dropout': 0.4104746115309413, 'se_reduction': 4, 'hidden_dim_min': 8, 'base_loss': 'huber', 'huber_delta': 0.025035518935923297, 'focal_gamma': 0.7612858098063436, 'n_bins': 6, 'scheduler_patience': 4, 'scheduler_factor': 0.6640778355925243, 'early_stopping_patience': 3}. Best is trial 9 with value: 0.08803266597627345.
Train: 2407 rows (1613 IDs),Test: 598 rows (404 IDs) 

n_features_x : 6, n_features_per_modality: [16, 23, 19, 17, 7, 4, 4, 4, 1, 4]

--- ImbalancedRegressionLoss initialized ---
  Bins: 11, Focal gamma: 1.1467224351620453, Base loss: mse
  Bin [0.00, 0.09): count= 1010, weight=0.003
  Bin [0.09, 0.18): count=  706, weight=0.004
  Bin [0.18, 0.27): count=  478, weight=0.006
  Bin [0.27, 0.36): count=  159, weight=0.018
  Bin [0.36, 0.45): count=   33, weight=0.085
  Bin [0.45, 0.55): count=   16, weight=0.170
  Bin [0.55, 0.64): count=    4, weight=0.579
  Bin [0.64, 0.73): count=    1, weight=1.448
  Bin [0.73, 0.82): count=    0, weight=2.896
  Bin [0.82, 0.91): count=    0, weight=2.896
  Bin [0.91, 1.00): count=    0, weight=2.896
-------------------------------------------

  Pred range: [0.0519, 0.4088], std: 0.0525
  RMSE : 0.1055, R2: -0.1005, MAE: 0.0859, Spearman rho: 0.3185, Spearman p: 1.4508e-15, Pearson r: 0.3156, Pearson p: 2.6914e-15
  Pred range: [0.0558, 0.3909], std: 0.0492
  RMSE : 0.0997, R2: 0.0172, MAE: 0.0813, Spearman rho: 0.3861, Spearman p: 1.0607e-22, Pearson r: 0.3863, Pearson p: 1.0189e-22
  Pred range: [0.0502, 0.3608], std: 0.0460
  RMSE : 0.0939, R2: 0.1294, MAE: 0.0758, Spearman rho: 0.4129, Spearman p: 5.0707e-26, Pearson r: 0.4149, Pearson p: 2.8101e-26
  Pred range: [0.0606, 0.3881], std: 0.0497
  RMSE : 0.0963, R2: 0.0844, MAE: 0.0785, Spearman rho: 0.4267, Spearman p: 7.4536e-28, Pearson r: 0.4296, Pearson p: 2.9394e-28
  Pred range: [0.0602, 0.3764], std: 0.0491
  RMSE : 0.0935, R2: 0.1357, MAE: 0.0757, Spearman rho: 0.4318, Spearman p: 1.4699e-28, Pearson r: 0.4338, Pearson p: 7.6847e-29
  Pred range: [0.0673, 0.3935], std: 0.0500
  RMSE : 0.0961, R2: 0.0874, MAE: 0.0784, Spearman rho: 0.4318, Spearman p: 1.4644e-28, Pearson r: 0.4346, Pearson p: 5.9530e-29
[I 2026-04-27 16:49:18,517] Trial 26 pruned. 
Train: 2407 rows (1613 IDs),Test: 598 rows (404 IDs) 

n_features_x : 6, n_features_per_modality: [16, 23, 19, 17, 7, 4, 4, 4, 1, 4]

--- ImbalancedRegressionLoss initialized ---
  Bins: 14, Focal gamma: 0.5198694638351238, Base loss: huber
  Bin [0.00, 0.07): count=  828, weight=0.003
  Bin [0.07, 0.14): count=  542, weight=0.005
  Bin [0.14, 0.21): count=  506, weight=0.005
  Bin [0.21, 0.29): count=  386, weight=0.007
  Bin [0.29, 0.36): count=   91, weight=0.029
  Bin [0.36, 0.43): count=   29, weight=0.090
  Bin [0.43, 0.50): count=   12, weight=0.207
  Bin [0.50, 0.57): count=   11, weight=0.224
  Bin [0.57, 0.64): count=    1, weight=1.343
  Bin [0.64, 0.71): count=    1, weight=1.343
  Bin [0.71, 0.79): count=    0, weight=2.686
  Bin [0.79, 0.86): count=    0, weight=2.686
  Bin [0.86, 0.93): count=    0, weight=2.686
  Bin [0.93, 1.00): count=    0, weight=2.686
-------------------------------------------

  Pred range: [0.0231, 0.3671], std: 0.0514
  RMSE : 0.0947, R2: 0.1133, MAE: 0.0755, Spearman rho: 0.3925, Spearman p: 1.8444e-23, Pearson r: 0.4158, Pearson p: 2.0925e-26
  Pred range: [0.0104, 0.3670], std: 0.0538
  RMSE : 0.0914, R2: 0.1744, MAE: 0.0723, Spearman rho: 0.4163, Spearman p: 1.7998e-26, Pearson r: 0.4401, Pearson p: 1.0129e-29
  Pred range: [0.0135, 0.3809], std: 0.0554
  RMSE : 0.0919, R2: 0.1659, MAE: 0.0730, Spearman rho: 0.4297, Spearman p: 2.8696e-28, Pearson r: 0.4519, Pearson p: 1.9757e-31
  Pred range: [0.0135, 0.3921], std: 0.0574
  RMSE : 0.0922, R2: 0.1605, MAE: 0.0734, Spearman rho: 0.4383, Spearman p: 1.8175e-29, Pearson r: 0.4596, Pearson p: 1.3806e-32
  Pred range: [0.0080, 0.3808], std: 0.0564
  RMSE : 0.0900, R2: 0.1989, MAE: 0.0712, Spearman rho: 0.4459, Spearman p: 1.4835e-30, Pearson r: 0.4670, Pearson p: 9.9519e-34
  Pred range: [0.0107, 0.3953], std: 0.0581
  RMSE : 0.0909, R2: 0.1834, MAE: 0.0723, Spearman rho: 0.4503, Spearman p: 3.4167e-31, Pearson r: 0.4703, Pearson p: 3.1238e-34
  Pred range: [0.0118, 0.4044], std: 0.0592
  RMSE : 0.0915, R2: 0.1734, MAE: 0.0729, Spearman rho: 0.4526, Spearman p: 1.5641e-31, Pearson r: 0.4724, Pearson p: 1.4469e-34
  Pred range: [0.0061, 0.3816], std: 0.0569
  RMSE : 0.0891, R2: 0.2155, MAE: 0.0705, Spearman rho: 0.4567, Spearman p: 3.7713e-32, Pearson r: 0.4771, Pearson p: 2.5422e-35
  Pred range: [0.0152, 0.4086], std: 0.0598
  RMSE : 0.0918, R2: 0.1680, MAE: 0.0733, Spearman rho: 0.4576, Spearman p: 2.7951e-32, Pearson r: 0.4771, Pearson p: 2.5134e-35
  Pred range: [0.0158, 0.4033], std: 0.0596
  RMSE : 0.0914, R2: 0.1748, MAE: 0.0729, Spearman rho: 0.4586, Spearman p: 1.9564e-32, Pearson r: 0.4778, Pearson p: 1.9483e-35
  Pred range: [0.0124, 0.3890], std: 0.0580
  RMSE : 0.0897, R2: 0.2042, MAE: 0.0713, Spearman rho: 0.4608, Spearman p: 8.9601e-33, Pearson r: 0.4797, Pearson p: 9.7440e-36
  Pred range: [0.0132, 0.3946], std: 0.0586
  RMSE : 0.0899, R2: 0.2010, MAE: 0.0715, Spearman rho: 0.4625, Spearman p: 4.9591e-33, Pearson r: 0.4801, Pearson p: 8.4493e-36
