[I 2026-04-29 01:19:38,110] Trial 14 finished with value: 0.1514074333585588 and parameters: {'learning_rate': 0.001650429065509917, 'batch_size': 4, 'num_epochs': 27, 'weight_decay': 5.520429517763897e-05, 'layers_PRS': 1, 'layers_SCZ15': 4, 'layers_ADHD9': 4, 'layers_ASD9': 1, 'layers_ACE15': 5, 'layers_ACE18': 2, 'layers_SUD18': 2, 'layers_SES': 2, 'layers_SEX': 3, 'dropout': 0.18924268055427296, 'se_reduction': 8, 'hidden_dim_min': 11, 'base_loss': 'huber', 'huber_delta': 0.19920881086994024, 'focal_gamma': 1.1940727337332226, 'n_bins': 14, 'scheduler_patience': 2, 'scheduler_factor': 0.3701240720269805, 'early_stopping_patience': 4}. Best is trial 10 with value: 0.15105277601580916.
Train: 2407 rows (1613 IDs),Test: 598 rows (404 IDs) 

n_features_x : 6, n_features_per_modality: [16, 23, 19, 17, 7, 4, 4, 4, 1, 4]

--- ImbalancedRegressionLoss initialized ---
  Bins: 9, Focal gamma: 0.9148835656659103, Base loss: huber
  Bin [0.00, 0.11): count=  585, weight=0.041
  Bin [0.11, 0.22): count=  746, weight=0.032
  Bin [0.22, 0.33): count=  478, weight=0.050
  Bin [0.33, 0.44): count=  231, weight=0.104
  Bin [0.44, 0.56): count=  215, weight=0.112
  Bin [0.56, 0.67): count=  100, weight=0.239
  Bin [0.67, 0.78): count=   36, weight=0.653
  Bin [0.78, 0.89): count=   13, weight=1.726
  Bin [0.89, 1.00): count=    3, weight=6.041
-------------------------------------------

  Pred range: [0.0482, 0.5744], std: 0.0994
  RMSE : 0.1519, R2: 0.2295, MAE: 0.1206, Spearman rho: 0.4899, Spearman p: 2.0494e-37, Pearson r: 0.4968, Pearson p: 1.3329e-38
  Pred range: [0.0182, 0.5679], std: 0.0994
  RMSE : 0.1518, R2: 0.2309, MAE: 0.1189, Spearman rho: 0.4720, Spearman p: 1.6852e-34, Pearson r: 0.4884, Pearson p: 3.5974e-37
  Pred range: [0.1016, 0.6944], std: 0.1101
  RMSE : 0.1816, R2: -0.1012, MAE: 0.1528, Spearman rho: 0.4813, Spearman p: 5.3636e-36, Pearson r: 0.4941, Pearson p: 4.0000e-38
  Pred range: [0.0674, 0.7017], std: 0.1132
  RMSE : 0.1678, R2: 0.0600, MAE: 0.1377, Spearman rho: 0.4750, Spearman p: 5.5516e-35, Pearson r: 0.4891, Pearson p: 2.7816e-37
  Pred range: [0.0562, 0.6109], std: 0.0967
  RMSE : 0.1550, R2: 0.1985, MAE: 0.1258, Spearman rho: 0.4657, Spearman p: 1.5827e-33, Pearson r: 0.4887, Pearson p: 3.1375e-37
  Pred range: [0.0349, 0.5835], std: 0.1019
  RMSE : 0.1526, R2: 0.2231, MAE: 0.1218, Spearman rho: 0.4834, Spearman p: 2.3911e-36, Pearson r: 0.5003, Pearson p: 3.3417e-39
  Pred range: [-0.0477, 0.5417], std: 0.1011
  RMSE : 0.1519, R2: 0.2298, MAE: 0.1164, Spearman rho: 0.4795, Spearman p: 1.0587e-35, Pearson r: 0.4944, Pearson p: 3.5130e-38
[I 2026-04-29 01:20:38,525] Trial 15 finished with value: 0.15179729267245487 and parameters: {'learning_rate': 0.0026805423113540634, 'batch_size': 4, 'num_epochs': 28, 'weight_decay': 0.0008660860926997257, 'layers_PRS': 3, 'layers_SCZ15': 3, 'layers_ADHD9': 4, 'layers_ASD9': 2, 'layers_ACE15': 4, 'layers_ACE18': 2, 'layers_SUD18': 3, 'layers_SES': 3, 'layers_SEX': 4, 'dropout': 0.30466200452582026, 'se_reduction': 6, 'hidden_dim_min': 9, 'base_loss': 'huber', 'huber_delta': 0.17626526472112372, 'focal_gamma': 0.9148835656659103, 'n_bins': 9, 'scheduler_patience': 2, 'scheduler_factor': 0.5447676926311802, 'early_stopping_patience': 5}. Best is trial 10 with value: 0.15105277601580916.
Train: 2407 rows (1613 IDs),Test: 598 rows (404 IDs) 

n_features_x : 6, n_features_per_modality: [16, 23, 19, 17, 7, 4, 4, 4, 1, 4]

--- ImbalancedRegressionLoss initialized ---
  Bins: 12, Focal gamma: 1.4781427944905108, Base loss: huber
  Bin [0.00, 0.08): count=  383, weight=0.051
  Bin [0.08, 0.17): count=  578, weight=0.034
  Bin [0.17, 0.25): count=  499, weight=0.039
  Bin [0.25, 0.33): count=  349, weight=0.055
  Bin [0.33, 0.42): count=  162, weight=0.119
  Bin [0.42, 0.50): count=  191, weight=0.101
  Bin [0.50, 0.58): count=  129, weight=0.149
  Bin [0.58, 0.67): count=   47, weight=0.404
  Bin [0.67, 0.75): count=   41, weight=0.462
  Bin [0.75, 0.83): count=   21, weight=0.882
  Bin [0.83, 0.92): count=    5, weight=3.235
  Bin [0.92, 1.00): count=    2, weight=6.469
-------------------------------------------

  Pred range: [0.0704, 0.5418], std: 0.0847
  RMSE : 0.1526, R2: 0.2232, MAE: 0.1207, Spearman rho: 0.4718, Spearman p: 1.7962e-34, Pearson r: 0.4796, Pearson p: 1.0162e-35
  Pred range: [0.0692, 0.5700], std: 0.0971
  RMSE : 0.1514, R2: 0.2350, MAE: 0.1211, Spearman rho: 0.4931, Spearman p: 5.7223e-38, Pearson r: 0.5058, Pearson p: 3.6691e-40
  Pred range: [0.0784, 0.5591], std: 0.0889
  RMSE : 0.1529, R2: 0.2200, MAE: 0.1251, Spearman rho: 0.4855, Spearman p: 1.0958e-36, Pearson r: 0.5090, Pearson p: 9.8321e-41
  Pred range: [0.0904, 0.6269], std: 0.0992
  RMSE : 0.1548, R2: 0.2002, MAE: 0.1267, Spearman rho: 0.4879, Spearman p: 4.3102e-37, Pearson r: 0.5094, Pearson p: 8.5841e-41
  Pred range: [0.0815, 0.6377], std: 0.0988
  RMSE : 0.1599, R2: 0.1460, MAE: 0.1322, Spearman rho: 0.4790, Spearman p: 1.2561e-35, Pearson r: 0.4999, Pearson p: 3.9248e-39
  Pred range: [0.0493, 0.6017], std: 0.0968
  RMSE : 0.1523, R2: 0.2257, MAE: 0.1228, Spearman rho: 0.4820, Spearman p: 4.0685e-36, Pearson r: 0.5015, Pearson p: 2.0684e-39
[I 2026-04-29 01:21:27,389] Trial 16 finished with value: 0.1513866289020656 and parameters: {'learning_rate': 0.0010676437832965167, 'batch_size': 4, 'num_epochs': 26, 'weight_decay': 8.325486284756873e-05, 'layers_PRS': 3, 'layers_SCZ15': 1, 'layers_ADHD9': 5, 'layers_ASD9': 1, 'layers_ACE15': 4, 'layers_ACE18': 4, 'layers_SUD18': 4, 'layers_SES': 1, 'layers_SEX': 4, 'dropout': 0.18184023214877879, 'se_reduction': 8, 'hidden_dim_min': 15, 'base_loss': 'huber', 'huber_delta': 0.17591584389466625, 'focal_gamma': 1.4781427944905108, 'n_bins': 12, 'scheduler_patience': 2, 'scheduler_factor': 0.544584603000528, 'early_stopping_patience': 4}. Best is trial 10 with value: 0.15105277601580916.
Train: 2407 rows (1613 IDs),Test: 598 rows (404 IDs) 

n_features_x : 6, n_features_per_modality: [16, 23, 19, 17, 7, 4, 4, 4, 1, 4]

--- ImbalancedRegressionLoss initialized ---
  Bins: 16, Focal gamma: 0.7388195572724824, Base loss: huber
  Bin [0.00, 0.06): count=  383, weight=0.041
  Bin [0.06, 0.12): count=  377, weight=0.042
  Bin [0.12, 0.19): count=  405, weight=0.039
  Bin [0.19, 0.25): count=  295, weight=0.053
  Bin [0.25, 0.31): count=  239, weight=0.066
  Bin [0.31, 0.38): count=  199, weight=0.079
  Bin [0.38, 0.44): count=  142, weight=0.111
  Bin [0.44, 0.50): count=  122, weight=0.129
  Bin [0.50, 0.56): count=   93, weight=0.168
  Bin [0.56, 0.62): count=   64, weight=0.243
  Bin [0.62, 0.69): count=   36, weight=0.427
  Bin [0.69, 0.75): count=   24, weight=0.633
  Bin [0.75, 0.81): count=   19, weight=0.791
  Bin [0.81, 0.88): count=    5, weight=2.636
  Bin [0.88, 0.94): count=    2, weight=5.271
  Bin [0.94, 1.00): count=    2, weight=5.271
-------------------------------------------

  Pred range: [-0.0873, 0.4585], std: 0.0971
  RMSE : 0.1945, R2: -0.2629, MAE: 0.1431, Spearman rho: 0.4278, Spearman p: 5.2389e-28, Pearson r: 0.4347, Pearson p: 5.8894e-29
  Pred range: [-0.1301, 0.5603], std: 0.0987
  RMSE : 0.1596, R2: 0.1500, MAE: 0.1179, Spearman rho: 0.4376, Spearman p: 2.2634e-29, Pearson r: 0.4418, Pearson p: 5.8841e-30
  Pred range: [-0.0300, 0.5895], std: 0.1106
  RMSE : 0.1553, R2: 0.1953, MAE: 0.1168, Spearman rho: 0.4744, Spearman p: 6.8911e-35, Pearson r: 0.4884, Pearson p: 3.6146e-37
  Pred range: [0.0303, 0.7030], std: 0.1092
  RMSE : 0.1571, R2: 0.1765, MAE: 0.1194, Spearman rho: 0.4607, Spearman p: 9.2685e-33, Pearson r: 0.4590, Pearson p: 1.6968e-32
  Pred range: [0.0661, 0.5773], std: 0.0964
  RMSE : 0.1576, R2: 0.1711, MAE: 0.1284, Spearman rho: 0.4471, Spearman p: 1.0116e-30, Pearson r: 0.4698, Pearson p: 3.6772e-34
  Pred range: [0.0798, 0.7862], std: 0.1168
  RMSE : 0.1751, R2: -0.0232, MAE: 0.1437, Spearman rho: 0.4723, Spearman p: 1.4639e-34, Pearson r: 0.4773, Pearson p: 2.4063e-35
[I 2026-04-29 01:22:16,373] Trial 17 finished with value: 0.155270498475864 and parameters: {'learning_rate': 0.005744249871731622, 'batch_size': 4, 'num_epochs': 30, 'weight_decay': 0.0003454136835879653, 'layers_PRS': 2, 'layers_SCZ15': 2, 'layers_ADHD9': 4, 'layers_ASD9': 4, 'layers_ACE15': 5, 'layers_ACE18': 1, 'layers_SUD18': 2, 'layers_SES': 3, 'layers_SEX': 3, 'dropout': 0.31475683580717173, 'se_reduction': 6, 'hidden_dim_min': 5, 'base_loss': 'huber', 'huber_delta': 0.04884738425963753, 'focal_gamma': 0.7388195572724824, 'n_bins': 16, 'scheduler_patience': 4, 'scheduler_factor': 0.30945311977785783, 'early_stopping_patience': 3}. Best is trial 10 with value: 0.15105277601580916.
Train: 2407 rows (1613 IDs),Test: 598 rows (404 IDs) 

n_features_x : 6, n_features_per_modality: [16, 23, 19, 17, 7, 4, 4, 4, 1, 4]

--- ImbalancedRegressionLoss initialized ---
  Bins: 5, Focal gamma: 1.1482946056665653, Base loss: huber
  Bin [0.00, 0.20): count= 1165, weight=0.037
  Bin [0.20, 0.40): count=  806, weight=0.054
  Bin [0.40, 0.60): count=  320, weight=0.136
  Bin [0.60, 0.80): count=  107, weight=0.404
  Bin [0.80, 1.00): count=    9, weight=4.368
-------------------------------------------

  Pred range: [0.1078, 0.5989], std: 0.0864
  RMSE : 0.1579, R2: 0.1682, MAE: 0.1293, Spearman rho: 0.4522, Spearman p: 1.7827e-31, Pearson r: 0.4662, Pearson p: 1.3596e-33
  Pred range: [0.1775, 0.8364], std: 0.1138
  RMSE : 0.2264, R2: -0.7107, MAE: 0.1953, Spearman rho: 0.4622, Spearman p: 5.4938e-33, Pearson r: 0.4944, Pearson p: 3.5616e-38
  Pred range: [-0.0611, 0.6173], std: 0.1046
  RMSE : 0.1565, R2: 0.1823, MAE: 0.1210, Spearman rho: 0.4283, Spearman p: 4.4989e-28, Pearson r: 0.4675, Pearson p: 8.4198e-34
  Pred range: [0.1141, 0.7304], std: 0.1059
  RMSE : 0.1880, R2: -0.1796, MAE: 0.1595, Spearman rho: 0.4566, Spearman p: 3.8811e-32, Pearson r: 0.4816, Pearson p: 4.8089e-36
  Pred range: [0.0467, 0.6499], std: 0.1006
  RMSE : 0.1564, R2: 0.1833, MAE: 0.1291, Spearman rho: 0.4491, Spearman p: 5.0240e-31, Pearson r: 0.4866, Pearson p: 7.0939e-37
  Pred range: [0.0494, 0.6556], std: 0.1070
  RMSE : 0.1617, R2: 0.1269, MAE: 0.1343, Spearman rho: 0.4604, Spearman p: 1.0330e-32, Pearson r: 0.4876, Pearson p: 4.8148e-37
  Pred range: [-0.0355, 0.6426], std: 0.1063
  RMSE : 0.1580, R2: 0.1667, MAE: 0.1280, Spearman rho: 0.4229, Spearman p: 2.4388e-27, Pearson r: 0.4591, Pearson p: 1.6375e-32
  Pred range: [0.0814, 0.8625], std: 0.1268
  RMSE : 0.2029, R2: -0.3747, MAE: 0.1717, Spearman rho: 0.4662, Spearman p: 1.3554e-33, Pearson r: 0.4924, Pearson p: 7.6216e-38
  Pred range: [0.0980, 0.7821], std: 0.1167
  RMSE : 0.2068, R2: -0.4282, MAE: 0.1768, Spearman rho: 0.4704, Spearman p: 2.9873e-34, Pearson r: 0.4990, Pearson p: 5.7333e-39
  Pred range: [0.0394, 0.7180], std: 0.1156
  RMSE : 0.1722, R2: 0.0102, MAE: 0.1434, Spearman rho: 0.4699, Spearman p: 3.5253e-34, Pearson r: 0.5016, Pearson p: 2.0221e-39
[I 2026-04-29 01:22:28,130] Trial 18 finished with value: 0.15641619069561852 and parameters: {'learning_rate': 0.008917209176294854, 'batch_size': 32, 'num_epochs': 24, 'weight_decay': 0.0016539734097844947, 'layers_PRS': 1, 'layers_SCZ15': 3, 'layers_ADHD9': 2, 'layers_ASD9': 2, 'layers_ACE15': 4, 'layers_ACE18': 2, 'layers_SUD18': 4, 'layers_SES': 2, 'layers_SEX': 5, 'dropout': 0.10274474299727945, 'se_reduction': 7, 'hidden_dim_min': 7, 'base_loss': 'huber', 'huber_delta': 0.17041057451971905, 'focal_gamma': 1.1482946056665653, 'n_bins': 5, 'scheduler_patience': 2, 'scheduler_factor': 0.3843832409166989, 'early_stopping_patience': 5}. Best is trial 10 with value: 0.15105277601580916.
Train: 2407 rows (1613 IDs),Test: 598 rows (404 IDs) 

n_features_x : 6, n_features_per_modality: [16, 23, 19, 17, 7, 4, 4, 4, 1, 4]

--- ImbalancedRegressionLoss initialized ---
  Bins: 13, Focal gamma: 1.6063650972322328, Base loss: huber
  Bin [0.00, 0.08): count=  383, weight=0.049
  Bin [0.08, 0.15): count=  578, weight=0.032
  Bin [0.15, 0.23): count=  370, weight=0.051
  Bin [0.23, 0.31): count=  368, weight=0.051
  Bin [0.31, 0.38): count=  199, weight=0.094
  Bin [0.38, 0.46): count=  207, weight=0.090
  Bin [0.46, 0.54): count=  108, weight=0.172
  Bin [0.54, 0.62): count=  106, weight=0.176
  Bin [0.62, 0.69): count=   36, weight=0.508
  Bin [0.69, 0.77): count=   36, weight=0.508
  Bin [0.77, 0.85): count=    9, weight=1.878
  Bin [0.85, 0.92): count=    5, weight=3.130
  Bin [0.92, 1.00): count=    2, weight=6.261
-------------------------------------------

  Pred range: [0.1350, 0.5417], std: 0.0783
  RMSE : 0.1731, R2: -0.0007, MAE: 0.1457, Spearman rho: 0.4297, Spearman p: 2.9223e-28, Pearson r: 0.4284, Pearson p: 4.4079e-28
  Pred range: [0.1186, 0.5714], std: 0.0843
  RMSE : 0.1635, R2: 0.1074, MAE: 0.1359, Spearman rho: 0.4684, Spearman p: 6.0796e-34, Pearson r: 0.4731, Pearson p: 1.1052e-34
  Pred range: [0.1259, 0.6001], std: 0.0879
  RMSE : 0.1646, R2: 0.0957, MAE: 0.1376, Spearman rho: 0.4798, Spearman p: 9.4334e-36, Pearson r: 0.4914, Pearson p: 1.1057e-37
  Pred range: [0.1350, 0.6606], std: 0.0941
  RMSE : 0.1756, R2: -0.0298, MAE: 0.1488, Spearman rho: 0.4856, Spearman p: 1.0592e-36, Pearson r: 0.4997, Pearson p: 4.2814e-39
  Pred range: [0.0571, 0.5448], std: 0.0853
  RMSE : 0.1512, R2: 0.2371, MAE: 0.1212, Spearman rho: 0.4809, Spearman p: 6.0912e-36, Pearson r: 0.5009, Pearson p: 2.6979e-39
  Pred range: [0.1148, 0.6398], std: 0.0945
  RMSE : 0.1688, R2: 0.0484, MAE: 0.1421, Spearman rho: 0.4878, Spearman p: 4.4858e-37, Pearson r: 0.5086, Pearson p: 1.1614e-40
  Pred range: [0.0786, 0.5616], std: 0.0889
  RMSE : 0.1513, R2: 0.2358, MAE: 0.1222, Spearman rho: 0.4866, Spearman p: 7.1504e-37, Pearson r: 0.5102, Pearson p: 6.1273e-41
  Pred range: [0.1025, 0.6208], std: 0.0918
  RMSE : 0.1595, R2: 0.1510, MAE: 0.1326, Spearman rho: 0.4859, Spearman p: 9.3249e-37, Pearson r: 0.5096, Pearson p: 7.8108e-41
  Pred range: [0.0932, 0.6262], std: 0.0942
  RMSE : 0.1610, R2: 0.1353, MAE: 0.1337, Spearman rho: 0.4871, Spearman p: 5.8255e-37, Pearson r: 0.5085, Pearson p: 1.2056e-40
[I 2026-04-29 01:23:09,393] Trial 19 finished with value: 0.1511849136545273 and parameters: {'learning_rate': 0.001020337985567293, 'batch_size': 8, 'num_epochs': 28, 'weight_decay': 0.003186565416783087, 'layers_PRS': 3, 'layers_SCZ15': 4, 'layers_ADHD9': 3, 'layers_ASD9': 1, 'layers_ACE15': 5, 'layers_ACE18': 4, 'layers_SUD18': 1, 'layers_SES': 3, 'layers_SEX': 4, 'dropout': 0.21409792469862934, 'se_reduction': 4, 'hidden_dim_min': 4, 'base_loss': 'huber', 'huber_delta': 0.18588774476156003, 'focal_gamma': 1.6063650972322328, 'n_bins': 13, 'scheduler_patience': 3, 'scheduler_factor': 0.35062398845955267, 'early_stopping_patience': 4}. Best is trial 10 with value: 0.15105277601580916.
Train: 2407 rows (1613 IDs),Test: 598 rows (404 IDs) 

n_features_x : 6, n_features_per_modality: [16, 23, 19, 17, 7, 4, 4, 4, 1, 4]

--- ImbalancedRegressionLoss initialized ---
  Bins: 20, Focal gamma: 2.921762475382166, Base loss: huber
  Bin [0.00, 0.05): count=  172, weight=0.053
  Bin [0.05, 0.10): count=  413, weight=0.022
  Bin [0.10, 0.15): count=  175, weight=0.052
  Bin [0.15, 0.20): count=  405, weight=0.023
  Bin [0.20, 0.25): count=  295, weight=0.031
  Bin [0.25, 0.30): count=  126, weight=0.072
  Bin [0.30, 0.35): count=  223, weight=0.041
  Bin [0.35, 0.40): count=  162, weight=0.056
  Bin [0.40, 0.45): count=   69, weight=0.131
  Bin [0.45, 0.50): count=  122, weight=0.074
  Bin [0.50, 0.55): count=   93, weight=0.097
  Bin [0.55, 0.60): count=   36, weight=0.247
  Bin [0.60, 0.65): count=   47, weight=0.190
  Bin [0.65, 0.70): count=   27, weight=0.326
  Bin [0.70, 0.75): count=   14, weight=0.609
  Bin [0.75, 0.80): count=   19, weight=0.457
  Bin [0.80, 0.85): count=    5, weight=1.523
  Bin [0.85, 0.90): count=    1, weight=4.570
  Bin [0.90, 0.95): count=    3, weight=2.285
  Bin [0.95, 1.00): count=    0, weight=9.140
-------------------------------------------

  Pred range: [0.0762, 0.5282], std: 0.0739
  RMSE : 0.1511, R2: 0.2376, MAE: 0.1191, Spearman rho: 0.4681, Spearman p: 6.9009e-34, Pearson r: 0.4918, Pearson p: 9.5852e-38
  Pred range: [0.1249, 0.7575], std: 0.0985
  RMSE : 0.1872, R2: -0.1700, MAE: 0.1592, Spearman rho: 0.4589, Spearman p: 1.7672e-32, Pearson r: 0.4897, Pearson p: 2.1799e-37
  Pred range: [0.0991, 0.7237], std: 0.0990
  RMSE : 0.1787, R2: -0.0657, MAE: 0.1508, Spearman rho: 0.4711, Spearman p: 2.3203e-34, Pearson r: 0.5063, Pearson p: 3.0574e-40
  Pred range: [0.0538, 0.7207], std: 0.1028
  RMSE : 0.1668, R2: 0.0718, MAE: 0.1389, Spearman rho: 0.4694, Spearman p: 4.2674e-34, Pearson r: 0.5015, Pearson p: 2.0643e-39
[I 2026-04-29 01:23:16,908] Trial 20 finished with value: 0.15113336284475132 and parameters: {'learning_rate': 0.0038176955604905262, 'batch_size': 16, 'num_epochs': 13, 'weight_decay': 0.0002299848065096313, 'layers_PRS': 2, 'layers_SCZ15': 2, 'layers_ADHD9': 5, 'layers_ASD9': 4, 'layers_ACE15': 2, 'layers_ACE18': 1, 'layers_SUD18': 2, 'layers_SES': 1, 'layers_SEX': 1, 'dropout': 0.1487334366850342, 'se_reduction': 8, 'hidden_dim_min': 11, 'base_loss': 'huber', 'huber_delta': 0.1518638512384564, 'focal_gamma': 2.921762475382166, 'n_bins': 20, 'scheduler_patience': 2, 'scheduler_factor': 0.524098807488596, 'early_stopping_patience': 3}. Best is trial 10 with value: 0.15105277601580916.
Train: 2407 rows (1613 IDs),Test: 598 rows (404 IDs) 

n_features_x : 6, n_features_per_modality: [16, 23, 19, 17, 7, 4, 4, 4, 1, 4]

--- ImbalancedRegressionLoss initialized ---
  Bins: 20, Focal gamma: 2.90886103411262, Base loss: huber
  Bin [0.00, 0.05): count=  172, weight=0.053
  Bin [0.05, 0.10): count=  413, weight=0.022
  Bin [0.10, 0.15): count=  175, weight=0.052
  Bin [0.15, 0.20): count=  405, weight=0.023
  Bin [0.20, 0.25): count=  295, weight=0.031
  Bin [0.25, 0.30): count=  126, weight=0.072
  Bin [0.30, 0.35): count=  223, weight=0.041
  Bin [0.35, 0.40): count=  162, weight=0.056
  Bin [0.40, 0.45): count=   69, weight=0.131
  Bin [0.45, 0.50): count=  122, weight=0.074
  Bin [0.50, 0.55): count=   93, weight=0.097
  Bin [0.55, 0.60): count=   36, weight=0.247
  Bin [0.60, 0.65): count=   47, weight=0.190
  Bin [0.65, 0.70): count=   27, weight=0.326
  Bin [0.70, 0.75): count=   14, weight=0.609
  Bin [0.75, 0.80): count=   19, weight=0.457
  Bin [0.80, 0.85): count=    5, weight=1.523
  Bin [0.85, 0.90): count=    1, weight=4.570
  Bin [0.90, 0.95): count=    3, weight=2.285
  Bin [0.95, 1.00): count=    0, weight=9.140
-------------------------------------------

  Pred range: [0.1378, 0.6787], std: 0.0839
  RMSE : 0.1826, R2: -0.1133, MAE: 0.1565, Spearman rho: 0.4383, Spearman p: 1.8359e-29, Pearson r: 0.4530, Pearson p: 1.3620e-31
  Pred range: [0.1181, 0.6343], std: 0.0878
  RMSE : 0.1747, R2: -0.0189, MAE: 0.1485, Spearman rho: 0.4661, Spearman p: 1.3758e-33, Pearson r: 0.4874, Pearson p: 5.3337e-37
  Pred range: [0.0655, 0.6099], std: 0.0869
  RMSE : 0.1635, R2: 0.1078, MAE: 0.1367, Spearman rho: 0.4564, Spearman p: 4.1793e-32, Pearson r: 0.4802, Pearson p: 8.1530e-36
  Pred range: [-0.0009, 0.6099], std: 0.0945
  RMSE : 0.1518, R2: 0.2309, MAE: 0.1216, Spearman rho: 0.4637, Spearman p: 3.2590e-33, Pearson r: 0.4943, Pearson p: 3.6001e-38
  Pred range: [0.0309, 0.5894], std: 0.0889
  RMSE : 0.1589, R2: 0.1576, MAE: 0.1313, Spearman rho: 0.4528, Spearman p: 1.4646e-31, Pearson r: 0.4785, Pearson p: 1.5327e-35
  Pred range: [0.0351, 0.6412], std: 0.1014
  RMSE : 0.1590, R2: 0.1558, MAE: 0.1310, Spearman rho: 0.4682, Spearman p: 6.4831e-34, Pearson r: 0.5027, Pearson p: 1.3100e-39
  Pred range: [0.0973, 0.7238], std: 0.1041
  RMSE : 0.1904, R2: -0.2095, MAE: 0.1620, Spearman rho: 0.4645, Spearman p: 2.4355e-33, Pearson r: 0.5020, Pearson p: 1.6833e-39
