[I 2026-04-27 23:12:13,779] A new study created in memory with name: DCMFNet_Pos
Data shape: (4033, 125)
modality sizes for ['SUD15', 'PRS', 'SCZ15', 'ADHD9', 'ASD9', 'ACE15', 'ACE18', 'SUD18', 'SES', 'SEX', '^batch_.*_x_PC'] : [6, 16, 23, 19, 17, 7, 4, 4, 4, 1, 4]
Train: 3005 rows (2017 IDs),Test: 1028 rows (673 IDs) 


============================================================
  Tuning Pos symptom model (50 trials)
============================================================
  0%|          | 0/50 [00:00<?, ?it/s]                                        0%|          | 0/50 [01:45<?, ?it/s]Best trial: 0. Best value: 0.089851:   0%|          | 0/50 [01:45<?, ?it/s]Best trial: 0. Best value: 0.089851:   2%|▏         | 1/50 [01:45<1:26:32, 105.98s/it]                                                                                      Best trial: 0. Best value: 0.089851:   2%|▏         | 1/50 [03:30<1:26:32, 105.98s/it]Best trial: 0. Best value: 0.089851:   2%|▏         | 1/50 [03:30<1:26:32, 105.98s/it]Best trial: 0. Best value: 0.089851:   4%|▍         | 2/50 [03:30<1:24:17, 105.37s/it]                                                                                      Best trial: 0. Best value: 0.089851:   4%|▍         | 2/50 [03:43<1:24:17, 105.37s/it]Best trial: 0. Best value: 0.089851:   4%|▍         | 2/50 [03:43<1:24:17, 105.37s/it]Best trial: 0. Best value: 0.089851:   6%|▌         | 3/50 [03:43<49:30, 63.20s/it]                                                                                      Best trial: 0. Best value: 0.089851:   6%|▌         | 3/50 [06:09<49:30, 63.20s/it]Best trial: 0. Best value: 0.089851:   6%|▌         | 3/50 [06:09<49:30, 63.20s/it]Best trial: 0. Best value: 0.089851:   8%|▊         | 4/50 [06:09<1:13:27, 95.82s/it]                                                                                     Best trial: 0. Best value: 0.089851:   8%|▊         | 4/50 [07:28<1:13:27, 95.82s/it]Best trial: 4. Best value: 0.0897348:   8%|▊         | 4/50 [07:28<1:13:27, 95.82s/it]Best trial: 4. Best value: 0.0897348:  10%|█         | 5/50 [07:28<1:07:08, 89.52s/it]                                                                                      Best trial: 4. Best value: 0.0897348:  10%|█         | 5/50 [07:34<1:07:08, 89.52s/it]Best trial: 4. Best value: 0.0897348:  10%|█         | 5/50 [07:34<1:07:08, 89.52s/it]Best trial: 4. Best value: 0.0897348:  12%|█▏        | 6/50 [07:34<44:56, 61.28s/it]                                                                                      Best trial: 4. Best value: 0.0897348:  12%|█▏        | 6/50 [07:42<44:56, 61.28s/it]Best trial: 4. Best value: 0.0897348:  12%|█▏        | 6/50 [07:42<44:56, 61.28s/it]Best trial: 4. Best value: 0.0897348:  14%|█▍        | 7/50 [07:42<31:29, 43.94s/it]                                                                                    Best trial: 4. Best value: 0.0897348:  14%|█▍        | 7/50 [09:05<31:29, 43.94s/it]Best trial: 7. Best value: 0.0895231:  14%|█▍        | 7/50 [09:05<31:29, 43.94s/it]Best trial: 7. Best value: 0.0895231:  16%|█▌        | 8/50 [09:05<39:24, 56.29s/it]                                                                                    Best trial: 7. Best value: 0.0895231:  16%|█▌        | 8/50 [11:26<39:24, 56.29s/it]Best trial: 8. Best value: 0.0878705:  16%|█▌        | 8/50 [11:26<39:24, 56.29s/it]Best trial: 8. Best value: 0.0878705:  18%|█▊        | 9/50 [11:26<56:32, 82.75s/it]                                                                                    Best trial: 8. Best value: 0.0878705:  18%|█▊        | 9/50 [13:08<56:32, 82.75s/it]Best trial: 8. Best value: 0.0878705:  18%|█▊        | 9/50 [13:08<56:32, 82.75s/it]Best trial: 8. Best value: 0.0878705:  20%|██        | 10/50 [13:08<59:12, 88.82s/it]                                                                                     Best trial: 8. Best value: 0.0878705:  20%|██        | 10/50 [14:38<59:12, 88.82s/it]Best trial: 8. Best value: 0.0878705:  20%|██        | 10/50 [14:38<59:12, 88.82s/it]Best trial: 8. Best value: 0.0878705:  22%|██▏       | 11/50 [14:38<57:52, 89.04s/it]                                                                                     Best trial: 8. Best value: 0.0878705:  22%|██▏       | 11/50 [17:05<57:52, 89.04s/it]Best trial: 8. Best value: 0.0878705:  22%|██▏       | 11/50 [17:05<57:52, 89.04s/it]Best trial: 8. Best value: 0.0878705:  24%|██▍       | 12/50 [17:05<1:07:34, 106.70s/it]                                                                                        Best trial: 8. Best value: 0.0878705:  24%|██▍       | 12/50 [19:53<1:07:34, 106.70s/it]Best trial: 8. Best value: 0.0878705:  24%|██▍       | 12/50 [19:53<1:07:34, 106.70s/it]Best trial: 8. Best value: 0.0878705:  26%|██▌       | 13/50 [19:53<1:17:17, 125.32s/it]                                                                                        Best trial: 8. Best value: 0.0878705:  26%|██▌       | 13/50 [22:24<1:17:17, 125.32s/it]Best trial: 8. Best value: 0.0878705:  26%|██▌       | 13/50 [22:24<1:17:17, 125.32s/it]Best trial: 8. Best value: 0.0878705:  28%|██▊       | 14/50 [22:24<1:19:47, 132.98s/it]                                                                                        Best trial: 8. Best value: 0.0878705:  28%|██▊       | 14/50 [24:24<1:19:47, 132.98s/it]Best trial: 8. Best value: 0.0878705:  28%|██▊       | 14/50 [24:24<1:19:47, 132.98s/it]Best trial: 8. Best value: 0.0878705:  30%|███       | 15/50 [24:24<1:15:15, 129.02s/it]                                                                                        Best trial: 8. Best value: 0.0878705:  30%|███       | 15/50 [24:41<1:15:15, 129.02s/it]Best trial: 8. Best value: 0.0878705:  30%|███       | 15/50 [24:41<1:15:15, 129.02s/it]Best trial: 8. Best value: 0.0878705:  32%|███▏      | 16/50 [24:41<54:00, 95.30s/it]                                                                                        Best trial: 8. Best value: 0.0878705:  32%|███▏      | 16/50 [27:26<54:00, 95.30s/it]Best trial: 8. Best value: 0.0878705:  32%|███▏      | 16/50 [27:26<54:00, 95.30s/it]Best trial: 8. Best value: 0.0878705:  34%|███▍      | 17/50 [27:26<1:04:03, 116.46s/it]                                                                                        Best trial: 8. Best value: 0.0878705:  34%|███▍      | 17/50 [28:13<1:04:03, 116.46s/it]Best trial: 8. Best value: 0.0878705:  34%|███▍      | 17/50 [28:13<1:04:03, 116.46s/it]Best trial: 8. Best value: 0.0878705:  36%|███▌      | 18/50 [28:13<50:51, 95.36s/it]                                                                                        Best trial: 8. Best value: 0.0878705:  36%|███▌      | 18/50 [30:04<50:51, 95.36s/it]Best trial: 8. Best value: 0.0878705:  36%|███▌      | 18/50 [30:04<50:51, 95.36s/it]Best trial: 8. Best value: 0.0878705:  38%|███▊      | 19/50 [30:04<51:46, 100.22s/it]                                                                                      Best trial: 8. Best value: 0.0878705:  38%|███▊      | 19/50 [30:40<51:46, 100.22s/it]Best trial: 8. Best value: 0.0878705:  38%|███▊      | 19/50 [30:40<51:46, 100.22s/it]Best trial: 8. Best value: 0.0878705:  40%|████      | 20/50 [30:40<40:27, 80.91s/it]                                                                                      Best trial: 8. Best value: 0.0878705:  40%|████      | 20/50 [30:55<40:27, 80.91s/it]Best trial: 8. Best value: 0.0878705:  40%|████      | 20/50 [30:55<40:27, 80.91s/it]Best trial: 8. Best value: 0.0878705:  42%|████▏     | 21/50 [30:55<29:32, 61.10s/it]                                                                                     Best trial: 8. Best value: 0.0878705:  42%|████▏     | 21/50 [33:07<29:32, 61.10s/it]Best trial: 8. Best value: 0.0878705:  42%|████▏     | 21/50 [33:07<29:32, 61.10s/it]Best trial: 8. Best value: 0.0878705:  44%|████▍     | 22/50 [33:07<38:28, 82.44s/it]                                                                                     Best trial: 8. Best value: 0.0878705:  44%|████▍     | 22/50 [34:48<38:28, 82.44s/it]Best trial: 22. Best value: 0.0876416:  44%|████▍     | 22/50 [34:48<38:28, 82.44s/it]Best trial: 22. Best value: 0.0876416:  46%|████▌     | 23/50 [34:48<39:36, 88.02s/it]                                                                                      Best trial: 22. Best value: 0.0876416:  46%|████▌     | 23/50 [37:55<39:36, 88.02s/it]Best trial: 22. Best value: 0.0876416:  46%|████▌     | 23/50 [37:55<39:36, 88.02s/it]Best trial: 22. Best value: 0.0876416:  48%|████▊     | 24/50 [37:55<50:59, 117.65s/it]                                                                                       Best trial: 22. Best value: 0.0876416:  48%|████▊     | 24/50 [38:02<50:59, 117.65s/it]Best trial: 22. Best value: 0.0876416:  48%|████▊     | 24/50 [38:02<50:59, 117.65s/it]Best trial: 22. Best value: 0.0876416:  50%|█████     | 25/50 [38:02<35:13, 84.52s/it]                                                                                       Best trial: 22. Best value: 0.0876416:  50%|█████     | 25/50 [40:56<35:13, 84.52s/it]Best trial: 22. Best value: 0.0876416:  50%|█████     | 25/50 [40:56<35:13, 84.52s/it]Best trial: 22. Best value: 0.0876416:  52%|█████▏    | 26/50 [40:56<44:30, 111.27s/it]                                                                                       Best trial: 22. Best value: 0.0876416:  52%|█████▏    | 26/50 [43:37<44:30, 111.27s/it]Best trial: 22. Best value: 0.0876416:  52%|█████▏    | 26/50 [43:37<44:30, 111.27s/it]Best trial: 22. Best value: 0.0876416:  54%|█████▍    | 27/50 [43:37<48:26, 126.36s/it]                                                                                       Best trial: 22. Best value: 0.0876416:  54%|█████▍    | 27/50 [45:55<48:26, 126.36s/it]Best trial: 22. Best value: 0.0876416:  54%|█████▍    | 27/50 [45:55<48:26, 126.36s/it]Best trial: 22. Best value: 0.0876416:  56%|█████▌    | 28/50 [45:55<47:31, 129.61s/it]                                                                                       Best trial: 22. Best value: 0.0876416:  56%|█████▌    | 28/50 [46:40<47:31, 129.61s/it]Best trial: 22. Best value: 0.0876416:  56%|█████▌    | 28/50 [46:40<47:31, 129.61s/it]Best trial: 22. Best value: 0.0876416:  58%|█████▊    | 29/50 [46:40<36:33, 104.43s/it]                                                                                       Best trial: 22. Best value: 0.0876416:  58%|█████▊    | 29/50 [46:54<36:33, 104.43s/it]Best trial: 22. Best value: 0.0876416:  58%|█████▊    | 29/50 [46:54<36:33, 104.43s/it]Best trial: 22. Best value: 0.0876416:  60%|██████    | 30/50 [46:54<25:46, 77.31s/it]                                                                                       Best trial: 22. Best value: 0.0876416:  60%|██████    | 30/50 [47:23<25:46, 77.31s/it]Best trial: 22. Best value: 0.0876416:  60%|██████    | 30/50 [47:23<25:46, 77.31s/it]Best trial: 22. Best value: 0.0876416:  62%|██████▏   | 31/50 [47:23<19:50, 62.67s/it]                                                                                      Best trial: 22. Best value: 0.0876416:  62%|██████▏   | 31/50 [50:50<19:50, 62.67s/it]Best trial: 22. Best value: 0.0876416:  62%|██████▏   | 31/50 [50:50<19:50, 62.67s/it]Best trial: 22. Best value: 0.0876416:  64%|██████▍   | 32/50 [50:50<31:48, 106.02s/it]                                                                                       Best trial: 22. Best value: 0.0876416:  64%|██████▍   | 32/50 [52:14<31:48, 106.02s/it]Best trial: 22. Best value: 0.0876416:  64%|██████▍   | 32/50 [52:14<31:48, 106.02s/it]Best trial: 22. Best value: 0.0876416:  66%|██████▌   | 33/50 [52:14<28:10, 99.47s/it]                                                                                       Best trial: 22. Best value: 0.0876416:  66%|██████▌   | 33/50 [53:11<28:10, 99.47s/it]Best trial: 22. Best value: 0.0876416:  66%|██████▌   | 33/50 [53:11<28:10, 99.47s/it]Best trial: 22. Best value: 0.0876416:  68%|██████▊   | 34/50 [53:11<23:05, 86.57s/it]                                                                                      Best trial: 22. Best value: 0.0876416:  68%|██████▊   | 34/50 [55:13<23:05, 86.57s/it]Best trial: 22. Best value: 0.0876416:  68%|██████▊   | 34/50 [55:13<23:05, 86.57s/it]Best trial: 22. Best value: 0.0876416:  70%|███████   | 35/50 [55:13<24:18, 97.26s/it]                                                                                      Best trial: 22. Best value: 0.0876416:  70%|███████   | 35/50 [56:28<24:18, 97.26s/it]Best trial: 22. Best value: 0.0876416:  70%|███████   | 35/50 [56:28<24:18, 97.26s/it]Best trial: 22. Best value: 0.0876416:  72%|███████▏  | 36/50 [56:28<21:09, 90.69s/it]                                                                                      Best trial: 22. Best value: 0.0876416:  72%|███████▏  | 36/50 [56:35<21:09, 90.69s/it]Best trial: 22. Best value: 0.0876416:  72%|███████▏  | 36/50 [56:35<21:09, 90.69s/it]Best trial: 22. Best value: 0.0876416:  74%|███████▍  | 37/50 [56:35<14:10, 65.42s/it]                                                                                      Best trial: 22. Best value: 0.0876416:  74%|███████▍  | 37/50 [57:28<14:10, 65.42s/it]Best trial: 22. Best value: 0.0876416:  74%|███████▍  | 37/50 [57:28<14:10, 65.42s/it]Best trial: 22. Best value: 0.0876416:  76%|███████▌  | 38/50 [57:28<12:22, 61.90s/it]                                                                                      Best trial: 22. Best value: 0.0876416:  76%|███████▌  | 38/50 [58:16<12:22, 61.90s/it]Best trial: 22. Best value: 0.0876416:  76%|███████▌  | 38/50 [58:16<12:22, 61.90s/it]Best trial: 22. Best value: 0.0876416:  78%|███████▊  | 39/50 [58:16<10:32, 57.55s/it]                                                                                      Best trial: 22. Best value: 0.0876416:  78%|███████▊  | 39/50 [58:57<10:32, 57.55s/it]Best trial: 22. Best value: 0.0876416:  78%|███████▊  | 39/50 [58:57<10:32, 57.55s/it]Best trial: 22. Best value: 0.0876416:  80%|████████  | 40/50 [58:57<08:47, 52.73s/it]                                                                                      Best trial: 22. Best value: 0.0876416:  80%|████████  | 40/50 [1:00:00<08:47, 52.73s/it]Best trial: 22. Best value: 0.0876416:  80%|████████  | 40/50 [1:00:00<08:47, 52.73s/it]Best trial: 22. Best value: 0.0876416:  82%|████████▏ | 41/50 [1:00:00<08:22, 55.84s/it]                                                                                        Best trial: 22. Best value: 0.0876416:  82%|████████▏ | 41/50 [1:03:17<08:22, 55.84s/it]Best trial: 22. Best value: 0.0876416:  82%|████████▏ | 41/50 [1:03:17<08:22, 55.84s/it]Best trial: 22. Best value: 0.0876416:  84%|████████▍ | 42/50 [1:03:17<13:05, 98.19s/it]                                                                                        Best trial: 22. Best value: 0.0876416:  84%|████████▍ | 42/50 [1:05:49<13:05, 98.19s/it]Best trial: 22. Best value: 0.0876416:  84%|████████▍ | 42/50 [1:05:49<13:05, 98.19s/it]Best trial: 22. Best value: 0.0876416:  86%|████████▌ | 43/50 [1:05:49<13:18, 114.09s/it]                                                                                         Best trial: 22. Best value: 0.0876416:  86%|████████▌ | 43/50 [1:07:29<13:18, 114.09s/it]Best trial: 22. Best value: 0.0876416:  86%|████████▌ | 43/50 [1:07:29<13:18, 114.09s/it]Best trial: 22. Best value: 0.0876416:  88%|████████▊ | 44/50 [1:07:29<10:59, 109.98s/it]                                                                                         Best trial: 22. Best value: 0.0876416:  88%|████████▊ | 44/50 [1:08:40<10:59, 109.98s/it]Best trial: 22. Best value: 0.0876416:  88%|████████▊ | 44/50 [1:08:40<10:59, 109.98s/it]Best trial: 22. Best value: 0.0876416:  90%|█████████ | 45/50 [1:08:40<08:11, 98.34s/it]                                                                                         Best trial: 22. Best value: 0.0876416:  90%|█████████ | 45/50 [1:08:46<08:11, 98.34s/it]Best trial: 22. Best value: 0.0876416:  90%|█████████ | 45/50 [1:08:46<08:11, 98.34s/it]Best trial: 22. Best value: 0.0876416:  92%|█████████▏| 46/50 [1:08:46<04:42, 70.72s/it]                                                                                        Best trial: 22. Best value: 0.0876416:  92%|█████████▏| 46/50 [1:12:19<04:42, 70.72s/it]Best trial: 22. Best value: 0.0876416:  92%|█████████▏| 46/50 [1:12:19<04:42, 70.72s/it]Best trial: 22. Best value: 0.0876416:  94%|█████████▍| 47/50 [1:12:19<05:39, 113.33s/it]                                                                                         Best trial: 22. Best value: 0.0876416:  94%|█████████▍| 47/50 [1:12:33<05:39, 113.33s/it]Best trial: 22. Best value: 0.0876416:  94%|█████████▍| 47/50 [1:12:33<05:39, 113.33s/it]Best trial: 22. Best value: 0.0876416:  96%|█████████▌| 48/50 [1:12:33<02:46, 83.42s/it]                                                                                         Best trial: 22. Best value: 0.0876416:  96%|█████████▌| 48/50 [1:14:39<02:46, 83.42s/it]Best trial: 22. Best value: 0.0876416:  96%|█████████▌| 48/50 [1:14:39<02:46, 83.42s/it]Best trial: 22. Best value: 0.0876416:  98%|█████████▊| 49/50 [1:14:39<01:36, 96.18s/it]                                                                                        Best trial: 22. Best value: 0.0876416:  98%|█████████▊| 49/50 [1:17:01<01:36, 96.18s/it]Best trial: 22. Best value: 0.0876416:  98%|█████████▊| 49/50 [1:17:01<01:36, 96.18s/it]Best trial: 22. Best value: 0.0876416: 100%|██████████| 50/50 [1:17:01<00:00, 109.98s/it]Best trial: 22. Best value: 0.0876416: 100%|██████████| 50/50 [1:17:01<00:00, 92.43s/it] 
[I 2026-04-28 00:29:21,010] A new study created in memory with name: DCMFNet_Neg
Train: 2407 rows (1613 IDs),Test: 598 rows (404 IDs) 

n_features_x : 6, n_features_per_modality: [16, 23, 19, 17, 7, 4, 4, 4, 1, 4]

--- ImbalancedRegressionLoss initialized ---
  Bins: 14, Focal gamma: 2.5466641293736214, Base loss: mse
  Bin [0.00, 0.07): count=  828, weight=0.003
  Bin [0.07, 0.14): count=  542, weight=0.005
  Bin [0.14, 0.21): count=  506, weight=0.005
  Bin [0.21, 0.29): count=  386, weight=0.007
  Bin [0.29, 0.36): count=   91, weight=0.029
  Bin [0.36, 0.43): count=   29, weight=0.090
  Bin [0.43, 0.50): count=   12, weight=0.207
  Bin [0.50, 0.57): count=   11, weight=0.224
  Bin [0.57, 0.64): count=    1, weight=1.343
  Bin [0.64, 0.71): count=    1, weight=1.343
  Bin [0.71, 0.79): count=    0, weight=2.686
  Bin [0.79, 0.86): count=    0, weight=2.686
  Bin [0.86, 0.93): count=    0, weight=2.686
  Bin [0.93, 1.00): count=    0, weight=2.686
-------------------------------------------

  Pred range: [0.0613, 0.3802], std: 0.0433
  RMSE : 0.0985, R2: 0.0407, MAE: 0.0797, Spearman rho: 0.3025, Spearman p: 4.0260e-14, Pearson r: 0.3114, Pearson p: 6.5273e-15
  Pred range: [0.0596, 0.4010], std: 0.0483
  RMSE : 0.0953, R2: 0.1017, MAE: 0.0767, Spearman rho: 0.3777, Spearman p: 1.0317e-21, Pearson r: 0.3833, Pearson p: 2.2817e-22
  Pred range: [0.0642, 0.4054], std: 0.0500
  RMSE : 0.0957, R2: 0.0953, MAE: 0.0772, Spearman rho: 0.4037, Spearman p: 7.4889e-25, Pearson r: 0.4109, Pearson p: 9.1080e-26
  Pred range: [0.0585, 0.3926], std: 0.0497
  RMSE : 0.0924, R2: 0.1567, MAE: 0.0740, Spearman rho: 0.4234, Spearman p: 2.0627e-27, Pearson r: 0.4278, Pearson p: 5.2876e-28
  Pred range: [0.0897, 0.4433], std: 0.0521
  RMSE : 0.1039, R2: -0.0671, MAE: 0.0851, Spearman rho: 0.4276, Spearman p: 5.5245e-28, Pearson r: 0.4326, Pearson p: 1.1445e-28
  Pred range: [0.0724, 0.3985], std: 0.0500
  RMSE : 0.0991, R2: 0.0290, MAE: 0.0809, Spearman rho: 0.4303, Spearman p: 2.4145e-28, Pearson r: 0.4361, Pearson p: 3.7136e-29
  Pred range: [0.0801, 0.4141], std: 0.0510
  RMSE : 0.1021, R2: -0.0310, MAE: 0.0837, Spearman rho: 0.4360, Spearman p: 3.8057e-29, Pearson r: 0.4428, Pearson p: 4.2353e-30
  Pred range: [0.0544, 0.3814], std: 0.0498
  RMSE : 0.0930, R2: 0.1457, MAE: 0.0751, Spearman rho: 0.4454, Spearman p: 1.7309e-30, Pearson r: 0.4498, Pearson p: 3.9659e-31
  Pred range: [0.0218, 0.3433], std: 0.0460
  RMSE : 0.0899, R2: 0.2022, MAE: 0.0714, Spearman rho: 0.4471, Spearman p: 1.0113e-30, Pearson r: 0.4500, Pearson p: 3.7268e-31
  Pred range: [0.0530, 0.3922], std: 0.0482
  RMSE : 0.0970, R2: 0.0710, MAE: 0.0792, Spearman rho: 0.4392, Spearman p: 1.3816e-29, Pearson r: 0.4457, Pearson p: 1.5798e-30
  Pred range: [0.0526, 0.3913], std: 0.0497
  RMSE : 0.0951, R2: 0.1070, MAE: 0.0773, Spearman rho: 0.4451, Spearman p: 1.9275e-30, Pearson r: 0.4507, Pearson p: 2.9287e-31
  Pred range: [0.0556, 0.3961], std: 0.0495
  RMSE : 0.0946, R2: 0.1165, MAE: 0.0768, Spearman rho: 0.4507, Spearman p: 3.0058e-31, Pearson r: 0.4540, Pearson p: 9.6104e-32
  Pred range: [0.0577, 0.3936], std: 0.0514
  RMSE : 0.0951, R2: 0.1072, MAE: 0.0773, Spearman rho: 0.4474, Spearman p: 8.9525e-31, Pearson r: 0.4503, Pearson p: 3.4138e-31
  Pred range: [0.0516, 0.3910], std: 0.0489
  RMSE : 0.0933, R2: 0.1407, MAE: 0.0756, Spearman rho: 0.4423, Spearman p: 4.9521e-30, Pearson r: 0.4476, Pearson p: 8.5497e-31
  Pred range: [0.0558, 0.3926], std: 0.0498
  RMSE : 0.0935, R2: 0.1355, MAE: 0.0758, Spearman rho: 0.4428, Spearman p: 4.1509e-30, Pearson r: 0.4485, Pearson p: 6.2503e-31
  Pred range: [0.0657, 0.3988], std: 0.0506
  RMSE : 0.0953, R2: 0.1021, MAE: 0.0775, Spearman rho: 0.4469, Spearman p: 1.0488e-30, Pearson r: 0.4521, Pearson p: 1.8553e-31
