[I 2026-04-27 20:41:44,682] Trial 96 finished with value: 0.16174759192973648 and parameters: {'learning_rate': 0.0014438598287127775, 'batch_size': 32, 'num_epochs': 21, 'weight_decay': 5.621754115099269e-05, 'layers_PRS': 4, 'layers_SCZ15': 7, 'layers_ADHD9': 2, 'layers_ASD9': 7, 'layers_ACE15': 4, 'layers_ACE18': 5, 'layers_SUD18': 5, 'layers_SES': 2, 'layers_SEX': 5, 'dropout': 0.3306286383388887, 'se_reduction': 2, 'hidden_dim_min': 11, 'base_loss': 'huber', 'huber_delta': 0.14679746917665165, 'focal_gamma': 1.6440360646617516, 'n_bins': 19, 'scheduler_patience': 5, 'scheduler_factor': 0.3152871570895518, 'early_stopping_patience': 3}. Best is trial 81 with value: 0.14825416838187774.
Train: 2407 rows (1613 IDs),Test: 598 rows (404 IDs) 

n_features_x : 6, n_features_per_modality: [16, 23, 19, 17, 7, 4, 4, 4, 1, 4]

--- ImbalancedRegressionLoss initialized ---
  Bins: 17, Focal gamma: 1.4842257935893959, Base loss: huber
  Bin [0.00, 0.06): count=  172, weight=0.058
  Bin [0.06, 0.12): count=  413, weight=0.024
  Bin [0.12, 0.18): count=  376, weight=0.027
  Bin [0.18, 0.24): count=  370, weight=0.027
  Bin [0.24, 0.29): count=  255, weight=0.039
  Bin [0.29, 0.35): count=  223, weight=0.045
  Bin [0.35, 0.41): count=  162, weight=0.061
  Bin [0.41, 0.47): count=  134, weight=0.074
  Bin [0.47, 0.53): count=  108, weight=0.092
  Bin [0.53, 0.59): count=   78, weight=0.127
  Bin [0.59, 0.65): count=   47, weight=0.208
  Bin [0.65, 0.71): count=   27, weight=0.357
  Bin [0.71, 0.76): count=   26, weight=0.370
  Bin [0.76, 0.82): count=    9, weight=0.999
  Bin [0.82, 0.88): count=    4, weight=1.999
  Bin [0.88, 0.94): count=    3, weight=2.499
  Bin [0.94, 1.00): count=    0, weight=9.995
-------------------------------------------

  Pred range: [0.0658, 0.6640], std: 0.1042
  RMSE : 0.1544, R2: 0.2042, MAE: 0.1229, Spearman rho: 0.4825, Spearman p: 3.3293e-36, Pearson r: 0.4935, Pearson p: 4.9950e-38
  Pred range: [0.0474, 0.6234], std: 0.0993
  RMSE : 0.1551, R2: 0.1966, MAE: 0.1260, Spearman rho: 0.4952, Spearman p: 2.5078e-38, Pearson r: 0.5088, Pearson p: 1.0886e-40
  Pred range: [0.0998, 0.6467], std: 0.1006
  RMSE : 0.1642, R2: 0.0997, MAE: 0.1362, Spearman rho: 0.4765, Spearman p: 3.1299e-35, Pearson r: 0.4955, Pearson p: 2.2559e-38
  Pred range: [-0.0089, 0.5721], std: 0.1019
  RMSE : 0.1524, R2: 0.2245, MAE: 0.1212, Spearman rho: 0.4925, Spearman p: 7.4743e-38, Pearson r: 0.5030, Pearson p: 1.1476e-39
  Pred range: [0.0539, 0.6858], std: 0.1053
  RMSE : 0.1580, R2: 0.1669, MAE: 0.1269, Spearman rho: 0.4688, Spearman p: 5.3091e-34, Pearson r: 0.4836, Pearson p: 2.1976e-36
  Pred range: [0.0710, 0.7074], std: 0.1125
  RMSE : 0.1805, R2: -0.0869, MAE: 0.1510, Spearman rho: 0.4699, Spearman p: 3.4858e-34, Pearson r: 0.4941, Pearson p: 3.8709e-38
  Pred range: [-0.0327, 0.5785], std: 0.1067
  RMSE : 0.1511, R2: 0.2383, MAE: 0.1172, Spearman rho: 0.4853, Spearman p: 1.1762e-36, Pearson r: 0.5015, Pearson p: 2.1219e-39
  Pred range: [0.0689, 0.7304], std: 0.1156
  RMSE : 0.1720, R2: 0.0124, MAE: 0.1420, Spearman rho: 0.4815, Spearman p: 4.8725e-36, Pearson r: 0.4957, Pearson p: 2.1377e-38
  Pred range: [0.0085, 0.6019], std: 0.0990
  RMSE : 0.1598, R2: 0.1481, MAE: 0.1304, Spearman rho: 0.4650, Spearman p: 2.0797e-33, Pearson r: 0.4799, Pearson p: 9.1308e-36
  Pred range: [-0.0963, 0.5930], std: 0.1087
  RMSE : 0.1555, R2: 0.1931, MAE: 0.1162, Spearman rho: 0.4743, Spearman p: 7.1800e-35, Pearson r: 0.4965, Pearson p: 1.5169e-38
[I 2026-04-27 20:43:58,776] Trial 97 finished with value: 0.15106241861924366 and parameters: {'learning_rate': 0.0019406982977724732, 'batch_size': 4, 'num_epochs': 22, 'weight_decay': 0.0002017394631751699, 'layers_PRS': 4, 'layers_SCZ15': 7, 'layers_ADHD9': 1, 'layers_ASD9': 7, 'layers_ACE15': 4, 'layers_ACE18': 6, 'layers_SUD18': 4, 'layers_SES': 2, 'layers_SEX': 7, 'dropout': 0.3535035056190546, 'se_reduction': 4, 'hidden_dim_min': 13, 'base_loss': 'huber', 'huber_delta': 0.1600837955731437, 'focal_gamma': 1.4842257935893959, 'n_bins': 17, 'scheduler_patience': 5, 'scheduler_factor': 0.504145209010457, 'early_stopping_patience': 3}. Best is trial 81 with value: 0.14825416838187774.
Train: 2407 rows (1613 IDs),Test: 598 rows (404 IDs) 

n_features_x : 6, n_features_per_modality: [16, 23, 19, 17, 7, 4, 4, 4, 1, 4]

--- ImbalancedRegressionLoss initialized ---
  Bins: 18, Focal gamma: 1.3489260646721872, Base loss: huber
  Bin [0.00, 0.06): count=  172, weight=0.058
  Bin [0.06, 0.11): count=  413, weight=0.024
  Bin [0.11, 0.17): count=  376, weight=0.027
  Bin [0.17, 0.22): count=  370, weight=0.027
  Bin [0.22, 0.28): count=  255, weight=0.040
  Bin [0.28, 0.33): count=  223, weight=0.045
  Bin [0.33, 0.39): count=   89, weight=0.112
  Bin [0.39, 0.44): count=  142, weight=0.071
  Bin [0.44, 0.50): count=  122, weight=0.082
  Bin [0.50, 0.56): count=   93, weight=0.108
  Bin [0.56, 0.61): count=   64, weight=0.156
  Bin [0.61, 0.67): count=   36, weight=0.273
  Bin [0.67, 0.72): count=   10, weight=0.920
  Bin [0.72, 0.78): count=   26, weight=0.375
  Bin [0.78, 0.83): count=    9, weight=1.012
  Bin [0.83, 0.89): count=    4, weight=2.023
  Bin [0.89, 0.94): count=    3, weight=2.529
  Bin [0.94, 1.00): count=    0, weight=10.117
-------------------------------------------

  Pred range: [0.1246, 0.7268], std: 0.1011
  RMSE : 0.1673, R2: 0.0656, MAE: 0.1398, Spearman rho: 0.4838, Spearman p: 2.0503e-36, Pearson r: 0.5049, Pearson p: 5.2685e-40
  Pred range: [0.0978, 0.5611], std: 0.0848
  RMSE : 0.1489, R2: 0.2602, MAE: 0.1188, Spearman rho: 0.4997, Spearman p: 4.3053e-39, Pearson r: 0.5227, Pearson p: 3.0548e-43
  Pred range: [0.1607, 0.6943], std: 0.0966
  RMSE : 0.1904, R2: -0.2100, MAE: 0.1632, Spearman rho: 0.4950, Spearman p: 2.7572e-38, Pearson r: 0.5155, Pearson p: 6.5749e-42
  Pred range: [0.0967, 0.6507], std: 0.0974
  RMSE : 0.1549, R2: 0.1990, MAE: 0.1268, Spearman rho: 0.4956, Spearman p: 2.1404e-38, Pearson r: 0.5143, Pearson p: 1.1174e-41
  Pred range: [0.0610, 0.6351], std: 0.1036
  RMSE : 0.1502, R2: 0.2472, MAE: 0.1185, Spearman rho: 0.4890, Spearman p: 2.8580e-37, Pearson r: 0.5087, Pearson p: 1.1137e-40
  Pred range: [0.0421, 0.6152], std: 0.0978
  RMSE : 0.1505, R2: 0.2436, MAE: 0.1184, Spearman rho: 0.4781, Spearman p: 1.7674e-35, Pearson r: 0.5003, Pearson p: 3.4113e-39
[I 2026-04-27 20:44:49,919] Trial 98 finished with value: 0.1488755438447975 and parameters: {'learning_rate': 0.0010849228515486988, 'batch_size': 6, 'num_epochs': 23, 'weight_decay': 4.594453739845329e-05, 'layers_PRS': 3, 'layers_SCZ15': 7, 'layers_ADHD9': 2, 'layers_ASD9': 6, 'layers_ACE15': 4, 'layers_ACE18': 5, 'layers_SUD18': 2, 'layers_SES': 2, 'layers_SEX': 5, 'dropout': 0.3191533916872466, 'se_reduction': 3, 'hidden_dim_min': 15, 'base_loss': 'huber', 'huber_delta': 0.18117651505494553, 'focal_gamma': 1.3489260646721872, 'n_bins': 18, 'scheduler_patience': 5, 'scheduler_factor': 0.5331445823581011, 'early_stopping_patience': 4}. Best is trial 81 with value: 0.14825416838187774.
Train: 2407 rows (1613 IDs),Test: 598 rows (404 IDs) 

n_features_x : 6, n_features_per_modality: [16, 23, 19, 17, 7, 4, 4, 4, 1, 4]

--- ImbalancedRegressionLoss initialized ---
  Bins: 18, Focal gamma: 2.7470057371266385, Base loss: huber
  Bin [0.00, 0.06): count=  172, weight=0.058
  Bin [0.06, 0.11): count=  413, weight=0.024
  Bin [0.11, 0.17): count=  376, weight=0.027
  Bin [0.17, 0.22): count=  370, weight=0.027
  Bin [0.22, 0.28): count=  255, weight=0.040
  Bin [0.28, 0.33): count=  223, weight=0.045
  Bin [0.33, 0.39): count=   89, weight=0.112
  Bin [0.39, 0.44): count=  142, weight=0.071
  Bin [0.44, 0.50): count=  122, weight=0.082
  Bin [0.50, 0.56): count=   93, weight=0.108
  Bin [0.56, 0.61): count=   64, weight=0.156
  Bin [0.61, 0.67): count=   36, weight=0.273
  Bin [0.67, 0.72): count=   10, weight=0.920
  Bin [0.72, 0.78): count=   26, weight=0.375
  Bin [0.78, 0.83): count=    9, weight=1.012
  Bin [0.83, 0.89): count=    4, weight=2.023
  Bin [0.89, 0.94): count=    3, weight=2.529
  Bin [0.94, 1.00): count=    0, weight=10.117
-------------------------------------------

  Pred range: [0.1261, 0.6155], std: 0.0810
  RMSE : 0.1570, R2: 0.1777, MAE: 0.1301, Spearman rho: 0.4896, Spearman p: 2.2890e-37, Pearson r: 0.5049, Pearson p: 5.2137e-40
  Pred range: [0.0886, 0.6621], std: 0.0944
  RMSE : 0.1578, R2: 0.1687, MAE: 0.1305, Spearman rho: 0.4952, Spearman p: 2.5907e-38, Pearson r: 0.5128, Pearson p: 2.0949e-41
  Pred range: [0.0726, 0.6382], std: 0.0868
  RMSE : 0.1534, R2: 0.2148, MAE: 0.1257, Spearman rho: 0.4917, Spearman p: 1.0142e-37, Pearson r: 0.5129, Pearson p: 1.9834e-41
  Pred range: [0.1059, 0.6444], std: 0.0862
  RMSE : 0.1673, R2: 0.0662, MAE: 0.1415, Spearman rho: 0.4833, Spearman p: 2.5129e-36, Pearson r: 0.5062, Pearson p: 3.0848e-40
  Pred range: [0.1353, 0.6059], std: 0.0895
  RMSE : 0.1607, R2: 0.1382, MAE: 0.1343, Spearman rho: 0.4926, Spearman p: 7.1752e-38, Pearson r: 0.5179, Pearson p: 2.4439e-42
  Pred range: [0.0906, 0.6824], std: 0.0975
  RMSE : 0.1564, R2: 0.1838, MAE: 0.1287, Spearman rho: 0.4956, Spearman p: 2.1936e-38, Pearson r: 0.5212, Pearson p: 5.9976e-43
[I 2026-04-27 20:45:45,815] Trial 99 finished with value: 0.1533734114233539 and parameters: {'learning_rate': 0.00117996517124966, 'batch_size': 6, 'num_epochs': 21, 'weight_decay': 4.8129793974872156e-05, 'layers_PRS': 4, 'layers_SCZ15': 7, 'layers_ADHD9': 2, 'layers_ASD9': 7, 'layers_ACE15': 5, 'layers_ACE18': 6, 'layers_SUD18': 2, 'layers_SES': 2, 'layers_SEX': 6, 'dropout': 0.31245516007911833, 'se_reduction': 4, 'hidden_dim_min': 15, 'base_loss': 'huber', 'huber_delta': 0.1836436627919617, 'focal_gamma': 2.7470057371266385, 'n_bins': 18, 'scheduler_patience': 5, 'scheduler_factor': 0.5602417361478913, 'early_stopping_patience': 3}. Best is trial 81 with value: 0.14825416838187774.

Completed in 140.1 minutes
Trials: 84 complete, 16 pruned

============================================================
  Best Neg trial
============================================================
  RMSE: 0.1483

  Copy these into hyperparameters.json:
  ----------------------------------------
  learning_rate = 0.0007723851956271341
  batch_size = 4
  num_epochs = 18
  weight_decay = 4.029949877032903e-05
  layers_PRS = 4
  layers_SCZ15 = 7
  layers_ADHD9 = 1
  layers_ASD9 = 7
  layers_ACE15 = 4
  layers_ACE18 = 5
  layers_SUD18 = 3
  layers_SES = 3
  layers_SEX = 5
  dropout = 0.24233091212431557
  se_reduction = 3
  hidden_dim_min = 4
  base_loss = 'huber'
  huber_delta = 0.17438262633923302
  focal_gamma = 1.3043544590836897
  n_bins = 18
  scheduler_patience = 5
  scheduler_factor = 0.48602426412499666
  early_stopping_patience = 4
  ----------------------------------------

Best hyperparameters saved to 'Neg_best_params.txt'
All trial results saved to 'Neg_optuna_results.csv'
Visualizations saved as Neg_*.html
