[I 2026-04-27 16:18:46,854] Trial 0 finished with value: 0.08964510394112955 and parameters: {'learning_rate': 0.00023270316961752593, 'batch_size': 4, 'num_epochs': 14, 'weight_decay': 1.1264707265604194e-05, 'layers_PRS': 3, 'layers_SCZ15': 2, 'layers_ADHD9': 6, 'layers_ASD9': 1, 'layers_ACE15': 6, 'layers_ACE18': 2, 'layers_SUD18': 4, 'layers_SES': 3, 'layers_SEX': 7, 'dropout': 0.26718730486307873, 'se_reduction': 5, 'hidden_dim_min': 13, 'base_loss': 'mse', 'huber_delta': 0.11134089257369496, 'focal_gamma': 2.4081348884971203, 'n_bins': 6, 'scheduler_patience': 5, 'scheduler_factor': 0.45118737891532473, 'early_stopping_patience': 8}. Best is trial 0 with value: 0.08964510394112955.
Train: 2407 rows (1613 IDs),Test: 598 rows (404 IDs) 

n_features_x : 6, n_features_per_modality: [16, 23, 19, 17, 7, 4, 4, 4, 1, 4]

--- ImbalancedRegressionLoss initialized ---
  Bins: 18, Focal gamma: 0.6927574055587746, Base loss: huber
  Bin [0.00, 0.06): count=  650, weight=0.004
  Bin [0.06, 0.11): count=  530, weight=0.005
  Bin [0.11, 0.17): count=  358, weight=0.007
  Bin [0.17, 0.22): count=  477, weight=0.005
  Bin [0.22, 0.28): count=  179, weight=0.014
  Bin [0.28, 0.33): count=  133, weight=0.019
  Bin [0.33, 0.39): count=   39, weight=0.064
  Bin [0.39, 0.44): count=   20, weight=0.122
  Bin [0.44, 0.50): count=   10, weight=0.233
  Bin [0.50, 0.56): count=    6, weight=0.366
  Bin [0.56, 0.61): count=    4, weight=0.512
  Bin [0.61, 0.67): count=    0, weight=2.561
  Bin [0.67, 0.72): count=    1, weight=1.281
  Bin [0.72, 0.78): count=    0, weight=2.561
  Bin [0.78, 0.83): count=    0, weight=2.561
  Bin [0.83, 0.89): count=    0, weight=2.561
  Bin [0.89, 0.94): count=    0, weight=2.561
  Bin [0.94, 1.00): count=    0, weight=2.561
-------------------------------------------

  Pred range: [-0.0086, 0.2270], std: 0.0348
  RMSE : 0.1071, R2: -0.1338, MAE: 0.0855, Spearman rho: 0.0084, Spearman p: 8.3765e-01, Pearson r: -0.0135, Pearson p: 7.4091e-01
  Pred range: [0.0748, 0.2825], std: 0.0374
  RMSE : 0.1075, R2: -0.1409, MAE: 0.0884, Spearman rho: 0.1582, Spearman p: 1.0244e-04, Pearson r: 0.1498, Pearson p: 2.3716e-04
  Pred range: [0.0731, 0.3101], std: 0.0399
  RMSE : 0.1060, R2: -0.1112, MAE: 0.0870, Spearman rho: 0.2315, Spearman p: 1.0188e-08, Pearson r: 0.2268, Pearson p: 2.0443e-08
  Pred range: [0.0676, 0.3357], std: 0.0428
  RMSE : 0.1042, R2: -0.0732, MAE: 0.0853, Spearman rho: 0.2829, Spearman p: 1.8061e-12, Pearson r: 0.2785, Pearson p: 4.0626e-12
  Pred range: [0.0612, 0.3548], std: 0.0457
  RMSE : 0.1030, R2: -0.0491, MAE: 0.0841, Spearman rho: 0.3153, Spearman p: 2.8908e-15, Pearson r: 0.3121, Pearson p: 5.6460e-15
  Pred range: [0.0606, 0.3753], std: 0.0487
  RMSE : 0.1040, R2: -0.0690, MAE: 0.0850, Spearman rho: 0.3388, Spearman p: 1.5930e-17, Pearson r: 0.3365, Pearson p: 2.6765e-17
  Pred range: [0.0507, 0.3748], std: 0.0499
  RMSE : 0.1005, R2: 0.0024, MAE: 0.0815, Spearman rho: 0.3559, Spearman p: 2.6933e-19, Pearson r: 0.3544, Pearson p: 3.8562e-19
  Pred range: [0.0514, 0.3869], std: 0.0518
  RMSE : 0.1012, R2: -0.0123, MAE: 0.0822, Spearman rho: 0.3673, Spearman p: 1.5592e-20, Pearson r: 0.3670, Pearson p: 1.6489e-20
  Pred range: [0.0500, 0.3953], std: 0.0537
  RMSE : 0.1012, R2: -0.0126, MAE: 0.0822, Spearman rho: 0.3794, Spearman p: 6.5972e-22, Pearson r: 0.3791, Pearson p: 7.0472e-22
  Pred range: [0.0477, 0.3977], std: 0.0549
  RMSE : 0.1006, R2: 0.0006, MAE: 0.0816, Spearman rho: 0.3887, Spearman p: 5.2669e-23, Pearson r: 0.3885, Pearson p: 5.5300e-23
  Pred range: [0.0474, 0.4026], std: 0.0560
  RMSE : 0.1006, R2: -0.0008, MAE: 0.0816, Spearman rho: 0.3947, Spearman p: 9.8417e-24, Pearson r: 0.3957, Pearson p: 7.3905e-24
  Pred range: [0.0442, 0.3987], std: 0.0564
  RMSE : 0.0991, R2: 0.0287, MAE: 0.0802, Spearman rho: 0.4023, Spearman p: 1.1364e-24, Pearson r: 0.4037, Pearson p: 7.6893e-25
  Pred range: [0.0476, 0.4053], std: 0.0576
  RMSE : 0.1007, R2: -0.0013, MAE: 0.0816, Spearman rho: 0.4072, Spearman p: 2.7265e-25, Pearson r: 0.4088, Pearson p: 1.6941e-25
[I 2026-04-27 16:20:02,644] Trial 1 finished with value: 0.09913950312244967 and parameters: {'learning_rate': 4.705627912870611e-05, 'batch_size': 6, 'num_epochs': 13, 'weight_decay': 0.008843816306363769, 'layers_PRS': 2, 'layers_SCZ15': 4, 'layers_ADHD9': 3, 'layers_ASD9': 1, 'layers_ACE15': 1, 'layers_ACE18': 6, 'layers_SUD18': 2, 'layers_SES': 2, 'layers_SEX': 6, 'dropout': 0.30643637356820874, 'se_reduction': 3, 'hidden_dim_min': 3, 'base_loss': 'huber', 'huber_delta': 0.0817026368121888, 'focal_gamma': 0.6927574055587746, 'n_bins': 18, 'scheduler_patience': 4, 'scheduler_factor': 0.453661301609274, 'early_stopping_patience': 8}. Best is trial 0 with value: 0.08964510394112955.
Train: 2407 rows (1613 IDs),Test: 598 rows (404 IDs) 

n_features_x : 6, n_features_per_modality: [16, 23, 19, 17, 7, 4, 4, 4, 1, 4]

--- ImbalancedRegressionLoss initialized ---
  Bins: 19, Focal gamma: 1.3907600344353053, Base loss: mse
  Bin [0.00, 0.05): count=  650, weight=0.004
  Bin [0.05, 0.11): count=  360, weight=0.007
  Bin [0.11, 0.16): count=  528, weight=0.005
  Bin [0.16, 0.21): count=  338, weight=0.008
  Bin [0.21, 0.26): count=  318, weight=0.008
  Bin [0.26, 0.32): count=  109, weight=0.023
  Bin [0.32, 0.37): count=   50, weight=0.050
  Bin [0.37, 0.42): count=   29, weight=0.085
  Bin [0.42, 0.47): count=    7, weight=0.320
  Bin [0.47, 0.53): count=   10, weight=0.232
  Bin [0.53, 0.58): count=    6, weight=0.365
  Bin [0.58, 0.63): count=    1, weight=1.278
  Bin [0.63, 0.68): count=    0, weight=2.556
  Bin [0.68, 0.74): count=    1, weight=1.278
  Bin [0.74, 0.79): count=    0, weight=2.556
  Bin [0.79, 0.84): count=    0, weight=2.556
  Bin [0.84, 0.89): count=    0, weight=2.556
  Bin [0.89, 0.95): count=    0, weight=2.556
  Bin [0.95, 1.00): count=    0, weight=2.556
-------------------------------------------

  Pred range: [-0.0226, 0.2264], std: 0.0384
  RMSE : 0.1117, R2: -0.2324, MAE: 0.0869, Spearman rho: 0.0574, Spearman p: 1.6083e-01, Pearson r: 0.0541, Pearson p: 1.8634e-01
  Pred range: [0.0215, 0.2754], std: 0.0396
  RMSE : 0.1047, R2: -0.0828, MAE: 0.0841, Spearman rho: 0.0951, Spearman p: 2.0069e-02, Pearson r: 0.0923, Pearson p: 2.3934e-02
  Pred range: [0.0451, 0.3050], std: 0.0408
  RMSE : 0.1071, R2: -0.1330, MAE: 0.0874, Spearman rho: 0.1243, Spearman p: 2.3267e-03, Pearson r: 0.1227, Pearson p: 2.6590e-03
  Pred range: [0.0515, 0.3160], std: 0.0414
  RMSE : 0.1094, R2: -0.1821, MAE: 0.0897, Spearman rho: 0.1457, Spearman p: 3.4933e-04, Pearson r: 0.1461, Pearson p: 3.3645e-04
  Pred range: [0.0556, 0.3232], std: 0.0421
  RMSE : 0.1114, R2: -0.2273, MAE: 0.0917, Spearman rho: 0.1652, Spearman p: 4.9070e-05, Pearson r: 0.1673, Pearson p: 3.9238e-05
  Pred range: [0.0559, 0.3236], std: 0.0422
  RMSE : 0.1116, R2: -0.2312, MAE: 0.0919, Spearman rho: 0.1714, Spearman p: 2.4980e-05, Pearson r: 0.1736, Pearson p: 1.9552e-05
  Pred range: [0.0562, 0.3242], std: 0.0424
  RMSE : 0.1118, R2: -0.2353, MAE: 0.0920, Spearman rho: 0.1783, Spearman p: 1.1575e-05, Pearson r: 0.1800, Pearson p: 9.5261e-06
  Pred range: [0.0560, 0.3235], std: 0.0424
  RMSE : 0.1117, R2: -0.2324, MAE: 0.0919, Spearman rho: 0.1837, Spearman p: 6.1418e-06, Pearson r: 0.1857, Pearson p: 4.8317e-06
[I 2026-04-27 16:20:53,617] Trial 2 finished with value: 0.1046778375522074 and parameters: {'learning_rate': 1.1608224471991907e-05, 'batch_size': 8, 'num_epochs': 11, 'weight_decay': 0.0002752484473218512, 'layers_PRS': 1, 'layers_SCZ15': 5, 'layers_ADHD9': 7, 'layers_ASD9': 6, 'layers_ACE15': 4, 'layers_ACE18': 1, 'layers_SUD18': 7, 'layers_SES': 5, 'layers_SEX': 5, 'dropout': 0.45197608285480884, 'se_reduction': 8, 'hidden_dim_min': 13, 'base_loss': 'mse', 'huber_delta': 0.1712195581492856, 'focal_gamma': 1.3907600344353053, 'n_bins': 19, 'scheduler_patience': 2, 'scheduler_factor': 0.33527313083287946, 'early_stopping_patience': 6}. Best is trial 0 with value: 0.08964510394112955.
Train: 2407 rows (1613 IDs),Test: 598 rows (404 IDs) 

n_features_x : 6, n_features_per_modality: [16, 23, 19, 17, 7, 4, 4, 4, 1, 4]

--- ImbalancedRegressionLoss initialized ---
  Bins: 18, Focal gamma: 1.263256673254006, Base loss: huber
  Bin [0.00, 0.06): count=  650, weight=0.004
  Bin [0.06, 0.11): count=  530, weight=0.005
  Bin [0.11, 0.17): count=  358, weight=0.007
  Bin [0.17, 0.22): count=  477, weight=0.005
  Bin [0.22, 0.28): count=  179, weight=0.014
  Bin [0.28, 0.33): count=  133, weight=0.019
  Bin [0.33, 0.39): count=   39, weight=0.064
  Bin [0.39, 0.44): count=   20, weight=0.122
  Bin [0.44, 0.50): count=   10, weight=0.233
  Bin [0.50, 0.56): count=    6, weight=0.366
  Bin [0.56, 0.61): count=    4, weight=0.512
  Bin [0.61, 0.67): count=    0, weight=2.561
  Bin [0.67, 0.72): count=    1, weight=1.281
  Bin [0.72, 0.78): count=    0, weight=2.561
  Bin [0.78, 0.83): count=    0, weight=2.561
  Bin [0.83, 0.89): count=    0, weight=2.561
  Bin [0.89, 0.94): count=    0, weight=2.561
  Bin [0.94, 1.00): count=    0, weight=2.561
-------------------------------------------

  Pred range: [0.0602, 0.3373], std: 0.0522
  RMSE : 0.0986, R2: 0.0393, MAE: 0.0795, Spearman rho: 0.3995, Spearman p: 2.5335e-24, Pearson r: 0.4019, Pearson p: 1.2766e-24
  Pred range: [0.0478, 0.3447], std: 0.0525
  RMSE : 0.0921, R2: 0.1625, MAE: 0.0733, Spearman rho: 0.4256, Spearman p: 1.0309e-27, Pearson r: 0.4336, Pearson p: 8.2327e-29
  Pred range: [0.0641, 0.3572], std: 0.0497
  RMSE : 0.0934, R2: 0.1383, MAE: 0.0751, Spearman rho: 0.4295, Spearman p: 3.0749e-28, Pearson r: 0.4376, Pearson p: 2.3259e-29
  Pred range: [0.0762, 0.4045], std: 0.0521
  RMSE : 0.1020, R2: -0.0283, MAE: 0.0836, Spearman rho: 0.4313, Spearman p: 1.7432e-28, Pearson r: 0.4406, Pearson p: 8.5525e-30
  Pred range: [0.0668, 0.4059], std: 0.0562
  RMSE : 0.0966, R2: 0.0782, MAE: 0.0780, Spearman rho: 0.4433, Spearman p: 3.5733e-30, Pearson r: 0.4493, Pearson p: 4.8120e-31
  Pred range: [0.0775, 0.4057], std: 0.0535
  RMSE : 0.1031, R2: -0.0509, MAE: 0.0848, Spearman rho: 0.4429, Spearman p: 4.0049e-30, Pearson r: 0.4522, Pearson p: 1.7912e-31
  Pred range: [0.0553, 0.3935], std: 0.0550
  RMSE : 0.0931, R2: 0.1436, MAE: 0.0746, Spearman rho: 0.4468, Spearman p: 1.1131e-30, Pearson r: 0.4522, Pearson p: 1.7723e-31
  Pred range: [0.0706, 0.4167], std: 0.0562
  RMSE : 0.1000, R2: 0.0113, MAE: 0.0816, Spearman rho: 0.4440, Spearman p: 2.8072e-30, Pearson r: 0.4509, Pearson p: 2.7729e-31
[I 2026-04-27 16:21:35,478] Trial 3 finished with value: 0.09206263139104175 and parameters: {'learning_rate': 0.000693566228996864, 'batch_size': 8, 'num_epochs': 16, 'weight_decay': 0.009836449947392396, 'layers_PRS': 7, 'layers_SCZ15': 3, 'layers_ADHD9': 5, 'layers_ASD9': 3, 'layers_ACE15': 1, 'layers_ACE18': 3, 'layers_SUD18': 4, 'layers_SES': 3, 'layers_SEX': 4, 'dropout': 0.3493469218558647, 'se_reduction': 5, 'hidden_dim_min': 9, 'base_loss': 'huber', 'huber_delta': 0.026542678793518876, 'focal_gamma': 1.263256673254006, 'n_bins': 18, 'scheduler_patience': 4, 'scheduler_factor': 0.3527433032331459, 'early_stopping_patience': 6}. Best is trial 0 with value: 0.08964510394112955.
Train: 2407 rows (1613 IDs),Test: 598 rows (404 IDs) 

n_features_x : 6, n_features_per_modality: [16, 23, 19, 17, 7, 4, 4, 4, 1, 4]

--- ImbalancedRegressionLoss initialized ---
  Bins: 20, Focal gamma: 1.7786662070241048, Base loss: mse
  Bin [0.00, 0.05): count=  650, weight=0.004
  Bin [0.05, 0.10): count=  360, weight=0.007
  Bin [0.10, 0.15): count=  360, weight=0.007
  Bin [0.15, 0.20): count=  506, weight=0.005
  Bin [0.20, 0.25): count=  237, weight=0.011
  Bin [0.25, 0.30): count=  149, weight=0.017
  Bin [0.30, 0.35): count=   91, weight=0.028
  Bin [0.35, 0.40): count=   20, weight=0.125
  Bin [0.40, 0.45): count=   13, weight=0.187
  Bin [0.45, 0.50): count=   10, weight=0.238
  Bin [0.50, 0.55): count=    6, weight=0.374
  Bin [0.55, 0.60): count=    3, weight=0.655
  Bin [0.60, 0.65): count=    1, weight=1.310
  Bin [0.65, 0.70): count=    1, weight=1.310
  Bin [0.70, 0.75): count=    0, weight=2.620
  Bin [0.75, 0.80): count=    0, weight=2.620
  Bin [0.80, 0.85): count=    0, weight=2.620
  Bin [0.85, 0.90): count=    0, weight=2.620
  Bin [0.90, 0.95): count=    0, weight=2.620
  Bin [0.95, 1.00): count=    0, weight=2.620
-------------------------------------------

  Pred range: [0.0884, 0.3876], std: 0.0512
  RMSE : 0.1002, R2: 0.0082, MAE: 0.0817, Spearman rho: 0.4233, Spearman p: 2.1085e-27, Pearson r: 0.4355, Pearson p: 4.4638e-29
  Pred range: [0.0807, 0.3825], std: 0.0483
  RMSE : 0.0999, R2: 0.0132, MAE: 0.0821, Spearman rho: 0.4544, Spearman p: 8.3213e-32, Pearson r: 0.4654, Pearson p: 1.7537e-33
  Pred range: [0.0623, 0.3986], std: 0.0550
  RMSE : 0.0962, R2: 0.0847, MAE: 0.0776, Spearman rho: 0.4304, Spearman p: 2.2973e-28, Pearson r: 0.4391, Pearson p: 1.4087e-29
  Pred range: [0.0578, 0.4350], std: 0.0534
  RMSE : 0.0978, R2: 0.0541, MAE: 0.0797, Spearman rho: 0.4428, Spearman p: 4.2098e-30, Pearson r: 0.4496, Pearson p: 4.3606e-31
  Pred range: [0.0924, 0.4726], std: 0.0593
  RMSE : 0.1183, R2: -0.3838, MAE: 0.0987, Spearman rho: 0.4382, Spearman p: 1.8540e-29, Pearson r: 0.4477, Pearson p: 8.0905e-31
  Pred range: [0.0199, 0.3549], std: 0.0487
  RMSE : 0.0929, R2: 0.1473, MAE: 0.0751, Spearman rho: 0.4146, Spearman p: 3.0510e-26, Pearson r: 0.4243, Pearson p: 1.5666e-27
  Pred range: [0.0052, 0.3706], std: 0.0514
  RMSE : 0.0921, R2: 0.1619, MAE: 0.0738, Spearman rho: 0.4216, Spearman p: 3.6441e-27, Pearson r: 0.4251, Pearson p: 1.2154e-27
  Pred range: [0.0769, 0.4807], std: 0.0658
  RMSE : 0.1116, R2: -0.2307, MAE: 0.0917, Spearman rho: 0.4510, Spearman p: 2.6645e-31, Pearson r: 0.4572, Pearson p: 3.1761e-32
  Pred range: [0.0306, 0.3780], std: 0.0488
  RMSE : 0.0935, R2: 0.1358, MAE: 0.0755, Spearman rho: 0.4137, Spearman p: 3.9893e-26, Pearson r: 0.4263, Pearson p: 8.3837e-28
  Pred range: [0.0787, 0.4349], std: 0.0581
  RMSE : 0.1064, R2: -0.1186, MAE: 0.0871, Spearman rho: 0.4191, Spearman p: 7.7676e-27, Pearson r: 0.4303, Pearson p: 2.3707e-28
  Pred range: [0.0343, 0.4113], std: 0.0507
  RMSE : 0.1001, R2: 0.0090, MAE: 0.0822, Spearman rho: 0.3994, Spearman p: 2.6068e-24, Pearson r: 0.4185, Pearson p: 9.2684e-27
  Pred range: [0.0425, 0.3776], std: 0.0518
  RMSE : 0.0911, R2: 0.1791, MAE: 0.0732, Spearman rho: 0.4349, Spearman p: 5.4874e-29, Pearson r: 0.4524, Pearson p: 1.6561e-31
  Pred range: [0.0317, 0.3963], std: 0.0515
  RMSE : 0.0922, R2: 0.1591, MAE: 0.0743, Spearman rho: 0.4363, Spearman p: 3.5336e-29, Pearson r: 0.4512, Pearson p: 2.4924e-31
  Pred range: [0.0776, 0.4445], std: 0.0566
  RMSE : 0.1054, R2: -0.0979, MAE: 0.0863, Spearman rho: 0.4339, Spearman p: 7.5334e-29, Pearson r: 0.4447, Pearson p: 2.2177e-30
  Pred range: [0.0554, 0.3999], std: 0.0593
  RMSE : 0.0966, R2: 0.0778, MAE: 0.0777, Spearman rho: 0.4412, Spearman p: 7.0296e-30, Pearson r: 0.4486, Pearson p: 6.0277e-31
  Pred range: [0.0410, 0.4053], std: 0.0572
  RMSE : 0.0986, R2: 0.0386, MAE: 0.0804, Spearman rho: 0.4481, Spearman p: 7.1947e-31, Pearson r: 0.4559, Pearson p: 4.9787e-32
  Pred range: [0.0468, 0.3880], std: 0.0526
  RMSE : 0.0971, R2: 0.0685, MAE: 0.0791, Spearman rho: 0.4262, Spearman p: 8.5818e-28, Pearson r: 0.4387, Pearson p: 1.5995e-29
[I 2026-04-27 16:23:20,919] Trial 4 finished with value: 0.09114587534040663 and parameters: {'learning_rate': 0.0015211132169443745, 'batch_size': 8, 'num_epochs': 26, 'weight_decay': 0.0004988822120698722, 'layers_PRS': 6, 'layers_SCZ15': 7, 'layers_ADHD9': 4, 'layers_ASD9': 4, 'layers_ACE15': 1, 'layers_ACE18': 4, 'layers_SUD18': 2, 'layers_SES': 6, 'layers_SEX': 3, 'dropout': 0.10089966561117346, 'se_reduction': 4, 'hidden_dim_min': 15, 'base_loss': 'mse', 'huber_delta': 0.10202603990598114, 'focal_gamma': 1.7786662070241048, 'n_bins': 20, 'scheduler_patience': 5, 'scheduler_factor': 0.5841084966608305, 'early_stopping_patience': 5}. Best is trial 0 with value: 0.08964510394112955.
Train: 2407 rows (1613 IDs),Test: 598 rows (404 IDs) 

n_features_x : 6, n_features_per_modality: [16, 23, 19, 17, 7, 4, 4, 4, 1, 4]

--- ImbalancedRegressionLoss initialized ---
  Bins: 14, Focal gamma: 2.363183395761734, Base loss: huber
  Bin [0.00, 0.07): count=  828, weight=0.003
  Bin [0.07, 0.14): count=  542, weight=0.005
  Bin [0.14, 0.21): count=  506, weight=0.005
  Bin [0.21, 0.29): count=  386, weight=0.007
  Bin [0.29, 0.36): count=   91, weight=0.029
  Bin [0.36, 0.43): count=   29, weight=0.090
  Bin [0.43, 0.50): count=   12, weight=0.207
  Bin [0.50, 0.57): count=   11, weight=0.224
  Bin [0.57, 0.64): count=    1, weight=1.343
  Bin [0.64, 0.71): count=    1, weight=1.343
  Bin [0.71, 0.79): count=    0, weight=2.686
  Bin [0.79, 0.86): count=    0, weight=2.686
  Bin [0.86, 0.93): count=    0, weight=2.686
  Bin [0.93, 1.00): count=    0, weight=2.686
-------------------------------------------

  Pred range: [0.0518, 0.4369], std: 0.0607
  RMSE : 0.1100, R2: -0.1956, MAE: 0.0897, Spearman rho: 0.3408, Spearman p: 1.0031e-17, Pearson r: 0.3606, Pearson p: 8.4015e-20
  Pred range: [0.0772, 0.4454], std: 0.0575
  RMSE : 0.1113, R2: -0.2246, MAE: 0.0914, Spearman rho: 0.3837, Spearman p: 2.0440e-22, Pearson r: 0.4030, Pearson p: 9.2710e-25
  Pred range: [0.0701, 0.4322], std: 0.0581
  RMSE : 0.1011, R2: -0.0101, MAE: 0.0821, Spearman rho: 0.4056, Spearman p: 4.3376e-25, Pearson r: 0.4232, Pearson p: 2.1936e-27
  Pred range: [0.0699, 0.4409], std: 0.0614
  RMSE : 0.1037, R2: -0.0634, MAE: 0.0842, Spearman rho: 0.4202, Spearman p: 5.5974e-27, Pearson r: 0.4352, Pearson p: 4.9936e-29
  Pred range: [0.0486, 0.3955], std: 0.0587
  RMSE : 0.0937, R2: 0.1319, MAE: 0.0753, Spearman rho: 0.4266, Spearman p: 7.5432e-28, Pearson r: 0.4408, Pearson p: 7.9531e-30
  Pred range: [0.0615, 0.4088], std: 0.0558
  RMSE : 0.0968, R2: 0.0749, MAE: 0.0783, Spearman rho: 0.4199, Spearman p: 6.0846e-27, Pearson r: 0.4340, Pearson p: 7.3669e-29
  Pred range: [0.0783, 0.4297], std: 0.0577
  RMSE : 0.1051, R2: -0.0918, MAE: 0.0857, Spearman rho: 0.4212, Spearman p: 4.0567e-27, Pearson r: 0.4369, Pearson p: 2.8296e-29
  Pred range: [0.0735, 0.4260], std: 0.0588
  RMSE : 0.1042, R2: -0.0720, MAE: 0.0850, Spearman rho: 0.4315, Spearman p: 1.6462e-28, Pearson r: 0.4471, Pearson p: 9.8703e-31
  Pred range: [0.0685, 0.4265], std: 0.0596
  RMSE : 0.1018, R2: -0.0231, MAE: 0.0827, Spearman rho: 0.4425, Spearman p: 4.6416e-30, Pearson r: 0.4560, Pearson p: 4.7438e-32
  Pred range: [0.0536, 0.4303], std: 0.0612
  RMSE : 0.0993, R2: 0.0259, MAE: 0.0803, Spearman rho: 0.4491, Spearman p: 5.0787e-31, Pearson r: 0.4627, Pearson p: 4.5761e-33
  Pred range: [0.0166, 0.3769], std: 0.0545
  RMSE : 0.0913, R2: 0.1769, MAE: 0.0734, Spearman rho: 0.4359, Spearman p: 3.9791e-29, Pearson r: 0.4522, Pearson p: 1.8029e-31
  Pred range: [0.0475, 0.4232], std: 0.0586
  RMSE : 0.0973, R2: 0.0643, MAE: 0.0787, Spearman rho: 0.4377, Spearman p: 2.2392e-29, Pearson r: 0.4540, Pearson p: 9.6878e-32
[I 2026-04-27 16:23:52,858] Trial 5 pruned. 
Train: 2407 rows (1613 IDs),Test: 598 rows (404 IDs) 

n_features_x : 6, n_features_per_modality: [16, 23, 19, 17, 7, 4, 4, 4, 1, 4]

--- ImbalancedRegressionLoss initialized ---
  Bins: 16, Focal gamma: 1.407033205364129, Base loss: mse
  Bin [0.00, 0.06): count=  650, weight=0.004
  Bin [0.06, 0.12): count=  530, weight=0.005
  Bin [0.12, 0.19): count=  536, weight=0.005
  Bin [0.19, 0.25): count=  397, weight=0.007
  Bin [0.25, 0.31): count=  190, weight=0.014
  Bin [0.31, 0.38): count=   63, weight=0.042
  Bin [0.38, 0.44): count=   20, weight=0.127
  Bin [0.44, 0.50): count=   10, weight=0.242
  Bin [0.50, 0.56): count=    6, weight=0.380
  Bin [0.56, 0.62): count=    4, weight=0.532
  Bin [0.62, 0.69): count=    0, weight=2.662
  Bin [0.69, 0.75): count=    1, weight=1.331
  Bin [0.75, 0.81): count=    0, weight=2.662
  Bin [0.81, 0.88): count=    0, weight=2.662
  Bin [0.88, 0.94): count=    0, weight=2.662
  Bin [0.94, 1.00): count=    0, weight=2.662
-------------------------------------------

  Pred range: [0.0224, 0.3813], std: 0.0610
  RMSE : 0.0935, R2: 0.1355, MAE: 0.0748, Spearman rho: 0.4562, Spearman p: 4.5489e-32, Pearson r: 0.4508, Pearson p: 2.8841e-31
  Pred range: [0.0703, 0.4735], std: 0.0619
  RMSE : 0.1169, R2: -0.3504, MAE: 0.0983, Spearman rho: 0.4626, Spearman p: 4.8204e-33, Pearson r: 0.4581, Pearson p: 2.3204e-32
  Pred range: [0.0729, 0.5150], std: 0.0626
  RMSE : 0.1318, R2: -0.7157, MAE: 0.1117, Spearman rho: 0.4507, Spearman p: 2.9573e-31, Pearson r: 0.4490, Pearson p: 5.2376e-31
  Pred range: [0.0244, 0.4264], std: 0.0579
  RMSE : 0.0965, R2: 0.0804, MAE: 0.0784, Spearman rho: 0.4557, Spearman p: 5.3176e-32, Pearson r: 0.4565, Pearson p: 4.0105e-32
  Pred range: [0.0684, 0.4861], std: 0.0626
  RMSE : 0.1096, R2: -0.1870, MAE: 0.0903, Spearman rho: 0.4463, Spearman p: 1.2900e-30, Pearson r: 0.4462, Pearson p: 1.3459e-30
  Pred range: [0.0103, 0.4365], std: 0.0538
  RMSE : 0.0957, R2: 0.0944, MAE: 0.0782, Spearman rho: 0.4425, Spearman p: 4.5427e-30, Pearson r: 0.4449, Pearson p: 2.0726e-30
  Pred range: [0.0085, 0.4138], std: 0.0539
  RMSE : 0.0954, R2: 0.1000, MAE: 0.0778, Spearman rho: 0.4356, Spearman p: 4.4398e-29, Pearson r: 0.4408, Pearson p: 8.1842e-30
  Pred range: [-0.0003, 0.4377], std: 0.0574
  RMSE : 0.0963, R2: 0.0839, MAE: 0.0787, Spearman rho: 0.4427, Spearman p: 4.2658e-30, Pearson r: 0.4494, Pearson p: 4.5762e-31
