[I 2026-04-28 01:15:16,293] Trial 34 pruned. 
Train: 2407 rows (1613 IDs),Test: 598 rows (404 IDs) 

n_features_x : 6, n_features_per_modality: [16, 23, 19, 17, 7, 4, 4, 4, 1, 4]

--- ImbalancedRegressionLoss initialized ---
  Bins: 11, Focal gamma: 1.6815172422610012, Base loss: huber
  Bin [0.00, 0.09): count=  585, weight=0.034
  Bin [0.09, 0.18): count=  580, weight=0.034
  Bin [0.18, 0.27): count=  421, weight=0.047
  Bin [0.27, 0.36): count=  312, weight=0.064
  Bin [0.36, 0.45): count=  207, weight=0.096
  Bin [0.45, 0.55): count=  108, weight=0.183
  Bin [0.55, 0.64): count=  125, weight=0.159
  Bin [0.64, 0.73): count=   41, weight=0.476
  Bin [0.73, 0.82): count=   21, weight=0.909
  Bin [0.82, 0.91): count=    4, weight=3.999
  Bin [0.91, 1.00): count=    3, weight=4.998
-------------------------------------------

  Pred range: [0.1588, 0.6751], std: 0.0773
  RMSE : 0.2097, R2: -0.4680, MAE: 0.1814, Spearman rho: 0.2889, Spearman p: 5.8534e-13, Pearson r: 0.3159, Pearson p: 2.5086e-15
  Pred range: [0.1646, 0.6353], std: 0.0748
  RMSE : 0.2012, R2: -0.3508, MAE: 0.1739, Spearman rho: 0.3291, Spearman p: 1.4191e-16, Pearson r: 0.3550, Pearson p: 3.3534e-19
  Pred range: [0.1600, 0.6391], std: 0.0763
  RMSE : 0.1945, R2: -0.2621, MAE: 0.1676, Spearman rho: 0.3679, Spearman p: 1.3172e-20, Pearson r: 0.3893, Pearson p: 4.4785e-23
  Pred range: [0.1623, 0.6814], std: 0.0829
  RMSE : 0.2004, R2: -0.3399, MAE: 0.1732, Spearman rho: 0.3945, Spearman p: 1.0517e-23, Pearson r: 0.4144, Pearson p: 3.2001e-26
  Pred range: [0.1492, 0.6629], std: 0.0821
  RMSE : 0.1884, R2: -0.1845, MAE: 0.1616, Spearman rho: 0.4115, Spearman p: 7.6093e-26, Pearson r: 0.4313, Pearson p: 1.7351e-28
  Pred range: [0.1323, 0.6295], std: 0.0808
  RMSE : 0.1756, R2: -0.0295, MAE: 0.1489, Spearman rho: 0.4271, Spearman p: 6.5444e-28, Pearson r: 0.4467, Pearson p: 1.1283e-30
[I 2026-04-28 01:15:32,176] Trial 35 pruned. 
Train: 2407 rows (1613 IDs),Test: 598 rows (404 IDs) 

n_features_x : 6, n_features_per_modality: [16, 23, 19, 17, 7, 4, 4, 4, 1, 4]

--- ImbalancedRegressionLoss initialized ---
  Bins: 13, Focal gamma: 0.8619763882417657, Base loss: mse
  Bin [0.00, 0.08): count=  383, weight=0.049
  Bin [0.08, 0.15): count=  578, weight=0.032
  Bin [0.15, 0.23): count=  370, weight=0.051
  Bin [0.23, 0.31): count=  368, weight=0.051
  Bin [0.31, 0.38): count=  199, weight=0.094
  Bin [0.38, 0.46): count=  207, weight=0.090
  Bin [0.46, 0.54): count=  108, weight=0.172
  Bin [0.54, 0.62): count=  106, weight=0.176
  Bin [0.62, 0.69): count=   36, weight=0.508
  Bin [0.69, 0.77): count=   36, weight=0.508
  Bin [0.77, 0.85): count=    9, weight=1.878
  Bin [0.85, 0.92): count=    5, weight=3.130
  Bin [0.92, 1.00): count=    2, weight=6.261
-------------------------------------------

  Pred range: [0.0834, 0.5727], std: 0.0611
  RMSE : 0.1783, R2: -0.0615, MAE: 0.1459, Spearman rho: 0.1774, Spearman p: 1.2743e-05, Pearson r: 0.1798, Pearson p: 9.6744e-06
  Pred range: [0.1090, 0.6408], std: 0.0672
  RMSE : 0.1914, R2: -0.2233, MAE: 0.1614, Spearman rho: 0.2332, Spearman p: 7.8939e-09, Pearson r: 0.2377, Pearson p: 3.9603e-09
  Pred range: [0.1171, 0.6401], std: 0.0685
  RMSE : 0.1928, R2: -0.2411, MAE: 0.1635, Spearman rho: 0.2718, Spearman p: 1.3862e-11, Pearson r: 0.2761, Pearson p: 6.3569e-12
  Pred range: [0.1163, 0.6209], std: 0.0687
  RMSE : 0.1874, R2: -0.1728, MAE: 0.1585, Spearman rho: 0.3047, Spearman p: 2.5668e-14, Pearson r: 0.3108, Pearson p: 7.3114e-15
  Pred range: [0.1159, 0.6029], std: 0.0698
  RMSE : 0.1836, R2: -0.1255, MAE: 0.1549, Spearman rho: 0.3340, Spearman p: 4.7606e-17, Pearson r: 0.3402, Pearson p: 1.1520e-17
  Pred range: [0.1146, 0.6037], std: 0.0714
  RMSE : 0.1807, R2: -0.0894, MAE: 0.1522, Spearman rho: 0.3579, Spearman p: 1.6473e-19, Pearson r: 0.3642, Pearson p: 3.4136e-20
[I 2026-04-28 01:16:08,142] Trial 36 pruned. 
Train: 2407 rows (1613 IDs),Test: 598 rows (404 IDs) 

n_features_x : 6, n_features_per_modality: [16, 23, 19, 17, 7, 4, 4, 4, 1, 4]

--- ImbalancedRegressionLoss initialized ---
  Bins: 9, Focal gamma: 2.157391970070785, Base loss: huber
  Bin [0.00, 0.11): count=  585, weight=0.041
  Bin [0.11, 0.22): count=  746, weight=0.032
  Bin [0.22, 0.33): count=  478, weight=0.050
  Bin [0.33, 0.44): count=  231, weight=0.104
  Bin [0.44, 0.56): count=  215, weight=0.112
  Bin [0.56, 0.67): count=  100, weight=0.239
  Bin [0.67, 0.78): count=   36, weight=0.653
  Bin [0.78, 0.89): count=   13, weight=1.726
  Bin [0.89, 1.00): count=    3, weight=6.041
-------------------------------------------

  Pred range: [0.0796, 0.5587], std: 0.0893
  RMSE : 0.1509, R2: 0.2400, MAE: 0.1192, Spearman rho: 0.4785, Spearman p: 1.5417e-35, Pearson r: 0.4972, Pearson p: 1.1518e-38
  Pred range: [0.1188, 0.6487], std: 0.0916
  RMSE : 0.1554, R2: 0.1941, MAE: 0.1277, Spearman rho: 0.4927, Spearman p: 6.9254e-38, Pearson r: 0.5161, Pearson p: 5.1456e-42
  Pred range: [0.0822, 0.6295], std: 0.0995
  RMSE : 0.1496, R2: 0.2526, MAE: 0.1191, Spearman rho: 0.5021, Spearman p: 1.6717e-39, Pearson r: 0.5216, Pearson p: 4.9326e-43
  Pred range: [0.0957, 0.6007], std: 0.0867
  RMSE : 0.1549, R2: 0.1993, MAE: 0.1274, Spearman rho: 0.5022, Spearman p: 1.5753e-39, Pearson r: 0.5149, Pearson p: 8.4470e-42
  Pred range: [0.0521, 0.6154], std: 0.0946
  RMSE : 0.1513, R2: 0.2360, MAE: 0.1216, Spearman rho: 0.5009, Spearman p: 2.7044e-39, Pearson r: 0.5141, Pearson p: 1.2127e-41
  Pred range: [0.0513, 0.5983], std: 0.0894
  RMSE : 0.1514, R2: 0.2351, MAE: 0.1219, Spearman rho: 0.4938, Spearman p: 4.4756e-38, Pearson r: 0.5094, Pearson p: 8.4409e-41
  Pred range: [0.0206, 0.6693], std: 0.0987
  RMSE : 0.1537, R2: 0.2113, MAE: 0.1248, Spearman rho: 0.4936, Spearman p: 4.8306e-38, Pearson r: 0.5104, Pearson p: 5.5329e-41
  Pred range: [-0.0013, 0.5880], std: 0.0896
  RMSE : 0.1523, R2: 0.2255, MAE: 0.1230, Spearman rho: 0.4904, Spearman p: 1.6825e-37, Pearson r: 0.5037, Pearson p: 8.4939e-40
[I 2026-04-28 01:17:12,606] Trial 37 finished with value: 0.14964065324397288 and parameters: {'learning_rate': 0.0005111878845254935, 'batch_size': 4, 'num_epochs': 12, 'weight_decay': 1.633081140973971e-05, 'depth_complex': 4, 'depth_moderate': 3, 'depth_simple': 2, 'dropout': 0.2984665826630297, 'se_reduction': 7, 'hidden_dim_min': 8, 'base_loss': 'huber', 'huber_delta': 0.11056236459471513, 'focal_gamma': 2.157391970070785, 'n_bins': 9, 'scheduler_patience': 4, 'scheduler_factor': 0.4409162076529445, 'early_stopping_patience': 5}. Best is trial 22 with value: 0.14933273495596114.
Train: 2407 rows (1613 IDs),Test: 598 rows (404 IDs) 

n_features_x : 6, n_features_per_modality: [16, 23, 19, 17, 7, 4, 4, 4, 1, 4]

--- ImbalancedRegressionLoss initialized ---
  Bins: 16, Focal gamma: 1.8663984901759574, Base loss: mse
  Bin [0.00, 0.06): count=  383, weight=0.041
  Bin [0.06, 0.12): count=  377, weight=0.042
  Bin [0.12, 0.19): count=  405, weight=0.039
  Bin [0.19, 0.25): count=  295, weight=0.053
  Bin [0.25, 0.31): count=  239, weight=0.066
  Bin [0.31, 0.38): count=  199, weight=0.079
  Bin [0.38, 0.44): count=  142, weight=0.111
  Bin [0.44, 0.50): count=  122, weight=0.129
  Bin [0.50, 0.56): count=   93, weight=0.168
  Bin [0.56, 0.62): count=   64, weight=0.243
  Bin [0.62, 0.69): count=   36, weight=0.427
  Bin [0.69, 0.75): count=   24, weight=0.633
  Bin [0.75, 0.81): count=   19, weight=0.791
  Bin [0.81, 0.88): count=    5, weight=2.636
  Bin [0.88, 0.94): count=    2, weight=5.271
  Bin [0.94, 1.00): count=    2, weight=5.271
-------------------------------------------

  Pred range: [0.1479, 0.6549], std: 0.0749
  RMSE : 0.1707, R2: 0.0279, MAE: 0.1440, Spearman rho: 0.4411, Spearman p: 7.1872e-30, Pearson r: 0.4592, Pearson p: 1.5907e-32
  Pred range: [0.1699, 0.7130], std: 0.0845
  RMSE : 0.1857, R2: -0.1513, MAE: 0.1596, Spearman rho: 0.4762, Spearman p: 3.5932e-35, Pearson r: 0.4897, Pearson p: 2.1955e-37
  Pred range: [0.1449, 0.7233], std: 0.0906
  RMSE : 0.1741, R2: -0.0113, MAE: 0.1475, Spearman rho: 0.4722, Spearman p: 1.5590e-34, Pearson r: 0.4890, Pearson p: 2.7990e-37
  Pred range: [0.1426, 0.6061], std: 0.0786
  RMSE : 0.1605, R2: 0.1399, MAE: 0.1344, Spearman rho: 0.4735, Spearman p: 9.6621e-35, Pearson r: 0.5007, Pearson p: 2.9394e-39
  Pred range: [0.1199, 0.6931], std: 0.0920
  RMSE : 0.1725, R2: 0.0067, MAE: 0.1464, Spearman rho: 0.4772, Spearman p: 2.4526e-35, Pearson r: 0.4985, Pearson p: 6.9165e-39
  Pred range: [0.1399, 0.7241], std: 0.0993
  RMSE : 0.1722, R2: 0.0103, MAE: 0.1454, Spearman rho: 0.4857, Spearman p: 1.0002e-36, Pearson r: 0.5095, Pearson p: 8.0818e-41
  Pred range: [0.1189, 0.7099], std: 0.0997
  RMSE : 0.1753, R2: -0.0259, MAE: 0.1485, Spearman rho: 0.4971, Spearman p: 1.2105e-38, Pearson r: 0.5160, Pearson p: 5.3249e-42
  Pred range: [0.0421, 0.6894], std: 0.0938
  RMSE : 0.1611, R2: 0.1332, MAE: 0.1343, Spearman rho: 0.4824, Spearman p: 3.5279e-36, Pearson r: 0.5081, Pearson p: 1.4517e-40
[I 2026-04-28 01:17:55,518] Trial 38 pruned. 
Train: 2407 rows (1613 IDs),Test: 598 rows (404 IDs) 

n_features_x : 6, n_features_per_modality: [16, 23, 19, 17, 7, 4, 4, 4, 1, 4]

--- ImbalancedRegressionLoss initialized ---
  Bins: 6, Focal gamma: 1.503470256696303, Base loss: huber
  Bin [0.00, 0.17): count=  961, weight=0.041
  Bin [0.17, 0.33): count=  848, weight=0.047
  Bin [0.33, 0.50): count=  353, weight=0.112
  Bin [0.50, 0.67): count=  176, weight=0.224
  Bin [0.67, 0.83): count=   62, weight=0.628
  Bin [0.83, 1.00): count=    7, weight=4.948
-------------------------------------------

  Pred range: [0.0263, 0.5766], std: 0.0876
  RMSE : 0.1555, R2: 0.1926, MAE: 0.1186, Spearman rho: 0.4575, Spearman p: 2.9001e-32, Pearson r: 0.4577, Pearson p: 2.6858e-32
  Pred range: [-0.0426, 0.5917], std: 0.0969
  RMSE : 0.1523, R2: 0.2257, MAE: 0.1176, Spearman rho: 0.4701, Spearman p: 3.3593e-34, Pearson r: 0.4821, Pearson p: 3.8794e-36
  Pred range: [0.0229, 0.6036], std: 0.1048
  RMSE : 0.1539, R2: 0.2097, MAE: 0.1240, Spearman rho: 0.4754, Spearman p: 4.7199e-35, Pearson r: 0.4961, Pearson p: 1.8071e-38
  Pred range: [0.1293, 0.6855], std: 0.1020
  RMSE : 0.1844, R2: -0.1347, MAE: 0.1571, Spearman rho: 0.4599, Spearman p: 1.2439e-32, Pearson r: 0.4797, Pearson p: 9.6654e-36
  Pred range: [0.0252, 0.6062], std: 0.0999
  RMSE : 0.1537, R2: 0.2117, MAE: 0.1229, Spearman rho: 0.4634, Spearman p: 3.6272e-33, Pearson r: 0.4877, Pearson p: 4.7127e-37
  Pred range: [0.0651, 0.6397], std: 0.1058
  RMSE : 0.1626, R2: 0.1170, MAE: 0.1346, Spearman rho: 0.4656, Spearman p: 1.6637e-33, Pearson r: 0.4889, Pearson p: 2.9077e-37
[I 2026-04-28 01:18:28,222] Trial 39 finished with value: 0.1523069985393661 and parameters: {'learning_rate': 0.004828475199231528, 'batch_size': 6, 'num_epochs': 21, 'weight_decay': 0.0001020093573829827, 'depth_complex': 3, 'depth_moderate': 4, 'depth_simple': 1, 'dropout': 0.4805129640815343, 'se_reduction': 5, 'hidden_dim_min': 15, 'base_loss': 'huber', 'huber_delta': 0.04315221193958592, 'focal_gamma': 1.503470256696303, 'n_bins': 6, 'scheduler_patience': 5, 'scheduler_factor': 0.4611044788102314, 'early_stopping_patience': 4}. Best is trial 22 with value: 0.14933273495596114.
Train: 2407 rows (1613 IDs),Test: 598 rows (404 IDs) 

n_features_x : 6, n_features_per_modality: [16, 23, 19, 17, 7, 4, 4, 4, 1, 4]

--- ImbalancedRegressionLoss initialized ---
  Bins: 20, Focal gamma: 2.309529838015953, Base loss: mse
  Bin [0.00, 0.05): count=  172, weight=0.053
  Bin [0.05, 0.10): count=  413, weight=0.022
  Bin [0.10, 0.15): count=  175, weight=0.052
  Bin [0.15, 0.20): count=  405, weight=0.023
  Bin [0.20, 0.25): count=  295, weight=0.031
  Bin [0.25, 0.30): count=  126, weight=0.072
  Bin [0.30, 0.35): count=  223, weight=0.041
  Bin [0.35, 0.40): count=  162, weight=0.056
  Bin [0.40, 0.45): count=   69, weight=0.131
  Bin [0.45, 0.50): count=  122, weight=0.074
  Bin [0.50, 0.55): count=   93, weight=0.097
  Bin [0.55, 0.60): count=   36, weight=0.247
  Bin [0.60, 0.65): count=   47, weight=0.190
  Bin [0.65, 0.70): count=   27, weight=0.326
  Bin [0.70, 0.75): count=   14, weight=0.609
  Bin [0.75, 0.80): count=   19, weight=0.457
  Bin [0.80, 0.85): count=    5, weight=1.523
  Bin [0.85, 0.90): count=    1, weight=4.570
  Bin [0.90, 0.95): count=    3, weight=2.285
  Bin [0.95, 1.00): count=    0, weight=9.140
-------------------------------------------

  Pred range: [-0.0482, 0.4043], std: 0.0539
  RMSE : 0.2098, R2: -0.4695, MAE: 0.1501, Spearman rho: 0.2113, Spearman p: 1.8254e-07, Pearson r: 0.2003, Pearson p: 7.9168e-07
  Pred range: [0.0769, 0.8577], std: 0.0949
  RMSE : 0.1931, R2: -0.2444, MAE: 0.1609, Spearman rho: 0.2729, Spearman p: 1.1346e-11, Pearson r: 0.2735, Pearson p: 1.0181e-11
  Pred range: [0.0976, 0.9217], std: 0.1023
  RMSE : 0.2158, R2: -0.5551, MAE: 0.1832, Spearman rho: 0.2922, Spearman p: 3.0796e-13, Pearson r: 0.2946, Pearson p: 1.9434e-13
  Pred range: [0.1008, 0.9044], std: 0.1003
  RMSE : 0.2121, R2: -0.5023, MAE: 0.1802, Spearman rho: 0.3096, Spearman p: 9.5118e-15, Pearson r: 0.3155, Pearson p: 2.7755e-15
  Pred range: [0.1007, 0.8505], std: 0.0966
  RMSE : 0.2058, R2: -0.4131, MAE: 0.1748, Spearman rho: 0.3224, Spearman p: 6.2380e-16, Pearson r: 0.3296, Pearson p: 1.2883e-16
[I 2026-04-28 01:18:35,703] Trial 40 finished with value: 0.19308353747482057 and parameters: {'learning_rate': 0.00010044671894763361, 'batch_size': 32, 'num_epochs': 29, 'weight_decay': 0.00040358153207081495, 'depth_complex': 4, 'depth_moderate': 4, 'depth_simple': 2, 'dropout': 0.23984451585144229, 'se_reduction': 3, 'hidden_dim_min': 12, 'base_loss': 'mse', 'huber_delta': 0.12489524151120769, 'focal_gamma': 2.309529838015953, 'n_bins': 20, 'scheduler_patience': 5, 'scheduler_factor': 0.4829424948562646, 'early_stopping_patience': 3}. Best is trial 22 with value: 0.14933273495596114.
Train: 2407 rows (1613 IDs),Test: 598 rows (404 IDs) 

n_features_x : 6, n_features_per_modality: [16, 23, 19, 17, 7, 4, 4, 4, 1, 4]

--- ImbalancedRegressionLoss initialized ---
  Bins: 9, Focal gamma: 2.158356912573688, Base loss: huber
  Bin [0.00, 0.11): count=  585, weight=0.041
  Bin [0.11, 0.22): count=  746, weight=0.032
  Bin [0.22, 0.33): count=  478, weight=0.050
  Bin [0.33, 0.44): count=  231, weight=0.104
  Bin [0.44, 0.56): count=  215, weight=0.112
  Bin [0.56, 0.67): count=  100, weight=0.239
  Bin [0.67, 0.78): count=   36, weight=0.653
  Bin [0.78, 0.89): count=   13, weight=1.726
  Bin [0.89, 1.00): count=    3, weight=6.041
-------------------------------------------

  Pred range: [0.0877, 0.6549], std: 0.0971
  RMSE : 0.1563, R2: 0.1847, MAE: 0.1263, Spearman rho: 0.4746, Spearman p: 6.2910e-35, Pearson r: 0.4826, Pearson p: 3.2446e-36
  Pred range: [0.0796, 0.5652], std: 0.0904
  RMSE : 0.1493, R2: 0.2555, MAE: 0.1172, Spearman rho: 0.4969, Spearman p: 1.2965e-38, Pearson r: 0.5075, Pearson p: 1.8320e-40
  Pred range: [0.0862, 0.5838], std: 0.0907
  RMSE : 0.1481, R2: 0.2674, MAE: 0.1159, Spearman rho: 0.5031, Spearman p: 1.0996e-39, Pearson r: 0.5183, Pearson p: 2.0403e-42
  Pred range: [0.0830, 0.6329], std: 0.0959
  RMSE : 0.1523, R2: 0.2260, MAE: 0.1234, Spearman rho: 0.4976, Spearman p: 1.0088e-38, Pearson r: 0.5142, Pearson p: 1.1704e-41
  Pred range: [0.0646, 0.6227], std: 0.0957
  RMSE : 0.1505, R2: 0.2438, MAE: 0.1206, Spearman rho: 0.4964, Spearman p: 1.5945e-38, Pearson r: 0.5138, Pearson p: 1.3780e-41
  Pred range: [0.0399, 0.6442], std: 0.0978
  RMSE : 0.1510, R2: 0.2390, MAE: 0.1206, Spearman rho: 0.4909, Spearman p: 1.3528e-37, Pearson r: 0.5086, Pearson p: 1.1539e-40
  Pred range: [0.0772, 0.6760], std: 0.1037
  RMSE : 0.1510, R2: 0.2393, MAE: 0.1207, Spearman rho: 0.5008, Spearman p: 2.7761e-39, Pearson r: 0.5182, Pearson p: 2.1496e-42
  Pred range: [0.0427, 0.6198], std: 0.0997
  RMSE : 0.1499, R2: 0.2497, MAE: 0.1184, Spearman rho: 0.4875, Spearman p: 5.0241e-37, Pearson r: 0.5087, Pearson p: 1.1232e-40
[I 2026-04-28 01:19:40,141] Trial 41 finished with value: 0.14814692842961857 and parameters: {'learning_rate': 0.0004855152971163052, 'batch_size': 4, 'num_epochs': 12, 'weight_decay': 1.3785146058868597e-05, 'depth_complex': 4, 'depth_moderate': 3, 'depth_simple': 2, 'dropout': 0.29289702899627734, 'se_reduction': 7, 'hidden_dim_min': 8, 'base_loss': 'huber', 'huber_delta': 0.10727768027372797, 'focal_gamma': 2.158356912573688, 'n_bins': 9, 'scheduler_patience': 4, 'scheduler_factor': 0.43874458411714623, 'early_stopping_patience': 5}. Best is trial 41 with value: 0.14814692842961857.
Train: 2407 rows (1613 IDs),Test: 598 rows (404 IDs) 

n_features_x : 6, n_features_per_modality: [16, 23, 19, 17, 7, 4, 4, 4, 1, 4]

--- ImbalancedRegressionLoss initialized ---
  Bins: 8, Focal gamma: 1.9836351880896972, Base loss: huber
  Bin [0.00, 0.12): count=  760, weight=0.039
  Bin [0.12, 0.25): count=  700, weight=0.042
  Bin [0.25, 0.38): count=  438, weight=0.067
  Bin [0.38, 0.50): count=  264, weight=0.111
  Bin [0.50, 0.62): count=  157, weight=0.186
  Bin [0.62, 0.75): count=   60, weight=0.483
  Bin [0.75, 0.88): count=   24, weight=1.179
  Bin [0.88, 1.00): count=    4, weight=5.893
-------------------------------------------

  Pred range: [0.0976, 0.5321], std: 0.0738
  RMSE : 0.1589, R2: 0.1567, MAE: 0.1247, Spearman rho: 0.3817, Spearman p: 3.5757e-22, Pearson r: 0.3992, Pearson p: 2.7952e-24
  Pred range: [0.0988, 0.5694], std: 0.0831
  RMSE : 0.1568, R2: 0.1790, MAE: 0.1251, Spearman rho: 0.4363, Spearman p: 3.4383e-29, Pearson r: 0.4455, Pearson p: 1.6998e-30
  Pred range: [0.0847, 0.5974], std: 0.0833
  RMSE : 0.1544, R2: 0.2043, MAE: 0.1236, Spearman rho: 0.4583, Spearman p: 2.1393e-32, Pearson r: 0.4710, Pearson p: 2.3720e-34
  Pred range: [0.0735, 0.5804], std: 0.0850
  RMSE : 0.1508, R2: 0.2406, MAE: 0.1175, Spearman rho: 0.4795, Spearman p: 1.0385e-35, Pearson r: 0.4906, Pearson p: 1.5417e-37
  Pred range: [0.0897, 0.6775], std: 0.0988
  RMSE : 0.1550, R2: 0.1980, MAE: 0.1252, Spearman rho: 0.4897, Spearman p: 2.1379e-37, Pearson r: 0.5007, Pearson p: 2.8316e-39
  Pred range: [0.0718, 0.6438], std: 0.0949
  RMSE : 0.1518, R2: 0.2308, MAE: 0.1211, Spearman rho: 0.4895, Spearman p: 2.3535e-37, Pearson r: 0.5015, Pearson p: 2.0685e-39
  Pred range: [0.0773, 0.6298], std: 0.0921
  RMSE : 0.1520, R2: 0.2289, MAE: 0.1218, Spearman rho: 0.4886, Spearman p: 3.3508e-37, Pearson r: 0.5020, Pearson p: 1.7122e-39
  Pred range: [0.0686, 0.6524], std: 0.0934
  RMSE : 0.1515, R2: 0.2341, MAE: 0.1211, Spearman rho: 0.4889, Spearman p: 2.9659e-37, Pearson r: 0.5041, Pearson p: 7.3103e-40
  Pred range: [0.0813, 0.6697], std: 0.0962
  RMSE : 0.1541, R2: 0.2072, MAE: 0.1249, Spearman rho: 0.4915, Spearman p: 1.0907e-37, Pearson r: 0.5069, Pearson p: 2.3234e-40
