[I 2026-04-27 19:39:36,551] Trial 59 finished with value: 0.15008166394884137 and parameters: {'learning_rate': 0.0002546124683961391, 'batch_size': 4, 'num_epochs': 17, 'weight_decay': 1.1082054093727136e-05, 'layers_PRS': 5, 'layers_SCZ15': 5, 'layers_ADHD9': 4, 'layers_ASD9': 3, 'layers_ACE15': 1, 'layers_ACE18': 4, 'layers_SUD18': 7, 'layers_SES': 4, 'layers_SEX': 4, 'dropout': 0.19410910252309405, 'se_reduction': 4, 'hidden_dim_min': 7, 'base_loss': 'huber', 'huber_delta': 0.1309911716599871, 'focal_gamma': 1.7831077578572927, 'n_bins': 11, 'scheduler_patience': 5, 'scheduler_factor': 0.47836219831388854, 'early_stopping_patience': 5}. Best is trial 31 with value: 0.14835994978477499.
Train: 2407 rows (1613 IDs),Test: 598 rows (404 IDs) 

n_features_x : 6, n_features_per_modality: [16, 23, 19, 17, 7, 4, 4, 4, 1, 4]

--- ImbalancedRegressionLoss initialized ---
  Bins: 10, Focal gamma: 1.9112118948512127, Base loss: mse
  Bin [0.00, 0.10): count=  585, weight=0.037
  Bin [0.10, 0.20): count=  580, weight=0.038
  Bin [0.20, 0.30): count=  421, weight=0.052
  Bin [0.30, 0.40): count=  385, weight=0.057
  Bin [0.40, 0.50): count=  191, weight=0.114
  Bin [0.50, 0.60): count=  129, weight=0.168
  Bin [0.60, 0.70): count=   74, weight=0.292
  Bin [0.70, 0.80): count=   33, weight=0.644
  Bin [0.80, 0.90): count=    6, weight=3.127
  Bin [0.90, 1.00): count=    3, weight=5.472
-------------------------------------------

  Pred range: [0.1424, 0.6235], std: 0.0840
  RMSE : 0.1635, R2: 0.1075, MAE: 0.1365, Spearman rho: 0.4492, Spearman p: 4.8313e-31, Pearson r: 0.4664, Pearson p: 1.2642e-33
  Pred range: [0.1417, 0.6007], std: 0.0795
  RMSE : 0.1612, R2: 0.1328, MAE: 0.1353, Spearman rho: 0.4677, Spearman p: 7.8443e-34, Pearson r: 0.4949, Pearson p: 2.9275e-38
  Pred range: [0.0031, 0.5777], std: 0.0822
  RMSE : 0.1518, R2: 0.2311, MAE: 0.1229, Spearman rho: 0.4782, Spearman p: 1.6906e-35, Pearson r: 0.5006, Pearson p: 2.9891e-39
  Pred range: [0.0214, 0.6165], std: 0.0881
  RMSE : 0.1599, R2: 0.1464, MAE: 0.1334, Spearman rho: 0.4847, Spearman p: 1.4548e-36, Pearson r: 0.5030, Pearson p: 1.1264e-39
  Pred range: [0.0633, 0.5963], std: 0.0861
  RMSE : 0.1528, R2: 0.2203, MAE: 0.1250, Spearman rho: 0.4810, Spearman p: 5.8974e-36, Pearson r: 0.5061, Pearson p: 3.3194e-40
  Pred range: [-0.0002, 0.6297], std: 0.0973
  RMSE : 0.1537, R2: 0.2110, MAE: 0.1256, Spearman rho: 0.4866, Spearman p: 7.0870e-37, Pearson r: 0.5110, Pearson p: 4.3227e-41
  Pred range: [0.0088, 0.6290], std: 0.0927
  RMSE : 0.1595, R2: 0.1507, MAE: 0.1328, Spearman rho: 0.4813, Spearman p: 5.4021e-36, Pearson r: 0.5103, Pearson p: 5.7672e-41
  Pred range: [0.0520, 0.6465], std: 0.0962
  RMSE : 0.1554, R2: 0.1936, MAE: 0.1273, Spearman rho: 0.4824, Spearman p: 3.4924e-36, Pearson r: 0.5086, Pearson p: 1.1529e-40
  Pred range: [-0.0075, 0.6504], std: 0.0952
  RMSE : 0.1510, R2: 0.2386, MAE: 0.1205, Spearman rho: 0.4820, Spearman p: 4.0911e-36, Pearson r: 0.5028, Pearson p: 1.2377e-39
  Pred range: [0.0114, 0.6143], std: 0.0989
  RMSE : 0.1503, R2: 0.2458, MAE: 0.1183, Spearman rho: 0.4779, Spearman p: 1.9072e-35, Pearson r: 0.5036, Pearson p: 9.1499e-40
  Pred range: [0.0486, 0.6491], std: 0.0986
  RMSE : 0.1566, R2: 0.1810, MAE: 0.1281, Spearman rho: 0.4821, Spearman p: 3.9238e-36, Pearson r: 0.5036, Pearson p: 8.9550e-40
  Pred range: [0.0944, 0.6756], std: 0.1009
  RMSE : 0.1642, R2: 0.1005, MAE: 0.1365, Spearman rho: 0.4833, Spearman p: 2.4758e-36, Pearson r: 0.5040, Pearson p: 7.6946e-40
  Pred range: [0.0529, 0.6240], std: 0.0889
  RMSE : 0.1513, R2: 0.2358, MAE: 0.1197, Spearman rho: 0.4762, Spearman p: 3.6167e-35, Pearson r: 0.4909, Pearson p: 1.3924e-37
  Pred range: [0.0544, 0.6839], std: 0.0985
  RMSE : 0.1577, R2: 0.1700, MAE: 0.1287, Spearman rho: 0.4793, Spearman p: 1.1385e-35, Pearson r: 0.4958, Pearson p: 2.0541e-38
  Pred range: [0.0577, 0.6637], std: 0.0997
  RMSE : 0.1592, R2: 0.1536, MAE: 0.1298, Spearman rho: 0.4597, Spearman p: 1.3300e-32, Pearson r: 0.4810, Pearson p: 6.0230e-36
  Pred range: [-0.0449, 0.6996], std: 0.1006
  RMSE : 0.1570, R2: 0.1768, MAE: 0.1267, Spearman rho: 0.4660, Spearman p: 1.4163e-33, Pearson r: 0.4813, Pearson p: 5.2995e-36
[I 2026-04-27 19:42:57,696] Trial 60 finished with value: 0.1503130167577509 and parameters: {'learning_rate': 0.0008049792443317069, 'batch_size': 4, 'num_epochs': 28, 'weight_decay': 2.6441890791718705e-05, 'layers_PRS': 4, 'layers_SCZ15': 5, 'layers_ADHD9': 4, 'layers_ASD9': 4, 'layers_ACE15': 6, 'layers_ACE18': 5, 'layers_SUD18': 6, 'layers_SES': 3, 'layers_SEX': 5, 'dropout': 0.3972492751701599, 'se_reduction': 5, 'hidden_dim_min': 6, 'base_loss': 'mse', 'huber_delta': 0.14608439120363076, 'focal_gamma': 1.9112118948512127, 'n_bins': 10, 'scheduler_patience': 5, 'scheduler_factor': 0.5006320784367365, 'early_stopping_patience': 6}. Best is trial 31 with value: 0.14835994978477499.
Train: 2407 rows (1613 IDs),Test: 598 rows (404 IDs) 

n_features_x : 6, n_features_per_modality: [16, 23, 19, 17, 7, 4, 4, 4, 1, 4]

--- ImbalancedRegressionLoss initialized ---
  Bins: 12, Focal gamma: 2.594423076617887, Base loss: huber
  Bin [0.00, 0.08): count=  383, weight=0.051
  Bin [0.08, 0.17): count=  578, weight=0.034
  Bin [0.17, 0.25): count=  499, weight=0.039
  Bin [0.25, 0.33): count=  349, weight=0.055
  Bin [0.33, 0.42): count=  162, weight=0.119
  Bin [0.42, 0.50): count=  191, weight=0.101
  Bin [0.50, 0.58): count=  129, weight=0.149
  Bin [0.58, 0.67): count=   47, weight=0.404
  Bin [0.67, 0.75): count=   41, weight=0.462
  Bin [0.75, 0.83): count=   21, weight=0.882
  Bin [0.83, 0.92): count=    5, weight=3.235
  Bin [0.92, 1.00): count=    2, weight=6.469
-------------------------------------------

  Pred range: [0.0771, 0.5430], std: 0.0869
  RMSE : 0.1499, R2: 0.2503, MAE: 0.1173, Spearman rho: 0.4829, Spearman p: 2.9186e-36, Pearson r: 0.5007, Pearson p: 2.9038e-39
  Pred range: [0.0984, 0.6042], std: 0.0925
  RMSE : 0.1535, R2: 0.2135, MAE: 0.1247, Spearman rho: 0.4881, Spearman p: 3.9799e-37, Pearson r: 0.5067, Pearson p: 2.5914e-40
  Pred range: [0.0790, 0.6132], std: 0.0941
  RMSE : 0.1597, R2: 0.1484, MAE: 0.1324, Spearman rho: 0.4899, Spearman p: 2.0099e-37, Pearson r: 0.5088, Pearson p: 1.0718e-40
  Pred range: [-0.0180, 0.5617], std: 0.0897
  RMSE : 0.1512, R2: 0.2364, MAE: 0.1182, Spearman rho: 0.4749, Spearman p: 5.7572e-35, Pearson r: 0.4879, Pearson p: 4.2914e-37
  Pred range: [0.0276, 0.5850], std: 0.0948
  RMSE : 0.1505, R2: 0.2441, MAE: 0.1178, Spearman rho: 0.4760, Spearman p: 3.8182e-35, Pearson r: 0.4975, Pearson p: 1.0349e-38
  Pred range: [0.0590, 0.6561], std: 0.1056
  RMSE : 0.1542, R2: 0.2066, MAE: 0.1242, Spearman rho: 0.4784, Spearman p: 1.5528e-35, Pearson r: 0.5060, Pearson p: 3.4217e-40
  Pred range: [0.0280, 0.6733], std: 0.1001
  RMSE : 0.1545, R2: 0.2036, MAE: 0.1251, Spearman rho: 0.4787, Spearman p: 1.4006e-35, Pearson r: 0.5040, Pearson p: 7.6443e-40
  Pred range: [0.0205, 0.6500], std: 0.1026
  RMSE : 0.1510, R2: 0.2385, MAE: 0.1204, Spearman rho: 0.4864, Spearman p: 7.7125e-37, Pearson r: 0.5116, Pearson p: 3.3410e-41
[I 2026-04-27 19:44:24,681] Trial 61 finished with value: 0.1498679764707016 and parameters: {'learning_rate': 0.0013302826251505844, 'batch_size': 4, 'num_epochs': 27, 'weight_decay': 2.962974330735408e-05, 'layers_PRS': 5, 'layers_SCZ15': 4, 'layers_ADHD9': 3, 'layers_ASD9': 4, 'layers_ACE15': 4, 'layers_ACE18': 1, 'layers_SUD18': 7, 'layers_SES': 4, 'layers_SEX': 3, 'dropout': 0.16066636831988781, 'se_reduction': 4, 'hidden_dim_min': 4, 'base_loss': 'huber', 'huber_delta': 0.12378048077052527, 'focal_gamma': 2.594423076617887, 'n_bins': 12, 'scheduler_patience': 4, 'scheduler_factor': 0.4344661984570671, 'early_stopping_patience': 7}. Best is trial 31 with value: 0.14835994978477499.
Train: 2407 rows (1613 IDs),Test: 598 rows (404 IDs) 

n_features_x : 6, n_features_per_modality: [16, 23, 19, 17, 7, 4, 4, 4, 1, 4]

--- ImbalancedRegressionLoss initialized ---
  Bins: 11, Focal gamma: 1.7052988776694926, Base loss: huber
  Bin [0.00, 0.09): count=  585, weight=0.034
  Bin [0.09, 0.18): count=  580, weight=0.034
  Bin [0.18, 0.27): count=  421, weight=0.047
  Bin [0.27, 0.36): count=  312, weight=0.064
  Bin [0.36, 0.45): count=  207, weight=0.096
  Bin [0.45, 0.55): count=  108, weight=0.183
  Bin [0.55, 0.64): count=  125, weight=0.159
  Bin [0.64, 0.73): count=   41, weight=0.476
  Bin [0.73, 0.82): count=   21, weight=0.909
  Bin [0.82, 0.91): count=    4, weight=3.999
  Bin [0.91, 1.00): count=    3, weight=4.998
-------------------------------------------

  Pred range: [0.1019, 0.5847], std: 0.0838
  RMSE : 0.1517, R2: 0.2321, MAE: 0.1205, Spearman rho: 0.4828, Spearman p: 3.0498e-36, Pearson r: 0.4915, Pearson p: 1.0946e-37
  Pred range: [0.0985, 0.5802], std: 0.0847
  RMSE : 0.1522, R2: 0.2268, MAE: 0.1222, Spearman rho: 0.4920, Spearman p: 8.9659e-38, Pearson r: 0.4990, Pearson p: 5.6170e-39
  Pred range: [0.0783, 0.5870], std: 0.0859
  RMSE : 0.1495, R2: 0.2539, MAE: 0.1165, Spearman rho: 0.4857, Spearman p: 1.0062e-36, Pearson r: 0.5040, Pearson p: 7.7718e-40
  Pred range: [0.0971, 0.6624], std: 0.0987
  RMSE : 0.1557, R2: 0.1909, MAE: 0.1268, Spearman rho: 0.4955, Spearman p: 2.2669e-38, Pearson r: 0.5067, Pearson p: 2.5643e-40
  Pred range: [0.0736, 0.6259], std: 0.0939
  RMSE : 0.1507, R2: 0.2416, MAE: 0.1197, Spearman rho: 0.4907, Spearman p: 1.4736e-37, Pearson r: 0.5026, Pearson p: 1.3462e-39
  Pred range: [0.1097, 0.6500], std: 0.0951
  RMSE : 0.1589, R2: 0.1574, MAE: 0.1309, Spearman rho: 0.4876, Spearman p: 4.9372e-37, Pearson r: 0.5021, Pearson p: 1.6576e-39
  Pred range: [0.0915, 0.6003], std: 0.0937
  RMSE : 0.1527, R2: 0.2214, MAE: 0.1228, Spearman rho: 0.4858, Spearman p: 9.6597e-37, Pearson r: 0.4969, Pearson p: 1.3107e-38
  Pred range: [0.1010, 0.6336], std: 0.0969
  RMSE : 0.1557, R2: 0.1908, MAE: 0.1272, Spearman rho: 0.4884, Spearman p: 3.5372e-37, Pearson r: 0.5055, Pearson p: 4.1646e-40
  Pred range: [0.0682, 0.6055], std: 0.0935
  RMSE : 0.1506, R2: 0.2431, MAE: 0.1185, Spearman rho: 0.4860, Spearman p: 9.1053e-37, Pearson r: 0.4997, Pearson p: 4.3476e-39
[I 2026-04-27 19:46:00,664] Trial 62 finished with value: 0.14950842152952024 and parameters: {'learning_rate': 0.0005023159450191331, 'batch_size': 4, 'num_epochs': 26, 'weight_decay': 1.3545439382944316e-05, 'layers_PRS': 2, 'layers_SCZ15': 3, 'layers_ADHD9': 2, 'layers_ASD9': 4, 'layers_ACE15': 5, 'layers_ACE18': 7, 'layers_SUD18': 7, 'layers_SES': 4, 'layers_SEX': 3, 'dropout': 0.17912359290800803, 'se_reduction': 4, 'hidden_dim_min': 5, 'base_loss': 'huber', 'huber_delta': 0.11013003508921118, 'focal_gamma': 1.7052988776694926, 'n_bins': 11, 'scheduler_patience': 5, 'scheduler_factor': 0.41257612894426554, 'early_stopping_patience': 6}. Best is trial 31 with value: 0.14835994978477499.
Train: 2407 rows (1613 IDs),Test: 598 rows (404 IDs) 

n_features_x : 6, n_features_per_modality: [16, 23, 19, 17, 7, 4, 4, 4, 1, 4]

--- ImbalancedRegressionLoss initialized ---
  Bins: 10, Focal gamma: 1.7259463020845687, Base loss: huber
  Bin [0.00, 0.10): count=  585, weight=0.037
  Bin [0.10, 0.20): count=  580, weight=0.038
  Bin [0.20, 0.30): count=  421, weight=0.052
  Bin [0.30, 0.40): count=  385, weight=0.057
  Bin [0.40, 0.50): count=  191, weight=0.114
  Bin [0.50, 0.60): count=  129, weight=0.168
  Bin [0.60, 0.70): count=   74, weight=0.292
  Bin [0.70, 0.80): count=   33, weight=0.644
  Bin [0.80, 0.90): count=    6, weight=3.127
  Bin [0.90, 1.00): count=    3, weight=5.472
-------------------------------------------

  Pred range: [0.0828, 0.5872], std: 0.0930
  RMSE : 0.1546, R2: 0.2021, MAE: 0.1243, Spearman rho: 0.4825, Spearman p: 3.4383e-36, Pearson r: 0.4936, Pearson p: 4.7510e-38
  Pred range: [0.0877, 0.5976], std: 0.0925
  RMSE : 0.1502, R2: 0.2468, MAE: 0.1199, Spearman rho: 0.5095, Spearman p: 8.0715e-41, Pearson r: 0.5189, Pearson p: 1.5807e-42
  Pred range: [0.1101, 0.6937], std: 0.1088
  RMSE : 0.1688, R2: 0.0489, MAE: 0.1397, Spearman rho: 0.5022, Spearman p: 1.5952e-39, Pearson r: 0.5183, Pearson p: 2.0823e-42
  Pred range: [0.1006, 0.6623], std: 0.1061
  RMSE : 0.1593, R2: 0.1528, MAE: 0.1302, Spearman rho: 0.4973, Spearman p: 1.0985e-38, Pearson r: 0.5171, Pearson p: 3.3855e-42
  Pred range: [0.0910, 0.6629], std: 0.1074
  RMSE : 0.1555, R2: 0.1928, MAE: 0.1266, Spearman rho: 0.5042, Spearman p: 7.0264e-40, Pearson r: 0.5244, Pearson p: 1.4854e-43
  Pred range: [0.1028, 0.6379], std: 0.1046
  RMSE : 0.1571, R2: 0.1760, MAE: 0.1283, Spearman rho: 0.5036, Spearman p: 8.9875e-40, Pearson r: 0.5213, Pearson p: 5.7453e-43
  Pred range: [0.0974, 0.7077], std: 0.1156
  RMSE : 0.1653, R2: 0.0879, MAE: 0.1357, Spearman rho: 0.5053, Spearman p: 4.5097e-40, Pearson r: 0.5309, Pearson p: 8.4078e-45
  Pred range: [0.0953, 0.6593], std: 0.1026
  RMSE : 0.1550, R2: 0.1980, MAE: 0.1265, Spearman rho: 0.5036, Spearman p: 8.9442e-40, Pearson r: 0.5256, Pearson p: 8.6881e-44
[I 2026-04-27 19:47:40,717] Trial 63 finished with value: 0.1502180533685595 and parameters: {'learning_rate': 0.0006365072342337623, 'batch_size': 4, 'num_epochs': 26, 'weight_decay': 1.341252964808763e-05, 'layers_PRS': 6, 'layers_SCZ15': 5, 'layers_ADHD9': 3, 'layers_ASD9': 4, 'layers_ACE15': 5, 'layers_ACE18': 4, 'layers_SUD18': 7, 'layers_SES': 4, 'layers_SEX': 3, 'dropout': 0.22337861455149058, 'se_reduction': 4, 'hidden_dim_min': 5, 'base_loss': 'huber', 'huber_delta': 0.10866731464216388, 'focal_gamma': 1.7259463020845687, 'n_bins': 10, 'scheduler_patience': 5, 'scheduler_factor': 0.4020252525735439, 'early_stopping_patience': 6}. Best is trial 31 with value: 0.14835994978477499.
Train: 2407 rows (1613 IDs),Test: 598 rows (404 IDs) 

n_features_x : 6, n_features_per_modality: [16, 23, 19, 17, 7, 4, 4, 4, 1, 4]

--- ImbalancedRegressionLoss initialized ---
  Bins: 10, Focal gamma: 2.099718577826932, Base loss: huber
  Bin [0.00, 0.10): count=  585, weight=0.037
  Bin [0.10, 0.20): count=  580, weight=0.038
  Bin [0.20, 0.30): count=  421, weight=0.052
  Bin [0.30, 0.40): count=  385, weight=0.057
  Bin [0.40, 0.50): count=  191, weight=0.114
  Bin [0.50, 0.60): count=  129, weight=0.168
  Bin [0.60, 0.70): count=   74, weight=0.292
  Bin [0.70, 0.80): count=   33, weight=0.644
  Bin [0.80, 0.90): count=    6, weight=3.127
  Bin [0.90, 1.00): count=    3, weight=5.472
-------------------------------------------

  Pred range: [0.0194, 0.5156], std: 0.0814
  RMSE : 0.1537, R2: 0.2117, MAE: 0.1172, Spearman rho: 0.4591, Spearman p: 1.6580e-32, Pearson r: 0.4647, Pearson p: 2.2492e-33
  Pred range: [0.0786, 0.6568], std: 0.0955
  RMSE : 0.1679, R2: 0.0593, MAE: 0.1401, Spearman rho: 0.4828, Spearman p: 3.0532e-36, Pearson r: 0.4893, Pearson p: 2.5286e-37
  Pred range: [0.0437, 0.6744], std: 0.0993
  RMSE : 0.1578, R2: 0.1683, MAE: 0.1288, Spearman rho: 0.4812, Spearman p: 5.5113e-36, Pearson r: 0.4979, Pearson p: 8.7873e-39
  Pred range: [0.0463, 0.5498], std: 0.0805
  RMSE : 0.1510, R2: 0.2385, MAE: 0.1181, Spearman rho: 0.4692, Spearman p: 4.4925e-34, Pearson r: 0.4890, Pearson p: 2.8119e-37
  Pred range: [0.0420, 0.5906], std: 0.0916
  RMSE : 0.1510, R2: 0.2387, MAE: 0.1206, Spearman rho: 0.4904, Spearman p: 1.6664e-37, Pearson r: 0.5044, Pearson p: 6.5345e-40
  Pred range: [0.0423, 0.6584], std: 0.0953
  RMSE : 0.1585, R2: 0.1610, MAE: 0.1304, Spearman rho: 0.4791, Spearman p: 1.2090e-35, Pearson r: 0.4983, Pearson p: 7.3588e-39
  Pred range: [0.0031, 0.6198], std: 0.0918
  RMSE : 0.1524, R2: 0.2250, MAE: 0.1224, Spearman rho: 0.4803, Spearman p: 7.7196e-36, Pearson r: 0.4995, Pearson p: 4.5784e-39
  Pred range: [0.0185, 0.7228], std: 0.1056
  RMSE : 0.1567, R2: 0.1801, MAE: 0.1272, Spearman rho: 0.4878, Spearman p: 4.5436e-37, Pearson r: 0.5024, Pearson p: 1.4567e-39
  Pred range: [0.0012, 0.6343], std: 0.0948
  RMSE : 0.1509, R2: 0.2400, MAE: 0.1195, Spearman rho: 0.4882, Spearman p: 3.9198e-37, Pearson r: 0.5014, Pearson p: 2.1513e-39
  Pred range: [-0.0213, 0.6490], std: 0.0968
  RMSE : 0.1513, R2: 0.2359, MAE: 0.1191, Spearman rho: 0.4734, Spearman p: 9.8621e-35, Pearson r: 0.4940, Pearson p: 4.1411e-38
  Pred range: [-0.0242, 0.6230], std: 0.0946
  RMSE : 0.1537, R2: 0.2116, MAE: 0.1231, Spearman rho: 0.4846, Spearman p: 1.5520e-36, Pearson r: 0.4965, Pearson p: 1.5125e-38
  Pred range: [-0.0523, 0.6510], std: 0.0981
  RMSE : 0.1507, R2: 0.2416, MAE: 0.1171, Spearman rho: 0.4770, Spearman p: 2.5980e-35, Pearson r: 0.4969, Pearson p: 1.2972e-38
  Pred range: [-0.0330, 0.6759], std: 0.1022
  RMSE : 0.1512, R2: 0.2369, MAE: 0.1184, Spearman rho: 0.4797, Spearman p: 9.6744e-36, Pearson r: 0.4994, Pearson p: 4.9213e-39
  Pred range: [-0.0019, 0.6178], std: 0.0919
  RMSE : 0.1514, R2: 0.2353, MAE: 0.1196, Spearman rho: 0.4759, Spearman p: 4.0311e-35, Pearson r: 0.4950, Pearson p: 2.8078e-38
  Pred range: [0.0158, 0.6801], std: 0.1070
  RMSE : 0.1522, R2: 0.2271, MAE: 0.1203, Spearman rho: 0.4874, Spearman p: 5.1694e-37, Pearson r: 0.5048, Pearson p: 5.5157e-40
  Pred range: [-0.0166, 0.6862], std: 0.1023
  RMSE : 0.1520, R2: 0.2289, MAE: 0.1202, Spearman rho: 0.4840, Spearman p: 1.9113e-36, Pearson r: 0.4999, Pearson p: 3.9981e-39
  Pred range: [0.0109, 0.7692], std: 0.1112
  RMSE : 0.1580, R2: 0.1663, MAE: 0.1268, Spearman rho: 0.4809, Spearman p: 6.1222e-36, Pearson r: 0.4995, Pearson p: 4.6310e-39
[I 2026-04-27 19:50:49,483] Trial 64 finished with value: 0.150737405984354 and parameters: {'learning_rate': 0.0005450341887013602, 'batch_size': 4, 'num_epochs': 29, 'weight_decay': 1.5877756558124255e-05, 'layers_PRS': 4, 'layers_SCZ15': 4, 'layers_ADHD9': 5, 'layers_ASD9': 3, 'layers_ACE15': 5, 'layers_ACE18': 3, 'layers_SUD18': 6, 'layers_SES': 4, 'layers_SEX': 4, 'dropout': 0.18087764828852992, 'se_reduction': 5, 'hidden_dim_min': 5, 'base_loss': 'huber', 'huber_delta': 0.10060998891380228, 'focal_gamma': 2.099718577826932, 'n_bins': 10, 'scheduler_patience': 5, 'scheduler_factor': 0.5477419610443586, 'early_stopping_patience': 5}. Best is trial 31 with value: 0.14835994978477499.
Train: 2407 rows (1613 IDs),Test: 598 rows (404 IDs) 

n_features_x : 6, n_features_per_modality: [16, 23, 19, 17, 7, 4, 4, 4, 1, 4]

--- ImbalancedRegressionLoss initialized ---
  Bins: 11, Focal gamma: 1.312763067094804, Base loss: huber
  Bin [0.00, 0.09): count=  585, weight=0.034
  Bin [0.09, 0.18): count=  580, weight=0.034
  Bin [0.18, 0.27): count=  421, weight=0.047
  Bin [0.27, 0.36): count=  312, weight=0.064
  Bin [0.36, 0.45): count=  207, weight=0.096
  Bin [0.45, 0.55): count=  108, weight=0.183
  Bin [0.55, 0.64): count=  125, weight=0.159
  Bin [0.64, 0.73): count=   41, weight=0.476
  Bin [0.73, 0.82): count=   21, weight=0.909
  Bin [0.82, 0.91): count=    4, weight=3.999
  Bin [0.91, 1.00): count=    3, weight=4.998
-------------------------------------------

  Pred range: [0.1266, 0.6576], std: 0.0955
  RMSE : 0.1645, R2: 0.0969, MAE: 0.1364, Spearman rho: 0.4734, Spearman p: 9.9481e-35, Pearson r: 0.4919, Pearson p: 9.4231e-38
  Pred range: [0.1184, 0.6204], std: 0.0858
  RMSE : 0.1541, R2: 0.2070, MAE: 0.1264, Spearman rho: 0.4877, Spearman p: 4.6162e-37, Pearson r: 0.5163, Pearson p: 4.7196e-42
  Pred range: [0.1313, 0.6719], std: 0.0977
  RMSE : 0.1641, R2: 0.1013, MAE: 0.1373, Spearman rho: 0.5038, Spearman p: 8.1513e-40, Pearson r: 0.5234, Pearson p: 2.2981e-43
  Pred range: [0.0821, 0.6549], std: 0.1004
  RMSE : 0.1494, R2: 0.2553, MAE: 0.1187, Spearman rho: 0.5015, Spearman p: 2.1063e-39, Pearson r: 0.5203, Pearson p: 8.6881e-43
  Pred range: [0.0934, 0.6647], std: 0.0994
  RMSE : 0.1514, R2: 0.2349, MAE: 0.1218, Spearman rho: 0.4983, Spearman p: 7.3788e-39, Pearson r: 0.5190, Pearson p: 1.4882e-42
  Pred range: [0.0792, 0.6437], std: 0.0956
  RMSE : 0.1522, R2: 0.2271, MAE: 0.1231, Spearman rho: 0.4946, Spearman p: 3.2287e-38, Pearson r: 0.5145, Pearson p: 1.0336e-41
  Pred range: [0.1019, 0.7255], std: 0.1077
  RMSE : 0.1636, R2: 0.1069, MAE: 0.1352, Spearman rho: 0.4924, Spearman p: 7.6966e-38, Pearson r: 0.5116, Pearson p: 3.3575e-41
  Pred range: [0.0529, 0.6145], std: 0.0980
  RMSE : 0.1487, R2: 0.2619, MAE: 0.1161, Spearman rho: 0.4955, Spearman p: 2.2322e-38, Pearson r: 0.5145, Pearson p: 1.0210e-41
  Pred range: [0.0933, 0.5867], std: 0.0877
  RMSE : 0.1496, R2: 0.2525, MAE: 0.1190, Spearman rho: 0.4892, Spearman p: 2.6304e-37, Pearson r: 0.5104, Pearson p: 5.6890e-41
  Pred range: [0.0681, 0.6762], std: 0.0995
  RMSE : 0.1513, R2: 0.2356, MAE: 0.1210, Spearman rho: 0.4899, Spearman p: 2.0263e-37, Pearson r: 0.5113, Pearson p: 3.7804e-41
  Pred range: [0.0620, 0.6576], std: 0.0974
  RMSE : 0.1508, R2: 0.2410, MAE: 0.1194, Spearman rho: 0.4863, Spearman p: 8.1061e-37, Pearson r: 0.5040, Pearson p: 7.5921e-40
  Pred range: [0.0768, 0.7249], std: 0.1067
  RMSE : 0.1586, R2: 0.1608, MAE: 0.1289, Spearman rho: 0.4849, Spearman p: 1.3597e-36, Pearson r: 0.5071, Pearson p: 2.1218e-40
  Pred range: [0.0779, 0.7122], std: 0.1075
  RMSE : 0.1548, R2: 0.2002, MAE: 0.1240, Spearman rho: 0.4851, Spearman p: 1.2747e-36, Pearson r: 0.5043, Pearson p: 6.8458e-40
  Pred range: [0.0674, 0.8086], std: 0.1200
  RMSE : 0.1653, R2: 0.0879, MAE: 0.1343, Spearman rho: 0.4865, Spearman p: 7.4220e-37, Pearson r: 0.5056, Pearson p: 3.9679e-40
