[I 2026-04-29 00:33:49,682] Trial 25 pruned. 
Train: 2407 rows (1613 IDs),Test: 598 rows (404 IDs) 

n_features_x : 6, n_features_per_modality: [16, 23, 19, 17, 7, 4, 4, 4, 1, 4]

--- ImbalancedRegressionLoss initialized ---
  Bins: 20, Focal gamma: 1.6284531819501606, Base loss: huber
  Bin [0.00, 0.05): count=  650, weight=0.004
  Bin [0.05, 0.10): count=  360, weight=0.007
  Bin [0.10, 0.15): count=  360, weight=0.007
  Bin [0.15, 0.20): count=  506, weight=0.005
  Bin [0.20, 0.25): count=  237, weight=0.011
  Bin [0.25, 0.30): count=  149, weight=0.017
  Bin [0.30, 0.35): count=   91, weight=0.028
  Bin [0.35, 0.40): count=   20, weight=0.125
  Bin [0.40, 0.45): count=   13, weight=0.187
  Bin [0.45, 0.50): count=   10, weight=0.238
  Bin [0.50, 0.55): count=    6, weight=0.374
  Bin [0.55, 0.60): count=    3, weight=0.655
  Bin [0.60, 0.65): count=    1, weight=1.310
  Bin [0.65, 0.70): count=    1, weight=1.310
  Bin [0.70, 0.75): count=    0, weight=2.620
  Bin [0.75, 0.80): count=    0, weight=2.620
  Bin [0.80, 0.85): count=    0, weight=2.620
  Bin [0.85, 0.90): count=    0, weight=2.620
  Bin [0.90, 0.95): count=    0, weight=2.620
  Bin [0.95, 1.00): count=    0, weight=2.620
-------------------------------------------

  Pred range: [0.0326, 0.4199], std: 0.0660
  RMSE : 0.0943, R2: 0.1219, MAE: 0.0749, Spearman rho: 0.4432, Spearman p: 3.6403e-30, Pearson r: 0.4355, Pearson p: 4.4866e-29
  Pred range: [0.0299, 0.4315], std: 0.0643
  RMSE : 0.0917, R2: 0.1686, MAE: 0.0724, Spearman rho: 0.4507, Spearman p: 2.9225e-31, Pearson r: 0.4524, Pearson p: 1.6854e-31
  Pred range: [0.0481, 0.4218], std: 0.0626
  RMSE : 0.0926, R2: 0.1531, MAE: 0.0734, Spearman rho: 0.4677, Spearman p: 7.8467e-34, Pearson r: 0.4625, Pearson p: 5.0448e-33
  Pred range: [0.1071, 0.3956], std: 0.0541
  RMSE : 0.1100, R2: -0.1968, MAE: 0.0921, Spearman rho: 0.4657, Spearman p: 1.6008e-33, Pearson r: 0.4722, Pearson p: 1.5174e-34
  Pred range: [-0.0347, 0.3008], std: 0.0459
  RMSE : 0.0911, R2: 0.1804, MAE: 0.0731, Spearman rho: 0.4287, Spearman p: 3.9478e-28, Pearson r: 0.4265, Pearson p: 7.8894e-28
  Pred range: [0.0093, 0.4340], std: 0.0607
  RMSE : 0.0908, R2: 0.1857, MAE: 0.0712, Spearman rho: 0.4631, Spearman p: 3.9814e-33, Pearson r: 0.4564, Pearson p: 4.2431e-32
  Pred range: [0.0400, 0.4637], std: 0.0625
  RMSE : 0.0928, R2: 0.1490, MAE: 0.0727, Spearman rho: 0.4645, Spearman p: 2.4794e-33, Pearson r: 0.4518, Pearson p: 2.0567e-31
  Pred range: [0.0603, 0.4649], std: 0.0554
  RMSE : 0.0904, R2: 0.1920, MAE: 0.0721, Spearman rho: 0.4755, Spearman p: 4.5723e-35, Pearson r: 0.4679, Pearson p: 7.2262e-34
  Pred range: [0.0635, 0.4428], std: 0.0577
  RMSE : 0.0995, R2: 0.0216, MAE: 0.0812, Spearman rho: 0.4615, Spearman p: 7.2147e-33, Pearson r: 0.4400, Pearson p: 1.0350e-29
  Pred range: [0.0724, 0.3012], std: 0.0381
  RMSE : 0.0895, R2: 0.2090, MAE: 0.0714, Spearman rho: 0.4754, Spearman p: 4.8357e-35, Pearson r: 0.4664, Pearson p: 1.2642e-33
  Pred range: [0.0511, 0.5112], std: 0.0754
  RMSE : 0.1018, R2: -0.0234, MAE: 0.0812, Spearman rho: 0.4721, Spearman p: 1.6037e-34, Pearson r: 0.4719, Pearson p: 1.6930e-34
  Pred range: [0.0058, 0.3005], std: 0.0490
  RMSE : 0.0891, R2: 0.2149, MAE: 0.0708, Spearman rho: 0.4642, Spearman p: 2.7331e-33, Pearson r: 0.4657, Pearson p: 1.6311e-33
  Pred range: [0.0595, 0.3956], std: 0.0521
  RMSE : 0.0939, R2: 0.1279, MAE: 0.0760, Spearman rho: 0.4709, Spearman p: 2.4272e-34, Pearson r: 0.4710, Pearson p: 2.4189e-34
  Pred range: [0.0123, 0.3200], std: 0.0427
  RMSE : 0.0933, R2: 0.1396, MAE: 0.0725, Spearman rho: 0.4496, Spearman p: 4.2563e-31, Pearson r: 0.4432, Pearson p: 3.6180e-30
  Pred range: [0.0451, 0.3783], std: 0.0545
  RMSE : 0.0906, R2: 0.1896, MAE: 0.0729, Spearman rho: 0.4602, Spearman p: 1.1141e-32, Pearson r: 0.4666, Pearson p: 1.1518e-33
  Pred range: [0.0329, 0.4450], std: 0.0619
  RMSE : 0.0955, R2: 0.0996, MAE: 0.0771, Spearman rho: 0.4760, Spearman p: 3.8464e-35, Pearson r: 0.4742, Pearson p: 7.3951e-35
  Pred range: [0.0150, 0.3863], std: 0.0533
  RMSE : 0.0921, R2: 0.1615, MAE: 0.0747, Spearman rho: 0.4726, Spearman p: 1.3418e-34, Pearson r: 0.4736, Pearson p: 9.0702e-35
  Pred range: [0.0342, 0.3640], std: 0.0543
  RMSE : 0.0891, R2: 0.2156, MAE: 0.0704, Spearman rho: 0.4592, Spearman p: 1.5810e-32, Pearson r: 0.4696, Pearson p: 3.8858e-34
  Pred range: [0.0641, 0.4096], std: 0.0572
  RMSE : 0.0963, R2: 0.0835, MAE: 0.0780, Spearman rho: 0.4582, Spearman p: 2.2837e-32, Pearson r: 0.4623, Pearson p: 5.3199e-33
  Pred range: [-0.0234, 0.3519], std: 0.0532
  RMSE : 0.0892, R2: 0.2144, MAE: 0.0702, Spearman rho: 0.4738, Spearman p: 8.5327e-35, Pearson r: 0.4672, Pearson p: 9.5111e-34
  Pred range: [0.0653, 0.3759], std: 0.0513
  RMSE : 0.0979, R2: 0.0535, MAE: 0.0803, Spearman rho: 0.4586, Spearman p: 1.9721e-32, Pearson r: 0.4684, Pearson p: 6.0955e-34
  Pred range: [-0.0187, 0.3654], std: 0.0591
  RMSE : 0.0907, R2: 0.1877, MAE: 0.0718, Spearman rho: 0.4536, Spearman p: 1.1160e-31, Pearson r: 0.4540, Pearson p: 9.5654e-32
[I 2026-04-29 00:37:06,079] Trial 26 finished with value: 0.08909424395944442 and parameters: {'learning_rate': 0.003797917225726028, 'batch_size': 4, 'num_epochs': 22, 'weight_decay': 2.4969605839179857e-05, 'layers_PRS': 3, 'layers_SCZ15': 3, 'layers_ADHD9': 2, 'layers_ASD9': 5, 'layers_ACE15': 3, 'layers_ACE18': 1, 'layers_SUD18': 4, 'layers_SES': 4, 'layers_SEX': 3, 'dropout': 0.24542763960362035, 'se_reduction': 4, 'hidden_dim_min': 12, 'base_loss': 'huber', 'huber_delta': 0.02871105856202978, 'focal_gamma': 1.6284531819501606, 'n_bins': 20, 'scheduler_patience': 3, 'scheduler_factor': 0.46711925686489203, 'early_stopping_patience': 7}. Best is trial 24 with value: 0.08843051078225092.
Train: 2407 rows (1613 IDs),Test: 598 rows (404 IDs) 

n_features_x : 6, n_features_per_modality: [16, 23, 19, 17, 7, 4, 4, 4, 1, 4]

--- ImbalancedRegressionLoss initialized ---
  Bins: 17, Focal gamma: 0.6676735828944835, Base loss: huber
  Bin [0.00, 0.06): count=  650, weight=0.004
  Bin [0.06, 0.12): count=  530, weight=0.005
  Bin [0.12, 0.18): count=  536, weight=0.005
  Bin [0.18, 0.24): count=  299, weight=0.009
  Bin [0.24, 0.29): count=  247, weight=0.011
  Bin [0.29, 0.35): count=   91, weight=0.029
  Bin [0.35, 0.41): count=   20, weight=0.127
  Bin [0.41, 0.47): count=   16, weight=0.157
  Bin [0.47, 0.53): count=   10, weight=0.243
  Bin [0.53, 0.59): count=    6, weight=0.382
  Bin [0.59, 0.65): count=    1, weight=1.336
  Bin [0.65, 0.71): count=    1, weight=1.336
  Bin [0.71, 0.76): count=    0, weight=2.671
  Bin [0.76, 0.82): count=    0, weight=2.671
  Bin [0.82, 0.88): count=    0, weight=2.671
  Bin [0.88, 0.94): count=    0, weight=2.671
  Bin [0.94, 1.00): count=    0, weight=2.671
-------------------------------------------

  Pred range: [0.0686, 0.3870], std: 0.0538
  RMSE : 0.1128, R2: -0.2576, MAE: 0.0931, Spearman rho: 0.3343, Spearman p: 4.4244e-17, Pearson r: 0.3633, Pearson p: 4.3109e-20
  Pred range: [0.0740, 0.3947], std: 0.0537
  RMSE : 0.1137, R2: -0.2785, MAE: 0.0943, Spearman rho: 0.3673, Spearman p: 1.5268e-20, Pearson r: 0.3929, Pearson p: 1.6287e-23
  Pred range: [0.0773, 0.4084], std: 0.0543
  RMSE : 0.1155, R2: -0.3175, MAE: 0.0962, Spearman rho: 0.3862, Spearman p: 1.0460e-22, Pearson r: 0.4103, Pearson p: 1.0957e-25
  Pred range: [0.0797, 0.4184], std: 0.0551
  RMSE : 0.1169, R2: -0.3511, MAE: 0.0978, Spearman rho: 0.4007, Spearman p: 1.7813e-24, Pearson r: 0.4218, Pearson p: 3.4262e-27
  Pred range: [0.0791, 0.4179], std: 0.0550
  RMSE : 0.1157, R2: -0.3232, MAE: 0.0967, Spearman rho: 0.4064, Spearman p: 3.4245e-25, Pearson r: 0.4260, Pearson p: 9.2364e-28
  Pred range: [0.0795, 0.4208], std: 0.0551
  RMSE : 0.1156, R2: -0.3206, MAE: 0.0966, Spearman rho: 0.4108, Spearman p: 9.4110e-26, Pearson r: 0.4285, Pearson p: 4.2026e-28
[I 2026-04-29 00:37:12,694] Trial 27 pruned. 
Train: 2407 rows (1613 IDs),Test: 598 rows (404 IDs) 

n_features_x : 6, n_features_per_modality: [16, 23, 19, 17, 7, 4, 4, 4, 1, 4]

--- ImbalancedRegressionLoss initialized ---
  Bins: 14, Focal gamma: 0.8438819788792014, Base loss: huber
  Bin [0.00, 0.07): count=  828, weight=0.003
  Bin [0.07, 0.14): count=  542, weight=0.005
  Bin [0.14, 0.21): count=  506, weight=0.005
  Bin [0.21, 0.29): count=  386, weight=0.007
  Bin [0.29, 0.36): count=   91, weight=0.029
  Bin [0.36, 0.43): count=   29, weight=0.090
  Bin [0.43, 0.50): count=   12, weight=0.207
  Bin [0.50, 0.57): count=   11, weight=0.224
  Bin [0.57, 0.64): count=    1, weight=1.343
  Bin [0.64, 0.71): count=    1, weight=1.343
  Bin [0.71, 0.79): count=    0, weight=2.686
  Bin [0.79, 0.86): count=    0, weight=2.686
  Bin [0.86, 0.93): count=    0, weight=2.686
  Bin [0.93, 1.00): count=    0, weight=2.686
-------------------------------------------

  Pred range: [0.0340, 0.4126], std: 0.0569
  RMSE : 0.0946, R2: 0.1153, MAE: 0.0764, Spearman rho: 0.4398, Spearman p: 1.1279e-29, Pearson r: 0.4419, Pearson p: 5.5661e-30
  Pred range: [0.0295, 0.4095], std: 0.0571
  RMSE : 0.0976, R2: 0.0585, MAE: 0.0802, Spearman rho: 0.4743, Spearman p: 7.1455e-35, Pearson r: 0.4758, Pearson p: 4.1263e-35
  Pred range: [0.0259, 0.4530], std: 0.0628
  RMSE : 0.1023, R2: -0.0336, MAE: 0.0840, Spearman rho: 0.4675, Spearman p: 8.3542e-34, Pearson r: 0.4677, Pearson p: 7.7473e-34
  Pred range: [-0.0388, 0.3645], std: 0.0581
  RMSE : 0.0896, R2: 0.2064, MAE: 0.0715, Spearman rho: 0.4710, Spearman p: 2.4172e-34, Pearson r: 0.4776, Pearson p: 2.1025e-35
  Pred range: [0.0221, 0.4120], std: 0.0594
  RMSE : 0.0917, R2: 0.1695, MAE: 0.0733, Spearman rho: 0.4625, Spearman p: 4.9269e-33, Pearson r: 0.4699, Pearson p: 3.5177e-34
  Pred range: [0.0131, 0.4662], std: 0.0665
  RMSE : 0.0973, R2: 0.0640, MAE: 0.0784, Spearman rho: 0.4689, Spearman p: 5.0605e-34, Pearson r: 0.4765, Pearson p: 3.2301e-35
  Pred range: [-0.0136, 0.4260], std: 0.0642
  RMSE : 0.0950, R2: 0.1084, MAE: 0.0765, Spearman rho: 0.4689, Spearman p: 5.0071e-34, Pearson r: 0.4761, Pearson p: 3.7101e-35
  Pred range: [-0.0041, 0.4547], std: 0.0647
  RMSE : 0.0951, R2: 0.1054, MAE: 0.0762, Spearman rho: 0.4548, Spearman p: 7.1744e-32, Pearson r: 0.4618, Pearson p: 6.3506e-33
  Pred range: [-0.0023, 0.4167], std: 0.0633
  RMSE : 0.0952, R2: 0.1051, MAE: 0.0767, Spearman rho: 0.4588, Spearman p: 1.8412e-32, Pearson r: 0.4707, Pearson p: 2.6936e-34
  Pred range: [0.0110, 0.4404], std: 0.0664
  RMSE : 0.1002, R2: 0.0076, MAE: 0.0814, Spearman rho: 0.4626, Spearman p: 4.8319e-33, Pearson r: 0.4739, Pearson p: 8.4252e-35
  Pred range: [-0.0112, 0.4041], std: 0.0609
  RMSE : 0.0939, R2: 0.1295, MAE: 0.0760, Spearman rho: 0.4635, Spearman p: 3.5520e-33, Pearson r: 0.4764, Pearson p: 3.3424e-35
[I 2026-04-29 00:38:02,452] Trial 28 finished with value: 0.08961453950062712 and parameters: {'learning_rate': 0.0006085507732147695, 'batch_size': 8, 'num_epochs': 19, 'weight_decay': 6.3290116827269e-05, 'layers_PRS': 2, 'layers_SCZ15': 4, 'layers_ADHD9': 3, 'layers_ASD9': 3, 'layers_ACE15': 3, 'layers_ACE18': 2, 'layers_SUD18': 3, 'layers_SES': 3, 'layers_SEX': 3, 'dropout': 0.3477100715723086, 'se_reduction': 2, 'hidden_dim_min': 14, 'base_loss': 'huber', 'huber_delta': 0.08296133192152118, 'focal_gamma': 0.8438819788792014, 'n_bins': 14, 'scheduler_patience': 3, 'scheduler_factor': 0.5946612373799054, 'early_stopping_patience': 7}. Best is trial 24 with value: 0.08843051078225092.
Train: 2407 rows (1613 IDs),Test: 598 rows (404 IDs) 

n_features_x : 6, n_features_per_modality: [16, 23, 19, 17, 7, 4, 4, 4, 1, 4]

--- ImbalancedRegressionLoss initialized ---
  Bins: 12, Focal gamma: 2.7575761829192675, Base loss: huber
  Bin [0.00, 0.08): count=  828, weight=0.003
  Bin [0.08, 0.17): count=  710, weight=0.004
  Bin [0.17, 0.25): count=  575, weight=0.005
  Bin [0.25, 0.33): count=  214, weight=0.013
  Bin [0.33, 0.42): count=   55, weight=0.051
  Bin [0.42, 0.50): count=   14, weight=0.191
  Bin [0.50, 0.58): count=    9, weight=0.286
  Bin [0.58, 0.67): count=    1, weight=1.431
  Bin [0.67, 0.75): count=    1, weight=1.431
  Bin [0.75, 0.83): count=    0, weight=2.862
  Bin [0.83, 0.92): count=    0, weight=2.862
  Bin [0.92, 1.00): count=    0, weight=2.862
-------------------------------------------

  Pred range: [0.0139, 0.3279], std: 0.0520
  RMSE : 0.0928, R2: 0.1495, MAE: 0.0736, Spearman rho: 0.4035, Spearman p: 7.9980e-25, Pearson r: 0.4088, Pearson p: 1.7222e-25
  Pred range: [-0.0238, 0.3630], std: 0.0535
  RMSE : 0.0899, R2: 0.2007, MAE: 0.0712, Spearman rho: 0.4495, Spearman p: 4.3781e-31, Pearson r: 0.4547, Pearson p: 7.5107e-32
  Pred range: [-0.0058, 0.3220], std: 0.0505
  RMSE : 0.0890, R2: 0.2179, MAE: 0.0705, Spearman rho: 0.4603, Spearman p: 1.0962e-32, Pearson r: 0.4683, Pearson p: 6.3096e-34
  Pred range: [0.0188, 0.3739], std: 0.0543
  RMSE : 0.0897, R2: 0.2058, MAE: 0.0712, Spearman rho: 0.4666, Spearman p: 1.1491e-33, Pearson r: 0.4715, Pearson p: 2.0106e-34
  Pred range: [0.0321, 0.3754], std: 0.0549
  RMSE : 0.0930, R2: 0.1456, MAE: 0.0745, Spearman rho: 0.4614, Spearman p: 7.4402e-33, Pearson r: 0.4661, Pearson p: 1.4061e-33
  Pred range: [0.0131, 0.3993], std: 0.0567
  RMSE : 0.0917, R2: 0.1691, MAE: 0.0734, Spearman rho: 0.4612, Spearman p: 7.8659e-33, Pearson r: 0.4714, Pearson p: 2.0518e-34
  Pred range: [-0.0162, 0.3653], std: 0.0534
  RMSE : 0.0888, R2: 0.2201, MAE: 0.0703, Spearman rho: 0.4607, Spearman p: 9.4429e-33, Pearson r: 0.4728, Pearson p: 1.2150e-34
  Pred range: [-0.0018, 0.3719], std: 0.0521
  RMSE : 0.0892, R2: 0.2145, MAE: 0.0712, Spearman rho: 0.4626, Spearman p: 4.8978e-33, Pearson r: 0.4729, Pearson p: 1.2107e-34
  Pred range: [-0.0317, 0.3789], std: 0.0530
  RMSE : 0.0888, R2: 0.2214, MAE: 0.0704, Spearman rho: 0.4640, Spearman p: 2.9116e-33, Pearson r: 0.4736, Pearson p: 9.3413e-35
  Pred range: [-0.0112, 0.3612], std: 0.0516
  RMSE : 0.0891, R2: 0.2163, MAE: 0.0711, Spearman rho: 0.4577, Spearman p: 2.6900e-32, Pearson r: 0.4693, Pearson p: 4.4204e-34
  Pred range: [0.0026, 0.3790], std: 0.0554
  RMSE : 0.0901, R2: 0.1973, MAE: 0.0719, Spearman rho: 0.4580, Spearman p: 2.3807e-32, Pearson r: 0.4675, Pearson p: 8.5518e-34
  Pred range: [0.0039, 0.3745], std: 0.0548
  RMSE : 0.0900, R2: 0.1998, MAE: 0.0718, Spearman rho: 0.4550, Spearman p: 6.7789e-32, Pearson r: 0.4658, Pearson p: 1.5371e-33
[I 2026-04-29 00:39:46,924] Trial 29 finished with value: 0.08876225805754592 and parameters: {'learning_rate': 0.00028858759792341416, 'batch_size': 4, 'num_epochs': 12, 'weight_decay': 1.2304430087708497e-05, 'layers_PRS': 3, 'layers_SCZ15': 3, 'layers_ADHD9': 2, 'layers_ASD9': 4, 'layers_ACE15': 5, 'layers_ACE18': 1, 'layers_SUD18': 3, 'layers_SES': 4, 'layers_SEX': 2, 'dropout': 0.40020697279905604, 'se_reduction': 3, 'hidden_dim_min': 9, 'base_loss': 'huber', 'huber_delta': 0.050191266853391245, 'focal_gamma': 2.7575761829192675, 'n_bins': 12, 'scheduler_patience': 2, 'scheduler_factor': 0.4526114002908439, 'early_stopping_patience': 8}. Best is trial 24 with value: 0.08843051078225092.
Train: 2407 rows (1613 IDs),Test: 598 rows (404 IDs) 

n_features_x : 6, n_features_per_modality: [16, 23, 19, 17, 7, 4, 4, 4, 1, 4]

--- ImbalancedRegressionLoss initialized ---
  Bins: 15, Focal gamma: 2.869071038822473, Base loss: huber
  Bin [0.00, 0.07): count=  828, weight=0.003
  Bin [0.07, 0.13): count=  542, weight=0.005
  Bin [0.13, 0.20): count=  506, weight=0.006
  Bin [0.20, 0.27): count=  318, weight=0.009
  Bin [0.27, 0.33): count=  133, weight=0.021
  Bin [0.33, 0.40): count=   46, weight=0.060
  Bin [0.40, 0.47): count=   16, weight=0.166
  Bin [0.47, 0.53): count=   10, weight=0.256
  Bin [0.53, 0.60): count=    6, weight=0.402
  Bin [0.60, 0.67): count=    1, weight=1.407
  Bin [0.67, 0.73): count=    1, weight=1.407
  Bin [0.73, 0.80): count=    0, weight=2.815
  Bin [0.80, 0.87): count=    0, weight=2.815
  Bin [0.87, 0.93): count=    0, weight=2.815
  Bin [0.93, 1.00): count=    0, weight=2.815
-------------------------------------------

  Pred range: [0.0190, 0.3440], std: 0.0512
  RMSE : 0.0927, R2: 0.1503, MAE: 0.0749, Spearman rho: 0.4231, Spearman p: 2.2656e-27, Pearson r: 0.4403, Pearson p: 9.4749e-30
  Pred range: [0.0288, 0.3503], std: 0.0524
  RMSE : 0.0904, R2: 0.1928, MAE: 0.0725, Spearman rho: 0.4520, Spearman p: 1.8753e-31, Pearson r: 0.4624, Pearson p: 5.0832e-33
  Pred range: [0.0470, 0.3506], std: 0.0504
  RMSE : 0.0924, R2: 0.1561, MAE: 0.0752, Spearman rho: 0.4667, Spearman p: 1.1208e-33, Pearson r: 0.4786, Pearson p: 1.4670e-35
  Pred range: [0.0576, 0.4162], std: 0.0604
  RMSE : 0.0980, R2: 0.0518, MAE: 0.0799, Spearman rho: 0.4723, Spearman p: 1.4821e-34, Pearson r: 0.4801, Pearson p: 8.2495e-36
  Pred range: [0.0516, 0.3503], std: 0.0513
  RMSE : 0.0902, R2: 0.1960, MAE: 0.0725, Spearman rho: 0.4713, Spearman p: 2.1633e-34, Pearson r: 0.4782, Pearson p: 1.7127e-35
  Pred range: [0.0442, 0.3283], std: 0.0506
  RMSE : 0.0891, R2: 0.2153, MAE: 0.0710, Spearman rho: 0.4622, Spearman p: 5.4718e-33, Pearson r: 0.4679, Pearson p: 7.1931e-34
  Pred range: [0.0434, 0.3332], std: 0.0510
  RMSE : 0.0891, R2: 0.2148, MAE: 0.0707, Spearman rho: 0.4579, Spearman p: 2.4816e-32, Pearson r: 0.4655, Pearson p: 1.7398e-33
  Pred range: [0.0513, 0.3560], std: 0.0507
  RMSE : 0.0914, R2: 0.1745, MAE: 0.0739, Spearman rho: 0.4560, Spearman p: 4.7415e-32, Pearson r: 0.4670, Pearson p: 1.0084e-33
  Pred range: [0.0535, 0.3775], std: 0.0557
  RMSE : 0.0943, R2: 0.1207, MAE: 0.0763, Spearman rho: 0.4555, Spearman p: 5.6777e-32, Pearson r: 0.4627, Pearson p: 4.5759e-33
  Pred range: [0.0551, 0.3656], std: 0.0548
  RMSE : 0.0920, R2: 0.1629, MAE: 0.0739, Spearman rho: 0.4583, Spearman p: 2.1846e-32, Pearson r: 0.4663, Pearson p: 1.2948e-33
  Pred range: [0.0440, 0.3804], std: 0.0579
  RMSE : 0.0904, R2: 0.1924, MAE: 0.0717, Spearman rho: 0.4714, Spearman p: 2.0691e-34, Pearson r: 0.4740, Pearson p: 7.9092e-35
[I 2026-04-29 00:41:19,406] Trial 30 finished with value: 0.08911413423483384 and parameters: {'learning_rate': 0.0003560919413583848, 'batch_size': 4, 'num_epochs': 11, 'weight_decay': 1.2147697989862918e-05, 'layers_PRS': 4, 'layers_SCZ15': 1, 'layers_ADHD9': 2, 'layers_ASD9': 4, 'layers_ACE15': 5, 'layers_ACE18': 1, 'layers_SUD18': 4, 'layers_SES': 4, 'layers_SEX': 2, 'dropout': 0.4109362333527242, 'se_reduction': 4, 'hidden_dim_min': 8, 'base_loss': 'huber', 'huber_delta': 0.05585529766656287, 'focal_gamma': 2.869071038822473, 'n_bins': 15, 'scheduler_patience': 4, 'scheduler_factor': 0.4497938632616637, 'early_stopping_patience': 8}. Best is trial 24 with value: 0.08843051078225092.
Train: 2407 rows (1613 IDs),Test: 598 rows (404 IDs) 

n_features_x : 6, n_features_per_modality: [16, 23, 19, 17, 7, 4, 4, 4, 1, 4]

--- ImbalancedRegressionLoss initialized ---
  Bins: 12, Focal gamma: 2.6212417781405595, Base loss: huber
  Bin [0.00, 0.08): count=  828, weight=0.003
  Bin [0.08, 0.17): count=  710, weight=0.004
  Bin [0.17, 0.25): count=  575, weight=0.005
  Bin [0.25, 0.33): count=  214, weight=0.013
  Bin [0.33, 0.42): count=   55, weight=0.051
  Bin [0.42, 0.50): count=   14, weight=0.191
  Bin [0.50, 0.58): count=    9, weight=0.286
  Bin [0.58, 0.67): count=    1, weight=1.431
  Bin [0.67, 0.75): count=    1, weight=1.431
  Bin [0.75, 0.83): count=    0, weight=2.862
  Bin [0.83, 0.92): count=    0, weight=2.862
  Bin [0.92, 1.00): count=    0, weight=2.862
-------------------------------------------

  Pred range: [0.0221, 0.3453], std: 0.0535
  RMSE : 0.0898, R2: 0.2023, MAE: 0.0702, Spearman rho: 0.4532, Spearman p: 1.2438e-31, Pearson r: 0.4657, Pearson p: 1.5844e-33
  Pred range: [0.0374, 0.3955], std: 0.0575
  RMSE : 0.0911, R2: 0.1804, MAE: 0.0724, Spearman rho: 0.4683, Spearman p: 6.3704e-34, Pearson r: 0.4726, Pearson p: 1.3220e-34
  Pred range: [0.0121, 0.3622], std: 0.0510
  RMSE : 0.0889, R2: 0.2195, MAE: 0.0702, Spearman rho: 0.4642, Spearman p: 2.7204e-33, Pearson r: 0.4701, Pearson p: 3.3270e-34
  Pred range: [0.0724, 0.4181], std: 0.0594
  RMSE : 0.1029, R2: -0.0464, MAE: 0.0839, Spearman rho: 0.4485, Spearman p: 6.2808e-31, Pearson r: 0.4572, Pearson p: 3.1664e-32
  Pred range: [-0.0025, 0.3462], std: 0.0521
  RMSE : 0.0900, R2: 0.2003, MAE: 0.0723, Spearman rho: 0.4452, Spearman p: 1.8665e-30, Pearson r: 0.4583, Pearson p: 2.1777e-32
  Pred range: [0.0250, 0.3666], std: 0.0532
  RMSE : 0.0893, R2: 0.2126, MAE: 0.0714, Spearman rho: 0.4681, Spearman p: 6.7330e-34, Pearson r: 0.4758, Pearson p: 4.0952e-35
  Pred range: [0.0290, 0.3765], std: 0.0577
  RMSE : 0.0900, R2: 0.1996, MAE: 0.0718, Spearman rho: 0.4684, Spearman p: 6.1585e-34, Pearson r: 0.4741, Pearson p: 7.7485e-35
  Pred range: [0.0456, 0.3849], std: 0.0580
  RMSE : 0.0919, R2: 0.1653, MAE: 0.0738, Spearman rho: 0.4656, Spearman p: 1.6898e-33, Pearson r: 0.4730, Pearson p: 1.1383e-34
  Pred range: [0.0315, 0.3632], std: 0.0535
  RMSE : 0.0894, R2: 0.2100, MAE: 0.0717, Spearman rho: 0.4611, Spearman p: 8.2566e-33, Pearson r: 0.4709, Pearson p: 2.4270e-34
  Pred range: [0.0259, 0.3465], std: 0.0532
  RMSE : 0.0888, R2: 0.2201, MAE: 0.0708, Spearman rho: 0.4625, Spearman p: 4.9109e-33, Pearson r: 0.4727, Pearson p: 1.2771e-34
  Pred range: [0.0358, 0.3642], std: 0.0561
  RMSE : 0.0895, R2: 0.2079, MAE: 0.0715, Spearman rho: 0.4631, Spearman p: 3.9915e-33, Pearson r: 0.4724, Pearson p: 1.4438e-34
  Pred range: [0.0248, 0.3549], std: 0.0535
  RMSE : 0.0890, R2: 0.2166, MAE: 0.0711, Spearman rho: 0.4607, Spearman p: 9.3565e-33, Pearson r: 0.4708, Pearson p: 2.5944e-34
  Pred range: [0.0170, 0.3465], std: 0.0535
  RMSE : 0.0889, R2: 0.2194, MAE: 0.0707, Spearman rho: 0.4625, Spearman p: 4.9479e-33, Pearson r: 0.4721, Pearson p: 1.5735e-34
