[I 2026-04-29 00:18:19,658] Trial 12 finished with value: 0.08869736027930415 and parameters: {'learning_rate': 0.0014663690330004235, 'batch_size': 4, 'num_epochs': 15, 'weight_decay': 0.000113487316679276, 'layers_PRS': 2, 'layers_SCZ15': 3, 'layers_ADHD9': 1, 'layers_ASD9': 5, 'layers_ACE15': 4, 'layers_ACE18': 1, 'layers_SUD18': 2, 'layers_SES': 5, 'layers_SEX': 2, 'dropout': 0.4963104379489801, 'se_reduction': 2, 'hidden_dim_min': 11, 'base_loss': 'huber', 'huber_delta': 0.012578730689892265, 'focal_gamma': 0.559938495954553, 'n_bins': 9, 'scheduler_patience': 2, 'scheduler_factor': 0.5308207682227687, 'early_stopping_patience': 6}. Best is trial 12 with value: 0.08869736027930415.
Train: 2407 rows (1613 IDs),Test: 598 rows (404 IDs) 

n_features_x : 6, n_features_per_modality: [16, 23, 19, 17, 7, 4, 4, 4, 1, 4]

--- ImbalancedRegressionLoss initialized ---
  Bins: 9, Focal gamma: 0.7481748537232316, Base loss: huber
  Bin [0.00, 0.11): count= 1180, weight=0.003
  Bin [0.11, 0.22): count=  835, weight=0.004
  Bin [0.22, 0.33): count=  312, weight=0.010
  Bin [0.33, 0.44): count=   59, weight=0.054
  Bin [0.44, 0.56): count=   16, weight=0.190
  Bin [0.56, 0.67): count=    4, weight=0.647
  Bin [0.67, 0.78): count=    1, weight=1.618
  Bin [0.78, 0.89): count=    0, weight=3.237
  Bin [0.89, 1.00): count=    0, weight=3.237
-------------------------------------------

  Pred range: [0.0500, 0.3097], std: 0.0439
  RMSE : 0.0970, R2: 0.0693, MAE: 0.0789, Spearman rho: 0.4049, Spearman p: 5.3824e-25, Pearson r: 0.4147, Pearson p: 2.9703e-26
  Pred range: [0.0285, 0.2622], std: 0.0430
  RMSE : 0.0909, R2: 0.1836, MAE: 0.0710, Spearman rho: 0.4495, Spearman p: 4.4320e-31, Pearson r: 0.4533, Pearson p: 1.2393e-31
  Pred range: [0.0590, 0.3402], std: 0.0470
  RMSE : 0.0948, R2: 0.1114, MAE: 0.0766, Spearman rho: 0.4281, Spearman p: 4.8247e-28, Pearson r: 0.4357, Pearson p: 4.2489e-29
  Pred range: [0.0979, 0.4726], std: 0.0569
  RMSE : 0.1161, R2: -0.3330, MAE: 0.0960, Spearman rho: 0.4205, Spearman p: 4.9893e-27, Pearson r: 0.4209, Pearson p: 4.4845e-27
  Pred range: [0.0599, 0.3455], std: 0.0518
  RMSE : 0.0921, R2: 0.1611, MAE: 0.0738, Spearman rho: 0.4470, Spearman p: 1.0141e-30, Pearson r: 0.4515, Pearson p: 2.2733e-31
  Pred range: [0.0609, 0.3478], std: 0.0496
  RMSE : 0.0926, R2: 0.1529, MAE: 0.0744, Spearman rho: 0.4469, Spearman p: 1.0546e-30, Pearson r: 0.4540, Pearson p: 9.4588e-32
  Pred range: [0.0746, 0.3765], std: 0.0506
  RMSE : 0.1005, R2: 0.0013, MAE: 0.0824, Spearman rho: 0.4366, Spearman p: 3.2040e-29, Pearson r: 0.4431, Pearson p: 3.7266e-30
[I 2026-04-29 00:19:17,204] Trial 13 finished with value: 0.0908908365085522 and parameters: {'learning_rate': 0.0011891798830554606, 'batch_size': 4, 'num_epochs': 14, 'weight_decay': 0.004476127712510368, 'layers_PRS': 3, 'layers_SCZ15': 2, 'layers_ADHD9': 1, 'layers_ASD9': 5, 'layers_ACE15': 4, 'layers_ACE18': 1, 'layers_SUD18': 2, 'layers_SES': 5, 'layers_SEX': 2, 'dropout': 0.4921424828624847, 'se_reduction': 2, 'hidden_dim_min': 10, 'base_loss': 'huber', 'huber_delta': 0.010484411227529161, 'focal_gamma': 0.7481748537232316, 'n_bins': 9, 'scheduler_patience': 2, 'scheduler_factor': 0.5609271444996696, 'early_stopping_patience': 5}. Best is trial 12 with value: 0.08869736027930415.
Train: 2407 rows (1613 IDs),Test: 598 rows (404 IDs) 

n_features_x : 6, n_features_per_modality: [16, 23, 19, 17, 7, 4, 4, 4, 1, 4]

--- ImbalancedRegressionLoss initialized ---
  Bins: 14, Focal gamma: 0.5126371214955474, Base loss: huber
  Bin [0.00, 0.07): count=  828, weight=0.003
  Bin [0.07, 0.14): count=  542, weight=0.005
  Bin [0.14, 0.21): count=  506, weight=0.005
  Bin [0.21, 0.29): count=  386, weight=0.007
  Bin [0.29, 0.36): count=   91, weight=0.029
  Bin [0.36, 0.43): count=   29, weight=0.090
  Bin [0.43, 0.50): count=   12, weight=0.207
  Bin [0.50, 0.57): count=   11, weight=0.224
  Bin [0.57, 0.64): count=    1, weight=1.343
  Bin [0.64, 0.71): count=    1, weight=1.343
  Bin [0.71, 0.79): count=    0, weight=2.686
  Bin [0.79, 0.86): count=    0, weight=2.686
  Bin [0.86, 0.93): count=    0, weight=2.686
  Bin [0.93, 1.00): count=    0, weight=2.686
-------------------------------------------

  Pred range: [0.0368, 0.4174], std: 0.0523
  RMSE : 0.0973, R2: 0.0647, MAE: 0.0775, Spearman rho: 0.3147, Spearman p: 3.2845e-15, Pearson r: 0.3339, Pearson p: 4.9071e-17
  Pred range: [0.0397, 0.4103], std: 0.0578
  RMSE : 0.0988, R2: 0.0350, MAE: 0.0799, Spearman rho: 0.3850, Spearman p: 1.4585e-22, Pearson r: 0.3983, Pearson p: 3.5760e-24
  Pred range: [0.0298, 0.3977], std: 0.0571
  RMSE : 0.0942, R2: 0.1235, MAE: 0.0758, Spearman rho: 0.4112, Spearman p: 8.3504e-26, Pearson r: 0.4231, Pearson p: 2.3010e-27
  Pred range: [0.0334, 0.3951], std: 0.0580
  RMSE : 0.0948, R2: 0.1124, MAE: 0.0765, Spearman rho: 0.4252, Spearman p: 1.1909e-27, Pearson r: 0.4359, Pearson p: 3.9324e-29
  Pred range: [0.0277, 0.3871], std: 0.0576
  RMSE : 0.0926, R2: 0.1533, MAE: 0.0745, Spearman rho: 0.4356, Spearman p: 4.3065e-29, Pearson r: 0.4454, Pearson p: 1.7708e-30
  Pred range: [0.0306, 0.4002], std: 0.0589
  RMSE : 0.0932, R2: 0.1410, MAE: 0.0751, Spearman rho: 0.4399, Spearman p: 1.0973e-29, Pearson r: 0.4493, Pearson p: 4.7652e-31
  Pred range: [0.0381, 0.4127], std: 0.0603
  RMSE : 0.0962, R2: 0.0849, MAE: 0.0780, Spearman rho: 0.4436, Spearman p: 3.2441e-30, Pearson r: 0.4531, Pearson p: 1.2867e-31
  Pred range: [0.0301, 0.3951], std: 0.0591
  RMSE : 0.0927, R2: 0.1504, MAE: 0.0748, Spearman rho: 0.4498, Spearman p: 4.0286e-31, Pearson r: 0.4588, Pearson p: 1.8212e-32
  Pred range: [0.0291, 0.3958], std: 0.0590
  RMSE : 0.0921, R2: 0.1612, MAE: 0.0741, Spearman rho: 0.4518, Spearman p: 2.0024e-31, Pearson r: 0.4607, Pearson p: 9.3807e-33
[I 2026-04-29 00:20:41,498] Trial 14 pruned. 
Train: 2407 rows (1613 IDs),Test: 598 rows (404 IDs) 

n_features_x : 6, n_features_per_modality: [16, 23, 19, 17, 7, 4, 4, 4, 1, 4]

--- ImbalancedRegressionLoss initialized ---
  Bins: 8, Focal gamma: 1.8871429755563114, Base loss: huber
  Bin [0.00, 0.12): count= 1180, weight=0.003
  Bin [0.12, 0.25): count=  933, weight=0.003
  Bin [0.25, 0.38): count=  253, weight=0.012
  Bin [0.38, 0.50): count=   30, weight=0.098
  Bin [0.50, 0.62): count=   10, weight=0.277
  Bin [0.62, 0.75): count=    1, weight=1.521
  Bin [0.75, 0.88): count=    0, weight=3.043
  Bin [0.88, 1.00): count=    0, weight=3.043
-------------------------------------------

  Pred range: [-0.0449, 0.3222], std: 0.0524
  RMSE : 0.0897, R2: 0.2053, MAE: 0.0710, Spearman rho: 0.4670, Spearman p: 1.0015e-33, Pearson r: 0.4582, Pearson p: 2.2578e-32
  Pred range: [0.0366, 0.4543], std: 0.0696
  RMSE : 0.1045, R2: -0.0799, MAE: 0.0852, Spearman rho: 0.4698, Spearman p: 3.7252e-34, Pearson r: 0.4722, Pearson p: 1.5364e-34
  Pred range: [0.0621, 0.3938], std: 0.0480
  RMSE : 0.0970, R2: 0.0696, MAE: 0.0798, Spearman rho: 0.4465, Spearman p: 1.2294e-30, Pearson r: 0.4530, Pearson p: 1.3463e-31
  Pred range: [-0.0145, 0.3121], std: 0.0575
  RMSE : 0.0939, R2: 0.1290, MAE: 0.0725, Spearman rho: 0.4103, Spearman p: 1.0829e-25, Pearson r: 0.4166, Pearson p: 1.6759e-26
  Pred range: [0.0100, 0.3461], std: 0.0535
  RMSE : 0.0891, R2: 0.2158, MAE: 0.0703, Spearman rho: 0.4629, Spearman p: 4.2810e-33, Pearson r: 0.4690, Pearson p: 4.9761e-34
  Pred range: [0.0358, 0.3793], std: 0.0564
  RMSE : 0.0895, R2: 0.2083, MAE: 0.0709, Spearman rho: 0.4605, Spearman p: 1.0177e-32, Pearson r: 0.4664, Pearson p: 1.2647e-33
  Pred range: [0.0234, 0.3805], std: 0.0571
  RMSE : 0.0899, R2: 0.2009, MAE: 0.0710, Spearman rho: 0.4527, Spearman p: 1.4784e-31, Pearson r: 0.4608, Pearson p: 8.9239e-33
  Pred range: [0.0718, 0.4529], std: 0.0624
  RMSE : 0.1033, R2: -0.0538, MAE: 0.0847, Spearman rho: 0.4675, Spearman p: 8.3452e-34, Pearson r: 0.4734, Pearson p: 1.0022e-34
  Pred range: [0.0316, 0.3763], std: 0.0594
  RMSE : 0.0894, R2: 0.2104, MAE: 0.0705, Spearman rho: 0.4736, Spearman p: 9.3253e-35, Pearson r: 0.4780, Pearson p: 1.8493e-35
  Pred range: [0.0384, 0.3835], std: 0.0573
  RMSE : 0.0920, R2: 0.1639, MAE: 0.0739, Spearman rho: 0.4640, Spearman p: 2.8864e-33, Pearson r: 0.4719, Pearson p: 1.7022e-34
[I 2026-04-29 00:22:03,448] Trial 15 finished with value: 0.08908039758108875 and parameters: {'learning_rate': 0.0021113594244482363, 'batch_size': 4, 'num_epochs': 14, 'weight_decay': 0.0001765442370085558, 'layers_PRS': 3, 'layers_SCZ15': 3, 'layers_ADHD9': 2, 'layers_ASD9': 4, 'layers_ACE15': 3, 'layers_ACE18': 2, 'layers_SUD18': 2, 'layers_SES': 3, 'layers_SEX': 3, 'dropout': 0.42948210207521537, 'se_reduction': 3, 'hidden_dim_min': 7, 'base_loss': 'huber', 'huber_delta': 0.04213866505677502, 'focal_gamma': 1.8871429755563114, 'n_bins': 8, 'scheduler_patience': 2, 'scheduler_factor': 0.497868445563042, 'early_stopping_patience': 5}. Best is trial 12 with value: 0.08869736027930415.
Train: 2407 rows (1613 IDs),Test: 598 rows (404 IDs) 

n_features_x : 6, n_features_per_modality: [16, 23, 19, 17, 7, 4, 4, 4, 1, 4]

--- ImbalancedRegressionLoss initialized ---
  Bins: 13, Focal gamma: 1.0131159706458241, Base loss: huber
  Bin [0.00, 0.08): count=  828, weight=0.003
  Bin [0.08, 0.15): count=  710, weight=0.004
  Bin [0.15, 0.23): count=  477, weight=0.006
  Bin [0.23, 0.31): count=  288, weight=0.009
  Bin [0.31, 0.38): count=   63, weight=0.042
  Bin [0.38, 0.46): count=   23, weight=0.113
  Bin [0.46, 0.54): count=   10, weight=0.247
  Bin [0.54, 0.62): count=    7, weight=0.340
  Bin [0.62, 0.69): count=    0, weight=2.719
  Bin [0.69, 0.77): count=    1, weight=1.359
  Bin [0.77, 0.85): count=    0, weight=2.719
  Bin [0.85, 0.92): count=    0, weight=2.719
  Bin [0.92, 1.00): count=    0, weight=2.719
-------------------------------------------

  Pred range: [0.0625, 0.4250], std: 0.0542
  RMSE : 0.0965, R2: 0.0795, MAE: 0.0774, Spearman rho: 0.4219, Spearman p: 3.2918e-27, Pearson r: 0.4205, Pearson p: 5.0562e-27
  Pred range: [0.0569, 0.3563], std: 0.0485
  RMSE : 0.0922, R2: 0.1600, MAE: 0.0736, Spearman rho: 0.4344, Spearman p: 6.4401e-29, Pearson r: 0.4354, Pearson p: 4.6483e-29
  Pred range: [0.0415, 0.3659], std: 0.0458
  RMSE : 0.0925, R2: 0.1549, MAE: 0.0745, Spearman rho: 0.4436, Spearman p: 3.1823e-30, Pearson r: 0.4491, Pearson p: 5.1061e-31
  Pred range: [0.0435, 0.3648], std: 0.0557
  RMSE : 0.0921, R2: 0.1625, MAE: 0.0732, Spearman rho: 0.4357, Spearman p: 4.2075e-29, Pearson r: 0.4387, Pearson p: 1.6150e-29
  Pred range: [0.0491, 0.3847], std: 0.0563
  RMSE : 0.0920, R2: 0.1635, MAE: 0.0731, Spearman rho: 0.4534, Spearman p: 1.1680e-31, Pearson r: 0.4516, Pearson p: 2.1412e-31
  Pred range: [0.0287, 0.3869], std: 0.0577
  RMSE : 0.0897, R2: 0.2045, MAE: 0.0707, Spearman rho: 0.4659, Spearman p: 1.4923e-33, Pearson r: 0.4735, Pearson p: 9.4248e-35
  Pred range: [0.0184, 0.3914], std: 0.0542
  RMSE : 0.0913, R2: 0.1756, MAE: 0.0732, Spearman rho: 0.4543, Spearman p: 8.6261e-32, Pearson r: 0.4626, Pearson p: 4.7768e-33
  Pred range: [-0.0144, 0.3583], std: 0.0492
  RMSE : 0.0904, R2: 0.1922, MAE: 0.0724, Spearman rho: 0.4349, Spearman p: 5.4491e-29, Pearson r: 0.4466, Pearson p: 1.1935e-30
  Pred range: [0.0071, 0.3485], std: 0.0498
  RMSE : 0.0909, R2: 0.1836, MAE: 0.0730, Spearman rho: 0.4321, Spearman p: 1.3521e-28, Pearson r: 0.4434, Pearson p: 3.3691e-30
  Pred range: [0.0189, 0.3982], std: 0.0566
  RMSE : 0.0893, R2: 0.2113, MAE: 0.0707, Spearman rho: 0.4623, Spearman p: 5.4180e-33, Pearson r: 0.4714, Pearson p: 2.0608e-34
  Pred range: [0.0016, 0.4243], std: 0.0597
  RMSE : 0.0904, R2: 0.1930, MAE: 0.0714, Spearman rho: 0.4525, Spearman p: 1.6274e-31, Pearson r: 0.4650, Pearson p: 2.0272e-33
  Pred range: [0.0318, 0.3475], std: 0.0533
  RMSE : 0.0897, R2: 0.2050, MAE: 0.0710, Spearman rho: 0.4478, Spearman p: 7.9686e-31, Pearson r: 0.4585, Pearson p: 2.0308e-32
  Pred range: [0.0298, 0.3503], std: 0.0542
  RMSE : 0.0902, R2: 0.1962, MAE: 0.0723, Spearman rho: 0.4484, Spearman p: 6.4837e-31, Pearson r: 0.4659, Pearson p: 1.4987e-33
  Pred range: [0.0073, 0.3526], std: 0.0529
  RMSE : 0.0908, R2: 0.1847, MAE: 0.0725, Spearman rho: 0.4360, Spearman p: 3.8834e-29, Pearson r: 0.4481, Pearson p: 7.0611e-31
  Pred range: [0.0479, 0.3686], std: 0.0534
  RMSE : 0.0921, R2: 0.1610, MAE: 0.0741, Spearman rho: 0.4444, Spearman p: 2.4149e-30, Pearson r: 0.4573, Pearson p: 3.0846e-32
  Pred range: [0.0428, 0.3714], std: 0.0525
  RMSE : 0.0916, R2: 0.1715, MAE: 0.0735, Spearman rho: 0.4404, Spearman p: 9.2183e-30, Pearson r: 0.4528, Pearson p: 1.4221e-31
  Pred range: [0.0329, 0.3780], std: 0.0537
  RMSE : 0.0907, R2: 0.1879, MAE: 0.0723, Spearman rho: 0.4444, Spearman p: 2.4295e-30, Pearson r: 0.4582, Pearson p: 2.2421e-32
[I 2026-04-29 00:23:41,157] Trial 16 finished with value: 0.08933805077058633 and parameters: {'learning_rate': 0.0005949756233135244, 'batch_size': 4, 'num_epochs': 20, 'weight_decay': 3.328899290473538e-05, 'layers_PRS': 2, 'layers_SCZ15': 1, 'layers_ADHD9': 1, 'layers_ASD9': 3, 'layers_ACE15': 2, 'layers_ACE18': 1, 'layers_SUD18': 1, 'layers_SES': 4, 'layers_SEX': 2, 'dropout': 0.4399908777661039, 'se_reduction': 3, 'hidden_dim_min': 11, 'base_loss': 'huber', 'huber_delta': 0.19650384974558494, 'focal_gamma': 1.0131159706458241, 'n_bins': 13, 'scheduler_patience': 3, 'scheduler_factor': 0.3485731866225169, 'early_stopping_patience': 7}. Best is trial 12 with value: 0.08869736027930415.
Train: 2407 rows (1613 IDs),Test: 598 rows (404 IDs) 

n_features_x : 6, n_features_per_modality: [16, 23, 19, 17, 7, 4, 4, 4, 1, 4]

--- ImbalancedRegressionLoss initialized ---
  Bins: 8, Focal gamma: 0.5164893015503448, Base loss: huber
  Bin [0.00, 0.12): count= 1180, weight=0.003
  Bin [0.12, 0.25): count=  933, weight=0.003
  Bin [0.25, 0.38): count=  253, weight=0.012
  Bin [0.38, 0.50): count=   30, weight=0.098
  Bin [0.50, 0.62): count=   10, weight=0.277
  Bin [0.62, 0.75): count=    1, weight=1.521
  Bin [0.75, 0.88): count=    0, weight=3.043
  Bin [0.88, 1.00): count=    0, weight=3.043
-------------------------------------------

  Pred range: [0.0894, 0.5678], std: 0.0798
  RMSE : 0.1424, R2: -1.0046, MAE: 0.1208, Spearman rho: 0.4706, Spearman p: 2.7125e-34, Pearson r: 0.4810, Pearson p: 5.8993e-36
  Pred range: [-0.0229, 0.3951], std: 0.0581
  RMSE : 0.0897, R2: 0.2052, MAE: 0.0701, Spearman rho: 0.4634, Spearman p: 3.6143e-33, Pearson r: 0.4665, Pearson p: 1.1856e-33
  Pred range: [0.0089, 0.3932], std: 0.0627
  RMSE : 0.0904, R2: 0.1917, MAE: 0.0712, Spearman rho: 0.4637, Spearman p: 3.2808e-33, Pearson r: 0.4726, Pearson p: 1.3200e-34
  Pred range: [0.0066, 0.5658], std: 0.0726
  RMSE : 0.1155, R2: -0.3174, MAE: 0.0955, Spearman rho: 0.4627, Spearman p: 4.5919e-33, Pearson r: 0.4729, Pearson p: 1.1990e-34
  Pred range: [0.0002, 0.4668], std: 0.0657
  RMSE : 0.0968, R2: 0.0749, MAE: 0.0772, Spearman rho: 0.4547, Spearman p: 7.4924e-32, Pearson r: 0.4573, Pearson p: 3.1010e-32
[I 2026-04-29 00:24:02,995] Trial 17 finished with value: 0.08968337402589324 and parameters: {'learning_rate': 0.0027750238422294235, 'batch_size': 8, 'num_epochs': 16, 'weight_decay': 0.00014321771209893858, 'layers_PRS': 2, 'layers_SCZ15': 3, 'layers_ADHD9': 1, 'layers_ASD9': 3, 'layers_ACE15': 4, 'layers_ACE18': 2, 'layers_SUD18': 3, 'layers_SES': 5, 'layers_SEX': 3, 'dropout': 0.38352514655877057, 'se_reduction': 2, 'hidden_dim_min': 2, 'base_loss': 'huber', 'huber_delta': 0.06433589338820825, 'focal_gamma': 0.5164893015503448, 'n_bins': 8, 'scheduler_patience': 2, 'scheduler_factor': 0.5737908913431512, 'early_stopping_patience': 3}. Best is trial 12 with value: 0.08869736027930415.
Train: 2407 rows (1613 IDs),Test: 598 rows (404 IDs) 

n_features_x : 6, n_features_per_modality: [16, 23, 19, 17, 7, 4, 4, 4, 1, 4]

--- ImbalancedRegressionLoss initialized ---
  Bins: 10, Focal gamma: 1.7064583474088975, Base loss: huber
  Bin [0.00, 0.10): count= 1010, weight=0.003
  Bin [0.10, 0.20): count=  866, weight=0.003
  Bin [0.20, 0.30): count=  386, weight=0.007
  Bin [0.30, 0.40): count=  111, weight=0.026
  Bin [0.40, 0.50): count=   23, weight=0.119
  Bin [0.50, 0.60): count=    9, weight=0.287
  Bin [0.60, 0.70): count=    2, weight=0.955
  Bin [0.70, 0.80): count=    0, weight=2.866
  Bin [0.80, 0.90): count=    0, weight=2.866
  Bin [0.90, 1.00): count=    0, weight=2.866
-------------------------------------------

  Pred range: [0.0649, 0.5246], std: 0.0615
  RMSE : 0.1164, R2: -0.3385, MAE: 0.0946, Spearman rho: 0.3041, Spearman p: 2.9501e-14, Pearson r: 0.3153, Pearson p: 2.8684e-15
  Pred range: [0.0654, 0.4783], std: 0.0580
  RMSE : 0.1088, R2: -0.1708, MAE: 0.0885, Spearman rho: 0.3502, Spearman p: 1.0641e-18, Pearson r: 0.3605, Pearson p: 8.6625e-20
  Pred range: [0.0784, 0.4979], std: 0.0617
  RMSE : 0.1191, R2: -0.4013, MAE: 0.0981, Spearman rho: 0.3802, Spearman p: 5.3354e-22, Pearson r: 0.3887, Pearson p: 5.3216e-23
  Pred range: [0.0786, 0.4986], std: 0.0636
  RMSE : 0.1210, R2: -0.4459, MAE: 0.1000, Spearman rho: 0.3966, Spearman p: 5.8807e-24, Pearson r: 0.4052, Pearson p: 4.8472e-25
  Pred range: [0.0627, 0.4558], std: 0.0601
  RMSE : 0.1063, R2: -0.1168, MAE: 0.0865, Spearman rho: 0.4119, Spearman p: 6.8451e-26, Pearson r: 0.4203, Pearson p: 5.3684e-27
  Pred range: [0.0707, 0.4731], std: 0.0622
  RMSE : 0.1122, R2: -0.2436, MAE: 0.0921, Spearman rho: 0.4227, Spearman p: 2.5952e-27, Pearson r: 0.4305, Pearson p: 2.2063e-28
[I 2026-04-29 00:24:10,235] Trial 18 pruned. 
Train: 2407 rows (1613 IDs),Test: 598 rows (404 IDs) 

n_features_x : 6, n_features_per_modality: [16, 23, 19, 17, 7, 4, 4, 4, 1, 4]

--- ImbalancedRegressionLoss initialized ---
  Bins: 7, Focal gamma: 0.9097529282505616, Base loss: huber
  Bin [0.00, 0.14): count= 1370, weight=0.002
  Bin [0.14, 0.29): count=  892, weight=0.003
  Bin [0.29, 0.43): count=  120, weight=0.024
  Bin [0.43, 0.57): count=   23, weight=0.122
  Bin [0.57, 0.71): count=    2, weight=0.978
  Bin [0.71, 0.86): count=    0, weight=2.935
  Bin [0.86, 1.00): count=    0, weight=2.935
-------------------------------------------

  Pred range: [0.0557, 0.3824], std: 0.0517
  RMSE : 0.0965, R2: 0.0792, MAE: 0.0761, Spearman rho: 0.3342, Spearman p: 4.5493e-17, Pearson r: 0.3499, Pearson p: 1.1525e-18
  Pred range: [0.0546, 0.3821], std: 0.0563
  RMSE : 0.0952, R2: 0.1050, MAE: 0.0753, Spearman rho: 0.3819, Spearman p: 3.3363e-22, Pearson r: 0.3971, Pearson p: 4.9745e-24
  Pred range: [0.0549, 0.4001], std: 0.0582
  RMSE : 0.0961, R2: 0.0873, MAE: 0.0770, Spearman rho: 0.4123, Spearman p: 6.1337e-26, Pearson r: 0.4274, Pearson p: 5.9563e-28
  Pred range: [0.0415, 0.3745], std: 0.0547
  RMSE : 0.0925, R2: 0.1542, MAE: 0.0736, Spearman rho: 0.4216, Spearman p: 3.5823e-27, Pearson r: 0.4371, Pearson p: 2.6705e-29
  Pred range: [0.0336, 0.3652], std: 0.0541
  RMSE : 0.0908, R2: 0.1849, MAE: 0.0716, Spearman rho: 0.4312, Spearman p: 1.7747e-28, Pearson r: 0.4457, Pearson p: 1.6142e-30
  Pred range: [0.0456, 0.3944], std: 0.0568
  RMSE : 0.0929, R2: 0.1463, MAE: 0.0742, Spearman rho: 0.4347, Spearman p: 5.8360e-29, Pearson r: 0.4483, Pearson p: 6.6424e-31
  Pred range: [0.0334, 0.3741], std: 0.0543
  RMSE : 0.0909, R2: 0.1842, MAE: 0.0721, Spearman rho: 0.4449, Spearman p: 2.0885e-30, Pearson r: 0.4556, Pearson p: 5.5524e-32
  Pred range: [0.0244, 0.4078], std: 0.0584
  RMSE : 0.0926, R2: 0.1534, MAE: 0.0739, Spearman rho: 0.4486, Spearman p: 5.9305e-31, Pearson r: 0.4584, Pearson p: 2.1042e-32
  Pred range: [0.0189, 0.3782], std: 0.0545
  RMSE : 0.0909, R2: 0.1836, MAE: 0.0724, Spearman rho: 0.4477, Spearman p: 8.0340e-31, Pearson r: 0.4575, Pearson p: 2.8830e-32
  Pred range: [0.0156, 0.3908], std: 0.0553
  RMSE : 0.0909, R2: 0.1838, MAE: 0.0723, Spearman rho: 0.4512, Spearman p: 2.5115e-31, Pearson r: 0.4608, Pearson p: 9.0418e-33
