[I 2026-04-27 19:53:22,176] Trial 65 finished with value: 0.14870428279359044 and parameters: {'learning_rate': 0.000417259710231227, 'batch_size': 4, 'num_epochs': 28, 'weight_decay': 1.9409041547282653e-05, 'layers_PRS': 3, 'layers_SCZ15': 3, 'layers_ADHD9': 3, 'layers_ASD9': 4, 'layers_ACE15': 5, 'layers_ACE18': 6, 'layers_SUD18': 7, 'layers_SES': 3, 'layers_SEX': 3, 'dropout': 0.25454341710045636, 'se_reduction': 3, 'hidden_dim_min': 5, 'base_loss': 'huber', 'huber_delta': 0.1124640085583179, 'focal_gamma': 1.312763067094804, 'n_bins': 11, 'scheduler_patience': 5, 'scheduler_factor': 0.4148889258458493, 'early_stopping_patience': 6}. Best is trial 31 with value: 0.14835994978477499.
Train: 2407 rows (1613 IDs),Test: 598 rows (404 IDs) 

n_features_x : 6, n_features_per_modality: [16, 23, 19, 17, 7, 4, 4, 4, 1, 4]

--- ImbalancedRegressionLoss initialized ---
  Bins: 11, Focal gamma: 1.267767665449464, Base loss: huber
  Bin [0.00, 0.09): count=  585, weight=0.034
  Bin [0.09, 0.18): count=  580, weight=0.034
  Bin [0.18, 0.27): count=  421, weight=0.047
  Bin [0.27, 0.36): count=  312, weight=0.064
  Bin [0.36, 0.45): count=  207, weight=0.096
  Bin [0.45, 0.55): count=  108, weight=0.183
  Bin [0.55, 0.64): count=  125, weight=0.159
  Bin [0.64, 0.73): count=   41, weight=0.476
  Bin [0.73, 0.82): count=   21, weight=0.909
  Bin [0.82, 0.91): count=    4, weight=3.999
  Bin [0.91, 1.00): count=    3, weight=4.998
-------------------------------------------

  Pred range: [0.0763, 0.5460], std: 0.0813
  RMSE : 0.1554, R2: 0.1942, MAE: 0.1235, Spearman rho: 0.4508, Spearman p: 2.8378e-31, Pearson r: 0.4629, Pearson p: 4.3668e-33
  Pred range: [0.0866, 0.7253], std: 0.1128
  RMSE : 0.1655, R2: 0.0852, MAE: 0.1347, Spearman rho: 0.4875, Spearman p: 4.9824e-37, Pearson r: 0.4969, Pearson p: 1.2825e-38
  Pred range: [0.0822, 0.6310], std: 0.1017
  RMSE : 0.1588, R2: 0.1585, MAE: 0.1286, Spearman rho: 0.4918, Spearman p: 9.5872e-38, Pearson r: 0.4996, Pearson p: 4.4177e-39
  Pred range: [0.0973, 0.6149], std: 0.0983
  RMSE : 0.1577, R2: 0.1699, MAE: 0.1289, Spearman rho: 0.4950, Spearman p: 2.7679e-38, Pearson r: 0.5083, Pearson p: 1.3246e-40
  Pred range: [0.0926, 0.5925], std: 0.0903
  RMSE : 0.1570, R2: 0.1776, MAE: 0.1286, Spearman rho: 0.4865, Spearman p: 7.5180e-37, Pearson r: 0.5029, Pearson p: 1.1800e-39
  Pred range: [0.0824, 0.6658], std: 0.1022
  RMSE : 0.1554, R2: 0.1944, MAE: 0.1259, Spearman rho: 0.4957, Spearman p: 2.1291e-38, Pearson r: 0.5091, Pearson p: 9.7256e-41
  Pred range: [0.1016, 0.6549], std: 0.1000
  RMSE : 0.1658, R2: 0.0819, MAE: 0.1379, Spearman rho: 0.4913, Spearman p: 1.1561e-37, Pearson r: 0.5075, Pearson p: 1.8557e-40
  Pred range: [0.0794, 0.6386], std: 0.1003
  RMSE : 0.1559, R2: 0.1890, MAE: 0.1269, Spearman rho: 0.4934, Spearman p: 5.1610e-38, Pearson r: 0.5115, Pearson p: 3.4934e-41
  Pred range: [0.0921, 0.6755], std: 0.1051
  RMSE : 0.1627, R2: 0.1160, MAE: 0.1341, Spearman rho: 0.4961, Spearman p: 1.7599e-38, Pearson r: 0.5126, Pearson p: 2.2354e-41
  Pred range: [0.0779, 0.6793], std: 0.1081
  RMSE : 0.1567, R2: 0.1802, MAE: 0.1270, Spearman rho: 0.4953, Spearman p: 2.4738e-38, Pearson r: 0.5136, Pearson p: 1.4602e-41
  Pred range: [0.0206, 0.6399], std: 0.0962
  RMSE : 0.1521, R2: 0.2277, MAE: 0.1207, Spearman rho: 0.4705, Spearman p: 2.8048e-34, Pearson r: 0.4915, Pearson p: 1.0693e-37
  Pred range: [0.0733, 0.6458], std: 0.0997
  RMSE : 0.1534, R2: 0.2145, MAE: 0.1236, Spearman rho: 0.4891, Spearman p: 2.6912e-37, Pearson r: 0.5090, Pearson p: 9.9100e-41
  Pred range: [0.0297, 0.6972], std: 0.1043
  RMSE : 0.1511, R2: 0.2382, MAE: 0.1189, Spearman rho: 0.4838, Spearman p: 2.0902e-36, Pearson r: 0.5036, Pearson p: 8.9321e-40
  Pred range: [0.0930, 0.6764], std: 0.0973
  RMSE : 0.1617, R2: 0.1275, MAE: 0.1335, Spearman rho: 0.4810, Spearman p: 5.9051e-36, Pearson r: 0.5003, Pearson p: 3.3805e-39
  Pred range: [0.0593, 0.6533], std: 0.1086
  RMSE : 0.1549, R2: 0.1992, MAE: 0.1238, Spearman rho: 0.4839, Spearman p: 2.0095e-36, Pearson r: 0.5046, Pearson p: 5.9461e-40
  Pred range: [0.0301, 0.7621], std: 0.1086
  RMSE : 0.1623, R2: 0.1208, MAE: 0.1322, Spearman rho: 0.4782, Spearman p: 1.6658e-35, Pearson r: 0.4927, Pearson p: 6.7710e-38
  Pred range: [0.0294, 0.8215], std: 0.1161
  RMSE : 0.1639, R2: 0.1035, MAE: 0.1326, Spearman rho: 0.4805, Spearman p: 7.1949e-36, Pearson r: 0.4987, Pearson p: 6.3381e-39
  Pred range: [-0.0042, 0.6969], std: 0.1039
  RMSE : 0.1532, R2: 0.2167, MAE: 0.1206, Spearman rho: 0.4674, Spearman p: 8.8713e-34, Pearson r: 0.4896, Pearson p: 2.2548e-37
  Pred range: [0.0378, 0.6354], std: 0.0970
  RMSE : 0.1537, R2: 0.2110, MAE: 0.1228, Spearman rho: 0.4751, Spearman p: 5.3446e-35, Pearson r: 0.4935, Pearson p: 5.0051e-38
[I 2026-04-27 19:56:32,176] Trial 66 finished with value: 0.1510726339285441 and parameters: {'learning_rate': 0.0004515684977077002, 'batch_size': 4, 'num_epochs': 30, 'weight_decay': 2.0166675664644707e-05, 'layers_PRS': 3, 'layers_SCZ15': 2, 'layers_ADHD9': 2, 'layers_ASD9': 4, 'layers_ACE15': 5, 'layers_ACE18': 5, 'layers_SUD18': 7, 'layers_SES': 3, 'layers_SEX': 3, 'dropout': 0.25921969349935836, 'se_reduction': 3, 'hidden_dim_min': 10, 'base_loss': 'huber', 'huber_delta': 0.11530056510524357, 'focal_gamma': 1.267767665449464, 'n_bins': 11, 'scheduler_patience': 5, 'scheduler_factor': 0.38215673879508777, 'early_stopping_patience': 6}. Best is trial 31 with value: 0.14835994978477499.
Train: 2407 rows (1613 IDs),Test: 598 rows (404 IDs) 

n_features_x : 6, n_features_per_modality: [16, 23, 19, 17, 7, 4, 4, 4, 1, 4]

--- ImbalancedRegressionLoss initialized ---
  Bins: 9, Focal gamma: 1.3850364302534908, Base loss: huber
  Bin [0.00, 0.11): count=  585, weight=0.041
  Bin [0.11, 0.22): count=  746, weight=0.032
  Bin [0.22, 0.33): count=  478, weight=0.050
  Bin [0.33, 0.44): count=  231, weight=0.104
  Bin [0.44, 0.56): count=  215, weight=0.112
  Bin [0.56, 0.67): count=  100, weight=0.239
  Bin [0.67, 0.78): count=   36, weight=0.653
  Bin [0.78, 0.89): count=   13, weight=1.726
  Bin [0.89, 1.00): count=    3, weight=6.041
-------------------------------------------

  Pred range: [0.1113, 0.6426], std: 0.0914
  RMSE : 0.1633, R2: 0.1097, MAE: 0.1347, Spearman rho: 0.4227, Spearman p: 2.6021e-27, Pearson r: 0.4435, Pearson p: 3.3129e-30
  Pred range: [0.0905, 0.6128], std: 0.0909
  RMSE : 0.1538, R2: 0.2109, MAE: 0.1228, Spearman rho: 0.4609, Spearman p: 8.6703e-33, Pearson r: 0.4757, Pearson p: 4.2341e-35
  Pred range: [0.1046, 0.6745], std: 0.1041
  RMSE : 0.1615, R2: 0.1299, MAE: 0.1324, Spearman rho: 0.4792, Spearman p: 1.1670e-35, Pearson r: 0.4928, Pearson p: 6.5995e-38
  Pred range: [0.0987, 0.6579], std: 0.0967
  RMSE : 0.1561, R2: 0.1863, MAE: 0.1271, Spearman rho: 0.4781, Spearman p: 1.7376e-35, Pearson r: 0.4946, Pearson p: 3.2560e-38
  Pred range: [0.0983, 0.6778], std: 0.0970
  RMSE : 0.1578, R2: 0.1689, MAE: 0.1292, Spearman rho: 0.4765, Spearman p: 3.1449e-35, Pearson r: 0.4951, Pearson p: 2.6743e-38
  Pred range: [0.0933, 0.6789], std: 0.1024
  RMSE : 0.1595, R2: 0.1507, MAE: 0.1308, Spearman rho: 0.4886, Spearman p: 3.3652e-37, Pearson r: 0.5019, Pearson p: 1.8009e-39
  Pred range: [0.0354, 0.6369], std: 0.1010
  RMSE : 0.1508, R2: 0.2409, MAE: 0.1182, Spearman rho: 0.4881, Spearman p: 4.1033e-37, Pearson r: 0.5005, Pearson p: 3.1076e-39
  Pred range: [0.0383, 0.5624], std: 0.0866
  RMSE : 0.1501, R2: 0.2476, MAE: 0.1176, Spearman rho: 0.4856, Spearman p: 1.0466e-36, Pearson r: 0.4981, Pearson p: 8.2392e-39
  Pred range: [0.0240, 0.6697], std: 0.1008
  RMSE : 0.1509, R2: 0.2398, MAE: 0.1180, Spearman rho: 0.4846, Spearman p: 1.5299e-36, Pearson r: 0.4985, Pearson p: 6.8633e-39
  Pred range: [0.0322, 0.6540], std: 0.1023
  RMSE : 0.1512, R2: 0.2367, MAE: 0.1192, Spearman rho: 0.4906, Spearman p: 1.5329e-37, Pearson r: 0.5032, Pearson p: 1.0727e-39
  Pred range: [0.0675, 0.6868], std: 0.1025
  RMSE : 0.1554, R2: 0.1944, MAE: 0.1254, Spearman rho: 0.4855, Spearman p: 1.0828e-36, Pearson r: 0.5004, Pearson p: 3.2975e-39
  Pred range: [0.0220, 0.6176], std: 0.0988
  RMSE : 0.1516, R2: 0.2326, MAE: 0.1204, Spearman rho: 0.4921, Spearman p: 8.6486e-38, Pearson r: 0.5021, Pearson p: 1.6657e-39
  Pred range: [0.0239, 0.6895], std: 0.1068
  RMSE : 0.1549, R2: 0.1987, MAE: 0.1242, Spearman rho: 0.4900, Spearman p: 1.9740e-37, Pearson r: 0.5038, Pearson p: 8.1849e-40
[I 2026-04-27 19:58:44,075] Trial 67 finished with value: 0.15013447535180988 and parameters: {'learning_rate': 0.00027758611615808865, 'batch_size': 4, 'num_epochs': 26, 'weight_decay': 1.0100579871866195e-05, 'layers_PRS': 2, 'layers_SCZ15': 6, 'layers_ADHD9': 2, 'layers_ASD9': 1, 'layers_ACE15': 6, 'layers_ACE18': 4, 'layers_SUD18': 6, 'layers_SES': 3, 'layers_SEX': 3, 'dropout': 0.3011400590673504, 'se_reduction': 3, 'hidden_dim_min': 4, 'base_loss': 'huber', 'huber_delta': 0.11044542186920653, 'focal_gamma': 1.3850364302534908, 'n_bins': 9, 'scheduler_patience': 5, 'scheduler_factor': 0.4157200230311381, 'early_stopping_patience': 5}. Best is trial 31 with value: 0.14835994978477499.
Train: 2407 rows (1613 IDs),Test: 598 rows (404 IDs) 

n_features_x : 6, n_features_per_modality: [16, 23, 19, 17, 7, 4, 4, 4, 1, 4]

--- ImbalancedRegressionLoss initialized ---
  Bins: 11, Focal gamma: 1.1932958224048995, Base loss: huber
  Bin [0.00, 0.09): count=  585, weight=0.034
  Bin [0.09, 0.18): count=  580, weight=0.034
  Bin [0.18, 0.27): count=  421, weight=0.047
  Bin [0.27, 0.36): count=  312, weight=0.064
  Bin [0.36, 0.45): count=  207, weight=0.096
  Bin [0.45, 0.55): count=  108, weight=0.183
  Bin [0.55, 0.64): count=  125, weight=0.159
  Bin [0.64, 0.73): count=   41, weight=0.476
  Bin [0.73, 0.82): count=   21, weight=0.909
  Bin [0.82, 0.91): count=    4, weight=3.999
  Bin [0.91, 1.00): count=    3, weight=4.998
-------------------------------------------

  Pred range: [0.1316, 0.6165], std: 0.0819
  RMSE : 0.1628, R2: 0.1151, MAE: 0.1336, Spearman rho: 0.4280, Spearman p: 4.9186e-28, Pearson r: 0.4467, Pearson p: 1.1353e-30
  Pred range: [0.1200, 0.6625], std: 0.0990
  RMSE : 0.1634, R2: 0.1091, MAE: 0.1344, Spearman rho: 0.4749, Spearman p: 5.7135e-35, Pearson r: 0.4888, Pearson p: 3.0819e-37
  Pred range: [0.1013, 0.5764], std: 0.0839
  RMSE : 0.1524, R2: 0.2250, MAE: 0.1225, Spearman rho: 0.4798, Spearman p: 9.4165e-36, Pearson r: 0.4991, Pearson p: 5.5158e-39
  Pred range: [0.1202, 0.6575], std: 0.0957
  RMSE : 0.1638, R2: 0.1047, MAE: 0.1365, Spearman rho: 0.4918, Spearman p: 9.6737e-38, Pearson r: 0.5098, Pearson p: 7.1012e-41
  Pred range: [0.1259, 0.7150], std: 0.0983
  RMSE : 0.1673, R2: 0.0662, MAE: 0.1398, Spearman rho: 0.4890, Spearman p: 2.8104e-37, Pearson r: 0.5053, Pearson p: 4.5906e-40
  Pred range: [0.0484, 0.6371], std: 0.0937
  RMSE : 0.1499, R2: 0.2503, MAE: 0.1183, Spearman rho: 0.4918, Spearman p: 9.6478e-38, Pearson r: 0.5068, Pearson p: 2.4719e-40
  Pred range: [0.0933, 0.7265], std: 0.1044
  RMSE : 0.1638, R2: 0.1049, MAE: 0.1351, Spearman rho: 0.4916, Spearman p: 1.0511e-37, Pearson r: 0.5039, Pearson p: 7.9745e-40
  Pred range: [0.0666, 0.7024], std: 0.1091
  RMSE : 0.1585, R2: 0.1612, MAE: 0.1287, Spearman rho: 0.4952, Spearman p: 2.5500e-38, Pearson r: 0.5077, Pearson p: 1.7035e-40
  Pred range: [0.0292, 0.6400], std: 0.0963
  RMSE : 0.1524, R2: 0.2249, MAE: 0.1215, Spearman rho: 0.4855, Spearman p: 1.0941e-36, Pearson r: 0.5003, Pearson p: 3.4106e-39
  Pred range: [0.0689, 0.6766], std: 0.1004
  RMSE : 0.1563, R2: 0.1848, MAE: 0.1267, Spearman rho: 0.4889, Spearman p: 2.9396e-37, Pearson r: 0.5023, Pearson p: 1.4935e-39
  Pred range: [0.0622, 0.6806], std: 0.1014
  RMSE : 0.1585, R2: 0.1617, MAE: 0.1288, Spearman rho: 0.4917, Spearman p: 1.0032e-37, Pearson r: 0.5009, Pearson p: 2.6677e-39
  Pred range: [0.0646, 0.6005], std: 0.0927
  RMSE : 0.1556, R2: 0.1920, MAE: 0.1264, Spearman rho: 0.4941, Spearman p: 3.9641e-38, Pearson r: 0.5048, Pearson p: 5.4780e-40
  Pred range: [0.0401, 0.6655], std: 0.1021
  RMSE : 0.1560, R2: 0.1875, MAE: 0.1262, Spearman rho: 0.4959, Spearman p: 1.9024e-38, Pearson r: 0.5071, Pearson p: 2.1660e-40
[I 2026-04-27 20:01:12,537] Trial 68 finished with value: 0.149868616540866 and parameters: {'learning_rate': 0.00036610821723381484, 'batch_size': 4, 'num_epochs': 24, 'weight_decay': 3.6680158042187655e-05, 'layers_PRS': 3, 'layers_SCZ15': 3, 'layers_ADHD9': 4, 'layers_ASD9': 4, 'layers_ACE15': 5, 'layers_ACE18': 6, 'layers_SUD18': 7, 'layers_SES': 2, 'layers_SEX': 3, 'dropout': 0.20585099458365827, 'se_reduction': 2, 'hidden_dim_min': 6, 'base_loss': 'huber', 'huber_delta': 0.13916188528337486, 'focal_gamma': 1.1932958224048995, 'n_bins': 11, 'scheduler_patience': 5, 'scheduler_factor': 0.3837842200511285, 'early_stopping_patience': 7}. Best is trial 31 with value: 0.14835994978477499.
Train: 2407 rows (1613 IDs),Test: 598 rows (404 IDs) 

n_features_x : 6, n_features_per_modality: [16, 23, 19, 17, 7, 4, 4, 4, 1, 4]

--- ImbalancedRegressionLoss initialized ---
  Bins: 11, Focal gamma: 1.7164886622167421, Base loss: huber
  Bin [0.00, 0.09): count=  585, weight=0.034
  Bin [0.09, 0.18): count=  580, weight=0.034
  Bin [0.18, 0.27): count=  421, weight=0.047
  Bin [0.27, 0.36): count=  312, weight=0.064
  Bin [0.36, 0.45): count=  207, weight=0.096
  Bin [0.45, 0.55): count=  108, weight=0.183
  Bin [0.55, 0.64): count=  125, weight=0.159
  Bin [0.64, 0.73): count=   41, weight=0.476
  Bin [0.73, 0.82): count=   21, weight=0.909
  Bin [0.82, 0.91): count=    4, weight=3.999
  Bin [0.91, 1.00): count=    3, weight=4.998
-------------------------------------------

  Pred range: [0.1119, 0.5568], std: 0.0804
  RMSE : 0.1548, R2: 0.2005, MAE: 0.1239, Spearman rho: 0.4558, Spearman p: 5.1949e-32, Pearson r: 0.4671, Pearson p: 9.8370e-34
  Pred range: [0.1174, 0.6054], std: 0.0983
  RMSE : 0.1614, R2: 0.1301, MAE: 0.1334, Spearman rho: 0.4953, Spearman p: 2.4091e-38, Pearson r: 0.5010, Pearson p: 2.5992e-39
  Pred range: [0.0634, 0.5108], std: 0.0850
  RMSE : 0.1503, R2: 0.2462, MAE: 0.1148, Spearman rho: 0.4911, Spearman p: 1.2780e-37, Pearson r: 0.5005, Pearson p: 3.1631e-39
  Pred range: [0.0827, 0.5949], std: 0.0954
  RMSE : 0.1514, R2: 0.2352, MAE: 0.1204, Spearman rho: 0.4912, Spearman p: 1.2203e-37, Pearson r: 0.5035, Pearson p: 9.3440e-40
  Pred range: [0.1001, 0.5884], std: 0.0892
  RMSE : 0.1526, R2: 0.2225, MAE: 0.1225, Spearman rho: 0.4831, Spearman p: 2.6615e-36, Pearson r: 0.4975, Pearson p: 1.0232e-38
  Pred range: [0.0427, 0.6452], std: 0.0972
  RMSE : 0.1569, R2: 0.1784, MAE: 0.1281, Spearman rho: 0.4830, Spearman p: 2.8519e-36, Pearson r: 0.4941, Pearson p: 3.8910e-38
  Pred range: [0.0524, 0.7070], std: 0.1091
  RMSE : 0.1644, R2: 0.0973, MAE: 0.1353, Spearman rho: 0.4822, Spearman p: 3.8559e-36, Pearson r: 0.4913, Pearson p: 1.1812e-37
  Pred range: [0.0784, 0.6344], std: 0.0990
  RMSE : 0.1572, R2: 0.1747, MAE: 0.1287, Spearman rho: 0.4885, Spearman p: 3.4733e-37, Pearson r: 0.5025, Pearson p: 1.3780e-39
  Pred range: [0.0257, 0.6079], std: 0.0962
  RMSE : 0.1530, R2: 0.2188, MAE: 0.1226, Spearman rho: 0.4828, Spearman p: 2.9971e-36, Pearson r: 0.4940, Pearson p: 4.0555e-38
[I 2026-04-27 20:02:38,768] Trial 69 finished with value: 0.15028034229048062 and parameters: {'learning_rate': 0.0007047668085409034, 'batch_size': 4, 'num_epochs': 29, 'weight_decay': 1.8885175949902376e-05, 'layers_PRS': 2, 'layers_SCZ15': 3, 'layers_ADHD9': 3, 'layers_ASD9': 4, 'layers_ACE15': 4, 'layers_ACE18': 6, 'layers_SUD18': 5, 'layers_SES': 3, 'layers_SEX': 3, 'dropout': 0.14334081378718447, 'se_reduction': 6, 'hidden_dim_min': 8, 'base_loss': 'huber', 'huber_delta': 0.052064876945630466, 'focal_gamma': 1.7164886622167421, 'n_bins': 11, 'scheduler_patience': 5, 'scheduler_factor': 0.3021171340492284, 'early_stopping_patience': 6}. Best is trial 31 with value: 0.14835994978477499.
Train: 2407 rows (1613 IDs),Test: 598 rows (404 IDs) 

n_features_x : 6, n_features_per_modality: [16, 23, 19, 17, 7, 4, 4, 4, 1, 4]

--- ImbalancedRegressionLoss initialized ---
  Bins: 7, Focal gamma: 1.5907854273379294, Base loss: mse
  Bin [0.00, 0.14): count=  760, weight=0.038
  Bin [0.14, 0.29): count=  826, weight=0.035
  Bin [0.29, 0.43): count=  454, weight=0.063
  Bin [0.43, 0.57): count=  215, weight=0.133
  Bin [0.57, 0.71): count=  110, weight=0.258
  Bin [0.71, 0.86): count=   38, weight=0.736
  Bin [0.86, 1.00): count=    4, weight=5.738
-------------------------------------------

  Pred range: [0.1322, 0.4857], std: 0.0637
  RMSE : 0.1638, R2: 0.1048, MAE: 0.1350, Spearman rho: 0.4167, Spearman p: 1.6041e-26, Pearson r: 0.4203, Pearson p: 5.4620e-27
  Pred range: [0.1421, 0.6059], std: 0.0815
  RMSE : 0.1718, R2: 0.0143, MAE: 0.1450, Spearman rho: 0.4656, Spearman p: 1.6519e-33, Pearson r: 0.4698, Pearson p: 3.6673e-34
  Pred range: [0.1301, 0.5800], std: 0.0789
  RMSE : 0.1587, R2: 0.1590, MAE: 0.1309, Spearman rho: 0.4854, Spearman p: 1.1486e-36, Pearson r: 0.4902, Pearson p: 1.7979e-37
  Pred range: [0.1293, 0.5590], std: 0.0770
  RMSE : 0.1563, R2: 0.1843, MAE: 0.1284, Spearman rho: 0.4969, Spearman p: 1.3102e-38, Pearson r: 0.5027, Pearson p: 1.2790e-39
  Pred range: [0.1301, 0.5865], std: 0.0841
  RMSE : 0.1566, R2: 0.1814, MAE: 0.1290, Spearman rho: 0.4997, Spearman p: 4.3573e-39, Pearson r: 0.5085, Pearson p: 1.2373e-40
  Pred range: [0.0986, 0.5754], std: 0.0837
  RMSE : 0.1496, R2: 0.2533, MAE: 0.1183, Spearman rho: 0.4973, Spearman p: 1.1333e-38, Pearson r: 0.5113, Pearson p: 3.8373e-41
  Pred range: [0.1155, 0.6135], std: 0.0880
  RMSE : 0.1544, R2: 0.2041, MAE: 0.1261, Spearman rho: 0.4969, Spearman p: 1.2971e-38, Pearson r: 0.5120, Pearson p: 2.9245e-41
  Pred range: [0.1210, 0.6329], std: 0.0907
  RMSE : 0.1576, R2: 0.1714, MAE: 0.1298, Spearman rho: 0.4969, Spearman p: 1.2983e-38, Pearson r: 0.5107, Pearson p: 4.8841e-41
  Pred range: [0.1065, 0.6160], std: 0.0878
  RMSE : 0.1558, R2: 0.1898, MAE: 0.1280, Spearman rho: 0.4997, Spearman p: 4.3463e-39, Pearson r: 0.5130, Pearson p: 1.8623e-41
  Pred range: [0.0790, 0.6297], std: 0.0888
  RMSE : 0.1551, R2: 0.1971, MAE: 0.1266, Spearman rho: 0.4932, Spearman p: 5.5474e-38, Pearson r: 0.5071, Pearson p: 2.1692e-40
  Pred range: [0.0744, 0.6310], std: 0.0900
  RMSE : 0.1547, R2: 0.2015, MAE: 0.1262, Spearman rho: 0.4943, Spearman p: 3.5810e-38, Pearson r: 0.5101, Pearson p: 6.3288e-41
  Pred range: [0.0721, 0.6410], std: 0.0911
  RMSE : 0.1575, R2: 0.1725, MAE: 0.1299, Spearman rho: 0.4953, Spearman p: 2.4856e-38, Pearson r: 0.5090, Pearson p: 9.9344e-41
  Pred range: [0.0809, 0.6913], std: 0.0959
  RMSE : 0.1625, R2: 0.1187, MAE: 0.1351, Spearman rho: 0.4924, Spearman p: 7.7536e-38, Pearson r: 0.5082, Pearson p: 1.3881e-40
[I 2026-04-27 20:04:59,235] Trial 70 finished with value: 0.14956184010533458 and parameters: {'learning_rate': 0.00016671260815341837, 'batch_size': 4, 'num_epochs': 28, 'weight_decay': 1.3904228457242278e-05, 'layers_PRS': 1, 'layers_SCZ15': 2, 'layers_ADHD9': 5, 'layers_ASD9': 5, 'layers_ACE15': 5, 'layers_ACE18': 4, 'layers_SUD18': 7, 'layers_SES': 2, 'layers_SEX': 3, 'dropout': 0.24775743704076392, 'se_reduction': 3, 'hidden_dim_min': 5, 'base_loss': 'mse', 'huber_delta': 0.10168881903379416, 'focal_gamma': 1.5907854273379294, 'n_bins': 7, 'scheduler_patience': 5, 'scheduler_factor': 0.4620679583409596, 'early_stopping_patience': 7}. Best is trial 31 with value: 0.14835994978477499.
Train: 2407 rows (1613 IDs),Test: 598 rows (404 IDs) 

n_features_x : 6, n_features_per_modality: [16, 23, 19, 17, 7, 4, 4, 4, 1, 4]

--- ImbalancedRegressionLoss initialized ---
  Bins: 12, Focal gamma: 1.536916092182055, Base loss: huber
  Bin [0.00, 0.08): count=  383, weight=0.051
  Bin [0.08, 0.17): count=  578, weight=0.034
  Bin [0.17, 0.25): count=  499, weight=0.039
  Bin [0.25, 0.33): count=  349, weight=0.055
  Bin [0.33, 0.42): count=  162, weight=0.119
  Bin [0.42, 0.50): count=  191, weight=0.101
  Bin [0.50, 0.58): count=  129, weight=0.149
  Bin [0.58, 0.67): count=   47, weight=0.404
  Bin [0.67, 0.75): count=   41, weight=0.462
  Bin [0.75, 0.83): count=   21, weight=0.882
  Bin [0.83, 0.92): count=    5, weight=3.235
  Bin [0.92, 1.00): count=    2, weight=6.469
-------------------------------------------

  Pred range: [0.0928, 0.7942], std: 0.1086
  RMSE : 0.1648, R2: 0.0935, MAE: 0.1346, Spearman rho: 0.4784, Spearman p: 1.5908e-35, Pearson r: 0.4842, Pearson p: 1.8045e-36
  Pred range: [0.0821, 0.6708], std: 0.0950
  RMSE : 0.1534, R2: 0.2148, MAE: 0.1237, Spearman rho: 0.4862, Spearman p: 8.4315e-37, Pearson r: 0.4983, Pearson p: 7.4804e-39
  Pred range: [0.1121, 0.7240], std: 0.1053
  RMSE : 0.1669, R2: 0.0701, MAE: 0.1383, Spearman rho: 0.4923, Spearman p: 7.8972e-38, Pearson r: 0.5035, Pearson p: 9.4335e-40
  Pred range: [0.0760, 0.7091], std: 0.1066
  RMSE : 0.1618, R2: 0.1262, MAE: 0.1325, Spearman rho: 0.4860, Spearman p: 9.1474e-37, Pearson r: 0.5021, Pearson p: 1.6213e-39
  Pred range: [0.0757, 0.7142], std: 0.1066
  RMSE : 0.1620, R2: 0.1241, MAE: 0.1328, Spearman rho: 0.4838, Spearman p: 2.0964e-36, Pearson r: 0.5012, Pearson p: 2.3678e-39
  Pred range: [0.0580, 0.6770], std: 0.1011
  RMSE : 0.1570, R2: 0.1775, MAE: 0.1284, Spearman rho: 0.4870, Spearman p: 6.2259e-37, Pearson r: 0.5070, Pearson p: 2.2783e-40
  Pred range: [0.0329, 0.7407], std: 0.1078
  RMSE : 0.1631, R2: 0.1125, MAE: 0.1339, Spearman rho: 0.4886, Spearman p: 3.2681e-37, Pearson r: 0.5014, Pearson p: 2.1645e-39
  Pred range: [0.0467, 0.7737], std: 0.1095
  RMSE : 0.1632, R2: 0.1115, MAE: 0.1336, Spearman rho: 0.4858, Spearman p: 9.6226e-37, Pearson r: 0.5020, Pearson p: 1.7132e-39
