[I 2026-04-27 16:32:46,364] Trial 13 finished with value: 0.09014743811452343 and parameters: {'learning_rate': 0.002946524549782986, 'batch_size': 4, 'num_epochs': 30, 'weight_decay': 9.433864405961733e-05, 'layers_PRS': 2, 'layers_SCZ15': 6, 'layers_ADHD9': 7, 'layers_ASD9': 5, 'layers_ACE15': 5, 'layers_ACE18': 4, 'layers_SUD18': 6, 'layers_SES': 7, 'layers_SEX': 4, 'dropout': 0.2083969351199868, 'se_reduction': 7, 'hidden_dim_min': 6, 'base_loss': 'huber', 'huber_delta': 0.06830266902613993, 'focal_gamma': 0.9570993257244832, 'n_bins': 14, 'scheduler_patience': 4, 'scheduler_factor': 0.6016133654326803, 'early_stopping_patience': 4}. Best is trial 9 with value: 0.08803266597627345.
Train: 2407 rows (1613 IDs),Test: 598 rows (404 IDs) 

n_features_x : 6, n_features_per_modality: [16, 23, 19, 17, 7, 4, 4, 4, 1, 4]

--- ImbalancedRegressionLoss initialized ---
  Bins: 7, Focal gamma: 2.0621796801017287, Base loss: huber
  Bin [0.00, 0.14): count= 1370, weight=0.002
  Bin [0.14, 0.29): count=  892, weight=0.003
  Bin [0.29, 0.43): count=  120, weight=0.024
  Bin [0.43, 0.57): count=   23, weight=0.122
  Bin [0.57, 0.71): count=    2, weight=0.978
  Bin [0.71, 0.86): count=    0, weight=2.935
  Bin [0.86, 1.00): count=    0, weight=2.935
-------------------------------------------

  Pred range: [0.0599, 0.3522], std: 0.0494
  RMSE : 0.0975, R2: 0.0611, MAE: 0.0781, Spearman rho: 0.3602, Spearman p: 9.2455e-20, Pearson r: 0.3424, Pearson p: 6.8387e-18
  Pred range: [0.0488, 0.3541], std: 0.0523
  RMSE : 0.0927, R2: 0.1503, MAE: 0.0738, Spearman rho: 0.4232, Spearman p: 2.2033e-27, Pearson r: 0.4161, Pearson p: 1.9419e-26
  Pred range: [0.0502, 0.3557], std: 0.0518
  RMSE : 0.0916, R2: 0.1716, MAE: 0.0731, Spearman rho: 0.4430, Spearman p: 3.9249e-30, Pearson r: 0.4418, Pearson p: 5.8807e-30
  Pred range: [0.0431, 0.3387], std: 0.0503
  RMSE : 0.0896, R2: 0.2060, MAE: 0.0711, Spearman rho: 0.4540, Spearman p: 9.4780e-32, Pearson r: 0.4560, Pearson p: 4.7632e-32
  Pred range: [0.0447, 0.3344], std: 0.0504
  RMSE : 0.0892, R2: 0.2134, MAE: 0.0708, Spearman rho: 0.4608, Spearman p: 9.0603e-33, Pearson r: 0.4639, Pearson p: 3.0526e-33
  Pred range: [0.0546, 0.3527], std: 0.0519
  RMSE : 0.0902, R2: 0.1958, MAE: 0.0721, Spearman rho: 0.4600, Spearman p: 1.2023e-32, Pearson r: 0.4637, Pearson p: 3.2076e-33
  Pred range: [0.0506, 0.3415], std: 0.0515
  RMSE : 0.0888, R2: 0.2207, MAE: 0.0706, Spearman rho: 0.4696, Spearman p: 3.9265e-34, Pearson r: 0.4734, Pearson p: 1.0005e-34
  Pred range: [0.0422, 0.3243], std: 0.0503
  RMSE : 0.0886, R2: 0.2245, MAE: 0.0698, Spearman rho: 0.4729, Spearman p: 1.1857e-34, Pearson r: 0.4778, Pearson p: 1.9809e-35
  Pred range: [0.0573, 0.3387], std: 0.0494
  RMSE : 0.0891, R2: 0.2163, MAE: 0.0712, Spearman rho: 0.4701, Spearman p: 3.3569e-34, Pearson r: 0.4747, Pearson p: 6.0943e-35
  Pred range: [0.0488, 0.3385], std: 0.0520
  RMSE : 0.0887, R2: 0.2226, MAE: 0.0705, Spearman rho: 0.4737, Spearman p: 8.9030e-35, Pearson r: 0.4781, Pearson p: 1.7410e-35
  Pred range: [0.0419, 0.3308], std: 0.0528
  RMSE : 0.0885, R2: 0.2257, MAE: 0.0701, Spearman rho: 0.4720, Spearman p: 1.6714e-34, Pearson r: 0.4778, Pearson p: 1.9647e-35
  Pred range: [0.0582, 0.3515], std: 0.0528
  RMSE : 0.0907, R2: 0.1868, MAE: 0.0728, Spearman rho: 0.4693, Spearman p: 4.3781e-34, Pearson r: 0.4748, Pearson p: 5.9020e-35
  Pred range: [0.0549, 0.3395], std: 0.0515
  RMSE : 0.0895, R2: 0.2080, MAE: 0.0716, Spearman rho: 0.4698, Spearman p: 3.6828e-34, Pearson r: 0.4751, Pearson p: 5.3321e-35
  Pred range: [0.0517, 0.3372], std: 0.0508
  RMSE : 0.0888, R2: 0.2213, MAE: 0.0706, Spearman rho: 0.4761, Spearman p: 3.6367e-35, Pearson r: 0.4802, Pearson p: 8.0885e-36
  Pred range: [0.0520, 0.3419], std: 0.0522
  RMSE : 0.0891, R2: 0.2162, MAE: 0.0709, Spearman rho: 0.4750, Spearman p: 5.6102e-35, Pearson r: 0.4796, Pearson p: 1.0022e-35
  Pred range: [0.0503, 0.3360], std: 0.0516
  RMSE : 0.0889, R2: 0.2189, MAE: 0.0708, Spearman rho: 0.4740, Spearman p: 7.8498e-35, Pearson r: 0.4789, Pearson p: 1.3143e-35
[I 2026-04-27 16:35:03,209] Trial 14 finished with value: 0.08851730196105848 and parameters: {'learning_rate': 0.0002448492136686774, 'batch_size': 4, 'num_epochs': 19, 'weight_decay': 0.0014340541879226576, 'layers_PRS': 4, 'layers_SCZ15': 3, 'layers_ADHD9': 1, 'layers_ASD9': 3, 'layers_ACE15': 2, 'layers_ACE18': 5, 'layers_SUD18': 5, 'layers_SES': 5, 'layers_SEX': 1, 'dropout': 0.49929265345353374, 'se_reduction': 6, 'hidden_dim_min': 4, 'base_loss': 'huber', 'huber_delta': 0.014589879983780377, 'focal_gamma': 2.0621796801017287, 'n_bins': 7, 'scheduler_patience': 2, 'scheduler_factor': 0.5136405302737819, 'early_stopping_patience': 5}. Best is trial 9 with value: 0.08803266597627345.
Train: 2407 rows (1613 IDs),Test: 598 rows (404 IDs) 

n_features_x : 6, n_features_per_modality: [16, 23, 19, 17, 7, 4, 4, 4, 1, 4]

--- ImbalancedRegressionLoss initialized ---
  Bins: 5, Focal gamma: 2.3446782124131436, Base loss: huber
  Bin [0.00, 0.20): count= 1876, weight=0.002
  Bin [0.20, 0.40): count=  497, weight=0.007
  Bin [0.40, 0.60): count=   32, weight=0.111
  Bin [0.60, 0.80): count=    2, weight=1.220
  Bin [0.80, 1.00): count=    0, weight=3.660
-------------------------------------------

  Pred range: [-0.0992, 0.1063], std: 0.0312
  RMSE : 0.1814, R2: -2.2510, MAE: 0.1507, Spearman rho: 0.0735, Spearman p: 7.2450e-02, Pearson r: 0.0897, Pearson p: 2.8242e-02
  Pred range: [-0.0150, 0.2580], std: 0.0399
  RMSE : 0.1129, R2: -0.2606, MAE: 0.0867, Spearman rho: 0.1739, Spearman p: 1.8945e-05, Pearson r: 0.1930, Pearson p: 2.0014e-06
  Pred range: [0.0467, 0.3747], std: 0.0484
  RMSE : 0.1037, R2: -0.0618, MAE: 0.0835, Spearman rho: 0.2172, Spearman p: 8.1542e-08, Pearson r: 0.2401, Pearson p: 2.7322e-09
  Pred range: [0.0638, 0.4107], std: 0.0509
  RMSE : 0.1120, R2: -0.2406, MAE: 0.0917, Spearman rho: 0.2487, Spearman p: 7.0389e-10, Pearson r: 0.2722, Pearson p: 1.2925e-11
  Pred range: [0.0683, 0.4114], std: 0.0510
  RMSE : 0.1127, R2: -0.2562, MAE: 0.0926, Spearman rho: 0.2738, Spearman p: 9.6116e-12, Pearson r: 0.2969, Pearson p: 1.2368e-13
  Pred range: [0.0703, 0.4044], std: 0.0505
  RMSE : 0.1117, R2: -0.2322, MAE: 0.0917, Spearman rho: 0.2921, Spearman p: 3.1454e-13, Pearson r: 0.3137, Pearson p: 4.0086e-15
[I 2026-04-27 16:35:13,247] Trial 15 pruned. 
Train: 2407 rows (1613 IDs),Test: 598 rows (404 IDs) 

n_features_x : 6, n_features_per_modality: [16, 23, 19, 17, 7, 4, 4, 4, 1, 4]

--- ImbalancedRegressionLoss initialized ---
  Bins: 7, Focal gamma: 0.9391808442307052, Base loss: huber
  Bin [0.00, 0.14): count= 1370, weight=0.002
  Bin [0.14, 0.29): count=  892, weight=0.003
  Bin [0.29, 0.43): count=  120, weight=0.024
  Bin [0.43, 0.57): count=   23, weight=0.122
  Bin [0.57, 0.71): count=    2, weight=0.978
  Bin [0.71, 0.86): count=    0, weight=2.935
  Bin [0.86, 1.00): count=    0, weight=2.935
-------------------------------------------

  Pred range: [0.0514, 0.3419], std: 0.0498
  RMSE : 0.1032, R2: -0.0515, MAE: 0.0832, Spearman rho: 0.2802, Spearman p: 3.0068e-12, Pearson r: 0.2757, Pearson p: 6.7937e-12
  Pred range: [0.0541, 0.3999], std: 0.0550
  RMSE : 0.0983, R2: 0.0443, MAE: 0.0790, Spearman rho: 0.3752, Spearman p: 1.9998e-21, Pearson r: 0.3709, Pearson p: 6.1528e-21
  Pred range: [0.0445, 0.4019], std: 0.0558
  RMSE : 0.0942, R2: 0.1236, MAE: 0.0752, Spearman rho: 0.4136, Spearman p: 4.1150e-26, Pearson r: 0.4117, Pearson p: 7.3481e-26
  Pred range: [0.0444, 0.4120], std: 0.0591
  RMSE : 0.0943, R2: 0.1216, MAE: 0.0755, Spearman rho: 0.4336, Spearman p: 8.2138e-29, Pearson r: 0.4346, Pearson p: 6.0689e-29
  Pred range: [0.0420, 0.4154], std: 0.0603
  RMSE : 0.0934, R2: 0.1378, MAE: 0.0747, Spearman rho: 0.4474, Spearman p: 8.8617e-31, Pearson r: 0.4490, Pearson p: 5.1774e-31
  Pred range: [0.0379, 0.3935], std: 0.0596
  RMSE : 0.0913, R2: 0.1764, MAE: 0.0725, Spearman rho: 0.4592, Spearman p: 1.5697e-32, Pearson r: 0.4609, Pearson p: 8.7556e-33
  Pred range: [0.0329, 0.3785], std: 0.0587
  RMSE : 0.0898, R2: 0.2028, MAE: 0.0708, Spearman rho: 0.4669, Spearman p: 1.0624e-33, Pearson r: 0.4686, Pearson p: 5.6627e-34
  Pred range: [0.0475, 0.4000], std: 0.0602
  RMSE : 0.0925, R2: 0.1544, MAE: 0.0741, Spearman rho: 0.4665, Spearman p: 1.1840e-33, Pearson r: 0.4691, Pearson p: 4.7323e-34
  Pred range: [0.0566, 0.4232], std: 0.0619
  RMSE : 0.0957, R2: 0.0944, MAE: 0.0773, Spearman rho: 0.4661, Spearman p: 1.3736e-33, Pearson r: 0.4692, Pearson p: 4.6227e-34
  Pred range: [0.0511, 0.3886], std: 0.0586
  RMSE : 0.0916, R2: 0.1711, MAE: 0.0733, Spearman rho: 0.4707, Spearman p: 2.6470e-34, Pearson r: 0.4732, Pearson p: 1.0757e-34
  Pred range: [0.0479, 0.3827], std: 0.0584
  RMSE : 0.0906, R2: 0.1887, MAE: 0.0722, Spearman rho: 0.4741, Spearman p: 7.7604e-35, Pearson r: 0.4760, Pearson p: 3.8699e-35
  Pred range: [0.0495, 0.3815], std: 0.0583
  RMSE : 0.0908, R2: 0.1855, MAE: 0.0724, Spearman rho: 0.4742, Spearman p: 7.5220e-35, Pearson r: 0.4763, Pearson p: 3.4252e-35
[I 2026-04-27 16:36:25,557] Trial 16 finished with value: 0.08981876958952081 and parameters: {'learning_rate': 0.00020808000204414589, 'batch_size': 6, 'num_epochs': 22, 'weight_decay': 0.002335379911009054, 'layers_PRS': 4, 'layers_SCZ15': 3, 'layers_ADHD9': 2, 'layers_ASD9': 2, 'layers_ACE15': 5, 'layers_ACE18': 3, 'layers_SUD18': 5, 'layers_SES': 4, 'layers_SEX': 2, 'dropout': 0.3051978263391431, 'se_reduction': 8, 'hidden_dim_min': 8, 'base_loss': 'huber', 'huber_delta': 0.03507584293366423, 'focal_gamma': 0.9391808442307052, 'n_bins': 7, 'scheduler_patience': 2, 'scheduler_factor': 0.518522594936784, 'early_stopping_patience': 5}. Best is trial 9 with value: 0.08803266597627345.
Train: 2407 rows (1613 IDs),Test: 598 rows (404 IDs) 

n_features_x : 6, n_features_per_modality: [16, 23, 19, 17, 7, 4, 4, 4, 1, 4]

--- ImbalancedRegressionLoss initialized ---
  Bins: 8, Focal gamma: 2.867834402178699, Base loss: huber
  Bin [0.00, 0.12): count= 1180, weight=0.003
  Bin [0.12, 0.25): count=  933, weight=0.003
  Bin [0.25, 0.38): count=  253, weight=0.012
  Bin [0.38, 0.50): count=   30, weight=0.098
  Bin [0.50, 0.62): count=   10, weight=0.277
  Bin [0.62, 0.75): count=    1, weight=1.521
  Bin [0.75, 0.88): count=    0, weight=3.043
  Bin [0.88, 1.00): count=    0, weight=3.043
-------------------------------------------

  Pred range: [0.0052, 0.3343], std: 0.0476
  RMSE : 0.1019, R2: -0.0253, MAE: 0.0804, Spearman rho: 0.1865, Spearman p: 4.3942e-06, Pearson r: 0.2099, Pearson p: 2.2234e-07
  Pred range: [0.0336, 0.3589], std: 0.0494
  RMSE : 0.1014, R2: -0.0157, MAE: 0.0805, Spearman rho: 0.2396, Spearman p: 2.9452e-09, Pearson r: 0.2542, Pearson p: 2.8637e-10
  Pred range: [0.0456, 0.3584], std: 0.0494
  RMSE : 0.0998, R2: 0.0152, MAE: 0.0793, Spearman rho: 0.2731, Spearman p: 1.0891e-11, Pearson r: 0.2848, Pearson p: 1.2802e-12
  Pred range: [0.0537, 0.3598], std: 0.0496
  RMSE : 0.0990, R2: 0.0308, MAE: 0.0788, Spearman rho: 0.2999, Spearman p: 6.7952e-14, Pearson r: 0.3071, Pearson p: 1.5897e-14
  Pred range: [0.0554, 0.3681], std: 0.0506
  RMSE : 0.0992, R2: 0.0270, MAE: 0.0791, Spearman rho: 0.3167, Spearman p: 2.1503e-15, Pearson r: 0.3227, Pearson p: 5.8546e-16
  Pred range: [0.0532, 0.3591], std: 0.0498
  RMSE : 0.0975, R2: 0.0604, MAE: 0.0776, Spearman rho: 0.3325, Spearman p: 6.7423e-17, Pearson r: 0.3378, Pearson p: 2.0085e-17
[I 2026-04-27 16:37:37,178] Trial 17 pruned. 
Train: 2407 rows (1613 IDs),Test: 598 rows (404 IDs) 

n_features_x : 6, n_features_per_modality: [16, 23, 19, 17, 7, 4, 4, 4, 1, 4]

--- ImbalancedRegressionLoss initialized ---
  Bins: 9, Focal gamma: 1.6129617773822247, Base loss: huber
  Bin [0.00, 0.11): count= 1180, weight=0.003
  Bin [0.11, 0.22): count=  835, weight=0.004
  Bin [0.22, 0.33): count=  312, weight=0.010
  Bin [0.33, 0.44): count=   59, weight=0.054
  Bin [0.44, 0.56): count=   16, weight=0.190
  Bin [0.56, 0.67): count=    4, weight=0.647
  Bin [0.67, 0.78): count=    1, weight=1.618
  Bin [0.78, 0.89): count=    0, weight=3.237
  Bin [0.89, 1.00): count=    0, weight=3.237
-------------------------------------------

  Pred range: [0.0454, 0.4108], std: 0.0523
  RMSE : 0.0923, R2: 0.1577, MAE: 0.0730, Spearman rho: 0.4187, Spearman p: 8.9163e-27, Pearson r: 0.4206, Pearson p: 4.9840e-27
  Pred range: [0.0482, 0.3980], std: 0.0547
  RMSE : 0.0908, R2: 0.1844, MAE: 0.0721, Spearman rho: 0.4556, Spearman p: 5.4735e-32, Pearson r: 0.4604, Pearson p: 1.0320e-32
  Pred range: [0.0174, 0.3395], std: 0.0539
  RMSE : 0.0890, R2: 0.2166, MAE: 0.0696, Spearman rho: 0.4643, Spearman p: 2.5977e-33, Pearson r: 0.4721, Pearson p: 1.6050e-34
  Pred range: [0.0523, 0.3659], std: 0.0529
  RMSE : 0.0903, R2: 0.1942, MAE: 0.0719, Spearman rho: 0.4666, Spearman p: 1.1674e-33, Pearson r: 0.4739, Pearson p: 8.1880e-35
  Pred range: [0.0519, 0.3943], std: 0.0556
  RMSE : 0.0906, R2: 0.1883, MAE: 0.0722, Spearman rho: 0.4698, Spearman p: 3.7308e-34, Pearson r: 0.4754, Pearson p: 4.7899e-35
  Pred range: [0.0425, 0.3839], std: 0.0581
  RMSE : 0.0912, R2: 0.1779, MAE: 0.0727, Spearman rho: 0.4730, Spearman p: 1.1417e-34, Pearson r: 0.4798, Pearson p: 9.4262e-36
  Pred range: [0.0317, 0.3525], std: 0.0547
  RMSE : 0.0885, R2: 0.2254, MAE: 0.0696, Spearman rho: 0.4717, Spearman p: 1.8324e-34, Pearson r: 0.4802, Pearson p: 7.9445e-36
  Pred range: [0.0366, 0.3512], std: 0.0543
  RMSE : 0.0889, R2: 0.2191, MAE: 0.0702, Spearman rho: 0.4699, Spearman p: 3.5083e-34, Pearson r: 0.4776, Pearson p: 2.0917e-35
  Pred range: [0.0318, 0.3565], std: 0.0531
  RMSE : 0.0886, R2: 0.2240, MAE: 0.0701, Spearman rho: 0.4711, Spearman p: 2.3213e-34, Pearson r: 0.4804, Pearson p: 7.4559e-36
  Pred range: [0.0286, 0.3569], std: 0.0541
  RMSE : 0.0888, R2: 0.2209, MAE: 0.0701, Spearman rho: 0.4685, Spearman p: 5.8532e-34, Pearson r: 0.4769, Pearson p: 2.7023e-35
  Pred range: [0.0265, 0.3571], std: 0.0539
  RMSE : 0.0888, R2: 0.2202, MAE: 0.0701, Spearman rho: 0.4673, Spearman p: 9.0521e-34, Pearson r: 0.4753, Pearson p: 4.8781e-35
[I 2026-04-27 16:39:05,042] Trial 18 finished with value: 0.08853775312619647 and parameters: {'learning_rate': 0.0004242286723297681, 'batch_size': 4, 'num_epochs': 21, 'weight_decay': 0.00016032188989990068, 'layers_PRS': 5, 'layers_SCZ15': 4, 'layers_ADHD9': 1, 'layers_ASD9': 2, 'layers_ACE15': 2, 'layers_ACE18': 2, 'layers_SUD18': 3, 'layers_SES': 6, 'layers_SEX': 1, 'dropout': 0.4110901262000439, 'se_reduction': 6, 'hidden_dim_min': 10, 'base_loss': 'huber', 'huber_delta': 0.08907100030047618, 'focal_gamma': 1.6129617773822247, 'n_bins': 9, 'scheduler_patience': 2, 'scheduler_factor': 0.5468406601901694, 'early_stopping_patience': 4}. Best is trial 9 with value: 0.08803266597627345.
Train: 2407 rows (1613 IDs),Test: 598 rows (404 IDs) 

n_features_x : 6, n_features_per_modality: [16, 23, 19, 17, 7, 4, 4, 4, 1, 4]

--- ImbalancedRegressionLoss initialized ---
  Bins: 16, Focal gamma: 2.0751056901550062, Base loss: huber
  Bin [0.00, 0.06): count=  650, weight=0.004
  Bin [0.06, 0.12): count=  530, weight=0.005
  Bin [0.12, 0.19): count=  536, weight=0.005
  Bin [0.19, 0.25): count=  397, weight=0.007
  Bin [0.25, 0.31): count=  190, weight=0.014
  Bin [0.31, 0.38): count=   63, weight=0.042
  Bin [0.38, 0.44): count=   20, weight=0.127
  Bin [0.44, 0.50): count=   10, weight=0.242
  Bin [0.50, 0.56): count=    6, weight=0.380
  Bin [0.56, 0.62): count=    4, weight=0.532
  Bin [0.62, 0.69): count=    0, weight=2.662
  Bin [0.69, 0.75): count=    1, weight=1.331
  Bin [0.75, 0.81): count=    0, weight=2.662
  Bin [0.81, 0.88): count=    0, weight=2.662
  Bin [0.88, 0.94): count=    0, weight=2.662
  Bin [0.94, 1.00): count=    0, weight=2.662
-------------------------------------------

  Pred range: [0.0273, 0.3948], std: 0.0541
  RMSE : 0.0909, R2: 0.1830, MAE: 0.0713, Spearman rho: 0.4392, Spearman p: 1.3661e-29, Pearson r: 0.4409, Pearson p: 7.7569e-30
  Pred range: [0.0627, 0.4297], std: 0.0637
  RMSE : 0.1027, R2: -0.0421, MAE: 0.0838, Spearman rho: 0.4444, Spearman p: 2.4549e-30, Pearson r: 0.4563, Pearson p: 4.3492e-32
  Pred range: [0.0332, 0.3247], std: 0.0527
  RMSE : 0.0888, R2: 0.2201, MAE: 0.0699, Spearman rho: 0.4611, Spearman p: 8.0566e-33, Pearson r: 0.4720, Pearson p: 1.6567e-34
  Pred range: [0.0434, 0.3613], std: 0.0548
  RMSE : 0.0899, R2: 0.2020, MAE: 0.0708, Spearman rho: 0.4546, Spearman p: 7.9275e-32, Pearson r: 0.4597, Pearson p: 1.3354e-32
  Pred range: [0.0675, 0.4045], std: 0.0571
  RMSE : 0.0984, R2: 0.0428, MAE: 0.0790, Spearman rho: 0.4276, Spearman p: 5.5799e-28, Pearson r: 0.4224, Pearson p: 2.8330e-27
  Pred range: [0.0482, 0.3509], std: 0.0551
  RMSE : 0.0926, R2: 0.1526, MAE: 0.0736, Spearman rho: 0.4322, Spearman p: 1.3047e-28, Pearson r: 0.4290, Pearson p: 3.5407e-28
  Pred range: [0.0112, 0.2450], std: 0.0402
  RMSE : 0.0936, R2: 0.1349, MAE: 0.0730, Spearman rho: 0.4462, Spearman p: 1.3503e-30, Pearson r: 0.4441, Pearson p: 2.6809e-30
  Pred range: [0.0494, 0.3444], std: 0.0535
  RMSE : 0.0896, R2: 0.2070, MAE: 0.0712, Spearman rho: 0.4611, Spearman p: 8.2637e-33, Pearson r: 0.4692, Pearson p: 4.6156e-34
[I 2026-04-27 16:40:39,714] Trial 19 finished with value: 0.08883821623022202 and parameters: {'learning_rate': 0.0025622224493934975, 'batch_size': 4, 'num_epochs': 25, 'weight_decay': 0.004205720473180417, 'layers_PRS': 3, 'layers_SCZ15': 6, 'layers_ADHD9': 4, 'layers_ASD9': 5, 'layers_ACE15': 7, 'layers_ACE18': 5, 'layers_SUD18': 5, 'layers_SES': 4, 'layers_SEX': 2, 'dropout': 0.2728901195058444, 'se_reduction': 7, 'hidden_dim_min': 2, 'base_loss': 'huber', 'huber_delta': 0.03224732075083007, 'focal_gamma': 2.0751056901550062, 'n_bins': 16, 'scheduler_patience': 3, 'scheduler_factor': 0.38596823966924476, 'early_stopping_patience': 5}. Best is trial 9 with value: 0.08803266597627345.
Train: 2407 rows (1613 IDs),Test: 598 rows (404 IDs) 

n_features_x : 6, n_features_per_modality: [16, 23, 19, 17, 7, 4, 4, 4, 1, 4]

--- ImbalancedRegressionLoss initialized ---
  Bins: 16, Focal gamma: 2.6042363935990096, Base loss: huber
  Bin [0.00, 0.06): count=  650, weight=0.004
  Bin [0.06, 0.12): count=  530, weight=0.005
  Bin [0.12, 0.19): count=  536, weight=0.005
  Bin [0.19, 0.25): count=  397, weight=0.007
  Bin [0.25, 0.31): count=  190, weight=0.014
  Bin [0.31, 0.38): count=   63, weight=0.042
  Bin [0.38, 0.44): count=   20, weight=0.127
  Bin [0.44, 0.50): count=   10, weight=0.242
  Bin [0.50, 0.56): count=    6, weight=0.380
  Bin [0.56, 0.62): count=    4, weight=0.532
  Bin [0.62, 0.69): count=    0, weight=2.662
  Bin [0.69, 0.75): count=    1, weight=1.331
  Bin [0.75, 0.81): count=    0, weight=2.662
  Bin [0.81, 0.88): count=    0, weight=2.662
  Bin [0.88, 0.94): count=    0, weight=2.662
  Bin [0.94, 1.00): count=    0, weight=2.662
-------------------------------------------

  Pred range: [0.0565, 0.3840], std: 0.0415
  RMSE : 0.1284, R2: -0.6304, MAE: 0.1072, Spearman rho: 0.0807, Spearman p: 4.8639e-02, Pearson r: 0.1235, Pearson p: 2.4881e-03
  Pred range: [0.0747, 0.3969], std: 0.0429
  RMSE : 0.1283, R2: -0.6259, MAE: 0.1072, Spearman rho: 0.1552, Spearman p: 1.3834e-04, Pearson r: 0.1965, Pearson p: 1.2901e-06
  Pred range: [0.0852, 0.4030], std: 0.0444
  RMSE : 0.1266, R2: -0.5846, MAE: 0.1057, Spearman rho: 0.2061, Spearman p: 3.7075e-07, Pearson r: 0.2436, Pearson p: 1.5869e-09
  Pred range: [0.0820, 0.3921], std: 0.0442
  RMSE : 0.1184, R2: -0.3849, MAE: 0.0981, Spearman rho: 0.2344, Spearman p: 6.6017e-09, Pearson r: 0.2706, Pearson p: 1.7162e-11
  Pred range: [0.0837, 0.3880], std: 0.0452
  RMSE : 0.1144, R2: -0.2933, MAE: 0.0944, Spearman rho: 0.2639, Spearman p: 5.5487e-11, Pearson r: 0.2955, Pearson p: 1.6183e-13
  Pred range: [0.0966, 0.3885], std: 0.0470
  RMSE : 0.1158, R2: -0.3253, MAE: 0.0957, Spearman rho: 0.2904, Spearman p: 4.3891e-13, Pearson r: 0.3202, Pearson p: 9.9594e-16
