[I 2026-04-27 23:40:26,890] Trial 17 pruned. 
Train: 2407 rows (1613 IDs),Test: 598 rows (404 IDs) 

n_features_x : 6, n_features_per_modality: [16, 23, 19, 17, 7, 4, 4, 4, 1, 4]

--- ImbalancedRegressionLoss initialized ---
  Bins: 9, Focal gamma: 1.5528607800695955, Base loss: huber
  Bin [0.00, 0.11): count= 1180, weight=0.003
  Bin [0.11, 0.22): count=  835, weight=0.004
  Bin [0.22, 0.33): count=  312, weight=0.010
  Bin [0.33, 0.44): count=   59, weight=0.054
  Bin [0.44, 0.56): count=   16, weight=0.190
  Bin [0.56, 0.67): count=    4, weight=0.647
  Bin [0.67, 0.78): count=    1, weight=1.618
  Bin [0.78, 0.89): count=    0, weight=3.237
  Bin [0.89, 1.00): count=    0, weight=3.237
-------------------------------------------

  Pred range: [0.0479, 0.3715], std: 0.0555
  RMSE : 0.0969, R2: 0.0713, MAE: 0.0779, Spearman rho: 0.4231, Spearman p: 2.2660e-27, Pearson r: 0.4260, Pearson p: 9.1511e-28
  Pred range: [0.0296, 0.3598], std: 0.0549
  RMSE : 0.0910, R2: 0.1814, MAE: 0.0713, Spearman rho: 0.4390, Spearman p: 1.4646e-29, Pearson r: 0.4394, Pearson p: 1.2851e-29
  Pred range: [0.0580, 0.3848], std: 0.0553
  RMSE : 0.0933, R2: 0.1404, MAE: 0.0751, Spearman rho: 0.4561, Spearman p: 4.6232e-32, Pearson r: 0.4632, Pearson p: 3.9019e-33
  Pred range: [0.0574, 0.3732], std: 0.0530
  RMSE : 0.0919, R2: 0.1653, MAE: 0.0740, Spearman rho: 0.4632, Spearman p: 3.9245e-33, Pearson r: 0.4703, Pearson p: 3.1198e-34
  Pred range: [0.0554, 0.4140], std: 0.0587
  RMSE : 0.0926, R2: 0.1528, MAE: 0.0740, Spearman rho: 0.4702, Spearman p: 3.2313e-34, Pearson r: 0.4762, Pearson p: 3.4973e-35
  Pred range: [0.0390, 0.3621], std: 0.0542
  RMSE : 0.0886, R2: 0.2237, MAE: 0.0699, Spearman rho: 0.4712, Spearman p: 2.2126e-34, Pearson r: 0.4782, Pearson p: 1.7157e-35
  Pred range: [0.0430, 0.3741], std: 0.0558
  RMSE : 0.0892, R2: 0.2133, MAE: 0.0708, Spearman rho: 0.4697, Spearman p: 3.8625e-34, Pearson r: 0.4780, Pearson p: 1.8341e-35
  Pred range: [0.0414, 0.3650], std: 0.0540
  RMSE : 0.0889, R2: 0.2199, MAE: 0.0705, Spearman rho: 0.4698, Spearman p: 3.7253e-34, Pearson r: 0.4780, Pearson p: 1.8278e-35
  Pred range: [0.0525, 0.3759], std: 0.0547
  RMSE : 0.0904, R2: 0.1922, MAE: 0.0723, Spearman rho: 0.4679, Spearman p: 7.3741e-34, Pearson r: 0.4761, Pearson p: 3.6406e-35
  Pred range: [0.0544, 0.3792], std: 0.0552
  RMSE : 0.0911, R2: 0.1794, MAE: 0.0730, Spearman rho: 0.4673, Spearman p: 9.1043e-34, Pearson r: 0.4757, Pearson p: 4.2220e-35
  Pred range: [0.0563, 0.3814], std: 0.0546
  RMSE : 0.0912, R2: 0.1784, MAE: 0.0732, Spearman rho: 0.4693, Spearman p: 4.4737e-34, Pearson r: 0.4770, Pearson p: 2.6505e-35
  Pred range: [0.0514, 0.3712], std: 0.0541
  RMSE : 0.0900, R2: 0.1988, MAE: 0.0720, Spearman rho: 0.4689, Spearman p: 5.0672e-34, Pearson r: 0.4770, Pearson p: 2.6668e-35
  Pred range: [0.0527, 0.3777], std: 0.0549
  RMSE : 0.0907, R2: 0.1878, MAE: 0.0726, Spearman rho: 0.4694, Spearman p: 4.3213e-34, Pearson r: 0.4774, Pearson p: 2.2687e-35
  Pred range: [0.0507, 0.3725], std: 0.0544
  RMSE : 0.0900, R2: 0.2003, MAE: 0.0719, Spearman rho: 0.4706, Spearman p: 2.8018e-34, Pearson r: 0.4785, Pearson p: 1.4904e-35
[I 2026-04-27 23:42:18,439] Trial 18 finished with value: 0.08863542013253882 and parameters: {'learning_rate': 0.0008489563602125075, 'batch_size': 4, 'num_epochs': 26, 'weight_decay': 0.002071878736651649, 'depth_complex': 4, 'depth_moderate': 3, 'depth_simple': 1, 'dropout': 0.28220673746567965, 'se_reduction': 4, 'hidden_dim_min': 11, 'base_loss': 'huber', 'huber_delta': 0.08247579495074328, 'focal_gamma': 1.5528607800695955, 'n_bins': 9, 'scheduler_patience': 2, 'scheduler_factor': 0.3638702057274577, 'early_stopping_patience': 8}. Best is trial 8 with value: 0.08787048956906457.
Train: 2407 rows (1613 IDs),Test: 598 rows (404 IDs) 

n_features_x : 6, n_features_per_modality: [16, 23, 19, 17, 7, 4, 4, 4, 1, 4]

--- ImbalancedRegressionLoss initialized ---
  Bins: 7, Focal gamma: 1.9703866079659627, Base loss: huber
  Bin [0.00, 0.14): count= 1370, weight=0.002
  Bin [0.14, 0.29): count=  892, weight=0.003
  Bin [0.29, 0.43): count=  120, weight=0.024
  Bin [0.43, 0.57): count=   23, weight=0.122
  Bin [0.57, 0.71): count=    2, weight=0.978
  Bin [0.71, 0.86): count=    0, weight=2.935
  Bin [0.86, 1.00): count=    0, weight=2.935
-------------------------------------------

  Pred range: [0.0371, 0.3909], std: 0.0442
  RMSE : 0.1031, R2: -0.0501, MAE: 0.0837, Spearman rho: 0.2168, Spearman p: 8.6404e-08, Pearson r: 0.2393, Pearson p: 3.1112e-09
  Pred range: [0.0505, 0.4500], std: 0.0532
  RMSE : 0.1034, R2: -0.0560, MAE: 0.0836, Spearman rho: 0.3317, Spearman p: 7.9158e-17, Pearson r: 0.3387, Pearson p: 1.6293e-17
  Pred range: [0.0413, 0.4476], std: 0.0553
  RMSE : 0.0978, R2: 0.0551, MAE: 0.0786, Spearman rho: 0.3725, Spearman p: 4.0303e-21, Pearson r: 0.3811, Pearson p: 4.1842e-22
  Pred range: [0.0371, 0.4376], std: 0.0548
  RMSE : 0.0944, R2: 0.1190, MAE: 0.0756, Spearman rho: 0.3964, Spearman p: 6.0902e-24, Pearson r: 0.4053, Pearson p: 4.7286e-25
  Pred range: [0.0414, 0.4451], std: 0.0570
  RMSE : 0.0945, R2: 0.1184, MAE: 0.0756, Spearman rho: 0.4101, Spearman p: 1.1640e-25, Pearson r: 0.4199, Pearson p: 6.1353e-27
  Pred range: [0.0402, 0.4251], std: 0.0558
  RMSE : 0.0925, R2: 0.1540, MAE: 0.0740, Spearman rho: 0.4208, Spearman p: 4.5797e-27, Pearson r: 0.4318, Pearson p: 1.4582e-28
  Pred range: [0.0559, 0.4482], std: 0.0587
  RMSE : 0.0968, R2: 0.0744, MAE: 0.0779, Spearman rho: 0.4257, Spearman p: 1.0246e-27, Pearson r: 0.4361, Pearson p: 3.6969e-29
  Pred range: [0.0531, 0.4488], std: 0.0599
  RMSE : 0.0958, R2: 0.0932, MAE: 0.0769, Spearman rho: 0.4316, Spearman p: 1.5820e-28, Pearson r: 0.4404, Pearson p: 9.1789e-30
[I 2026-04-27 23:42:54,342] Trial 19 pruned. 
Train: 2407 rows (1613 IDs),Test: 598 rows (404 IDs) 

n_features_x : 6, n_features_per_modality: [16, 23, 19, 17, 7, 4, 4, 4, 1, 4]

--- ImbalancedRegressionLoss initialized ---
  Bins: 11, Focal gamma: 0.9854948213557408, Base loss: huber
  Bin [0.00, 0.09): count= 1010, weight=0.003
  Bin [0.09, 0.18): count=  706, weight=0.004
  Bin [0.18, 0.27): count=  478, weight=0.006
  Bin [0.27, 0.36): count=  159, weight=0.018
  Bin [0.36, 0.45): count=   33, weight=0.085
  Bin [0.45, 0.55): count=   16, weight=0.170
  Bin [0.55, 0.64): count=    4, weight=0.579
  Bin [0.64, 0.73): count=    1, weight=1.448
  Bin [0.73, 0.82): count=    0, weight=2.896
  Bin [0.82, 0.91): count=    0, weight=2.896
  Bin [0.91, 1.00): count=    0, weight=2.896
-------------------------------------------

  Pred range: [0.0701, 0.4134], std: 0.0561
  RMSE : 0.1132, R2: -0.2660, MAE: 0.0934, Spearman rho: 0.4035, Spearman p: 8.0638e-25, Pearson r: 0.4117, Pearson p: 7.2501e-26
  Pred range: [0.0640, 0.4347], std: 0.0625
  RMSE : 0.1122, R2: -0.2431, MAE: 0.0920, Spearman rho: 0.4219, Spearman p: 3.2675e-27, Pearson r: 0.4310, Pearson p: 1.9198e-28
  Pred range: [0.0417, 0.3955], std: 0.0614
  RMSE : 0.0986, R2: 0.0401, MAE: 0.0800, Spearman rho: 0.4332, Spearman p: 9.4642e-29, Pearson r: 0.4455, Pearson p: 1.6772e-30
  Pred range: [0.0568, 0.4375], std: 0.0656
  RMSE : 0.1061, R2: -0.1125, MAE: 0.0864, Spearman rho: 0.4378, Spearman p: 2.1108e-29, Pearson r: 0.4481, Pearson p: 7.2223e-31
  Pred range: [0.0511, 0.4199], std: 0.0644
  RMSE : 0.1009, R2: -0.0052, MAE: 0.0819, Spearman rho: 0.4437, Spearman p: 3.0483e-30, Pearson r: 0.4556, Pearson p: 5.4927e-32
  Pred range: [0.0630, 0.4484], std: 0.0662
  RMSE : 0.1079, R2: -0.1501, MAE: 0.0883, Spearman rho: 0.4469, Spearman p: 1.0768e-30, Pearson r: 0.4590, Pearson p: 1.7035e-32
[I 2026-04-27 23:43:09,270] Trial 20 pruned. 
Train: 2407 rows (1613 IDs),Test: 598 rows (404 IDs) 

n_features_x : 6, n_features_per_modality: [16, 23, 19, 17, 7, 4, 4, 4, 1, 4]

--- ImbalancedRegressionLoss initialized ---
  Bins: 12, Focal gamma: 2.413769371182892, Base loss: huber
  Bin [0.00, 0.08): count=  828, weight=0.003
  Bin [0.08, 0.17): count=  710, weight=0.004
  Bin [0.17, 0.25): count=  575, weight=0.005
  Bin [0.25, 0.33): count=  214, weight=0.013
  Bin [0.33, 0.42): count=   55, weight=0.051
  Bin [0.42, 0.50): count=   14, weight=0.191
  Bin [0.50, 0.58): count=    9, weight=0.286
  Bin [0.58, 0.67): count=    1, weight=1.431
  Bin [0.67, 0.75): count=    1, weight=1.431
  Bin [0.75, 0.83): count=    0, weight=2.862
  Bin [0.83, 0.92): count=    0, weight=2.862
  Bin [0.92, 1.00): count=    0, weight=2.862
-------------------------------------------

  Pred range: [0.0205, 0.3559], std: 0.0490
  RMSE : 0.0956, R2: 0.0972, MAE: 0.0740, Spearman rho: 0.4150, Spearman p: 2.6941e-26, Pearson r: 0.4061, Pearson p: 3.8288e-25
  Pred range: [0.0661, 0.3715], std: 0.0520
  RMSE : 0.0956, R2: 0.0966, MAE: 0.0779, Spearman rho: 0.4439, Spearman p: 2.9228e-30, Pearson r: 0.4578, Pearson p: 2.5766e-32
  Pred range: [0.0594, 0.3288], std: 0.0473
  RMSE : 0.0905, R2: 0.1902, MAE: 0.0723, Spearman rho: 0.4564, Spearman p: 4.2271e-32, Pearson r: 0.4593, Pearson p: 1.5409e-32
  Pred range: [0.0943, 0.4464], std: 0.0592
  RMSE : 0.1129, R2: -0.2597, MAE: 0.0941, Spearman rho: 0.4464, Spearman p: 1.2495e-30, Pearson r: 0.4497, Pearson p: 4.1509e-31
  Pred range: [0.0441, 0.2819], std: 0.0406
  RMSE : 0.0903, R2: 0.1939, MAE: 0.0707, Spearman rho: 0.4875, Spearman p: 5.1406e-37, Pearson r: 0.4817, Pearson p: 4.5531e-36
  Pred range: [0.0288, 0.2754], std: 0.0427
  RMSE : 0.0920, R2: 0.1637, MAE: 0.0710, Spearman rho: 0.4912, Spearman p: 1.2329e-37, Pearson r: 0.4942, Pearson p: 3.7937e-38
  Pred range: [0.0422, 0.2931], std: 0.0483
  RMSE : 0.0890, R2: 0.2168, MAE: 0.0709, Spearman rho: 0.4731, Spearman p: 1.1146e-34, Pearson r: 0.4739, Pearson p: 8.3988e-35
  Pred range: [0.0338, 0.3819], std: 0.0546
  RMSE : 0.0886, R2: 0.2248, MAE: 0.0697, Spearman rho: 0.4766, Spearman p: 3.1023e-35, Pearson r: 0.4792, Pearson p: 1.1769e-35
  Pred range: [0.0702, 0.3927], std: 0.0557
  RMSE : 0.0963, R2: 0.0844, MAE: 0.0783, Spearman rho: 0.4697, Spearman p: 3.8549e-34, Pearson r: 0.4764, Pearson p: 3.3500e-35
  Pred range: [0.0510, 0.3423], std: 0.0519
  RMSE : 0.0885, R2: 0.2254, MAE: 0.0703, Spearman rho: 0.4677, Spearman p: 7.7893e-34, Pearson r: 0.4784, Pearson p: 1.5631e-35
  Pred range: [0.0494, 0.4008], std: 0.0574
  RMSE : 0.0917, R2: 0.1696, MAE: 0.0725, Spearman rho: 0.4492, Spearman p: 4.9528e-31, Pearson r: 0.4549, Pearson p: 7.1455e-32
  Pred range: [0.0435, 0.2940], std: 0.0411
  RMSE : 0.0898, R2: 0.2040, MAE: 0.0712, Spearman rho: 0.4611, Spearman p: 8.0888e-33, Pearson r: 0.4563, Pearson p: 4.2712e-32
  Pred range: [0.0176, 0.3956], std: 0.0581
  RMSE : 0.0919, R2: 0.1646, MAE: 0.0715, Spearman rho: 0.4475, Spearman p: 8.5798e-31, Pearson r: 0.4495, Pearson p: 4.3922e-31
  Pred range: [0.0668, 0.3337], std: 0.0495
  RMSE : 0.0923, R2: 0.1583, MAE: 0.0743, Spearman rho: 0.4689, Spearman p: 5.0474e-34, Pearson r: 0.4711, Pearson p: 2.3371e-34
  Pred range: [0.0384, 0.3438], std: 0.0479
  RMSE : 0.0887, R2: 0.2225, MAE: 0.0697, Spearman rho: 0.4806, Spearman p: 6.9390e-36, Pearson r: 0.4770, Pearson p: 2.6718e-35
  Pred range: [0.0632, 0.3531], std: 0.0502
  RMSE : 0.0906, R2: 0.1882, MAE: 0.0724, Spearman rho: 0.4765, Spearman p: 3.2059e-35, Pearson r: 0.4785, Pearson p: 1.5220e-35
  Pred range: [0.0688, 0.3692], std: 0.0530
  RMSE : 0.0930, R2: 0.1461, MAE: 0.0750, Spearman rho: 0.4803, Spearman p: 7.8016e-36, Pearson r: 0.4822, Pearson p: 3.7483e-36
[I 2026-04-27 23:45:21,455] Trial 21 finished with value: 0.08853529166197167 and parameters: {'learning_rate': 0.0020125620832837244, 'batch_size': 4, 'num_epochs': 24, 'weight_decay': 0.008930851682618483, 'depth_complex': 3, 'depth_moderate': 4, 'depth_simple': 1, 'dropout': 0.35794999839648795, 'se_reduction': 6, 'hidden_dim_min': 6, 'base_loss': 'huber', 'huber_delta': 0.0662547732503814, 'focal_gamma': 2.413769371182892, 'n_bins': 12, 'scheduler_patience': 2, 'scheduler_factor': 0.6025306972418593, 'early_stopping_patience': 7}. Best is trial 8 with value: 0.08787048956906457.
Train: 2407 rows (1613 IDs),Test: 598 rows (404 IDs) 

n_features_x : 6, n_features_per_modality: [16, 23, 19, 17, 7, 4, 4, 4, 1, 4]

--- ImbalancedRegressionLoss initialized ---
  Bins: 9, Focal gamma: 2.232660448508375, Base loss: huber
  Bin [0.00, 0.11): count= 1180, weight=0.003
  Bin [0.11, 0.22): count=  835, weight=0.004
  Bin [0.22, 0.33): count=  312, weight=0.010
  Bin [0.33, 0.44): count=   59, weight=0.054
  Bin [0.44, 0.56): count=   16, weight=0.190
  Bin [0.56, 0.67): count=    4, weight=0.647
  Bin [0.67, 0.78): count=    1, weight=1.618
  Bin [0.78, 0.89): count=    0, weight=3.237
  Bin [0.89, 1.00): count=    0, weight=3.237
-------------------------------------------

  Pred range: [0.0547, 0.3830], std: 0.0532
  RMSE : 0.0908, R2: 0.1856, MAE: 0.0722, Spearman rho: 0.4549, Spearman p: 7.0139e-32, Pearson r: 0.4547, Pearson p: 7.4656e-32
  Pred range: [0.0650, 0.4282], std: 0.0574
  RMSE : 0.0958, R2: 0.0939, MAE: 0.0774, Spearman rho: 0.4642, Spearman p: 2.7716e-33, Pearson r: 0.4727, Pearson p: 1.3034e-34
  Pred range: [0.0247, 0.4157], std: 0.0591
  RMSE : 0.0916, R2: 0.1716, MAE: 0.0716, Spearman rho: 0.4451, Spearman p: 1.9648e-30, Pearson r: 0.4409, Pearson p: 7.6771e-30
  Pred range: [0.0630, 0.3611], std: 0.0528
  RMSE : 0.0999, R2: 0.0132, MAE: 0.0820, Spearman rho: 0.4665, Spearman p: 1.1976e-33, Pearson r: 0.4698, Pearson p: 3.7051e-34
  Pred range: [0.0557, 0.3527], std: 0.0519
  RMSE : 0.0901, R2: 0.1973, MAE: 0.0725, Spearman rho: 0.4700, Spearman p: 3.4640e-34, Pearson r: 0.4786, Pearson p: 1.4460e-35
  Pred range: [0.0504, 0.3221], std: 0.0504
  RMSE : 0.0876, R2: 0.2410, MAE: 0.0699, Spearman rho: 0.4923, Spearman p: 7.8462e-38, Pearson r: 0.4970, Pearson p: 1.2500e-38
  Pred range: [0.0651, 0.3233], std: 0.0471
  RMSE : 0.0921, R2: 0.1617, MAE: 0.0747, Spearman rho: 0.4703, Spearman p: 3.0519e-34, Pearson r: 0.4773, Pearson p: 2.3893e-35
  Pred range: [0.0597, 0.3412], std: 0.0494
  RMSE : 0.0898, R2: 0.2023, MAE: 0.0721, Spearman rho: 0.4849, Spearman p: 1.3424e-36, Pearson r: 0.4863, Pearson p: 8.0142e-37
  Pred range: [0.0335, 0.3153], std: 0.0498
  RMSE : 0.0890, R2: 0.2172, MAE: 0.0702, Spearman rho: 0.4660, Spearman p: 1.4168e-33, Pearson r: 0.4701, Pearson p: 3.3330e-34
  Pred range: [0.0592, 0.3578], std: 0.0523
  RMSE : 0.0923, R2: 0.1576, MAE: 0.0746, Spearman rho: 0.4755, Spearman p: 4.5783e-35, Pearson r: 0.4812, Pearson p: 5.5082e-36
  Pred range: [0.0421, 0.3566], std: 0.0545
  RMSE : 0.0888, R2: 0.2200, MAE: 0.0705, Spearman rho: 0.4739, Spearman p: 8.4178e-35, Pearson r: 0.4797, Pearson p: 9.6302e-36
  Pred range: [0.0565, 0.3597], std: 0.0519
  RMSE : 0.0897, R2: 0.2049, MAE: 0.0718, Spearman rho: 0.4824, Spearman p: 3.5663e-36, Pearson r: 0.4853, Pearson p: 1.1519e-36
  Pred range: [0.0483, 0.3338], std: 0.0489
  RMSE : 0.0881, R2: 0.2331, MAE: 0.0700, Spearman rho: 0.4833, Spearman p: 2.4880e-36, Pearson r: 0.4857, Pearson p: 1.0131e-36
[I 2026-04-27 23:47:02,493] Trial 22 finished with value: 0.08764163086185245 and parameters: {'learning_rate': 0.0014309323651807086, 'batch_size': 4, 'num_epochs': 30, 'weight_decay': 0.004771587471653592, 'depth_complex': 3, 'depth_moderate': 4, 'depth_simple': 1, 'dropout': 0.3739860514488121, 'se_reduction': 6, 'hidden_dim_min': 4, 'base_loss': 'huber', 'huber_delta': 0.07583418438994234, 'focal_gamma': 2.232660448508375, 'n_bins': 9, 'scheduler_patience': 2, 'scheduler_factor': 0.5903610082320528, 'early_stopping_patience': 7}. Best is trial 22 with value: 0.08764163086185245.
Train: 2407 rows (1613 IDs),Test: 598 rows (404 IDs) 

n_features_x : 6, n_features_per_modality: [16, 23, 19, 17, 7, 4, 4, 4, 1, 4]

--- ImbalancedRegressionLoss initialized ---
  Bins: 9, Focal gamma: 2.2556917606506786, Base loss: huber
  Bin [0.00, 0.11): count= 1180, weight=0.003
  Bin [0.11, 0.22): count=  835, weight=0.004
  Bin [0.22, 0.33): count=  312, weight=0.010
  Bin [0.33, 0.44): count=   59, weight=0.054
  Bin [0.44, 0.56): count=   16, weight=0.190
  Bin [0.56, 0.67): count=    4, weight=0.647
  Bin [0.67, 0.78): count=    1, weight=1.618
  Bin [0.78, 0.89): count=    0, weight=3.237
  Bin [0.89, 1.00): count=    0, weight=3.237
-------------------------------------------

  Pred range: [0.0346, 0.3448], std: 0.0486
  RMSE : 0.0912, R2: 0.1789, MAE: 0.0726, Spearman rho: 0.4289, Spearman p: 3.7349e-28, Pearson r: 0.4347, Pearson p: 5.8559e-29
  Pred range: [0.0403, 0.4001], std: 0.0584
  RMSE : 0.0908, R2: 0.1850, MAE: 0.0718, Spearman rho: 0.4552, Spearman p: 6.3343e-32, Pearson r: 0.4627, Pearson p: 4.6426e-33
  Pred range: [0.0378, 0.3780], std: 0.0567
  RMSE : 0.0894, R2: 0.2095, MAE: 0.0707, Spearman rho: 0.4709, Spearman p: 2.4481e-34, Pearson r: 0.4750, Pearson p: 5.5686e-35
  Pred range: [0.0282, 0.3346], std: 0.0490
  RMSE : 0.0898, R2: 0.2031, MAE: 0.0714, Spearman rho: 0.4443, Spearman p: 2.4932e-30, Pearson r: 0.4520, Pearson p: 1.8912e-31
  Pred range: [0.0322, 0.3892], std: 0.0525
  RMSE : 0.0894, R2: 0.2111, MAE: 0.0713, Spearman rho: 0.4648, Spearman p: 2.2093e-33, Pearson r: 0.4708, Pearson p: 2.5345e-34
  Pred range: [0.0239, 0.3871], std: 0.0583
  RMSE : 0.0903, R2: 0.1949, MAE: 0.0718, Spearman rho: 0.4719, Spearman p: 1.7159e-34, Pearson r: 0.4776, Pearson p: 2.1269e-35
  Pred range: [0.0444, 0.3948], std: 0.0537
  RMSE : 0.1015, R2: -0.0190, MAE: 0.0834, Spearman rho: 0.4578, Spearman p: 2.6002e-32, Pearson r: 0.4628, Pearson p: 4.5088e-33
  Pred range: [0.0324, 0.3647], std: 0.0528
  RMSE : 0.0893, R2: 0.2128, MAE: 0.0710, Spearman rho: 0.4716, Spearman p: 1.8939e-34, Pearson r: 0.4744, Pearson p: 6.8359e-35
  Pred range: [0.0406, 0.3719], std: 0.0540
  RMSE : 0.0907, R2: 0.1876, MAE: 0.0730, Spearman rho: 0.4709, Spearman p: 2.4657e-34, Pearson r: 0.4762, Pearson p: 3.5971e-35
  Pred range: [0.0433, 0.3634], std: 0.0524
  RMSE : 0.0927, R2: 0.1513, MAE: 0.0751, Spearman rho: 0.4656, Spearman p: 1.6445e-33, Pearson r: 0.4697, Pearson p: 3.7950e-34
  Pred range: [0.0570, 0.3832], std: 0.0588
  RMSE : 0.0942, R2: 0.1233, MAE: 0.0760, Spearman rho: 0.4700, Spearman p: 3.4804e-34, Pearson r: 0.4769, Pearson p: 2.7739e-35
  Pred range: [0.0550, 0.3763], std: 0.0530
  RMSE : 0.0903, R2: 0.1949, MAE: 0.0724, Spearman rho: 0.4763, Spearman p: 3.3962e-35, Pearson r: 0.4784, Pearson p: 1.5721e-35
  Pred range: [0.0379, 0.3700], std: 0.0564
  RMSE : 0.0883, R2: 0.2295, MAE: 0.0697, Spearman rho: 0.4856, Spearman p: 1.0451e-36, Pearson r: 0.4873, Pearson p: 5.4681e-37
  Pred range: [0.0440, 0.3609], std: 0.0543
  RMSE : 0.0892, R2: 0.2140, MAE: 0.0712, Spearman rho: 0.4805, Spearman p: 7.1499e-36, Pearson r: 0.4846, Pearson p: 1.5278e-36
  Pred range: [0.0593, 0.3923], std: 0.0551
  RMSE : 0.0921, R2: 0.1626, MAE: 0.0741, Spearman rho: 0.4772, Spearman p: 2.4230e-35, Pearson r: 0.4803, Pearson p: 7.7832e-36
  Pred range: [0.0452, 0.3680], std: 0.0532
  RMSE : 0.0888, R2: 0.2201, MAE: 0.0707, Spearman rho: 0.4789, Spearman p: 1.2911e-35, Pearson r: 0.4821, Pearson p: 4.0105e-36
  Pred range: [0.0488, 0.3825], std: 0.0566
  RMSE : 0.0906, R2: 0.1891, MAE: 0.0723, Spearman rho: 0.4785, Spearman p: 1.5143e-35, Pearson r: 0.4822, Pearson p: 3.7716e-36
  Pred range: [0.0476, 0.3682], std: 0.0544
  RMSE : 0.0892, R2: 0.2131, MAE: 0.0712, Spearman rho: 0.4792, Spearman p: 1.1838e-35, Pearson r: 0.4838, Pearson p: 2.0383e-36
  Pred range: [0.0522, 0.3656], std: 0.0537
  RMSE : 0.0899, R2: 0.2010, MAE: 0.0719, Spearman rho: 0.4778, Spearman p: 1.9756e-35, Pearson r: 0.4823, Pearson p: 3.6122e-36
  Pred range: [0.0454, 0.3654], std: 0.0545
  RMSE : 0.0892, R2: 0.2144, MAE: 0.0709, Spearman rho: 0.4776, Spearman p: 2.1363e-35, Pearson r: 0.4823, Pearson p: 3.6720e-36
[I 2026-04-27 23:50:09,277] Trial 23 finished with value: 0.08830239477373049 and parameters: {'learning_rate': 0.0007765093161296705, 'batch_size': 4, 'num_epochs': 30, 'weight_decay': 0.0017544768019148221, 'depth_complex': 4, 'depth_moderate': 5, 'depth_simple': 1, 'dropout': 0.39224046358158204, 'se_reduction': 7, 'hidden_dim_min': 4, 'base_loss': 'huber', 'huber_delta': 0.08331485667800716, 'focal_gamma': 2.2556917606506786, 'n_bins': 9, 'scheduler_patience': 3, 'scheduler_factor': 0.5769282859873057, 'early_stopping_patience': 7}. Best is trial 22 with value: 0.08764163086185245.
Train: 2407 rows (1613 IDs),Test: 598 rows (404 IDs) 

n_features_x : 6, n_features_per_modality: [16, 23, 19, 17, 7, 4, 4, 4, 1, 4]

--- ImbalancedRegressionLoss initialized ---
  Bins: 6, Focal gamma: 1.911789699997234, Base loss: huber
  Bin [0.00, 0.17): count= 1538, weight=0.002
  Bin [0.17, 0.33): count=  789, weight=0.005
  Bin [0.33, 0.50): count=   69, weight=0.053
  Bin [0.50, 0.67): count=   10, weight=0.339
  Bin [0.67, 0.83): count=    1, weight=1.867
  Bin [0.83, 1.00): count=    0, weight=3.733
-------------------------------------------

  Pred range: [0.0675, 0.5858], std: 0.0854
  RMSE : 0.1355, R2: -0.8137, MAE: 0.1115, Spearman rho: 0.4266, Spearman p: 7.5724e-28, Pearson r: 0.4341, Pearson p: 6.9781e-29
  Pred range: [0.0875, 0.5578], std: 0.0758
  RMSE : 0.1320, R2: -0.7228, MAE: 0.1103, Spearman rho: 0.4449, Spearman p: 2.0441e-30, Pearson r: 0.4536, Pearson p: 1.1132e-31
  Pred range: [0.0716, 0.4896], std: 0.0680
  RMSE : 0.1087, R2: -0.1683, MAE: 0.0891, Spearman rho: 0.4432, Spearman p: 3.6918e-30, Pearson r: 0.4518, Pearson p: 2.0008e-31
  Pred range: [0.0704, 0.4524], std: 0.0601
  RMSE : 0.1027, R2: -0.0420, MAE: 0.0839, Spearman rho: 0.4409, Spearman p: 7.8708e-30, Pearson r: 0.4476, Pearson p: 8.5559e-31
  Pred range: [0.0245, 0.4060], std: 0.0616
  RMSE : 0.0937, R2: 0.1322, MAE: 0.0748, Spearman rho: 0.4352, Spearman p: 4.9752e-29, Pearson r: 0.4413, Pearson p: 6.7357e-30
  Pred range: [0.1248, 0.4516], std: 0.0546
  RMSE : 0.1287, R2: -0.6379, MAE: 0.1096, Spearman rho: 0.4477, Spearman p: 8.1433e-31, Pearson r: 0.4616, Pearson p: 6.7339e-33
