[I 2026-04-29 01:07:21,349] Trial 0 finished with value: 0.17696197058187627 and parameters: {'learning_rate': 4.827997405486851e-05, 'batch_size': 16, 'num_epochs': 23, 'weight_decay': 1.3233170642076544e-05, 'layers_PRS': 4, 'layers_SCZ15': 4, 'layers_ADHD9': 3, 'layers_ASD9': 2, 'layers_ACE15': 1, 'layers_ACE18': 1, 'layers_SUD18': 3, 'layers_SES': 2, 'layers_SEX': 5, 'dropout': 0.35615213868535966, 'se_reduction': 5, 'hidden_dim_min': 4, 'base_loss': 'mse', 'huber_delta': 0.15333633015690565, 'focal_gamma': 2.1743422183077334, 'n_bins': 7, 'scheduler_patience': 3, 'scheduler_factor': 0.4722940033452621, 'early_stopping_patience': 6}. Best is trial 0 with value: 0.17696197058187627.
Train: 2407 rows (1613 IDs),Test: 598 rows (404 IDs) 

n_features_x : 6, n_features_per_modality: [16, 23, 19, 17, 7, 4, 4, 4, 1, 4]

--- ImbalancedRegressionLoss initialized ---
  Bins: 8, Focal gamma: 1.7234145189386305, Base loss: huber
  Bin [0.00, 0.12): count=  760, weight=0.039
  Bin [0.12, 0.25): count=  700, weight=0.042
  Bin [0.25, 0.38): count=  438, weight=0.067
  Bin [0.38, 0.50): count=  264, weight=0.111
  Bin [0.50, 0.62): count=  157, weight=0.186
  Bin [0.62, 0.75): count=   60, weight=0.483
  Bin [0.75, 0.88): count=   24, weight=1.179
  Bin [0.88, 1.00): count=    4, weight=5.893
-------------------------------------------

  Pred range: [-0.0473, 0.1875], std: 0.0427
  RMSE : 0.2300, R2: -0.7658, MAE: 0.1658, Spearman rho: 0.0561, Spearman p: 1.7043e-01, Pearson r: 0.0225, Pearson p: 5.8273e-01
  Pred range: [0.0321, 0.2924], std: 0.0458
  RMSE : 0.1844, R2: -0.1350, MAE: 0.1333, Spearman rho: 0.1538, Spearman p: 1.5993e-04, Pearson r: 0.1339, Pearson p: 1.0261e-03
  Pred range: [0.0846, 0.3997], std: 0.0534
  RMSE : 0.1708, R2: 0.0267, MAE: 0.1365, Spearman rho: 0.2136, Spearman p: 1.3328e-07, Pearson r: 0.2090, Pearson p: 2.5198e-07
  Pred range: [0.1215, 0.4915], std: 0.0608
  RMSE : 0.1827, R2: -0.1140, MAE: 0.1544, Spearman rho: 0.2438, Spearman p: 1.5382e-09, Pearson r: 0.2497, Pearson p: 5.9523e-10
  Pred range: [0.1437, 0.5473], std: 0.0653
  RMSE : 0.1967, R2: -0.2918, MAE: 0.1692, Spearman rho: 0.2615, Spearman p: 8.3326e-11, Pearson r: 0.2728, Pearson p: 1.1582e-11
  Pred range: [0.1526, 0.5729], std: 0.0670
  RMSE : 0.2043, R2: -0.3929, MAE: 0.1767, Spearman rho: 0.2737, Spearman p: 9.8184e-12, Pearson r: 0.2873, Pearson p: 7.8764e-13
  Pred range: [0.1568, 0.5858], std: 0.0677
  RMSE : 0.2073, R2: -0.4341, MAE: 0.1798, Spearman rho: 0.2828, Spearman p: 1.8456e-12, Pearson r: 0.2991, Pearson p: 7.9360e-14
  Pred range: [0.1590, 0.5926], std: 0.0680
  RMSE : 0.2091, R2: -0.4597, MAE: 0.1817, Spearman rho: 0.2872, Spearman p: 8.0965e-13, Pearson r: 0.3048, Pearson p: 2.5247e-14
  Pred range: [0.1586, 0.5914], std: 0.0676
  RMSE : 0.2081, R2: -0.4462, MAE: 0.1808, Spearman rho: 0.2909, Spearman p: 4.0008e-13, Pearson r: 0.3090, Pearson p: 1.0627e-14
  Pred range: [0.1600, 0.5965], std: 0.0679
  RMSE : 0.2095, R2: -0.4647, MAE: 0.1822, Spearman rho: 0.2948, Spearman p: 1.8505e-13, Pearson r: 0.3141, Pearson p: 3.7123e-15
  Pred range: [0.1612, 0.6014], std: 0.0683
  RMSE : 0.2105, R2: -0.4796, MAE: 0.1833, Spearman rho: 0.2991, Spearman p: 7.9339e-14, Pearson r: 0.3190, Pearson p: 1.3129e-15
[I 2026-04-29 01:07:37,873] Trial 1 finished with value: 0.1707573117251745 and parameters: {'learning_rate': 6.173591846405484e-05, 'batch_size': 32, 'num_epochs': 11, 'weight_decay': 0.006965815626820463, 'layers_PRS': 4, 'layers_SCZ15': 2, 'layers_ADHD9': 1, 'layers_ASD9': 5, 'layers_ACE15': 3, 'layers_ACE18': 5, 'layers_SUD18': 3, 'layers_SES': 4, 'layers_SEX': 5, 'dropout': 0.11385101663605975, 'se_reduction': 3, 'hidden_dim_min': 9, 'base_loss': 'huber', 'huber_delta': 0.11011337229072705, 'focal_gamma': 1.7234145189386305, 'n_bins': 8, 'scheduler_patience': 3, 'scheduler_factor': 0.4614354135406624, 'early_stopping_patience': 8}. Best is trial 1 with value: 0.1707573117251745.
Train: 2407 rows (1613 IDs),Test: 598 rows (404 IDs) 

n_features_x : 6, n_features_per_modality: [16, 23, 19, 17, 7, 4, 4, 4, 1, 4]

--- ImbalancedRegressionLoss initialized ---
  Bins: 19, Focal gamma: 2.246286237671578, Base loss: mse
  Bin [0.00, 0.05): count=  172, weight=0.055
  Bin [0.05, 0.11): count=  413, weight=0.023
  Bin [0.11, 0.16): count=  376, weight=0.025
  Bin [0.16, 0.21): count=  204, weight=0.046
  Bin [0.21, 0.26): count=  295, weight=0.032
  Bin [0.26, 0.32): count=  239, weight=0.039
  Bin [0.32, 0.37): count=  199, weight=0.047
  Bin [0.37, 0.42): count=   73, weight=0.128
  Bin [0.42, 0.47): count=  134, weight=0.070
  Bin [0.47, 0.53): count=  108, weight=0.087
  Bin [0.53, 0.58): count=   78, weight=0.120
  Bin [0.58, 0.63): count=   28, weight=0.327
  Bin [0.63, 0.68): count=   36, weight=0.256
  Bin [0.68, 0.74): count=   24, weight=0.379
  Bin [0.74, 0.79): count=   19, weight=0.474
  Bin [0.79, 0.84): count=    2, weight=3.157
  Bin [0.84, 0.89): count=    4, weight=1.894
  Bin [0.89, 0.95): count=    3, weight=2.368
  Bin [0.95, 1.00): count=    0, weight=9.472
-------------------------------------------

  Pred range: [0.1113, 0.5679], std: 0.0724
  RMSE : 0.1681, R2: 0.0569, MAE: 0.1411, Spearman rho: 0.4388, Spearman p: 1.5448e-29, Pearson r: 0.4649, Pearson p: 2.1302e-33
  Pred range: [0.1228, 0.6005], std: 0.0758
  RMSE : 0.1676, R2: 0.0619, MAE: 0.1413, Spearman rho: 0.4644, Spearman p: 2.5792e-33, Pearson r: 0.4900, Pearson p: 1.9328e-37
  Pred range: [0.1110, 0.5713], std: 0.0756
  RMSE : 0.1594, R2: 0.1524, MAE: 0.1326, Spearman rho: 0.4795, Spearman p: 1.0329e-35, Pearson r: 0.5031, Pearson p: 1.1096e-39
  Pred range: [0.1121, 0.6047], std: 0.0813
  RMSE : 0.1604, R2: 0.1411, MAE: 0.1338, Spearman rho: 0.4861, Spearman p: 8.5178e-37, Pearson r: 0.5089, Pearson p: 1.0477e-40
  Pred range: [0.1331, 0.6612], std: 0.0863
  RMSE : 0.1761, R2: -0.0354, MAE: 0.1498, Spearman rho: 0.4831, Spearman p: 2.6658e-36, Pearson r: 0.5071, Pearson p: 2.1780e-40
  Pred range: [0.1276, 0.6560], std: 0.0876
  RMSE : 0.1727, R2: 0.0047, MAE: 0.1464, Spearman rho: 0.4871, Spearman p: 5.8814e-37, Pearson r: 0.5107, Pearson p: 4.9289e-41
  Pred range: [0.1100, 0.6226], std: 0.0844
  RMSE : 0.1582, R2: 0.1645, MAE: 0.1315, Spearman rho: 0.4888, Spearman p: 3.0272e-37, Pearson r: 0.5141, Pearson p: 1.2186e-41
  Pred range: [0.1117, 0.6409], std: 0.0879
  RMSE : 0.1616, R2: 0.1284, MAE: 0.1352, Spearman rho: 0.4880, Spearman p: 4.1234e-37, Pearson r: 0.5142, Pearson p: 1.1521e-41
  Pred range: [0.1120, 0.6399], std: 0.0877
  RMSE : 0.1622, R2: 0.1216, MAE: 0.1357, Spearman rho: 0.4885, Spearman p: 3.4521e-37, Pearson r: 0.5121, Pearson p: 2.7516e-41
  Pred range: [0.1086, 0.6331], std: 0.0853
  RMSE : 0.1610, R2: 0.1349, MAE: 0.1345, Spearman rho: 0.4831, Spearman p: 2.7116e-36, Pearson r: 0.5091, Pearson p: 9.5030e-41
  Pred range: [0.1126, 0.6367], std: 0.0889
  RMSE : 0.1628, R2: 0.1158, MAE: 0.1363, Spearman rho: 0.4874, Spearman p: 5.2363e-37, Pearson r: 0.5137, Pearson p: 1.4372e-41
  Pred range: [0.1137, 0.6353], std: 0.0876
  RMSE : 0.1632, R2: 0.1109, MAE: 0.1367, Spearman rho: 0.4813, Spearman p: 5.3157e-36, Pearson r: 0.5079, Pearson p: 1.5343e-40
  Pred range: [0.1132, 0.6240], std: 0.0874
  RMSE : 0.1638, R2: 0.1042, MAE: 0.1372, Spearman rho: 0.4763, Spearman p: 3.4777e-35, Pearson r: 0.5046, Pearson p: 5.9088e-40
  Pred range: [0.1064, 0.6093], std: 0.0860
  RMSE : 0.1600, R2: 0.1458, MAE: 0.1332, Spearman rho: 0.4781, Spearman p: 1.7614e-35, Pearson r: 0.5065, Pearson p: 2.7119e-40
  Pred range: [0.1198, 0.6376], std: 0.0891
  RMSE : 0.1678, R2: 0.0607, MAE: 0.1416, Spearman rho: 0.4811, Spearman p: 5.7491e-36, Pearson r: 0.5089, Pearson p: 1.0417e-40
[I 2026-04-29 01:09:06,176] Trial 2 finished with value: 0.15821390350735257 and parameters: {'learning_rate': 0.0005132103420388684, 'batch_size': 8, 'num_epochs': 22, 'weight_decay': 0.003999499770910396, 'layers_PRS': 4, 'layers_SCZ15': 5, 'layers_ADHD9': 5, 'layers_ASD9': 5, 'layers_ACE15': 2, 'layers_ACE18': 3, 'layers_SUD18': 5, 'layers_SES': 5, 'layers_SEX': 2, 'dropout': 0.3485466960534518, 'se_reduction': 6, 'hidden_dim_min': 2, 'base_loss': 'mse', 'huber_delta': 0.09278638869038291, 'focal_gamma': 2.246286237671578, 'n_bins': 19, 'scheduler_patience': 5, 'scheduler_factor': 0.6239852878119585, 'early_stopping_patience': 8}. Best is trial 2 with value: 0.15821390350735257.
Train: 2407 rows (1613 IDs),Test: 598 rows (404 IDs) 

n_features_x : 6, n_features_per_modality: [16, 23, 19, 17, 7, 4, 4, 4, 1, 4]

--- ImbalancedRegressionLoss initialized ---
  Bins: 15, Focal gamma: 0.8916213496113128, Base loss: mse
  Bin [0.00, 0.07): count=  383, weight=0.040
  Bin [0.07, 0.13): count=  377, weight=0.041
  Bin [0.13, 0.20): count=  405, weight=0.038
  Bin [0.20, 0.27): count=  295, weight=0.052
  Bin [0.27, 0.33): count=  349, weight=0.044
  Bin [0.33, 0.40): count=  162, weight=0.094
  Bin [0.40, 0.47): count=  134, weight=0.114
  Bin [0.47, 0.53): count=  108, weight=0.141
  Bin [0.53, 0.60): count=   78, weight=0.194
  Bin [0.60, 0.67): count=   47, weight=0.320
  Bin [0.67, 0.73): count=   41, weight=0.365
  Bin [0.73, 0.80): count=   19, weight=0.767
  Bin [0.80, 0.87): count=    5, weight=2.558
  Bin [0.87, 0.93): count=    2, weight=5.116
  Bin [0.93, 1.00): count=    2, weight=5.116
-------------------------------------------

  Pred range: [-0.0141, 0.3054], std: 0.0459
  RMSE : 0.2060, R2: -0.4158, MAE: 0.1489, Spearman rho: 0.1565, Spearman p: 1.2118e-04, Pearson r: 0.1937, Pearson p: 1.8151e-06
  Pred range: [0.0599, 0.4472], std: 0.0553
  RMSE : 0.1717, R2: 0.0155, MAE: 0.1288, Spearman rho: 0.2097, Spearman p: 2.2691e-07, Pearson r: 0.2453, Pearson p: 1.2179e-09
  Pred range: [0.1099, 0.5400], std: 0.0625
  RMSE : 0.1684, R2: 0.0531, MAE: 0.1340, Spearman rho: 0.2377, Spearman p: 4.0023e-09, Pearson r: 0.2714, Pearson p: 1.4667e-11
  Pred range: [0.1384, 0.5859], std: 0.0664
  RMSE : 0.1732, R2: -0.0010, MAE: 0.1421, Spearman rho: 0.2549, Spearman p: 2.5463e-10, Pearson r: 0.2885, Pearson p: 6.2729e-13
  Pred range: [0.1466, 0.6056], std: 0.0682
  RMSE : 0.1766, R2: -0.0415, MAE: 0.1468, Spearman rho: 0.2693, Spearman p: 2.1289e-11, Pearson r: 0.3023, Pearson p: 4.1750e-14
  Pred range: [0.1488, 0.6055], std: 0.0685
  RMSE : 0.1773, R2: -0.0487, MAE: 0.1479, Spearman rho: 0.2813, Spearman p: 2.4217e-12, Pearson r: 0.3132, Pearson p: 4.4880e-15
  Pred range: [0.1507, 0.6049], std: 0.0687
  RMSE : 0.1779, R2: -0.0565, MAE: 0.1490, Spearman rho: 0.2936, Spearman p: 2.3711e-13, Pearson r: 0.3240, Pearson p: 4.3927e-16
  Pred range: [0.1510, 0.6019], std: 0.0687
  RMSE : 0.1777, R2: -0.0542, MAE: 0.1490, Spearman rho: 0.3017, Spearman p: 4.7641e-14, Pearson r: 0.3306, Pearson p: 1.0261e-16
  Pred range: [0.1523, 0.6017], std: 0.0689
  RMSE : 0.1783, R2: -0.0608, MAE: 0.1498, Spearman rho: 0.3079, Spearman p: 1.3549e-14, Pearson r: 0.3370, Pearson p: 2.3849e-17
[I 2026-04-29 01:10:15,815] Trial 3 finished with value: 0.168431061664105 and parameters: {'learning_rate': 1.2050722089484438e-05, 'batch_size': 4, 'num_epochs': 17, 'weight_decay': 0.0014555749013365992, 'layers_PRS': 5, 'layers_SCZ15': 3, 'layers_ADHD9': 2, 'layers_ASD9': 3, 'layers_ACE15': 3, 'layers_ACE18': 4, 'layers_SUD18': 1, 'layers_SES': 1, 'layers_SEX': 2, 'dropout': 0.4563964865158775, 'se_reduction': 5, 'hidden_dim_min': 14, 'base_loss': 'mse', 'huber_delta': 0.1362404533353927, 'focal_gamma': 0.8916213496113128, 'n_bins': 15, 'scheduler_patience': 3, 'scheduler_factor': 0.6401147465087352, 'early_stopping_patience': 6}. Best is trial 2 with value: 0.15821390350735257.
Train: 2407 rows (1613 IDs),Test: 598 rows (404 IDs) 

n_features_x : 6, n_features_per_modality: [16, 23, 19, 17, 7, 4, 4, 4, 1, 4]

--- ImbalancedRegressionLoss initialized ---
  Bins: 5, Focal gamma: 1.3086451621524249, Base loss: mse
  Bin [0.00, 0.20): count= 1165, weight=0.037
  Bin [0.20, 0.40): count=  806, weight=0.054
  Bin [0.40, 0.60): count=  320, weight=0.136
  Bin [0.60, 0.80): count=  107, weight=0.404
  Bin [0.80, 1.00): count=    9, weight=4.368
-------------------------------------------

  Pred range: [0.1591, 0.5246], std: 0.0673
  RMSE : 0.1651, R2: 0.0902, MAE: 0.1381, Spearman rho: 0.4526, Spearman p: 1.5407e-31, Pearson r: 0.4582, Pearson p: 2.2572e-32
  Pred range: [0.1929, 0.7813], std: 0.1043
  RMSE : 0.2173, R2: -0.5766, MAE: 0.1884, Spearman rho: 0.4808, Spearman p: 6.3592e-36, Pearson r: 0.5043, Pearson p: 6.8551e-40
  Pred range: [-0.0250, 0.5752], std: 0.0770
  RMSE : 0.1679, R2: 0.0592, MAE: 0.1422, Spearman rho: 0.4719, Spearman p: 1.7039e-34, Pearson r: 0.4879, Pearson p: 4.4092e-37
  Pred range: [0.1653, 0.6741], std: 0.0901
  RMSE : 0.1940, R2: -0.2568, MAE: 0.1681, Spearman rho: 0.4887, Spearman p: 3.1791e-37, Pearson r: 0.5078, Pearson p: 1.6411e-40
  Pred range: [0.1149, 0.6404], std: 0.0949
  RMSE : 0.1778, R2: -0.0550, MAE: 0.1515, Spearman rho: 0.4858, Spearman p: 9.6345e-37, Pearson r: 0.5045, Pearson p: 6.1148e-40
  Pred range: [0.1485, 0.7439], std: 0.1084
  RMSE : 0.2090, R2: -0.4581, MAE: 0.1800, Spearman rho: 0.4904, Spearman p: 1.6471e-37, Pearson r: 0.5123, Pearson p: 2.4870e-41
  Pred range: [0.0873, 0.6385], std: 0.0925
  RMSE : 0.1706, R2: 0.0286, MAE: 0.1440, Spearman rho: 0.4734, Spearman p: 9.8130e-35, Pearson r: 0.4919, Pearson p: 9.2039e-38
[I 2026-04-29 01:10:35,915] Trial 4 finished with value: 0.16509508841031817 and parameters: {'learning_rate': 0.002560401311464407, 'batch_size': 16, 'num_epochs': 16, 'weight_decay': 0.0004352625783053177, 'layers_PRS': 4, 'layers_SCZ15': 4, 'layers_ADHD9': 5, 'layers_ASD9': 5, 'layers_ACE15': 1, 'layers_ACE18': 3, 'layers_SUD18': 1, 'layers_SES': 5, 'layers_SEX': 3, 'dropout': 0.40772987247412484, 'se_reduction': 2, 'hidden_dim_min': 8, 'base_loss': 'mse', 'huber_delta': 0.1163456146796979, 'focal_gamma': 1.3086451621524249, 'n_bins': 5, 'scheduler_patience': 5, 'scheduler_factor': 0.4396177560528077, 'early_stopping_patience': 6}. Best is trial 2 with value: 0.15821390350735257.
Train: 2407 rows (1613 IDs),Test: 598 rows (404 IDs) 

n_features_x : 6, n_features_per_modality: [16, 23, 19, 17, 7, 4, 4, 4, 1, 4]

--- ImbalancedRegressionLoss initialized ---
  Bins: 12, Focal gamma: 0.8869880458212918, Base loss: mse
  Bin [0.00, 0.08): count=  383, weight=0.051
  Bin [0.08, 0.17): count=  578, weight=0.034
  Bin [0.17, 0.25): count=  499, weight=0.039
  Bin [0.25, 0.33): count=  349, weight=0.055
  Bin [0.33, 0.42): count=  162, weight=0.119
  Bin [0.42, 0.50): count=  191, weight=0.101
  Bin [0.50, 0.58): count=  129, weight=0.149
  Bin [0.58, 0.67): count=   47, weight=0.404
  Bin [0.67, 0.75): count=   41, weight=0.462
  Bin [0.75, 0.83): count=   21, weight=0.882
  Bin [0.83, 0.92): count=    5, weight=3.235
  Bin [0.92, 1.00): count=    2, weight=6.469
-------------------------------------------

  Pred range: [0.0979, 0.5715], std: 0.0764
  RMSE : 0.1610, R2: 0.1345, MAE: 0.1323, Spearman rho: 0.4336, Spearman p: 8.3215e-29, Pearson r: 0.4613, Pearson p: 7.7078e-33
  Pred range: [0.0910, 0.6023], std: 0.0873
  RMSE : 0.1584, R2: 0.1621, MAE: 0.1309, Spearman rho: 0.4709, Spearman p: 2.4699e-34, Pearson r: 0.5019, Pearson p: 1.7801e-39
  Pred range: [0.1103, 0.6772], std: 0.0998
  RMSE : 0.1756, R2: -0.0294, MAE: 0.1481, Spearman rho: 0.4876, Spearman p: 4.9252e-37, Pearson r: 0.5130, Pearson p: 1.8892e-41
  Pred range: [0.0915, 0.5847], std: 0.0907
  RMSE : 0.1526, R2: 0.2225, MAE: 0.1246, Spearman rho: 0.4986, Spearman p: 6.7482e-39, Pearson r: 0.5227, Pearson p: 3.0829e-43
  Pred range: [0.1076, 0.6632], std: 0.0985
  RMSE : 0.1664, R2: 0.0756, MAE: 0.1392, Spearman rho: 0.4948, Spearman p: 3.0012e-38, Pearson r: 0.5200, Pearson p: 9.9212e-43
  Pred range: [0.0922, 0.6329], std: 0.0963
  RMSE : 0.1568, R2: 0.1793, MAE: 0.1292, Spearman rho: 0.4930, Spearman p: 5.9447e-38, Pearson r: 0.5210, Pearson p: 6.4460e-43
  Pred range: [0.1088, 0.6364], std: 0.0961
  RMSE : 0.1629, R2: 0.1146, MAE: 0.1359, Spearman rho: 0.4989, Spearman p: 6.0277e-39, Pearson r: 0.5233, Pearson p: 2.3822e-43
  Pred range: [0.0956, 0.5890], std: 0.0893
  RMSE : 0.1532, R2: 0.2171, MAE: 0.1258, Spearman rho: 0.4913, Spearman p: 1.1715e-37, Pearson r: 0.5216, Pearson p: 5.0727e-43
  Pred range: [0.0879, 0.6085], std: 0.0915
  RMSE : 0.1543, R2: 0.2055, MAE: 0.1269, Spearman rho: 0.4892, Spearman p: 2.6650e-37, Pearson r: 0.5198, Pearson p: 1.0566e-42
[I 2026-04-29 01:11:37,168] Trial 5 finished with value: 0.152618777391536 and parameters: {'learning_rate': 0.0003435967564936163, 'batch_size': 4, 'num_epochs': 19, 'weight_decay': 0.0001764525146416123, 'layers_PRS': 4, 'layers_SCZ15': 2, 'layers_ADHD9': 1, 'layers_ASD9': 1, 'layers_ACE15': 3, 'layers_ACE18': 1, 'layers_SUD18': 2, 'layers_SES': 4, 'layers_SEX': 4, 'dropout': 0.25893765571569427, 'se_reduction': 7, 'hidden_dim_min': 5, 'base_loss': 'mse', 'huber_delta': 0.13612346964638003, 'focal_gamma': 0.8869880458212918, 'n_bins': 12, 'scheduler_patience': 3, 'scheduler_factor': 0.4347415301312368, 'early_stopping_patience': 5}. Best is trial 5 with value: 0.152618777391536.
Train: 2407 rows (1613 IDs),Test: 598 rows (404 IDs) 

n_features_x : 6, n_features_per_modality: [16, 23, 19, 17, 7, 4, 4, 4, 1, 4]

--- ImbalancedRegressionLoss initialized ---
  Bins: 7, Focal gamma: 2.739202740897359, Base loss: mse
  Bin [0.00, 0.14): count=  760, weight=0.038
  Bin [0.14, 0.29): count=  826, weight=0.035
  Bin [0.29, 0.43): count=  454, weight=0.063
  Bin [0.43, 0.57): count=  215, weight=0.133
  Bin [0.57, 0.71): count=  110, weight=0.258
  Bin [0.71, 0.86): count=   38, weight=0.736
  Bin [0.86, 1.00): count=    4, weight=5.738
-------------------------------------------

  Pred range: [-0.1068, 0.2428], std: 0.0464
  RMSE : 0.2470, R2: -1.0371, MAE: 0.1840, Spearman rho: 0.0752, Spearman p: 6.6125e-02, Pearson r: 0.0364, Pearson p: 3.7425e-01
  Pred range: [-0.0809, 0.2692], std: 0.0471
  RMSE : 0.2305, R2: -0.7741, MAE: 0.1680, Spearman rho: 0.0975, Spearman p: 1.7132e-02, Pearson r: 0.0642, Pearson p: 1.1667e-01
  Pred range: [-0.0545, 0.2962], std: 0.0482
  RMSE : 0.2151, R2: -0.5447, MAE: 0.1545, Spearman rho: 0.1198, Spearman p: 3.3377e-03, Pearson r: 0.0920, Pearson p: 2.4383e-02
  Pred range: [-0.0299, 0.3227], std: 0.0497
  RMSE : 0.2019, R2: -0.3610, MAE: 0.1441, Spearman rho: 0.1430, Spearman p: 4.5280e-04, Pearson r: 0.1165, Pearson p: 4.3429e-03
  Pred range: [-0.0038, 0.3500], std: 0.0514
  RMSE : 0.1903, R2: -0.2084, MAE: 0.1366, Spearman rho: 0.1644, Spearman p: 5.3484e-05, Pearson r: 0.1402, Pearson p: 5.8353e-04
  Pred range: [0.0209, 0.3761], std: 0.0535
  RMSE : 0.1814, R2: -0.0980, MAE: 0.1322, Spearman rho: 0.1830, Spearman p: 6.6405e-06, Pearson r: 0.1605, Pearson p: 8.0930e-05
  Pred range: [0.0451, 0.4022], std: 0.0558
  RMSE : 0.1753, R2: -0.0253, MAE: 0.1307, Spearman rho: 0.1984, Spearman p: 1.0008e-06, Pearson r: 0.1776, Pearson p: 1.2500e-05
  Pred range: [0.0634, 0.4355], std: 0.0581
  RMSE : 0.1719, R2: 0.0136, MAE: 0.1320, Spearman rho: 0.2131, Spearman p: 1.4338e-07, Pearson r: 0.1936, Pearson p: 1.8511e-06
[I 2026-04-29 01:11:47,138] Trial 6 pruned. 
Train: 2407 rows (1613 IDs),Test: 598 rows (404 IDs) 

n_features_x : 6, n_features_per_modality: [16, 23, 19, 17, 7, 4, 4, 4, 1, 4]

--- ImbalancedRegressionLoss initialized ---
  Bins: 14, Focal gamma: 2.1978065638739332, Base loss: mse
  Bin [0.00, 0.07): count=  383, weight=0.042
  Bin [0.07, 0.14): count=  377, weight=0.043
  Bin [0.14, 0.21): count=  571, weight=0.028
  Bin [0.21, 0.29): count=  255, weight=0.063
  Bin [0.29, 0.36): count=  223, weight=0.072
  Bin [0.36, 0.43): count=  231, weight=0.070
  Bin [0.43, 0.50): count=  122, weight=0.131
  Bin [0.50, 0.57): count=   93, weight=0.172
  Bin [0.57, 0.64): count=   83, weight=0.192
  Bin [0.64, 0.71): count=   27, weight=0.577
  Bin [0.71, 0.79): count=   26, weight=0.598
  Bin [0.79, 0.86): count=   12, weight=1.243
  Bin [0.86, 0.93): count=    2, weight=5.384
  Bin [0.93, 1.00): count=    2, weight=5.384
-------------------------------------------

  Pred range: [0.1568, 0.6155], std: 0.0767
  RMSE : 0.1899, R2: -0.2035, MAE: 0.1639, Spearman rho: 0.4251, Spearman p: 1.2077e-27, Pearson r: 0.4316, Pearson p: 1.5551e-28
  Pred range: [0.1615, 0.6952], std: 0.0866
  RMSE : 0.1929, R2: -0.2418, MAE: 0.1666, Spearman rho: 0.4632, Spearman p: 3.9512e-33, Pearson r: 0.4726, Pearson p: 1.3305e-34
  Pred range: [0.1635, 0.7190], std: 0.0923
  RMSE : 0.1988, R2: -0.3194, MAE: 0.1720, Spearman rho: 0.4795, Spearman p: 1.0366e-35, Pearson r: 0.4928, Pearson p: 6.4188e-38
  Pred range: [0.1290, 0.6115], std: 0.0799
  RMSE : 0.1615, R2: 0.1294, MAE: 0.1355, Spearman rho: 0.4858, Spearman p: 9.5377e-37, Pearson r: 0.5077, Pearson p: 1.7036e-40
  Pred range: [0.1314, 0.6246], std: 0.0824
  RMSE : 0.1619, R2: 0.1256, MAE: 0.1358, Spearman rho: 0.4809, Spearman p: 6.0834e-36, Pearson r: 0.5094, Pearson p: 8.3358e-41
  Pred range: [0.1285, 0.5903], std: 0.0836
  RMSE : 0.1564, R2: 0.1834, MAE: 0.1299, Spearman rho: 0.4898, Spearman p: 2.0904e-37, Pearson r: 0.5187, Pearson p: 1.7488e-42
  Pred range: [0.1250, 0.6015], std: 0.0853
  RMSE : 0.1570, R2: 0.1775, MAE: 0.1305, Spearman rho: 0.4889, Spearman p: 2.9919e-37, Pearson r: 0.5217, Pearson p: 4.8485e-43
  Pred range: [0.0938, 0.6195], std: 0.0857
  RMSE : 0.1650, R2: 0.0907, MAE: 0.1392, Spearman rho: 0.4808, Spearman p: 6.3969e-36, Pearson r: 0.5111, Pearson p: 4.1792e-41
  Pred range: [0.0789, 0.6180], std: 0.0868
  RMSE : 0.1682, R2: 0.0554, MAE: 0.1426, Spearman rho: 0.4794, Spearman p: 1.0712e-35, Pearson r: 0.5103, Pearson p: 5.8123e-41
