[I 2026-04-29 00:25:27,863] Trial 19 finished with value: 0.09082131231434451 and parameters: {'learning_rate': 0.0001473218930049893, 'batch_size': 4, 'num_epochs': 20, 'weight_decay': 2.8430562087997475e-05, 'layers_PRS': 3, 'layers_SCZ15': 4, 'layers_ADHD9': 1, 'layers_ASD9': 4, 'layers_ACE15': 3, 'layers_ACE18': 1, 'layers_SUD18': 2, 'layers_SES': 3, 'layers_SEX': 2, 'dropout': 0.45372833382707006, 'se_reduction': 3, 'hidden_dim_min': 9, 'base_loss': 'huber', 'huber_delta': 0.11939006064010645, 'focal_gamma': 0.9097529282505616, 'n_bins': 7, 'scheduler_patience': 3, 'scheduler_factor': 0.47971563367272374, 'early_stopping_patience': 5}. Best is trial 12 with value: 0.08869736027930415.
Train: 2407 rows (1613 IDs),Test: 598 rows (404 IDs) 

n_features_x : 6, n_features_per_modality: [16, 23, 19, 17, 7, 4, 4, 4, 1, 4]

--- ImbalancedRegressionLoss initialized ---
  Bins: 11, Focal gamma: 1.2281751844769768, Base loss: huber
  Bin [0.00, 0.09): count= 1010, weight=0.003
  Bin [0.09, 0.18): count=  706, weight=0.004
  Bin [0.18, 0.27): count=  478, weight=0.006
  Bin [0.27, 0.36): count=  159, weight=0.018
  Bin [0.36, 0.45): count=   33, weight=0.085
  Bin [0.45, 0.55): count=   16, weight=0.170
  Bin [0.55, 0.64): count=    4, weight=0.579
  Bin [0.64, 0.73): count=    1, weight=1.448
  Bin [0.73, 0.82): count=    0, weight=2.896
  Bin [0.82, 0.91): count=    0, weight=2.896
  Bin [0.91, 1.00): count=    0, weight=2.896
-------------------------------------------

  Pred range: [0.0529, 0.3907], std: 0.0520
  RMSE : 0.0984, R2: 0.0425, MAE: 0.0789, Spearman rho: 0.3499, Spearman p: 1.1444e-18, Pearson r: 0.3424, Pearson p: 6.8601e-18
  Pred range: [0.0529, 0.3822], std: 0.0501
  RMSE : 0.0953, R2: 0.1028, MAE: 0.0763, Spearman rho: 0.3951, Spearman p: 8.7929e-24, Pearson r: 0.3901, Pearson p: 3.5515e-23
  Pred range: [0.0517, 0.3567], std: 0.0482
  RMSE : 0.0927, R2: 0.1508, MAE: 0.0740, Spearman rho: 0.4198, Spearman p: 6.2992e-27, Pearson r: 0.4197, Pearson p: 6.4889e-27
  Pred range: [0.0531, 0.3462], std: 0.0474
  RMSE : 0.0916, R2: 0.1707, MAE: 0.0730, Spearman rho: 0.4310, Spearman p: 1.9280e-28, Pearson r: 0.4322, Pearson p: 1.3197e-28
  Pred range: [0.0600, 0.3605], std: 0.0490
  RMSE : 0.0926, R2: 0.1531, MAE: 0.0742, Spearman rho: 0.4403, Spearman p: 9.4679e-30, Pearson r: 0.4440, Pearson p: 2.8345e-30
  Pred range: [0.0542, 0.3428], std: 0.0477
  RMSE : 0.0904, R2: 0.1929, MAE: 0.0718, Spearman rho: 0.4477, Spearman p: 8.1059e-31, Pearson r: 0.4512, Pearson p: 2.4946e-31
  Pred range: [0.0594, 0.3564], std: 0.0488
  RMSE : 0.0915, R2: 0.1728, MAE: 0.0732, Spearman rho: 0.4463, Spearman p: 1.3184e-30, Pearson r: 0.4517, Pearson p: 2.1256e-31
  Pred range: [0.0617, 0.3548], std: 0.0489
  RMSE : 0.0922, R2: 0.1599, MAE: 0.0741, Spearman rho: 0.4475, Spearman p: 8.7298e-31, Pearson r: 0.4541, Pearson p: 9.3610e-32
  Pred range: [0.0615, 0.3576], std: 0.0488
  RMSE : 0.0916, R2: 0.1717, MAE: 0.0733, Spearman rho: 0.4487, Spearman p: 5.8810e-31, Pearson r: 0.4537, Pearson p: 1.0491e-31
  Pred range: [0.0596, 0.3433], std: 0.0478
  RMSE : 0.0908, R2: 0.1852, MAE: 0.0725, Spearman rho: 0.4515, Spearman p: 2.2339e-31, Pearson r: 0.4573, Pearson p: 3.0511e-32
  Pred range: [0.0664, 0.3613], std: 0.0488
  RMSE : 0.0934, R2: 0.1387, MAE: 0.0753, Spearman rho: 0.4505, Spearman p: 3.1748e-31, Pearson r: 0.4549, Pearson p: 6.9695e-32
  Pred range: [0.0606, 0.3438], std: 0.0476
  RMSE : 0.0913, R2: 0.1770, MAE: 0.0731, Spearman rho: 0.4535, Spearman p: 1.1518e-31, Pearson r: 0.4592, Pearson p: 1.5715e-32
[I 2026-04-29 00:27:16,996] Trial 20 finished with value: 0.09037435931754256 and parameters: {'learning_rate': 0.00017147052544375872, 'batch_size': 4, 'num_epochs': 12, 'weight_decay': 0.004586936994996487, 'layers_PRS': 3, 'layers_SCZ15': 2, 'layers_ADHD9': 2, 'layers_ASD9': 5, 'layers_ACE15': 5, 'layers_ACE18': 3, 'layers_SUD18': 3, 'layers_SES': 5, 'layers_SEX': 1, 'dropout': 0.3973426873489929, 'se_reduction': 4, 'hidden_dim_min': 5, 'base_loss': 'huber', 'huber_delta': 0.011900875570463905, 'focal_gamma': 1.2281751844769768, 'n_bins': 11, 'scheduler_patience': 2, 'scheduler_factor': 0.5271482697753108, 'early_stopping_patience': 6}. Best is trial 12 with value: 0.08869736027930415.
Train: 2407 rows (1613 IDs),Test: 598 rows (404 IDs) 

n_features_x : 6, n_features_per_modality: [16, 23, 19, 17, 7, 4, 4, 4, 1, 4]

--- ImbalancedRegressionLoss initialized ---
  Bins: 8, Focal gamma: 0.7160605222949601, Base loss: huber
  Bin [0.00, 0.12): count= 1180, weight=0.003
  Bin [0.12, 0.25): count=  933, weight=0.003
  Bin [0.25, 0.38): count=  253, weight=0.012
  Bin [0.38, 0.50): count=   30, weight=0.098
  Bin [0.50, 0.62): count=   10, weight=0.277
  Bin [0.62, 0.75): count=    1, weight=1.521
  Bin [0.75, 0.88): count=    0, weight=3.043
  Bin [0.88, 1.00): count=    0, weight=3.043
-------------------------------------------

  Pred range: [0.0255, 0.3867], std: 0.0561
  RMSE : 0.0906, R2: 0.1894, MAE: 0.0713, Spearman rho: 0.4513, Spearman p: 2.3798e-31, Pearson r: 0.4501, Pearson p: 3.6248e-31
  Pred range: [-0.0070, 0.3876], std: 0.0671
  RMSE : 0.0930, R2: 0.1462, MAE: 0.0740, Spearman rho: 0.4700, Spearman p: 3.4308e-34, Pearson r: 0.4782, Pearson p: 1.7239e-35
  Pred range: [0.0046, 0.4335], std: 0.0670
  RMSE : 0.0920, R2: 0.1634, MAE: 0.0722, Spearman rho: 0.4730, Spearman p: 1.1366e-34, Pearson r: 0.4706, Pearson p: 2.7919e-34
  Pred range: [0.0291, 0.5180], std: 0.0747
  RMSE : 0.1162, R2: -0.3337, MAE: 0.0956, Spearman rho: 0.4707, Spearman p: 2.6110e-34, Pearson r: 0.4718, Pearson p: 1.8065e-34
  Pred range: [0.0209, 0.3886], std: 0.0607
  RMSE : 0.0901, R2: 0.1981, MAE: 0.0718, Spearman rho: 0.4708, Spearman p: 2.5258e-34, Pearson r: 0.4759, Pearson p: 3.9984e-35
  Pred range: [0.0274, 0.3760], std: 0.0575
  RMSE : 0.0895, R2: 0.2077, MAE: 0.0709, Spearman rho: 0.4700, Spearman p: 3.4223e-34, Pearson r: 0.4792, Pearson p: 1.1832e-35
  Pred range: [0.0033, 0.3651], std: 0.0597
  RMSE : 0.0914, R2: 0.1751, MAE: 0.0730, Spearman rho: 0.4673, Spearman p: 8.9933e-34, Pearson r: 0.4749, Pearson p: 5.6584e-35
  Pred range: [0.0381, 0.4501], std: 0.0680
  RMSE : 0.0961, R2: 0.0879, MAE: 0.0765, Spearman rho: 0.4704, Spearman p: 2.9104e-34, Pearson r: 0.4710, Pearson p: 2.3688e-34
  Pred range: [0.0459, 0.4230], std: 0.0671
  RMSE : 0.0967, R2: 0.0768, MAE: 0.0781, Spearman rho: 0.4786, Spearman p: 1.4773e-35, Pearson r: 0.4866, Pearson p: 7.1905e-37
  Pred range: [0.0037, 0.3639], std: 0.0617
  RMSE : 0.0894, R2: 0.2098, MAE: 0.0708, Spearman rho: 0.4749, Spearman p: 5.7195e-35, Pearson r: 0.4830, Pearson p: 2.8132e-36
  Pred range: [0.0006, 0.3896], std: 0.0643
  RMSE : 0.0914, R2: 0.1752, MAE: 0.0727, Spearman rho: 0.4758, Spearman p: 4.0878e-35, Pearson r: 0.4806, Pearson p: 6.8024e-36
  Pred range: [0.0197, 0.3893], std: 0.0602
  RMSE : 0.0922, R2: 0.1595, MAE: 0.0741, Spearman rho: 0.4673, Spearman p: 8.9099e-34, Pearson r: 0.4735, Pearson p: 9.7093e-35
  Pred range: [0.0199, 0.3990], std: 0.0659
  RMSE : 0.0937, R2: 0.1323, MAE: 0.0752, Spearman rho: 0.4777, Spearman p: 2.0026e-35, Pearson r: 0.4841, Pearson p: 1.8703e-36
  Pred range: [0.0089, 0.3863], std: 0.0651
  RMSE : 0.0922, R2: 0.1606, MAE: 0.0736, Spearman rho: 0.4767, Spearman p: 2.9442e-35, Pearson r: 0.4830, Pearson p: 2.7808e-36
  Pred range: [0.0002, 0.3602], std: 0.0619
  RMSE : 0.0896, R2: 0.2061, MAE: 0.0708, Spearman rho: 0.4728, Spearman p: 1.2436e-34, Pearson r: 0.4793, Pearson p: 1.1049e-35
[I 2026-04-29 00:29:19,044] Trial 21 finished with value: 0.08942539834842149 and parameters: {'learning_rate': 0.002163393890681841, 'batch_size': 4, 'num_epochs': 15, 'weight_decay': 9.800382502421917e-05, 'layers_PRS': 2, 'layers_SCZ15': 3, 'layers_ADHD9': 1, 'layers_ASD9': 5, 'layers_ACE15': 4, 'layers_ACE18': 1, 'layers_SUD18': 2, 'layers_SES': 5, 'layers_SEX': 1, 'dropout': 0.4775588551061644, 'se_reduction': 2, 'hidden_dim_min': 11, 'base_loss': 'huber', 'huber_delta': 0.030949661074543017, 'focal_gamma': 0.7160605222949601, 'n_bins': 8, 'scheduler_patience': 2, 'scheduler_factor': 0.5366306216849842, 'early_stopping_patience': 6}. Best is trial 12 with value: 0.08869736027930415.
Train: 2407 rows (1613 IDs),Test: 598 rows (404 IDs) 

n_features_x : 6, n_features_per_modality: [16, 23, 19, 17, 7, 4, 4, 4, 1, 4]

--- ImbalancedRegressionLoss initialized ---
  Bins: 9, Focal gamma: 0.5199827372579041, Base loss: huber
  Bin [0.00, 0.11): count= 1180, weight=0.003
  Bin [0.11, 0.22): count=  835, weight=0.004
  Bin [0.22, 0.33): count=  312, weight=0.010
  Bin [0.33, 0.44): count=   59, weight=0.054
  Bin [0.44, 0.56): count=   16, weight=0.190
  Bin [0.56, 0.67): count=    4, weight=0.647
  Bin [0.67, 0.78): count=    1, weight=1.618
  Bin [0.78, 0.89): count=    0, weight=3.237
  Bin [0.89, 1.00): count=    0, weight=3.237
-------------------------------------------

  Pred range: [0.0522, 0.4096], std: 0.0603
  RMSE : 0.0965, R2: 0.0795, MAE: 0.0780, Spearman rho: 0.4419, Spearman p: 5.6967e-30, Pearson r: 0.4521, Pearson p: 1.8382e-31
  Pred range: [0.0232, 0.4053], std: 0.0641
  RMSE : 0.0949, R2: 0.1093, MAE: 0.0766, Spearman rho: 0.4571, Spearman p: 3.2706e-32, Pearson r: 0.4675, Pearson p: 8.2745e-34
  Pred range: [0.0305, 0.4036], std: 0.0611
  RMSE : 0.0917, R2: 0.1685, MAE: 0.0731, Spearman rho: 0.4606, Spearman p: 9.6578e-33, Pearson r: 0.4710, Pearson p: 2.3673e-34
  Pred range: [0.0162, 0.4127], std: 0.0582
  RMSE : 0.0950, R2: 0.1082, MAE: 0.0765, Spearman rho: 0.4553, Spearman p: 6.1214e-32, Pearson r: 0.4619, Pearson p: 6.0904e-33
  Pred range: [0.0162, 0.4245], std: 0.0667
  RMSE : 0.0907, R2: 0.1871, MAE: 0.0714, Spearman rho: 0.4733, Spearman p: 1.0131e-34, Pearson r: 0.4779, Pearson p: 1.9090e-35
  Pred range: [0.0056, 0.3901], std: 0.0584
  RMSE : 0.0889, R2: 0.2183, MAE: 0.0704, Spearman rho: 0.4699, Spearman p: 3.6025e-34, Pearson r: 0.4809, Pearson p: 6.1067e-36
  Pred range: [-0.0339, 0.3205], std: 0.0584
  RMSE : 0.0917, R2: 0.1697, MAE: 0.0710, Spearman rho: 0.4620, Spearman p: 5.9878e-33, Pearson r: 0.4740, Pearson p: 8.0736e-35
  Pred range: [-0.0336, 0.4250], std: 0.0680
  RMSE : 0.0947, R2: 0.1143, MAE: 0.0754, Spearman rho: 0.4527, Spearman p: 1.4885e-31, Pearson r: 0.4572, Pearson p: 3.1787e-32
  Pred range: [-0.0345, 0.3743], std: 0.0617
  RMSE : 0.0892, R2: 0.2130, MAE: 0.0702, Spearman rho: 0.4718, Spearman p: 1.7754e-34, Pearson r: 0.4804, Pearson p: 7.5503e-36
  Pred range: [-0.0006, 0.3784], std: 0.0599
  RMSE : 0.0903, R2: 0.1950, MAE: 0.0720, Spearman rho: 0.4653, Spearman p: 1.8428e-33, Pearson r: 0.4757, Pearson p: 4.3110e-35
  Pred range: [-0.0052, 0.3689], std: 0.0594
  RMSE : 0.0927, R2: 0.1500, MAE: 0.0748, Spearman rho: 0.4631, Spearman p: 3.9940e-33, Pearson r: 0.4766, Pearson p: 3.0421e-35
  Pred range: [-0.0075, 0.3831], std: 0.0609
  RMSE : 0.0913, R2: 0.1757, MAE: 0.0730, Spearman rho: 0.4698, Spearman p: 3.7200e-34, Pearson r: 0.4765, Pearson p: 3.2192e-35
  Pred range: [0.0036, 0.3911], std: 0.0614
  RMSE : 0.0951, R2: 0.1056, MAE: 0.0770, Spearman rho: 0.4606, Spearman p: 9.8833e-33, Pearson r: 0.4721, Pearson p: 1.6160e-34
[I 2026-04-29 00:31:01,298] Trial 22 finished with value: 0.08893829163026779 and parameters: {'learning_rate': 0.0013336646081865892, 'batch_size': 4, 'num_epochs': 16, 'weight_decay': 9.552851073037673e-05, 'layers_PRS': 2, 'layers_SCZ15': 3, 'layers_ADHD9': 1, 'layers_ASD9': 5, 'layers_ACE15': 4, 'layers_ACE18': 1, 'layers_SUD18': 2, 'layers_SES': 4, 'layers_SEX': 1, 'dropout': 0.4533534984247262, 'se_reduction': 2, 'hidden_dim_min': 11, 'base_loss': 'huber', 'huber_delta': 0.068873188592907, 'focal_gamma': 0.5199827372579041, 'n_bins': 9, 'scheduler_patience': 2, 'scheduler_factor': 0.5937022429525435, 'early_stopping_patience': 7}. Best is trial 12 with value: 0.08869736027930415.
Train: 2407 rows (1613 IDs),Test: 598 rows (404 IDs) 

n_features_x : 6, n_features_per_modality: [16, 23, 19, 17, 7, 4, 4, 4, 1, 4]

--- ImbalancedRegressionLoss initialized ---
  Bins: 10, Focal gamma: 0.8710759243153419, Base loss: huber
  Bin [0.00, 0.10): count= 1010, weight=0.003
  Bin [0.10, 0.20): count=  866, weight=0.003
  Bin [0.20, 0.30): count=  386, weight=0.007
  Bin [0.30, 0.40): count=  111, weight=0.026
  Bin [0.40, 0.50): count=   23, weight=0.119
  Bin [0.50, 0.60): count=    9, weight=0.287
  Bin [0.60, 0.70): count=    2, weight=0.955
  Bin [0.70, 0.80): count=    0, weight=2.866
  Bin [0.80, 0.90): count=    0, weight=2.866
  Bin [0.90, 1.00): count=    0, weight=2.866
-------------------------------------------

  Pred range: [-0.0174, 0.2708], std: 0.0406
  RMSE : 0.1140, R2: -0.2850, MAE: 0.0878, Spearman rho: 0.1410, Spearman p: 5.4181e-04, Pearson r: 0.1543, Pearson p: 1.5203e-04
  Pred range: [0.0279, 0.3416], std: 0.0464
  RMSE : 0.1016, R2: -0.0201, MAE: 0.0816, Spearman rho: 0.2024, Spearman p: 5.9990e-07, Pearson r: 0.2096, Pearson p: 2.3063e-07
  Pred range: [0.0384, 0.3613], std: 0.0487
  RMSE : 0.1022, R2: -0.0313, MAE: 0.0823, Spearman rho: 0.2345, Spearman p: 6.4630e-09, Pearson r: 0.2416, Pearson p: 2.1856e-09
  Pred range: [0.0414, 0.3643], std: 0.0496
  RMSE : 0.1018, R2: -0.0251, MAE: 0.0820, Spearman rho: 0.2605, Spearman p: 9.7973e-11, Pearson r: 0.2656, Pearson p: 4.0963e-11
  Pred range: [0.0420, 0.3629], std: 0.0502
  RMSE : 0.1010, R2: -0.0076, MAE: 0.0812, Spearman rho: 0.2793, Spearman p: 3.5326e-12, Pearson r: 0.2859, Pearson p: 1.0395e-12
  Pred range: [0.0415, 0.3585], std: 0.0505
  RMSE : 0.0999, R2: 0.0143, MAE: 0.0801, Spearman rho: 0.2951, Spearman p: 1.7615e-13, Pearson r: 0.3021, Pearson p: 4.3631e-14
[I 2026-04-29 00:31:48,122] Trial 23 pruned. 
Train: 2407 rows (1613 IDs),Test: 598 rows (404 IDs) 

n_features_x : 6, n_features_per_modality: [16, 23, 19, 17, 7, 4, 4, 4, 1, 4]

--- ImbalancedRegressionLoss initialized ---
  Bins: 20, Focal gamma: 0.6157598292018587, Base loss: huber
  Bin [0.00, 0.05): count=  650, weight=0.004
  Bin [0.05, 0.10): count=  360, weight=0.007
  Bin [0.10, 0.15): count=  360, weight=0.007
  Bin [0.15, 0.20): count=  506, weight=0.005
  Bin [0.20, 0.25): count=  237, weight=0.011
  Bin [0.25, 0.30): count=  149, weight=0.017
  Bin [0.30, 0.35): count=   91, weight=0.028
  Bin [0.35, 0.40): count=   20, weight=0.125
  Bin [0.40, 0.45): count=   13, weight=0.187
  Bin [0.45, 0.50): count=   10, weight=0.238
  Bin [0.50, 0.55): count=    6, weight=0.374
  Bin [0.55, 0.60): count=    3, weight=0.655
  Bin [0.60, 0.65): count=    1, weight=1.310
  Bin [0.65, 0.70): count=    1, weight=1.310
  Bin [0.70, 0.75): count=    0, weight=2.620
  Bin [0.75, 0.80): count=    0, weight=2.620
  Bin [0.80, 0.85): count=    0, weight=2.620
  Bin [0.85, 0.90): count=    0, weight=2.620
  Bin [0.90, 0.95): count=    0, weight=2.620
  Bin [0.95, 1.00): count=    0, weight=2.620
-------------------------------------------

  Pred range: [0.0413, 0.3623], std: 0.0539
  RMSE : 0.0885, R2: 0.2257, MAE: 0.0705, Spearman rho: 0.4706, Spearman p: 2.7839e-34, Pearson r: 0.4809, Pearson p: 6.2047e-36
  Pred range: [0.0707, 0.4284], std: 0.0598
  RMSE : 0.1000, R2: 0.0115, MAE: 0.0815, Spearman rho: 0.4548, Spearman p: 7.2269e-32, Pearson r: 0.4687, Pearson p: 5.4472e-34
  Pred range: [-0.0118, 0.3374], std: 0.0520
  RMSE : 0.0898, R2: 0.2026, MAE: 0.0709, Spearman rho: 0.4554, Spearman p: 5.9693e-32, Pearson r: 0.4669, Pearson p: 1.0511e-33
  Pred range: [0.0442, 0.4024], std: 0.0581
  RMSE : 0.0965, R2: 0.0795, MAE: 0.0783, Spearman rho: 0.4621, Spearman p: 5.6727e-33, Pearson r: 0.4727, Pearson p: 1.2850e-34
  Pred range: [0.0081, 0.4081], std: 0.0635
  RMSE : 0.0928, R2: 0.1489, MAE: 0.0744, Spearman rho: 0.4712, Spearman p: 2.2417e-34, Pearson r: 0.4805, Pearson p: 7.1774e-36
  Pred range: [0.0392, 0.4341], std: 0.0649
  RMSE : 0.1015, R2: -0.0181, MAE: 0.0825, Spearman rho: 0.4607, Spearman p: 9.5139e-33, Pearson r: 0.4709, Pearson p: 2.4910e-34
  Pred range: [0.0089, 0.3555], std: 0.0545
  RMSE : 0.0884, R2: 0.2272, MAE: 0.0696, Spearman rho: 0.4702, Spearman p: 3.1523e-34, Pearson r: 0.4819, Pearson p: 4.3077e-36
  Pred range: [0.0229, 0.4129], std: 0.0665
  RMSE : 0.0910, R2: 0.1822, MAE: 0.0713, Spearman rho: 0.4623, Spearman p: 5.3816e-33, Pearson r: 0.4711, Pearson p: 2.2707e-34
  Pred range: [0.0038, 0.3722], std: 0.0552
  RMSE : 0.0897, R2: 0.2049, MAE: 0.0717, Spearman rho: 0.4648, Spearman p: 2.1791e-33, Pearson r: 0.4755, Pearson p: 4.5429e-35
  Pred range: [0.0597, 0.4310], std: 0.0621
  RMSE : 0.1011, R2: -0.0110, MAE: 0.0827, Spearman rho: 0.4632, Spearman p: 3.9615e-33, Pearson r: 0.4752, Pearson p: 5.1382e-35
  Pred range: [-0.0245, 0.3592], std: 0.0571
  RMSE : 0.0890, R2: 0.2172, MAE: 0.0705, Spearman rho: 0.4623, Spearman p: 5.3970e-33, Pearson r: 0.4751, Pearson p: 5.2854e-35
  Pred range: [0.0073, 0.3853], std: 0.0619
  RMSE : 0.0916, R2: 0.1717, MAE: 0.0732, Spearman rho: 0.4653, Spearman p: 1.8256e-33, Pearson r: 0.4789, Pearson p: 1.2821e-35
  Pred range: [-0.0025, 0.3717], std: 0.0590
  RMSE : 0.0894, R2: 0.2102, MAE: 0.0710, Spearman rho: 0.4676, Spearman p: 7.9854e-34, Pearson r: 0.4788, Pearson p: 1.3723e-35
  Pred range: [0.0004, 0.3711], std: 0.0606
  RMSE : 0.0897, R2: 0.2056, MAE: 0.0711, Spearman rho: 0.4683, Spearman p: 6.3754e-34, Pearson r: 0.4791, Pearson p: 1.2307e-35
[I 2026-04-29 00:33:36,556] Trial 24 finished with value: 0.08843051078225092 and parameters: {'learning_rate': 0.0009950246910973121, 'batch_size': 4, 'num_epochs': 19, 'weight_decay': 4.9682014011934153e-05, 'layers_PRS': 2, 'layers_SCZ15': 3, 'layers_ADHD9': 2, 'layers_ASD9': 5, 'layers_ACE15': 3, 'layers_ACE18': 1, 'layers_SUD18': 2, 'layers_SES': 4, 'layers_SEX': 1, 'dropout': 0.3365472474792071, 'se_reduction': 3, 'hidden_dim_min': 12, 'base_loss': 'huber', 'huber_delta': 0.04845073097970327, 'focal_gamma': 0.6157598292018587, 'n_bins': 20, 'scheduler_patience': 2, 'scheduler_factor': 0.6065531415699572, 'early_stopping_patience': 7}. Best is trial 24 with value: 0.08843051078225092.
Train: 2407 rows (1613 IDs),Test: 598 rows (404 IDs) 

n_features_x : 6, n_features_per_modality: [16, 23, 19, 17, 7, 4, 4, 4, 1, 4]

--- ImbalancedRegressionLoss initialized ---
  Bins: 20, Focal gamma: 1.0036009432850896, Base loss: huber
  Bin [0.00, 0.05): count=  650, weight=0.004
  Bin [0.05, 0.10): count=  360, weight=0.007
  Bin [0.10, 0.15): count=  360, weight=0.007
  Bin [0.15, 0.20): count=  506, weight=0.005
  Bin [0.20, 0.25): count=  237, weight=0.011
  Bin [0.25, 0.30): count=  149, weight=0.017
  Bin [0.30, 0.35): count=   91, weight=0.028
  Bin [0.35, 0.40): count=   20, weight=0.125
  Bin [0.40, 0.45): count=   13, weight=0.187
  Bin [0.45, 0.50): count=   10, weight=0.238
  Bin [0.50, 0.55): count=    6, weight=0.374
  Bin [0.55, 0.60): count=    3, weight=0.655
  Bin [0.60, 0.65): count=    1, weight=1.310
  Bin [0.65, 0.70): count=    1, weight=1.310
  Bin [0.70, 0.75): count=    0, weight=2.620
  Bin [0.75, 0.80): count=    0, weight=2.620
  Bin [0.80, 0.85): count=    0, weight=2.620
  Bin [0.85, 0.90): count=    0, weight=2.620
  Bin [0.90, 0.95): count=    0, weight=2.620
  Bin [0.95, 1.00): count=    0, weight=2.620
-------------------------------------------

  Pred range: [0.0418, 0.4060], std: 0.0557
  RMSE : 0.0957, R2: 0.0952, MAE: 0.0760, Spearman rho: 0.3738, Spearman p: 2.9061e-21, Pearson r: 0.3737, Pearson p: 2.9507e-21
  Pred range: [0.0776, 0.4784], std: 0.0624
  RMSE : 0.1068, R2: -0.1271, MAE: 0.0880, Spearman rho: 0.4437, Spearman p: 3.1430e-30, Pearson r: 0.4486, Pearson p: 5.9641e-31
  Pred range: [0.0605, 0.5124], std: 0.0700
  RMSE : 0.1067, R2: -0.1248, MAE: 0.0869, Spearman rho: 0.4492, Spearman p: 4.8973e-31, Pearson r: 0.4547, Pearson p: 7.5887e-32
  Pred range: [0.0464, 0.4293], std: 0.0640
  RMSE : 0.0934, R2: 0.1379, MAE: 0.0740, Spearman rho: 0.4441, Spearman p: 2.6891e-30, Pearson r: 0.4464, Pearson p: 1.2398e-30
  Pred range: [0.0594, 0.4845], std: 0.0670
  RMSE : 0.1075, R2: -0.1429, MAE: 0.0875, Spearman rho: 0.4446, Spearman p: 2.3292e-30, Pearson r: 0.4510, Pearson p: 2.6763e-31
  Pred range: [0.0103, 0.4273], std: 0.0614
  RMSE : 0.0965, R2: 0.0792, MAE: 0.0781, Spearman rho: 0.4481, Spearman p: 7.2348e-31, Pearson r: 0.4581, Pearson p: 2.3510e-32
