[I 2026-04-27 16:51:23,352] Trial 27 finished with value: 0.08909831017290984 and parameters: {'learning_rate': 6.486822427036724e-05, 'batch_size': 4, 'num_epochs': 24, 'weight_decay': 0.00010106295041528403, 'layers_PRS': 7, 'layers_SCZ15': 4, 'layers_ADHD9': 4, 'layers_ASD9': 2, 'layers_ACE15': 6, 'layers_ACE18': 3, 'layers_SUD18': 4, 'layers_SES': 2, 'layers_SEX': 2, 'dropout': 0.22862579884060247, 'se_reduction': 4, 'hidden_dim_min': 7, 'base_loss': 'huber', 'huber_delta': 0.05020566936594496, 'focal_gamma': 0.5198694638351238, 'n_bins': 14, 'scheduler_patience': 4, 'scheduler_factor': 0.6033757224740651, 'early_stopping_patience': 4}. Best is trial 9 with value: 0.08803266597627345.
Train: 2407 rows (1613 IDs),Test: 598 rows (404 IDs) 

n_features_x : 6, n_features_per_modality: [16, 23, 19, 17, 7, 4, 4, 4, 1, 4]

--- ImbalancedRegressionLoss initialized ---
  Bins: 7, Focal gamma: 1.0709238702209831, Base loss: huber
  Bin [0.00, 0.14): count= 1370, weight=0.002
  Bin [0.14, 0.29): count=  892, weight=0.003
  Bin [0.29, 0.43): count=  120, weight=0.024
  Bin [0.43, 0.57): count=   23, weight=0.122
  Bin [0.57, 0.71): count=    2, weight=0.978
  Bin [0.71, 0.86): count=    0, weight=2.935
  Bin [0.86, 1.00): count=    0, weight=2.935
-------------------------------------------

  Pred range: [0.0342, 0.4321], std: 0.0571
  RMSE : 0.0935, R2: 0.1355, MAE: 0.0746, Spearman rho: 0.4236, Spearman p: 1.9449e-27, Pearson r: 0.4297, Pearson p: 2.8835e-28
  Pred range: [0.0428, 0.5027], std: 0.0757
  RMSE : 0.1269, R2: -0.5909, MAE: 0.1063, Spearman rho: 0.4543, Spearman p: 8.5490e-32, Pearson r: 0.4697, Pearson p: 3.8034e-34
  Pred range: [-0.0061, 0.3937], std: 0.0601
  RMSE : 0.0964, R2: 0.0810, MAE: 0.0784, Spearman rho: 0.4610, Spearman p: 8.5618e-33, Pearson r: 0.4758, Pearson p: 4.0440e-35
  Pred range: [-0.0011, 0.3685], std: 0.0553
  RMSE : 0.0894, R2: 0.2103, MAE: 0.0713, Spearman rho: 0.4667, Spearman p: 1.1039e-33, Pearson r: 0.4741, Pearson p: 7.7471e-35
  Pred range: [0.0218, 0.3922], std: 0.0504
  RMSE : 0.0900, R2: 0.1998, MAE: 0.0719, Spearman rho: 0.4610, Spearman p: 8.3451e-33, Pearson r: 0.4651, Pearson p: 1.9906e-33
  Pred range: [-0.0530, 0.3406], std: 0.0591
  RMSE : 0.0914, R2: 0.1738, MAE: 0.0729, Spearman rho: 0.4466, Spearman p: 1.1591e-30, Pearson r: 0.4445, Pearson p: 2.3532e-30
  Pred range: [0.0151, 0.4487], std: 0.0646
  RMSE : 0.0928, R2: 0.1497, MAE: 0.0726, Spearman rho: 0.4551, Spearman p: 6.5485e-32, Pearson r: 0.4454, Pearson p: 1.7784e-30
[I 2026-04-27 16:52:26,229] Trial 28 finished with value: 0.08939340963695577 and parameters: {'learning_rate': 0.0021109271636123523, 'batch_size': 4, 'num_epochs': 15, 'weight_decay': 2.6366759018295242e-05, 'layers_PRS': 6, 'layers_SCZ15': 5, 'layers_ADHD9': 2, 'layers_ASD9': 3, 'layers_ACE15': 3, 'layers_ACE18': 2, 'layers_SUD18': 2, 'layers_SES': 5, 'layers_SEX': 1, 'dropout': 0.46194670819232936, 'se_reduction': 5, 'hidden_dim_min': 16, 'base_loss': 'huber', 'huber_delta': 0.028879572789981146, 'focal_gamma': 1.0709238702209831, 'n_bins': 7, 'scheduler_patience': 3, 'scheduler_factor': 0.6742388303882642, 'early_stopping_patience': 3}. Best is trial 9 with value: 0.08803266597627345.
Train: 2407 rows (1613 IDs),Test: 598 rows (404 IDs) 

n_features_x : 6, n_features_per_modality: [16, 23, 19, 17, 7, 4, 4, 4, 1, 4]

--- ImbalancedRegressionLoss initialized ---
  Bins: 5, Focal gamma: 0.7432578489413463, Base loss: mse
  Bin [0.00, 0.20): count= 1876, weight=0.002
  Bin [0.20, 0.40): count=  497, weight=0.007
  Bin [0.40, 0.60): count=   32, weight=0.111
  Bin [0.60, 0.80): count=    2, weight=1.220
  Bin [0.80, 1.00): count=    0, weight=3.660
-------------------------------------------

  Pred range: [0.0612, 0.3778], std: 0.0573
  RMSE : 0.0978, R2: 0.0539, MAE: 0.0790, Spearman rho: 0.4169, Spearman p: 1.4989e-26, Pearson r: 0.4226, Pearson p: 2.6201e-27
  Pred range: [0.0648, 0.4020], std: 0.0588
  RMSE : 0.0981, R2: 0.0495, MAE: 0.0795, Spearman rho: 0.4353, Spearman p: 4.8681e-29, Pearson r: 0.4422, Pearson p: 5.0573e-30
  Pred range: [0.0639, 0.3744], std: 0.0535
  RMSE : 0.0935, R2: 0.1353, MAE: 0.0754, Spearman rho: 0.4408, Spearman p: 7.9275e-30, Pearson r: 0.4486, Pearson p: 6.0120e-31
  Pred range: [0.0567, 0.3683], std: 0.0548
  RMSE : 0.0921, R2: 0.1612, MAE: 0.0741, Spearman rho: 0.4481, Spearman p: 7.1301e-31, Pearson r: 0.4558, Pearson p: 5.1955e-32
  Pred range: [0.0507, 0.3630], std: 0.0534
  RMSE : 0.0911, R2: 0.1805, MAE: 0.0730, Spearman rho: 0.4548, Spearman p: 7.3108e-32, Pearson r: 0.4621, Pearson p: 5.7618e-33
  Pred range: [0.0505, 0.3722], std: 0.0536
  RMSE : 0.0926, R2: 0.1526, MAE: 0.0747, Spearman rho: 0.4592, Spearman p: 1.5877e-32, Pearson r: 0.4673, Pearson p: 9.2069e-34
  Pred range: [0.0584, 0.3963], std: 0.0549
  RMSE : 0.0975, R2: 0.0600, MAE: 0.0797, Spearman rho: 0.4585, Spearman p: 2.0499e-32, Pearson r: 0.4665, Pearson p: 1.2220e-33
  Pred range: [0.0508, 0.3679], std: 0.0525
  RMSE : 0.0939, R2: 0.1294, MAE: 0.0761, Spearman rho: 0.4560, Spearman p: 4.7790e-32, Pearson r: 0.4660, Pearson p: 1.4462e-33
  Pred range: [0.0657, 0.3939], std: 0.0559
  RMSE : 0.1010, R2: -0.0089, MAE: 0.0830, Spearman rho: 0.4560, Spearman p: 4.8644e-32, Pearson r: 0.4649, Pearson p: 2.0983e-33
  Pred range: [0.0474, 0.3778], std: 0.0546
  RMSE : 0.0934, R2: 0.1374, MAE: 0.0755, Spearman rho: 0.4604, Spearman p: 1.0352e-32, Pearson r: 0.4692, Pearson p: 4.6108e-34
[I 2026-04-27 16:53:59,990] Trial 29 finished with value: 0.09106316961861746 and parameters: {'learning_rate': 0.00028373228236748955, 'batch_size': 4, 'num_epochs': 20, 'weight_decay': 0.0007072759413249469, 'layers_PRS': 5, 'layers_SCZ15': 6, 'layers_ADHD9': 2, 'layers_ASD9': 1, 'layers_ACE15': 6, 'layers_ACE18': 1, 'layers_SUD18': 3, 'layers_SES': 4, 'layers_SEX': 3, 'dropout': 0.27584942574785076, 'se_reduction': 5, 'hidden_dim_min': 10, 'base_loss': 'mse', 'huber_delta': 0.12697241342278748, 'focal_gamma': 0.7432578489413463, 'n_bins': 5, 'scheduler_patience': 5, 'scheduler_factor': 0.6210887482030982, 'early_stopping_patience': 5}. Best is trial 9 with value: 0.08803266597627345.
Train: 2407 rows (1613 IDs),Test: 598 rows (404 IDs) 

n_features_x : 6, n_features_per_modality: [16, 23, 19, 17, 7, 4, 4, 4, 1, 4]

--- ImbalancedRegressionLoss initialized ---
  Bins: 6, Focal gamma: 0.7142933807755256, Base loss: huber
  Bin [0.00, 0.17): count= 1538, weight=0.002
  Bin [0.17, 0.33): count=  789, weight=0.005
  Bin [0.33, 0.50): count=   69, weight=0.053
  Bin [0.50, 0.67): count=   10, weight=0.339
  Bin [0.67, 0.83): count=    1, weight=1.867
  Bin [0.83, 1.00): count=    0, weight=3.733
-------------------------------------------

  Pred range: [0.0299, 0.3863], std: 0.0449
  RMSE : 0.1140, R2: -0.2836, MAE: 0.0945, Spearman rho: 0.1671, Spearman p: 4.0086e-05, Pearson r: 0.2048, Pearson p: 4.3587e-07
  Pred range: [0.0356, 0.4128], std: 0.0566
  RMSE : 0.1129, R2: -0.2600, MAE: 0.0934, Spearman rho: 0.2964, Spearman p: 1.3502e-13, Pearson r: 0.3206, Pearson p: 9.1488e-16
  Pred range: [0.0211, 0.3931], std: 0.0581
  RMSE : 0.1070, R2: -0.1315, MAE: 0.0881, Spearman rho: 0.3368, Spearman p: 2.5185e-17, Pearson r: 0.3580, Pearson p: 1.6222e-19
  Pred range: [0.0152, 0.3942], std: 0.0592
  RMSE : 0.1039, R2: -0.0673, MAE: 0.0852, Spearman rho: 0.3647, Spearman p: 3.0111e-20, Pearson r: 0.3822, Pearson p: 3.1030e-22
  Pred range: [0.0197, 0.4298], std: 0.0630
  RMSE : 0.1088, R2: -0.1688, MAE: 0.0898, Spearman rho: 0.3843, Spearman p: 1.7561e-22, Pearson r: 0.4003, Pearson p: 2.0413e-24
  Pred range: [0.0207, 0.4500], std: 0.0648
  RMSE : 0.1107, R2: -0.2111, MAE: 0.0915, Spearman rho: 0.3971, Spearman p: 4.9857e-24, Pearson r: 0.4129, Pearson p: 5.0863e-26
[I 2026-04-27 16:54:17,610] Trial 30 pruned. 
Train: 2407 rows (1613 IDs),Test: 598 rows (404 IDs) 

n_features_x : 6, n_features_per_modality: [16, 23, 19, 17, 7, 4, 4, 4, 1, 4]

--- ImbalancedRegressionLoss initialized ---
  Bins: 7, Focal gamma: 0.8474936554575239, Base loss: huber
  Bin [0.00, 0.14): count= 1370, weight=0.002
  Bin [0.14, 0.29): count=  892, weight=0.003
  Bin [0.29, 0.43): count=  120, weight=0.024
  Bin [0.43, 0.57): count=   23, weight=0.122
  Bin [0.57, 0.71): count=    2, weight=0.978
  Bin [0.71, 0.86): count=    0, weight=2.935
  Bin [0.86, 1.00): count=    0, weight=2.935
-------------------------------------------

  Pred range: [0.0527, 0.4448], std: 0.0602
  RMSE : 0.0985, R2: 0.0419, MAE: 0.0785, Spearman rho: 0.3609, Spearman p: 7.8552e-20, Pearson r: 0.3659, Pearson p: 2.1931e-20
  Pred range: [0.0479, 0.4229], std: 0.0590
  RMSE : 0.0951, R2: 0.1067, MAE: 0.0758, Spearman rho: 0.3990, Spearman p: 2.9720e-24, Pearson r: 0.4077, Pearson p: 2.3315e-25
  Pred range: [0.0401, 0.3910], std: 0.0586
  RMSE : 0.0924, R2: 0.1561, MAE: 0.0734, Spearman rho: 0.4259, Spearman p: 9.5774e-28, Pearson r: 0.4355, Pearson p: 4.5528e-29
  Pred range: [0.0461, 0.4024], std: 0.0594
  RMSE : 0.0930, R2: 0.1446, MAE: 0.0746, Spearman rho: 0.4401, Spearman p: 9.9816e-30, Pearson r: 0.4500, Pearson p: 3.7387e-31
  Pred range: [0.0428, 0.3997], std: 0.0588
  RMSE : 0.0920, R2: 0.1637, MAE: 0.0736, Spearman rho: 0.4476, Spearman p: 8.4921e-31, Pearson r: 0.4585, Pearson p: 2.0460e-32
  Pred range: [0.0354, 0.3876], std: 0.0590
  RMSE : 0.0905, R2: 0.1906, MAE: 0.0716, Spearman rho: 0.4505, Spearman p: 3.1784e-31, Pearson r: 0.4601, Pearson p: 1.1736e-32
  Pred range: [0.0470, 0.4110], std: 0.0614
  RMSE : 0.0962, R2: 0.0862, MAE: 0.0779, Spearman rho: 0.4531, Spearman p: 1.2843e-31, Pearson r: 0.4647, Pearson p: 2.3182e-33
  Pred range: [0.0297, 0.3678], std: 0.0577
  RMSE : 0.0897, R2: 0.2053, MAE: 0.0712, Spearman rho: 0.4630, Spearman p: 4.1421e-33, Pearson r: 0.4736, Pearson p: 9.2799e-35
  Pred range: [0.0387, 0.3936], std: 0.0606
  RMSE : 0.0933, R2: 0.1405, MAE: 0.0750, Spearman rho: 0.4624, Spearman p: 5.1422e-33, Pearson r: 0.4729, Pearson p: 1.2136e-34
  Pred range: [0.0324, 0.3780], std: 0.0585
  RMSE : 0.0899, R2: 0.2007, MAE: 0.0713, Spearman rho: 0.4616, Spearman p: 6.7510e-33, Pearson r: 0.4716, Pearson p: 1.9290e-34
  Pred range: [0.0301, 0.3631], std: 0.0582
  RMSE : 0.0893, R2: 0.2120, MAE: 0.0708, Spearman rho: 0.4700, Spearman p: 3.4838e-34, Pearson r: 0.4791, Pearson p: 1.2046e-35
  Pred range: [0.0448, 0.3915], std: 0.0608
  RMSE : 0.0948, R2: 0.1124, MAE: 0.0767, Spearman rho: 0.4683, Spearman p: 6.4212e-34, Pearson r: 0.4777, Pearson p: 2.0588e-35
  Pred range: [0.0314, 0.3650], std: 0.0584
  RMSE : 0.0891, R2: 0.2162, MAE: 0.0705, Spearman rho: 0.4729, Spearman p: 1.1717e-34, Pearson r: 0.4804, Pearson p: 7.3920e-36
  Pred range: [0.0463, 0.3942], std: 0.0606
  RMSE : 0.0937, R2: 0.1332, MAE: 0.0755, Spearman rho: 0.4687, Spearman p: 5.4476e-34, Pearson r: 0.4771, Pearson p: 2.5048e-35
  Pred range: [0.0465, 0.3811], std: 0.0563
  RMSE : 0.0918, R2: 0.1681, MAE: 0.0740, Spearman rho: 0.4710, Spearman p: 2.3877e-34, Pearson r: 0.4804, Pearson p: 7.5372e-36
  Pred range: [0.0421, 0.3814], std: 0.0597
  RMSE : 0.0904, R2: 0.1932, MAE: 0.0721, Spearman rho: 0.4742, Spearman p: 7.4252e-35, Pearson r: 0.4830, Pearson p: 2.8281e-36
  Pred range: [0.0390, 0.3731], std: 0.0597
  RMSE : 0.0895, R2: 0.2090, MAE: 0.0710, Spearman rho: 0.4772, Spearman p: 2.4395e-35, Pearson r: 0.4844, Pearson p: 1.6691e-36
  Pred range: [0.0403, 0.3751], std: 0.0592
  RMSE : 0.0897, R2: 0.2051, MAE: 0.0713, Spearman rho: 0.4756, Spearman p: 4.4827e-35, Pearson r: 0.4838, Pearson p: 2.0845e-36
[I 2026-04-27 16:56:47,449] Trial 31 finished with value: 0.089059793908016 and parameters: {'learning_rate': 0.0002557121111633475, 'batch_size': 4, 'num_epochs': 19, 'weight_decay': 0.0008676384900340206, 'layers_PRS': 4, 'layers_SCZ15': 3, 'layers_ADHD9': 1, 'layers_ASD9': 3, 'layers_ACE15': 2, 'layers_ACE18': 3, 'layers_SUD18': 5, 'layers_SES': 5, 'layers_SEX': 1, 'dropout': 0.4953939032012947, 'se_reduction': 4, 'hidden_dim_min': 3, 'base_loss': 'huber', 'huber_delta': 0.01954598263907321, 'focal_gamma': 0.8474936554575239, 'n_bins': 7, 'scheduler_patience': 2, 'scheduler_factor': 0.6694726882658618, 'early_stopping_patience': 5}. Best is trial 9 with value: 0.08803266597627345.
Train: 2407 rows (1613 IDs),Test: 598 rows (404 IDs) 

n_features_x : 6, n_features_per_modality: [16, 23, 19, 17, 7, 4, 4, 4, 1, 4]

--- ImbalancedRegressionLoss initialized ---
  Bins: 8, Focal gamma: 2.138556434530469, Base loss: huber
  Bin [0.00, 0.12): count= 1180, weight=0.003
  Bin [0.12, 0.25): count=  933, weight=0.003
  Bin [0.25, 0.38): count=  253, weight=0.012
  Bin [0.38, 0.50): count=   30, weight=0.098
  Bin [0.50, 0.62): count=   10, weight=0.277
  Bin [0.62, 0.75): count=    1, weight=1.521
  Bin [0.75, 0.88): count=    0, weight=3.043
  Bin [0.88, 1.00): count=    0, weight=3.043
-------------------------------------------

  Pred range: [0.0372, 0.3558], std: 0.0536
  RMSE : 0.0924, R2: 0.1555, MAE: 0.0742, Spearman rho: 0.4141, Spearman p: 3.4978e-26, Pearson r: 0.4295, Pearson p: 3.0909e-28
  Pred range: [0.0472, 0.3617], std: 0.0548
  RMSE : 0.0920, R2: 0.1637, MAE: 0.0739, Spearman rho: 0.4379, Spearman p: 2.1032e-29, Pearson r: 0.4509, Pearson p: 2.7683e-31
  Pred range: [0.0403, 0.3316], std: 0.0528
  RMSE : 0.0894, R2: 0.2109, MAE: 0.0711, Spearman rho: 0.4498, Spearman p: 3.9899e-31, Pearson r: 0.4645, Pearson p: 2.4146e-33
  Pred range: [0.0481, 0.3396], std: 0.0508
  RMSE : 0.0899, R2: 0.2009, MAE: 0.0722, Spearman rho: 0.4552, Spearman p: 6.4341e-32, Pearson r: 0.4650, Pearson p: 2.0583e-33
  Pred range: [0.0435, 0.3465], std: 0.0519
  RMSE : 0.0899, R2: 0.2015, MAE: 0.0718, Spearman rho: 0.4548, Spearman p: 7.4119e-32, Pearson r: 0.4628, Pearson p: 4.4511e-33
  Pred range: [0.0537, 0.4025], std: 0.0604
  RMSE : 0.0937, R2: 0.1315, MAE: 0.0754, Spearman rho: 0.4619, Spearman p: 6.2080e-33, Pearson r: 0.4678, Pearson p: 7.6836e-34
  Pred range: [0.0519, 0.3364], std: 0.0515
  RMSE : 0.0892, R2: 0.2143, MAE: 0.0711, Spearman rho: 0.4698, Spearman p: 3.7350e-34, Pearson r: 0.4760, Pearson p: 3.7783e-35
  Pred range: [0.0455, 0.3280], std: 0.0508
  RMSE : 0.0888, R2: 0.2215, MAE: 0.0704, Spearman rho: 0.4651, Spearman p: 2.0111e-33, Pearson r: 0.4732, Pearson p: 1.0548e-34
  Pred range: [0.0408, 0.3479], std: 0.0530
  RMSE : 0.0888, R2: 0.2211, MAE: 0.0702, Spearman rho: 0.4694, Spearman p: 4.2893e-34, Pearson r: 0.4743, Pearson p: 7.0967e-35
  Pred range: [0.0529, 0.3395], std: 0.0526
  RMSE : 0.0897, R2: 0.2057, MAE: 0.0716, Spearman rho: 0.4720, Spearman p: 1.6370e-34, Pearson r: 0.4782, Pearson p: 1.6806e-35
  Pred range: [0.0374, 0.3209], std: 0.0521
  RMSE : 0.0884, R2: 0.2275, MAE: 0.0697, Spearman rho: 0.4743, Spearman p: 7.2258e-35, Pearson r: 0.4787, Pearson p: 1.4135e-35
  Pred range: [0.0498, 0.3370], std: 0.0497
  RMSE : 0.0888, R2: 0.2213, MAE: 0.0707, Spearman rho: 0.4745, Spearman p: 6.5720e-35, Pearson r: 0.4813, Pearson p: 5.2681e-36
  Pred range: [0.0496, 0.3445], std: 0.0519
  RMSE : 0.0888, R2: 0.2205, MAE: 0.0707, Spearman rho: 0.4697, Spearman p: 3.8200e-34, Pearson r: 0.4782, Pearson p: 1.6729e-35
  Pred range: [0.0449, 0.3282], std: 0.0492
  RMSE : 0.0882, R2: 0.2309, MAE: 0.0696, Spearman rho: 0.4765, Spearman p: 3.2310e-35, Pearson r: 0.4808, Pearson p: 6.3761e-36
  Pred range: [0.0627, 0.3764], std: 0.0551
  RMSE : 0.0932, R2: 0.1424, MAE: 0.0752, Spearman rho: 0.4725, Spearman p: 1.3954e-34, Pearson r: 0.4781, Pearson p: 1.7508e-35
  Pred range: [0.0499, 0.3233], std: 0.0487
  RMSE : 0.0886, R2: 0.2242, MAE: 0.0703, Spearman rho: 0.4708, Spearman p: 2.5814e-34, Pearson r: 0.4760, Pearson p: 3.7973e-35
  Pred range: [0.0673, 0.3722], std: 0.0533
  RMSE : 0.0934, R2: 0.1374, MAE: 0.0756, Spearman rho: 0.4751, Spearman p: 5.3810e-35, Pearson r: 0.4800, Pearson p: 8.5940e-36
  Pred range: [0.0684, 0.3879], std: 0.0536
  RMSE : 0.0949, R2: 0.1092, MAE: 0.0769, Spearman rho: 0.4644, Spearman p: 2.5204e-33, Pearson r: 0.4702, Pearson p: 3.1814e-34
[I 2026-04-27 16:59:23,873] Trial 32 finished with value: 0.08821984725544084 and parameters: {'learning_rate': 0.0006788572252930187, 'batch_size': 4, 'num_epochs': 18, 'weight_decay': 0.004563033653801763, 'layers_PRS': 3, 'layers_SCZ15': 4, 'layers_ADHD9': 1, 'layers_ASD9': 3, 'layers_ACE15': 1, 'layers_ACE18': 4, 'layers_SUD18': 6, 'layers_SES': 5, 'layers_SEX': 1, 'dropout': 0.4772844730554973, 'se_reduction': 3, 'hidden_dim_min': 6, 'base_loss': 'huber', 'huber_delta': 0.03914194123508935, 'focal_gamma': 2.138556434530469, 'n_bins': 8, 'scheduler_patience': 2, 'scheduler_factor': 0.6100987240472954, 'early_stopping_patience': 4}. Best is trial 9 with value: 0.08803266597627345.
Train: 2407 rows (1613 IDs),Test: 598 rows (404 IDs) 

n_features_x : 6, n_features_per_modality: [16, 23, 19, 17, 7, 4, 4, 4, 1, 4]

--- ImbalancedRegressionLoss initialized ---
  Bins: 8, Focal gamma: 1.1232010109287145, Base loss: huber
  Bin [0.00, 0.12): count= 1180, weight=0.003
  Bin [0.12, 0.25): count=  933, weight=0.003
  Bin [0.25, 0.38): count=  253, weight=0.012
  Bin [0.38, 0.50): count=   30, weight=0.098
  Bin [0.50, 0.62): count=   10, weight=0.277
  Bin [0.62, 0.75): count=    1, weight=1.521
  Bin [0.75, 0.88): count=    0, weight=3.043
  Bin [0.88, 1.00): count=    0, weight=3.043
-------------------------------------------

  Pred range: [0.0540, 0.4351], std: 0.0567
  RMSE : 0.0969, R2: 0.0720, MAE: 0.0783, Spearman rho: 0.4424, Spearman p: 4.7394e-30, Pearson r: 0.4455, Pearson p: 1.6779e-30
  Pred range: [0.0362, 0.3827], std: 0.0574
  RMSE : 0.0893, R2: 0.2122, MAE: 0.0708, Spearman rho: 0.4748, Spearman p: 6.0491e-35, Pearson r: 0.4781, Pearson p: 1.7897e-35
  Pred range: [0.0444, 0.3591], std: 0.0550
  RMSE : 0.0891, R2: 0.2161, MAE: 0.0710, Spearman rho: 0.4747, Spearman p: 6.0703e-35, Pearson r: 0.4807, Pearson p: 6.5572e-36
  Pred range: [0.0517, 0.3929], std: 0.0600
  RMSE : 0.0936, R2: 0.1342, MAE: 0.0753, Spearman rho: 0.4698, Spearman p: 3.6291e-34, Pearson r: 0.4772, Pearson p: 2.4927e-35
  Pred range: [0.0386, 0.3813], std: 0.0574
  RMSE : 0.0893, R2: 0.2117, MAE: 0.0709, Spearman rho: 0.4683, Spearman p: 6.3420e-34, Pearson r: 0.4768, Pearson p: 2.8412e-35
  Pred range: [0.0541, 0.3845], std: 0.0582
  RMSE : 0.0929, R2: 0.1464, MAE: 0.0747, Spearman rho: 0.4668, Spearman p: 1.0946e-33, Pearson r: 0.4754, Pearson p: 4.6906e-35
  Pred range: [0.0634, 0.4307], std: 0.0596
  RMSE : 0.0972, R2: 0.0668, MAE: 0.0786, Spearman rho: 0.4580, Spearman p: 2.4427e-32, Pearson r: 0.4653, Pearson p: 1.8400e-33
[I 2026-04-27 17:00:08,562] Trial 33 finished with value: 0.0890656393317687 and parameters: {'learning_rate': 0.0006830479417275656, 'batch_size': 6, 'num_epochs': 10, 'weight_decay': 0.0053846888637927165, 'layers_PRS': 2, 'layers_SCZ15': 4, 'layers_ADHD9': 1, 'layers_ASD9': 4, 'layers_ACE15': 1, 'layers_ACE18': 3, 'layers_SUD18': 4, 'layers_SES': 4, 'layers_SEX': 7, 'dropout': 0.4348362166479497, 'se_reduction': 3, 'hidden_dim_min': 8, 'base_loss': 'huber', 'huber_delta': 0.03916848889307786, 'focal_gamma': 1.1232010109287145, 'n_bins': 8, 'scheduler_patience': 2, 'scheduler_factor': 0.6160156495925215, 'early_stopping_patience': 4}. Best is trial 9 with value: 0.08803266597627345.
Train: 2407 rows (1613 IDs),Test: 598 rows (404 IDs) 

n_features_x : 6, n_features_per_modality: [16, 23, 19, 17, 7, 4, 4, 4, 1, 4]

--- ImbalancedRegressionLoss initialized ---
  Bins: 9, Focal gamma: 2.254636359521056, Base loss: huber
  Bin [0.00, 0.11): count= 1180, weight=0.003
  Bin [0.11, 0.22): count=  835, weight=0.004
  Bin [0.22, 0.33): count=  312, weight=0.010
  Bin [0.33, 0.44): count=   59, weight=0.054
  Bin [0.44, 0.56): count=   16, weight=0.190
  Bin [0.56, 0.67): count=    4, weight=0.647
  Bin [0.67, 0.78): count=    1, weight=1.618
  Bin [0.78, 0.89): count=    0, weight=3.237
  Bin [0.89, 1.00): count=    0, weight=3.237
-------------------------------------------

  Pred range: [0.0506, 0.3802], std: 0.0550
  RMSE : 0.0911, R2: 0.1804, MAE: 0.0727, Spearman rho: 0.4513, Spearman p: 2.4177e-31, Pearson r: 0.4554, Pearson p: 6.0260e-32
  Pred range: [0.0354, 0.3435], std: 0.0513
  RMSE : 0.0890, R2: 0.2175, MAE: 0.0695, Spearman rho: 0.4728, Spearman p: 1.2538e-34, Pearson r: 0.4808, Pearson p: 6.3875e-36
  Pred range: [0.0683, 0.3558], std: 0.0474
  RMSE : 0.0917, R2: 0.1683, MAE: 0.0743, Spearman rho: 0.4569, Spearman p: 3.5569e-32, Pearson r: 0.4695, Pearson p: 4.0788e-34
  Pred range: [0.0385, 0.3601], std: 0.0570
  RMSE : 0.0886, R2: 0.2243, MAE: 0.0703, Spearman rho: 0.4711, Spearman p: 2.3213e-34, Pearson r: 0.4836, Pearson p: 2.2447e-36
  Pred range: [0.0150, 0.3305], std: 0.0542
  RMSE : 0.0889, R2: 0.2188, MAE: 0.0704, Spearman rho: 0.4616, Spearman p: 6.7943e-33, Pearson r: 0.4728, Pearson p: 1.2479e-34
  Pred range: [0.0176, 0.3321], std: 0.0523
  RMSE : 0.0890, R2: 0.2175, MAE: 0.0704, Spearman rho: 0.4598, Spearman p: 1.3004e-32, Pearson r: 0.4716, Pearson p: 1.9222e-34
  Pred range: [0.0417, 0.3593], std: 0.0526
  RMSE : 0.0902, R2: 0.1961, MAE: 0.0721, Spearman rho: 0.4572, Spearman p: 3.1340e-32, Pearson r: 0.4640, Pearson p: 2.9610e-33
