[I 2026-04-29 01:06:56,248] Trial 49 finished with value: 0.08862901567688321 and parameters: {'learning_rate': 0.0010854576045455583, 'batch_size': 4, 'num_epochs': 11, 'weight_decay': 2.5188581375367888e-05, 'layers_PRS': 1, 'layers_SCZ15': 5, 'layers_ADHD9': 5, 'layers_ASD9': 5, 'layers_ACE15': 1, 'layers_ACE18': 2, 'layers_SUD18': 1, 'layers_SES': 3, 'layers_SEX': 1, 'dropout': 0.2362749936397685, 'se_reduction': 7, 'hidden_dim_min': 13, 'base_loss': 'huber', 'huber_delta': 0.058575938644202845, 'focal_gamma': 2.582005822447618, 'n_bins': 9, 'scheduler_patience': 2, 'scheduler_factor': 0.40217845186790413, 'early_stopping_patience': 7}. Best is trial 47 with value: 0.08810896773294083.

Completed in 63.9 minutes
Trials: 39 complete, 11 pruned

============================================================
  Best Pos trial
============================================================
  RMSE: 0.0881

  Copy these into hyperparameters.json:
  ----------------------------------------
  learning_rate = 0.0005290143613782196
  batch_size = 4
  num_epochs = 12
  weight_decay = 2.9403379028811774e-05
  layers_PRS = 1
  layers_SCZ15 = 4
  layers_ADHD9 = 5
  layers_ASD9 = 5
  layers_ACE15 = 1
  layers_ACE18 = 1
  layers_SUD18 = 2
  layers_SES = 4
  layers_SEX = 1
  dropout = 0.24404259470937037
  se_reduction = 2
  hidden_dim_min = 13
  base_loss = 'huber'
  huber_delta = 0.03342532350375165
  focal_gamma = 2.6381167276961652
  n_bins = 10
  scheduler_patience = 2
  scheduler_factor = 0.3731385035657518
  early_stopping_patience = 7
  ----------------------------------------

Best hyperparameters saved to 'Pos_best_params.txt'
All trial results saved to 'Pos_optuna_results.csv'
Visualizations saved as Pos_*.html

============================================================
  Tuning Neg symptom model (50 trials)
============================================================
  0%|          | 0/50 [00:00<?, ?it/s]                                        0%|          | 0/50 [00:17<?, ?it/s]Best trial: 0. Best value: 0.176962:   0%|          | 0/50 [00:17<?, ?it/s]Best trial: 0. Best value: 0.176962:   2%|▏         | 1/50 [00:17<14:14, 17.43s/it]                                                                                   Best trial: 0. Best value: 0.176962:   2%|▏         | 1/50 [00:33<14:14, 17.43s/it]Best trial: 1. Best value: 0.170757:   2%|▏         | 1/50 [00:33<14:14, 17.43s/it]Best trial: 1. Best value: 0.170757:   4%|▍         | 2/50 [00:33<13:31, 16.90s/it]                                                                                   Best trial: 1. Best value: 0.170757:   4%|▍         | 2/50 [02:02<13:31, 16.90s/it]Best trial: 2. Best value: 0.158214:   4%|▍         | 2/50 [02:02<13:31, 16.90s/it]Best trial: 2. Best value: 0.158214:   6%|▌         | 3/50 [02:02<38:46, 49.50s/it]                                                                                   Best trial: 2. Best value: 0.158214:   6%|▌         | 3/50 [03:11<38:46, 49.50s/it]Best trial: 2. Best value: 0.158214:   6%|▌         | 3/50 [03:11<38:46, 49.50s/it]Best trial: 2. Best value: 0.158214:   8%|▊         | 4/50 [03:11<44:02, 57.45s/it]                                                                                   Best trial: 2. Best value: 0.158214:   8%|▊         | 4/50 [03:31<44:02, 57.45s/it]Best trial: 2. Best value: 0.158214:   8%|▊         | 4/50 [03:31<44:02, 57.45s/it]Best trial: 2. Best value: 0.158214:  10%|█         | 5/50 [03:31<32:59, 43.98s/it]                                                                                   Best trial: 2. Best value: 0.158214:  10%|█         | 5/50 [04:33<32:59, 43.98s/it]Best trial: 5. Best value: 0.152619:  10%|█         | 5/50 [04:33<32:59, 43.98s/it]Best trial: 5. Best value: 0.152619:  12%|█▏        | 6/50 [04:33<36:33, 49.85s/it]                                                                                   Best trial: 5. Best value: 0.152619:  12%|█▏        | 6/50 [04:43<36:33, 49.85s/it]Best trial: 5. Best value: 0.152619:  12%|█▏        | 6/50 [04:43<36:33, 49.85s/it]Best trial: 5. Best value: 0.152619:  14%|█▍        | 7/50 [04:43<26:23, 36.82s/it]                                                                                   Best trial: 5. Best value: 0.152619:  14%|█▍        | 7/50 [05:24<26:23, 36.82s/it]Best trial: 5. Best value: 0.152619:  14%|█▍        | 7/50 [05:24<26:23, 36.82s/it]Best trial: 5. Best value: 0.152619:  16%|█▌        | 8/50 [05:24<26:50, 38.35s/it]                                                                                   Best trial: 5. Best value: 0.152619:  16%|█▌        | 8/50 [06:02<26:50, 38.35s/it]Best trial: 5. Best value: 0.152619:  16%|█▌        | 8/50 [06:02<26:50, 38.35s/it]Best trial: 5. Best value: 0.152619:  18%|█▊        | 9/50 [06:02<26:08, 38.26s/it]                                                                                   Best trial: 5. Best value: 0.152619:  18%|█▊        | 9/50 [07:00<26:08, 38.26s/it]Best trial: 5. Best value: 0.152619:  18%|█▊        | 9/50 [07:00<26:08, 38.26s/it]Best trial: 5. Best value: 0.152619:  20%|██        | 10/50 [07:00<29:26, 44.17s/it]                                                                                    Best trial: 5. Best value: 0.152619:  20%|██        | 10/50 [07:52<29:26, 44.17s/it]Best trial: 10. Best value: 0.151053:  20%|██        | 10/50 [07:52<29:26, 44.17s/it]Best trial: 10. Best value: 0.151053:  22%|██▏       | 11/50 [07:52<30:15, 46.54s/it]                                                                                     Best trial: 10. Best value: 0.151053:  22%|██▏       | 11/50 [08:51<30:15, 46.54s/it]Best trial: 10. Best value: 0.151053:  22%|██▏       | 11/50 [08:51<30:15, 46.54s/it]Best trial: 10. Best value: 0.151053:  24%|██▍       | 12/50 [08:51<31:58, 50.48s/it]                                                                                     Best trial: 10. Best value: 0.151053:  24%|██▍       | 12/50 [10:16<31:58, 50.48s/it]Best trial: 10. Best value: 0.151053:  24%|██▍       | 12/50 [10:16<31:58, 50.48s/it]Best trial: 10. Best value: 0.151053:  26%|██▌       | 13/50 [10:16<37:35, 60.96s/it]                                                                                     Best trial: 10. Best value: 0.151053:  26%|██▌       | 13/50 [11:56<37:35, 60.96s/it]Best trial: 10. Best value: 0.151053:  26%|██▌       | 13/50 [11:56<37:35, 60.96s/it]Best trial: 10. Best value: 0.151053:  28%|██▊       | 14/50 [11:56<43:36, 72.67s/it]                                                                                     Best trial: 10. Best value: 0.151053:  28%|██▊       | 14/50 [12:34<43:36, 72.67s/it]Best trial: 10. Best value: 0.151053:  28%|██▊       | 14/50 [12:34<43:36, 72.67s/it]Best trial: 10. Best value: 0.151053:  30%|███       | 15/50 [12:34<36:14, 62.12s/it]                                                                                     Best trial: 10. Best value: 0.151053:  30%|███       | 15/50 [13:34<36:14, 62.12s/it]Best trial: 10. Best value: 0.151053:  30%|███       | 15/50 [13:34<36:14, 62.12s/it]Best trial: 10. Best value: 0.151053:  32%|███▏      | 16/50 [13:34<34:54, 61.61s/it]                                                                                     Best trial: 10. Best value: 0.151053:  32%|███▏      | 16/50 [14:23<34:54, 61.61s/it]Best trial: 10. Best value: 0.151053:  32%|███▏      | 16/50 [14:23<34:54, 61.61s/it]Best trial: 10. Best value: 0.151053:  34%|███▍      | 17/50 [14:23<31:46, 57.78s/it]                                                                                     Best trial: 10. Best value: 0.151053:  34%|███▍      | 17/50 [15:12<31:46, 57.78s/it]Best trial: 10. Best value: 0.151053:  34%|███▍      | 17/50 [15:12<31:46, 57.78s/it]Best trial: 10. Best value: 0.151053:  36%|███▌      | 18/50 [15:12<29:24, 55.13s/it]                                                                                     Best trial: 10. Best value: 0.151053:  36%|███▌      | 18/50 [15:24<29:24, 55.13s/it]Best trial: 10. Best value: 0.151053:  36%|███▌      | 18/50 [15:24<29:24, 55.13s/it]Best trial: 10. Best value: 0.151053:  38%|███▊      | 19/50 [15:24<21:45, 42.11s/it]                                                                                     Best trial: 10. Best value: 0.151053:  38%|███▊      | 19/50 [16:05<21:45, 42.11s/it]Best trial: 10. Best value: 0.151053:  38%|███▊      | 19/50 [16:05<21:45, 42.11s/it]Best trial: 10. Best value: 0.151053:  40%|████      | 20/50 [16:05<20:55, 41.85s/it]                                                                                     Best trial: 10. Best value: 0.151053:  40%|████      | 20/50 [16:12<20:55, 41.85s/it]Best trial: 10. Best value: 0.151053:  40%|████      | 20/50 [16:12<20:55, 41.85s/it]Best trial: 10. Best value: 0.151053:  42%|████▏     | 21/50 [16:12<15:14, 31.55s/it]                                                                                     Best trial: 10. Best value: 0.151053:  42%|████▏     | 21/50 [16:26<15:14, 31.55s/it]Best trial: 10. Best value: 0.151053:  42%|████▏     | 21/50 [16:26<15:14, 31.55s/it]Best trial: 10. Best value: 0.151053:  44%|████▍     | 22/50 [16:26<12:08, 26.01s/it]                                                                                     Best trial: 10. Best value: 0.151053:  44%|████▍     | 22/50 [16:34<12:08, 26.01s/it]Best trial: 10. Best value: 0.151053:  44%|████▍     | 22/50 [16:34<12:08, 26.01s/it]Best trial: 10. Best value: 0.151053:  46%|████▌     | 23/50 [16:34<09:18, 20.67s/it]                                                                                     Best trial: 10. Best value: 0.151053:  46%|████▌     | 23/50 [16:54<09:18, 20.67s/it]Best trial: 10. Best value: 0.151053:  46%|████▌     | 23/50 [16:54<09:18, 20.67s/it]Best trial: 10. Best value: 0.151053:  48%|████▊     | 24/50 [16:54<08:52, 20.48s/it]                                                                                     Best trial: 10. Best value: 0.151053:  48%|████▊     | 24/50 [17:25<08:52, 20.48s/it]Best trial: 10. Best value: 0.151053:  48%|████▊     | 24/50 [17:25<08:52, 20.48s/it]Best trial: 10. Best value: 0.151053:  50%|█████     | 25/50 [17:25<09:50, 23.64s/it]                                                                                     Best trial: 10. Best value: 0.151053:  50%|█████     | 25/50 [17:39<09:50, 23.64s/it]Best trial: 10. Best value: 0.151053:  50%|█████     | 25/50 [17:39<09:50, 23.64s/it]Best trial: 10. Best value: 0.151053:  52%|█████▏    | 26/50 [17:39<08:22, 20.92s/it]                                                                                     Best trial: 10. Best value: 0.151053:  52%|█████▏    | 26/50 [18:37<08:22, 20.92s/it]Best trial: 26. Best value: 0.15061:  52%|█████▏    | 26/50 [18:37<08:22, 20.92s/it] Best trial: 26. Best value: 0.15061:  54%|█████▍    | 27/50 [18:37<12:17, 32.05s/it]                                                                                    Best trial: 26. Best value: 0.15061:  54%|█████▍    | 27/50 [19:42<12:17, 32.05s/it]Best trial: 27. Best value: 0.149992:  54%|█████▍    | 27/50 [19:42<12:17, 32.05s/it]Best trial: 27. Best value: 0.149992:  56%|█████▌    | 28/50 [19:42<15:18, 41.74s/it]                                                                                     Best trial: 27. Best value: 0.149992:  56%|█████▌    | 28/50 [20:48<15:18, 41.74s/it]Best trial: 28. Best value: 0.149813:  56%|█████▌    | 28/50 [20:48<15:18, 41.74s/it]Best trial: 28. Best value: 0.149813:  58%|█████▊    | 29/50 [20:48<17:07, 48.95s/it]                                                                                     Best trial: 28. Best value: 0.149813:  58%|█████▊    | 29/50 [22:35<17:07, 48.95s/it]Best trial: 29. Best value: 0.148758:  58%|█████▊    | 29/50 [22:35<17:07, 48.95s/it]Best trial: 29. Best value: 0.148758:  60%|██████    | 30/50 [22:35<22:08, 66.41s/it]                                                                                     Best trial: 29. Best value: 0.148758:  60%|██████    | 30/50 [24:48<22:08, 66.41s/it]Best trial: 29. Best value: 0.148758:  60%|██████    | 30/50 [24:48<22:08, 66.41s/it]Best trial: 29. Best value: 0.148758:  62%|██████▏   | 31/50 [24:48<27:25, 86.62s/it]                                                                                     Best trial: 29. Best value: 0.148758:  62%|██████▏   | 31/50 [26:46<27:25, 86.62s/it]Best trial: 29. Best value: 0.148758:  62%|██████▏   | 31/50 [26:46<27:25, 86.62s/it]Best trial: 29. Best value: 0.148758:  64%|██████▍   | 32/50 [26:46<28:43, 95.75s/it]                                                                                     Best trial: 29. Best value: 0.148758:  64%|██████▍   | 32/50 [28:41<28:43, 95.75s/it]Best trial: 29. Best value: 0.148758:  64%|██████▍   | 32/50 [28:41<28:43, 95.75s/it]Best trial: 29. Best value: 0.148758:  66%|██████▌   | 33/50 [28:41<28:45, 101.52s/it]                                                                                      Best trial: 29. Best value: 0.148758:  66%|██████▌   | 33/50 [30:23<28:45, 101.52s/it]Best trial: 29. Best value: 0.148758:  66%|██████▌   | 33/50 [30:23<28:45, 101.52s/it]Best trial: 29. Best value: 0.148758:  68%|██████▊   | 34/50 [30:23<27:10, 101.90s/it]                                                                                      Best trial: 29. Best value: 0.148758:  68%|██████▊   | 34/50 [30:31<27:10, 101.90s/it]Best trial: 29. Best value: 0.148758:  68%|██████▊   | 34/50 [30:31<27:10, 101.90s/it]Best trial: 29. Best value: 0.148758:  70%|███████   | 35/50 [30:31<18:23, 73.54s/it]                                                                                      Best trial: 29. Best value: 0.148758:  70%|███████   | 35/50 [32:46<18:23, 73.54s/it]Best trial: 35. Best value: 0.148282:  70%|███████   | 35/50 [32:46<18:23, 73.54s/it]Best trial: 35. Best value: 0.148282:  72%|███████▏  | 36/50 [32:46<21:28, 92.03s/it]                                                                                     Best trial: 35. Best value: 0.148282:  72%|███████▏  | 36/50 [33:14<21:28, 92.03s/it]Best trial: 35. Best value: 0.148282:  72%|███████▏  | 36/50 [33:14<21:28, 92.03s/it]Best trial: 35. Best value: 0.148282:  74%|███████▍  | 37/50 [33:14<15:46, 72.79s/it]                                                                                     Best trial: 35. Best value: 0.148282:  74%|███████▍  | 37/50 [34:59<15:46, 72.79s/it]Best trial: 35. Best value: 0.148282:  74%|███████▍  | 37/50 [34:59<15:46, 72.79s/it]Best trial: 35. Best value: 0.148282:  76%|███████▌  | 38/50 [34:59<16:29, 82.43s/it]                                                                                     Best trial: 35. Best value: 0.148282:  76%|███████▌  | 38/50 [36:51<16:29, 82.43s/it]Best trial: 35. Best value: 0.148282:  76%|███████▌  | 38/50 [36:51<16:29, 82.43s/it]Best trial: 35. Best value: 0.148282:  78%|███████▊  | 39/50 [36:51<16:43, 91.25s/it]                                                                                     Best trial: 35. Best value: 0.148282:  78%|███████▊  | 39/50 [36:59<16:43, 91.25s/it]Best trial: 35. Best value: 0.148282:  78%|███████▊  | 39/50 [36:59<16:43, 91.25s/it]Best trial: 35. Best value: 0.148282:  80%|████████  | 40/50 [36:59<11:03, 66.33s/it]                                                                                     Best trial: 35. Best value: 0.148282:  80%|████████  | 40/50 [37:40<11:03, 66.33s/it]Best trial: 35. Best value: 0.148282:  80%|████████  | 40/50 [37:40<11:03, 66.33s/it]Best trial: 35. Best value: 0.148282:  82%|████████▏ | 41/50 [37:40<08:49, 58.79s/it]                                                                                     Best trial: 35. Best value: 0.148282:  82%|████████▏ | 41/50 [39:15<08:49, 58.79s/it]Best trial: 35. Best value: 0.148282:  82%|████████▏ | 41/50 [39:15<08:49, 58.79s/it]Best trial: 35. Best value: 0.148282:  84%|████████▍ | 42/50 [39:15<09:16, 69.55s/it]                                                                                     Best trial: 35. Best value: 0.148282:  84%|████████▍ | 42/50 [40:02<09:16, 69.55s/it]Best trial: 35. Best value: 0.148282:  84%|████████▍ | 42/50 [40:02<09:16, 69.55s/it]Best trial: 35. Best value: 0.148282:  86%|████████▌ | 43/50 [40:02<07:21, 63.02s/it]                                                                                     Best trial: 35. Best value: 0.148282:  86%|████████▌ | 43/50 [41:41<07:21, 63.02s/it]Best trial: 35. Best value: 0.148282:  86%|████████▌ | 43/50 [41:41<07:21, 63.02s/it]Best trial: 35. Best value: 0.148282:  88%|████████▊ | 44/50 [41:41<07:21, 73.59s/it]                                                                                     Best trial: 35. Best value: 0.148282:  88%|████████▊ | 44/50 [43:25<07:21, 73.59s/it]Best trial: 35. Best value: 0.148282:  88%|████████▊ | 44/50 [43:25<07:21, 73.59s/it]Best trial: 35. Best value: 0.148282:  90%|█████████ | 45/50 [43:25<06:54, 82.83s/it]                                                                                     Best trial: 35. Best value: 0.148282:  90%|█████████ | 45/50 [44:56<06:54, 82.83s/it]Best trial: 35. Best value: 0.148282:  90%|█████████ | 45/50 [44:56<06:54, 82.83s/it]Best trial: 35. Best value: 0.148282:  92%|█████████▏| 46/50 [44:56<05:40, 85.23s/it]                                                                                     Best trial: 35. Best value: 0.148282:  92%|█████████▏| 46/50 [45:43<05:40, 85.23s/it]Best trial: 35. Best value: 0.148282:  92%|█████████▏| 46/50 [45:43<05:40, 85.23s/it]Best trial: 35. Best value: 0.148282:  94%|█████████▍| 47/50 [45:43<03:41, 73.69s/it]                                                                                     Best trial: 35. Best value: 0.148282:  94%|█████████▍| 47/50 [47:33<03:41, 73.69s/it]Best trial: 35. Best value: 0.148282:  94%|█████████▍| 47/50 [47:33<03:41, 73.69s/it]Best trial: 35. Best value: 0.148282:  96%|█████████▌| 48/50 [47:33<02:49, 84.80s/it]                                                                                     Best trial: 35. Best value: 0.148282:  96%|█████████▌| 48/50 [49:31<02:49, 84.80s/it]Best trial: 35. Best value: 0.148282:  96%|█████████▌| 48/50 [49:31<02:49, 84.80s/it]Best trial: 35. Best value: 0.148282:  98%|█████████▊| 49/50 [49:31<01:34, 94.79s/it]                                                                                     Best trial: 35. Best value: 0.148282:  98%|█████████▊| 49/50 [50:41<01:34, 94.79s/it]Best trial: 35. Best value: 0.148282:  98%|█████████▊| 49/50 [50:41<01:34, 94.79s/it]Best trial: 35. Best value: 0.148282: 100%|██████████| 50/50 [50:41<00:00, 87.08s/it]Best trial: 35. Best value: 0.148282: 100%|██████████| 50/50 [50:41<00:00, 60.82s/it]
Train: 2407 rows (1613 IDs),Test: 598 rows (404 IDs) 

n_features_x : 6, n_features_per_modality: [16, 23, 19, 17, 7, 4, 4, 4, 1, 4]

--- ImbalancedRegressionLoss initialized ---
  Bins: 7, Focal gamma: 2.1743422183077334, Base loss: mse
  Bin [0.00, 0.14): count=  760, weight=0.038
  Bin [0.14, 0.29): count=  826, weight=0.035
  Bin [0.29, 0.43): count=  454, weight=0.063
  Bin [0.43, 0.57): count=  215, weight=0.133
  Bin [0.57, 0.71): count=  110, weight=0.258
  Bin [0.71, 0.86): count=   38, weight=0.736
  Bin [0.86, 1.00): count=    4, weight=5.738
-------------------------------------------

  Pred range: [-0.0919, 0.2273], std: 0.0403
  RMSE : 0.2648, R2: -1.3411, MAE: 0.2059, Spearman rho: 0.2096, Spearman p: 2.3108e-07, Pearson r: 0.1873, Pearson p: 3.9852e-06
  Pred range: [-0.0144, 0.4934], std: 0.0589
  RMSE : 0.1770, R2: -0.0453, MAE: 0.1273, Spearman rho: 0.2923, Spearman p: 3.0578e-13, Pearson r: 0.2783, Pearson p: 4.2653e-12
  Pred range: [0.0470, 0.7370], std: 0.0839
  RMSE : 0.1844, R2: -0.1349, MAE: 0.1535, Spearman rho: 0.3036, Spearman p: 3.2034e-14, Pearson r: 0.2964, Pearson p: 1.3554e-13
  Pred range: [0.0637, 0.7792], std: 0.0893
  RMSE : 0.1993, R2: -0.3252, MAE: 0.1693, Spearman rho: 0.3153, Spearman p: 2.8767e-15, Pearson r: 0.3094, Pearson p: 9.9030e-15
  Pred range: [0.0690, 0.7614], std: 0.0885
  RMSE : 0.1989, R2: -0.3201, MAE: 0.1694, Spearman rho: 0.3281, Spearman p: 1.7833e-16, Pearson r: 0.3229, Pearson p: 5.5828e-16
  Pred range: [0.0735, 0.7495], std: 0.0879
  RMSE : 0.1981, R2: -0.3093, MAE: 0.1689, Spearman rho: 0.3406, Spearman p: 1.0326e-17, Pearson r: 0.3354, Pearson p: 3.4649e-17
  Pred range: [0.0770, 0.7480], std: 0.0883
  RMSE : 0.1994, R2: -0.3266, MAE: 0.1703, Spearman rho: 0.3463, Spearman p: 2.7021e-18, Pearson r: 0.3409, Pearson p: 9.7713e-18
  Pred range: [0.0795, 0.7440], std: 0.0883
  RMSE : 0.1999, R2: -0.3334, MAE: 0.1710, Spearman rho: 0.3512, Spearman p: 8.5350e-19, Pearson r: 0.3459, Pearson p: 2.9816e-18
