[I 2026-04-27 23:50:16,501] Trial 24 pruned. 
Train: 2407 rows (1613 IDs),Test: 598 rows (404 IDs) 

n_features_x : 6, n_features_per_modality: [16, 23, 19, 17, 7, 4, 4, 4, 1, 4]

--- ImbalancedRegressionLoss initialized ---
  Bins: 8, Focal gamma: 1.5531364744775944, Base loss: huber
  Bin [0.00, 0.12): count= 1180, weight=0.003
  Bin [0.12, 0.25): count=  933, weight=0.003
  Bin [0.25, 0.38): count=  253, weight=0.012
  Bin [0.38, 0.50): count=   30, weight=0.098
  Bin [0.50, 0.62): count=   10, weight=0.277
  Bin [0.62, 0.75): count=    1, weight=1.521
  Bin [0.75, 0.88): count=    0, weight=3.043
  Bin [0.88, 1.00): count=    0, weight=3.043
-------------------------------------------

  Pred range: [0.0423, 0.3679], std: 0.0567
  RMSE : 0.1003, R2: 0.0050, MAE: 0.0822, Spearman rho: 0.4336, Spearman p: 8.3761e-29, Pearson r: 0.4468, Pearson p: 1.1052e-30
  Pred range: [0.0579, 0.3735], std: 0.0554
  RMSE : 0.0934, R2: 0.1385, MAE: 0.0751, Spearman rho: 0.4537, Spearman p: 1.0620e-31, Pearson r: 0.4609, Pearson p: 8.6385e-33
  Pred range: [0.0703, 0.3694], std: 0.0487
  RMSE : 0.0967, R2: 0.0763, MAE: 0.0787, Spearman rho: 0.4423, Spearman p: 4.9930e-30, Pearson r: 0.4502, Pearson p: 3.4718e-31
  Pred range: [0.0633, 0.3615], std: 0.0527
  RMSE : 0.0911, R2: 0.1792, MAE: 0.0730, Spearman rho: 0.4489, Spearman p: 5.3744e-31, Pearson r: 0.4540, Pearson p: 9.6767e-32
  Pred range: [0.0835, 0.4134], std: 0.0564
  RMSE : 0.1068, R2: -0.1279, MAE: 0.0880, Spearman rho: 0.4368, Spearman p: 2.9298e-29, Pearson r: 0.4454, Pearson p: 1.7584e-30
  Pred range: [0.0579, 0.2734], std: 0.0433
  RMSE : 0.0897, R2: 0.2046, MAE: 0.0714, Spearman rho: 0.4500, Spearman p: 3.7675e-31, Pearson r: 0.4546, Pearson p: 7.9223e-32
  Pred range: [0.0591, 0.3169], std: 0.0466
  RMSE : 0.0889, R2: 0.2183, MAE: 0.0709, Spearman rho: 0.4788, Spearman p: 1.3311e-35, Pearson r: 0.4831, Pearson p: 2.7294e-36
  Pred range: [0.0148, 0.2724], std: 0.0469
  RMSE : 0.0932, R2: 0.1423, MAE: 0.0721, Spearman rho: 0.4828, Spearman p: 3.0050e-36, Pearson r: 0.4887, Pearson p: 3.2320e-37
  Pred range: [0.0714, 0.3342], std: 0.0464
  RMSE : 0.0921, R2: 0.1623, MAE: 0.0747, Spearman rho: 0.4582, Spearman p: 2.2165e-32, Pearson r: 0.4675, Pearson p: 8.4881e-34
  Pred range: [0.0576, 0.4832], std: 0.0622
  RMSE : 0.0971, R2: 0.0688, MAE: 0.0777, Spearman rho: 0.4455, Spearman p: 1.7142e-30, Pearson r: 0.4495, Pearson p: 4.4567e-31
  Pred range: [0.0403, 0.3204], std: 0.0476
  RMSE : 0.0888, R2: 0.2200, MAE: 0.0699, Spearman rho: 0.4699, Spearman p: 3.6113e-34, Pearson r: 0.4748, Pearson p: 5.8685e-35
  Pred range: [0.0543, 0.3352], std: 0.0518
  RMSE : 0.0887, R2: 0.2220, MAE: 0.0705, Spearman rho: 0.4749, Spearman p: 5.6924e-35, Pearson r: 0.4858, Pearson p: 9.6676e-37
  Pred range: [0.0549, 0.3960], std: 0.0583
  RMSE : 0.0931, R2: 0.1435, MAE: 0.0746, Spearman rho: 0.4630, Spearman p: 4.1941e-33, Pearson r: 0.4701, Pearson p: 3.2523e-34
  Pred range: [0.0456, 0.3002], std: 0.0465
  RMSE : 0.0881, R2: 0.2335, MAE: 0.0693, Spearman rho: 0.4781, Spearman p: 1.7384e-35, Pearson r: 0.4837, Pearson p: 2.1654e-36
  Pred range: [0.0616, 0.3556], std: 0.0511
  RMSE : 0.0914, R2: 0.1744, MAE: 0.0735, Spearman rho: 0.4636, Spearman p: 3.3464e-33, Pearson r: 0.4701, Pearson p: 3.3545e-34
  Pred range: [0.0402, 0.3356], std: 0.0527
  RMSE : 0.0882, R2: 0.2307, MAE: 0.0694, Spearman rho: 0.4795, Spearman p: 1.0293e-35, Pearson r: 0.4837, Pearson p: 2.1338e-36
  Pred range: [0.0540, 0.3196], std: 0.0498
  RMSE : 0.0886, R2: 0.2234, MAE: 0.0704, Spearman rho: 0.4775, Spearman p: 2.1848e-35, Pearson r: 0.4835, Pearson p: 2.3409e-36
  Pred range: [0.0363, 0.3115], std: 0.0486
  RMSE : 0.0885, R2: 0.2261, MAE: 0.0693, Spearman rho: 0.4804, Spearman p: 7.4143e-36, Pearson r: 0.4845, Pearson p: 1.6032e-36
  Pred range: [0.0647, 0.3416], std: 0.0493
  RMSE : 0.0908, R2: 0.1853, MAE: 0.0729, Spearman rho: 0.4727, Spearman p: 1.2835e-34, Pearson r: 0.4782, Pearson p: 1.7003e-35
  Pred range: [0.0400, 0.3110], std: 0.0471
  RMSE : 0.0884, R2: 0.2271, MAE: 0.0693, Spearman rho: 0.4764, Spearman p: 3.3112e-35, Pearson r: 0.4823, Pearson p: 3.6408e-36
  Pred range: [0.0740, 0.3988], std: 0.0553
  RMSE : 0.0976, R2: 0.0585, MAE: 0.0796, Spearman rho: 0.4652, Spearman p: 1.8850e-33, Pearson r: 0.4717, Pearson p: 1.8752e-34
  Pred range: [0.0577, 0.3502], std: 0.0514
  RMSE : 0.0904, R2: 0.1918, MAE: 0.0725, Spearman rho: 0.4713, Spearman p: 2.1296e-34, Pearson r: 0.4789, Pearson p: 1.2986e-35
[I 2026-04-27 23:53:10,177] Trial 25 finished with value: 0.08807134063291132 and parameters: {'learning_rate': 0.0014895605580772895, 'batch_size': 4, 'num_epochs': 26, 'weight_decay': 0.0048836455291741574, 'depth_complex': 4, 'depth_moderate': 3, 'depth_simple': 1, 'dropout': 0.3853643623561654, 'se_reduction': 5, 'hidden_dim_min': 3, 'base_loss': 'huber', 'huber_delta': 0.025887429653351265, 'focal_gamma': 1.5531364744775944, 'n_bins': 8, 'scheduler_patience': 2, 'scheduler_factor': 0.5666233591823597, 'early_stopping_patience': 8}. Best is trial 22 with value: 0.08764163086185245.
Train: 2407 rows (1613 IDs),Test: 598 rows (404 IDs) 

n_features_x : 6, n_features_per_modality: [16, 23, 19, 17, 7, 4, 4, 4, 1, 4]

--- ImbalancedRegressionLoss initialized ---
  Bins: 5, Focal gamma: 2.5692974446254992, Base loss: huber
  Bin [0.00, 0.20): count= 1876, weight=0.002
  Bin [0.20, 0.40): count=  497, weight=0.007
  Bin [0.40, 0.60): count=   32, weight=0.111
  Bin [0.60, 0.80): count=    2, weight=1.220
  Bin [0.80, 1.00): count=    0, weight=3.660
-------------------------------------------

  Pred range: [0.0390, 0.2932], std: 0.0457
  RMSE : 0.0911, R2: 0.1793, MAE: 0.0720, Spearman rho: 0.4229, Spearman p: 2.3930e-27, Pearson r: 0.4246, Pearson p: 1.4408e-27
  Pred range: [0.0587, 0.3718], std: 0.0526
  RMSE : 0.0940, R2: 0.1277, MAE: 0.0754, Spearman rho: 0.4537, Spearman p: 1.0758e-31, Pearson r: 0.4562, Pearson p: 4.5278e-32
  Pred range: [0.0333, 0.3249], std: 0.0447
  RMSE : 0.0898, R2: 0.2038, MAE: 0.0701, Spearman rho: 0.4750, Spearman p: 5.5119e-35, Pearson r: 0.4752, Pearson p: 5.0630e-35
  Pred range: [0.0684, 0.3863], std: 0.0513
  RMSE : 0.0942, R2: 0.1225, MAE: 0.0760, Spearman rho: 0.4584, Spearman p: 2.0962e-32, Pearson r: 0.4615, Pearson p: 7.1857e-33
  Pred range: [0.0443, 0.3395], std: 0.0454
  RMSE : 0.0892, R2: 0.2131, MAE: 0.0706, Spearman rho: 0.4626, Spearman p: 4.7527e-33, Pearson r: 0.4644, Pearson p: 2.5283e-33
  Pred range: [0.0329, 0.3614], std: 0.0529
  RMSE : 0.0897, R2: 0.2050, MAE: 0.0707, Spearman rho: 0.4621, Spearman p: 5.7849e-33, Pearson r: 0.4640, Pearson p: 2.9477e-33
  Pred range: [0.0487, 0.3828], std: 0.0499
  RMSE : 0.0888, R2: 0.2201, MAE: 0.0703, Spearman rho: 0.4706, Spearman p: 2.7484e-34, Pearson r: 0.4715, Pearson p: 1.9618e-34
  Pred range: [0.0765, 0.4191], std: 0.0525
  RMSE : 0.0959, R2: 0.0905, MAE: 0.0780, Spearman rho: 0.4667, Spearman p: 1.1020e-33, Pearson r: 0.4682, Pearson p: 6.5370e-34
  Pred range: [0.0520, 0.3748], std: 0.0530
  RMSE : 0.0906, R2: 0.1892, MAE: 0.0726, Spearman rho: 0.4658, Spearman p: 1.5351e-33, Pearson r: 0.4691, Pearson p: 4.7894e-34
  Pred range: [0.0536, 0.3546], std: 0.0518
  RMSE : 0.0896, R2: 0.2070, MAE: 0.0717, Spearman rho: 0.4723, Spearman p: 1.5114e-34, Pearson r: 0.4810, Pearson p: 5.9419e-36
  Pred range: [0.0326, 0.3379], std: 0.0478
  RMSE : 0.0884, R2: 0.2273, MAE: 0.0700, Spearman rho: 0.4743, Spearman p: 7.1796e-35, Pearson r: 0.4773, Pearson p: 2.3833e-35
  Pred range: [0.0421, 0.3546], std: 0.0498
  RMSE : 0.0884, R2: 0.2281, MAE: 0.0703, Spearman rho: 0.4785, Spearman p: 1.5281e-35, Pearson r: 0.4808, Pearson p: 6.3414e-36
  Pred range: [0.0421, 0.3680], std: 0.0519
  RMSE : 0.0889, R2: 0.2196, MAE: 0.0707, Spearman rho: 0.4702, Spearman p: 3.2056e-34, Pearson r: 0.4753, Pearson p: 4.9159e-35
  Pred range: [0.0431, 0.3489], std: 0.0503
  RMSE : 0.0882, R2: 0.2313, MAE: 0.0698, Spearman rho: 0.4743, Spearman p: 7.0708e-35, Pearson r: 0.4818, Pearson p: 4.4446e-36
  Pred range: [0.0410, 0.3512], std: 0.0531
  RMSE : 0.0885, R2: 0.2258, MAE: 0.0700, Spearman rho: 0.4729, Spearman p: 1.1998e-34, Pearson r: 0.4790, Pearson p: 1.2583e-35
  Pred range: [0.0493, 0.3613], std: 0.0495
  RMSE : 0.0887, R2: 0.2221, MAE: 0.0708, Spearman rho: 0.4746, Spearman p: 6.4851e-35, Pearson r: 0.4778, Pearson p: 1.9888e-35
  Pred range: [0.0673, 0.4015], std: 0.0513
  RMSE : 0.0931, R2: 0.1442, MAE: 0.0753, Spearman rho: 0.4556, Spearman p: 5.5936e-32, Pearson r: 0.4621, Pearson p: 5.7290e-33
  Pred range: [0.0664, 0.4038], std: 0.0529
  RMSE : 0.0931, R2: 0.1432, MAE: 0.0755, Spearman rho: 0.4752, Spearman p: 5.1166e-35, Pearson r: 0.4810, Pearson p: 5.9454e-36
  Pred range: [0.0516, 0.3733], std: 0.0534
  RMSE : 0.0892, R2: 0.2139, MAE: 0.0712, Spearman rho: 0.4818, Spearman p: 4.4401e-36, Pearson r: 0.4872, Pearson p: 5.6740e-37
  Pred range: [0.0463, 0.3527], std: 0.0488
  RMSE : 0.0886, R2: 0.2245, MAE: 0.0707, Spearman rho: 0.4735, Spearman p: 9.6581e-35, Pearson r: 0.4782, Pearson p: 1.7035e-35
  Pred range: [0.0376, 0.3289], std: 0.0477
  RMSE : 0.0883, R2: 0.2292, MAE: 0.0700, Spearman rho: 0.4768, Spearman p: 2.8288e-35, Pearson r: 0.4832, Pearson p: 2.5948e-36
[I 2026-04-27 23:55:51,753] Trial 26 finished with value: 0.08819966555248697 and parameters: {'learning_rate': 0.0005855236312462109, 'batch_size': 4, 'num_epochs': 27, 'weight_decay': 0.0016459300288387967, 'depth_complex': 3, 'depth_moderate': 4, 'depth_simple': 1, 'dropout': 0.2568137893718625, 'se_reduction': 7, 'hidden_dim_min': 5, 'base_loss': 'huber', 'huber_delta': 0.12115785446159084, 'focal_gamma': 2.5692974446254992, 'n_bins': 5, 'scheduler_patience': 3, 'scheduler_factor': 0.6647512193808677, 'early_stopping_patience': 7}. Best is trial 22 with value: 0.08764163086185245.
Train: 2407 rows (1613 IDs),Test: 598 rows (404 IDs) 

n_features_x : 6, n_features_per_modality: [16, 23, 19, 17, 7, 4, 4, 4, 1, 4]

--- ImbalancedRegressionLoss initialized ---
  Bins: 10, Focal gamma: 2.7153660807351105, Base loss: huber
  Bin [0.00, 0.10): count= 1010, weight=0.003
  Bin [0.10, 0.20): count=  866, weight=0.003
  Bin [0.20, 0.30): count=  386, weight=0.007
  Bin [0.30, 0.40): count=  111, weight=0.026
  Bin [0.40, 0.50): count=   23, weight=0.119
  Bin [0.50, 0.60): count=    9, weight=0.287
  Bin [0.60, 0.70): count=    2, weight=0.955
  Bin [0.70, 0.80): count=    0, weight=2.866
  Bin [0.80, 0.90): count=    0, weight=2.866
  Bin [0.90, 1.00): count=    0, weight=2.866
-------------------------------------------

  Pred range: [0.0204, 0.2683], std: 0.0428
  RMSE : 0.0902, R2: 0.1952, MAE: 0.0710, Spearman rho: 0.4439, Spearman p: 2.9231e-30, Pearson r: 0.4555, Pearson p: 5.7208e-32
  Pred range: [0.0342, 0.3848], std: 0.0615
  RMSE : 0.0910, R2: 0.1819, MAE: 0.0722, Spearman rho: 0.4626, Spearman p: 4.8156e-33, Pearson r: 0.4689, Pearson p: 5.1342e-34
  Pred range: [0.0475, 0.3411], std: 0.0512
  RMSE : 0.0896, R2: 0.2070, MAE: 0.0723, Spearman rho: 0.4811, Spearman p: 5.6813e-36, Pearson r: 0.4888, Pearson p: 3.0518e-37
  Pred range: [0.0281, 0.3853], std: 0.0567
  RMSE : 0.0911, R2: 0.1790, MAE: 0.0721, Spearman rho: 0.4331, Spearman p: 9.6641e-29, Pearson r: 0.4418, Pearson p: 5.7695e-30
  Pred range: [0.0306, 0.3457], std: 0.0535
  RMSE : 0.0890, R2: 0.2170, MAE: 0.0702, Spearman rho: 0.4671, Spearman p: 9.7269e-34, Pearson r: 0.4729, Pearson p: 1.1781e-34
  Pred range: [0.0474, 0.3379], std: 0.0516
  RMSE : 0.0897, R2: 0.2047, MAE: 0.0714, Spearman rho: 0.4740, Spearman p: 7.9332e-35, Pearson r: 0.4776, Pearson p: 2.1045e-35
  Pred range: [0.0150, 0.3594], std: 0.0547
  RMSE : 0.0894, R2: 0.2102, MAE: 0.0694, Spearman rho: 0.4867, Spearman p: 6.9823e-37, Pearson r: 0.4874, Pearson p: 5.3063e-37
  Pred range: [0.0610, 0.3626], std: 0.0518
  RMSE : 0.0908, R2: 0.1859, MAE: 0.0730, Spearman rho: 0.4749, Spearman p: 5.8262e-35, Pearson r: 0.4815, Pearson p: 5.0154e-36
  Pred range: [0.0485, 0.3973], std: 0.0544
  RMSE : 0.0901, R2: 0.1971, MAE: 0.0718, Spearman rho: 0.4645, Spearman p: 2.4748e-33, Pearson r: 0.4680, Pearson p: 7.0592e-34
  Pred range: [0.0608, 0.3627], std: 0.0512
  RMSE : 0.0904, R2: 0.1929, MAE: 0.0726, Spearman rho: 0.4707, Spearman p: 2.6629e-34, Pearson r: 0.4770, Pearson p: 2.6537e-35
  Pred range: [0.0652, 0.3685], std: 0.0547
  RMSE : 0.0933, R2: 0.1398, MAE: 0.0755, Spearman rho: 0.4748, Spearman p: 6.0022e-35, Pearson r: 0.4814, Pearson p: 5.1115e-36
[I 2026-04-27 23:58:08,952] Trial 27 finished with value: 0.08901214828484669 and parameters: {'learning_rate': 0.0013849731615718992, 'batch_size': 4, 'num_epochs': 16, 'weight_decay': 0.005552099906913407, 'depth_complex': 6, 'depth_moderate': 5, 'depth_simple': 2, 'dropout': 0.18832496328981435, 'se_reduction': 4, 'hidden_dim_min': 2, 'base_loss': 'huber', 'huber_delta': 0.0679781603004731, 'focal_gamma': 2.7153660807351105, 'n_bins': 10, 'scheduler_patience': 2, 'scheduler_factor': 0.4109088788393552, 'early_stopping_patience': 6}. Best is trial 22 with value: 0.08764163086185245.
Train: 2407 rows (1613 IDs),Test: 598 rows (404 IDs) 

n_features_x : 6, n_features_per_modality: [16, 23, 19, 17, 7, 4, 4, 4, 1, 4]

--- ImbalancedRegressionLoss initialized ---
  Bins: 8, Focal gamma: 2.2263058284509962, Base loss: huber
  Bin [0.00, 0.12): count= 1180, weight=0.003
  Bin [0.12, 0.25): count=  933, weight=0.003
  Bin [0.25, 0.38): count=  253, weight=0.012
  Bin [0.38, 0.50): count=   30, weight=0.098
  Bin [0.50, 0.62): count=   10, weight=0.277
  Bin [0.62, 0.75): count=    1, weight=1.521
  Bin [0.75, 0.88): count=    0, weight=3.043
  Bin [0.88, 1.00): count=    0, weight=3.043
-------------------------------------------

  Pred range: [0.0325, 0.3653], std: 0.0519
  RMSE : 0.0983, R2: 0.0453, MAE: 0.0763, Spearman rho: 0.3552, Spearman p: 3.2301e-19, Pearson r: 0.3037, Pearson p: 3.1399e-14
  Pred range: [0.0236, 0.4106], std: 0.0538
  RMSE : 0.1053, R2: -0.0961, MAE: 0.0852, Spearman rho: 0.3237, Spearman p: 4.7528e-16, Pearson r: 0.3216, Pearson p: 7.3669e-16
  Pred range: [0.0370, 0.4893], std: 0.0649
  RMSE : 0.1016, R2: -0.0206, MAE: 0.0822, Spearman rho: 0.4103, Spearman p: 1.0924e-25, Pearson r: 0.4110, Pearson p: 9.0335e-26
  Pred range: [-0.0028, 0.3447], std: 0.0410
  RMSE : 0.0972, R2: 0.0656, MAE: 0.0769, Spearman rho: 0.3032, Spearman p: 3.5202e-14, Pearson r: 0.2907, Pearson p: 4.1192e-13
  Pred range: [0.0838, 0.5316], std: 0.0549
  RMSE : 0.1322, R2: -0.7265, MAE: 0.1118, Spearman rho: 0.3027, Spearman p: 3.8797e-14, Pearson r: 0.3173, Pearson p: 1.8870e-15
  Pred range: [-0.1327, 0.2904], std: 0.0518
  RMSE : 0.1221, R2: -0.4733, MAE: 0.0924, Spearman rho: 0.3373, Spearman p: 2.2459e-17, Pearson r: 0.3471, Pearson p: 2.2484e-18
[I 2026-04-27 23:58:54,626] Trial 28 pruned. 
Train: 2407 rows (1613 IDs),Test: 598 rows (404 IDs) 

n_features_x : 6, n_features_per_modality: [16, 23, 19, 17, 7, 4, 4, 4, 1, 4]

--- ImbalancedRegressionLoss initialized ---
  Bins: 6, Focal gamma: 1.6346604784766625, Base loss: mse
  Bin [0.00, 0.17): count= 1538, weight=0.002
  Bin [0.17, 0.33): count=  789, weight=0.005
  Bin [0.33, 0.50): count=   69, weight=0.053
  Bin [0.50, 0.67): count=   10, weight=0.339
  Bin [0.67, 0.83): count=    1, weight=1.867
  Bin [0.83, 1.00): count=    0, weight=3.733
-------------------------------------------

  Pred range: [0.0387, 0.3985], std: 0.0526
  RMSE : 0.1077, R2: -0.1464, MAE: 0.0885, Spearman rho: 0.3307, Spearman p: 9.9822e-17, Pearson r: 0.3453, Pearson p: 3.4535e-18
  Pred range: [0.0478, 0.3558], std: 0.0478
  RMSE : 0.0980, R2: 0.0506, MAE: 0.0797, Spearman rho: 0.3776, Spearman p: 1.0665e-21, Pearson r: 0.3840, Pearson p: 1.9235e-22
  Pred range: [0.0579, 0.3945], std: 0.0543
  RMSE : 0.1028, R2: -0.0438, MAE: 0.0844, Spearman rho: 0.4127, Spearman p: 5.3803e-26, Pearson r: 0.4137, Pearson p: 4.0017e-26
  Pred range: [0.0602, 0.3916], std: 0.0546
  RMSE : 0.1036, R2: -0.0608, MAE: 0.0852, Spearman rho: 0.4207, Spearman p: 4.7902e-27, Pearson r: 0.4213, Pearson p: 3.9315e-27
  Pred range: [0.0648, 0.3985], std: 0.0544
  RMSE : 0.1026, R2: -0.0409, MAE: 0.0843, Spearman rho: 0.4259, Spearman p: 9.5579e-28, Pearson r: 0.4268, Pearson p: 7.0983e-28
  Pred range: [0.0572, 0.3889], std: 0.0537
  RMSE : 0.0980, R2: 0.0510, MAE: 0.0800, Spearman rho: 0.4332, Spearman p: 9.6017e-29, Pearson r: 0.4332, Pearson p: 9.4445e-29
[I 2026-04-27 23:59:08,642] Trial 29 pruned. 
Train: 2407 rows (1613 IDs),Test: 598 rows (404 IDs) 

n_features_x : 6, n_features_per_modality: [16, 23, 19, 17, 7, 4, 4, 4, 1, 4]

--- ImbalancedRegressionLoss initialized ---
  Bins: 13, Focal gamma: 2.0164103931677233, Base loss: huber
  Bin [0.00, 0.08): count=  828, weight=0.003
  Bin [0.08, 0.15): count=  710, weight=0.004
  Bin [0.15, 0.23): count=  477, weight=0.006
  Bin [0.23, 0.31): count=  288, weight=0.009
  Bin [0.31, 0.38): count=   63, weight=0.042
  Bin [0.38, 0.46): count=   23, weight=0.113
  Bin [0.46, 0.54): count=   10, weight=0.247
  Bin [0.54, 0.62): count=    7, weight=0.340
  Bin [0.62, 0.69): count=    0, weight=2.719
  Bin [0.69, 0.77): count=    1, weight=1.359
  Bin [0.77, 0.85): count=    0, weight=2.719
  Bin [0.85, 0.92): count=    0, weight=2.719
  Bin [0.92, 1.00): count=    0, weight=2.719
-------------------------------------------

  Pred range: [0.0173, 0.4008], std: 0.0522
  RMSE : 0.1020, R2: -0.0274, MAE: 0.0835, Spearman rho: 0.2688, Spearman p: 2.3323e-11, Pearson r: 0.3081, Pearson p: 1.2908e-14
  Pred range: [0.0348, 0.4172], std: 0.0567
  RMSE : 0.1001, R2: 0.0101, MAE: 0.0815, Spearman rho: 0.3421, Spearman p: 7.3983e-18, Pearson r: 0.3713, Pearson p: 5.5261e-21
  Pred range: [0.0291, 0.3691], std: 0.0534
  RMSE : 0.0930, R2: 0.1446, MAE: 0.0744, Spearman rho: 0.3822, Spearman p: 3.0747e-22, Pearson r: 0.4076, Pearson p: 2.4054e-25
  Pred range: [0.0420, 0.3778], std: 0.0554
  RMSE : 0.0944, R2: 0.1185, MAE: 0.0763, Spearman rho: 0.4007, Spearman p: 1.8167e-24, Pearson r: 0.4220, Pearson p: 3.2183e-27
  Pred range: [0.0475, 0.3796], std: 0.0539
  RMSE : 0.0938, R2: 0.1301, MAE: 0.0759, Spearman rho: 0.4163, Spearman p: 1.8103e-26, Pearson r: 0.4355, Pearson p: 4.5238e-29
  Pred range: [0.0447, 0.3729], std: 0.0529
  RMSE : 0.0916, R2: 0.1711, MAE: 0.0736, Spearman rho: 0.4295, Spearman p: 3.1005e-28, Pearson r: 0.4455, Pearson p: 1.6728e-30
  Pred range: [0.0528, 0.3960], std: 0.0560
  RMSE : 0.0941, R2: 0.1250, MAE: 0.0762, Spearman rho: 0.4414, Spearman p: 6.5446e-30, Pearson r: 0.4546, Pearson p: 7.8076e-32
