[I 2026-04-28 01:06:44,462] Trial 26 finished with value: 0.1518730631751904 and parameters: {'learning_rate': 0.00293112464768553, 'batch_size': 4, 'num_epochs': 15, 'weight_decay': 0.00016486873449232672, 'depth_complex': 5, 'depth_moderate': 5, 'depth_simple': 3, 'dropout': 0.2562791865537838, 'se_reduction': 6, 'hidden_dim_min': 5, 'base_loss': 'mse', 'huber_delta': 0.14946213946850412, 'focal_gamma': 1.9507790270224206, 'n_bins': 7, 'scheduler_patience': 5, 'scheduler_factor': 0.4348420857318951, 'early_stopping_patience': 4}. Best is trial 22 with value: 0.14933273495596114.
Train: 2407 rows (1613 IDs),Test: 598 rows (404 IDs) 

n_features_x : 6, n_features_per_modality: [16, 23, 19, 17, 7, 4, 4, 4, 1, 4]

--- ImbalancedRegressionLoss initialized ---
  Bins: 13, Focal gamma: 1.639804132119741, Base loss: mse
  Bin [0.00, 0.08): count=  383, weight=0.049
  Bin [0.08, 0.15): count=  578, weight=0.032
  Bin [0.15, 0.23): count=  370, weight=0.051
  Bin [0.23, 0.31): count=  368, weight=0.051
  Bin [0.31, 0.38): count=  199, weight=0.094
  Bin [0.38, 0.46): count=  207, weight=0.090
  Bin [0.46, 0.54): count=  108, weight=0.172
  Bin [0.54, 0.62): count=  106, weight=0.176
  Bin [0.62, 0.69): count=   36, weight=0.508
  Bin [0.69, 0.77): count=   36, weight=0.508
  Bin [0.77, 0.85): count=    9, weight=1.878
  Bin [0.85, 0.92): count=    5, weight=3.130
  Bin [0.92, 1.00): count=    2, weight=6.261
-------------------------------------------

  Pred range: [0.0508, 0.6099], std: 0.0773
  RMSE : 0.1762, R2: -0.0367, MAE: 0.1489, Spearman rho: 0.3958, Spearman p: 7.2164e-24, Pearson r: 0.4028, Pearson p: 9.9134e-25
  Pred range: [0.0488, 0.5940], std: 0.0757
  RMSE : 0.1641, R2: 0.1011, MAE: 0.1367, Spearman rho: 0.4354, Spearman p: 4.7084e-29, Pearson r: 0.4483, Pearson p: 6.7304e-31
  Pred range: [0.0896, 0.6984], std: 0.0860
  RMSE : 0.1839, R2: -0.1285, MAE: 0.1575, Spearman rho: 0.4493, Spearman p: 4.8267e-31, Pearson r: 0.4630, Pearson p: 4.2335e-33
  Pred range: [0.0603, 0.6480], std: 0.0832
  RMSE : 0.1655, R2: 0.0856, MAE: 0.1394, Spearman rho: 0.4634, Spearman p: 3.6558e-33, Pearson r: 0.4795, Pearson p: 1.0506e-35
  Pred range: [0.0884, 0.6868], std: 0.0855
  RMSE : 0.1741, R2: -0.0123, MAE: 0.1480, Spearman rho: 0.4641, Spearman p: 2.7983e-33, Pearson r: 0.4864, Pearson p: 7.8283e-37
  Pred range: [0.1105, 0.7553], std: 0.0952
  RMSE : 0.1854, R2: -0.1476, MAE: 0.1585, Spearman rho: 0.4761, Spearman p: 3.6548e-35, Pearson r: 0.4975, Pearson p: 1.0238e-38
  Pred range: [0.1370, 0.7774], std: 0.0944
  RMSE : 0.1922, R2: -0.2335, MAE: 0.1647, Spearman rho: 0.4660, Spearman p: 1.4237e-33, Pearson r: 0.4910, Pearson p: 1.3149e-37
[I 2026-04-28 01:06:57,691] Trial 27 pruned. 
Train: 2407 rows (1613 IDs),Test: 598 rows (404 IDs) 

n_features_x : 6, n_features_per_modality: [16, 23, 19, 17, 7, 4, 4, 4, 1, 4]

--- ImbalancedRegressionLoss initialized ---
  Bins: 8, Focal gamma: 0.6911163692542811, Base loss: mse
  Bin [0.00, 0.12): count=  760, weight=0.039
  Bin [0.12, 0.25): count=  700, weight=0.042
  Bin [0.25, 0.38): count=  438, weight=0.067
  Bin [0.38, 0.50): count=  264, weight=0.111
  Bin [0.50, 0.62): count=  157, weight=0.186
  Bin [0.62, 0.75): count=   60, weight=0.483
  Bin [0.75, 0.88): count=   24, weight=1.179
  Bin [0.88, 1.00): count=    4, weight=5.893
-------------------------------------------

  Pred range: [0.1257, 0.5777], std: 0.0765
  RMSE : 0.1650, R2: 0.0916, MAE: 0.1363, Spearman rho: 0.4007, Spearman p: 1.8149e-24, Pearson r: 0.4345, Pearson p: 6.1349e-29
  Pred range: [0.1270, 0.6222], std: 0.0863
  RMSE : 0.1656, R2: 0.0851, MAE: 0.1380, Spearman rho: 0.4516, Spearman p: 2.1577e-31, Pearson r: 0.4779, Pearson p: 1.8747e-35
  Pred range: [0.1225, 0.5977], std: 0.0827
  RMSE : 0.1592, R2: 0.1535, MAE: 0.1320, Spearman rho: 0.4713, Spearman p: 2.1062e-34, Pearson r: 0.4950, Pearson p: 2.7115e-38
  Pred range: [0.1205, 0.6262], std: 0.0873
  RMSE : 0.1584, R2: 0.1621, MAE: 0.1312, Spearman rho: 0.4853, Spearman p: 1.1899e-36, Pearson r: 0.5052, Pearson p: 4.6718e-40
  Pred range: [0.1186, 0.6063], std: 0.0863
  RMSE : 0.1567, R2: 0.1802, MAE: 0.1295, Spearman rho: 0.4874, Spearman p: 5.3230e-37, Pearson r: 0.5088, Pearson p: 1.0603e-40
  Pred range: [0.1292, 0.6683], std: 0.0939
  RMSE : 0.1645, R2: 0.0963, MAE: 0.1378, Spearman rho: 0.4899, Spearman p: 1.9950e-37, Pearson r: 0.5100, Pearson p: 6.4465e-41
  Pred range: [0.1344, 0.6654], std: 0.0914
  RMSE : 0.1664, R2: 0.0758, MAE: 0.1403, Spearman rho: 0.4892, Spearman p: 2.5894e-37, Pearson r: 0.5107, Pearson p: 4.9525e-41
  Pred range: [0.1087, 0.5897], std: 0.0852
  RMSE : 0.1508, R2: 0.2405, MAE: 0.1225, Spearman rho: 0.4937, Spearman p: 4.6033e-38, Pearson r: 0.5159, Pearson p: 5.7145e-42
  Pred range: [0.1277, 0.6546], std: 0.0919
  RMSE : 0.1617, R2: 0.1267, MAE: 0.1353, Spearman rho: 0.4924, Spearman p: 7.7568e-38, Pearson r: 0.5159, Pearson p: 5.7033e-42
  Pred range: [0.1341, 0.7158], std: 0.0994
  RMSE : 0.1679, R2: 0.0590, MAE: 0.1410, Spearman rho: 0.4905, Spearman p: 1.6108e-37, Pearson r: 0.5129, Pearson p: 1.9458e-41
  Pred range: [0.1198, 0.6386], std: 0.0935
  RMSE : 0.1566, R2: 0.1813, MAE: 0.1295, Spearman rho: 0.4914, Spearman p: 1.1469e-37, Pearson r: 0.5159, Pearson p: 5.6865e-42
  Pred range: [0.1134, 0.6409], std: 0.0926
  RMSE : 0.1574, R2: 0.1727, MAE: 0.1303, Spearman rho: 0.4852, Spearman p: 1.2125e-36, Pearson r: 0.5118, Pearson p: 3.1221e-41
  Pred range: [0.1126, 0.6577], std: 0.0940
  RMSE : 0.1596, R2: 0.1494, MAE: 0.1328, Spearman rho: 0.4851, Spearman p: 1.2622e-36, Pearson r: 0.5109, Pearson p: 4.5727e-41
[I 2026-04-28 01:08:45,882] Trial 28 finished with value: 0.15084548382486745 and parameters: {'learning_rate': 0.00017945842187790939, 'batch_size': 4, 'num_epochs': 22, 'weight_decay': 0.0003594511433525249, 'depth_complex': 5, 'depth_moderate': 2, 'depth_simple': 2, 'dropout': 0.45045121620323925, 'se_reduction': 5, 'hidden_dim_min': 10, 'base_loss': 'mse', 'huber_delta': 0.1867785036668717, 'focal_gamma': 0.6911163692542811, 'n_bins': 8, 'scheduler_patience': 5, 'scheduler_factor': 0.6877878371020053, 'early_stopping_patience': 5}. Best is trial 22 with value: 0.14933273495596114.
Train: 2407 rows (1613 IDs),Test: 598 rows (404 IDs) 

n_features_x : 6, n_features_per_modality: [16, 23, 19, 17, 7, 4, 4, 4, 1, 4]

--- ImbalancedRegressionLoss initialized ---
  Bins: 18, Focal gamma: 1.4408302283079726, Base loss: mse
  Bin [0.00, 0.06): count=  172, weight=0.058
  Bin [0.06, 0.11): count=  413, weight=0.024
  Bin [0.11, 0.17): count=  376, weight=0.027
  Bin [0.17, 0.22): count=  370, weight=0.027
  Bin [0.22, 0.28): count=  255, weight=0.040
  Bin [0.28, 0.33): count=  223, weight=0.045
  Bin [0.33, 0.39): count=   89, weight=0.112
  Bin [0.39, 0.44): count=  142, weight=0.071
  Bin [0.44, 0.50): count=  122, weight=0.082
  Bin [0.50, 0.56): count=   93, weight=0.108
  Bin [0.56, 0.61): count=   64, weight=0.156
  Bin [0.61, 0.67): count=   36, weight=0.273
  Bin [0.67, 0.72): count=   10, weight=0.920
  Bin [0.72, 0.78): count=   26, weight=0.375
  Bin [0.78, 0.83): count=    9, weight=1.012
  Bin [0.83, 0.89): count=    4, weight=2.023
  Bin [0.89, 0.94): count=    3, weight=2.529
  Bin [0.94, 1.00): count=    0, weight=10.117
-------------------------------------------

  Pred range: [0.1360, 0.5437], std: 0.0573
  RMSE : 0.1822, R2: -0.1078, MAE: 0.1534, Spearman rho: 0.2443, Spearman p: 1.4176e-09, Pearson r: 0.2680, Pearson p: 2.7090e-11
  Pred range: [0.1154, 0.5704], std: 0.0652
  RMSE : 0.1659, R2: 0.0810, MAE: 0.1378, Spearman rho: 0.3747, Spearman p: 2.2983e-21, Pearson r: 0.4091, Pearson p: 1.5794e-25
  Pred range: [0.1188, 0.6420], std: 0.0780
  RMSE : 0.1665, R2: 0.0743, MAE: 0.1391, Spearman rho: 0.4269, Spearman p: 7.0192e-28, Pearson r: 0.4537, Pearson p: 1.0801e-31
  Pred range: [0.1183, 0.6622], std: 0.0845
  RMSE : 0.1645, R2: 0.0969, MAE: 0.1370, Spearman rho: 0.4521, Spearman p: 1.8153e-31, Pearson r: 0.4737, Pearson p: 8.7808e-35
  Pred range: [0.1149, 0.6272], std: 0.0837
  RMSE : 0.1577, R2: 0.1697, MAE: 0.1299, Spearman rho: 0.4685, Spearman p: 5.9176e-34, Pearson r: 0.4866, Pearson p: 7.1383e-37
  Pred range: [0.1153, 0.6390], std: 0.0869
  RMSE : 0.1572, R2: 0.1750, MAE: 0.1294, Spearman rho: 0.4756, Spearman p: 4.4242e-35, Pearson r: 0.4921, Pearson p: 8.7050e-38
  Pred range: [0.1177, 0.6403], std: 0.0881
  RMSE : 0.1575, R2: 0.1720, MAE: 0.1299, Spearman rho: 0.4804, Spearman p: 7.5389e-36, Pearson r: 0.4968, Pearson p: 1.3479e-38
  Pred range: [0.1214, 0.6499], std: 0.0891
  RMSE : 0.1599, R2: 0.1462, MAE: 0.1328, Spearman rho: 0.4803, Spearman p: 7.7735e-36, Pearson r: 0.4986, Pearson p: 6.6448e-39
  Pred range: [0.1098, 0.6434], std: 0.0893
  RMSE : 0.1571, R2: 0.1764, MAE: 0.1293, Spearman rho: 0.4807, Spearman p: 6.7851e-36, Pearson r: 0.4984, Pearson p: 7.1771e-39
  Pred range: [0.1169, 0.6651], std: 0.0926
  RMSE : 0.1611, R2: 0.1339, MAE: 0.1338, Spearman rho: 0.4821, Spearman p: 4.0130e-36, Pearson r: 0.5003, Pearson p: 3.4410e-39
  Pred range: [0.1342, 0.6851], std: 0.0942
  RMSE : 0.1674, R2: 0.0644, MAE: 0.1406, Spearman rho: 0.4832, Spearman p: 2.6462e-36, Pearson r: 0.5032, Pearson p: 1.0622e-39
[I 2026-04-28 01:10:18,453] Trial 29 pruned. 
Train: 2407 rows (1613 IDs),Test: 598 rows (404 IDs) 

n_features_x : 6, n_features_per_modality: [16, 23, 19, 17, 7, 4, 4, 4, 1, 4]

--- ImbalancedRegressionLoss initialized ---
  Bins: 11, Focal gamma: 1.1540262809782011, Base loss: mse
  Bin [0.00, 0.09): count=  585, weight=0.034
  Bin [0.09, 0.18): count=  580, weight=0.034
  Bin [0.18, 0.27): count=  421, weight=0.047
  Bin [0.27, 0.36): count=  312, weight=0.064
  Bin [0.36, 0.45): count=  207, weight=0.096
  Bin [0.45, 0.55): count=  108, weight=0.183
  Bin [0.55, 0.64): count=  125, weight=0.159
  Bin [0.64, 0.73): count=   41, weight=0.476
  Bin [0.73, 0.82): count=   21, weight=0.909
  Bin [0.82, 0.91): count=    4, weight=3.999
  Bin [0.91, 1.00): count=    3, weight=4.998
-------------------------------------------

  Pred range: [0.1263, 0.5687], std: 0.0692
  RMSE : 0.1662, R2: 0.0775, MAE: 0.1367, Spearman rho: 0.3874, Spearman p: 7.5588e-23, Pearson r: 0.3953, Pearson p: 8.4318e-24
  Pred range: [0.1208, 0.6088], std: 0.0749
  RMSE : 0.1574, R2: 0.1726, MAE: 0.1271, Spearman rho: 0.4402, Spearman p: 9.8723e-30, Pearson r: 0.4452, Pearson p: 1.8689e-30
  Pred range: [0.1307, 0.6171], std: 0.0806
  RMSE : 0.1595, R2: 0.1512, MAE: 0.1316, Spearman rho: 0.4692, Spearman p: 4.5139e-34, Pearson r: 0.4739, Pearson p: 8.2927e-35
  Pred range: [0.1255, 0.6604], std: 0.0836
  RMSE : 0.1565, R2: 0.1830, MAE: 0.1282, Spearman rho: 0.4761, Spearman p: 3.7316e-35, Pearson r: 0.4842, Pearson p: 1.8020e-36
  Pred range: [0.1668, 0.7738], std: 0.0971
  RMSE : 0.1879, R2: -0.1781, MAE: 0.1602, Spearman rho: 0.4810, Spearman p: 6.0606e-36, Pearson r: 0.4920, Pearson p: 8.9943e-38
  Pred range: [0.1390, 0.6844], std: 0.0867
  RMSE : 0.1609, R2: 0.1360, MAE: 0.1342, Spearman rho: 0.4861, Spearman p: 8.7033e-37, Pearson r: 0.4977, Pearson p: 9.5539e-39
  Pred range: [0.1527, 0.7309], std: 0.0918
  RMSE : 0.1702, R2: 0.0326, MAE: 0.1440, Spearman rho: 0.4867, Spearman p: 6.9712e-37, Pearson r: 0.4979, Pearson p: 8.8904e-39
  Pred range: [0.1370, 0.6700], std: 0.0874
  RMSE : 0.1625, R2: 0.1190, MAE: 0.1361, Spearman rho: 0.4860, Spearman p: 8.9446e-37, Pearson r: 0.5012, Pearson p: 2.3882e-39
  Pred range: [0.1298, 0.7055], std: 0.0885
  RMSE : 0.1654, R2: 0.0869, MAE: 0.1394, Spearman rho: 0.4877, Spearman p: 4.7751e-37, Pearson r: 0.5043, Pearson p: 6.8849e-40
  Pred range: [0.1279, 0.7097], std: 0.0924
  RMSE : 0.1665, R2: 0.0743, MAE: 0.1401, Spearman rho: 0.4857, Spearman p: 9.9845e-37, Pearson r: 0.5013, Pearson p: 2.2901e-39
[I 2026-04-28 01:11:39,500] Trial 30 finished with value: 0.15645295909048748 and parameters: {'learning_rate': 0.00026761540361250964, 'batch_size': 4, 'num_epochs': 10, 'weight_decay': 8.432531531017828e-05, 'depth_complex': 3, 'depth_moderate': 4, 'depth_simple': 2, 'dropout': 0.1436430842329954, 'se_reduction': 6, 'hidden_dim_min': 8, 'base_loss': 'mse', 'huber_delta': 0.1208839545400047, 'focal_gamma': 1.1540262809782011, 'n_bins': 11, 'scheduler_patience': 5, 'scheduler_factor': 0.5015289984626611, 'early_stopping_patience': 6}. Best is trial 22 with value: 0.14933273495596114.
Train: 2407 rows (1613 IDs),Test: 598 rows (404 IDs) 

n_features_x : 6, n_features_per_modality: [16, 23, 19, 17, 7, 4, 4, 4, 1, 4]

--- ImbalancedRegressionLoss initialized ---
  Bins: 9, Focal gamma: 1.5818465004882434, Base loss: mse
  Bin [0.00, 0.11): count=  585, weight=0.041
  Bin [0.11, 0.22): count=  746, weight=0.032
  Bin [0.22, 0.33): count=  478, weight=0.050
  Bin [0.33, 0.44): count=  231, weight=0.104
  Bin [0.44, 0.56): count=  215, weight=0.112
  Bin [0.56, 0.67): count=  100, weight=0.239
  Bin [0.67, 0.78): count=   36, weight=0.653
  Bin [0.78, 0.89): count=   13, weight=1.726
  Bin [0.89, 1.00): count=    3, weight=6.041
-------------------------------------------

  Pred range: [0.0949, 0.6056], std: 0.0795
  RMSE : 0.1592, R2: 0.1536, MAE: 0.1314, Spearman rho: 0.4664, Spearman p: 1.2480e-33, Pearson r: 0.4900, Pearson p: 1.9256e-37
  Pred range: [0.1018, 0.6058], std: 0.0831
  RMSE : 0.1560, R2: 0.1878, MAE: 0.1277, Spearman rho: 0.4797, Spearman p: 9.6737e-36, Pearson r: 0.4948, Pearson p: 2.9614e-38
  Pred range: [0.1328, 0.7073], std: 0.0963
  RMSE : 0.1690, R2: 0.0471, MAE: 0.1421, Spearman rho: 0.4880, Spearman p: 4.1515e-37, Pearson r: 0.5098, Pearson p: 7.0698e-41
  Pred range: [0.0621, 0.6517], std: 0.0907
  RMSE : 0.1595, R2: 0.1511, MAE: 0.1328, Spearman rho: 0.4929, Spearman p: 6.2974e-38, Pearson r: 0.5126, Pearson p: 2.2721e-41
  Pred range: [0.0574, 0.5531], std: 0.0846
  RMSE : 0.1513, R2: 0.2354, MAE: 0.1224, Spearman rho: 0.4830, Spearman p: 2.7845e-36, Pearson r: 0.5074, Pearson p: 1.8849e-40
  Pred range: [0.0861, 0.7761], std: 0.1055
  RMSE : 0.1757, R2: -0.0307, MAE: 0.1477, Spearman rho: 0.4850, Spearman p: 1.2955e-36, Pearson r: 0.5040, Pearson p: 7.6450e-40
  Pred range: [0.0373, 0.5886], std: 0.0841
  RMSE : 0.1533, R2: 0.2161, MAE: 0.1249, Spearman rho: 0.4793, Spearman p: 1.1354e-35, Pearson r: 0.5006, Pearson p: 3.0056e-39
  Pred range: [-0.0478, 0.5436], std: 0.0841
  RMSE : 0.1510, R2: 0.2389, MAE: 0.1208, Spearman rho: 0.4826, Spearman p: 3.3241e-36, Pearson r: 0.4991, Pearson p: 5.4910e-39
  Pred range: [0.0304, 0.5868], std: 0.0856
  RMSE : 0.1597, R2: 0.1489, MAE: 0.1329, Spearman rho: 0.4791, Spearman p: 1.2221e-35, Pearson r: 0.4993, Pearson p: 4.9419e-39
  Pred range: [0.0578, 0.6606], std: 0.0937
  RMSE : 0.1661, R2: 0.0790, MAE: 0.1393, Spearman rho: 0.4871, Spearman p: 5.9298e-37, Pearson r: 0.5044, Pearson p: 6.4804e-40
  Pred range: [0.0114, 0.6906], std: 0.0949
  RMSE : 0.1616, R2: 0.1287, MAE: 0.1341, Spearman rho: 0.4793, Spearman p: 1.1242e-35, Pearson r: 0.5003, Pearson p: 3.3548e-39
[I 2026-04-28 01:13:17,351] Trial 31 finished with value: 0.1509992866144002 and parameters: {'learning_rate': 0.0008014992108397143, 'batch_size': 4, 'num_epochs': 15, 'weight_decay': 0.0002078856033309423, 'depth_complex': 4, 'depth_moderate': 4, 'depth_simple': 2, 'dropout': 0.40806142284609975, 'se_reduction': 6, 'hidden_dim_min': 7, 'base_loss': 'mse', 'huber_delta': 0.10765751764701302, 'focal_gamma': 1.5818465004882434, 'n_bins': 9, 'scheduler_patience': 5, 'scheduler_factor': 0.5219103855203285, 'early_stopping_patience': 3}. Best is trial 22 with value: 0.14933273495596114.
Train: 2407 rows (1613 IDs),Test: 598 rows (404 IDs) 

n_features_x : 6, n_features_per_modality: [16, 23, 19, 17, 7, 4, 4, 4, 1, 4]

--- ImbalancedRegressionLoss initialized ---
  Bins: 10, Focal gamma: 1.9651135647269764, Base loss: mse
  Bin [0.00, 0.10): count=  585, weight=0.037
  Bin [0.10, 0.20): count=  580, weight=0.038
  Bin [0.20, 0.30): count=  421, weight=0.052
  Bin [0.30, 0.40): count=  385, weight=0.057
  Bin [0.40, 0.50): count=  191, weight=0.114
  Bin [0.50, 0.60): count=  129, weight=0.168
  Bin [0.60, 0.70): count=   74, weight=0.292
  Bin [0.70, 0.80): count=   33, weight=0.644
  Bin [0.80, 0.90): count=    6, weight=3.127
  Bin [0.90, 1.00): count=    3, weight=5.472
-------------------------------------------

  Pred range: [0.1314, 0.5205], std: 0.0744
  RMSE : 0.1570, R2: 0.1774, MAE: 0.1267, Spearman rho: 0.4485, Spearman p: 6.1341e-31, Pearson r: 0.4508, Pearson p: 2.8371e-31
  Pred range: [0.1268, 0.5351], std: 0.0753
  RMSE : 0.1536, R2: 0.2129, MAE: 0.1233, Spearman rho: 0.4710, Spearman p: 2.3809e-34, Pearson r: 0.4811, Pearson p: 5.6925e-36
  Pred range: [0.1409, 0.6416], std: 0.0893
  RMSE : 0.1641, R2: 0.1006, MAE: 0.1376, Spearman rho: 0.4879, Spearman p: 4.2745e-37, Pearson r: 0.5022, Pearson p: 1.6031e-39
  Pred range: [0.1181, 0.6507], std: 0.0899
  RMSE : 0.1581, R2: 0.1654, MAE: 0.1315, Spearman rho: 0.4912, Spearman p: 1.2246e-37, Pearson r: 0.5137, Pearson p: 1.4268e-41
  Pred range: [0.0667, 0.5937], std: 0.0854
  RMSE : 0.1517, R2: 0.2315, MAE: 0.1238, Spearman rho: 0.4950, Spearman p: 2.7785e-38, Pearson r: 0.5171, Pearson p: 3.3519e-42
  Pred range: [0.0830, 0.6503], std: 0.0903
  RMSE : 0.1598, R2: 0.1471, MAE: 0.1335, Spearman rho: 0.4878, Spearman p: 4.4745e-37, Pearson r: 0.5132, Pearson p: 1.7113e-41
  Pred range: [0.0958, 0.6743], std: 0.0907
  RMSE : 0.1731, R2: 0.0004, MAE: 0.1472, Spearman rho: 0.4765, Spearman p: 3.2160e-35, Pearson r: 0.5039, Pearson p: 8.0216e-40
  Pred range: [0.0672, 0.6954], std: 0.0954
  RMSE : 0.1657, R2: 0.0837, MAE: 0.1391, Spearman rho: 0.4801, Spearman p: 8.2765e-36, Pearson r: 0.5061, Pearson p: 3.3141e-40
[I 2026-04-28 01:14:33,964] Trial 32 finished with value: 0.1517364796258897 and parameters: {'learning_rate': 0.0005263969686433447, 'batch_size': 4, 'num_epochs': 14, 'weight_decay': 3.1884521784750554e-05, 'depth_complex': 5, 'depth_moderate': 4, 'depth_simple': 2, 'dropout': 0.4637967121453761, 'se_reduction': 7, 'hidden_dim_min': 6, 'base_loss': 'mse', 'huber_delta': 0.09853621998620998, 'focal_gamma': 1.9651135647269764, 'n_bins': 10, 'scheduler_patience': 5, 'scheduler_factor': 0.5863221676160711, 'early_stopping_patience': 3}. Best is trial 22 with value: 0.14933273495596114.
Train: 2407 rows (1613 IDs),Test: 598 rows (404 IDs) 

n_features_x : 6, n_features_per_modality: [16, 23, 19, 17, 7, 4, 4, 4, 1, 4]

--- ImbalancedRegressionLoss initialized ---
  Bins: 6, Focal gamma: 1.5067350114501947, Base loss: mse
  Bin [0.00, 0.17): count=  961, weight=0.041
  Bin [0.17, 0.33): count=  848, weight=0.047
  Bin [0.33, 0.50): count=  353, weight=0.112
  Bin [0.50, 0.67): count=  176, weight=0.224
  Bin [0.67, 0.83): count=   62, weight=0.628
  Bin [0.83, 1.00): count=    7, weight=4.948
-------------------------------------------

  Pred range: [0.0727, 0.5899], std: 0.0863
  RMSE : 0.1513, R2: 0.2363, MAE: 0.1194, Spearman rho: 0.4772, Spearman p: 2.4273e-35, Pearson r: 0.4922, Pearson p: 8.1306e-38
  Pred range: [0.0860, 0.6047], std: 0.0887
  RMSE : 0.1557, R2: 0.1905, MAE: 0.1276, Spearman rho: 0.4744, Spearman p: 6.8030e-35, Pearson r: 0.4980, Pearson p: 8.4260e-39
  Pred range: [0.0608, 0.4740], std: 0.0783
  RMSE : 0.1519, R2: 0.2296, MAE: 0.1221, Spearman rho: 0.4738, Spearman p: 8.5602e-35, Pearson r: 0.4963, Pearson p: 1.6494e-38
  Pred range: [0.0200, 0.5787], std: 0.0856
  RMSE : 0.1569, R2: 0.1788, MAE: 0.1278, Spearman rho: 0.4384, Spearman p: 1.7533e-29, Pearson r: 0.4591, Pearson p: 1.6680e-32
[I 2026-04-28 01:15:09,820] Trial 33 finished with value: 0.15126066458951717 and parameters: {'learning_rate': 0.002258925262232437, 'batch_size': 4, 'num_epochs': 18, 'weight_decay': 0.0028748966674033523, 'depth_complex': 4, 'depth_moderate': 4, 'depth_simple': 2, 'dropout': 0.39230803534732683, 'se_reduction': 5, 'hidden_dim_min': 6, 'base_loss': 'mse', 'huber_delta': 0.07930543861250841, 'focal_gamma': 1.5067350114501947, 'n_bins': 6, 'scheduler_patience': 5, 'scheduler_factor': 0.5447056682694903, 'early_stopping_patience': 3}. Best is trial 22 with value: 0.14933273495596114.
Train: 2407 rows (1613 IDs),Test: 598 rows (404 IDs) 

n_features_x : 6, n_features_per_modality: [16, 23, 19, 17, 7, 4, 4, 4, 1, 4]

--- ImbalancedRegressionLoss initialized ---
  Bins: 8, Focal gamma: 1.2687916970662025, Base loss: huber
  Bin [0.00, 0.12): count=  760, weight=0.039
  Bin [0.12, 0.25): count=  700, weight=0.042
  Bin [0.25, 0.38): count=  438, weight=0.067
  Bin [0.38, 0.50): count=  264, weight=0.111
  Bin [0.50, 0.62): count=  157, weight=0.186
  Bin [0.62, 0.75): count=   60, weight=0.483
  Bin [0.75, 0.88): count=   24, weight=1.179
  Bin [0.88, 1.00): count=    4, weight=5.893
-------------------------------------------

  Pred range: [0.1901, 0.6915], std: 0.0889
  RMSE : 0.2170, R2: -0.5717, MAE: 0.1899, Spearman rho: 0.3874, Spearman p: 7.4921e-23, Pearson r: 0.4025, Pearson p: 1.0670e-24
  Pred range: [0.1621, 0.6794], std: 0.0937
  RMSE : 0.1969, R2: -0.2944, MAE: 0.1699, Spearman rho: 0.4238, Spearman p: 1.8548e-27, Pearson r: 0.4350, Pearson p: 5.3685e-29
  Pred range: [0.1207, 0.6228], std: 0.0909
  RMSE : 0.1694, R2: 0.0420, MAE: 0.1420, Spearman rho: 0.4463, Spearman p: 1.2822e-30, Pearson r: 0.4568, Pearson p: 3.7123e-32
  Pred range: [0.1726, 0.7549], std: 0.1043
  RMSE : 0.2105, R2: -0.4796, MAE: 0.1819, Spearman rho: 0.4522, Spearman p: 1.8027e-31, Pearson r: 0.4687, Pearson p: 5.4224e-34
  Pred range: [0.1346, 0.7475], std: 0.1072
  RMSE : 0.1844, R2: -0.1350, MAE: 0.1562, Spearman rho: 0.4694, Spearman p: 4.2030e-34, Pearson r: 0.4882, Pearson p: 3.8460e-37
  Pred range: [0.1510, 0.7726], std: 0.1102
  RMSE : 0.1950, R2: -0.2690, MAE: 0.1665, Spearman rho: 0.4730, Spearman p: 1.1634e-34, Pearson r: 0.4960, Pearson p: 1.8940e-38
