[I 2026-04-29 00:04:27,610] Trial 0 finished with value: 0.09085364396642441 and parameters: {'learning_rate': 0.0003450385569608915, 'batch_size': 6, 'num_epochs': 11, 'weight_decay': 6.595933446829832e-05, 'layers_PRS': 2, 'layers_SCZ15': 5, 'layers_ADHD9': 2, 'layers_ASD9': 4, 'layers_ACE15': 3, 'layers_ACE18': 3, 'layers_SUD18': 4, 'layers_SES': 4, 'layers_SEX': 4, 'dropout': 0.149629815330862, 'se_reduction': 5, 'hidden_dim_min': 8, 'base_loss': 'mse', 'huber_delta': 0.15780578422258573, 'focal_gamma': 2.8549161502623557, 'n_bins': 5, 'scheduler_patience': 4, 'scheduler_factor': 0.4419406691147032, 'early_stopping_patience': 8}. Best is trial 0 with value: 0.09085364396642441.
Train: 2407 rows (1613 IDs),Test: 598 rows (404 IDs) 

n_features_x : 6, n_features_per_modality: [16, 23, 19, 17, 7, 4, 4, 4, 1, 4]

--- ImbalancedRegressionLoss initialized ---
  Bins: 10, Focal gamma: 1.4232379003714626, Base loss: huber
  Bin [0.00, 0.10): count= 1010, weight=0.003
  Bin [0.10, 0.20): count=  866, weight=0.003
  Bin [0.20, 0.30): count=  386, weight=0.007
  Bin [0.30, 0.40): count=  111, weight=0.026
  Bin [0.40, 0.50): count=   23, weight=0.119
  Bin [0.50, 0.60): count=    9, weight=0.287
  Bin [0.60, 0.70): count=    2, weight=0.955
  Bin [0.70, 0.80): count=    0, weight=2.866
  Bin [0.80, 0.90): count=    0, weight=2.866
  Bin [0.90, 1.00): count=    0, weight=2.866
-------------------------------------------

  Pred range: [0.0488, 0.3542], std: 0.0499
  RMSE : 0.0914, R2: 0.1748, MAE: 0.0736, Spearman rho: 0.4256, Spearman p: 1.0551e-27, Pearson r: 0.4433, Pearson p: 3.5164e-30
  Pred range: [-0.0108, 0.3605], std: 0.0496
  RMSE : 0.0942, R2: 0.1228, MAE: 0.0765, Spearman rho: 0.3517, Spearman p: 7.5310e-19, Pearson r: 0.3771, Pearson p: 1.2233e-21
  Pred range: [0.0056, 0.3845], std: 0.0578
  RMSE : 0.0911, R2: 0.1806, MAE: 0.0725, Spearman rho: 0.4358, Spearman p: 4.0530e-29, Pearson r: 0.4503, Pearson p: 3.3784e-31
  Pred range: [0.0225, 0.3676], std: 0.0475
  RMSE : 0.0925, R2: 0.1545, MAE: 0.0745, Spearman rho: 0.3959, Spearman p: 7.0815e-24, Pearson r: 0.4127, Pearson p: 5.4246e-26
  Pred range: [0.0585, 0.4242], std: 0.0617
  RMSE : 0.1019, R2: -0.0266, MAE: 0.0836, Spearman rho: 0.4583, Spearman p: 2.1965e-32, Pearson r: 0.4622, Pearson p: 5.4877e-33
  Pred range: [-0.0091, 0.3568], std: 0.0598
  RMSE : 0.0916, R2: 0.1714, MAE: 0.0718, Spearman rho: 0.4414, Spearman p: 6.6628e-30, Pearson r: 0.4423, Pearson p: 4.9167e-30
  Pred range: [-0.0650, 0.3442], std: 0.0578
  RMSE : 0.0934, R2: 0.1373, MAE: 0.0738, Spearman rho: 0.3943, Spearman p: 1.1156e-23, Pearson r: 0.4069, Pearson p: 2.9514e-25
  Pred range: [0.0053, 0.3828], std: 0.0591
  RMSE : 0.1010, R2: -0.0076, MAE: 0.0824, Spearman rho: 0.4285, Spearman p: 4.2226e-28, Pearson r: 0.4381, Pearson p: 1.9362e-29
  Pred range: [-0.0145, 0.3939], std: 0.0604
  RMSE : 0.0918, R2: 0.1677, MAE: 0.0728, Spearman rho: 0.4388, Spearman p: 1.5397e-29, Pearson r: 0.4476, Pearson p: 8.4918e-31
  Pred range: [-0.0048, 0.3718], std: 0.0565
  RMSE : 0.0915, R2: 0.1729, MAE: 0.0734, Spearman rho: 0.4517, Spearman p: 2.1011e-31, Pearson r: 0.4621, Pearson p: 5.7088e-33
  Pred range: [-0.0008, 0.4183], std: 0.0660
  RMSE : 0.0920, R2: 0.1634, MAE: 0.0719, Spearman rho: 0.4519, Spearman p: 1.9882e-31, Pearson r: 0.4582, Pearson p: 2.2617e-32
[I 2026-04-29 00:05:16,473] Trial 1 finished with value: 0.09105877692401484 and parameters: {'learning_rate': 0.0049343621540916234, 'batch_size': 8, 'num_epochs': 18, 'weight_decay': 0.000719287662459365, 'layers_PRS': 2, 'layers_SCZ15': 4, 'layers_ADHD9': 3, 'layers_ASD9': 3, 'layers_ACE15': 2, 'layers_ACE18': 2, 'layers_SUD18': 5, 'layers_SES': 2, 'layers_SEX': 4, 'dropout': 0.3865153433541202, 'se_reduction': 7, 'hidden_dim_min': 12, 'base_loss': 'huber', 'huber_delta': 0.1112710018461958, 'focal_gamma': 1.4232379003714626, 'n_bins': 10, 'scheduler_patience': 3, 'scheduler_factor': 0.4240663042296575, 'early_stopping_patience': 8}. Best is trial 0 with value: 0.09085364396642441.
Train: 2407 rows (1613 IDs),Test: 598 rows (404 IDs) 

n_features_x : 6, n_features_per_modality: [16, 23, 19, 17, 7, 4, 4, 4, 1, 4]

--- ImbalancedRegressionLoss initialized ---
  Bins: 17, Focal gamma: 1.3693971721867824, Base loss: mse
  Bin [0.00, 0.06): count=  650, weight=0.004
  Bin [0.06, 0.12): count=  530, weight=0.005
  Bin [0.12, 0.18): count=  536, weight=0.005
  Bin [0.18, 0.24): count=  299, weight=0.009
  Bin [0.24, 0.29): count=  247, weight=0.011
  Bin [0.29, 0.35): count=   91, weight=0.029
  Bin [0.35, 0.41): count=   20, weight=0.127
  Bin [0.41, 0.47): count=   16, weight=0.157
  Bin [0.47, 0.53): count=   10, weight=0.243
  Bin [0.53, 0.59): count=    6, weight=0.382
  Bin [0.59, 0.65): count=    1, weight=1.336
  Bin [0.65, 0.71): count=    1, weight=1.336
  Bin [0.71, 0.76): count=    0, weight=2.671
  Bin [0.76, 0.82): count=    0, weight=2.671
  Bin [0.82, 0.88): count=    0, weight=2.671
  Bin [0.88, 0.94): count=    0, weight=2.671
  Bin [0.94, 1.00): count=    0, weight=2.671
-------------------------------------------

  Pred range: [0.0090, 0.4541], std: 0.0638
  RMSE : 0.1033, R2: -0.0542, MAE: 0.0830, Spearman rho: 0.3394, Spearman p: 1.3703e-17, Pearson r: 0.3391, Pearson p: 1.4767e-17
  Pred range: [0.0146, 0.4166], std: 0.0604
  RMSE : 0.0993, R2: 0.0259, MAE: 0.0797, Spearman rho: 0.3576, Spearman p: 1.7610e-19, Pearson r: 0.3617, Pearson p: 6.3173e-20
  Pred range: [0.0253, 0.4056], std: 0.0591
  RMSE : 0.0996, R2: 0.0191, MAE: 0.0804, Spearman rho: 0.3683, Spearman p: 1.1878e-20, Pearson r: 0.3754, Pearson p: 1.8874e-21
  Pred range: [0.0343, 0.4135], std: 0.0589
  RMSE : 0.1014, R2: -0.0158, MAE: 0.0824, Spearman rho: 0.3742, Spearman p: 2.5616e-21, Pearson r: 0.3829, Pearson p: 2.5873e-22
  Pred range: [0.0349, 0.4068], std: 0.0580
  RMSE : 0.0988, R2: 0.0344, MAE: 0.0800, Spearman rho: 0.3816, Spearman p: 3.6484e-22, Pearson r: 0.3928, Pearson p: 1.6840e-23
  Pred range: [0.0367, 0.3945], std: 0.0565
  RMSE : 0.0970, R2: 0.0705, MAE: 0.0783, Spearman rho: 0.3855, Spearman p: 1.2609e-22, Pearson r: 0.3996, Pearson p: 2.4882e-24
  Pred range: [0.0417, 0.3945], std: 0.0556
  RMSE : 0.0970, R2: 0.0704, MAE: 0.0785, Spearman rho: 0.3877, Spearman p: 6.9762e-23, Pearson r: 0.4033, Pearson p: 8.6238e-25
  Pred range: [0.0469, 0.4049], std: 0.0562
  RMSE : 0.0984, R2: 0.0429, MAE: 0.0799, Spearman rho: 0.3912, Spearman p: 2.6605e-23, Pearson r: 0.4079, Pearson p: 2.2413e-25
  Pred range: [0.0487, 0.4002], std: 0.0553
  RMSE : 0.0972, R2: 0.0664, MAE: 0.0788, Spearman rho: 0.3947, Spearman p: 1.0022e-23, Pearson r: 0.4126, Pearson p: 5.6070e-26
  Pred range: [0.0514, 0.4031], std: 0.0550
  RMSE : 0.0974, R2: 0.0632, MAE: 0.0790, Spearman rho: 0.3973, Spearman p: 4.7370e-24, Pearson r: 0.4155, Pearson p: 2.3349e-26
  Pred range: [0.0502, 0.3958], std: 0.0540
  RMSE : 0.0961, R2: 0.0865, MAE: 0.0779, Spearman rho: 0.3995, Spearman p: 2.5120e-24, Pearson r: 0.4179, Pearson p: 1.1204e-26
  Pred range: [0.0527, 0.3990], std: 0.0541
  RMSE : 0.0967, R2: 0.0758, MAE: 0.0784, Spearman rho: 0.4006, Spearman p: 1.8577e-24, Pearson r: 0.4200, Pearson p: 5.9677e-27
  Pred range: [0.0489, 0.3867], std: 0.0532
  RMSE : 0.0948, R2: 0.1128, MAE: 0.0766, Spearman rho: 0.4038, Spearman p: 7.3014e-25, Pearson r: 0.4235, Pearson p: 2.0136e-27
  Pred range: [0.0515, 0.3843], std: 0.0528
  RMSE : 0.0950, R2: 0.1083, MAE: 0.0769, Spearman rho: 0.4047, Spearman p: 5.6869e-25, Pearson r: 0.4251, Pearson p: 1.2257e-27
  Pred range: [0.0551, 0.4017], std: 0.0543
  RMSE : 0.0970, R2: 0.0709, MAE: 0.0787, Spearman rho: 0.4063, Spearman p: 3.5350e-25, Pearson r: 0.4266, Pearson p: 7.5489e-28
  Pred range: [0.0565, 0.4052], std: 0.0548
  RMSE : 0.0976, R2: 0.0595, MAE: 0.0792, Spearman rho: 0.4086, Spearman p: 1.7936e-25, Pearson r: 0.4287, Pearson p: 3.9890e-28
  Pred range: [0.0480, 0.3840], std: 0.0530
  RMSE : 0.0936, R2: 0.1336, MAE: 0.0756, Spearman rho: 0.4096, Spearman p: 1.3343e-25, Pearson r: 0.4310, Pearson p: 1.8898e-28
  Pred range: [0.0560, 0.4037], std: 0.0545
  RMSE : 0.0968, R2: 0.0750, MAE: 0.0785, Spearman rho: 0.4104, Spearman p: 1.0556e-25, Pearson r: 0.4315, Pearson p: 1.6231e-28
  Pred range: [0.0556, 0.4046], std: 0.0546
  RMSE : 0.0963, R2: 0.0841, MAE: 0.0780, Spearman rho: 0.4120, Spearman p: 6.6668e-26, Pearson r: 0.4331, Pearson p: 9.6621e-29
  Pred range: [0.0573, 0.4041], std: 0.0547
  RMSE : 0.0967, R2: 0.0767, MAE: 0.0784, Spearman rho: 0.4143, Spearman p: 3.3689e-26, Pearson r: 0.4353, Pearson p: 4.8703e-29
  Pred range: [0.0543, 0.3906], std: 0.0537
  RMSE : 0.0948, R2: 0.1114, MAE: 0.0768, Spearman rho: 0.4172, Spearman p: 1.4054e-26, Pearson r: 0.4379, Pearson p: 2.0681e-29
  Pred range: [0.0582, 0.3976], std: 0.0540
  RMSE : 0.0963, R2: 0.0839, MAE: 0.0781, Spearman rho: 0.4156, Spearman p: 2.2656e-26, Pearson r: 0.4363, Pearson p: 3.4494e-29
  Pred range: [0.0611, 0.4012], std: 0.0544
  RMSE : 0.0976, R2: 0.0578, MAE: 0.0794, Spearman rho: 0.4164, Spearman p: 1.7522e-26, Pearson r: 0.4370, Pearson p: 2.7489e-29
[I 2026-04-29 00:07:20,425] Trial 2 finished with value: 0.09363417125920742 and parameters: {'learning_rate': 6.503024468842336e-05, 'batch_size': 6, 'num_epochs': 24, 'weight_decay': 0.0008052837504272792, 'layers_PRS': 4, 'layers_SCZ15': 5, 'layers_ADHD9': 5, 'layers_ASD9': 2, 'layers_ACE15': 1, 'layers_ACE18': 1, 'layers_SUD18': 1, 'layers_SES': 1, 'layers_SEX': 2, 'dropout': 0.3105688063630544, 'se_reduction': 5, 'hidden_dim_min': 15, 'base_loss': 'mse', 'huber_delta': 0.043650995488147014, 'focal_gamma': 1.3693971721867824, 'n_bins': 17, 'scheduler_patience': 5, 'scheduler_factor': 0.3256976371304872, 'early_stopping_patience': 6}. Best is trial 0 with value: 0.09085364396642441.
Train: 2407 rows (1613 IDs),Test: 598 rows (404 IDs) 

n_features_x : 6, n_features_per_modality: [16, 23, 19, 17, 7, 4, 4, 4, 1, 4]

--- ImbalancedRegressionLoss initialized ---
  Bins: 12, Focal gamma: 1.1632018511426225, Base loss: mse
  Bin [0.00, 0.08): count=  828, weight=0.003
  Bin [0.08, 0.17): count=  710, weight=0.004
  Bin [0.17, 0.25): count=  575, weight=0.005
  Bin [0.25, 0.33): count=  214, weight=0.013
  Bin [0.33, 0.42): count=   55, weight=0.051
  Bin [0.42, 0.50): count=   14, weight=0.191
  Bin [0.50, 0.58): count=    9, weight=0.286
  Bin [0.58, 0.67): count=    1, weight=1.431
  Bin [0.67, 0.75): count=    1, weight=1.431
  Bin [0.75, 0.83): count=    0, weight=2.862
  Bin [0.83, 0.92): count=    0, weight=2.862
  Bin [0.92, 1.00): count=    0, weight=2.862
-------------------------------------------

  Pred range: [0.0124, 0.3728], std: 0.0513
  RMSE : 0.0955, R2: 0.0996, MAE: 0.0762, Spearman rho: 0.3832, Spearman p: 2.3806e-22, Pearson r: 0.3838, Pearson p: 1.9889e-22
  Pred range: [0.0457, 0.4259], std: 0.0608
  RMSE : 0.1057, R2: -0.1050, MAE: 0.0864, Spearman rho: 0.4180, Spearman p: 1.1030e-26, Pearson r: 0.4222, Pearson p: 3.0053e-27
  Pred range: [0.0571, 0.4023], std: 0.0544
  RMSE : 0.0973, R2: 0.0647, MAE: 0.0789, Spearman rho: 0.4307, Spearman p: 2.1274e-28, Pearson r: 0.4373, Pearson p: 2.5397e-29
  Pred range: [0.0502, 0.3887], std: 0.0500
  RMSE : 0.0921, R2: 0.1616, MAE: 0.0742, Spearman rho: 0.4373, Spearman p: 2.5541e-29, Pearson r: 0.4432, Pearson p: 3.6628e-30
  Pred range: [0.0537, 0.4187], std: 0.0518
  RMSE : 0.0926, R2: 0.1526, MAE: 0.0745, Spearman rho: 0.4356, Spearman p: 4.4299e-29, Pearson r: 0.4428, Pearson p: 4.1451e-30
  Pred range: [0.0713, 0.4632], std: 0.0611
  RMSE : 0.1047, R2: -0.0830, MAE: 0.0851, Spearman rho: 0.4324, Spearman p: 1.2219e-28, Pearson r: 0.4399, Pearson p: 1.0730e-29
  Pred range: [0.0671, 0.4440], std: 0.0584
  RMSE : 0.1008, R2: -0.0032, MAE: 0.0819, Spearman rho: 0.4435, Spearman p: 3.2525e-30, Pearson r: 0.4534, Pearson p: 1.1895e-31
  Pred range: [0.0175, 0.4131], std: 0.0546
  RMSE : 0.0924, R2: 0.1555, MAE: 0.0742, Spearman rho: 0.4497, Spearman p: 4.1403e-31, Pearson r: 0.4566, Pearson p: 3.9416e-32
  Pred range: [0.0534, 0.4412], std: 0.0647
  RMSE : 0.0996, R2: 0.0206, MAE: 0.0802, Spearman rho: 0.4498, Spearman p: 4.0079e-31, Pearson r: 0.4575, Pearson p: 2.8587e-32
  Pred range: [0.0341, 0.3935], std: 0.0582
  RMSE : 0.0913, R2: 0.1766, MAE: 0.0720, Spearman rho: 0.4423, Spearman p: 4.8889e-30, Pearson r: 0.4481, Pearson p: 7.1154e-31
  Pred range: [0.0498, 0.4325], std: 0.0588
  RMSE : 0.0947, R2: 0.1144, MAE: 0.0761, Spearman rho: 0.4512, Spearman p: 2.5235e-31, Pearson r: 0.4585, Pearson p: 2.0539e-32
  Pred range: [0.0017, 0.3846], std: 0.0551
  RMSE : 0.0903, R2: 0.1936, MAE: 0.0717, Spearman rho: 0.4459, Spearman p: 1.4771e-30, Pearson r: 0.4558, Pearson p: 5.1004e-32
  Pred range: [0.0346, 0.4184], std: 0.0545
  RMSE : 0.0937, R2: 0.1329, MAE: 0.0756, Spearman rho: 0.4498, Spearman p: 4.0785e-31, Pearson r: 0.4590, Pearson p: 1.6978e-32
  Pred range: [0.0456, 0.4544], std: 0.0610
  RMSE : 0.1004, R2: 0.0038, MAE: 0.0816, Spearman rho: 0.4497, Spearman p: 4.1121e-31, Pearson r: 0.4570, Pearson p: 3.3689e-32
  Pred range: [0.0509, 0.4389], std: 0.0612
  RMSE : 0.0952, R2: 0.1053, MAE: 0.0764, Spearman rho: 0.4547, Spearman p: 7.4484e-32, Pearson r: 0.4617, Pearson p: 6.6931e-33
  Pred range: [0.0095, 0.3903], std: 0.0535
  RMSE : 0.0897, R2: 0.2045, MAE: 0.0712, Spearman rho: 0.4524, Spearman p: 1.6315e-31, Pearson r: 0.4618, Pearson p: 6.3148e-33
  Pred range: [0.0235, 0.3896], std: 0.0533
  RMSE : 0.0906, R2: 0.1881, MAE: 0.0722, Spearman rho: 0.4409, Spearman p: 7.7044e-30, Pearson r: 0.4519, Pearson p: 1.9691e-31
  Pred range: [0.0641, 0.4640], std: 0.0601
  RMSE : 0.1013, R2: -0.0137, MAE: 0.0828, Spearman rho: 0.4568, Spearman p: 3.6999e-32, Pearson r: 0.4666, Pearson p: 1.1729e-33
  Pred range: [0.0500, 0.4359], std: 0.0572
  RMSE : 0.0974, R2: 0.0627, MAE: 0.0792, Spearman rho: 0.4459, Spearman p: 1.4836e-30, Pearson r: 0.4568, Pearson p: 3.5981e-32
  Pred range: [0.0656, 0.4524], std: 0.0606
  RMSE : 0.1011, R2: -0.0108, MAE: 0.0823, Spearman rho: 0.4410, Spearman p: 7.4228e-30, Pearson r: 0.4512, Pearson p: 2.4904e-31
  Pred range: [0.0430, 0.4015], std: 0.0569
  RMSE : 0.0912, R2: 0.1780, MAE: 0.0726, Spearman rho: 0.4462, Spearman p: 1.3609e-30, Pearson r: 0.4582, Pearson p: 2.2338e-32
  Pred range: [0.0591, 0.4177], std: 0.0578
  RMSE : 0.0960, R2: 0.0887, MAE: 0.0778, Spearman rho: 0.4463, Spearman p: 1.2987e-30, Pearson r: 0.4559, Pearson p: 5.0215e-32
  Pred range: [0.0506, 0.4121], std: 0.0555
  RMSE : 0.0934, R2: 0.1385, MAE: 0.0753, Spearman rho: 0.4494, Spearman p: 4.5553e-31, Pearson r: 0.4591, Pearson p: 1.6367e-32
  Pred range: [0.0504, 0.4089], std: 0.0549
  RMSE : 0.0931, R2: 0.1438, MAE: 0.0750, Spearman rho: 0.4484, Spearman p: 6.3649e-31, Pearson r: 0.4584, Pearson p: 2.1283e-32
[I 2026-04-29 00:09:21,907] Trial 3 finished with value: 0.08972527632997604 and parameters: {'learning_rate': 0.0010666237512537942, 'batch_size': 6, 'num_epochs': 30, 'weight_decay': 0.0014152409171748774, 'layers_PRS': 1, 'layers_SCZ15': 3, 'layers_ADHD9': 5, 'layers_ASD9': 2, 'layers_ACE15': 1, 'layers_ACE18': 3, 'layers_SUD18': 1, 'layers_SES': 1, 'layers_SEX': 5, 'dropout': 0.2182258461783861, 'se_reduction': 5, 'hidden_dim_min': 3, 'base_loss': 'mse', 'huber_delta': 0.0927877834179746, 'focal_gamma': 1.1632018511426225, 'n_bins': 12, 'scheduler_patience': 4, 'scheduler_factor': 0.6498865704718182, 'early_stopping_patience': 8}. Best is trial 3 with value: 0.08972527632997604.
Train: 2407 rows (1613 IDs),Test: 598 rows (404 IDs) 

n_features_x : 6, n_features_per_modality: [16, 23, 19, 17, 7, 4, 4, 4, 1, 4]

--- ImbalancedRegressionLoss initialized ---
  Bins: 6, Focal gamma: 1.4597666014867623, Base loss: huber
  Bin [0.00, 0.17): count= 1538, weight=0.002
  Bin [0.17, 0.33): count=  789, weight=0.005
  Bin [0.33, 0.50): count=   69, weight=0.053
  Bin [0.50, 0.67): count=   10, weight=0.339
  Bin [0.67, 0.83): count=    1, weight=1.867
  Bin [0.83, 1.00): count=    0, weight=3.733
-------------------------------------------

  Pred range: [0.1233, 0.3923], std: 0.0393
  RMSE : 0.1101, R2: -0.1969, MAE: 0.0914, Spearman rho: 0.4126, Spearman p: 5.5431e-26, Pearson r: 0.4212, Pearson p: 4.0707e-27
  Pred range: [0.0262, 0.3450], std: 0.0522
  RMSE : 0.0934, R2: 0.1383, MAE: 0.0727, Spearman rho: 0.4394, Spearman p: 1.2675e-29, Pearson r: 0.4462, Pearson p: 1.3409e-30
  Pred range: [-0.0040, 0.3512], std: 0.0511
  RMSE : 0.0892, R2: 0.2141, MAE: 0.0701, Spearman rho: 0.4655, Spearman p: 1.7366e-33, Pearson r: 0.4665, Pearson p: 1.1951e-33
  Pred range: [0.0285, 0.3692], std: 0.0502
  RMSE : 0.0922, R2: 0.1596, MAE: 0.0743, Spearman rho: 0.4501, Spearman p: 3.5864e-31, Pearson r: 0.4500, Pearson p: 3.7675e-31
  Pred range: [0.0731, 0.4291], std: 0.0622
  RMSE : 0.0988, R2: 0.0348, MAE: 0.0799, Spearman rho: 0.4374, Spearman p: 2.4828e-29, Pearson r: 0.4394, Pearson p: 1.2640e-29
  Pred range: [0.0871, 0.3906], std: 0.0504
  RMSE : 0.0978, R2: 0.0556, MAE: 0.0800, Spearman rho: 0.4368, Spearman p: 2.9362e-29, Pearson r: 0.4370, Pearson p: 2.7543e-29
  Pred range: [0.0493, 0.3757], std: 0.0577
  RMSE : 0.0921, R2: 0.1623, MAE: 0.0742, Spearman rho: 0.4657, Spearman p: 1.6219e-33, Pearson r: 0.4665, Pearson p: 1.2030e-33
  Pred range: [0.0993, 0.4510], std: 0.0503
  RMSE : 0.1051, R2: -0.0907, MAE: 0.0856, Spearman rho: 0.4303, Spearman p: 2.3558e-28, Pearson r: 0.4145, Pearson p: 3.1753e-26
  Pred range: [0.0810, 0.4115], std: 0.0502
  RMSE : 0.0936, R2: 0.1337, MAE: 0.0756, Spearman rho: 0.4601, Spearman p: 1.1504e-32, Pearson r: 0.4491, Pearson p: 5.0930e-31
[I 2026-04-29 00:10:10,458] Trial 4 finished with value: 0.08917975215600402 and parameters: {'learning_rate': 0.0047777604842542875, 'batch_size': 6, 'num_epochs': 17, 'weight_decay': 4.322996835482004e-05, 'layers_PRS': 1, 'layers_SCZ15': 4, 'layers_ADHD9': 4, 'layers_ASD9': 4, 'layers_ACE15': 4, 'layers_ACE18': 2, 'layers_SUD18': 2, 'layers_SES': 1, 'layers_SEX': 1, 'dropout': 0.1618323690468092, 'se_reduction': 6, 'hidden_dim_min': 13, 'base_loss': 'huber', 'huber_delta': 0.14240414430157347, 'focal_gamma': 1.4597666014867623, 'n_bins': 6, 'scheduler_patience': 5, 'scheduler_factor': 0.4462293776913201, 'early_stopping_patience': 6}. Best is trial 4 with value: 0.08917975215600402.
Train: 2407 rows (1613 IDs),Test: 598 rows (404 IDs) 

n_features_x : 6, n_features_per_modality: [16, 23, 19, 17, 7, 4, 4, 4, 1, 4]

--- ImbalancedRegressionLoss initialized ---
  Bins: 15, Focal gamma: 2.8165219383656472, Base loss: mse
  Bin [0.00, 0.07): count=  828, weight=0.003
  Bin [0.07, 0.13): count=  542, weight=0.005
  Bin [0.13, 0.20): count=  506, weight=0.006
  Bin [0.20, 0.27): count=  318, weight=0.009
  Bin [0.27, 0.33): count=  133, weight=0.021
  Bin [0.33, 0.40): count=   46, weight=0.060
  Bin [0.40, 0.47): count=   16, weight=0.166
  Bin [0.47, 0.53): count=   10, weight=0.256
  Bin [0.53, 0.60): count=    6, weight=0.402
  Bin [0.60, 0.67): count=    1, weight=1.407
  Bin [0.67, 0.73): count=    1, weight=1.407
  Bin [0.73, 0.80): count=    0, weight=2.815
  Bin [0.80, 0.87): count=    0, weight=2.815
  Bin [0.87, 0.93): count=    0, weight=2.815
  Bin [0.93, 1.00): count=    0, weight=2.815
-------------------------------------------

  Pred range: [0.1152, 0.5927], std: 0.0573
  RMSE : 0.1908, R2: -2.5959, MAE: 0.1712, Spearman rho: 0.4187, Spearman p: 8.8117e-27, Pearson r: 0.4294, Pearson p: 3.1692e-28
  Pred range: [-0.0092, 0.3930], std: 0.0507
  RMSE : 0.0966, R2: 0.0782, MAE: 0.0782, Spearman rho: 0.4027, Spearman p: 1.0210e-24, Pearson r: 0.4105, Pearson p: 1.0492e-25
  Pred range: [-0.0080, 0.3467], std: 0.0405
  RMSE : 0.0942, R2: 0.1230, MAE: 0.0756, Spearman rho: 0.3483, Spearman p: 1.7053e-18, Pearson r: 0.3622, Pearson p: 5.6151e-20
  Pred range: [-0.0544, 0.3383], std: 0.0452
  RMSE : 0.1022, R2: -0.0330, MAE: 0.0851, Spearman rho: 0.2856, Spearman p: 1.1015e-12, Pearson r: 0.3009, Pearson p: 5.5678e-14
  Pred range: [0.1081, 0.4182], std: 0.0463
  RMSE : 0.1186, R2: -0.3892, MAE: 0.0995, Spearman rho: 0.3273, Spearman p: 2.1263e-16, Pearson r: 0.3664, Pearson p: 1.9459e-20
  Pred range: [0.0906, 0.3892], std: 0.0401
  RMSE : 0.1045, R2: -0.0794, MAE: 0.0867, Spearman rho: 0.3730, Spearman p: 3.5532e-21, Pearson r: 0.3845, Pearson p: 1.6439e-22
  Pred range: [-0.0232, 0.3293], std: 0.0482
  RMSE : 0.0965, R2: 0.0795, MAE: 0.0779, Spearman rho: 0.3326, Spearman p: 6.5837e-17, Pearson r: 0.3358, Pearson p: 3.1661e-17
