[I 2026-04-28 00:57:10,950] Trial 18 pruned. 
Train: 2407 rows (1613 IDs),Test: 598 rows (404 IDs) 

n_features_x : 6, n_features_per_modality: [16, 23, 19, 17, 7, 4, 4, 4, 1, 4]

--- ImbalancedRegressionLoss initialized ---
  Bins: 19, Focal gamma: 1.8441548191805934, Base loss: mse
  Bin [0.00, 0.05): count=  172, weight=0.055
  Bin [0.05, 0.11): count=  413, weight=0.023
  Bin [0.11, 0.16): count=  376, weight=0.025
  Bin [0.16, 0.21): count=  204, weight=0.046
  Bin [0.21, 0.26): count=  295, weight=0.032
  Bin [0.26, 0.32): count=  239, weight=0.039
  Bin [0.32, 0.37): count=  199, weight=0.047
  Bin [0.37, 0.42): count=   73, weight=0.128
  Bin [0.42, 0.47): count=  134, weight=0.070
  Bin [0.47, 0.53): count=  108, weight=0.087
  Bin [0.53, 0.58): count=   78, weight=0.120
  Bin [0.58, 0.63): count=   28, weight=0.327
  Bin [0.63, 0.68): count=   36, weight=0.256
  Bin [0.68, 0.74): count=   24, weight=0.379
  Bin [0.74, 0.79): count=   19, weight=0.474
  Bin [0.79, 0.84): count=    2, weight=3.157
  Bin [0.84, 0.89): count=    4, weight=1.894
  Bin [0.89, 0.95): count=    3, weight=2.368
  Bin [0.95, 1.00): count=    0, weight=9.472
-------------------------------------------

  Pred range: [0.1215, 0.6506], std: 0.0831
  RMSE : 0.1691, R2: 0.0452, MAE: 0.1415, Spearman rho: 0.4397, Spearman p: 1.1408e-29, Pearson r: 0.4455, Pearson p: 1.6990e-30
  Pred range: [0.1070, 0.6257], std: 0.0815
  RMSE : 0.1561, R2: 0.1868, MAE: 0.1267, Spearman rho: 0.4653, Spearman p: 1.8503e-33, Pearson r: 0.4750, Pearson p: 5.4663e-35
  Pred range: [0.1373, 0.7113], std: 0.0956
  RMSE : 0.1741, R2: -0.0122, MAE: 0.1469, Spearman rho: 0.4829, Spearman p: 2.8682e-36, Pearson r: 0.4936, Pearson p: 4.8082e-38
  Pred range: [0.1186, 0.6217], std: 0.0836
  RMSE : 0.1554, R2: 0.1941, MAE: 0.1277, Spearman rho: 0.4913, Spearman p: 1.1691e-37, Pearson r: 0.5044, Pearson p: 6.4548e-40
  Pred range: [0.1148, 0.6472], std: 0.0878
  RMSE : 0.1538, R2: 0.2106, MAE: 0.1256, Spearman rho: 0.4901, Spearman p: 1.8300e-37, Pearson r: 0.5071, Pearson p: 2.1311e-40
  Pred range: [0.1236, 0.6546], std: 0.0873
  RMSE : 0.1589, R2: 0.1573, MAE: 0.1320, Spearman rho: 0.4891, Spearman p: 2.7228e-37, Pearson r: 0.5069, Pearson p: 2.3620e-40
  Pred range: [0.1079, 0.6373], std: 0.0909
  RMSE : 0.1525, R2: 0.2239, MAE: 0.1238, Spearman rho: 0.4889, Spearman p: 2.9283e-37, Pearson r: 0.5088, Pearson p: 1.0781e-40
  Pred range: [0.0623, 0.5567], std: 0.0769
  RMSE : 0.1502, R2: 0.2472, MAE: 0.1179, Spearman rho: 0.4790, Spearman p: 1.2440e-35, Pearson r: 0.5013, Pearson p: 2.2779e-39
  Pred range: [0.1023, 0.6485], std: 0.0906
  RMSE : 0.1578, R2: 0.1683, MAE: 0.1304, Spearman rho: 0.4847, Spearman p: 1.4831e-36, Pearson r: 0.5065, Pearson p: 2.7128e-40
  Pred range: [0.0558, 0.6352], std: 0.0869
  RMSE : 0.1533, R2: 0.2156, MAE: 0.1250, Spearman rho: 0.4861, Spearman p: 8.7998e-37, Pearson r: 0.5074, Pearson p: 1.8762e-40
  Pred range: [0.0632, 0.6621], std: 0.0934
  RMSE : 0.1534, R2: 0.2141, MAE: 0.1248, Spearman rho: 0.4906, Spearman p: 1.5319e-37, Pearson r: 0.5100, Pearson p: 6.5760e-41
  Pred range: [0.0627, 0.7185], std: 0.0960
  RMSE : 0.1609, R2: 0.1355, MAE: 0.1338, Spearman rho: 0.4923, Spearman p: 7.9185e-38, Pearson r: 0.5114, Pearson p: 3.7305e-41
[I 2026-04-28 00:58:50,389] Trial 19 finished with value: 0.15017407791773202 and parameters: {'learning_rate': 0.0003594864268833665, 'batch_size': 4, 'num_epochs': 17, 'weight_decay': 9.972782838001843e-05, 'depth_complex': 4, 'depth_moderate': 3, 'depth_simple': 2, 'dropout': 0.32332063316081167, 'se_reduction': 5, 'hidden_dim_min': 7, 'base_loss': 'mse', 'huber_delta': 0.07876515544304084, 'focal_gamma': 1.8441548191805934, 'n_bins': 19, 'scheduler_patience': 5, 'scheduler_factor': 0.3931910200206054, 'early_stopping_patience': 4}. Best is trial 16 with value: 0.14933282226777683.
Train: 2407 rows (1613 IDs),Test: 598 rows (404 IDs) 

n_features_x : 6, n_features_per_modality: [16, 23, 19, 17, 7, 4, 4, 4, 1, 4]

--- ImbalancedRegressionLoss initialized ---
  Bins: 12, Focal gamma: 0.7972583779873671, Base loss: mse
  Bin [0.00, 0.08): count=  383, weight=0.051
  Bin [0.08, 0.17): count=  578, weight=0.034
  Bin [0.17, 0.25): count=  499, weight=0.039
  Bin [0.25, 0.33): count=  349, weight=0.055
  Bin [0.33, 0.42): count=  162, weight=0.119
  Bin [0.42, 0.50): count=  191, weight=0.101
  Bin [0.50, 0.58): count=  129, weight=0.149
  Bin [0.58, 0.67): count=   47, weight=0.404
  Bin [0.67, 0.75): count=   41, weight=0.462
  Bin [0.75, 0.83): count=   21, weight=0.882
  Bin [0.83, 0.92): count=    5, weight=3.235
  Bin [0.92, 1.00): count=    2, weight=6.469
-------------------------------------------

  Pred range: [0.0059, 0.2953], std: 0.0474
  RMSE : 0.1985, R2: -0.3158, MAE: 0.1433, Spearman rho: 0.1935, Spearman p: 1.8576e-06, Pearson r: 0.1884, Pearson p: 3.4962e-06
  Pred range: [0.0626, 0.4593], std: 0.0604
  RMSE : 0.1698, R2: 0.0377, MAE: 0.1305, Spearman rho: 0.2337, Spearman p: 7.3059e-09, Pearson r: 0.2348, Pearson p: 6.2360e-09
  Pred range: [0.0954, 0.5681], std: 0.0701
  RMSE : 0.1747, R2: -0.0190, MAE: 0.1422, Spearman rho: 0.2529, Spearman p: 3.5346e-10, Pearson r: 0.2583, Pearson p: 1.4262e-10
  Pred range: [0.1024, 0.5899], std: 0.0719
  RMSE : 0.1767, R2: -0.0419, MAE: 0.1452, Spearman rho: 0.2665, Spearman p: 3.5276e-11, Pearson r: 0.2737, Pearson p: 9.7139e-12
  Pred range: [0.1076, 0.6061], std: 0.0733
  RMSE : 0.1780, R2: -0.0577, MAE: 0.1473, Spearman rho: 0.2778, Spearman p: 4.6418e-12, Pearson r: 0.2884, Pearson p: 6.4468e-13
  Pred range: [0.1118, 0.6155], std: 0.0742
  RMSE : 0.1786, R2: -0.0643, MAE: 0.1483, Spearman rho: 0.2897, Spearman p: 4.9728e-13, Pearson r: 0.3030, Pearson p: 3.6731e-14
[I 2026-04-28 00:59:47,598] Trial 20 pruned. 
Train: 2407 rows (1613 IDs),Test: 598 rows (404 IDs) 

n_features_x : 6, n_features_per_modality: [16, 23, 19, 17, 7, 4, 4, 4, 1, 4]

--- ImbalancedRegressionLoss initialized ---
  Bins: 6, Focal gamma: 1.2881932535486849, Base loss: mse
  Bin [0.00, 0.17): count=  961, weight=0.041
  Bin [0.17, 0.33): count=  848, weight=0.047
  Bin [0.33, 0.50): count=  353, weight=0.112
  Bin [0.50, 0.67): count=  176, weight=0.224
  Bin [0.67, 0.83): count=   62, weight=0.628
  Bin [0.83, 1.00): count=    7, weight=4.948
-------------------------------------------

  Pred range: [0.1211, 0.5973], std: 0.0784
  RMSE : 0.1655, R2: 0.0861, MAE: 0.1376, Spearman rho: 0.4295, Spearman p: 3.0496e-28, Pearson r: 0.4445, Pearson p: 2.3408e-30
  Pred range: [0.1273, 0.6416], std: 0.0858
  RMSE : 0.1667, R2: 0.0722, MAE: 0.1398, Spearman rho: 0.4618, Spearman p: 6.3404e-33, Pearson r: 0.4776, Pearson p: 2.0928e-35
  Pred range: [0.1381, 0.6672], std: 0.0848
  RMSE : 0.1726, R2: 0.0051, MAE: 0.1464, Spearman rho: 0.4689, Spearman p: 5.0875e-34, Pearson r: 0.4883, Pearson p: 3.6971e-37
  Pred range: [0.1216, 0.6960], std: 0.0929
  RMSE : 0.1589, R2: 0.1577, MAE: 0.1318, Spearman rho: 0.4834, Spearman p: 2.4525e-36, Pearson r: 0.5066, Pearson p: 2.6833e-40
  Pred range: [0.1251, 0.7254], std: 0.0939
  RMSE : 0.1639, R2: 0.1036, MAE: 0.1374, Spearman rho: 0.4833, Spearman p: 2.4734e-36, Pearson r: 0.5115, Pearson p: 3.4878e-41
  Pred range: [0.1061, 0.6748], std: 0.0877
  RMSE : 0.1520, R2: 0.2287, MAE: 0.1243, Spearman rho: 0.4913, Spearman p: 1.1906e-37, Pearson r: 0.5188, Pearson p: 1.6339e-42
  Pred range: [0.0965, 0.6192], std: 0.0790
  RMSE : 0.1522, R2: 0.2271, MAE: 0.1245, Spearman rho: 0.4857, Spearman p: 1.0113e-36, Pearson r: 0.5145, Pearson p: 1.0227e-41
  Pred range: [0.0642, 0.6767], std: 0.0896
  RMSE : 0.1516, R2: 0.2330, MAE: 0.1230, Spearman rho: 0.4855, Spearman p: 1.0695e-36, Pearson r: 0.5118, Pearson p: 3.0761e-41
  Pred range: [0.0374, 0.6426], std: 0.0890
  RMSE : 0.1503, R2: 0.2458, MAE: 0.1214, Spearman rho: 0.4898, Spearman p: 2.0906e-37, Pearson r: 0.5180, Pearson p: 2.3430e-42
  Pred range: [0.1005, 0.7240], std: 0.1050
  RMSE : 0.1607, R2: 0.1376, MAE: 0.1329, Spearman rho: 0.4914, Spearman p: 1.1387e-37, Pearson r: 0.5192, Pearson p: 1.3705e-42
  Pred range: [0.0439, 0.7104], std: 0.0928
  RMSE : 0.1567, R2: 0.1801, MAE: 0.1290, Spearman rho: 0.4795, Spearman p: 1.0436e-35, Pearson r: 0.5044, Pearson p: 6.5763e-40
  Pred range: [0.0581, 0.6782], std: 0.0925
  RMSE : 0.1555, R2: 0.1926, MAE: 0.1278, Spearman rho: 0.4810, Spearman p: 5.9289e-36, Pearson r: 0.5090, Pearson p: 9.7446e-41
  Pred range: [0.0981, 0.7606], std: 0.1012
  RMSE : 0.1668, R2: 0.0716, MAE: 0.1397, Spearman rho: 0.4830, Spearman p: 2.7603e-36, Pearson r: 0.5155, Pearson p: 6.5749e-42
  Pred range: [0.0720, 0.7567], std: 0.0988
  RMSE : 0.1604, R2: 0.1411, MAE: 0.1332, Spearman rho: 0.4864, Spearman p: 7.8557e-37, Pearson r: 0.5170, Pearson p: 3.5201e-42
  Pred range: [0.0315, 0.7144], std: 0.0978
  RMSE : 0.1551, R2: 0.1970, MAE: 0.1272, Spearman rho: 0.4869, Spearman p: 6.3913e-37, Pearson r: 0.5156, Pearson p: 6.4067e-42
  Pred range: [0.0265, 0.7038], std: 0.0945
  RMSE : 0.1522, R2: 0.2264, MAE: 0.1237, Spearman rho: 0.4811, Spearman p: 5.7439e-36, Pearson r: 0.5118, Pearson p: 3.1221e-41
[I 2026-04-28 01:02:05,146] Trial 21 finished with value: 0.1503144975676218 and parameters: {'learning_rate': 0.00031477726992049565, 'batch_size': 4, 'num_epochs': 27, 'weight_decay': 5.015735806500245e-05, 'depth_complex': 3, 'depth_moderate': 4, 'depth_simple': 2, 'dropout': 0.3511550890648262, 'se_reduction': 3, 'hidden_dim_min': 9, 'base_loss': 'mse', 'huber_delta': 0.15447618016474812, 'focal_gamma': 1.2881932535486849, 'n_bins': 6, 'scheduler_patience': 5, 'scheduler_factor': 0.5683791589320089, 'early_stopping_patience': 7}. Best is trial 16 with value: 0.14933282226777683.
Train: 2407 rows (1613 IDs),Test: 598 rows (404 IDs) 

n_features_x : 6, n_features_per_modality: [16, 23, 19, 17, 7, 4, 4, 4, 1, 4]

--- ImbalancedRegressionLoss initialized ---
  Bins: 9, Focal gamma: 1.5398508708542216, Base loss: mse
  Bin [0.00, 0.11): count=  585, weight=0.041
  Bin [0.11, 0.22): count=  746, weight=0.032
  Bin [0.22, 0.33): count=  478, weight=0.050
  Bin [0.33, 0.44): count=  231, weight=0.104
  Bin [0.44, 0.56): count=  215, weight=0.112
  Bin [0.56, 0.67): count=  100, weight=0.239
  Bin [0.67, 0.78): count=   36, weight=0.653
  Bin [0.78, 0.89): count=   13, weight=1.726
  Bin [0.89, 1.00): count=    3, weight=6.041
-------------------------------------------

  Pred range: [0.0565, 0.4807], std: 0.0688
  RMSE : 0.1561, R2: 0.1870, MAE: 0.1162, Spearman rho: 0.4636, Spearman p: 3.4218e-33, Pearson r: 0.4819, Pearson p: 4.2137e-36
  Pred range: [0.0972, 0.5731], std: 0.0743
  RMSE : 0.1518, R2: 0.2312, MAE: 0.1221, Spearman rho: 0.4701, Spearman p: 3.2854e-34, Pearson r: 0.5011, Pearson p: 2.4598e-39
  Pred range: [0.0825, 0.5531], std: 0.0820
  RMSE : 0.1493, R2: 0.2556, MAE: 0.1186, Spearman rho: 0.4902, Spearman p: 1.8035e-37, Pearson r: 0.5131, Pearson p: 1.8447e-41
  Pred range: [0.1116, 0.6484], std: 0.0901
  RMSE : 0.1661, R2: 0.0786, MAE: 0.1403, Spearman rho: 0.4880, Spearman p: 4.2329e-37, Pearson r: 0.5084, Pearson p: 1.2948e-40
  Pred range: [0.0587, 0.6330], std: 0.0898
  RMSE : 0.1587, R2: 0.1589, MAE: 0.1318, Spearman rho: 0.4806, Spearman p: 6.8501e-36, Pearson r: 0.4984, Pearson p: 7.2170e-39
  Pred range: [0.0329, 0.5499], std: 0.0844
  RMSE : 0.1516, R2: 0.2330, MAE: 0.1207, Spearman rho: 0.4832, Spearman p: 2.5608e-36, Pearson r: 0.4932, Pearson p: 5.5282e-38
  Pred range: [0.0220, 0.5837], std: 0.0862
  RMSE : 0.1500, R2: 0.2487, MAE: 0.1184, Spearman rho: 0.4798, Spearman p: 9.2255e-36, Pearson r: 0.5017, Pearson p: 1.9400e-39
  Pred range: [0.0170, 0.5863], std: 0.0961
  RMSE : 0.1497, R2: 0.2516, MAE: 0.1172, Spearman rho: 0.4867, Spearman p: 6.9072e-37, Pearson r: 0.5046, Pearson p: 6.0053e-40
  Pred range: [0.0350, 0.6334], std: 0.0954
  RMSE : 0.1545, R2: 0.2037, MAE: 0.1263, Spearman rho: 0.4847, Spearman p: 1.4652e-36, Pearson r: 0.5058, Pearson p: 3.6474e-40
[I 2026-04-28 01:03:19,396] Trial 22 finished with value: 0.14933273495596114 and parameters: {'learning_rate': 0.0007142020196754379, 'batch_size': 4, 'num_epochs': 10, 'weight_decay': 7.019757340372491e-05, 'depth_complex': 3, 'depth_moderate': 4, 'depth_simple': 2, 'dropout': 0.4177921972212158, 'se_reduction': 6, 'hidden_dim_min': 8, 'base_loss': 'mse', 'huber_delta': 0.11844800361933353, 'focal_gamma': 1.5398508708542216, 'n_bins': 9, 'scheduler_patience': 5, 'scheduler_factor': 0.5253625716759481, 'early_stopping_patience': 6}. Best is trial 22 with value: 0.14933273495596114.
Train: 2407 rows (1613 IDs),Test: 598 rows (404 IDs) 

n_features_x : 6, n_features_per_modality: [16, 23, 19, 17, 7, 4, 4, 4, 1, 4]

--- ImbalancedRegressionLoss initialized ---
  Bins: 9, Focal gamma: 1.5443810995054625, Base loss: mse
  Bin [0.00, 0.11): count=  585, weight=0.041
  Bin [0.11, 0.22): count=  746, weight=0.032
  Bin [0.22, 0.33): count=  478, weight=0.050
  Bin [0.33, 0.44): count=  231, weight=0.104
  Bin [0.44, 0.56): count=  215, weight=0.112
  Bin [0.56, 0.67): count=  100, weight=0.239
  Bin [0.67, 0.78): count=   36, weight=0.653
  Bin [0.78, 0.89): count=   13, weight=1.726
  Bin [0.89, 1.00): count=    3, weight=6.041
-------------------------------------------

  Pred range: [0.1057, 0.5214], std: 0.0727
  RMSE : 0.1538, R2: 0.2102, MAE: 0.1214, Spearman rho: 0.4635, Spearman p: 3.5269e-33, Pearson r: 0.4662, Pearson p: 1.3180e-33
  Pred range: [0.0801, 0.5758], std: 0.0835
  RMSE : 0.1498, R2: 0.2511, MAE: 0.1177, Spearman rho: 0.4925, Spearman p: 7.4113e-38, Pearson r: 0.5042, Pearson p: 7.0722e-40
  Pred range: [0.0757, 0.5372], std: 0.0839
  RMSE : 0.1496, R2: 0.2528, MAE: 0.1172, Spearman rho: 0.4892, Spearman p: 2.6391e-37, Pearson r: 0.5038, Pearson p: 8.3398e-40
  Pred range: [0.0839, 0.6690], std: 0.1046
  RMSE : 0.1604, R2: 0.1413, MAE: 0.1325, Spearman rho: 0.5008, Spearman p: 2.7368e-39, Pearson r: 0.5195, Pearson p: 1.2051e-42
  Pred range: [0.0813, 0.6759], std: 0.1015
  RMSE : 0.1685, R2: 0.0528, MAE: 0.1412, Spearman rho: 0.4973, Spearman p: 1.0989e-38, Pearson r: 0.5181, Pearson p: 2.2112e-42
  Pred range: [0.0575, 0.6340], std: 0.0924
  RMSE : 0.1585, R2: 0.1618, MAE: 0.1316, Spearman rho: 0.4900, Spearman p: 1.9385e-37, Pearson r: 0.5121, Pearson p: 2.7530e-41
[I 2026-04-28 01:04:13,491] Trial 23 finished with value: 0.14961978363203696 and parameters: {'learning_rate': 0.0007952217335366245, 'batch_size': 4, 'num_epochs': 15, 'weight_decay': 0.00020326614713578572, 'depth_complex': 4, 'depth_moderate': 4, 'depth_simple': 2, 'dropout': 0.42537704521503883, 'se_reduction': 6, 'hidden_dim_min': 7, 'base_loss': 'mse', 'huber_delta': 0.11604357432890082, 'focal_gamma': 1.5443810995054625, 'n_bins': 9, 'scheduler_patience': 5, 'scheduler_factor': 0.5295163437907145, 'early_stopping_patience': 3}. Best is trial 22 with value: 0.14933273495596114.
Train: 2407 rows (1613 IDs),Test: 598 rows (404 IDs) 

n_features_x : 6, n_features_per_modality: [16, 23, 19, 17, 7, 4, 4, 4, 1, 4]

--- ImbalancedRegressionLoss initialized ---
  Bins: 14, Focal gamma: 2.9921396818203276, Base loss: mse
  Bin [0.00, 0.07): count=  383, weight=0.042
  Bin [0.07, 0.14): count=  377, weight=0.043
  Bin [0.14, 0.21): count=  571, weight=0.028
  Bin [0.21, 0.29): count=  255, weight=0.063
  Bin [0.29, 0.36): count=  223, weight=0.072
  Bin [0.36, 0.43): count=  231, weight=0.070
  Bin [0.43, 0.50): count=  122, weight=0.131
  Bin [0.50, 0.57): count=   93, weight=0.172
  Bin [0.57, 0.64): count=   83, weight=0.192
  Bin [0.64, 0.71): count=   27, weight=0.577
  Bin [0.71, 0.79): count=   26, weight=0.598
  Bin [0.79, 0.86): count=   12, weight=1.243
  Bin [0.86, 0.93): count=    2, weight=5.384
  Bin [0.93, 1.00): count=    2, weight=5.384
-------------------------------------------

  Pred range: [0.1181, 0.5338], std: 0.0651
  RMSE : 0.1812, R2: -0.0964, MAE: 0.1524, Spearman rho: 0.2837, Spearman p: 1.5552e-12, Pearson r: 0.2655, Pearson p: 4.1979e-11
  Pred range: [0.1152, 0.5085], std: 0.0635
  RMSE : 0.1708, R2: 0.0263, MAE: 0.1417, Spearman rho: 0.3440, Spearman p: 4.7290e-18, Pearson r: 0.3329, Pearson p: 6.1544e-17
  Pred range: [0.1233, 0.5389], std: 0.0697
  RMSE : 0.1709, R2: 0.0248, MAE: 0.1430, Spearman rho: 0.3836, Spearman p: 2.1421e-22, Pearson r: 0.3781, Pearson p: 9.1396e-22
  Pred range: [0.1244, 0.5540], std: 0.0728
  RMSE : 0.1664, R2: 0.0760, MAE: 0.1380, Spearman rho: 0.4103, Spearman p: 1.1000e-25, Pearson r: 0.4068, Pearson p: 3.0893e-25
  Pred range: [0.1300, 0.5815], std: 0.0756
  RMSE : 0.1669, R2: 0.0701, MAE: 0.1392, Spearman rho: 0.4252, Spearman p: 1.1952e-27, Pearson r: 0.4238, Pearson p: 1.8118e-27
  Pred range: [0.1363, 0.5984], std: 0.0778
  RMSE : 0.1673, R2: 0.0657, MAE: 0.1401, Spearman rho: 0.4385, Spearman p: 1.6834e-29, Pearson r: 0.4376, Pearson p: 2.2843e-29
[I 2026-04-28 01:04:58,371] Trial 24 pruned. 
Train: 2407 rows (1613 IDs),Test: 598 rows (404 IDs) 

n_features_x : 6, n_features_per_modality: [16, 23, 19, 17, 7, 4, 4, 4, 1, 4]

--- ImbalancedRegressionLoss initialized ---
  Bins: 10, Focal gamma: 1.008368931918846, Base loss: mse
  Bin [0.00, 0.10): count=  585, weight=0.037
  Bin [0.10, 0.20): count=  580, weight=0.038
  Bin [0.20, 0.30): count=  421, weight=0.052
  Bin [0.30, 0.40): count=  385, weight=0.057
  Bin [0.40, 0.50): count=  191, weight=0.114
  Bin [0.50, 0.60): count=  129, weight=0.168
  Bin [0.60, 0.70): count=   74, weight=0.292
  Bin [0.70, 0.80): count=   33, weight=0.644
  Bin [0.80, 0.90): count=    6, weight=3.127
  Bin [0.90, 1.00): count=    3, weight=5.472
-------------------------------------------

  Pred range: [0.1233, 0.6252], std: 0.0911
  RMSE : 0.1659, R2: 0.0809, MAE: 0.1388, Spearman rho: 0.4881, Spearman p: 3.9664e-37, Pearson r: 0.4984, Pearson p: 7.1860e-39
  Pred range: [0.1218, 0.6409], std: 0.0928
  RMSE : 0.1621, R2: 0.1233, MAE: 0.1350, Spearman rho: 0.4865, Spearman p: 7.3995e-37, Pearson r: 0.5055, Pearson p: 4.0936e-40
  Pred range: [0.1428, 0.6548], std: 0.0885
  RMSE : 0.1715, R2: 0.0187, MAE: 0.1456, Spearman rho: 0.4893, Spearman p: 2.5428e-37, Pearson r: 0.5147, Pearson p: 9.3018e-42
  Pred range: [0.1609, 0.7540], std: 0.1050
  RMSE : 0.1992, R2: -0.3250, MAE: 0.1713, Spearman rho: 0.4954, Spearman p: 2.3154e-38, Pearson r: 0.5148, Pearson p: 8.8394e-42
  Pred range: [0.0966, 0.5911], std: 0.0915
  RMSE : 0.1514, R2: 0.2353, MAE: 0.1227, Spearman rho: 0.4960, Spearman p: 1.8914e-38, Pearson r: 0.5165, Pearson p: 4.3272e-42
  Pred range: [0.1306, 0.6587], std: 0.0962
  RMSE : 0.1761, R2: -0.0353, MAE: 0.1495, Spearman rho: 0.4920, Spearman p: 8.7629e-38, Pearson r: 0.5093, Pearson p: 8.7940e-41
  Pred range: [0.0931, 0.6967], std: 0.1036
  RMSE : 0.1662, R2: 0.0783, MAE: 0.1389, Spearman rho: 0.4887, Spearman p: 3.1601e-37, Pearson r: 0.5118, Pearson p: 3.0957e-41
  Pred range: [0.0664, 0.6752], std: 0.1052
  RMSE : 0.1573, R2: 0.1738, MAE: 0.1289, Spearman rho: 0.4887, Spearman p: 3.1734e-37, Pearson r: 0.5135, Pearson p: 1.5608e-41
  Pred range: [0.0621, 0.6402], std: 0.0982
  RMSE : 0.1638, R2: 0.1045, MAE: 0.1358, Spearman rho: 0.4829, Spearman p: 2.9418e-36, Pearson r: 0.4994, Pearson p: 4.9041e-39
  Pred range: [0.0565, 0.6895], std: 0.1077
  RMSE : 0.1650, R2: 0.0913, MAE: 0.1364, Spearman rho: 0.4914, Spearman p: 1.1118e-37, Pearson r: 0.5126, Pearson p: 2.2687e-41
[I 2026-04-28 01:05:46,960] Trial 25 finished with value: 0.15136249904139545 and parameters: {'learning_rate': 0.0012295430888261782, 'batch_size': 8, 'num_epochs': 11, 'weight_decay': 7.378279297631994e-05, 'depth_complex': 4, 'depth_moderate': 4, 'depth_simple': 2, 'dropout': 0.4076625872660093, 'se_reduction': 5, 'hidden_dim_min': 8, 'base_loss': 'mse', 'huber_delta': 0.12007346300080798, 'focal_gamma': 1.008368931918846, 'n_bins': 10, 'scheduler_patience': 4, 'scheduler_factor': 0.5077162167303603, 'early_stopping_patience': 5}. Best is trial 22 with value: 0.14933273495596114.
Train: 2407 rows (1613 IDs),Test: 598 rows (404 IDs) 

n_features_x : 6, n_features_per_modality: [16, 23, 19, 17, 7, 4, 4, 4, 1, 4]

--- ImbalancedRegressionLoss initialized ---
  Bins: 7, Focal gamma: 1.9507790270224206, Base loss: mse
  Bin [0.00, 0.14): count=  760, weight=0.038
  Bin [0.14, 0.29): count=  826, weight=0.035
  Bin [0.29, 0.43): count=  454, weight=0.063
  Bin [0.43, 0.57): count=  215, weight=0.133
  Bin [0.57, 0.71): count=  110, weight=0.258
  Bin [0.71, 0.86): count=   38, weight=0.736
  Bin [0.86, 1.00): count=    4, weight=5.738
-------------------------------------------

  Pred range: [0.0752, 0.5202], std: 0.0751
  RMSE : 0.1519, R2: 0.2301, MAE: 0.1193, Spearman rho: 0.4731, Spearman p: 1.0920e-34, Pearson r: 0.4831, Pearson p: 2.6586e-36
  Pred range: [-0.0095, 0.6378], std: 0.0968
  RMSE : 0.1552, R2: 0.1963, MAE: 0.1265, Spearman rho: 0.4732, Spearman p: 1.0804e-34, Pearson r: 0.4992, Pearson p: 5.2566e-39
  Pred range: [0.1245, 0.6453], std: 0.0939
  RMSE : 0.1567, R2: 0.1808, MAE: 0.1285, Spearman rho: 0.4710, Spearman p: 2.3573e-34, Pearson r: 0.4950, Pearson p: 2.8027e-38
  Pred range: [0.1335, 0.6258], std: 0.0950
  RMSE : 0.1629, R2: 0.1141, MAE: 0.1359, Spearman rho: 0.4922, Spearman p: 8.3085e-38, Pearson r: 0.5102, Pearson p: 6.1335e-41
  Pred range: [0.0144, 0.5478], std: 0.0810
  RMSE : 0.1583, R2: 0.1635, MAE: 0.1317, Spearman rho: 0.4803, Spearman p: 7.8254e-36, Pearson r: 0.4917, Pearson p: 1.0174e-37
