[I 2026-04-29 00:52:11,844] Trial 37 finished with value: 0.08979856349910142 and parameters: {'learning_rate': 0.00012145938336735799, 'batch_size': 4, 'num_epochs': 17, 'weight_decay': 0.0005668275503739704, 'layers_PRS': 4, 'layers_SCZ15': 2, 'layers_ADHD9': 2, 'layers_ASD9': 4, 'layers_ACE15': 5, 'layers_ACE18': 1, 'layers_SUD18': 1, 'layers_SES': 4, 'layers_SEX': 3, 'dropout': 0.28397286735149296, 'se_reduction': 4, 'hidden_dim_min': 10, 'base_loss': 'mse', 'huber_delta': 0.04045390409535508, 'focal_gamma': 2.3928947105917167, 'n_bins': 17, 'scheduler_patience': 3, 'scheduler_factor': 0.46282627371433915, 'early_stopping_patience': 8}. Best is trial 32 with value: 0.08834048484537571.
Train: 2407 rows (1613 IDs),Test: 598 rows (404 IDs) 

n_features_x : 6, n_features_per_modality: [16, 23, 19, 17, 7, 4, 4, 4, 1, 4]

--- ImbalancedRegressionLoss initialized ---
  Bins: 18, Focal gamma: 2.0974298915152594, Base loss: huber
  Bin [0.00, 0.06): count=  650, weight=0.004
  Bin [0.06, 0.11): count=  530, weight=0.005
  Bin [0.11, 0.17): count=  358, weight=0.007
  Bin [0.17, 0.22): count=  477, weight=0.005
  Bin [0.22, 0.28): count=  179, weight=0.014
  Bin [0.28, 0.33): count=  133, weight=0.019
  Bin [0.33, 0.39): count=   39, weight=0.064
  Bin [0.39, 0.44): count=   20, weight=0.122
  Bin [0.44, 0.50): count=   10, weight=0.233
  Bin [0.50, 0.56): count=    6, weight=0.366
  Bin [0.56, 0.61): count=    4, weight=0.512
  Bin [0.61, 0.67): count=    0, weight=2.561
  Bin [0.67, 0.72): count=    1, weight=1.281
  Bin [0.72, 0.78): count=    0, weight=2.561
  Bin [0.78, 0.83): count=    0, weight=2.561
  Bin [0.83, 0.89): count=    0, weight=2.561
  Bin [0.89, 0.94): count=    0, weight=2.561
  Bin [0.94, 1.00): count=    0, weight=2.561
-------------------------------------------

  Pred range: [0.0797, 0.4233], std: 0.0514
  RMSE : 0.1036, R2: -0.0608, MAE: 0.0842, Spearman rho: 0.3927, Spearman p: 1.7280e-23, Pearson r: 0.3743, Pearson p: 2.5062e-21
  Pred range: [0.0844, 0.4290], std: 0.0535
  RMSE : 0.1044, R2: -0.0770, MAE: 0.0854, Spearman rho: 0.4281, Spearman p: 4.7808e-28, Pearson r: 0.4138, Pearson p: 3.9089e-26
  Pred range: [0.0592, 0.3846], std: 0.0517
  RMSE : 0.0951, R2: 0.1064, MAE: 0.0761, Spearman rho: 0.4396, Spearman p: 1.2091e-29, Pearson r: 0.4256, Pearson p: 1.0555e-27
  Pred range: [0.0749, 0.4185], std: 0.0556
  RMSE : 0.0992, R2: 0.0275, MAE: 0.0803, Spearman rho: 0.4536, Spearman p: 1.1076e-31, Pearson r: 0.4439, Pearson p: 2.9369e-30
  Pred range: [0.0699, 0.4364], std: 0.0583
  RMSE : 0.1000, R2: 0.0117, MAE: 0.0809, Spearman rho: 0.4618, Spearman p: 6.3235e-33, Pearson r: 0.4511, Pearson p: 2.5844e-31
  Pred range: [0.0650, 0.4431], std: 0.0567
  RMSE : 0.1009, R2: -0.0066, MAE: 0.0821, Spearman rho: 0.4668, Spearman p: 1.0655e-33, Pearson r: 0.4564, Pearson p: 4.2681e-32
[I 2026-04-29 00:52:27,177] Trial 38 pruned. 
Train: 2407 rows (1613 IDs),Test: 598 rows (404 IDs) 

n_features_x : 6, n_features_per_modality: [16, 23, 19, 17, 7, 4, 4, 4, 1, 4]

--- ImbalancedRegressionLoss initialized ---
  Bins: 14, Focal gamma: 2.739804145476114, Base loss: mse
  Bin [0.00, 0.07): count=  828, weight=0.003
  Bin [0.07, 0.14): count=  542, weight=0.005
  Bin [0.14, 0.21): count=  506, weight=0.005
  Bin [0.21, 0.29): count=  386, weight=0.007
  Bin [0.29, 0.36): count=   91, weight=0.029
  Bin [0.36, 0.43): count=   29, weight=0.090
  Bin [0.43, 0.50): count=   12, weight=0.207
  Bin [0.50, 0.57): count=   11, weight=0.224
  Bin [0.57, 0.64): count=    1, weight=1.343
  Bin [0.64, 0.71): count=    1, weight=1.343
  Bin [0.71, 0.79): count=    0, weight=2.686
  Bin [0.79, 0.86): count=    0, weight=2.686
  Bin [0.86, 0.93): count=    0, weight=2.686
  Bin [0.93, 1.00): count=    0, weight=2.686
-------------------------------------------

  Pred range: [0.0842, 0.3784], std: 0.0444
  RMSE : 0.0977, R2: 0.0566, MAE: 0.0803, Spearman rho: 0.4422, Spearman p: 5.0817e-30, Pearson r: 0.4440, Pearson p: 2.8048e-30
  Pred range: [0.0588, 0.3735], std: 0.0528
  RMSE : 0.0907, R2: 0.1869, MAE: 0.0726, Spearman rho: 0.4612, Spearman p: 7.8130e-33, Pearson r: 0.4687, Pearson p: 5.3798e-34
  Pred range: [0.0812, 0.4113], std: 0.0502
  RMSE : 0.0972, R2: 0.0667, MAE: 0.0793, Spearman rho: 0.4628, Spearman p: 4.4146e-33, Pearson r: 0.4647, Pearson p: 2.3171e-33
  Pred range: [0.0822, 0.4071], std: 0.0491
  RMSE : 0.0974, R2: 0.0632, MAE: 0.0792, Spearman rho: 0.4415, Spearman p: 6.3877e-30, Pearson r: 0.4519, Pearson p: 1.9885e-31
  Pred range: [0.0389, 0.3027], std: 0.0424
  RMSE : 0.0909, R2: 0.1843, MAE: 0.0722, Spearman rho: 0.4165, Spearman p: 1.7278e-26, Pearson r: 0.4301, Pearson p: 2.5395e-28
  Pred range: [0.0930, 0.4435], std: 0.0549
  RMSE : 0.1057, R2: -0.1041, MAE: 0.0866, Spearman rho: 0.4358, Spearman p: 4.0982e-29, Pearson r: 0.4441, Pearson p: 2.7468e-30
  Pred range: [0.0430, 0.3544], std: 0.0481
  RMSE : 0.0934, R2: 0.1377, MAE: 0.0752, Spearman rho: 0.4210, Spearman p: 4.3655e-27, Pearson r: 0.4302, Pearson p: 2.4339e-28
  Pred range: [0.0386, 0.3754], std: 0.0500
  RMSE : 0.0908, R2: 0.1856, MAE: 0.0726, Spearman rho: 0.4471, Spearman p: 1.0036e-30, Pearson r: 0.4583, Pearson p: 2.1909e-32
  Pred range: [0.0355, 0.3770], std: 0.0489
  RMSE : 0.0911, R2: 0.1801, MAE: 0.0731, Spearman rho: 0.4342, Spearman p: 6.8607e-29, Pearson r: 0.4504, Pearson p: 3.2561e-31
  Pred range: [0.0639, 0.3865], std: 0.0493
  RMSE : 0.0947, R2: 0.1144, MAE: 0.0764, Spearman rho: 0.4350, Spearman p: 5.3836e-29, Pearson r: 0.4473, Pearson p: 9.1654e-31
[I 2026-04-29 00:53:31,576] Trial 39 finished with value: 0.09071184161620004 and parameters: {'learning_rate': 0.0008881857395229951, 'batch_size': 6, 'num_epochs': 26, 'weight_decay': 5.803187304436636e-05, 'layers_PRS': 1, 'layers_SCZ15': 5, 'layers_ADHD9': 4, 'layers_ASD9': 4, 'layers_ACE15': 2, 'layers_ACE18': 3, 'layers_SUD18': 2, 'layers_SES': 4, 'layers_SEX': 4, 'dropout': 0.24820803486498605, 'se_reduction': 5, 'hidden_dim_min': 14, 'base_loss': 'mse', 'huber_delta': 0.10193955863943542, 'focal_gamma': 2.739804145476114, 'n_bins': 14, 'scheduler_patience': 5, 'scheduler_factor': 0.32518773850778115, 'early_stopping_patience': 8}. Best is trial 32 with value: 0.08834048484537571.
Train: 2407 rows (1613 IDs),Test: 598 rows (404 IDs) 

n_features_x : 6, n_features_per_modality: [16, 23, 19, 17, 7, 4, 4, 4, 1, 4]

--- ImbalancedRegressionLoss initialized ---
  Bins: 16, Focal gamma: 1.2418343397958183, Base loss: huber
  Bin [0.00, 0.06): count=  650, weight=0.004
  Bin [0.06, 0.12): count=  530, weight=0.005
  Bin [0.12, 0.19): count=  536, weight=0.005
  Bin [0.19, 0.25): count=  397, weight=0.007
  Bin [0.25, 0.31): count=  190, weight=0.014
  Bin [0.31, 0.38): count=   63, weight=0.042
  Bin [0.38, 0.44): count=   20, weight=0.127
  Bin [0.44, 0.50): count=   10, weight=0.242
  Bin [0.50, 0.56): count=    6, weight=0.380
  Bin [0.56, 0.62): count=    4, weight=0.532
  Bin [0.62, 0.69): count=    0, weight=2.662
  Bin [0.69, 0.75): count=    1, weight=1.331
  Bin [0.75, 0.81): count=    0, weight=2.662
  Bin [0.81, 0.88): count=    0, weight=2.662
  Bin [0.88, 0.94): count=    0, weight=2.662
  Bin [0.94, 1.00): count=    0, weight=2.662
-------------------------------------------

  Pred range: [-0.0275, 0.3623], std: 0.0487
  RMSE : 0.1009, R2: -0.0054, MAE: 0.0801, Spearman rho: 0.2602, Spearman p: 1.0357e-10, Pearson r: 0.2492, Pearson p: 6.4397e-10
  Pred range: [-0.0020, 0.3870], std: 0.0516
  RMSE : 0.1004, R2: 0.0040, MAE: 0.0802, Spearman rho: 0.3085, Spearman p: 1.1936e-14, Pearson r: 0.2988, Pearson p: 8.3914e-14
  Pred range: [0.0084, 0.3787], std: 0.0526
  RMSE : 0.0981, R2: 0.0490, MAE: 0.0781, Spearman rho: 0.3378, Spearman p: 1.9983e-17, Pearson r: 0.3314, Pearson p: 8.6066e-17
  Pred range: [0.0225, 0.3869], std: 0.0540
  RMSE : 0.0978, R2: 0.0545, MAE: 0.0782, Spearman rho: 0.3605, Spearman p: 8.5578e-20, Pearson r: 0.3553, Pearson p: 3.1450e-19
  Pred range: [0.0249, 0.3724], std: 0.0534
  RMSE : 0.0957, R2: 0.0948, MAE: 0.0761, Spearman rho: 0.3769, Spearman p: 1.2870e-21, Pearson r: 0.3715, Pearson p: 5.1884e-21
  Pred range: [0.0287, 0.3653], std: 0.0539
  RMSE : 0.0943, R2: 0.1210, MAE: 0.0747, Spearman rho: 0.3915, Spearman p: 2.4075e-23, Pearson r: 0.3872, Pearson p: 7.9236e-23
[I 2026-04-29 00:54:20,640] Trial 40 pruned. 
Train: 2407 rows (1613 IDs),Test: 598 rows (404 IDs) 

n_features_x : 6, n_features_per_modality: [16, 23, 19, 17, 7, 4, 4, 4, 1, 4]

--- ImbalancedRegressionLoss initialized ---
  Bins: 12, Focal gamma: 2.5740209100825777, Base loss: huber
  Bin [0.00, 0.08): count=  828, weight=0.003
  Bin [0.08, 0.17): count=  710, weight=0.004
  Bin [0.17, 0.25): count=  575, weight=0.005
  Bin [0.25, 0.33): count=  214, weight=0.013
  Bin [0.33, 0.42): count=   55, weight=0.051
  Bin [0.42, 0.50): count=   14, weight=0.191
  Bin [0.50, 0.58): count=    9, weight=0.286
  Bin [0.58, 0.67): count=    1, weight=1.431
  Bin [0.67, 0.75): count=    1, weight=1.431
  Bin [0.75, 0.83): count=    0, weight=2.862
  Bin [0.83, 0.92): count=    0, weight=2.862
  Bin [0.92, 1.00): count=    0, weight=2.862
-------------------------------------------

  Pred range: [0.0439, 0.3385], std: 0.0445
  RMSE : 0.0910, R2: 0.1823, MAE: 0.0723, Spearman rho: 0.4188, Spearman p: 8.4375e-27, Pearson r: 0.4281, Pearson p: 4.7967e-28
  Pred range: [0.0656, 0.3583], std: 0.0482
  RMSE : 0.0918, R2: 0.1674, MAE: 0.0742, Spearman rho: 0.4542, Spearman p: 9.1017e-32, Pearson r: 0.4645, Pearson p: 2.4620e-33
  Pred range: [0.0482, 0.3603], std: 0.0537
  RMSE : 0.0897, R2: 0.2053, MAE: 0.0714, Spearman rho: 0.4661, Spearman p: 1.4064e-33, Pearson r: 0.4751, Pearson p: 5.4060e-35
  Pred range: [0.0457, 0.3560], std: 0.0519
  RMSE : 0.0913, R2: 0.1761, MAE: 0.0734, Spearman rho: 0.4592, Spearman p: 1.5696e-32, Pearson r: 0.4690, Pearson p: 4.9693e-34
  Pred range: [0.0552, 0.3296], std: 0.0456
  RMSE : 0.0897, R2: 0.2040, MAE: 0.0721, Spearman rho: 0.4560, Spearman p: 4.8801e-32, Pearson r: 0.4652, Pearson p: 1.8876e-33
  Pred range: [0.0394, 0.3699], std: 0.0534
  RMSE : 0.0891, R2: 0.2156, MAE: 0.0706, Spearman rho: 0.4651, Spearman p: 1.9952e-33, Pearson r: 0.4716, Pearson p: 1.9285e-34
  Pred range: [0.0426, 0.3971], std: 0.0618
  RMSE : 0.0902, R2: 0.1969, MAE: 0.0716, Spearman rho: 0.4751, Spearman p: 5.4143e-35, Pearson r: 0.4861, Pearson p: 8.6908e-37
  Pred range: [0.0508, 0.3787], std: 0.0611
  RMSE : 0.0945, R2: 0.1179, MAE: 0.0761, Spearman rho: 0.4546, Spearman p: 7.9012e-32, Pearson r: 0.4684, Pearson p: 6.0804e-34
  Pred range: [0.0279, 0.3355], std: 0.0521
  RMSE : 0.0897, R2: 0.2042, MAE: 0.0723, Spearman rho: 0.4661, Spearman p: 1.3855e-33, Pearson r: 0.4803, Pearson p: 7.7838e-36
  Pred range: [0.0249, 0.3531], std: 0.0570
  RMSE : 0.0884, R2: 0.2281, MAE: 0.0699, Spearman rho: 0.4744, Spearman p: 6.8687e-35, Pearson r: 0.4847, Pearson p: 1.4859e-36
  Pred range: [0.0373, 0.3724], std: 0.0544
  RMSE : 0.0908, R2: 0.1860, MAE: 0.0731, Spearman rho: 0.4721, Spearman p: 1.6217e-34, Pearson r: 0.4824, Pearson p: 3.4692e-36
  Pred range: [0.0274, 0.3682], std: 0.0555
  RMSE : 0.0903, R2: 0.1944, MAE: 0.0726, Spearman rho: 0.4693, Spearman p: 4.4027e-34, Pearson r: 0.4812, Pearson p: 5.4510e-36
  Pred range: [0.0035, 0.3295], std: 0.0528
  RMSE : 0.0892, R2: 0.2130, MAE: 0.0706, Spearman rho: 0.4605, Spearman p: 9.9058e-33, Pearson r: 0.4721, Pearson p: 1.5988e-34
[I 2026-04-29 00:56:14,873] Trial 41 finished with value: 0.08838255490100527 and parameters: {'learning_rate': 0.0006933954805364104, 'batch_size': 4, 'num_epochs': 13, 'weight_decay': 1.0345858446820104e-05, 'layers_PRS': 3, 'layers_SCZ15': 3, 'layers_ADHD9': 2, 'layers_ASD9': 5, 'layers_ACE15': 5, 'layers_ACE18': 1, 'layers_SUD18': 3, 'layers_SES': 4, 'layers_SEX': 1, 'dropout': 0.3405708120374924, 'se_reduction': 3, 'hidden_dim_min': 10, 'base_loss': 'huber', 'huber_delta': 0.03730652934030882, 'focal_gamma': 2.5740209100825777, 'n_bins': 12, 'scheduler_patience': 2, 'scheduler_factor': 0.4057916704873299, 'early_stopping_patience': 8}. Best is trial 32 with value: 0.08834048484537571.
Train: 2407 rows (1613 IDs),Test: 598 rows (404 IDs) 

n_features_x : 6, n_features_per_modality: [16, 23, 19, 17, 7, 4, 4, 4, 1, 4]

--- ImbalancedRegressionLoss initialized ---
  Bins: 12, Focal gamma: 2.496224517790248, Base loss: huber
  Bin [0.00, 0.08): count=  828, weight=0.003
  Bin [0.08, 0.17): count=  710, weight=0.004
  Bin [0.17, 0.25): count=  575, weight=0.005
  Bin [0.25, 0.33): count=  214, weight=0.013
  Bin [0.33, 0.42): count=   55, weight=0.051
  Bin [0.42, 0.50): count=   14, weight=0.191
  Bin [0.50, 0.58): count=    9, weight=0.286
  Bin [0.58, 0.67): count=    1, weight=1.431
  Bin [0.67, 0.75): count=    1, weight=1.431
  Bin [0.75, 0.83): count=    0, weight=2.862
  Bin [0.83, 0.92): count=    0, weight=2.862
  Bin [0.92, 1.00): count=    0, weight=2.862
-------------------------------------------

  Pred range: [0.0409, 0.3411], std: 0.0467
  RMSE : 0.0941, R2: 0.1248, MAE: 0.0752, Spearman rho: 0.3414, Spearman p: 8.7083e-18, Pearson r: 0.3669, Pearson p: 1.6999e-20
  Pred range: [0.0496, 0.3766], std: 0.0530
  RMSE : 0.0923, R2: 0.1582, MAE: 0.0740, Spearman rho: 0.4142, Spearman p: 3.3834e-26, Pearson r: 0.4315, Pearson p: 1.6412e-28
  Pred range: [0.0606, 0.3664], std: 0.0512
  RMSE : 0.0923, R2: 0.1585, MAE: 0.0745, Spearman rho: 0.4393, Spearman p: 1.3120e-29, Pearson r: 0.4531, Pearson p: 1.3089e-31
  Pred range: [0.0544, 0.3776], std: 0.0548
  RMSE : 0.0910, R2: 0.1820, MAE: 0.0730, Spearman rho: 0.4497, Spearman p: 4.2194e-31, Pearson r: 0.4611, Pearson p: 8.2785e-33
  Pred range: [0.0492, 0.3355], std: 0.0500
  RMSE : 0.0891, R2: 0.2151, MAE: 0.0714, Spearman rho: 0.4566, Spearman p: 3.8586e-32, Pearson r: 0.4682, Pearson p: 6.6474e-34
  Pred range: [0.0424, 0.3469], std: 0.0512
  RMSE : 0.0892, R2: 0.2138, MAE: 0.0713, Spearman rho: 0.4582, Spearman p: 2.2507e-32, Pearson r: 0.4671, Pearson p: 9.7550e-34
  Pred range: [0.0337, 0.3614], std: 0.0523
  RMSE : 0.0892, R2: 0.2129, MAE: 0.0713, Spearman rho: 0.4613, Spearman p: 7.4873e-33, Pearson r: 0.4691, Pearson p: 4.6717e-34
  Pred range: [0.0377, 0.3631], std: 0.0542
  RMSE : 0.0897, R2: 0.2044, MAE: 0.0718, Spearman rho: 0.4622, Spearman p: 5.4926e-33, Pearson r: 0.4711, Pearson p: 2.2987e-34
  Pred range: [0.0386, 0.3660], std: 0.0539
  RMSE : 0.0898, R2: 0.2039, MAE: 0.0719, Spearman rho: 0.4631, Spearman p: 3.9647e-33, Pearson r: 0.4722, Pearson p: 1.5351e-34
  Pred range: [0.0349, 0.3713], std: 0.0548
  RMSE : 0.0897, R2: 0.2046, MAE: 0.0717, Spearman rho: 0.4634, Spearman p: 3.6761e-33, Pearson r: 0.4717, Pearson p: 1.8274e-34
  Pred range: [0.0242, 0.3591], std: 0.0541
  RMSE : 0.0891, R2: 0.2162, MAE: 0.0710, Spearman rho: 0.4615, Spearman p: 7.0081e-33, Pearson r: 0.4709, Pearson p: 2.5052e-34
  Pred range: [0.0324, 0.3720], std: 0.0543
  RMSE : 0.0897, R2: 0.2045, MAE: 0.0718, Spearman rho: 0.4643, Spearman p: 2.5949e-33, Pearson r: 0.4722, Pearson p: 1.5171e-34
  Pred range: [0.0263, 0.3626], std: 0.0536
  RMSE : 0.0893, R2: 0.2128, MAE: 0.0713, Spearman rho: 0.4649, Spearman p: 2.1352e-33, Pearson r: 0.4734, Pearson p: 1.0109e-34
  Pred range: [0.0288, 0.3662], std: 0.0534
  RMSE : 0.0895, R2: 0.2076, MAE: 0.0717, Spearman rho: 0.4645, Spearman p: 2.4976e-33, Pearson r: 0.4730, Pearson p: 1.1466e-34
[I 2026-04-29 00:58:12,358] Trial 42 finished with value: 0.08906164482609613 and parameters: {'learning_rate': 0.00019204829418611145, 'batch_size': 4, 'num_epochs': 14, 'weight_decay': 1.4312053055049894e-05, 'layers_PRS': 3, 'layers_SCZ15': 3, 'layers_ADHD9': 2, 'layers_ASD9': 5, 'layers_ACE15': 5, 'layers_ACE18': 1, 'layers_SUD18': 4, 'layers_SES': 3, 'layers_SEX': 1, 'dropout': 0.3656852804964306, 'se_reduction': 8, 'hidden_dim_min': 9, 'base_loss': 'huber', 'huber_delta': 0.03494592978704131, 'focal_gamma': 2.496224517790248, 'n_bins': 12, 'scheduler_patience': 2, 'scheduler_factor': 0.39480712936393153, 'early_stopping_patience': 8}. Best is trial 32 with value: 0.08834048484537571.
Train: 2407 rows (1613 IDs),Test: 598 rows (404 IDs) 

n_features_x : 6, n_features_per_modality: [16, 23, 19, 17, 7, 4, 4, 4, 1, 4]

--- ImbalancedRegressionLoss initialized ---
  Bins: 11, Focal gamma: 2.993281655295632, Base loss: huber
  Bin [0.00, 0.09): count= 1010, weight=0.003
  Bin [0.09, 0.18): count=  706, weight=0.004
  Bin [0.18, 0.27): count=  478, weight=0.006
  Bin [0.27, 0.36): count=  159, weight=0.018
  Bin [0.36, 0.45): count=   33, weight=0.085
  Bin [0.45, 0.55): count=   16, weight=0.170
  Bin [0.55, 0.64): count=    4, weight=0.579
  Bin [0.64, 0.73): count=    1, weight=1.448
  Bin [0.73, 0.82): count=    0, weight=2.896
  Bin [0.82, 0.91): count=    0, weight=2.896
  Bin [0.91, 1.00): count=    0, weight=2.896
-------------------------------------------

  Pred range: [0.0427, 0.3565], std: 0.0506
  RMSE : 0.0896, R2: 0.2070, MAE: 0.0715, Spearman rho: 0.4613, Spearman p: 7.7170e-33, Pearson r: 0.4711, Pearson p: 2.2590e-34
  Pred range: [0.0584, 0.3963], std: 0.0560
  RMSE : 0.0929, R2: 0.1480, MAE: 0.0750, Spearman rho: 0.4765, Spearman p: 3.1672e-35, Pearson r: 0.4811, Pearson p: 5.7457e-36
  Pred range: [0.0605, 0.3744], std: 0.0527
  RMSE : 0.0904, R2: 0.1918, MAE: 0.0727, Spearman rho: 0.4735, Spearman p: 9.6332e-35, Pearson r: 0.4801, Pearson p: 8.4648e-36
  Pred range: [0.0146, 0.3326], std: 0.0522
  RMSE : 0.0885, R2: 0.2265, MAE: 0.0698, Spearman rho: 0.4724, Spearman p: 1.4059e-34, Pearson r: 0.4787, Pearson p: 1.3944e-35
  Pred range: [0.0184, 0.3759], std: 0.0589
  RMSE : 0.0899, R2: 0.2009, MAE: 0.0716, Spearman rho: 0.4685, Spearman p: 5.8024e-34, Pearson r: 0.4753, Pearson p: 4.9356e-35
  Pred range: [0.0288, 0.3613], std: 0.0531
  RMSE : 0.0892, R2: 0.2138, MAE: 0.0715, Spearman rho: 0.4729, Spearman p: 1.1973e-34, Pearson r: 0.4789, Pearson p: 1.3123e-35
  Pred range: [0.0038, 0.3562], std: 0.0572
  RMSE : 0.0888, R2: 0.2199, MAE: 0.0702, Spearman rho: 0.4726, Spearman p: 1.3451e-34, Pearson r: 0.4782, Pearson p: 1.6814e-35
  Pred range: [0.0061, 0.3582], std: 0.0546
  RMSE : 0.0887, R2: 0.2217, MAE: 0.0706, Spearman rho: 0.4708, Spearman p: 2.5458e-34, Pearson r: 0.4795, Pearson p: 1.0499e-35
  Pred range: [0.0248, 0.3707], std: 0.0544
  RMSE : 0.0897, R2: 0.2052, MAE: 0.0718, Spearman rho: 0.4682, Spearman p: 6.4807e-34, Pearson r: 0.4767, Pearson p: 2.9023e-35
  Pred range: [0.0080, 0.3616], std: 0.0528
  RMSE : 0.0895, R2: 0.2090, MAE: 0.0716, Spearman rho: 0.4615, Spearman p: 7.0929e-33, Pearson r: 0.4698, Pearson p: 3.6183e-34
  Pred range: [0.0090, 0.3665], std: 0.0522
  RMSE : 0.0896, R2: 0.2066, MAE: 0.0719, Spearman rho: 0.4635, Spearman p: 3.4753e-33, Pearson r: 0.4729, Pearson p: 1.1876e-34
