[I 2026-04-27 20:06:07,452] Trial 71 finished with value: 0.15337485661340616 and parameters: {'learning_rate': 0.0009147432301769557, 'batch_size': 6, 'num_epochs': 28, 'weight_decay': 2.4865616595023144e-05, 'layers_PRS': 4, 'layers_SCZ15': 4, 'layers_ADHD9': 3, 'layers_ASD9': 4, 'layers_ACE15': 5, 'layers_ACE18': 7, 'layers_SUD18': 7, 'layers_SES': 4, 'layers_SEX': 4, 'dropout': 0.18700062912867055, 'se_reduction': 4, 'hidden_dim_min': 5, 'base_loss': 'huber', 'huber_delta': 0.09203387279515467, 'focal_gamma': 1.536916092182055, 'n_bins': 12, 'scheduler_patience': 5, 'scheduler_factor': 0.48160042163941486, 'early_stopping_patience': 6}. Best is trial 31 with value: 0.14835994978477499.
Train: 2407 rows (1613 IDs),Test: 598 rows (404 IDs) 

n_features_x : 6, n_features_per_modality: [16, 23, 19, 17, 7, 4, 4, 4, 1, 4]

--- ImbalancedRegressionLoss initialized ---
  Bins: 18, Focal gamma: 1.3466798908215305, Base loss: huber
  Bin [0.00, 0.06): count=  172, weight=0.058
  Bin [0.06, 0.11): count=  413, weight=0.024
  Bin [0.11, 0.17): count=  376, weight=0.027
  Bin [0.17, 0.22): count=  370, weight=0.027
  Bin [0.22, 0.28): count=  255, weight=0.040
  Bin [0.28, 0.33): count=  223, weight=0.045
  Bin [0.33, 0.39): count=   89, weight=0.112
  Bin [0.39, 0.44): count=  142, weight=0.071
  Bin [0.44, 0.50): count=  122, weight=0.082
  Bin [0.50, 0.56): count=   93, weight=0.108
  Bin [0.56, 0.61): count=   64, weight=0.156
  Bin [0.61, 0.67): count=   36, weight=0.273
  Bin [0.67, 0.72): count=   10, weight=0.920
  Bin [0.72, 0.78): count=   26, weight=0.375
  Bin [0.78, 0.83): count=    9, weight=1.012
  Bin [0.83, 0.89): count=    4, weight=2.023
  Bin [0.89, 0.94): count=    3, weight=2.529
  Bin [0.94, 1.00): count=    0, weight=10.117
-------------------------------------------

  Pred range: [0.0774, 0.6013], std: 0.0855
  RMSE : 0.1648, R2: 0.0934, MAE: 0.1361, Spearman rho: 0.4299, Spearman p: 2.7455e-28, Pearson r: 0.4434, Pearson p: 3.3912e-30
  Pred range: [0.0452, 0.6108], std: 0.1028
  RMSE : 0.1563, R2: 0.1847, MAE: 0.1249, Spearman rho: 0.4764, Spearman p: 3.2930e-35, Pearson r: 0.4816, Pearson p: 4.7282e-36
  Pred range: [0.0759, 0.6717], std: 0.0982
  RMSE : 0.1676, R2: 0.0622, MAE: 0.1401, Spearman rho: 0.4863, Spearman p: 8.0830e-37, Pearson r: 0.4977, Pearson p: 9.4212e-39
  Pred range: [0.0767, 0.6747], std: 0.1057
  RMSE : 0.1600, R2: 0.1453, MAE: 0.1312, Spearman rho: 0.5009, Spearman p: 2.6352e-39, Pearson r: 0.5117, Pearson p: 3.2594e-41
  Pred range: [0.0640, 0.6893], std: 0.1092
  RMSE : 0.1555, R2: 0.1927, MAE: 0.1250, Spearman rho: 0.4936, Spearman p: 4.8261e-38, Pearson r: 0.5057, Pearson p: 3.8920e-40
  Pred range: [0.0440, 0.6474], std: 0.0973
  RMSE : 0.1534, R2: 0.2143, MAE: 0.1240, Spearman rho: 0.4931, Spearman p: 5.7841e-38, Pearson r: 0.5083, Pearson p: 1.3365e-40
  Pred range: [0.0454, 0.6703], std: 0.0989
  RMSE : 0.1561, R2: 0.1868, MAE: 0.1271, Spearman rho: 0.4877, Spearman p: 4.7119e-37, Pearson r: 0.5059, Pearson p: 3.5856e-40
  Pred range: [0.0191, 0.6972], std: 0.1030
  RMSE : 0.1560, R2: 0.1873, MAE: 0.1263, Spearman rho: 0.4790, Spearman p: 1.2745e-35, Pearson r: 0.5000, Pearson p: 3.7949e-39
  Pred range: [0.0438, 0.7295], std: 0.1078
  RMSE : 0.1566, R2: 0.1815, MAE: 0.1266, Spearman rho: 0.4867, Spearman p: 6.9152e-37, Pearson r: 0.5038, Pearson p: 8.4279e-40
  Pred range: [0.0362, 0.7349], std: 0.1081
  RMSE : 0.1565, R2: 0.1826, MAE: 0.1264, Spearman rho: 0.4873, Spearman p: 5.3820e-37, Pearson r: 0.5047, Pearson p: 5.8647e-40
  Pred range: [0.0682, 0.7908], std: 0.1098
  RMSE : 0.1701, R2: 0.0339, MAE: 0.1411, Spearman rho: 0.4860, Spearman p: 9.0964e-37, Pearson r: 0.5048, Pearson p: 5.4668e-40
  Pred range: [0.0409, 0.7532], std: 0.1108
  RMSE : 0.1611, R2: 0.1332, MAE: 0.1315, Spearman rho: 0.4899, Spearman p: 1.9917e-37, Pearson r: 0.5084, Pearson p: 1.2853e-40
[I 2026-04-27 20:07:44,832] Trial 72 finished with value: 0.15342674691615338 and parameters: {'learning_rate': 0.0004687345986647384, 'batch_size': 6, 'num_epochs': 28, 'weight_decay': 1.2292862434077555e-05, 'layers_PRS': 3, 'layers_SCZ15': 3, 'layers_ADHD9': 3, 'layers_ASD9': 4, 'layers_ACE15': 5, 'layers_ACE18': 7, 'layers_SUD18': 7, 'layers_SES': 4, 'layers_SEX': 6, 'dropout': 0.19602017717598846, 'se_reduction': 4, 'hidden_dim_min': 4, 'base_loss': 'huber', 'huber_delta': 0.09536364946476482, 'focal_gamma': 1.3466798908215305, 'n_bins': 18, 'scheduler_patience': 4, 'scheduler_factor': 0.509309125336984, 'early_stopping_patience': 6}. Best is trial 31 with value: 0.14835994978477499.
Train: 2407 rows (1613 IDs),Test: 598 rows (404 IDs) 

n_features_x : 6, n_features_per_modality: [16, 23, 19, 17, 7, 4, 4, 4, 1, 4]

--- ImbalancedRegressionLoss initialized ---
  Bins: 11, Focal gamma: 2.2859769518435593, Base loss: huber
  Bin [0.00, 0.09): count=  585, weight=0.034
  Bin [0.09, 0.18): count=  580, weight=0.034
  Bin [0.18, 0.27): count=  421, weight=0.047
  Bin [0.27, 0.36): count=  312, weight=0.064
  Bin [0.36, 0.45): count=  207, weight=0.096
  Bin [0.45, 0.55): count=  108, weight=0.183
  Bin [0.55, 0.64): count=  125, weight=0.159
  Bin [0.64, 0.73): count=   41, weight=0.476
  Bin [0.73, 0.82): count=   21, weight=0.909
  Bin [0.82, 0.91): count=    4, weight=3.999
  Bin [0.91, 1.00): count=    3, weight=4.998
-------------------------------------------

  Pred range: [0.0543, 0.4785], std: 0.0726
  RMSE : 0.1558, R2: 0.1896, MAE: 0.1147, Spearman rho: 0.4892, Spearman p: 2.6129e-37, Pearson r: 0.4970, Pearson p: 1.2516e-38
  Pred range: [0.0481, 0.5373], std: 0.0812
  RMSE : 0.1507, R2: 0.2417, MAE: 0.1185, Spearman rho: 0.4812, Spearman p: 5.4247e-36, Pearson r: 0.4960, Pearson p: 1.8603e-38
  Pred range: [0.1254, 0.6290], std: 0.0943
  RMSE : 0.1615, R2: 0.1292, MAE: 0.1341, Spearman rho: 0.4922, Spearman p: 8.4106e-38, Pearson r: 0.5062, Pearson p: 3.1577e-40
  Pred range: [0.0779, 0.6624], std: 0.0959
  RMSE : 0.1601, R2: 0.1445, MAE: 0.1325, Spearman rho: 0.4805, Spearman p: 7.0729e-36, Pearson r: 0.4922, Pearson p: 8.0978e-38
  Pred range: [0.0380, 0.5366], std: 0.0866
  RMSE : 0.1502, R2: 0.2470, MAE: 0.1166, Spearman rho: 0.4794, Spearman p: 1.0742e-35, Pearson r: 0.4977, Pearson p: 9.4712e-39
  Pred range: [0.0926, 0.6396], std: 0.0952
  RMSE : 0.1555, R2: 0.1927, MAE: 0.1269, Spearman rho: 0.4865, Spearman p: 7.3464e-37, Pearson r: 0.5033, Pearson p: 1.0075e-39
  Pred range: [0.0293, 0.6139], std: 0.0958
  RMSE : 0.1506, R2: 0.2429, MAE: 0.1199, Spearman rho: 0.4871, Spearman p: 5.8857e-37, Pearson r: 0.5084, Pearson p: 1.2918e-40
  Pred range: [0.0652, 0.6261], std: 0.0944
  RMSE : 0.1504, R2: 0.2454, MAE: 0.1200, Spearman rho: 0.4851, Spearman p: 1.2825e-36, Pearson r: 0.5084, Pearson p: 1.2551e-40
  Pred range: [0.0973, 0.6845], std: 0.0999
  RMSE : 0.1657, R2: 0.0831, MAE: 0.1392, Spearman rho: 0.4937, Spearman p: 4.5206e-38, Pearson r: 0.5168, Pearson p: 3.8171e-42
  Pred range: [0.1040, 0.6641], std: 0.1014
  RMSE : 0.1594, R2: 0.1517, MAE: 0.1315, Spearman rho: 0.4799, Spearman p: 8.9321e-36, Pearson r: 0.5093, Pearson p: 8.7127e-41
  Pred range: [0.0438, 0.6742], std: 0.0924
  RMSE : 0.1576, R2: 0.1707, MAE: 0.1303, Spearman rho: 0.4778, Spearman p: 1.9580e-35, Pearson r: 0.5003, Pearson p: 3.3179e-39
[I 2026-04-27 20:09:43,787] Trial 73 finished with value: 0.15019727018590975 and parameters: {'learning_rate': 0.0015923421941032214, 'batch_size': 4, 'num_epochs': 27, 'weight_decay': 3.0937193598073965e-05, 'layers_PRS': 2, 'layers_SCZ15': 4, 'layers_ADHD9': 2, 'layers_ASD9': 3, 'layers_ACE15': 5, 'layers_ACE18': 7, 'layers_SUD18': 6, 'layers_SES': 4, 'layers_SEX': 4, 'dropout': 0.17581600509950737, 'se_reduction': 4, 'hidden_dim_min': 7, 'base_loss': 'huber', 'huber_delta': 0.11691692413936028, 'focal_gamma': 2.2859769518435593, 'n_bins': 11, 'scheduler_patience': 4, 'scheduler_factor': 0.5366388519251931, 'early_stopping_patience': 6}. Best is trial 31 with value: 0.14835994978477499.
Train: 2407 rows (1613 IDs),Test: 598 rows (404 IDs) 

n_features_x : 6, n_features_per_modality: [16, 23, 19, 17, 7, 4, 4, 4, 1, 4]

--- ImbalancedRegressionLoss initialized ---
  Bins: 12, Focal gamma: 1.0828527884573564, Base loss: huber
  Bin [0.00, 0.08): count=  383, weight=0.051
  Bin [0.08, 0.17): count=  578, weight=0.034
  Bin [0.17, 0.25): count=  499, weight=0.039
  Bin [0.25, 0.33): count=  349, weight=0.055
  Bin [0.33, 0.42): count=  162, weight=0.119
  Bin [0.42, 0.50): count=  191, weight=0.101
  Bin [0.50, 0.58): count=  129, weight=0.149
  Bin [0.58, 0.67): count=   47, weight=0.404
  Bin [0.67, 0.75): count=   41, weight=0.462
  Bin [0.75, 0.83): count=   21, weight=0.882
  Bin [0.83, 0.92): count=    5, weight=3.235
  Bin [0.92, 1.00): count=    2, weight=6.469
-------------------------------------------

  Pred range: [0.1154, 0.5852], std: 0.0721
  RMSE : 0.1762, R2: -0.0366, MAE: 0.1473, Spearman rho: 0.3288, Spearman p: 1.5369e-16, Pearson r: 0.3351, Pearson p: 3.6577e-17
  Pred range: [0.1149, 0.6378], std: 0.0827
  RMSE : 0.1759, R2: -0.0324, MAE: 0.1473, Spearman rho: 0.3730, Spearman p: 3.5390e-21, Pearson r: 0.3819, Pearson p: 3.3621e-22
  Pred range: [0.1107, 0.6614], std: 0.0900
  RMSE : 0.1734, R2: -0.0038, MAE: 0.1446, Spearman rho: 0.3983, Spearman p: 3.6223e-24, Pearson r: 0.4073, Pearson p: 2.6755e-25
  Pred range: [0.1038, 0.6717], std: 0.0953
  RMSE : 0.1706, R2: 0.0287, MAE: 0.1413, Spearman rho: 0.4155, Spearman p: 2.3193e-26, Pearson r: 0.4234, Pearson p: 2.0635e-27
  Pred range: [0.1030, 0.6666], std: 0.0955
  RMSE : 0.1688, R2: 0.0484, MAE: 0.1399, Spearman rho: 0.4297, Spearman p: 2.8684e-28, Pearson r: 0.4352, Pearson p: 4.9288e-29
  Pred range: [0.1065, 0.6705], std: 0.0969
  RMSE : 0.1698, R2: 0.0374, MAE: 0.1412, Spearman rho: 0.4381, Spearman p: 1.9407e-29, Pearson r: 0.4438, Pearson p: 2.9955e-30
[I 2026-04-27 20:10:19,276] Trial 74 pruned. 
Train: 2407 rows (1613 IDs),Test: 598 rows (404 IDs) 

n_features_x : 6, n_features_per_modality: [16, 23, 19, 17, 7, 4, 4, 4, 1, 4]

--- ImbalancedRegressionLoss initialized ---
  Bins: 17, Focal gamma: 1.407333956341358, Base loss: huber
  Bin [0.00, 0.06): count=  172, weight=0.058
  Bin [0.06, 0.12): count=  413, weight=0.024
  Bin [0.12, 0.18): count=  376, weight=0.027
  Bin [0.18, 0.24): count=  370, weight=0.027
  Bin [0.24, 0.29): count=  255, weight=0.039
  Bin [0.29, 0.35): count=  223, weight=0.045
  Bin [0.35, 0.41): count=  162, weight=0.061
  Bin [0.41, 0.47): count=  134, weight=0.074
  Bin [0.47, 0.53): count=  108, weight=0.092
  Bin [0.53, 0.59): count=   78, weight=0.127
  Bin [0.59, 0.65): count=   47, weight=0.208
  Bin [0.65, 0.71): count=   27, weight=0.357
  Bin [0.71, 0.76): count=   26, weight=0.370
  Bin [0.76, 0.82): count=    9, weight=0.999
  Bin [0.82, 0.88): count=    4, weight=1.999
  Bin [0.88, 0.94): count=    3, weight=2.499
  Bin [0.94, 1.00): count=    0, weight=9.995
-------------------------------------------

  Pred range: [0.1280, 0.7018], std: 0.1111
  RMSE : 0.1815, R2: -0.0994, MAE: 0.1523, Spearman rho: 0.4819, Spearman p: 4.3222e-36, Pearson r: 0.4911, Pearson p: 1.2634e-37
  Pred range: [0.1048, 0.5286], std: 0.0811
  RMSE : 0.1517, R2: 0.2322, MAE: 0.1226, Spearman rho: 0.4888, Spearman p: 3.0311e-37, Pearson r: 0.5066, Pearson p: 2.6705e-40
  Pred range: [0.0614, 0.6514], std: 0.1014
  RMSE : 0.1546, R2: 0.2021, MAE: 0.1261, Spearman rho: 0.4966, Spearman p: 1.4447e-38, Pearson r: 0.5115, Pearson p: 3.5416e-41
  Pred range: [0.0271, 0.5833], std: 0.0979
  RMSE : 0.1487, R2: 0.2617, MAE: 0.1146, Spearman rho: 0.5002, Spearman p: 3.4701e-39, Pearson r: 0.5169, Pearson p: 3.6882e-42
  Pred range: [0.0756, 0.6785], std: 0.1149
  RMSE : 0.1586, R2: 0.1604, MAE: 0.1289, Spearman rho: 0.5074, Spearman p: 1.9431e-40, Pearson r: 0.5256, Pearson p: 8.6881e-44
  Pred range: [0.0989, 0.7289], std: 0.1097
  RMSE : 0.1727, R2: 0.0049, MAE: 0.1439, Spearman rho: 0.5000, Spearman p: 3.7840e-39, Pearson r: 0.5131, Pearson p: 1.7911e-41
  Pred range: [0.0478, 0.6530], std: 0.0967
  RMSE : 0.1562, R2: 0.1857, MAE: 0.1272, Spearman rho: 0.4811, Spearman p: 5.6414e-36, Pearson r: 0.4969, Pearson p: 1.3165e-38
  Pred range: [0.0074, 0.8580], std: 0.1215
  RMSE : 0.1852, R2: -0.1450, MAE: 0.1538, Spearman rho: 0.4804, Spearman p: 7.3831e-36, Pearson r: 0.4887, Pearson p: 3.1728e-37
  Pred range: [0.0695, 0.6922], std: 0.1126
  RMSE : 0.1569, R2: 0.1780, MAE: 0.1263, Spearman rho: 0.4906, Spearman p: 1.5255e-37, Pearson r: 0.5071, Pearson p: 2.2016e-40
[I 2026-04-27 20:11:36,753] Trial 75 finished with value: 0.14872069073080285 and parameters: {'learning_rate': 0.0010546419757105144, 'batch_size': 6, 'num_epochs': 22, 'weight_decay': 2.3530706335612876e-05, 'layers_PRS': 4, 'layers_SCZ15': 6, 'layers_ADHD9': 2, 'layers_ASD9': 4, 'layers_ACE15': 4, 'layers_ACE18': 6, 'layers_SUD18': 7, 'layers_SES': 3, 'layers_SEX': 5, 'dropout': 0.22367191959132965, 'se_reduction': 4, 'hidden_dim_min': 5, 'base_loss': 'huber', 'huber_delta': 0.1312204789780281, 'focal_gamma': 1.407333956341358, 'n_bins': 17, 'scheduler_patience': 5, 'scheduler_factor': 0.5021259397364588, 'early_stopping_patience': 5}. Best is trial 31 with value: 0.14835994978477499.
Train: 2407 rows (1613 IDs),Test: 598 rows (404 IDs) 

n_features_x : 6, n_features_per_modality: [16, 23, 19, 17, 7, 4, 4, 4, 1, 4]

--- ImbalancedRegressionLoss initialized ---
  Bins: 19, Focal gamma: 1.4005765036919626, Base loss: huber
  Bin [0.00, 0.05): count=  172, weight=0.055
  Bin [0.05, 0.11): count=  413, weight=0.023
  Bin [0.11, 0.16): count=  376, weight=0.025
  Bin [0.16, 0.21): count=  204, weight=0.046
  Bin [0.21, 0.26): count=  295, weight=0.032
  Bin [0.26, 0.32): count=  239, weight=0.039
  Bin [0.32, 0.37): count=  199, weight=0.047
  Bin [0.37, 0.42): count=   73, weight=0.128
  Bin [0.42, 0.47): count=  134, weight=0.070
  Bin [0.47, 0.53): count=  108, weight=0.087
  Bin [0.53, 0.58): count=   78, weight=0.120
  Bin [0.58, 0.63): count=   28, weight=0.327
  Bin [0.63, 0.68): count=   36, weight=0.256
  Bin [0.68, 0.74): count=   24, weight=0.379
  Bin [0.74, 0.79): count=   19, weight=0.474
  Bin [0.79, 0.84): count=    2, weight=3.157
  Bin [0.84, 0.89): count=    4, weight=1.894
  Bin [0.89, 0.95): count=    3, weight=2.368
  Bin [0.95, 1.00): count=    0, weight=9.472
-------------------------------------------

  Pred range: [0.0892, 0.6876], std: 0.1008
  RMSE : 0.1547, R2: 0.2015, MAE: 0.1237, Spearman rho: 0.4831, Spearman p: 2.7144e-36, Pearson r: 0.4884, Pearson p: 3.6495e-37
  Pred range: [0.0846, 0.5665], std: 0.0842
  RMSE : 0.1509, R2: 0.2403, MAE: 0.1205, Spearman rho: 0.4940, Spearman p: 4.0253e-38, Pearson r: 0.5022, Pearson p: 1.5591e-39
  Pred range: [0.0653, 0.5810], std: 0.0865
  RMSE : 0.1491, R2: 0.2583, MAE: 0.1154, Spearman rho: 0.4927, Spearman p: 6.8387e-38, Pearson r: 0.5094, Pearson p: 8.4498e-41
  Pred range: [0.0871, 0.6900], std: 0.0963
  RMSE : 0.1609, R2: 0.1364, MAE: 0.1333, Spearman rho: 0.4914, Spearman p: 1.1049e-37, Pearson r: 0.5072, Pearson p: 2.1004e-40
  Pred range: [0.0890, 0.6534], std: 0.0996
  RMSE : 0.1535, R2: 0.2137, MAE: 0.1242, Spearman rho: 0.4967, Spearman p: 1.3919e-38, Pearson r: 0.5126, Pearson p: 2.2765e-41
  Pred range: [0.0448, 0.6173], std: 0.0985
  RMSE : 0.1493, R2: 0.2563, MAE: 0.1172, Spearman rho: 0.4918, Spearman p: 9.5772e-38, Pearson r: 0.5111, Pearson p: 4.2529e-41
  Pred range: [0.0907, 0.6732], std: 0.1036
  RMSE : 0.1643, R2: 0.0994, MAE: 0.1361, Spearman rho: 0.4925, Spearman p: 7.3114e-38, Pearson r: 0.5091, Pearson p: 9.5535e-41
[I 2026-04-27 20:13:00,322] Trial 76 finished with value: 0.14906509012295185 and parameters: {'learning_rate': 0.0006661982304435581, 'batch_size': 4, 'num_epochs': 19, 'weight_decay': 0.0001283446512827324, 'layers_PRS': 3, 'layers_SCZ15': 6, 'layers_ADHD9': 2, 'layers_ASD9': 6, 'layers_ACE15': 4, 'layers_ACE18': 5, 'layers_SUD18': 3, 'layers_SES': 3, 'layers_SEX': 5, 'dropout': 0.22874149959812204, 'se_reduction': 3, 'hidden_dim_min': 4, 'base_loss': 'huber', 'huber_delta': 0.1533769325316756, 'focal_gamma': 1.4005765036919626, 'n_bins': 19, 'scheduler_patience': 5, 'scheduler_factor': 0.5032604186106573, 'early_stopping_patience': 4}. Best is trial 31 with value: 0.14835994978477499.
Train: 2407 rows (1613 IDs),Test: 598 rows (404 IDs) 

n_features_x : 6, n_features_per_modality: [16, 23, 19, 17, 7, 4, 4, 4, 1, 4]

--- ImbalancedRegressionLoss initialized ---
  Bins: 20, Focal gamma: 1.4202142856212807, Base loss: huber
  Bin [0.00, 0.05): count=  172, weight=0.053
  Bin [0.05, 0.10): count=  413, weight=0.022
  Bin [0.10, 0.15): count=  175, weight=0.052
  Bin [0.15, 0.20): count=  405, weight=0.023
  Bin [0.20, 0.25): count=  295, weight=0.031
  Bin [0.25, 0.30): count=  126, weight=0.072
  Bin [0.30, 0.35): count=  223, weight=0.041
  Bin [0.35, 0.40): count=  162, weight=0.056
  Bin [0.40, 0.45): count=   69, weight=0.131
  Bin [0.45, 0.50): count=  122, weight=0.074
  Bin [0.50, 0.55): count=   93, weight=0.097
  Bin [0.55, 0.60): count=   36, weight=0.247
  Bin [0.60, 0.65): count=   47, weight=0.190
  Bin [0.65, 0.70): count=   27, weight=0.326
  Bin [0.70, 0.75): count=   14, weight=0.609
  Bin [0.75, 0.80): count=   19, weight=0.457
  Bin [0.80, 0.85): count=    5, weight=1.523
  Bin [0.85, 0.90): count=    1, weight=4.570
  Bin [0.90, 0.95): count=    3, weight=2.285
  Bin [0.95, 1.00): count=    0, weight=9.140
-------------------------------------------

  Pred range: [0.0832, 0.5630], std: 0.0803
  RMSE : 0.1519, R2: 0.2302, MAE: 0.1188, Spearman rho: 0.4714, Spearman p: 2.0645e-34, Pearson r: 0.4806, Pearson p: 6.8625e-36
  Pred range: [0.1103, 0.6918], std: 0.0956
  RMSE : 0.1600, R2: 0.1450, MAE: 0.1321, Spearman rho: 0.4899, Spearman p: 1.9822e-37, Pearson r: 0.5092, Pearson p: 9.0249e-41
  Pred range: [0.1234, 0.6609], std: 0.0993
  RMSE : 0.1627, R2: 0.1166, MAE: 0.1356, Spearman rho: 0.5071, Spearman p: 2.2029e-40, Pearson r: 0.5276, Pearson p: 3.6434e-44
  Pred range: [0.1192, 0.6916], std: 0.1038
  RMSE : 0.1644, R2: 0.0980, MAE: 0.1368, Spearman rho: 0.5000, Spearman p: 3.8602e-39, Pearson r: 0.5211, Pearson p: 6.0536e-43
  Pred range: [0.1126, 0.6587], std: 0.1007
  RMSE : 0.1566, R2: 0.1811, MAE: 0.1286, Spearman rho: 0.5061, Spearman p: 3.3091e-40, Pearson r: 0.5269, Pearson p: 5.0447e-44
[I 2026-04-27 20:13:39,555] Trial 77 finished with value: 0.15186479668624395 and parameters: {'learning_rate': 0.0006375356022494405, 'batch_size': 6, 'num_epochs': 19, 'weight_decay': 0.00012393411772181642, 'layers_PRS': 3, 'layers_SCZ15': 6, 'layers_ADHD9': 1, 'layers_ASD9': 6, 'layers_ACE15': 4, 'layers_ACE18': 5, 'layers_SUD18': 3, 'layers_SES': 2, 'layers_SEX': 5, 'dropout': 0.23193859947703854, 'se_reduction': 3, 'hidden_dim_min': 4, 'base_loss': 'huber', 'huber_delta': 0.16627056512395205, 'focal_gamma': 1.4202142856212807, 'n_bins': 20, 'scheduler_patience': 5, 'scheduler_factor': 0.5035714396657909, 'early_stopping_patience': 4}. Best is trial 31 with value: 0.14835994978477499.
Train: 2407 rows (1613 IDs),Test: 598 rows (404 IDs) 

n_features_x : 6, n_features_per_modality: [16, 23, 19, 17, 7, 4, 4, 4, 1, 4]

--- ImbalancedRegressionLoss initialized ---
  Bins: 19, Focal gamma: 1.129555721824689, Base loss: huber
  Bin [0.00, 0.05): count=  172, weight=0.055
  Bin [0.05, 0.11): count=  413, weight=0.023
  Bin [0.11, 0.16): count=  376, weight=0.025
  Bin [0.16, 0.21): count=  204, weight=0.046
  Bin [0.21, 0.26): count=  295, weight=0.032
  Bin [0.26, 0.32): count=  239, weight=0.039
  Bin [0.32, 0.37): count=  199, weight=0.047
  Bin [0.37, 0.42): count=   73, weight=0.128
  Bin [0.42, 0.47): count=  134, weight=0.070
  Bin [0.47, 0.53): count=  108, weight=0.087
  Bin [0.53, 0.58): count=   78, weight=0.120
  Bin [0.58, 0.63): count=   28, weight=0.327
  Bin [0.63, 0.68): count=   36, weight=0.256
  Bin [0.68, 0.74): count=   24, weight=0.379
  Bin [0.74, 0.79): count=   19, weight=0.474
  Bin [0.79, 0.84): count=    2, weight=3.157
  Bin [0.84, 0.89): count=    4, weight=1.894
  Bin [0.89, 0.95): count=    3, weight=2.368
  Bin [0.95, 1.00): count=    0, weight=9.472
-------------------------------------------

  Pred range: [0.1749, 0.7151], std: 0.0786
  RMSE : 0.1849, R2: -0.1412, MAE: 0.1575, Spearman rho: 0.3738, Spearman p: 2.9132e-21, Pearson r: 0.3876, Pearson p: 7.1325e-23
  Pred range: [0.1833, 0.8930], std: 0.1102
  RMSE : 0.2168, R2: -0.5694, MAE: 0.1868, Spearman rho: 0.4195, Spearman p: 6.8061e-27, Pearson r: 0.4368, Pearson p: 2.9673e-29
  Pred range: [0.1680, 0.8199], std: 0.1107
  RMSE : 0.2080, R2: -0.4436, MAE: 0.1786, Spearman rho: 0.4545, Spearman p: 8.1134e-32, Pearson r: 0.4728, Pearson p: 1.2321e-34
  Pred range: [0.1592, 0.8393], std: 0.1132
  RMSE : 0.1995, R2: -0.3290, MAE: 0.1704, Spearman rho: 0.4684, Spearman p: 6.1495e-34, Pearson r: 0.4906, Pearson p: 1.5557e-37
