[I 2026-04-28 00:18:02,865] Trial 42 finished with value: 0.08873773410314591 and parameters: {'learning_rate': 0.00036206154347946147, 'batch_size': 4, 'num_epochs': 27, 'weight_decay': 0.0007110540283799527, 'depth_complex': 3, 'depth_moderate': 4, 'depth_simple': 1, 'dropout': 0.24838559359413787, 'se_reduction': 7, 'hidden_dim_min': 4, 'base_loss': 'huber', 'huber_delta': 0.13513965628311164, 'focal_gamma': 2.768949079890156, 'n_bins': 5, 'scheduler_patience': 2, 'scheduler_factor': 0.6390883067725657, 'early_stopping_patience': 7}. Best is trial 22 with value: 0.08764163086185245.
Train: 2407 rows (1613 IDs),Test: 598 rows (404 IDs) 

n_features_x : 6, n_features_per_modality: [16, 23, 19, 17, 7, 4, 4, 4, 1, 4]

--- ImbalancedRegressionLoss initialized ---
  Bins: 6, Focal gamma: 2.4596872566314687, Base loss: huber
  Bin [0.00, 0.17): count= 1538, weight=0.002
  Bin [0.17, 0.33): count=  789, weight=0.005
  Bin [0.33, 0.50): count=   69, weight=0.053
  Bin [0.50, 0.67): count=   10, weight=0.339
  Bin [0.67, 0.83): count=    1, weight=1.867
  Bin [0.83, 1.00): count=    0, weight=3.733
-------------------------------------------

  Pred range: [0.0259, 0.3995], std: 0.0570
  RMSE : 0.0914, R2: 0.1739, MAE: 0.0707, Spearman rho: 0.4498, Spearman p: 3.9593e-31, Pearson r: 0.4492, Pearson p: 4.8701e-31
  Pred range: [0.1207, 0.4743], std: 0.0563
  RMSE : 0.1267, R2: -0.5852, MAE: 0.1065, Spearman rho: 0.4136, Spearman p: 4.0896e-26, Pearson r: 0.4282, Pearson p: 4.5640e-28
  Pred range: [-0.0276, 0.3439], std: 0.0509
  RMSE : 0.0916, R2: 0.1709, MAE: 0.0734, Spearman rho: 0.4404, Spearman p: 9.1270e-30, Pearson r: 0.4436, Pearson p: 3.1899e-30
  Pred range: [0.0341, 0.3549], std: 0.0520
  RMSE : 0.0890, R2: 0.2171, MAE: 0.0703, Spearman rho: 0.4604, Spearman p: 1.0378e-32, Pearson r: 0.4692, Pearson p: 4.5978e-34
  Pred range: [0.0563, 0.3295], std: 0.0458
  RMSE : 0.0898, R2: 0.2037, MAE: 0.0722, Spearman rho: 0.4497, Spearman p: 4.1304e-31, Pearson r: 0.4621, Pearson p: 5.7021e-33
  Pred range: [0.0173, 0.3118], std: 0.0439
  RMSE : 0.0910, R2: 0.1815, MAE: 0.0722, Spearman rho: 0.4412, Spearman p: 7.0609e-30, Pearson r: 0.4365, Pearson p: 3.2609e-29
  Pred range: [0.0697, 0.4251], std: 0.0531
  RMSE : 0.1002, R2: 0.0080, MAE: 0.0819, Spearman rho: 0.4613, Spearman p: 7.5140e-33, Pearson r: 0.4604, Pearson p: 1.0502e-32
  Pred range: [0.0239, 0.3470], std: 0.0554
  RMSE : 0.0892, R2: 0.2143, MAE: 0.0699, Spearman rho: 0.4659, Spearman p: 1.5050e-33, Pearson r: 0.4741, Pearson p: 7.5929e-35
  Pred range: [0.0327, 0.3754], std: 0.0557
  RMSE : 0.0936, R2: 0.1345, MAE: 0.0754, Spearman rho: 0.4727, Spearman p: 1.2688e-34, Pearson r: 0.4762, Pearson p: 3.5434e-35
  Pred range: [0.0314, 0.3977], std: 0.0603
  RMSE : 0.0898, R2: 0.2035, MAE: 0.0708, Spearman rho: 0.4679, Spearman p: 7.2499e-34, Pearson r: 0.4755, Pearson p: 4.5260e-35
  Pred range: [0.0093, 0.2966], std: 0.0479
  RMSE : 0.0905, R2: 0.1898, MAE: 0.0704, Spearman rho: 0.4784, Spearman p: 1.5523e-35, Pearson r: 0.4828, Pearson p: 3.0552e-36
  Pred range: [0.0616, 0.3667], std: 0.0533
  RMSE : 0.0936, R2: 0.1350, MAE: 0.0758, Spearman rho: 0.4741, Spearman p: 7.5943e-35, Pearson r: 0.4754, Pearson p: 4.7909e-35
[I 2026-04-28 00:19:43,243] Trial 43 finished with value: 0.08900928664378352 and parameters: {'learning_rate': 0.0018705713100529348, 'batch_size': 4, 'num_epochs': 28, 'weight_decay': 0.0017663321414366987, 'depth_complex': 3, 'depth_moderate': 5, 'depth_simple': 1, 'dropout': 0.49602745272187726, 'se_reduction': 6, 'hidden_dim_min': 3, 'base_loss': 'huber', 'huber_delta': 0.10729531736918987, 'focal_gamma': 2.4596872566314687, 'n_bins': 6, 'scheduler_patience': 3, 'scheduler_factor': 0.6989366171135183, 'early_stopping_patience': 8}. Best is trial 22 with value: 0.08764163086185245.
Train: 2407 rows (1613 IDs),Test: 598 rows (404 IDs) 

n_features_x : 6, n_features_per_modality: [16, 23, 19, 17, 7, 4, 4, 4, 1, 4]

--- ImbalancedRegressionLoss initialized ---
  Bins: 7, Focal gamma: 2.3577424847954314, Base loss: huber
  Bin [0.00, 0.14): count= 1370, weight=0.002
  Bin [0.14, 0.29): count=  892, weight=0.003
  Bin [0.29, 0.43): count=  120, weight=0.024
  Bin [0.43, 0.57): count=   23, weight=0.122
  Bin [0.57, 0.71): count=    2, weight=0.978
  Bin [0.71, 0.86): count=    0, weight=2.935
  Bin [0.86, 1.00): count=    0, weight=2.935
-------------------------------------------

  Pred range: [0.0599, 0.4582], std: 0.0593
  RMSE : 0.0988, R2: 0.0357, MAE: 0.0798, Spearman rho: 0.4236, Spearman p: 1.9676e-27, Pearson r: 0.4308, Pearson p: 2.0356e-28
  Pred range: [0.0356, 0.3881], std: 0.0577
  RMSE : 0.0949, R2: 0.1099, MAE: 0.0768, Spearman rho: 0.4496, Spearman p: 4.3607e-31, Pearson r: 0.4585, Pearson p: 2.0262e-32
  Pred range: [-0.0206, 0.3518], std: 0.0543
  RMSE : 0.0927, R2: 0.1514, MAE: 0.0719, Spearman rho: 0.4316, Spearman p: 1.5878e-28, Pearson r: 0.4338, Pearson p: 7.7612e-29
  Pred range: [0.0623, 0.4171], std: 0.0567
  RMSE : 0.0979, R2: 0.0527, MAE: 0.0790, Spearman rho: 0.3942, Spearman p: 1.1336e-23, Pearson r: 0.4127, Pearson p: 5.3870e-26
  Pred range: [0.0302, 0.4710], std: 0.0683
  RMSE : 0.0985, R2: 0.0406, MAE: 0.0784, Spearman rho: 0.4225, Spearman p: 2.7616e-27, Pearson r: 0.4250, Pearson p: 1.2475e-27
  Pred range: [-0.0165, 0.3078], std: 0.0492
  RMSE : 0.0913, R2: 0.1765, MAE: 0.0725, Spearman rho: 0.4214, Spearman p: 3.8322e-27, Pearson r: 0.4270, Pearson p: 6.6796e-28
  Pred range: [0.0021, 0.4132], std: 0.0615
  RMSE : 0.0962, R2: 0.0845, MAE: 0.0776, Spearman rho: 0.4454, Spearman p: 1.7828e-30, Pearson r: 0.4446, Pearson p: 2.3216e-30
  Pred range: [0.0001, 0.2773], std: 0.0509
  RMSE : 0.0940, R2: 0.1266, MAE: 0.0719, Spearman rho: 0.4754, Spearman p: 4.8125e-35, Pearson r: 0.4855, Pearson p: 1.0984e-36
[I 2026-04-28 00:20:54,425] Trial 44 pruned. 
Train: 2407 rows (1613 IDs),Test: 598 rows (404 IDs) 

n_features_x : 6, n_features_per_modality: [16, 23, 19, 17, 7, 4, 4, 4, 1, 4]

--- ImbalancedRegressionLoss initialized ---
  Bins: 17, Focal gamma: 2.0956778165590837, Base loss: huber
  Bin [0.00, 0.06): count=  650, weight=0.004
  Bin [0.06, 0.12): count=  530, weight=0.005
  Bin [0.12, 0.18): count=  536, weight=0.005
  Bin [0.18, 0.24): count=  299, weight=0.009
  Bin [0.24, 0.29): count=  247, weight=0.011
  Bin [0.29, 0.35): count=   91, weight=0.029
  Bin [0.35, 0.41): count=   20, weight=0.127
  Bin [0.41, 0.47): count=   16, weight=0.157
  Bin [0.47, 0.53): count=   10, weight=0.243
  Bin [0.53, 0.59): count=    6, weight=0.382
  Bin [0.59, 0.65): count=    1, weight=1.336
  Bin [0.65, 0.71): count=    1, weight=1.336
  Bin [0.71, 0.76): count=    0, weight=2.671
  Bin [0.76, 0.82): count=    0, weight=2.671
  Bin [0.82, 0.88): count=    0, weight=2.671
  Bin [0.88, 0.94): count=    0, weight=2.671
  Bin [0.94, 1.00): count=    0, weight=2.671
-------------------------------------------

  Pred range: [0.0375, 0.4582], std: 0.0654
  RMSE : 0.1215, R2: -0.4586, MAE: 0.1004, Spearman rho: 0.3521, Spearman p: 6.7942e-19, Pearson r: 0.3613, Pearson p: 7.0457e-20
  Pred range: [0.0279, 0.4226], std: 0.0647
  RMSE : 0.1083, R2: -0.1585, MAE: 0.0885, Spearman rho: 0.3828, Spearman p: 2.6220e-22, Pearson r: 0.3928, Pearson p: 1.6730e-23
  Pred range: [0.0531, 0.4724], std: 0.0665
  RMSE : 0.1186, R2: -0.3908, MAE: 0.0984, Spearman rho: 0.3921, Spearman p: 2.0462e-23, Pearson r: 0.4073, Pearson p: 2.6212e-25
  Pred range: [0.0209, 0.3763], std: 0.0598
  RMSE : 0.0944, R2: 0.1196, MAE: 0.0755, Spearman rho: 0.4113, Spearman p: 8.2080e-26, Pearson r: 0.4240, Pearson p: 1.7288e-27
  Pred range: [0.0511, 0.4348], std: 0.0636
  RMSE : 0.1071, R2: -0.1337, MAE: 0.0882, Spearman rho: 0.4172, Spearman p: 1.3657e-26, Pearson r: 0.4303, Pearson p: 2.4029e-28
  Pred range: [0.0502, 0.4199], std: 0.0605
  RMSE : 0.1020, R2: -0.0285, MAE: 0.0835, Spearman rho: 0.4174, Spearman p: 1.2995e-26, Pearson r: 0.4288, Pearson p: 3.8436e-28
[I 2026-04-28 00:21:00,705] Trial 45 pruned. 
Train: 2407 rows (1613 IDs),Test: 598 rows (404 IDs) 

n_features_x : 6, n_features_per_modality: [16, 23, 19, 17, 7, 4, 4, 4, 1, 4]

--- ImbalancedRegressionLoss initialized ---
  Bins: 8, Focal gamma: 2.6639221491902068, Base loss: huber
  Bin [0.00, 0.12): count= 1180, weight=0.003
  Bin [0.12, 0.25): count=  933, weight=0.003
  Bin [0.25, 0.38): count=  253, weight=0.012
  Bin [0.38, 0.50): count=   30, weight=0.098
  Bin [0.50, 0.62): count=   10, weight=0.277
  Bin [0.62, 0.75): count=    1, weight=1.521
  Bin [0.75, 0.88): count=    0, weight=3.043
  Bin [0.88, 1.00): count=    0, weight=3.043
-------------------------------------------

  Pred range: [0.0542, 0.3982], std: 0.0473
  RMSE : 0.0975, R2: 0.0598, MAE: 0.0789, Spearman rho: 0.3372, Spearman p: 2.2788e-17, Pearson r: 0.3521, Pearson p: 6.8000e-19
  Pred range: [0.0567, 0.3816], std: 0.0499
  RMSE : 0.0941, R2: 0.1258, MAE: 0.0758, Spearman rho: 0.4017, Spearman p: 1.3443e-24, Pearson r: 0.4109, Pearson p: 9.1637e-26
  Pred range: [0.0745, 0.3947], std: 0.0527
  RMSE : 0.1014, R2: -0.0152, MAE: 0.0834, Spearman rho: 0.4226, Spearman p: 2.6247e-27, Pearson r: 0.4319, Pearson p: 1.4521e-28
  Pred range: [0.0533, 0.3376], std: 0.0474
  RMSE : 0.0905, R2: 0.1915, MAE: 0.0723, Spearman rho: 0.4378, Spearman p: 2.1252e-29, Pearson r: 0.4478, Pearson p: 7.8351e-31
  Pred range: [0.0573, 0.3402], std: 0.0483
  RMSE : 0.0908, R2: 0.1853, MAE: 0.0729, Spearman rho: 0.4463, Spearman p: 1.3068e-30, Pearson r: 0.4561, Pearson p: 4.5767e-32
  Pred range: [0.0572, 0.3384], std: 0.0478
  RMSE : 0.0902, R2: 0.1967, MAE: 0.0721, Spearman rho: 0.4494, Spearman p: 4.5756e-31, Pearson r: 0.4587, Pearson p: 1.9221e-32
  Pred range: [0.0620, 0.3360], std: 0.0477
  RMSE : 0.0903, R2: 0.1936, MAE: 0.0725, Spearman rho: 0.4560, Spearman p: 4.7599e-32, Pearson r: 0.4649, Pearson p: 2.1131e-33
  Pred range: [0.0584, 0.3320], std: 0.0478
  RMSE : 0.0893, R2: 0.2121, MAE: 0.0714, Spearman rho: 0.4637, Spearman p: 3.3072e-33, Pearson r: 0.4714, Pearson p: 2.0762e-34
  Pred range: [0.0663, 0.3469], std: 0.0482
  RMSE : 0.0913, R2: 0.1772, MAE: 0.0736, Spearman rho: 0.4561, Spearman p: 4.7186e-32, Pearson r: 0.4645, Pearson p: 2.4279e-33
  Pred range: [0.0589, 0.3517], std: 0.0495
  RMSE : 0.0899, R2: 0.2007, MAE: 0.0720, Spearman rho: 0.4593, Spearman p: 1.5315e-32, Pearson r: 0.4667, Pearson p: 1.1398e-33
  Pred range: [0.0683, 0.3430], std: 0.0478
  RMSE : 0.0911, R2: 0.1800, MAE: 0.0735, Spearman rho: 0.4596, Spearman p: 1.3629e-32, Pearson r: 0.4668, Pearson p: 1.0677e-33
  Pred range: [0.0685, 0.3521], std: 0.0483
  RMSE : 0.0912, R2: 0.1772, MAE: 0.0736, Spearman rho: 0.4616, Spearman p: 6.7745e-33, Pearson r: 0.4690, Pearson p: 4.9808e-34
  Pred range: [0.0568, 0.3241], std: 0.0457
  RMSE : 0.0892, R2: 0.2135, MAE: 0.0713, Spearman rho: 0.4592, Spearman p: 1.5864e-32, Pearson r: 0.4664, Pearson p: 1.2397e-33
  Pred range: [0.0616, 0.3254], std: 0.0452
  RMSE : 0.0894, R2: 0.2099, MAE: 0.0716, Spearman rho: 0.4630, Spearman p: 4.2060e-33, Pearson r: 0.4690, Pearson p: 4.8829e-34
  Pred range: [0.0540, 0.3077], std: 0.0435
  RMSE : 0.0887, R2: 0.2217, MAE: 0.0704, Spearman rho: 0.4666, Spearman p: 1.1646e-33, Pearson r: 0.4729, Pearson p: 1.1798e-34
  Pred range: [0.0780, 0.3685], std: 0.0485
  RMSE : 0.0944, R2: 0.1198, MAE: 0.0768, Spearman rho: 0.4559, Spearman p: 5.0123e-32, Pearson r: 0.4627, Pearson p: 4.6856e-33
  Pred range: [0.0611, 0.3358], std: 0.0469
  RMSE : 0.0894, R2: 0.2100, MAE: 0.0717, Spearman rho: 0.4652, Spearman p: 1.9270e-33, Pearson r: 0.4713, Pearson p: 2.1326e-34
  Pred range: [0.0772, 0.3773], std: 0.0505
  RMSE : 0.0954, R2: 0.1000, MAE: 0.0776, Spearman rho: 0.4588, Spearman p: 1.7947e-32, Pearson r: 0.4650, Pearson p: 2.0908e-33
  Pred range: [0.0600, 0.3367], std: 0.0463
  RMSE : 0.0891, R2: 0.2155, MAE: 0.0713, Spearman rho: 0.4685, Spearman p: 5.8104e-34, Pearson r: 0.4735, Pearson p: 9.4676e-35
  Pred range: [0.0535, 0.3196], std: 0.0447
  RMSE : 0.0886, R2: 0.2244, MAE: 0.0704, Spearman rho: 0.4700, Spearman p: 3.4830e-34, Pearson r: 0.4747, Pearson p: 6.2128e-35
  Pred range: [0.0628, 0.3387], std: 0.0468
  RMSE : 0.0899, R2: 0.2015, MAE: 0.0722, Spearman rho: 0.4648, Spearman p: 2.1696e-33, Pearson r: 0.4696, Pearson p: 3.9822e-34
  Pred range: [0.0617, 0.3300], std: 0.0458
  RMSE : 0.0895, R2: 0.2093, MAE: 0.0717, Spearman rho: 0.4636, Spearman p: 3.3846e-33, Pearson r: 0.4700, Pearson p: 3.4346e-34
  Pred range: [0.0597, 0.3234], std: 0.0450
  RMSE : 0.0886, R2: 0.2235, MAE: 0.0708, Spearman rho: 0.4714, Spearman p: 2.0599e-34, Pearson r: 0.4789, Pearson p: 1.3205e-35
  Pred range: [0.0752, 0.3872], std: 0.0514
  RMSE : 0.0955, R2: 0.0987, MAE: 0.0776, Spearman rho: 0.4567, Spearman p: 3.8091e-32, Pearson r: 0.4652, Pearson p: 1.9393e-33
  Pred range: [0.0542, 0.3193], std: 0.0453
  RMSE : 0.0887, R2: 0.2231, MAE: 0.0705, Spearman rho: 0.4657, Spearman p: 1.5778e-33, Pearson r: 0.4731, Pearson p: 1.1201e-34
  Pred range: [0.0684, 0.3406], std: 0.0459
  RMSE : 0.0904, R2: 0.1924, MAE: 0.0729, Spearman rho: 0.4620, Spearman p: 5.9814e-33, Pearson r: 0.4693, Pearson p: 4.4584e-34
  Pred range: [0.0761, 0.3539], std: 0.0472
  RMSE : 0.0928, R2: 0.1488, MAE: 0.0753, Spearman rho: 0.4609, Spearman p: 8.8358e-33, Pearson r: 0.4689, Pearson p: 5.0426e-34
  Pred range: [0.0628, 0.3328], std: 0.0459
  RMSE : 0.0893, R2: 0.2113, MAE: 0.0717, Spearman rho: 0.4671, Spearman p: 9.5508e-34, Pearson r: 0.4737, Pearson p: 8.8111e-35
[I 2026-04-28 00:24:33,465] Trial 46 finished with value: 0.08859365937566412 and parameters: {'learning_rate': 0.00026926896571087105, 'batch_size': 4, 'num_epochs': 29, 'weight_decay': 0.009761930354974956, 'depth_complex': 3, 'depth_moderate': 4, 'depth_simple': 1, 'dropout': 0.20450008729187935, 'se_reduction': 7, 'hidden_dim_min': 5, 'base_loss': 'huber', 'huber_delta': 0.19830760650547682, 'focal_gamma': 2.6639221491902068, 'n_bins': 8, 'scheduler_patience': 4, 'scheduler_factor': 0.6206826282595865, 'early_stopping_patience': 8}. Best is trial 22 with value: 0.08764163086185245.
Train: 2407 rows (1613 IDs),Test: 598 rows (404 IDs) 

n_features_x : 6, n_features_per_modality: [16, 23, 19, 17, 7, 4, 4, 4, 1, 4]

--- ImbalancedRegressionLoss initialized ---
  Bins: 5, Focal gamma: 2.520730867451368, Base loss: mse
  Bin [0.00, 0.20): count= 1876, weight=0.002
  Bin [0.20, 0.40): count=  497, weight=0.007
  Bin [0.40, 0.60): count=   32, weight=0.111
  Bin [0.60, 0.80): count=    2, weight=1.220
  Bin [0.80, 1.00): count=    0, weight=3.660
-------------------------------------------

  Pred range: [0.0799, 0.4559], std: 0.0535
  RMSE : 0.1210, R2: -0.4465, MAE: 0.1001, Spearman rho: 0.3076, Spearman p: 1.4357e-14, Pearson r: 0.3023, Pearson p: 4.1988e-14
  Pred range: [0.0750, 0.4056], std: 0.0516
  RMSE : 0.1085, R2: -0.1632, MAE: 0.0896, Spearman rho: 0.3527, Spearman p: 5.9142e-19, Pearson r: 0.3499, Pearson p: 1.1542e-18
  Pred range: [0.0806, 0.4192], std: 0.0543
  RMSE : 0.1102, R2: -0.1992, MAE: 0.0912, Spearman rho: 0.3782, Spearman p: 9.0922e-22, Pearson r: 0.3796, Pearson p: 6.2431e-22
  Pred range: [0.0828, 0.3821], std: 0.0512
  RMSE : 0.1082, R2: -0.1573, MAE: 0.0898, Spearman rho: 0.3868, Spearman p: 8.8469e-23, Pearson r: 0.3898, Pearson p: 3.9300e-23
  Pred range: [0.0754, 0.3840], std: 0.0523
  RMSE : 0.1041, R2: -0.0717, MAE: 0.0860, Spearman rho: 0.4025, Spearman p: 1.0743e-24, Pearson r: 0.4056, Pearson p: 4.4148e-25
  Pred range: [0.0747, 0.3812], std: 0.0511
  RMSE : 0.1023, R2: -0.0342, MAE: 0.0843, Spearman rho: 0.4084, Spearman p: 1.9013e-25, Pearson r: 0.4128, Pearson p: 5.2577e-26
[I 2026-04-28 00:24:47,086] Trial 47 pruned. 
Train: 2407 rows (1613 IDs),Test: 598 rows (404 IDs) 

n_features_x : 6, n_features_per_modality: [16, 23, 19, 17, 7, 4, 4, 4, 1, 4]

--- ImbalancedRegressionLoss initialized ---
  Bins: 6, Focal gamma: 2.822277881414741, Base loss: huber
  Bin [0.00, 0.17): count= 1538, weight=0.002
  Bin [0.17, 0.33): count=  789, weight=0.005
  Bin [0.33, 0.50): count=   69, weight=0.053
  Bin [0.50, 0.67): count=   10, weight=0.339
  Bin [0.67, 0.83): count=    1, weight=1.867
  Bin [0.83, 1.00): count=    0, weight=3.733
-------------------------------------------

  Pred range: [0.0644, 0.3788], std: 0.0465
  RMSE : 0.0964, R2: 0.0815, MAE: 0.0780, Spearman rho: 0.3924, Spearman p: 1.9150e-23, Pearson r: 0.4052, Pearson p: 4.9206e-25
  Pred range: [0.0345, 0.3075], std: 0.0456
  RMSE : 0.0909, R2: 0.1831, MAE: 0.0708, Spearman rho: 0.4482, Spearman p: 6.9105e-31, Pearson r: 0.4551, Pearson p: 6.6317e-32
  Pred range: [0.0682, 0.3183], std: 0.0432
  RMSE : 0.0934, R2: 0.1380, MAE: 0.0756, Spearman rho: 0.4414, Spearman p: 6.5681e-30, Pearson r: 0.4497, Pearson p: 4.1732e-31
  Pred range: [0.0395, 0.3142], std: 0.0429
  RMSE : 0.0904, R2: 0.1929, MAE: 0.0706, Spearman rho: 0.4548, Spearman p: 7.2169e-32, Pearson r: 0.4587, Pearson p: 1.9187e-32
  Pred range: [0.0676, 0.3564], std: 0.0447
  RMSE : 0.0920, R2: 0.1643, MAE: 0.0737, Spearman rho: 0.4362, Spearman p: 3.5549e-29, Pearson r: 0.4408, Pearson p: 8.0134e-30
  Pred range: [0.0629, 0.3434], std: 0.0460
  RMSE : 0.0917, R2: 0.1692, MAE: 0.0735, Spearman rho: 0.4399, Spearman p: 1.0815e-29, Pearson r: 0.4447, Pearson p: 2.2122e-30
  Pred range: [0.0585, 0.3350], std: 0.0488
  RMSE : 0.0907, R2: 0.1868, MAE: 0.0722, Spearman rho: 0.4504, Spearman p: 3.2443e-31, Pearson r: 0.4539, Pearson p: 9.9967e-32
  Pred range: [0.0709, 0.3259], std: 0.0446
  RMSE : 0.0919, R2: 0.1647, MAE: 0.0740, Spearman rho: 0.4488, Spearman p: 5.5317e-31, Pearson r: 0.4558, Pearson p: 5.2334e-32
  Pred range: [0.0785, 0.3450], std: 0.0452
  RMSE : 0.0950, R2: 0.1084, MAE: 0.0771, Spearman rho: 0.4454, Spearman p: 1.7598e-30, Pearson r: 0.4517, Pearson p: 2.0895e-31
  Pred range: [0.0496, 0.3379], std: 0.0469
  RMSE : 0.0895, R2: 0.2091, MAE: 0.0707, Spearman rho: 0.4522, Spearman p: 1.7653e-31, Pearson r: 0.4574, Pearson p: 2.9823e-32
  Pred range: [0.0551, 0.2928], std: 0.0421
  RMSE : 0.0892, R2: 0.2133, MAE: 0.0706, Spearman rho: 0.4580, Spearman p: 2.3753e-32, Pearson r: 0.4643, Pearson p: 2.6126e-33
  Pred range: [0.0630, 0.3127], std: 0.0433
  RMSE : 0.0904, R2: 0.1929, MAE: 0.0723, Spearman rho: 0.4533, Spearman p: 1.2343e-31, Pearson r: 0.4579, Pearson p: 2.4622e-32
  Pred range: [0.0578, 0.2905], std: 0.0401
  RMSE : 0.0898, R2: 0.2036, MAE: 0.0714, Spearman rho: 0.4521, Spearman p: 1.8156e-31, Pearson r: 0.4563, Pearson p: 4.4016e-32
  Pred range: [0.0752, 0.3558], std: 0.0480
  RMSE : 0.0946, R2: 0.1148, MAE: 0.0766, Spearman rho: 0.4461, Spearman p: 1.4025e-30, Pearson r: 0.4524, Pearson p: 1.6815e-31
  Pred range: [0.0699, 0.3435], std: 0.0460
  RMSE : 0.0918, R2: 0.1666, MAE: 0.0736, Spearman rho: 0.4482, Spearman p: 6.8233e-31, Pearson r: 0.4515, Pearson p: 2.2897e-31
  Pred range: [0.0722, 0.3139], std: 0.0435
  RMSE : 0.0925, R2: 0.1543, MAE: 0.0747, Spearman rho: 0.4541, Spearman p: 9.3563e-32, Pearson r: 0.4612, Pearson p: 7.7626e-33
  Pred range: [0.0691, 0.3372], std: 0.0453
  RMSE : 0.0914, R2: 0.1743, MAE: 0.0734, Spearman rho: 0.4570, Spearman p: 3.4608e-32, Pearson r: 0.4629, Pearson p: 4.3891e-33
  Pred range: [0.0711, 0.3307], std: 0.0444
  RMSE : 0.0914, R2: 0.1741, MAE: 0.0734, Spearman rho: 0.4535, Spearman p: 1.1221e-31, Pearson r: 0.4581, Pearson p: 2.2921e-32
