[I 2026-04-27 19:22:02,327] Trial 48 pruned. 
Train: 2407 rows (1613 IDs),Test: 598 rows (404 IDs) 

n_features_x : 6, n_features_per_modality: [16, 23, 19, 17, 7, 4, 4, 4, 1, 4]

--- ImbalancedRegressionLoss initialized ---
  Bins: 18, Focal gamma: 2.621720846536441, Base loss: huber
  Bin [0.00, 0.06): count=  172, weight=0.058
  Bin [0.06, 0.11): count=  413, weight=0.024
  Bin [0.11, 0.17): count=  376, weight=0.027
  Bin [0.17, 0.22): count=  370, weight=0.027
  Bin [0.22, 0.28): count=  255, weight=0.040
  Bin [0.28, 0.33): count=  223, weight=0.045
  Bin [0.33, 0.39): count=   89, weight=0.112
  Bin [0.39, 0.44): count=  142, weight=0.071
  Bin [0.44, 0.50): count=  122, weight=0.082
  Bin [0.50, 0.56): count=   93, weight=0.108
  Bin [0.56, 0.61): count=   64, weight=0.156
  Bin [0.61, 0.67): count=   36, weight=0.273
  Bin [0.67, 0.72): count=   10, weight=0.920
  Bin [0.72, 0.78): count=   26, weight=0.375
  Bin [0.78, 0.83): count=    9, weight=1.012
  Bin [0.83, 0.89): count=    4, weight=2.023
  Bin [0.89, 0.94): count=    3, weight=2.529
  Bin [0.94, 1.00): count=    0, weight=10.117
-------------------------------------------

  Pred range: [0.1065, 0.6204], std: 0.0690
  RMSE : 0.1694, R2: 0.0417, MAE: 0.1386, Spearman rho: 0.2975, Spearman p: 1.0861e-13, Pearson r: 0.3242, Pearson p: 4.1825e-16
  Pred range: [0.1059, 0.6031], std: 0.0802
  RMSE : 0.1671, R2: 0.0682, MAE: 0.1384, Spearman rho: 0.4036, Spearman p: 7.8699e-25, Pearson r: 0.4150, Pearson p: 2.7060e-26
  Pred range: [0.1104, 0.6225], std: 0.0833
  RMSE : 0.1648, R2: 0.0940, MAE: 0.1361, Spearman rho: 0.4339, Spearman p: 7.5196e-29, Pearson r: 0.4381, Pearson p: 1.9717e-29
  Pred range: [0.1014, 0.5984], std: 0.0823
  RMSE : 0.1583, R2: 0.1633, MAE: 0.1289, Spearman rho: 0.4567, Spearman p: 3.7811e-32, Pearson r: 0.4589, Pearson p: 1.7410e-32
  Pred range: [0.0981, 0.6023], std: 0.0834
  RMSE : 0.1556, R2: 0.1918, MAE: 0.1254, Spearman rho: 0.4692, Spearman p: 4.6205e-34, Pearson r: 0.4729, Pearson p: 1.1742e-34
  Pred range: [0.1162, 0.6424], std: 0.0919
  RMSE : 0.1584, R2: 0.1629, MAE: 0.1296, Spearman rho: 0.4829, Spearman p: 2.8803e-36, Pearson r: 0.4875, Pearson p: 5.0004e-37
  Pred range: [0.1212, 0.6227], std: 0.0878
  RMSE : 0.1581, R2: 0.1659, MAE: 0.1302, Spearman rho: 0.4853, Spearman p: 1.1659e-36, Pearson r: 0.4928, Pearson p: 6.5658e-38
  Pred range: [0.1185, 0.6490], std: 0.0933
  RMSE : 0.1586, R2: 0.1600, MAE: 0.1307, Spearman rho: 0.4898, Spearman p: 2.0653e-37, Pearson r: 0.5002, Pearson p: 3.5676e-39
  Pred range: [0.1068, 0.5984], std: 0.0873
  RMSE : 0.1525, R2: 0.2236, MAE: 0.1228, Spearman rho: 0.4967, Spearman p: 1.4036e-38, Pearson r: 0.5051, Pearson p: 4.9816e-40
  Pred range: [0.1210, 0.6279], std: 0.0906
  RMSE : 0.1565, R2: 0.1820, MAE: 0.1285, Spearman rho: 0.4971, Spearman p: 1.1960e-38, Pearson r: 0.5072, Pearson p: 2.1174e-40
  Pred range: [0.1114, 0.6146], std: 0.0878
  RMSE : 0.1545, R2: 0.2037, MAE: 0.1261, Spearman rho: 0.4989, Spearman p: 5.8187e-39, Pearson r: 0.5093, Pearson p: 8.6256e-41
  Pred range: [0.1115, 0.6448], std: 0.0923
  RMSE : 0.1529, R2: 0.2197, MAE: 0.1234, Spearman rho: 0.4969, Spearman p: 1.2931e-38, Pearson r: 0.5072, Pearson p: 2.0885e-40
  Pred range: [0.1093, 0.6159], std: 0.0896
  RMSE : 0.1543, R2: 0.2058, MAE: 0.1257, Spearman rho: 0.4971, Spearman p: 1.1986e-38, Pearson r: 0.5078, Pearson p: 1.6114e-40
  Pred range: [0.1237, 0.6346], std: 0.0902
  RMSE : 0.1589, R2: 0.1570, MAE: 0.1316, Spearman rho: 0.4977, Spearman p: 9.3578e-39, Pearson r: 0.5076, Pearson p: 1.7740e-40
  Pred range: [0.1030, 0.6119], std: 0.0887
  RMSE : 0.1529, R2: 0.2194, MAE: 0.1239, Spearman rho: 0.4977, Spearman p: 9.7045e-39, Pearson r: 0.5092, Pearson p: 9.0213e-41
  Pred range: [0.1172, 0.6648], std: 0.0956
  RMSE : 0.1597, R2: 0.1487, MAE: 0.1320, Spearman rho: 0.4981, Spearman p: 8.0278e-39, Pearson r: 0.5093, Pearson p: 8.8512e-41
[I 2026-04-27 19:23:59,176] Trial 49 finished with value: 0.1525110768571232 and parameters: {'learning_rate': 0.00017302841481654086, 'batch_size': 6, 'num_epochs': 29, 'weight_decay': 5.889065119193181e-05, 'layers_PRS': 2, 'layers_SCZ15': 4, 'layers_ADHD9': 3, 'layers_ASD9': 5, 'layers_ACE15': 5, 'layers_ACE18': 7, 'layers_SUD18': 3, 'layers_SES': 5, 'layers_SEX': 2, 'dropout': 0.22005075204124935, 'se_reduction': 5, 'hidden_dim_min': 9, 'base_loss': 'huber', 'huber_delta': 0.16182039511071317, 'focal_gamma': 2.621720846536441, 'n_bins': 18, 'scheduler_patience': 4, 'scheduler_factor': 0.5473608891308444, 'early_stopping_patience': 7}. Best is trial 31 with value: 0.14835994978477499.
Train: 2407 rows (1613 IDs),Test: 598 rows (404 IDs) 

n_features_x : 6, n_features_per_modality: [16, 23, 19, 17, 7, 4, 4, 4, 1, 4]

--- ImbalancedRegressionLoss initialized ---
  Bins: 6, Focal gamma: 2.939003955789496, Base loss: huber
  Bin [0.00, 0.17): count=  961, weight=0.041
  Bin [0.17, 0.33): count=  848, weight=0.047
  Bin [0.33, 0.50): count=  353, weight=0.112
  Bin [0.50, 0.67): count=  176, weight=0.224
  Bin [0.67, 0.83): count=   62, weight=0.628
  Bin [0.83, 1.00): count=    7, weight=4.948
-------------------------------------------

  Pred range: [0.0423, 0.4642], std: 0.0610
  RMSE : 0.1791, R2: -0.0705, MAE: 0.1325, Spearman rho: 0.1834, Spearman p: 6.3819e-06, Pearson r: 0.1910, Pearson p: 2.5433e-06
  Pred range: [0.0825, 0.5771], std: 0.0742
  RMSE : 0.1719, R2: 0.0135, MAE: 0.1375, Spearman rho: 0.2554, Spearman p: 2.3196e-10, Pearson r: 0.2659, Pearson p: 3.9263e-11
  Pred range: [0.0865, 0.5889], std: 0.0755
  RMSE : 0.1716, R2: 0.0176, MAE: 0.1386, Spearman rho: 0.2863, Spearman p: 9.5302e-13, Pearson r: 0.2994, Pearson p: 7.5427e-14
  Pred range: [0.0858, 0.5792], std: 0.0751
  RMSE : 0.1688, R2: 0.0491, MAE: 0.1362, Spearman rho: 0.3129, Spearman p: 4.7335e-15, Pearson r: 0.3262, Pearson p: 2.6982e-16
  Pred range: [0.0842, 0.5699], std: 0.0747
  RMSE : 0.1660, R2: 0.0797, MAE: 0.1334, Spearman rho: 0.3340, Spearman p: 4.7852e-17, Pearson r: 0.3482, Pearson p: 1.7258e-18
  Pred range: [0.0870, 0.5879], std: 0.0775
  RMSE : 0.1662, R2: 0.0779, MAE: 0.1346, Spearman rho: 0.3561, Spearman p: 2.5514e-19, Pearson r: 0.3701, Pearson p: 7.4788e-21
[I 2026-04-27 19:24:41,439] Trial 50 pruned. 
Train: 2407 rows (1613 IDs),Test: 598 rows (404 IDs) 

n_features_x : 6, n_features_per_modality: [16, 23, 19, 17, 7, 4, 4, 4, 1, 4]

--- ImbalancedRegressionLoss initialized ---
  Bins: 15, Focal gamma: 2.4158376558082217, Base loss: huber
  Bin [0.00, 0.07): count=  383, weight=0.040
  Bin [0.07, 0.13): count=  377, weight=0.041
  Bin [0.13, 0.20): count=  405, weight=0.038
  Bin [0.20, 0.27): count=  295, weight=0.052
  Bin [0.27, 0.33): count=  349, weight=0.044
  Bin [0.33, 0.40): count=  162, weight=0.094
  Bin [0.40, 0.47): count=  134, weight=0.114
  Bin [0.47, 0.53): count=  108, weight=0.141
  Bin [0.53, 0.60): count=   78, weight=0.194
  Bin [0.60, 0.67): count=   47, weight=0.320
  Bin [0.67, 0.73): count=   41, weight=0.365
  Bin [0.73, 0.80): count=   19, weight=0.767
  Bin [0.80, 0.87): count=    5, weight=2.558
  Bin [0.87, 0.93): count=    2, weight=5.116
  Bin [0.93, 1.00): count=    2, weight=5.116
-------------------------------------------

  Pred range: [0.1071, 0.7086], std: 0.1072
  RMSE : 0.1747, R2: -0.0184, MAE: 0.1463, Spearman rho: 0.4877, Spearman p: 4.6132e-37, Pearson r: 0.5000, Pearson p: 3.8824e-39
  Pred range: [0.0890, 0.6188], std: 0.1024
  RMSE : 0.1549, R2: 0.1990, MAE: 0.1264, Spearman rho: 0.4970, Spearman p: 1.2378e-38, Pearson r: 0.5185, Pearson p: 1.8525e-42
  Pred range: [0.0712, 0.5920], std: 0.0913
  RMSE : 0.1565, R2: 0.1820, MAE: 0.1281, Spearman rho: 0.4858, Spearman p: 9.7403e-37, Pearson r: 0.4997, Pearson p: 4.2914e-39
  Pred range: [0.0747, 0.5681], std: 0.0922
  RMSE : 0.1538, R2: 0.2104, MAE: 0.1245, Spearman rho: 0.4823, Spearman p: 3.6674e-36, Pearson r: 0.5042, Pearson p: 6.9746e-40
  Pred range: [0.0718, 0.6457], std: 0.0966
  RMSE : 0.1544, R2: 0.2038, MAE: 0.1257, Spearman rho: 0.4855, Spearman p: 1.0979e-36, Pearson r: 0.5065, Pearson p: 2.7810e-40
  Pred range: [0.0937, 0.7169], std: 0.1112
  RMSE : 0.1821, R2: -0.1064, MAE: 0.1528, Spearman rho: 0.4837, Spearman p: 2.1556e-36, Pearson r: 0.5016, Pearson p: 2.0029e-39
  Pred range: [0.0865, 0.6358], std: 0.0917
  RMSE : 0.1547, R2: 0.2011, MAE: 0.1250, Spearman rho: 0.4739, Spearman p: 8.2681e-35, Pearson r: 0.4917, Pearson p: 1.0061e-37
  Pred range: [0.0838, 0.6207], std: 0.0906
  RMSE : 0.1513, R2: 0.2358, MAE: 0.1198, Spearman rho: 0.4754, Spearman p: 4.8077e-35, Pearson r: 0.4972, Pearson p: 1.1793e-38
  Pred range: [0.0519, 0.6657], std: 0.0998
  RMSE : 0.1551, R2: 0.1974, MAE: 0.1247, Spearman rho: 0.4671, Spearman p: 9.5708e-34, Pearson r: 0.4823, Pearson p: 3.6041e-36
  Pred range: [0.0333, 0.6602], std: 0.0940
  RMSE : 0.1593, R2: 0.1533, MAE: 0.1304, Spearman rho: 0.4673, Spearman p: 9.0853e-34, Pearson r: 0.4839, Pearson p: 2.0253e-36
  Pred range: [0.0490, 0.7020], std: 0.1052
  RMSE : 0.1544, R2: 0.2046, MAE: 0.1242, Spearman rho: 0.4751, Spearman p: 5.4250e-35, Pearson r: 0.4965, Pearson p: 1.5115e-38
  Pred range: [0.0823, 0.6831], std: 0.0991
  RMSE : 0.1563, R2: 0.1841, MAE: 0.1267, Spearman rho: 0.4765, Spearman p: 3.1921e-35, Pearson r: 0.4920, Pearson p: 8.8331e-38
  Pred range: [0.0467, 0.7396], std: 0.0991
  RMSE : 0.1558, R2: 0.1901, MAE: 0.1252, Spearman rho: 0.4575, Spearman p: 2.8365e-32, Pearson r: 0.4772, Pearson p: 2.4431e-35
  Pred range: [0.0466, 0.6549], std: 0.0965
  RMSE : 0.1538, R2: 0.2106, MAE: 0.1233, Spearman rho: 0.4654, Spearman p: 1.7794e-33, Pearson r: 0.4891, Pearson p: 2.6945e-37
  Pred range: [0.0226, 0.7481], std: 0.1098
  RMSE : 0.1637, R2: 0.1060, MAE: 0.1338, Spearman rho: 0.4594, Spearman p: 1.4560e-32, Pearson r: 0.4830, Pearson p: 2.7658e-36
  Pred range: [-0.0023, 0.7810], std: 0.1111
  RMSE : 0.1614, R2: 0.1299, MAE: 0.1310, Spearman rho: 0.4612, Spearman p: 7.7802e-33, Pearson r: 0.4786, Pearson p: 1.4595e-35
[I 2026-04-27 19:26:41,563] Trial 51 finished with value: 0.15130578303013117 and parameters: {'learning_rate': 0.00189753078731315, 'batch_size': 6, 'num_epochs': 29, 'weight_decay': 1.5824109798916862e-05, 'layers_PRS': 3, 'layers_SCZ15': 4, 'layers_ADHD9': 2, 'layers_ASD9': 5, 'layers_ACE15': 5, 'layers_ACE18': 7, 'layers_SUD18': 2, 'layers_SES': 5, 'layers_SEX': 2, 'dropout': 0.11986955369533611, 'se_reduction': 3, 'hidden_dim_min': 3, 'base_loss': 'huber', 'huber_delta': 0.09871209948812898, 'focal_gamma': 2.4158376558082217, 'n_bins': 15, 'scheduler_patience': 4, 'scheduler_factor': 0.6648353591103222, 'early_stopping_patience': 8}. Best is trial 31 with value: 0.14835994978477499.
Train: 2407 rows (1613 IDs),Test: 598 rows (404 IDs) 

n_features_x : 6, n_features_per_modality: [16, 23, 19, 17, 7, 4, 4, 4, 1, 4]

--- ImbalancedRegressionLoss initialized ---
  Bins: 13, Focal gamma: 2.502757816994867, Base loss: huber
  Bin [0.00, 0.08): count=  383, weight=0.049
  Bin [0.08, 0.15): count=  578, weight=0.032
  Bin [0.15, 0.23): count=  370, weight=0.051
  Bin [0.23, 0.31): count=  368, weight=0.051
  Bin [0.31, 0.38): count=  199, weight=0.094
  Bin [0.38, 0.46): count=  207, weight=0.090
  Bin [0.46, 0.54): count=  108, weight=0.172
  Bin [0.54, 0.62): count=  106, weight=0.176
  Bin [0.62, 0.69): count=   36, weight=0.508
  Bin [0.69, 0.77): count=   36, weight=0.508
  Bin [0.77, 0.85): count=    9, weight=1.878
  Bin [0.85, 0.92): count=    5, weight=3.130
  Bin [0.92, 1.00): count=    2, weight=6.261
-------------------------------------------

  Pred range: [0.1036, 0.6669], std: 0.1016
  RMSE : 0.1667, R2: 0.0729, MAE: 0.1382, Spearman rho: 0.4690, Spearman p: 4.8813e-34, Pearson r: 0.4819, Pearson p: 4.2312e-36
  Pred range: [0.0990, 0.5605], std: 0.0820
  RMSE : 0.1564, R2: 0.1835, MAE: 0.1274, Spearman rho: 0.4728, Spearman p: 1.2187e-34, Pearson r: 0.4829, Pearson p: 2.9363e-36
  Pred range: [0.1218, 0.6224], std: 0.1000
  RMSE : 0.1680, R2: 0.0575, MAE: 0.1407, Spearman rho: 0.4808, Spearman p: 6.4060e-36, Pearson r: 0.4995, Pearson p: 4.6114e-39
  Pred range: [0.0968, 0.6350], std: 0.1032
  RMSE : 0.1679, R2: 0.0596, MAE: 0.1398, Spearman rho: 0.4773, Spearman p: 2.3224e-35, Pearson r: 0.5009, Pearson p: 2.6392e-39
  Pred range: [0.0638, 0.5697], std: 0.0898
  RMSE : 0.1586, R2: 0.1602, MAE: 0.1307, Spearman rho: 0.4731, Spearman p: 1.1022e-34, Pearson r: 0.4891, Pearson p: 2.7806e-37
  Pred range: [-0.0188, 0.5104], std: 0.0917
  RMSE : 0.1503, R2: 0.2456, MAE: 0.1171, Spearman rho: 0.4792, Spearman p: 1.1665e-35, Pearson r: 0.4967, Pearson p: 1.4197e-38
  Pred range: [0.0272, 0.6227], std: 0.1046
  RMSE : 0.1577, R2: 0.1694, MAE: 0.1286, Spearman rho: 0.4798, Spearman p: 9.4055e-36, Pearson r: 0.5005, Pearson p: 3.0790e-39
  Pred range: [0.0112, 0.5136], std: 0.0848
  RMSE : 0.1527, R2: 0.2221, MAE: 0.1241, Spearman rho: 0.4846, Spearman p: 1.5584e-36, Pearson r: 0.4986, Pearson p: 6.5959e-39
  Pred range: [0.0420, 0.5833], std: 0.0939
  RMSE : 0.1514, R2: 0.2349, MAE: 0.1222, Spearman rho: 0.4829, Spearman p: 2.9549e-36, Pearson r: 0.5047, Pearson p: 5.8049e-40
  Pred range: [0.0967, 0.6191], std: 0.1052
  RMSE : 0.1548, R2: 0.2005, MAE: 0.1263, Spearman rho: 0.4901, Spearman p: 1.8919e-37, Pearson r: 0.5095, Pearson p: 8.1631e-41
  Pred range: [0.0847, 0.5951], std: 0.0918
  RMSE : 0.1518, R2: 0.2305, MAE: 0.1239, Spearman rho: 0.4929, Spearman p: 6.3012e-38, Pearson r: 0.5158, Pearson p: 5.8434e-42
  Pred range: [0.0832, 0.6316], std: 0.0978
  RMSE : 0.1538, R2: 0.2100, MAE: 0.1258, Spearman rho: 0.4861, Spearman p: 8.5697e-37, Pearson r: 0.5081, Pearson p: 1.4167e-40
  Pred range: [0.0135, 0.5790], std: 0.0904
  RMSE : 0.1517, R2: 0.2314, MAE: 0.1224, Spearman rho: 0.4812, Spearman p: 5.4772e-36, Pearson r: 0.5017, Pearson p: 1.9375e-39
  Pred range: [0.0457, 0.6111], std: 0.0984
  RMSE : 0.1533, R2: 0.2159, MAE: 0.1244, Spearman rho: 0.4811, Spearman p: 5.8026e-36, Pearson r: 0.5009, Pearson p: 2.6490e-39
[I 2026-04-27 19:28:34,508] Trial 52 finished with value: 0.15033720975235523 and parameters: {'learning_rate': 0.0021928684640324103, 'batch_size': 6, 'num_epochs': 27, 'weight_decay': 4.131368545961531e-05, 'layers_PRS': 3, 'layers_SCZ15': 4, 'layers_ADHD9': 2, 'layers_ASD9': 5, 'layers_ACE15': 6, 'layers_ACE18': 7, 'layers_SUD18': 2, 'layers_SES': 5, 'layers_SEX': 3, 'dropout': 0.13931079617262057, 'se_reduction': 2, 'hidden_dim_min': 3, 'base_loss': 'huber', 'huber_delta': 0.1192738379239919, 'focal_gamma': 2.502757816994867, 'n_bins': 13, 'scheduler_patience': 4, 'scheduler_factor': 0.6285952719552613, 'early_stopping_patience': 8}. Best is trial 31 with value: 0.14835994978477499.
Train: 2407 rows (1613 IDs),Test: 598 rows (404 IDs) 

n_features_x : 6, n_features_per_modality: [16, 23, 19, 17, 7, 4, 4, 4, 1, 4]

--- ImbalancedRegressionLoss initialized ---
  Bins: 16, Focal gamma: 2.741089203591843, Base loss: huber
  Bin [0.00, 0.06): count=  383, weight=0.041
  Bin [0.06, 0.12): count=  377, weight=0.042
  Bin [0.12, 0.19): count=  405, weight=0.039
  Bin [0.19, 0.25): count=  295, weight=0.053
  Bin [0.25, 0.31): count=  239, weight=0.066
  Bin [0.31, 0.38): count=  199, weight=0.079
  Bin [0.38, 0.44): count=  142, weight=0.111
  Bin [0.44, 0.50): count=  122, weight=0.129
  Bin [0.50, 0.56): count=   93, weight=0.168
  Bin [0.56, 0.62): count=   64, weight=0.243
  Bin [0.62, 0.69): count=   36, weight=0.427
  Bin [0.69, 0.75): count=   24, weight=0.633
  Bin [0.75, 0.81): count=   19, weight=0.791
  Bin [0.81, 0.88): count=    5, weight=2.636
  Bin [0.88, 0.94): count=    2, weight=5.271
  Bin [0.94, 1.00): count=    2, weight=5.271
-------------------------------------------

  Pred range: [0.0913, 0.5470], std: 0.0740
  RMSE : 0.1570, R2: 0.1768, MAE: 0.1233, Spearman rho: 0.4082, Spearman p: 2.0366e-25, Pearson r: 0.4237, Pearson p: 1.8638e-27
  Pred range: [0.1209, 0.6759], std: 0.0926
  RMSE : 0.1699, R2: 0.0366, MAE: 0.1425, Spearman rho: 0.4469, Spearman p: 1.0473e-30, Pearson r: 0.4602, Pearson p: 1.1352e-32
  Pred range: [0.1116, 0.6200], std: 0.0855
  RMSE : 0.1571, R2: 0.1760, MAE: 0.1292, Spearman rho: 0.4735, Spearman p: 9.5776e-35, Pearson r: 0.4891, Pearson p: 2.7753e-37
  Pred range: [0.1047, 0.6005], std: 0.0832
  RMSE : 0.1528, R2: 0.2203, MAE: 0.1231, Spearman rho: 0.4777, Spearman p: 2.0338e-35, Pearson r: 0.4940, Pearson p: 4.0866e-38
  Pred range: [0.1098, 0.6272], std: 0.0907
  RMSE : 0.1563, R2: 0.1847, MAE: 0.1283, Spearman rho: 0.4822, Spearman p: 3.7837e-36, Pearson r: 0.5017, Pearson p: 1.8972e-39
  Pred range: [0.1069, 0.6512], std: 0.0918
  RMSE : 0.1601, R2: 0.1442, MAE: 0.1331, Spearman rho: 0.4794, Spearman p: 1.0859e-35, Pearson r: 0.4978, Pearson p: 9.1125e-39
  Pred range: [0.1220, 0.7263], std: 0.0962
  RMSE : 0.1684, R2: 0.0539, MAE: 0.1417, Spearman rho: 0.4783, Spearman p: 1.6059e-35, Pearson r: 0.4976, Pearson p: 1.0098e-38
  Pred range: [0.1040, 0.6689], std: 0.0968
  RMSE : 0.1583, R2: 0.1638, MAE: 0.1307, Spearman rho: 0.4856, Spearman p: 1.0566e-36, Pearson r: 0.5034, Pearson p: 9.5833e-40
  Pred range: [0.0526, 0.6636], std: 0.0927
  RMSE : 0.1558, R2: 0.1896, MAE: 0.1279, Spearman rho: 0.4781, Spearman p: 1.7572e-35, Pearson r: 0.4969, Pearson p: 1.3027e-38
  Pred range: [0.0815, 0.6826], std: 0.0948
  RMSE : 0.1609, R2: 0.1358, MAE: 0.1342, Spearman rho: 0.4847, Spearman p: 1.4540e-36, Pearson r: 0.5048, Pearson p: 5.5082e-40
  Pred range: [0.0496, 0.6403], std: 0.0914
  RMSE : 0.1540, R2: 0.2084, MAE: 0.1256, Spearman rho: 0.4829, Spearman p: 2.9434e-36, Pearson r: 0.5014, Pearson p: 2.1599e-39
  Pred range: [0.0879, 0.6587], std: 0.0909
  RMSE : 0.1600, R2: 0.1455, MAE: 0.1333, Spearman rho: 0.4807, Spearman p: 6.6290e-36, Pearson r: 0.5007, Pearson p: 2.8459e-39
