[I 2026-04-29 00:03:01,435] A new study created in memory with name: DCMFNet_Pos
Data shape: (4033, 125)
modality sizes for ['SUD15', 'PRS', 'SCZ15', 'ADHD9', 'ASD9', 'ACE15', 'ACE18', 'SUD18', 'SES', 'SEX', '^batch_.*_x_PC'] : [6, 16, 23, 19, 17, 7, 4, 4, 4, 1, 4]
Train: 3005 rows (2017 IDs),Test: 1028 rows (673 IDs) 


============================================================
  Tuning Pos symptom model (50 trials)
============================================================
  0%|          | 0/50 [00:00<?, ?it/s]                                        0%|          | 0/50 [01:26<?, ?it/s]Best trial: 0. Best value: 0.0908536:   0%|          | 0/50 [01:26<?, ?it/s]Best trial: 0. Best value: 0.0908536:   2%|▏         | 1/50 [01:26<1:10:22, 86.17s/it]                                                                                      Best trial: 0. Best value: 0.0908536:   2%|▏         | 1/50 [02:15<1:10:22, 86.17s/it]Best trial: 0. Best value: 0.0908536:   2%|▏         | 1/50 [02:15<1:10:22, 86.17s/it]Best trial: 0. Best value: 0.0908536:   4%|▍         | 2/50 [02:15<51:22, 64.23s/it]                                                                                      Best trial: 0. Best value: 0.0908536:   4%|▍         | 2/50 [04:18<51:22, 64.23s/it]Best trial: 0. Best value: 0.0908536:   4%|▍         | 2/50 [04:18<51:22, 64.23s/it]Best trial: 0. Best value: 0.0908536:   6%|▌         | 3/50 [04:18<1:11:40, 91.50s/it]                                                                                      Best trial: 0. Best value: 0.0908536:   6%|▌         | 3/50 [06:20<1:11:40, 91.50s/it]Best trial: 3. Best value: 0.0897253:   6%|▌         | 3/50 [06:20<1:11:40, 91.50s/it]Best trial: 3. Best value: 0.0897253:   8%|▊         | 4/50 [06:20<1:19:13, 103.34s/it]                                                                                       Best trial: 3. Best value: 0.0897253:   8%|▊         | 4/50 [07:09<1:19:13, 103.34s/it]Best trial: 4. Best value: 0.0891798:   8%|▊         | 4/50 [07:09<1:19:13, 103.34s/it]Best trial: 4. Best value: 0.0891798:  10%|█         | 5/50 [07:09<1:02:41, 83.58s/it]                                                                                       Best trial: 4. Best value: 0.0891798:  10%|█         | 5/50 [07:17<1:02:41, 83.58s/it]Best trial: 4. Best value: 0.0891798:  10%|█         | 5/50 [07:17<1:02:41, 83.58s/it]Best trial: 4. Best value: 0.0891798:  12%|█▏        | 6/50 [07:17<42:36, 58.10s/it]                                                                                      Best trial: 4. Best value: 0.0891798:  12%|█▏        | 6/50 [07:30<42:36, 58.10s/it]Best trial: 4. Best value: 0.0891798:  12%|█▏        | 6/50 [07:30<42:36, 58.10s/it]Best trial: 4. Best value: 0.0891798:  14%|█▍        | 7/50 [07:30<31:05, 43.38s/it]                                                                                    Best trial: 4. Best value: 0.0891798:  14%|█▍        | 7/50 [08:45<31:05, 43.38s/it]Best trial: 4. Best value: 0.0891798:  14%|█▍        | 7/50 [08:45<31:05, 43.38s/it]Best trial: 4. Best value: 0.0891798:  16%|█▌        | 8/50 [08:45<37:21, 53.36s/it]                                                                                    Best trial: 4. Best value: 0.0891798:  16%|█▌        | 8/50 [09:08<37:21, 53.36s/it]Best trial: 4. Best value: 0.0891798:  16%|█▌        | 8/50 [09:08<37:21, 53.36s/it]Best trial: 4. Best value: 0.0891798:  18%|█▊        | 9/50 [09:08<30:01, 43.95s/it]                                                                                    Best trial: 4. Best value: 0.0891798:  18%|█▊        | 9/50 [10:31<30:01, 43.95s/it]Best trial: 4. Best value: 0.0891798:  18%|█▊        | 9/50 [10:31<30:01, 43.95s/it]Best trial: 4. Best value: 0.0891798:  20%|██        | 10/50 [10:31<37:11, 55.79s/it]                                                                                     Best trial: 4. Best value: 0.0891798:  20%|██        | 10/50 [12:00<37:11, 55.79s/it]Best trial: 10. Best value: 0.0888396:  20%|██        | 10/50 [12:00<37:11, 55.79s/it]Best trial: 10. Best value: 0.0888396:  22%|██▏       | 11/50 [12:00<42:56, 66.07s/it]                                                                                      Best trial: 10. Best value: 0.0888396:  22%|██▏       | 11/50 [13:13<42:56, 66.07s/it]Best trial: 10. Best value: 0.0888396:  22%|██▏       | 11/50 [13:13<42:56, 66.07s/it]Best trial: 10. Best value: 0.0888396:  24%|██▍       | 12/50 [13:13<43:15, 68.29s/it]                                                                                      Best trial: 10. Best value: 0.0888396:  24%|██▍       | 12/50 [15:18<43:15, 68.29s/it]Best trial: 12. Best value: 0.0886974:  24%|██▍       | 12/50 [15:18<43:15, 68.29s/it]Best trial: 12. Best value: 0.0886974:  26%|██▌       | 13/50 [15:18<52:36, 85.30s/it]                                                                                      Best trial: 12. Best value: 0.0886974:  26%|██▌       | 13/50 [16:15<52:36, 85.30s/it]Best trial: 12. Best value: 0.0886974:  26%|██▌       | 13/50 [16:15<52:36, 85.30s/it]Best trial: 12. Best value: 0.0886974:  28%|██▊       | 14/50 [16:15<46:09, 76.92s/it]                                                                                      Best trial: 12. Best value: 0.0886974:  28%|██▊       | 14/50 [17:40<46:09, 76.92s/it]Best trial: 12. Best value: 0.0886974:  28%|██▊       | 14/50 [17:40<46:09, 76.92s/it]Best trial: 12. Best value: 0.0886974:  30%|███       | 15/50 [17:40<46:09, 79.14s/it]                                                                                      Best trial: 12. Best value: 0.0886974:  30%|███       | 15/50 [19:02<46:09, 79.14s/it]Best trial: 12. Best value: 0.0886974:  30%|███       | 15/50 [19:02<46:09, 79.14s/it]Best trial: 12. Best value: 0.0886974:  32%|███▏      | 16/50 [19:02<45:19, 79.99s/it]                                                                                      Best trial: 12. Best value: 0.0886974:  32%|███▏      | 16/50 [20:39<45:19, 79.99s/it]Best trial: 12. Best value: 0.0886974:  32%|███▏      | 16/50 [20:39<45:19, 79.99s/it]Best trial: 12. Best value: 0.0886974:  34%|███▍      | 17/50 [20:39<46:55, 85.32s/it]                                                                                      Best trial: 12. Best value: 0.0886974:  34%|███▍      | 17/50 [21:01<46:55, 85.32s/it]Best trial: 12. Best value: 0.0886974:  34%|███▍      | 17/50 [21:01<46:55, 85.32s/it]Best trial: 12. Best value: 0.0886974:  36%|███▌      | 18/50 [21:01<35:19, 66.24s/it]                                                                                      Best trial: 12. Best value: 0.0886974:  36%|███▌      | 18/50 [21:08<35:19, 66.24s/it]Best trial: 12. Best value: 0.0886974:  36%|███▌      | 18/50 [21:08<35:19, 66.24s/it]Best trial: 12. Best value: 0.0886974:  38%|███▊      | 19/50 [21:08<25:04, 48.52s/it]                                                                                      Best trial: 12. Best value: 0.0886974:  38%|███▊      | 19/50 [22:26<25:04, 48.52s/it]Best trial: 12. Best value: 0.0886974:  38%|███▊      | 19/50 [22:26<25:04, 48.52s/it]Best trial: 12. Best value: 0.0886974:  40%|████      | 20/50 [22:26<28:37, 57.26s/it]                                                                                      Best trial: 12. Best value: 0.0886974:  40%|████      | 20/50 [24:15<28:37, 57.26s/it]Best trial: 12. Best value: 0.0886974:  40%|████      | 20/50 [24:15<28:37, 57.26s/it]Best trial: 12. Best value: 0.0886974:  42%|████▏     | 21/50 [24:15<35:12, 72.83s/it]                                                                                      Best trial: 12. Best value: 0.0886974:  42%|████▏     | 21/50 [26:17<35:12, 72.83s/it]Best trial: 12. Best value: 0.0886974:  42%|████▏     | 21/50 [26:17<35:12, 72.83s/it]Best trial: 12. Best value: 0.0886974:  44%|████▍     | 22/50 [26:17<40:52, 87.60s/it]                                                                                      Best trial: 12. Best value: 0.0886974:  44%|████▍     | 22/50 [27:59<40:52, 87.60s/it]Best trial: 12. Best value: 0.0886974:  44%|████▍     | 22/50 [27:59<40:52, 87.60s/it]Best trial: 12. Best value: 0.0886974:  46%|████▌     | 23/50 [27:59<41:23, 92.00s/it]                                                                                      Best trial: 12. Best value: 0.0886974:  46%|████▌     | 23/50 [28:46<41:23, 92.00s/it]Best trial: 12. Best value: 0.0886974:  46%|████▌     | 23/50 [28:46<41:23, 92.00s/it]Best trial: 12. Best value: 0.0886974:  48%|████▊     | 24/50 [28:46<33:59, 78.44s/it]                                                                                      Best trial: 12. Best value: 0.0886974:  48%|████▊     | 24/50 [30:35<33:59, 78.44s/it]Best trial: 24. Best value: 0.0884305:  48%|████▊     | 24/50 [30:35<33:59, 78.44s/it]Best trial: 24. Best value: 0.0884305:  50%|█████     | 25/50 [30:35<36:26, 87.44s/it]                                                                                      Best trial: 24. Best value: 0.0884305:  50%|█████     | 25/50 [30:48<36:26, 87.44s/it]Best trial: 24. Best value: 0.0884305:  50%|█████     | 25/50 [30:48<36:26, 87.44s/it]Best trial: 24. Best value: 0.0884305:  52%|█████▏    | 26/50 [30:48<26:03, 65.15s/it]                                                                                      Best trial: 24. Best value: 0.0884305:  52%|█████▏    | 26/50 [34:04<26:03, 65.15s/it]Best trial: 24. Best value: 0.0884305:  52%|█████▏    | 26/50 [34:04<26:03, 65.15s/it]Best trial: 24. Best value: 0.0884305:  54%|█████▍    | 27/50 [34:04<40:04, 104.52s/it]                                                                                       Best trial: 24. Best value: 0.0884305:  54%|█████▍    | 27/50 [34:11<40:04, 104.52s/it]Best trial: 24. Best value: 0.0884305:  54%|█████▍    | 27/50 [34:11<40:04, 104.52s/it]Best trial: 24. Best value: 0.0884305:  56%|█████▌    | 28/50 [34:11<27:33, 75.15s/it]                                                                                       Best trial: 24. Best value: 0.0884305:  56%|█████▌    | 28/50 [35:01<27:33, 75.15s/it]Best trial: 24. Best value: 0.0884305:  56%|█████▌    | 28/50 [35:01<27:33, 75.15s/it]Best trial: 24. Best value: 0.0884305:  58%|█████▊    | 29/50 [35:01<23:38, 67.53s/it]                                                                                      Best trial: 24. Best value: 0.0884305:  58%|█████▊    | 29/50 [36:45<23:38, 67.53s/it]Best trial: 24. Best value: 0.0884305:  58%|█████▊    | 29/50 [36:45<23:38, 67.53s/it]Best trial: 24. Best value: 0.0884305:  60%|██████    | 30/50 [36:45<26:12, 78.61s/it]                                                                                      Best trial: 24. Best value: 0.0884305:  60%|██████    | 30/50 [38:17<26:12, 78.61s/it]Best trial: 24. Best value: 0.0884305:  60%|██████    | 30/50 [38:17<26:12, 78.61s/it]Best trial: 24. Best value: 0.0884305:  62%|██████▏   | 31/50 [38:17<26:12, 82.77s/it]                                                                                      Best trial: 24. Best value: 0.0884305:  62%|██████▏   | 31/50 [40:12<26:12, 82.77s/it]Best trial: 24. Best value: 0.0884305:  62%|██████▏   | 31/50 [40:12<26:12, 82.77s/it]Best trial: 24. Best value: 0.0884305:  64%|██████▍   | 32/50 [40:12<27:42, 92.38s/it]                                                                                      Best trial: 24. Best value: 0.0884305:  64%|██████▍   | 32/50 [42:14<27:42, 92.38s/it]Best trial: 32. Best value: 0.0883405:  64%|██████▍   | 32/50 [42:14<27:42, 92.38s/it]Best trial: 32. Best value: 0.0883405:  66%|██████▌   | 33/50 [42:14<28:38, 101.09s/it]                                                                                       Best trial: 32. Best value: 0.0883405:  66%|██████▌   | 33/50 [43:04<28:38, 101.09s/it]Best trial: 32. Best value: 0.0883405:  66%|██████▌   | 33/50 [43:04<28:38, 101.09s/it]Best trial: 32. Best value: 0.0883405:  68%|██████▊   | 34/50 [43:04<22:55, 85.96s/it]                                                                                       Best trial: 32. Best value: 0.0883405:  68%|██████▊   | 34/50 [45:00<22:55, 85.96s/it]Best trial: 32. Best value: 0.0883405:  68%|██████▊   | 34/50 [45:00<22:55, 85.96s/it]Best trial: 32. Best value: 0.0883405:  70%|███████   | 35/50 [45:00<23:42, 94.84s/it]                                                                                      Best trial: 32. Best value: 0.0883405:  70%|███████   | 35/50 [47:06<23:42, 94.84s/it]Best trial: 32. Best value: 0.0883405:  70%|███████   | 35/50 [47:06<23:42, 94.84s/it]Best trial: 32. Best value: 0.0883405:  72%|███████▏  | 36/50 [47:06<24:19, 104.26s/it]                                                                                       Best trial: 32. Best value: 0.0883405:  72%|███████▏  | 36/50 [47:14<24:19, 104.26s/it]Best trial: 32. Best value: 0.0883405:  72%|███████▏  | 36/50 [47:14<24:19, 104.26s/it]Best trial: 32. Best value: 0.0883405:  74%|███████▍  | 37/50 [47:14<16:21, 75.47s/it]                                                                                       Best trial: 32. Best value: 0.0883405:  74%|███████▍  | 37/50 [49:10<16:21, 75.47s/it]Best trial: 32. Best value: 0.0883405:  74%|███████▍  | 37/50 [49:10<16:21, 75.47s/it]Best trial: 32. Best value: 0.0883405:  76%|███████▌  | 38/50 [49:10<17:29, 87.47s/it]                                                                                      Best trial: 32. Best value: 0.0883405:  76%|███████▌  | 38/50 [49:25<17:29, 87.47s/it]Best trial: 32. Best value: 0.0883405:  76%|███████▌  | 38/50 [49:25<17:29, 87.47s/it]Best trial: 32. Best value: 0.0883405:  78%|███████▊  | 39/50 [49:25<12:04, 65.83s/it]                                                                                      Best trial: 32. Best value: 0.0883405:  78%|███████▊  | 39/50 [50:30<12:04, 65.83s/it]Best trial: 32. Best value: 0.0883405:  78%|███████▊  | 39/50 [50:30<12:04, 65.83s/it]Best trial: 32. Best value: 0.0883405:  80%|████████  | 40/50 [50:30<10:54, 65.40s/it]                                                                                      Best trial: 32. Best value: 0.0883405:  80%|████████  | 40/50 [51:19<10:54, 65.40s/it]Best trial: 32. Best value: 0.0883405:  80%|████████  | 40/50 [51:19<10:54, 65.40s/it]Best trial: 32. Best value: 0.0883405:  82%|████████▏ | 41/50 [51:19<09:04, 60.50s/it]                                                                                      Best trial: 32. Best value: 0.0883405:  82%|████████▏ | 41/50 [53:13<09:04, 60.50s/it]Best trial: 32. Best value: 0.0883405:  82%|████████▏ | 41/50 [53:13<09:04, 60.50s/it]Best trial: 32. Best value: 0.0883405:  84%|████████▍ | 42/50 [53:13<10:12, 76.62s/it]                                                                                      Best trial: 32. Best value: 0.0883405:  84%|████████▍ | 42/50 [55:10<10:12, 76.62s/it]Best trial: 32. Best value: 0.0883405:  84%|████████▍ | 42/50 [55:10<10:12, 76.62s/it]Best trial: 32. Best value: 0.0883405:  86%|████████▌ | 43/50 [55:10<10:22, 88.88s/it]                                                                                      Best trial: 32. Best value: 0.0883405:  86%|████████▌ | 43/50 [56:52<10:22, 88.88s/it]Best trial: 32. Best value: 0.0883405:  86%|████████▌ | 43/50 [56:52<10:22, 88.88s/it]Best trial: 32. Best value: 0.0883405:  88%|████████▊ | 44/50 [56:52<09:15, 92.58s/it]                                                                                      Best trial: 32. Best value: 0.0883405:  88%|████████▊ | 44/50 [58:26<09:15, 92.58s/it]Best trial: 44. Best value: 0.0882818:  88%|████████▊ | 44/50 [58:26<09:15, 92.58s/it]Best trial: 44. Best value: 0.0882818:  90%|█████████ | 45/50 [58:26<07:45, 93.10s/it]                                                                                      Best trial: 44. Best value: 0.0882818:  90%|█████████ | 45/50 [59:35<07:45, 93.10s/it]Best trial: 44. Best value: 0.0882818:  90%|█████████ | 45/50 [59:35<07:45, 93.10s/it]Best trial: 44. Best value: 0.0882818:  92%|█████████▏| 46/50 [59:35<05:43, 85.94s/it]                                                                                      Best trial: 44. Best value: 0.0882818:  92%|█████████▏| 46/50 [59:53<05:43, 85.94s/it]Best trial: 44. Best value: 0.0882818:  92%|█████████▏| 46/50 [59:53<05:43, 85.94s/it]Best trial: 44. Best value: 0.0882818:  94%|█████████▍| 47/50 [59:53<03:16, 65.39s/it]                                                                                      Best trial: 44. Best value: 0.0882818:  94%|█████████▍| 47/50 [1:01:26<03:16, 65.39s/it]Best trial: 47. Best value: 0.088109:  94%|█████████▍| 47/50 [1:01:26<03:16, 65.39s/it] Best trial: 47. Best value: 0.088109:  96%|█████████▌| 48/50 [1:01:26<02:27, 73.65s/it]                                                                                       Best trial: 47. Best value: 0.088109:  96%|█████████▌| 48/50 [1:02:27<02:27, 73.65s/it]Best trial: 47. Best value: 0.088109:  96%|█████████▌| 48/50 [1:02:27<02:27, 73.65s/it]Best trial: 47. Best value: 0.088109:  98%|█████████▊| 49/50 [1:02:27<01:09, 69.85s/it]                                                                                       Best trial: 47. Best value: 0.088109:  98%|█████████▊| 49/50 [1:03:54<01:09, 69.85s/it]Best trial: 47. Best value: 0.088109:  98%|█████████▊| 49/50 [1:03:54<01:09, 69.85s/it]Best trial: 47. Best value: 0.088109: 100%|██████████| 50/50 [1:03:54<00:00, 75.23s/it]Best trial: 47. Best value: 0.088109: 100%|██████████| 50/50 [1:03:54<00:00, 76.70s/it]
[I 2026-04-29 01:07:03,918] A new study created in memory with name: DCMFNet_Neg
Train: 2407 rows (1613 IDs),Test: 598 rows (404 IDs) 

n_features_x : 6, n_features_per_modality: [16, 23, 19, 17, 7, 4, 4, 4, 1, 4]

--- ImbalancedRegressionLoss initialized ---
  Bins: 5, Focal gamma: 2.8549161502623557, Base loss: mse
  Bin [0.00, 0.20): count= 1876, weight=0.002
  Bin [0.20, 0.40): count=  497, weight=0.007
  Bin [0.40, 0.60): count=   32, weight=0.111
  Bin [0.60, 0.80): count=    2, weight=1.220
  Bin [0.80, 1.00): count=    0, weight=3.660
-------------------------------------------

  Pred range: [0.0571, 0.3660], std: 0.0484
  RMSE : 0.1049, R2: -0.0878, MAE: 0.0859, Spearman rho: 0.3659, Spearman p: 2.2334e-20, Pearson r: 0.3773, Pearson p: 1.1506e-21
  Pred range: [0.0580, 0.3430], std: 0.0500
  RMSE : 0.0949, R2: 0.1109, MAE: 0.0766, Spearman rho: 0.4080, Spearman p: 2.1449e-25, Pearson r: 0.4158, Pearson p: 2.1039e-26
  Pred range: [0.0684, 0.3458], std: 0.0461
  RMSE : 0.0924, R2: 0.1564, MAE: 0.0747, Spearman rho: 0.4438, Spearman p: 2.9631e-30, Pearson r: 0.4512, Pearson p: 2.4760e-31
  Pred range: [0.0631, 0.3502], std: 0.0468
  RMSE : 0.0919, R2: 0.1654, MAE: 0.0743, Spearman rho: 0.4274, Spearman p: 6.0019e-28, Pearson r: 0.4380, Pearson p: 2.0294e-29
  Pred range: [0.0651, 0.3981], std: 0.0496
  RMSE : 0.0926, R2: 0.1522, MAE: 0.0750, Spearman rho: 0.4429, Spearman p: 4.0165e-30, Pearson r: 0.4508, Pearson p: 2.8980e-31
  Pred range: [0.0692, 0.3658], std: 0.0448
  RMSE : 0.0933, R2: 0.1406, MAE: 0.0759, Spearman rho: 0.4242, Spearman p: 1.6052e-27, Pearson r: 0.4329, Pearson p: 1.0437e-28
  Pred range: [0.0592, 0.3923], std: 0.0524
  RMSE : 0.0934, R2: 0.1385, MAE: 0.0755, Spearman rho: 0.4428, Spearman p: 4.1697e-30, Pearson r: 0.4488, Pearson p: 5.6230e-31
  Pred range: [0.0533, 0.4041], std: 0.0527
  RMSE : 0.0952, R2: 0.1041, MAE: 0.0774, Spearman rho: 0.4376, Spearman p: 2.3018e-29, Pearson r: 0.4467, Pearson p: 1.1310e-30
  Pred range: [0.0272, 0.3525], std: 0.0465
  RMSE : 0.0909, R2: 0.1843, MAE: 0.0731, Spearman rho: 0.4318, Spearman p: 1.4750e-28, Pearson r: 0.4443, Pearson p: 2.5264e-30
  Pred range: [0.0274, 0.3495], std: 0.0464
  RMSE : 0.0912, R2: 0.1774, MAE: 0.0736, Spearman rho: 0.4269, Spearman p: 7.0670e-28, Pearson r: 0.4409, Pearson p: 7.7360e-30
  Pred range: [0.0507, 0.3972], std: 0.0481
  RMSE : 0.0966, R2: 0.0788, MAE: 0.0789, Spearman rho: 0.4265, Spearman p: 7.8885e-28, Pearson r: 0.4376, Pearson p: 2.2618e-29
