[I 2026-04-27 23:19:56,597] Trial 6 pruned. 
Train: 2407 rows (1613 IDs),Test: 598 rows (404 IDs) 

n_features_x : 6, n_features_per_modality: [16, 23, 19, 17, 7, 4, 4, 4, 1, 4]

--- ImbalancedRegressionLoss initialized ---
  Bins: 14, Focal gamma: 2.952761373300512, Base loss: mse
  Bin [0.00, 0.07): count=  828, weight=0.003
  Bin [0.07, 0.14): count=  542, weight=0.005
  Bin [0.14, 0.21): count=  506, weight=0.005
  Bin [0.21, 0.29): count=  386, weight=0.007
  Bin [0.29, 0.36): count=   91, weight=0.029
  Bin [0.36, 0.43): count=   29, weight=0.090
  Bin [0.43, 0.50): count=   12, weight=0.207
  Bin [0.50, 0.57): count=   11, weight=0.224
  Bin [0.57, 0.64): count=    1, weight=1.343
  Bin [0.64, 0.71): count=    1, weight=1.343
  Bin [0.71, 0.79): count=    0, weight=2.686
  Bin [0.79, 0.86): count=    0, weight=2.686
  Bin [0.86, 0.93): count=    0, weight=2.686
  Bin [0.93, 1.00): count=    0, weight=2.686
-------------------------------------------

  Pred range: [0.0439, 0.3285], std: 0.0491
  RMSE : 0.0932, R2: 0.1416, MAE: 0.0742, Spearman rho: 0.3772, Spearman p: 1.1634e-21, Pearson r: 0.3920, Pearson p: 2.1006e-23
  Pred range: [0.0752, 0.4114], std: 0.0521
  RMSE : 0.1015, R2: -0.0179, MAE: 0.0834, Spearman rho: 0.4045, Spearman p: 5.9815e-25, Pearson r: 0.4158, Pearson p: 2.1198e-26
  Pred range: [0.0256, 0.3173], std: 0.0449
  RMSE : 0.0902, R2: 0.1954, MAE: 0.0722, Spearman rho: 0.4280, Spearman p: 4.9905e-28, Pearson r: 0.4435, Pearson p: 3.3249e-30
  Pred range: [0.0344, 0.3340], std: 0.0470
  RMSE : 0.0912, R2: 0.1777, MAE: 0.0736, Spearman rho: 0.4293, Spearman p: 3.2265e-28, Pearson r: 0.4430, Pearson p: 3.8935e-30
  Pred range: [0.0313, 0.3281], std: 0.0447
  RMSE : 0.0901, R2: 0.1981, MAE: 0.0721, Spearman rho: 0.4325, Spearman p: 1.1957e-28, Pearson r: 0.4462, Pearson p: 1.3577e-30
  Pred range: [0.0553, 0.3648], std: 0.0483
  RMSE : 0.0943, R2: 0.1218, MAE: 0.0766, Spearman rho: 0.4323, Spearman p: 1.2613e-28, Pearson r: 0.4460, Pearson p: 1.4412e-30
  Pred range: [0.0082, 0.3331], std: 0.0457
  RMSE : 0.0895, R2: 0.2080, MAE: 0.0709, Spearman rho: 0.4496, Spearman p: 4.2931e-31, Pearson r: 0.4599, Pearson p: 1.2554e-32
  Pred range: [0.0588, 0.3919], std: 0.0501
  RMSE : 0.0960, R2: 0.0891, MAE: 0.0781, Spearman rho: 0.4402, Spearman p: 9.6644e-30, Pearson r: 0.4504, Pearson p: 3.2460e-31
  Pred range: [0.0193, 0.3693], std: 0.0473
  RMSE : 0.0914, R2: 0.1747, MAE: 0.0738, Spearman rho: 0.4454, Spearman p: 1.7792e-30, Pearson r: 0.4523, Pearson p: 1.7323e-31
  Pred range: [0.0448, 0.3789], std: 0.0486
  RMSE : 0.0932, R2: 0.1413, MAE: 0.0757, Spearman rho: 0.4400, Spearman p: 1.0423e-29, Pearson r: 0.4494, Pearson p: 4.6475e-31
[I 2026-04-27 23:21:19,318] Trial 7 finished with value: 0.08952313727593075 and parameters: {'learning_rate': 0.00041286275427685187, 'batch_size': 4, 'num_epochs': 15, 'weight_decay': 0.0008641750509472987, 'depth_complex': 5, 'depth_moderate': 2, 'depth_simple': 2, 'dropout': 0.3116907533874032, 'se_reduction': 6, 'hidden_dim_min': 6, 'base_loss': 'mse', 'huber_delta': 0.16819419359046625, 'focal_gamma': 2.952761373300512, 'n_bins': 14, 'scheduler_patience': 3, 'scheduler_factor': 0.5128333701542522, 'early_stopping_patience': 3}. Best is trial 7 with value: 0.08952313727593075.
Train: 2407 rows (1613 IDs),Test: 598 rows (404 IDs) 

n_features_x : 6, n_features_per_modality: [16, 23, 19, 17, 7, 4, 4, 4, 1, 4]

--- ImbalancedRegressionLoss initialized ---
  Bins: 6, Focal gamma: 1.8059787653716919, Base loss: huber
  Bin [0.00, 0.17): count= 1538, weight=0.002
  Bin [0.17, 0.33): count=  789, weight=0.005
  Bin [0.33, 0.50): count=   69, weight=0.053
  Bin [0.50, 0.67): count=   10, weight=0.339
  Bin [0.67, 0.83): count=    1, weight=1.867
  Bin [0.83, 1.00): count=    0, weight=3.733
-------------------------------------------

  Pred range: [0.0350, 0.3519], std: 0.0508
  RMSE : 0.0901, R2: 0.1981, MAE: 0.0713, Spearman rho: 0.4471, Spearman p: 9.9480e-31, Pearson r: 0.4526, Pearson p: 1.5735e-31
  Pred range: [0.0287, 0.3523], std: 0.0521
  RMSE : 0.0897, R2: 0.2058, MAE: 0.0713, Spearman rho: 0.4633, Spearman p: 3.8232e-33, Pearson r: 0.4687, Pearson p: 5.4791e-34
  Pred range: [0.0207, 0.3631], std: 0.0568
  RMSE : 0.0891, R2: 0.2157, MAE: 0.0701, Spearman rho: 0.4718, Spearman p: 1.7649e-34, Pearson r: 0.4747, Pearson p: 6.2543e-35
  Pred range: [0.0549, 0.4412], std: 0.0624
  RMSE : 0.0991, R2: 0.0289, MAE: 0.0804, Spearman rho: 0.4617, Spearman p: 6.5925e-33, Pearson r: 0.4688, Pearson p: 5.3650e-34
  Pred range: [0.0020, 0.3423], std: 0.0592
  RMSE : 0.0890, R2: 0.2180, MAE: 0.0686, Spearman rho: 0.4819, Spearman p: 4.1927e-36, Pearson r: 0.4884, Pearson p: 3.5363e-37
  Pred range: [0.0542, 0.3767], std: 0.0557
  RMSE : 0.0928, R2: 0.1486, MAE: 0.0748, Spearman rho: 0.4675, Spearman p: 8.3878e-34, Pearson r: 0.4752, Pearson p: 5.0420e-35
  Pred range: [0.0212, 0.3133], std: 0.0474
  RMSE : 0.0894, R2: 0.2102, MAE: 0.0698, Spearman rho: 0.4797, Spearman p: 9.5822e-36, Pearson r: 0.4838, Pearson p: 2.0521e-36
  Pred range: [0.0297, 0.3570], std: 0.0540
  RMSE : 0.0893, R2: 0.2128, MAE: 0.0702, Spearman rho: 0.4632, Spearman p: 3.8946e-33, Pearson r: 0.4671, Pearson p: 9.7579e-34
  Pred range: [0.0485, 0.3683], std: 0.0530
  RMSE : 0.0896, R2: 0.2066, MAE: 0.0716, Spearman rho: 0.4751, Spearman p: 5.4051e-35, Pearson r: 0.4804, Pearson p: 7.5817e-36
  Pred range: [0.0326, 0.3380], std: 0.0519
  RMSE : 0.0880, R2: 0.2349, MAE: 0.0694, Spearman rho: 0.4815, Spearman p: 5.0078e-36, Pearson r: 0.4858, Pearson p: 9.5515e-37
  Pred range: [0.0441, 0.3588], std: 0.0549
  RMSE : 0.0892, R2: 0.2145, MAE: 0.0710, Spearman rho: 0.4808, Spearman p: 6.4342e-36, Pearson r: 0.4833, Pearson p: 2.5428e-36
  Pred range: [0.0577, 0.3740], std: 0.0531
  RMSE : 0.0915, R2: 0.1735, MAE: 0.0738, Spearman rho: 0.4811, Spearman p: 5.6846e-36, Pearson r: 0.4837, Pearson p: 2.1163e-36
  Pred range: [0.0594, 0.3892], std: 0.0564
  RMSE : 0.0940, R2: 0.1276, MAE: 0.0758, Spearman rho: 0.4736, Spearman p: 9.3948e-35, Pearson r: 0.4769, Pearson p: 2.7738e-35
  Pred range: [0.0485, 0.3625], std: 0.0539
  RMSE : 0.0895, R2: 0.2084, MAE: 0.0715, Spearman rho: 0.4824, Spearman p: 3.5633e-36, Pearson r: 0.4871, Pearson p: 5.9027e-37
  Pred range: [0.0365, 0.3276], std: 0.0493
  RMSE : 0.0879, R2: 0.2370, MAE: 0.0693, Spearman rho: 0.4841, Spearman p: 1.8268e-36, Pearson r: 0.4883, Pearson p: 3.7914e-37
  Pred range: [0.0426, 0.3486], std: 0.0523
  RMSE : 0.0880, R2: 0.2350, MAE: 0.0697, Spearman rho: 0.4875, Spearman p: 5.0666e-37, Pearson r: 0.4917, Pearson p: 1.0107e-37
  Pred range: [0.0519, 0.3626], std: 0.0541
  RMSE : 0.0906, R2: 0.1880, MAE: 0.0728, Spearman rho: 0.4837, Spearman p: 2.1708e-36, Pearson r: 0.4888, Pearson p: 3.0577e-37
  Pred range: [0.0556, 0.3782], std: 0.0550
  RMSE : 0.0921, R2: 0.1623, MAE: 0.0744, Spearman rho: 0.4863, Spearman p: 7.9356e-37, Pearson r: 0.4902, Pearson p: 1.8094e-37
  Pred range: [0.0432, 0.3576], std: 0.0530
  RMSE : 0.0885, R2: 0.2266, MAE: 0.0703, Spearman rho: 0.4876, Spearman p: 4.9440e-37, Pearson r: 0.4905, Pearson p: 1.5824e-37
  Pred range: [0.0532, 0.3718], std: 0.0532
  RMSE : 0.0904, R2: 0.1932, MAE: 0.0725, Spearman rho: 0.4834, Spearman p: 2.3915e-36, Pearson r: 0.4873, Pearson p: 5.4554e-37
  Pred range: [0.0426, 0.3577], std: 0.0534
  RMSE : 0.0884, R2: 0.2271, MAE: 0.0702, Spearman rho: 0.4859, Spearman p: 9.2516e-37, Pearson r: 0.4891, Pearson p: 2.7645e-37
[I 2026-04-27 23:23:40,265] Trial 8 finished with value: 0.08787048956906457 and parameters: {'learning_rate': 0.000984356660970888, 'batch_size': 4, 'num_epochs': 30, 'weight_decay': 0.0005090276003486293, 'depth_complex': 3, 'depth_moderate': 3, 'depth_simple': 1, 'dropout': 0.20827044978689743, 'se_reduction': 6, 'hidden_dim_min': 2, 'base_loss': 'huber', 'huber_delta': 0.0148045111774797, 'focal_gamma': 1.8059787653716919, 'n_bins': 6, 'scheduler_patience': 2, 'scheduler_factor': 0.5167428955320486, 'early_stopping_patience': 6}. Best is trial 8 with value: 0.08787048956906457.
Train: 2407 rows (1613 IDs),Test: 598 rows (404 IDs) 

n_features_x : 6, n_features_per_modality: [16, 23, 19, 17, 7, 4, 4, 4, 1, 4]

--- ImbalancedRegressionLoss initialized ---
  Bins: 19, Focal gamma: 1.787314218824375, Base loss: mse
  Bin [0.00, 0.05): count=  650, weight=0.004
  Bin [0.05, 0.11): count=  360, weight=0.007
  Bin [0.11, 0.16): count=  528, weight=0.005
  Bin [0.16, 0.21): count=  338, weight=0.008
  Bin [0.21, 0.26): count=  318, weight=0.008
  Bin [0.26, 0.32): count=  109, weight=0.023
  Bin [0.32, 0.37): count=   50, weight=0.050
  Bin [0.37, 0.42): count=   29, weight=0.085
  Bin [0.42, 0.47): count=    7, weight=0.320
  Bin [0.47, 0.53): count=   10, weight=0.232
  Bin [0.53, 0.58): count=    6, weight=0.365
  Bin [0.58, 0.63): count=    1, weight=1.278
  Bin [0.63, 0.68): count=    0, weight=2.556
  Bin [0.68, 0.74): count=    1, weight=1.278
  Bin [0.74, 0.79): count=    0, weight=2.556
  Bin [0.79, 0.84): count=    0, weight=2.556
  Bin [0.84, 0.89): count=    0, weight=2.556
  Bin [0.89, 0.95): count=    0, weight=2.556
  Bin [0.95, 1.00): count=    0, weight=2.556
-------------------------------------------

  Pred range: [0.0684, 0.4172], std: 0.0565
  RMSE : 0.1035, R2: -0.0585, MAE: 0.0849, Spearman rho: 0.4323, Spearman p: 1.2588e-28, Pearson r: 0.4388, Pearson p: 1.5741e-29
  Pred range: [0.0849, 0.3675], std: 0.0478
  RMSE : 0.0995, R2: 0.0220, MAE: 0.0816, Spearman rho: 0.4502, Spearman p: 3.5510e-31, Pearson r: 0.4549, Pearson p: 7.1428e-32
  Pred range: [0.0681, 0.3786], std: 0.0520
  RMSE : 0.0968, R2: 0.0734, MAE: 0.0791, Spearman rho: 0.4615, Spearman p: 7.0700e-33, Pearson r: 0.4660, Pearson p: 1.4442e-33
  Pred range: [0.0227, 0.3560], std: 0.0487
  RMSE : 0.0902, R2: 0.1965, MAE: 0.0719, Spearman rho: 0.4618, Spearman p: 6.4174e-33, Pearson r: 0.4635, Pearson p: 3.5595e-33
  Pred range: [0.0817, 0.4583], std: 0.0580
  RMSE : 0.1030, R2: -0.0478, MAE: 0.0843, Spearman rho: 0.4495, Spearman p: 4.5091e-31, Pearson r: 0.4572, Pearson p: 3.1590e-32
  Pred range: [0.0607, 0.4074], std: 0.0521
  RMSE : 0.0952, R2: 0.1044, MAE: 0.0771, Spearman rho: 0.4427, Spearman p: 4.3170e-30, Pearson r: 0.4498, Pearson p: 3.9617e-31
  Pred range: [0.0367, 0.3812], std: 0.0507
  RMSE : 0.0913, R2: 0.1769, MAE: 0.0732, Spearman rho: 0.4468, Spearman p: 1.1068e-30, Pearson r: 0.4526, Pearson p: 1.5478e-31
  Pred range: [0.0697, 0.3975], std: 0.0523
  RMSE : 0.0963, R2: 0.0829, MAE: 0.0785, Spearman rho: 0.4488, Spearman p: 5.5614e-31, Pearson r: 0.4559, Pearson p: 4.9984e-32
  Pred range: [0.0279, 0.3833], std: 0.0519
  RMSE : 0.0901, R2: 0.1979, MAE: 0.0715, Spearman rho: 0.4400, Spearman p: 1.0314e-29, Pearson r: 0.4524, Pearson p: 1.6665e-31
  Pred range: [0.0208, 0.3743], std: 0.0509
  RMSE : 0.0922, R2: 0.1607, MAE: 0.0741, Spearman rho: 0.4258, Spearman p: 9.7874e-28, Pearson r: 0.4370, Pearson p: 2.8236e-29
  Pred range: [0.0137, 0.4039], std: 0.0528
  RMSE : 0.0919, R2: 0.1653, MAE: 0.0739, Spearman rho: 0.4452, Spearman p: 1.8702e-30, Pearson r: 0.4532, Pearson p: 1.2515e-31
  Pred range: [0.0300, 0.4042], std: 0.0510
  RMSE : 0.0939, R2: 0.1290, MAE: 0.0763, Spearman rho: 0.4502, Spearman p: 3.4623e-31, Pearson r: 0.4584, Pearson p: 2.1307e-32
  Pred range: [0.0420, 0.4141], std: 0.0573
  RMSE : 0.0963, R2: 0.0839, MAE: 0.0783, Spearman rho: 0.4593, Spearman p: 1.5160e-32, Pearson r: 0.4658, Pearson p: 1.5613e-33
  Pred range: [0.0239, 0.3946], std: 0.0542
  RMSE : 0.0919, R2: 0.1656, MAE: 0.0738, Spearman rho: 0.4435, Spearman p: 3.3246e-30, Pearson r: 0.4541, Pearson p: 9.1734e-32
  Pred range: [0.0308, 0.4247], std: 0.0550
  RMSE : 0.0966, R2: 0.0771, MAE: 0.0786, Spearman rho: 0.4426, Spearman p: 4.4761e-30, Pearson r: 0.4511, Pearson p: 2.5722e-31
  Pred range: [0.0659, 0.4523], std: 0.0546
  RMSE : 0.1077, R2: -0.1457, MAE: 0.0889, Spearman rho: 0.4355, Spearman p: 4.5506e-29, Pearson r: 0.4453, Pearson p: 1.8004e-30
  Pred range: [0.0352, 0.4148], std: 0.0536
  RMSE : 0.0950, R2: 0.1088, MAE: 0.0769, Spearman rho: 0.4406, Spearman p: 8.6487e-30, Pearson r: 0.4496, Pearson p: 4.2431e-31
[I 2026-04-27 23:25:22,654] Trial 9 finished with value: 0.09009337473151746 and parameters: {'learning_rate': 0.0008550480755820139, 'batch_size': 8, 'num_epochs': 29, 'weight_decay': 0.0005705631305706065, 'depth_complex': 6, 'depth_moderate': 4, 'depth_simple': 2, 'dropout': 0.2181654775003899, 'se_reduction': 3, 'hidden_dim_min': 3, 'base_loss': 'mse', 'huber_delta': 0.14981952041034605, 'focal_gamma': 1.787314218824375, 'n_bins': 19, 'scheduler_patience': 4, 'scheduler_factor': 0.5343388067901077, 'early_stopping_patience': 8}. Best is trial 8 with value: 0.08787048956906457.
Train: 2407 rows (1613 IDs),Test: 598 rows (404 IDs) 

n_features_x : 6, n_features_per_modality: [16, 23, 19, 17, 7, 4, 4, 4, 1, 4]

--- ImbalancedRegressionLoss initialized ---
  Bins: 5, Focal gamma: 1.2604100033452985, Base loss: huber
  Bin [0.00, 0.20): count= 1876, weight=0.002
  Bin [0.20, 0.40): count=  497, weight=0.007
  Bin [0.40, 0.60): count=   32, weight=0.111
  Bin [0.60, 0.80): count=    2, weight=1.220
  Bin [0.80, 1.00): count=    0, weight=3.660
-------------------------------------------

  Pred range: [-0.1098, 0.3044], std: 0.0651
  RMSE : 0.0994, R2: 0.0229, MAE: 0.0763, Spearman rho: 0.3983, Spearman p: 3.5408e-24, Pearson r: 0.4076, Pearson p: 2.4173e-25
  Pred range: [-0.0170, 0.3318], std: 0.0576
  RMSE : 0.0977, R2: 0.0564, MAE: 0.0758, Spearman rho: 0.4155, Spearman p: 2.2905e-26, Pearson r: 0.4262, Pearson p: 8.7728e-28
  Pred range: [0.0720, 0.5393], std: 0.0640
  RMSE : 0.1250, R2: -0.5447, MAE: 0.1040, Spearman rho: 0.4086, Spearman p: 1.8355e-25, Pearson r: 0.4080, Pearson p: 2.1400e-25
  Pred range: [0.0869, 0.4704], std: 0.0613
  RMSE : 0.1304, R2: -0.6811, MAE: 0.1098, Spearman rho: 0.4221, Spearman p: 3.0635e-27, Pearson r: 0.4221, Pearson p: 3.1352e-27
  Pred range: [-0.0300, 0.4001], std: 0.0516
  RMSE : 0.0995, R2: 0.0208, MAE: 0.0797, Spearman rho: 0.3705, Spearman p: 6.7814e-21, Pearson r: 0.3515, Pearson p: 7.9549e-19
  Pred range: [0.0157, 0.3108], std: 0.0511
  RMSE : 0.0913, R2: 0.1766, MAE: 0.0711, Spearman rho: 0.4630, Spearman p: 4.2528e-33, Pearson r: 0.4658, Pearson p: 1.5318e-33
  Pred range: [0.0642, 0.4317], std: 0.0622
  RMSE : 0.1004, R2: 0.0045, MAE: 0.0818, Spearman rho: 0.4644, Spearman p: 2.5704e-33, Pearson r: 0.4715, Pearson p: 1.9789e-34
  Pred range: [0.1145, 0.4673], std: 0.0590
  RMSE : 0.1259, R2: -0.5654, MAE: 0.1065, Spearman rho: 0.4572, Spearman p: 3.1394e-32, Pearson r: 0.4621, Pearson p: 5.8299e-33
  Pred range: [0.0866, 0.3774], std: 0.0517
  RMSE : 0.1061, R2: -0.1128, MAE: 0.0886, Spearman rho: 0.4556, Spearman p: 5.6033e-32, Pearson r: 0.4587, Pearson p: 1.8649e-32
  Pred range: [0.0609, 0.3855], std: 0.0560
  RMSE : 0.0950, R2: 0.1090, MAE: 0.0771, Spearman rho: 0.4747, Spearman p: 6.1452e-35, Pearson r: 0.4828, Pearson p: 2.9942e-36
  Pred range: [0.0570, 0.3568], std: 0.0535
  RMSE : 0.0922, R2: 0.1592, MAE: 0.0747, Spearman rho: 0.4753, Spearman p: 5.0112e-35, Pearson r: 0.4842, Pearson p: 1.7536e-36
[I 2026-04-27 23:26:52,205] Trial 10 finished with value: 0.09128258584634079 and parameters: {'learning_rate': 0.006876229410039036, 'batch_size': 4, 'num_epochs': 19, 'weight_decay': 0.00115976553126795, 'depth_complex': 4, 'depth_moderate': 3, 'depth_simple': 2, 'dropout': 0.13357853465540812, 'se_reduction': 6, 'hidden_dim_min': 2, 'base_loss': 'huber', 'huber_delta': 0.016263056041260347, 'focal_gamma': 1.2604100033452985, 'n_bins': 5, 'scheduler_patience': 2, 'scheduler_factor': 0.3215395237922877, 'early_stopping_patience': 5}. Best is trial 8 with value: 0.08787048956906457.
Train: 2407 rows (1613 IDs),Test: 598 rows (404 IDs) 

n_features_x : 6, n_features_per_modality: [16, 23, 19, 17, 7, 4, 4, 4, 1, 4]

--- ImbalancedRegressionLoss initialized ---
  Bins: 12, Focal gamma: 2.9835752908753337, Base loss: huber
  Bin [0.00, 0.08): count=  828, weight=0.003
  Bin [0.08, 0.17): count=  710, weight=0.004
  Bin [0.17, 0.25): count=  575, weight=0.005
  Bin [0.25, 0.33): count=  214, weight=0.013
  Bin [0.33, 0.42): count=   55, weight=0.051
  Bin [0.42, 0.50): count=   14, weight=0.191
  Bin [0.50, 0.58): count=    9, weight=0.286
  Bin [0.58, 0.67): count=    1, weight=1.431
  Bin [0.67, 0.75): count=    1, weight=1.431
  Bin [0.75, 0.83): count=    0, weight=2.862
  Bin [0.83, 0.92): count=    0, weight=2.862
  Bin [0.92, 1.00): count=    0, weight=2.862
-------------------------------------------

  Pred range: [0.0497, 0.4471], std: 0.0538
  RMSE : 0.0946, R2: 0.1157, MAE: 0.0765, Spearman rho: 0.4377, Spearman p: 2.2018e-29, Pearson r: 0.4437, Pearson p: 3.0467e-30
  Pred range: [-0.0145, 0.4344], std: 0.0652
  RMSE : 0.0966, R2: 0.0776, MAE: 0.0783, Spearman rho: 0.4644, Spearman p: 2.5380e-33, Pearson r: 0.4691, Pearson p: 4.7094e-34
  Pred range: [0.0288, 0.2998], std: 0.0471
  RMSE : 0.0904, R2: 0.1926, MAE: 0.0705, Spearman rho: 0.4659, Spearman p: 1.5089e-33, Pearson r: 0.4661, Pearson p: 1.4052e-33
  Pred range: [0.0060, 0.3263], std: 0.0616
  RMSE : 0.0899, R2: 0.2020, MAE: 0.0706, Spearman rho: 0.4675, Spearman p: 8.5712e-34, Pearson r: 0.4751, Pearson p: 5.4101e-35
  Pred range: [0.0548, 0.4460], std: 0.0624
  RMSE : 0.1006, R2: -0.0002, MAE: 0.0819, Spearman rho: 0.4515, Spearman p: 2.2581e-31, Pearson r: 0.4591, Pearson p: 1.6546e-32
  Pred range: [0.0601, 0.4283], std: 0.0660
  RMSE : 0.1014, R2: -0.0152, MAE: 0.0830, Spearman rho: 0.4612, Spearman p: 7.8568e-33, Pearson r: 0.4722, Pearson p: 1.5433e-34
  Pred range: [0.0680, 0.3998], std: 0.0599
  RMSE : 0.0993, R2: 0.0262, MAE: 0.0809, Spearman rho: 0.4709, Spearman p: 2.4768e-34, Pearson r: 0.4741, Pearson p: 7.5893e-35
  Pred range: [0.0016, 0.3124], std: 0.0534
  RMSE : 0.0900, R2: 0.1989, MAE: 0.0698, Spearman rho: 0.4722, Spearman p: 1.5486e-34, Pearson r: 0.4711, Pearson p: 2.2797e-34
  Pred range: [0.0174, 0.3411], std: 0.0536
  RMSE : 0.0895, R2: 0.2079, MAE: 0.0704, Spearman rho: 0.4742, Spearman p: 7.4002e-35, Pearson r: 0.4755, Pearson p: 4.6268e-35
  Pred range: [0.0328, 0.3116], std: 0.0479
  RMSE : 0.0901, R2: 0.1979, MAE: 0.0707, Spearman rho: 0.4641, Spearman p: 2.8661e-33, Pearson r: 0.4666, Pearson p: 1.1525e-33
  Pred range: [0.0160, 0.3332], std: 0.0516
  RMSE : 0.0919, R2: 0.1651, MAE: 0.0712, Spearman rho: 0.4667, Spearman p: 1.1151e-33, Pearson r: 0.4702, Pearson p: 3.1910e-34
  Pred range: [0.0214, 0.3144], std: 0.0528
  RMSE : 0.0905, R2: 0.1907, MAE: 0.0704, Spearman rho: 0.4552, Spearman p: 6.3903e-32, Pearson r: 0.4605, Pearson p: 9.9269e-33
  Pred range: [0.0211, 0.2961], std: 0.0515
  RMSE : 0.0886, R2: 0.2248, MAE: 0.0690, Spearman rho: 0.4839, Spearman p: 1.9724e-36, Pearson r: 0.4869, Pearson p: 6.3489e-37
  Pred range: [0.0317, 0.3204], std: 0.0489
  RMSE : 0.0897, R2: 0.2048, MAE: 0.0705, Spearman rho: 0.4654, Spearman p: 1.7524e-33, Pearson r: 0.4699, Pearson p: 3.5450e-34
  Pred range: [0.0635, 0.3865], std: 0.0494
  RMSE : 0.0914, R2: 0.1751, MAE: 0.0738, Spearman rho: 0.4728, Spearman p: 1.2457e-34, Pearson r: 0.4764, Pearson p: 3.3233e-35
  Pred range: [0.0285, 0.2876], std: 0.0458
  RMSE : 0.0928, R2: 0.1497, MAE: 0.0729, Spearman rho: 0.4264, Spearman p: 8.2636e-28, Pearson r: 0.4316, Pearson p: 1.5531e-28
  Pred range: [0.0590, 0.4036], std: 0.0539
  RMSE : 0.0920, R2: 0.1642, MAE: 0.0737, Spearman rho: 0.4745, Spearman p: 6.7080e-35, Pearson r: 0.4691, Pearson p: 4.6787e-34
  Pred range: [0.0517, 0.4067], std: 0.0597
  RMSE : 0.0929, R2: 0.1476, MAE: 0.0746, Spearman rho: 0.4784, Spearman p: 1.5459e-35, Pearson r: 0.4818, Pearson p: 4.3535e-36
