[I 2026-04-29 01:27:52,000] Trial 28 finished with value: 0.14981324346745398 and parameters: {'learning_rate': 0.0007927564146938293, 'batch_size': 4, 'num_epochs': 17, 'weight_decay': 0.0009556988566187702, 'layers_PRS': 3, 'layers_SCZ15': 1, 'layers_ADHD9': 3, 'layers_ASD9': 1, 'layers_ACE15': 4, 'layers_ACE18': 3, 'layers_SUD18': 3, 'layers_SES': 3, 'layers_SEX': 3, 'dropout': 0.12329811471683184, 'se_reduction': 7, 'hidden_dim_min': 9, 'base_loss': 'huber', 'huber_delta': 0.12928023517728876, 'focal_gamma': 2.463284240030438, 'n_bins': 8, 'scheduler_patience': 4, 'scheduler_factor': 0.5964095976848293, 'early_stopping_patience': 5}. Best is trial 28 with value: 0.14981324346745398.
Train: 2407 rows (1613 IDs),Test: 598 rows (404 IDs) 

n_features_x : 6, n_features_per_modality: [16, 23, 19, 17, 7, 4, 4, 4, 1, 4]

--- ImbalancedRegressionLoss initialized ---
  Bins: 7, Focal gamma: 2.525103474225967, Base loss: huber
  Bin [0.00, 0.14): count=  760, weight=0.038
  Bin [0.14, 0.29): count=  826, weight=0.035
  Bin [0.29, 0.43): count=  454, weight=0.063
  Bin [0.43, 0.57): count=  215, weight=0.133
  Bin [0.57, 0.71): count=  110, weight=0.258
  Bin [0.71, 0.86): count=   38, weight=0.736
  Bin [0.86, 1.00): count=    4, weight=5.738
-------------------------------------------

  Pred range: [0.1256, 0.5597], std: 0.0775
  RMSE : 0.1582, R2: 0.1648, MAE: 0.1301, Spearman rho: 0.4689, Spearman p: 5.1758e-34, Pearson r: 0.4812, Pearson p: 5.6026e-36
  Pred range: [0.0875, 0.5380], std: 0.0822
  RMSE : 0.1499, R2: 0.2503, MAE: 0.1177, Spearman rho: 0.4892, Spearman p: 2.6225e-37, Pearson r: 0.5020, Pearson p: 1.6915e-39
  Pred range: [0.0930, 0.5630], std: 0.0843
  RMSE : 0.1507, R2: 0.2423, MAE: 0.1205, Spearman rho: 0.4944, Spearman p: 3.5475e-38, Pearson r: 0.5076, Pearson p: 1.7999e-40
  Pred range: [0.1247, 0.6263], std: 0.0898
  RMSE : 0.1635, R2: 0.1074, MAE: 0.1370, Spearman rho: 0.4909, Spearman p: 1.3821e-37, Pearson r: 0.5079, Pearson p: 1.5470e-40
  Pred range: [0.0717, 0.5582], std: 0.0882
  RMSE : 0.1491, R2: 0.2575, MAE: 0.1181, Spearman rho: 0.4985, Spearman p: 7.0061e-39, Pearson r: 0.5137, Pearson p: 1.4288e-41
  Pred range: [0.0735, 0.5758], std: 0.0914
  RMSE : 0.1540, R2: 0.2086, MAE: 0.1252, Spearman rho: 0.4936, Spearman p: 4.7071e-38, Pearson r: 0.5089, Pearson p: 1.0263e-40
  Pred range: [0.0456, 0.5551], std: 0.0868
  RMSE : 0.1488, R2: 0.2614, MAE: 0.1162, Spearman rho: 0.4943, Spearman p: 3.6852e-38, Pearson r: 0.5115, Pearson p: 3.5887e-41
  Pred range: [0.0537, 0.5977], std: 0.0921
  RMSE : 0.1531, R2: 0.2180, MAE: 0.1239, Spearman rho: 0.4941, Spearman p: 4.0010e-38, Pearson r: 0.5075, Pearson p: 1.8657e-40
  Pred range: [0.0518, 0.5612], std: 0.0909
  RMSE : 0.1489, R2: 0.2595, MAE: 0.1182, Spearman rho: 0.5015, Spearman p: 2.0591e-39, Pearson r: 0.5171, Pearson p: 3.3631e-42
  Pred range: [0.0172, 0.5748], std: 0.0906
  RMSE : 0.1491, R2: 0.2578, MAE: 0.1185, Spearman rho: 0.4964, Spearman p: 1.5649e-38, Pearson r: 0.5140, Pearson p: 1.2362e-41
  Pred range: [0.0527, 0.5670], std: 0.0906
  RMSE : 0.1506, R2: 0.2431, MAE: 0.1211, Spearman rho: 0.4997, Spearman p: 4.3630e-39, Pearson r: 0.5165, Pearson p: 4.4141e-42
  Pred range: [0.0698, 0.5925], std: 0.0957
  RMSE : 0.1557, R2: 0.1911, MAE: 0.1277, Spearman rho: 0.5024, Spearman p: 1.4629e-39, Pearson r: 0.5199, Pearson p: 1.0286e-42
  Pred range: [0.0509, 0.5817], std: 0.0954
  RMSE : 0.1497, R2: 0.2519, MAE: 0.1194, Spearman rho: 0.5015, Spearman p: 2.0583e-39, Pearson r: 0.5179, Pearson p: 2.4523e-42
  Pred range: [0.0641, 0.5620], std: 0.0930
  RMSE : 0.1494, R2: 0.2547, MAE: 0.1187, Spearman rho: 0.5002, Spearman p: 3.4675e-39, Pearson r: 0.5156, Pearson p: 6.5132e-42
[I 2026-04-29 01:29:39,155] Trial 29 finished with value: 0.148758134128657 and parameters: {'learning_rate': 0.0008197635124357406, 'batch_size': 4, 'num_epochs': 17, 'weight_decay': 0.0027360665699411608, 'layers_PRS': 3, 'layers_SCZ15': 1, 'layers_ADHD9': 3, 'layers_ASD9': 2, 'layers_ACE15': 3, 'layers_ACE18': 3, 'layers_SUD18': 3, 'layers_SES': 4, 'layers_SEX': 3, 'dropout': 0.11053948557280441, 'se_reduction': 5, 'hidden_dim_min': 10, 'base_loss': 'huber', 'huber_delta': 0.1285920280585329, 'focal_gamma': 2.525103474225967, 'n_bins': 7, 'scheduler_patience': 4, 'scheduler_factor': 0.5952891412384348, 'early_stopping_patience': 7}. Best is trial 29 with value: 0.148758134128657.
Train: 2407 rows (1613 IDs),Test: 598 rows (404 IDs) 

n_features_x : 6, n_features_per_modality: [16, 23, 19, 17, 7, 4, 4, 4, 1, 4]

--- ImbalancedRegressionLoss initialized ---
  Bins: 7, Focal gamma: 2.487987791383486, Base loss: huber
  Bin [0.00, 0.14): count=  760, weight=0.038
  Bin [0.14, 0.29): count=  826, weight=0.035
  Bin [0.29, 0.43): count=  454, weight=0.063
  Bin [0.43, 0.57): count=  215, weight=0.133
  Bin [0.57, 0.71): count=  110, weight=0.258
  Bin [0.71, 0.86): count=   38, weight=0.736
  Bin [0.86, 1.00): count=    4, weight=5.738
-------------------------------------------

  Pred range: [0.0582, 0.5734], std: 0.0833
  RMSE : 0.1657, R2: 0.0833, MAE: 0.1334, Spearman rho: 0.3385, Spearman p: 1.7130e-17, Pearson r: 0.3631, Pearson p: 4.4700e-20
  Pred range: [0.0629, 0.5587], std: 0.0834
  RMSE : 0.1629, R2: 0.1141, MAE: 0.1316, Spearman rho: 0.3778, Spearman p: 9.9534e-22, Pearson r: 0.4004, Pearson p: 1.9419e-24
  Pred range: [0.0660, 0.5449], std: 0.0839
  RMSE : 0.1611, R2: 0.1337, MAE: 0.1303, Spearman rho: 0.4016, Spearman p: 1.3828e-24, Pearson r: 0.4232, Pearson p: 2.2063e-27
  Pred range: [0.0600, 0.5350], std: 0.0852
  RMSE : 0.1582, R2: 0.1645, MAE: 0.1274, Spearman rho: 0.4222, Spearman p: 3.0309e-27, Pearson r: 0.4423, Pearson p: 4.8889e-30
  Pred range: [0.0620, 0.5486], std: 0.0864
  RMSE : 0.1577, R2: 0.1696, MAE: 0.1275, Spearman rho: 0.4340, Spearman p: 7.3291e-29, Pearson r: 0.4543, Pearson p: 8.6719e-32
  Pred range: [0.0583, 0.5486], std: 0.0882
  RMSE : 0.1560, R2: 0.1882, MAE: 0.1255, Spearman rho: 0.4482, Spearman p: 6.9487e-31, Pearson r: 0.4660, Pearson p: 1.4322e-33
  Pred range: [0.0645, 0.5666], std: 0.0899
  RMSE : 0.1569, R2: 0.1783, MAE: 0.1274, Spearman rho: 0.4565, Spearman p: 4.0322e-32, Pearson r: 0.4726, Pearson p: 1.3344e-34
  Pred range: [0.0643, 0.5629], std: 0.0899
  RMSE : 0.1551, R2: 0.1966, MAE: 0.1252, Spearman rho: 0.4612, Spearman p: 7.7808e-33, Pearson r: 0.4780, Pearson p: 1.8064e-35
  Pred range: [0.0706, 0.5666], std: 0.0888
  RMSE : 0.1554, R2: 0.1935, MAE: 0.1260, Spearman rho: 0.4649, Spearman p: 2.0994e-33, Pearson r: 0.4807, Pearson p: 6.7621e-36
  Pred range: [0.0601, 0.5496], std: 0.0884
  RMSE : 0.1526, R2: 0.2229, MAE: 0.1215, Spearman rho: 0.4694, Spearman p: 4.2828e-34, Pearson r: 0.4852, Pearson p: 1.2091e-36
  Pred range: [0.0769, 0.5951], std: 0.0928
  RMSE : 0.1584, R2: 0.1626, MAE: 0.1302, Spearman rho: 0.4716, Spearman p: 1.9201e-34, Pearson r: 0.4882, Pearson p: 3.8703e-37
  Pred range: [0.0583, 0.5624], std: 0.0890
  RMSE : 0.1527, R2: 0.2219, MAE: 0.1223, Spearman rho: 0.4739, Spearman p: 8.2528e-35, Pearson r: 0.4906, Pearson p: 1.5532e-37
  Pred range: [0.0596, 0.5779], std: 0.0909
  RMSE : 0.1535, R2: 0.2135, MAE: 0.1239, Spearman rho: 0.4764, Spearman p: 3.2614e-35, Pearson r: 0.4928, Pearson p: 6.6139e-38
  Pred range: [0.0715, 0.6111], std: 0.0938
  RMSE : 0.1579, R2: 0.1675, MAE: 0.1298, Spearman rho: 0.4774, Spearman p: 2.3140e-35, Pearson r: 0.4957, Pearson p: 2.1109e-38
  Pred range: [0.0416, 0.5503], std: 0.0899
  RMSE : 0.1498, R2: 0.2508, MAE: 0.1173, Spearman rho: 0.4842, Spearman p: 1.7964e-36, Pearson r: 0.5016, Pearson p: 2.0283e-39
  Pred range: [0.0627, 0.5794], std: 0.0914
  RMSE : 0.1524, R2: 0.2244, MAE: 0.1229, Spearman rho: 0.4828, Spearman p: 3.0345e-36, Pearson r: 0.5007, Pearson p: 2.9389e-39
  Pred range: [0.0564, 0.5672], std: 0.0901
  RMSE : 0.1512, R2: 0.2367, MAE: 0.1210, Spearman rho: 0.4848, Spearman p: 1.4050e-36, Pearson r: 0.5021, Pearson p: 1.6612e-39
[I 2026-04-29 01:31:52,907] Trial 30 finished with value: 0.14981239801330978 and parameters: {'learning_rate': 0.00018335913828806336, 'batch_size': 4, 'num_epochs': 17, 'weight_decay': 0.0027376550923562367, 'layers_PRS': 3, 'layers_SCZ15': 1, 'layers_ADHD9': 3, 'layers_ASD9': 2, 'layers_ACE15': 4, 'layers_ACE18': 3, 'layers_SUD18': 4, 'layers_SES': 4, 'layers_SEX': 2, 'dropout': 0.10038858200412626, 'se_reduction': 5, 'hidden_dim_min': 13, 'base_loss': 'huber', 'huber_delta': 0.09674053647000982, 'focal_gamma': 2.487987791383486, 'n_bins': 7, 'scheduler_patience': 4, 'scheduler_factor': 0.6803610944114833, 'early_stopping_patience': 7}. Best is trial 29 with value: 0.148758134128657.
Train: 2407 rows (1613 IDs),Test: 598 rows (404 IDs) 

n_features_x : 6, n_features_per_modality: [16, 23, 19, 17, 7, 4, 4, 4, 1, 4]

--- ImbalancedRegressionLoss initialized ---
  Bins: 7, Focal gamma: 2.4551039257039986, Base loss: huber
  Bin [0.00, 0.14): count=  760, weight=0.038
  Bin [0.14, 0.29): count=  826, weight=0.035
  Bin [0.29, 0.43): count=  454, weight=0.063
  Bin [0.43, 0.57): count=  215, weight=0.133
  Bin [0.57, 0.71): count=  110, weight=0.258
  Bin [0.71, 0.86): count=   38, weight=0.736
  Bin [0.86, 1.00): count=    4, weight=5.738
-------------------------------------------

  Pred range: [0.1432, 0.6227], std: 0.0729
  RMSE : 0.1662, R2: 0.0776, MAE: 0.1381, Spearman rho: 0.3790, Spearman p: 7.3069e-22, Pearson r: 0.3989, Pearson p: 3.0290e-24
  Pred range: [0.1263, 0.5724], std: 0.0738
  RMSE : 0.1602, R2: 0.1438, MAE: 0.1311, Spearman rho: 0.4193, Spearman p: 7.3842e-27, Pearson r: 0.4322, Pearson p: 1.3015e-28
  Pred range: [0.1331, 0.5907], std: 0.0800
  RMSE : 0.1647, R2: 0.0946, MAE: 0.1375, Spearman rho: 0.4385, Spearman p: 1.7269e-29, Pearson r: 0.4503, Pearson p: 3.4442e-31
  Pred range: [0.1224, 0.5783], std: 0.0822
  RMSE : 0.1594, R2: 0.1515, MAE: 0.1313, Spearman rho: 0.4540, Spearman p: 9.5473e-32, Pearson r: 0.4652, Pearson p: 1.9211e-33
  Pred range: [0.1081, 0.5407], std: 0.0799
  RMSE : 0.1553, R2: 0.1952, MAE: 0.1259, Spearman rho: 0.4644, Spearman p: 2.5633e-33, Pearson r: 0.4752, Pearson p: 5.0657e-35
  Pred range: [0.1010, 0.5448], std: 0.0819
  RMSE : 0.1550, R2: 0.1978, MAE: 0.1260, Spearman rho: 0.4719, Spearman p: 1.6893e-34, Pearson r: 0.4828, Pearson p: 3.0521e-36
  Pred range: [0.0822, 0.5270], std: 0.0828
  RMSE : 0.1513, R2: 0.2356, MAE: 0.1199, Spearman rho: 0.4807, Spearman p: 6.6854e-36, Pearson r: 0.4916, Pearson p: 1.0357e-37
  Pred range: [0.0900, 0.5519], std: 0.0855
  RMSE : 0.1531, R2: 0.2177, MAE: 0.1237, Spearman rho: 0.4834, Spearman p: 2.3736e-36, Pearson r: 0.4950, Pearson p: 2.7699e-38
  Pred range: [0.0869, 0.5613], std: 0.0875
  RMSE : 0.1526, R2: 0.2225, MAE: 0.1231, Spearman rho: 0.4882, Spearman p: 3.9175e-37, Pearson r: 0.4990, Pearson p: 5.7178e-39
  Pred range: [0.0968, 0.5813], std: 0.0901
  RMSE : 0.1560, R2: 0.1875, MAE: 0.1280, Spearman rho: 0.4901, Spearman p: 1.8515e-37, Pearson r: 0.5011, Pearson p: 2.4268e-39
  Pred range: [0.0882, 0.5774], std: 0.0893
  RMSE : 0.1545, R2: 0.2035, MAE: 0.1261, Spearman rho: 0.4900, Spearman p: 1.9051e-37, Pearson r: 0.5016, Pearson p: 2.0048e-39
  Pred range: [0.0764, 0.5582], std: 0.0870
  RMSE : 0.1513, R2: 0.2358, MAE: 0.1214, Spearman rho: 0.4919, Spearman p: 9.1011e-38, Pearson r: 0.5031, Pearson p: 1.1208e-39
  Pred range: [0.0815, 0.5670], std: 0.0880
  RMSE : 0.1522, R2: 0.2267, MAE: 0.1230, Spearman rho: 0.4933, Spearman p: 5.3637e-38, Pearson r: 0.5047, Pearson p: 5.6395e-40
  Pred range: [0.0822, 0.5738], std: 0.0880
  RMSE : 0.1526, R2: 0.2227, MAE: 0.1236, Spearman rho: 0.4942, Spearman p: 3.8381e-38, Pearson r: 0.5055, Pearson p: 4.1735e-40
  Pred range: [0.0923, 0.5839], std: 0.0891
  RMSE : 0.1555, R2: 0.1927, MAE: 0.1277, Spearman rho: 0.4946, Spearman p: 3.1896e-38, Pearson r: 0.5072, Pearson p: 2.0384e-40
[I 2026-04-29 01:33:49,972] Trial 31 pruned. 
Train: 2407 rows (1613 IDs),Test: 598 rows (404 IDs) 

n_features_x : 6, n_features_per_modality: [16, 23, 19, 17, 7, 4, 4, 4, 1, 4]

--- ImbalancedRegressionLoss initialized ---
  Bins: 7, Focal gamma: 2.7691335082238515, Base loss: huber
  Bin [0.00, 0.14): count=  760, weight=0.038
  Bin [0.14, 0.29): count=  826, weight=0.035
  Bin [0.29, 0.43): count=  454, weight=0.063
  Bin [0.43, 0.57): count=  215, weight=0.133
  Bin [0.57, 0.71): count=  110, weight=0.258
  Bin [0.71, 0.86): count=   38, weight=0.736
  Bin [0.86, 1.00): count=    4, weight=5.738
-------------------------------------------

  Pred range: [0.1181, 0.5358], std: 0.0693
  RMSE : 0.1600, R2: 0.1457, MAE: 0.1317, Spearman rho: 0.4435, Spearman p: 3.3213e-30, Pearson r: 0.4510, Pearson p: 2.6430e-31
  Pred range: [0.0932, 0.5348], std: 0.0729
  RMSE : 0.1549, R2: 0.1992, MAE: 0.1255, Spearman rho: 0.4669, Spearman p: 1.0335e-33, Pearson r: 0.4775, Pearson p: 2.1844e-35
  Pred range: [0.0736, 0.5282], std: 0.0788
  RMSE : 0.1507, R2: 0.2419, MAE: 0.1192, Spearman rho: 0.4860, Spearman p: 9.1246e-37, Pearson r: 0.4988, Pearson p: 6.1185e-39
  Pred range: [0.0898, 0.5528], std: 0.0846
  RMSE : 0.1540, R2: 0.2079, MAE: 0.1254, Spearman rho: 0.4910, Spearman p: 1.3032e-37, Pearson r: 0.5003, Pearson p: 3.3795e-39
  Pred range: [0.0757, 0.5639], std: 0.0819
  RMSE : 0.1530, R2: 0.2183, MAE: 0.1239, Spearman rho: 0.4863, Spearman p: 7.9129e-37, Pearson r: 0.4997, Pearson p: 4.3326e-39
  Pred range: [0.0843, 0.5884], std: 0.0895
  RMSE : 0.1566, R2: 0.1816, MAE: 0.1290, Spearman rho: 0.4939, Spearman p: 4.2998e-38, Pearson r: 0.5066, Pearson p: 2.6760e-40
  Pred range: [0.0981, 0.5778], std: 0.0872
  RMSE : 0.1545, R2: 0.2032, MAE: 0.1263, Spearman rho: 0.4967, Spearman p: 1.4265e-38, Pearson r: 0.5087, Pearson p: 1.1307e-40
  Pred range: [0.0574, 0.5310], std: 0.0796
  RMSE : 0.1491, R2: 0.2584, MAE: 0.1163, Spearman rho: 0.4975, Spearman p: 1.0481e-38, Pearson r: 0.5109, Pearson p: 4.5433e-41
  Pred range: [0.0951, 0.5346], std: 0.0802
  RMSE : 0.1505, R2: 0.2440, MAE: 0.1211, Spearman rho: 0.5037, Spearman p: 8.5618e-40, Pearson r: 0.5166, Pearson p: 4.2515e-42
  Pred range: [0.0634, 0.5445], std: 0.0811
  RMSE : 0.1497, R2: 0.2515, MAE: 0.1188, Spearman rho: 0.4958, Spearman p: 2.0456e-38, Pearson r: 0.5105, Pearson p: 5.2571e-41
  Pred range: [0.0716, 0.5483], std: 0.0821
  RMSE : 0.1510, R2: 0.2389, MAE: 0.1214, Spearman rho: 0.4996, Spearman p: 4.4897e-39, Pearson r: 0.5111, Pearson p: 4.1448e-41
  Pred range: [0.1118, 0.5953], std: 0.0896
  RMSE : 0.1583, R2: 0.1637, MAE: 0.1310, Spearman rho: 0.5012, Spearman p: 2.3451e-39, Pearson r: 0.5134, Pearson p: 1.5894e-41
  Pred range: [0.0861, 0.5672], std: 0.0846
  RMSE : 0.1514, R2: 0.2350, MAE: 0.1225, Spearman rho: 0.5020, Spearman p: 1.7289e-39, Pearson r: 0.5155, Pearson p: 6.6534e-42
  Pred range: [0.0862, 0.5793], std: 0.0853
  RMSE : 0.1541, R2: 0.2073, MAE: 0.1261, Spearman rho: 0.4995, Spearman p: 4.6854e-39, Pearson r: 0.5151, Pearson p: 7.8781e-42
  Pred range: [0.0714, 0.5569], std: 0.0819
  RMSE : 0.1501, R2: 0.2484, MAE: 0.1200, Spearman rho: 0.5003, Spearman p: 3.3617e-39, Pearson r: 0.5143, Pearson p: 1.1227e-41
[I 2026-04-29 01:35:44,957] Trial 32 finished with value: 0.14905677412539872 and parameters: {'learning_rate': 0.0006052061556482464, 'batch_size': 4, 'num_epochs': 16, 'weight_decay': 0.009526366506238686, 'layers_PRS': 3, 'layers_SCZ15': 1, 'layers_ADHD9': 3, 'layers_ASD9': 2, 'layers_ACE15': 3, 'layers_ACE18': 4, 'layers_SUD18': 3, 'layers_SES': 4, 'layers_SEX': 2, 'dropout': 0.12572478729477105, 'se_reduction': 4, 'hidden_dim_min': 14, 'base_loss': 'huber', 'huber_delta': 0.09967419137297844, 'focal_gamma': 2.7691335082238515, 'n_bins': 7, 'scheduler_patience': 4, 'scheduler_factor': 0.5997171110202921, 'early_stopping_patience': 7}. Best is trial 29 with value: 0.148758134128657.
Train: 2407 rows (1613 IDs),Test: 598 rows (404 IDs) 

n_features_x : 6, n_features_per_modality: [16, 23, 19, 17, 7, 4, 4, 4, 1, 4]

--- ImbalancedRegressionLoss initialized ---
  Bins: 6, Focal gamma: 2.743593696316865, Base loss: huber
  Bin [0.00, 0.17): count=  961, weight=0.041
  Bin [0.17, 0.33): count=  848, weight=0.047
  Bin [0.33, 0.50): count=  353, weight=0.112
  Bin [0.50, 0.67): count=  176, weight=0.224
  Bin [0.67, 0.83): count=   62, weight=0.628
  Bin [0.83, 1.00): count=    7, weight=4.948
-------------------------------------------

  Pred range: [0.1503, 0.5573], std: 0.0659
  RMSE : 0.1695, R2: 0.0405, MAE: 0.1413, Spearman rho: 0.3737, Spearman p: 2.9685e-21, Pearson r: 0.3869, Pearson p: 8.7477e-23
  Pred range: [0.1305, 0.5596], std: 0.0705
  RMSE : 0.1635, R2: 0.1081, MAE: 0.1352, Spearman rho: 0.4192, Spearman p: 7.5451e-27, Pearson r: 0.4295, Pearson p: 3.1052e-28
  Pred range: [0.1168, 0.5595], std: 0.0736
  RMSE : 0.1588, R2: 0.1583, MAE: 0.1298, Spearman rho: 0.4455, Spearman p: 1.6962e-30, Pearson r: 0.4532, Pearson p: 1.2604e-31
  Pred range: [0.1051, 0.5393], std: 0.0752
  RMSE : 0.1553, R2: 0.1951, MAE: 0.1253, Spearman rho: 0.4614, Spearman p: 7.3406e-33, Pearson r: 0.4680, Pearson p: 7.0468e-34
  Pred range: [0.1076, 0.5545], std: 0.0785
  RMSE : 0.1557, R2: 0.1904, MAE: 0.1266, Spearman rho: 0.4674, Spearman p: 8.8132e-34, Pearson r: 0.4757, Pearson p: 4.2211e-35
  Pred range: [0.1113, 0.5533], std: 0.0805
  RMSE : 0.1562, R2: 0.1855, MAE: 0.1277, Spearman rho: 0.4747, Spearman p: 6.1622e-35, Pearson r: 0.4817, Pearson p: 4.6143e-36
  Pred range: [0.1155, 0.5658], std: 0.0807
  RMSE : 0.1557, R2: 0.1907, MAE: 0.1272, Spearman rho: 0.4788, Spearman p: 1.3598e-35, Pearson r: 0.4851, Pearson p: 1.2855e-36
  Pred range: [0.1119, 0.5720], std: 0.0813
  RMSE : 0.1558, R2: 0.1896, MAE: 0.1275, Spearman rho: 0.4809, Spearman p: 6.1609e-36, Pearson r: 0.4877, Pearson p: 4.7680e-37
  Pred range: [0.0987, 0.5537], std: 0.0806
  RMSE : 0.1526, R2: 0.2225, MAE: 0.1227, Spearman rho: 0.4864, Spearman p: 7.7700e-37, Pearson r: 0.4928, Pearson p: 6.5338e-38
  Pred range: [0.0987, 0.5631], std: 0.0813
  RMSE : 0.1533, R2: 0.2160, MAE: 0.1239, Spearman rho: 0.4881, Spearman p: 4.0255e-37, Pearson r: 0.4934, Pearson p: 5.2140e-38
  Pred range: [0.1029, 0.5677], std: 0.0807
  RMSE : 0.1541, R2: 0.2072, MAE: 0.1255, Spearman rho: 0.4869, Spearman p: 6.3723e-37, Pearson r: 0.4952, Pearson p: 2.5789e-38
  Pred range: [0.1118, 0.5801], std: 0.0831
  RMSE : 0.1565, R2: 0.1829, MAE: 0.1287, Spearman rho: 0.4901, Spearman p: 1.8857e-37, Pearson r: 0.4967, Pearson p: 1.4199e-38
  Pred range: [0.1129, 0.5908], std: 0.0828
  RMSE : 0.1582, R2: 0.1642, MAE: 0.1311, Spearman rho: 0.4880, Spearman p: 4.2527e-37, Pearson r: 0.4974, Pearson p: 1.0884e-38
[I 2026-04-29 01:37:27,744] Trial 33 pruned. 
Train: 2407 rows (1613 IDs),Test: 598 rows (404 IDs) 

n_features_x : 6, n_features_per_modality: [16, 23, 19, 17, 7, 4, 4, 4, 1, 4]

--- ImbalancedRegressionLoss initialized ---
  Bins: 8, Focal gamma: 2.6738892041573123, Base loss: huber
  Bin [0.00, 0.12): count=  760, weight=0.039
  Bin [0.12, 0.25): count=  700, weight=0.042
  Bin [0.25, 0.38): count=  438, weight=0.067
  Bin [0.38, 0.50): count=  264, weight=0.111
  Bin [0.50, 0.62): count=  157, weight=0.186
  Bin [0.62, 0.75): count=   60, weight=0.483
  Bin [0.75, 0.88): count=   24, weight=1.179
  Bin [0.88, 1.00): count=    4, weight=5.893
-------------------------------------------

  Pred range: [0.0172, 0.2929], std: 0.0450
  RMSE : 0.1808, R2: -0.0914, MAE: 0.1309, Spearman rho: 0.2484, Spearman p: 7.3966e-10, Pearson r: 0.2352, Pearson p: 5.8313e-09
  Pred range: [0.1235, 0.4242], std: 0.0572
  RMSE : 0.1694, R2: 0.0424, MAE: 0.1382, Spearman rho: 0.3092, Spearman p: 1.0324e-14, Pearson r: 0.3013, Pearson p: 5.1307e-14
  Pred range: [0.1581, 0.5105], std: 0.0656
  RMSE : 0.1902, R2: -0.2074, MAE: 0.1632, Spearman rho: 0.3298, Spearman p: 1.2146e-16, Pearson r: 0.3255, Pearson p: 3.1849e-16
  Pred range: [0.1709, 0.5355], std: 0.0682
  RMSE : 0.1997, R2: -0.3309, MAE: 0.1730, Spearman rho: 0.3414, Spearman p: 8.6065e-18, Pearson r: 0.3394, Pearson p: 1.3738e-17
  Pred range: [0.1783, 0.5494], std: 0.0700
  RMSE : 0.2051, R2: -0.4048, MAE: 0.1785, Spearman rho: 0.3528, Spearman p: 5.7547e-19, Pearson r: 0.3521, Pearson p: 6.7228e-19
  Pred range: [0.1809, 0.5531], std: 0.0695
  RMSE : 0.2048, R2: -0.3997, MAE: 0.1783, Spearman rho: 0.3596, Spearman p: 1.0683e-19, Pearson r: 0.3607, Pearson p: 8.1104e-20
