[I 2026-04-27 18:48:42,209] Trial 17 finished with value: 0.1524180084590586 and parameters: {'learning_rate': 0.003739459764395766, 'batch_size': 6, 'num_epochs': 21, 'weight_decay': 3.012108592981636e-05, 'layers_PRS': 6, 'layers_SCZ15': 7, 'layers_ADHD9': 6, 'layers_ASD9': 3, 'layers_ACE15': 3, 'layers_ACE18': 6, 'layers_SUD18': 2, 'layers_SES': 1, 'layers_SEX': 6, 'dropout': 0.34416771654725, 'se_reduction': 5, 'hidden_dim_min': 13, 'base_loss': 'huber', 'huber_delta': 0.19981707707037266, 'focal_gamma': 1.610502379966601, 'n_bins': 18, 'scheduler_patience': 4, 'scheduler_factor': 0.3340384695128801, 'early_stopping_patience': 6}. Best is trial 8 with value: 0.15005696427010315.
Train: 2407 rows (1613 IDs),Test: 598 rows (404 IDs) 

n_features_x : 6, n_features_per_modality: [16, 23, 19, 17, 7, 4, 4, 4, 1, 4]

--- ImbalancedRegressionLoss initialized ---
  Bins: 18, Focal gamma: 0.5020138574341073, Base loss: huber
  Bin [0.00, 0.06): count=  172, weight=0.058
  Bin [0.06, 0.11): count=  413, weight=0.024
  Bin [0.11, 0.17): count=  376, weight=0.027
  Bin [0.17, 0.22): count=  370, weight=0.027
  Bin [0.22, 0.28): count=  255, weight=0.040
  Bin [0.28, 0.33): count=  223, weight=0.045
  Bin [0.33, 0.39): count=   89, weight=0.112
  Bin [0.39, 0.44): count=  142, weight=0.071
  Bin [0.44, 0.50): count=  122, weight=0.082
  Bin [0.50, 0.56): count=   93, weight=0.108
  Bin [0.56, 0.61): count=   64, weight=0.156
  Bin [0.61, 0.67): count=   36, weight=0.273
  Bin [0.67, 0.72): count=   10, weight=0.920
  Bin [0.72, 0.78): count=   26, weight=0.375
  Bin [0.78, 0.83): count=    9, weight=1.012
  Bin [0.83, 0.89): count=    4, weight=2.023
  Bin [0.89, 0.94): count=    3, weight=2.529
  Bin [0.94, 1.00): count=    0, weight=10.117
-------------------------------------------

  Pred range: [0.1178, 0.7591], std: 0.1198
  RMSE : 0.2039, R2: -0.3873, MAE: 0.1721, Spearman rho: 0.4454, Spearman p: 1.7369e-30, Pearson r: 0.4616, Pearson p: 6.8195e-33
  Pred range: [0.0766, 0.7436], std: 0.1199
  RMSE : 0.1653, R2: 0.0878, MAE: 0.1349, Spearman rho: 0.4802, Spearman p: 7.9114e-36, Pearson r: 0.4983, Pearson p: 7.4956e-39
  Pred range: [-0.0474, 0.7746], std: 0.1259
  RMSE : 0.1784, R2: -0.0621, MAE: 0.1479, Spearman rho: 0.4582, Spearman p: 2.2309e-32, Pearson r: 0.4835, Pearson p: 2.2940e-36
  Pred range: [0.1081, 0.7868], std: 0.1308
  RMSE : 0.1903, R2: -0.2087, MAE: 0.1580, Spearman rho: 0.4774, Spearman p: 2.3072e-35, Pearson r: 0.5084, Pearson p: 1.2681e-40
  Pred range: [0.0671, 0.7599], std: 0.1323
  RMSE : 0.1689, R2: 0.0477, MAE: 0.1361, Spearman rho: 0.4765, Spearman p: 3.1667e-35, Pearson r: 0.5018, Pearson p: 1.8713e-39
  Pred range: [0.0401, 0.8462], std: 0.1370
  RMSE : 0.1817, R2: -0.1014, MAE: 0.1479, Spearman rho: 0.4650, Spearman p: 2.0668e-33, Pearson r: 0.4926, Pearson p: 6.9307e-38
[I 2026-04-27 18:48:52,689] Trial 18 pruned. 
Train: 2407 rows (1613 IDs),Test: 598 rows (404 IDs) 

n_features_x : 6, n_features_per_modality: [16, 23, 19, 17, 7, 4, 4, 4, 1, 4]

--- ImbalancedRegressionLoss initialized ---
  Bins: 18, Focal gamma: 1.0128350259055874, Base loss: huber
  Bin [0.00, 0.06): count=  172, weight=0.058
  Bin [0.06, 0.11): count=  413, weight=0.024
  Bin [0.11, 0.17): count=  376, weight=0.027
  Bin [0.17, 0.22): count=  370, weight=0.027
  Bin [0.22, 0.28): count=  255, weight=0.040
  Bin [0.28, 0.33): count=  223, weight=0.045
  Bin [0.33, 0.39): count=   89, weight=0.112
  Bin [0.39, 0.44): count=  142, weight=0.071
  Bin [0.44, 0.50): count=  122, weight=0.082
  Bin [0.50, 0.56): count=   93, weight=0.108
  Bin [0.56, 0.61): count=   64, weight=0.156
  Bin [0.61, 0.67): count=   36, weight=0.273
  Bin [0.67, 0.72): count=   10, weight=0.920
  Bin [0.72, 0.78): count=   26, weight=0.375
  Bin [0.78, 0.83): count=    9, weight=1.012
  Bin [0.83, 0.89): count=    4, weight=2.023
  Bin [0.89, 0.94): count=    3, weight=2.529
  Bin [0.94, 1.00): count=    0, weight=10.117
-------------------------------------------

  Pred range: [0.1203, 0.5997], std: 0.0841
  RMSE : 0.1706, R2: 0.0285, MAE: 0.1439, Spearman rho: 0.4573, Spearman p: 3.1135e-32, Pearson r: 0.4713, Pearson p: 2.1504e-34
  Pred range: [0.1138, 0.6616], std: 0.1001
  RMSE : 0.1718, R2: 0.0144, MAE: 0.1444, Spearman rho: 0.4898, Spearman p: 2.1052e-37, Pearson r: 0.5067, Pearson p: 2.5370e-40
  Pred range: [0.1004, 0.6932], std: 0.1077
  RMSE : 0.1684, R2: 0.0531, MAE: 0.1405, Spearman rho: 0.4956, Spearman p: 2.2167e-38, Pearson r: 0.5175, Pearson p: 2.8082e-42
  Pred range: [0.0965, 0.7432], std: 0.1109
  RMSE : 0.1680, R2: 0.0577, MAE: 0.1396, Spearman rho: 0.4819, Spearman p: 4.2135e-36, Pearson r: 0.5060, Pearson p: 3.3533e-40
  Pred range: [0.1031, 0.7225], std: 0.1094
  RMSE : 0.1719, R2: 0.0140, MAE: 0.1436, Spearman rho: 0.4867, Spearman p: 6.9299e-37, Pearson r: 0.5119, Pearson p: 2.9671e-41
  Pred range: [0.1209, 0.8765], std: 0.1300
  RMSE : 0.2040, R2: -0.3887, MAE: 0.1719, Spearman rho: 0.4818, Spearman p: 4.3436e-36, Pearson r: 0.5085, Pearson p: 1.2145e-40
[I 2026-04-27 18:49:13,672] Trial 19 pruned. 
Train: 2407 rows (1613 IDs),Test: 598 rows (404 IDs) 

n_features_x : 6, n_features_per_modality: [16, 23, 19, 17, 7, 4, 4, 4, 1, 4]

--- ImbalancedRegressionLoss initialized ---
  Bins: 14, Focal gamma: 2.0173160362219527, Base loss: huber
  Bin [0.00, 0.07): count=  383, weight=0.042
  Bin [0.07, 0.14): count=  377, weight=0.043
  Bin [0.14, 0.21): count=  571, weight=0.028
  Bin [0.21, 0.29): count=  255, weight=0.063
  Bin [0.29, 0.36): count=  223, weight=0.072
  Bin [0.36, 0.43): count=  231, weight=0.070
  Bin [0.43, 0.50): count=  122, weight=0.131
  Bin [0.50, 0.57): count=   93, weight=0.172
  Bin [0.57, 0.64): count=   83, weight=0.192
  Bin [0.64, 0.71): count=   27, weight=0.577
  Bin [0.71, 0.79): count=   26, weight=0.598
  Bin [0.79, 0.86): count=   12, weight=1.243
  Bin [0.86, 0.93): count=    2, weight=5.384
  Bin [0.93, 1.00): count=    2, weight=5.384
-------------------------------------------

  Pred range: [0.1011, 0.5956], std: 0.0849
  RMSE : 0.1561, R2: 0.1868, MAE: 0.1275, Spearman rho: 0.4843, Spearman p: 1.6889e-36, Pearson r: 0.4935, Pearson p: 5.0291e-38
  Pred range: [0.0932, 0.6547], std: 0.0924
  RMSE : 0.1682, R2: 0.0557, MAE: 0.1416, Spearman rho: 0.4740, Spearman p: 7.9519e-35, Pearson r: 0.4968, Pearson p: 1.3418e-38
  Pred range: [-0.0098, 0.6435], std: 0.1136
  RMSE : 0.1555, R2: 0.1925, MAE: 0.1239, Spearman rho: 0.4716, Spearman p: 1.9220e-34, Pearson r: 0.4897, Pearson p: 2.1690e-37
  Pred range: [-0.0198, 0.5931], std: 0.1013
  RMSE : 0.1544, R2: 0.2040, MAE: 0.1244, Spearman rho: 0.4654, Spearman p: 1.7602e-33, Pearson r: 0.4868, Pearson p: 6.6156e-37
  Pred range: [0.0648, 0.7721], std: 0.1224
  RMSE : 0.1928, R2: -0.2412, MAE: 0.1616, Spearman rho: 0.4761, Spearman p: 3.6215e-35, Pearson r: 0.5007, Pearson p: 2.8583e-39
  Pred range: [-0.0120, 0.6450], std: 0.1010
  RMSE : 0.1610, R2: 0.1347, MAE: 0.1329, Spearman rho: 0.4699, Spearman p: 3.6089e-34, Pearson r: 0.4944, Pearson p: 3.4487e-38
  Pred range: [0.0543, 0.6919], std: 0.1081
  RMSE : 0.1683, R2: 0.0549, MAE: 0.1400, Spearman rho: 0.4819, Spearman p: 4.1681e-36, Pearson r: 0.5054, Pearson p: 4.2628e-40
  Pred range: [0.0737, 0.6575], std: 0.1039
  RMSE : 0.1778, R2: -0.0551, MAE: 0.1500, Spearman rho: 0.4848, Spearman p: 1.4286e-36, Pearson r: 0.5121, Pearson p: 2.7412e-41
  Pred range: [0.0066, 0.6279], std: 0.1019
  RMSE : 0.1600, R2: 0.1457, MAE: 0.1320, Spearman rho: 0.4799, Spearman p: 8.9179e-36, Pearson r: 0.5053, Pearson p: 4.4382e-40
[I 2026-04-27 18:50:16,866] Trial 20 finished with value: 0.15442617648235288 and parameters: {'learning_rate': 0.003339428299068992, 'batch_size': 8, 'num_epochs': 15, 'weight_decay': 1.0921051594110573e-05, 'layers_PRS': 6, 'layers_SCZ15': 7, 'layers_ADHD9': 7, 'layers_ASD9': 2, 'layers_ACE15': 5, 'layers_ACE18': 6, 'layers_SUD18': 5, 'layers_SES': 1, 'layers_SEX': 6, 'dropout': 0.4909939301906957, 'se_reduction': 8, 'hidden_dim_min': 4, 'base_loss': 'huber', 'huber_delta': 0.015364700054280749, 'focal_gamma': 2.0173160362219527, 'n_bins': 14, 'scheduler_patience': 3, 'scheduler_factor': 0.46815198968261584, 'early_stopping_patience': 5}. Best is trial 8 with value: 0.15005696427010315.
Train: 2407 rows (1613 IDs),Test: 598 rows (404 IDs) 

n_features_x : 6, n_features_per_modality: [16, 23, 19, 17, 7, 4, 4, 4, 1, 4]

--- ImbalancedRegressionLoss initialized ---
  Bins: 12, Focal gamma: 0.7959307473271944, Base loss: mse
  Bin [0.00, 0.08): count=  383, weight=0.051
  Bin [0.08, 0.17): count=  578, weight=0.034
  Bin [0.17, 0.25): count=  499, weight=0.039
  Bin [0.25, 0.33): count=  349, weight=0.055
  Bin [0.33, 0.42): count=  162, weight=0.119
  Bin [0.42, 0.50): count=  191, weight=0.101
  Bin [0.50, 0.58): count=  129, weight=0.149
  Bin [0.58, 0.67): count=   47, weight=0.404
  Bin [0.67, 0.75): count=   41, weight=0.462
  Bin [0.75, 0.83): count=   21, weight=0.882
  Bin [0.83, 0.92): count=    5, weight=3.235
  Bin [0.92, 1.00): count=    2, weight=6.469
-------------------------------------------

  Pred range: [0.1508, 0.5654], std: 0.0757
  RMSE : 0.1701, R2: 0.0344, MAE: 0.1431, Spearman rho: 0.4078, Spearman p: 2.3024e-25, Pearson r: 0.4143, Pearson p: 3.2921e-26
  Pred range: [0.1473, 0.6143], std: 0.0874
  RMSE : 0.1703, R2: 0.0317, MAE: 0.1436, Spearman rho: 0.4513, Spearman p: 2.3853e-31, Pearson r: 0.4625, Pearson p: 5.0290e-33
  Pred range: [0.1342, 0.6026], std: 0.0877
  RMSE : 0.1611, R2: 0.1335, MAE: 0.1338, Spearman rho: 0.4729, Spearman p: 1.1908e-34, Pearson r: 0.4840, Pearson p: 1.9242e-36
  Pred range: [0.1272, 0.5985], std: 0.0871
  RMSE : 0.1576, R2: 0.1712, MAE: 0.1298, Spearman rho: 0.4808, Spearman p: 6.4115e-36, Pearson r: 0.4922, Pearson p: 8.1381e-38
  Pred range: [0.1548, 0.6675], std: 0.0931
  RMSE : 0.1753, R2: -0.0258, MAE: 0.1490, Spearman rho: 0.4788, Spearman p: 1.3632e-35, Pearson r: 0.4949, Pearson p: 2.8444e-38
  Pred range: [0.1039, 0.5555], std: 0.0848
  RMSE : 0.1517, R2: 0.2321, MAE: 0.1222, Spearman rho: 0.4878, Spearman p: 4.4461e-37, Pearson r: 0.5044, Pearson p: 6.5231e-40
  Pred range: [0.1290, 0.6260], std: 0.0923
  RMSE : 0.1617, R2: 0.1278, MAE: 0.1351, Spearman rho: 0.4883, Spearman p: 3.7573e-37, Pearson r: 0.5057, Pearson p: 3.9066e-40
  Pred range: [0.0975, 0.6023], std: 0.0888
  RMSE : 0.1559, R2: 0.1886, MAE: 0.1283, Spearman rho: 0.4882, Spearman p: 3.8260e-37, Pearson r: 0.5054, Pearson p: 4.3242e-40
  Pred range: [0.0873, 0.6445], std: 0.0956
  RMSE : 0.1640, R2: 0.1018, MAE: 0.1374, Spearman rho: 0.4902, Spearman p: 1.7744e-37, Pearson r: 0.5068, Pearson p: 2.4561e-40
  Pred range: [0.0688, 0.5999], std: 0.0907
  RMSE : 0.1560, R2: 0.1876, MAE: 0.1282, Spearman rho: 0.4896, Spearman p: 2.2986e-37, Pearson r: 0.5056, Pearson p: 4.0299e-40
[I 2026-04-27 18:51:59,274] Trial 21 finished with value: 0.1516720317015679 and parameters: {'learning_rate': 0.00022627375749632118, 'batch_size': 4, 'num_epochs': 26, 'weight_decay': 0.00014965421151865048, 'layers_PRS': 3, 'layers_SCZ15': 2, 'layers_ADHD9': 5, 'layers_ASD9': 4, 'layers_ACE15': 6, 'layers_ACE18': 5, 'layers_SUD18': 4, 'layers_SES': 3, 'layers_SEX': 4, 'dropout': 0.1928094443945619, 'se_reduction': 7, 'hidden_dim_min': 8, 'base_loss': 'mse', 'huber_delta': 0.06105902666276876, 'focal_gamma': 0.7959307473271944, 'n_bins': 12, 'scheduler_patience': 5, 'scheduler_factor': 0.3767427788794832, 'early_stopping_patience': 4}. Best is trial 8 with value: 0.15005696427010315.
Train: 2407 rows (1613 IDs),Test: 598 rows (404 IDs) 

n_features_x : 6, n_features_per_modality: [16, 23, 19, 17, 7, 4, 4, 4, 1, 4]

--- ImbalancedRegressionLoss initialized ---
  Bins: 19, Focal gamma: 0.721768028283476, Base loss: huber
  Bin [0.00, 0.05): count=  172, weight=0.055
  Bin [0.05, 0.11): count=  413, weight=0.023
  Bin [0.11, 0.16): count=  376, weight=0.025
  Bin [0.16, 0.21): count=  204, weight=0.046
  Bin [0.21, 0.26): count=  295, weight=0.032
  Bin [0.26, 0.32): count=  239, weight=0.039
  Bin [0.32, 0.37): count=  199, weight=0.047
  Bin [0.37, 0.42): count=   73, weight=0.128
  Bin [0.42, 0.47): count=  134, weight=0.070
  Bin [0.47, 0.53): count=  108, weight=0.087
  Bin [0.53, 0.58): count=   78, weight=0.120
  Bin [0.58, 0.63): count=   28, weight=0.327
  Bin [0.63, 0.68): count=   36, weight=0.256
  Bin [0.68, 0.74): count=   24, weight=0.379
  Bin [0.74, 0.79): count=   19, weight=0.474
  Bin [0.79, 0.84): count=    2, weight=3.157
  Bin [0.84, 0.89): count=    4, weight=1.894
  Bin [0.89, 0.95): count=    3, weight=2.368
  Bin [0.95, 1.00): count=    0, weight=9.472
-------------------------------------------

  Pred range: [0.0691, 0.5261], std: 0.0713
  RMSE : 0.1776, R2: -0.0532, MAE: 0.1450, Spearman rho: 0.2190, Spearman p: 6.2850e-08, Pearson r: 0.2281, Pearson p: 1.7031e-08
  Pred range: [0.0693, 0.5356], std: 0.0741
  RMSE : 0.1698, R2: 0.0375, MAE: 0.1372, Spearman rho: 0.3063, Spearman p: 1.8484e-14, Pearson r: 0.3186, Pearson p: 1.4219e-15
  Pred range: [0.0711, 0.5622], std: 0.0791
  RMSE : 0.1655, R2: 0.0858, MAE: 0.1331, Spearman rho: 0.3615, Spearman p: 6.7476e-20, Pearson r: 0.3727, Pearson p: 3.8116e-21
  Pred range: [0.0794, 0.5980], std: 0.0865
  RMSE : 0.1653, R2: 0.0878, MAE: 0.1337, Spearman rho: 0.3953, Spearman p: 8.3352e-24, Pearson r: 0.4060, Pearson p: 3.8845e-25
  Pred range: [0.0732, 0.5772], std: 0.0868
  RMSE : 0.1600, R2: 0.1451, MAE: 0.1275, Spearman rho: 0.4134, Spearman p: 4.3585e-26, Pearson r: 0.4241, Pearson p: 1.6581e-27
  Pred range: [0.0746, 0.5944], std: 0.0907
  RMSE : 0.1607, R2: 0.1381, MAE: 0.1289, Spearman rho: 0.4259, Spearman p: 9.5752e-28, Pearson r: 0.4363, Pearson p: 3.4571e-29
  Pred range: [0.0694, 0.5884], std: 0.0914
  RMSE : 0.1583, R2: 0.1630, MAE: 0.1262, Spearman rho: 0.4372, Spearman p: 2.5904e-29, Pearson r: 0.4473, Pearson p: 9.2184e-31
  Pred range: [0.0768, 0.6392], std: 0.0979
  RMSE : 0.1628, R2: 0.1156, MAE: 0.1324, Spearman rho: 0.4444, Spearman p: 2.4640e-30, Pearson r: 0.4555, Pearson p: 5.7411e-32
[I 2026-04-27 18:53:22,173] Trial 22 pruned. 
Train: 2407 rows (1613 IDs),Test: 598 rows (404 IDs) 

n_features_x : 6, n_features_per_modality: [16, 23, 19, 17, 7, 4, 4, 4, 1, 4]

--- ImbalancedRegressionLoss initialized ---
  Bins: 15, Focal gamma: 1.0682853194774946, Base loss: mse
  Bin [0.00, 0.07): count=  383, weight=0.040
  Bin [0.07, 0.13): count=  377, weight=0.041
  Bin [0.13, 0.20): count=  405, weight=0.038
  Bin [0.20, 0.27): count=  295, weight=0.052
  Bin [0.27, 0.33): count=  349, weight=0.044
  Bin [0.33, 0.40): count=  162, weight=0.094
  Bin [0.40, 0.47): count=  134, weight=0.114
  Bin [0.47, 0.53): count=  108, weight=0.141
  Bin [0.53, 0.60): count=   78, weight=0.194
  Bin [0.60, 0.67): count=   47, weight=0.320
  Bin [0.67, 0.73): count=   41, weight=0.365
  Bin [0.73, 0.80): count=   19, weight=0.767
  Bin [0.80, 0.87): count=    5, weight=2.558
  Bin [0.87, 0.93): count=    2, weight=5.116
  Bin [0.93, 1.00): count=    2, weight=5.116
-------------------------------------------

  Pred range: [0.0234, 0.5210], std: 0.0564
  RMSE : 0.1580, R2: 0.1668, MAE: 0.1248, Spearman rho: 0.4115, Spearman p: 7.5753e-26, Pearson r: 0.4235, Pearson p: 1.9783e-27
  Pred range: [0.1618, 0.6128], std: 0.0878
  RMSE : 0.1758, R2: -0.0317, MAE: 0.1489, Spearman rho: 0.4670, Spearman p: 1.0043e-33, Pearson r: 0.4821, Pearson p: 4.0010e-36
  Pred range: [0.0668, 0.4672], std: 0.0674
  RMSE : 0.1553, R2: 0.1949, MAE: 0.1208, Spearman rho: 0.4215, Spearman p: 3.7373e-27, Pearson r: 0.4451, Pearson p: 1.9374e-30
  Pred range: [0.0078, 0.5912], std: 0.0918
  RMSE : 0.1565, R2: 0.1822, MAE: 0.1277, Spearman rho: 0.4653, Spearman p: 1.8602e-33, Pearson r: 0.4872, Pearson p: 5.7638e-37
  Pred range: [0.1199, 0.6554], std: 0.1025
  RMSE : 0.1707, R2: 0.0273, MAE: 0.1414, Spearman rho: 0.4496, Spearman p: 4.3308e-31, Pearson r: 0.4750, Pearson p: 5.5696e-35
  Pred range: [0.0820, 0.5519], std: 0.0847
  RMSE : 0.1665, R2: 0.0741, MAE: 0.1403, Spearman rho: 0.4678, Spearman p: 7.6483e-34, Pearson r: 0.4803, Pearson p: 7.7330e-36
  Pred range: [0.1993, 0.6013], std: 0.0737
  RMSE : 0.1864, R2: -0.1601, MAE: 0.1599, Spearman rho: 0.4482, Spearman p: 6.8526e-31, Pearson r: 0.4451, Pearson p: 1.9556e-30
  Pred range: [-0.0139, 0.5946], std: 0.0914
  RMSE : 0.1583, R2: 0.1637, MAE: 0.1279, Spearman rho: 0.4379, Spearman p: 2.0530e-29, Pearson r: 0.4452, Pearson p: 1.9056e-30
[I 2026-04-27 18:55:05,745] Trial 23 finished with value: 0.15530933109212902 and parameters: {'learning_rate': 0.00994741969518535, 'batch_size': 4, 'num_epochs': 25, 'weight_decay': 2.211893816261141e-05, 'layers_PRS': 5, 'layers_SCZ15': 6, 'layers_ADHD9': 4, 'layers_ASD9': 6, 'layers_ACE15': 7, 'layers_ACE18': 4, 'layers_SUD18': 4, 'layers_SES': 3, 'layers_SEX': 4, 'dropout': 0.3204902343700245, 'se_reduction': 6, 'hidden_dim_min': 12, 'base_loss': 'mse', 'huber_delta': 0.04757184329457687, 'focal_gamma': 1.0682853194774946, 'n_bins': 15, 'scheduler_patience': 4, 'scheduler_factor': 0.3393203872850594, 'early_stopping_patience': 5}. Best is trial 8 with value: 0.15005696427010315.
Train: 2407 rows (1613 IDs),Test: 598 rows (404 IDs) 

n_features_x : 6, n_features_per_modality: [16, 23, 19, 17, 7, 4, 4, 4, 1, 4]

--- ImbalancedRegressionLoss initialized ---
  Bins: 17, Focal gamma: 1.3974013609951983, Base loss: huber
  Bin [0.00, 0.06): count=  172, weight=0.058
  Bin [0.06, 0.12): count=  413, weight=0.024
  Bin [0.12, 0.18): count=  376, weight=0.027
  Bin [0.18, 0.24): count=  370, weight=0.027
  Bin [0.24, 0.29): count=  255, weight=0.039
  Bin [0.29, 0.35): count=  223, weight=0.045
  Bin [0.35, 0.41): count=  162, weight=0.061
  Bin [0.41, 0.47): count=  134, weight=0.074
  Bin [0.47, 0.53): count=  108, weight=0.092
  Bin [0.53, 0.59): count=   78, weight=0.127
  Bin [0.59, 0.65): count=   47, weight=0.208
  Bin [0.65, 0.71): count=   27, weight=0.357
  Bin [0.71, 0.76): count=   26, weight=0.370
  Bin [0.76, 0.82): count=    9, weight=0.999
  Bin [0.82, 0.88): count=    4, weight=1.999
  Bin [0.88, 0.94): count=    3, weight=2.499
  Bin [0.94, 1.00): count=    0, weight=9.995
-------------------------------------------

  Pred range: [0.0702, 0.5419], std: 0.0845
  RMSE : 0.1507, R2: 0.2418, MAE: 0.1182, Spearman rho: 0.4860, Spearman p: 8.8515e-37, Pearson r: 0.4947, Pearson p: 3.1337e-38
  Pred range: [0.0276, 0.5379], std: 0.0938
  RMSE : 0.1517, R2: 0.2315, MAE: 0.1133, Spearman rho: 0.5040, Spearman p: 7.6968e-40, Pearson r: 0.5174, Pearson p: 2.9680e-42
  Pred range: [0.0311, 0.6303], std: 0.1063
  RMSE : 0.1503, R2: 0.2460, MAE: 0.1191, Spearman rho: 0.5016, Spearman p: 2.0139e-39, Pearson r: 0.5171, Pearson p: 3.3267e-42
  Pred range: [0.0665, 0.6181], std: 0.1021
  RMSE : 0.1537, R2: 0.2118, MAE: 0.1235, Spearman rho: 0.4990, Spearman p: 5.7156e-39, Pearson r: 0.5104, Pearson p: 5.6044e-41
  Pred range: [0.0636, 0.6182], std: 0.0981
  RMSE : 0.1553, R2: 0.1947, MAE: 0.1265, Spearman rho: 0.4958, Spearman p: 2.0153e-38, Pearson r: 0.5101, Pearson p: 6.2414e-41
  Pred range: [0.0508, 0.5922], std: 0.0981
  RMSE : 0.1503, R2: 0.2459, MAE: 0.1195, Spearman rho: 0.4939, Spearman p: 4.2075e-38, Pearson r: 0.5103, Pearson p: 5.8807e-41
  Pred range: [-0.0019, 0.6035], std: 0.1038
  RMSE : 0.1503, R2: 0.2463, MAE: 0.1189, Spearman rho: 0.4945, Spearman p: 3.3208e-38, Pearson r: 0.5125, Pearson p: 2.3107e-41
  Pred range: [0.0154, 0.6703], std: 0.1072
  RMSE : 0.1537, R2: 0.2113, MAE: 0.1234, Spearman rho: 0.4949, Spearman p: 2.8704e-38, Pearson r: 0.5080, Pearson p: 1.4894e-40
  Pred range: [0.0126, 0.5986], std: 0.1018
  RMSE : 0.1494, R2: 0.2545, MAE: 0.1160, Spearman rho: 0.4942, Spearman p: 3.7207e-38, Pearson r: 0.5105, Pearson p: 5.4155e-41
  Pred range: [0.0241, 0.7005], std: 0.1154
  RMSE : 0.1576, R2: 0.1705, MAE: 0.1271, Spearman rho: 0.5002, Spearman p: 3.5152e-39, Pearson r: 0.5124, Pearson p: 2.3895e-41
  Pred range: [0.0133, 0.6360], std: 0.1016
  RMSE : 0.1529, R2: 0.2197, MAE: 0.1223, Spearman rho: 0.4882, Spearman p: 3.9138e-37, Pearson r: 0.5028, Pearson p: 1.2606e-39
  Pred range: [0.0367, 0.6397], std: 0.1023
  RMSE : 0.1536, R2: 0.2123, MAE: 0.1234, Spearman rho: 0.4956, Spearman p: 2.1881e-38, Pearson r: 0.5058, Pearson p: 3.6395e-40
  Pred range: [0.0322, 0.6188], std: 0.1028
  RMSE : 0.1583, R2: 0.1640, MAE: 0.1292, Spearman rho: 0.4934, Spearman p: 5.0761e-38, Pearson r: 0.5049, Pearson p: 5.3058e-40
  Pred range: [0.0156, 0.6769], std: 0.1090
  RMSE : 0.1623, R2: 0.1204, MAE: 0.1327, Spearman rho: 0.4907, Spearman p: 1.5062e-37, Pearson r: 0.5019, Pearson p: 1.7771e-39
  Pred range: [0.0209, 0.6630], std: 0.1073
  RMSE : 0.1548, R2: 0.2004, MAE: 0.1246, Spearman rho: 0.4921, Spearman p: 8.4950e-38, Pearson r: 0.5069, Pearson p: 2.3363e-40
  Pred range: [0.0167, 0.6889], std: 0.1130
  RMSE : 0.1548, R2: 0.2000, MAE: 0.1237, Spearman rho: 0.4936, Spearman p: 4.7442e-38, Pearson r: 0.5080, Pearson p: 1.5146e-40
