[I 2026-04-28 00:29:15,216] Trial 49 finished with value: 0.08991125929053458 and parameters: {'learning_rate': 0.00017505347905967788, 'batch_size': 4, 'num_epochs': 24, 'weight_decay': 0.00022715274143210584, 'depth_complex': 6, 'depth_moderate': 4, 'depth_simple': 2, 'dropout': 0.24013756687157628, 'se_reduction': 6, 'hidden_dim_min': 3, 'base_loss': 'huber', 'huber_delta': 0.02039026079950023, 'focal_gamma': 1.442778505018326, 'n_bins': 7, 'scheduler_patience': 2, 'scheduler_factor': 0.5413770525282804, 'early_stopping_patience': 6}. Best is trial 22 with value: 0.08764163086185245.

Completed in 77.0 minutes
Trials: 35 complete, 15 pruned

============================================================
  Best Pos trial
============================================================
  RMSE: 0.0876

  Copy these into hyperparameters.json:
  ----------------------------------------
  learning_rate = 0.0014309323651807086
  batch_size = 4
  num_epochs = 30
  weight_decay = 0.004771587471653592
  depth_complex = 3
  depth_moderate = 4
  depth_simple = 1
  dropout = 0.3739860514488121
  se_reduction = 6
  hidden_dim_min = 4
  base_loss = 'huber'
  huber_delta = 0.07583418438994234
  focal_gamma = 2.232660448508375
  n_bins = 9
  scheduler_patience = 2
  scheduler_factor = 0.5903610082320528
  early_stopping_patience = 7
  ----------------------------------------

Best hyperparameters saved to 'Pos_best_params.txt'
All trial results saved to 'Pos_optuna_results.csv'
Visualizations saved as Pos_*.html

============================================================
  Tuning Neg symptom model (50 trials)
============================================================
  0%|          | 0/50 [00:00<?, ?it/s]                                        0%|          | 0/50 [02:14<?, ?it/s]Best trial: 0. Best value: 0.164196:   0%|          | 0/50 [02:14<?, ?it/s]Best trial: 0. Best value: 0.164196:   2%|▏         | 1/50 [02:14<1:50:09, 134.89s/it]                                                                                      Best trial: 0. Best value: 0.164196:   2%|▏         | 1/50 [03:41<1:50:09, 134.89s/it]Best trial: 0. Best value: 0.164196:   2%|▏         | 1/50 [03:41<1:50:09, 134.89s/it]Best trial: 0. Best value: 0.164196:   4%|▍         | 2/50 [03:41<1:25:08, 106.43s/it]                                                                                      Best trial: 0. Best value: 0.164196:   4%|▍         | 2/50 [03:52<1:25:08, 106.43s/it]Best trial: 0. Best value: 0.164196:   4%|▍         | 2/50 [03:52<1:25:08, 106.43s/it]Best trial: 0. Best value: 0.164196:   6%|▌         | 3/50 [03:52<49:11, 62.79s/it]                                                                                      Best trial: 0. Best value: 0.164196:   6%|▌         | 3/50 [08:30<49:11, 62.79s/it]Best trial: 3. Best value: 0.15777:   6%|▌         | 3/50 [08:30<49:11, 62.79s/it] Best trial: 3. Best value: 0.15777:   8%|▊         | 4/50 [08:30<1:53:14, 147.71s/it]                                                                                     Best trial: 3. Best value: 0.15777:   8%|▊         | 4/50 [08:49<1:53:14, 147.71s/it]Best trial: 4. Best value: 0.155696:   8%|▊         | 4/50 [08:49<1:53:14, 147.71s/it]Best trial: 4. Best value: 0.155696:  10%|█         | 5/50 [08:49<1:16:10, 101.56s/it]                                                                                      Best trial: 4. Best value: 0.155696:  10%|█         | 5/50 [11:02<1:16:10, 101.56s/it]Best trial: 5. Best value: 0.15179:  10%|█         | 5/50 [11:02<1:16:10, 101.56s/it] Best trial: 5. Best value: 0.15179:  12%|█▏        | 6/50 [11:02<1:22:16, 112.20s/it]                                                                                     Best trial: 5. Best value: 0.15179:  12%|█▏        | 6/50 [11:37<1:22:16, 112.20s/it]Best trial: 5. Best value: 0.15179:  12%|█▏        | 6/50 [11:37<1:22:16, 112.20s/it]Best trial: 5. Best value: 0.15179:  14%|█▍        | 7/50 [11:37<1:02:16, 86.90s/it]                                                                                     Best trial: 5. Best value: 0.15179:  14%|█▍        | 7/50 [13:13<1:02:16, 86.90s/it]Best trial: 5. Best value: 0.15179:  14%|█▍        | 7/50 [13:13<1:02:16, 86.90s/it]Best trial: 5. Best value: 0.15179:  16%|█▌        | 8/50 [13:13<1:02:48, 89.73s/it]                                                                                    Best trial: 5. Best value: 0.15179:  16%|█▌        | 8/50 [13:21<1:02:48, 89.73s/it]Best trial: 5. Best value: 0.15179:  16%|█▌        | 8/50 [13:21<1:02:48, 89.73s/it]Best trial: 5. Best value: 0.15179:  18%|█▊        | 9/50 [13:21<43:59, 64.37s/it]                                                                                    Best trial: 5. Best value: 0.15179:  18%|█▊        | 9/50 [13:33<43:59, 64.37s/it]Best trial: 5. Best value: 0.15179:  18%|█▊        | 9/50 [13:33<43:59, 64.37s/it]Best trial: 5. Best value: 0.15179:  20%|██        | 10/50 [13:33<32:08, 48.22s/it]                                                                                   Best trial: 5. Best value: 0.15179:  20%|██        | 10/50 [15:48<32:08, 48.22s/it]Best trial: 10. Best value: 0.149589:  20%|██        | 10/50 [15:48<32:08, 48.22s/it]Best trial: 10. Best value: 0.149589:  22%|██▏       | 11/50 [15:48<48:35, 74.75s/it]                                                                                     Best trial: 10. Best value: 0.149589:  22%|██▏       | 11/50 [18:46<48:35, 74.75s/it]Best trial: 10. Best value: 0.149589:  22%|██▏       | 11/50 [18:46<48:35, 74.75s/it]Best trial: 10. Best value: 0.149589:  24%|██▍       | 12/50 [18:46<1:07:04, 105.91s/it]                                                                                        Best trial: 10. Best value: 0.149589:  24%|██▍       | 12/50 [20:10<1:07:04, 105.91s/it]Best trial: 10. Best value: 0.149589:  24%|██▍       | 12/50 [20:10<1:07:04, 105.91s/it]Best trial: 10. Best value: 0.149589:  26%|██▌       | 13/50 [20:10<1:01:15, 99.33s/it]                                                                                        Best trial: 10. Best value: 0.149589:  26%|██▌       | 13/50 [20:51<1:01:15, 99.33s/it]Best trial: 10. Best value: 0.149589:  26%|██▌       | 13/50 [20:51<1:01:15, 99.33s/it]Best trial: 10. Best value: 0.149589:  28%|██▊       | 14/50 [20:51<49:05, 81.82s/it]                                                                                       Best trial: 10. Best value: 0.149589:  28%|██▊       | 14/50 [23:07<49:05, 81.82s/it]Best trial: 10. Best value: 0.149589:  28%|██▊       | 14/50 [23:07<49:05, 81.82s/it]Best trial: 10. Best value: 0.149589:  30%|███       | 15/50 [23:07<57:16, 98.19s/it]                                                                                     Best trial: 10. Best value: 0.149589:  30%|███       | 15/50 [25:07<57:16, 98.19s/it]Best trial: 10. Best value: 0.149589:  30%|███       | 15/50 [25:07<57:16, 98.19s/it]Best trial: 10. Best value: 0.149589:  32%|███▏      | 16/50 [25:07<59:16, 104.60s/it]                                                                                      Best trial: 10. Best value: 0.149589:  32%|███▏      | 16/50 [27:03<59:16, 104.60s/it]Best trial: 16. Best value: 0.149333:  32%|███▏      | 16/50 [27:03<59:16, 104.60s/it]Best trial: 16. Best value: 0.149333:  34%|███▍      | 17/50 [27:03<59:27, 108.10s/it]                                                                                      Best trial: 16. Best value: 0.149333:  34%|███▍      | 17/50 [27:33<59:27, 108.10s/it]Best trial: 16. Best value: 0.149333:  34%|███▍      | 17/50 [27:33<59:27, 108.10s/it]Best trial: 16. Best value: 0.149333:  36%|███▌      | 18/50 [27:33<45:10, 84.72s/it]                                                                                      Best trial: 16. Best value: 0.149333:  36%|███▌      | 18/50 [27:49<45:10, 84.72s/it]Best trial: 16. Best value: 0.149333:  36%|███▌      | 18/50 [27:49<45:10, 84.72s/it]Best trial: 16. Best value: 0.149333:  38%|███▊      | 19/50 [27:49<33:08, 64.13s/it]                                                                                     Best trial: 16. Best value: 0.149333:  38%|███▊      | 19/50 [29:29<33:08, 64.13s/it]Best trial: 16. Best value: 0.149333:  38%|███▊      | 19/50 [29:29<33:08, 64.13s/it]Best trial: 16. Best value: 0.149333:  40%|████      | 20/50 [29:29<37:21, 74.73s/it]                                                                                     Best trial: 16. Best value: 0.149333:  40%|████      | 20/50 [30:26<37:21, 74.73s/it]Best trial: 16. Best value: 0.149333:  40%|████      | 20/50 [30:26<37:21, 74.73s/it]Best trial: 16. Best value: 0.149333:  42%|████▏     | 21/50 [30:26<33:34, 69.47s/it]                                                                                     Best trial: 16. Best value: 0.149333:  42%|████▏     | 21/50 [32:44<33:34, 69.47s/it]Best trial: 16. Best value: 0.149333:  42%|████▏     | 21/50 [32:44<33:34, 69.47s/it]Best trial: 16. Best value: 0.149333:  44%|████▍     | 22/50 [32:44<41:57, 89.90s/it]                                                                                     Best trial: 16. Best value: 0.149333:  44%|████▍     | 22/50 [33:58<41:57, 89.90s/it]Best trial: 22. Best value: 0.149333:  44%|████▍     | 22/50 [33:58<41:57, 89.90s/it]Best trial: 22. Best value: 0.149333:  46%|████▌     | 23/50 [33:58<38:20, 85.21s/it]                                                                                     Best trial: 22. Best value: 0.149333:  46%|████▌     | 23/50 [34:52<38:20, 85.21s/it]Best trial: 22. Best value: 0.149333:  46%|████▌     | 23/50 [34:52<38:20, 85.21s/it]Best trial: 22. Best value: 0.149333:  48%|████▊     | 24/50 [34:52<32:52, 75.87s/it]                                                                                     Best trial: 22. Best value: 0.149333:  48%|████▊     | 24/50 [35:37<32:52, 75.87s/it]Best trial: 22. Best value: 0.149333:  48%|████▊     | 24/50 [35:37<32:52, 75.87s/it]Best trial: 22. Best value: 0.149333:  50%|█████     | 25/50 [35:37<27:44, 66.57s/it]                                                                                     Best trial: 22. Best value: 0.149333:  50%|█████     | 25/50 [36:25<27:44, 66.57s/it]Best trial: 22. Best value: 0.149333:  50%|█████     | 25/50 [36:25<27:44, 66.57s/it]Best trial: 22. Best value: 0.149333:  52%|█████▏    | 26/50 [36:25<24:28, 61.18s/it]                                                                                     Best trial: 22. Best value: 0.149333:  52%|█████▏    | 26/50 [37:23<24:28, 61.18s/it]Best trial: 22. Best value: 0.149333:  52%|█████▏    | 26/50 [37:23<24:28, 61.18s/it]Best trial: 22. Best value: 0.149333:  54%|█████▍    | 27/50 [37:23<23:01, 60.07s/it]                                                                                     Best trial: 22. Best value: 0.149333:  54%|█████▍    | 27/50 [37:36<23:01, 60.07s/it]Best trial: 22. Best value: 0.149333:  54%|█████▍    | 27/50 [37:36<23:01, 60.07s/it]Best trial: 22. Best value: 0.149333:  56%|█████▌    | 28/50 [37:36<16:52, 46.02s/it]                                                                                     Best trial: 22. Best value: 0.149333:  56%|█████▌    | 28/50 [39:24<16:52, 46.02s/it]Best trial: 22. Best value: 0.149333:  56%|█████▌    | 28/50 [39:24<16:52, 46.02s/it]Best trial: 22. Best value: 0.149333:  58%|█████▊    | 29/50 [39:24<22:38, 64.67s/it]                                                                                     Best trial: 22. Best value: 0.149333:  58%|█████▊    | 29/50 [40:57<22:38, 64.67s/it]Best trial: 22. Best value: 0.149333:  58%|█████▊    | 29/50 [40:57<22:38, 64.67s/it]Best trial: 22. Best value: 0.149333:  60%|██████    | 30/50 [40:57<24:20, 73.04s/it]                                                                                     Best trial: 22. Best value: 0.149333:  60%|██████    | 30/50 [42:18<24:20, 73.04s/it]Best trial: 22. Best value: 0.149333:  60%|██████    | 30/50 [42:18<24:20, 73.04s/it]Best trial: 22. Best value: 0.149333:  62%|██████▏   | 31/50 [42:18<23:53, 75.44s/it]                                                                                     Best trial: 22. Best value: 0.149333:  62%|██████▏   | 31/50 [43:56<23:53, 75.44s/it]Best trial: 22. Best value: 0.149333:  62%|██████▏   | 31/50 [43:56<23:53, 75.44s/it]Best trial: 22. Best value: 0.149333:  64%|██████▍   | 32/50 [43:56<24:38, 82.17s/it]                                                                                     Best trial: 22. Best value: 0.149333:  64%|██████▍   | 32/50 [45:12<24:38, 82.17s/it]Best trial: 22. Best value: 0.149333:  64%|██████▍   | 32/50 [45:12<24:38, 82.17s/it]Best trial: 22. Best value: 0.149333:  66%|██████▌   | 33/50 [45:12<22:48, 80.50s/it]                                                                                     Best trial: 22. Best value: 0.149333:  66%|██████▌   | 33/50 [45:48<22:48, 80.50s/it]Best trial: 22. Best value: 0.149333:  66%|██████▌   | 33/50 [45:48<22:48, 80.50s/it]Best trial: 22. Best value: 0.149333:  68%|██████▊   | 34/50 [45:48<17:53, 67.11s/it]                                                                                     Best trial: 22. Best value: 0.149333:  68%|██████▊   | 34/50 [45:55<17:53, 67.11s/it]Best trial: 22. Best value: 0.149333:  68%|██████▊   | 34/50 [45:55<17:53, 67.11s/it]Best trial: 22. Best value: 0.149333:  70%|███████   | 35/50 [45:55<12:13, 48.92s/it]                                                                                     Best trial: 22. Best value: 0.149333:  70%|███████   | 35/50 [46:11<12:13, 48.92s/it]Best trial: 22. Best value: 0.149333:  70%|███████   | 35/50 [46:11<12:13, 48.92s/it]Best trial: 22. Best value: 0.149333:  72%|███████▏  | 36/50 [46:11<09:06, 39.01s/it]                                                                                     Best trial: 22. Best value: 0.149333:  72%|███████▏  | 36/50 [46:47<09:06, 39.01s/it]Best trial: 22. Best value: 0.149333:  72%|███████▏  | 36/50 [46:47<09:06, 39.01s/it]Best trial: 22. Best value: 0.149333:  74%|███████▍  | 37/50 [46:47<08:15, 38.09s/it]                                                                                     Best trial: 22. Best value: 0.149333:  74%|███████▍  | 37/50 [47:51<08:15, 38.09s/it]Best trial: 22. Best value: 0.149333:  74%|███████▍  | 37/50 [47:51<08:15, 38.09s/it]Best trial: 22. Best value: 0.149333:  76%|███████▌  | 38/50 [47:51<09:12, 46.01s/it]                                                                                     Best trial: 22. Best value: 0.149333:  76%|███████▌  | 38/50 [48:34<09:12, 46.01s/it]Best trial: 22. Best value: 0.149333:  76%|███████▌  | 38/50 [48:34<09:12, 46.01s/it]Best trial: 22. Best value: 0.149333:  78%|███████▊  | 39/50 [48:34<08:15, 45.08s/it]                                                                                     Best trial: 22. Best value: 0.149333:  78%|███████▊  | 39/50 [49:07<08:15, 45.08s/it]Best trial: 22. Best value: 0.149333:  78%|███████▊  | 39/50 [49:07<08:15, 45.08s/it]Best trial: 22. Best value: 0.149333:  80%|████████  | 40/50 [49:07<06:53, 41.37s/it]                                                                                     Best trial: 22. Best value: 0.149333:  80%|████████  | 40/50 [49:14<06:53, 41.37s/it]Best trial: 22. Best value: 0.149333:  80%|████████  | 40/50 [49:14<06:53, 41.37s/it]Best trial: 22. Best value: 0.149333:  82%|████████▏ | 41/50 [49:14<04:40, 31.20s/it]                                                                                     Best trial: 22. Best value: 0.149333:  82%|████████▏ | 41/50 [50:19<04:40, 31.20s/it]Best trial: 41. Best value: 0.148147:  82%|████████▏ | 41/50 [50:19<04:40, 31.20s/it]Best trial: 41. Best value: 0.148147:  84%|████████▍ | 42/50 [50:19<05:29, 41.17s/it]                                                                                     Best trial: 41. Best value: 0.148147:  84%|████████▍ | 42/50 [51:38<05:29, 41.17s/it]Best trial: 41. Best value: 0.148147:  84%|████████▍ | 42/50 [51:38<05:29, 41.17s/it]Best trial: 41. Best value: 0.148147:  86%|████████▌ | 43/50 [51:38<06:07, 52.52s/it]                                                                                     Best trial: 41. Best value: 0.148147:  86%|████████▌ | 43/50 [52:58<06:07, 52.52s/it]Best trial: 41. Best value: 0.148147:  86%|████████▌ | 43/50 [52:58<06:07, 52.52s/it]Best trial: 41. Best value: 0.148147:  88%|████████▊ | 44/50 [52:58<06:05, 60.94s/it]                                                                                     Best trial: 41. Best value: 0.148147:  88%|████████▊ | 44/50 [54:05<06:05, 60.94s/it]Best trial: 41. Best value: 0.148147:  88%|████████▊ | 44/50 [54:05<06:05, 60.94s/it]Best trial: 41. Best value: 0.148147:  90%|█████████ | 45/50 [54:05<05:13, 62.60s/it]                                                                                     Best trial: 41. Best value: 0.148147:  90%|█████████ | 45/50 [55:32<05:13, 62.60s/it]Best trial: 41. Best value: 0.148147:  90%|█████████ | 45/50 [55:32<05:13, 62.60s/it]Best trial: 41. Best value: 0.148147:  92%|█████████▏| 46/50 [55:32<04:40, 70.14s/it]                                                                                     Best trial: 41. Best value: 0.148147:  92%|█████████▏| 46/50 [56:51<04:40, 70.14s/it]Best trial: 41. Best value: 0.148147:  92%|█████████▏| 46/50 [56:51<04:40, 70.14s/it]Best trial: 41. Best value: 0.148147:  94%|█████████▍| 47/50 [56:51<03:38, 72.72s/it]                                                                                     Best trial: 41. Best value: 0.148147:  94%|█████████▍| 47/50 [58:05<03:38, 72.72s/it]Best trial: 41. Best value: 0.148147:  94%|█████████▍| 47/50 [58:05<03:38, 72.72s/it]Best trial: 41. Best value: 0.148147:  96%|█████████▌| 48/50 [58:05<02:26, 73.04s/it]                                                                                     Best trial: 41. Best value: 0.148147:  96%|█████████▌| 48/50 [58:56<02:26, 73.04s/it]Best trial: 41. Best value: 0.148147:  96%|█████████▌| 48/50 [58:56<02:26, 73.04s/it]Best trial: 41. Best value: 0.148147:  98%|█████████▊| 49/50 [58:56<01:06, 66.55s/it]                                                                                     Best trial: 41. Best value: 0.148147:  98%|█████████▊| 49/50 [59:06<01:06, 66.55s/it]Best trial: 41. Best value: 0.148147:  98%|█████████▊| 49/50 [59:06<01:06, 66.55s/it]Best trial: 41. Best value: 0.148147: 100%|██████████| 50/50 [59:06<00:00, 49.56s/it]Best trial: 41. Best value: 0.148147: 100%|██████████| 50/50 [59:06<00:00, 70.94s/it]
Train: 2407 rows (1613 IDs),Test: 598 rows (404 IDs) 

n_features_x : 6, n_features_per_modality: [16, 23, 19, 17, 7, 4, 4, 4, 1, 4]

--- ImbalancedRegressionLoss initialized ---
  Bins: 17, Focal gamma: 2.6309710644613897, Base loss: mse
  Bin [0.00, 0.06): count=  172, weight=0.058
  Bin [0.06, 0.12): count=  413, weight=0.024
  Bin [0.12, 0.18): count=  376, weight=0.027
  Bin [0.18, 0.24): count=  370, weight=0.027
  Bin [0.24, 0.29): count=  255, weight=0.039
  Bin [0.29, 0.35): count=  223, weight=0.045
  Bin [0.35, 0.41): count=  162, weight=0.061
  Bin [0.41, 0.47): count=  134, weight=0.074
  Bin [0.47, 0.53): count=  108, weight=0.092
  Bin [0.53, 0.59): count=   78, weight=0.127
  Bin [0.59, 0.65): count=   47, weight=0.208
  Bin [0.65, 0.71): count=   27, weight=0.357
  Bin [0.71, 0.76): count=   26, weight=0.370
  Bin [0.76, 0.82): count=    9, weight=0.999
  Bin [0.82, 0.88): count=    4, weight=1.999
  Bin [0.88, 0.94): count=    3, weight=2.499
  Bin [0.94, 1.00): count=    0, weight=9.995
-------------------------------------------

  Pred range: [0.1167, 0.6500], std: 0.0674
  RMSE : 0.1776, R2: -0.0531, MAE: 0.1469, Spearman rho: 0.2555, Spearman p: 2.2961e-10, Pearson r: 0.2487, Pearson p: 7.0130e-10
  Pred range: [0.1248, 0.6538], std: 0.0687
  RMSE : 0.1805, R2: -0.0876, MAE: 0.1514, Spearman rho: 0.2972, Spearman p: 1.1546e-13, Pearson r: 0.2936, Pearson p: 2.3796e-13
  Pred range: [0.1220, 0.6332], std: 0.0691
  RMSE : 0.1756, R2: -0.0298, MAE: 0.1467, Spearman rho: 0.3382, Spearman p: 1.8164e-17, Pearson r: 0.3357, Pearson p: 3.2432e-17
  Pred range: [0.1147, 0.5948], std: 0.0684
  RMSE : 0.1682, R2: 0.0554, MAE: 0.1385, Spearman rho: 0.3684, Spearman p: 1.1642e-20, Pearson r: 0.3676, Pearson p: 1.4470e-20
  Pred range: [0.1221, 0.6114], std: 0.0723
  RMSE : 0.1718, R2: 0.0150, MAE: 0.1435, Spearman rho: 0.3885, Spearman p: 5.6329e-23, Pearson r: 0.3908, Pearson p: 2.9507e-23
  Pred range: [0.1229, 0.5885], std: 0.0736
  RMSE : 0.1706, R2: 0.0283, MAE: 0.1426, Spearman rho: 0.4045, Spearman p: 6.0864e-25, Pearson r: 0.4082, Pearson p: 2.0290e-25
  Pred range: [0.1260, 0.5896], std: 0.0768
  RMSE : 0.1726, R2: 0.0060, MAE: 0.1450, Spearman rho: 0.4176, Spearman p: 1.2405e-26, Pearson r: 0.4215, Pearson p: 3.7013e-27
  Pred range: [0.1224, 0.5822], std: 0.0763
  RMSE : 0.1680, R2: 0.0582, MAE: 0.1401, Spearman rho: 0.4269, Spearman p: 6.8775e-28, Pearson r: 0.4302, Pearson p: 2.4549e-28
  Pred range: [0.1224, 0.5857], std: 0.0766
  RMSE : 0.1669, R2: 0.0705, MAE: 0.1390, Spearman rho: 0.4324, Spearman p: 1.2311e-28, Pearson r: 0.4368, Pearson p: 2.9983e-29
  Pred range: [0.1232, 0.5914], std: 0.0772
  RMSE : 0.1663, R2: 0.0774, MAE: 0.1384, Spearman rho: 0.4379, Spearman p: 2.1099e-29, Pearson r: 0.4424, Pearson p: 4.7263e-30
  Pred range: [0.1244, 0.5987], std: 0.0782
  RMSE : 0.1668, R2: 0.0712, MAE: 0.1391, Spearman rho: 0.4410, Spearman p: 7.5012e-30, Pearson r: 0.4464, Pearson p: 1.2750e-30
  Pred range: [0.1264, 0.6052], std: 0.0790
  RMSE : 0.1674