[I 2026-04-27 17:28:34,633] Trial 57 finished with value: 0.08806175948942363 and parameters: {'learning_rate': 0.0007187549961002195, 'batch_size': 4, 'num_epochs': 18, 'weight_decay': 0.0018117061582530803, 'layers_PRS': 6, 'layers_SCZ15': 5, 'layers_ADHD9': 3, 'layers_ASD9': 1, 'layers_ACE15': 3, 'layers_ACE18': 4, 'layers_SUD18': 6, 'layers_SES': 6, 'layers_SEX': 2, 'dropout': 0.32410516949167745, 'se_reduction': 5, 'hidden_dim_min': 8, 'base_loss': 'huber', 'huber_delta': 0.03766902486809532, 'focal_gamma': 2.540759019058621, 'n_bins': 12, 'scheduler_patience': 2, 'scheduler_factor': 0.4744912939371384, 'early_stopping_patience': 5}. Best is trial 53 with value: 0.08802287430437908.
Train: 2407 rows (1613 IDs),Test: 598 rows (404 IDs) 

n_features_x : 6, n_features_per_modality: [16, 23, 19, 17, 7, 4, 4, 4, 1, 4]

--- ImbalancedRegressionLoss initialized ---
  Bins: 13, Focal gamma: 2.5269752014420184, Base loss: huber
  Bin [0.00, 0.08): count=  828, weight=0.003
  Bin [0.08, 0.15): count=  710, weight=0.004
  Bin [0.15, 0.23): count=  477, weight=0.006
  Bin [0.23, 0.31): count=  288, weight=0.009
  Bin [0.31, 0.38): count=   63, weight=0.042
  Bin [0.38, 0.46): count=   23, weight=0.113
  Bin [0.46, 0.54): count=   10, weight=0.247
  Bin [0.54, 0.62): count=    7, weight=0.340
  Bin [0.62, 0.69): count=    0, weight=2.719
  Bin [0.69, 0.77): count=    1, weight=1.359
  Bin [0.77, 0.85): count=    0, weight=2.719
  Bin [0.85, 0.92): count=    0, weight=2.719
  Bin [0.92, 1.00): count=    0, weight=2.719
-------------------------------------------

  Pred range: [0.0360, 0.3871], std: 0.0515
  RMSE : 0.0972, R2: 0.0664, MAE: 0.0776, Spearman rho: 0.3372, Spearman p: 2.3050e-17, Pearson r: 0.3324, Pearson p: 6.8259e-17
  Pred range: [0.0413, 0.3924], std: 0.0540
  RMSE : 0.0947, R2: 0.1133, MAE: 0.0755, Spearman rho: 0.3780, Spearman p: 9.4814e-22, Pearson r: 0.3839, Pearson p: 1.9753e-22
  Pred range: [0.0353, 0.3526], std: 0.0516
  RMSE : 0.0924, R2: 0.1563, MAE: 0.0729, Spearman rho: 0.4003, Spearman p: 2.0138e-24, Pearson r: 0.4115, Pearson p: 7.7435e-26
  Pred range: [0.0454, 0.3832], std: 0.0554
  RMSE : 0.0923, R2: 0.1582, MAE: 0.0736, Spearman rho: 0.4162, Spearman p: 1.8579e-26, Pearson r: 0.4281, Pearson p: 4.7862e-28
  Pred range: [0.0512, 0.3957], std: 0.0557
  RMSE : 0.0932, R2: 0.1408, MAE: 0.0749, Spearman rho: 0.4220, Spearman p: 3.1784e-27, Pearson r: 0.4322, Pearson p: 1.3078e-28
  Pred range: [0.0571, 0.3946], std: 0.0560
  RMSE : 0.0937, R2: 0.1320, MAE: 0.0756, Spearman rho: 0.4331, Spearman p: 9.8608e-29, Pearson r: 0.4442, Pearson p: 2.6348e-30
[I 2026-04-27 17:29:32,451] Trial 58 pruned. 
Train: 2407 rows (1613 IDs),Test: 598 rows (404 IDs) 

n_features_x : 6, n_features_per_modality: [16, 23, 19, 17, 7, 4, 4, 4, 1, 4]

--- ImbalancedRegressionLoss initialized ---
  Bins: 12, Focal gamma: 2.746582054512765, Base loss: mse
  Bin [0.00, 0.08): count=  828, weight=0.003
  Bin [0.08, 0.17): count=  710, weight=0.004
  Bin [0.17, 0.25): count=  575, weight=0.005
  Bin [0.25, 0.33): count=  214, weight=0.013
  Bin [0.33, 0.42): count=   55, weight=0.051
  Bin [0.42, 0.50): count=   14, weight=0.191
  Bin [0.50, 0.58): count=    9, weight=0.286
  Bin [0.58, 0.67): count=    1, weight=1.431
  Bin [0.67, 0.75): count=    1, weight=1.431
  Bin [0.75, 0.83): count=    0, weight=2.862
  Bin [0.83, 0.92): count=    0, weight=2.862
  Bin [0.92, 1.00): count=    0, weight=2.862
-------------------------------------------

  Pred range: [0.0471, 0.3197], std: 0.0458
  RMSE : 0.1002, R2: 0.0085, MAE: 0.0802, Spearman rho: 0.3232, Spearman p: 5.2722e-16, Pearson r: 0.3166, Pearson p: 2.1761e-15
  Pred range: [0.0623, 0.3497], std: 0.0471
  RMSE : 0.1019, R2: -0.0259, MAE: 0.0822, Spearman rho: 0.3595, Spearman p: 1.0934e-19, Pearson r: 0.3610, Pearson p: 7.5962e-20
  Pred range: [0.0552, 0.3422], std: 0.0474
  RMSE : 0.0974, R2: 0.0618, MAE: 0.0784, Spearman rho: 0.3863, Spearman p: 1.0121e-22, Pearson r: 0.3913, Pearson p: 2.5461e-23
  Pred range: [0.0557, 0.3383], std: 0.0476
  RMSE : 0.0966, R2: 0.0786, MAE: 0.0779, Spearman rho: 0.3995, Spearman p: 2.5801e-24, Pearson r: 0.4058, Pearson p: 4.1768e-25
  Pred range: [0.0644, 0.3563], std: 0.0487
  RMSE : 0.0986, R2: 0.0386, MAE: 0.0799, Spearman rho: 0.4071, Spearman p: 2.8112e-25, Pearson r: 0.4143, Pearson p: 3.3290e-26
  Pred range: [0.0610, 0.3613], std: 0.0493
  RMSE : 0.0962, R2: 0.0856, MAE: 0.0777, Spearman rho: 0.4126, Spearman p: 5.5157e-26, Pearson r: 0.4210, Pearson p: 4.2792e-27
[I 2026-04-27 17:30:05,230] Trial 59 pruned. 
Train: 2407 rows (1613 IDs),Test: 598 rows (404 IDs) 

n_features_x : 6, n_features_per_modality: [16, 23, 19, 17, 7, 4, 4, 4, 1, 4]

--- ImbalancedRegressionLoss initialized ---
  Bins: 11, Focal gamma: 2.3967673738208446, Base loss: huber
  Bin [0.00, 0.09): count= 1010, weight=0.003
  Bin [0.09, 0.18): count=  706, weight=0.004
  Bin [0.18, 0.27): count=  478, weight=0.006
  Bin [0.27, 0.36): count=  159, weight=0.018
  Bin [0.36, 0.45): count=   33, weight=0.085
  Bin [0.45, 0.55): count=   16, weight=0.170
  Bin [0.55, 0.64): count=    4, weight=0.579
  Bin [0.64, 0.73): count=    1, weight=1.448
  Bin [0.73, 0.82): count=    0, weight=2.896
  Bin [0.82, 0.91): count=    0, weight=2.896
  Bin [0.91, 1.00): count=    0, weight=2.896
-------------------------------------------

  Pred range: [0.0412, 0.4371], std: 0.0605
  RMSE : 0.0986, R2: 0.0395, MAE: 0.0800, Spearman rho: 0.4238, Spearman p: 1.8214e-27, Pearson r: 0.4390, Pearson p: 1.4495e-29
  Pred range: [0.0500, 0.4307], std: 0.0586
  RMSE : 0.0962, R2: 0.0846, MAE: 0.0779, Spearman rho: 0.4367, Spearman p: 3.0733e-29, Pearson r: 0.4514, Pearson p: 2.3151e-31
  Pred range: [0.0285, 0.3544], std: 0.0550
  RMSE : 0.0892, R2: 0.2129, MAE: 0.0706, Spearman rho: 0.4547, Spearman p: 7.5095e-32, Pearson r: 0.4682, Pearson p: 6.5501e-34
  Pred range: [0.0620, 0.4077], std: 0.0593
  RMSE : 0.0987, R2: 0.0382, MAE: 0.0803, Spearman rho: 0.4501, Spearman p: 3.6814e-31, Pearson r: 0.4640, Pearson p: 2.9289e-33
  Pred range: [0.0582, 0.3734], std: 0.0538
  RMSE : 0.0936, R2: 0.1339, MAE: 0.0758, Spearman rho: 0.4507, Spearman p: 2.9841e-31, Pearson r: 0.4642, Pearson p: 2.6939e-33
  Pred range: [0.0550, 0.3885], std: 0.0566
  RMSE : 0.0926, R2: 0.1534, MAE: 0.0745, Spearman rho: 0.4541, Spearman p: 9.2318e-32, Pearson r: 0.4643, Pearson p: 2.6764e-33
  Pred range: [0.0424, 0.3488], std: 0.0534
  RMSE : 0.0893, R2: 0.2122, MAE: 0.0712, Spearman rho: 0.4582, Spearman p: 2.2729e-32, Pearson r: 0.4694, Pearson p: 4.3161e-34
  Pred range: [0.0428, 0.3537], std: 0.0526
  RMSE : 0.0892, R2: 0.2136, MAE: 0.0710, Spearman rho: 0.4578, Spearman p: 2.6142e-32, Pearson r: 0.4680, Pearson p: 7.1025e-34
  Pred range: [0.0300, 0.3463], std: 0.0524
  RMSE : 0.0888, R2: 0.2200, MAE: 0.0706, Spearman rho: 0.4620, Spearman p: 5.8503e-33, Pearson r: 0.4718, Pearson p: 1.7604e-34
  Pred range: [0.0384, 0.3573], std: 0.0538
  RMSE : 0.0890, R2: 0.2181, MAE: 0.0708, Spearman rho: 0.4641, Spearman p: 2.8552e-33, Pearson r: 0.4743, Pearson p: 7.1008e-35
  Pred range: [0.0539, 0.3792], std: 0.0561
  RMSE : 0.0917, R2: 0.1691, MAE: 0.0738, Spearman rho: 0.4601, Spearman p: 1.1501e-32, Pearson r: 0.4702, Pearson p: 3.1840e-34
  Pred range: [0.0344, 0.3621], std: 0.0537
  RMSE : 0.0893, R2: 0.2128, MAE: 0.0713, Spearman rho: 0.4633, Spearman p: 3.7089e-33, Pearson r: 0.4726, Pearson p: 1.3487e-34
  Pred range: [0.0423, 0.3753], std: 0.0547
  RMSE : 0.0905, R2: 0.1903, MAE: 0.0727, Spearman rho: 0.4627, Spearman p: 4.5958e-33, Pearson r: 0.4724, Pearson p: 1.4282e-34
  Pred range: [0.0428, 0.3718], std: 0.0550
  RMSE : 0.0902, R2: 0.1955, MAE: 0.0723, Spearman rho: 0.4609, Spearman p: 8.6869e-33, Pearson r: 0.4709, Pearson p: 2.4987e-34
  Pred range: [0.0480, 0.3837], std: 0.0557
  RMSE : 0.0914, R2: 0.1742, MAE: 0.0735, Spearman rho: 0.4629, Spearman p: 4.4000e-33, Pearson r: 0.4721, Pearson p: 1.5770e-34
[I 2026-04-27 17:33:09,374] Trial 60 finished with value: 0.0888462146701622 and parameters: {'learning_rate': 0.00044030539100987025, 'batch_size': 4, 'num_epochs': 17, 'weight_decay': 0.00040558107069383237, 'layers_PRS': 6, 'layers_SCZ15': 6, 'layers_ADHD9': 3, 'layers_ASD9': 3, 'layers_ACE15': 7, 'layers_ACE18': 3, 'layers_SUD18': 6, 'layers_SES': 6, 'layers_SEX': 2, 'dropout': 0.4817543822724076, 'se_reduction': 5, 'hidden_dim_min': 11, 'base_loss': 'huber', 'huber_delta': 0.027822807128389002, 'focal_gamma': 2.3967673738208446, 'n_bins': 11, 'scheduler_patience': 2, 'scheduler_factor': 0.4176263868615597, 'early_stopping_patience': 6}. Best is trial 53 with value: 0.08802287430437908.
Train: 2407 rows (1613 IDs),Test: 598 rows (404 IDs) 

n_features_x : 6, n_features_per_modality: [16, 23, 19, 17, 7, 4, 4, 4, 1, 4]

--- ImbalancedRegressionLoss initialized ---
  Bins: 10, Focal gamma: 0.6929571152493492, Base loss: huber
  Bin [0.00, 0.10): count= 1010, weight=0.003
  Bin [0.10, 0.20): count=  866, weight=0.003
  Bin [0.20, 0.30): count=  386, weight=0.007
  Bin [0.30, 0.40): count=  111, weight=0.026
  Bin [0.40, 0.50): count=   23, weight=0.119
  Bin [0.50, 0.60): count=    9, weight=0.287
  Bin [0.60, 0.70): count=    2, weight=0.955
  Bin [0.70, 0.80): count=    0, weight=2.866
  Bin [0.80, 0.90): count=    0, weight=2.866
  Bin [0.90, 1.00): count=    0, weight=2.866
-------------------------------------------

  Pred range: [0.0322, 0.2900], std: 0.0432
  RMSE : 0.0917, R2: 0.1687, MAE: 0.0717, Spearman rho: 0.4313, Spearman p: 1.7138e-28, Pearson r: 0.4347, Pearson p: 5.7931e-29
  Pred range: [0.0620, 0.3189], std: 0.0432
  RMSE : 0.0941, R2: 0.1258, MAE: 0.0758, Spearman rho: 0.4144, Spearman p: 3.2048e-26, Pearson r: 0.4202, Pearson p: 5.5463e-27
  Pred range: [0.0638, 0.3328], std: 0.0463
  RMSE : 0.0970, R2: 0.0706, MAE: 0.0784, Spearman rho: 0.4131, Spearman p: 4.7293e-26, Pearson r: 0.4135, Pearson p: 4.1661e-26
  Pred range: [0.0748, 0.3588], std: 0.0454
  RMSE : 0.0974, R2: 0.0631, MAE: 0.0791, Spearman rho: 0.4208, Spearman p: 4.5932e-27, Pearson r: 0.4234, Pearson p: 2.0944e-27
  Pred range: [0.0572, 0.3277], std: 0.0454
  RMSE : 0.0925, R2: 0.1541, MAE: 0.0742, Spearman rho: 0.4314, Spearman p: 1.6602e-28, Pearson r: 0.4361, Pearson p: 3.7454e-29
[I 2026-04-27 17:34:03,822] Trial 61 finished with value: 0.091717335553611 and parameters: {'learning_rate': 0.001049711846981178, 'batch_size': 4, 'num_epochs': 20, 'weight_decay': 0.007518547627452277, 'layers_PRS': 6, 'layers_SCZ15': 5, 'layers_ADHD9': 3, 'layers_ASD9': 1, 'layers_ACE15': 4, 'layers_ACE18': 4, 'layers_SUD18': 5, 'layers_SES': 6, 'layers_SEX': 1, 'dropout': 0.3221225112578737, 'se_reduction': 5, 'hidden_dim_min': 9, 'base_loss': 'huber', 'huber_delta': 0.011103024044780651, 'focal_gamma': 0.6929571152493492, 'n_bins': 10, 'scheduler_patience': 2, 'scheduler_factor': 0.4620728154357334, 'early_stopping_patience': 4}. Best is trial 53 with value: 0.08802287430437908.
Train: 2407 rows (1613 IDs),Test: 598 rows (404 IDs) 

n_features_x : 6, n_features_per_modality: [16, 23, 19, 17, 7, 4, 4, 4, 1, 4]

--- ImbalancedRegressionLoss initialized ---
  Bins: 12, Focal gamma: 1.8790924851203854, Base loss: huber
  Bin [0.00, 0.08): count=  828, weight=0.003
  Bin [0.08, 0.17): count=  710, weight=0.004
  Bin [0.17, 0.25): count=  575, weight=0.005
  Bin [0.25, 0.33): count=  214, weight=0.013
  Bin [0.33, 0.42): count=   55, weight=0.051
  Bin [0.42, 0.50): count=   14, weight=0.191
  Bin [0.50, 0.58): count=    9, weight=0.286
  Bin [0.58, 0.67): count=    1, weight=1.431
  Bin [0.67, 0.75): count=    1, weight=1.431
  Bin [0.75, 0.83): count=    0, weight=2.862
  Bin [0.83, 0.92): count=    0, weight=2.862
  Bin [0.92, 1.00): count=    0, weight=2.862
-------------------------------------------

  Pred range: [0.0378, 0.3159], std: 0.0499
  RMSE : 0.0910, R2: 0.1810, MAE: 0.0711, Spearman rho: 0.4272, Spearman p: 6.2906e-28, Pearson r: 0.4330, Pearson p: 1.0111e-28
  Pred range: [0.0762, 0.4014], std: 0.0526
  RMSE : 0.0977, R2: 0.0563, MAE: 0.0794, Spearman rho: 0.4431, Spearman p: 3.7420e-30, Pearson r: 0.4480, Pearson p: 7.2694e-31
  Pred range: [0.0688, 0.3777], std: 0.0511
  RMSE : 0.0952, R2: 0.1050, MAE: 0.0773, Spearman rho: 0.4517, Spearman p: 2.1050e-31, Pearson r: 0.4570, Pearson p: 3.3526e-32
  Pred range: [0.0569, 0.4354], std: 0.0570
  RMSE : 0.0943, R2: 0.1206, MAE: 0.0754, Spearman rho: 0.4469, Spearman p: 1.0511e-30, Pearson r: 0.4475, Pearson p: 8.6426e-31
  Pred range: [0.0630, 0.3575], std: 0.0499
  RMSE : 0.0910, R2: 0.1808, MAE: 0.0729, Spearman rho: 0.4632, Spearman p: 3.8914e-33, Pearson r: 0.4686, Pearson p: 5.6836e-34
  Pred range: [0.0602, 0.3453], std: 0.0499
  RMSE : 0.0907, R2: 0.1872, MAE: 0.0726, Spearman rho: 0.4617, Spearman p: 6.6330e-33, Pearson r: 0.4675, Pearson p: 8.3135e-34
  Pred range: [0.0659, 0.3527], std: 0.0501
  RMSE : 0.0924, R2: 0.1554, MAE: 0.0745, Spearman rho: 0.4578, Spearman p: 2.5944e-32, Pearson r: 0.4640, Pearson p: 2.9694e-33
  Pred range: [0.0487, 0.3485], std: 0.0512
  RMSE : 0.0894, R2: 0.2109, MAE: 0.0709, Spearman rho: 0.4640, Spearman p: 2.9664e-33, Pearson r: 0.4677, Pearson p: 7.8116e-34
  Pred range: [0.0654, 0.3683], std: 0.0497
  RMSE : 0.0920, R2: 0.1643, MAE: 0.0739, Spearman rho: 0.4586, Spearman p: 1.9659e-32, Pearson r: 0.4626, Pearson p: 4.7816e-33
  Pred range: [0.0461, 0.3166], std: 0.0465
  RMSE : 0.0886, R2: 0.2242, MAE: 0.0698, Spearman rho: 0.4689, Spearman p: 5.1035e-34, Pearson r: 0.4742, Pearson p: 7.4499e-35
  Pred range: [0.0520, 0.3135], std: 0.0465
  RMSE : 0.0886, R2: 0.2245, MAE: 0.0703, Spearman rho: 0.4691, Spearman p: 4.8046e-34, Pearson r: 0.4754, Pearson p: 4.7844e-35
  Pred range: [0.0515, 0.3420], std: 0.0505
  RMSE : 0.0892, R2: 0.2141, MAE: 0.0708, Spearman rho: 0.4682, Spearman p: 6.4551e-34, Pearson r: 0.4728, Pearson p: 1.2525e-34
  Pred range: [0.0419, 0.3176], std: 0.0472
  RMSE : 0.0888, R2: 0.2215, MAE: 0.0698, Spearman rho: 0.4696, Spearman p: 3.9447e-34, Pearson r: 0.4747, Pearson p: 6.1597e-35
  Pred range: [0.0417, 0.3231], std: 0.0494
  RMSE : 0.0887, R2: 0.2229, MAE: 0.0700, Spearman rho: 0.4651, Spearman p: 1.9515e-33, Pearson r: 0.4725, Pearson p: 1.3587e-34
  Pred range: [0.0603, 0.3417], std: 0.0495
  RMSE : 0.0904, R2: 0.1919, MAE: 0.0725, Spearman rho: 0.4639, Spearman p: 3.0568e-33, Pearson r: 0.4714, Pearson p: 2.0582e-34
  Pred range: [0.0545, 0.3280], std: 0.0476
  RMSE : 0.0889, R2: 0.2197, MAE: 0.0707, Spearman rho: 0.4679, Spearman p: 7.2424e-34, Pearson r: 0.4755, Pearson p: 4.5407e-35
[I 2026-04-27 17:37:01,831] Trial 62 finished with value: 0.08858828217420951 and parameters: {'learning_rate': 0.0007671500074636684, 'batch_size': 4, 'num_epochs': 21, 'weight_decay': 0.00465439366268036, 'layers_PRS': 6, 'layers_SCZ15': 5, 'layers_ADHD9': 1, 'layers_ASD9': 1, 'layers_ACE15': 4, 'layers_ACE18': 4, 'layers_SUD18': 6, 'layers_SES': 7, 'layers_SEX': 3, 'dropout': 0.30473592877692324, 'se_reduction': 6, 'hidden_dim_min': 7, 'base_loss': 'huber', 'huber_delta': 0.022760842921532264, 'focal_gamma': 1.8790924851203854, 'n_bins': 12, 'scheduler_patience': 2, 'scheduler_factor': 0.44538162431822526, 'early_stopping_patience': 5}. Best is trial 53 with value: 0.08802287430437908.
Train: 2407 rows (1613 IDs),Test: 598 rows (404 IDs) 

n_features_x : 6, n_features_per_modality: [16, 23, 19, 17, 7, 4, 4, 4, 1, 4]

--- ImbalancedRegressionLoss initialized ---
  Bins: 7, Focal gamma: 2.518741038433503, Base loss: huber
  Bin [0.00, 0.14): count= 1370, weight=0.002
  Bin [0.14, 0.29): count=  892, weight=0.003
  Bin [0.29, 0.43): count=  120, weight=0.024
  Bin [0.43, 0.57): count=   23, weight=0.122
  Bin [0.57, 0.71): count=    2, weight=0.978
  Bin [0.71, 0.86): count=    0, weight=2.935
  Bin [0.86, 1.00): count=    0, weight=2.935
-------------------------------------------

  Pred range: [0.0546, 0.4616], std: 0.0677
  RMSE : 0.0985, R2: 0.0412, MAE: 0.0789, Spearman rho: 0.4492, Spearman p: 4.9264e-31, Pearson r: 0.4581, Pearson p: 2.3350e-32
  Pred range: [0.0194, 0.3814], std: 0.0553
  RMSE : 0.0904, R2: 0.1917, MAE: 0.0713, Spearman rho: 0.4450, Spearman p: 2.0414e-30, Pearson r: 0.4498, Pearson p: 4.0512e-31
  Pred range: [-0.0039, 0.3761], std: 0.0532
  RMSE : 0.0969, R2: 0.0730, MAE: 0.0789, Spearman rho: 0.4506, Spearman p: 3.0268e-31, Pearson r: 0.4589, Pearson p: 1.7364e-32
  Pred range: [0.0523, 0.4058], std: 0.0632
  RMSE : 0.0972, R2: 0.0659, MAE: 0.0786, Spearman rho: 0.4601, Spearman p: 1.1572e-32, Pearson r: 0.4721, Pearson p: 1.5721e-34
  Pred range: [0.0010, 0.3727], std: 0.0456
  RMSE : 0.0908, R2: 0.1850, MAE: 0.0733, Spearman rho: 0.4342, Spearman p: 6.8006e-29, Pearson r: 0.4403, Pearson p: 9.4063e-30
  Pred range: [-0.0179, 0.3433], std: 0.0606
  RMSE : 0.0998, R2: 0.0162, MAE: 0.0755, Spearman rho: 0.4684, Spearman p: 6.1121e-34, Pearson r: 0.4701, Pearson p: 3.3433e-34
[I 2026-04-27 17:37:58,365] Trial 63 finished with value: 0.09044414470610997 and parameters: {'learning_rate': 0.00238834252177499, 'batch_size': 4, 'num_epochs': 16, 'weight_decay': 0.00012622249889260285, 'layers_PRS': 5, 'layers_SCZ15': 4, 'layers_ADHD9': 2, 'layers_ASD9': 1, 'layers_ACE15': 3, 'layers_ACE18': 5, 'layers_SUD18': 4, 'layers_SES': 6, 'layers_SEX': 2, 'dropout': 0.35947287091973423, 'se_reduction': 5, 'hidden_dim_min': 8, 'base_loss': 'huber', 'huber_delta': 0.017097612728745788, 'focal_gamma': 2.518741038433503, 'n_bins': 7, 'scheduler_patience': 3, 'scheduler_factor': 0.47840946397842954, 'early_stopping_patience': 4}. Best is trial 53 with value: 0.08802287430437908.
Train: 2407 rows (1613 IDs),Test: 598 rows (404 IDs) 

n_features_x : 6, n_features_per_modality: [16, 23, 19, 17, 7, 4, 4, 4, 1, 4]

--- ImbalancedRegressionLoss initialized ---
  Bins: 9, Focal gamma: 2.2726866917406388, Base loss: huber
  Bin [0.00, 0.11): count= 1180, weight=0.003
  Bin [0.11, 0.22): count=  835, weight=0.004
  Bin [0.22, 0.33): count=  312, weight=0.010
  Bin [0.33, 0.44): count=   59, weight=0.054
  Bin [0.44, 0.56): count=   16, weight=0.190
  Bin [0.56, 0.67): count=    4, weight=0.647
  Bin [0.67, 0.78): count=    1, weight=1.618
  Bin [0.78, 0.89): count=    0, weight=3.237
  Bin [0.89, 1.00): count=    0, weight=3.237
-------------------------------------------

  Pred range: [0.0207, 0.3678], std: 0.0431
  RMSE : 0.0928, R2: 0.1498, MAE: 0.0748, Spearman rho: 0.4230, Spearman p: 2.3802e-27, Pearson r: 0.4310, Pearson p: 1.9171e-28
  Pred range: [0.0399, 0.3287], std: 0.0405
  RMSE : 0.0908, R2: 0.1853, MAE: 0.0726, Spearman rho: 0.4275, Spearman p: 5.7488e-28, Pearson r: 0.4315, Pearson p: 1.6231e-28
  Pred range: [0.0341, 0.3774], std: 0.0523
  RMSE : 0.0919, R2: 0.1646, MAE: 0.0736, Spearman rho: 0.4268, Spearman p: 7.2578e-28, Pearson r: 0.4391, Pearson p: 1.4258e-29
  Pred range: [0.0750, 0.4441], std: 0.0574
  RMSE : 0.0989, R2: 0.0337, MAE: 0.0801, Spearman rho: 0.4495, Spearman p: 4.4100e-31, Pearson r: 0.4514, Pearson p: 2.3288e-31
  Pred range: [0.0653, 0.4096], std: 0.0481
  RMSE : 0.0934, R2: 0.1383, MAE: 0.0757, Spearman rho: 0.4291, Spearman p: 3.5212e-28, Pearson r: 0.4397, Pearson p: 1.1603e-29
