[I 2026-04-27 18:13:22,748] Trial 93 finished with value: 0.08862759181787289 and parameters: {'learning_rate': 0.0011680805522245729, 'batch_size': 4, 'num_epochs': 23, 'weight_decay': 0.004735008020525256, 'layers_PRS': 6, 'layers_SCZ15': 2, 'layers_ADHD9': 3, 'layers_ASD9': 1, 'layers_ACE15': 4, 'layers_ACE18': 4, 'layers_SUD18': 4, 'layers_SES': 6, 'layers_SEX': 4, 'dropout': 0.28174421496397717, 'se_reduction': 3, 'hidden_dim_min': 7, 'base_loss': 'huber', 'huber_delta': 0.014445943587227533, 'focal_gamma': 0.65284526626463, 'n_bins': 6, 'scheduler_patience': 4, 'scheduler_factor': 0.6420642143385793, 'early_stopping_patience': 4}. Best is trial 66 with value: 0.08778944019020135.
Train: 2407 rows (1613 IDs),Test: 598 rows (404 IDs) 

n_features_x : 6, n_features_per_modality: [16, 23, 19, 17, 7, 4, 4, 4, 1, 4]

--- ImbalancedRegressionLoss initialized ---
  Bins: 9, Focal gamma: 0.570476559435749, Base loss: huber
  Bin [0.00, 0.11): count= 1180, weight=0.003
  Bin [0.11, 0.22): count=  835, weight=0.004
  Bin [0.22, 0.33): count=  312, weight=0.010
  Bin [0.33, 0.44): count=   59, weight=0.054
  Bin [0.44, 0.56): count=   16, weight=0.190
  Bin [0.56, 0.67): count=    4, weight=0.647
  Bin [0.67, 0.78): count=    1, weight=1.618
  Bin [0.78, 0.89): count=    0, weight=3.237
  Bin [0.89, 1.00): count=    0, weight=3.237
-------------------------------------------

  Pred range: [0.0256, 0.4062], std: 0.0593
  RMSE : 0.0909, R2: 0.1834, MAE: 0.0727, Spearman rho: 0.4436, Spearman p: 3.2203e-30, Pearson r: 0.4568, Pearson p: 3.6138e-32
  Pred range: [-0.0245, 0.3344], std: 0.0536
  RMSE : 0.0909, R2: 0.1839, MAE: 0.0707, Spearman rho: 0.4685, Spearman p: 5.8021e-34, Pearson r: 0.4808, Pearson p: 6.4451e-36
  Pred range: [0.0376, 0.4146], std: 0.0611
  RMSE : 0.0937, R2: 0.1322, MAE: 0.0757, Spearman rho: 0.4647, Spearman p: 2.2768e-33, Pearson r: 0.4818, Pearson p: 4.3356e-36
  Pred range: [0.0125, 0.4225], std: 0.0666
  RMSE : 0.0957, R2: 0.0948, MAE: 0.0769, Spearman rho: 0.4689, Spearman p: 5.0693e-34, Pearson r: 0.4796, Pearson p: 1.0210e-35
  Pred range: [0.0346, 0.4286], std: 0.0629
  RMSE : 0.0932, R2: 0.1424, MAE: 0.0742, Spearman rho: 0.4524, Spearman p: 1.6520e-31, Pearson r: 0.4629, Pearson p: 4.3127e-33
  Pred range: [0.0503, 0.4240], std: 0.0604
  RMSE : 0.1009, R2: -0.0060, MAE: 0.0827, Spearman rho: 0.4608, Spearman p: 9.0993e-33, Pearson r: 0.4757, Pearson p: 4.2518e-35
  Pred range: [0.0259, 0.4201], std: 0.0646
  RMSE : 0.0922, R2: 0.1600, MAE: 0.0732, Spearman rho: 0.4569, Spearman p: 3.4850e-32, Pearson r: 0.4704, Pearson p: 2.9182e-34
  Pred range: [0.0084, 0.3744], std: 0.0567
  RMSE : 0.0898, R2: 0.2024, MAE: 0.0719, Spearman rho: 0.4605, Spearman p: 9.9242e-33, Pearson r: 0.4758, Pearson p: 4.1424e-35
  Pred range: [-0.0125, 0.3564], std: 0.0611
  RMSE : 0.0892, R2: 0.2140, MAE: 0.0700, Spearman rho: 0.4692, Spearman p: 4.5552e-34, Pearson r: 0.4804, Pearson p: 7.3676e-36
  Pred range: [0.0367, 0.4139], std: 0.0588
  RMSE : 0.0958, R2: 0.0927, MAE: 0.0778, Spearman rho: 0.4645, Spearman p: 2.4230e-33, Pearson r: 0.4770, Pearson p: 2.6774e-35
  Pred range: [0.0093, 0.3638], std: 0.0577
  RMSE : 0.0896, R2: 0.2066, MAE: 0.0714, Spearman rho: 0.4598, Spearman p: 1.2899e-32, Pearson r: 0.4741, Pearson p: 7.8209e-35
  Pred range: [0.0242, 0.4050], std: 0.0629
  RMSE : 0.0932, R2: 0.1414, MAE: 0.0747, Spearman rho: 0.4649, Spearman p: 2.1162e-33, Pearson r: 0.4742, Pearson p: 7.4087e-35
  Pred range: [0.0303, 0.4257], std: 0.0624
  RMSE : 0.0950, R2: 0.1080, MAE: 0.0767, Spearman rho: 0.4728, Spearman p: 1.2257e-34, Pearson r: 0.4817, Pearson p: 4.6178e-36
  Pred range: [0.0110, 0.4107], std: 0.0611
  RMSE : 0.0917, R2: 0.1698, MAE: 0.0735, Spearman rho: 0.4737, Spearman p: 8.9844e-35, Pearson r: 0.4814, Pearson p: 5.1686e-36
  Pred range: [0.0124, 0.3922], std: 0.0588
  RMSE : 0.0901, R2: 0.1970, MAE: 0.0719, Spearman rho: 0.4728, Spearman p: 1.2421e-34, Pearson r: 0.4813, Pearson p: 5.3601e-36
  Pred range: [-0.0064, 0.3612], std: 0.0576
  RMSE : 0.0887, R2: 0.2224, MAE: 0.0702, Spearman rho: 0.4717, Spearman p: 1.8808e-34, Pearson r: 0.4811, Pearson p: 5.6750e-36
  Pred range: [0.0139, 0.3955], std: 0.0608
  RMSE : 0.0935, R2: 0.1366, MAE: 0.0754, Spearman rho: 0.4696, Spearman p: 4.0248e-34, Pearson r: 0.4779, Pearson p: 1.8637e-35
  Pred range: [0.0001, 0.3818], std: 0.0610
  RMSE : 0.0902, R2: 0.1966, MAE: 0.0715, Spearman rho: 0.4677, Spearman p: 7.8313e-34, Pearson r: 0.4743, Pearson p: 7.2539e-35
[I 2026-04-27 18:16:22,010] Trial 94 pruned. 
Train: 2407 rows (1613 IDs),Test: 598 rows (404 IDs) 

n_features_x : 6, n_features_per_modality: [16, 23, 19, 17, 7, 4, 4, 4, 1, 4]

--- ImbalancedRegressionLoss initialized ---
  Bins: 7, Focal gamma: 0.7737399416408333, Base loss: huber
  Bin [0.00, 0.14): count= 1370, weight=0.002
  Bin [0.14, 0.29): count=  892, weight=0.003
  Bin [0.29, 0.43): count=  120, weight=0.024
  Bin [0.43, 0.57): count=   23, weight=0.122
  Bin [0.57, 0.71): count=    2, weight=0.978
  Bin [0.71, 0.86): count=    0, weight=2.935
  Bin [0.86, 1.00): count=    0, weight=2.935
-------------------------------------------

  Pred range: [0.0207, 0.3694], std: 0.0613
  RMSE : 0.0904, R2: 0.1918, MAE: 0.0707, Spearman rho: 0.4577, Spearman p: 2.6405e-32, Pearson r: 0.4625, Pearson p: 5.0140e-33
  Pred range: [0.0376, 0.3793], std: 0.0597
  RMSE : 0.0893, R2: 0.2124, MAE: 0.0702, Spearman rho: 0.4757, Spearman p: 4.3309e-35, Pearson r: 0.4803, Pearson p: 7.6770e-36
  Pred range: [0.0481, 0.3909], std: 0.0591
  RMSE : 0.0918, R2: 0.1666, MAE: 0.0733, Spearman rho: 0.4588, Spearman p: 1.8013e-32, Pearson r: 0.4659, Pearson p: 1.5155e-33
  Pred range: [0.0480, 0.3324], std: 0.0510
  RMSE : 0.0902, R2: 0.1961, MAE: 0.0720, Spearman rho: 0.4583, Spearman p: 2.1370e-32, Pearson r: 0.4631, Pearson p: 4.1001e-33
  Pred range: [0.0530, 0.3772], std: 0.0494
  RMSE : 0.0886, R2: 0.2251, MAE: 0.0708, Spearman rho: 0.4803, Spearman p: 7.6731e-36, Pearson r: 0.4829, Pearson p: 2.8933e-36
  Pred range: [0.0569, 0.3917], std: 0.0621
  RMSE : 0.0947, R2: 0.1131, MAE: 0.0766, Spearman rho: 0.4835, Spearman p: 2.2987e-36, Pearson r: 0.4887, Pearson p: 3.1592e-37
  Pred range: [0.0494, 0.4082], std: 0.0614
  RMSE : 0.0931, R2: 0.1437, MAE: 0.0746, Spearman rho: 0.4756, Spearman p: 4.3833e-35, Pearson r: 0.4791, Pearson p: 1.2188e-35
  Pred range: [0.0408, 0.3604], std: 0.0564
  RMSE : 0.0885, R2: 0.2260, MAE: 0.0699, Spearman rho: 0.4763, Spearman p: 3.3709e-35, Pearson r: 0.4833, Pearson p: 2.4767e-36
  Pred range: [0.0213, 0.3504], std: 0.0569
  RMSE : 0.0876, R2: 0.2411, MAE: 0.0682, Spearman rho: 0.4943, Spearman p: 3.6345e-38, Pearson r: 0.5005, Pearson p: 3.0699e-39
  Pred range: [0.0363, 0.4617], std: 0.0699
  RMSE : 0.0960, R2: 0.0887, MAE: 0.0760, Spearman rho: 0.4605, Spearman p: 1.0018e-32, Pearson r: 0.4637, Pearson p: 3.2206e-33
  Pred range: [0.0774, 0.4097], std: 0.0534
  RMSE : 0.0959, R2: 0.0905, MAE: 0.0781, Spearman rho: 0.4729, Spearman p: 1.2008e-34, Pearson r: 0.4787, Pearson p: 1.4241e-35
  Pred range: [0.0457, 0.3974], std: 0.0605
  RMSE : 0.0905, R2: 0.1909, MAE: 0.0718, Spearman rho: 0.4738, Spearman p: 8.4614e-35, Pearson r: 0.4796, Pearson p: 1.0132e-35
  Pred range: [0.0484, 0.3880], std: 0.0558
  RMSE : 0.0952, R2: 0.1038, MAE: 0.0769, Spearman rho: 0.4555, Spearman p: 5.8156e-32, Pearson r: 0.4647, Pearson p: 2.3244e-33
  Pred range: [-0.0421, 0.2828], std: 0.0514
  RMSE : 0.0970, R2: 0.0710, MAE: 0.0741, Spearman rho: 0.4824, Spearman p: 3.5326e-36, Pearson r: 0.4824, Pearson p: 3.5176e-36
[I 2026-04-27 18:18:29,179] Trial 95 finished with value: 0.08763367923288566 and parameters: {'learning_rate': 0.0013763607938104196, 'batch_size': 4, 'num_epochs': 21, 'weight_decay': 0.003675633147123033, 'layers_PRS': 2, 'layers_SCZ15': 4, 'layers_ADHD9': 6, 'layers_ASD9': 1, 'layers_ACE15': 3, 'layers_ACE18': 4, 'layers_SUD18': 3, 'layers_SES': 5, 'layers_SEX': 3, 'dropout': 0.30964103036281887, 'se_reduction': 8, 'hidden_dim_min': 5, 'base_loss': 'huber', 'huber_delta': 0.08209149216493337, 'focal_gamma': 0.7737399416408333, 'n_bins': 7, 'scheduler_patience': 4, 'scheduler_factor': 0.6380817676841847, 'early_stopping_patience': 5}. Best is trial 95 with value: 0.08763367923288566.
Train: 2407 rows (1613 IDs),Test: 598 rows (404 IDs) 

n_features_x : 6, n_features_per_modality: [16, 23, 19, 17, 7, 4, 4, 4, 1, 4]

--- ImbalancedRegressionLoss initialized ---
  Bins: 7, Focal gamma: 0.976494743783582, Base loss: huber
  Bin [0.00, 0.14): count= 1370, weight=0.002
  Bin [0.14, 0.29): count=  892, weight=0.003
  Bin [0.29, 0.43): count=  120, weight=0.024
  Bin [0.43, 0.57): count=   23, weight=0.122
  Bin [0.57, 0.71): count=    2, weight=0.978
  Bin [0.71, 0.86): count=    0, weight=2.935
  Bin [0.86, 1.00): count=    0, weight=2.935
-------------------------------------------

  Pred range: [0.0465, 0.3262], std: 0.0533
  RMSE : 0.0912, R2: 0.1779, MAE: 0.0724, Spearman rho: 0.4405, Spearman p: 9.0190e-30, Pearson r: 0.4458, Pearson p: 1.5535e-30
  Pred range: [0.0424, 0.3653], std: 0.0577
  RMSE : 0.0914, R2: 0.1739, MAE: 0.0730, Spearman rho: 0.4553, Spearman p: 6.0940e-32, Pearson r: 0.4624, Pearson p: 5.0958e-33
  Pred range: [0.0488, 0.3251], std: 0.0507
  RMSE : 0.0888, R2: 0.2208, MAE: 0.0705, Spearman rho: 0.4693, Spearman p: 4.3353e-34, Pearson r: 0.4785, Pearson p: 1.5248e-35
  Pred range: [0.0401, 0.3571], std: 0.0568
  RMSE : 0.0892, R2: 0.2135, MAE: 0.0706, Spearman rho: 0.4706, Spearman p: 2.8037e-34, Pearson r: 0.4778, Pearson p: 1.9918e-35
  Pred range: [0.0346, 0.3453], std: 0.0553
  RMSE : 0.0885, R2: 0.2256, MAE: 0.0698, Spearman rho: 0.4753, Spearman p: 4.9892e-35, Pearson r: 0.4806, Pearson p: 6.9346e-36
  Pred range: [0.0415, 0.3085], std: 0.0505
  RMSE : 0.0883, R2: 0.2293, MAE: 0.0697, Spearman rho: 0.4720, Spearman p: 1.6320e-34, Pearson r: 0.4795, Pearson p: 1.0624e-35
  Pred range: [0.0386, 0.3333], std: 0.0532
  RMSE : 0.0885, R2: 0.2266, MAE: 0.0699, Spearman rho: 0.4745, Spearman p: 6.6219e-35, Pearson r: 0.4810, Pearson p: 5.8725e-36
  Pred range: [0.0360, 0.3387], std: 0.0503
  RMSE : 0.0883, R2: 0.2304, MAE: 0.0695, Spearman rho: 0.4775, Spearman p: 2.1987e-35, Pearson r: 0.4819, Pearson p: 4.3189e-36
  Pred range: [0.0637, 0.4180], std: 0.0581
  RMSE : 0.0968, R2: 0.0738, MAE: 0.0785, Spearman rho: 0.4612, Spearman p: 7.8086e-33, Pearson r: 0.4690, Pearson p: 4.9736e-34
  Pred range: [0.0343, 0.3042], std: 0.0522
  RMSE : 0.0878, R2: 0.2389, MAE: 0.0688, Spearman rho: 0.4829, Spearman p: 2.9444e-36, Pearson r: 0.4905, Pearson p: 1.5860e-37
  Pred range: [0.0574, 0.3662], std: 0.0527
  RMSE : 0.0906, R2: 0.1884, MAE: 0.0724, Spearman rho: 0.4679, Spearman p: 7.2127e-34, Pearson r: 0.4731, Pearson p: 1.1272e-34
  Pred range: [0.0424, 0.3501], std: 0.0512
  RMSE : 0.0888, R2: 0.2202, MAE: 0.0702, Spearman rho: 0.4651, Spearman p: 2.0074e-33, Pearson r: 0.4708, Pearson p: 2.5595e-34
  Pred range: [0.0522, 0.3950], std: 0.0600
  RMSE : 0.0928, R2: 0.1488, MAE: 0.0745, Spearman rho: 0.4757, Spearman p: 4.2213e-35, Pearson r: 0.4808, Pearson p: 6.3647e-36
  Pred range: [0.0351, 0.3566], std: 0.0559
  RMSE : 0.0889, R2: 0.2187, MAE: 0.0701, Spearman rho: 0.4688, Spearman p: 5.2189e-34, Pearson r: 0.4746, Pearson p: 6.5022e-35
  Pred range: [0.0452, 0.3399], std: 0.0530
  RMSE : 0.0887, R2: 0.2222, MAE: 0.0705, Spearman rho: 0.4767, Spearman p: 2.9361e-35, Pearson r: 0.4829, Pearson p: 2.9296e-36
[I 2026-04-27 18:21:06,050] Trial 96 finished with value: 0.08776175534965848 and parameters: {'learning_rate': 0.0007056614742062017, 'batch_size': 4, 'num_epochs': 21, 'weight_decay': 0.0026077611605791993, 'layers_PRS': 2, 'layers_SCZ15': 4, 'layers_ADHD9': 6, 'layers_ASD9': 3, 'layers_ACE15': 3, 'layers_ACE18': 5, 'layers_SUD18': 6, 'layers_SES': 5, 'layers_SEX': 3, 'dropout': 0.35440378948966583, 'se_reduction': 8, 'hidden_dim_min': 9, 'base_loss': 'huber', 'huber_delta': 0.01969052135280855, 'focal_gamma': 0.976494743783582, 'n_bins': 7, 'scheduler_patience': 4, 'scheduler_factor': 0.6249048785092167, 'early_stopping_patience': 5}. Best is trial 95 with value: 0.08763367923288566.
Train: 2407 rows (1613 IDs),Test: 598 rows (404 IDs) 

n_features_x : 6, n_features_per_modality: [16, 23, 19, 17, 7, 4, 4, 4, 1, 4]

--- ImbalancedRegressionLoss initialized ---
  Bins: 7, Focal gamma: 0.769942233570305, Base loss: huber
  Bin [0.00, 0.14): count= 1370, weight=0.002
  Bin [0.14, 0.29): count=  892, weight=0.003
  Bin [0.29, 0.43): count=  120, weight=0.024
  Bin [0.43, 0.57): count=   23, weight=0.122
  Bin [0.57, 0.71): count=    2, weight=0.978
  Bin [0.71, 0.86): count=    0, weight=2.935
  Bin [0.86, 1.00): count=    0, weight=2.935
-------------------------------------------

  Pred range: [0.0448, 0.3668], std: 0.0595
  RMSE : 0.0902, R2: 0.1955, MAE: 0.0717, Spearman rho: 0.4649, Spearman p: 2.1051e-33, Pearson r: 0.4705, Pearson p: 2.9067e-34
  Pred range: [0.0341, 0.3548], std: 0.0551
  RMSE : 0.0883, R2: 0.2288, MAE: 0.0693, Spearman rho: 0.4735, Spearman p: 9.4913e-35, Pearson r: 0.4828, Pearson p: 3.0165e-36
  Pred range: [0.0179, 0.3380], std: 0.0519
  RMSE : 0.0908, R2: 0.1859, MAE: 0.0703, Spearman rho: 0.4733, Spearman p: 1.0141e-34, Pearson r: 0.4746, Pearson p: 6.3542e-35
  Pred range: [0.0625, 0.4322], std: 0.0626
  RMSE : 0.0988, R2: 0.0353, MAE: 0.0800, Spearman rho: 0.4561, Spearman p: 4.7325e-32, Pearson r: 0.4584, Pearson p: 2.0754e-32
  Pred range: [0.0378, 0.4498], std: 0.0600
  RMSE : 0.0908, R2: 0.1844, MAE: 0.0717, Spearman rho: 0.4550, Spearman p: 6.8091e-32, Pearson r: 0.4570, Pearson p: 3.4171e-32
  Pred range: [0.0367, 0.3158], std: 0.0504
  RMSE : 0.0888, R2: 0.2208, MAE: 0.0700, Spearman rho: 0.4629, Spearman p: 4.3712e-33, Pearson r: 0.4727, Pearson p: 1.2619e-34
  Pred range: [0.0598, 0.3842], std: 0.0572
  RMSE : 0.0942, R2: 0.1226, MAE: 0.0761, Spearman rho: 0.4667, Spearman p: 1.1256e-33, Pearson r: 0.4705, Pearson p: 2.9031e-34
[I 2026-04-27 18:22:22,476] Trial 97 finished with value: 0.08833962826952398 and parameters: {'learning_rate': 0.0012879580778028359, 'batch_size': 4, 'num_epochs': 21, 'weight_decay': 0.0035082785576952985, 'layers_PRS': 2, 'layers_SCZ15': 4, 'layers_ADHD9': 6, 'layers_ASD9': 3, 'layers_ACE15': 3, 'layers_ACE18': 6, 'layers_SUD18': 6, 'layers_SES': 5, 'layers_SEX': 3, 'dropout': 0.3537569983918537, 'se_reduction': 7, 'hidden_dim_min': 5, 'base_loss': 'huber', 'huber_delta': 0.023206908281490565, 'focal_gamma': 0.769942233570305, 'n_bins': 7, 'scheduler_patience': 4, 'scheduler_factor': 0.6641486316972004, 'early_stopping_patience': 5}. Best is trial 95 with value: 0.08763367923288566.
Train: 2407 rows (1613 IDs),Test: 598 rows (404 IDs) 

n_features_x : 6, n_features_per_modality: [16, 23, 19, 17, 7, 4, 4, 4, 1, 4]

--- ImbalancedRegressionLoss initialized ---
  Bins: 6, Focal gamma: 0.8633081404988507, Base loss: huber
  Bin [0.00, 0.17): count= 1538, weight=0.002
  Bin [0.17, 0.33): count=  789, weight=0.005
  Bin [0.33, 0.50): count=   69, weight=0.053
  Bin [0.50, 0.67): count=   10, weight=0.339
  Bin [0.67, 0.83): count=    1, weight=1.867
  Bin [0.83, 1.00): count=    0, weight=3.733
-------------------------------------------

  Pred range: [0.0227, 0.3729], std: 0.0525
  RMSE : 0.0944, R2: 0.1201, MAE: 0.0751, Spearman rho: 0.3796, Spearman p: 6.1443e-22, Pearson r: 0.3881, Pearson p: 6.2582e-23
  Pred range: [0.0277, 0.3897], std: 0.0563
  RMSE : 0.0946, R2: 0.1147, MAE: 0.0758, Spearman rho: 0.4175, Spearman p: 1.2497e-26, Pearson r: 0.4258, Pearson p: 9.7163e-28
  Pred range: [0.0313, 0.3935], std: 0.0585
  RMSE : 0.0969, R2: 0.0720, MAE: 0.0784, Spearman rho: 0.4335, Spearman p: 8.4876e-29, Pearson r: 0.4420, Pearson p: 5.4422e-30
  Pred range: [0.0312, 0.3741], std: 0.0567
  RMSE : 0.0934, R2: 0.1375, MAE: 0.0750, Spearman rho: 0.4454, Spearman p: 1.7606e-30, Pearson r: 0.4532, Pearson p: 1.2532e-31
  Pred range: [0.0192, 0.3662], std: 0.0586
  RMSE : 0.0908, R2: 0.1860, MAE: 0.0720, Spearman rho: 0.4542, Spearman p: 9.0635e-32, Pearson r: 0.4615, Pearson p: 7.0108e-33
  Pred range: [0.0270, 0.3615], std: 0.0576
  RMSE : 0.0911, R2: 0.1791, MAE: 0.0728, Spearman rho: 0.4623, Spearman p: 5.3525e-33, Pearson r: 0.4689, Pearson p: 5.0344e-34
  Pred range: [0.0335, 0.3852], std: 0.0583
  RMSE : 0.0931, R2: 0.1434, MAE: 0.0751, Spearman rho: 0.4666, Spearman p: 1.1672e-33, Pearson r: 0.4727, Pearson p: 1.2891e-34
  Pred range: [0.0309, 0.3722], std: 0.0558
  RMSE : 0.0909, R2: 0.1834, MAE: 0.0729, Spearman rho: 0.4647, Spearman p: 2.2981e-33, Pearson r: 0.4715, Pearson p: 2.0074e-34
  Pred range: [0.0337, 0.3913], std: 0.0576
  RMSE : 0.0924, R2: 0.1560, MAE: 0.0745, Spearman rho: 0.4663, Spearman p: 1.2934e-33, Pearson r: 0.4722, Pearson p: 1.5625e-34
[I 2026-04-27 18:23:57,310] Trial 98 pruned. 
Train: 2407 rows (1613 IDs),Test: 598 rows (404 IDs) 

n_features_x : 6, n_features_per_modality: [16, 23, 19, 17, 7, 4, 4, 4, 1, 4]

--- ImbalancedRegressionLoss initialized ---
  Bins: 7, Focal gamma: 0.793142749268557, Base loss: huber
  Bin [0.00, 0.14): count= 1370, weight=0.002
  Bin [0.14, 0.29): count=  892, weight=0.003
  Bin [0.29, 0.43): count=  120, weight=0.024
  Bin [0.43, 0.57): count=   23, weight=0.122
  Bin [0.57, 0.71): count=    2, weight=0.978
  Bin [0.71, 0.86): count=    0, weight=2.935
  Bin [0.86, 1.00): count=    0, weight=2.935
-------------------------------------------

  Pred range: [0.0377, 0.3801], std: 0.0612
  RMSE : 0.0940, R2: 0.1270, MAE: 0.0753, Spearman rho: 0.4493, Spearman p: 4.7234e-31, Pearson r: 0.4513, Pearson p: 2.4394e-31
  Pred range: [0.0704, 0.4614], std: 0.0652
  RMSE : 0.1090, R2: -0.1731, MAE: 0.0895, Spearman rho: 0.4518, Spearman p: 2.0656e-31, Pearson r: 0.4598, Pearson p: 1.2840e-32
  Pred range: [0.0409, 0.4403], std: 0.0607
  RMSE : 0.0914, R2: 0.1739, MAE: 0.0718, Spearman rho: 0.4505, Spearman p: 3.1644e-31, Pearson r: 0.4484, Pearson p: 6.4919e-31
  Pred range: [0.0374, 0.3005], std: 0.0460
  RMSE : 0.0894, R2: 0.2104, MAE: 0.0708, Spearman rho: 0.4547, Spearman p: 7.5190e-32, Pearson r: 0.4602, Pearson p: 1.1190e-32
  Pred range: [0.0730, 0.4518], std: 0.0647
  RMSE : 0.1058, R2: -0.1058, MAE: 0.0867, Spearman rho: 0.4562, Spearman p: 4.4537e-32, Pearson r: 0.4666, Pearson p: 1.1527e-33
  Pred range: [0.0651, 0.4175], std: 0.0624
  RMSE : 0.1042, R2: -0.0724, MAE: 0.0858, Spearman rho: 0.4797, Spearman p: 9.5948e-36, Pearson r: 0.4825, Pearson p: 3.3285e-36
  Pred range: [0.0674, 0.4039], std: 0.0571
  RMSE : 0.0966, R2: 0.0786, MAE: 0.0785, Spearman rho: 0.4659, Spearman p: 1.4808e-33, Pearson r: 0.4687, Pearson p: 5.4490e-34
  Pred range: [0.0717, 0.4108], std: 0.0573
  RMSE : 0.0977, R2: 0.0570, MAE: 0.0796, Spearman rho: 0.4780, Spearman p: 1.8324e-35, Pearson r: 0.4789, Pearson p: 1.3135e-35
  Pred range: [0.0252, 0.4013], std: 0.0634
  RMSE : 0.0898, R2: 0.2027, MAE: 0.0706, Spearman rho: 0.4740, Spearman p: 7.8964e-35, Pearson r: 0.4777, Pearson p: 2.0771e-35
