[I 2026-04-29 01:47:06,776] Trial 42 pruned. 
Train: 2407 rows (1613 IDs),Test: 598 rows (404 IDs) 

n_features_x : 6, n_features_per_modality: [16, 23, 19, 17, 7, 4, 4, 4, 1, 4]

--- ImbalancedRegressionLoss initialized ---
  Bins: 6, Focal gamma: 2.5964856043597013, Base loss: huber
  Bin [0.00, 0.17): count=  961, weight=0.041
  Bin [0.17, 0.33): count=  848, weight=0.047
  Bin [0.33, 0.50): count=  353, weight=0.112
  Bin [0.50, 0.67): count=  176, weight=0.224
  Bin [0.67, 0.83): count=   62, weight=0.628
  Bin [0.83, 1.00): count=    7, weight=4.948
-------------------------------------------

  Pred range: [0.1382, 0.6543], std: 0.0918
  RMSE : 0.1660, R2: 0.0797, MAE: 0.1392, Spearman rho: 0.4750, Spearman p: 5.6266e-35, Pearson r: 0.4730, Pearson p: 1.1467e-34
  Pred range: [0.0958, 0.7021], std: 0.1050
  RMSE : 0.1758, R2: -0.0310, MAE: 0.1475, Spearman rho: 0.4885, Spearman p: 3.4771e-37, Pearson r: 0.4927, Pearson p: 6.8491e-38
  Pred range: [0.0937, 0.5939], std: 0.0897
  RMSE : 0.1574, R2: 0.1735, MAE: 0.1298, Spearman rho: 0.4933, Spearman p: 5.4211e-38, Pearson r: 0.5070, Pearson p: 2.2367e-40
  Pred range: [0.0125, 0.5099], std: 0.0839
  RMSE : 0.1490, R2: 0.2586, MAE: 0.1169, Spearman rho: 0.4884, Spearman p: 3.6524e-37, Pearson r: 0.5091, Pearson p: 9.4798e-41
  Pred range: [0.0707, 0.5765], std: 0.0895
  RMSE : 0.1527, R2: 0.2220, MAE: 0.1241, Spearman rho: 0.4801, Spearman p: 8.4747e-36, Pearson r: 0.5066, Pearson p: 2.6047e-40
  Pred range: [0.0529, 0.5115], std: 0.0893
  RMSE : 0.1487, R2: 0.2617, MAE: 0.1151, Spearman rho: 0.4957, Spearman p: 2.1221e-38, Pearson r: 0.5119, Pearson p: 2.9402e-41
  Pred range: [0.0777, 0.6362], std: 0.0974
  RMSE : 0.1651, R2: 0.0902, MAE: 0.1373, Spearman rho: 0.4947, Spearman p: 3.1513e-38, Pearson r: 0.5061, Pearson p: 3.2800e-40
  Pred range: [0.0361, 0.5255], std: 0.0872
  RMSE : 0.1488, R2: 0.2611, MAE: 0.1160, Spearman rho: 0.4955, Spearman p: 2.2451e-38, Pearson r: 0.5110, Pearson p: 4.3597e-41
  Pred range: [0.0907, 0.5845], std: 0.0915
  RMSE : 0.1529, R2: 0.2195, MAE: 0.1241, Spearman rho: 0.4906, Spearman p: 1.5489e-37, Pearson r: 0.5102, Pearson p: 6.0023e-41
  Pred range: [0.0986, 0.5449], std: 0.0837
  RMSE : 0.1548, R2: 0.2006, MAE: 0.1272, Spearman rho: 0.4919, Spearman p: 9.3242e-38, Pearson r: 0.5087, Pearson p: 1.1327e-40
  Pred range: [0.0460, 0.5532], std: 0.0892
  RMSE : 0.1505, R2: 0.2441, MAE: 0.1192, Spearman rho: 0.4839, Spearman p: 1.9743e-36, Pearson r: 0.5022, Pearson p: 1.5687e-39
  Pred range: [0.0377, 0.5460], std: 0.0877
  RMSE : 0.1494, R2: 0.2546, MAE: 0.1175, Spearman rho: 0.4897, Spearman p: 2.1906e-37, Pearson r: 0.5059, Pearson p: 3.5832e-40
  Pred range: [0.0491, 0.6215], std: 0.0969
  RMSE : 0.1566, R2: 0.1814, MAE: 0.1282, Spearman rho: 0.4976, Spearman p: 9.7929e-39, Pearson r: 0.5118, Pearson p: 3.0582e-41
[I 2026-04-29 01:48:45,025] Trial 43 finished with value: 0.14872078466416302 and parameters: {'learning_rate': 0.0013526846828421939, 'batch_size': 4, 'num_epochs': 15, 'weight_decay': 0.002266470903559869, 'layers_PRS': 3, 'layers_SCZ15': 1, 'layers_ADHD9': 3, 'layers_ASD9': 2, 'layers_ACE15': 4, 'layers_ACE18': 3, 'layers_SUD18': 3, 'layers_SES': 4, 'layers_SEX': 2, 'dropout': 0.16830347868725495, 'se_reduction': 5, 'hidden_dim_min': 12, 'base_loss': 'huber', 'huber_delta': 0.11085942683213426, 'focal_gamma': 2.5964856043597013, 'n_bins': 6, 'scheduler_patience': 4, 'scheduler_factor': 0.650984329009181, 'early_stopping_patience': 7}. Best is trial 35 with value: 0.14828249718771663.
Train: 2407 rows (1613 IDs),Test: 598 rows (404 IDs) 

n_features_x : 6, n_features_per_modality: [16, 23, 19, 17, 7, 4, 4, 4, 1, 4]

--- ImbalancedRegressionLoss initialized ---
  Bins: 6, Focal gamma: 2.6200783288819283, Base loss: huber
  Bin [0.00, 0.17): count=  961, weight=0.041
  Bin [0.17, 0.33): count=  848, weight=0.047
  Bin [0.33, 0.50): count=  353, weight=0.112
  Bin [0.50, 0.67): count=  176, weight=0.224
  Bin [0.67, 0.83): count=   62, weight=0.628
  Bin [0.83, 1.00): count=    7, weight=4.948
-------------------------------------------

  Pred range: [0.1419, 0.7195], std: 0.0917
  RMSE : 0.1900, R2: -0.2051, MAE: 0.1636, Spearman rho: 0.4696, Spearman p: 3.9876e-34, Pearson r: 0.4822, Pearson p: 3.8439e-36
  Pred range: [0.0952, 0.6080], std: 0.0934
  RMSE : 0.1590, R2: 0.1564, MAE: 0.1305, Spearman rho: 0.4871, Spearman p: 5.8490e-37, Pearson r: 0.4948, Pearson p: 2.9452e-38
  Pred range: [0.1107, 0.6462], std: 0.0935
  RMSE : 0.1681, R2: 0.0566, MAE: 0.1416, Spearman rho: 0.4950, Spearman p: 2.7546e-38, Pearson r: 0.5056, Pearson p: 4.0093e-40
  Pred range: [0.0534, 0.5872], std: 0.0970
  RMSE : 0.1524, R2: 0.2244, MAE: 0.1228, Spearman rho: 0.5005, Spearman p: 3.1411e-39, Pearson r: 0.5113, Pearson p: 3.7824e-41
  Pred range: [0.0811, 0.6711], std: 0.1002
  RMSE : 0.1637, R2: 0.1059, MAE: 0.1356, Spearman rho: 0.5002, Spearman p: 3.4878e-39, Pearson r: 0.5121, Pearson p: 2.7199e-41
  Pred range: [0.0190, 0.5767], std: 0.0900
  RMSE : 0.1513, R2: 0.2359, MAE: 0.1197, Spearman rho: 0.4793, Spearman p: 1.1044e-35, Pearson r: 0.4906, Pearson p: 1.5125e-37
  Pred range: [0.0733, 0.6498], std: 0.0976
  RMSE : 0.1625, R2: 0.1187, MAE: 0.1346, Spearman rho: 0.4782, Spearman p: 1.7176e-35, Pearson r: 0.4955, Pearson p: 2.2412e-38
  Pred range: [0.0527, 0.5557], std: 0.0913
  RMSE : 0.1513, R2: 0.2358, MAE: 0.1212, Spearman rho: 0.4912, Spearman p: 1.2019e-37, Pearson r: 0.5040, Pearson p: 7.5804e-40
  Pred range: [0.0730, 0.6501], std: 0.0989
  RMSE : 0.1561, R2: 0.1861, MAE: 0.1274, Spearman rho: 0.4885, Spearman p: 3.5192e-37, Pearson r: 0.5086, Pearson p: 1.1642e-40
  Pred range: [0.0543, 0.5595], std: 0.0905
  RMSE : 0.1532, R2: 0.2167, MAE: 0.1245, Spearman rho: 0.4977, Spearman p: 9.6036e-39, Pearson r: 0.5126, Pearson p: 2.2567e-41
  Pred range: [0.0588, 0.5747], std: 0.0912
  RMSE : 0.1512, R2: 0.2371, MAE: 0.1214, Spearman rho: 0.4941, Spearman p: 3.9526e-38, Pearson r: 0.5096, Pearson p: 7.7940e-41
  Pred range: [0.0716, 0.5318], std: 0.0865
  RMSE : 0.1492, R2: 0.2574, MAE: 0.1175, Spearman rho: 0.4921, Spearman p: 8.4795e-38, Pearson r: 0.5093, Pearson p: 8.9016e-41
[I 2026-04-29 01:50:29,416] Trial 44 finished with value: 0.14915333857033589 and parameters: {'learning_rate': 0.0015319735313714586, 'batch_size': 4, 'num_epochs': 12, 'weight_decay': 0.002197885365057158, 'layers_PRS': 3, 'layers_SCZ15': 5, 'layers_ADHD9': 3, 'layers_ASD9': 2, 'layers_ACE15': 3, 'layers_ACE18': 3, 'layers_SUD18': 3, 'layers_SES': 4, 'layers_SEX': 2, 'dropout': 0.1637056739718905, 'se_reduction': 5, 'hidden_dim_min': 12, 'base_loss': 'huber', 'huber_delta': 0.11039761039741915, 'focal_gamma': 2.6200783288819283, 'n_bins': 6, 'scheduler_patience': 4, 'scheduler_factor': 0.6495205761193866, 'early_stopping_patience': 7}. Best is trial 35 with value: 0.14828249718771663.
Train: 2407 rows (1613 IDs),Test: 598 rows (404 IDs) 

n_features_x : 6, n_features_per_modality: [16, 23, 19, 17, 7, 4, 4, 4, 1, 4]

--- ImbalancedRegressionLoss initialized ---
  Bins: 5, Focal gamma: 2.621222199791358, Base loss: huber
  Bin [0.00, 0.20): count= 1165, weight=0.037
  Bin [0.20, 0.40): count=  806, weight=0.054
  Bin [0.40, 0.60): count=  320, weight=0.136
  Bin [0.60, 0.80): count=  107, weight=0.404
  Bin [0.80, 1.00): count=    9, weight=4.368
-------------------------------------------

  Pred range: [0.0740, 0.5641], std: 0.0843
  RMSE : 0.1519, R2: 0.2302, MAE: 0.1212, Spearman rho: 0.4796, Spearman p: 1.0208e-35, Pearson r: 0.4912, Pearson p: 1.2151e-37
  Pred range: [0.0927, 0.5754], std: 0.0867
  RMSE : 0.1521, R2: 0.2278, MAE: 0.1232, Spearman rho: 0.4900, Spearman p: 1.9401e-37, Pearson r: 0.5068, Pearson p: 2.4123e-40
  Pred range: [0.1103, 0.6154], std: 0.0925
  RMSE : 0.1620, R2: 0.1235, MAE: 0.1354, Spearman rho: 0.4941, Spearman p: 3.8619e-38, Pearson r: 0.5131, Pearson p: 1.8340e-41
  Pred range: [0.0295, 0.5787], std: 0.0910
  RMSE : 0.1486, R2: 0.2630, MAE: 0.1168, Spearman rho: 0.4929, Spearman p: 6.1641e-38, Pearson r: 0.5145, Pearson p: 1.0078e-41
  Pred range: [0.0664, 0.5773], std: 0.0872
  RMSE : 0.1544, R2: 0.2042, MAE: 0.1264, Spearman rho: 0.4975, Spearman p: 1.0126e-38, Pearson r: 0.5120, Pearson p: 2.9097e-41
  Pred range: [0.0926, 0.6303], std: 0.0886
  RMSE : 0.1594, R2: 0.1521, MAE: 0.1323, Spearman rho: 0.4882, Spearman p: 3.9286e-37, Pearson r: 0.5076, Pearson p: 1.7307e-40
  Pred range: [0.0835, 0.5968], std: 0.0864
  RMSE : 0.1553, R2: 0.1954, MAE: 0.1274, Spearman rho: 0.4944, Spearman p: 3.5505e-38, Pearson r: 0.5114, Pearson p: 3.7429e-41
  Pred range: [0.0642, 0.5490], std: 0.0916
  RMSE : 0.1502, R2: 0.2474, MAE: 0.1200, Spearman rho: 0.5066, Spearman p: 2.6864e-40, Pearson r: 0.5194, Pearson p: 1.2864e-42
  Pred range: [0.0291, 0.5301], std: 0.0871
  RMSE : 0.1491, R2: 0.2575, MAE: 0.1147, Spearman rho: 0.4961, Spearman p: 1.7785e-38, Pearson r: 0.5113, Pearson p: 3.8396e-41
  Pred range: [0.0900, 0.5838], std: 0.0846
  RMSE : 0.1542, R2: 0.2062, MAE: 0.1267, Spearman rho: 0.4977, Spearman p: 9.6065e-39, Pearson r: 0.5144, Pearson p: 1.0538e-41
[I 2026-04-29 01:52:00,260] Trial 45 finished with value: 0.14859286133533534 and parameters: {'learning_rate': 0.0014225362826088552, 'batch_size': 4, 'num_epochs': 11, 'weight_decay': 0.004227430208465582, 'layers_PRS': 4, 'layers_SCZ15': 5, 'layers_ADHD9': 2, 'layers_ASD9': 2, 'layers_ACE15': 3, 'layers_ACE18': 4, 'layers_SUD18': 3, 'layers_SES': 5, 'layers_SEX': 2, 'dropout': 0.16942739691825, 'se_reduction': 6, 'hidden_dim_min': 12, 'base_loss': 'huber', 'huber_delta': 0.11342940939507345, 'focal_gamma': 2.621222199791358, 'n_bins': 5, 'scheduler_patience': 4, 'scheduler_factor': 0.6470635536336694, 'early_stopping_patience': 6}. Best is trial 35 with value: 0.14828249718771663.
Train: 2407 rows (1613 IDs),Test: 598 rows (404 IDs) 

n_features_x : 6, n_features_per_modality: [16, 23, 19, 17, 7, 4, 4, 4, 1, 4]

--- ImbalancedRegressionLoss initialized ---
  Bins: 5, Focal gamma: 2.857977217823147, Base loss: huber
  Bin [0.00, 0.20): count= 1165, weight=0.037
  Bin [0.20, 0.40): count=  806, weight=0.054
  Bin [0.40, 0.60): count=  320, weight=0.136
  Bin [0.60, 0.80): count=  107, weight=0.404
  Bin [0.80, 1.00): count=    9, weight=4.368
-------------------------------------------

  Pred range: [0.1312, 0.6033], std: 0.0782
  RMSE : 0.1655, R2: 0.0853, MAE: 0.1388, Spearman rho: 0.4371, Spearman p: 2.7015e-29, Pearson r: 0.4545, Pearson p: 8.0627e-32
  Pred range: [0.1316, 0.5915], std: 0.0833
  RMSE : 0.1655, R2: 0.0861, MAE: 0.1394, Spearman rho: 0.4693, Spearman p: 4.4233e-34, Pearson r: 0.4844, Pearson p: 1.6692e-36
  Pred range: [0.1128, 0.5791], std: 0.0822
  RMSE : 0.1594, R2: 0.1517, MAE: 0.1323, Spearman rho: 0.4785, Spearman p: 1.5369e-35, Pearson r: 0.4978, Pearson p: 9.1951e-39
  Pred range: [0.0801, 0.5266], std: 0.0781
  RMSE : 0.1509, R2: 0.2396, MAE: 0.1209, Spearman rho: 0.4845, Spearman p: 1.5781e-36, Pearson r: 0.5079, Pearson p: 1.5807e-40
  Pred range: [0.1217, 0.5672], std: 0.0788
  RMSE : 0.1565, R2: 0.1820, MAE: 0.1298, Spearman rho: 0.4830, Spearman p: 2.7643e-36, Pearson r: 0.5074, Pearson p: 1.9126e-40
  Pred range: [0.1074, 0.6143], std: 0.0888
  RMSE : 0.1605, R2: 0.1403, MAE: 0.1339, Spearman rho: 0.4909, Spearman p: 1.3756e-37, Pearson r: 0.5149, Pearson p: 8.4694e-42
  Pred range: [0.1236, 0.6163], std: 0.0909
  RMSE : 0.1645, R2: 0.0968, MAE: 0.1383, Spearman rho: 0.4916, Spearman p: 1.0449e-37, Pearson r: 0.5155, Pearson p: 6.5805e-42
  Pred range: [0.1085, 0.5829], std: 0.0840
  RMSE : 0.1583, R2: 0.1638, MAE: 0.1324, Spearman rho: 0.4870, Spearman p: 6.2338e-37, Pearson r: 0.5156, Pearson p: 6.5160e-42
  Pred range: [0.1333, 0.6656], std: 0.0932
  RMSE : 0.1780, R2: -0.0572, MAE: 0.1518, Spearman rho: 0.4912, Spearman p: 1.1973e-37, Pearson r: 0.5165, Pearson p: 4.2908e-42
  Pred range: [0.0823, 0.5291], std: 0.0818
  RMSE : 0.1500, R2: 0.2491, MAE: 0.1216, Spearman rho: 0.4919, Spearman p: 9.1834e-38, Pearson r: 0.5198, Pearson p: 1.0706e-42
[I 2026-04-29 01:52:47,002] Trial 46 finished with value: 0.1499841137758689 and parameters: {'learning_rate': 0.0014360868694205618, 'batch_size': 8, 'num_epochs': 10, 'weight_decay': 0.0037399122774695545, 'layers_PRS': 5, 'layers_SCZ15': 4, 'layers_ADHD9': 1, 'layers_ASD9': 3, 'layers_ACE15': 3, 'layers_ACE18': 4, 'layers_SUD18': 3, 'layers_SES': 5, 'layers_SEX': 1, 'dropout': 0.2726884537666697, 'se_reduction': 6, 'hidden_dim_min': 12, 'base_loss': 'huber', 'huber_delta': 0.08412875509190909, 'focal_gamma': 2.857977217823147, 'n_bins': 5, 'scheduler_patience': 5, 'scheduler_factor': 0.6333143509679909, 'early_stopping_patience': 6}. Best is trial 35 with value: 0.14828249718771663.
Train: 2407 rows (1613 IDs),Test: 598 rows (404 IDs) 

n_features_x : 6, n_features_per_modality: [16, 23, 19, 17, 7, 4, 4, 4, 1, 4]

--- ImbalancedRegressionLoss initialized ---
  Bins: 5, Focal gamma: 2.196299713450148, Base loss: mse
  Bin [0.00, 0.20): count= 1165, weight=0.037
  Bin [0.20, 0.40): count=  806, weight=0.054
  Bin [0.40, 0.60): count=  320, weight=0.136
  Bin [0.60, 0.80): count=  107, weight=0.404
  Bin [0.80, 1.00): count=    9, weight=4.368
-------------------------------------------

  Pred range: [0.1062, 0.4807], std: 0.0602
  RMSE : 0.1611, R2: 0.1339, MAE: 0.1328, Spearman rho: 0.4219, Spearman p: 3.3049e-27, Pearson r: 0.4417, Pearson p: 6.0618e-30
  Pred range: [0.1119, 0.5273], std: 0.0716
  RMSE : 0.1619, R2: 0.1248, MAE: 0.1353, Spearman rho: 0.4622, Spearman p: 5.5789e-33, Pearson r: 0.4791, Pearson p: 1.2194e-35
  Pred range: [0.1150, 0.5270], std: 0.0726
  RMSE : 0.1572, R2: 0.1749, MAE: 0.1302, Spearman rho: 0.4756, Spearman p: 4.4982e-35, Pearson r: 0.4937, Pearson p: 4.5511e-38
  Pred range: [0.1365, 0.5753], std: 0.0781
  RMSE : 0.1651, R2: 0.0905, MAE: 0.1395, Spearman rho: 0.4808, Spearman p: 6.4307e-36, Pearson r: 0.4997, Pearson p: 4.2800e-39
  Pred range: [0.1323, 0.5680], std: 0.0781
  RMSE : 0.1607, R2: 0.1384, MAE: 0.1346, Spearman rho: 0.4864, Spearman p: 7.7856e-37, Pearson r: 0.5070, Pearson p: 2.2689e-40
  Pred range: [0.1137, 0.5275], std: 0.0758
  RMSE : 0.1531, R2: 0.2179, MAE: 0.1254, Spearman rho: 0.4887, Spearman p: 3.2477e-37, Pearson r: 0.5111, Pearson p: 4.2403e-41
  Pred range: [0.1274, 0.5714], std: 0.0788
  RMSE : 0.1593, R2: 0.1525, MAE: 0.1332, Spearman rho: 0.4858, Spearman p: 9.5869e-37, Pearson r: 0.5097, Pearson p: 7.5205e-41
  Pred range: [0.1115, 0.5484], std: 0.0796
  RMSE : 0.1526, R2: 0.2223, MAE: 0.1245, Spearman rho: 0.4898, Spearman p: 2.0985e-37, Pearson r: 0.5116, Pearson p: 3.3962e-41
  Pred range: [0.0938, 0.5235], std: 0.0780
  RMSE : 0.1501, R2: 0.2477, MAE: 0.1203, Spearman rho: 0.4872, Spearman p: 5.7224e-37, Pearson r: 0.5117, Pearson p: 3.2143e-41
  Pred range: [0.1159, 0.5685], std: 0.0813
  RMSE : 0.1559, R2: 0.1891, MAE: 0.1289, Spearman rho: 0.4917, Spearman p: 1.0167e-37, Pearson r: 0.5140, Pearson p: 1.2371e-41
  Pred range: [0.0953, 0.5467], std: 0.0810
  RMSE : 0.1533, R2: 0.2157, MAE: 0.1257, Spearman rho: 0.4955, Spearman p: 2.2488e-38, Pearson r: 0.5168, Pearson p: 3.9012e-42
  Pred range: [0.1254, 0.6025], std: 0.0849
  RMSE : 0.1648, R2: 0.0930, MAE: 0.1393, Spearman rho: 0.4920, Spearman p: 8.9710e-38, Pearson r: 0.5154, Pearson p: 6.8327e-42
[I 2026-04-29 01:54:37,715] Trial 47 finished with value: 0.15012414657539186 and parameters: {'learning_rate': 0.0003988052678384391, 'batch_size': 4, 'num_epochs': 12, 'weight_decay': 0.0099452730853002, 'layers_PRS': 4, 'layers_SCZ15': 5, 'layers_ADHD9': 2, 'layers_ASD9': 2, 'layers_ACE15': 3, 'layers_ACE18': 4, 'layers_SUD18': 3, 'layers_SES': 5, 'layers_SEX': 2, 'dropout': 0.17381052354078272, 'se_reduction': 4, 'hidden_dim_min': 10, 'base_loss': 'mse', 'huber_delta': 0.11836099895221643, 'focal_gamma': 2.196299713450148, 'n_bins': 5, 'scheduler_patience': 4, 'scheduler_factor': 0.6959611479845923, 'early_stopping_patience': 6}. Best is trial 35 with value: 0.14828249718771663.
Train: 2407 rows (1613 IDs),Test: 598 rows (404 IDs) 

n_features_x : 6, n_features_per_modality: [16, 23, 19, 17, 7, 4, 4, 4, 1, 4]

--- ImbalancedRegressionLoss initialized ---
  Bins: 6, Focal gamma: 2.8071904954015556, Base loss: huber
  Bin [0.00, 0.17): count=  961, weight=0.041
  Bin [0.17, 0.33): count=  848, weight=0.047
  Bin [0.33, 0.50): count=  353, weight=0.112
  Bin [0.50, 0.67): count=  176, weight=0.224
  Bin [0.67, 0.83): count=   62, weight=0.628
  Bin [0.83, 1.00): count=    7, weight=4.948
-------------------------------------------

  Pred range: [0.0944, 0.5630], std: 0.0841
  RMSE : 0.1544, R2: 0.2044, MAE: 0.1239, Spearman rho: 0.4682, Spearman p: 6.6265e-34, Pearson r: 0.4746, Pearson p: 6.4571e-35
  Pred range: [0.0683, 0.5875], std: 0.0924
  RMSE : 0.1555, R2: 0.1931, MAE: 0.1262, Spearman rho: 0.4897, Spearman p: 2.1564e-37, Pearson r: 0.4975, Pearson p: 1.0426e-38
  Pred range: [0.0122, 0.4983], std: 0.0823
  RMSE : 0.1504, R2: 0.2450, MAE: 0.1149, Spearman rho: 0.4867, Spearman p: 6.8419e-37, Pearson r: 0.5022, Pearson p: 1.5672e-39
  Pred range: [0.0097, 0.5123], std: 0.0900
  RMSE : 0.1524, R2: 0.2251, MAE: 0.1136, Spearman rho: 0.4965, Spearman p: 1.5532e-38, Pearson r: 0.5065, Pearson p: 2.7180e-40
  Pred range: [0.0438, 0.5869], std: 0.0941
  RMSE : 0.1517, R2: 0.2313, MAE: 0.1212, Spearman rho: 0.4953, Spearman p: 2.4385e-38, Pearson r: 0.5075, Pearson p: 1.8465e-40
  Pred range: [0.0417, 0.5277], std: 0.0913
  RMSE : 0.1490, R2: 0.2588, MAE: 0.1168, Spearman rho: 0.4984, Spearman p: 7.2919e-39, Pearson r: 0.5098, Pearson p: 7.2699e-41
  Pred range: [0.0061, 0.5899], std: 0.0938
  RMSE : 0.1500, R2: 0.2494, MAE: 0.1186, Spearman rho: 0.4878, Spearman p: 4.5873e-37, Pearson r: 0.5058, Pearson p: 3.6270e-40
  Pred range: [0.0506, 0.6329], std: 0.0983
  RMSE : 0.1579, R2: 0.1677, MAE: 0.1301, Spearman rho: 0.4963, Spearman p: 1.6271e-38, Pearson r: 0.5152, Pearson p: 7.5726e-42
  Pred range: [0.0103, 0.5973], std: 0.0955
  RMSE : 0.1497, R2: 0.2520, MAE: 0.1195, Spearman rho: 0.4941, Spearman p: 3.8731e-38, Pearson r: 0.5160, Pearson p: 5.4567e-42
  Pred range: [0.1105, 0.6925], std: 0.1039
  RMSE : 0.1739, R2: -0.0097, MAE: 0.1465, Spearman rho: 0.4957, Spearman p: 2.0835e-38, Pearson r: 0.5165, Pearson p: 4.3552e-42
  Pred range: [0.0358, 0.5694], std: 0.0954
  RMSE : 0.1489, R2: 0.2597, MAE: 0.1175, Spearman rho: 0.4989, Spearman p: 5.9985e-39, Pearson r: 0.5157, Pearson p: 6.2106e-42
  Pred range: [0.0805, 0.6329], std: 0.0968
  RMSE : 0.1611, R2: 0.1338, MAE: 0.1339, Spearman rho: 0.4945, Spearman p: 3.3650e-38, Pearson r: 0.5088, Pearson p: 1.0728e-40
  Pred range: [0.0284, 0.5413], std: 0.0885
  RMSE : 0.1502, R2: 0.2469, MAE: 0.1154, Spearman rho: 0.4828, Spearman p: 2.9780e-36, Pearson r: 0.4996, Pearson p: 4.4455e-39
  Pred range: [0.0670, 0.5958], std: 0.0937
  RMSE : 0.1538, R2: 0.2099, MAE: 0.1255, Spearman rho: 0.4949, Spearman p: 2.8303e-38, Pearson r: 0.5110, Pearson p: 4.2672e-41
