[I 2026-04-27 16:24:09,886] Trial 6 finished with value: 0.09353096029954953 and parameters: {'learning_rate': 0.0011566086695307513, 'batch_size': 16, 'num_epochs': 26, 'weight_decay': 0.00040153041863319987, 'layers_PRS': 3, 'layers_SCZ15': 1, 'layers_ADHD9': 1, 'layers_ASD9': 1, 'layers_ACE15': 4, 'layers_ACE18': 6, 'layers_SUD18': 1, 'layers_SES': 4, 'layers_SEX': 6, 'dropout': 0.17622107216886623, 'se_reduction': 3, 'hidden_dim_min': 12, 'base_loss': 'mse', 'huber_delta': 0.06147197818223973, 'focal_gamma': 1.407033205364129, 'n_bins': 16, 'scheduler_patience': 3, 'scheduler_factor': 0.5136339508644155, 'early_stopping_patience': 7}. Best is trial 0 with value: 0.08964510394112955.
Train: 2407 rows (1613 IDs),Test: 598 rows (404 IDs) 

n_features_x : 6, n_features_per_modality: [16, 23, 19, 17, 7, 4, 4, 4, 1, 4]

--- ImbalancedRegressionLoss initialized ---
  Bins: 12, Focal gamma: 2.0183598036712738, Base loss: huber
  Bin [0.00, 0.08): count=  828, weight=0.003
  Bin [0.08, 0.17): count=  710, weight=0.004
  Bin [0.17, 0.25): count=  575, weight=0.005
  Bin [0.25, 0.33): count=  214, weight=0.013
  Bin [0.33, 0.42): count=   55, weight=0.051
  Bin [0.42, 0.50): count=   14, weight=0.191
  Bin [0.50, 0.58): count=    9, weight=0.286
  Bin [0.58, 0.67): count=    1, weight=1.431
  Bin [0.67, 0.75): count=    1, weight=1.431
  Bin [0.75, 0.83): count=    0, weight=2.862
  Bin [0.83, 0.92): count=    0, weight=2.862
  Bin [0.92, 1.00): count=    0, weight=2.862
-------------------------------------------

  Pred range: [0.0328, 0.3924], std: 0.0676
  RMSE : 0.0943, R2: 0.1214, MAE: 0.0752, Spearman rho: 0.4469, Spearman p: 1.0506e-30, Pearson r: 0.4577, Pearson p: 2.7159e-32
  Pred range: [-0.0090, 0.3961], std: 0.0624
  RMSE : 0.0916, R2: 0.1717, MAE: 0.0730, Spearman rho: 0.4618, Spearman p: 6.4318e-33, Pearson r: 0.4694, Pearson p: 4.2221e-34
  Pred range: [-0.0052, 0.3549], std: 0.0557
  RMSE : 0.0912, R2: 0.1787, MAE: 0.0719, Spearman rho: 0.4369, Spearman p: 2.9026e-29, Pearson r: 0.4446, Pearson p: 2.2685e-30
  Pred range: [0.0395, 0.4013], std: 0.0498
  RMSE : 0.0968, R2: 0.0739, MAE: 0.0791, Spearman rho: 0.4528, Spearman p: 1.4634e-31, Pearson r: 0.4574, Pearson p: 2.9423e-32
  Pred range: [-0.0223, 0.3243], std: 0.0481
  RMSE : 0.0891, R2: 0.2158, MAE: 0.0709, Spearman rho: 0.4537, Spearman p: 1.0458e-31, Pearson r: 0.4648, Pearson p: 2.2282e-33
  Pred range: [0.0500, 0.3933], std: 0.0565
  RMSE : 0.0915, R2: 0.1719, MAE: 0.0728, Spearman rho: 0.4496, Spearman p: 4.2320e-31, Pearson r: 0.4558, Pearson p: 5.1582e-32
  Pred range: [0.0662, 0.3574], std: 0.0529
  RMSE : 0.0925, R2: 0.1552, MAE: 0.0748, Spearman rho: 0.4602, Spearman p: 1.1104e-32, Pearson r: 0.4735, Pearson p: 9.6195e-35
  Pred range: [0.0803, 0.4235], std: 0.0601
  RMSE : 0.1021, R2: -0.0297, MAE: 0.0834, Spearman rho: 0.4614, Spearman p: 7.4083e-33, Pearson r: 0.4703, Pearson p: 3.0500e-34
  Pred range: [0.0207, 0.3817], std: 0.0572
  RMSE : 0.0961, R2: 0.0878, MAE: 0.0779, Spearman rho: 0.4425, Spearman p: 4.5970e-30, Pearson r: 0.4566, Pearson p: 3.9025e-32
  Pred range: [-0.0054, 0.3234], std: 0.0508
  RMSE : 0.0899, R2: 0.2016, MAE: 0.0715, Spearman rho: 0.4437, Spearman p: 3.1133e-30, Pearson r: 0.4533, Pearson p: 1.2274e-31
  Pred range: [0.0089, 0.3771], std: 0.0552
  RMSE : 0.0939, R2: 0.1286, MAE: 0.0763, Spearman rho: 0.4483, Spearman p: 6.6685e-31, Pearson r: 0.4646, Pearson p: 2.3708e-33
[I 2026-04-27 16:26:16,449] Trial 7 finished with value: 0.08908359670904911 and parameters: {'learning_rate': 0.0013265335429882938, 'batch_size': 4, 'num_epochs': 29, 'weight_decay': 1.1597844194071143e-05, 'layers_PRS': 1, 'layers_SCZ15': 2, 'layers_ADHD9': 7, 'layers_ASD9': 3, 'layers_ACE15': 3, 'layers_ACE18': 5, 'layers_SUD18': 7, 'layers_SES': 7, 'layers_SEX': 4, 'dropout': 0.4499775350780124, 'se_reduction': 6, 'hidden_dim_min': 5, 'base_loss': 'huber', 'huber_delta': 0.06369003286720494, 'focal_gamma': 2.0183598036712738, 'n_bins': 12, 'scheduler_patience': 4, 'scheduler_factor': 0.4614809625266759, 'early_stopping_patience': 6}. Best is trial 7 with value: 0.08908359670904911.
Train: 2407 rows (1613 IDs),Test: 598 rows (404 IDs) 

n_features_x : 6, n_features_per_modality: [16, 23, 19, 17, 7, 4, 4, 4, 1, 4]

--- ImbalancedRegressionLoss initialized ---
  Bins: 18, Focal gamma: 1.3182811527652192, Base loss: mse
  Bin [0.00, 0.06): count=  650, weight=0.004
  Bin [0.06, 0.11): count=  530, weight=0.005
  Bin [0.11, 0.17): count=  358, weight=0.007
  Bin [0.17, 0.22): count=  477, weight=0.005
  Bin [0.22, 0.28): count=  179, weight=0.014
  Bin [0.28, 0.33): count=  133, weight=0.019
  Bin [0.33, 0.39): count=   39, weight=0.064
  Bin [0.39, 0.44): count=   20, weight=0.122
  Bin [0.44, 0.50): count=   10, weight=0.233
  Bin [0.50, 0.56): count=    6, weight=0.366
  Bin [0.56, 0.61): count=    4, weight=0.512
  Bin [0.61, 0.67): count=    0, weight=2.561
  Bin [0.67, 0.72): count=    1, weight=1.281
  Bin [0.72, 0.78): count=    0, weight=2.561
  Bin [0.78, 0.83): count=    0, weight=2.561
  Bin [0.83, 0.89): count=    0, weight=2.561
  Bin [0.89, 0.94): count=    0, weight=2.561
  Bin [0.94, 1.00): count=    0, weight=2.561
-------------------------------------------

  Pred range: [0.0472, 0.3746], std: 0.0462
  RMSE : 0.1030, R2: -0.0475, MAE: 0.0853, Spearman rho: 0.3916, Spearman p: 2.3858e-23, Pearson r: 0.4064, Pearson p: 3.4562e-25
  Pred range: [0.0731, 0.3944], std: 0.0564
  RMSE : 0.1069, R2: -0.1291, MAE: 0.0888, Spearman rho: 0.4273, Spearman p: 6.0640e-28, Pearson r: 0.4432, Pearson p: 3.6928e-30
  Pred range: [0.0706, 0.3852], std: 0.0507
  RMSE : 0.1037, R2: -0.0626, MAE: 0.0857, Spearman rho: 0.4236, Spearman p: 1.9714e-27, Pearson r: 0.4376, Pearson p: 2.2594e-29
  Pred range: [0.0704, 0.4303], std: 0.0587
  RMSE : 0.1170, R2: -0.3520, MAE: 0.0980, Spearman rho: 0.4426, Spearman p: 4.4291e-30, Pearson r: 0.4544, Pearson p: 8.4643e-32
  Pred range: [0.0249, 0.3833], std: 0.0517
  RMSE : 0.0975, R2: 0.0603, MAE: 0.0801, Spearman rho: 0.4405, Spearman p: 9.0225e-30, Pearson r: 0.4509, Pearson p: 2.7344e-31
  Pred range: [0.0291, 0.3982], std: 0.0564
  RMSE : 0.0999, R2: 0.0143, MAE: 0.0820, Spearman rho: 0.4425, Spearman p: 4.6259e-30, Pearson r: 0.4540, Pearson p: 9.5611e-32
[I 2026-04-27 16:26:34,853] Trial 8 pruned. 
Train: 2407 rows (1613 IDs),Test: 598 rows (404 IDs) 

n_features_x : 6, n_features_per_modality: [16, 23, 19, 17, 7, 4, 4, 4, 1, 4]

--- ImbalancedRegressionLoss initialized ---
  Bins: 18, Focal gamma: 0.7165053820845673, Base loss: huber
  Bin [0.00, 0.06): count=  650, weight=0.004
  Bin [0.06, 0.11): count=  530, weight=0.005
  Bin [0.11, 0.17): count=  358, weight=0.007
  Bin [0.17, 0.22): count=  477, weight=0.005
  Bin [0.22, 0.28): count=  179, weight=0.014
  Bin [0.28, 0.33): count=  133, weight=0.019
  Bin [0.33, 0.39): count=   39, weight=0.064
  Bin [0.39, 0.44): count=   20, weight=0.122
  Bin [0.44, 0.50): count=   10, weight=0.233
  Bin [0.50, 0.56): count=    6, weight=0.366
  Bin [0.56, 0.61): count=    4, weight=0.512
  Bin [0.61, 0.67): count=    0, weight=2.561
  Bin [0.67, 0.72): count=    1, weight=1.281
  Bin [0.72, 0.78): count=    0, weight=2.561
  Bin [0.78, 0.83): count=    0, weight=2.561
  Bin [0.83, 0.89): count=    0, weight=2.561
  Bin [0.89, 0.94): count=    0, weight=2.561
  Bin [0.94, 1.00): count=    0, weight=2.561
-------------------------------------------

  Pred range: [0.0496, 0.3838], std: 0.0584
  RMSE : 0.0924, R2: 0.1555, MAE: 0.0738, Spearman rho: 0.4393, Spearman p: 1.3049e-29, Pearson r: 0.4500, Pearson p: 3.6881e-31
  Pred range: [0.0456, 0.4100], std: 0.0573
  RMSE : 0.0938, R2: 0.1306, MAE: 0.0759, Spearman rho: 0.4619, Spearman p: 6.1158e-33, Pearson r: 0.4700, Pearson p: 3.4619e-34
  Pred range: [0.0322, 0.3451], std: 0.0537
  RMSE : 0.0880, R2: 0.2342, MAE: 0.0696, Spearman rho: 0.4773, Spearman p: 2.3801e-35, Pearson r: 0.4863, Pearson p: 8.1718e-37
  Pred range: [0.0638, 0.3994], std: 0.0555
  RMSE : 0.0957, R2: 0.0956, MAE: 0.0777, Spearman rho: 0.4473, Spearman p: 9.3018e-31, Pearson r: 0.4526, Pearson p: 1.5573e-31
  Pred range: [0.0317, 0.3852], std: 0.0595
  RMSE : 0.0931, R2: 0.1435, MAE: 0.0751, Spearman rho: 0.4691, Spearman p: 4.7413e-34, Pearson r: 0.4770, Pearson p: 2.5953e-35
  Pred range: [0.0612, 0.3874], std: 0.0584
  RMSE : 0.0960, R2: 0.0888, MAE: 0.0780, Spearman rho: 0.4690, Spearman p: 4.8909e-34, Pearson r: 0.4776, Pearson p: 2.1540e-35
[I 2026-04-27 16:27:32,035] Trial 9 finished with value: 0.08803266597627345 and parameters: {'learning_rate': 0.0009621856356680918, 'batch_size': 4, 'num_epochs': 21, 'weight_decay': 0.0003732041444908443, 'layers_PRS': 1, 'layers_SCZ15': 5, 'layers_ADHD9': 3, 'layers_ASD9': 3, 'layers_ACE15': 4, 'layers_ACE18': 4, 'layers_SUD18': 6, 'layers_SES': 4, 'layers_SEX': 3, 'dropout': 0.2227051622730727, 'se_reduction': 8, 'hidden_dim_min': 2, 'base_loss': 'huber', 'huber_delta': 0.013677825596186834, 'focal_gamma': 0.7165053820845673, 'n_bins': 18, 'scheduler_patience': 4, 'scheduler_factor': 0.6695884336276172, 'early_stopping_patience': 3}. Best is trial 9 with value: 0.08803266597627345.
Train: 2407 rows (1613 IDs),Test: 598 rows (404 IDs) 

n_features_x : 6, n_features_per_modality: [16, 23, 19, 17, 7, 4, 4, 4, 1, 4]

--- ImbalancedRegressionLoss initialized ---
  Bins: 10, Focal gamma: 0.5282280428035186, Base loss: huber
  Bin [0.00, 0.10): count= 1010, weight=0.003
  Bin [0.10, 0.20): count=  866, weight=0.003
  Bin [0.20, 0.30): count=  386, weight=0.007
  Bin [0.30, 0.40): count=  111, weight=0.026
  Bin [0.40, 0.50): count=   23, weight=0.119
  Bin [0.50, 0.60): count=    9, weight=0.287
  Bin [0.60, 0.70): count=    2, weight=0.955
  Bin [0.70, 0.80): count=    0, weight=2.866
  Bin [0.80, 0.90): count=    0, weight=2.866
  Bin [0.90, 1.00): count=    0, weight=2.866
-------------------------------------------

  Pred range: [0.0640, 0.4659], std: 0.0643
  RMSE : 0.1093, R2: -0.1796, MAE: 0.0904, Spearman rho: 0.4513, Spearman p: 2.4188e-31, Pearson r: 0.4571, Pearson p: 3.2433e-32
  Pred range: [0.0397, 0.3403], std: 0.0512
  RMSE : 0.0909, R2: 0.1842, MAE: 0.0720, Spearman rho: 0.4298, Spearman p: 2.7605e-28, Pearson r: 0.4357, Pearson p: 4.2680e-29
  Pred range: [0.0131, 0.3366], std: 0.0604
  RMSE : 0.0914, R2: 0.1742, MAE: 0.0719, Spearman rho: 0.4336, Spearman p: 8.3688e-29, Pearson r: 0.4469, Pearson p: 1.0669e-30
  Pred range: [0.1032, 0.5613], std: 0.0763
  RMSE : 0.1545, R2: -1.3586, MAE: 0.1323, Spearman rho: 0.4456, Spearman p: 1.6591e-30, Pearson r: 0.4547, Pearson p: 7.4235e-32
  Pred range: [0.1083, 0.6357], std: 0.0772
  RMSE : 0.1525, R2: -1.2991, MAE: 0.1292, Spearman rho: 0.4290, Spearman p: 3.6434e-28, Pearson r: 0.4340, Pearson p: 7.4124e-29
[I 2026-04-27 16:27:40,655] Trial 10 finished with value: 0.09085826695981004 and parameters: {'learning_rate': 0.007634895857142566, 'batch_size': 32, 'num_epochs': 22, 'weight_decay': 0.0022116768208452872, 'layers_PRS': 4, 'layers_SCZ15': 7, 'layers_ADHD9': 2, 'layers_ASD9': 7, 'layers_ACE15': 5, 'layers_ACE18': 3, 'layers_SUD18': 6, 'layers_SES': 1, 'layers_SEX': 1, 'dropout': 0.23768999453755535, 'se_reduction': 8, 'hidden_dim_min': 7, 'base_loss': 'huber', 'huber_delta': 0.012700605193453215, 'focal_gamma': 0.5282280428035186, 'n_bins': 10, 'scheduler_patience': 3, 'scheduler_factor': 0.6998907018366458, 'early_stopping_patience': 3}. Best is trial 9 with value: 0.08803266597627345.
Train: 2407 rows (1613 IDs),Test: 598 rows (404 IDs) 

n_features_x : 6, n_features_per_modality: [16, 23, 19, 17, 7, 4, 4, 4, 1, 4]

--- ImbalancedRegressionLoss initialized ---
  Bins: 10, Focal gamma: 1.9509062026135258, Base loss: huber
  Bin [0.00, 0.10): count= 1010, weight=0.003
  Bin [0.10, 0.20): count=  866, weight=0.003
  Bin [0.20, 0.30): count=  386, weight=0.007
  Bin [0.30, 0.40): count=  111, weight=0.026
  Bin [0.40, 0.50): count=   23, weight=0.119
  Bin [0.50, 0.60): count=    9, weight=0.287
  Bin [0.60, 0.70): count=    2, weight=0.955
  Bin [0.70, 0.80): count=    0, weight=2.866
  Bin [0.80, 0.90): count=    0, weight=2.866
  Bin [0.90, 1.00): count=    0, weight=2.866
-------------------------------------------

  Pred range: [-0.0931, 0.2814], std: 0.0430
  RMSE : 0.0961, R2: 0.0870, MAE: 0.0749, Spearman rho: 0.3818, Spearman p: 3.4544e-22, Pearson r: 0.3479, Pearson p: 1.8540e-18
  Pred range: [0.0492, 0.3809], std: 0.0492
  RMSE : 0.0922, R2: 0.1599, MAE: 0.0749, Spearman rho: 0.4310, Spearman p: 1.9080e-28, Pearson r: 0.4356, Pearson p: 4.4259e-29
  Pred range: [0.0539, 0.2556], std: 0.0374
  RMSE : 0.0930, R2: 0.1454, MAE: 0.0738, Spearman rho: 0.3933, Spearman p: 1.4829e-23, Pearson r: 0.4014, Pearson p: 1.4884e-24
  Pred range: [0.0415, 0.4951], std: 0.0657
  RMSE : 0.0942, R2: 0.1229, MAE: 0.0744, Spearman rho: 0.4377, Spearman p: 2.2473e-29, Pearson r: 0.4446, Pearson p: 2.3214e-30
  Pred range: [-0.0364, 0.4427], std: 0.0533
  RMSE : 0.0931, R2: 0.1430, MAE: 0.0752, Spearman rho: 0.4402, Spearman p: 9.8570e-30, Pearson r: 0.4261, Pearson p: 9.0774e-28
[I 2026-04-27 16:28:30,699] Trial 11 finished with value: 0.09220180077273363 and parameters: {'learning_rate': 0.005229612955826336, 'batch_size': 4, 'num_epochs': 29, 'weight_decay': 6.326457782742073e-05, 'layers_PRS': 1, 'layers_SCZ15': 5, 'layers_ADHD9': 3, 'layers_ASD9': 4, 'layers_ACE15': 3, 'layers_ACE18': 4, 'layers_SUD18': 6, 'layers_SES': 7, 'layers_SEX': 2, 'dropout': 0.4748078377963224, 'se_reduction': 7, 'hidden_dim_min': 2, 'base_loss': 'huber', 'huber_delta': 0.04246815078266483, 'focal_gamma': 1.9509062026135258, 'n_bins': 10, 'scheduler_patience': 4, 'scheduler_factor': 0.69622917379275, 'early_stopping_patience': 3}. Best is trial 9 with value: 0.08803266597627345.
Train: 2407 rows (1613 IDs),Test: 598 rows (404 IDs) 

n_features_x : 6, n_features_per_modality: [16, 23, 19, 17, 7, 4, 4, 4, 1, 4]

--- ImbalancedRegressionLoss initialized ---
  Bins: 12, Focal gamma: 2.840963041611864, Base loss: huber
  Bin [0.00, 0.08): count=  828, weight=0.003
  Bin [0.08, 0.17): count=  710, weight=0.004
  Bin [0.17, 0.25): count=  575, weight=0.005
  Bin [0.25, 0.33): count=  214, weight=0.013
  Bin [0.33, 0.42): count=   55, weight=0.051
  Bin [0.42, 0.50): count=   14, weight=0.191
  Bin [0.50, 0.58): count=    9, weight=0.286
  Bin [0.58, 0.67): count=    1, weight=1.431
  Bin [0.67, 0.75): count=    1, weight=1.431
  Bin [0.75, 0.83): count=    0, weight=2.862
  Bin [0.83, 0.92): count=    0, weight=2.862
  Bin [0.92, 1.00): count=    0, weight=2.862
-------------------------------------------

  Pred range: [0.0430, 0.3315], std: 0.0470
  RMSE : 0.0973, R2: 0.0644, MAE: 0.0781, Spearman rho: 0.3320, Spearman p: 7.4656e-17, Pearson r: 0.3285, Pearson p: 1.6274e-16
  Pred range: [0.0454, 0.3749], std: 0.0484
  RMSE : 0.0952, R2: 0.1043, MAE: 0.0772, Spearman rho: 0.3903, Spearman p: 3.4119e-23, Pearson r: 0.3925, Pearson p: 1.8454e-23
  Pred range: [0.0443, 0.3682], std: 0.0458
  RMSE : 0.0918, R2: 0.1673, MAE: 0.0739, Spearman rho: 0.4230, Spearman p: 2.3155e-27, Pearson r: 0.4255, Pearson p: 1.0949e-27
  Pred range: [0.0465, 0.3766], std: 0.0477
  RMSE : 0.0908, R2: 0.1860, MAE: 0.0728, Spearman rho: 0.4406, Spearman p: 8.4651e-30, Pearson r: 0.4418, Pearson p: 5.7370e-30
  Pred range: [0.0491, 0.3833], std: 0.0488
  RMSE : 0.0905, R2: 0.1903, MAE: 0.0727, Spearman rho: 0.4480, Spearman p: 7.2905e-31, Pearson r: 0.4480, Pearson p: 7.2857e-31
  Pred range: [0.0539, 0.3695], std: 0.0461
  RMSE : 0.0900, R2: 0.2001, MAE: 0.0723, Spearman rho: 0.4564, Spearman p: 4.2706e-32, Pearson r: 0.4560, Pearson p: 4.8248e-32
  Pred range: [0.0533, 0.3739], std: 0.0487
  RMSE : 0.0902, R2: 0.1965, MAE: 0.0723, Spearman rho: 0.4545, Spearman p: 8.0285e-32, Pearson r: 0.4537, Pearson p: 1.0455e-31
  Pred range: [0.0654, 0.3992], std: 0.0497
  RMSE : 0.0929, R2: 0.1473, MAE: 0.0755, Spearman rho: 0.4606, Spearman p: 9.7386e-33, Pearson r: 0.4609, Pearson p: 8.8421e-33
  Pred range: [0.0513, 0.3699], std: 0.0478
  RMSE : 0.0892, R2: 0.2136, MAE: 0.0713, Spearman rho: 0.4673, Spearman p: 9.1326e-34, Pearson r: 0.4680, Pearson p: 7.0308e-34
  Pred range: [0.0515, 0.3782], std: 0.0502
  RMSE : 0.0902, R2: 0.1966, MAE: 0.0724, Spearman rho: 0.4571, Spearman p: 3.2437e-32, Pearson r: 0.4588, Pearson p: 1.8051e-32
  Pred range: [0.0511, 0.3739], std: 0.0513
  RMSE : 0.0899, R2: 0.2012, MAE: 0.0720, Spearman rho: 0.4615, Spearman p: 7.1603e-33, Pearson r: 0.4627, Pearson p: 4.6389e-33
  Pred range: [0.0518, 0.3648], std: 0.0493
  RMSE : 0.0906, R2: 0.1888, MAE: 0.0731, Spearman rho: 0.4548, Spearman p: 7.2473e-32, Pearson r: 0.4596, Pearson p: 1.3859e-32
  Pred range: [0.0399, 0.3529], std: 0.0483
  RMSE : 0.0894, R2: 0.2110, MAE: 0.0713, Spearman rho: 0.4558, Spearman p: 5.1212e-32, Pearson r: 0.4608, Pearson p: 9.0642e-33
[I 2026-04-27 16:30:29,295] Trial 12 finished with value: 0.08920979742171381 and parameters: {'learning_rate': 0.00011141199073220388, 'batch_size': 4, 'num_epochs': 22, 'weight_decay': 1.349261874121319e-05, 'layers_PRS': 2, 'layers_SCZ15': 1, 'layers_ADHD9': 3, 'layers_ASD9': 3, 'layers_ACE15': 3, 'layers_ACE18': 5, 'layers_SUD18': 7, 'layers_SES': 5, 'layers_SEX': 3, 'dropout': 0.17913009590035378, 'se_reduction': 7, 'hidden_dim_min': 6, 'base_loss': 'huber', 'huber_delta': 0.13115798816727764, 'focal_gamma': 2.840963041611864, 'n_bins': 12, 'scheduler_patience': 3, 'scheduler_factor': 0.5758318308296015, 'early_stopping_patience': 4}. Best is trial 9 with value: 0.08803266597627345.
Train: 2407 rows (1613 IDs),Test: 598 rows (404 IDs) 

n_features_x : 6, n_features_per_modality: [16, 23, 19, 17, 7, 4, 4, 4, 1, 4]

--- ImbalancedRegressionLoss initialized ---
  Bins: 14, Focal gamma: 0.9570993257244832, Base loss: huber
  Bin [0.00, 0.07): count=  828, weight=0.003
  Bin [0.07, 0.14): count=  542, weight=0.005
  Bin [0.14, 0.21): count=  506, weight=0.005
  Bin [0.21, 0.29): count=  386, weight=0.007
  Bin [0.29, 0.36): count=   91, weight=0.029
  Bin [0.36, 0.43): count=   29, weight=0.090
  Bin [0.43, 0.50): count=   12, weight=0.207
  Bin [0.50, 0.57): count=   11, weight=0.224
  Bin [0.57, 0.64): count=    1, weight=1.343
  Bin [0.64, 0.71): count=    1, weight=1.343
  Bin [0.71, 0.79): count=    0, weight=2.686
  Bin [0.79, 0.86): count=    0, weight=2.686
  Bin [0.86, 0.93): count=    0, weight=2.686
  Bin [0.93, 1.00): count=    0, weight=2.686
-------------------------------------------

  Pred range: [0.0550, 0.3915], std: 0.0514
  RMSE : 0.0929, R2: 0.1473, MAE: 0.0747, Spearman rho: 0.4377, Spearman p: 2.2306e-29, Pearson r: 0.4378, Pearson p: 2.1198e-29
  Pred range: [0.0062, 0.4121], std: 0.0601
  RMSE : 0.0922, R2: 0.1598, MAE: 0.0732, Spearman rho: 0.4484, Spearman p: 6.3947e-31, Pearson r: 0.4513, Pearson p: 2.3749e-31
  Pred range: [0.0508, 0.4209], std: 0.0554
  RMSE : 0.0921, R2: 0.1615, MAE: 0.0723, Spearman rho: 0.4382, Spearman p: 1.8583e-29, Pearson r: 0.4237, Pearson p: 1.8632e-27
  Pred range: [0.0242, 0.3691], std: 0.0592
  RMSE : 0.0917, R2: 0.1696, MAE: 0.0735, Spearman rho: 0.4504, Spearman p: 3.2539e-31, Pearson r: 0.4556, Pearson p: 5.5190e-32
  Pred range: [0.0611, 0.3925], std: 0.0516
  RMSE : 0.0956, R2: 0.0976, MAE: 0.0779, Spearman rho: 0.4622, Spearman p: 5.5973e-33, Pearson r: 0.4618, Pearson p: 6.4714e-33
  Pred range: [-0.0140, 0.3011], std: 0.0515
  RMSE : 0.0901, R2: 0.1969, MAE: 0.0705, Spearman rho: 0.4682, Spearman p: 6.6026e-34, Pearson r: 0.4714, Pearson p: 2.0604e-34
  Pred range: [-0.0263, 0.3271], std: 0.0467
  RMSE : 0.0907, R2: 0.1874, MAE: 0.0732, Spearman rho: 0.4373, Spearman p: 2.5313e-29, Pearson r: 0.4395, Pearson p: 1.2277e-29
  Pred range: [-0.0291, 0.3512], std: 0.0549
  RMSE : 0.0909, R2: 0.1829, MAE: 0.0728, Spearman rho: 0.4661, Spearman p: 1.3740e-33, Pearson r: 0.4656, Pearson p: 1.6471e-33
  Pred range: [0.0346, 0.3879], std: 0.0597
  RMSE : 0.0913, R2: 0.1770, MAE: 0.0724, Spearman rho: 0.4438, Spearman p: 2.9881e-30, Pearson r: 0.4471, Pearson p: 9.9794e-31
  Pred range: [0.0293, 0.3782], std: 0.0542
  RMSE : 0.0943, R2: 0.1220, MAE: 0.0763, Spearman rho: 0.4415, Spearman p: 6.3193e-30, Pearson r: 0.4575, Pearson p: 2.8745e-32
