[I 2026-04-29 01:37:35,126] Trial 34 pruned. 
Train: 2407 rows (1613 IDs),Test: 598 rows (404 IDs) 

n_features_x : 6, n_features_per_modality: [16, 23, 19, 17, 7, 4, 4, 4, 1, 4]

--- ImbalancedRegressionLoss initialized ---
  Bins: 6, Focal gamma: 2.3580799711413936, Base loss: huber
  Bin [0.00, 0.17): count=  961, weight=0.041
  Bin [0.17, 0.33): count=  848, weight=0.047
  Bin [0.33, 0.50): count=  353, weight=0.112
  Bin [0.50, 0.67): count=  176, weight=0.224
  Bin [0.67, 0.83): count=   62, weight=0.628
  Bin [0.83, 1.00): count=    7, weight=4.948
-------------------------------------------

  Pred range: [0.1313, 0.5753], std: 0.0779
  RMSE : 0.1617, R2: 0.1275, MAE: 0.1333, Spearman rho: 0.4469, Spearman p: 1.0655e-30, Pearson r: 0.4608, Pearson p: 9.1920e-33
  Pred range: [0.1091, 0.5840], std: 0.0830
  RMSE : 0.1547, R2: 0.2016, MAE: 0.1253, Spearman rho: 0.4785, Spearman p: 1.5026e-35, Pearson r: 0.4897, Pearson p: 2.2023e-37
  Pred range: [0.0726, 0.5089], std: 0.0801
  RMSE : 0.1501, R2: 0.2477, MAE: 0.1155, Spearman rho: 0.4889, Spearman p: 2.9323e-37, Pearson r: 0.5016, Pearson p: 1.9698e-39
  Pred range: [0.0994, 0.5986], std: 0.0889
  RMSE : 0.1576, R2: 0.1714, MAE: 0.1296, Spearman rho: 0.4928, Spearman p: 6.5601e-38, Pearson r: 0.5031, Pearson p: 1.1162e-39
  Pred range: [0.0944, 0.5934], std: 0.0874
  RMSE : 0.1541, R2: 0.2073, MAE: 0.1256, Spearman rho: 0.4934, Spearman p: 5.2309e-38, Pearson r: 0.5073, Pearson p: 1.9646e-40
  Pred range: [0.1010, 0.6249], std: 0.0934
  RMSE : 0.1587, R2: 0.1591, MAE: 0.1312, Spearman rho: 0.4999, Spearman p: 3.9714e-39, Pearson r: 0.5121, Pearson p: 2.7261e-41
  Pred range: [0.0647, 0.5562], std: 0.0875
  RMSE : 0.1496, R2: 0.2525, MAE: 0.1194, Spearman rho: 0.4972, Spearman p: 1.1434e-38, Pearson r: 0.5131, Pearson p: 1.8273e-41
  Pred range: [0.0713, 0.5523], std: 0.0865
  RMSE : 0.1502, R2: 0.2472, MAE: 0.1202, Spearman rho: 0.4965, Spearman p: 1.5215e-38, Pearson r: 0.5111, Pearson p: 4.2213e-41
  Pred range: [0.0811, 0.5715], std: 0.0871
  RMSE : 0.1530, R2: 0.2191, MAE: 0.1244, Spearman rho: 0.4946, Spearman p: 3.1864e-38, Pearson r: 0.5091, Pearson p: 9.4714e-41
  Pred range: [0.0461, 0.5131], std: 0.0863
  RMSE : 0.1483, R2: 0.2661, MAE: 0.1147, Spearman rho: 0.5022, Spearman p: 1.5526e-39, Pearson r: 0.5178, Pearson p: 2.5027e-42
  Pred range: [0.0593, 0.5594], std: 0.0900
  RMSE : 0.1502, R2: 0.2471, MAE: 0.1202, Spearman rho: 0.5023, Spearman p: 1.5449e-39, Pearson r: 0.5151, Pearson p: 7.8585e-42
  Pred range: [0.0693, 0.5813], std: 0.0929
  RMSE : 0.1528, R2: 0.2202, MAE: 0.1244, Spearman rho: 0.4990, Spearman p: 5.7927e-39, Pearson r: 0.5157, Pearson p: 6.1545e-42
  Pred range: [0.0608, 0.5930], std: 0.0942
  RMSE : 0.1511, R2: 0.2380, MAE: 0.1216, Spearman rho: 0.4999, Spearman p: 4.0164e-39, Pearson r: 0.5158, Pearson p: 5.9051e-42
  Pred range: [0.0825, 0.6708], std: 0.1015
  RMSE : 0.1668, R2: 0.0716, MAE: 0.1393, Spearman rho: 0.4977, Spearman p: 9.4991e-39, Pearson r: 0.5149, Pearson p: 8.4666e-42
  Pred range: [0.0430, 0.5508], std: 0.0877
  RMSE : 0.1493, R2: 0.2563, MAE: 0.1184, Spearman rho: 0.4943, Spearman p: 3.6643e-38, Pearson r: 0.5115, Pearson p: 3.5742e-41
  Pred range: [0.0741, 0.5679], std: 0.0883
  RMSE : 0.1510, R2: 0.2388, MAE: 0.1218, Spearman rho: 0.4963, Spearman p: 1.6429e-38, Pearson r: 0.5128, Pearson p: 2.0310e-41
[I 2026-04-29 01:39:50,274] Trial 35 finished with value: 0.14828249718771663 and parameters: {'learning_rate': 0.0005612239698890053, 'batch_size': 4, 'num_epochs': 17, 'weight_decay': 0.0021287671241259944, 'layers_PRS': 4, 'layers_SCZ15': 1, 'layers_ADHD9': 3, 'layers_ASD9': 3, 'layers_ACE15': 3, 'layers_ACE18': 4, 'layers_SUD18': 4, 'layers_SES': 4, 'layers_SEX': 2, 'dropout': 0.16661646377244627, 'se_reduction': 4, 'hidden_dim_min': 16, 'base_loss': 'huber', 'huber_delta': 0.07036973928004242, 'focal_gamma': 2.3580799711413936, 'n_bins': 6, 'scheduler_patience': 5, 'scheduler_factor': 0.6665989953904287, 'early_stopping_patience': 6}. Best is trial 35 with value: 0.14828249718771663.
Train: 2407 rows (1613 IDs),Test: 598 rows (404 IDs) 

n_features_x : 6, n_features_per_modality: [16, 23, 19, 17, 7, 4, 4, 4, 1, 4]

--- ImbalancedRegressionLoss initialized ---
  Bins: 6, Focal gamma: 2.3203935704112695, Base loss: huber
  Bin [0.00, 0.17): count=  961, weight=0.041
  Bin [0.17, 0.33): count=  848, weight=0.047
  Bin [0.33, 0.50): count=  353, weight=0.112
  Bin [0.50, 0.67): count=  176, weight=0.224
  Bin [0.67, 0.83): count=   62, weight=0.628
  Bin [0.83, 1.00): count=    7, weight=4.948
-------------------------------------------

  Pred range: [0.1851, 0.5783], std: 0.0647
  RMSE : 0.1821, R2: -0.1072, MAE: 0.1550, Spearman rho: 0.3346, Spearman p: 4.1036e-17, Pearson r: 0.3616, Pearson p: 6.5758e-20
  Pred range: [0.1693, 0.5693], std: 0.0660
  RMSE : 0.1708, R2: 0.0262, MAE: 0.1440, Spearman rho: 0.3897, Spearman p: 3.9781e-23, Pearson r: 0.4134, Pearson p: 4.3804e-26
  Pred range: [0.1648, 0.5847], std: 0.0694
  RMSE : 0.1679, R2: 0.0588, MAE: 0.1412, Spearman rho: 0.4237, Spearman p: 1.8740e-27, Pearson r: 0.4417, Pearson p: 5.9382e-30
  Pred range: [0.1643, 0.6177], std: 0.0750
  RMSE : 0.1695, R2: 0.0410, MAE: 0.1432, Spearman rho: 0.4446, Spearman p: 2.2638e-30, Pearson r: 0.4590, Pearson p: 1.7203e-32
  Pred range: [0.1530, 0.6136], std: 0.0771
  RMSE : 0.1652, R2: 0.0892, MAE: 0.1387, Spearman rho: 0.4619, Spearman p: 6.1354e-33, Pearson r: 0.4710, Pearson p: 2.3791e-34
  Pred range: [0.1474, 0.6142], std: 0.0794
  RMSE : 0.1638, R2: 0.1048, MAE: 0.1372, Spearman rho: 0.4707, Spearman p: 2.6093e-34, Pearson r: 0.4797, Pearson p: 9.7797e-36
[I 2026-04-29 01:40:18,197] Trial 36 pruned. 
Train: 2407 rows (1613 IDs),Test: 598 rows (404 IDs) 

n_features_x : 6, n_features_per_modality: [16, 23, 19, 17, 7, 4, 4, 4, 1, 4]

--- ImbalancedRegressionLoss initialized ---
  Bins: 6, Focal gamma: 1.9690418364978095, Base loss: mse
  Bin [0.00, 0.17): count=  961, weight=0.041
  Bin [0.17, 0.33): count=  848, weight=0.047
  Bin [0.33, 0.50): count=  353, weight=0.112
  Bin [0.50, 0.67): count=  176, weight=0.224
  Bin [0.67, 0.83): count=   62, weight=0.628
  Bin [0.83, 1.00): count=    7, weight=4.948
-------------------------------------------

  Pred range: [0.1104, 0.5801], std: 0.0817
  RMSE : 0.1676, R2: 0.0629, MAE: 0.1405, Spearman rho: 0.4557, Spearman p: 5.4365e-32, Pearson r: 0.4723, Pearson p: 1.5098e-34
  Pred range: [0.0971, 0.5188], std: 0.0750
  RMSE : 0.1526, R2: 0.2229, MAE: 0.1232, Spearman rho: 0.4823, Spearman p: 3.6526e-36, Pearson r: 0.5005, Pearson p: 3.1180e-39
  Pred range: [0.1206, 0.5555], std: 0.0777
  RMSE : 0.1588, R2: 0.1580, MAE: 0.1322, Spearman rho: 0.4893, Spearman p: 2.5331e-37, Pearson r: 0.5055, Pearson p: 4.1429e-40
  Pred range: [0.0965, 0.5501], std: 0.0777
  RMSE : 0.1508, R2: 0.2409, MAE: 0.1208, Spearman rho: 0.4920, Spearman p: 8.8137e-38, Pearson r: 0.5093, Pearson p: 8.6275e-41
  Pred range: [0.1121, 0.5944], std: 0.0844
  RMSE : 0.1591, R2: 0.1554, MAE: 0.1325, Spearman rho: 0.4938, Spearman p: 4.5017e-38, Pearson r: 0.5105, Pearson p: 5.3743e-41
  Pred range: [0.0926, 0.5808], std: 0.0833
  RMSE : 0.1520, R2: 0.2290, MAE: 0.1231, Spearman rho: 0.4931, Spearman p: 5.7870e-38, Pearson r: 0.5113, Pearson p: 3.7857e-41
  Pred range: [0.1138, 0.5959], std: 0.0833
  RMSE : 0.1563, R2: 0.1842, MAE: 0.1291, Spearman rho: 0.4891, Spearman p: 2.6981e-37, Pearson r: 0.5103, Pearson p: 5.9034e-41
  Pred range: [0.0853, 0.5801], std: 0.0857
  RMSE : 0.1517, R2: 0.2323, MAE: 0.1228, Spearman rho: 0.4879, Spearman p: 4.4281e-37, Pearson r: 0.5119, Pearson p: 3.0459e-41
  Pred range: [0.1059, 0.5978], std: 0.0861
  RMSE : 0.1594, R2: 0.1521, MAE: 0.1326, Spearman rho: 0.4842, Spearman p: 1.7873e-36, Pearson r: 0.5084, Pearson p: 1.2672e-40
  Pred range: [0.0708, 0.5525], std: 0.0818
  RMSE : 0.1526, R2: 0.2230, MAE: 0.1238, Spearman rho: 0.4763, Spearman p: 3.4288e-35, Pearson r: 0.5024, Pearson p: 1.4458e-39
  Pred range: [0.0815, 0.5956], std: 0.0873
  RMSE : 0.1580, R2: 0.1668, MAE: 0.1309, Spearman rho: 0.4837, Spearman p: 2.1590e-36, Pearson r: 0.5073, Pearson p: 1.9697e-40
  Pred range: [0.0842, 0.5793], std: 0.0874
  RMSE : 0.1554, R2: 0.1943, MAE: 0.1278, Spearman rho: 0.4853, Spearman p: 1.1952e-36, Pearson r: 0.5098, Pearson p: 7.0466e-41
[I 2026-04-29 01:42:03,099] Trial 37 finished with value: 0.15080490272679337 and parameters: {'learning_rate': 0.0005252794906025994, 'batch_size': 4, 'num_epochs': 19, 'weight_decay': 0.0025086243186190054, 'layers_PRS': 4, 'layers_SCZ15': 1, 'layers_ADHD9': 3, 'layers_ASD9': 3, 'layers_ACE15': 3, 'layers_ACE18': 5, 'layers_SUD18': 4, 'layers_SES': 4, 'layers_SEX': 2, 'dropout': 0.33939137411209247, 'se_reduction': 4, 'hidden_dim_min': 15, 'base_loss': 'mse', 'huber_delta': 0.05201763270423919, 'focal_gamma': 1.9690418364978095, 'n_bins': 6, 'scheduler_patience': 5, 'scheduler_factor': 0.6624548200257342, 'early_stopping_patience': 8}. Best is trial 35 with value: 0.14828249718771663.
Train: 2407 rows (1613 IDs),Test: 598 rows (404 IDs) 

n_features_x : 6, n_features_per_modality: [16, 23, 19, 17, 7, 4, 4, 4, 1, 4]

--- ImbalancedRegressionLoss initialized ---
  Bins: 5, Focal gamma: 2.9819517197924146, Base loss: mse
  Bin [0.00, 0.20): count= 1165, weight=0.037
  Bin [0.20, 0.40): count=  806, weight=0.054
  Bin [0.40, 0.60): count=  320, weight=0.136
  Bin [0.60, 0.80): count=  107, weight=0.404
  Bin [0.80, 1.00): count=    9, weight=4.368
-------------------------------------------

  Pred range: [0.1479, 0.5463], std: 0.0691
  RMSE : 0.1721, R2: 0.0108, MAE: 0.1456, Spearman rho: 0.4250, Spearman p: 1.2545e-27, Pearson r: 0.4301, Pearson p: 2.5131e-28
  Pred range: [0.1587, 0.5615], std: 0.0728
  RMSE : 0.1758, R2: -0.0316, MAE: 0.1499, Spearman rho: 0.4522, Spearman p: 1.8007e-31, Pearson r: 0.4643, Pearson p: 2.6051e-33
  Pred range: [0.1337, 0.5689], std: 0.0771
  RMSE : 0.1651, R2: 0.0897, MAE: 0.1391, Spearman rho: 0.4743, Spearman p: 7.0845e-35, Pearson r: 0.4858, Pearson p: 9.7323e-37
  Pred range: [0.1203, 0.5159], std: 0.0733
  RMSE : 0.1553, R2: 0.1951, MAE: 0.1274, Spearman rho: 0.4841, Spearman p: 1.8359e-36, Pearson r: 0.5000, Pearson p: 3.7863e-39
  Pred range: [0.1243, 0.5446], std: 0.0788
  RMSE : 0.1573, R2: 0.1738, MAE: 0.1302, Spearman rho: 0.4891, Spearman p: 2.7515e-37, Pearson r: 0.5042, Pearson p: 6.9719e-40
  Pred range: [0.1184, 0.5413], std: 0.0779
  RMSE : 0.1565, R2: 0.1826, MAE: 0.1293, Spearman rho: 0.4867, Spearman p: 6.8075e-37, Pearson r: 0.5048, Pearson p: 5.4801e-40
  Pred range: [0.0846, 0.5039], std: 0.0749
  RMSE : 0.1499, R2: 0.2496, MAE: 0.1188, Spearman rho: 0.4861, Spearman p: 8.5924e-37, Pearson r: 0.5078, Pearson p: 1.6119e-40
  Pred range: [0.0776, 0.5164], std: 0.0752
  RMSE : 0.1508, R2: 0.2414, MAE: 0.1205, Spearman rho: 0.4841, Spearman p: 1.8675e-36, Pearson r: 0.5039, Pearson p: 8.1141e-40
  Pred range: [0.1166, 0.5667], std: 0.0815
  RMSE : 0.1568, R2: 0.1792, MAE: 0.1297, Spearman rho: 0.4899, Spearman p: 2.0326e-37, Pearson r: 0.5105, Pearson p: 5.3235e-41
  Pred range: [0.0968, 0.5440], std: 0.0797
  RMSE : 0.1524, R2: 0.2248, MAE: 0.1241, Spearman rho: 0.4893, Spearman p: 2.5696e-37, Pearson r: 0.5115, Pearson p: 3.4775e-41
  Pred range: [0.1147, 0.5785], std: 0.0823
  RMSE : 0.1610, R2: 0.1348, MAE: 0.1347, Spearman rho: 0.4898, Spearman p: 2.1115e-37, Pearson r: 0.5115, Pearson p: 3.5882e-41
  Pred range: [0.1274, 0.5992], std: 0.0829
  RMSE : 0.1666, R2: 0.0734, MAE: 0.1412, Spearman rho: 0.4820, Spearman p: 4.1665e-36, Pearson r: 0.5102, Pearson p: 6.1727e-41
  Pred range: [0.0701, 0.5428], std: 0.0808
  RMSE : 0.1506, R2: 0.2427, MAE: 0.1217, Spearman rho: 0.4911, Spearman p: 1.2561e-37, Pearson r: 0.5161, Pearson p: 5.1007e-42
[I 2026-04-29 01:43:54,948] Trial 38 finished with value: 0.14993474032457055 and parameters: {'learning_rate': 0.0005448834401424862, 'batch_size': 4, 'num_epochs': 18, 'weight_decay': 0.008796068269017568, 'layers_PRS': 4, 'layers_SCZ15': 1, 'layers_ADHD9': 3, 'layers_ASD9': 2, 'layers_ACE15': 3, 'layers_ACE18': 4, 'layers_SUD18': 5, 'layers_SES': 5, 'layers_SEX': 2, 'dropout': 0.38303534576695886, 'se_reduction': 5, 'hidden_dim_min': 13, 'base_loss': 'mse', 'huber_delta': 0.1088054614434755, 'focal_gamma': 2.9819517197924146, 'n_bins': 5, 'scheduler_patience': 5, 'scheduler_factor': 0.6151982727364242, 'early_stopping_patience': 6}. Best is trial 35 with value: 0.14828249718771663.
Train: 2407 rows (1613 IDs),Test: 598 rows (404 IDs) 

n_features_x : 6, n_features_per_modality: [16, 23, 19, 17, 7, 4, 4, 4, 1, 4]

--- ImbalancedRegressionLoss initialized ---
  Bins: 7, Focal gamma: 2.6782255316207255, Base loss: huber
  Bin [0.00, 0.14): count=  760, weight=0.038
  Bin [0.14, 0.29): count=  826, weight=0.035
  Bin [0.29, 0.43): count=  454, weight=0.063
  Bin [0.43, 0.57): count=  215, weight=0.133
  Bin [0.57, 0.71): count=  110, weight=0.258
  Bin [0.71, 0.86): count=   38, weight=0.736
  Bin [0.86, 1.00): count=    4, weight=5.738
-------------------------------------------

  Pred range: [-0.1395, 0.1933], std: 0.0435
  RMSE : 0.3037, R2: -2.0784, MAE: 0.2490, Spearman rho: 0.0599, Spearman p: 1.4360e-01, Pearson r: 0.0775, Pearson p: 5.8125e-02
  Pred range: [0.0156, 0.5092], std: 0.0708
  RMSE : 0.1921, R2: -0.2319, MAE: 0.1398, Spearman rho: 0.1986, Spearman p: 9.8295e-07, Pearson r: 0.2157, Pearson p: 9.9474e-08
  Pred range: [0.1098, 0.7870], std: 0.0991
  RMSE : 0.1834, R2: -0.1228, MAE: 0.1488, Spearman rho: 0.2448, Spearman p: 1.3043e-09, Pearson r: 0.2619, Pearson p: 7.7543e-11
  Pred range: [0.1388, 0.8036], std: 0.1008
  RMSE : 0.1948, R2: -0.2660, MAE: 0.1614, Spearman rho: 0.2626, Spearman p: 6.9292e-11, Pearson r: 0.2785, Pearson p: 4.1020e-12
  Pred range: [0.1487, 0.7587], std: 0.0959
  RMSE : 0.1951, R2: -0.2704, MAE: 0.1632, Spearman rho: 0.2748, Spearman p: 8.0352e-12, Pearson r: 0.2901, Pearson p: 4.6826e-13
  Pred range: [0.1548, 0.7312], std: 0.0929
  RMSE : 0.1970, R2: -0.2958, MAE: 0.1662, Spearman rho: 0.2879, Spearman p: 7.0392e-13, Pearson r: 0.3018, Pearson p: 4.6098e-14
[I 2026-04-29 01:44:03,138] Trial 39 pruned. 
Train: 2407 rows (1613 IDs),Test: 598 rows (404 IDs) 

n_features_x : 6, n_features_per_modality: [16, 23, 19, 17, 7, 4, 4, 4, 1, 4]

--- ImbalancedRegressionLoss initialized ---
  Bins: 8, Focal gamma: 2.040539922492071, Base loss: mse
  Bin [0.00, 0.12): count=  760, weight=0.039
  Bin [0.12, 0.25): count=  700, weight=0.042
  Bin [0.25, 0.38): count=  438, weight=0.067
  Bin [0.38, 0.50): count=  264, weight=0.111
  Bin [0.50, 0.62): count=  157, weight=0.186
  Bin [0.62, 0.75): count=   60, weight=0.483
  Bin [0.75, 0.88): count=   24, weight=1.179
  Bin [0.88, 1.00): count=    4, weight=5.893
-------------------------------------------

  Pred range: [0.1375, 0.5572], std: 0.0639
  RMSE : 0.1767, R2: -0.0427, MAE: 0.1493, Spearman rho: 0.3313, Spearman p: 8.7464e-17, Pearson r: 0.3477, Pearson p: 1.9413e-18
  Pred range: [0.1207, 0.5512], std: 0.0651
  RMSE : 0.1651, R2: 0.0898, MAE: 0.1381, Spearman rho: 0.4125, Spearman p: 5.6871e-26, Pearson r: 0.4310, Pearson p: 1.9138e-28
  Pred range: [0.1315, 0.6027], std: 0.0721
  RMSE : 0.1736, R2: -0.0064, MAE: 0.1482, Spearman rho: 0.4413, Spearman p: 6.8433e-30, Pearson r: 0.4591, Pearson p: 1.6446e-32
  Pred range: [0.1243, 0.6197], std: 0.0749
  RMSE : 0.1706, R2: 0.0286, MAE: 0.1450, Spearman rho: 0.4567, Spearman p: 3.7196e-32, Pearson r: 0.4733, Pearson p: 1.0343e-34
  Pred range: [0.0992, 0.5693], std: 0.0722
  RMSE : 0.1583, R2: 0.1634, MAE: 0.1312, Spearman rho: 0.4662, Spearman p: 1.3441e-33, Pearson r: 0.4825, Pearson p: 3.3829e-36
  Pred range: [0.1249, 0.6365], std: 0.0809
  RMSE : 0.1750, R2: -0.0219, MAE: 0.1494, Spearman rho: 0.4686, Spearman p: 5.5713e-34, Pearson r: 0.4849, Pearson p: 1.3639e-36
  Pred range: [0.1108, 0.6096], std: 0.0803
  RMSE : 0.1652, R2: 0.0894, MAE: 0.1393, Spearman rho: 0.4752, Spearman p: 5.1887e-35, Pearson r: 0.4911, Pearson p: 1.2542e-37
[I 2026-04-29 01:44:44,331] Trial 40 pruned. 
Train: 2407 rows (1613 IDs),Test: 598 rows (404 IDs) 

n_features_x : 6, n_features_per_modality: [16, 23, 19, 17, 7, 4, 4, 4, 1, 4]

--- ImbalancedRegressionLoss initialized ---
  Bins: 8, Focal gamma: 2.355594830007651, Base loss: huber
  Bin [0.00, 0.12): count=  760, weight=0.039
  Bin [0.12, 0.25): count=  700, weight=0.042
  Bin [0.25, 0.38): count=  438, weight=0.067
  Bin [0.38, 0.50): count=  264, weight=0.111
  Bin [0.50, 0.62): count=  157, weight=0.186
  Bin [0.62, 0.75): count=   60, weight=0.483
  Bin [0.75, 0.88): count=   24, weight=1.179
  Bin [0.88, 1.00): count=    4, weight=5.893
-------------------------------------------

  Pred range: [0.1047, 0.5532], std: 0.0749
  RMSE : 0.1564, R2: 0.1836, MAE: 0.1282, Spearman rho: 0.4662, Spearman p: 1.3431e-33, Pearson r: 0.4840, Pearson p: 1.9059e-36
  Pred range: [0.1496, 0.6536], std: 0.0900
  RMSE : 0.1805, R2: -0.0876, MAE: 0.1545, Spearman rho: 0.4850, Spearman p: 1.2935e-36, Pearson r: 0.4962, Pearson p: 1.7483e-38
  Pred range: [0.1168, 0.5802], std: 0.0872
  RMSE : 0.1572, R2: 0.1754, MAE: 0.1300, Spearman rho: 0.4952, Spearman p: 2.5825e-38, Pearson r: 0.5071, Pearson p: 2.1891e-40
  Pred range: [0.0812, 0.5735], std: 0.0852
  RMSE : 0.1535, R2: 0.2130, MAE: 0.1250, Spearman rho: 0.4864, Spearman p: 7.7378e-37, Pearson r: 0.5020, Pearson p: 1.7175e-39
  Pred range: [0.0821, 0.5794], std: 0.0930
  RMSE : 0.1536, R2: 0.2124, MAE: 0.1250, Spearman rho: 0.4972, Spearman p: 1.1403e-38, Pearson r: 0.5095, Pearson p: 8.0306e-41
  Pred range: [0.0180, 0.4845], std: 0.0811
  RMSE : 0.1513, R2: 0.2362, MAE: 0.1146, Spearman rho: 0.4878, Spearman p: 4.5498e-37, Pearson r: 0.5023, Pearson p: 1.5245e-39
  Pred range: [0.0815, 0.6053], std: 0.0924
  RMSE : 0.1624, R2: 0.1195, MAE: 0.1357, Spearman rho: 0.4959, Spearman p: 1.9556e-38, Pearson r: 0.5087, Pearson p: 1.1106e-40
  Pred range: [0.0585, 0.5650], std: 0.0921
  RMSE : 0.1545, R2: 0.2036, MAE: 0.1264, Spearman rho: 0.4948, Spearman p: 2.9317e-38, Pearson r: 0.5108, Pearson p: 4.6831e-41
  Pred range: [0.0496, 0.5653], std: 0.0940
  RMSE : 0.1521, R2: 0.2277, MAE: 0.1230, Spearman rho: 0.4951, Spearman p: 2.6564e-38, Pearson r: 0.5111, Pearson p: 4.2429e-41
  Pred range: [0.0588, 0.5702], std: 0.0939
  RMSE : 0.1541, R2: 0.2072, MAE: 0.1256, Spearman rho: 0.4948, Spearman p: 2.9329e-38, Pearson r: 0.5127, Pearson p: 2.1544e-41
  Pred range: [0.0476, 0.5727], std: 0.0925
  RMSE : 0.1533, R2: 0.2151, MAE: 0.1248, Spearman rho: 0.4896, Spearman p: 2.2967e-37, Pearson r: 0.5087, Pearson p: 1.1227e-40
  Pred range: [0.0571, 0.5567], std: 0.0920
  RMSE : 0.1519, R2: 0.2299, MAE: 0.1228, Spearman rho: 0.4928, Spearman p: 6.4523e-38, Pearson r: 0.5120, Pearson p: 2.8906e-41
[I 2026-04-29 01:46:18,993] Trial 41 finished with value: 0.15126514687042436 and parameters: {'learning_rate': 0.0006710797407028345, 'batch_size': 4, 'num_epochs': 17, 'weight_decay': 0.0010782134353083132, 'layers_PRS': 3, 'layers_SCZ15': 1, 'layers_ADHD9': 3, 'layers_ASD9': 2, 'layers_ACE15': 4, 'layers_ACE18': 3, 'layers_SUD18': 3, 'layers_SES': 4, 'layers_SEX': 3, 'dropout': 0.1267053620148346, 'se_reduction': 5, 'hidden_dim_min': 12, 'base_loss': 'huber', 'huber_delta': 0.12656500914014873, 'focal_gamma': 2.355594830007651, 'n_bins': 8, 'scheduler_patience': 4, 'scheduler_factor': 0.6775996052955838, 'early_stopping_patience': 6}. Best is trial 35 with value: 0.14828249718771663.
Train: 2407 rows (1613 IDs),Test: 598 rows (404 IDs) 

n_features_x : 6, n_features_per_modality: [16, 23, 19, 17, 7, 4, 4, 4, 1, 4]

--- ImbalancedRegressionLoss initialized ---
  Bins: 7, Focal gamma: 2.7640361259376536, Base loss: huber
  Bin [0.00, 0.14): count=  760, weight=0.038
  Bin [0.14, 0.29): count=  826, weight=0.035
  Bin [0.29, 0.43): count=  454, weight=0.063
  Bin [0.43, 0.57): count=  215, weight=0.133
  Bin [0.57, 0.71): count=  110, weight=0.258
  Bin [0.71, 0.86): count=   38, weight=0.736
  Bin [0.86, 1.00): count=    4, weight=5.738
-------------------------------------------

  Pred range: [0.0482, 0.6074], std: 0.0748
  RMSE : 0.1649, R2: 0.0923, MAE: 0.1320, Spearman rho: 0.3085, Spearman p: 1.1795e-14, Pearson r: 0.3372, Pearson p: 2.3116e-17
  Pred range: [0.0753, 0.6468], std: 0.0774
  RMSE : 0.1698, R2: 0.0375, MAE: 0.1407, Spearman rho: 0.3426, Spearman p: 6.4868e-18, Pearson r: 0.3678, Pearson p: 1.3533e-20
  Pred range: [0.0706, 0.5954], std: 0.0736
  RMSE : 0.1631, R2: 0.1122, MAE: 0.1333, Spearman rho: 0.3664, Spearman p: 1.9618e-20, Pearson r: 0.3897, Pearson p: 4.0181e-23
  Pred range: [0.0773, 0.5898], std: 0.0739
  RMSE : 0.1622, R2: 0.1216, MAE: 0.1330, Spearman rho: 0.3853, Spearman p: 1.3304e-22, Pearson r: 0.4070, Pearson p: 2.9254e-25
  Pred range: [0.0799, 0.5864], std: 0.0742
  RMSE : 0.1606, R2: 0.1388, MAE: 0.1314, Spearman rho: 0.4001, Spearman p: 2.1210e-24, Pearson r: 0.4217, Pearson p: 3.5481e-27
  Pred range: [0.0809, 0.5921], std: 0.0750
  RMSE : 0.1594, R2: 0.1521, MAE: 0.1300, Spearman rho: 0.4113, Spearman p: 8.1670e-26, Pearson r: 0.4322, Pearson p: 1.2916e-28
