[I 2026-04-27 20:24:32,038] Trial 84 finished with value: 0.15031586683908174 and parameters: {'learning_rate': 0.0011162264496382556, 'batch_size': 4, 'num_epochs': 14, 'weight_decay': 5.16931191482559e-05, 'layers_PRS': 4, 'layers_SCZ15': 6, 'layers_ADHD9': 1, 'layers_ASD9': 7, 'layers_ACE15': 4, 'layers_ACE18': 6, 'layers_SUD18': 3, 'layers_SES': 3, 'layers_SEX': 6, 'dropout': 0.23959899442722937, 'se_reduction': 3, 'hidden_dim_min': 3, 'base_loss': 'huber', 'huber_delta': 0.19551649497453305, 'focal_gamma': 1.1504245567061715, 'n_bins': 19, 'scheduler_patience': 5, 'scheduler_factor': 0.5400832961270569, 'early_stopping_patience': 3}. Best is trial 81 with value: 0.14825416838187774.
Train: 2407 rows (1613 IDs),Test: 598 rows (404 IDs) 

n_features_x : 6, n_features_per_modality: [16, 23, 19, 17, 7, 4, 4, 4, 1, 4]

--- ImbalancedRegressionLoss initialized ---
  Bins: 17, Focal gamma: 1.315795817032698, Base loss: huber
  Bin [0.00, 0.06): count=  172, weight=0.058
  Bin [0.06, 0.12): count=  413, weight=0.024
  Bin [0.12, 0.18): count=  376, weight=0.027
  Bin [0.18, 0.24): count=  370, weight=0.027
  Bin [0.24, 0.29): count=  255, weight=0.039
  Bin [0.29, 0.35): count=  223, weight=0.045
  Bin [0.35, 0.41): count=  162, weight=0.061
  Bin [0.41, 0.47): count=  134, weight=0.074
  Bin [0.47, 0.53): count=  108, weight=0.092
  Bin [0.53, 0.59): count=   78, weight=0.127
  Bin [0.59, 0.65): count=   47, weight=0.208
  Bin [0.65, 0.71): count=   27, weight=0.357
  Bin [0.71, 0.76): count=   26, weight=0.370
  Bin [0.76, 0.82): count=    9, weight=0.999
  Bin [0.82, 0.88): count=    4, weight=1.999
  Bin [0.88, 0.94): count=    3, weight=2.499
  Bin [0.94, 1.00): count=    0, weight=9.995
-------------------------------------------

  Pred range: [0.0944, 0.6968], std: 0.1011
  RMSE : 0.1680, R2: 0.0583, MAE: 0.1398, Spearman rho: 0.4718, Spearman p: 1.7515e-34, Pearson r: 0.4805, Pearson p: 7.2696e-36
  Pred range: [0.0779, 0.6416], std: 0.0907
  RMSE : 0.1550, R2: 0.1982, MAE: 0.1260, Spearman rho: 0.4839, Spearman p: 1.9660e-36, Pearson r: 0.4983, Pearson p: 7.5023e-39
  Pred range: [0.0803, 0.5998], std: 0.0921
  RMSE : 0.1507, R2: 0.2417, MAE: 0.1207, Spearman rho: 0.4945, Spearman p: 3.3325e-38, Pearson r: 0.5101, Pearson p: 6.3451e-41
  Pred range: [0.0374, 0.6291], std: 0.1000
  RMSE : 0.1503, R2: 0.2460, MAE: 0.1180, Spearman rho: 0.4873, Spearman p: 5.4774e-37, Pearson r: 0.5037, Pearson p: 8.5235e-40
  Pred range: [0.0582, 0.6194], std: 0.0944
  RMSE : 0.1508, R2: 0.2412, MAE: 0.1204, Spearman rho: 0.4875, Spearman p: 5.0300e-37, Pearson r: 0.5058, Pearson p: 3.7167e-40
  Pred range: [0.0988, 0.6686], std: 0.1015
  RMSE : 0.1626, R2: 0.1174, MAE: 0.1350, Spearman rho: 0.4920, Spearman p: 9.0413e-38, Pearson r: 0.5104, Pearson p: 5.6730e-41
  Pred range: [0.0695, 0.6444], std: 0.0997
  RMSE : 0.1554, R2: 0.1937, MAE: 0.1271, Spearman rho: 0.4895, Spearman p: 2.3113e-37, Pearson r: 0.5114, Pearson p: 3.7387e-41
  Pred range: [0.0568, 0.6098], std: 0.0949
  RMSE : 0.1545, R2: 0.2034, MAE: 0.1259, Spearman rho: 0.4848, Spearman p: 1.4223e-36, Pearson r: 0.5051, Pearson p: 4.9312e-40
[I 2026-04-27 20:26:14,497] Trial 85 finished with value: 0.15029959586579958 and parameters: {'learning_rate': 0.0007725185722606423, 'batch_size': 4, 'num_epochs': 17, 'weight_decay': 0.0005278415760429501, 'layers_PRS': 5, 'layers_SCZ15': 7, 'layers_ADHD9': 1, 'layers_ASD9': 7, 'layers_ACE15': 3, 'layers_ACE18': 5, 'layers_SUD18': 2, 'layers_SES': 3, 'layers_SEX': 5, 'dropout': 0.21609430902189056, 'se_reduction': 3, 'hidden_dim_min': 4, 'base_loss': 'huber', 'huber_delta': 0.18515119322418827, 'focal_gamma': 1.315795817032698, 'n_bins': 17, 'scheduler_patience': 5, 'scheduler_factor': 0.587208875432711, 'early_stopping_patience': 4}. Best is trial 81 with value: 0.14825416838187774.
Train: 2407 rows (1613 IDs),Test: 598 rows (404 IDs) 

n_features_x : 6, n_features_per_modality: [16, 23, 19, 17, 7, 4, 4, 4, 1, 4]

--- ImbalancedRegressionLoss initialized ---
  Bins: 18, Focal gamma: 0.6165905191124867, Base loss: huber
  Bin [0.00, 0.06): count=  172, weight=0.058
  Bin [0.06, 0.11): count=  413, weight=0.024
  Bin [0.11, 0.17): count=  376, weight=0.027
  Bin [0.17, 0.22): count=  370, weight=0.027
  Bin [0.22, 0.28): count=  255, weight=0.040
  Bin [0.28, 0.33): count=  223, weight=0.045
  Bin [0.33, 0.39): count=   89, weight=0.112
  Bin [0.39, 0.44): count=  142, weight=0.071
  Bin [0.44, 0.50): count=  122, weight=0.082
  Bin [0.50, 0.56): count=   93, weight=0.108
  Bin [0.56, 0.61): count=   64, weight=0.156
  Bin [0.61, 0.67): count=   36, weight=0.273
  Bin [0.67, 0.72): count=   10, weight=0.920
  Bin [0.72, 0.78): count=   26, weight=0.375
  Bin [0.78, 0.83): count=    9, weight=1.012
  Bin [0.83, 0.89): count=    4, weight=2.023
  Bin [0.89, 0.94): count=    3, weight=2.529
  Bin [0.94, 1.00): count=    0, weight=10.117
-------------------------------------------

  Pred range: [0.1140, 0.6830], std: 0.0937
  RMSE : 0.1621, R2: 0.1226, MAE: 0.1338, Spearman rho: 0.4607, Spearman p: 9.4412e-33, Pearson r: 0.4767, Pearson p: 2.9539e-35
  Pred range: [0.1221, 0.8223], std: 0.1233
  RMSE : 0.1851, R2: -0.1438, MAE: 0.1549, Spearman rho: 0.4864, Spearman p: 7.7987e-37, Pearson r: 0.5006, Pearson p: 2.9836e-39
  Pred range: [0.0884, 0.6527], std: 0.1026
  RMSE : 0.1561, R2: 0.1869, MAE: 0.1271, Spearman rho: 0.4940, Spearman p: 4.0764e-38, Pearson r: 0.5111, Pearson p: 4.1739e-41
  Pred range: [0.0845, 0.6901], std: 0.1111
  RMSE : 0.1558, R2: 0.1898, MAE: 0.1258, Spearman rho: 0.4983, Spearman p: 7.4264e-39, Pearson r: 0.5154, Pearson p: 6.8664e-42
  Pred range: [0.1004, 0.7100], std: 0.1145
  RMSE : 0.1631, R2: 0.1119, MAE: 0.1334, Spearman rho: 0.4980, Spearman p: 8.3557e-39, Pearson r: 0.5128, Pearson p: 2.0280e-41
  Pred range: [0.1037, 0.7177], std: 0.1130
  RMSE : 0.1637, R2: 0.1055, MAE: 0.1339, Spearman rho: 0.4944, Spearman p: 3.5222e-38, Pearson r: 0.5106, Pearson p: 5.1778e-41
  Pred range: [0.1106, 0.7663], std: 0.1166
  RMSE : 0.1708, R2: 0.0266, MAE: 0.1409, Spearman rho: 0.4950, Spearman p: 2.7788e-38, Pearson r: 0.5107, Pearson p: 4.8541e-41
[I 2026-04-27 20:27:18,834] Trial 86 finished with value: 0.15579347675363953 and parameters: {'learning_rate': 0.00043100178060055466, 'batch_size': 6, 'num_epochs': 17, 'weight_decay': 7.113749082675146e-05, 'layers_PRS': 4, 'layers_SCZ15': 7, 'layers_ADHD9': 2, 'layers_ASD9': 6, 'layers_ACE15': 4, 'layers_ACE18': 6, 'layers_SUD18': 2, 'layers_SES': 3, 'layers_SEX': 5, 'dropout': 0.22663835177209696, 'se_reduction': 3, 'hidden_dim_min': 6, 'base_loss': 'huber', 'huber_delta': 0.1493547828150098, 'focal_gamma': 0.6165905191124867, 'n_bins': 18, 'scheduler_patience': 5, 'scheduler_factor': 0.4951243360741771, 'early_stopping_patience': 3}. Best is trial 81 with value: 0.14825416838187774.
Train: 2407 rows (1613 IDs),Test: 598 rows (404 IDs) 

n_features_x : 6, n_features_per_modality: [16, 23, 19, 17, 7, 4, 4, 4, 1, 4]

--- ImbalancedRegressionLoss initialized ---
  Bins: 20, Focal gamma: 1.4444036792996884, Base loss: huber
  Bin [0.00, 0.05): count=  172, weight=0.053
  Bin [0.05, 0.10): count=  413, weight=0.022
  Bin [0.10, 0.15): count=  175, weight=0.052
  Bin [0.15, 0.20): count=  405, weight=0.023
  Bin [0.20, 0.25): count=  295, weight=0.031
  Bin [0.25, 0.30): count=  126, weight=0.072
  Bin [0.30, 0.35): count=  223, weight=0.041
  Bin [0.35, 0.40): count=  162, weight=0.056
  Bin [0.40, 0.45): count=   69, weight=0.131
  Bin [0.45, 0.50): count=  122, weight=0.074
  Bin [0.50, 0.55): count=   93, weight=0.097
  Bin [0.55, 0.60): count=   36, weight=0.247
  Bin [0.60, 0.65): count=   47, weight=0.190
  Bin [0.65, 0.70): count=   27, weight=0.326
  Bin [0.70, 0.75): count=   14, weight=0.609
  Bin [0.75, 0.80): count=   19, weight=0.457
  Bin [0.80, 0.85): count=    5, weight=1.523
  Bin [0.85, 0.90): count=    1, weight=4.570
  Bin [0.90, 0.95): count=    3, weight=2.285
  Bin [0.95, 1.00): count=    0, weight=9.140
-------------------------------------------

  Pred range: [0.0831, 0.6036], std: 0.0908
  RMSE : 0.1530, R2: 0.2191, MAE: 0.1221, Spearman rho: 0.4835, Spearman p: 2.3220e-36, Pearson r: 0.4939, Pearson p: 4.2579e-38
  Pred range: [0.0930, 0.5320], std: 0.0833
  RMSE : 0.1504, R2: 0.2452, MAE: 0.1200, Spearman rho: 0.4972, Spearman p: 1.1408e-38, Pearson r: 0.5098, Pearson p: 7.2175e-41
  Pred range: [0.0988, 0.6564], std: 0.1041
  RMSE : 0.1568, R2: 0.1793, MAE: 0.1275, Spearman rho: 0.5022, Spearman p: 1.5847e-39, Pearson r: 0.5123, Pearson p: 2.5781e-41
  Pred range: [0.0566, 0.6685], std: 0.1037
  RMSE : 0.1496, R2: 0.2533, MAE: 0.1174, Spearman rho: 0.5021, Spearman p: 1.6680e-39, Pearson r: 0.5137, Pearson p: 1.4363e-41
  Pred range: [0.0962, 0.7937], std: 0.1142
  RMSE : 0.1697, R2: 0.0383, MAE: 0.1407, Spearman rho: 0.4977, Spearman p: 9.5361e-39, Pearson r: 0.5136, Pearson p: 1.5002e-41
  Pred range: [0.0657, 0.6314], std: 0.0977
  RMSE : 0.1493, R2: 0.2559, MAE: 0.1189, Spearman rho: 0.4988, Spearman p: 6.0819e-39, Pearson r: 0.5208, Pearson p: 7.0345e-43
  Pred range: [0.0503, 0.6459], std: 0.0984
  RMSE : 0.1532, R2: 0.2164, MAE: 0.1240, Spearman rho: 0.4969, Spearman p: 1.3223e-38, Pearson r: 0.5117, Pearson p: 3.2084e-41
  Pred range: [-0.0281, 0.6984], std: 0.1029
  RMSE : 0.1513, R2: 0.2358, MAE: 0.1193, Spearman rho: 0.4884, Spearman p: 3.5568e-37, Pearson r: 0.5026, Pearson p: 1.3306e-39
  Pred range: [0.0294, 0.7320], std: 0.1077
  RMSE : 0.1577, R2: 0.1696, MAE: 0.1281, Spearman rho: 0.4951, Spearman p: 2.6161e-38, Pearson r: 0.5103, Pearson p: 5.7910e-41
  Pred range: [0.0202, 0.6731], std: 0.0964
  RMSE : 0.1500, R2: 0.2486, MAE: 0.1196, Spearman rho: 0.4929, Spearman p: 6.2630e-38, Pearson r: 0.5139, Pearson p: 1.2940e-41
  Pred range: [0.0496, 0.7726], std: 0.1194
  RMSE : 0.1591, R2: 0.1554, MAE: 0.1288, Spearman rho: 0.4905, Spearman p: 1.5826e-37, Pearson r: 0.5172, Pearson p: 3.2482e-42
[I 2026-04-27 20:29:34,770] Trial 87 finished with value: 0.14930533523383135 and parameters: {'learning_rate': 0.0005971610054962349, 'batch_size': 4, 'num_epochs': 20, 'weight_decay': 2.119556070878903e-05, 'layers_PRS': 3, 'layers_SCZ15': 6, 'layers_ADHD9': 2, 'layers_ASD9': 7, 'layers_ACE15': 4, 'layers_ACE18': 5, 'layers_SUD18': 3, 'layers_SES': 2, 'layers_SEX': 5, 'dropout': 0.2578570268412294, 'se_reduction': 3, 'hidden_dim_min': 4, 'base_loss': 'huber', 'huber_delta': 0.13146501758031282, 'focal_gamma': 1.4444036792996884, 'n_bins': 20, 'scheduler_patience': 5, 'scheduler_factor': 0.5156662955896844, 'early_stopping_patience': 5}. Best is trial 81 with value: 0.14825416838187774.
Train: 2407 rows (1613 IDs),Test: 598 rows (404 IDs) 

n_features_x : 6, n_features_per_modality: [16, 23, 19, 17, 7, 4, 4, 4, 1, 4]

--- ImbalancedRegressionLoss initialized ---
  Bins: 16, Focal gamma: 1.5243024236813936, Base loss: huber
  Bin [0.00, 0.06): count=  383, weight=0.041
  Bin [0.06, 0.12): count=  377, weight=0.042
  Bin [0.12, 0.19): count=  405, weight=0.039
  Bin [0.19, 0.25): count=  295, weight=0.053
  Bin [0.25, 0.31): count=  239, weight=0.066
  Bin [0.31, 0.38): count=  199, weight=0.079
  Bin [0.38, 0.44): count=  142, weight=0.111
  Bin [0.44, 0.50): count=  122, weight=0.129
  Bin [0.50, 0.56): count=   93, weight=0.168
  Bin [0.56, 0.62): count=   64, weight=0.243
  Bin [0.62, 0.69): count=   36, weight=0.427
  Bin [0.69, 0.75): count=   24, weight=0.633
  Bin [0.75, 0.81): count=   19, weight=0.791
  Bin [0.81, 0.88): count=    5, weight=2.636
  Bin [0.88, 0.94): count=    2, weight=5.271
  Bin [0.94, 1.00): count=    2, weight=5.271
-------------------------------------------

  Pred range: [0.0552, 0.7278], std: 0.0978
  RMSE : 0.1834, R2: -0.1226, MAE: 0.1538, Spearman rho: 0.4140, Spearman p: 3.6950e-26, Pearson r: 0.4238, Pearson p: 1.8101e-27
  Pred range: [0.0646, 0.7116], std: 0.0977
  RMSE : 0.1787, R2: -0.0665, MAE: 0.1502, Spearman rho: 0.4489, Spearman p: 5.3507e-31, Pearson r: 0.4607, Pearson p: 9.2329e-33
  Pred range: [0.0419, 0.6264], std: 0.0902
  RMSE : 0.1540, R2: 0.2080, MAE: 0.1244, Spearman rho: 0.4735, Spearman p: 9.6070e-35, Pearson r: 0.4878, Pearson p: 4.4618e-37
  Pred range: [0.0990, 0.8018], std: 0.1085
  RMSE : 0.2065, R2: -0.4232, MAE: 0.1763, Spearman rho: 0.4691, Spearman p: 4.7566e-34, Pearson r: 0.4870, Pearson p: 6.2098e-37
  Pred range: [0.0722, 0.6667], std: 0.0942
  RMSE : 0.1652, R2: 0.0890, MAE: 0.1380, Spearman rho: 0.4813, Spearman p: 5.3186e-36, Pearson r: 0.4980, Pearson p: 8.3791e-39
  Pred range: [0.0751, 0.6593], std: 0.0950
  RMSE : 0.1614, R2: 0.1309, MAE: 0.1341, Spearman rho: 0.4840, Spearman p: 1.9255e-36, Pearson r: 0.5013, Pearson p: 2.3044e-39
  Pred range: [0.0819, 0.6430], std: 0.0909
  RMSE : 0.1600, R2: 0.1450, MAE: 0.1332, Spearman rho: 0.4813, Spearman p: 5.3293e-36, Pearson r: 0.5024, Pearson p: 1.4358e-39
[I 2026-04-27 20:30:30,653] Trial 88 finished with value: 0.15404136845514504 and parameters: {'learning_rate': 0.0002884835557222473, 'batch_size': 8, 'num_epochs': 22, 'weight_decay': 9.94394966730933e-05, 'layers_PRS': 7, 'layers_SCZ15': 7, 'layers_ADHD9': 1, 'layers_ASD9': 6, 'layers_ACE15': 4, 'layers_ACE18': 6, 'layers_SUD18': 4, 'layers_SES': 3, 'layers_SEX': 6, 'dropout': 0.293028394063213, 'se_reduction': 2, 'hidden_dim_min': 13, 'base_loss': 'huber', 'huber_delta': 0.1559896782712897, 'focal_gamma': 1.5243024236813936, 'n_bins': 16, 'scheduler_patience': 5, 'scheduler_factor': 0.5336807838084924, 'early_stopping_patience': 4}. Best is trial 81 with value: 0.14825416838187774.
Train: 2407 rows (1613 IDs),Test: 598 rows (404 IDs) 

n_features_x : 6, n_features_per_modality: [16, 23, 19, 17, 7, 4, 4, 4, 1, 4]

--- ImbalancedRegressionLoss initialized ---
  Bins: 17, Focal gamma: 0.8853347841075395, Base loss: huber
  Bin [0.00, 0.06): count=  172, weight=0.058
  Bin [0.06, 0.12): count=  413, weight=0.024
  Bin [0.12, 0.18): count=  376, weight=0.027
  Bin [0.18, 0.24): count=  370, weight=0.027
  Bin [0.24, 0.29): count=  255, weight=0.039
  Bin [0.29, 0.35): count=  223, weight=0.045
  Bin [0.35, 0.41): count=  162, weight=0.061
  Bin [0.41, 0.47): count=  134, weight=0.074
  Bin [0.47, 0.53): count=  108, weight=0.092
  Bin [0.53, 0.59): count=   78, weight=0.127
  Bin [0.59, 0.65): count=   47, weight=0.208
  Bin [0.65, 0.71): count=   27, weight=0.357
  Bin [0.71, 0.76): count=   26, weight=0.370
  Bin [0.76, 0.82): count=    9, weight=0.999
  Bin [0.82, 0.88): count=    4, weight=1.999
  Bin [0.88, 0.94): count=    3, weight=2.499
  Bin [0.94, 1.00): count=    0, weight=9.995
-------------------------------------------

  Pred range: [0.1161, 0.6655], std: 0.1064
  RMSE : 0.1747, R2: -0.0185, MAE: 0.1468, Spearman rho: 0.4974, Spearman p: 1.0578e-38, Pearson r: 0.5178, Pearson p: 2.5700e-42
  Pred range: [0.0831, 0.7467], std: 0.1158
  RMSE : 0.1582, R2: 0.1648, MAE: 0.1275, Spearman rho: 0.4854, Spearman p: 1.1319e-36, Pearson r: 0.5019, Pearson p: 1.7482e-39
  Pred range: [0.0871, 0.7182], std: 0.1218
  RMSE : 0.1651, R2: 0.0899, MAE: 0.1346, Spearman rho: 0.4814, Spearman p: 5.1966e-36, Pearson r: 0.4995, Pearson p: 4.6883e-39
  Pred range: [0.0749, 0.5645], std: 0.0957
  RMSE : 0.1526, R2: 0.2222, MAE: 0.1234, Spearman rho: 0.4840, Spearman p: 1.8946e-36, Pearson r: 0.5045, Pearson p: 6.3267e-40
  Pred range: [0.1422, 0.7625], std: 0.1249
  RMSE : 0.1958, R2: -0.2800, MAE: 0.1644, Spearman rho: 0.4945, Spearman p: 3.3055e-38, Pearson r: 0.5170, Pearson p: 3.5369e-42
  Pred range: [0.1279, 0.6729], std: 0.1121
  RMSE : 0.1788, R2: -0.0673, MAE: 0.1501, Spearman rho: 0.4852, Spearman p: 1.2332e-36, Pearson r: 0.5145, Pearson p: 1.0277e-41
  Pred range: [0.0493, 0.6314], std: 0.1143
  RMSE : 0.1536, R2: 0.2122, MAE: 0.1233, Spearman rho: 0.4857, Spearman p: 1.0027e-36, Pearson r: 0.5122, Pearson p: 2.6168e-41
  Pred range: [0.0800, 0.7741], std: 0.1350
  RMSE : 0.1770, R2: -0.0459, MAE: 0.1433, Spearman rho: 0.4908, Spearman p: 1.4280e-37, Pearson r: 0.5071, Pearson p: 2.1815e-40
  Pred range: [0.1067, 0.6679], std: 0.1089
  RMSE : 0.1655, R2: 0.0862, MAE: 0.1367, Spearman rho: 0.4926, Spearman p: 7.0333e-38, Pearson r: 0.5110, Pearson p: 4.4289e-41
[I 2026-04-27 20:31:49,041] Trial 89 finished with value: 0.1526486268282727 and parameters: {'learning_rate': 0.002841107989157469, 'batch_size': 6, 'num_epochs': 18, 'weight_decay': 3.392050597900145e-05, 'layers_PRS': 4, 'layers_SCZ15': 6, 'layers_ADHD9': 2, 'layers_ASD9': 7, 'layers_ACE15': 3, 'layers_ACE18': 4, 'layers_SUD18': 2, 'layers_SES': 3, 'layers_SEX': 6, 'dropout': 0.23837922037185455, 'se_reduction': 3, 'hidden_dim_min': 5, 'base_loss': 'huber', 'huber_delta': 0.1681501716684291, 'focal_gamma': 0.8853347841075395, 'n_bins': 17, 'scheduler_patience': 5, 'scheduler_factor': 0.5540804744309578, 'early_stopping_patience': 5}. Best is trial 81 with value: 0.14825416838187774.
Train: 2407 rows (1613 IDs),Test: 598 rows (404 IDs) 

n_features_x : 6, n_features_per_modality: [16, 23, 19, 17, 7, 4, 4, 4, 1, 4]

--- ImbalancedRegressionLoss initialized ---
  Bins: 19, Focal gamma: 0.9914961979427608, Base loss: mse
  Bin [0.00, 0.05): count=  172, weight=0.055
  Bin [0.05, 0.11): count=  413, weight=0.023
  Bin [0.11, 0.16): count=  376, weight=0.025
  Bin [0.16, 0.21): count=  204, weight=0.046
  Bin [0.21, 0.26): count=  295, weight=0.032
  Bin [0.26, 0.32): count=  239, weight=0.039
  Bin [0.32, 0.37): count=  199, weight=0.047
  Bin [0.37, 0.42): count=   73, weight=0.128
  Bin [0.42, 0.47): count=  134, weight=0.070
  Bin [0.47, 0.53): count=  108, weight=0.087
  Bin [0.53, 0.58): count=   78, weight=0.120
  Bin [0.58, 0.63): count=   28, weight=0.327
  Bin [0.63, 0.68): count=   36, weight=0.256
  Bin [0.68, 0.74): count=   24, weight=0.379
  Bin [0.74, 0.79): count=   19, weight=0.474
  Bin [0.79, 0.84): count=    2, weight=3.157
  Bin [0.84, 0.89): count=    4, weight=1.894
  Bin [0.89, 0.95): count=    3, weight=2.368
  Bin [0.95, 1.00): count=    0, weight=9.472
-------------------------------------------

  Pred range: [0.1126, 0.6027], std: 0.0803
  RMSE : 0.1629, R2: 0.1141, MAE: 0.1354, Spearman rho: 0.4240, Spearman p: 1.6972e-27, Pearson r: 0.4524, Pearson p: 1.6662e-31
  Pred range: [0.1094, 0.6098], std: 0.0855
  RMSE : 0.1590, R2: 0.1556, MAE: 0.1321, Spearman rho: 0.4722, Spearman p: 1.5178e-34, Pearson r: 0.4909, Pearson p: 1.3528e-37
  Pred range: [0.1200, 0.6411], std: 0.0852
  RMSE : 0.1630, R2: 0.1127, MAE: 0.1370, Spearman rho: 0.4853, Spearman p: 1.1924e-36, Pearson r: 0.5057, Pearson p: 3.8898e-40
  Pred range: [0.1054, 0.5804], std: 0.0808
  RMSE : 0.1528, R2: 0.2206, MAE: 0.1256, Spearman rho: 0.5010, Spearman p: 2.5497e-39, Pearson r: 0.5195, Pearson p: 1.2191e-42
  Pred range: [0.1251, 0.6920], std: 0.0963
  RMSE : 0.1680, R2: 0.0576, MAE: 0.1418, Spearman rho: 0.5005, Spearman p: 3.0982e-39, Pearson r: 0.5202, Pearson p: 9.0244e-43
  Pred range: [0.0962, 0.6128], std: 0.0901
  RMSE : 0.1494, R2: 0.2554, MAE: 0.1204, Spearman rho: 0.5058, Spearman p: 3.7382e-40, Pearson r: 0.5245, Pearson p: 1.4293e-43
  Pred range: [0.1247, 0.6840], std: 0.0945
  RMSE : 0.1672, R2: 0.0667, MAE: 0.1410, Spearman rho: 0.4992, Spearman p: 5.2502e-39, Pearson r: 0.5215, Pearson p: 5.2128e-43
  Pred range: [0.1369, 0.7174], std: 0.1021
  RMSE : 0.1804, R2: -0.0861, MAE: 0.1531, Spearman rho: 0.4983, Spearman p: 7.6333e-39, Pearson r: 0.5219, Pearson p: 4.4842e-43
  Pred range: [0.1039, 0.6189], std: 0.0894
  RMSE : 0.1530, R2: 0.2185, MAE: 0.1253, Spearman rho: 0.4926, Spearman p: 6.9789e-38, Pearson r: 0.5168, Pearson p: 3.7863e-42
  Pred range: [0.0979, 0.6217], std: 0.0907
  RMSE : 0.1512, R2: 0.2368, MAE: 0.1224, Spearman rho: 0.4873, Spearman p: 5.5036e-37, Pearson r: 0.5123, Pearson p: 2.5187e-41
