[I 2026-04-27 17:07:14,976] Trial 42 finished with value: 0.08845296149178929 and parameters: {'learning_rate': 0.00034135899110998395, 'batch_size': 4, 'num_epochs': 19, 'weight_decay': 0.003298071023606516, 'layers_PRS': 6, 'layers_SCZ15': 3, 'layers_ADHD9': 5, 'layers_ASD9': 1, 'layers_ACE15': 3, 'layers_ACE18': 5, 'layers_SUD18': 3, 'layers_SES': 5, 'layers_SEX': 2, 'dropout': 0.446237335016673, 'se_reduction': 4, 'hidden_dim_min': 9, 'base_loss': 'huber', 'huber_delta': 0.021368657217159824, 'focal_gamma': 1.0552188177596544, 'n_bins': 10, 'scheduler_patience': 3, 'scheduler_factor': 0.655353765958543, 'early_stopping_patience': 4}. Best is trial 9 with value: 0.08803266597627345.
Train: 2407 rows (1613 IDs),Test: 598 rows (404 IDs) 

n_features_x : 6, n_features_per_modality: [16, 23, 19, 17, 7, 4, 4, 4, 1, 4]

--- ImbalancedRegressionLoss initialized ---
  Bins: 6, Focal gamma: 0.7981357909871684, Base loss: huber
  Bin [0.00, 0.17): count= 1538, weight=0.002
  Bin [0.17, 0.33): count=  789, weight=0.005
  Bin [0.33, 0.50): count=   69, weight=0.053
  Bin [0.50, 0.67): count=   10, weight=0.339
  Bin [0.67, 0.83): count=    1, weight=1.867
  Bin [0.83, 1.00): count=    0, weight=3.733
-------------------------------------------

  Pred range: [0.0239, 0.3541], std: 0.0592
  RMSE : 0.0896, R2: 0.2062, MAE: 0.0700, Spearman rho: 0.4621, Spearman p: 5.7869e-33, Pearson r: 0.4695, Pearson p: 4.0706e-34
  Pred range: [0.0525, 0.4189], std: 0.0625
  RMSE : 0.0953, R2: 0.1026, MAE: 0.0766, Spearman rho: 0.4678, Spearman p: 7.5828e-34, Pearson r: 0.4736, Pearson p: 9.3932e-35
  Pred range: [0.0264, 0.3446], std: 0.0493
  RMSE : 0.0881, R2: 0.2334, MAE: 0.0697, Spearman rho: 0.4803, Spearman p: 7.7543e-36, Pearson r: 0.4832, Pearson p: 2.5774e-36
  Pred range: [0.0197, 0.4147], std: 0.0629
  RMSE : 0.0901, R2: 0.1985, MAE: 0.0707, Spearman rho: 0.4765, Spearman p: 3.1492e-35, Pearson r: 0.4783, Pearson p: 1.6392e-35
  Pred range: [-0.0122, 0.3827], std: 0.0588
  RMSE : 0.0887, R2: 0.2232, MAE: 0.0693, Spearman rho: 0.4804, Spearman p: 7.3852e-36, Pearson r: 0.4831, Pearson p: 2.6706e-36
  Pred range: [0.0172, 0.3845], std: 0.0556
  RMSE : 0.0888, R2: 0.2204, MAE: 0.0703, Spearman rho: 0.4762, Spearman p: 3.5560e-35, Pearson r: 0.4798, Pearson p: 9.4860e-36
  Pred range: [0.0282, 0.3991], std: 0.0622
  RMSE : 0.0909, R2: 0.1831, MAE: 0.0722, Spearman rho: 0.4759, Spearman p: 3.9694e-35, Pearson r: 0.4797, Pearson p: 9.6775e-36
  Pred range: [0.0034, 0.3735], std: 0.0572
  RMSE : 0.0888, R2: 0.2216, MAE: 0.0700, Spearman rho: 0.4745, Spearman p: 6.5364e-35, Pearson r: 0.4809, Pearson p: 6.0765e-36
  Pred range: [0.0223, 0.3982], std: 0.0625
  RMSE : 0.0902, R2: 0.1962, MAE: 0.0713, Spearman rho: 0.4772, Spearman p: 2.4777e-35, Pearson r: 0.4837, Pearson p: 2.1470e-36
[I 2026-04-27 17:08:35,171] Trial 43 finished with value: 0.08807492007524793 and parameters: {'learning_rate': 0.0005743825630707693, 'batch_size': 4, 'num_epochs': 21, 'weight_decay': 4.0334600966370455e-05, 'layers_PRS': 5, 'layers_SCZ15': 2, 'layers_ADHD9': 3, 'layers_ASD9': 3, 'layers_ACE15': 5, 'layers_ACE18': 3, 'layers_SUD18': 2, 'layers_SES': 6, 'layers_SEX': 1, 'dropout': 0.3634890477503548, 'se_reduction': 4, 'hidden_dim_min': 5, 'base_loss': 'huber', 'huber_delta': 0.05136858490531789, 'focal_gamma': 0.7981357909871684, 'n_bins': 6, 'scheduler_patience': 4, 'scheduler_factor': 0.6863762155684725, 'early_stopping_patience': 6}. Best is trial 9 with value: 0.08803266597627345.
Train: 2407 rows (1613 IDs),Test: 598 rows (404 IDs) 

n_features_x : 6, n_features_per_modality: [16, 23, 19, 17, 7, 4, 4, 4, 1, 4]

--- ImbalancedRegressionLoss initialized ---
  Bins: 6, Focal gamma: 0.8259359912488017, Base loss: huber
  Bin [0.00, 0.17): count= 1538, weight=0.002
  Bin [0.17, 0.33): count=  789, weight=0.005
  Bin [0.33, 0.50): count=   69, weight=0.053
  Bin [0.50, 0.67): count=   10, weight=0.339
  Bin [0.67, 0.83): count=    1, weight=1.867
  Bin [0.83, 1.00): count=    0, weight=3.733
-------------------------------------------

  Pred range: [0.0279, 0.3963], std: 0.0628
  RMSE : 0.0889, R2: 0.2181, MAE: 0.0692, Spearman rho: 0.4794, Spearman p: 1.0825e-35, Pearson r: 0.4894, Pearson p: 2.4208e-37
  Pred range: [0.0384, 0.3978], std: 0.0573
  RMSE : 0.0899, R2: 0.2016, MAE: 0.0710, Spearman rho: 0.4580, Spearman p: 2.3943e-32, Pearson r: 0.4638, Pearson p: 3.1042e-33
  Pred range: [-0.0415, 0.3394], std: 0.0580
  RMSE : 0.0905, R2: 0.1909, MAE: 0.0700, Spearman rho: 0.4751, Spearman p: 5.3231e-35, Pearson r: 0.4850, Pearson p: 1.3129e-36
  Pred range: [0.0723, 0.3827], std: 0.0542
  RMSE : 0.0961, R2: 0.0880, MAE: 0.0783, Spearman rho: 0.4629, Spearman p: 4.3611e-33, Pearson r: 0.4779, Pearson p: 1.8639e-35
  Pred range: [0.0171, 0.4246], std: 0.0621
  RMSE : 0.1003, R2: 0.0059, MAE: 0.0820, Spearman rho: 0.4735, Spearman p: 9.5125e-35, Pearson r: 0.4794, Pearson p: 1.0716e-35
  Pred range: [0.0028, 0.3761], std: 0.0552
  RMSE : 0.0932, R2: 0.1417, MAE: 0.0755, Spearman rho: 0.4614, Spearman p: 7.4631e-33, Pearson r: 0.4738, Pearson p: 8.7125e-35
  Pred range: [0.0382, 0.3571], std: 0.0571
  RMSE : 0.0896, R2: 0.2059, MAE: 0.0710, Spearman rho: 0.4669, Spearman p: 1.0322e-33, Pearson r: 0.4759, Pearson p: 3.9781e-35
  Pred range: [-0.0258, 0.3245], std: 0.0549
  RMSE : 0.0900, R2: 0.1997, MAE: 0.0711, Spearman rho: 0.4479, Spearman p: 7.5449e-31, Pearson r: 0.4566, Pearson p: 3.8504e-32
[I 2026-04-27 17:10:08,014] Trial 44 finished with value: 0.08894960543023395 and parameters: {'learning_rate': 0.0015236043912275298, 'batch_size': 4, 'num_epochs': 21, 'weight_decay': 3.711484952285486e-05, 'layers_PRS': 7, 'layers_SCZ15': 2, 'layers_ADHD9': 4, 'layers_ASD9': 6, 'layers_ACE15': 5, 'layers_ACE18': 3, 'layers_SUD18': 2, 'layers_SES': 6, 'layers_SEX': 3, 'dropout': 0.29251723897123927, 'se_reduction': 3, 'hidden_dim_min': 5, 'base_loss': 'huber', 'huber_delta': 0.10928950531960907, 'focal_gamma': 0.8259359912488017, 'n_bins': 6, 'scheduler_patience': 4, 'scheduler_factor': 0.6850507542756207, 'early_stopping_patience': 7}. Best is trial 9 with value: 0.08803266597627345.
Train: 2407 rows (1613 IDs),Test: 598 rows (404 IDs) 

n_features_x : 6, n_features_per_modality: [16, 23, 19, 17, 7, 4, 4, 4, 1, 4]

--- ImbalancedRegressionLoss initialized ---
  Bins: 5, Focal gamma: 2.6378237513971676, Base loss: huber
  Bin [0.00, 0.20): count= 1876, weight=0.002
  Bin [0.20, 0.40): count=  497, weight=0.007
  Bin [0.40, 0.60): count=   32, weight=0.111
  Bin [0.60, 0.80): count=    2, weight=1.220
  Bin [0.80, 1.00): count=    0, weight=3.660
-------------------------------------------

  Pred range: [0.0334, 0.3873], std: 0.0568
  RMSE : 0.0921, R2: 0.1613, MAE: 0.0729, Spearman rho: 0.4131, Spearman p: 4.7319e-26, Pearson r: 0.4254, Pearson p: 1.0964e-27
  Pred range: [0.0376, 0.3679], std: 0.0544
  RMSE : 0.0901, R2: 0.1979, MAE: 0.0714, Spearman rho: 0.4425, Spearman p: 4.5488e-30, Pearson r: 0.4538, Pearson p: 1.0247e-31
  Pred range: [0.0675, 0.4099], std: 0.0572
  RMSE : 0.0975, R2: 0.0615, MAE: 0.0795, Spearman rho: 0.4547, Spearman p: 7.4417e-32, Pearson r: 0.4639, Pearson p: 3.0554e-33
  Pred range: [0.0313, 0.3580], std: 0.0544
  RMSE : 0.0889, R2: 0.2194, MAE: 0.0698, Spearman rho: 0.4694, Spearman p: 4.1754e-34, Pearson r: 0.4751, Pearson p: 5.2884e-35
  Pred range: [0.0219, 0.3802], std: 0.0572
  RMSE : 0.0893, R2: 0.2112, MAE: 0.0710, Spearman rho: 0.4767, Spearman p: 2.9345e-35, Pearson r: 0.4822, Pearson p: 3.7979e-36
  Pred range: [0.0210, 0.3565], std: 0.0543
  RMSE : 0.0901, R2: 0.1983, MAE: 0.0723, Spearman rho: 0.4667, Spearman p: 1.1347e-33, Pearson r: 0.4732, Pearson p: 1.0593e-34
  Pred range: [0.0159, 0.3588], std: 0.0522
  RMSE : 0.0893, R2: 0.2113, MAE: 0.0714, Spearman rho: 0.4661, Spearman p: 1.3984e-33, Pearson r: 0.4709, Pearson p: 2.4334e-34
  Pred range: [0.0532, 0.3753], std: 0.0532
  RMSE : 0.0923, R2: 0.1587, MAE: 0.0744, Spearman rho: 0.4657, Spearman p: 1.5889e-33, Pearson r: 0.4699, Pearson p: 3.5013e-34
  Pred range: [0.0043, 0.3799], std: 0.0558
  RMSE : 0.0885, R2: 0.2263, MAE: 0.0703, Spearman rho: 0.4874, Spearman p: 5.1910e-37, Pearson r: 0.4882, Pearson p: 3.8868e-37
  Pred range: [0.0332, 0.3854], std: 0.0582
  RMSE : 0.0903, R2: 0.1942, MAE: 0.0721, Spearman rho: 0.4750, Spearman p: 5.4870e-35, Pearson r: 0.4813, Pearson p: 5.2685e-36
  Pred range: [0.0231, 0.3773], std: 0.0542
  RMSE : 0.0892, R2: 0.2142, MAE: 0.0714, Spearman rho: 0.4758, Spearman p: 4.0733e-35, Pearson r: 0.4845, Pearson p: 1.5856e-36
  Pred range: [0.0415, 0.3416], std: 0.0495
  RMSE : 0.0900, R2: 0.1987, MAE: 0.0729, Spearman rho: 0.4597, Spearman p: 1.3231e-32, Pearson r: 0.4693, Pearson p: 4.3551e-34
  Pred range: [0.0520, 0.4032], std: 0.0582
  RMSE : 0.0943, R2: 0.1221, MAE: 0.0764, Spearman rho: 0.4705, Spearman p: 2.8529e-34, Pearson r: 0.4788, Pearson p: 1.3560e-35
  Pred range: [0.0529, 0.3826], std: 0.0555
  RMSE : 0.0962, R2: 0.0859, MAE: 0.0784, Spearman rho: 0.4562, Spearman p: 4.5446e-32, Pearson r: 0.4696, Pearson p: 3.8913e-34
  Pred range: [0.0303, 0.3722], std: 0.0531
  RMSE : 0.0900, R2: 0.1993, MAE: 0.0725, Spearman rho: 0.4669, Spearman p: 1.0332e-33, Pearson r: 0.4762, Pearson p: 3.5062e-35
[I 2026-04-27 17:12:24,080] Trial 45 finished with value: 0.08848528492692258 and parameters: {'learning_rate': 0.0005341758346085224, 'batch_size': 4, 'num_epochs': 27, 'weight_decay': 4.7553810643683646e-05, 'layers_PRS': 1, 'layers_SCZ15': 1, 'layers_ADHD9': 3, 'layers_ASD9': 3, 'layers_ACE15': 6, 'layers_ACE18': 4, 'layers_SUD18': 1, 'layers_SES': 7, 'layers_SEX': 6, 'dropout': 0.31752426966754593, 'se_reduction': 5, 'hidden_dim_min': 6, 'base_loss': 'huber', 'huber_delta': 0.04893373032473702, 'focal_gamma': 2.6378237513971676, 'n_bins': 5, 'scheduler_patience': 5, 'scheduler_factor': 0.695611827040494, 'early_stopping_patience': 6}. Best is trial 9 with value: 0.08803266597627345.
Train: 2407 rows (1613 IDs),Test: 598 rows (404 IDs) 

n_features_x : 6, n_features_per_modality: [16, 23, 19, 17, 7, 4, 4, 4, 1, 4]

--- ImbalancedRegressionLoss initialized ---
  Bins: 6, Focal gamma: 0.6267511627107291, Base loss: huber
  Bin [0.00, 0.17): count= 1538, weight=0.002
  Bin [0.17, 0.33): count=  789, weight=0.005
  Bin [0.33, 0.50): count=   69, weight=0.053
  Bin [0.50, 0.67): count=   10, weight=0.339
  Bin [0.67, 0.83): count=    1, weight=1.867
  Bin [0.83, 1.00): count=    0, weight=3.733
-------------------------------------------

  Pred range: [0.0661, 0.3787], std: 0.0525
  RMSE : 0.0916, R2: 0.1716, MAE: 0.0732, Spearman rho: 0.4637, Spearman p: 3.2728e-33, Pearson r: 0.4592, Pearson p: 1.5918e-32
  Pred range: [0.0329, 0.3503], std: 0.0519
  RMSE : 0.0902, R2: 0.1958, MAE: 0.0724, Spearman rho: 0.4776, Spearman p: 2.1398e-35, Pearson r: 0.4792, Pearson p: 1.1648e-35
  Pred range: [0.0296, 0.3907], std: 0.0591
  RMSE : 0.0889, R2: 0.2183, MAE: 0.0699, Spearman rho: 0.4872, Spearman p: 5.6221e-37, Pearson r: 0.4868, Pearson p: 6.5997e-37
  Pred range: [0.0051, 0.3719], std: 0.0531
  RMSE : 0.0900, R2: 0.2001, MAE: 0.0719, Spearman rho: 0.4770, Spearman p: 2.5945e-35, Pearson r: 0.4763, Pearson p: 3.4081e-35
  Pred range: [0.0172, 0.3773], std: 0.0565
  RMSE : 0.0889, R2: 0.2185, MAE: 0.0703, Spearman rho: 0.4774, Spearman p: 2.2912e-35, Pearson r: 0.4800, Pearson p: 8.8076e-36
  Pred range: [0.0344, 0.3999], std: 0.0592
  RMSE : 0.0938, R2: 0.1311, MAE: 0.0756, Spearman rho: 0.4742, Spearman p: 7.5323e-35, Pearson r: 0.4798, Pearson p: 9.4031e-36
  Pred range: [0.0475, 0.4106], std: 0.0627
  RMSE : 0.0936, R2: 0.1349, MAE: 0.0750, Spearman rho: 0.4710, Spearman p: 2.4053e-34, Pearson r: 0.4779, Pearson p: 1.9027e-35
  Pred range: [-0.0040, 0.3520], std: 0.0564
  RMSE : 0.0895, R2: 0.2080, MAE: 0.0717, Spearman rho: 0.4764, Spearman p: 3.3267e-35, Pearson r: 0.4844, Pearson p: 1.6295e-36
  Pred range: [0.0138, 0.3896], std: 0.0627
  RMSE : 0.0910, R2: 0.1822, MAE: 0.0724, Spearman rho: 0.4790, Spearman p: 1.2509e-35, Pearson r: 0.4858, Pearson p: 9.8314e-37
  Pred range: [-0.0054, 0.3874], std: 0.0654
  RMSE : 0.0919, R2: 0.1656, MAE: 0.0734, Spearman rho: 0.4852, Spearman p: 1.2072e-36, Pearson r: 0.4900, Pearson p: 1.9341e-37
  Pred range: [-0.0192, 0.3431], std: 0.0563
  RMSE : 0.0889, R2: 0.2187, MAE: 0.0702, Spearman rho: 0.4675, Spearman p: 8.4226e-34, Pearson r: 0.4757, Pearson p: 4.1978e-35
  Pred range: [0.0027, 0.3480], std: 0.0581
  RMSE : 0.0890, R2: 0.2173, MAE: 0.0696, Spearman rho: 0.4711, Spearman p: 2.2986e-34, Pearson r: 0.4782, Pearson p: 1.6694e-35
  Pred range: [-0.0118, 0.3768], std: 0.0637
  RMSE : 0.0896, R2: 0.2063, MAE: 0.0697, Spearman rho: 0.4769, Spearman p: 2.7079e-35, Pearson r: 0.4801, Pearson p: 8.4196e-36
  Pred range: [0.0113, 0.3760], std: 0.0628
  RMSE : 0.0900, R2: 0.1999, MAE: 0.0710, Spearman rho: 0.4703, Spearman p: 3.0855e-34, Pearson r: 0.4773, Pearson p: 2.4036e-35
  Pred range: [0.0135, 0.4021], std: 0.0645
  RMSE : 0.0937, R2: 0.1316, MAE: 0.0754, Spearman rho: 0.4721, Spearman p: 1.5951e-34, Pearson r: 0.4810, Pearson p: 5.9017e-36
  Pred range: [0.0271, 0.4155], std: 0.0639
  RMSE : 0.0958, R2: 0.0923, MAE: 0.0774, Spearman rho: 0.4698, Spearman p: 3.6873e-34, Pearson r: 0.4782, Pearson p: 1.6723e-35
  Pred range: [-0.0003, 0.4055], std: 0.0637
  RMSE : 0.0927, R2: 0.1515, MAE: 0.0742, Spearman rho: 0.4759, Spearman p: 3.9722e-35, Pearson r: 0.4825, Pearson p: 3.4280e-36
[I 2026-04-27 17:15:37,486] Trial 46 finished with value: 0.08891674902423385 and parameters: {'learning_rate': 0.000969622760003021, 'batch_size': 4, 'num_epochs': 23, 'weight_decay': 8.907575427410368e-05, 'layers_PRS': 6, 'layers_SCZ15': 2, 'layers_ADHD9': 4, 'layers_ASD9': 4, 'layers_ACE15': 5, 'layers_ACE18': 4, 'layers_SUD18': 2, 'layers_SES': 6, 'layers_SEX': 4, 'dropout': 0.20730444326673342, 'se_reduction': 3, 'hidden_dim_min': 7, 'base_loss': 'huber', 'huber_delta': 0.06010543427762316, 'focal_gamma': 0.6267511627107291, 'n_bins': 6, 'scheduler_patience': 4, 'scheduler_factor': 0.6346181520026404, 'early_stopping_patience': 6}. Best is trial 9 with value: 0.08803266597627345.
Train: 2407 rows (1613 IDs),Test: 598 rows (404 IDs) 

n_features_x : 6, n_features_per_modality: [16, 23, 19, 17, 7, 4, 4, 4, 1, 4]

--- ImbalancedRegressionLoss initialized ---
  Bins: 7, Focal gamma: 1.9391137520273907, Base loss: mse
  Bin [0.00, 0.14): count= 1370, weight=0.002
  Bin [0.14, 0.29): count=  892, weight=0.003
  Bin [0.29, 0.43): count=  120, weight=0.024
  Bin [0.43, 0.57): count=   23, weight=0.122
  Bin [0.57, 0.71): count=    2, weight=0.978
  Bin [0.71, 0.86): count=    0, weight=2.935
  Bin [0.86, 1.00): count=    0, weight=2.935
-------------------------------------------

  Pred range: [-0.0239, 0.4204], std: 0.0565
  RMSE : 0.0924, R2: 0.1558, MAE: 0.0739, Spearman rho: 0.4443, Spearman p: 2.5180e-30, Pearson r: 0.4501, Pearson p: 3.6157e-31
  Pred range: [-0.0319, 0.3953], std: 0.0507
  RMSE : 0.0979, R2: 0.0527, MAE: 0.0799, Spearman rho: 0.4276, Spearman p: 5.6089e-28, Pearson r: 0.4323, Pearson p: 1.2643e-28
  Pred range: [0.0585, 0.3769], std: 0.0522
  RMSE : 0.0908, R2: 0.1854, MAE: 0.0727, Spearman rho: 0.4417, Spearman p: 6.0833e-30, Pearson r: 0.4567, Pearson p: 3.7590e-32
  Pred range: [0.0578, 0.4014], std: 0.0533
  RMSE : 0.0970, R2: 0.0702, MAE: 0.0789, Spearman rho: 0.4526, Spearman p: 1.5295e-31, Pearson r: 0.4653, Pearson p: 1.8501e-33
  Pred range: [0.0196, 0.3879], std: 0.0608
  RMSE : 0.0944, R2: 0.1191, MAE: 0.0758, Spearman rho: 0.4453, Spearman p: 1.8442e-30, Pearson r: 0.4603, Pearson p: 1.0980e-32
  Pred range: [0.0508, 0.3724], std: 0.0477
  RMSE : 0.0921, R2: 0.1613, MAE: 0.0746, Spearman rho: 0.4428, Spearman p: 4.1801e-30, Pearson r: 0.4580, Pearson p: 2.3974e-32
  Pred range: [0.0524, 0.3490], std: 0.0483
  RMSE : 0.0906, R2: 0.1880, MAE: 0.0721, Spearman rho: 0.4419, Spearman p: 5.6187e-30, Pearson r: 0.4436, Pearson p: 3.2290e-30
  Pred range: [0.0443, 0.3563], std: 0.0489
  RMSE : 0.0901, R2: 0.1983, MAE: 0.0721, Spearman rho: 0.4327, Spearman p: 1.1171e-28, Pearson r: 0.4528, Pearson p: 1.4389e-31
  Pred range: [0.0583, 0.3265], std: 0.0464
  RMSE : 0.0994, R2: 0.0230, MAE: 0.0809, Spearman rho: 0.3931, Spearman p: 1.5748e-23, Pearson r: 0.4084, Pearson p: 1.9008e-25
  Pred range: [0.0766, 0.4184], std: 0.0566
  RMSE : 0.1001, R2: 0.0105, MAE: 0.0813, Spearman rho: 0.4163, Spearman p: 1.8353e-26, Pearson r: 0.4364, Pearson p: 3.3331e-29
  Pred range: [0.0229, 0.4246], std: 0.0591
  RMSE : 0.1016, R2: -0.0197, MAE: 0.0829, Spearman rho: 0.4231, Spearman p: 2.3054e-27, Pearson r: 0.4412, Pearson p: 7.1215e-30
[I 2026-04-27 17:16:46,134] Trial 47 pruned. 
Train: 2407 rows (1613 IDs),Test: 598 rows (404 IDs) 

n_features_x : 6, n_features_per_modality: [16, 23, 19, 17, 7, 4, 4, 4, 1, 4]

--- ImbalancedRegressionLoss initialized ---
  Bins: 6, Focal gamma: 1.3992618456862593, Base loss: huber
  Bin [0.00, 0.17): count= 1538, weight=0.002
  Bin [0.17, 0.33): count=  789, weight=0.005
  Bin [0.33, 0.50): count=   69, weight=0.053
  Bin [0.50, 0.67): count=   10, weight=0.339
  Bin [0.67, 0.83): count=    1, weight=1.867
  Bin [0.83, 1.00): count=    0, weight=3.733
-------------------------------------------

  Pred range: [0.0726, 0.4215], std: 0.0544
  RMSE : 0.0994, R2: 0.0243, MAE: 0.0799, Spearman rho: 0.3828, Spearman p: 2.6346e-22, Pearson r: 0.3534, Pearson p: 4.9426e-19
  Pred range: [0.0718, 0.5035], std: 0.0557
  RMSE : 0.0970, R2: 0.0711, MAE: 0.0775, Spearman rho: 0.4180, Spearman p: 1.0989e-26, Pearson r: 0.3873, Pearson p: 7.7876e-23
  Pred range: [0.0674, 0.3822], std: 0.0427
  RMSE : 0.0926, R2: 0.1522, MAE: 0.0748, Spearman rho: 0.4438, Spearman p: 3.0254e-30, Pearson r: 0.4159, Pearson p: 2.0417e-26
  Pred range: [0.0253, 0.3121], std: 0.0366
  RMSE : 0.0981, R2: 0.0489, MAE: 0.0803, Spearman rho: 0.3422, Spearman p: 7.1827e-18, Pearson r: 0.3369, Pearson p: 2.4511e-17
  Pred range: [0.0253, 0.5650], std: 0.0605
  RMSE : 0.0933, R2: 0.1399, MAE: 0.0727, Spearman rho: 0.4424, Spearman p: 4.6958e-30, Pearson r: 0.4365, Pearson p: 3.2846e-29
  Pred range: [0.0509, 0.3480], std: 0.0569
  RMSE : 0.0938, R2: 0.1304, MAE: 0.0760, Spearman rho: 0.4602, Spearman p: 1.1277e-32, Pearson r: 0.4480, Pearson p: 7.3830e-31
[I 2026-04-27 17:18:00,816] Trial 48 pruned. 
Train: 2407 rows (1613 IDs),Test: 598 rows (404 IDs) 

n_features_x : 6, n_features_per_modality: [16, 23, 19, 17, 7, 4, 4, 4, 1, 4]

--- ImbalancedRegressionLoss initialized ---
  Bins: 15, Focal gamma: 1.2268519131310616, Base loss: huber
  Bin [0.00, 0.07): count=  828, weight=0.003
  Bin [0.07, 0.13): count=  542, weight=0.005
  Bin [0.13, 0.20): count=  506, weight=0.006
  Bin [0.20, 0.27): count=  318, weight=0.009
  Bin [0.27, 0.33): count=  133, weight=0.021
  Bin [0.33, 0.40): count=   46, weight=0.060
  Bin [0.40, 0.47): count=   16, weight=0.166
  Bin [0.47, 0.53): count=   10, weight=0.256
  Bin [0.53, 0.60): count=    6, weight=0.402
  Bin [0.60, 0.67): count=    1, weight=1.407
  Bin [0.67, 0.73): count=    1, weight=1.407
  Bin [0.73, 0.80): count=    0, weight=2.815
  Bin [0.80, 0.87): count=    0, weight=2.815
  Bin [0.87, 0.93): count=    0, weight=2.815
  Bin [0.93, 1.00): count=    0, weight=2.815
-------------------------------------------

  Pred range: [-0.0675, 0.3366], std: 0.0467
  RMSE : 0.0958, R2: 0.0926, MAE: 0.0733, Spearman rho: 0.4665, Spearman p: 1.2009e-33, Pearson r: 0.4579, Pearson p: 2.4941e-32
  Pred range: [0.0801, 0.4248], std: 0.0525
  RMSE : 0.0934, R2: 0.1372, MAE: 0.0758, Spearman rho: 0.4851, Spearman p: 1.2881e-36, Pearson r: 0.4873, Pearson p: 5.4112e-37
  Pred range: [0.0892, 0.5220], std: 0.0678
  RMSE : 0.1105, R2: -0.2069, MAE: 0.0914, Spearman rho: 0.4437, Spearman p: 3.1092e-30, Pearson r: 0.4458, Pearson p: 1.5139e-30
  Pred range: [0.1081, 0.4768], std: 0.0596
  RMSE : 0.1142, R2: -0.2881, MAE: 0.0953, Spearman rho: 0.4284, Spearman p: 4.2832e-28, Pearson r: 0.4437, Pearson p: 3.1330e-30
  Pred range: [0.0708, 0.4238], std: 0.0562
  RMSE : 0.1181, R2: -0.3790, MAE: 0.0987, Spearman rho: 0.4189, Spearman p: 8.3864e-27, Pearson r: 0.4309, Pearson p: 1.9868e-28
  Pred range: [-0.0270, 0.4412], std: 0.0626
  RMSE : 0.1050, R2: -0.0887, MAE: 0.0863, Spearman rho: 0.4066, Spearman p: 3.2283e-25, Pearson r: 0.4231, Pearson p: 2.2777e-27
[I 2026-04-27 17:18:18,901] Trial 49 pruned. 
Train: 2407 rows (1613 IDs),Test: 598 rows (404 IDs) 

n_features_x : 6, n_features_per_modality: [16, 23, 19, 17, 7, 4, 4, 4, 1, 4]

--- ImbalancedRegressionLoss initialized ---
  Bins: 5, Focal gamma: 0.5223371073381349, Base loss: huber
  Bin [0.00, 0.20): count= 1876, weight=0.002
  Bin [0.20, 0.40): count=  497, weight=0.007
  Bin [0.40, 0.60): count=   32, weight=0.111
  Bin [0.60, 0.80): count=    2, weight=1.220
  Bin [0.80, 1.00): count=    0, weight=3.660
-------------------------------------------

  Pred range: [0.0531, 0.4117], std: 0.0616
  RMSE : 0.0950, R2: 0.1077, MAE: 0.0763, Spearman rho: 0.4379, Spearman p: 2.0722e-29, Pearson r: 0.4481, Pearson p: 7.0733e-31
  Pred range: [0.0278, 0.3481], std: 0.0577
  RMSE : 0.0887, R2: 0.2228, MAE: 0.0701, Spearman rho: 0.4740, Spearman p: 8.0879e-35, Pearson r: 0.4818, Pearson p: 4.4506e-36
  Pred range: [0.0754, 0.4687], std: 0.0649
  RMSE : 0.1062, R2: -0.1145, MAE: 0.0872, Spearman rho: 0.4465, Spearman p: 1.2009e-30, Pearson r: 0.4579, Pearson p: 2.4638e-32
  Pred range: [0.0257, 0.4003], std: 0.0635
  RMSE : 0.0978, R2: 0.0540, MAE: 0.0800, Spearman rho: 0.4813, Spearman p: 5.3002e-36, Pearson r: 0.4848, Pearson p: 1.4039e-36
  Pred range: [0.0159, 0.3109], std: 0.0513
  RMSE : 0.0887, R2: 0.2219, MAE: 0.0709, Spearman rho: 0.4712, Spearman p: 2.2195e-34, Pearson r: 0.4744, Pearson p: 6.9749e-35
