[I 2026-04-27 20:13:46,837] Trial 78 finished with value: 0.18490586231236822 and parameters: {'learning_rate': 0.0009062174558925488, 'batch_size': 32, 'num_epochs': 21, 'weight_decay': 0.0002764535426652408, 'layers_PRS': 3, 'layers_SCZ15': 6, 'layers_ADHD9': 2, 'layers_ASD9': 6, 'layers_ACE15': 3, 'layers_ACE18': 5, 'layers_SUD18': 4, 'layers_SES': 3, 'layers_SEX': 5, 'dropout': 0.2815916007965903, 'se_reduction': 2, 'hidden_dim_min': 4, 'base_loss': 'huber', 'huber_delta': 0.15384666509764244, 'focal_gamma': 1.129555721824689, 'n_bins': 19, 'scheduler_patience': 5, 'scheduler_factor': 0.4605425502467831, 'early_stopping_patience': 3}. Best is trial 31 with value: 0.14835994978477499.
Train: 2407 rows (1613 IDs),Test: 598 rows (404 IDs) 

n_features_x : 6, n_features_per_modality: [16, 23, 19, 17, 7, 4, 4, 4, 1, 4]

--- ImbalancedRegressionLoss initialized ---
  Bins: 18, Focal gamma: 0.858463489213486, Base loss: huber
  Bin [0.00, 0.06): count=  172, weight=0.058
  Bin [0.06, 0.11): count=  413, weight=0.024
  Bin [0.11, 0.17): count=  376, weight=0.027
  Bin [0.17, 0.22): count=  370, weight=0.027
  Bin [0.22, 0.28): count=  255, weight=0.040
  Bin [0.28, 0.33): count=  223, weight=0.045
  Bin [0.33, 0.39): count=   89, weight=0.112
  Bin [0.39, 0.44): count=  142, weight=0.071
  Bin [0.44, 0.50): count=  122, weight=0.082
  Bin [0.50, 0.56): count=   93, weight=0.108
  Bin [0.56, 0.61): count=   64, weight=0.156
  Bin [0.61, 0.67): count=   36, weight=0.273
  Bin [0.67, 0.72): count=   10, weight=0.920
  Bin [0.72, 0.78): count=   26, weight=0.375
  Bin [0.78, 0.83): count=    9, weight=1.012
  Bin [0.83, 0.89): count=    4, weight=2.023
  Bin [0.89, 0.94): count=    3, weight=2.529
  Bin [0.94, 1.00): count=    0, weight=10.117
-------------------------------------------

  Pred range: [0.0655, 0.5829], std: 0.0807
  RMSE : 0.1539, R2: 0.2092, MAE: 0.1229, Spearman rho: 0.4530, Spearman p: 1.3442e-31, Pearson r: 0.4702, Pearson p: 3.2193e-34
  Pred range: [0.0779, 0.6223], std: 0.0954
  RMSE : 0.1567, R2: 0.1803, MAE: 0.1276, Spearman rho: 0.4795, Spearman p: 1.0287e-35, Pearson r: 0.4944, Pearson p: 3.4534e-38
  Pred range: [0.0694, 0.6319], std: 0.0986
  RMSE : 0.1535, R2: 0.2132, MAE: 0.1242, Spearman rho: 0.4895, Spearman p: 2.3729e-37, Pearson r: 0.5076, Pearson p: 1.7968e-40
  Pred range: [0.0880, 0.7204], std: 0.1075
  RMSE : 0.1629, R2: 0.1145, MAE: 0.1348, Spearman rho: 0.4948, Spearman p: 3.0229e-38, Pearson r: 0.5126, Pearson p: 2.2429e-41
  Pred range: [0.0548, 0.6512], std: 0.1064
  RMSE : 0.1490, R2: 0.2590, MAE: 0.1167, Spearman rho: 0.5022, Spearman p: 1.6065e-39, Pearson r: 0.5203, Pearson p: 8.5759e-43
  Pred range: [0.0696, 0.6355], std: 0.0979
  RMSE : 0.1498, R2: 0.2506, MAE: 0.1197, Spearman rho: 0.4968, Spearman p: 1.3619e-38, Pearson r: 0.5180, Pearson p: 2.2841e-42
  Pred range: [0.0743, 0.6929], std: 0.1089
  RMSE : 0.1543, R2: 0.2057, MAE: 0.1246, Spearman rho: 0.4955, Spearman p: 2.2665e-38, Pearson r: 0.5176, Pearson p: 2.7381e-42
  Pred range: [0.0677, 0.6896], std: 0.1100
  RMSE : 0.1545, R2: 0.2033, MAE: 0.1250, Spearman rho: 0.4979, Spearman p: 8.9259e-39, Pearson r: 0.5209, Pearson p: 6.7262e-43
[I 2026-04-27 20:15:26,229] Trial 79 finished with value: 0.14899411119154607 and parameters: {'learning_rate': 0.00022455256348157083, 'batch_size': 4, 'num_epochs': 19, 'weight_decay': 3.9702420519184585e-05, 'layers_PRS': 4, 'layers_SCZ15': 7, 'layers_ADHD9': 1, 'layers_ASD9': 7, 'layers_ACE15': 4, 'layers_ACE18': 5, 'layers_SUD18': 3, 'layers_SES': 3, 'layers_SEX': 5, 'dropout': 0.2554026434226654, 'se_reduction': 3, 'hidden_dim_min': 3, 'base_loss': 'huber', 'huber_delta': 0.1388211963235292, 'focal_gamma': 0.858463489213486, 'n_bins': 18, 'scheduler_patience': 5, 'scheduler_factor': 0.5181486408644892, 'early_stopping_patience': 3}. Best is trial 31 with value: 0.14835994978477499.
Train: 2407 rows (1613 IDs),Test: 598 rows (404 IDs) 

n_features_x : 6, n_features_per_modality: [16, 23, 19, 17, 7, 4, 4, 4, 1, 4]

--- ImbalancedRegressionLoss initialized ---
  Bins: 19, Focal gamma: 0.8390357697726913, Base loss: huber
  Bin [0.00, 0.05): count=  172, weight=0.055
  Bin [0.05, 0.11): count=  413, weight=0.023
  Bin [0.11, 0.16): count=  376, weight=0.025
  Bin [0.16, 0.21): count=  204, weight=0.046
  Bin [0.21, 0.26): count=  295, weight=0.032
  Bin [0.26, 0.32): count=  239, weight=0.039
  Bin [0.32, 0.37): count=  199, weight=0.047
  Bin [0.37, 0.42): count=   73, weight=0.128
  Bin [0.42, 0.47): count=  134, weight=0.070
  Bin [0.47, 0.53): count=  108, weight=0.087
  Bin [0.53, 0.58): count=   78, weight=0.120
  Bin [0.58, 0.63): count=   28, weight=0.327
  Bin [0.63, 0.68): count=   36, weight=0.256
  Bin [0.68, 0.74): count=   24, weight=0.379
  Bin [0.74, 0.79): count=   19, weight=0.474
  Bin [0.79, 0.84): count=    2, weight=3.157
  Bin [0.84, 0.89): count=    4, weight=1.894
  Bin [0.89, 0.95): count=    3, weight=2.368
  Bin [0.95, 1.00): count=    0, weight=9.472
-------------------------------------------

  Pred range: [0.0938, 0.6120], std: 0.0819
  RMSE : 0.1719, R2: 0.0135, MAE: 0.1435, Spearman rho: 0.3961, Spearman p: 6.6265e-24, Pearson r: 0.4132, Pearson p: 4.6284e-26
  Pred range: [0.0782, 0.6048], std: 0.0868
  RMSE : 0.1588, R2: 0.1582, MAE: 0.1295, Spearman rho: 0.4472, Spearman p: 9.7279e-31, Pearson r: 0.4641, Pearson p: 2.8302e-33
  Pred range: [0.0762, 0.6333], std: 0.0969
  RMSE : 0.1600, R2: 0.1452, MAE: 0.1313, Spearman rho: 0.4703, Spearman p: 3.0539e-34, Pearson r: 0.4875, Pearson p: 5.0004e-37
  Pred range: [0.0710, 0.6411], std: 0.0999
  RMSE : 0.1596, R2: 0.1500, MAE: 0.1311, Spearman rho: 0.4812, Spearman p: 5.5429e-36, Pearson r: 0.4982, Pearson p: 7.8629e-39
  Pred range: [0.0713, 0.6349], std: 0.0983
  RMSE : 0.1572, R2: 0.1754, MAE: 0.1288, Spearman rho: 0.4830, Spearman p: 2.7600e-36, Pearson r: 0.5033, Pearson p: 1.0006e-39
  Pred range: [0.0774, 0.6877], std: 0.1059
  RMSE : 0.1625, R2: 0.1191, MAE: 0.1340, Spearman rho: 0.4907, Spearman p: 1.4661e-37, Pearson r: 0.5109, Pearson p: 4.5545e-41
[I 2026-04-27 20:16:22,823] Trial 80 pruned. 
Train: 2407 rows (1613 IDs),Test: 598 rows (404 IDs) 

n_features_x : 6, n_features_per_modality: [16, 23, 19, 17, 7, 4, 4, 4, 1, 4]

--- ImbalancedRegressionLoss initialized ---
  Bins: 18, Focal gamma: 1.3043544590836897, Base loss: huber
  Bin [0.00, 0.06): count=  172, weight=0.058
  Bin [0.06, 0.11): count=  413, weight=0.024
  Bin [0.11, 0.17): count=  376, weight=0.027
  Bin [0.17, 0.22): count=  370, weight=0.027
  Bin [0.22, 0.28): count=  255, weight=0.040
  Bin [0.28, 0.33): count=  223, weight=0.045
  Bin [0.33, 0.39): count=   89, weight=0.112
  Bin [0.39, 0.44): count=  142, weight=0.071
  Bin [0.44, 0.50): count=  122, weight=0.082
  Bin [0.50, 0.56): count=   93, weight=0.108
  Bin [0.56, 0.61): count=   64, weight=0.156
  Bin [0.61, 0.67): count=   36, weight=0.273
  Bin [0.67, 0.72): count=   10, weight=0.920
  Bin [0.72, 0.78): count=   26, weight=0.375
  Bin [0.78, 0.83): count=    9, weight=1.012
  Bin [0.83, 0.89): count=    4, weight=2.023
  Bin [0.89, 0.94): count=    3, weight=2.529
  Bin [0.94, 1.00): count=    0, weight=10.117
-------------------------------------------

  Pred range: [0.1242, 0.6384], std: 0.0939
  RMSE : 0.1625, R2: 0.1187, MAE: 0.1330, Spearman rho: 0.4737, Spearman p: 8.7741e-35, Pearson r: 0.4792, Pearson p: 1.1488e-35
  Pred range: [0.0970, 0.6494], std: 0.0947
  RMSE : 0.1536, R2: 0.2120, MAE: 0.1245, Spearman rho: 0.4942, Spearman p: 3.8091e-38, Pearson r: 0.5083, Pearson p: 1.3381e-40
  Pred range: [0.1097, 0.6058], std: 0.0915
  RMSE : 0.1547, R2: 0.2008, MAE: 0.1267, Spearman rho: 0.5042, Spearman p: 7.1100e-40, Pearson r: 0.5144, Pearson p: 1.0650e-41
  Pred range: [0.0644, 0.5425], std: 0.0897
  RMSE : 0.1483, R2: 0.2663, MAE: 0.1143, Spearman rho: 0.5011, Spearman p: 2.4567e-39, Pearson r: 0.5168, Pearson p: 3.8592e-42
  Pred range: [0.0404, 0.6012], std: 0.0920
  RMSE : 0.1512, R2: 0.2370, MAE: 0.1201, Spearman rho: 0.4887, Spearman p: 3.1492e-37, Pearson r: 0.5000, Pearson p: 3.8493e-39
  Pred range: [0.0925, 0.6411], std: 0.0959
  RMSE : 0.1591, R2: 0.1550, MAE: 0.1308, Spearman rho: 0.4973, Spearman p: 1.1267e-38, Pearson r: 0.5081, Pearson p: 1.4272e-40
  Pred range: [0.0722, 0.6801], std: 0.1010
  RMSE : 0.1510, R2: 0.2386, MAE: 0.1206, Spearman rho: 0.4918, Spearman p: 9.5681e-38, Pearson r: 0.5116, Pearson p: 3.3993e-41
  Pred range: [0.0762, 0.6703], std: 0.1017
  RMSE : 0.1583, R2: 0.1631, MAE: 0.1303, Spearman rho: 0.4913, Spearman p: 1.1515e-37, Pearson r: 0.5141, Pearson p: 1.1939e-41
[I 2026-04-27 20:18:05,731] Trial 81 finished with value: 0.14825416838187774 and parameters: {'learning_rate': 0.0007723851956271341, 'batch_size': 4, 'num_epochs': 18, 'weight_decay': 4.029949877032903e-05, 'layers_PRS': 4, 'layers_SCZ15': 7, 'layers_ADHD9': 1, 'layers_ASD9': 7, 'layers_ACE15': 4, 'layers_ACE18': 5, 'layers_SUD18': 3, 'layers_SES': 3, 'layers_SEX': 5, 'dropout': 0.24233091212431557, 'se_reduction': 3, 'hidden_dim_min': 4, 'base_loss': 'huber', 'huber_delta': 0.17438262633923302, 'focal_gamma': 1.3043544590836897, 'n_bins': 18, 'scheduler_patience': 5, 'scheduler_factor': 0.48602426412499666, 'early_stopping_patience': 4}. Best is trial 81 with value: 0.14825416838187774.
Train: 2407 rows (1613 IDs),Test: 598 rows (404 IDs) 

n_features_x : 6, n_features_per_modality: [16, 23, 19, 17, 7, 4, 4, 4, 1, 4]

--- ImbalancedRegressionLoss initialized ---
  Bins: 18, Focal gamma: 0.9612863986941075, Base loss: huber
  Bin [0.00, 0.06): count=  172, weight=0.058
  Bin [0.06, 0.11): count=  413, weight=0.024
  Bin [0.11, 0.17): count=  376, weight=0.027
  Bin [0.17, 0.22): count=  370, weight=0.027
  Bin [0.22, 0.28): count=  255, weight=0.040
  Bin [0.28, 0.33): count=  223, weight=0.045
  Bin [0.33, 0.39): count=   89, weight=0.112
  Bin [0.39, 0.44): count=  142, weight=0.071
  Bin [0.44, 0.50): count=  122, weight=0.082
  Bin [0.50, 0.56): count=   93, weight=0.108
  Bin [0.56, 0.61): count=   64, weight=0.156
  Bin [0.61, 0.67): count=   36, weight=0.273
  Bin [0.67, 0.72): count=   10, weight=0.920
  Bin [0.72, 0.78): count=   26, weight=0.375
  Bin [0.78, 0.83): count=    9, weight=1.012
  Bin [0.83, 0.89): count=    4, weight=2.023
  Bin [0.89, 0.94): count=    3, weight=2.529
  Bin [0.94, 1.00): count=    0, weight=10.117
-------------------------------------------

  Pred range: [0.1523, 0.6118], std: 0.0759
  RMSE : 0.1814, R2: -0.0985, MAE: 0.1541, Spearman rho: 0.3799, Spearman p: 5.7117e-22, Pearson r: 0.3879, Pearson p: 6.6002e-23
  Pred range: [0.1127, 0.5721], std: 0.0787
  RMSE : 0.1605, R2: 0.1401, MAE: 0.1311, Spearman rho: 0.4218, Spearman p: 3.4259e-27, Pearson r: 0.4273, Pearson p: 6.2122e-28
  Pred range: [0.1123, 0.5932], std: 0.0841
  RMSE : 0.1616, R2: 0.1285, MAE: 0.1332, Spearman rho: 0.4450, Spearman p: 1.9812e-30, Pearson r: 0.4485, Pearson p: 6.2583e-31
  Pred range: [0.1018, 0.6102], std: 0.0863
  RMSE : 0.1583, R2: 0.1639, MAE: 0.1294, Spearman rho: 0.4597, Spearman p: 1.3131e-32, Pearson r: 0.4643, Pearson p: 2.6448e-33
  Pred range: [0.0955, 0.6370], std: 0.0918
  RMSE : 0.1566, R2: 0.1818, MAE: 0.1274, Spearman rho: 0.4749, Spearman p: 5.8207e-35, Pearson r: 0.4803, Pearson p: 7.7731e-36
  Pred range: [0.1023, 0.6595], std: 0.0953
  RMSE : 0.1587, R2: 0.1590, MAE: 0.1305, Spearman rho: 0.4816, Spearman p: 4.8278e-36, Pearson r: 0.4901, Pearson p: 1.8302e-37
  Pred range: [0.0950, 0.6660], std: 0.0972
  RMSE : 0.1573, R2: 0.1738, MAE: 0.1288, Spearman rho: 0.4863, Spearman p: 7.9756e-37, Pearson r: 0.4961, Pearson p: 1.8123e-38
  Pred range: [0.0896, 0.6545], std: 0.0963
  RMSE : 0.1549, R2: 0.1989, MAE: 0.1260, Spearman rho: 0.4902, Spearman p: 1.7628e-37, Pearson r: 0.5001, Pearson p: 3.5975e-39
  Pred range: [0.1024, 0.6891], std: 0.1016
  RMSE : 0.1601, R2: 0.1449, MAE: 0.1317, Spearman rho: 0.4917, Spearman p: 1.0064e-37, Pearson r: 0.5036, Pearson p: 9.1490e-40
  Pred range: [0.1037, 0.6665], std: 0.1007
  RMSE : 0.1575, R2: 0.1715, MAE: 0.1291, Spearman rho: 0.4949, Spearman p: 2.8520e-38, Pearson r: 0.5083, Pearson p: 1.3098e-40
  Pred range: [0.1047, 0.6799], std: 0.1011
  RMSE : 0.1601, R2: 0.1443, MAE: 0.1321, Spearman rho: 0.4921, Spearman p: 8.5497e-38, Pearson r: 0.5087, Pearson p: 1.1189e-40
  Pred range: [0.0937, 0.6650], std: 0.0987
  RMSE : 0.1546, R2: 0.2020, MAE: 0.1256, Spearman rho: 0.4920, Spearman p: 8.9090e-38, Pearson r: 0.5082, Pearson p: 1.3932e-40
  Pred range: [0.0893, 0.6441], std: 0.0980
  RMSE : 0.1521, R2: 0.2274, MAE: 0.1225, Spearman rho: 0.4960, Spearman p: 1.8946e-38, Pearson r: 0.5107, Pearson p: 4.8695e-41
  Pred range: [0.0905, 0.6526], std: 0.0976
  RMSE : 0.1531, R2: 0.2180, MAE: 0.1236, Spearman rho: 0.4927, Spearman p: 6.7085e-38, Pearson r: 0.5082, Pearson p: 1.3553e-40
  Pred range: [0.0893, 0.6774], std: 0.1007
  RMSE : 0.1545, R2: 0.2032, MAE: 0.1251, Spearman rho: 0.4927, Spearman p: 6.7990e-38, Pearson r: 0.5078, Pearson p: 1.6077e-40
  Pred range: [0.0912, 0.6629], std: 0.0994
  RMSE : 0.1529, R2: 0.2192, MAE: 0.1235, Spearman rho: 0.4950, Spearman p: 2.7525e-38, Pearson r: 0.5114, Pearson p: 3.6417e-41
  Pred range: [0.1048, 0.6850], std: 0.0997
  RMSE : 0.1584, R2: 0.1626, MAE: 0.1303, Spearman rho: 0.4928, Spearman p: 6.5486e-38, Pearson r: 0.5101, Pearson p: 6.1949e-41
[I 2026-04-27 20:21:46,432] Trial 82 finished with value: 0.1521340969413274 and parameters: {'learning_rate': 9.033073191527853e-05, 'batch_size': 4, 'num_epochs': 18, 'weight_decay': 3.862170164839502e-05, 'layers_PRS': 4, 'layers_SCZ15': 7, 'layers_ADHD9': 1, 'layers_ASD9': 7, 'layers_ACE15': 4, 'layers_ACE18': 5, 'layers_SUD18': 4, 'layers_SES': 3, 'layers_SEX': 5, 'dropout': 0.3062965932681278, 'se_reduction': 3, 'hidden_dim_min': 4, 'base_loss': 'huber', 'huber_delta': 0.17381706043149484, 'focal_gamma': 0.9612863986941075, 'n_bins': 18, 'scheduler_patience': 5, 'scheduler_factor': 0.5197167904872542, 'early_stopping_patience': 4}. Best is trial 81 with value: 0.14825416838187774.
Train: 2407 rows (1613 IDs),Test: 598 rows (404 IDs) 

n_features_x : 6, n_features_per_modality: [16, 23, 19, 17, 7, 4, 4, 4, 1, 4]

--- ImbalancedRegressionLoss initialized ---
  Bins: 18, Focal gamma: 1.2804101119532285, Base loss: huber
  Bin [0.00, 0.06): count=  172, weight=0.058
  Bin [0.06, 0.11): count=  413, weight=0.024
  Bin [0.11, 0.17): count=  376, weight=0.027
  Bin [0.17, 0.22): count=  370, weight=0.027
  Bin [0.22, 0.28): count=  255, weight=0.040
  Bin [0.28, 0.33): count=  223, weight=0.045
  Bin [0.33, 0.39): count=   89, weight=0.112
  Bin [0.39, 0.44): count=  142, weight=0.071
  Bin [0.44, 0.50): count=  122, weight=0.082
  Bin [0.50, 0.56): count=   93, weight=0.108
  Bin [0.56, 0.61): count=   64, weight=0.156
  Bin [0.61, 0.67): count=   36, weight=0.273
  Bin [0.67, 0.72): count=   10, weight=0.920
  Bin [0.72, 0.78): count=   26, weight=0.375
  Bin [0.78, 0.83): count=    9, weight=1.012
  Bin [0.83, 0.89): count=    4, weight=2.023
  Bin [0.89, 0.94): count=    3, weight=2.529
  Bin [0.94, 1.00): count=    0, weight=10.117
-------------------------------------------

  Pred range: [0.1050, 0.5641], std: 0.0737
  RMSE : 0.1554, R2: 0.1943, MAE: 0.1236, Spearman rho: 0.4540, Spearman p: 9.4683e-32, Pearson r: 0.4549, Pearson p: 7.0249e-32
  Pred range: [0.1031, 0.7590], std: 0.1010
  RMSE : 0.1614, R2: 0.1306, MAE: 0.1322, Spearman rho: 0.4848, Spearman p: 1.4102e-36, Pearson r: 0.4845, Pearson p: 1.5649e-36
  Pred range: [0.1173, 0.7382], std: 0.1002
  RMSE : 0.1661, R2: 0.0787, MAE: 0.1383, Spearman rho: 0.4984, Spearman p: 7.1128e-39, Pearson r: 0.5035, Pearson p: 9.3657e-40
  Pred range: [0.1070, 0.7157], std: 0.0981
  RMSE : 0.1601, R2: 0.1449, MAE: 0.1314, Spearman rho: 0.4993, Spearman p: 5.0326e-39, Pearson r: 0.5068, Pearson p: 2.4961e-40
  Pred range: [0.1059, 0.7585], std: 0.1056
  RMSE : 0.1607, R2: 0.1376, MAE: 0.1319, Spearman rho: 0.5067, Spearman p: 2.5586e-40, Pearson r: 0.5161, Pearson p: 5.2268e-42
[I 2026-04-27 20:22:48,378] Trial 83 finished with value: 0.15536748688909174 and parameters: {'learning_rate': 0.000350028598119616, 'batch_size': 4, 'num_epochs': 20, 'weight_decay': 8.385228754467822e-05, 'layers_PRS': 4, 'layers_SCZ15': 7, 'layers_ADHD9': 1, 'layers_ASD9': 7, 'layers_ACE15': 4, 'layers_ACE18': 5, 'layers_SUD18': 3, 'layers_SES': 3, 'layers_SEX': 5, 'dropout': 0.27301788170884345, 'se_reduction': 2, 'hidden_dim_min': 3, 'base_loss': 'huber', 'huber_delta': 0.17632875706690865, 'focal_gamma': 1.2804101119532285, 'n_bins': 18, 'scheduler_patience': 5, 'scheduler_factor': 0.4912231846132901, 'early_stopping_patience': 4}. Best is trial 81 with value: 0.14825416838187774.
Train: 2407 rows (1613 IDs),Test: 598 rows (404 IDs) 

n_features_x : 6, n_features_per_modality: [16, 23, 19, 17, 7, 4, 4, 4, 1, 4]

--- ImbalancedRegressionLoss initialized ---
  Bins: 19, Focal gamma: 1.1504245567061715, Base loss: huber
  Bin [0.00, 0.05): count=  172, weight=0.055
  Bin [0.05, 0.11): count=  413, weight=0.023
  Bin [0.11, 0.16): count=  376, weight=0.025
  Bin [0.16, 0.21): count=  204, weight=0.046
  Bin [0.21, 0.26): count=  295, weight=0.032
  Bin [0.26, 0.32): count=  239, weight=0.039
  Bin [0.32, 0.37): count=  199, weight=0.047
  Bin [0.37, 0.42): count=   73, weight=0.128
  Bin [0.42, 0.47): count=  134, weight=0.070
  Bin [0.47, 0.53): count=  108, weight=0.087
  Bin [0.53, 0.58): count=   78, weight=0.120
  Bin [0.58, 0.63): count=   28, weight=0.327
  Bin [0.63, 0.68): count=   36, weight=0.256
  Bin [0.68, 0.74): count=   24, weight=0.379
  Bin [0.74, 0.79): count=   19, weight=0.474
  Bin [0.79, 0.84): count=    2, weight=3.157
  Bin [0.84, 0.89): count=    4, weight=1.894
  Bin [0.89, 0.95): count=    3, weight=2.368
  Bin [0.95, 1.00): count=    0, weight=9.472
-------------------------------------------

  Pred range: [0.1065, 0.6648], std: 0.0955
  RMSE : 0.1602, R2: 0.1434, MAE: 0.1311, Spearman rho: 0.4778, Spearman p: 1.9821e-35, Pearson r: 0.4756, Pearson p: 4.4345e-35
  Pred range: [0.0920, 0.7226], std: 0.1078
  RMSE : 0.1599, R2: 0.1464, MAE: 0.1307, Spearman rho: 0.4934, Spearman p: 5.2184e-38, Pearson r: 0.5036, Pearson p: 9.0151e-40
  Pred range: [0.1065, 0.7002], std: 0.1029
  RMSE : 0.1611, R2: 0.1340, MAE: 0.1329, Spearman rho: 0.4974, Spearman p: 1.0903e-38, Pearson r: 0.5078, Pearson p: 1.6097e-40
  Pred range: [0.0982, 0.6542], std: 0.1046
  RMSE : 0.1571, R2: 0.1766, MAE: 0.1281, Spearman rho: 0.4929, Spearman p: 6.2493e-38, Pearson r: 0.5118, Pearson p: 3.1187e-41
  Pred range: [0.0655, 0.5996], std: 0.0952
  RMSE : 0.1503, R2: 0.2458, MAE: 0.1195, Spearman rho: 0.4928, Spearman p: 6.6399e-38, Pearson r: 0.5095, Pearson p: 8.0154e-41
  Pred range: [0.0864, 0.6703], std: 0.0965
  RMSE : 0.1615, R2: 0.1294, MAE: 0.1338, Spearman rho: 0.4799, Spearman p: 8.9549e-36, Pearson r: 0.4974, Pearson p: 1.0517e-38
  Pred range: [0.0611, 0.7043], std: 0.1119
  RMSE : 0.1571, R2: 0.1759, MAE: 0.1276, Spearman rho: 0.4934, Spearman p: 5.1557e-38, Pearson r: 0.5195, Pearson p: 1.2163e-42
  Pred range: [0.0261, 0.5971], std: 0.0934
  RMSE : 0.1519, R2: 0.2303, MAE: 0.1222, Spearman rho: 0.4906, Spearman p: 1.5657e-37, Pearson r: 0.5103, Pearson p: 5.7257e-41
