[I 2026-04-27 18:57:41,654] Trial 24 finished with value: 0.14944143605522978 and parameters: {'learning_rate': 0.0006772486600911097, 'batch_size': 4, 'num_epochs': 27, 'weight_decay': 5.065047595347223e-05, 'layers_PRS': 2, 'layers_SCZ15': 4, 'layers_ADHD9': 5, 'layers_ASD9': 5, 'layers_ACE15': 5, 'layers_ACE18': 4, 'layers_SUD18': 3, 'layers_SES': 2, 'layers_SEX': 3, 'dropout': 0.1850719240862092, 'se_reduction': 8, 'hidden_dim_min': 5, 'base_loss': 'huber', 'huber_delta': 0.10071128406097471, 'focal_gamma': 1.3974013609951983, 'n_bins': 17, 'scheduler_patience': 4, 'scheduler_factor': 0.4727772697340525, 'early_stopping_patience': 7}. Best is trial 24 with value: 0.14944143605522978.
Train: 2407 rows (1613 IDs),Test: 598 rows (404 IDs) 

n_features_x : 6, n_features_per_modality: [16, 23, 19, 17, 7, 4, 4, 4, 1, 4]

--- ImbalancedRegressionLoss initialized ---
  Bins: 17, Focal gamma: 1.4771472742475353, Base loss: huber
  Bin [0.00, 0.06): count=  172, weight=0.058
  Bin [0.06, 0.12): count=  413, weight=0.024
  Bin [0.12, 0.18): count=  376, weight=0.027
  Bin [0.18, 0.24): count=  370, weight=0.027
  Bin [0.24, 0.29): count=  255, weight=0.039
  Bin [0.29, 0.35): count=  223, weight=0.045
  Bin [0.35, 0.41): count=  162, weight=0.061
  Bin [0.41, 0.47): count=  134, weight=0.074
  Bin [0.47, 0.53): count=  108, weight=0.092
  Bin [0.53, 0.59): count=   78, weight=0.127
  Bin [0.59, 0.65): count=   47, weight=0.208
  Bin [0.65, 0.71): count=   27, weight=0.357
  Bin [0.71, 0.76): count=   26, weight=0.370
  Bin [0.76, 0.82): count=    9, weight=0.999
  Bin [0.82, 0.88): count=    4, weight=1.999
  Bin [0.88, 0.94): count=    3, weight=2.499
  Bin [0.94, 1.00): count=    0, weight=9.995
-------------------------------------------

  Pred range: [0.1033, 0.7496], std: 0.1156
  RMSE : 0.1750, R2: -0.0219, MAE: 0.1448, Spearman rho: 0.4662, Spearman p: 1.3589e-33, Pearson r: 0.4811, Pearson p: 5.7573e-36
  Pred range: [0.0902, 0.6689], std: 0.1008
  RMSE : 0.1556, R2: 0.1918, MAE: 0.1269, Spearman rho: 0.4887, Spearman p: 3.2223e-37, Pearson r: 0.5074, Pearson p: 1.9062e-40
  Pred range: [0.0890, 0.5984], std: 0.0952
  RMSE : 0.1520, R2: 0.2285, MAE: 0.1229, Spearman rho: 0.4926, Spearman p: 6.9344e-38, Pearson r: 0.5122, Pearson p: 2.6386e-41
  Pred range: [0.1069, 0.7393], std: 0.1157
  RMSE : 0.1742, R2: -0.0135, MAE: 0.1449, Spearman rho: 0.4996, Spearman p: 4.4201e-39, Pearson r: 0.5193, Pearson p: 1.3312e-42
  Pred range: [0.1040, 0.7020], std: 0.1048
  RMSE : 0.1617, R2: 0.1275, MAE: 0.1334, Spearman rho: 0.4927, Spearman p: 6.7914e-38, Pearson r: 0.5157, Pearson p: 6.1181e-42
  Pred range: [0.0900, 0.7078], std: 0.1052
  RMSE : 0.1573, R2: 0.1738, MAE: 0.1283, Spearman rho: 0.4887, Spearman p: 3.1756e-37, Pearson r: 0.5110, Pearson p: 4.3880e-41
  Pred range: [0.0224, 0.6640], std: 0.1003
  RMSE : 0.1518, R2: 0.2306, MAE: 0.1219, Spearman rho: 0.4923, Spearman p: 7.8930e-38, Pearson r: 0.5132, Pearson p: 1.7390e-41
  Pred range: [0.0427, 0.6275], std: 0.1022
  RMSE : 0.1500, R2: 0.2487, MAE: 0.1186, Spearman rho: 0.4912, Spearman p: 1.2394e-37, Pearson r: 0.5140, Pearson p: 1.2665e-41
  Pred range: [0.0806, 0.6941], std: 0.1078
  RMSE : 0.1639, R2: 0.1035, MAE: 0.1353, Spearman rho: 0.4970, Spearman p: 1.2744e-38, Pearson r: 0.5169, Pearson p: 3.6154e-42
  Pred range: [0.0636, 0.7022], std: 0.1005
  RMSE : 0.1686, R2: 0.0517, MAE: 0.1414, Spearman rho: 0.4922, Spearman p: 8.3740e-38, Pearson r: 0.5114, Pearson p: 3.6608e-41
  Pred range: [0.0717, 0.7040], std: 0.1094
  RMSE : 0.1543, R2: 0.2054, MAE: 0.1239, Spearman rho: 0.4929, Spearman p: 6.3241e-38, Pearson r: 0.5144, Pearson p: 1.0577e-41
  Pred range: [0.0518, 0.6809], std: 0.1049
  RMSE : 0.1538, R2: 0.2108, MAE: 0.1239, Spearman rho: 0.4880, Spearman p: 4.1773e-37, Pearson r: 0.5120, Pearson p: 2.8163e-41
  Pred range: [0.0034, 0.7673], std: 0.1141
  RMSE : 0.1590, R2: 0.1566, MAE: 0.1284, Spearman rho: 0.4867, Spearman p: 6.7800e-37, Pearson r: 0.5070, Pearson p: 2.2474e-40
  Pred range: [0.0065, 0.6838], std: 0.1037
  RMSE : 0.1512, R2: 0.2367, MAE: 0.1202, Spearman rho: 0.4889, Spearman p: 2.9337e-37, Pearson r: 0.5126, Pearson p: 2.2592e-41
  Pred range: [0.0609, 0.8000], std: 0.1125
  RMSE : 0.1673, R2: 0.0658, MAE: 0.1378, Spearman rho: 0.4856, Spearman p: 1.0368e-36, Pearson r: 0.5090, Pearson p: 9.8326e-41
[I 2026-04-27 18:59:29,160] Trial 25 finished with value: 0.15002416575002334 and parameters: {'learning_rate': 0.0006125404310247959, 'batch_size': 6, 'num_epochs': 28, 'weight_decay': 4.769948200604799e-05, 'layers_PRS': 2, 'layers_SCZ15': 4, 'layers_ADHD9': 6, 'layers_ASD9': 5, 'layers_ACE15': 5, 'layers_ACE18': 6, 'layers_SUD18': 2, 'layers_SES': 2, 'layers_SEX': 3, 'dropout': 0.10604692823567191, 'se_reduction': 8, 'hidden_dim_min': 5, 'base_loss': 'huber', 'huber_delta': 0.1037275487114241, 'focal_gamma': 1.4771472742475353, 'n_bins': 17, 'scheduler_patience': 4, 'scheduler_factor': 0.46755405937680616, 'early_stopping_patience': 7}. Best is trial 24 with value: 0.14944143605522978.
Train: 2407 rows (1613 IDs),Test: 598 rows (404 IDs) 

n_features_x : 6, n_features_per_modality: [16, 23, 19, 17, 7, 4, 4, 4, 1, 4]

--- ImbalancedRegressionLoss initialized ---
  Bins: 17, Focal gamma: 1.473381277700822, Base loss: huber
  Bin [0.00, 0.06): count=  172, weight=0.058
  Bin [0.06, 0.12): count=  413, weight=0.024
  Bin [0.12, 0.18): count=  376, weight=0.027
  Bin [0.18, 0.24): count=  370, weight=0.027
  Bin [0.24, 0.29): count=  255, weight=0.039
  Bin [0.29, 0.35): count=  223, weight=0.045
  Bin [0.35, 0.41): count=  162, weight=0.061
  Bin [0.41, 0.47): count=  134, weight=0.074
  Bin [0.47, 0.53): count=  108, weight=0.092
  Bin [0.53, 0.59): count=   78, weight=0.127
  Bin [0.59, 0.65): count=   47, weight=0.208
  Bin [0.65, 0.71): count=   27, weight=0.357
  Bin [0.71, 0.76): count=   26, weight=0.370
  Bin [0.76, 0.82): count=    9, weight=0.999
  Bin [0.82, 0.88): count=    4, weight=1.999
  Bin [0.88, 0.94): count=    3, weight=2.499
  Bin [0.94, 1.00): count=    0, weight=9.995
-------------------------------------------

  Pred range: [0.1317, 0.6851], std: 0.0877
  RMSE : 0.1669, R2: 0.0701, MAE: 0.1404, Spearman rho: 0.4765, Spearman p: 3.1631e-35, Pearson r: 0.4800, Pearson p: 8.6551e-36
  Pred range: [0.0975, 0.6774], std: 0.0958
  RMSE : 0.1542, R2: 0.2064, MAE: 0.1253, Spearman rho: 0.4908, Spearman p: 1.4234e-37, Pearson r: 0.5028, Pearson p: 1.2357e-39
  Pred range: [0.1163, 0.7202], std: 0.1014
  RMSE : 0.1647, R2: 0.0945, MAE: 0.1373, Spearman rho: 0.4938, Spearman p: 4.3474e-38, Pearson r: 0.5087, Pearson p: 1.1332e-40
  Pred range: [0.1239, 0.7312], std: 0.1024
  RMSE : 0.1686, R2: 0.0514, MAE: 0.1413, Spearman rho: 0.4974, Spearman p: 1.0816e-38, Pearson r: 0.5123, Pearson p: 2.5089e-41
  Pred range: [0.1028, 0.6831], std: 0.1027
  RMSE : 0.1560, R2: 0.1882, MAE: 0.1271, Spearman rho: 0.4969, Spearman p: 1.2846e-38, Pearson r: 0.5141, Pearson p: 1.1891e-41
  Pred range: [0.0904, 0.6766], std: 0.1048
  RMSE : 0.1548, R2: 0.2006, MAE: 0.1259, Spearman rho: 0.4931, Spearman p: 5.8521e-38, Pearson r: 0.5164, Pearson p: 4.6271e-42
  Pred range: [0.0959, 0.7171], std: 0.1090
  RMSE : 0.1588, R2: 0.1580, MAE: 0.1297, Spearman rho: 0.4902, Spearman p: 1.8000e-37, Pearson r: 0.5151, Pearson p: 7.9538e-42
  Pred range: [0.0850, 0.6981], std: 0.1082
  RMSE : 0.1557, R2: 0.1909, MAE: 0.1264, Spearman rho: 0.4905, Spearman p: 1.5776e-37, Pearson r: 0.5137, Pearson p: 1.3884e-41
  Pred range: [0.0766, 0.6692], std: 0.1048
  RMSE : 0.1525, R2: 0.2240, MAE: 0.1229, Spearman rho: 0.4918, Spearman p: 9.6919e-38, Pearson r: 0.5145, Pearson p: 9.9296e-42
  Pred range: [0.0576, 0.6228], std: 0.0994
  RMSE : 0.1501, R2: 0.2478, MAE: 0.1196, Spearman rho: 0.4893, Spearman p: 2.5200e-37, Pearson r: 0.5132, Pearson p: 1.7603e-41
  Pred range: [0.0445, 0.6693], std: 0.1036
  RMSE : 0.1534, R2: 0.2149, MAE: 0.1239, Spearman rho: 0.4910, Spearman p: 1.2923e-37, Pearson r: 0.5141, Pearson p: 1.1835e-41
  Pred range: [0.0590, 0.6976], std: 0.1079
  RMSE : 0.1578, R2: 0.1693, MAE: 0.1285, Spearman rho: 0.4937, Spearman p: 4.5862e-38, Pearson r: 0.5144, Pearson p: 1.0454e-41
  Pred range: [0.0651, 0.6887], std: 0.1042
  RMSE : 0.1563, R2: 0.1846, MAE: 0.1273, Spearman rho: 0.4918, Spearman p: 9.5298e-38, Pearson r: 0.5145, Pearson p: 9.9408e-42
  Pred range: [0.0506, 0.6502], std: 0.1027
  RMSE : 0.1527, R2: 0.2221, MAE: 0.1227, Spearman rho: 0.4916, Spearman p: 1.0349e-37, Pearson r: 0.5133, Pearson p: 1.6572e-41
  Pred range: [0.0479, 0.6853], std: 0.1055
  RMSE : 0.1556, R2: 0.1914, MAE: 0.1263, Spearman rho: 0.4910, Spearman p: 1.3005e-37, Pearson r: 0.5141, Pearson p: 1.1847e-41
  Pred range: [0.0352, 0.6803], std: 0.1047
  RMSE : 0.1531, R2: 0.2174, MAE: 0.1233, Spearman rho: 0.4910, Spearman p: 1.3085e-37, Pearson r: 0.5133, Pearson p: 1.6541e-41
  Pred range: [0.0548, 0.6982], std: 0.1063
  RMSE : 0.1555, R2: 0.1927, MAE: 0.1260, Spearman rho: 0.4883, Spearman p: 3.7406e-37, Pearson r: 0.5114, Pearson p: 3.7415e-41
[I 2026-04-27 19:01:13,303] Trial 26 finished with value: 0.1501133145545697 and parameters: {'learning_rate': 0.0005165705694327773, 'batch_size': 6, 'num_epochs': 29, 'weight_decay': 5.095540862091561e-05, 'layers_PRS': 2, 'layers_SCZ15': 4, 'layers_ADHD9': 4, 'layers_ASD9': 5, 'layers_ACE15': 5, 'layers_ACE18': 4, 'layers_SUD18': 2, 'layers_SES': 1, 'layers_SEX': 2, 'dropout': 0.10488232095579106, 'se_reduction': 8, 'hidden_dim_min': 5, 'base_loss': 'huber', 'huber_delta': 0.1131922082259683, 'focal_gamma': 1.473381277700822, 'n_bins': 17, 'scheduler_patience': 4, 'scheduler_factor': 0.5286110136637567, 'early_stopping_patience': 7}. Best is trial 24 with value: 0.14944143605522978.
Train: 2407 rows (1613 IDs),Test: 598 rows (404 IDs) 

n_features_x : 6, n_features_per_modality: [16, 23, 19, 17, 7, 4, 4, 4, 1, 4]

--- ImbalancedRegressionLoss initialized ---
  Bins: 20, Focal gamma: 1.8388292587006925, Base loss: huber
  Bin [0.00, 0.05): count=  172, weight=0.053
  Bin [0.05, 0.10): count=  413, weight=0.022
  Bin [0.10, 0.15): count=  175, weight=0.052
  Bin [0.15, 0.20): count=  405, weight=0.023
  Bin [0.20, 0.25): count=  295, weight=0.031
  Bin [0.25, 0.30): count=  126, weight=0.072
  Bin [0.30, 0.35): count=  223, weight=0.041
  Bin [0.35, 0.40): count=  162, weight=0.056
  Bin [0.40, 0.45): count=   69, weight=0.131
  Bin [0.45, 0.50): count=  122, weight=0.074
  Bin [0.50, 0.55): count=   93, weight=0.097
  Bin [0.55, 0.60): count=   36, weight=0.247
  Bin [0.60, 0.65): count=   47, weight=0.190
  Bin [0.65, 0.70): count=   27, weight=0.326
  Bin [0.70, 0.75): count=   14, weight=0.609
  Bin [0.75, 0.80): count=   19, weight=0.457
  Bin [0.80, 0.85): count=    5, weight=1.523
  Bin [0.85, 0.90): count=    1, weight=4.570
  Bin [0.90, 0.95): count=    3, weight=2.285
  Bin [0.95, 1.00): count=    0, weight=9.140
-------------------------------------------

  Pred range: [0.0982, 0.6565], std: 0.0878
  RMSE : 0.1575, R2: 0.1721, MAE: 0.1288, Spearman rho: 0.4702, Spearman p: 3.1266e-34, Pearson r: 0.4763, Pearson p: 3.4117e-35
  Pred range: [0.0597, 0.6562], std: 0.1018
  RMSE : 0.1532, R2: 0.2169, MAE: 0.1240, Spearman rho: 0.4887, Spearman p: 3.2278e-37, Pearson r: 0.5102, Pearson p: 6.1453e-41
  Pred range: [0.0969, 0.6568], std: 0.0960
  RMSE : 0.1742, R2: -0.0129, MAE: 0.1478, Spearman rho: 0.4871, Spearman p: 5.9960e-37, Pearson r: 0.5023, Pearson p: 1.5146e-39
  Pred range: [0.0381, 0.6525], std: 0.1030
  RMSE : 0.1533, R2: 0.2159, MAE: 0.1233, Spearman rho: 0.4819, Spearman p: 4.2335e-36, Pearson r: 0.5042, Pearson p: 7.0297e-40
  Pred range: [0.0342, 0.6112], std: 0.0936
  RMSE : 0.1548, R2: 0.1999, MAE: 0.1264, Spearman rho: 0.4804, Spearman p: 7.4229e-36, Pearson r: 0.5016, Pearson p: 2.0030e-39
  Pred range: [0.0284, 0.5862], std: 0.0962
  RMSE : 0.1529, R2: 0.2194, MAE: 0.1237, Spearman rho: 0.4844, Spearman p: 1.6775e-36, Pearson r: 0.5074, Pearson p: 1.8778e-40
  Pred range: [0.0355, 0.6409], std: 0.0982
  RMSE : 0.1604, R2: 0.1417, MAE: 0.1322, Spearman rho: 0.4825, Spearman p: 3.4151e-36, Pearson r: 0.5063, Pearson p: 2.9614e-40
  Pred range: [0.0025, 0.6053], std: 0.0980
  RMSE : 0.1578, R2: 0.1691, MAE: 0.1294, Spearman rho: 0.4800, Spearman p: 8.5713e-36, Pearson r: 0.5006, Pearson p: 3.0070e-39
  Pred range: [0.0406, 0.6377], std: 0.1058
  RMSE : 0.1597, R2: 0.1483, MAE: 0.1308, Spearman rho: 0.4843, Spearman p: 1.6950e-36, Pearson r: 0.5081, Pearson p: 1.4139e-40
  Pred range: [0.0056, 0.6154], std: 0.1015
  RMSE : 0.1652, R2: 0.0889, MAE: 0.1371, Spearman rho: 0.4859, Spearman p: 9.3514e-37, Pearson r: 0.5034, Pearson p: 9.5726e-40
[I 2026-04-27 19:02:19,502] Trial 27 finished with value: 0.15292723496615362 and parameters: {'learning_rate': 0.0014916716400012805, 'batch_size': 6, 'num_epochs': 10, 'weight_decay': 0.00024449251381250395, 'layers_PRS': 2, 'layers_SCZ15': 4, 'layers_ADHD9': 5, 'layers_ASD9': 5, 'layers_ACE15': 5, 'layers_ACE18': 5, 'layers_SUD18': 1, 'layers_SES': 2, 'layers_SEX': 3, 'dropout': 0.13423501731857593, 'se_reduction': 8, 'hidden_dim_min': 2, 'base_loss': 'huber', 'huber_delta': 0.15087672264822174, 'focal_gamma': 1.8388292587006925, 'n_bins': 20, 'scheduler_patience': 3, 'scheduler_factor': 0.4683495765344564, 'early_stopping_patience': 7}. Best is trial 24 with value: 0.14944143605522978.
Train: 2407 rows (1613 IDs),Test: 598 rows (404 IDs) 

n_features_x : 6, n_features_per_modality: [16, 23, 19, 17, 7, 4, 4, 4, 1, 4]

--- ImbalancedRegressionLoss initialized ---
  Bins: 17, Focal gamma: 2.2248755088459755, Base loss: huber
  Bin [0.00, 0.06): count=  172, weight=0.058
  Bin [0.06, 0.12): count=  413, weight=0.024
  Bin [0.12, 0.18): count=  376, weight=0.027
  Bin [0.18, 0.24): count=  370, weight=0.027
  Bin [0.24, 0.29): count=  255, weight=0.039
  Bin [0.29, 0.35): count=  223, weight=0.045
  Bin [0.35, 0.41): count=  162, weight=0.061
  Bin [0.41, 0.47): count=  134, weight=0.074
  Bin [0.47, 0.53): count=  108, weight=0.092
  Bin [0.53, 0.59): count=   78, weight=0.127
  Bin [0.59, 0.65): count=   47, weight=0.208
  Bin [0.65, 0.71): count=   27, weight=0.357
  Bin [0.71, 0.76): count=   26, weight=0.370
  Bin [0.76, 0.82): count=    9, weight=0.999
  Bin [0.82, 0.88): count=    4, weight=1.999
  Bin [0.88, 0.94): count=    3, weight=2.499
  Bin [0.94, 1.00): count=    0, weight=9.995
-------------------------------------------

  Pred range: [0.0896, 0.6692], std: 0.0958
  RMSE : 0.1620, R2: 0.1235, MAE: 0.1336, Spearman rho: 0.4793, Spearman p: 1.1294e-35, Pearson r: 0.4974, Pearson p: 1.0694e-38
  Pred range: [0.0886, 0.5946], std: 0.0864
  RMSE : 0.1502, R2: 0.2468, MAE: 0.1216, Spearman rho: 0.4982, Spearman p: 7.6918e-39, Pearson r: 0.5230, Pearson p: 2.6905e-43
  Pred range: [0.1063, 0.7066], std: 0.1109
  RMSE : 0.1655, R2: 0.0856, MAE: 0.1366, Spearman rho: 0.5012, Spearman p: 2.3541e-39, Pearson r: 0.5234, Pearson p: 2.2701e-43
  Pred range: [0.1151, 0.6360], std: 0.0929
  RMSE : 0.1541, R2: 0.2071, MAE: 0.1263, Spearman rho: 0.4937, Spearman p: 4.6600e-38, Pearson r: 0.5184, Pearson p: 1.9786e-42
  Pred range: [0.0699, 0.6158], std: 0.0902
  RMSE : 0.1511, R2: 0.2375, MAE: 0.1224, Spearman rho: 0.4959, Spearman p: 1.9721e-38, Pearson r: 0.5169, Pearson p: 3.6518e-42
  Pred range: [0.0289, 0.6859], std: 0.1000
  RMSE : 0.1510, R2: 0.2388, MAE: 0.1207, Spearman rho: 0.4883, Spearman p: 3.7049e-37, Pearson r: 0.5105, Pearson p: 5.4508e-41
  Pred range: [0.1274, 0.7449], std: 0.1064
  RMSE : 0.1758, R2: -0.0315, MAE: 0.1481, Spearman rho: 0.4939, Spearman p: 4.3184e-38, Pearson r: 0.5143, Pearson p: 1.1115e-41
  Pred range: [0.0628, 0.6347], std: 0.0921
  RMSE : 0.1526, R2: 0.2223, MAE: 0.1238, Spearman rho: 0.4870, Spearman p: 6.0529e-37, Pearson r: 0.5097, Pearson p: 7.3809e-41
  Pred range: [0.0597, 0.6407], std: 0.0947
  RMSE : 0.1533, R2: 0.2152, MAE: 0.1249, Spearman rho: 0.4905, Spearman p: 1.5895e-37, Pearson r: 0.5131, Pearson p: 1.7802e-41
  Pred range: [0.0277, 0.6133], std: 0.0930
  RMSE : 0.1501, R2: 0.2482, MAE: 0.1195, Spearman rho: 0.4882, Spearman p: 3.8022e-37, Pearson r: 0.5107, Pearson p: 4.9222e-41
  Pred range: [0.0330, 0.6845], std: 0.1063
  RMSE : 0.1568, R2: 0.1790, MAE: 0.1280, Spearman rho: 0.4929, Spearman p: 6.2891e-38, Pearson r: 0.5147, Pearson p: 9.3775e-42
  Pred range: [0.0239, 0.6194], std: 0.0996
  RMSE : 0.1517, R2: 0.2322, MAE: 0.1218, Spearman rho: 0.4900, Spearman p: 1.9032e-37, Pearson r: 0.5113, Pearson p: 3.8684e-41
  Pred range: [0.0655, 0.6735], std: 0.0999
  RMSE : 0.1586, R2: 0.1603, MAE: 0.1304, Spearman rho: 0.4852, Spearman p: 1.2210e-36, Pearson r: 0.5067, Pearson p: 2.5321e-40
  Pred range: [0.0557, 0.6146], std: 0.0961
  RMSE : 0.1506, R2: 0.2428, MAE: 0.1199, Spearman rho: 0.4854, Spearman p: 1.1267e-36, Pearson r: 0.5080, Pearson p: 1.4963e-40
  Pred range: [0.0614, 0.6705], std: 0.1043
  RMSE : 0.1553, R2: 0.1947, MAE: 0.1265, Spearman rho: 0.4944, Spearman p: 3.4596e-38, Pearson r: 0.5169, Pearson p: 3.6125e-42
  Pred range: [0.0383, 0.6698], std: 0.1018
  RMSE : 0.1527, R2: 0.2212, MAE: 0.1233, Spearman rho: 0.4921, Spearman p: 8.4712e-38, Pearson r: 0.5145, Pearson p: 1.0089e-41
  Pred range: [0.0366, 0.6318], std: 0.0969
  RMSE : 0.1511, R2: 0.2384, MAE: 0.1209, Spearman rho: 0.4880, Spearman p: 4.1121e-37, Pearson r: 0.5099, Pearson p: 6.9958e-41
  Pred range: [0.0293, 0.6362], std: 0.0986
  RMSE : 0.1508, R2: 0.2405, MAE: 0.1205, Spearman rho: 0.4888, Spearman p: 3.0229e-37, Pearson r: 0.5113, Pearson p: 3.7673e-41
[I 2026-04-27 19:04:18,364] Trial 28 finished with value: 0.15007180938855896 and parameters: {'learning_rate': 0.000731462345904954, 'batch_size': 6, 'num_epochs': 28, 'weight_decay': 5.3323981794788945e-05, 'layers_PRS': 3, 'layers_SCZ15': 3, 'layers_ADHD9': 3, 'layers_ASD9': 4, 'layers_ACE15': 5, 'layers_ACE18': 7, 'layers_SUD18': 2, 'layers_SES': 4, 'layers_SEX': 1, 'dropout': 0.17930852559946803, 'se_reduction': 4, 'hidden_dim_min': 4, 'base_loss': 'huber', 'huber_delta': 0.09370399046719481, 'focal_gamma': 2.2248755088459755, 'n_bins': 17, 'scheduler_patience': 4, 'scheduler_factor': 0.5403629431052004, 'early_stopping_patience': 8}. Best is trial 24 with value: 0.14944143605522978.
Train: 2407 rows (1613 IDs),Test: 598 rows (404 IDs) 

n_features_x : 6, n_features_per_modality: [16, 23, 19, 17, 7, 4, 4, 4, 1, 4]

--- ImbalancedRegressionLoss initialized ---
  Bins: 14, Focal gamma: 1.6347737968897882, Base loss: huber
  Bin [0.00, 0.07): count=  383, weight=0.042
  Bin [0.07, 0.14): count=  377, weight=0.043
  Bin [0.14, 0.21): count=  571, weight=0.028
  Bin [0.21, 0.29): count=  255, weight=0.063
  Bin [0.29, 0.36): count=  223, weight=0.072
  Bin [0.36, 0.43): count=  231, weight=0.070
  Bin [0.43, 0.50): count=  122, weight=0.131
  Bin [0.50, 0.57): count=   93, weight=0.172
  Bin [0.57, 0.64): count=   83, weight=0.192
  Bin [0.64, 0.71): count=   27, weight=0.577
  Bin [0.71, 0.79): count=   26, weight=0.598
  Bin [0.79, 0.86): count=   12, weight=1.243
  Bin [0.86, 0.93): count=    2, weight=5.384
  Bin [0.93, 1.00): count=    2, weight=5.384
-------------------------------------------

  Pred range: [0.1451, 0.5941], std: 0.0722
  RMSE : 0.1679, R2: 0.0592, MAE: 0.1387, Spearman rho: 0.3804, Spearman p: 5.0367e-22, Pearson r: 0.3816, Pearson p: 3.6047e-22
  Pred range: [0.1490, 0.6462], std: 0.0896
  RMSE : 0.1749, R2: -0.0211, MAE: 0.1467, Spearman rho: 0.4312, Spearman p: 1.7663e-28, Pearson r: 0.4310, Pearson p: 1.9284e-28
  Pred range: [0.1350, 0.6819], std: 0.1023
  RMSE : 0.1692, R2: 0.0443, MAE: 0.1399, Spearman rho: 0.4596, Spearman p: 1.4024e-32, Pearson r: 0.4567, Pearson p: 3.7669e-32
  Pred range: [0.1353, 0.6353], std: 0.0913
  RMSE : 0.1614, R2: 0.1302, MAE: 0.1326, Spearman rho: 0.4688, Spearman p: 5.2939e-34, Pearson r: 0.4683, Pearson p: 6.3535e-34
  Pred range: [0.1326, 0.6353], std: 0.0914
  RMSE : 0.1591, R2: 0.1553, MAE: 0.1305, Spearman rho: 0.4827, Spearman p: 3.1785e-36, Pearson r: 0.4846, Pearson p: 1.5588e-36
  Pred range: [0.1150, 0.6215], std: 0.0912
  RMSE : 0.1537, R2: 0.2110, MAE: 0.1236, Spearman rho: 0.4923, Spearman p: 8.0927e-38, Pearson r: 0.4937, Pearson p: 4.5739e-38
  Pred range: [0.1331, 0.7351], std: 0.1053
  RMSE : 0.1672, R2: 0.0670, MAE: 0.1386, Spearman rho: 0.4914, Spearman p: 1.1326e-37, Pearson r: 0.4963, Pearson p: 1.6811e-38
  Pred range: [0.1170, 0.6672], std: 0.0999
  RMSE : 0.1583, R2: 0.1638, MAE: 0.1297, Spearman rho: 0.4962, Spearman p: 1.7526e-38, Pearson r: 0.5032, Pearson p: 1.0469e-39
  Pred range: [0.1084, 0.6758], std: 0.0966
  RMSE : 0.1542, R2: 0.2065, MAE: 0.1244, Spearman rho: 0.4897, Spearman p: 2.2046e-37, Pearson r: 0.4991, Pearson p: 5.5471e-39
  Pred range: [0.1133, 0.6646], std: 0.0948
  RMSE : 0.1548, R2: 0.2000, MAE: 0.1258, Spearman rho: 0.4917, Spearman p: 1.0156e-37, Pearson r: 0.5028, Pearson p: 1.2311e-39
  Pred range: [0.1212, 0.7008], std: 0.0996
  RMSE : 0.1592, R2: 0.1540, MAE: 0.1309, Spearman rho: 0.4923, Spearman p: 7.8988e-38, Pearson r: 0.5049, Pearson p: 5.3002e-40
  Pred range: [0.1114, 0.6940], std: 0.0995
  RMSE : 0.1565, R2: 0.1826, MAE: 0.1276, Spearman rho: 0.4934, Spearman p: 5.2053e-38, Pearson r: 0.5058, Pearson p: 3.6073e-40
  Pred range: [0.1124, 0.7128], std: 0.1022
  RMSE : 0.1585, R2: 0.1616, MAE: 0.1298, Spearman rho: 0.4945, Spearman p: 3.3988e-38, Pearson r: 0.5073, Pearson p: 2.0283e-40
