[I 2026-04-29 01:23:30,021] Trial 21 finished with value: 0.15179096090641536 and parameters: {'learning_rate': 0.003785542187847662, 'batch_size': 16, 'num_epochs': 14, 'weight_decay': 0.000278308842121026, 'layers_PRS': 2, 'layers_SCZ15': 2, 'layers_ADHD9': 5, 'layers_ASD9': 4, 'layers_ACE15': 2, 'layers_ACE18': 1, 'layers_SUD18': 2, 'layers_SES': 1, 'layers_SEX': 1, 'dropout': 0.15439611070571296, 'se_reduction': 8, 'hidden_dim_min': 11, 'base_loss': 'huber', 'huber_delta': 0.15816854875715633, 'focal_gamma': 2.90886103411262, 'n_bins': 20, 'scheduler_patience': 2, 'scheduler_factor': 0.5194381444513866, 'early_stopping_patience': 3}. Best is trial 10 with value: 0.15105277601580916.
Train: 2407 rows (1613 IDs),Test: 598 rows (404 IDs) 

n_features_x : 6, n_features_per_modality: [16, 23, 19, 17, 7, 4, 4, 4, 1, 4]

--- ImbalancedRegressionLoss initialized ---
  Bins: 18, Focal gamma: 2.516974314261986, Base loss: huber
  Bin [0.00, 0.06): count=  172, weight=0.058
  Bin [0.06, 0.11): count=  413, weight=0.024
  Bin [0.11, 0.17): count=  376, weight=0.027
  Bin [0.17, 0.22): count=  370, weight=0.027
  Bin [0.22, 0.28): count=  255, weight=0.040
  Bin [0.28, 0.33): count=  223, weight=0.045
  Bin [0.33, 0.39): count=   89, weight=0.112
  Bin [0.39, 0.44): count=  142, weight=0.071
  Bin [0.44, 0.50): count=  122, weight=0.082
  Bin [0.50, 0.56): count=   93, weight=0.108
  Bin [0.56, 0.61): count=   64, weight=0.156
  Bin [0.61, 0.67): count=   36, weight=0.273
  Bin [0.67, 0.72): count=   10, weight=0.920
  Bin [0.72, 0.78): count=   26, weight=0.375
  Bin [0.78, 0.83): count=    9, weight=1.012
  Bin [0.83, 0.89): count=    4, weight=2.023
  Bin [0.89, 0.94): count=    3, weight=2.529
  Bin [0.94, 1.00): count=    0, weight=10.117
-------------------------------------------

  Pred range: [0.1393, 0.7350], std: 0.0952
  RMSE : 0.1681, R2: 0.0565, MAE: 0.1409, Spearman rho: 0.4709, Spearman p: 2.5100e-34, Pearson r: 0.4903, Pearson p: 1.7264e-37
  Pred range: [0.1712, 0.7488], std: 0.1006
  RMSE : 0.2072, R2: -0.4335, MAE: 0.1791, Spearman rho: 0.4890, Spearman p: 2.8047e-37, Pearson r: 0.5027, Pearson p: 1.2660e-39
  Pred range: [0.1496, 0.7184], std: 0.0975
  RMSE : 0.1894, R2: -0.1971, MAE: 0.1619, Spearman rho: 0.4884, Spearman p: 3.5505e-37, Pearson r: 0.5048, Pearson p: 5.5379e-40
  Pred range: [0.1827, 0.7979], std: 0.1028
  RMSE : 0.2086, R2: -0.4523, MAE: 0.1798, Spearman rho: 0.4736, Spearman p: 9.0734e-35, Pearson r: 0.5029, Pearson p: 1.1950e-39
[I 2026-04-29 01:23:38,225] Trial 22 finished with value: 0.16812231008512044 and parameters: {'learning_rate': 0.005186762371377667, 'batch_size': 16, 'num_epochs': 12, 'weight_decay': 0.0007400976186256623, 'layers_PRS': 2, 'layers_SCZ15': 3, 'layers_ADHD9': 5, 'layers_ASD9': 4, 'layers_ACE15': 2, 'layers_ACE18': 1, 'layers_SUD18': 3, 'layers_SES': 1, 'layers_SEX': 1, 'dropout': 0.27155148200048884, 'se_reduction': 7, 'hidden_dim_min': 13, 'base_loss': 'huber', 'huber_delta': 0.1848853833762156, 'focal_gamma': 2.516974314261986, 'n_bins': 18, 'scheduler_patience': 2, 'scheduler_factor': 0.5807909190893125, 'early_stopping_patience': 3}. Best is trial 10 with value: 0.15105277601580916.
Train: 2407 rows (1613 IDs),Test: 598 rows (404 IDs) 

n_features_x : 6, n_features_per_modality: [16, 23, 19, 17, 7, 4, 4, 4, 1, 4]

--- ImbalancedRegressionLoss initialized ---
  Bins: 11, Focal gamma: 1.9111535674892792, Base loss: huber
  Bin [0.00, 0.09): count=  585, weight=0.034
  Bin [0.09, 0.18): count=  580, weight=0.034
  Bin [0.18, 0.27): count=  421, weight=0.047
  Bin [0.27, 0.36): count=  312, weight=0.064
  Bin [0.36, 0.45): count=  207, weight=0.096
  Bin [0.45, 0.55): count=  108, weight=0.183
  Bin [0.55, 0.64): count=  125, weight=0.159
  Bin [0.64, 0.73): count=   41, weight=0.476
  Bin [0.73, 0.82): count=   21, weight=0.909
  Bin [0.82, 0.91): count=    4, weight=3.999
  Bin [0.91, 1.00): count=    3, weight=4.998
-------------------------------------------

  Pred range: [0.1614, 0.7044], std: 0.1003
  RMSE : 0.1730, R2: 0.0005, MAE: 0.1461, Spearman rho: 0.4844, Spearman p: 1.6815e-36, Pearson r: 0.4911, Pearson p: 1.2585e-37
  Pred range: [0.0779, 0.7103], std: 0.1074
  RMSE : 0.1694, R2: 0.0421, MAE: 0.1407, Spearman rho: 0.4598, Spearman p: 1.2825e-32, Pearson r: 0.4901, Pearson p: 1.8468e-37
  Pred range: [-0.0424, 0.6676], std: 0.1097
  RMSE : 0.1629, R2: 0.1140, MAE: 0.1332, Spearman rho: 0.4611, Spearman p: 8.1196e-33, Pearson r: 0.4827, Pearson p: 3.1641e-36
  Pred range: [-0.1336, 0.5440], std: 0.0784
  RMSE : 0.1768, R2: -0.0437, MAE: 0.1508, Spearman rho: 0.3980, Spearman p: 3.9011e-24, Pearson r: 0.3901, Pearson p: 3.5996e-23
  Pred range: [0.1305, 0.6420], std: 0.0963
  RMSE : 0.1835, R2: -0.1239, MAE: 0.1560, Spearman rho: 0.4649, Spearman p: 2.1311e-33, Pearson r: 0.4929, Pearson p: 6.3288e-38
  Pred range: [0.0556, 0.5468], std: 0.0857
  RMSE : 0.1548, R2: 0.2002, MAE: 0.1266, Spearman rho: 0.4581, Spearman p: 2.3405e-32, Pearson r: 0.4918, Pearson p: 9.6092e-38
  Pred range: [0.1483, 0.8243], std: 0.1271
  RMSE : 0.2273, R2: -0.7239, MAE: 0.1946, Spearman rho: 0.4680, Spearman p: 7.1370e-34, Pearson r: 0.4917, Pearson p: 1.0087e-37
  Pred range: [0.0725, 0.6741], std: 0.0950
  RMSE : 0.1823, R2: -0.1089, MAE: 0.1555, Spearman rho: 0.4558, Spearman p: 5.0807e-32, Pearson r: 0.4869, Pearson p: 6.2572e-37
  Pred range: [0.1134, 0.8087], std: 0.1162
  RMSE : 0.2123, R2: -0.5043, MAE: 0.1813, Spearman rho: 0.4468, Spearman p: 1.1174e-30, Pearson r: 0.4671, Pearson p: 9.5538e-34
  Pred range: [0.0799, 0.6295], std: 0.0917
  RMSE : 0.1704, R2: 0.0307, MAE: 0.1440, Spearman rho: 0.4692, Spearman p: 4.6169e-34, Pearson r: 0.4970, Pearson p: 1.2524e-38
[I 2026-04-29 01:23:58,263] Trial 23 finished with value: 0.15479794759273838 and parameters: {'learning_rate': 0.009466973039288604, 'batch_size': 16, 'num_epochs': 14, 'weight_decay': 0.00012808535842444844, 'layers_PRS': 3, 'layers_SCZ15': 1, 'layers_ADHD9': 4, 'layers_ASD9': 4, 'layers_ACE15': 2, 'layers_ACE18': 2, 'layers_SUD18': 2, 'layers_SES': 2, 'layers_SEX': 3, 'dropout': 0.14742627240374206, 'se_reduction': 8, 'hidden_dim_min': 8, 'base_loss': 'huber', 'huber_delta': 0.16277520025752543, 'focal_gamma': 1.9111535674892792, 'n_bins': 11, 'scheduler_patience': 2, 'scheduler_factor': 0.4096304938730577, 'early_stopping_patience': 4}. Best is trial 10 with value: 0.15105277601580916.
Train: 2407 rows (1613 IDs),Test: 598 rows (404 IDs) 

n_features_x : 6, n_features_per_modality: [16, 23, 19, 17, 7, 4, 4, 4, 1, 4]

--- ImbalancedRegressionLoss initialized ---
  Bins: 13, Focal gamma: 0.7413560449067722, Base loss: huber
  Bin [0.00, 0.08): count=  383, weight=0.049
  Bin [0.08, 0.15): count=  578, weight=0.032
  Bin [0.15, 0.23): count=  370, weight=0.051
  Bin [0.23, 0.31): count=  368, weight=0.051
  Bin [0.31, 0.38): count=  199, weight=0.094
  Bin [0.38, 0.46): count=  207, weight=0.090
  Bin [0.46, 0.54): count=  108, weight=0.172
  Bin [0.54, 0.62): count=  106, weight=0.176
  Bin [0.62, 0.69): count=   36, weight=0.508
  Bin [0.69, 0.77): count=   36, weight=0.508
  Bin [0.77, 0.85): count=    9, weight=1.878
  Bin [0.85, 0.92): count=    5, weight=3.130
  Bin [0.92, 1.00): count=    2, weight=6.261
-------------------------------------------

  Pred range: [0.0632, 0.7259], std: 0.0993
  RMSE : 0.1533, R2: 0.2156, MAE: 0.1230, Spearman rho: 0.4901, Spearman p: 1.8335e-37, Pearson r: 0.5035, Pearson p: 9.2464e-40
  Pred range: [-0.0287, 0.6367], std: 0.1117
  RMSE : 0.1524, R2: 0.2252, MAE: 0.1175, Spearman rho: 0.4828, Spearman p: 3.0440e-36, Pearson r: 0.4991, Pearson p: 5.4260e-39
  Pred range: [0.0881, 0.6920], std: 0.1029
  RMSE : 0.1599, R2: 0.1468, MAE: 0.1317, Spearman rho: 0.4906, Spearman p: 1.5286e-37, Pearson r: 0.5090, Pearson p: 9.7637e-41
  Pred range: [0.0549, 0.6764], std: 0.0998
  RMSE : 0.1643, R2: 0.0993, MAE: 0.1365, Spearman rho: 0.4795, Spearman p: 1.0331e-35, Pearson r: 0.4928, Pearson p: 6.6351e-38
  Pred range: [-0.0799, 0.6031], std: 0.1119
  RMSE : 0.1549, R2: 0.1992, MAE: 0.1179, Spearman rho: 0.4741, Spearman p: 7.6348e-35, Pearson r: 0.4861, Pearson p: 8.6513e-37
  Pred range: [0.0742, 0.6834], std: 0.1046
  RMSE : 0.1616, R2: 0.1287, MAE: 0.1330, Spearman rho: 0.4869, Spearman p: 6.3306e-37, Pearson r: 0.5019, Pearson p: 1.7834e-39
  Pred range: [0.0629, 0.6591], std: 0.1098
  RMSE : 0.1560, R2: 0.1877, MAE: 0.1263, Spearman rho: 0.4882, Spearman p: 3.8386e-37, Pearson r: 0.5080, Pearson p: 1.4728e-40
[I 2026-04-29 01:24:29,264] Trial 24 finished with value: 0.15235456403840184 and parameters: {'learning_rate': 0.0018129885130266764, 'batch_size': 6, 'num_epochs': 22, 'weight_decay': 3.648900957230211e-05, 'layers_PRS': 1, 'layers_SCZ15': 2, 'layers_ADHD9': 5, 'layers_ASD9': 2, 'layers_ACE15': 4, 'layers_ACE18': 1, 'layers_SUD18': 1, 'layers_SES': 1, 'layers_SEX': 2, 'dropout': 0.22182160052212416, 'se_reduction': 7, 'hidden_dim_min': 10, 'base_loss': 'huber', 'huber_delta': 0.1348059007841363, 'focal_gamma': 0.7413560449067722, 'n_bins': 13, 'scheduler_patience': 3, 'scheduler_factor': 0.49227367846514614, 'early_stopping_patience': 5}. Best is trial 10 with value: 0.15105277601580916.
Train: 2407 rows (1613 IDs),Test: 598 rows (404 IDs) 

n_features_x : 6, n_features_per_modality: [16, 23, 19, 17, 7, 4, 4, 4, 1, 4]

--- ImbalancedRegressionLoss initialized ---
  Bins: 16, Focal gamma: 1.9263824694468927, Base loss: huber
  Bin [0.00, 0.06): count=  383, weight=0.041
  Bin [0.06, 0.12): count=  377, weight=0.042
  Bin [0.12, 0.19): count=  405, weight=0.039
  Bin [0.19, 0.25): count=  295, weight=0.053
  Bin [0.25, 0.31): count=  239, weight=0.066
  Bin [0.31, 0.38): count=  199, weight=0.079
  Bin [0.38, 0.44): count=  142, weight=0.111
  Bin [0.44, 0.50): count=  122, weight=0.129
  Bin [0.50, 0.56): count=   93, weight=0.168
  Bin [0.56, 0.62): count=   64, weight=0.243
  Bin [0.62, 0.69): count=   36, weight=0.427
  Bin [0.69, 0.75): count=   24, weight=0.633
  Bin [0.75, 0.81): count=   19, weight=0.791
  Bin [0.81, 0.88): count=    5, weight=2.636
  Bin [0.88, 0.94): count=    2, weight=5.271
  Bin [0.94, 1.00): count=    2, weight=5.271
-------------------------------------------

  Pred range: [0.1270, 0.6043], std: 0.0752
  RMSE : 0.1976, R2: -0.3028, MAE: 0.1699, Spearman rho: 0.3222, Spearman p: 6.5398e-16, Pearson r: 0.3484, Pearson p: 1.6580e-18
  Pred range: [0.1278, 0.6239], std: 0.0792
  RMSE : 0.1969, R2: -0.2936, MAE: 0.1696, Spearman rho: 0.3616, Spearman p: 6.5910e-20, Pearson r: 0.3839, Pearson p: 1.9753e-22
  Pred range: [0.1168, 0.6161], std: 0.0795
  RMSE : 0.1859, R2: -0.1537, MAE: 0.1590, Spearman rho: 0.3885, Spearman p: 5.6213e-23, Pearson r: 0.4079, Pearson p: 2.2006e-25
  Pred range: [0.1126, 0.6199], std: 0.0808
  RMSE : 0.1812, R2: -0.0957, MAE: 0.1544, Spearman rho: 0.4081, Spearman p: 2.0801e-25, Pearson r: 0.4273, Pearson p: 6.1357e-28
  Pred range: [0.1108, 0.6337], std: 0.0829
  RMSE : 0.1788, R2: -0.0676, MAE: 0.1522, Spearman rho: 0.4220, Spearman p: 3.1755e-27, Pearson r: 0.4414, Pearson p: 6.6008e-30
  Pred range: [0.1139, 0.6471], std: 0.0852
  RMSE : 0.1808, R2: -0.0916, MAE: 0.1544, Spearman rho: 0.4325, Spearman p: 1.1784e-28, Pearson r: 0.4518, Pearson p: 2.0095e-31
[I 2026-04-29 01:24:43,859] Trial 25 pruned. 
Train: 2407 rows (1613 IDs),Test: 598 rows (404 IDs) 

n_features_x : 6, n_features_per_modality: [16, 23, 19, 17, 7, 4, 4, 4, 1, 4]

--- ImbalancedRegressionLoss initialized ---
  Bins: 9, Focal gamma: 2.535031077920636, Base loss: huber
  Bin [0.00, 0.11): count=  585, weight=0.041
  Bin [0.11, 0.22): count=  746, weight=0.032
  Bin [0.22, 0.33): count=  478, weight=0.050
  Bin [0.33, 0.44): count=  231, weight=0.104
  Bin [0.44, 0.56): count=  215, weight=0.112
  Bin [0.56, 0.67): count=  100, weight=0.239
  Bin [0.67, 0.78): count=   36, weight=0.653
  Bin [0.78, 0.89): count=   13, weight=1.726
  Bin [0.89, 1.00): count=    3, weight=6.041
-------------------------------------------

  Pred range: [0.1346, 0.7398], std: 0.0974
  RMSE : 0.1767, R2: -0.0416, MAE: 0.1482, Spearman rho: 0.4456, Spearman p: 1.6408e-30, Pearson r: 0.4602, Pearson p: 1.1308e-32
  Pred range: [0.0941, 0.6179], std: 0.0913
  RMSE : 0.1535, R2: 0.2140, MAE: 0.1236, Spearman rho: 0.4822, Spearman p: 3.8053e-36, Pearson r: 0.4939, Pearson p: 4.1999e-38
  Pred range: [0.0930, 0.5863], std: 0.0845
  RMSE : 0.1553, R2: 0.1949, MAE: 0.1273, Spearman rho: 0.4869, Spearman p: 6.4554e-37, Pearson r: 0.4962, Pearson p: 1.7252e-38
  Pred range: [0.0303, 0.5533], std: 0.0857
  RMSE : 0.1506, R2: 0.2428, MAE: 0.1197, Spearman rho: 0.4852, Spearman p: 1.2198e-36, Pearson r: 0.4991, Pearson p: 5.5431e-39
  Pred range: [0.0615, 0.6057], std: 0.0943
  RMSE : 0.1534, R2: 0.2145, MAE: 0.1243, Spearman rho: 0.4900, Spearman p: 1.9578e-37, Pearson r: 0.5051, Pearson p: 4.8331e-40
  Pred range: [0.0373, 0.5900], std: 0.0951
  RMSE : 0.1542, R2: 0.2059, MAE: 0.1253, Spearman rho: 0.4920, Spearman p: 8.8593e-38, Pearson r: 0.5074, Pearson p: 1.8780e-40
  Pred range: [0.0162, 0.5759], std: 0.0923
  RMSE : 0.1520, R2: 0.2287, MAE: 0.1222, Spearman rho: 0.4864, Spearman p: 7.6465e-37, Pearson r: 0.5037, Pearson p: 8.5849e-40
  Pred range: [0.0343, 0.6162], std: 0.0954
  RMSE : 0.1573, R2: 0.1739, MAE: 0.1294, Spearman rho: 0.4792, Spearman p: 1.1779e-35, Pearson r: 0.4960, Pearson p: 1.8283e-38
[I 2026-04-29 01:25:41,879] Trial 26 finished with value: 0.1506098660210636 and parameters: {'learning_rate': 0.0008558429375665869, 'batch_size': 4, 'num_epochs': 16, 'weight_decay': 0.0004969988019890974, 'layers_PRS': 3, 'layers_SCZ15': 2, 'layers_ADHD9': 5, 'layers_ASD9': 1, 'layers_ACE15': 2, 'layers_ACE18': 2, 'layers_SUD18': 2, 'layers_SES': 3, 'layers_SEX': 3, 'dropout': 0.1271065958631703, 'se_reduction': 8, 'hidden_dim_min': 10, 'base_loss': 'huber', 'huber_delta': 0.14389630205431547, 'focal_gamma': 2.535031077920636, 'n_bins': 9, 'scheduler_patience': 3, 'scheduler_factor': 0.5915430328473807, 'early_stopping_patience': 4}. Best is trial 26 with value: 0.1506098660210636.
Train: 2407 rows (1613 IDs),Test: 598 rows (404 IDs) 

n_features_x : 6, n_features_per_modality: [16, 23, 19, 17, 7, 4, 4, 4, 1, 4]

--- ImbalancedRegressionLoss initialized ---
  Bins: 9, Focal gamma: 2.4502067013402384, Base loss: huber
  Bin [0.00, 0.11): count=  585, weight=0.041
  Bin [0.11, 0.22): count=  746, weight=0.032
  Bin [0.22, 0.33): count=  478, weight=0.050
  Bin [0.33, 0.44): count=  231, weight=0.104
  Bin [0.44, 0.56): count=  215, weight=0.112
  Bin [0.56, 0.67): count=  100, weight=0.239
  Bin [0.67, 0.78): count=   36, weight=0.653
  Bin [0.78, 0.89): count=   13, weight=1.726
  Bin [0.89, 1.00): count=    3, weight=6.041
-------------------------------------------

  Pred range: [0.1430, 0.7033], std: 0.0959
  RMSE : 0.1815, R2: -0.0995, MAE: 0.1539, Spearman rho: 0.4612, Spearman p: 7.8609e-33, Pearson r: 0.4749, Pearson p: 5.8323e-35
  Pred range: [0.1219, 0.5749], std: 0.0868
  RMSE : 0.1605, R2: 0.1398, MAE: 0.1328, Spearman rho: 0.4739, Spearman p: 8.2843e-35, Pearson r: 0.4851, Pearson p: 1.2679e-36
  Pred range: [0.1033, 0.5865], std: 0.0874
  RMSE : 0.1592, R2: 0.1536, MAE: 0.1322, Spearman rho: 0.4876, Spearman p: 4.8800e-37, Pearson r: 0.5007, Pearson p: 2.9290e-39
  Pred range: [0.0749, 0.5614], std: 0.0876
  RMSE : 0.1500, R2: 0.2490, MAE: 0.1192, Spearman rho: 0.4879, Spearman p: 4.3816e-37, Pearson r: 0.5058, Pearson p: 3.6354e-40
  Pred range: [0.0945, 0.6051], std: 0.0928
  RMSE : 0.1584, R2: 0.1627, MAE: 0.1311, Spearman rho: 0.4888, Spearman p: 3.0411e-37, Pearson r: 0.5070, Pearson p: 2.2158e-40
  Pred range: [0.0702, 0.5473], std: 0.0886
  RMSE : 0.1513, R2: 0.2360, MAE: 0.1213, Spearman rho: 0.4852, Spearman p: 1.2394e-36, Pearson r: 0.5044, Pearson p: 6.6065e-40
  Pred range: [0.0543, 0.5243], std: 0.0833
  RMSE : 0.1524, R2: 0.2243, MAE: 0.1235, Spearman rho: 0.4861, Spearman p: 8.6773e-37, Pearson r: 0.5019, Pearson p: 1.8155e-39
  Pred range: [0.0533, 0.5726], std: 0.0923
  RMSE : 0.1517, R2: 0.2319, MAE: 0.1223, Spearman rho: 0.4897, Spearman p: 2.1490e-37, Pearson r: 0.5112, Pearson p: 3.9696e-41
  Pred range: [0.0348, 0.6044], std: 0.0911
  RMSE : 0.1555, R2: 0.1929, MAE: 0.1273, Spearman rho: 0.4809, Spearman p: 6.2853e-36, Pearson r: 0.5013, Pearson p: 2.2586e-39
[I 2026-04-29 01:26:46,227] Trial 27 finished with value: 0.14999227280383107 and parameters: {'learning_rate': 0.0007677074314082148, 'batch_size': 4, 'num_epochs': 17, 'weight_decay': 0.00046927837658842733, 'layers_PRS': 3, 'layers_SCZ15': 1, 'layers_ADHD9': 4, 'layers_ASD9': 1, 'layers_ACE15': 4, 'layers_ACE18': 2, 'layers_SUD18': 2, 'layers_SES': 3, 'layers_SEX': 3, 'dropout': 0.205946785772642, 'se_reduction': 7, 'hidden_dim_min': 8, 'base_loss': 'huber', 'huber_delta': 0.17036166390537008, 'focal_gamma': 2.4502067013402384, 'n_bins': 9, 'scheduler_patience': 4, 'scheduler_factor': 0.5939466952523744, 'early_stopping_patience': 5}. Best is trial 27 with value: 0.14999227280383107.
Train: 2407 rows (1613 IDs),Test: 598 rows (404 IDs) 

n_features_x : 6, n_features_per_modality: [16, 23, 19, 17, 7, 4, 4, 4, 1, 4]

--- ImbalancedRegressionLoss initialized ---
  Bins: 8, Focal gamma: 2.463284240030438, Base loss: huber
  Bin [0.00, 0.12): count=  760, weight=0.039
  Bin [0.12, 0.25): count=  700, weight=0.042
  Bin [0.25, 0.38): count=  438, weight=0.067
  Bin [0.38, 0.50): count=  264, weight=0.111
  Bin [0.50, 0.62): count=  157, weight=0.186
  Bin [0.62, 0.75): count=   60, weight=0.483
  Bin [0.75, 0.88): count=   24, weight=1.179
  Bin [0.88, 1.00): count=    4, weight=5.893
-------------------------------------------

  Pred range: [0.0507, 0.5550], std: 0.0868
  RMSE : 0.1560, R2: 0.1874, MAE: 0.1253, Spearman rho: 0.4555, Spearman p: 5.7230e-32, Pearson r: 0.4630, Pearson p: 4.2026e-33
  Pred range: [0.0545, 0.5330], std: 0.0842
  RMSE : 0.1516, R2: 0.2328, MAE: 0.1202, Spearman rho: 0.4779, Spearman p: 1.8895e-35, Pearson r: 0.4884, Pearson p: 3.5216e-37
  Pred range: [0.0451, 0.5599], std: 0.0881
  RMSE : 0.1499, R2: 0.2497, MAE: 0.1176, Spearman rho: 0.4870, Spearman p: 6.0331e-37, Pearson r: 0.5007, Pearson p: 2.8675e-39
  Pred range: [0.0374, 0.5504], std: 0.0922
  RMSE : 0.1498, R2: 0.2508, MAE: 0.1177, Spearman rho: 0.4880, Spearman p: 4.2284e-37, Pearson r: 0.5034, Pearson p: 9.8375e-40
  Pred range: [0.0682, 0.6551], std: 0.0969
  RMSE : 0.1659, R2: 0.0812, MAE: 0.1385, Spearman rho: 0.4770, Spearman p: 2.6333e-35, Pearson r: 0.4966, Pearson p: 1.4613e-38
  Pred range: [0.0671, 0.6421], std: 0.0996
  RMSE : 0.1662, R2: 0.0783, MAE: 0.1386, Spearman rho: 0.4859, Spearman p: 9.3538e-37, Pearson r: 0.5014, Pearson p: 2.1912e-39
  Pred range: [0.0397, 0.5685], std: 0.0933
  RMSE : 0.1533, R2: 0.2153, MAE: 0.1233, Spearman rho: 0.4822, Spearman p: 3.8595e-36, Pearson r: 0.4974, Pearson p: 1.0558e-38
  Pred range: [0.0343, 0.5423], std: 0.0915
  RMSE : 0.1508, R2: 0.2413, MAE: 0.1200, Spearman rho: 0.4828, Spearman p: 3.0214e-36, Pearson r: 0.5030, Pearson p: 1.1282e-39
  Pred range: [0.0439, 0.5846], std: 0.0955
  RMSE : 0.1532, R2: 0.2168, MAE: 0.1239, Spearman rho: 0.4861, Spearman p: 8.6512e-37, Pearson r: 0.5067, Pearson p: 2.5332e-40
