[I 2026-04-27 17:01:15,537] Trial 34 finished with value: 0.08859959862257002 and parameters: {'learning_rate': 0.0007691159387523849, 'batch_size': 4, 'num_epochs': 13, 'weight_decay': 1.7810864346423967e-05, 'layers_PRS': 2, 'layers_SCZ15': 4, 'layers_ADHD9': 3, 'layers_ASD9': 4, 'layers_ACE15': 1, 'layers_ACE18': 2, 'layers_SUD18': 7, 'layers_SES': 5, 'layers_SEX': 2, 'dropout': 0.4678370911460316, 'se_reduction': 2, 'hidden_dim_min': 6, 'base_loss': 'huber', 'huber_delta': 0.05599565120764717, 'focal_gamma': 2.254636359521056, 'n_bins': 9, 'scheduler_patience': 2, 'scheduler_factor': 0.6535394969825077, 'early_stopping_patience': 3}. Best is trial 9 with value: 0.08803266597627345.
Train: 2407 rows (1613 IDs),Test: 598 rows (404 IDs) 

n_features_x : 6, n_features_per_modality: [16, 23, 19, 17, 7, 4, 4, 4, 1, 4]

--- ImbalancedRegressionLoss initialized ---
  Bins: 20, Focal gamma: 1.5349334003930601, Base loss: huber
  Bin [0.00, 0.05): count=  650, weight=0.004
  Bin [0.05, 0.10): count=  360, weight=0.007
  Bin [0.10, 0.15): count=  360, weight=0.007
  Bin [0.15, 0.20): count=  506, weight=0.005
  Bin [0.20, 0.25): count=  237, weight=0.011
  Bin [0.25, 0.30): count=  149, weight=0.017
  Bin [0.30, 0.35): count=   91, weight=0.028
  Bin [0.35, 0.40): count=   20, weight=0.125
  Bin [0.40, 0.45): count=   13, weight=0.187
  Bin [0.45, 0.50): count=   10, weight=0.238
  Bin [0.50, 0.55): count=    6, weight=0.374
  Bin [0.55, 0.60): count=    3, weight=0.655
  Bin [0.60, 0.65): count=    1, weight=1.310
  Bin [0.65, 0.70): count=    1, weight=1.310
  Bin [0.70, 0.75): count=    0, weight=2.620
  Bin [0.75, 0.80): count=    0, weight=2.620
  Bin [0.80, 0.85): count=    0, weight=2.620
  Bin [0.85, 0.90): count=    0, weight=2.620
  Bin [0.90, 0.95): count=    0, weight=2.620
  Bin [0.95, 1.00): count=    0, weight=2.620
-------------------------------------------

  Pred range: [-0.0750, 0.1922], std: 0.0372
  RMSE : 0.1406, R2: -0.9522, MAE: 0.1088, Spearman rho: 0.1588, Spearman p: 9.5960e-05, Pearson r: 0.1495, Pearson p: 2.4247e-04
  Pred range: [-0.0225, 0.3040], std: 0.0468
  RMSE : 0.1018, R2: -0.0248, MAE: 0.0797, Spearman rho: 0.2175, Spearman p: 7.8346e-08, Pearson r: 0.2124, Pearson p: 1.5813e-07
  Pred range: [-0.0053, 0.3409], std: 0.0502
  RMSE : 0.1027, R2: -0.0424, MAE: 0.0815, Spearman rho: 0.2433, Spearman p: 1.6634e-09, Pearson r: 0.2404, Pearson p: 2.6059e-09
  Pred range: [0.0029, 0.3572], std: 0.0519
  RMSE : 0.1042, R2: -0.0732, MAE: 0.0830, Spearman rho: 0.2641, Spearman p: 5.3163e-11, Pearson r: 0.2630, Pearson p: 6.4399e-11
  Pred range: [0.0058, 0.3604], std: 0.0523
  RMSE : 0.1039, R2: -0.0666, MAE: 0.0827, Spearman rho: 0.2789, Spearman p: 3.7901e-12, Pearson r: 0.2794, Pearson p: 3.4402e-12
  Pred range: [0.0083, 0.3644], std: 0.0527
  RMSE : 0.1034, R2: -0.0565, MAE: 0.0823, Spearman rho: 0.2925, Spearman p: 2.9385e-13, Pearson r: 0.2931, Pearson p: 2.6051e-13
[I 2026-04-27 17:01:43,389] Trial 35 finished with value: 0.10183646773714976 and parameters: {'learning_rate': 2.5518666045635723e-05, 'batch_size': 8, 'num_epochs': 17, 'weight_decay': 0.004026145417561194, 'layers_PRS': 3, 'layers_SCZ15': 5, 'layers_ADHD9': 2, 'layers_ASD9': 3, 'layers_ACE15': 1, 'layers_ACE18': 4, 'layers_SUD18': 6, 'layers_SES': 3, 'layers_SEX': 1, 'dropout': 0.4268924681498973, 'se_reduction': 4, 'hidden_dim_min': 7, 'base_loss': 'huber', 'huber_delta': 0.07664965112206995, 'focal_gamma': 1.5349334003930601, 'n_bins': 20, 'scheduler_patience': 4, 'scheduler_factor': 0.6876892738597127, 'early_stopping_patience': 4}. Best is trial 9 with value: 0.08803266597627345.
Train: 2407 rows (1613 IDs),Test: 598 rows (404 IDs) 

n_features_x : 6, n_features_per_modality: [16, 23, 19, 17, 7, 4, 4, 4, 1, 4]

--- ImbalancedRegressionLoss initialized ---
  Bins: 11, Focal gamma: 1.7733051673017608, Base loss: mse
  Bin [0.00, 0.09): count= 1010, weight=0.003
  Bin [0.09, 0.18): count=  706, weight=0.004
  Bin [0.18, 0.27): count=  478, weight=0.006
  Bin [0.27, 0.36): count=  159, weight=0.018
  Bin [0.36, 0.45): count=   33, weight=0.085
  Bin [0.45, 0.55): count=   16, weight=0.170
  Bin [0.55, 0.64): count=    4, weight=0.579
  Bin [0.64, 0.73): count=    1, weight=1.448
  Bin [0.73, 0.82): count=    0, weight=2.896
  Bin [0.82, 0.91): count=    0, weight=2.896
  Bin [0.91, 1.00): count=    0, weight=2.896
-------------------------------------------

  Pred range: [0.0594, 0.4267], std: 0.0520
  RMSE : 0.1001, R2: 0.0106, MAE: 0.0801, Spearman rho: 0.3179, Spearman p: 1.6353e-15, Pearson r: 0.3224, Pearson p: 6.3181e-16
  Pred range: [0.0921, 0.4022], std: 0.0486
  RMSE : 0.1077, R2: -0.1470, MAE: 0.0883, Spearman rho: 0.3747, Spearman p: 2.3002e-21, Pearson r: 0.3767, Pearson p: 1.3433e-21
  Pred range: [0.0702, 0.3698], std: 0.0478
  RMSE : 0.0952, R2: 0.1041, MAE: 0.0768, Spearman rho: 0.4130, Spearman p: 4.9810e-26, Pearson r: 0.4196, Pearson p: 6.7607e-27
  Pred range: [0.0781, 0.3942], std: 0.0521
  RMSE : 0.0981, R2: 0.0496, MAE: 0.0794, Spearman rho: 0.4242, Spearman p: 1.6304e-27, Pearson r: 0.4291, Pearson p: 3.4939e-28
  Pred range: [0.0695, 0.4124], std: 0.0531
  RMSE : 0.0960, R2: 0.0891, MAE: 0.0774, Spearman rho: 0.4325, Spearman p: 1.1860e-28, Pearson r: 0.4372, Pearson p: 2.6376e-29
  Pred range: [0.0862, 0.3944], std: 0.0486
  RMSE : 0.0999, R2: 0.0134, MAE: 0.0813, Spearman rho: 0.4176, Spearman p: 1.2091e-26, Pearson r: 0.4222, Pearson p: 2.9878e-27
[I 2026-04-27 17:02:06,448] Trial 36 pruned. 
Train: 2407 rows (1613 IDs),Test: 598 rows (404 IDs) 

n_features_x : 6, n_features_per_modality: [16, 23, 19, 17, 7, 4, 4, 4, 1, 4]

--- ImbalancedRegressionLoss initialized ---
  Bins: 8, Focal gamma: 0.5998180760343993, Base loss: huber
  Bin [0.00, 0.12): count= 1180, weight=0.003
  Bin [0.12, 0.25): count=  933, weight=0.003
  Bin [0.25, 0.38): count=  253, weight=0.012
  Bin [0.38, 0.50): count=   30, weight=0.098
  Bin [0.50, 0.62): count=   10, weight=0.277
  Bin [0.62, 0.75): count=    1, weight=1.521
  Bin [0.75, 0.88): count=    0, weight=3.043
  Bin [0.88, 1.00): count=    0, weight=3.043
-------------------------------------------

  Pred range: [0.0560, 0.3740], std: 0.0561
  RMSE : 0.0928, R2: 0.1485, MAE: 0.0748, Spearman rho: 0.4465, Spearman p: 1.2265e-30, Pearson r: 0.4576, Pearson p: 2.7361e-32
  Pred range: [0.0179, 0.3585], std: 0.0589
  RMSE : 0.0883, R2: 0.2289, MAE: 0.0687, Spearman rho: 0.4879, Spearman p: 4.3294e-37, Pearson r: 0.4926, Pearson p: 7.1283e-38
  Pred range: [0.0307, 0.3529], std: 0.0520
  RMSE : 0.0899, R2: 0.2015, MAE: 0.0703, Spearman rho: 0.4572, Spearman p: 3.1309e-32, Pearson r: 0.4688, Pearson p: 5.3377e-34
  Pred range: [0.0351, 0.3288], std: 0.0512
  RMSE : 0.0884, R2: 0.2272, MAE: 0.0700, Spearman rho: 0.4797, Spearman p: 9.7893e-36, Pearson r: 0.4829, Pearson p: 2.9369e-36
  Pred range: [0.0123, 0.3619], std: 0.0619
  RMSE : 0.0904, R2: 0.1930, MAE: 0.0698, Spearman rho: 0.4669, Spearman p: 1.0345e-33, Pearson r: 0.4758, Pearson p: 4.1304e-35
  Pred range: [0.0283, 0.3789], std: 0.0579
  RMSE : 0.0893, R2: 0.2125, MAE: 0.0694, Spearman rho: 0.4800, Spearman p: 8.5849e-36, Pearson r: 0.4736, Pearson p: 9.3278e-35
[I 2026-04-27 17:03:07,249] Trial 37 finished with value: 0.0883353848020436 and parameters: {'learning_rate': 0.001688095573286285, 'batch_size': 4, 'num_epochs': 23, 'weight_decay': 0.006728415217950297, 'layers_PRS': 6, 'layers_SCZ15': 2, 'layers_ADHD9': 5, 'layers_ASD9': 1, 'layers_ACE15': 4, 'layers_ACE18': 4, 'layers_SUD18': 3, 'layers_SES': 6, 'layers_SEX': 3, 'dropout': 0.31747570491063704, 'se_reduction': 4, 'hidden_dim_min': 5, 'base_loss': 'huber', 'huber_delta': 0.10038073126211036, 'focal_gamma': 0.5998180760343993, 'n_bins': 8, 'scheduler_patience': 4, 'scheduler_factor': 0.6368651083887358, 'early_stopping_patience': 4}. Best is trial 9 with value: 0.08803266597627345.
Train: 2407 rows (1613 IDs),Test: 598 rows (404 IDs) 

n_features_x : 6, n_features_per_modality: [16, 23, 19, 17, 7, 4, 4, 4, 1, 4]

--- ImbalancedRegressionLoss initialized ---
  Bins: 17, Focal gamma: 0.6242673862800288, Base loss: huber
  Bin [0.00, 0.06): count=  650, weight=0.004
  Bin [0.06, 0.12): count=  530, weight=0.005
  Bin [0.12, 0.18): count=  536, weight=0.005
  Bin [0.18, 0.24): count=  299, weight=0.009
  Bin [0.24, 0.29): count=  247, weight=0.011
  Bin [0.29, 0.35): count=   91, weight=0.029
  Bin [0.35, 0.41): count=   20, weight=0.127
  Bin [0.41, 0.47): count=   16, weight=0.157
  Bin [0.47, 0.53): count=   10, weight=0.243
  Bin [0.53, 0.59): count=    6, weight=0.382
  Bin [0.59, 0.65): count=    1, weight=1.336
  Bin [0.65, 0.71): count=    1, weight=1.336
  Bin [0.71, 0.76): count=    0, weight=2.671
  Bin [0.76, 0.82): count=    0, weight=2.671
  Bin [0.82, 0.88): count=    0, weight=2.671
  Bin [0.88, 0.94): count=    0, weight=2.671
  Bin [0.94, 1.00): count=    0, weight=2.671
-------------------------------------------

  Pred range: [0.0719, 0.5066], std: 0.0683
  RMSE : 0.1128, R2: -0.2582, MAE: 0.0935, Spearman rho: 0.4258, Spearman p: 9.8361e-28, Pearson r: 0.4373, Pearson p: 2.5585e-29
  Pred range: [0.0602, 0.4797], std: 0.0712
  RMSE : 0.1073, R2: -0.1368, MAE: 0.0874, Spearman rho: 0.4449, Spearman p: 2.0959e-30, Pearson r: 0.4518, Pearson p: 2.0059e-31
  Pred range: [0.0633, 0.4677], std: 0.0707
  RMSE : 0.1104, R2: -0.2039, MAE: 0.0907, Spearman rho: 0.4416, Spearman p: 6.2898e-30, Pearson r: 0.4578, Pearson p: 2.5746e-32
  Pred range: [0.0721, 0.4541], std: 0.0594
  RMSE : 0.1071, R2: -0.1343, MAE: 0.0883, Spearman rho: 0.4424, Spearman p: 4.7151e-30, Pearson r: 0.4545, Pearson p: 7.9966e-32
  Pred range: [0.0654, 0.5027], std: 0.0706
  RMSE : 0.1108, R2: -0.2124, MAE: 0.0908, Spearman rho: 0.4393, Spearman p: 1.2984e-29, Pearson r: 0.4508, Pearson p: 2.8704e-31
  Pred range: [-0.0017, 0.3438], std: 0.0630
  RMSE : 0.0919, R2: 0.1656, MAE: 0.0702, Spearman rho: 0.4627, Spearman p: 4.5654e-33, Pearson r: 0.4685, Pearson p: 5.9272e-34
[I 2026-04-27 17:03:18,145] Trial 38 pruned. 
Train: 2407 rows (1613 IDs),Test: 598 rows (404 IDs) 

n_features_x : 6, n_features_per_modality: [16, 23, 19, 17, 7, 4, 4, 4, 1, 4]

--- ImbalancedRegressionLoss initialized ---
  Bins: 13, Focal gamma: 0.6148931999640552, Base loss: mse
  Bin [0.00, 0.08): count=  828, weight=0.003
  Bin [0.08, 0.15): count=  710, weight=0.004
  Bin [0.15, 0.23): count=  477, weight=0.006
  Bin [0.23, 0.31): count=  288, weight=0.009
  Bin [0.31, 0.38): count=   63, weight=0.042
  Bin [0.38, 0.46): count=   23, weight=0.113
  Bin [0.46, 0.54): count=   10, weight=0.247
  Bin [0.54, 0.62): count=    7, weight=0.340
  Bin [0.62, 0.69): count=    0, weight=2.719
  Bin [0.69, 0.77): count=    1, weight=1.359
  Bin [0.77, 0.85): count=    0, weight=2.719
  Bin [0.85, 0.92): count=    0, weight=2.719
  Bin [0.92, 1.00): count=    0, weight=2.719
-------------------------------------------

  Pred range: [0.0669, 0.4231], std: 0.0602
  RMSE : 0.1083, R2: -0.1596, MAE: 0.0887, Spearman rho: 0.4195, Spearman p: 6.9364e-27, Pearson r: 0.4292, Pearson p: 3.3832e-28
  Pred range: [0.0605, 0.4520], std: 0.0647
  RMSE : 0.1007, R2: -0.0026, MAE: 0.0814, Spearman rho: 0.4454, Spearman p: 1.7687e-30, Pearson r: 0.4514, Pearson p: 2.3059e-31
  Pred range: [0.0331, 0.4134], std: 0.0560
  RMSE : 0.0943, R2: 0.1218, MAE: 0.0761, Spearman rho: 0.4606, Spearman p: 9.5850e-33, Pearson r: 0.4651, Pearson p: 2.0045e-33
  Pred range: [0.0494, 0.4072], std: 0.0604
  RMSE : 0.0964, R2: 0.0819, MAE: 0.0779, Spearman rho: 0.4519, Spearman p: 1.9989e-31, Pearson r: 0.4619, Pearson p: 6.0585e-33
  Pred range: [0.0647, 0.4318], std: 0.0594
  RMSE : 0.0999, R2: 0.0147, MAE: 0.0815, Spearman rho: 0.4544, Spearman p: 8.4246e-32, Pearson r: 0.4654, Pearson p: 1.7580e-33
  Pred range: [0.1225, 0.5166], std: 0.0619
  RMSE : 0.1386, R2: -0.8990, MAE: 0.1183, Spearman rho: 0.4385, Spearman p: 1.7013e-29, Pearson r: 0.4505, Pearson p: 3.1183e-31
[I 2026-04-27 17:03:51,014] Trial 39 finished with value: 0.09427076975502413 and parameters: {'learning_rate': 0.0017631440865436224, 'batch_size': 8, 'num_epochs': 18, 'weight_decay': 0.009168944610577259, 'layers_PRS': 1, 'layers_SCZ15': 1, 'layers_ADHD9': 6, 'layers_ASD9': 5, 'layers_ACE15': 4, 'layers_ACE18': 4, 'layers_SUD18': 4, 'layers_SES': 6, 'layers_SEX': 3, 'dropout': 0.25377425586768326, 'se_reduction': 3, 'hidden_dim_min': 3, 'base_loss': 'mse', 'huber_delta': 0.11736386572624749, 'focal_gamma': 0.6148931999640552, 'n_bins': 13, 'scheduler_patience': 4, 'scheduler_factor': 0.6285973387150319, 'early_stopping_patience': 3}. Best is trial 9 with value: 0.08803266597627345.
Train: 2407 rows (1613 IDs),Test: 598 rows (404 IDs) 

n_features_x : 6, n_features_per_modality: [16, 23, 19, 17, 7, 4, 4, 4, 1, 4]

--- ImbalancedRegressionLoss initialized ---
  Bins: 19, Focal gamma: 0.8648904874657649, Base loss: huber
  Bin [0.00, 0.05): count=  650, weight=0.004
  Bin [0.05, 0.11): count=  360, weight=0.007
  Bin [0.11, 0.16): count=  528, weight=0.005
  Bin [0.16, 0.21): count=  338, weight=0.008
  Bin [0.21, 0.26): count=  318, weight=0.008
  Bin [0.26, 0.32): count=  109, weight=0.023
  Bin [0.32, 0.37): count=   50, weight=0.050
  Bin [0.37, 0.42): count=   29, weight=0.085
  Bin [0.42, 0.47): count=    7, weight=0.320
  Bin [0.47, 0.53): count=   10, weight=0.232
  Bin [0.53, 0.58): count=    6, weight=0.365
  Bin [0.58, 0.63): count=    1, weight=1.278
  Bin [0.63, 0.68): count=    0, weight=2.556
  Bin [0.68, 0.74): count=    1, weight=1.278
  Bin [0.74, 0.79): count=    0, weight=2.556
  Bin [0.79, 0.84): count=    0, weight=2.556
  Bin [0.84, 0.89): count=    0, weight=2.556
  Bin [0.89, 0.95): count=    0, weight=2.556
  Bin [0.95, 1.00): count=    0, weight=2.556
-------------------------------------------

  Pred range: [0.0633, 0.4482], std: 0.0610
  RMSE : 0.1013, R2: -0.0136, MAE: 0.0820, Spearman rho: 0.4103, Spearman p: 1.0945e-25, Pearson r: 0.4191, Pearson p: 7.6778e-27
  Pred range: [0.0588, 0.4603], std: 0.0660
  RMSE : 0.1017, R2: -0.0214, MAE: 0.0823, Spearman rho: 0.4466, Spearman p: 1.1834e-30, Pearson r: 0.4562, Pearson p: 4.5671e-32
  Pred range: [0.0617, 0.4356], std: 0.0605
  RMSE : 0.1046, R2: -0.0807, MAE: 0.0858, Spearman rho: 0.4439, Spearman p: 2.8498e-30, Pearson r: 0.4577, Pearson p: 2.6442e-32
  Pred range: [0.0753, 0.4748], std: 0.0658
  RMSE : 0.1106, R2: -0.2091, MAE: 0.0909, Spearman rho: 0.4539, Spearman p: 9.9356e-32, Pearson r: 0.4640, Pearson p: 2.8983e-33
  Pred range: [0.0600, 0.4559], std: 0.0644
  RMSE : 0.1034, R2: -0.0555, MAE: 0.0841, Spearman rho: 0.4429, Spearman p: 4.0246e-30, Pearson r: 0.4553, Pearson p: 6.1619e-32
  Pred range: [0.0293, 0.3958], std: 0.0626
  RMSE : 0.0919, R2: 0.1647, MAE: 0.0732, Spearman rho: 0.4589, Spearman p: 1.7724e-32, Pearson r: 0.4677, Pearson p: 7.9525e-34
[I 2026-04-27 17:04:13,967] Trial 40 pruned. 
Train: 2407 rows (1613 IDs),Test: 598 rows (404 IDs) 

n_features_x : 6, n_features_per_modality: [16, 23, 19, 17, 7, 4, 4, 4, 1, 4]

--- ImbalancedRegressionLoss initialized ---
  Bins: 8, Focal gamma: 1.2534066839766713, Base loss: huber
  Bin [0.00, 0.12): count= 1180, weight=0.003
  Bin [0.12, 0.25): count=  933, weight=0.003
  Bin [0.25, 0.38): count=  253, weight=0.012
  Bin [0.38, 0.50): count=   30, weight=0.098
  Bin [0.50, 0.62): count=   10, weight=0.277
  Bin [0.62, 0.75): count=    1, weight=1.521
  Bin [0.75, 0.88): count=    0, weight=3.043
  Bin [0.88, 1.00): count=    0, weight=3.043
-------------------------------------------

  Pred range: [0.0673, 0.4225], std: 0.0582
  RMSE : 0.0972, R2: 0.0658, MAE: 0.0785, Spearman rho: 0.4380, Spearman p: 2.0180e-29, Pearson r: 0.4487, Pearson p: 5.8580e-31
  Pred range: [0.0659, 0.3675], std: 0.0507
  RMSE : 0.0920, R2: 0.1633, MAE: 0.0743, Spearman rho: 0.4559, Spearman p: 4.9098e-32, Pearson r: 0.4624, Pearson p: 5.1896e-33
  Pred range: [0.0429, 0.3568], std: 0.0524
  RMSE : 0.0892, R2: 0.2135, MAE: 0.0709, Spearman rho: 0.4624, Spearman p: 5.2300e-33, Pearson r: 0.4656, Pearson p: 1.6428e-33
  Pred range: [0.0723, 0.3747], std: 0.0486
  RMSE : 0.0931, R2: 0.1438, MAE: 0.0754, Spearman rho: 0.4558, Spearman p: 5.2425e-32, Pearson r: 0.4678, Pearson p: 7.5248e-34
  Pred range: [0.0656, 0.3759], std: 0.0544
  RMSE : 0.0957, R2: 0.0949, MAE: 0.0775, Spearman rho: 0.4499, Spearman p: 3.8418e-31, Pearson r: 0.4606, Pearson p: 9.8414e-33
  Pred range: [0.0479, 0.3702], std: 0.0535
  RMSE : 0.0896, R2: 0.2062, MAE: 0.0717, Spearman rho: 0.4666, Spearman p: 1.1529e-33, Pearson r: 0.4725, Pearson p: 1.3650e-34
  Pred range: [0.0539, 0.3893], std: 0.0573
  RMSE : 0.0918, R2: 0.1673, MAE: 0.0737, Spearman rho: 0.4762, Spearman p: 3.4948e-35, Pearson r: 0.4799, Pearson p: 9.0631e-36
[I 2026-04-27 17:05:15,447] Trial 41 finished with value: 0.0892121202223606 and parameters: {'learning_rate': 0.0009253277827679531, 'batch_size': 4, 'num_epochs': 23, 'weight_decay': 0.006073103175557938, 'layers_PRS': 6, 'layers_SCZ15': 4, 'layers_ADHD9': 1, 'layers_ASD9': 1, 'layers_ACE15': 3, 'layers_ACE18': 3, 'layers_SUD18': 3, 'layers_SES': 5, 'layers_SEX': 3, 'dropout': 0.40386019427800574, 'se_reduction': 4, 'hidden_dim_min': 8, 'base_loss': 'huber', 'huber_delta': 0.1579061554327051, 'focal_gamma': 1.2534066839766713, 'n_bins': 8, 'scheduler_patience': 4, 'scheduler_factor': 0.30017056723122953, 'early_stopping_patience': 4}. Best is trial 9 with value: 0.08803266597627345.
Train: 2407 rows (1613 IDs),Test: 598 rows (404 IDs) 

n_features_x : 6, n_features_per_modality: [16, 23, 19, 17, 7, 4, 4, 4, 1, 4]

--- ImbalancedRegressionLoss initialized ---
  Bins: 10, Focal gamma: 1.0552188177596544, Base loss: huber
  Bin [0.00, 0.10): count= 1010, weight=0.003
  Bin [0.10, 0.20): count=  866, weight=0.003
  Bin [0.20, 0.30): count=  386, weight=0.007
  Bin [0.30, 0.40): count=  111, weight=0.026
  Bin [0.40, 0.50): count=   23, weight=0.119
  Bin [0.50, 0.60): count=    9, weight=0.287
  Bin [0.60, 0.70): count=    2, weight=0.955
  Bin [0.70, 0.80): count=    0, weight=2.866
  Bin [0.80, 0.90): count=    0, weight=2.866
  Bin [0.90, 1.00): count=    0, weight=2.866
-------------------------------------------

  Pred range: [0.0370, 0.4116], std: 0.0602
  RMSE : 0.0989, R2: 0.0336, MAE: 0.0787, Spearman rho: 0.3837, Spearman p: 2.0503e-22, Pearson r: 0.3830, Pearson p: 2.4990e-22
  Pred range: [0.0320, 0.3330], std: 0.0522
  RMSE : 0.0918, R2: 0.1676, MAE: 0.0726, Spearman rho: 0.4343, Spearman p: 6.7119e-29, Pearson r: 0.4355, Pearson p: 4.4790e-29
  Pred range: [0.0393, 0.3621], std: 0.0564
  RMSE : 0.0929, R2: 0.1479, MAE: 0.0743, Spearman rho: 0.4471, Spearman p: 1.0102e-30, Pearson r: 0.4502, Pearson p: 3.4613e-31
  Pred range: [0.0447, 0.3695], std: 0.0561
  RMSE : 0.0954, R2: 0.1007, MAE: 0.0773, Spearman rho: 0.4549, Spearman p: 7.0253e-32, Pearson r: 0.4598, Pearson p: 1.2679e-32
  Pred range: [0.0330, 0.3587], std: 0.0564
  RMSE : 0.0902, R2: 0.1967, MAE: 0.0713, Spearman rho: 0.4636, Spearman p: 3.3352e-33, Pearson r: 0.4680, Pearson p: 7.0955e-34
  Pred range: [0.0403, 0.3648], std: 0.0561
  RMSE : 0.0905, R2: 0.1908, MAE: 0.0719, Spearman rho: 0.4635, Spearman p: 3.4759e-33, Pearson r: 0.4681, Pearson p: 6.9025e-34
  Pred range: [0.0396, 0.3379], std: 0.0534
  RMSE : 0.0898, R2: 0.2028, MAE: 0.0715, Spearman rho: 0.4672, Spearman p: 9.2987e-34, Pearson r: 0.4725, Pearson p: 1.3963e-34
  Pred range: [0.0384, 0.3373], std: 0.0519
  RMSE : 0.0885, R2: 0.2269, MAE: 0.0698, Spearman rho: 0.4737, Spearman p: 9.0652e-35, Pearson r: 0.4785, Pearson p: 1.4988e-35
  Pred range: [0.0510, 0.3987], std: 0.0571
  RMSE : 0.0932, R2: 0.1422, MAE: 0.0750, Spearman rho: 0.4657, Spearman p: 1.6198e-33, Pearson r: 0.4710, Pearson p: 2.4047e-34
  Pred range: [0.0442, 0.3377], std: 0.0519
  RMSE : 0.0894, R2: 0.2101, MAE: 0.0712, Spearman rho: 0.4743, Spearman p: 7.2771e-35, Pearson r: 0.4807, Pearson p: 6.6235e-36
  Pred range: [0.0534, 0.3693], std: 0.0542
  RMSE : 0.0930, R2: 0.1456, MAE: 0.0752, Spearman rho: 0.4701, Spearman p: 3.2925e-34, Pearson r: 0.4767, Pearson p: 2.9949e-35
  Pred range: [0.0473, 0.3640], std: 0.0539
  RMSE : 0.0895, R2: 0.2090, MAE: 0.0710, Spearman rho: 0.4705, Spearman p: 2.8775e-34, Pearson r: 0.4772, Pearson p: 2.4452e-35
