[I 2026-04-27 19:17:04,495] Trial 42 finished with value: 0.14878186635877452 and parameters: {'learning_rate': 0.00129400069483465, 'batch_size': 6, 'num_epochs': 29, 'weight_decay': 2.303801119271042e-05, 'layers_PRS': 1, 'layers_SCZ15': 3, 'layers_ADHD9': 2, 'layers_ASD9': 5, 'layers_ACE15': 5, 'layers_ACE18': 7, 'layers_SUD18': 2, 'layers_SES': 4, 'layers_SEX': 3, 'dropout': 0.1526849300045047, 'se_reduction': 4, 'hidden_dim_min': 4, 'base_loss': 'huber', 'huber_delta': 0.11329775801304749, 'focal_gamma': 2.819840586359179, 'n_bins': 17, 'scheduler_patience': 4, 'scheduler_factor': 0.5167364819940109, 'early_stopping_patience': 8}. Best is trial 31 with value: 0.14835994978477499.
Train: 2407 rows (1613 IDs),Test: 598 rows (404 IDs) 

n_features_x : 6, n_features_per_modality: [16, 23, 19, 17, 7, 4, 4, 4, 1, 4]

--- ImbalancedRegressionLoss initialized ---
  Bins: 17, Focal gamma: 2.80470310093252, Base loss: huber
  Bin [0.00, 0.06): count=  172, weight=0.058
  Bin [0.06, 0.12): count=  413, weight=0.024
  Bin [0.12, 0.18): count=  376, weight=0.027
  Bin [0.18, 0.24): count=  370, weight=0.027
  Bin [0.24, 0.29): count=  255, weight=0.039
  Bin [0.29, 0.35): count=  223, weight=0.045
  Bin [0.35, 0.41): count=  162, weight=0.061
  Bin [0.41, 0.47): count=  134, weight=0.074
  Bin [0.47, 0.53): count=  108, weight=0.092
  Bin [0.53, 0.59): count=   78, weight=0.127
  Bin [0.59, 0.65): count=   47, weight=0.208
  Bin [0.65, 0.71): count=   27, weight=0.357
  Bin [0.71, 0.76): count=   26, weight=0.370
  Bin [0.76, 0.82): count=    9, weight=0.999
  Bin [0.82, 0.88): count=    4, weight=1.999
  Bin [0.88, 0.94): count=    3, weight=2.499
  Bin [0.94, 1.00): count=    0, weight=9.995
-------------------------------------------

  Pred range: [0.1146, 0.5847], std: 0.0848
  RMSE : 0.1680, R2: 0.0575, MAE: 0.1397, Spearman rho: 0.4332, Spearman p: 9.4598e-29, Pearson r: 0.4495, Pearson p: 4.5147e-31
  Pred range: [0.1127, 0.6725], std: 0.0930
  RMSE : 0.1642, R2: 0.1003, MAE: 0.1361, Spearman rho: 0.4776, Spearman p: 2.1177e-35, Pearson r: 0.4782, Pearson p: 1.6860e-35
  Pred range: [0.1358, 0.6889], std: 0.0950
  RMSE : 0.1746, R2: -0.0173, MAE: 0.1479, Spearman rho: 0.4870, Spearman p: 6.1630e-37, Pearson r: 0.4988, Pearson p: 6.1234e-39
  Pred range: [0.1094, 0.5978], std: 0.0831
  RMSE : 0.1529, R2: 0.2199, MAE: 0.1239, Spearman rho: 0.4888, Spearman p: 3.1341e-37, Pearson r: 0.5046, Pearson p: 5.9625e-40
  Pred range: [0.0926, 0.6473], std: 0.0900
  RMSE : 0.1564, R2: 0.1837, MAE: 0.1291, Spearman rho: 0.5002, Spearman p: 3.5285e-39, Pearson r: 0.5135, Pearson p: 1.5243e-41
  Pred range: [0.0849, 0.6158], std: 0.0844
  RMSE : 0.1511, R2: 0.2384, MAE: 0.1217, Spearman rho: 0.4900, Spearman p: 1.9183e-37, Pearson r: 0.5131, Pearson p: 1.8309e-41
  Pred range: [0.0480, 0.6681], std: 0.0973
  RMSE : 0.1539, R2: 0.2092, MAE: 0.1260, Spearman rho: 0.4983, Spearman p: 7.6312e-39, Pearson r: 0.5217, Pearson p: 4.8765e-43
  Pred range: [0.0410, 0.7133], std: 0.0989
  RMSE : 0.1609, R2: 0.1361, MAE: 0.1335, Spearman rho: 0.4962, Spearman p: 1.7439e-38, Pearson r: 0.5157, Pearson p: 6.0928e-42
  Pred range: [0.0520, 0.7316], std: 0.0944
  RMSE : 0.1566, R2: 0.1814, MAE: 0.1289, Spearman rho: 0.4922, Spearman p: 8.4039e-38, Pearson r: 0.5127, Pearson p: 2.1891e-41
  Pred range: [0.0278, 0.7077], std: 0.0958
  RMSE : 0.1529, R2: 0.2196, MAE: 0.1236, Spearman rho: 0.4867, Spearman p: 6.8313e-37, Pearson r: 0.5098, Pearson p: 7.2486e-41
  Pred range: [0.0432, 0.7636], std: 0.1018
  RMSE : 0.1595, R2: 0.1510, MAE: 0.1312, Spearman rho: 0.4876, Spearman p: 4.8996e-37, Pearson r: 0.5097, Pearson p: 7.5833e-41
  Pred range: [0.0475, 0.7578], std: 0.0981
  RMSE : 0.1608, R2: 0.1370, MAE: 0.1333, Spearman rho: 0.4876, Spearman p: 4.8377e-37, Pearson r: 0.5118, Pearson p: 3.1016e-41
  Pred range: [-0.0161, 0.7064], std: 0.0964
  RMSE : 0.1515, R2: 0.2343, MAE: 0.1215, Spearman rho: 0.4901, Spearman p: 1.8599e-37, Pearson r: 0.5123, Pearson p: 2.5554e-41
  Pred range: [0.0466, 0.7908], std: 0.1045
  RMSE : 0.1613, R2: 0.1321, MAE: 0.1326, Spearman rho: 0.4834, Spearman p: 2.3688e-36, Pearson r: 0.5100, Pearson p: 6.5045e-41
[I 2026-04-27 19:18:13,595] Trial 43 finished with value: 0.15105580326770132 and parameters: {'learning_rate': 0.0004158273858704823, 'batch_size': 8, 'num_epochs': 27, 'weight_decay': 1.52896388424808e-05, 'layers_PRS': 1, 'layers_SCZ15': 3, 'layers_ADHD9': 1, 'layers_ASD9': 6, 'layers_ACE15': 5, 'layers_ACE18': 7, 'layers_SUD18': 1, 'layers_SES': 4, 'layers_SEX': 3, 'dropout': 0.1519802439184206, 'se_reduction': 4, 'hidden_dim_min': 7, 'base_loss': 'huber', 'huber_delta': 0.11170242974436431, 'focal_gamma': 2.80470310093252, 'n_bins': 17, 'scheduler_patience': 3, 'scheduler_factor': 0.513494324826915, 'early_stopping_patience': 8}. Best is trial 31 with value: 0.14835994978477499.
Train: 2407 rows (1613 IDs),Test: 598 rows (404 IDs) 

n_features_x : 6, n_features_per_modality: [16, 23, 19, 17, 7, 4, 4, 4, 1, 4]

--- ImbalancedRegressionLoss initialized ---
  Bins: 16, Focal gamma: 2.852503906531049, Base loss: huber
  Bin [0.00, 0.06): count=  383, weight=0.041
  Bin [0.06, 0.12): count=  377, weight=0.042
  Bin [0.12, 0.19): count=  405, weight=0.039
  Bin [0.19, 0.25): count=  295, weight=0.053
  Bin [0.25, 0.31): count=  239, weight=0.066
  Bin [0.31, 0.38): count=  199, weight=0.079
  Bin [0.38, 0.44): count=  142, weight=0.111
  Bin [0.44, 0.50): count=  122, weight=0.129
  Bin [0.50, 0.56): count=   93, weight=0.168
  Bin [0.56, 0.62): count=   64, weight=0.243
  Bin [0.62, 0.69): count=   36, weight=0.427
  Bin [0.69, 0.75): count=   24, weight=0.633
  Bin [0.75, 0.81): count=   19, weight=0.791
  Bin [0.81, 0.88): count=    5, weight=2.636
  Bin [0.88, 0.94): count=    2, weight=5.271
  Bin [0.94, 1.00): count=    2, weight=5.271
-------------------------------------------

  Pred range: [0.1321, 0.7017], std: 0.0846
  RMSE : 0.1958, R2: -0.2795, MAE: 0.1689, Spearman rho: 0.4269, Spearman p: 7.0186e-28, Pearson r: 0.4392, Pearson p: 1.3476e-29
  Pred range: [0.1044, 0.6317], std: 0.0830
  RMSE : 0.1617, R2: 0.1272, MAE: 0.1359, Spearman rho: 0.4603, Spearman p: 1.0709e-32, Pearson r: 0.4837, Pearson p: 2.1940e-36
  Pred range: [0.1060, 0.7310], std: 0.0922
  RMSE : 0.1855, R2: -0.1492, MAE: 0.1593, Spearman rho: 0.4592, Spearman p: 1.5894e-32, Pearson r: 0.4874, Pearson p: 5.2000e-37
  Pred range: [0.1107, 0.7818], std: 0.1021
  RMSE : 0.2044, R2: -0.3941, MAE: 0.1762, Spearman rho: 0.4716, Spearman p: 1.8934e-34, Pearson r: 0.4990, Pearson p: 5.7456e-39
  Pred range: [0.0513, 0.6105], std: 0.0833
  RMSE : 0.1605, R2: 0.1404, MAE: 0.1350, Spearman rho: 0.4660, Spearman p: 1.4410e-33, Pearson r: 0.4986, Pearson p: 6.5349e-39
  Pred range: [0.0458, 0.7480], std: 0.0998
  RMSE : 0.1773, R2: -0.0494, MAE: 0.1509, Spearman rho: 0.4751, Spearman p: 5.2350e-35, Pearson r: 0.5061, Pearson p: 3.3077e-40
[I 2026-04-27 19:18:29,028] Trial 44 pruned. 
Train: 2407 rows (1613 IDs),Test: 598 rows (404 IDs) 

n_features_x : 6, n_features_per_modality: [16, 23, 19, 17, 7, 4, 4, 4, 1, 4]

--- ImbalancedRegressionLoss initialized ---
  Bins: 17, Focal gamma: 2.6738802794542003, Base loss: huber
  Bin [0.00, 0.06): count=  172, weight=0.058
  Bin [0.06, 0.12): count=  413, weight=0.024
  Bin [0.12, 0.18): count=  376, weight=0.027
  Bin [0.18, 0.24): count=  370, weight=0.027
  Bin [0.24, 0.29): count=  255, weight=0.039
  Bin [0.29, 0.35): count=  223, weight=0.045
  Bin [0.35, 0.41): count=  162, weight=0.061
  Bin [0.41, 0.47): count=  134, weight=0.074
  Bin [0.47, 0.53): count=  108, weight=0.092
  Bin [0.53, 0.59): count=   78, weight=0.127
  Bin [0.59, 0.65): count=   47, weight=0.208
  Bin [0.65, 0.71): count=   27, weight=0.357
  Bin [0.71, 0.76): count=   26, weight=0.370
  Bin [0.76, 0.82): count=    9, weight=0.999
  Bin [0.82, 0.88): count=    4, weight=1.999
  Bin [0.88, 0.94): count=    3, weight=2.499
  Bin [0.94, 1.00): count=    0, weight=9.995
-------------------------------------------

  Pred range: [0.0822, 0.5301], std: 0.0739
  RMSE : 0.1563, R2: 0.1844, MAE: 0.1215, Spearman rho: 0.4335, Spearman p: 8.4929e-29, Pearson r: 0.4294, Pearson p: 3.1753e-28
  Pred range: [0.0835, 0.5766], std: 0.0829
  RMSE : 0.1518, R2: 0.2313, MAE: 0.1187, Spearman rho: 0.4748, Spearman p: 5.9770e-35, Pearson r: 0.4826, Pearson p: 3.2183e-36
  Pred range: [0.0553, 0.5783], std: 0.0857
  RMSE : 0.1522, R2: 0.2272, MAE: 0.1155, Spearman rho: 0.4762, Spearman p: 3.5376e-35, Pearson r: 0.4852, Pearson p: 1.2231e-36
  Pred range: [0.0996, 0.6582], std: 0.0974
  RMSE : 0.1563, R2: 0.1842, MAE: 0.1274, Spearman rho: 0.4883, Spearman p: 3.7674e-37, Pearson r: 0.5007, Pearson p: 2.9160e-39
  Pred range: [0.0609, 0.6779], std: 0.0978
  RMSE : 0.1535, R2: 0.2131, MAE: 0.1234, Spearman rho: 0.4876, Spearman p: 4.8597e-37, Pearson r: 0.5001, Pearson p: 3.6777e-39
  Pred range: [0.0740, 0.6103], std: 0.0927
  RMSE : 0.1516, R2: 0.2332, MAE: 0.1212, Spearman rho: 0.4865, Spearman p: 7.3523e-37, Pearson r: 0.5032, Pearson p: 1.0688e-39
  Pred range: [0.0609, 0.6014], std: 0.0958
  RMSE : 0.1508, R2: 0.2409, MAE: 0.1196, Spearman rho: 0.4857, Spearman p: 1.0186e-36, Pearson r: 0.5037, Pearson p: 8.6102e-40
  Pred range: [0.0579, 0.6522], std: 0.0971
  RMSE : 0.1552, R2: 0.1957, MAE: 0.1258, Spearman rho: 0.4747, Spearman p: 6.2381e-35, Pearson r: 0.4932, Pearson p: 5.5582e-38
  Pred range: [0.0985, 0.6515], std: 0.0980
  RMSE : 0.1576, R2: 0.1708, MAE: 0.1290, Spearman rho: 0.4785, Spearman p: 1.4898e-35, Pearson r: 0.4986, Pearson p: 6.6502e-39
  Pred range: [0.0557, 0.6466], std: 0.0975
  RMSE : 0.1549, R2: 0.1986, MAE: 0.1254, Spearman rho: 0.4741, Spearman p: 7.6991e-35, Pearson r: 0.4934, Pearson p: 5.1931e-38
  Pred range: [0.0555, 0.6560], std: 0.1006
  RMSE : 0.1547, R2: 0.2009, MAE: 0.1249, Spearman rho: 0.4756, Spearman p: 4.4638e-35, Pearson r: 0.4965, Pearson p: 1.5100e-38
  Pred range: [0.0412, 0.6430], std: 0.0987
  RMSE : 0.1539, R2: 0.2095, MAE: 0.1236, Spearman rho: 0.4718, Spearman p: 1.7583e-34, Pearson r: 0.4925, Pearson p: 7.4640e-38
  Pred range: [0.0452, 0.6701], std: 0.1017
  RMSE : 0.1550, R2: 0.1979, MAE: 0.1247, Spearman rho: 0.4734, Spearman p: 9.9974e-35, Pearson r: 0.4929, Pearson p: 6.1945e-38
  Pred range: [0.0573, 0.6662], std: 0.1010
  RMSE : 0.1550, R2: 0.1976, MAE: 0.1249, Spearman rho: 0.4735, Spearman p: 9.7481e-35, Pearson r: 0.4940, Pearson p: 4.1661e-38
[I 2026-04-27 19:19:57,117] Trial 45 finished with value: 0.1508012528567134 and parameters: {'learning_rate': 0.000800073299411577, 'batch_size': 6, 'num_epochs': 24, 'weight_decay': 2.2843262483471103e-05, 'layers_PRS': 1, 'layers_SCZ15': 2, 'layers_ADHD9': 3, 'layers_ASD9': 5, 'layers_ACE15': 4, 'layers_ACE18': 6, 'layers_SUD18': 2, 'layers_SES': 4, 'layers_SEX': 3, 'dropout': 0.20965816231103493, 'se_reduction': 4, 'hidden_dim_min': 6, 'base_loss': 'huber', 'huber_delta': 0.11477605153891211, 'focal_gamma': 2.6738802794542003, 'n_bins': 17, 'scheduler_patience': 2, 'scheduler_factor': 0.529836647622625, 'early_stopping_patience': 7}. Best is trial 31 with value: 0.14835994978477499.
Train: 2407 rows (1613 IDs),Test: 598 rows (404 IDs) 

n_features_x : 6, n_features_per_modality: [16, 23, 19, 17, 7, 4, 4, 4, 1, 4]

--- ImbalancedRegressionLoss initialized ---
  Bins: 19, Focal gamma: 2.2663833843914603, Base loss: huber
  Bin [0.00, 0.05): count=  172, weight=0.055
  Bin [0.05, 0.11): count=  413, weight=0.023
  Bin [0.11, 0.16): count=  376, weight=0.025
  Bin [0.16, 0.21): count=  204, weight=0.046
  Bin [0.21, 0.26): count=  295, weight=0.032
  Bin [0.26, 0.32): count=  239, weight=0.039
  Bin [0.32, 0.37): count=  199, weight=0.047
  Bin [0.37, 0.42): count=   73, weight=0.128
  Bin [0.42, 0.47): count=  134, weight=0.070
  Bin [0.47, 0.53): count=  108, weight=0.087
  Bin [0.53, 0.58): count=   78, weight=0.120
  Bin [0.58, 0.63): count=   28, weight=0.327
  Bin [0.63, 0.68): count=   36, weight=0.256
  Bin [0.68, 0.74): count=   24, weight=0.379
  Bin [0.74, 0.79): count=   19, weight=0.474
  Bin [0.79, 0.84): count=    2, weight=3.157
  Bin [0.84, 0.89): count=    4, weight=1.894
  Bin [0.89, 0.95): count=    3, weight=2.368
  Bin [0.95, 1.00): count=    0, weight=9.472
-------------------------------------------

  Pred range: [0.0839, 0.5540], std: 0.0818
  RMSE : 0.1533, R2: 0.2157, MAE: 0.1214, Spearman rho: 0.4646, Spearman p: 2.3733e-33, Pearson r: 0.4744, Pearson p: 6.8410e-35
  Pred range: [0.0857, 0.6620], std: 0.1040
  RMSE : 0.1567, R2: 0.1806, MAE: 0.1275, Spearman rho: 0.4856, Spearman p: 1.0596e-36, Pearson r: 0.5029, Pearson p: 1.1847e-39
  Pred range: [0.0906, 0.7753], std: 0.1123
  RMSE : 0.1588, R2: 0.1582, MAE: 0.1292, Spearman rho: 0.4926, Spearman p: 7.0570e-38, Pearson r: 0.5127, Pearson p: 2.1807e-41
  Pred range: [0.0551, 0.6842], std: 0.0932
  RMSE : 0.1571, R2: 0.1758, MAE: 0.1298, Spearman rho: 0.4807, Spearman p: 6.7676e-36, Pearson r: 0.4972, Pearson p: 1.1704e-38
  Pred range: [0.0166, 0.5966], std: 0.0893
  RMSE : 0.1521, R2: 0.2280, MAE: 0.1226, Spearman rho: 0.4800, Spearman p: 8.5941e-36, Pearson r: 0.4987, Pearson p: 6.4003e-39
  Pred range: [0.1028, 0.7723], std: 0.1143
  RMSE : 0.1687, R2: 0.0506, MAE: 0.1402, Spearman rho: 0.4944, Spearman p: 3.5595e-38, Pearson r: 0.5164, Pearson p: 4.6159e-42
  Pred range: [0.1121, 0.8307], std: 0.1201
  RMSE : 0.1843, R2: -0.1336, MAE: 0.1543, Spearman rho: 0.4928, Spearman p: 6.4355e-38, Pearson r: 0.5138, Pearson p: 1.3789e-41
  Pred range: [0.0921, 0.7414], std: 0.1260
  RMSE : 0.1668, R2: 0.0718, MAE: 0.1355, Spearman rho: 0.4995, Spearman p: 4.6034e-39, Pearson r: 0.5252, Pearson p: 1.0370e-43
  Pred range: [0.0473, 0.6811], std: 0.1026
  RMSE : 0.1544, R2: 0.2039, MAE: 0.1257, Spearman rho: 0.4910, Spearman p: 1.2917e-37, Pearson r: 0.5126, Pearson p: 2.2586e-41
  Pred range: [0.0797, 0.6666], std: 0.1032
  RMSE : 0.1532, R2: 0.2171, MAE: 0.1239, Spearman rho: 0.4866, Spearman p: 7.0505e-37, Pearson r: 0.5154, Pearson p: 6.9560e-42
  Pred range: [0.0430, 0.7140], std: 0.1107
  RMSE : 0.1597, R2: 0.1485, MAE: 0.1299, Spearman rho: 0.4905, Spearman p: 1.5860e-37, Pearson r: 0.5118, Pearson p: 3.1249e-41
  Pred range: [0.0589, 0.6735], std: 0.1051
  RMSE : 0.1532, R2: 0.2166, MAE: 0.1229, Spearman rho: 0.4859, Spearman p: 9.4873e-37, Pearson r: 0.5080, Pearson p: 1.4884e-40
  Pred range: [0.0196, 0.6928], std: 0.1103
  RMSE : 0.1546, R2: 0.2025, MAE: 0.1230, Spearman rho: 0.4817, Spearman p: 4.4946e-36, Pearson r: 0.5005, Pearson p: 3.1431e-39
[I 2026-04-27 19:21:23,294] Trial 46 finished with value: 0.15208265353947953 and parameters: {'learning_rate': 0.0013969468947720373, 'batch_size': 6, 'num_epochs': 26, 'weight_decay': 1.0548977785411431e-05, 'layers_PRS': 2, 'layers_SCZ15': 3, 'layers_ADHD9': 2, 'layers_ASD9': 5, 'layers_ACE15': 5, 'layers_ACE18': 7, 'layers_SUD18': 1, 'layers_SES': 4, 'layers_SEX': 4, 'dropout': 0.1877183613754461, 'se_reduction': 5, 'hidden_dim_min': 5, 'base_loss': 'huber', 'huber_delta': 0.08821375325577367, 'focal_gamma': 2.2663833843914603, 'n_bins': 19, 'scheduler_patience': 4, 'scheduler_factor': 0.45045969857521706, 'early_stopping_patience': 8}. Best is trial 31 with value: 0.14835994978477499.
Train: 2407 rows (1613 IDs),Test: 598 rows (404 IDs) 

n_features_x : 6, n_features_per_modality: [16, 23, 19, 17, 7, 4, 4, 4, 1, 4]

--- ImbalancedRegressionLoss initialized ---
  Bins: 14, Focal gamma: 2.8800408257861903, Base loss: huber
  Bin [0.00, 0.07): count=  383, weight=0.042
  Bin [0.07, 0.14): count=  377, weight=0.043
  Bin [0.14, 0.21): count=  571, weight=0.028
  Bin [0.21, 0.29): count=  255, weight=0.063
  Bin [0.29, 0.36): count=  223, weight=0.072
  Bin [0.36, 0.43): count=  231, weight=0.070
  Bin [0.43, 0.50): count=  122, weight=0.131
  Bin [0.50, 0.57): count=   93, weight=0.172
  Bin [0.57, 0.64): count=   83, weight=0.192
  Bin [0.64, 0.71): count=   27, weight=0.577
  Bin [0.71, 0.79): count=   26, weight=0.598
  Bin [0.79, 0.86): count=   12, weight=1.243
  Bin [0.86, 0.93): count=    2, weight=5.384
  Bin [0.93, 1.00): count=    2, weight=5.384
-------------------------------------------

  Pred range: [0.1173, 0.6216], std: 0.0820
  RMSE : 0.1894, R2: -0.1978, MAE: 0.1599, Spearman rho: 0.3097, Spearman p: 9.3220e-15, Pearson r: 0.3182, Pearson p: 1.5534e-15
  Pred range: [0.1206, 0.5985], std: 0.0783
  RMSE : 0.1796, R2: -0.0762, MAE: 0.1509, Spearman rho: 0.3493, Spearman p: 1.3381e-18, Pearson r: 0.3577, Pearson p: 1.7370e-19
  Pred range: [0.1534, 0.6382], std: 0.0844
  RMSE : 0.1887, R2: -0.1886, MAE: 0.1612, Spearman rho: 0.3824, Spearman p: 2.9332e-22, Pearson r: 0.3902, Pearson p: 3.5113e-23
  Pred range: [0.1543, 0.6186], std: 0.0821
  RMSE : 0.1847, R2: -0.1391, MAE: 0.1576, Spearman rho: 0.3939, Spearman p: 1.2406e-23, Pearson r: 0.4040, Pearson p: 6.9052e-25
  Pred range: [0.1535, 0.5990], std: 0.0814
  RMSE : 0.1770, R2: -0.0455, MAE: 0.1499, Spearman rho: 0.4084, Spearman p: 1.9326e-25, Pearson r: 0.4194, Pearson p: 7.1353e-27
  Pred range: [0.1811, 0.6463], std: 0.0860
  RMSE : 0.1895, R2: -0.1985, MAE: 0.1627, Spearman rho: 0.4199, Spearman p: 6.1318e-27, Pearson r: 0.4302, Pearson p: 2.4802e-28
[I 2026-04-27 19:21:37,136] Trial 47 pruned. 
Train: 2407 rows (1613 IDs),Test: 598 rows (404 IDs) 

n_features_x : 6, n_features_per_modality: [16, 23, 19, 17, 7, 4, 4, 4, 1, 4]

--- ImbalancedRegressionLoss initialized ---
  Bins: 16, Focal gamma: 1.996108548231588, Base loss: mse
  Bin [0.00, 0.06): count=  383, weight=0.041
  Bin [0.06, 0.12): count=  377, weight=0.042
  Bin [0.12, 0.19): count=  405, weight=0.039
  Bin [0.19, 0.25): count=  295, weight=0.053
  Bin [0.25, 0.31): count=  239, weight=0.066
  Bin [0.31, 0.38): count=  199, weight=0.079
  Bin [0.38, 0.44): count=  142, weight=0.111
  Bin [0.44, 0.50): count=  122, weight=0.129
  Bin [0.50, 0.56): count=   93, weight=0.168
  Bin [0.56, 0.62): count=   64, weight=0.243
  Bin [0.62, 0.69): count=   36, weight=0.427
  Bin [0.69, 0.75): count=   24, weight=0.633
  Bin [0.75, 0.81): count=   19, weight=0.791
  Bin [0.81, 0.88): count=    5, weight=2.636
  Bin [0.88, 0.94): count=    2, weight=5.271
  Bin [0.94, 1.00): count=    2, weight=5.271
-------------------------------------------

  Pred range: [-0.0856, 0.2068], std: 0.0437
  RMSE : 0.2747, R2: -1.5197, MAE: 0.2137, Spearman rho: 0.0245, Spearman p: 5.4985e-01, Pearson r: 0.0361, Pearson p: 3.7784e-01
  Pred range: [-0.0403, 0.2540], std: 0.0451
  RMSE : 0.2347, R2: -0.8381, MAE: 0.1729, Spearman rho: 0.0834, Spearman p: 4.1389e-02, Pearson r: 0.1001, Pearson p: 1.4304e-02
  Pred range: [-0.0002, 0.3254], std: 0.0485
  RMSE : 0.2000, R2: -0.3349, MAE: 0.1445, Spearman rho: 0.1450, Spearman p: 3.7362e-04, Pearson r: 0.1588, Pearson p: 9.5970e-05
  Pred range: [0.0383, 0.4247], std: 0.0537
  RMSE : 0.1766, R2: -0.0413, MAE: 0.1318, Spearman rho: 0.1966, Spearman p: 1.2692e-06, Pearson r: 0.2039, Pearson p: 4.9524e-07
  Pred range: [0.0724, 0.5167], std: 0.0598
  RMSE : 0.1694, R2: 0.0426, MAE: 0.1339, Spearman rho: 0.2314, Spearman p: 1.0388e-08, Pearson r: 0.2357, Pearson p: 5.3860e-09
  Pred range: [0.0973, 0.5849], std: 0.0650
  RMSE : 0.1742, R2: -0.0130, MAE: 0.1425, Spearman rho: 0.2526, Spearman p: 3.6945e-10, Pearson r: 0.2569, Pearson p: 1.8257e-10
