[I 2026-04-27 18:26:42,672] Trial 0 finished with value: 0.1533309179634956 and parameters: {'learning_rate': 0.006676030156436903, 'batch_size': 6, 'num_epochs': 19, 'weight_decay': 1.6594606447773968e-05, 'layers_PRS': 5, 'layers_SCZ15': 5, 'layers_ADHD9': 6, 'layers_ASD9': 3, 'layers_ACE15': 5, 'layers_ACE18': 2, 'layers_SUD18': 3, 'layers_SES': 7, 'layers_SEX': 1, 'dropout': 0.2248898333187067, 'se_reduction': 4, 'hidden_dim_min': 11, 'base_loss': 'mse', 'huber_delta': 0.1347764218902967, 'focal_gamma': 1.637574182862372, 'n_bins': 14, 'scheduler_patience': 3, 'scheduler_factor': 0.6096163595682115, 'early_stopping_patience': 7}. Best is trial 0 with value: 0.1533309179634956.
Train: 2407 rows (1613 IDs),Test: 598 rows (404 IDs) 

n_features_x : 6, n_features_per_modality: [16, 23, 19, 17, 7, 4, 4, 4, 1, 4]

--- ImbalancedRegressionLoss initialized ---
  Bins: 11, Focal gamma: 2.752228556884103, Base loss: huber
  Bin [0.00, 0.09): count=  585, weight=0.034
  Bin [0.09, 0.18): count=  580, weight=0.034
  Bin [0.18, 0.27): count=  421, weight=0.047
  Bin [0.27, 0.36): count=  312, weight=0.064
  Bin [0.36, 0.45): count=  207, weight=0.096
  Bin [0.45, 0.55): count=  108, weight=0.183
  Bin [0.55, 0.64): count=  125, weight=0.159
  Bin [0.64, 0.73): count=   41, weight=0.476
  Bin [0.73, 0.82): count=   21, weight=0.909
  Bin [0.82, 0.91): count=    4, weight=3.999
  Bin [0.91, 1.00): count=    3, weight=4.998
-------------------------------------------

  Pred range: [0.2171, 0.8250], std: 0.0973
  RMSE : 0.2411, R2: -0.9398, MAE: 0.2111, Spearman rho: 0.4412, Spearman p: 7.1519e-30, Pearson r: 0.4587, Pearson p: 1.8971e-32
  Pred range: [0.2339, 0.8548], std: 0.1011
  RMSE : 0.2767, R2: -1.5549, MAE: 0.2464, Spearman rho: 0.4663, Spearman p: 1.2874e-33, Pearson r: 0.4821, Pearson p: 3.9387e-36
  Pred range: [0.1456, 0.6973], std: 0.0857
  RMSE : 0.1732, R2: -0.0008, MAE: 0.1471, Spearman rho: 0.4682, Spearman p: 6.6530e-34, Pearson r: 0.4996, Pearson p: 4.5136e-39
  Pred range: [0.1614, 0.6775], std: 0.0804
  RMSE : 0.1855, R2: -0.1486, MAE: 0.1602, Spearman rho: 0.4621, Spearman p: 5.6755e-33, Pearson r: 0.4982, Pearson p: 7.6700e-39
  Pred range: [0.2021, 0.7907], std: 0.0980
  RMSE : 0.2425, R2: -0.9625, MAE: 0.2137, Spearman rho: 0.4539, Spearman p: 9.8783e-32, Pearson r: 0.4846, Pearson p: 1.5597e-36
  Pred range: [0.2043, 0.7727], std: 0.0942
  RMSE : 0.2400, R2: -0.9218, MAE: 0.2113, Spearman rho: 0.4629, Spearman p: 4.2953e-33, Pearson r: 0.4969, Pearson p: 1.3053e-38
  Pred range: [0.1668, 0.6551], std: 0.0817
  RMSE : 0.1871, R2: -0.1679, MAE: 0.1623, Spearman rho: 0.4702, Spearman p: 3.2154e-34, Pearson r: 0.4961, Pearson p: 1.7846e-38
  Pred range: [0.1697, 0.6328], std: 0.0768
  RMSE : 0.1867, R2: -0.1632, MAE: 0.1623, Spearman rho: 0.4800, Spearman p: 8.6368e-36, Pearson r: 0.5004, Pearson p: 3.2483e-39
  Pred range: [0.1367, 0.6556], std: 0.0826
  RMSE : 0.1750, R2: -0.0225, MAE: 0.1497, Spearman rho: 0.4748, Spearman p: 5.8785e-35, Pearson r: 0.5015, Pearson p: 2.0938e-39
  Pred range: [0.1910, 0.6845], std: 0.0796
  RMSE : 0.2044, R2: -0.3949, MAE: 0.1785, Spearman rho: 0.4673, Spearman p: 8.9970e-34, Pearson r: 0.5011, Pearson p: 2.4659e-39
  Pred range: [0.2170, 0.7696], std: 0.0944
  RMSE : 0.2370, R2: -0.8743, MAE: 0.2080, Spearman rho: 0.4585, Spearman p: 2.0376e-32, Pearson r: 0.4869, Pearson p: 6.3249e-37
[I 2026-04-27 18:27:00,819] Trial 1 finished with value: 0.1731572815083483 and parameters: {'learning_rate': 0.007455418385679419, 'batch_size': 32, 'num_epochs': 28, 'weight_decay': 0.005502404623205413, 'layers_PRS': 4, 'layers_SCZ15': 5, 'layers_ADHD9': 3, 'layers_ASD9': 2, 'layers_ACE15': 3, 'layers_ACE18': 1, 'layers_SUD18': 6, 'layers_SES': 6, 'layers_SEX': 6, 'dropout': 0.3238906468308394, 'se_reduction': 5, 'hidden_dim_min': 15, 'base_loss': 'huber', 'huber_delta': 0.032496136459910396, 'focal_gamma': 2.752228556884103, 'n_bins': 11, 'scheduler_patience': 4, 'scheduler_factor': 0.6566480240830357, 'early_stopping_patience': 8}. Best is trial 0 with value: 0.1533309179634956.
Train: 2407 rows (1613 IDs),Test: 598 rows (404 IDs) 

n_features_x : 6, n_features_per_modality: [16, 23, 19, 17, 7, 4, 4, 4, 1, 4]

--- ImbalancedRegressionLoss initialized ---
  Bins: 5, Focal gamma: 2.7525737324260593, Base loss: huber
  Bin [0.00, 0.20): count= 1165, weight=0.037
  Bin [0.20, 0.40): count=  806, weight=0.054
  Bin [0.40, 0.60): count=  320, weight=0.136
  Bin [0.60, 0.80): count=  107, weight=0.404
  Bin [0.80, 1.00): count=    9, weight=4.368
-------------------------------------------

  Pred range: [0.0132, 0.3792], std: 0.0545
  RMSE : 0.1894, R2: -0.1979, MAE: 0.1369, Spearman rho: 0.1959, Spearman p: 1.3751e-06, Pearson r: 0.2356, Pearson p: 5.4682e-09
  Pred range: [0.0799, 0.5928], std: 0.0756
  RMSE : 0.1710, R2: 0.0245, MAE: 0.1386, Spearman rho: 0.2628, Spearman p: 6.6056e-11, Pearson r: 0.2974, Pearson p: 1.1231e-13
  Pred range: [0.1055, 0.6689], std: 0.0832
  RMSE : 0.1864, R2: -0.1597, MAE: 0.1563, Spearman rho: 0.2871, Spearman p: 8.2592e-13, Pearson r: 0.3189, Pearson p: 1.3191e-15
  Pred range: [0.1116, 0.6514], std: 0.0818
  RMSE : 0.1878, R2: -0.1770, MAE: 0.1582, Spearman rho: 0.3024, Spearman p: 4.1622e-14, Pearson r: 0.3335, Pearson p: 5.3108e-17
  Pred range: [0.1154, 0.6372], std: 0.0811
  RMSE : 0.1882, R2: -0.1821, MAE: 0.1590, Spearman rho: 0.3147, Spearman p: 3.2349e-15, Pearson r: 0.3461, Pearson p: 2.8578e-18
  Pred range: [0.1234, 0.6394], std: 0.0825
  RMSE : 0.1929, R2: -0.2422, MAE: 0.1638, Spearman rho: 0.3267, Spearman p: 2.4250e-16, Pearson r: 0.3580, Pearson p: 1.5970e-19
  Pred range: [0.1222, 0.6293], std: 0.0802
  RMSE : 0.1888, R2: -0.1900, MAE: 0.1600, Spearman rho: 0.3340, Spearman p: 4.7464e-17, Pearson r: 0.3649, Pearson p: 2.8218e-20
  Pred range: [0.1236, 0.6303], std: 0.0795
  RMSE : 0.1874, R2: -0.1725, MAE: 0.1588, Spearman rho: 0.3403, Spearman p: 1.1225e-17, Pearson r: 0.3725, Pearson p: 4.0797e-21
  Pred range: [0.1270, 0.6377], std: 0.0797
  RMSE : 0.1881, R2: -0.1813, MAE: 0.1597, Spearman rho: 0.3474, Spearman p: 2.1138e-18, Pearson r: 0.3797, Pearson p: 6.0432e-22
  Pred range: [0.1272, 0.6321], std: 0.0787
  RMSE : 0.1858, R2: -0.1526, MAE: 0.1576, Spearman rho: 0.3536, Spearman p: 4.7120e-19, Pearson r: 0.3861, Pearson p: 1.0743e-22
[I 2026-04-27 18:27:27,608] Trial 2 finished with value: 0.17095562114415128 and parameters: {'learning_rate': 3.482595827886016e-05, 'batch_size': 16, 'num_epochs': 12, 'weight_decay': 3.0602727134662645e-05, 'layers_PRS': 6, 'layers_SCZ15': 4, 'layers_ADHD9': 2, 'layers_ASD9': 1, 'layers_ACE15': 7, 'layers_ACE18': 4, 'layers_SUD18': 1, 'layers_SES': 5, 'layers_SEX': 1, 'dropout': 0.219588731617391, 'se_reduction': 3, 'hidden_dim_min': 13, 'base_loss': 'huber', 'huber_delta': 0.16145582551297666, 'focal_gamma': 2.7525737324260593, 'n_bins': 5, 'scheduler_patience': 3, 'scheduler_factor': 0.6510789777657571, 'early_stopping_patience': 8}. Best is trial 0 with value: 0.1533309179634956.
Train: 2407 rows (1613 IDs),Test: 598 rows (404 IDs) 

n_features_x : 6, n_features_per_modality: [16, 23, 19, 17, 7, 4, 4, 4, 1, 4]

--- ImbalancedRegressionLoss initialized ---
  Bins: 6, Focal gamma: 0.7821399306802891, Base loss: mse
  Bin [0.00, 0.17): count=  961, weight=0.041
  Bin [0.17, 0.33): count=  848, weight=0.047
  Bin [0.33, 0.50): count=  353, weight=0.112
  Bin [0.50, 0.67): count=  176, weight=0.224
  Bin [0.67, 0.83): count=   62, weight=0.628
  Bin [0.83, 1.00): count=    7, weight=4.948
-------------------------------------------

  Pred range: [0.0155, 0.3753], std: 0.0498
  RMSE : 0.1800, R2: -0.0821, MAE: 0.1303, Spearman rho: 0.2771, Spearman p: 5.2956e-12, Pearson r: 0.3157, Pearson p: 2.6274e-15
  Pred range: [0.1245, 0.7852], std: 0.0935
  RMSE : 0.2163, R2: -0.5611, MAE: 0.1860, Spearman rho: 0.3050, Spearman p: 2.4176e-14, Pearson r: 0.3392, Pearson p: 1.4442e-17
  Pred range: [0.1322, 0.7870], std: 0.0966
  RMSE : 0.2259, R2: -0.7030, MAE: 0.1956, Spearman rho: 0.3261, Spearman p: 2.8002e-16, Pearson r: 0.3597, Pearson p: 1.0421e-19
  Pred range: [0.1310, 0.7654], std: 0.0946
  RMSE : 0.2198, R2: -0.6123, MAE: 0.1901, Spearman rho: 0.3397, Spearman p: 1.2983e-17, Pearson r: 0.3749, Pearson p: 2.1589e-21
  Pred range: [0.1300, 0.7588], std: 0.0942
  RMSE : 0.2156, R2: -0.5520, MAE: 0.1863, Spearman rho: 0.3495, Spearman p: 1.2681e-18, Pearson r: 0.3844, Pearson p: 1.6936e-22
[I 2026-04-27 18:27:36,156] Trial 3 finished with value: 0.1800475245560636 and parameters: {'learning_rate': 0.00012161909552697293, 'batch_size': 32, 'num_epochs': 18, 'weight_decay': 0.00016528476977092926, 'layers_PRS': 7, 'layers_SCZ15': 4, 'layers_ADHD9': 6, 'layers_ASD9': 2, 'layers_ACE15': 2, 'layers_ACE18': 1, 'layers_SUD18': 5, 'layers_SES': 4, 'layers_SEX': 3, 'dropout': 0.2503334029354048, 'se_reduction': 3, 'hidden_dim_min': 9, 'base_loss': 'mse', 'huber_delta': 0.18787713944781656, 'focal_gamma': 0.7821399306802891, 'n_bins': 6, 'scheduler_patience': 2, 'scheduler_factor': 0.5649949460654011, 'early_stopping_patience': 4}. Best is trial 0 with value: 0.1533309179634956.
Train: 2407 rows (1613 IDs),Test: 598 rows (404 IDs) 

n_features_x : 6, n_features_per_modality: [16, 23, 19, 17, 7, 4, 4, 4, 1, 4]

--- ImbalancedRegressionLoss initialized ---
  Bins: 5, Focal gamma: 2.435437700414579, Base loss: mse
  Bin [0.00, 0.20): count= 1165, weight=0.037
  Bin [0.20, 0.40): count=  806, weight=0.054
  Bin [0.40, 0.60): count=  320, weight=0.136
  Bin [0.60, 0.80): count=  107, weight=0.404
  Bin [0.80, 1.00): count=    9, weight=4.368
-------------------------------------------

  Pred range: [0.1212, 0.6232], std: 0.0757
  RMSE : 0.2022, R2: -0.3647, MAE: 0.1743, Spearman rho: 0.3277, Spearman p: 1.9616e-16, Pearson r: 0.3287, Pearson p: 1.5780e-16
  Pred range: [0.1357, 0.6378], std: 0.0766
  RMSE : 0.1964, R2: -0.2873, MAE: 0.1693, Spearman rho: 0.3754, Spearman p: 1.8887e-21, Pearson r: 0.3754, Pearson p: 1.8713e-21
  Pred range: [0.1423, 0.6202], std: 0.0758
  RMSE : 0.1872, R2: -0.1692, MAE: 0.1607, Spearman rho: 0.4061, Spearman p: 3.7701e-25, Pearson r: 0.4061, Pearson p: 3.7968e-25
  Pred range: [0.1461, 0.6315], std: 0.0784
  RMSE : 0.1860, R2: -0.1550, MAE: 0.1599, Spearman rho: 0.4288, Spearman p: 3.8851e-28, Pearson r: 0.4305, Pearson p: 2.2298e-28
  Pred range: [0.1595, 0.6863], std: 0.0835
  RMSE : 0.1970, R2: -0.2956, MAE: 0.1710, Spearman rho: 0.4402, Spearman p: 9.8372e-30, Pearson r: 0.4449, Pearson p: 2.0922e-30
  Pred range: [0.1449, 0.6453], std: 0.0788
  RMSE : 0.1756, R2: -0.0298, MAE: 0.1501, Spearman rho: 0.4551, Spearman p: 6.5514e-32, Pearson r: 0.4605, Pearson p: 1.0213e-32
  Pred range: [0.1478, 0.6341], std: 0.0799
  RMSE : 0.1723, R2: 0.0086, MAE: 0.1472, Spearman rho: 0.4745, Spearman p: 6.5807e-35, Pearson r: 0.4806, Pearson p: 6.9541e-36
  Pred range: [0.1621, 0.6949], std: 0.0869
  RMSE : 0.1902, R2: -0.2081, MAE: 0.1647, Spearman rho: 0.4790, Spearman p: 1.2429e-35, Pearson r: 0.4878, Pearson p: 4.5961e-37
  Pred range: [0.1481, 0.6427], std: 0.0806
  RMSE : 0.1707, R2: 0.0271, MAE: 0.1459, Spearman rho: 0.4820, Spearman p: 4.0990e-36, Pearson r: 0.4930, Pearson p: 6.1096e-38
  Pred range: [0.1671, 0.7052], std: 0.0882
  RMSE : 0.1890, R2: -0.1928, MAE: 0.1634, Spearman rho: 0.4805, Spearman p: 7.1059e-36, Pearson r: 0.4954, Pearson p: 2.3450e-38
  Pred range: [0.1474, 0.6650], std: 0.0833
  RMSE : 0.1743, R2: -0.0137, MAE: 0.1497, Spearman rho: 0.4885, Spearman p: 3.4905e-37, Pearson r: 0.5017, Pearson p: 1.9173e-39
  Pred range: [0.1512, 0.6537], std: 0.0820
  RMSE : 0.1758, R2: -0.0318, MAE: 0.1513, Spearman rho: 0.4923, Spearman p: 8.0842e-38, Pearson r: 0.5051, Pearson p: 4.8182e-40
  Pred range: [0.1473, 0.6766], std: 0.0851
  RMSE : 0.1785, R2: -0.0630, MAE: 0.1536, Spearman rho: 0.4903, Spearman p: 1.7323e-37, Pearson r: 0.5050, Pearson p: 5.1662e-40
  Pred range: [0.1281, 0.6744], std: 0.0844
  RMSE : 0.1748, R2: -0.0204, MAE: 0.1502, Spearman rho: 0.4883, Spearman p: 3.7245e-37, Pearson r: 0.5041, Pearson p: 7.3797e-40
  Pred range: [0.1247, 0.6839], std: 0.0856
  RMSE : 0.1783, R2: -0.0611, MAE: 0.1535, Spearman rho: 0.4883, Spearman p: 3.6943e-37, Pearson r: 0.5039, Pearson p: 7.9469e-40
  Pred range: [0.1122, 0.6669], std: 0.0843
  RMSE : 0.1733, R2: -0.0029, MAE: 0.1487, Spearman rho: 0.4889, Spearman p: 3.0051e-37, Pearson r: 0.5051, Pearson p: 4.7991e-40
  Pred range: [0.1075, 0.6645], std: 0.0847
  RMSE : 0.1716, R2: 0.0169, MAE: 0.1469, Spearman rho: 0.4894, Spearman p: 2.4586e-37, Pearson r: 0.5057, Pearson p: 3.7905e-40
[I 2026-04-27 18:28:23,063] Trial 4 finished with value: 0.17072019273468472 and parameters: {'learning_rate': 0.00026496357892775155, 'batch_size': 16, 'num_epochs': 27, 'weight_decay': 6.175879732362406e-05, 'layers_PRS': 7, 'layers_SCZ15': 3, 'layers_ADHD9': 7, 'layers_ASD9': 1, 'layers_ACE15': 4, 'layers_ACE18': 3, 'layers_SUD18': 3, 'layers_SES': 3, 'layers_SEX': 2, 'dropout': 0.3654232948089754, 'se_reduction': 7, 'hidden_dim_min': 10, 'base_loss': 'mse', 'huber_delta': 0.04477914376722161, 'focal_gamma': 2.435437700414579, 'n_bins': 5, 'scheduler_patience': 2, 'scheduler_factor': 0.5093276092565522, 'early_stopping_patience': 8}. Best is trial 0 with value: 0.1533309179634956.
Train: 2407 rows (1613 IDs),Test: 598 rows (404 IDs) 

n_features_x : 6, n_features_per_modality: [16, 23, 19, 17, 7, 4, 4, 4, 1, 4]

--- ImbalancedRegressionLoss initialized ---
  Bins: 9, Focal gamma: 2.150412740437883, Base loss: mse
  Bin [0.00, 0.11): count=  585, weight=0.041
  Bin [0.11, 0.22): count=  746, weight=0.032
  Bin [0.22, 0.33): count=  478, weight=0.050
  Bin [0.33, 0.44): count=  231, weight=0.104
  Bin [0.44, 0.56): count=  215, weight=0.112
  Bin [0.56, 0.67): count=  100, weight=0.239
  Bin [0.67, 0.78): count=   36, weight=0.653
  Bin [0.78, 0.89): count=   13, weight=1.726
  Bin [0.89, 1.00): count=    3, weight=6.041
-------------------------------------------

  Pred range: [0.1134, 0.5530], std: 0.0714
  RMSE : 0.1608, R2: 0.1365, MAE: 0.1330, Spearman rho: 0.4333, Spearman p: 9.2967e-29, Pearson r: 0.4527, Pearson p: 1.5105e-31
  Pred range: [0.1343, 0.5849], std: 0.0795
  RMSE : 0.1705, R2: 0.0294, MAE: 0.1448, Spearman rho: 0.4583, Spearman p: 2.1666e-32, Pearson r: 0.4821, Pearson p: 3.8818e-36
  Pred range: [0.1400, 0.5897], std: 0.0836
  RMSE : 0.1685, R2: 0.0518, MAE: 0.1427, Spearman rho: 0.4713, Spearman p: 2.1333e-34, Pearson r: 0.4969, Pearson p: 1.3064e-38
  Pred range: [0.1538, 0.6438], std: 0.0902
  RMSE : 0.1800, R2: -0.0814, MAE: 0.1540, Spearman rho: 0.4791, Spearman p: 1.1979e-35, Pearson r: 0.5044, Pearson p: 6.6221e-40
  Pred range: [0.1409, 0.5991], std: 0.0840
  RMSE : 0.1649, R2: 0.0922, MAE: 0.1394, Spearman rho: 0.4879, Spearman p: 4.4202e-37, Pearson r: 0.5136, Pearson p: 1.4674e-41
  Pred range: [0.1418, 0.6138], std: 0.0835
  RMSE : 0.1636, R2: 0.1071, MAE: 0.1379, Spearman rho: 0.4893, Spearman p: 2.5238e-37, Pearson r: 0.5143, Pearson p: 1.0793e-41
  Pred range: [0.1557, 0.6392], std: 0.0875
  RMSE : 0.1758, R2: -0.0321, MAE: 0.1504, Spearman rho: 0.4880, Spearman p: 4.2032e-37, Pearson r: 0.5139, Pearson p: 1.3251e-41
  Pred range: [0.1446, 0.5986], std: 0.0830
  RMSE : 0.1651, R2: 0.0907, MAE: 0.1397, Spearman rho: 0.4876, Spearman p: 4.9111e-37, Pearson r: 0.5160, Pearson p: 5.3025e-42
  Pred range: [0.1379, 0.5814], std: 0.0803
  RMSE : 0.1585, R2: 0.1615, MAE: 0.1322, Spearman rho: 0.4885, Spearman p: 3.4508e-37, Pearson r: 0.5156, Pearson p: 6.4880e-42
  Pred range: [0.1236, 0.5682], std: 0.0792
  RMSE : 0.1575, R2: 0.1719, MAE: 0.1310, Spearman rho: 0.4892, Spearman p: 2.6326e-37, Pearson r: 0.5154, Pearson p: 7.0766e-42
  Pred range: [0.1351, 0.5884], std: 0.0829
  RMSE : 0.1594, R2: 0.1517, MAE: 0.1334, Spearman rho: 0.4933, Spearman p: 5.4291e-38, Pearson r: 0.5191, Pearson p: 1.4405e-42
  Pred range: [0.1486, 0.6190], std: 0.0853
  RMSE : 0.1674, R2: 0.0651, MAE: 0.1421, Spearman rho: 0.4940, Spearman p: 4.1212e-38, Pearson r: 0.5186, Pearson p: 1.8273e-42
  Pred range: [0.1502, 0.6272], std: 0.0869
  RMSE : 0.1701, R2: 0.0345, MAE: 0.1447, Spearman rho: 0.4919, Spearman p: 9.2389e-38, Pearson r: 0.5172, Pearson p: 3.2174e-42
  Pred range: [0.1297, 0.5929], std: 0.0818
  RMSE : 0.1627, R2: 0.1159, MAE: 0.1371, Spearman rho: 0.4889, Spearman p: 2.9467e-37, Pearson r: 0.5141, Pearson p: 1.1799e-41
  Pred range: [0.1293, 0.6070], std: 0.0840
  RMSE : 0.1654, R2: 0.0871, MAE: 0.1399, Spearman rho: 0.4902, Spearman p: 1.8274e-37, Pearson r: 0.5156, Pearson p: 6.2806e-42
  Pred range: [0.1147, 0.5838], std: 0.0826
  RMSE : 0.1587, R2: 0.1590, MAE: 0.1325, Spearman rho: 0.4907, Spearman p: 1.5039e-37, Pearson r: 0.5160, Pearson p: 5.3754e-42
  Pred range: [0.1280, 0.6004], std: 0.0843
  RMSE : 0.1642, R2: 0.1003, MAE: 0.1386, Spearman rho: 0.4906, Spearman p: 1.5394e-37, Pearson r: 0.5161, Pearson p: 5.2353e-42
  Pred range: [0.1199, 0.5901], std: 0.0833
  RMSE : 0.1609, R2: 0.1356, MAE: 0.1349, Spearman rho: 0.4887, Spearman p: 3.1434e-37, Pearson r: 0.5143, Pearson p: 1.1037e-41
