[I 2026-04-27 18:25:30,488] Trial 99 finished with value: 0.08939162288982946 and parameters: {'learning_rate': 0.001536396847584887, 'batch_size': 4, 'num_epochs': 21, 'weight_decay': 0.002051169063630114, 'layers_PRS': 2, 'layers_SCZ15': 3, 'layers_ADHD9': 6, 'layers_ASD9': 3, 'layers_ACE15': 3, 'layers_ACE18': 5, 'layers_SUD18': 6, 'layers_SES': 5, 'layers_SEX': 3, 'dropout': 0.3086094872956638, 'se_reduction': 8, 'hidden_dim_min': 8, 'base_loss': 'huber', 'huber_delta': 0.020516092960272545, 'focal_gamma': 0.793142749268557, 'n_bins': 7, 'scheduler_patience': 4, 'scheduler_factor': 0.6176610927659378, 'early_stopping_patience': 5}. Best is trial 95 with value: 0.08763367923288566.

Completed in 129.2 minutes
Trials: 70 complete, 30 pruned

============================================================
  Best Pos trial
============================================================
  RMSE: 0.0876

  Copy these into hyperparameters.json:
  ----------------------------------------
  learning_rate = 0.0013763607938104196
  batch_size = 4
  num_epochs = 21
  weight_decay = 0.003675633147123033
  layers_PRS = 2
  layers_SCZ15 = 4
  layers_ADHD9 = 6
  layers_ASD9 = 1
  layers_ACE15 = 3
  layers_ACE18 = 4
  layers_SUD18 = 3
  layers_SES = 5
  layers_SEX = 3
  dropout = 0.30964103036281887
  se_reduction = 8
  hidden_dim_min = 5
  base_loss = 'huber'
  huber_delta = 0.08209149216493337
  focal_gamma = 0.7737399416408333
  n_bins = 7
  scheduler_patience = 4
  scheduler_factor = 0.6380817676841847
  early_stopping_patience = 5
  ----------------------------------------

Best hyperparameters saved to 'Pos_best_params.txt'
All trial results saved to 'Pos_optuna_results.csv'
Visualizations saved as Pos_*.html

============================================================
  Tuning Neg symptom model (100 trials)
============================================================
  0%|          | 0/100 [00:00<?, ?it/s]                                         0%|          | 0/100 [01:05<?, ?it/s]Best trial: 0. Best value: 0.153331:   0%|          | 0/100 [01:05<?, ?it/s]Best trial: 0. Best value: 0.153331:   1%|          | 1/100 [01:05<1:48:25, 65.71s/it]                                                                                      Best trial: 0. Best value: 0.153331:   1%|          | 1/100 [01:23<1:48:25, 65.71s/it]Best trial: 0. Best value: 0.153331:   1%|          | 1/100 [01:23<1:48:25, 65.71s/it]Best trial: 0. Best value: 0.153331:   2%|▏         | 2/100 [01:23<1:01:37, 37.73s/it]                                                                                      Best trial: 0. Best value: 0.153331:   2%|▏         | 2/100 [01:50<1:01:37, 37.73s/it]Best trial: 0. Best value: 0.153331:   2%|▏         | 2/100 [01:50<1:01:37, 37.73s/it]Best trial: 0. Best value: 0.153331:   3%|▎         | 3/100 [01:50<52:55, 32.74s/it]                                                                                      Best trial: 0. Best value: 0.153331:   3%|▎         | 3/100 [01:59<52:55, 32.74s/it]Best trial: 0. Best value: 0.153331:   3%|▎         | 3/100 [01:59<52:55, 32.74s/it]Best trial: 0. Best value: 0.153331:   4%|▍         | 4/100 [01:59<37:05, 23.19s/it]                                                                                    Best trial: 0. Best value: 0.153331:   4%|▍         | 4/100 [02:46<37:05, 23.19s/it]Best trial: 0. Best value: 0.153331:   4%|▍         | 4/100 [02:46<37:05, 23.19s/it]Best trial: 0. Best value: 0.153331:   5%|▌         | 5/100 [02:46<50:15, 31.74s/it]                                                                                    Best trial: 0. Best value: 0.153331:   5%|▌         | 5/100 [04:32<50:15, 31.74s/it]Best trial: 0. Best value: 0.153331:   5%|▌         | 5/100 [04:32<50:15, 31.74s/it]Best trial: 0. Best value: 0.153331:   6%|▌         | 6/100 [04:32<1:29:35, 57.19s/it]                                                                                      Best trial: 0. Best value: 0.153331:   6%|▌         | 6/100 [06:35<1:29:35, 57.19s/it]Best trial: 6. Best value: 0.152302:   6%|▌         | 6/100 [06:35<1:29:35, 57.19s/it]Best trial: 6. Best value: 0.152302:   7%|▋         | 7/100 [06:35<2:01:58, 78.70s/it]                                                                                      Best trial: 6. Best value: 0.152302:   7%|▋         | 7/100 [08:43<2:01:58, 78.70s/it]Best trial: 7. Best value: 0.151068:   7%|▋         | 7/100 [08:43<2:01:58, 78.70s/it]Best trial: 7. Best value: 0.151068:   8%|▊         | 8/100 [08:43<2:24:31, 94.26s/it]                                                                                      Best trial: 7. Best value: 0.151068:   8%|▊         | 8/100 [10:45<2:24:31, 94.26s/it]Best trial: 8. Best value: 0.150057:   8%|▊         | 8/100 [10:45<2:24:31, 94.26s/it]Best trial: 8. Best value: 0.150057:   9%|▉         | 9/100 [10:45<2:36:12, 102.99s/it]                                                                                       Best trial: 8. Best value: 0.150057:   9%|▉         | 9/100 [12:03<2:36:12, 102.99s/it]Best trial: 8. Best value: 0.150057:   9%|▉         | 9/100 [12:03<2:36:12, 102.99s/it]Best trial: 8. Best value: 0.150057:  10%|█         | 10/100 [12:03<2:23:08, 95.42s/it]                                                                                       Best trial: 8. Best value: 0.150057:  10%|█         | 10/100 [12:56<2:23:08, 95.42s/it]Best trial: 8. Best value: 0.150057:  10%|█         | 10/100 [12:56<2:23:08, 95.42s/it]Best trial: 8. Best value: 0.150057:  11%|█         | 11/100 [12:56<2:02:01, 82.26s/it]                                                                                       Best trial: 8. Best value: 0.150057:  11%|█         | 11/100 [13:39<2:02:01, 82.26s/it]Best trial: 8. Best value: 0.150057:  11%|█         | 11/100 [13:39<2:02:01, 82.26s/it]Best trial: 8. Best value: 0.150057:  12%|█▏        | 12/100 [13:39<1:43:18, 70.43s/it]                                                                                       Best trial: 8. Best value: 0.150057:  12%|█▏        | 12/100 [14:46<1:43:18, 70.43s/it]Best trial: 8. Best value: 0.150057:  12%|█▏        | 12/100 [14:46<1:43:18, 70.43s/it]Best trial: 8. Best value: 0.150057:  13%|█▎        | 13/100 [14:46<1:40:34, 69.36s/it]                                                                                       Best trial: 8. Best value: 0.150057:  13%|█▎        | 13/100 [15:18<1:40:34, 69.36s/it]Best trial: 8. Best value: 0.150057:  13%|█▎        | 13/100 [15:18<1:40:34, 69.36s/it]Best trial: 8. Best value: 0.150057:  14%|█▍        | 14/100 [15:18<1:23:01, 57.92s/it]                                                                                       Best trial: 8. Best value: 0.150057:  14%|█▍        | 14/100 [17:30<1:23:01, 57.92s/it]Best trial: 8. Best value: 0.150057:  14%|█▍        | 14/100 [17:30<1:23:01, 57.92s/it]Best trial: 8. Best value: 0.150057:  15%|█▌        | 15/100 [17:30<1:54:03, 80.51s/it]                                                                                       Best trial: 8. Best value: 0.150057:  15%|█▌        | 15/100 [19:01<1:54:03, 80.51s/it]Best trial: 8. Best value: 0.150057:  15%|█▌        | 15/100 [19:01<1:54:03, 80.51s/it]Best trial: 8. Best value: 0.150057:  16%|█▌        | 16/100 [19:01<1:57:04, 83.62s/it]                                                                                       Best trial: 8. Best value: 0.150057:  16%|█▌        | 16/100 [20:55<1:57:04, 83.62s/it]Best trial: 8. Best value: 0.150057:  16%|█▌        | 16/100 [20:55<1:57:04, 83.62s/it]Best trial: 8. Best value: 0.150057:  17%|█▋        | 17/100 [20:55<2:08:10, 92.65s/it]                                                                                       Best trial: 8. Best value: 0.150057:  17%|█▋        | 17/100 [23:05<2:08:10, 92.65s/it]Best trial: 8. Best value: 0.150057:  17%|█▋        | 17/100 [23:05<2:08:10, 92.65s/it]Best trial: 8. Best value: 0.150057:  18%|█▊        | 18/100 [23:05<2:21:52, 103.81s/it]                                                                                        Best trial: 8. Best value: 0.150057:  18%|█▊        | 18/100 [23:15<2:21:52, 103.81s/it]Best trial: 8. Best value: 0.150057:  18%|█▊        | 18/100 [23:15<2:21:52, 103.81s/it]Best trial: 8. Best value: 0.150057:  19%|█▉        | 19/100 [23:15<1:42:18, 75.78s/it]                                                                                        Best trial: 8. Best value: 0.150057:  19%|█▉        | 19/100 [23:36<1:42:18, 75.78s/it]Best trial: 8. Best value: 0.150057:  19%|█▉        | 19/100 [23:36<1:42:18, 75.78s/it]Best trial: 8. Best value: 0.150057:  20%|██        | 20/100 [23:36<1:19:06, 59.33s/it]                                                                                       Best trial: 8. Best value: 0.150057:  20%|██        | 20/100 [24:39<1:19:06, 59.33s/it]Best trial: 8. Best value: 0.150057:  20%|██        | 20/100 [24:39<1:19:06, 59.33s/it]Best trial: 8. Best value: 0.150057:  21%|██        | 21/100 [24:39<1:19:38, 60.49s/it]                                                                                       Best trial: 8. Best value: 0.150057:  21%|██        | 21/100 [26:22<1:19:38, 60.49s/it]Best trial: 8. Best value: 0.150057:  21%|██        | 21/100 [26:22<1:19:38, 60.49s/it]Best trial: 8. Best value: 0.150057:  22%|██▏       | 22/100 [26:22<1:34:59, 73.07s/it]                                                                                       Best trial: 8. Best value: 0.150057:  22%|██▏       | 22/100 [27:45<1:34:59, 73.07s/it]Best trial: 8. Best value: 0.150057:  22%|██▏       | 22/100 [27:45<1:34:59, 73.07s/it]Best trial: 8. Best value: 0.150057:  23%|██▎       | 23/100 [27:45<1:37:33, 76.02s/it]                                                                                       Best trial: 8. Best value: 0.150057:  23%|██▎       | 23/100 [29:28<1:37:33, 76.02s/it]Best trial: 8. Best value: 0.150057:  23%|██▎       | 23/100 [29:28<1:37:33, 76.02s/it]Best trial: 8. Best value: 0.150057:  24%|██▍       | 24/100 [29:28<1:46:45, 84.29s/it]                                                                                       Best trial: 8. Best value: 0.150057:  24%|██▍       | 24/100 [32:04<1:46:45, 84.29s/it]Best trial: 24. Best value: 0.149441:  24%|██▍       | 24/100 [32:04<1:46:45, 84.29s/it]Best trial: 24. Best value: 0.149441:  25%|██▌       | 25/100 [32:04<2:12:13, 105.78s/it]                                                                                         Best trial: 24. Best value: 0.149441:  25%|██▌       | 25/100 [33:52<2:12:13, 105.78s/it]Best trial: 24. Best value: 0.149441:  25%|██▌       | 25/100 [33:52<2:12:13, 105.78s/it]Best trial: 24. Best value: 0.149441:  26%|██▌       | 26/100 [33:52<2:11:05, 106.30s/it]                                                                                         Best trial: 24. Best value: 0.149441:  26%|██▌       | 26/100 [35:36<2:11:05, 106.30s/it]Best trial: 24. Best value: 0.149441:  26%|██▌       | 26/100 [35:36<2:11:05, 106.30s/it]Best trial: 24. Best value: 0.149441:  27%|██▋       | 27/100 [35:36<2:08:32, 105.65s/it]                                                                                         Best trial: 24. Best value: 0.149441:  27%|██▋       | 27/100 [36:42<2:08:32, 105.65s/it]Best trial: 24. Best value: 0.149441:  27%|██▋       | 27/100 [36:42<2:08:32, 105.65s/it]Best trial: 24. Best value: 0.149441:  28%|██▊       | 28/100 [36:42<1:52:34, 93.81s/it]                                                                                         Best trial: 24. Best value: 0.149441:  28%|██▊       | 28/100 [38:41<1:52:34, 93.81s/it]Best trial: 24. Best value: 0.149441:  28%|██▊       | 28/100 [38:41<1:52:34, 93.81s/it]Best trial: 24. Best value: 0.149441:  29%|██▉       | 29/100 [38:41<1:59:54, 101.33s/it]                                                                                         Best trial: 24. Best value: 0.149441:  29%|██▉       | 29/100 [40:23<1:59:54, 101.33s/it]Best trial: 24. Best value: 0.149441:  29%|██▉       | 29/100 [40:23<1:59:54, 101.33s/it]Best trial: 24. Best value: 0.149441:  30%|███       | 30/100 [40:23<1:58:22, 101.46s/it]                                                                                         Best trial: 24. Best value: 0.149441:  30%|███       | 30/100 [41:53<1:58:22, 101.46s/it]Best trial: 24. Best value: 0.149441:  30%|███       | 30/100 [41:53<1:58:22, 101.46s/it]Best trial: 24. Best value: 0.149441:  31%|███       | 31/100 [41:53<1:52:43, 98.02s/it]                                                                                         Best trial: 24. Best value: 0.149441:  31%|███       | 31/100 [42:59<1:52:43, 98.02s/it]Best trial: 31. Best value: 0.14836:  31%|███       | 31/100 [42:59<1:52:43, 98.02s/it] Best trial: 31. Best value: 0.14836:  32%|███▏      | 32/100 [42:59<1:40:13, 88.44s/it]                                                                                       Best trial: 31. Best value: 0.14836:  32%|███▏      | 32/100 [45:06<1:40:13, 88.44s/it]Best trial: 31. Best value: 0.14836:  32%|███▏      | 32/100 [45:06<1:40:13, 88.44s/it]Best trial: 31. Best value: 0.14836:  33%|███▎      | 33/100 [45:06<1:51:37, 99.97s/it]                                                                                       Best trial: 31. Best value: 0.14836:  33%|███▎      | 33/100 [46:53<1:51:37, 99.97s/it]Best trial: 31. Best value: 0.14836:  33%|███▎      | 33/100 [46:53<1:51:37, 99.97s/it]Best trial: 31. Best value: 0.14836:  34%|███▍      | 34/100 [46:53<1:52:32, 102.30s/it]                                                                                        Best trial: 31. Best value: 0.14836:  34%|███▍      | 34/100 [47:04<1:52:32, 102.30s/it]Best trial: 31. Best value: 0.14836:  34%|███▍      | 34/100 [47:04<1:52:32, 102.30s/it]Best trial: 31. Best value: 0.14836:  35%|███▌      | 35/100 [47:04<1:20:52, 74.65s/it]                                                                                        Best trial: 31. Best value: 0.14836:  35%|███▌      | 35/100 [47:34<1:20:52, 74.65s/it]Best trial: 31. Best value: 0.14836:  35%|███▌      | 35/100 [47:34<1:20:52, 74.65s/it]Best trial: 31. Best value: 0.14836:  36%|███▌      | 36/100 [47:34<1:05:27, 61.37s/it]                                                                                       Best trial: 31. Best value: 0.14836:  36%|███▌      | 36/100 [47:50<1:05:27, 61.37s/it]Best trial: 31. Best value: 0.14836:  36%|███▌      | 36/100 [47:50<1:05:27, 61.37s/it]Best trial: 31. Best value: 0.14836:  37%|███▋      | 37/100 [47:50<50:10, 47.79s/it]                                                                                       Best trial: 31. Best value: 0.14836:  37%|███▋      | 37/100 [48:08<50:10, 47.79s/it]Best trial: 31. Best value: 0.14836:  37%|███▋      | 37/100 [48:08<50:10, 47.79s/it]Best trial: 31. Best value: 0.14836:  38%|███▊      | 38/100 [48:08<40:07, 38.83s/it]                                                                                     Best trial: 31. Best value: 0.14836:  38%|███▊      | 38/100 [48:37<40:07, 38.83s/it]Best trial: 31. Best value: 0.14836:  38%|███▊      | 38/100 [48:37<40:07, 38.83s/it]Best trial: 31. Best value: 0.14836:  39%|███▉      | 39/100 [48:37<36:36, 36.00s/it]                                                                                     Best trial: 31. Best value: 0.14836:  39%|███▉      | 39/100 [48:57<36:36, 36.00s/it]Best trial: 31. Best value: 0.14836:  39%|███▉      | 39/100 [48:57<36:36, 36.00s/it]Best trial: 31. Best value: 0.14836:  40%|████      | 40/100 [48:57<31:01, 31.03s/it]                                                                                     Best trial: 31. Best value: 0.14836:  40%|████      | 40/100 [49:05<31:01, 31.03s/it]Best trial: 31. Best value: 0.14836:  40%|████      | 40/100 [49:05<31:01, 31.03s/it]Best trial: 31. Best value: 0.14836:  41%|████      | 41/100 [49:05<23:43, 24.13s/it]                                                                                     Best trial: 31. Best value: 0.14836:  41%|████      | 41/100 [50:09<23:43, 24.13s/it]Best trial: 31. Best value: 0.14836:  41%|████      | 41/100 [50:09<23:43, 24.13s/it]Best trial: 31. Best value: 0.14836:  42%|████▏     | 42/100 [50:09<34:51, 36.06s/it]                                                                                     Best trial: 31. Best value: 0.14836:  42%|████▏     | 42/100 [51:27<34:51, 36.06s/it]Best trial: 31. Best value: 0.14836:  42%|████▏     | 42/100 [51:27<34:51, 36.06s/it]Best trial: 31. Best value: 0.14836:  43%|████▎     | 43/100 [51:27<46:19, 48.75s/it]                                                                                     Best trial: 31. Best value: 0.14836:  43%|████▎     | 43/100 [52:36<46:19, 48.75s/it]Best trial: 31. Best value: 0.14836:  43%|████▎     | 43/100 [52:36<46:19, 48.75s/it]Best trial: 31. Best value: 0.14836:  44%|████▍     | 44/100 [52:36<51:12, 54.86s/it]                                                                                     Best trial: 31. Best value: 0.14836:  44%|████▍     | 44/100 [52:52<51:12, 54.86s/it]Best trial: 31. Best value: 0.14836:  44%|████▍     | 44/100 [52:52<51:12, 54.86s/it]Best trial: 31. Best value: 0.14836:  45%|████▌     | 45/100 [52:52<39:26, 43.03s/it]                                                                                     Best trial: 31. Best value: 0.14836:  45%|████▌     | 45/100 [54:20<39:26, 43.03s/it]Best trial: 31. Best value: 0.14836:  45%|████▌     | 45/100 [54:20<39:26, 43.03s/it]Best trial: 31. Best value: 0.14836:  46%|████▌     | 46/100 [54:20<50:53, 56.55s/it]                                                                                     Best trial: 31. Best value: 0.14836:  46%|████▌     | 46/100 [55:46<50:53, 56.55s/it]Best trial: 31. Best value: 0.14836:  46%|████▌     | 46/100 [55:46<50:53, 56.55s/it]Best trial: 31. Best value: 0.14836:  47%|████▋     | 47/100 [55:46<57:48, 65.44s/it]                                                                                     Best trial: 31. Best value: 0.14836:  47%|████▋     | 47/100 [56:00<57:48, 65.44s/it]Best trial: 31. Best value: 0.14836:  47%|████▋     | 47/100 [56:00<57:48, 65.44s/it]Best trial: 31. Best value: 0.14836:  48%|████▊     | 48/100 [56:00<43:17, 49.96s/it]                                                                                     Best trial: 31. Best value: 0.14836:  48%|████▊     | 48/100 [56:25<43:17, 49.96s/it]Best trial: 31. Best value: 0.14836:  48%|████▊     | 48/100 [56:25<43:17, 49.96s/it]Best trial: 31. Best value: 0.14836:  49%|████▉     | 49/100 [56:25<36:08, 42.53s/it]                                                                                     Best trial: 31. Best value: 0.14836:  49%|████▉     | 49/100 [58:22<36:08, 42.53s/it]Best trial: 31. Best value: 0.14836:  49%|████▉     | 49/100 [58:22<36:08, 42.53s/it]Best trial: 31. Best value: 0.14836:  50%|█████     | 50/100 [58:22<54:01, 64.82s/it]                                                                                     Best trial: 31. Best value: 0.14836:  50%|█████     | 50/100 [59:04<54:01, 64.82s/it]Best trial: 31. Best value: 0.14836:  50%|█████     | 50/100 [59:04<54:01, 64.82s/it]Best trial: 31. Best value: 0.14836:  51%|█████     | 51/100 [59:04<47:24, 58.06s/it]                                                                                     Best trial: 31. Best value: 0.14836:  51%|█████     | 51/100 [1:01:04<47:24, 58.06s/it]Best trial: 31. Best value: 0.14836:  51%|█████     | 51/100 [1:01:04<47:24, 58.06s/it]Best trial: 31. Best value: 0.14836:  52%|█████▏    | 52/100 [1:01:04<1:01:20, 76.68s/it]                                                                                         Best trial: 31. Best value: 0.14836:  52%|█████▏    | 52/100 [1:02:57<1:01:20, 76.68s/it]Best trial: 31. Best value: 0.14836:  52%|█████▏    | 52/100 [1:02:57<1:01:20, 76.68s/it]Best trial: 31. Best value: 0.14836:  53%|█████▎    | 53/100 [1:02:57<1:08:35, 87.56s/it]                                                                                         Best trial: 31. Best value: 0.14836:  53%|█████▎    | 53/100 [1:04:22<1:08:35, 87.56s/it]Best trial: 31. Best value: 0.14836:  53%|█████▎    | 53/100 [1:04:22<1:08:35, 87.56s/it]Best trial: 31. Best value: 0.14836:  54%|█████▍    | 54/100 [1:04:22<1:06:36, 86.88s/it]                                                                                         Best trial: 31. Best value: 0.14836:  54%|█████▍    | 54/100 [1:06:28<1:06:36, 86.88s/it]Best trial: 31. Best value: 0.14836:  54%|█████▍    | 54/100 [1:06:28<1:06:36, 86.88s/it]Best trial: 31. Best value: 0.14836:  55%|█████▌    | 55/100 [1:06:28<1:13:54, 98.55s/it]                                                                                         Best trial: 31. Best value: 0.14836:  55%|█████▌    | 55/100 [1:06:39<1:13:54, 98.55s/it]Best trial: 31. Best value: 0.14836:  55%|█████▌    | 55/100 [1:06:39<1:13:54, 98.55s/it]Best trial: 31. Best value: 0.14836:  56%|█████▌    | 56/100 [1:06:39<52:55, 72.18s/it]                                                                                         Best trial: 31. Best value: 0.14836:  56%|█████▌    | 56/100 [1:08:36<52:55, 72.18s/it]Best trial: 31. Best value: 0.14836:  56%|█████▌    | 56/100 [1:08:36<52:55, 72.18s/it]Best trial: 31. Best value: 0.14836:  57%|█████▋    | 57/100 [1:08:36<1:01:29, 85.81s/it]                                                                                         Best trial: 31. Best value: 0.14836: 