[I 2026-04-27 18:05:45,355] Trial 85 finished with value: 0.08973480440017437 and parameters: {'learning_rate': 0.0032647187590238947, 'batch_size': 4, 'num_epochs': 21, 'weight_decay': 0.003792427297686048, 'layers_PRS': 4, 'layers_SCZ15': 1, 'layers_ADHD9': 6, 'layers_ASD9': 3, 'layers_ACE15': 2, 'layers_ACE18': 5, 'layers_SUD18': 6, 'layers_SES': 5, 'layers_SEX': 1, 'dropout': 0.24932229625998797, 'se_reduction': 5, 'hidden_dim_min': 7, 'base_loss': 'huber', 'huber_delta': 0.10930828230686965, 'focal_gamma': 0.8302812286762504, 'n_bins': 10, 'scheduler_patience': 3, 'scheduler_factor': 0.6640398513164892, 'early_stopping_patience': 5}. Best is trial 66 with value: 0.08778944019020135.
Train: 2407 rows (1613 IDs),Test: 598 rows (404 IDs) 

n_features_x : 6, n_features_per_modality: [16, 23, 19, 17, 7, 4, 4, 4, 1, 4]

--- ImbalancedRegressionLoss initialized ---
  Bins: 20, Focal gamma: 0.9910574752541808, Base loss: huber
  Bin [0.00, 0.05): count=  650, weight=0.004
  Bin [0.05, 0.10): count=  360, weight=0.007
  Bin [0.10, 0.15): count=  360, weight=0.007
  Bin [0.15, 0.20): count=  506, weight=0.005
  Bin [0.20, 0.25): count=  237, weight=0.011
  Bin [0.25, 0.30): count=  149, weight=0.017
  Bin [0.30, 0.35): count=   91, weight=0.028
  Bin [0.35, 0.40): count=   20, weight=0.125
  Bin [0.40, 0.45): count=   13, weight=0.187
  Bin [0.45, 0.50): count=   10, weight=0.238
  Bin [0.50, 0.55): count=    6, weight=0.374
  Bin [0.55, 0.60): count=    3, weight=0.655
  Bin [0.60, 0.65): count=    1, weight=1.310
  Bin [0.65, 0.70): count=    1, weight=1.310
  Bin [0.70, 0.75): count=    0, weight=2.620
  Bin [0.75, 0.80): count=    0, weight=2.620
  Bin [0.80, 0.85): count=    0, weight=2.620
  Bin [0.85, 0.90): count=    0, weight=2.620
  Bin [0.90, 0.95): count=    0, weight=2.620
  Bin [0.95, 1.00): count=    0, weight=2.620
-------------------------------------------

  Pred range: [0.0579, 0.3782], std: 0.0538
  RMSE : 0.0976, R2: 0.0585, MAE: 0.0795, Spearman rho: 0.4277, Spearman p: 5.3804e-28, Pearson r: 0.4350, Pearson p: 5.3042e-29
  Pred range: [0.0603, 0.4014], std: 0.0578
  RMSE : 0.0979, R2: 0.0523, MAE: 0.0798, Spearman rho: 0.4406, Spearman p: 8.5756e-30, Pearson r: 0.4505, Pearson p: 3.1331e-31
  Pred range: [0.0579, 0.3688], std: 0.0519
  RMSE : 0.0912, R2: 0.1787, MAE: 0.0735, Spearman rho: 0.4516, Spearman p: 2.1803e-31, Pearson r: 0.4650, Pearson p: 2.0552e-33
  Pred range: [0.0469, 0.3936], std: 0.0549
  RMSE : 0.0909, R2: 0.1830, MAE: 0.0728, Spearman rho: 0.4448, Spearman p: 2.1474e-30, Pearson r: 0.4576, Pearson p: 2.7869e-32
  Pred range: [0.0581, 0.4023], std: 0.0516
  RMSE : 0.0929, R2: 0.1474, MAE: 0.0752, Spearman rho: 0.4408, Spearman p: 8.0140e-30, Pearson r: 0.4509, Pearson p: 2.8081e-31
  Pred range: [0.0834, 0.4389], std: 0.0590
  RMSE : 0.1054, R2: -0.0984, MAE: 0.0869, Spearman rho: 0.4556, Spearman p: 5.4739e-32, Pearson r: 0.4660, Pearson p: 1.4475e-33
  Pred range: [0.0383, 0.3527], std: 0.0547
  RMSE : 0.0889, R2: 0.2188, MAE: 0.0704, Spearman rho: 0.4646, Spearman p: 2.3393e-33, Pearson r: 0.4744, Pearson p: 6.9371e-35
  Pred range: [0.0466, 0.3721], std: 0.0568
  RMSE : 0.0903, R2: 0.1942, MAE: 0.0719, Spearman rho: 0.4679, Spearman p: 7.3745e-34, Pearson r: 0.4794, Pearson p: 1.0848e-35
  Pred range: [0.0703, 0.3965], std: 0.0554
  RMSE : 0.0971, R2: 0.0683, MAE: 0.0791, Spearman rho: 0.4555, Spearman p: 5.7582e-32, Pearson r: 0.4671, Pearson p: 9.6086e-34
  Pred range: [0.0451, 0.3658], std: 0.0564
  RMSE : 0.0897, R2: 0.2041, MAE: 0.0718, Spearman rho: 0.4719, Spearman p: 1.7049e-34, Pearson r: 0.4835, Pearson p: 2.3546e-36
  Pred range: [0.0480, 0.3902], std: 0.0542
  RMSE : 0.0896, R2: 0.2061, MAE: 0.0715, Spearman rho: 0.4773, Spearman p: 2.3372e-35, Pearson r: 0.4805, Pearson p: 7.1681e-36
  Pred range: [0.0474, 0.3994], std: 0.0536
  RMSE : 0.0915, R2: 0.1728, MAE: 0.0736, Spearman rho: 0.4733, Spearman p: 1.0379e-34, Pearson r: 0.4793, Pearson p: 1.1446e-35
[I 2026-04-27 18:07:32,894] Trial 86 finished with value: 0.08891038054573752 and parameters: {'learning_rate': 0.0007861553486526875, 'batch_size': 4, 'num_epochs': 22, 'weight_decay': 0.002436888294563312, 'layers_PRS': 5, 'layers_SCZ15': 1, 'layers_ADHD9': 3, 'layers_ASD9': 2, 'layers_ACE15': 3, 'layers_ACE18': 3, 'layers_SUD18': 6, 'layers_SES': 6, 'layers_SEX': 2, 'dropout': 0.23351838936539493, 'se_reduction': 6, 'hidden_dim_min': 7, 'base_loss': 'huber', 'huber_delta': 0.14084680118722445, 'focal_gamma': 0.9910574752541808, 'n_bins': 20, 'scheduler_patience': 4, 'scheduler_factor': 0.6743548827346642, 'early_stopping_patience': 5}. Best is trial 66 with value: 0.08778944019020135.
Train: 2407 rows (1613 IDs),Test: 598 rows (404 IDs) 

n_features_x : 6, n_features_per_modality: [16, 23, 19, 17, 7, 4, 4, 4, 1, 4]

--- ImbalancedRegressionLoss initialized ---
  Bins: 13, Focal gamma: 0.7440058436605134, Base loss: mse
  Bin [0.00, 0.08): count=  828, weight=0.003
  Bin [0.08, 0.15): count=  710, weight=0.004
  Bin [0.15, 0.23): count=  477, weight=0.006
  Bin [0.23, 0.31): count=  288, weight=0.009
  Bin [0.31, 0.38): count=   63, weight=0.042
  Bin [0.38, 0.46): count=   23, weight=0.113
  Bin [0.46, 0.54): count=   10, weight=0.247
  Bin [0.54, 0.62): count=    7, weight=0.340
  Bin [0.62, 0.69): count=    0, weight=2.719
  Bin [0.69, 0.77): count=    1, weight=1.359
  Bin [0.77, 0.85): count=    0, weight=2.719
  Bin [0.85, 0.92): count=    0, weight=2.719
  Bin [0.92, 1.00): count=    0, weight=2.719
-------------------------------------------

  Pred range: [0.1002, 0.4462], std: 0.0511
  RMSE : 0.1253, R2: -0.5512, MAE: 0.1045, Spearman rho: 0.3262, Spearman p: 2.7142e-16, Pearson r: 0.3294, Pearson p: 1.3274e-16
  Pred range: [0.0882, 0.4267], std: 0.0545
  RMSE : 0.1143, R2: -0.2920, MAE: 0.0946, Spearman rho: 0.3833, Spearman p: 2.2874e-22, Pearson r: 0.3850, Pearson p: 1.4308e-22
  Pred range: [0.0913, 0.4434], std: 0.0595
  RMSE : 0.1219, R2: -0.4689, MAE: 0.1017, Spearman rho: 0.4042, Spearman p: 6.6263e-25, Pearson r: 0.4058, Pearson p: 4.1611e-25
  Pred range: [0.0881, 0.4618], std: 0.0621
  RMSE : 0.1281, R2: -0.6221, MAE: 0.1077, Spearman rho: 0.4091, Spearman p: 1.5700e-25, Pearson r: 0.4139, Pearson p: 3.7739e-26
  Pred range: [0.0667, 0.4385], std: 0.0595
  RMSE : 0.1162, R2: -0.3345, MAE: 0.0965, Spearman rho: 0.4109, Spearman p: 9.1883e-26, Pearson r: 0.4169, Pearson p: 1.5208e-26
  Pred range: [0.0809, 0.4621], std: 0.0622
  RMSE : 0.1247, R2: -0.5374, MAE: 0.1044, Spearman rho: 0.4138, Spearman p: 3.8238e-26, Pearson r: 0.4198, Pearson p: 6.3489e-27
[I 2026-04-27 18:07:43,351] Trial 87 pruned. 
Train: 2407 rows (1613 IDs),Test: 598 rows (404 IDs) 

n_features_x : 6, n_features_per_modality: [16, 23, 19, 17, 7, 4, 4, 4, 1, 4]

--- ImbalancedRegressionLoss initialized ---
  Bins: 10, Focal gamma: 1.0834779075654912, Base loss: huber
  Bin [0.00, 0.10): count= 1010, weight=0.003
  Bin [0.10, 0.20): count=  866, weight=0.003
  Bin [0.20, 0.30): count=  386, weight=0.007
  Bin [0.30, 0.40): count=  111, weight=0.026
  Bin [0.40, 0.50): count=   23, weight=0.119
  Bin [0.50, 0.60): count=    9, weight=0.287
  Bin [0.60, 0.70): count=    2, weight=0.955
  Bin [0.70, 0.80): count=    0, weight=2.866
  Bin [0.80, 0.90): count=    0, weight=2.866
  Bin [0.90, 1.00): count=    0, weight=2.866
-------------------------------------------

  Pred range: [0.0472, 0.4760], std: 0.0701
  RMSE : 0.1149, R2: -0.3037, MAE: 0.0948, Spearman rho: 0.3788, Spearman p: 7.6476e-22, Pearson r: 0.3977, Pearson p: 4.2227e-24
  Pred range: [0.0587, 0.4232], std: 0.0624
  RMSE : 0.1033, R2: -0.0535, MAE: 0.0844, Spearman rho: 0.4075, Spearman p: 2.4748e-25, Pearson r: 0.4193, Pearson p: 7.2893e-27
  Pred range: [0.0573, 0.4253], std: 0.0636
  RMSE : 0.1020, R2: -0.0289, MAE: 0.0832, Spearman rho: 0.4293, Spearman p: 3.2565e-28, Pearson r: 0.4398, Pearson p: 1.1317e-29
  Pred range: [0.0470, 0.4210], std: 0.0638
  RMSE : 0.0973, R2: 0.0650, MAE: 0.0784, Spearman rho: 0.4389, Spearman p: 1.5100e-29, Pearson r: 0.4489, Pearson p: 5.4757e-31
  Pred range: [0.0846, 0.5099], std: 0.0708
  RMSE : 0.1225, R2: -0.4818, MAE: 0.1012, Spearman rho: 0.4388, Spearman p: 1.5689e-29, Pearson r: 0.4475, Pearson p: 8.6766e-31
  Pred range: [0.0496, 0.4247], std: 0.0623
  RMSE : 0.0989, R2: 0.0330, MAE: 0.0800, Spearman rho: 0.4503, Spearman p: 3.4396e-31, Pearson r: 0.4581, Pearson p: 2.3267e-32
[I 2026-04-27 18:07:55,761] Trial 88 pruned. 
Train: 2407 rows (1613 IDs),Test: 598 rows (404 IDs) 

n_features_x : 6, n_features_per_modality: [16, 23, 19, 17, 7, 4, 4, 4, 1, 4]

--- ImbalancedRegressionLoss initialized ---
  Bins: 14, Focal gamma: 0.9087560733634016, Base loss: huber
  Bin [0.00, 0.07): count=  828, weight=0.003
  Bin [0.07, 0.14): count=  542, weight=0.005
  Bin [0.14, 0.21): count=  506, weight=0.005
  Bin [0.21, 0.29): count=  386, weight=0.007
  Bin [0.29, 0.36): count=   91, weight=0.029
  Bin [0.36, 0.43): count=   29, weight=0.090
  Bin [0.43, 0.50): count=   12, weight=0.207
  Bin [0.50, 0.57): count=   11, weight=0.224
  Bin [0.57, 0.64): count=    1, weight=1.343
  Bin [0.64, 0.71): count=    1, weight=1.343
  Bin [0.71, 0.79): count=    0, weight=2.686
  Bin [0.79, 0.86): count=    0, weight=2.686
  Bin [0.86, 0.93): count=    0, weight=2.686
  Bin [0.93, 1.00): count=    0, weight=2.686
-------------------------------------------

  Pred range: [-0.0237, 0.2914], std: 0.0384
  RMSE : 0.1025, R2: -0.0381, MAE: 0.0813, Spearman rho: 0.1458, Spearman p: 3.4816e-04, Pearson r: 0.1432, Pearson p: 4.4514e-04
  Pred range: [-0.0001, 0.3146], std: 0.0403
  RMSE : 0.1024, R2: -0.0368, MAE: 0.0825, Spearman rho: 0.1909, Spearman p: 2.5633e-06, Pearson r: 0.1871, Pearson p: 4.0880e-06
  Pred range: [0.0063, 0.3209], std: 0.0415
  RMSE : 0.1024, R2: -0.0369, MAE: 0.0827, Spearman rho: 0.2196, Spearman p: 5.7685e-08, Pearson r: 0.2160, Pearson p: 9.6281e-08
  Pred range: [0.0080, 0.3214], std: 0.0424
  RMSE : 0.1018, R2: -0.0246, MAE: 0.0821, Spearman rho: 0.2411, Spearman p: 2.3531e-09, Pearson r: 0.2380, Pearson p: 3.8255e-09
  Pred range: [0.0088, 0.3217], std: 0.0433
  RMSE : 0.1012, R2: -0.0119, MAE: 0.0816, Spearman rho: 0.2587, Spearman p: 1.3440e-10, Pearson r: 0.2561, Pearson p: 2.0742e-10
  Pred range: [0.0076, 0.3182], std: 0.0438
  RMSE : 0.1002, R2: 0.0087, MAE: 0.0806, Spearman rho: 0.2712, Spearman p: 1.5339e-11, Pearson r: 0.2707, Pearson p: 1.6730e-11
[I 2026-04-27 18:08:58,935] Trial 89 pruned. 
Train: 2407 rows (1613 IDs),Test: 598 rows (404 IDs) 

n_features_x : 6, n_features_per_modality: [16, 23, 19, 17, 7, 4, 4, 4, 1, 4]

--- ImbalancedRegressionLoss initialized ---
  Bins: 5, Focal gamma: 0.818197873951516, Base loss: huber
  Bin [0.00, 0.20): count= 1876, weight=0.002
  Bin [0.20, 0.40): count=  497, weight=0.007
  Bin [0.40, 0.60): count=   32, weight=0.111
  Bin [0.60, 0.80): count=    2, weight=1.220
  Bin [0.80, 1.00): count=    0, weight=3.660
-------------------------------------------

  Pred range: [0.0452, 0.4781], std: 0.0524
  RMSE : 0.1008, R2: -0.0037, MAE: 0.0803, Spearman rho: 0.3774, Spearman p: 1.1282e-21, Pearson r: 0.3549, Pearson p: 3.4551e-19
  Pred range: [0.0438, 0.4739], std: 0.0569
  RMSE : 0.0973, R2: 0.0642, MAE: 0.0770, Spearman rho: 0.4132, Spearman p: 4.6182e-26, Pearson r: 0.3979, Pearson p: 4.0172e-24
  Pred range: [0.0447, 0.4624], std: 0.0583
  RMSE : 0.0956, R2: 0.0970, MAE: 0.0755, Spearman rho: 0.4303, Spearman p: 2.3931e-28, Pearson r: 0.4180, Pearson p: 1.0737e-26
  Pred range: [0.0550, 0.4946], std: 0.0630
  RMSE : 0.1000, R2: 0.0117, MAE: 0.0795, Spearman rho: 0.4404, Spearman p: 9.1082e-30, Pearson r: 0.4291, Pearson p: 3.4362e-28
  Pred range: [0.0498, 0.4558], std: 0.0617
  RMSE : 0.0953, R2: 0.1020, MAE: 0.0754, Spearman rho: 0.4502, Spearman p: 3.5473e-31, Pearson r: 0.4415, Pearson p: 6.3275e-30
  Pred range: [0.0423, 0.4209], std: 0.0587
  RMSE : 0.0915, R2: 0.1720, MAE: 0.0720, Spearman rho: 0.4581, Spearman p: 2.3522e-32, Pearson r: 0.4495, Pearson p: 4.4420e-31
[I 2026-04-27 18:10:06,484] Trial 90 pruned. 
Train: 2407 rows (1613 IDs),Test: 598 rows (404 IDs) 

n_features_x : 6, n_features_per_modality: [16, 23, 19, 17, 7, 4, 4, 4, 1, 4]

--- ImbalancedRegressionLoss initialized ---
  Bins: 6, Focal gamma: 0.5014264434273628, Base loss: huber
  Bin [0.00, 0.17): count= 1538, weight=0.002
  Bin [0.17, 0.33): count=  789, weight=0.005
  Bin [0.33, 0.50): count=   69, weight=0.053
  Bin [0.50, 0.67): count=   10, weight=0.339
  Bin [0.67, 0.83): count=    1, weight=1.867
  Bin [0.83, 1.00): count=    0, weight=3.733
-------------------------------------------

  Pred range: [0.0541, 0.4091], std: 0.0605
  RMSE : 0.0973, R2: 0.0637, MAE: 0.0792, Spearman rho: 0.4513, Spearman p: 2.4117e-31, Pearson r: 0.4649, Pearson p: 2.1282e-33
  Pred range: [0.0765, 0.4549], std: 0.0656
  RMSE : 0.1112, R2: -0.2215, MAE: 0.0918, Spearman rho: 0.4635, Spearman p: 3.4589e-33, Pearson r: 0.4709, Pearson p: 2.4310e-34
  Pred range: [0.0478, 0.4521], std: 0.0658
  RMSE : 0.0955, R2: 0.0986, MAE: 0.0755, Spearman rho: 0.4391, Spearman p: 1.4070e-29, Pearson r: 0.4413, Pearson p: 6.8354e-30
  Pred range: [0.0534, 0.3850], std: 0.0597
  RMSE : 0.0944, R2: 0.1188, MAE: 0.0763, Spearman rho: 0.4518, Spearman p: 2.0175e-31, Pearson r: 0.4631, Pearson p: 4.0929e-33
  Pred range: [-0.0012, 0.3806], std: 0.0649
  RMSE : 0.0962, R2: 0.0847, MAE: 0.0738, Spearman rho: 0.4321, Spearman p: 1.3495e-28, Pearson r: 0.4332, Pearson p: 9.6110e-29
  Pred range: [0.0698, 0.4751], std: 0.0632
  RMSE : 0.1047, R2: -0.0840, MAE: 0.0857, Spearman rho: 0.4551, Spearman p: 6.6828e-32, Pearson r: 0.4534, Pearson p: 1.1765e-31
[I 2026-04-27 18:11:08,702] Trial 91 pruned. 
Train: 2407 rows (1613 IDs),Test: 598 rows (404 IDs) 

n_features_x : 6, n_features_per_modality: [16, 23, 19, 17, 7, 4, 4, 4, 1, 4]

--- ImbalancedRegressionLoss initialized ---
  Bins: 11, Focal gamma: 0.7065538826242929, Base loss: huber
  Bin [0.00, 0.09): count= 1010, weight=0.003
  Bin [0.09, 0.18): count=  706, weight=0.004
  Bin [0.18, 0.27): count=  478, weight=0.006
  Bin [0.27, 0.36): count=  159, weight=0.018
  Bin [0.36, 0.45): count=   33, weight=0.085
  Bin [0.45, 0.55): count=   16, weight=0.170
  Bin [0.55, 0.64): count=    4, weight=0.579
  Bin [0.64, 0.73): count=    1, weight=1.448
  Bin [0.73, 0.82): count=    0, weight=2.896
  Bin [0.82, 0.91): count=    0, weight=2.896
  Bin [0.91, 1.00): count=    0, weight=2.896
-------------------------------------------

  Pred range: [0.0741, 0.4010], std: 0.0523
  RMSE : 0.0964, R2: 0.0814, MAE: 0.0777, Spearman rho: 0.4234, Spearman p: 2.0955e-27, Pearson r: 0.4350, Pearson p: 5.3213e-29
  Pred range: [0.0614, 0.3783], std: 0.0538
  RMSE : 0.0916, R2: 0.1717, MAE: 0.0734, Spearman rho: 0.4408, Spearman p: 8.1278e-30, Pearson r: 0.4553, Pearson p: 6.1188e-32
  Pred range: [0.0279, 0.3226], std: 0.0455
  RMSE : 0.0906, R2: 0.1885, MAE: 0.0711, Spearman rho: 0.4670, Spearman p: 1.0094e-33, Pearson r: 0.4694, Pearson p: 4.1884e-34
  Pred range: [0.0446, 0.2851], std: 0.0398
  RMSE : 0.0909, R2: 0.1840, MAE: 0.0719, Spearman rho: 0.4465, Spearman p: 1.2008e-30, Pearson r: 0.4551, Pearson p: 6.4829e-32
  Pred range: [0.0620, 0.4162], std: 0.0573
  RMSE : 0.0952, R2: 0.1038, MAE: 0.0772, Spearman rho: 0.4601, Spearman p: 1.1716e-32, Pearson r: 0.4707, Pearson p: 2.6738e-34
  Pred range: [0.0678, 0.3924], std: 0.0557
  RMSE : 0.0958, R2: 0.0927, MAE: 0.0780, Spearman rho: 0.4602, Spearman p: 1.1378e-32, Pearson r: 0.4719, Pearson p: 1.7274e-34
[I 2026-04-27 18:12:12,236] Trial 92 finished with value: 0.09062213194353658 and parameters: {'learning_rate': 0.0017854823483953164, 'batch_size': 4, 'num_epochs': 22, 'weight_decay': 0.00988993331367685, 'layers_PRS': 6, 'layers_SCZ15': 3, 'layers_ADHD9': 5, 'layers_ASD9': 1, 'layers_ACE15': 4, 'layers_ACE18': 4, 'layers_SUD18': 4, 'layers_SES': 6, 'layers_SEX': 3, 'dropout': 0.1907622152164514, 'se_reduction': 4, 'hidden_dim_min': 5, 'base_loss': 'huber', 'huber_delta': 0.1273647523959265, 'focal_gamma': 0.7065538826242929, 'n_bins': 11, 'scheduler_patience': 4, 'scheduler_factor': 0.5961670236547054, 'early_stopping_patience': 3}. Best is trial 66 with value: 0.08778944019020135.
Train: 2407 rows (1613 IDs),Test: 598 rows (404 IDs) 

n_features_x : 6, n_features_per_modality: [16, 23, 19, 17, 7, 4, 4, 4, 1, 4]

--- ImbalancedRegressionLoss initialized ---
  Bins: 6, Focal gamma: 0.65284526626463, Base loss: huber
  Bin [0.00, 0.17): count= 1538, weight=0.002
  Bin [0.17, 0.33): count=  789, weight=0.005
  Bin [0.33, 0.50): count=   69, weight=0.053
  Bin [0.50, 0.67): count=   10, weight=0.339
  Bin [0.67, 0.83): count=    1, weight=1.867
  Bin [0.83, 1.00): count=    0, weight=3.733
-------------------------------------------

  Pred range: [0.0586, 0.3705], std: 0.0571
  RMSE : 0.0930, R2: 0.1458, MAE: 0.0745, Spearman rho: 0.4571, Spearman p: 3.2415e-32, Pearson r: 0.4592, Pearson p: 1.5766e-32
  Pred range: [0.0531, 0.3322], std: 0.0524
  RMSE : 0.0913, R2: 0.1759, MAE: 0.0730, Spearman rho: 0.4604, Spearman p: 1.0484e-32, Pearson r: 0.4633, Pearson p: 3.7081e-33
  Pred range: [0.0465, 0.3198], std: 0.0486
  RMSE : 0.0886, R2: 0.2238, MAE: 0.0699, Spearman rho: 0.4659, Spearman p: 1.4791e-33, Pearson r: 0.4735, Pearson p: 9.7279e-35
  Pred range: [0.0771, 0.3531], std: 0.0485
  RMSE : 0.0985, R2: 0.0415, MAE: 0.0808, Spearman rho: 0.4495, Spearman p: 4.4104e-31, Pearson r: 0.4568, Pearson p: 3.6508e-32
  Pred range: [0.0464, 0.2654], std: 0.0439
  RMSE : 0.0892, R2: 0.2130, MAE: 0.0704, Spearman rho: 0.4575, Spearman p: 2.8698e-32, Pearson r: 0.4624, Pearson p: 5.1892e-33
  Pred range: [0.0578, 0.3646], std: 0.0532
  RMSE : 0.0924, R2: 0.1557, MAE: 0.0741, Spearman rho: 0.4567, Spearman p: 3.7923e-32, Pearson r: 0.4616, Pearson p: 6.9200e-33
  Pred range: [0.0654, 0.3794], std: 0.0522
  RMSE : 0.0933, R2: 0.1403, MAE: 0.0750, Spearman rho: 0.4584, Spearman p: 2.0901e-32, Pearson r: 0.4624, Pearson p: 5.1644e-33
