[I 2026-04-29 01:12:28,765] Trial 7 finished with value: 0.1564059611631274 and parameters: {'learning_rate': 0.00044476270451787424, 'batch_size': 8, 'num_epochs': 19, 'weight_decay': 2.168768296901957e-05, 'layers_PRS': 4, 'layers_SCZ15': 5, 'layers_ADHD9': 3, 'layers_ASD9': 5, 'layers_ACE15': 1, 'layers_ACE18': 1, 'layers_SUD18': 1, 'layers_SES': 5, 'layers_SEX': 2, 'dropout': 0.2483998335850179, 'se_reduction': 7, 'hidden_dim_min': 2, 'base_loss': 'mse', 'huber_delta': 0.15016857345320744, 'focal_gamma': 2.1978065638739332, 'n_bins': 14, 'scheduler_patience': 4, 'scheduler_factor': 0.39579929019241344, 'early_stopping_patience': 3}. Best is trial 5 with value: 0.152618777391536.
Train: 2407 rows (1613 IDs),Test: 598 rows (404 IDs) 

n_features_x : 6, n_features_per_modality: [16, 23, 19, 17, 7, 4, 4, 4, 1, 4]

--- ImbalancedRegressionLoss initialized ---
  Bins: 17, Focal gamma: 2.1322171153441247, Base loss: mse
  Bin [0.00, 0.06): count=  172, weight=0.058
  Bin [0.06, 0.12): count=  413, weight=0.024
  Bin [0.12, 0.18): count=  376, weight=0.027
  Bin [0.18, 0.24): count=  370, weight=0.027
  Bin [0.24, 0.29): count=  255, weight=0.039
  Bin [0.29, 0.35): count=  223, weight=0.045
  Bin [0.35, 0.41): count=  162, weight=0.061
  Bin [0.41, 0.47): count=  134, weight=0.074
  Bin [0.47, 0.53): count=  108, weight=0.092
  Bin [0.53, 0.59): count=   78, weight=0.127
  Bin [0.59, 0.65): count=   47, weight=0.208
  Bin [0.65, 0.71): count=   27, weight=0.357
  Bin [0.71, 0.76): count=   26, weight=0.370
  Bin [0.76, 0.82): count=    9, weight=0.999
  Bin [0.82, 0.88): count=    4, weight=1.999
  Bin [0.88, 0.94): count=    3, weight=2.499
  Bin [0.94, 1.00): count=    0, weight=9.995
-------------------------------------------

  Pred range: [-0.1239, 0.1765], std: 0.0436
  RMSE : 0.2793, R2: -1.6042, MAE: 0.2238, Spearman rho: 0.1651, Spearman p: 4.9674e-05, Pearson r: 0.1814, Pearson p: 8.0841e-06
  Pred range: [-0.0393, 0.3677], std: 0.0577
  RMSE : 0.1955, R2: -0.2764, MAE: 0.1419, Spearman rho: 0.2546, Spearman p: 2.6396e-10, Pearson r: 0.2707, Pearson p: 1.6702e-11
  Pred range: [0.0246, 0.5412], std: 0.0749
  RMSE : 0.1665, R2: 0.0749, MAE: 0.1297, Spearman rho: 0.2843, Spearman p: 1.4034e-12, Pearson r: 0.3035, Pearson p: 3.2758e-14
  Pred range: [0.0516, 0.6117], std: 0.0821
  RMSE : 0.1729, R2: 0.0024, MAE: 0.1411, Spearman rho: 0.2950, Spearman p: 1.8077e-13, Pearson r: 0.3160, Pearson p: 2.4511e-15
  Pred range: [0.0606, 0.6262], std: 0.0836
  RMSE : 0.1760, R2: -0.0338, MAE: 0.1453, Spearman rho: 0.3049, Spearman p: 2.4849e-14, Pearson r: 0.3258, Pearson p: 2.9977e-16
  Pred range: [0.0665, 0.6355], std: 0.0843
  RMSE : 0.1782, R2: -0.0603, MAE: 0.1482, Spearman rho: 0.3143, Spearman p: 3.5113e-15, Pearson r: 0.3343, Pearson p: 4.4476e-17
  Pred range: [0.0673, 0.6338], std: 0.0840
  RMSE : 0.1777, R2: -0.0541, MAE: 0.1479, Spearman rho: 0.3204, Spearman p: 9.6142e-16, Pearson r: 0.3401, Pearson p: 1.1614e-17
[I 2026-04-29 01:13:06,824] Trial 8 finished with value: 0.16647595928945186 and parameters: {'learning_rate': 1.6014639244688785e-05, 'batch_size': 6, 'num_epochs': 25, 'weight_decay': 5.481544257617842e-05, 'layers_PRS': 2, 'layers_SCZ15': 2, 'layers_ADHD9': 3, 'layers_ASD9': 3, 'layers_ACE15': 1, 'layers_ACE18': 2, 'layers_SUD18': 5, 'layers_SES': 4, 'layers_SEX': 3, 'dropout': 0.1427050270785784, 'se_reduction': 4, 'hidden_dim_min': 11, 'base_loss': 'mse', 'huber_delta': 0.07146480052864926, 'focal_gamma': 2.1322171153441247, 'n_bins': 17, 'scheduler_patience': 2, 'scheduler_factor': 0.6953051166381178, 'early_stopping_patience': 4}. Best is trial 5 with value: 0.152618777391536.
Train: 2407 rows (1613 IDs),Test: 598 rows (404 IDs) 

n_features_x : 6, n_features_per_modality: [16, 23, 19, 17, 7, 4, 4, 4, 1, 4]

--- ImbalancedRegressionLoss initialized ---
  Bins: 10, Focal gamma: 2.27995510875071, Base loss: huber
  Bin [0.00, 0.10): count=  585, weight=0.037
  Bin [0.10, 0.20): count=  580, weight=0.038
  Bin [0.20, 0.30): count=  421, weight=0.052
  Bin [0.30, 0.40): count=  385, weight=0.057
  Bin [0.40, 0.50): count=  191, weight=0.114
  Bin [0.50, 0.60): count=  129, weight=0.168
  Bin [0.60, 0.70): count=   74, weight=0.292
  Bin [0.70, 0.80): count=   33, weight=0.644
  Bin [0.80, 0.90): count=    6, weight=3.127
  Bin [0.90, 1.00): count=    3, weight=5.472
-------------------------------------------

  Pred range: [0.1430, 0.7360], std: 0.0777
  RMSE : 0.1781, R2: -0.0592, MAE: 0.1492, Spearman rho: 0.3402, Spearman p: 1.1454e-17, Pearson r: 0.3691, Pearson p: 9.6967e-21
  Pred range: [0.1263, 0.6247], std: 0.0704
  RMSE : 0.1640, R2: 0.1027, MAE: 0.1349, Spearman rho: 0.3735, Spearman p: 3.1161e-21, Pearson r: 0.4089, Pearson p: 1.6543e-25
  Pred range: [0.1389, 0.6206], std: 0.0745
  RMSE : 0.1682, R2: 0.0552, MAE: 0.1407, Spearman rho: 0.4006, Spearman p: 1.8417e-24, Pearson r: 0.4364, Pearson p: 3.3326e-29
  Pred range: [0.1312, 0.5720], std: 0.0733
  RMSE : 0.1621, R2: 0.1232, MAE: 0.1338, Spearman rho: 0.4178, Spearman p: 1.1395e-26, Pearson r: 0.4538, Pearson p: 1.0138e-31
  Pred range: [0.1333, 0.5707], std: 0.0757
  RMSE : 0.1620, R2: 0.1242, MAE: 0.1341, Spearman rho: 0.4321, Spearman p: 1.3559e-28, Pearson r: 0.4637, Pearson p: 3.2987e-33
  Pred range: [0.1346, 0.5635], std: 0.0771
  RMSE : 0.1618, R2: 0.1262, MAE: 0.1342, Spearman rho: 0.4404, Spearman p: 9.0613e-30, Pearson r: 0.4712, Pearson p: 2.2368e-34
  Pred range: [0.1377, 0.5632], std: 0.0783
  RMSE : 0.1626, R2: 0.1178, MAE: 0.1354, Spearman rho: 0.4475, Spearman p: 8.6914e-31, Pearson r: 0.4769, Pearson p: 2.7074e-35
  Pred range: [0.1345, 0.5691], std: 0.0804
  RMSE : 0.1619, R2: 0.1255, MAE: 0.1346, Spearman rho: 0.4542, Spearman p: 9.0248e-32, Pearson r: 0.4819, Pearson p: 4.2643e-36
  Pred range: [0.1293, 0.5663], std: 0.0800
  RMSE : 0.1599, R2: 0.1465, MAE: 0.1323, Spearman rho: 0.4594, Spearman p: 1.4992e-32, Pearson r: 0.4857, Pearson p: 1.0124e-36
  Pred range: [0.1337, 0.5857], std: 0.0831
  RMSE : 0.1628, R2: 0.1151, MAE: 0.1359, Spearman rho: 0.4640, Spearman p: 2.9037e-33, Pearson r: 0.4889, Pearson p: 3.0033e-37
[I 2026-04-29 01:14:04,234] Trial 9 finished with value: 0.15990161424514465 and parameters: {'learning_rate': 0.00010249710358288774, 'batch_size': 6, 'num_epochs': 10, 'weight_decay': 0.0014187540312783295, 'layers_PRS': 5, 'layers_SCZ15': 1, 'layers_ADHD9': 2, 'layers_ASD9': 3, 'layers_ACE15': 3, 'layers_ACE18': 3, 'layers_SUD18': 5, 'layers_SES': 4, 'layers_SEX': 1, 'dropout': 0.4435117688967719, 'se_reduction': 5, 'hidden_dim_min': 2, 'base_loss': 'huber', 'huber_delta': 0.0851132813181781, 'focal_gamma': 2.27995510875071, 'n_bins': 10, 'scheduler_patience': 4, 'scheduler_factor': 0.6375365026095604, 'early_stopping_patience': 8}. Best is trial 5 with value: 0.152618777391536.
Train: 2407 rows (1613 IDs),Test: 598 rows (404 IDs) 

n_features_x : 6, n_features_per_modality: [16, 23, 19, 17, 7, 4, 4, 4, 1, 4]

--- ImbalancedRegressionLoss initialized ---
  Bins: 11, Focal gamma: 0.619501281772681, Base loss: huber
  Bin [0.00, 0.09): count=  585, weight=0.034
  Bin [0.09, 0.18): count=  580, weight=0.034
  Bin [0.18, 0.27): count=  421, weight=0.047
  Bin [0.27, 0.36): count=  312, weight=0.064
  Bin [0.36, 0.45): count=  207, weight=0.096
  Bin [0.45, 0.55): count=  108, weight=0.183
  Bin [0.55, 0.64): count=  125, weight=0.159
  Bin [0.64, 0.73): count=   41, weight=0.476
  Bin [0.73, 0.82): count=   21, weight=0.909
  Bin [0.82, 0.91): count=    4, weight=3.999
  Bin [0.91, 1.00): count=    3, weight=4.998
-------------------------------------------

  Pred range: [0.0570, 0.7089], std: 0.1021
  RMSE : 0.1671, R2: 0.0682, MAE: 0.1371, Spearman rho: 0.4478, Spearman p: 7.9282e-31, Pearson r: 0.4613, Pearson p: 7.5146e-33
  Pred range: [0.0146, 0.5830], std: 0.1038
  RMSE : 0.1526, R2: 0.2225, MAE: 0.1185, Spearman rho: 0.4617, Spearman p: 6.6658e-33, Pearson r: 0.4855, Pearson p: 1.0673e-36
  Pred range: [0.0579, 0.6070], std: 0.1075
  RMSE : 0.1511, R2: 0.2384, MAE: 0.1190, Spearman rho: 0.4825, Spearman p: 3.4113e-36, Pearson r: 0.5059, Pearson p: 3.5007e-40
  Pred range: [0.1458, 0.6735], std: 0.0927
  RMSE : 0.1834, R2: -0.1233, MAE: 0.1575, Spearman rho: 0.4754, Spearman p: 4.8226e-35, Pearson r: 0.4996, Pearson p: 4.5420e-39
  Pred range: [0.1646, 0.7276], std: 0.1119
  RMSE : 0.1882, R2: -0.1822, MAE: 0.1596, Spearman rho: 0.4815, Spearman p: 4.9809e-36, Pearson r: 0.4982, Pearson p: 7.9148e-39
  Pred range: [-0.0779, 0.6016], std: 0.1116
  RMSE : 0.1564, R2: 0.1838, MAE: 0.1192, Spearman rho: 0.4481, Spearman p: 7.1147e-31, Pearson r: 0.4705, Pearson p: 2.8176e-34
  Pred range: [0.0407, 0.6047], std: 0.1024
  RMSE : 0.1547, R2: 0.2010, MAE: 0.1252, Spearman rho: 0.4901, Spearman p: 1.8665e-37, Pearson r: 0.4997, Pearson p: 4.2413e-39
[I 2026-04-29 01:14:56,143] Trial 10 finished with value: 0.15105277601580916 and parameters: {'learning_rate': 0.006750295508808858, 'batch_size': 4, 'num_epochs': 30, 'weight_decay': 0.00026131274459119185, 'layers_PRS': 2, 'layers_SCZ15': 2, 'layers_ADHD9': 4, 'layers_ASD9': 1, 'layers_ACE15': 5, 'layers_ACE18': 1, 'layers_SUD18': 2, 'layers_SES': 3, 'layers_SEX': 4, 'dropout': 0.22976566799472822, 'se_reduction': 8, 'hidden_dim_min': 7, 'base_loss': 'huber', 'huber_delta': 0.1970387049277539, 'focal_gamma': 0.619501281772681, 'n_bins': 11, 'scheduler_patience': 2, 'scheduler_factor': 0.3231072992903118, 'early_stopping_patience': 4}. Best is trial 10 with value: 0.15105277601580916.
Train: 2407 rows (1613 IDs),Test: 598 rows (404 IDs) 

n_features_x : 6, n_features_per_modality: [16, 23, 19, 17, 7, 4, 4, 4, 1, 4]

--- ImbalancedRegressionLoss initialized ---
  Bins: 11, Focal gamma: 0.5608204689738744, Base loss: huber
  Bin [0.00, 0.09): count=  585, weight=0.034
  Bin [0.09, 0.18): count=  580, weight=0.034
  Bin [0.18, 0.27): count=  421, weight=0.047
  Bin [0.27, 0.36): count=  312, weight=0.064
  Bin [0.36, 0.45): count=  207, weight=0.096
  Bin [0.45, 0.55): count=  108, weight=0.183
  Bin [0.55, 0.64): count=  125, weight=0.159
  Bin [0.64, 0.73): count=   41, weight=0.476
  Bin [0.73, 0.82): count=   21, weight=0.909
  Bin [0.82, 0.91): count=    4, weight=3.999
  Bin [0.91, 1.00): count=    3, weight=4.998
-------------------------------------------

  Pred range: [0.1203, 0.6957], std: 0.1116
  RMSE : 0.1670, R2: 0.0695, MAE: 0.1378, Spearman rho: 0.4771, Spearman p: 2.5870e-35, Pearson r: 0.4980, Pearson p: 8.5415e-39
  Pred range: [0.0013, 0.6027], std: 0.0918
  RMSE : 0.1529, R2: 0.2197, MAE: 0.1216, Spearman rho: 0.4744, Spearman p: 7.0166e-35, Pearson r: 0.4788, Pearson p: 1.3439e-35
  Pred range: [-0.0020, 0.5386], std: 0.0825
  RMSE : 0.1663, R2: 0.0764, MAE: 0.1391, Spearman rho: 0.4717, Spearman p: 1.8314e-34, Pearson r: 0.4657, Pearson p: 1.5990e-33
  Pred range: [0.0204, 0.5145], std: 0.0918
  RMSE : 0.1521, R2: 0.2274, MAE: 0.1152, Spearman rho: 0.4691, Spearman p: 4.7327e-34, Pearson r: 0.4976, Pearson p: 9.7246e-39
  Pred range: [-0.0821, 0.6078], std: 0.0987
  RMSE : 0.1614, R2: 0.1308, MAE: 0.1313, Spearman rho: 0.4444, Spearman p: 2.4510e-30, Pearson r: 0.4484, Pearson p: 6.4294e-31
  Pred range: [0.1445, 0.6190], std: 0.0963
  RMSE : 0.1684, R2: 0.0534, MAE: 0.1421, Spearman rho: 0.4771, Spearman p: 2.5619e-35, Pearson r: 0.5070, Pearson p: 2.2308e-40
  Pred range: [0.1130, 0.6413], std: 0.1058
  RMSE : 0.1566, R2: 0.1814, MAE: 0.1279, Spearman rho: 0.4742, Spearman p: 7.4038e-35, Pearson r: 0.5054, Pearson p: 4.2908e-40
  Pred range: [0.1253, 0.6690], std: 0.1026
  RMSE : 0.1598, R2: 0.1476, MAE: 0.1326, Spearman rho: 0.4906, Spearman p: 1.5594e-37, Pearson r: 0.5175, Pearson p: 2.8951e-42
[I 2026-04-29 01:15:55,625] Trial 11 finished with value: 0.15214329761055037 and parameters: {'learning_rate': 0.005721545573778574, 'batch_size': 4, 'num_epochs': 30, 'weight_decay': 0.00019496694847891894, 'layers_PRS': 2, 'layers_SCZ15': 2, 'layers_ADHD9': 4, 'layers_ASD9': 1, 'layers_ACE15': 5, 'layers_ACE18': 1, 'layers_SUD18': 2, 'layers_SES': 3, 'layers_SEX': 4, 'dropout': 0.23627100608195442, 'se_reduction': 8, 'hidden_dim_min': 6, 'base_loss': 'huber', 'huber_delta': 0.1997013074855153, 'focal_gamma': 0.5608204689738744, 'n_bins': 11, 'scheduler_patience': 2, 'scheduler_factor': 0.30148719177008765, 'early_stopping_patience': 4}. Best is trial 10 with value: 0.15105277601580916.
Train: 2407 rows (1613 IDs),Test: 598 rows (404 IDs) 

n_features_x : 6, n_features_per_modality: [16, 23, 19, 17, 7, 4, 4, 4, 1, 4]

--- ImbalancedRegressionLoss initialized ---
  Bins: 11, Focal gamma: 0.5075042398012939, Base loss: huber
  Bin [0.00, 0.09): count=  585, weight=0.034
  Bin [0.09, 0.18): count=  580, weight=0.034
  Bin [0.18, 0.27): count=  421, weight=0.047
  Bin [0.27, 0.36): count=  312, weight=0.064
  Bin [0.36, 0.45): count=  207, weight=0.096
  Bin [0.45, 0.55): count=  108, weight=0.183
  Bin [0.55, 0.64): count=  125, weight=0.159
  Bin [0.64, 0.73): count=   41, weight=0.476
  Bin [0.73, 0.82): count=   21, weight=0.909
  Bin [0.82, 0.91): count=    4, weight=3.999
  Bin [0.91, 1.00): count=    3, weight=4.998
-------------------------------------------

  Pred range: [0.0712, 0.6706], std: 0.1229
  RMSE : 0.1617, R2: 0.1272, MAE: 0.1286, Spearman rho: 0.4441, Spearman p: 2.6819e-30, Pearson r: 0.4697, Pearson p: 3.7600e-34
  Pred range: [-0.0091, 0.5960], std: 0.1096
  RMSE : 0.1535, R2: 0.2135, MAE: 0.1188, Spearman rho: 0.4672, Spearman p: 9.2620e-34, Pearson r: 0.4860, Pearson p: 8.9832e-37
  Pred range: [0.1091, 0.7691], std: 0.0992
  RMSE : 0.1636, R2: 0.1062, MAE: 0.1355, Spearman rho: 0.4511, Spearman p: 2.5609e-31, Pearson r: 0.4650, Pearson p: 2.0439e-33
  Pred range: [0.1712, 0.5904], std: 0.0750
  RMSE : 0.1849, R2: -0.1410, MAE: 0.1593, Spearman rho: 0.4455, Spearman p: 1.6797e-30, Pearson r: 0.4647, Pearson p: 2.2528e-33
  Pred range: [0.1452, 0.6303], std: 0.0873
  RMSE : 0.1927, R2: -0.2391, MAE: 0.1657, Spearman rho: 0.4110, Spearman p: 8.8020e-26, Pearson r: 0.4176, Pearson p: 1.2304e-26
  Pred range: [0.1165, 0.5775], std: 0.0910
  RMSE : 0.1533, R2: 0.2160, MAE: 0.1251, Spearman rho: 0.4684, Spearman p: 6.0079e-34, Pearson r: 0.5020, Pearson p: 1.7361e-39
  Pred range: [0.0535, 0.5569], std: 0.0994
  RMSE : 0.1511, R2: 0.2380, MAE: 0.1182, Spearman rho: 0.4661, Spearman p: 1.4067e-33, Pearson r: 0.4947, Pearson p: 3.1160e-38
  Pred range: [0.0545, 0.5595], std: 0.0907
  RMSE : 0.1559, R2: 0.1885, MAE: 0.1277, Spearman rho: 0.4701, Spearman p: 3.3490e-34, Pearson r: 0.4917, Pearson p: 9.9951e-38
  Pred range: [0.1187, 0.7365], std: 0.1131
  RMSE : 0.1732, R2: -0.0017, MAE: 0.1446, Spearman rho: 0.4900, Spearman p: 1.9555e-37, Pearson r: 0.5074, Pearson p: 1.9203e-40
  Pred range: [0.0807, 0.7040], std: 0.1115
  RMSE : 0.1752, R2: -0.0240, MAE: 0.1465, Spearman rho: 0.4913, Spearman p: 1.1508e-37, Pearson r: 0.5126, Pearson p: 2.2631e-41
  Pred range: [0.0578, 0.5779], std: 0.0984
  RMSE : 0.1530, R2: 0.2181, MAE: 0.1234, Spearman rho: 0.4847, Spearman p: 1.4990e-36, Pearson r: 0.5055, Pearson p: 4.1256e-40
[I 2026-04-29 01:17:20,700] Trial 12 finished with value: 0.15109171873894978 and parameters: {'learning_rate': 0.00984235798930246, 'batch_size': 4, 'num_epochs': 30, 'weight_decay': 0.00042026618999564674, 'layers_PRS': 2, 'layers_SCZ15': 3, 'layers_ADHD9': 4, 'layers_ASD9': 1, 'layers_ACE15': 5, 'layers_ACE18': 2, 'layers_SUD18': 2, 'layers_SES': 2, 'layers_SEX': 4, 'dropout': 0.19380310830540598, 'se_reduction': 8, 'hidden_dim_min': 7, 'base_loss': 'huber', 'huber_delta': 0.1976003806588079, 'focal_gamma': 0.5075042398012939, 'n_bins': 11, 'scheduler_patience': 2, 'scheduler_factor': 0.30525609208076154, 'early_stopping_patience': 4}. Best is trial 10 with value: 0.15105277601580916.
Train: 2407 rows (1613 IDs),Test: 598 rows (404 IDs) 

n_features_x : 6, n_features_per_modality: [16, 23, 19, 17, 7, 4, 4, 4, 1, 4]

--- ImbalancedRegressionLoss initialized ---
  Bins: 10, Focal gamma: 0.5167959387076266, Base loss: huber
  Bin [0.00, 0.10): count=  585, weight=0.037
  Bin [0.10, 0.20): count=  580, weight=0.038
  Bin [0.20, 0.30): count=  421, weight=0.052
  Bin [0.30, 0.40): count=  385, weight=0.057
  Bin [0.40, 0.50): count=  191, weight=0.114
  Bin [0.50, 0.60): count=  129, weight=0.168
  Bin [0.60, 0.70): count=   74, weight=0.292
  Bin [0.70, 0.80): count=   33, weight=0.644
  Bin [0.80, 0.90): count=    6, weight=3.127
  Bin [0.90, 1.00): count=    3, weight=5.472
-------------------------------------------

  Pred range: [-0.1916, 0.6185], std: 0.1157
  RMSE : 0.1685, R2: 0.0521, MAE: 0.1264, Spearman rho: 0.3864, Spearman p: 1.0032e-22, Pearson r: 0.3882, Pearson p: 6.1166e-23
  Pred range: [0.0776, 0.9082], std: 0.1204
  RMSE : 0.1759, R2: -0.0325, MAE: 0.1440, Spearman rho: 0.4631, Spearman p: 3.9935e-33, Pearson r: 0.4701, Pearson p: 3.2697e-34
  Pred range: [0.0674, 0.6343], std: 0.0964
  RMSE : 0.1654, R2: 0.0871, MAE: 0.1375, Spearman rho: 0.4628, Spearman p: 4.4842e-33, Pearson r: 0.4728, Pearson p: 1.2406e-34
  Pred range: [0.0568, 0.8926], std: 0.1228
  RMSE : 0.2206, R2: -0.6248, MAE: 0.1889, Spearman rho: 0.4720, Spearman p: 1.6439e-34, Pearson r: 0.4721, Pearson p: 1.5859e-34
  Pred range: [0.0932, 0.9088], std: 0.1141
  RMSE : 0.1887, R2: -0.1884, MAE: 0.1583, Spearman rho: 0.4455, Spearman p: 1.6795e-30, Pearson r: 0.4606, Pearson p: 9.8649e-33
  Pred range: [0.0529, 0.5982], std: 0.0990
  RMSE : 0.1602, R2: 0.1434, MAE: 0.1298, Spearman rho: 0.4521, Spearman p: 1.8268e-31, Pearson r: 0.4529, Pearson p: 1.3992e-31
  Pred range: [-0.1128, 0.5452], std: 0.0996
  RMSE : 0.1749, R2: -0.0211, MAE: 0.1279, Spearman rho: 0.4336, Spearman p: 8.2743e-29, Pearson r: 0.4211, Pearson p: 4.1855e-27
  Pred range: [0.1117, 0.8211], std: 0.1084
  RMSE : 0.1890, R2: -0.1917, MAE: 0.1594, Spearman rho: 0.4694, Spearman p: 4.1754e-34, Pearson r: 0.4676, Pearson p: 8.0308e-34
  Pred range: [0.0118, 0.5671], std: 0.0918
  RMSE : 0.1575, R2: 0.1725, MAE: 0.1267, Spearman rho: 0.4324, Spearman p: 1.2397e-28, Pearson r: 0.4484, Pearson p: 6.4307e-31
  Pred range: [0.0169, 0.6967], std: 0.1226
  RMSE : 0.1595, R2: 0.1505, MAE: 0.1218, Spearman rho: 0.4666, Spearman p: 1.1826e-33, Pearson r: 0.4604, Pearson p: 1.0398e-32
  Pred range: [-0.0596, 0.5911], std: 0.1042
  RMSE : 0.1695, R2: 0.0410, MAE: 0.1255, Spearman rho: 0.4150, Spearman p: 2.7095e-26, Pearson r: 0.4291, Pearson p: 3.4928e-28
  Pred range: [0.1156, 0.7428], std: 0.1138
  RMSE : 0.1825, R2: -0.1112, MAE: 0.1527, Spearman rho: 0.4740, Spearman p: 7.8998e-35, Pearson r: 0.4909, Pearson p: 1.3788e-37
[I 2026-04-29 01:19:00,437] Trial 13 finished with value: 0.1574528351338459 and parameters: {'learning_rate': 0.009375698115408112, 'batch_size': 4, 'num_epochs': 30, 'weight_decay': 0.0006034729016627398, 'layers_PRS': 2, 'layers_SCZ15': 3, 'layers_ADHD9': 4, 'layers_ASD9': 2, 'layers_ACE15': 4, 'layers_ACE18': 2, 'layers_SUD18': 4, 'layers_SES': 2, 'layers_SEX': 4, 'dropout': 0.19139285035120218, 'se_reduction': 7, 'hidden_dim_min': 7, 'base_loss': 'huber', 'huber_delta': 0.016098542551139808, 'focal_gamma': 0.5167959387076266, 'n_bins': 10, 'scheduler_patience': 2, 'scheduler_factor': 0.34004704958156823, 'early_stopping_patience': 3}. Best is trial 10 with value: 0.15105277601580916.
Train: 2407 rows (1613 IDs),Test: 598 rows (404 IDs) 

n_features_x : 6, n_features_per_modality: [16, 23, 19, 17, 7, 4, 4, 4, 1, 4]

--- ImbalancedRegressionLoss initialized ---
  Bins: 14, Focal gamma: 1.1940727337332226, Base loss: huber
  Bin [0.00, 0.07): count=  383, weight=0.042
  Bin [0.07, 0.14): count=  377, weight=0.043
  Bin [0.14, 0.21): count=  571, weight=0.028
  Bin [0.21, 0.29): count=  255, weight=0.063
  Bin [0.29, 0.36): count=  223, weight=0.072
  Bin [0.36, 0.43): count=  231, weight=0.070
  Bin [0.43, 0.50): count=  122, weight=0.131
  Bin [0.50, 0.57): count=   93, weight=0.172
  Bin [0.57, 0.64): count=   83, weight=0.192
  Bin [0.64, 0.71): count=   27, weight=0.577
  Bin [0.71, 0.79): count=   26, weight=0.598
  Bin [0.79, 0.86): count=   12, weight=1.243
  Bin [0.86, 0.93): count=    2, weight=5.384
  Bin [0.93, 1.00): count=    2, weight=5.384
-------------------------------------------

  Pred range: [0.0349, 0.5068], std: 0.0745
  RMSE : 0.1514, R2: 0.2348, MAE: 0.1176, Spearman rho: 0.4806, Spearman p: 6.8639e-36, Pearson r: 0.4880, Pearson p: 4.1293e-37
  Pred range: [0.1072, 0.6497], std: 0.1027
  RMSE : 0.1627, R2: 0.1162, MAE: 0.1345, Spearman rho: 0.4908, Spearman p: 1.4297e-37, Pearson r: 0.5025, Pearson p: 1.3917e-39
  Pred range: [0.0793, 0.6153], std: 0.0933
  RMSE : 0.1667, R2: 0.0728, MAE: 0.1396, Spearman rho: 0.4752, Spearman p: 5.0872e-35, Pearson r: 0.4931, Pearson p: 5.8870e-38
  Pred range: [0.0158, 0.5867], std: 0.0967
  RMSE : 0.1520, R2: 0.2284, MAE: 0.1221, Spearman rho: 0.4871, Spearman p: 5.9226e-37, Pearson r: 0.5044, Pearson p: 6.5282e-40
  Pred range: [-0.0013, 0.6043], std: 0.1035
  RMSE : 0.1517, R2: 0.2319, MAE: 0.1214, Spearman rho: 0.4896, Spearman p: 2.2301e-37, Pearson r: 0.5094, Pearson p: 8.3509e-41
