[I 2026-04-29 01:56:35,833] Trial 48 finished with value: 0.14892003407879917 and parameters: {'learning_rate': 0.001164550150197739, 'batch_size': 4, 'num_epochs': 14, 'weight_decay': 0.0014107151245982637, 'layers_PRS': 4, 'layers_SCZ15': 4, 'layers_ADHD9': 1, 'layers_ASD9': 2, 'layers_ACE15': 2, 'layers_ACE18': 5, 'layers_SUD18': 3, 'layers_SES': 5, 'layers_SEX': 2, 'dropout': 0.20491011412297122, 'se_reduction': 6, 'hidden_dim_min': 16, 'base_loss': 'huber', 'huber_delta': 0.06956963310883243, 'focal_gamma': 2.8071904954015556, 'n_bins': 6, 'scheduler_patience': 5, 'scheduler_factor': 0.5718202536100057, 'early_stopping_patience': 8}. Best is trial 35 with value: 0.14828249718771663.
Train: 2407 rows (1613 IDs),Test: 598 rows (404 IDs) 

n_features_x : 6, n_features_per_modality: [16, 23, 19, 17, 7, 4, 4, 4, 1, 4]

--- ImbalancedRegressionLoss initialized ---
  Bins: 6, Focal gamma: 2.6064258403083027, Base loss: huber
  Bin [0.00, 0.17): count=  961, weight=0.041
  Bin [0.17, 0.33): count=  848, weight=0.047
  Bin [0.33, 0.50): count=  353, weight=0.112
  Bin [0.50, 0.67): count=  176, weight=0.224
  Bin [0.67, 0.83): count=   62, weight=0.628
  Bin [0.83, 1.00): count=    7, weight=4.948
-------------------------------------------

  Pred range: [0.1108, 0.5595], std: 0.0791
  RMSE : 0.1507, R2: 0.2416, MAE: 0.1196, Spearman rho: 0.4795, Spearman p: 1.0342e-35, Pearson r: 0.5004, Pearson p: 3.2338e-39
  Pred range: [0.0937, 0.5752], std: 0.0860
  RMSE : 0.1523, R2: 0.2263, MAE: 0.1223, Spearman rho: 0.4775, Spearman p: 2.2161e-35, Pearson r: 0.4962, Pearson p: 1.7520e-38
  Pred range: [0.0980, 0.6221], std: 0.0948
  RMSE : 0.1581, R2: 0.1655, MAE: 0.1302, Spearman rho: 0.4926, Spearman p: 7.0748e-38, Pearson r: 0.5124, Pearson p: 2.4419e-41
  Pred range: [0.1249, 0.6432], std: 0.0932
  RMSE : 0.1638, R2: 0.1041, MAE: 0.1365, Spearman rho: 0.4844, Spearman p: 1.6485e-36, Pearson r: 0.5020, Pearson p: 1.7073e-39
  Pred range: [0.0880, 0.5735], std: 0.0892
  RMSE : 0.1545, R2: 0.2035, MAE: 0.1254, Spearman rho: 0.4710, Spearman p: 2.4192e-34, Pearson r: 0.4907, Pearson p: 1.5000e-37
  Pred range: [0.0401, 0.5832], std: 0.0910
  RMSE : 0.1537, R2: 0.2118, MAE: 0.1259, Spearman rho: 0.4801, Spearman p: 8.4838e-36, Pearson r: 0.5032, Pearson p: 1.0761e-39
  Pred range: [0.0275, 0.5732], std: 0.0946
  RMSE : 0.1515, R2: 0.2334, MAE: 0.1201, Spearman rho: 0.4778, Spearman p: 1.9341e-35, Pearson r: 0.4947, Pearson p: 3.0863e-38
  Pred range: [0.1078, 0.6620], std: 0.0964
  RMSE : 0.1685, R2: 0.0523, MAE: 0.1415, Spearman rho: 0.4841, Spearman p: 1.8384e-36, Pearson r: 0.5053, Pearson p: 4.5569e-40
  Pred range: [0.0763, 0.5809], std: 0.0910
  RMSE : 0.1502, R2: 0.2466, MAE: 0.1190, Spearman rho: 0.4877, Spearman p: 4.6170e-37, Pearson r: 0.5036, Pearson p: 8.9545e-40
  Pred range: [0.0328, 0.5060], std: 0.0876
  RMSE : 0.1487, R2: 0.2623, MAE: 0.1153, Spearman rho: 0.4962, Spearman p: 1.7418e-38, Pearson r: 0.5125, Pearson p: 2.3099e-41
  Pred range: [-0.0148, 0.4905], std: 0.0864
  RMSE : 0.1546, R2: 0.2026, MAE: 0.1151, Spearman rho: 0.4794, Spearman p: 1.0801e-35, Pearson r: 0.4995, Pearson p: 4.6180e-39
[I 2026-04-29 01:57:44,931] Trial 49 finished with value: 0.1486674710742538 and parameters: {'learning_rate': 0.00241908551979142, 'batch_size': 6, 'num_epochs': 11, 'weight_decay': 0.0012848322595293187, 'layers_PRS': 5, 'layers_SCZ15': 5, 'layers_ADHD9': 1, 'layers_ASD9': 3, 'layers_ACE15': 1, 'layers_ACE18': 5, 'layers_SUD18': 3, 'layers_SES': 5, 'layers_SEX': 1, 'dropout': 0.20737800771682857, 'se_reduction': 6, 'hidden_dim_min': 16, 'base_loss': 'huber', 'huber_delta': 0.06916840943310143, 'focal_gamma': 2.6064258403083027, 'n_bins': 6, 'scheduler_patience': 5, 'scheduler_factor': 0.5640469400303489, 'early_stopping_patience': 8}. Best is trial 35 with value: 0.14828249718771663.

Completed in 50.7 minutes
Trials: 41 complete, 9 pruned

============================================================
  Best Neg trial
============================================================
  RMSE: 0.1483

  Copy these into hyperparameters.json:
  ----------------------------------------
  learning_rate = 0.0005612239698890053
  batch_size = 4
  num_epochs = 17
  weight_decay = 0.0021287671241259944
  layers_PRS = 4
  layers_SCZ15 = 1
  layers_ADHD9 = 3
  layers_ASD9 = 3
  layers_ACE15 = 3
  layers_ACE18 = 4
  layers_SUD18 = 4
  layers_SES = 4
  layers_SEX = 2
  dropout = 0.16661646377244627
  se_reduction = 4
  hidden_dim_min = 16
  base_loss = 'huber'
  huber_delta = 0.07036973928004242
  focal_gamma = 2.3580799711413936
  n_bins = 6
  scheduler_patience = 5
  scheduler_factor = 0.6665989953904287
  early_stopping_patience = 6
  ----------------------------------------

Best hyperparameters saved to 'Neg_best_params.txt'
All trial results saved to 'Neg_optuna_results.csv'
Visualizations saved as Neg_*.html
