[I 2026-04-27 17:38:55,911] Trial 64 finished with value: 0.09079959079243494 and parameters: {'learning_rate': 0.0016597205747173758, 'batch_size': 4, 'num_epochs': 19, 'weight_decay': 0.00025330815142853805, 'layers_PRS': 6, 'layers_SCZ15': 6, 'layers_ADHD9': 4, 'layers_ASD9': 1, 'layers_ACE15': 3, 'layers_ACE18': 4, 'layers_SUD18': 7, 'layers_SES': 5, 'layers_SEX': 1, 'dropout': 0.3402984689893887, 'se_reduction': 4, 'hidden_dim_min': 6, 'base_loss': 'huber', 'huber_delta': 0.18835675102551963, 'focal_gamma': 2.2726866917406388, 'n_bins': 9, 'scheduler_patience': 4, 'scheduler_factor': 0.5345189926505569, 'early_stopping_patience': 3}. Best is trial 53 with value: 0.08802287430437908.
Train: 2407 rows (1613 IDs),Test: 598 rows (404 IDs) 

n_features_x : 6, n_features_per_modality: [16, 23, 19, 17, 7, 4, 4, 4, 1, 4]

--- ImbalancedRegressionLoss initialized ---
  Bins: 13, Focal gamma: 0.9340621563856337, Base loss: huber
  Bin [0.00, 0.08): count=  828, weight=0.003
  Bin [0.08, 0.15): count=  710, weight=0.004
  Bin [0.15, 0.23): count=  477, weight=0.006
  Bin [0.23, 0.31): count=  288, weight=0.009
  Bin [0.31, 0.38): count=   63, weight=0.042
  Bin [0.38, 0.46): count=   23, weight=0.113
  Bin [0.46, 0.54): count=   10, weight=0.247
  Bin [0.54, 0.62): count=    7, weight=0.340
  Bin [0.62, 0.69): count=    0, weight=2.719
  Bin [0.69, 0.77): count=    1, weight=1.359
  Bin [0.77, 0.85): count=    0, weight=2.719
  Bin [0.85, 0.92): count=    0, weight=2.719
  Bin [0.92, 1.00): count=    0, weight=2.719
-------------------------------------------

  Pred range: [0.0474, 0.4268], std: 0.0580
  RMSE : 0.0932, R2: 0.1419, MAE: 0.0747, Spearman rho: 0.4349, Spearman p: 5.4569e-29, Pearson r: 0.4423, Pearson p: 4.8487e-30
  Pred range: [0.0589, 0.4345], std: 0.0594
  RMSE : 0.0955, R2: 0.0989, MAE: 0.0770, Spearman rho: 0.4590, Spearman p: 1.7023e-32, Pearson r: 0.4656, Pearson p: 1.6600e-33
  Pred range: [0.0409, 0.4025], std: 0.0612
  RMSE : 0.0906, R2: 0.1894, MAE: 0.0721, Spearman rho: 0.4719, Spearman p: 1.7181e-34, Pearson r: 0.4796, Pearson p: 1.0087e-35
  Pred range: [0.0551, 0.3703], std: 0.0535
  RMSE : 0.0896, R2: 0.2073, MAE: 0.0718, Spearman rho: 0.4826, Spearman p: 3.2441e-36, Pearson r: 0.4906, Pearson p: 1.5187e-37
  Pred range: [0.0335, 0.3541], std: 0.0545
  RMSE : 0.0883, R2: 0.2302, MAE: 0.0701, Spearman rho: 0.4836, Spearman p: 2.2534e-36, Pearson r: 0.4890, Pearson p: 2.8654e-37
  Pred range: [0.0421, 0.3764], std: 0.0583
  RMSE : 0.0892, R2: 0.2145, MAE: 0.0709, Spearman rho: 0.4802, Spearman p: 8.1430e-36, Pearson r: 0.4890, Pearson p: 2.8524e-37
  Pred range: [0.0524, 0.4103], std: 0.0587
  RMSE : 0.0920, R2: 0.1635, MAE: 0.0737, Spearman rho: 0.4788, Spearman p: 1.3705e-35, Pearson r: 0.4860, Pearson p: 8.9290e-37
  Pred range: [0.0500, 0.3950], std: 0.0606
  RMSE : 0.0923, R2: 0.1579, MAE: 0.0741, Spearman rho: 0.4856, Spearman p: 1.0381e-36, Pearson r: 0.4918, Pearson p: 9.5807e-38
  Pred range: [0.0397, 0.3669], std: 0.0590
  RMSE : 0.0890, R2: 0.2181, MAE: 0.0707, Spearman rho: 0.4859, Spearman p: 9.3033e-37, Pearson r: 0.4951, Pearson p: 2.6112e-38
  Pred range: [0.0532, 0.3981], std: 0.0591
  RMSE : 0.0923, R2: 0.1580, MAE: 0.0742, Spearman rho: 0.4795, Spearman p: 1.0438e-35, Pearson r: 0.4879, Pearson p: 4.3145e-37
[I 2026-04-27 17:40:23,166] Trial 65 finished with value: 0.08826137863434683 and parameters: {'learning_rate': 0.0006933039615645738, 'batch_size': 6, 'num_epochs': 13, 'weight_decay': 0.0025372560184302646, 'layers_PRS': 7, 'layers_SCZ15': 4, 'layers_ADHD9': 7, 'layers_ASD9': 2, 'layers_ACE15': 4, 'layers_ACE18': 3, 'layers_SUD18': 5, 'layers_SES': 6, 'layers_SEX': 2, 'dropout': 0.4394664577029959, 'se_reduction': 3, 'hidden_dim_min': 9, 'base_loss': 'huber', 'huber_delta': 0.04412119437657898, 'focal_gamma': 0.9340621563856337, 'n_bins': 13, 'scheduler_patience': 2, 'scheduler_factor': 0.5920322603376007, 'early_stopping_patience': 5}. Best is trial 53 with value: 0.08802287430437908.
Train: 2407 rows (1613 IDs),Test: 598 rows (404 IDs) 

n_features_x : 6, n_features_per_modality: [16, 23, 19, 17, 7, 4, 4, 4, 1, 4]

--- ImbalancedRegressionLoss initialized ---
  Bins: 17, Focal gamma: 0.9221580342808675, Base loss: huber
  Bin [0.00, 0.06): count=  650, weight=0.004
  Bin [0.06, 0.12): count=  530, weight=0.005
  Bin [0.12, 0.18): count=  536, weight=0.005
  Bin [0.18, 0.24): count=  299, weight=0.009
  Bin [0.24, 0.29): count=  247, weight=0.011
  Bin [0.29, 0.35): count=   91, weight=0.029
  Bin [0.35, 0.41): count=   20, weight=0.127
  Bin [0.41, 0.47): count=   16, weight=0.157
  Bin [0.47, 0.53): count=   10, weight=0.243
  Bin [0.53, 0.59): count=    6, weight=0.382
  Bin [0.59, 0.65): count=    1, weight=1.336
  Bin [0.65, 0.71): count=    1, weight=1.336
  Bin [0.71, 0.76): count=    0, weight=2.671
  Bin [0.76, 0.82): count=    0, weight=2.671
  Bin [0.82, 0.88): count=    0, weight=2.671
  Bin [0.88, 0.94): count=    0, weight=2.671
  Bin [0.94, 1.00): count=    0, weight=2.671
-------------------------------------------

  Pred range: [0.0390, 0.4017], std: 0.0614
  RMSE : 0.0967, R2: 0.0761, MAE: 0.0783, Spearman rho: 0.4397, Spearman p: 1.1634e-29, Pearson r: 0.4485, Pearson p: 6.2626e-31
  Pred range: [0.0389, 0.3843], std: 0.0608
  RMSE : 0.0920, R2: 0.1635, MAE: 0.0736, Spearman rho: 0.4621, Spearman p: 5.7302e-33, Pearson r: 0.4698, Pearson p: 3.7106e-34
  Pred range: [0.0513, 0.4145], std: 0.0619
  RMSE : 0.0944, R2: 0.1186, MAE: 0.0762, Spearman rho: 0.4642, Spearman p: 2.7085e-33, Pearson r: 0.4731, Pearson p: 1.1137e-34
  Pred range: [0.0369, 0.3420], std: 0.0531
  RMSE : 0.0878, R2: 0.2384, MAE: 0.0693, Spearman rho: 0.4816, Spearman p: 4.6661e-36, Pearson r: 0.4898, Pearson p: 2.1133e-37
  Pred range: [0.0435, 0.4001], std: 0.0598
  RMSE : 0.0911, R2: 0.1803, MAE: 0.0730, Spearman rho: 0.4701, Spearman p: 3.3407e-34, Pearson r: 0.4796, Pearson p: 1.0092e-35
  Pred range: [0.0490, 0.4154], std: 0.0610
  RMSE : 0.0927, R2: 0.1508, MAE: 0.0745, Spearman rho: 0.4750, Spearman p: 5.6193e-35, Pearson r: 0.4828, Pearson p: 3.0042e-36
  Pred range: [0.0527, 0.4087], std: 0.0583
  RMSE : 0.0923, R2: 0.1587, MAE: 0.0743, Spearman rho: 0.4688, Spearman p: 5.3170e-34, Pearson r: 0.4788, Pearson p: 1.3348e-35
  Pred range: [0.0578, 0.4112], std: 0.0589
  RMSE : 0.0942, R2: 0.1224, MAE: 0.0763, Spearman rho: 0.4684, Spearman p: 6.0221e-34, Pearson r: 0.4795, Pearson p: 1.0380e-35
  Pred range: [0.0553, 0.4156], std: 0.0603
  RMSE : 0.0945, R2: 0.1182, MAE: 0.0764, Spearman rho: 0.4720, Spearman p: 1.6730e-34, Pearson r: 0.4819, Pearson p: 4.3174e-36
[I 2026-04-27 17:41:41,809] Trial 66 finished with value: 0.08778944019020135 and parameters: {'learning_rate': 0.0005973680867625539, 'batch_size': 6, 'num_epochs': 13, 'weight_decay': 0.0031227145352306397, 'layers_PRS': 7, 'layers_SCZ15': 4, 'layers_ADHD9': 7, 'layers_ASD9': 2, 'layers_ACE15': 5, 'layers_ACE18': 3, 'layers_SUD18': 5, 'layers_SES': 5, 'layers_SEX': 2, 'dropout': 0.45063058269731754, 'se_reduction': 3, 'hidden_dim_min': 9, 'base_loss': 'huber', 'huber_delta': 0.045453174882101266, 'focal_gamma': 0.9221580342808675, 'n_bins': 17, 'scheduler_patience': 2, 'scheduler_factor': 0.5061742592637344, 'early_stopping_patience': 5}. Best is trial 66 with value: 0.08778944019020135.
Train: 2407 rows (1613 IDs),Test: 598 rows (404 IDs) 

n_features_x : 6, n_features_per_modality: [16, 23, 19, 17, 7, 4, 4, 4, 1, 4]

--- ImbalancedRegressionLoss initialized ---
  Bins: 17, Focal gamma: 1.6935498876949429, Base loss: huber
  Bin [0.00, 0.06): count=  650, weight=0.004
  Bin [0.06, 0.12): count=  530, weight=0.005
  Bin [0.12, 0.18): count=  536, weight=0.005
  Bin [0.18, 0.24): count=  299, weight=0.009
  Bin [0.24, 0.29): count=  247, weight=0.011
  Bin [0.29, 0.35): count=   91, weight=0.029
  Bin [0.35, 0.41): count=   20, weight=0.127
  Bin [0.41, 0.47): count=   16, weight=0.157
  Bin [0.47, 0.53): count=   10, weight=0.243
  Bin [0.53, 0.59): count=    6, weight=0.382
  Bin [0.59, 0.65): count=    1, weight=1.336
  Bin [0.65, 0.71): count=    1, weight=1.336
  Bin [0.71, 0.76): count=    0, weight=2.671
  Bin [0.76, 0.82): count=    0, weight=2.671
  Bin [0.82, 0.88): count=    0, weight=2.671
  Bin [0.88, 0.94): count=    0, weight=2.671
  Bin [0.94, 1.00): count=    0, weight=2.671
-------------------------------------------

  Pred range: [0.0454, 0.3460], std: 0.0498
  RMSE : 0.0927, R2: 0.1505, MAE: 0.0743, Spearman rho: 0.4150, Spearman p: 2.7038e-26, Pearson r: 0.4105, Pearson p: 1.0262e-25
  Pred range: [0.0488, 0.3931], std: 0.0589
  RMSE : 0.0928, R2: 0.1486, MAE: 0.0744, Spearman rho: 0.4671, Spearman p: 9.8101e-34, Pearson r: 0.4654, Pearson p: 1.8141e-33
  Pred range: [0.0618, 0.4005], std: 0.0590
  RMSE : 0.0956, R2: 0.0960, MAE: 0.0777, Spearman rho: 0.4723, Spearman p: 1.4804e-34, Pearson r: 0.4750, Pearson p: 5.5513e-35
  Pred range: [0.0485, 0.3768], std: 0.0580
  RMSE : 0.0905, R2: 0.1915, MAE: 0.0721, Spearman rho: 0.4748, Spearman p: 5.9267e-35, Pearson r: 0.4774, Pearson p: 2.2671e-35
  Pred range: [0.0540, 0.4075], std: 0.0598
  RMSE : 0.0924, R2: 0.1560, MAE: 0.0741, Spearman rho: 0.4735, Spearman p: 9.7193e-35, Pearson r: 0.4784, Pearson p: 1.5528e-35
  Pred range: [0.0592, 0.4027], std: 0.0592
  RMSE : 0.0942, R2: 0.1232, MAE: 0.0760, Spearman rho: 0.4750, Spearman p: 5.5984e-35, Pearson r: 0.4810, Pearson p: 5.8583e-36
  Pred range: [0.0413, 0.3664], std: 0.0579
  RMSE : 0.0893, R2: 0.2113, MAE: 0.0707, Spearman rho: 0.4743, Spearman p: 7.0815e-35, Pearson r: 0.4813, Pearson p: 5.3996e-36
  Pred range: [0.0531, 0.3894], std: 0.0576
  RMSE : 0.0920, R2: 0.1633, MAE: 0.0738, Spearman rho: 0.4743, Spearman p: 7.0958e-35, Pearson r: 0.4816, Pearson p: 4.8154e-36
  Pred range: [0.0314, 0.3544], std: 0.0542
  RMSE : 0.0884, R2: 0.2272, MAE: 0.0696, Spearman rho: 0.4738, Spearman p: 8.5979e-35, Pearson r: 0.4812, Pearson p: 5.4554e-36
  Pred range: [0.0593, 0.4009], std: 0.0564
  RMSE : 0.0926, R2: 0.1527, MAE: 0.0746, Spearman rho: 0.4733, Spearman p: 1.0185e-34, Pearson r: 0.4822, Pearson p: 3.7962e-36
  Pred range: [0.0587, 0.3913], std: 0.0537
  RMSE : 0.0919, R2: 0.1648, MAE: 0.0740, Spearman rho: 0.4696, Spearman p: 3.9268e-34, Pearson r: 0.4782, Pearson p: 1.7092e-35
  Pred range: [0.0450, 0.3794], std: 0.0567
  RMSE : 0.0898, R2: 0.2039, MAE: 0.0715, Spearman rho: 0.4649, Spearman p: 2.1386e-33, Pearson r: 0.4750, Pearson p: 5.6268e-35
  Pred range: [0.0572, 0.3940], std: 0.0555
  RMSE : 0.0914, R2: 0.1750, MAE: 0.0734, Spearman rho: 0.4644, Spearman p: 2.5172e-33, Pearson r: 0.4753, Pearson p: 4.9412e-35
  Pred range: [0.0512, 0.3828], std: 0.0543
  RMSE : 0.0896, R2: 0.2060, MAE: 0.0716, Spearman rho: 0.4697, Spearman p: 3.8664e-34, Pearson r: 0.4792, Pearson p: 1.1477e-35
[I 2026-04-27 17:43:26,806] Trial 67 finished with value: 0.08843314366512764 and parameters: {'learning_rate': 0.000575569507411553, 'batch_size': 6, 'num_epochs': 14, 'weight_decay': 0.0016810107604546963, 'layers_PRS': 7, 'layers_SCZ15': 4, 'layers_ADHD9': 1, 'layers_ASD9': 2, 'layers_ACE15': 6, 'layers_ACE18': 3, 'layers_SUD18': 5, 'layers_SES': 4, 'layers_SEX': 2, 'dropout': 0.45930218406409484, 'se_reduction': 2, 'hidden_dim_min': 12, 'base_loss': 'huber', 'huber_delta': 0.06667504391207799, 'focal_gamma': 1.6935498876949429, 'n_bins': 17, 'scheduler_patience': 2, 'scheduler_factor': 0.3727871731452319, 'early_stopping_patience': 6}. Best is trial 66 with value: 0.08778944019020135.
Train: 2407 rows (1613 IDs),Test: 598 rows (404 IDs) 

n_features_x : 6, n_features_per_modality: [16, 23, 19, 17, 7, 4, 4, 4, 1, 4]

--- ImbalancedRegressionLoss initialized ---
  Bins: 18, Focal gamma: 0.7636820538093614, Base loss: huber
  Bin [0.00, 0.06): count=  650, weight=0.004
  Bin [0.06, 0.11): count=  530, weight=0.005
  Bin [0.11, 0.17): count=  358, weight=0.007
  Bin [0.17, 0.22): count=  477, weight=0.005
  Bin [0.22, 0.28): count=  179, weight=0.014
  Bin [0.28, 0.33): count=  133, weight=0.019
  Bin [0.33, 0.39): count=   39, weight=0.064
  Bin [0.39, 0.44): count=   20, weight=0.122
  Bin [0.44, 0.50): count=   10, weight=0.233
  Bin [0.50, 0.56): count=    6, weight=0.366
  Bin [0.56, 0.61): count=    4, weight=0.512
  Bin [0.61, 0.67): count=    0, weight=2.561
  Bin [0.67, 0.72): count=    1, weight=1.281
  Bin [0.72, 0.78): count=    0, weight=2.561
  Bin [0.78, 0.83): count=    0, weight=2.561
  Bin [0.83, 0.89): count=    0, weight=2.561
  Bin [0.89, 0.94): count=    0, weight=2.561
  Bin [0.94, 1.00): count=    0, weight=2.561
-------------------------------------------

  Pred range: [0.0452, 0.4124], std: 0.0610
  RMSE : 0.1006, R2: 0.0003, MAE: 0.0817, Spearman rho: 0.4145, Spearman p: 3.1558e-26, Pearson r: 0.4321, Pearson p: 1.3375e-28
  Pred range: [0.0504, 0.4127], std: 0.0612
  RMSE : 0.1017, R2: -0.0222, MAE: 0.0832, Spearman rho: 0.4353, Spearman p: 4.8216e-29, Pearson r: 0.4536, Pearson p: 1.0816e-31
  Pred range: [0.0396, 0.4065], std: 0.0603
  RMSE : 0.0922, R2: 0.1591, MAE: 0.0739, Spearman rho: 0.4493, Spearman p: 4.6746e-31, Pearson r: 0.4657, Pearson p: 1.6151e-33
  Pred range: [0.0505, 0.4136], std: 0.0606
  RMSE : 0.0959, R2: 0.0918, MAE: 0.0777, Spearman rho: 0.4582, Spearman p: 2.2223e-32, Pearson r: 0.4718, Pearson p: 1.7952e-34
  Pred range: [0.0453, 0.3947], std: 0.0595
  RMSE : 0.0920, R2: 0.1640, MAE: 0.0739, Spearman rho: 0.4630, Spearman p: 4.1240e-33, Pearson r: 0.4770, Pearson p: 2.6357e-35
  Pred range: [0.0536, 0.4052], std: 0.0590
  RMSE : 0.0928, R2: 0.1489, MAE: 0.0746, Spearman rho: 0.4610, Spearman p: 8.5911e-33, Pearson r: 0.4733, Pearson p: 1.0134e-34
[I 2026-04-27 17:44:08,060] Trial 68 pruned. 
Train: 2407 rows (1613 IDs),Test: 598 rows (404 IDs) 

n_features_x : 6, n_features_per_modality: [16, 23, 19, 17, 7, 4, 4, 4, 1, 4]

--- ImbalancedRegressionLoss initialized ---
  Bins: 19, Focal gamma: 1.189435458693814, Base loss: huber
  Bin [0.00, 0.05): count=  650, weight=0.004
  Bin [0.05, 0.11): count=  360, weight=0.007
  Bin [0.11, 0.16): count=  528, weight=0.005
  Bin [0.16, 0.21): count=  338, weight=0.008
  Bin [0.21, 0.26): count=  318, weight=0.008
  Bin [0.26, 0.32): count=  109, weight=0.023
  Bin [0.32, 0.37): count=   50, weight=0.050
  Bin [0.37, 0.42): count=   29, weight=0.085
  Bin [0.42, 0.47): count=    7, weight=0.320
  Bin [0.47, 0.53): count=   10, weight=0.232
  Bin [0.53, 0.58): count=    6, weight=0.365
  Bin [0.58, 0.63): count=    1, weight=1.278
  Bin [0.63, 0.68): count=    0, weight=2.556
  Bin [0.68, 0.74): count=    1, weight=1.278
  Bin [0.74, 0.79): count=    0, weight=2.556
  Bin [0.79, 0.84): count=    0, weight=2.556
  Bin [0.84, 0.89): count=    0, weight=2.556
  Bin [0.89, 0.95): count=    0, weight=2.556
  Bin [0.95, 1.00): count=    0, weight=2.556
-------------------------------------------

  Pred range: [0.0362, 0.3736], std: 0.0514
  RMSE : 0.0985, R2: 0.0407, MAE: 0.0786, Spearman rho: 0.3599, Spearman p: 9.9023e-20, Pearson r: 0.3645, Pearson p: 3.1336e-20
  Pred range: [0.0266, 0.3943], std: 0.0561
  RMSE : 0.0962, R2: 0.0851, MAE: 0.0766, Spearman rho: 0.3986, Spearman p: 3.2586e-24, Pearson r: 0.4059, Pearson p: 3.9844e-25
  Pred range: [0.0146, 0.3702], std: 0.0568
  RMSE : 0.0923, R2: 0.1578, MAE: 0.0728, Spearman rho: 0.4194, Spearman p: 7.1323e-27, Pearson r: 0.4300, Pearson p: 2.6333e-28
  Pred range: [0.0299, 0.4197], std: 0.0619
  RMSE : 0.0984, R2: 0.0433, MAE: 0.0794, Spearman rho: 0.4292, Spearman p: 3.3628e-28, Pearson r: 0.4403, Pearson p: 9.6271e-30
  Pred range: [0.0278, 0.4288], std: 0.0622
  RMSE : 0.0954, R2: 0.1009, MAE: 0.0763, Spearman rho: 0.4365, Spearman p: 3.2464e-29, Pearson r: 0.4463, Pearson p: 1.3201e-30
  Pred range: [0.0206, 0.3857], std: 0.0594
  RMSE : 0.0914, R2: 0.1745, MAE: 0.0725, Spearman rho: 0.4466, Spearman p: 1.1887e-30, Pearson r: 0.4568, Pearson p: 3.6372e-32
[I 2026-04-27 17:45:01,510] Trial 69 pruned. 
Train: 2407 rows (1613 IDs),Test: 598 rows (404 IDs) 

n_features_x : 6, n_features_per_modality: [16, 23, 19, 17, 7, 4, 4, 4, 1, 4]

--- ImbalancedRegressionLoss initialized ---
  Bins: 15, Focal gamma: 2.135124424397355, Base loss: huber
  Bin [0.00, 0.07): count=  828, weight=0.003
  Bin [0.07, 0.13): count=  542, weight=0.005
  Bin [0.13, 0.20): count=  506, weight=0.006
  Bin [0.20, 0.27): count=  318, weight=0.009
  Bin [0.27, 0.33): count=  133, weight=0.021
  Bin [0.33, 0.40): count=   46, weight=0.060
  Bin [0.40, 0.47): count=   16, weight=0.166
  Bin [0.47, 0.53): count=   10, weight=0.256
  Bin [0.53, 0.60): count=    6, weight=0.402
  Bin [0.60, 0.67): count=    1, weight=1.407
  Bin [0.67, 0.73): count=    1, weight=1.407
  Bin [0.73, 0.80): count=    0, weight=2.815
  Bin [0.80, 0.87): count=    0, weight=2.815
  Bin [0.87, 0.93): count=    0, weight=2.815
  Bin [0.93, 1.00): count=    0, weight=2.815
-------------------------------------------

  Pred range: [0.0792, 0.4693], std: 0.0481
  RMSE : 0.1275, R2: -0.6055, MAE: 0.1056, Spearman rho: 0.2637, Spearman p: 5.6653e-11, Pearson r: 0.2394, Pearson p: 3.0521e-09
  Pred range: [0.1012, 0.5047], std: 0.0528
  RMSE : 0.1332, R2: -0.7527, MAE: 0.1120, Spearman rho: 0.3518, Spearman p: 7.3567e-19, Pearson r: 0.3322, Pearson p: 7.1775e-17
  Pred range: [0.0768, 0.4514], std: 0.0520
  RMSE : 0.1131, R2: -0.2643, MAE: 0.0933, Spearman rho: 0.3916, Spearman p: 2.3312e-23, Pearson r: 0.3789, Pearson p: 7.5088e-22
  Pred range: [0.0704, 0.4542], std: 0.0545
  RMSE : 0.1093, R2: -0.1811, MAE: 0.0899, Spearman rho: 0.4106, Spearman p: 1.0025e-25, Pearson r: 0.4029, Pearson p: 9.6412e-25
  Pred range: [0.0802, 0.4912], std: 0.0586
  RMSE : 0.1193, R2: -0.4071, MAE: 0.0990, Spearman rho: 0.4187, Spearman p: 8.8179e-27, Pearson r: 0.4149, Pearson p: 2.7783e-26
  Pred range: [0.0849, 0.5122], std: 0.0621
  RMSE : 0.1272, R2: -0.5977, MAE: 0.1066, Spearman rho: 0.4292, Spearman p: 3.3906e-28, Pearson r: 0.4277, Pearson p: 5.4328e-28
[I 2026-04-27 17:45:11,571] Trial 70 pruned. 
Train: 2407 rows (1613 IDs),Test: 598 rows (404 IDs) 

n_features_x : 6, n_features_per_modality: [16, 23, 19, 17, 7, 4, 4, 4, 1, 4]

--- ImbalancedRegressionLoss initialized ---
  Bins: 17, Focal gamma: 0.9383763468639427, Base loss: huber
  Bin [0.00, 0.06): count=  650, weight=0.004
  Bin [0.06, 0.12): count=  530, weight=0.005
  Bin [0.12, 0.18): count=  536, weight=0.005
  Bin [0.18, 0.24): count=  299, weight=0.009
  Bin [0.24, 0.29): count=  247, weight=0.011
  Bin [0.29, 0.35): count=   91, weight=0.029
  Bin [0.35, 0.41): count=   20, weight=0.127
  Bin [0.41, 0.47): count=   16, weight=0.157
  Bin [0.47, 0.53): count=   10, weight=0.243
  Bin [0.53, 0.59): count=    6, weight=0.382
  Bin [0.59, 0.65): count=    1, weight=1.336
  Bin [0.65, 0.71): count=    1, weight=1.336
  Bin [0.71, 0.76): count=    0, weight=2.671
  Bin [0.76, 0.82): count=    0, weight=2.671
  Bin [0.82, 0.88): count=    0, weight=2.671
  Bin [0.88, 0.94): count=    0, weight=2.671
  Bin [0.94, 1.00): count=    0, weight=2.671
-------------------------------------------

  Pred range: [0.0064, 0.3221], std: 0.0527
  RMSE : 0.0917, R2: 0.1685, MAE: 0.0724, Spearman rho: 0.4188, Spearman p: 8.5664e-27, Pearson r: 0.4272, Pearson p: 6.3978e-28
  Pred range: [0.0372, 0.4175], std: 0.0640
  RMSE : 0.1007, R2: -0.0022, MAE: 0.0817, Spearman rho: 0.4330, Spearman p: 1.0044e-28, Pearson r: 0.4469, Pearson p: 1.0575e-30
  Pred range: [0.0456, 0.4283], std: 0.0635
  RMSE : 0.1013, R2: -0.0146, MAE: 0.0826, Spearman rho: 0.4481, Spearman p: 7.0951e-31, Pearson r: 0.4623, Pearson p: 5.3379e-33
  Pred range: [0.0360, 0.3991], std: 0.0615
  RMSE : 0.0939, R2: 0.1292, MAE: 0.0758, Spearman rho: 0.4594, Spearman p: 1.5032e-32, Pearson r: 0.4752, Pearson p: 5.1126e-35
  Pred range: [0.0323, 0.3800], std: 0.0591
  RMSE : 0.0914, R2: 0.1741, MAE: 0.0734, Spearman rho: 0.4602, Spearman p: 1.1115e-32, Pearson r: 0.4758, Pearson p: 4.0966e-35
  Pred range: [0.0351, 0.3921], std: 0.0615
  RMSE : 0.0929, R2: 0.1467, MAE: 0.0747, Spearman rho: 0.4635, Spearman p: 3.5609e-33, Pearson r: 0.4773, Pearson p: 2.3216e-35
