[I 2026-04-29 00:43:14,212] Trial 31 finished with value: 0.08883835251373487 and parameters: {'learning_rate': 0.0007321690597586578, 'batch_size': 4, 'num_epochs': 13, 'weight_decay': 1.008263154462235e-05, 'layers_PRS': 3, 'layers_SCZ15': 3, 'layers_ADHD9': 2, 'layers_ASD9': 5, 'layers_ACE15': 5, 'layers_ACE18': 1, 'layers_SUD18': 3, 'layers_SES': 4, 'layers_SEX': 1, 'dropout': 0.33596023196992175, 'se_reduction': 3, 'hidden_dim_min': 10, 'base_loss': 'huber', 'huber_delta': 0.03673485077965342, 'focal_gamma': 2.6212417781405595, 'n_bins': 12, 'scheduler_patience': 2, 'scheduler_factor': 0.393399100379595, 'early_stopping_patience': 8}. Best is trial 24 with value: 0.08843051078225092.
Train: 2407 rows (1613 IDs),Test: 598 rows (404 IDs) 

n_features_x : 6, n_features_per_modality: [16, 23, 19, 17, 7, 4, 4, 4, 1, 4]

--- ImbalancedRegressionLoss initialized ---
  Bins: 12, Focal gamma: 2.6030195686778295, Base loss: huber
  Bin [0.00, 0.08): count=  828, weight=0.003
  Bin [0.08, 0.17): count=  710, weight=0.004
  Bin [0.17, 0.25): count=  575, weight=0.005
  Bin [0.25, 0.33): count=  214, weight=0.013
  Bin [0.33, 0.42): count=   55, weight=0.051
  Bin [0.42, 0.50): count=   14, weight=0.191
  Bin [0.50, 0.58): count=    9, weight=0.286
  Bin [0.58, 0.67): count=    1, weight=1.431
  Bin [0.67, 0.75): count=    1, weight=1.431
  Bin [0.75, 0.83): count=    0, weight=2.862
  Bin [0.83, 0.92): count=    0, weight=2.862
  Bin [0.92, 1.00): count=    0, weight=2.862
-------------------------------------------

  Pred range: [0.0376, 0.3187], std: 0.0493
  RMSE : 0.0909, R2: 0.1829, MAE: 0.0726, Spearman rho: 0.4112, Spearman p: 8.5116e-26, Pearson r: 0.4318, Pearson p: 1.4868e-28
  Pred range: [0.0402, 0.3535], std: 0.0565
  RMSE : 0.0903, R2: 0.1941, MAE: 0.0719, Spearman rho: 0.4404, Spearman p: 9.2866e-30, Pearson r: 0.4575, Pearson p: 2.8746e-32
  Pred range: [0.0460, 0.3438], std: 0.0488
  RMSE : 0.0894, R2: 0.2093, MAE: 0.0719, Spearman rho: 0.4541, Spearman p: 9.3483e-32, Pearson r: 0.4673, Pearson p: 9.0289e-34
  Pred range: [0.0572, 0.3762], std: 0.0500
  RMSE : 0.0907, R2: 0.1871, MAE: 0.0734, Spearman rho: 0.4496, Spearman p: 4.3287e-31, Pearson r: 0.4601, Pearson p: 1.1578e-32
  Pred range: [0.0689, 0.4328], std: 0.0596
  RMSE : 0.0973, R2: 0.0643, MAE: 0.0791, Spearman rho: 0.4642, Spearman p: 2.7231e-33, Pearson r: 0.4710, Pearson p: 2.3643e-34
  Pred range: [0.0274, 0.3613], std: 0.0538
  RMSE : 0.0886, R2: 0.2236, MAE: 0.0702, Spearman rho: 0.4686, Spearman p: 5.6563e-34, Pearson r: 0.4765, Pearson p: 3.2067e-35
  Pred range: [0.0298, 0.3992], std: 0.0549
  RMSE : 0.0903, R2: 0.1941, MAE: 0.0727, Spearman rho: 0.4695, Spearman p: 4.1495e-34, Pearson r: 0.4755, Pearson p: 4.5539e-35
  Pred range: [0.0346, 0.3566], std: 0.0514
  RMSE : 0.0883, R2: 0.2288, MAE: 0.0702, Spearman rho: 0.4725, Spearman p: 1.3700e-34, Pearson r: 0.4794, Pearson p: 1.0675e-35
  Pred range: [0.0387, 0.3900], std: 0.0528
  RMSE : 0.0893, R2: 0.2116, MAE: 0.0715, Spearman rho: 0.4658, Spearman p: 1.5353e-33, Pearson r: 0.4708, Pearson p: 2.5976e-34
  Pred range: [0.0487, 0.3822], std: 0.0557
  RMSE : 0.0905, R2: 0.1908, MAE: 0.0725, Spearman rho: 0.4682, Spearman p: 6.5958e-34, Pearson r: 0.4771, Pearson p: 2.5601e-35
  Pred range: [0.0369, 0.4063], std: 0.0581
  RMSE : 0.0899, R2: 0.2006, MAE: 0.0717, Spearman rho: 0.4709, Spearman p: 2.4441e-34, Pearson r: 0.4792, Pearson p: 1.1479e-35
  Pred range: [0.0335, 0.3951], std: 0.0554
  RMSE : 0.0893, R2: 0.2114, MAE: 0.0712, Spearman rho: 0.4629, Spearman p: 4.3445e-33, Pearson r: 0.4730, Pearson p: 1.1489e-34
  Pred range: [0.0456, 0.3976], std: 0.0554
  RMSE : 0.0900, R2: 0.1989, MAE: 0.0720, Spearman rho: 0.4644, Spearman p: 2.5375e-33, Pearson r: 0.4746, Pearson p: 6.4438e-35
[I 2026-04-29 00:45:15,607] Trial 32 finished with value: 0.08834048484537571 and parameters: {'learning_rate': 0.00025407408631575654, 'batch_size': 4, 'num_epochs': 13, 'weight_decay': 1.0800833841975412e-05, 'layers_PRS': 3, 'layers_SCZ15': 4, 'layers_ADHD9': 2, 'layers_ASD9': 4, 'layers_ACE15': 5, 'layers_ACE18': 1, 'layers_SUD18': 3, 'layers_SES': 4, 'layers_SEX': 3, 'dropout': 0.3677896656588006, 'se_reduction': 3, 'hidden_dim_min': 9, 'base_loss': 'huber', 'huber_delta': 0.04279091199116786, 'focal_gamma': 2.6030195686778295, 'n_bins': 12, 'scheduler_patience': 2, 'scheduler_factor': 0.3803194724299379, 'early_stopping_patience': 8}. Best is trial 32 with value: 0.08834048484537571.
Train: 2407 rows (1613 IDs),Test: 598 rows (404 IDs) 

n_features_x : 6, n_features_per_modality: [16, 23, 19, 17, 7, 4, 4, 4, 1, 4]

--- ImbalancedRegressionLoss initialized ---
  Bins: 13, Focal gamma: 2.4943817414446428, Base loss: huber
  Bin [0.00, 0.08): count=  828, weight=0.003
  Bin [0.08, 0.15): count=  710, weight=0.004
  Bin [0.15, 0.23): count=  477, weight=0.006
  Bin [0.23, 0.31): count=  288, weight=0.009
  Bin [0.31, 0.38): count=   63, weight=0.042
  Bin [0.38, 0.46): count=   23, weight=0.113
  Bin [0.46, 0.54): count=   10, weight=0.247
  Bin [0.54, 0.62): count=    7, weight=0.340
  Bin [0.62, 0.69): count=    0, weight=2.719
  Bin [0.69, 0.77): count=    1, weight=1.359
  Bin [0.77, 0.85): count=    0, weight=2.719
  Bin [0.85, 0.92): count=    0, weight=2.719
  Bin [0.92, 1.00): count=    0, weight=2.719
-------------------------------------------

  Pred range: [0.0741, 0.4169], std: 0.0480
  RMSE : 0.0961, R2: 0.0879, MAE: 0.0776, Spearman rho: 0.3877, Spearman p: 6.8872e-23, Pearson r: 0.4030, Pearson p: 9.1743e-25
  Pred range: [0.0722, 0.4450], std: 0.0553
  RMSE : 0.0964, R2: 0.0809, MAE: 0.0780, Spearman rho: 0.4344, Spearman p: 6.4961e-29, Pearson r: 0.4422, Pearson p: 5.0894e-30
  Pred range: [0.0660, 0.4255], std: 0.0555
  RMSE : 0.0931, R2: 0.1426, MAE: 0.0749, Spearman rho: 0.4487, Spearman p: 5.7374e-31, Pearson r: 0.4569, Pearson p: 3.5467e-32
  Pred range: [0.0770, 0.3949], std: 0.0517
  RMSE : 0.0947, R2: 0.1138, MAE: 0.0770, Spearman rho: 0.4631, Spearman p: 4.0320e-33, Pearson r: 0.4642, Pearson p: 2.7216e-33
  Pred range: [0.0546, 0.3640], std: 0.0518
  RMSE : 0.0900, R2: 0.1995, MAE: 0.0719, Spearman rho: 0.4649, Spearman p: 2.1270e-33, Pearson r: 0.4689, Pearson p: 5.0303e-34
  Pred range: [0.0722, 0.4225], std: 0.0554
  RMSE : 0.0971, R2: 0.0689, MAE: 0.0789, Spearman rho: 0.4642, Spearman p: 2.7730e-33, Pearson r: 0.4671, Pearson p: 9.7846e-34
  Pred range: [0.0609, 0.4298], std: 0.0572
  RMSE : 0.0942, R2: 0.1239, MAE: 0.0758, Spearman rho: 0.4666, Spearman p: 1.1759e-33, Pearson r: 0.4688, Pearson p: 5.2299e-34
  Pred range: [0.0428, 0.3977], std: 0.0561
  RMSE : 0.0900, R2: 0.2001, MAE: 0.0713, Spearman rho: 0.4635, Spearman p: 3.4978e-33, Pearson r: 0.4664, Pearson p: 1.2470e-33
  Pred range: [0.0602, 0.3959], std: 0.0521
  RMSE : 0.0932, R2: 0.1411, MAE: 0.0755, Spearman rho: 0.4717, Spearman p: 1.8463e-34, Pearson r: 0.4712, Pearson p: 2.2472e-34
  Pred range: [0.0458, 0.4224], std: 0.0553
  RMSE : 0.0933, R2: 0.1392, MAE: 0.0751, Spearman rho: 0.4697, Spearman p: 3.7624e-34, Pearson r: 0.4674, Pearson p: 8.8482e-34
[I 2026-04-29 00:46:06,281] Trial 33 finished with value: 0.08997129115702635 and parameters: {'learning_rate': 0.0002643615484666999, 'batch_size': 8, 'num_epochs': 10, 'weight_decay': 1.859670753397455e-05, 'layers_PRS': 4, 'layers_SCZ15': 4, 'layers_ADHD9': 3, 'layers_ASD9': 3, 'layers_ACE15': 5, 'layers_ACE18': 2, 'layers_SUD18': 3, 'layers_SES': 3, 'layers_SEX': 3, 'dropout': 0.3754837483560075, 'se_reduction': 3, 'hidden_dim_min': 9, 'base_loss': 'huber', 'huber_delta': 0.053890153720186476, 'focal_gamma': 2.4943817414446428, 'n_bins': 13, 'scheduler_patience': 2, 'scheduler_factor': 0.35863351795298615, 'early_stopping_patience': 8}. Best is trial 32 with value: 0.08834048484537571.
Train: 2407 rows (1613 IDs),Test: 598 rows (404 IDs) 

n_features_x : 6, n_features_per_modality: [16, 23, 19, 17, 7, 4, 4, 4, 1, 4]

--- ImbalancedRegressionLoss initialized ---
  Bins: 11, Focal gamma: 1.937521850814192, Base loss: huber
  Bin [0.00, 0.09): count= 1010, weight=0.003
  Bin [0.09, 0.18): count=  706, weight=0.004
  Bin [0.18, 0.27): count=  478, weight=0.006
  Bin [0.27, 0.36): count=  159, weight=0.018
  Bin [0.36, 0.45): count=   33, weight=0.085
  Bin [0.45, 0.55): count=   16, weight=0.170
  Bin [0.55, 0.64): count=    4, weight=0.579
  Bin [0.64, 0.73): count=    1, weight=1.448
  Bin [0.73, 0.82): count=    0, weight=2.896
  Bin [0.82, 0.91): count=    0, weight=2.896
  Bin [0.91, 1.00): count=    0, weight=2.896
-------------------------------------------

  Pred range: [0.0253, 0.4012], std: 0.0525
  RMSE : 0.0954, R2: 0.1000, MAE: 0.0760, Spearman rho: 0.3478, Spearman p: 1.9095e-18, Pearson r: 0.3594, Pearson p: 1.1291e-19
  Pred range: [0.0386, 0.4083], std: 0.0548
  RMSE : 0.0959, R2: 0.0918, MAE: 0.0771, Spearman rho: 0.3805, Spearman p: 4.8571e-22, Pearson r: 0.3883, Pearson p: 5.8488e-23
  Pred range: [0.0439, 0.3967], std: 0.0540
  RMSE : 0.0946, R2: 0.1149, MAE: 0.0761, Spearman rho: 0.4038, Spearman p: 7.3000e-25, Pearson r: 0.4089, Pearson p: 1.6843e-25
  Pred range: [0.0500, 0.3812], std: 0.0531
  RMSE : 0.0940, R2: 0.1269, MAE: 0.0757, Spearman rho: 0.4179, Spearman p: 1.1314e-26, Pearson r: 0.4234, Pearson p: 2.0768e-27
  Pred range: [0.0498, 0.3539], std: 0.0508
  RMSE : 0.0920, R2: 0.1643, MAE: 0.0739, Spearman rho: 0.4262, Spearman p: 8.6885e-28, Pearson r: 0.4331, Pearson p: 9.6839e-29
  Pred range: [0.0572, 0.3703], std: 0.0544
  RMSE : 0.0937, R2: 0.1322, MAE: 0.0754, Spearman rho: 0.4336, Spearman p: 8.4072e-29, Pearson r: 0.4401, Pearson p: 1.0243e-29
  Pred range: [0.0525, 0.3546], std: 0.0529
  RMSE : 0.0914, R2: 0.1740, MAE: 0.0734, Spearman rho: 0.4406, Spearman p: 8.5638e-30, Pearson r: 0.4477, Pearson p: 8.0289e-31
  Pred range: [0.0589, 0.3619], std: 0.0533
  RMSE : 0.0923, R2: 0.1574, MAE: 0.0743, Spearman rho: 0.4452, Spearman p: 1.8567e-30, Pearson r: 0.4525, Pearson p: 1.5963e-31
  Pred range: [0.0510, 0.3370], std: 0.0517
  RMSE : 0.0901, R2: 0.1979, MAE: 0.0719, Spearman rho: 0.4490, Spearman p: 5.2118e-31, Pearson r: 0.4548, Pearson p: 7.2132e-32
  Pred range: [0.0521, 0.3553], std: 0.0539
  RMSE : 0.0907, R2: 0.1866, MAE: 0.0726, Spearman rho: 0.4500, Spearman p: 3.6972e-31, Pearson r: 0.4556, Pearson p: 5.6132e-32
  Pred range: [0.0473, 0.3508], std: 0.0527
  RMSE : 0.0899, R2: 0.2018, MAE: 0.0717, Spearman rho: 0.4542, Spearman p: 9.0942e-32, Pearson r: 0.4621, Pearson p: 5.8170e-33
  Pred range: [0.0500, 0.3680], std: 0.0546
  RMSE : 0.0905, R2: 0.1899, MAE: 0.0724, Spearman rho: 0.4557, Spearman p: 5.2976e-32, Pearson r: 0.4621, Pearson p: 5.8155e-33
[I 2026-04-29 00:48:01,826] Trial 34 finished with value: 0.08987737109487907 and parameters: {'learning_rate': 7.99555180328653e-05, 'batch_size': 4, 'num_epochs': 12, 'weight_decay': 2.3311135974699393e-05, 'layers_PRS': 3, 'layers_SCZ15': 4, 'layers_ADHD9': 2, 'layers_ASD9': 4, 'layers_ACE15': 5, 'layers_ACE18': 1, 'layers_SUD18': 4, 'layers_SES': 4, 'layers_SEX': 4, 'dropout': 0.2778967162113655, 'se_reduction': 4, 'hidden_dim_min': 7, 'base_loss': 'huber', 'huber_delta': 0.07840785755614448, 'focal_gamma': 1.937521850814192, 'n_bins': 11, 'scheduler_patience': 2, 'scheduler_factor': 0.3046301615544895, 'early_stopping_patience': 8}. Best is trial 32 with value: 0.08834048484537571.
Train: 2407 rows (1613 IDs),Test: 598 rows (404 IDs) 

n_features_x : 6, n_features_per_modality: [16, 23, 19, 17, 7, 4, 4, 4, 1, 4]

--- ImbalancedRegressionLoss initialized ---
  Bins: 15, Focal gamma: 2.6530586071248674, Base loss: mse
  Bin [0.00, 0.07): count=  828, weight=0.003
  Bin [0.07, 0.13): count=  542, weight=0.005
  Bin [0.13, 0.20): count=  506, weight=0.006
  Bin [0.20, 0.27): count=  318, weight=0.009
  Bin [0.27, 0.33): count=  133, weight=0.021
  Bin [0.33, 0.40): count=   46, weight=0.060
  Bin [0.40, 0.47): count=   16, weight=0.166
  Bin [0.47, 0.53): count=   10, weight=0.256
  Bin [0.53, 0.60): count=    6, weight=0.402
  Bin [0.60, 0.67): count=    1, weight=1.407
  Bin [0.67, 0.73): count=    1, weight=1.407
  Bin [0.73, 0.80): count=    0, weight=2.815
  Bin [0.80, 0.87): count=    0, weight=2.815
  Bin [0.87, 0.93): count=    0, weight=2.815
  Bin [0.93, 1.00): count=    0, weight=2.815
-------------------------------------------

  Pred range: [0.0255, 0.2900], std: 0.0454
  RMSE : 0.0921, R2: 0.1620, MAE: 0.0735, Spearman rho: 0.3953, Spearman p: 8.3018e-24, Pearson r: 0.4101, Pearson p: 1.1788e-25
  Pred range: [0.0615, 0.3537], std: 0.0512
  RMSE : 0.0923, R2: 0.1575, MAE: 0.0745, Spearman rho: 0.4333, Spearman p: 9.2693e-29, Pearson r: 0.4417, Pearson p: 6.0019e-30
  Pred range: [0.0602, 0.3668], std: 0.0494
  RMSE : 0.0939, R2: 0.1293, MAE: 0.0761, Spearman rho: 0.4417, Spearman p: 5.9517e-30, Pearson r: 0.4487, Pearson p: 5.8263e-31
  Pred range: [0.0555, 0.3838], std: 0.0481
  RMSE : 0.0957, R2: 0.0950, MAE: 0.0780, Spearman rho: 0.4487, Spearman p: 5.7456e-31, Pearson r: 0.4552, Pearson p: 6.4291e-32
  Pred range: [0.0493, 0.3901], std: 0.0499
  RMSE : 0.0943, R2: 0.1209, MAE: 0.0767, Spearman rho: 0.4576, Spearman p: 2.7238e-32, Pearson r: 0.4622, Pearson p: 5.5679e-33
  Pred range: [0.0426, 0.3778], std: 0.0484
  RMSE : 0.0923, R2: 0.1575, MAE: 0.0748, Spearman rho: 0.4572, Spearman p: 3.2320e-32, Pearson r: 0.4615, Pearson p: 7.0379e-33
  Pred range: [0.0335, 0.3645], std: 0.0494
  RMSE : 0.0899, R2: 0.2013, MAE: 0.0722, Spearman rho: 0.4558, Spearman p: 5.2198e-32, Pearson r: 0.4601, Pearson p: 1.1562e-32
  Pred range: [0.0338, 0.3703], std: 0.0492
  RMSE : 0.0907, R2: 0.1869, MAE: 0.0731, Spearman rho: 0.4474, Spearman p: 8.8920e-31, Pearson r: 0.4547, Pearson p: 7.5613e-32
  Pred range: [0.0424, 0.3784], std: 0.0487
  RMSE : 0.0919, R2: 0.1655, MAE: 0.0745, Spearman rho: 0.4459, Spearman p: 1.4709e-30, Pearson r: 0.4550, Pearson p: 6.8939e-32
  Pred range: [0.0461, 0.3992], std: 0.0501
  RMSE : 0.0943, R2: 0.1214, MAE: 0.0766, Spearman rho: 0.4548, Spearman p: 7.3543e-32, Pearson r: 0.4607, Pearson p: 9.3388e-33
  Pred range: [0.0298, 0.3746], std: 0.0485
  RMSE : 0.0906, R2: 0.1886, MAE: 0.0730, Spearman rho: 0.4502, Spearman p: 3.4614e-31, Pearson r: 0.4584, Pearson p: 2.1087e-32
  Pred range: [0.0310, 0.3762], std: 0.0493
  RMSE : 0.0909, R2: 0.1839, MAE: 0.0732, Spearman rho: 0.4481, Spearman p: 7.2371e-31, Pearson r: 0.4555, Pearson p: 5.6654e-32
  Pred range: [0.0271, 0.3772], std: 0.0504
  RMSE : 0.0909, R2: 0.1838, MAE: 0.0732, Spearman rho: 0.4477, Spearman p: 8.2132e-31, Pearson r: 0.4557, Pearson p: 5.3078e-32
[I 2026-04-29 00:50:08,070] Trial 35 finished with value: 0.08990047571403274 and parameters: {'learning_rate': 0.0004031245720330017, 'batch_size': 4, 'num_epochs': 13, 'weight_decay': 4.347765204280365e-05, 'layers_PRS': 5, 'layers_SCZ15': 5, 'layers_ADHD9': 2, 'layers_ASD9': 4, 'layers_ACE15': 5, 'layers_ACE18': 2, 'layers_SUD18': 3, 'layers_SES': 2, 'layers_SEX': 3, 'dropout': 0.32941155617100865, 'se_reduction': 5, 'hidden_dim_min': 12, 'base_loss': 'mse', 'huber_delta': 0.09422665541106984, 'focal_gamma': 2.6530586071248674, 'n_bins': 15, 'scheduler_patience': 2, 'scheduler_factor': 0.428418427694922, 'early_stopping_patience': 8}. Best is trial 32 with value: 0.08834048484537571.
Train: 2407 rows (1613 IDs),Test: 598 rows (404 IDs) 

n_features_x : 6, n_features_per_modality: [16, 23, 19, 17, 7, 4, 4, 4, 1, 4]

--- ImbalancedRegressionLoss initialized ---
  Bins: 12, Focal gamma: 2.955971301282022, Base loss: huber
  Bin [0.00, 0.08): count=  828, weight=0.003
  Bin [0.08, 0.17): count=  710, weight=0.004
  Bin [0.17, 0.25): count=  575, weight=0.005
  Bin [0.25, 0.33): count=  214, weight=0.013
  Bin [0.33, 0.42): count=   55, weight=0.051
  Bin [0.42, 0.50): count=   14, weight=0.191
  Bin [0.50, 0.58): count=    9, weight=0.286
  Bin [0.58, 0.67): count=    1, weight=1.431
  Bin [0.67, 0.75): count=    1, weight=1.431
  Bin [0.75, 0.83): count=    0, weight=2.862
  Bin [0.83, 0.92): count=    0, weight=2.862
  Bin [0.92, 1.00): count=    0, weight=2.862
-------------------------------------------

  Pred range: [0.0531, 0.5316], std: 0.0740
  RMSE : 0.1204, R2: -0.4320, MAE: 0.0982, Spearman rho: 0.3548, Spearman p: 3.5247e-19, Pearson r: 0.3622, Pearson p: 5.5642e-20
  Pred range: [0.0505, 0.4534], std: 0.0668
  RMSE : 0.1093, R2: -0.1806, MAE: 0.0891, Spearman rho: 0.3708, Spearman p: 6.2690e-21, Pearson r: 0.3819, Pearson p: 3.3335e-22
  Pred range: [0.0566, 0.4255], std: 0.0620
  RMSE : 0.1058, R2: -0.1069, MAE: 0.0867, Spearman rho: 0.3783, Spearman p: 8.7140e-22, Pearson r: 0.3941, Pearson p: 1.1612e-23
  Pred range: [0.0594, 0.4261], std: 0.0619
  RMSE : 0.1049, R2: -0.0878, MAE: 0.0861, Spearman rho: 0.3892, Spearman p: 4.5934e-23, Pearson r: 0.4068, Pearson p: 3.0876e-25
  Pred range: [0.0628, 0.4121], std: 0.0615
  RMSE : 0.1040, R2: -0.0695, MAE: 0.0855, Spearman rho: 0.3982, Spearman p: 3.6696e-24, Pearson r: 0.4182, Pearson p: 1.0267e-26
  Pred range: [0.0750, 0.4088], std: 0.0599
  RMSE : 0.1086, R2: -0.1660, MAE: 0.0898, Spearman rho: 0.4016, Spearman p: 1.3974e-24, Pearson r: 0.4221, Pearson p: 3.0571e-27
[I 2026-04-29 00:50:16,362] Trial 36 pruned. 
Train: 2407 rows (1613 IDs),Test: 598 rows (404 IDs) 

n_features_x : 6, n_features_per_modality: [16, 23, 19, 17, 7, 4, 4, 4, 1, 4]

--- ImbalancedRegressionLoss initialized ---
  Bins: 17, Focal gamma: 2.3928947105917167, Base loss: mse
  Bin [0.00, 0.06): count=  650, weight=0.004
  Bin [0.06, 0.12): count=  530, weight=0.005
  Bin [0.12, 0.18): count=  536, weight=0.005
  Bin [0.18, 0.24): count=  299, weight=0.009
  Bin [0.24, 0.29): count=  247, weight=0.011
  Bin [0.29, 0.35): count=   91, weight=0.029
  Bin [0.35, 0.41): count=   20, weight=0.127
  Bin [0.41, 0.47): count=   16, weight=0.157
  Bin [0.47, 0.53): count=   10, weight=0.243
  Bin [0.53, 0.59): count=    6, weight=0.382
  Bin [0.59, 0.65): count=    1, weight=1.336
  Bin [0.65, 0.71): count=    1, weight=1.336
  Bin [0.71, 0.76): count=    0, weight=2.671
  Bin [0.76, 0.82): count=    0, weight=2.671
  Bin [0.82, 0.88): count=    0, weight=2.671
  Bin [0.88, 0.94): count=    0, weight=2.671
  Bin [0.94, 1.00): count=    0, weight=2.671
-------------------------------------------

  Pred range: [0.0362, 0.3267], std: 0.0542
  RMSE : 0.1009, R2: -0.0056, MAE: 0.0798, Spearman rho: 0.2865, Spearman p: 9.2658e-13, Pearson r: 0.2895, Pearson p: 5.1692e-13
  Pred range: [0.0473, 0.3385], std: 0.0512
  RMSE : 0.0964, R2: 0.0813, MAE: 0.0764, Spearman rho: 0.3536, Spearman p: 4.6689e-19, Pearson r: 0.3589, Pearson p: 1.2885e-19
  Pred range: [0.0547, 0.3526], std: 0.0494
  RMSE : 0.0953, R2: 0.1023, MAE: 0.0761, Spearman rho: 0.3903, Spearman p: 3.4032e-23, Pearson r: 0.3976, Pearson p: 4.3765e-24
  Pred range: [0.0588, 0.3653], std: 0.0507
  RMSE : 0.0938, R2: 0.1312, MAE: 0.0748, Spearman rho: 0.4182, Spearman p: 1.0295e-26, Pearson r: 0.4255, Pearson p: 1.0643e-27
  Pred range: [0.0568, 0.3713], std: 0.0502
  RMSE : 0.0937, R2: 0.1325, MAE: 0.0750, Spearman rho: 0.4288, Spearman p: 3.7935e-28, Pearson r: 0.4355, Pearson p: 4.4879e-29
  Pred range: [0.0343, 0.3380], std: 0.0481
  RMSE : 0.0898, R2: 0.2032, MAE: 0.0706, Spearman rho: 0.4466, Spearman p: 1.1669e-30, Pearson r: 0.4515, Pearson p: 2.2206e-31
  Pred range: [0.0482, 0.3629], std: 0.0504
  RMSE : 0.0912, R2: 0.1784, MAE: 0.0725, Spearman rho: 0.4485, Spearman p: 6.1325e-31, Pearson r: 0.4530, Pearson p: 1.3649e-31
  Pred range: [0.0480, 0.3729], std: 0.0498
  RMSE : 0.0917, R2: 0.1686, MAE: 0.0732, Spearman rho: 0.4491, Spearman p: 5.0804e-31, Pearson r: 0.4535, Pearson p: 1.1275e-31
  Pred range: [0.0401, 0.3562], std: 0.0500
  RMSE : 0.0899, R2: 0.2007, MAE: 0.0712, Spearman rho: 0.4548, Spearman p: 7.3941e-32, Pearson r: 0.4596, Pearson p: 1.3794e-32
  Pred range: [0.0388, 0.3640], std: 0.0489
  RMSE : 0.0902, R2: 0.1966, MAE: 0.0718, Spearman rho: 0.4579, Spearman p: 2.5282e-32, Pearson r: 0.4622, Pearson p: 5.5443e-33
  Pred range: [0.0467, 0.3820], std: 0.0502
  RMSE : 0.0921, R2: 0.1615, MAE: 0.0739, Spearman rho: 0.4569, Spearman p: 3.4905e-32, Pearson r: 0.4614, Pearson p: 7.4295e-33
  Pred range: [0.0356, 0.3687], std: 0.0488
  RMSE : 0.0900, R2: 0.2003, MAE: 0.0715, Spearman rho: 0.4594, Spearman p: 1.4722e-32, Pearson r: 0.4636, Pearson p: 3.3383e-33
  Pred range: [0.0462, 0.3915], std: 0.0506
  RMSE : 0.0923, R2: 0.1590, MAE: 0.0741, Spearman rho: 0.4575, Spearman p: 2.9120e-32, Pearson r: 0.4618, Pearson p: 6.2978e-33
  Pred range: [0.0456, 0.3872], std: 0.0503
  RMSE : 0.0916, R2: 0.1702, MAE: 0.0734, Spearman rho: 0.4572, Spearman p: 3.2086e-32, Pearson r: 0.4613, Pearson p: 7.5693e-33
