[I 2026-04-29 00:10:19,097] Trial 5 finished with value: 0.09420717051980118 and parameters: {'learning_rate': 0.008612851997339186, 'batch_size': 32, 'num_epochs': 10, 'weight_decay': 1.5201407920859474e-05, 'layers_PRS': 4, 'layers_SCZ15': 2, 'layers_ADHD9': 4, 'layers_ASD9': 2, 'layers_ACE15': 3, 'layers_ACE18': 2, 'layers_SUD18': 3, 'layers_SES': 4, 'layers_SEX': 1, 'dropout': 0.1679893981928, 'se_reduction': 8, 'hidden_dim_min': 9, 'base_loss': 'mse', 'huber_delta': 0.1464260897676858, 'focal_gamma': 2.8165219383656472, 'n_bins': 15, 'scheduler_patience': 5, 'scheduler_factor': 0.6231643460726843, 'early_stopping_patience': 4}. Best is trial 4 with value: 0.08917975215600402.
Train: 2407 rows (1613 IDs),Test: 598 rows (404 IDs) 

n_features_x : 6, n_features_per_modality: [16, 23, 19, 17, 7, 4, 4, 4, 1, 4]

--- ImbalancedRegressionLoss initialized ---
  Bins: 6, Focal gamma: 2.1879578238144557, Base loss: mse
  Bin [0.00, 0.17): count= 1538, weight=0.002
  Bin [0.17, 0.33): count=  789, weight=0.005
  Bin [0.33, 0.50): count=   69, weight=0.053
  Bin [0.50, 0.67): count=   10, weight=0.339
  Bin [0.67, 0.83): count=    1, weight=1.867
  Bin [0.83, 1.00): count=    0, weight=3.733
-------------------------------------------

  Pred range: [-0.1481, 0.2538], std: 0.0534
  RMSE : 0.1435, R2: -1.0347, MAE: 0.1115, Spearman rho: 0.0839, Spearman p: 4.0281e-02, Pearson r: 0.1087, Pearson p: 7.7941e-03
  Pred range: [-0.0847, 0.3330], std: 0.0581
  RMSE : 0.1144, R2: -0.2938, MAE: 0.0889, Spearman rho: 0.1274, Spearman p: 1.8017e-03, Pearson r: 0.1522, Pearson p: 1.8745e-04
  Pred range: [-0.0378, 0.3894], std: 0.0623
  RMSE : 0.1084, R2: -0.1607, MAE: 0.0858, Spearman rho: 0.1585, Spearman p: 9.9322e-05, Pearson r: 0.1813, Pearson p: 8.1394e-06
  Pred range: [-0.0079, 0.4211], std: 0.0650
  RMSE : 0.1120, R2: -0.2389, MAE: 0.0891, Spearman rho: 0.1789, Spearman p: 1.0714e-05, Pearson r: 0.1988, Pearson p: 9.5491e-07
  Pred range: [0.0029, 0.4291], std: 0.0651
  RMSE : 0.1133, R2: -0.2689, MAE: 0.0905, Spearman rho: 0.1908, Spearman p: 2.6149e-06, Pearson r: 0.2090, Pearson p: 2.5076e-07
  Pred range: [0.0100, 0.4322], std: 0.0646
  RMSE : 0.1136, R2: -0.2751, MAE: 0.0909, Spearman rho: 0.2011, Spearman p: 7.1010e-07, Pearson r: 0.2185, Pearson p: 6.7860e-08
[I 2026-04-29 00:10:32,186] Trial 6 pruned. 
Train: 2407 rows (1613 IDs),Test: 598 rows (404 IDs) 

n_features_x : 6, n_features_per_modality: [16, 23, 19, 17, 7, 4, 4, 4, 1, 4]

--- ImbalancedRegressionLoss initialized ---
  Bins: 18, Focal gamma: 0.7660530963939228, Base loss: mse
  Bin [0.00, 0.06): count=  650, weight=0.004
  Bin [0.06, 0.11): count=  530, weight=0.005
  Bin [0.11, 0.17): count=  358, weight=0.007
  Bin [0.17, 0.22): count=  477, weight=0.005
  Bin [0.22, 0.28): count=  179, weight=0.014
  Bin [0.28, 0.33): count=  133, weight=0.019
  Bin [0.33, 0.39): count=   39, weight=0.064
  Bin [0.39, 0.44): count=   20, weight=0.122
  Bin [0.44, 0.50): count=   10, weight=0.233
  Bin [0.50, 0.56): count=    6, weight=0.366
  Bin [0.56, 0.61): count=    4, weight=0.512
  Bin [0.61, 0.67): count=    0, weight=2.561
  Bin [0.67, 0.72): count=    1, weight=1.281
  Bin [0.72, 0.78): count=    0, weight=2.561
  Bin [0.78, 0.83): count=    0, weight=2.561
  Bin [0.83, 0.89): count=    0, weight=2.561
  Bin [0.89, 0.94): count=    0, weight=2.561
  Bin [0.94, 1.00): count=    0, weight=2.561
-------------------------------------------

  Pred range: [0.0607, 0.3627], std: 0.0516
  RMSE : 0.0973, R2: 0.0644, MAE: 0.0789, Spearman rho: 0.4107, Spearman p: 9.6662e-26, Pearson r: 0.4180, Pearson p: 1.0993e-26
  Pred range: [0.0500, 0.3220], std: 0.0492
  RMSE : 0.0912, R2: 0.1789, MAE: 0.0730, Spearman rho: 0.4401, Spearman p: 1.0135e-29, Pearson r: 0.4458, Pearson p: 1.5554e-30
  Pred range: [0.0609, 0.4205], std: 0.0596
  RMSE : 0.0999, R2: 0.0131, MAE: 0.0813, Spearman rho: 0.4414, Spearman p: 6.5204e-30, Pearson r: 0.4487, Pearson p: 5.8406e-31
  Pred range: [0.0573, 0.3946], std: 0.0561
  RMSE : 0.0961, R2: 0.0882, MAE: 0.0777, Spearman rho: 0.4452, Spearman p: 1.8829e-30, Pearson r: 0.4539, Pearson p: 9.8894e-32
  Pred range: [0.0586, 0.3960], std: 0.0542
  RMSE : 0.0950, R2: 0.1090, MAE: 0.0770, Spearman rho: 0.4463, Spearman p: 1.2868e-30, Pearson r: 0.4555, Pearson p: 5.7801e-32
  Pred range: [0.0713, 0.4109], std: 0.0552
  RMSE : 0.1015, R2: -0.0182, MAE: 0.0828, Spearman rho: 0.4382, Spearman p: 1.8803e-29, Pearson r: 0.4482, Pearson p: 6.9881e-31
  Pred range: [0.0621, 0.4070], std: 0.0567
  RMSE : 0.0985, R2: 0.0419, MAE: 0.0801, Spearman rho: 0.4446, Spearman p: 2.2899e-30, Pearson r: 0.4522, Pearson p: 1.7860e-31
  Pred range: [0.0588, 0.4078], std: 0.0564
  RMSE : 0.0973, R2: 0.0648, MAE: 0.0790, Spearman rho: 0.4451, Spearman p: 1.9358e-30, Pearson r: 0.4529, Pearson p: 1.4186e-31
  Pred range: [0.0600, 0.4181], std: 0.0561
  RMSE : 0.0993, R2: 0.0259, MAE: 0.0810, Spearman rho: 0.4462, Spearman p: 1.3406e-30, Pearson r: 0.4553, Pearson p: 6.1193e-32
  Pred range: [0.0531, 0.4147], std: 0.0554
  RMSE : 0.0977, R2: 0.0573, MAE: 0.0796, Spearman rho: 0.4430, Spearman p: 3.8692e-30, Pearson r: 0.4531, Pearson p: 1.2908e-31
[I 2026-04-29 00:11:46,909] Trial 7 finished with value: 0.09115277218518743 and parameters: {'learning_rate': 0.000410978404185777, 'batch_size': 6, 'num_epochs': 27, 'weight_decay': 0.00035758627613384725, 'layers_PRS': 5, 'layers_SCZ15': 5, 'layers_ADHD9': 5, 'layers_ASD9': 1, 'layers_ACE15': 5, 'layers_ACE18': 4, 'layers_SUD18': 5, 'layers_SES': 1, 'layers_SEX': 4, 'dropout': 0.10068463845231874, 'se_reduction': 6, 'hidden_dim_min': 15, 'base_loss': 'mse', 'huber_delta': 0.08455354140808154, 'focal_gamma': 0.7660530963939228, 'n_bins': 18, 'scheduler_patience': 4, 'scheduler_factor': 0.5591768232464863, 'early_stopping_patience': 8}. Best is trial 4 with value: 0.08917975215600402.
Train: 2407 rows (1613 IDs),Test: 598 rows (404 IDs) 

n_features_x : 6, n_features_per_modality: [16, 23, 19, 17, 7, 4, 4, 4, 1, 4]

--- ImbalancedRegressionLoss initialized ---
  Bins: 11, Focal gamma: 1.0883023970370598, Base loss: mse
  Bin [0.00, 0.09): count= 1010, weight=0.003
  Bin [0.09, 0.18): count=  706, weight=0.004
  Bin [0.18, 0.27): count=  478, weight=0.006
  Bin [0.27, 0.36): count=  159, weight=0.018
  Bin [0.36, 0.45): count=   33, weight=0.085
  Bin [0.45, 0.55): count=   16, weight=0.170
  Bin [0.55, 0.64): count=    4, weight=0.579
  Bin [0.64, 0.73): count=    1, weight=1.448
  Bin [0.73, 0.82): count=    0, weight=2.896
  Bin [0.82, 0.91): count=    0, weight=2.896
  Bin [0.91, 1.00): count=    0, weight=2.896
-------------------------------------------

  Pred range: [0.0302, 0.4096], std: 0.0586
  RMSE : 0.0993, R2: 0.0258, MAE: 0.0800, Spearman rho: 0.4083, Spearman p: 1.9785e-25, Pearson r: 0.4217, Pearson p: 3.4699e-27
  Pred range: [-0.0844, 0.4378], std: 0.0618
  RMSE : 0.1086, R2: -0.1654, MAE: 0.0905, Spearman rho: 0.3950, Spearman p: 9.0904e-24, Pearson r: 0.4059, Pearson p: 3.9518e-25
  Pred range: [0.0222, 0.4200], std: 0.0568
  RMSE : 0.1004, R2: 0.0047, MAE: 0.0813, Spearman rho: 0.3833, Spearman p: 2.2755e-22, Pearson r: 0.3877, Pearson p: 7.0044e-23
  Pred range: [0.0410, 0.3243], std: 0.0404
  RMSE : 0.1028, R2: -0.0435, MAE: 0.0861, Spearman rho: 0.3985, Spearman p: 3.4192e-24, Pearson r: 0.4070, Pearson p: 2.8873e-25
  Pred range: [0.0382, 0.3450], std: 0.0520
  RMSE : 0.0929, R2: 0.1465, MAE: 0.0750, Spearman rho: 0.4249, Spearman p: 1.3136e-27, Pearson r: 0.4250, Pearson p: 1.2570e-27
  Pred range: [0.0627, 0.4512], std: 0.0456
  RMSE : 0.0971, R2: 0.0690, MAE: 0.0792, Spearman rho: 0.3777, Spearman p: 1.0364e-21, Pearson r: 0.3833, Pearson p: 2.3177e-22
  Pred range: [0.0831, 0.5514], std: 0.0732
  RMSE : 0.1144, R2: -0.2924, MAE: 0.0928, Spearman rho: 0.4285, Spearman p: 4.2607e-28, Pearson r: 0.4378, Pearson p: 2.1421e-29
  Pred range: [0.0733, 0.4522], std: 0.0461
  RMSE : 0.1176, R2: -0.3663, MAE: 0.0990, Spearman rho: 0.4110, Spearman p: 8.8226e-26, Pearson r: 0.4108, Pearson p: 9.3774e-26
  Pred range: [-0.0022, 0.3800], std: 0.0525
  RMSE : 0.0935, R2: 0.1366, MAE: 0.0754, Spearman rho: 0.4264, Spearman p: 8.1521e-28, Pearson r: 0.4340, Pearson p: 7.2856e-29
[I 2026-04-29 00:12:10,162] Trial 8 finished with value: 0.09293462904515032 and parameters: {'learning_rate': 0.008390588294348234, 'batch_size': 16, 'num_epochs': 18, 'weight_decay': 0.0011866974890637474, 'layers_PRS': 1, 'layers_SCZ15': 1, 'layers_ADHD9': 5, 'layers_ASD9': 4, 'layers_ACE15': 5, 'layers_ACE18': 4, 'layers_SUD18': 5, 'layers_SES': 1, 'layers_SEX': 5, 'dropout': 0.1666471259988255, 'se_reduction': 4, 'hidden_dim_min': 13, 'base_loss': 'mse', 'huber_delta': 0.16658467618803768, 'focal_gamma': 1.0883023970370598, 'n_bins': 11, 'scheduler_patience': 3, 'scheduler_factor': 0.408305554918287, 'early_stopping_patience': 4}. Best is trial 4 with value: 0.08917975215600402.
Train: 2407 rows (1613 IDs),Test: 598 rows (404 IDs) 

n_features_x : 6, n_features_per_modality: [16, 23, 19, 17, 7, 4, 4, 4, 1, 4]

--- ImbalancedRegressionLoss initialized ---
  Bins: 5, Focal gamma: 2.285628993545817, Base loss: huber
  Bin [0.00, 0.20): count= 1876, weight=0.002
  Bin [0.20, 0.40): count=  497, weight=0.007
  Bin [0.40, 0.60): count=   32, weight=0.111
  Bin [0.60, 0.80): count=    2, weight=1.220
  Bin [0.80, 1.00): count=    0, weight=3.660
-------------------------------------------

  Pred range: [0.0380, 0.2890], std: 0.0343
  RMSE : 0.1047, R2: -0.0829, MAE: 0.0859, Spearman rho: 0.1491, Spearman p: 2.5253e-04, Pearson r: 0.1562, Pearson p: 1.2578e-04
  Pred range: [0.0498, 0.2820], std: 0.0350
  RMSE : 0.1010, R2: -0.0075, MAE: 0.0822, Spearman rho: 0.2266, Spearman p: 2.0974e-08, Pearson r: 0.2420, Pearson p: 2.0519e-09
  Pred range: [0.0539, 0.2861], std: 0.0368
  RMSE : 0.1004, R2: 0.0040, MAE: 0.0815, Spearman rho: 0.2746, Spearman p: 8.2855e-12, Pearson r: 0.2918, Pearson p: 3.3157e-13
  Pred range: [0.0521, 0.2874], std: 0.0383
  RMSE : 0.0981, R2: 0.0482, MAE: 0.0793, Spearman rho: 0.3083, Spearman p: 1.2500e-14, Pearson r: 0.3237, Pearson p: 4.7255e-16
  Pred range: [0.0559, 0.2990], std: 0.0402
  RMSE : 0.0987, R2: 0.0375, MAE: 0.0799, Spearman rho: 0.3296, Spearman p: 1.2915e-16, Pearson r: 0.3464, Pearson p: 2.6392e-18
  Pred range: [0.0534, 0.2954], std: 0.0409
  RMSE : 0.0966, R2: 0.0782, MAE: 0.0778, Spearman rho: 0.3449, Spearman p: 3.8509e-18, Pearson r: 0.3624, Pearson p: 5.2940e-20
  Pred range: [0.0562, 0.3000], std: 0.0417
  RMSE : 0.0969, R2: 0.0722, MAE: 0.0782, Spearman rho: 0.3567, Spearman p: 2.2360e-19, Pearson r: 0.3740, Pearson p: 2.7520e-21
  Pred range: [0.0557, 0.2982], std: 0.0425
  RMSE : 0.0960, R2: 0.0885, MAE: 0.0774, Spearman rho: 0.3689, Spearman p: 1.0379e-20, Pearson r: 0.3856, Pearson p: 1.2406e-22
  Pred range: [0.0600, 0.3060], std: 0.0439
  RMSE : 0.0974, R2: 0.0616, MAE: 0.0789, Spearman rho: 0.3759, Spearman p: 1.6762e-21, Pearson r: 0.3934, Pearson p: 1.4477e-23
  Pred range: [0.0603, 0.3067], std: 0.0446
  RMSE : 0.0970, R2: 0.0708, MAE: 0.0784, Spearman rho: 0.3836, Spearman p: 2.1298e-22, Pearson r: 0.4008, Pearson p: 1.7783e-24
[I 2026-04-29 00:13:32,450] Trial 9 pruned. 
Train: 2407 rows (1613 IDs),Test: 598 rows (404 IDs) 

n_features_x : 6, n_features_per_modality: [16, 23, 19, 17, 7, 4, 4, 4, 1, 4]

--- ImbalancedRegressionLoss initialized ---
  Bins: 8, Focal gamma: 0.5425080300191436, Base loss: huber
  Bin [0.00, 0.12): count= 1180, weight=0.003
  Bin [0.12, 0.25): count=  933, weight=0.003
  Bin [0.25, 0.38): count=  253, weight=0.012
  Bin [0.38, 0.50): count=   30, weight=0.098
  Bin [0.50, 0.62): count=   10, weight=0.277
  Bin [0.62, 0.75): count=    1, weight=1.521
  Bin [0.75, 0.88): count=    0, weight=3.043
  Bin [0.88, 1.00): count=    0, weight=3.043
-------------------------------------------

  Pred range: [0.0189, 0.4481], std: 0.0692
  RMSE : 0.0949, R2: 0.1092, MAE: 0.0760, Spearman rho: 0.4714, Spearman p: 2.0294e-34, Pearson r: 0.4757, Pearson p: 4.3082e-35
  Pred range: [0.0191, 0.4280], std: 0.0708
  RMSE : 0.0912, R2: 0.1784, MAE: 0.0715, Spearman rho: 0.4797, Spearman p: 9.7104e-36, Pearson r: 0.4844, Pearson p: 1.6793e-36
  Pred range: [0.0010, 0.3729], std: 0.0652
  RMSE : 0.0907, R2: 0.1872, MAE: 0.0698, Spearman rho: 0.4782, Spearman p: 1.7192e-35, Pearson r: 0.4874, Pearson p: 5.2807e-37
  Pred range: [0.0029, 0.3885], std: 0.0618
  RMSE : 0.0894, R2: 0.2108, MAE: 0.0703, Spearman rho: 0.4730, Spearman p: 1.1628e-34, Pearson r: 0.4794, Pearson p: 1.0805e-35
  Pred range: [0.0122, 0.3771], std: 0.0586
  RMSE : 0.0888, R2: 0.2201, MAE: 0.0695, Spearman rho: 0.4745, Spearman p: 6.6470e-35, Pearson r: 0.4802, Pearson p: 7.9321e-36
  Pred range: [0.0109, 0.3999], std: 0.0688
  RMSE : 0.0919, R2: 0.1656, MAE: 0.0728, Spearman rho: 0.4802, Spearman p: 8.0728e-36, Pearson r: 0.4858, Pearson p: 9.7558e-37
  Pred range: [-0.0023, 0.3719], std: 0.0585
  RMSE : 0.0895, R2: 0.2090, MAE: 0.0710, Spearman rho: 0.4708, Spearman p: 2.5437e-34, Pearson r: 0.4788, Pearson p: 1.3439e-35
  Pred range: [0.0446, 0.4376], std: 0.0664
  RMSE : 0.0971, R2: 0.0684, MAE: 0.0787, Spearman rho: 0.4807, Spearman p: 6.5980e-36, Pearson r: 0.4894, Pearson p: 2.4438e-37
  Pred range: [-0.0008, 0.3705], std: 0.0630
  RMSE : 0.0895, R2: 0.2083, MAE: 0.0710, Spearman rho: 0.4804, Spearman p: 7.4458e-36, Pearson r: 0.4894, Pearson p: 2.4761e-37
  Pred range: [0.0197, 0.3840], std: 0.0603
  RMSE : 0.0954, R2: 0.1006, MAE: 0.0779, Spearman rho: 0.4773, Spearman p: 2.3887e-35, Pearson r: 0.4869, Pearson p: 6.4816e-37
  Pred range: [0.0163, 0.4070], std: 0.0656
  RMSE : 0.0973, R2: 0.0642, MAE: 0.0791, Spearman rho: 0.4728, Spearman p: 1.2558e-34, Pearson r: 0.4801, Pearson p: 8.2852e-36
[I 2026-04-29 00:15:01,826] Trial 10 finished with value: 0.08883958953913638 and parameters: {'learning_rate': 0.001440480783008361, 'batch_size': 4, 'num_epochs': 15, 'weight_decay': 9.438463922630498e-05, 'layers_PRS': 2, 'layers_SCZ15': 3, 'layers_ADHD9': 1, 'layers_ASD9': 5, 'layers_ACE15': 4, 'layers_ACE18': 1, 'layers_SUD18': 2, 'layers_SES': 5, 'layers_SEX': 1, 'dropout': 0.4921028559723807, 'se_reduction': 2, 'hidden_dim_min': 11, 'base_loss': 'huber', 'huber_delta': 0.01707946996028749, 'focal_gamma': 0.5425080300191436, 'n_bins': 8, 'scheduler_patience': 2, 'scheduler_factor': 0.5153854013528417, 'early_stopping_patience': 6}. Best is trial 10 with value: 0.08883958953913638.
Train: 2407 rows (1613 IDs),Test: 598 rows (404 IDs) 

n_features_x : 6, n_features_per_modality: [16, 23, 19, 17, 7, 4, 4, 4, 1, 4]

--- ImbalancedRegressionLoss initialized ---
  Bins: 8, Focal gamma: 0.6661308775829138, Base loss: huber
  Bin [0.00, 0.12): count= 1180, weight=0.003
  Bin [0.12, 0.25): count=  933, weight=0.003
  Bin [0.25, 0.38): count=  253, weight=0.012
  Bin [0.38, 0.50): count=   30, weight=0.098
  Bin [0.50, 0.62): count=   10, weight=0.277
  Bin [0.62, 0.75): count=    1, weight=1.521
  Bin [0.75, 0.88): count=    0, weight=3.043
  Bin [0.88, 1.00): count=    0, weight=3.043
-------------------------------------------

  Pred range: [0.0631, 0.4275], std: 0.0587
  RMSE : 0.1013, R2: -0.0132, MAE: 0.0828, Spearman rho: 0.4489, Spearman p: 5.4408e-31, Pearson r: 0.4591, Pearson p: 1.6336e-32
  Pred range: [0.0556, 0.4841], std: 0.0686
  RMSE : 0.1025, R2: -0.0380, MAE: 0.0830, Spearman rho: 0.4605, Spearman p: 9.9282e-33, Pearson r: 0.4654, Pearson p: 1.7676e-33
  Pred range: [-0.0295, 0.3958], std: 0.0631
  RMSE : 0.0890, R2: 0.2170, MAE: 0.0699, Spearman rho: 0.4785, Spearman p: 1.5388e-35, Pearson r: 0.4870, Pearson p: 6.0703e-37
  Pred range: [0.0240, 0.3520], std: 0.0546
  RMSE : 0.0897, R2: 0.2048, MAE: 0.0714, Spearman rho: 0.4534, Spearman p: 1.1819e-31, Pearson r: 0.4636, Pearson p: 3.3290e-33
  Pred range: [-0.0125, 0.3480], std: 0.0655
  RMSE : 0.0916, R2: 0.1703, MAE: 0.0711, Spearman rho: 0.4557, Spearman p: 5.2624e-32, Pearson r: 0.4717, Pearson p: 1.8346e-34
  Pred range: [-0.0209, 0.3886], std: 0.0654
  RMSE : 0.0920, R2: 0.1627, MAE: 0.0730, Spearman rho: 0.4568, Spearman p: 3.7098e-32, Pearson r: 0.4614, Pearson p: 7.4233e-33
  Pred range: [0.0094, 0.4009], std: 0.0686
  RMSE : 0.0913, R2: 0.1771, MAE: 0.0721, Spearman rho: 0.4898, Spearman p: 2.1052e-37, Pearson r: 0.4928, Pearson p: 6.4090e-38
  Pred range: [-0.0272, 0.3831], std: 0.0595
  RMSE : 0.0906, R2: 0.1887, MAE: 0.0725, Spearman rho: 0.4671, Spearman p: 9.6735e-34, Pearson r: 0.4739, Pearson p: 8.2141e-35
  Pred range: [-0.0064, 0.3967], std: 0.0620
  RMSE : 0.0933, R2: 0.1394, MAE: 0.0754, Spearman rho: 0.4774, Spearman p: 2.2695e-35, Pearson r: 0.4809, Pearson p: 6.2464e-36
[I 2026-04-29 00:16:15,209] Trial 11 finished with value: 0.08901694538167695 and parameters: {'learning_rate': 0.0018375444736857564, 'batch_size': 4, 'num_epochs': 15, 'weight_decay': 8.482040840591085e-05, 'layers_PRS': 2, 'layers_SCZ15': 3, 'layers_ADHD9': 1, 'layers_ASD9': 5, 'layers_ACE15': 4, 'layers_ACE18': 1, 'layers_SUD18': 2, 'layers_SES': 5, 'layers_SEX': 1, 'dropout': 0.47967838003504626, 'se_reduction': 2, 'hidden_dim_min': 11, 'base_loss': 'huber', 'huber_delta': 0.02346982974218087, 'focal_gamma': 0.6661308775829138, 'n_bins': 8, 'scheduler_patience': 2, 'scheduler_factor': 0.5257960856767695, 'early_stopping_patience': 6}. Best is trial 10 with value: 0.08883958953913638.
Train: 2407 rows (1613 IDs),Test: 598 rows (404 IDs) 

n_features_x : 6, n_features_per_modality: [16, 23, 19, 17, 7, 4, 4, 4, 1, 4]

--- ImbalancedRegressionLoss initialized ---
  Bins: 9, Focal gamma: 0.559938495954553, Base loss: huber
  Bin [0.00, 0.11): count= 1180, weight=0.003
  Bin [0.11, 0.22): count=  835, weight=0.004
  Bin [0.22, 0.33): count=  312, weight=0.010
  Bin [0.33, 0.44): count=   59, weight=0.054
  Bin [0.44, 0.56): count=   16, weight=0.190
  Bin [0.56, 0.67): count=    4, weight=0.647
  Bin [0.67, 0.78): count=    1, weight=1.618
  Bin [0.78, 0.89): count=    0, weight=3.237
  Bin [0.89, 1.00): count=    0, weight=3.237
-------------------------------------------

  Pred range: [0.0129, 0.3930], std: 0.0576
  RMSE : 0.0942, R2: 0.1238, MAE: 0.0728, Spearman rho: 0.4302, Spearman p: 2.4985e-28, Pearson r: 0.4294, Pearson p: 3.1871e-28
  Pred range: [0.0432, 0.4335], std: 0.0634
  RMSE : 0.0948, R2: 0.1111, MAE: 0.0764, Spearman rho: 0.4545, Spearman p: 7.9744e-32, Pearson r: 0.4669, Pearson p: 1.0407e-33
  Pred range: [0.0044, 0.3556], std: 0.0526
  RMSE : 0.0891, R2: 0.2152, MAE: 0.0712, Spearman rho: 0.4694, Spearman p: 4.3052e-34, Pearson r: 0.4800, Pearson p: 8.5730e-36
  Pred range: [0.0483, 0.4161], std: 0.0592
  RMSE : 0.0933, R2: 0.1398, MAE: 0.0750, Spearman rho: 0.4569, Spearman p: 3.5073e-32, Pearson r: 0.4676, Pearson p: 8.1907e-34
  Pred range: [0.0479, 0.4645], std: 0.0625
  RMSE : 0.1069, R2: -0.1297, MAE: 0.0887, Spearman rho: 0.4598, Spearman p: 1.2715e-32, Pearson r: 0.4669, Pearson p: 1.0606e-33
  Pred range: [0.0323, 0.4482], std: 0.0632
  RMSE : 0.0943, R2: 0.1216, MAE: 0.0753, Spearman rho: 0.4554, Spearman p: 5.9862e-32, Pearson r: 0.4603, Pearson p: 1.0622e-32
  Pred range: [-0.0016, 0.3624], std: 0.0596
  RMSE : 0.0889, R2: 0.2192, MAE: 0.0696, Spearman rho: 0.4735, Spearman p: 9.5330e-35, Pearson r: 0.4841, Pearson p: 1.8701e-36
  Pred range: [0.0027, 0.3961], std: 0.0617
  RMSE : 0.0917, R2: 0.1694, MAE: 0.0734, Spearman rho: 0.4655, Spearman p: 1.7149e-33, Pearson r: 0.4748, Pearson p: 5.9871e-35
  Pred range: [-0.0013, 0.3959], std: 0.0663
  RMSE : 0.0900, R2: 0.1991, MAE: 0.0707, Spearman rho: 0.4778, Spearman p: 1.9395e-35, Pearson r: 0.4836, Pearson p: 2.2230e-36
  Pred range: [-0.0029, 0.3877], std: 0.0643
  RMSE : 0.0906, R2: 0.1883, MAE: 0.0718, Spearman rho: 0.4739, Spearman p: 8.2604e-35, Pearson r: 0.4829, Pearson p: 2.9317e-36
  Pred range: [0.0116, 0.3911], std: 0.0641
  RMSE : 0.0914, R2: 0.1750, MAE: 0.0729, Spearman rho: 0.4740, Spearman p: 7.9194e-35, Pearson r: 0.4850, Pearson p: 1.3030e-36
  Pred range: [-0.0120, 0.3733], std: 0.0608
  RMSE : 0.0887, R2: 0.2226, MAE: 0.0702, Spearman rho: 0.4796, Spearman p: 1.0086e-35, Pearson r: 0.4897, Pearson p: 2.1789e-37
  Pred range: [0.0239, 0.3855], std: 0.0624
  RMSE : 0.0914, R2: 0.1738, MAE: 0.0732, Spearman rho: 0.4763, Spearman p: 3.4846e-35, Pearson r: 0.4858, Pearson p: 9.5832e-37
  Pred range: [-0.0067, 0.3477], std: 0.0607
  RMSE : 0.0887, R2: 0.2221, MAE: 0.0696, Spearman rho: 0.4768, Spearman p: 2.8776e-35, Pearson r: 0.4876, Pearson p: 4.9189e-37
  Pred range: [0.0474, 0.4576], std: 0.0694
  RMSE : 0.1007, R2: -0.0017, MAE: 0.0815, Spearman rho: 0.4722, Spearman p: 1.5363e-34, Pearson r: 0.4801, Pearson p: 8.3725e-36
