[I 2026-04-27 20:33:55,204] Trial 90 finished with value: 0.14935298369375447 and parameters: {'learning_rate': 0.00024154039472806314, 'batch_size': 4, 'num_epochs': 16, 'weight_decay': 4.241216079508776e-05, 'layers_PRS': 6, 'layers_SCZ15': 6, 'layers_ADHD9': 1, 'layers_ASD9': 6, 'layers_ACE15': 4, 'layers_ACE18': 6, 'layers_SUD18': 2, 'layers_SES': 3, 'layers_SEX': 5, 'dropout': 0.24647531733012285, 'se_reduction': 4, 'hidden_dim_min': 3, 'base_loss': 'mse', 'huber_delta': 0.12792008317099135, 'focal_gamma': 0.9914961979427608, 'n_bins': 19, 'scheduler_patience': 5, 'scheduler_factor': 0.4818260891078594, 'early_stopping_patience': 4}. Best is trial 81 with value: 0.14825416838187774.
Train: 2407 rows (1613 IDs),Test: 598 rows (404 IDs) 

n_features_x : 6, n_features_per_modality: [16, 23, 19, 17, 7, 4, 4, 4, 1, 4]

--- ImbalancedRegressionLoss initialized ---
  Bins: 20, Focal gamma: 1.2123116755905246, Base loss: huber
  Bin [0.00, 0.05): count=  172, weight=0.053
  Bin [0.05, 0.10): count=  413, weight=0.022
  Bin [0.10, 0.15): count=  175, weight=0.052
  Bin [0.15, 0.20): count=  405, weight=0.023
  Bin [0.20, 0.25): count=  295, weight=0.031
  Bin [0.25, 0.30): count=  126, weight=0.072
  Bin [0.30, 0.35): count=  223, weight=0.041
  Bin [0.35, 0.40): count=  162, weight=0.056
  Bin [0.40, 0.45): count=   69, weight=0.131
  Bin [0.45, 0.50): count=  122, weight=0.074
  Bin [0.50, 0.55): count=   93, weight=0.097
  Bin [0.55, 0.60): count=   36, weight=0.247
  Bin [0.60, 0.65): count=   47, weight=0.190
  Bin [0.65, 0.70): count=   27, weight=0.326
  Bin [0.70, 0.75): count=   14, weight=0.609
  Bin [0.75, 0.80): count=   19, weight=0.457
  Bin [0.80, 0.85): count=    5, weight=1.523
  Bin [0.85, 0.90): count=    1, weight=4.570
  Bin [0.90, 0.95): count=    3, weight=2.285
  Bin [0.95, 1.00): count=    0, weight=9.140
-------------------------------------------

  Pred range: [0.1091, 0.6093], std: 0.0905
  RMSE : 0.1571, R2: 0.1767, MAE: 0.1285, Spearman rho: 0.4727, Spearman p: 1.2603e-34, Pearson r: 0.4931, Pearson p: 5.8684e-38
  Pred range: [0.0835, 0.6488], std: 0.0951
  RMSE : 0.1510, R2: 0.2385, MAE: 0.1203, Spearman rho: 0.4933, Spearman p: 5.4387e-38, Pearson r: 0.5087, Pearson p: 1.1211e-40
  Pred range: [0.0848, 0.6507], std: 0.1030
  RMSE : 0.1528, R2: 0.2205, MAE: 0.1228, Spearman rho: 0.4958, Spearman p: 2.0126e-38, Pearson r: 0.5129, Pearson p: 1.9391e-41
  Pred range: [0.0738, 0.6780], std: 0.1097
  RMSE : 0.1532, R2: 0.2165, MAE: 0.1231, Spearman rho: 0.5062, Spearman p: 3.1533e-40, Pearson r: 0.5219, Pearson p: 4.4561e-43
  Pred range: [0.0761, 0.6688], std: 0.0984
  RMSE : 0.1541, R2: 0.2074, MAE: 0.1257, Spearman rho: 0.5003, Spearman p: 3.3341e-39, Pearson r: 0.5182, Pearson p: 2.1076e-42
  Pred range: [0.0410, 0.7057], std: 0.0987
  RMSE : 0.1549, R2: 0.1988, MAE: 0.1257, Spearman rho: 0.4901, Spearman p: 1.8531e-37, Pearson r: 0.5058, Pearson p: 3.6636e-40
  Pred range: [0.0832, 0.6833], std: 0.1094
  RMSE : 0.1555, R2: 0.1928, MAE: 0.1256, Spearman rho: 0.4934, Spearman p: 5.1518e-38, Pearson r: 0.5126, Pearson p: 2.2006e-41
[I 2026-04-27 20:35:20,974] Trial 91 finished with value: 0.15104393436658825 and parameters: {'learning_rate': 0.0006107406077184827, 'batch_size': 4, 'num_epochs': 20, 'weight_decay': 2.23621798808624e-05, 'layers_PRS': 3, 'layers_SCZ15': 6, 'layers_ADHD9': 2, 'layers_ASD9': 7, 'layers_ACE15': 4, 'layers_ACE18': 5, 'layers_SUD18': 3, 'layers_SES': 2, 'layers_SEX': 5, 'dropout': 0.2657550601065615, 'se_reduction': 3, 'hidden_dim_min': 4, 'base_loss': 'huber', 'huber_delta': 0.13522375321431365, 'focal_gamma': 1.2123116755905246, 'n_bins': 20, 'scheduler_patience': 5, 'scheduler_factor': 0.5134875554214362, 'early_stopping_patience': 5}. Best is trial 81 with value: 0.14825416838187774.
Train: 2407 rows (1613 IDs),Test: 598 rows (404 IDs) 

n_features_x : 6, n_features_per_modality: [16, 23, 19, 17, 7, 4, 4, 4, 1, 4]

--- ImbalancedRegressionLoss initialized ---
  Bins: 20, Focal gamma: 1.389397569263085, Base loss: huber
  Bin [0.00, 0.05): count=  172, weight=0.053
  Bin [0.05, 0.10): count=  413, weight=0.022
  Bin [0.10, 0.15): count=  175, weight=0.052
  Bin [0.15, 0.20): count=  405, weight=0.023
  Bin [0.20, 0.25): count=  295, weight=0.031
  Bin [0.25, 0.30): count=  126, weight=0.072
  Bin [0.30, 0.35): count=  223, weight=0.041
  Bin [0.35, 0.40): count=  162, weight=0.056
  Bin [0.40, 0.45): count=   69, weight=0.131
  Bin [0.45, 0.50): count=  122, weight=0.074
  Bin [0.50, 0.55): count=   93, weight=0.097
  Bin [0.55, 0.60): count=   36, weight=0.247
  Bin [0.60, 0.65): count=   47, weight=0.190
  Bin [0.65, 0.70): count=   27, weight=0.326
  Bin [0.70, 0.75): count=   14, weight=0.609
  Bin [0.75, 0.80): count=   19, weight=0.457
  Bin [0.80, 0.85): count=    5, weight=1.523
  Bin [0.85, 0.90): count=    1, weight=4.570
  Bin [0.90, 0.95): count=    3, weight=2.285
  Bin [0.95, 1.00): count=    0, weight=9.140
-------------------------------------------

  Pred range: [0.0816, 0.5299], std: 0.0777
  RMSE : 0.1520, R2: 0.2285, MAE: 0.1196, Spearman rho: 0.4752, Spearman p: 5.2138e-35, Pearson r: 0.4847, Pearson p: 1.4510e-36
  Pred range: [0.0928, 0.6273], std: 0.1027
  RMSE : 0.1581, R2: 0.1660, MAE: 0.1286, Spearman rho: 0.4963, Spearman p: 1.6851e-38, Pearson r: 0.5089, Pearson p: 1.0208e-40
  Pred range: [0.0637, 0.6401], std: 0.1066
  RMSE : 0.1561, R2: 0.1862, MAE: 0.1255, Spearman rho: 0.4935, Spearman p: 4.9323e-38, Pearson r: 0.5050, Pearson p: 5.1333e-40
  Pred range: [0.0795, 0.6589], std: 0.1070
  RMSE : 0.1611, R2: 0.1340, MAE: 0.1318, Spearman rho: 0.4978, Spearman p: 8.9827e-39, Pearson r: 0.5069, Pearson p: 2.3572e-40
  Pred range: [0.0056, 0.5263], std: 0.0900
  RMSE : 0.1542, R2: 0.2063, MAE: 0.1150, Spearman rho: 0.4829, Spearman p: 2.9279e-36, Pearson r: 0.4975, Pearson p: 1.0329e-38
  Pred range: [0.0470, 0.6765], std: 0.1123
  RMSE : 0.1639, R2: 0.1038, MAE: 0.1340, Spearman rho: 0.4936, Spearman p: 4.7731e-38, Pearson r: 0.5070, Pearson p: 2.2823e-40
[I 2026-04-27 20:36:33,286] Trial 92 finished with value: 0.15202886488397135 and parameters: {'learning_rate': 0.0009527405940116725, 'batch_size': 4, 'num_epochs': 19, 'weight_decay': 3.0030703419289422e-05, 'layers_PRS': 3, 'layers_SCZ15': 6, 'layers_ADHD9': 2, 'layers_ASD9': 7, 'layers_ACE15': 4, 'layers_ACE18': 5, 'layers_SUD18': 3, 'layers_SES': 1, 'layers_SEX': 5, 'dropout': 0.2570083463333829, 'se_reduction': 3, 'hidden_dim_min': 4, 'base_loss': 'huber', 'huber_delta': 0.1312193181284654, 'focal_gamma': 1.389397569263085, 'n_bins': 20, 'scheduler_patience': 5, 'scheduler_factor': 0.5196537723770246, 'early_stopping_patience': 5}. Best is trial 81 with value: 0.14825416838187774.
Train: 2407 rows (1613 IDs),Test: 598 rows (404 IDs) 

n_features_x : 6, n_features_per_modality: [16, 23, 19, 17, 7, 4, 4, 4, 1, 4]

--- ImbalancedRegressionLoss initialized ---
  Bins: 18, Focal gamma: 1.4414557036406739, Base loss: huber
  Bin [0.00, 0.06): count=  172, weight=0.058
  Bin [0.06, 0.11): count=  413, weight=0.024
  Bin [0.11, 0.17): count=  376, weight=0.027
  Bin [0.17, 0.22): count=  370, weight=0.027
  Bin [0.22, 0.28): count=  255, weight=0.040
  Bin [0.28, 0.33): count=  223, weight=0.045
  Bin [0.33, 0.39): count=   89, weight=0.112
  Bin [0.39, 0.44): count=  142, weight=0.071
  Bin [0.44, 0.50): count=  122, weight=0.082
  Bin [0.50, 0.56): count=   93, weight=0.108
  Bin [0.56, 0.61): count=   64, weight=0.156
  Bin [0.61, 0.67): count=   36, weight=0.273
  Bin [0.67, 0.72): count=   10, weight=0.920
  Bin [0.72, 0.78): count=   26, weight=0.375
  Bin [0.78, 0.83): count=    9, weight=1.012
  Bin [0.83, 0.89): count=    4, weight=2.023
  Bin [0.89, 0.94): count=    3, weight=2.529
  Bin [0.94, 1.00): count=    0, weight=10.117
-------------------------------------------

  Pred range: [0.0640, 0.6146], std: 0.0988
  RMSE : 0.1503, R2: 0.2457, MAE: 0.1170, Spearman rho: 0.4861, Spearman p: 8.5264e-37, Pearson r: 0.5008, Pearson p: 2.8103e-39
  Pred range: [0.0719, 0.5842], std: 0.0971
  RMSE : 0.1513, R2: 0.2362, MAE: 0.1195, Spearman rho: 0.4710, Spearman p: 2.4120e-34, Pearson r: 0.4959, Pearson p: 1.9317e-38
  Pred range: [0.0563, 0.5442], std: 0.0979
  RMSE : 0.1486, R2: 0.2626, MAE: 0.1141, Spearman rho: 0.5011, Spearman p: 2.4163e-39, Pearson r: 0.5172, Pearson p: 3.3043e-42
  Pred range: [0.1134, 0.7392], std: 0.1181
  RMSE : 0.1733, R2: -0.0021, MAE: 0.1427, Spearman rho: 0.4874, Spearman p: 5.2422e-37, Pearson r: 0.5076, Pearson p: 1.7391e-40
  Pred range: [0.1006, 0.7060], std: 0.1074
  RMSE : 0.1668, R2: 0.0713, MAE: 0.1380, Spearman rho: 0.4868, Spearman p: 6.5967e-37, Pearson r: 0.5107, Pearson p: 4.9382e-41
  Pred range: [0.0753, 0.6205], std: 0.1035
  RMSE : 0.1526, R2: 0.2223, MAE: 0.1229, Spearman rho: 0.4917, Spearman p: 1.0066e-37, Pearson r: 0.5123, Pearson p: 2.5717e-41
  Pred range: [0.0896, 0.6206], std: 0.1034
  RMSE : 0.1593, R2: 0.1531, MAE: 0.1301, Spearman rho: 0.4797, Spearman p: 9.8028e-36, Pearson r: 0.4941, Pearson p: 3.8839e-38
  Pred range: [0.1181, 0.7713], std: 0.1242
  RMSE : 0.1792, R2: -0.0724, MAE: 0.1474, Spearman rho: 0.4854, Spearman p: 1.1414e-36, Pearson r: 0.5062, Pearson p: 3.1527e-40
[I 2026-04-27 20:38:14,307] Trial 93 finished with value: 0.1486369537197671 and parameters: {'learning_rate': 0.001694279860505864, 'batch_size': 4, 'num_epochs': 22, 'weight_decay': 2.1912802522883962e-05, 'layers_PRS': 3, 'layers_SCZ15': 7, 'layers_ADHD9': 2, 'layers_ASD9': 7, 'layers_ACE15': 4, 'layers_ACE18': 5, 'layers_SUD18': 3, 'layers_SES': 2, 'layers_SEX': 5, 'dropout': 0.2835418893351052, 'se_reduction': 3, 'hidden_dim_min': 5, 'base_loss': 'huber', 'huber_delta': 0.14281472631347678, 'focal_gamma': 1.4414557036406739, 'n_bins': 18, 'scheduler_patience': 5, 'scheduler_factor': 0.5026051413687211, 'early_stopping_patience': 5}. Best is trial 81 with value: 0.14825416838187774.
Train: 2407 rows (1613 IDs),Test: 598 rows (404 IDs) 

n_features_x : 6, n_features_per_modality: [16, 23, 19, 17, 7, 4, 4, 4, 1, 4]

--- ImbalancedRegressionLoss initialized ---
  Bins: 18, Focal gamma: 1.5686792853992921, Base loss: huber
  Bin [0.00, 0.06): count=  172, weight=0.058
  Bin [0.06, 0.11): count=  413, weight=0.024
  Bin [0.11, 0.17): count=  376, weight=0.027
  Bin [0.17, 0.22): count=  370, weight=0.027
  Bin [0.22, 0.28): count=  255, weight=0.040
  Bin [0.28, 0.33): count=  223, weight=0.045
  Bin [0.33, 0.39): count=   89, weight=0.112
  Bin [0.39, 0.44): count=  142, weight=0.071
  Bin [0.44, 0.50): count=  122, weight=0.082
  Bin [0.50, 0.56): count=   93, weight=0.108
  Bin [0.56, 0.61): count=   64, weight=0.156
  Bin [0.61, 0.67): count=   36, weight=0.273
  Bin [0.67, 0.72): count=   10, weight=0.920
  Bin [0.72, 0.78): count=   26, weight=0.375
  Bin [0.78, 0.83): count=    9, weight=1.012
  Bin [0.83, 0.89): count=    4, weight=2.023
  Bin [0.89, 0.94): count=    3, weight=2.529
  Bin [0.94, 1.00): count=    0, weight=10.117
-------------------------------------------

  Pred range: [0.1107, 0.5909], std: 0.0877
  RMSE : 0.1599, R2: 0.1468, MAE: 0.1305, Spearman rho: 0.4661, Spearman p: 1.3922e-33, Pearson r: 0.4768, Pearson p: 2.8000e-35
  Pred range: [0.1016, 0.6556], std: 0.1024
  RMSE : 0.1575, R2: 0.1724, MAE: 0.1281, Spearman rho: 0.4921, Spearman p: 8.5391e-38, Pearson r: 0.5076, Pearson p: 1.7499e-40
  Pred range: [0.0918, 0.6641], std: 0.0975
  RMSE : 0.1595, R2: 0.1510, MAE: 0.1306, Spearman rho: 0.4800, Spearman p: 8.5063e-36, Pearson r: 0.4980, Pearson p: 8.2951e-39
  Pred range: [0.0395, 0.5904], std: 0.0859
  RMSE : 0.1525, R2: 0.2233, MAE: 0.1234, Spearman rho: 0.4881, Spearman p: 4.0896e-37, Pearson r: 0.5033, Pearson p: 1.0183e-39
  Pred range: [0.0891, 0.6759], std: 0.1077
  RMSE : 0.1579, R2: 0.1675, MAE: 0.1283, Spearman rho: 0.4937, Spearman p: 4.6551e-38, Pearson r: 0.5079, Pearson p: 1.5634e-40
  Pred range: [0.0726, 0.6586], std: 0.0982
  RMSE : 0.1523, R2: 0.2253, MAE: 0.1223, Spearman rho: 0.4823, Spearman p: 3.6109e-36, Pearson r: 0.5038, Pearson p: 8.4100e-40
  Pred range: [0.0288, 0.5855], std: 0.0947
  RMSE : 0.1493, R2: 0.2564, MAE: 0.1164, Spearman rho: 0.4921, Spearman p: 8.6911e-38, Pearson r: 0.5082, Pearson p: 1.3796e-40
  Pred range: [0.0297, 0.5791], std: 0.0941
  RMSE : 0.1488, R2: 0.2612, MAE: 0.1175, Spearman rho: 0.4947, Spearman p: 3.1496e-38, Pearson r: 0.5153, Pearson p: 7.3204e-42
  Pred range: [0.0585, 0.6222], std: 0.1021
  RMSE : 0.1529, R2: 0.2198, MAE: 0.1221, Spearman rho: 0.4930, Spearman p: 5.9814e-38, Pearson r: 0.5048, Pearson p: 5.5154e-40
  Pred range: [0.0089, 0.6709], std: 0.1026
  RMSE : 0.1631, R2: 0.1124, MAE: 0.1343, Spearman rho: 0.4901, Spearman p: 1.8689e-37, Pearson r: 0.5046, Pearson p: 5.9023e-40
  Pred range: [0.0276, 0.6723], std: 0.0981
  RMSE : 0.1531, R2: 0.2173, MAE: 0.1225, Spearman rho: 0.4754, Spearman p: 4.7873e-35, Pearson r: 0.4937, Pearson p: 4.6344e-38
[I 2026-04-27 20:40:40,483] Trial 94 finished with value: 0.14877304624892568 and parameters: {'learning_rate': 0.0008231480629028033, 'batch_size': 4, 'num_epochs': 22, 'weight_decay': 1.665139692052123e-05, 'layers_PRS': 5, 'layers_SCZ15': 7, 'layers_ADHD9': 2, 'layers_ASD9': 7, 'layers_ACE15': 4, 'layers_ACE18': 4, 'layers_SUD18': 5, 'layers_SES': 2, 'layers_SEX': 5, 'dropout': 0.3358037018104981, 'se_reduction': 4, 'hidden_dim_min': 14, 'base_loss': 'huber', 'huber_delta': 0.12139349967097018, 'focal_gamma': 1.5686792853992921, 'n_bins': 18, 'scheduler_patience': 5, 'scheduler_factor': 0.502908234517018, 'early_stopping_patience': 3}. Best is trial 81 with value: 0.14825416838187774.
Train: 2407 rows (1613 IDs),Test: 598 rows (404 IDs) 

n_features_x : 6, n_features_per_modality: [16, 23, 19, 17, 7, 4, 4, 4, 1, 4]

--- ImbalancedRegressionLoss initialized ---
  Bins: 18, Focal gamma: 1.5830032825175055, Base loss: huber
  Bin [0.00, 0.06): count=  172, weight=0.058
  Bin [0.06, 0.11): count=  413, weight=0.024
  Bin [0.11, 0.17): count=  376, weight=0.027
  Bin [0.17, 0.22): count=  370, weight=0.027
  Bin [0.22, 0.28): count=  255, weight=0.040
  Bin [0.28, 0.33): count=  223, weight=0.045
  Bin [0.33, 0.39): count=   89, weight=0.112
  Bin [0.39, 0.44): count=  142, weight=0.071
  Bin [0.44, 0.50): count=  122, weight=0.082
  Bin [0.50, 0.56): count=   93, weight=0.108
  Bin [0.56, 0.61): count=   64, weight=0.156
  Bin [0.61, 0.67): count=   36, weight=0.273
  Bin [0.67, 0.72): count=   10, weight=0.920
  Bin [0.72, 0.78): count=   26, weight=0.375
  Bin [0.78, 0.83): count=    9, weight=1.012
  Bin [0.83, 0.89): count=    4, weight=2.023
  Bin [0.89, 0.94): count=    3, weight=2.529
  Bin [0.94, 1.00): count=    0, weight=10.117
-------------------------------------------

  Pred range: [0.1338, 0.7426], std: 0.1114
  RMSE : 0.1887, R2: -0.1889, MAE: 0.1589, Spearman rho: 0.4791, Spearman p: 1.2068e-35, Pearson r: 0.4790, Pearson p: 1.2382e-35
  Pred range: [0.1248, 0.7631], std: 0.1184
  RMSE : 0.1784, R2: -0.0627, MAE: 0.1485, Spearman rho: 0.4904, Spearman p: 1.6556e-37, Pearson r: 0.4995, Pearson p: 4.6371e-39
  Pred range: [0.0524, 0.5508], std: 0.0878
  RMSE : 0.1499, R2: 0.2504, MAE: 0.1180, Spearman rho: 0.4886, Spearman p: 3.3593e-37, Pearson r: 0.5029, Pearson p: 1.1993e-39
  Pred range: [0.1154, 0.7904], std: 0.1244
  RMSE : 0.1770, R2: -0.0457, MAE: 0.1458, Spearman rho: 0.4923, Spearman p: 8.0642e-38, Pearson r: 0.5106, Pearson p: 5.1212e-41
  Pred range: [0.1487, 0.7406], std: 0.1061
  RMSE : 0.1843, R2: -0.1336, MAE: 0.1565, Spearman rho: 0.4922, Spearman p: 8.3891e-38, Pearson r: 0.5108, Pearson p: 4.7518e-41
  Pred range: [0.0468, 0.5730], std: 0.0855
  RMSE : 0.1521, R2: 0.2283, MAE: 0.1211, Spearman rho: 0.4672, Spearman p: 9.5021e-34, Pearson r: 0.4845, Pearson p: 1.5621e-36
[I 2026-04-27 20:41:33,864] Trial 95 finished with value: 0.14985916435307237 and parameters: {'learning_rate': 0.001717554682593893, 'batch_size': 6, 'num_epochs': 22, 'weight_decay': 1.577197388461068e-05, 'layers_PRS': 3, 'layers_SCZ15': 7, 'layers_ADHD9': 2, 'layers_ASD9': 7, 'layers_ACE15': 3, 'layers_ACE18': 5, 'layers_SUD18': 5, 'layers_SES': 1, 'layers_SEX': 5, 'dropout': 0.2773454206125535, 'se_reduction': 3, 'hidden_dim_min': 11, 'base_loss': 'huber', 'huber_delta': 0.14092834584117514, 'focal_gamma': 1.5830032825175055, 'n_bins': 18, 'scheduler_patience': 5, 'scheduler_factor': 0.49905085929962795, 'early_stopping_patience': 3}. Best is trial 81 with value: 0.14825416838187774.
Train: 2407 rows (1613 IDs),Test: 598 rows (404 IDs) 

n_features_x : 6, n_features_per_modality: [16, 23, 19, 17, 7, 4, 4, 4, 1, 4]

--- ImbalancedRegressionLoss initialized ---
  Bins: 19, Focal gamma: 1.6440360646617516, Base loss: huber
  Bin [0.00, 0.05): count=  172, weight=0.055
  Bin [0.05, 0.11): count=  413, weight=0.023
  Bin [0.11, 0.16): count=  376, weight=0.025
  Bin [0.16, 0.21): count=  204, weight=0.046
  Bin [0.21, 0.26): count=  295, weight=0.032
  Bin [0.26, 0.32): count=  239, weight=0.039
  Bin [0.32, 0.37): count=  199, weight=0.047
  Bin [0.37, 0.42): count=   73, weight=0.128
  Bin [0.42, 0.47): count=  134, weight=0.070
  Bin [0.47, 0.53): count=  108, weight=0.087
  Bin [0.53, 0.58): count=   78, weight=0.120
  Bin [0.58, 0.63): count=   28, weight=0.327
  Bin [0.63, 0.68): count=   36, weight=0.256
  Bin [0.68, 0.74): count=   24, weight=0.379
  Bin [0.74, 0.79): count=   19, weight=0.474
  Bin [0.79, 0.84): count=    2, weight=3.157
  Bin [0.84, 0.89): count=    4, weight=1.894
  Bin [0.89, 0.95): count=    3, weight=2.368
  Bin [0.95, 1.00): count=    0, weight=9.472
-------------------------------------------

  Pred range: [0.1423, 0.5973], std: 0.0749
  RMSE : 0.1798, R2: -0.0786, MAE: 0.1530, Spearman rho: 0.4004, Spearman p: 1.9600e-24, Pearson r: 0.4179, Pearson p: 1.1048e-26
  Pred range: [0.0944, 0.6593], std: 0.0929
  RMSE : 0.1617, R2: 0.1267, MAE: 0.1341, Spearman rho: 0.4519, Spearman p: 1.9412e-31, Pearson r: 0.4743, Pearson p: 7.2710e-35
  Pred range: [0.1141, 0.7356], std: 0.1084
  RMSE : 0.1759, R2: -0.0323, MAE: 0.1481, Spearman rho: 0.4741, Spearman p: 7.7227e-35, Pearson r: 0.4963, Pearson p: 1.6880e-38
  Pred range: [0.1213, 0.7464], std: 0.1147
  RMSE : 0.1792, R2: -0.0721, MAE: 0.1503, Spearman rho: 0.4762, Spearman p: 3.4966e-35, Pearson r: 0.5021, Pearson p: 1.6720e-39
  Pred range: [0.1553, 0.9064], std: 0.1243
  RMSE : 0.2214, R2: -0.6359, MAE: 0.1897, Spearman rho: 0.4789, Spearman p: 1.3098e-35, Pearson r: 0.5087, Pearson p: 1.1199e-40
