[I 2026-04-28 00:40:23,737] Trial 5 finished with value: 0.1517902491797665 and parameters: {'learning_rate': 0.00016046974871068899, 'batch_size': 4, 'num_epochs': 23, 'weight_decay': 0.00010655341706129069, 'depth_complex': 3, 'depth_moderate': 4, 'depth_simple': 1, 'dropout': 0.46076563106613666, 'se_reduction': 4, 'hidden_dim_min': 2, 'base_loss': 'mse', 'huber_delta': 0.16457068866277402, 'focal_gamma': 2.294822505204592, 'n_bins': 7, 'scheduler_patience': 4, 'scheduler_factor': 0.49491374606430727, 'early_stopping_patience': 8}. Best is trial 5 with value: 0.1517902491797665.
Train: 2407 rows (1613 IDs),Test: 598 rows (404 IDs) 

n_features_x : 6, n_features_per_modality: [16, 23, 19, 17, 7, 4, 4, 4, 1, 4]

--- ImbalancedRegressionLoss initialized ---
  Bins: 9, Focal gamma: 2.580433040973272, Base loss: huber
  Bin [0.00, 0.11): count=  585, weight=0.041
  Bin [0.11, 0.22): count=  746, weight=0.032
  Bin [0.22, 0.33): count=  478, weight=0.050
  Bin [0.33, 0.44): count=  231, weight=0.104
  Bin [0.44, 0.56): count=  215, weight=0.112
  Bin [0.56, 0.67): count=  100, weight=0.239
  Bin [0.67, 0.78): count=   36, weight=0.653
  Bin [0.78, 0.89): count=   13, weight=1.726
  Bin [0.89, 1.00): count=    3, weight=6.041
-------------------------------------------

  Pred range: [0.0386, 0.4302], std: 0.0591
  RMSE : 0.1691, R2: 0.0458, MAE: 0.1300, Spearman rho: 0.2419, Spearman p: 2.0775e-09, Pearson r: 0.2513, Pearson p: 4.6134e-10
  Pred range: [0.0783, 0.5265], std: 0.0679
  RMSE : 0.1720, R2: 0.0124, MAE: 0.1410, Spearman rho: 0.2735, Spearman p: 1.0072e-11, Pearson r: 0.2857, Pearson p: 1.0636e-12
  Pred range: [0.0812, 0.5338], std: 0.0682
  RMSE : 0.1712, R2: 0.0217, MAE: 0.1407, Spearman rho: 0.2898, Spearman p: 4.9216e-13, Pearson r: 0.3041, Pearson p: 2.9501e-14
  Pred range: [0.0897, 0.5542], std: 0.0704
  RMSE : 0.1732, R2: -0.0009, MAE: 0.1435, Spearman rho: 0.3065, Spearman p: 1.7822e-14, Pearson r: 0.3219, Pearson p: 6.9898e-16
  Pred range: [0.0913, 0.5558], std: 0.0706
  RMSE : 0.1722, R2: 0.0107, MAE: 0.1427, Spearman rho: 0.3190, Spearman p: 1.3104e-15, Pearson r: 0.3346, Pearson p: 4.1888e-17
  Pred range: [0.0915, 0.5587], std: 0.0717
  RMSE : 0.1712, R2: 0.0214, MAE: 0.1420, Spearman rho: 0.3304, Spearman p: 1.0806e-16, Pearson r: 0.3469, Pearson p: 2.3876e-18
[I 2026-04-28 00:40:58,547] Trial 6 finished with value: 0.16907189979440934 and parameters: {'learning_rate': 2.6638565430127437e-05, 'batch_size': 6, 'num_epochs': 13, 'weight_decay': 0.0003009058594418508, 'depth_complex': 6, 'depth_moderate': 2, 'depth_simple': 1, 'dropout': 0.1054952489731864, 'se_reduction': 8, 'hidden_dim_min': 4, 'base_loss': 'huber', 'huber_delta': 0.031101921382390846, 'focal_gamma': 2.580433040973272, 'n_bins': 9, 'scheduler_patience': 4, 'scheduler_factor': 0.4590219005159503, 'early_stopping_patience': 5}. Best is trial 5 with value: 0.1517902491797665.
Train: 2407 rows (1613 IDs),Test: 598 rows (404 IDs) 

n_features_x : 6, n_features_per_modality: [16, 23, 19, 17, 7, 4, 4, 4, 1, 4]

--- ImbalancedRegressionLoss initialized ---
  Bins: 8, Focal gamma: 2.5145108737043653, Base loss: huber
  Bin [0.00, 0.12): count=  760, weight=0.039
  Bin [0.12, 0.25): count=  700, weight=0.042
  Bin [0.25, 0.38): count=  438, weight=0.067
  Bin [0.38, 0.50): count=  264, weight=0.111
  Bin [0.50, 0.62): count=  157, weight=0.186
  Bin [0.62, 0.75): count=   60, weight=0.483
  Bin [0.75, 0.88): count=   24, weight=1.179
  Bin [0.88, 1.00): count=    4, weight=5.893
-------------------------------------------

  Pred range: [0.0518, 0.6261], std: 0.0968
  RMSE : 0.1669, R2: 0.0701, MAE: 0.1393, Spearman rho: 0.4468, Spearman p: 1.1194e-30, Pearson r: 0.4599, Pearson p: 1.2611e-32
  Pred range: [-0.0540, 0.6671], std: 0.0967
  RMSE : 0.1574, R2: 0.1733, MAE: 0.1274, Spearman rho: 0.4391, Spearman p: 1.3983e-29, Pearson r: 0.4561, Pearson p: 4.6072e-32
  Pred range: [0.1175, 0.7056], std: 0.0946
  RMSE : 0.1900, R2: -0.2048, MAE: 0.1618, Spearman rho: 0.4551, Spearman p: 6.6272e-32, Pearson r: 0.4739, Pearson p: 8.3043e-35
  Pred range: [0.0830, 0.6829], std: 0.0943
  RMSE : 0.1652, R2: 0.0890, MAE: 0.1380, Spearman rho: 0.4585, Spearman p: 2.0551e-32, Pearson r: 0.4904, Pearson p: 1.6573e-37
  Pred range: [0.0764, 0.7612], std: 0.1159
  RMSE : 0.1921, R2: -0.2316, MAE: 0.1625, Spearman rho: 0.4647, Spearman p: 2.3208e-33, Pearson r: 0.4872, Pearson p: 5.6005e-37
  Pred range: [0.1335, 0.6621], std: 0.0957
  RMSE : 0.1722, R2: 0.0100, MAE: 0.1460, Spearman rho: 0.4736, Spearman p: 9.3649e-35, Pearson r: 0.5010, Pearson p: 2.5605e-39
  Pred range: [0.0718, 0.5812], std: 0.0882
  RMSE : 0.1619, R2: 0.1247, MAE: 0.1353, Spearman rho: 0.4891, Spearman p: 2.7676e-37, Pearson r: 0.5083, Pearson p: 1.3393e-40
  Pred range: [0.0605, 0.5827], std: 0.0868
  RMSE : 0.1559, R2: 0.1891, MAE: 0.1288, Spearman rho: 0.4704, Spearman p: 2.9394e-34, Pearson r: 0.4986, Pearson p: 6.7358e-39
  Pred range: [-0.0175, 0.4719], std: 0.0805
  RMSE : 0.1624, R2: 0.1197, MAE: 0.1203, Spearman rho: 0.4075, Spearman p: 2.4963e-25, Pearson r: 0.4374, Pearson p: 2.4793e-29
  Pred range: [0.0548, 0.5792], std: 0.0938
  RMSE : 0.1534, R2: 0.2143, MAE: 0.1235, Spearman rho: 0.4616, Spearman p: 6.8466e-33, Pearson r: 0.4851, Pearson p: 1.2537e-36
  Pred range: [0.0619, 0.6313], std: 0.0986
  RMSE : 0.1703, R2: 0.0318, MAE: 0.1433, Spearman rho: 0.4867, Spearman p: 7.0065e-37, Pearson r: 0.5057, Pearson p: 3.7643e-40
  Pred range: [0.0852, 0.5515], std: 0.0893
  RMSE : 0.1520, R2: 0.2293, MAE: 0.1214, Spearman rho: 0.4699, Spearman p: 3.6036e-34, Pearson r: 0.4897, Pearson p: 2.1340e-37
[I 2026-04-28 00:42:34,336] Trial 7 finished with value: 0.15195137626014332 and parameters: {'learning_rate': 0.005960231537843525, 'batch_size': 6, 'num_epochs': 12, 'weight_decay': 0.0011255234244978657, 'depth_complex': 6, 'depth_moderate': 4, 'depth_simple': 3, 'dropout': 0.4965463058136752, 'se_reduction': 8, 'hidden_dim_min': 10, 'base_loss': 'huber', 'huber_delta': 0.09580676414220984, 'focal_gamma': 2.5145108737043653, 'n_bins': 8, 'scheduler_patience': 2, 'scheduler_factor': 0.6169127043892264, 'early_stopping_patience': 7}. Best is trial 5 with value: 0.1517902491797665.
Train: 2407 rows (1613 IDs),Test: 598 rows (404 IDs) 

n_features_x : 6, n_features_per_modality: [16, 23, 19, 17, 7, 4, 4, 4, 1, 4]

--- ImbalancedRegressionLoss initialized ---
  Bins: 15, Focal gamma: 2.1011857343831144, Base loss: mse
  Bin [0.00, 0.07): count=  383, weight=0.040
  Bin [0.07, 0.13): count=  377, weight=0.041
  Bin [0.13, 0.20): count=  405, weight=0.038
  Bin [0.20, 0.27): count=  295, weight=0.052
  Bin [0.27, 0.33): count=  349, weight=0.044
  Bin [0.33, 0.40): count=  162, weight=0.094
  Bin [0.40, 0.47): count=  134, weight=0.114
  Bin [0.47, 0.53): count=  108, weight=0.141
  Bin [0.53, 0.60): count=   78, weight=0.194
  Bin [0.60, 0.67): count=   47, weight=0.320
  Bin [0.67, 0.73): count=   41, weight=0.365
  Bin [0.73, 0.80): count=   19, weight=0.767
  Bin [0.80, 0.87): count=    5, weight=2.558
  Bin [0.87, 0.93): count=    2, weight=5.116
  Bin [0.93, 1.00): count=    2, weight=5.116
-------------------------------------------

  Pred range: [0.1352, 0.7004], std: 0.0858
  RMSE : 0.2125, R2: -0.5077, MAE: 0.1842, Spearman rho: 0.4060, Spearman p: 3.9391e-25, Pearson r: 0.4306, Pearson p: 2.1340e-28
  Pred range: [0.1526, 0.7342], std: 0.0933
  RMSE : 0.2148, R2: -0.5405, MAE: 0.1868, Spearman rho: 0.4552, Spearman p: 6.3098e-32, Pearson r: 0.4840, Pearson p: 1.9315e-36
  Pred range: [0.1413, 0.6623], std: 0.0888
  RMSE : 0.1875, R2: -0.1731, MAE: 0.1613, Spearman rho: 0.4681, Spearman p: 6.8039e-34, Pearson r: 0.5014, Pearson p: 2.1721e-39
  Pred range: [0.1327, 0.6577], std: 0.0884
  RMSE : 0.1773, R2: -0.0490, MAE: 0.1513, Spearman rho: 0.4628, Spearman p: 4.5036e-33, Pearson r: 0.5020, Pearson p: 1.7006e-39
  Pred range: [0.1316, 0.6796], std: 0.0928
  RMSE : 0.1821, R2: -0.1071, MAE: 0.1562, Spearman rho: 0.4707, Spearman p: 2.6788e-34, Pearson r: 0.5093, Pearson p: 8.7270e-41
  Pred range: [0.1297, 0.7296], std: 0.0998
  RMSE : 0.1933, R2: -0.2467, MAE: 0.1657, Spearman rho: 0.4605, Spearman p: 1.0138e-32, Pearson r: 0.4946, Pearson p: 3.2631e-38
[I 2026-04-28 00:42:42,942] Trial 8 pruned. 
Train: 2407 rows (1613 IDs),Test: 598 rows (404 IDs) 

n_features_x : 6, n_features_per_modality: [16, 23, 19, 17, 7, 4, 4, 4, 1, 4]

--- ImbalancedRegressionLoss initialized ---
  Bins: 17, Focal gamma: 2.7764207676836152, Base loss: mse
  Bin [0.00, 0.06): count=  172, weight=0.058
  Bin [0.06, 0.12): count=  413, weight=0.024
  Bin [0.12, 0.18): count=  376, weight=0.027
  Bin [0.18, 0.24): count=  370, weight=0.027
  Bin [0.24, 0.29): count=  255, weight=0.039
  Bin [0.29, 0.35): count=  223, weight=0.045
  Bin [0.35, 0.41): count=  162, weight=0.061
  Bin [0.41, 0.47): count=  134, weight=0.074
  Bin [0.47, 0.53): count=  108, weight=0.092
  Bin [0.53, 0.59): count=   78, weight=0.127
  Bin [0.59, 0.65): count=   47, weight=0.208
  Bin [0.65, 0.71): count=   27, weight=0.357
  Bin [0.71, 0.76): count=   26, weight=0.370
  Bin [0.76, 0.82): count=    9, weight=0.999
  Bin [0.82, 0.88): count=    4, weight=1.999
  Bin [0.88, 0.94): count=    3, weight=2.499
  Bin [0.94, 1.00): count=    0, weight=9.995
-------------------------------------------

  Pred range: [-0.1512, 0.0533], std: 0.0316
  RMSE : 0.3270, R2: -2.5701, MAE: 0.2721, Spearman rho: -0.1940, Spearman p: 1.7500e-06, Pearson r: -0.1853, Pearson p: 5.0893e-06
  Pred range: [-0.1184, 0.0807], std: 0.0311
  RMSE : 0.3069, R2: -2.1443, MAE: 0.2490, Spearman rho: -0.1558, Spearman p: 1.3008e-04, Pearson r: -0.1506, Pearson p: 2.1816e-04
  Pred range: [-0.0910, 0.1074], std: 0.0310
  RMSE : 0.2880, R2: -1.7679, MAE: 0.2272, Spearman rho: -0.1171, Spearman p: 4.1272e-03, Pearson r: -0.1151, Pearson p: 4.8145e-03
  Pred range: [-0.0659, 0.1344], std: 0.0314
  RMSE : 0.2697, R2: -1.4284, MAE: 0.2068, Spearman rho: -0.0809, Spearman p: 4.8078e-02, Pearson r: -0.0781, Pearson p: 5.6153e-02
  Pred range: [-0.0410, 0.1656], std: 0.0324
  RMSE : 0.2526, R2: -1.1302, MAE: 0.1891, Spearman rho: -0.0453, Spearman p: 2.6924e-01, Pearson r: -0.0419, Pearson p: 3.0634e-01
  Pred range: [-0.0169, 0.1964], std: 0.0336
  RMSE : 0.2367, R2: -0.8694, MAE: 0.1740, Spearman rho: -0.0133, Spearman p: 7.4626e-01, Pearson r: -0.0086, Pearson p: 8.3373e-01
[I 2026-04-28 00:42:55,000] Trial 9 pruned. 
Train: 2407 rows (1613 IDs),Test: 598 rows (404 IDs) 

n_features_x : 6, n_features_per_modality: [16, 23, 19, 17, 7, 4, 4, 4, 1, 4]

--- ImbalancedRegressionLoss initialized ---
  Bins: 5, Focal gamma: 1.4399056257138882, Base loss: mse
  Bin [0.00, 0.20): count= 1165, weight=0.037
  Bin [0.20, 0.40): count=  806, weight=0.054
  Bin [0.40, 0.60): count=  320, weight=0.136
  Bin [0.60, 0.80): count=  107, weight=0.404
  Bin [0.80, 1.00): count=    9, weight=4.368
-------------------------------------------

  Pred range: [0.1033, 0.5676], std: 0.0681
  RMSE : 0.1642, R2: 0.1003, MAE: 0.1367, Spearman rho: 0.4543, Spearman p: 8.7030e-32, Pearson r: 0.4693, Pearson p: 4.3478e-34
  Pred range: [0.0986, 0.5941], std: 0.0899
  RMSE : 0.1591, R2: 0.1552, MAE: 0.1312, Spearman rho: 0.4874, Spearman p: 5.2538e-37, Pearson r: 0.4981, Pearson p: 8.2775e-39
  Pred range: [0.0919, 0.4920], std: 0.0753
  RMSE : 0.1512, R2: 0.2370, MAE: 0.1215, Spearman rho: 0.4924, Spearman p: 7.6723e-38, Pearson r: 0.5084, Pearson p: 1.2539e-40
  Pred range: [0.1053, 0.6137], std: 0.0930
  RMSE : 0.1611, R2: 0.1337, MAE: 0.1344, Spearman rho: 0.4971, Spearman p: 1.2111e-38, Pearson r: 0.5158, Pearson p: 5.7453e-42
  Pred range: [0.1155, 0.5857], std: 0.0856
  RMSE : 0.1616, R2: 0.1282, MAE: 0.1355, Spearman rho: 0.4933, Spearman p: 5.3739e-38, Pearson r: 0.5147, Pearson p: 9.4055e-42
  Pred range: [0.1085, 0.5645], std: 0.0830
  RMSE : 0.1552, R2: 0.1965, MAE: 0.1280, Spearman rho: 0.4958, Spearman p: 2.0059e-38, Pearson r: 0.5151, Pearson p: 7.8977e-42
  Pred range: [0.0834, 0.5283], std: 0.0806
  RMSE : 0.1503, R2: 0.2463, MAE: 0.1209, Spearman rho: 0.4869, Spearman p: 6.3457e-37, Pearson r: 0.5103, Pearson p: 5.8703e-41
  Pred range: [0.0359, 0.5186], std: 0.0832
  RMSE : 0.1496, R2: 0.2531, MAE: 0.1184, Spearman rho: 0.4832, Spearman p: 2.5841e-36, Pearson r: 0.5054, Pearson p: 4.2904e-40
  Pred range: [0.0919, 0.6090], std: 0.0887
  RMSE : 0.1616, R2: 0.1288, MAE: 0.1354, Spearman rho: 0.4876, Spearman p: 4.8111e-37, Pearson r: 0.5087, Pearson p: 1.1094e-40
  Pred range: [0.1007, 0.6155], std: 0.0899
  RMSE : 0.1623, R2: 0.1211, MAE: 0.1360, Spearman rho: 0.4857, Spearman p: 1.0093e-36, Pearson r: 0.5101, Pearson p: 6.4252e-41
  Pred range: [0.0554, 0.5409], std: 0.0834
  RMSE : 0.1506, R2: 0.2428, MAE: 0.1208, Spearman rho: 0.4835, Spearman p: 2.3072e-36, Pearson r: 0.5058, Pearson p: 3.7191e-40
  Pred range: [0.0383, 0.5477], std: 0.0883
  RMSE : 0.1501, R2: 0.2484, MAE: 0.1192, Spearman rho: 0.4849, Spearman p: 1.3671e-36, Pearson r: 0.5041, Pearson p: 7.2948e-40
  Pred range: [0.0205, 0.5785], std: 0.0888
  RMSE : 0.1518, R2: 0.2307, MAE: 0.1226, Spearman rho: 0.4797, Spearman p: 9.7619e-36, Pearson r: 0.5033, Pearson p: 1.0047e-39
  Pred range: [0.0597, 0.6709], std: 0.1021
  RMSE : 0.1644, R2: 0.0982, MAE: 0.1368, Spearman rho: 0.4912, Spearman p: 1.2028e-37, Pearson r: 0.5124, Pearson p: 2.4612e-41
  Pred range: [0.0493, 0.6337], std: 0.0966
  RMSE : 0.1585, R2: 0.1617, MAE: 0.1308, Spearman rho: 0.4884, Spearman p: 3.5676e-37, Pearson r: 0.5086, Pearson p: 1.1865e-40
  Pred range: [0.0112, 0.5782], std: 0.0895
  RMSE : 0.1512, R2: 0.2373, MAE: 0.1208, Spearman rho: 0.4772, Spearman p: 2.4702e-35, Pearson r: 0.4986, Pearson p: 6.6009e-39
[I 2026-04-28 00:45:09,901] Trial 10 finished with value: 0.14958902474585228 and parameters: {'learning_rate': 0.00028122464175713637, 'batch_size': 4, 'num_epochs': 24, 'weight_decay': 5.443056971364108e-05, 'depth_complex': 3, 'depth_moderate': 4, 'depth_simple': 2, 'dropout': 0.3897534662290754, 'se_reduction': 4, 'hidden_dim_min': 9, 'base_loss': 'mse', 'huber_delta': 0.14030070143102247, 'focal_gamma': 1.4399056257138882, 'n_bins': 5, 'scheduler_patience': 5, 'scheduler_factor': 0.5602978002998583, 'early_stopping_patience': 8}. Best is trial 10 with value: 0.14958902474585228.
Train: 2407 rows (1613 IDs),Test: 598 rows (404 IDs) 

n_features_x : 6, n_features_per_modality: [16, 23, 19, 17, 7, 4, 4, 4, 1, 4]

--- ImbalancedRegressionLoss initialized ---
  Bins: 5, Focal gamma: 1.4054040948865674, Base loss: mse
  Bin [0.00, 0.20): count= 1165, weight=0.037
  Bin [0.20, 0.40): count=  806, weight=0.054
  Bin [0.40, 0.60): count=  320, weight=0.136
  Bin [0.60, 0.80): count=  107, weight=0.404
  Bin [0.80, 1.00): count=    9, weight=4.368
-------------------------------------------

  Pred range: [0.1247, 0.6247], std: 0.0733
  RMSE : 0.1725, R2: 0.0064, MAE: 0.1448, Spearman rho: 0.4067, Spearman p: 3.1534e-25, Pearson r: 0.4242, Pearson p: 1.6271e-27
  Pred range: [0.1013, 0.5582], std: 0.0753
  RMSE : 0.1555, R2: 0.1931, MAE: 0.1271, Spearman rho: 0.4701, Spearman p: 3.3386e-34, Pearson r: 0.4893, Pearson p: 2.5082e-37
  Pred range: [0.1085, 0.6071], std: 0.0841
  RMSE : 0.1586, R2: 0.1609, MAE: 0.1317, Spearman rho: 0.4834, Spearman p: 2.4312e-36, Pearson r: 0.5031, Pearson p: 1.0770e-39
  Pred range: [0.1095, 0.5836], std: 0.0833
  RMSE : 0.1592, R2: 0.1539, MAE: 0.1325, Spearman rho: 0.4896, Spearman p: 2.2185e-37, Pearson r: 0.5068, Pearson p: 2.4059e-40
  Pred range: [0.0918, 0.6116], std: 0.0841
  RMSE : 0.1594, R2: 0.1514, MAE: 0.1328, Spearman rho: 0.4822, Spearman p: 3.8643e-36, Pearson r: 0.5042, Pearson p: 6.9106e-40
  Pred range: [0.0651, 0.6149], std: 0.0885
  RMSE : 0.1551, R2: 0.1967, MAE: 0.1277, Spearman rho: 0.4921, Spearman p: 8.5234e-38, Pearson r: 0.5113, Pearson p: 3.9183e-41
  Pred range: [0.0549, 0.6204], std: 0.0874
  RMSE : 0.1578, R2: 0.1689, MAE: 0.1309, Spearman rho: 0.4887, Spearman p: 3.1443e-37, Pearson r: 0.5081, Pearson p: 1.4274e-40
  Pred range: [0.0490, 0.6273], std: 0.0914
  RMSE : 0.1574, R2: 0.1727, MAE: 0.1303, Spearman rho: 0.4934, Spearman p: 5.1545e-38, Pearson r: 0.5143, Pearson p: 1.0925e-41
  Pred range: [0.0669, 0.6520], std: 0.0954
  RMSE : 0.1643, R2: 0.0988, MAE: 0.1375, Spearman rho: 0.4925, Spearman p: 7.4797e-38, Pearson r: 0.5117, Pearson p: 3.1947e-41
  Pred range: [0.0209, 0.5647], std: 0.0815
  RMSE : 0.1536, R2: 0.2128, MAE: 0.1254, Spearman rho: 0.4836, Spearman p: 2.2002e-36, Pearson r: 0.5006, Pearson p: 2.9826e-39
  Pred range: [0.0874, 0.6320], std: 0.0940
  RMSE : 0.1653, R2: 0.0880, MAE: 0.1388, Spearman rho: 0.4953, Spearman p: 2.4142e-38, Pearson r: 0.5125, Pearson p: 2.3489e-41
  Pred range: [0.0634, 0.6886], std: 0.1003
  RMSE : 0.1663, R2: 0.0766, MAE: 0.1390, Spearman rho: 0.4931, Spearman p: 5.8689e-38, Pearson r: 0.5116, Pearson p: 3.3696e-41
  Pred range: [0.0119, 0.5461], std: 0.0876
  RMSE : 0.1510, R2: 0.2392, MAE: 0.1207, Spearman rho: 0.4931, Spearman p: 5.7636e-38, Pearson r: 0.5035, Pearson p: 9.2812e-40
  Pred range: [0.0370, 0.6474], std: 0.0938
  RMSE : 0.1544, R2: 0.2040, MAE: 0.1254, Spearman rho: 0.4850, Spearman p: 1.3292e-36, Pearson r: 0.5021, Pearson p: 1.6173e-39
  Pred range: [0.0407, 0.6638], std: 0.0938
  RMSE : 0.1567, R2: 0.1807, MAE: 0.1288, Spearman rho: 0.4881, Spearman p: 3.9735e-37, Pearson r: 0.5074, Pearson p: 1.9031e-40
  Pred range: [0.0158, 0.6494], std: 0.0932
  RMSE : 0.1586, R2: 0.1607, MAE: 0.1308, Spearman rho: 0.4891, Spearman p: 2.7274e-37, Pearson r: 0.5020, Pearson p: 1.7342e-39
  Pred range: [0.0584, 0.6453], std: 0.0915
  RMSE : 0.1552, R2: 0.1964, MAE: 0.1272, Spearman rho: 0.4872, Spearman p: 5.6337e-37, Pearson r: 0.5077, Pearson p: 1.7085e-40
  Pred range: [0.0180, 0.6392], std: 0.0956
  RMSE : 0.1537, R2: 0.2118, MAE: 0.1254, Spearman rho: 0.4906, Spearman p: 1.5494e-37, Pearson r: 0.5113, Pearson p: 3.9161e-41
  Pred range: [0.0609, 0.6524], std: 0.0954
  RMSE : 0.1630, R2: 0.1128, MAE: 0.1360, Spearman rho: 0.4847, Spearman p: 1.4696e-36, Pearson r: 0.5062, Pearson p: 3.1771e-40
  Pred range: [0.0096, 0.6546], std: 0.0971
  RMSE : 0.1548, R2: 0.2003, MAE: 0.1259, Spearman rho: 0.4866, Spearman p: 7.1541e-37, Pearson r: 0.5046, Pearson p: 6.0059e-40
  Pred range: [0.0247, 0.6634], std: 0.0992
  RMSE : 0.1601, R2: 0.1446, MAE: 0.1319, Spearman rho: 0.4835, Spearman p: 2.2967e-36, Pearson r: 0.5008, Pearson p: 2.7549e-39
[I 2026-04-28 00:48:07,088] Trial 11 finished with value: 0.15097573639124276 and parameters: {'learning_rate': 0.00029416636319916194, 'batch_size': 4, 'num_epochs': 25, 'weight_decay': 6.434476974014445e-05, 'depth_complex': 3, 'depth_moderate': 4, 'depth_simple': 2, 'dropout': 0.37515165542552664, 'se_reduction': 4, 'hidden_dim_min': 9, 'base_loss': 'mse', 'huber_delta': 0.1369643691340297, 'focal_gamma': 1.4054040948865674, 'n_bins': 5, 'scheduler_patience': 5, 'scheduler_factor': 0.5574739168125228, 'early_stopping_patience': 8}. Best is trial 10 with value: 0.14958902474585228.
Train: 2407 rows (1613 IDs),Test: 598 rows (404 IDs) 

n_features_x : 6, n_features_per_modality: [16, 23, 19, 17, 7, 4, 4, 4, 1, 4]

--- ImbalancedRegressionLoss initialized ---
  Bins: 5, Focal gamma: 1.3120059705886895, Base loss: mse
  Bin [0.00, 0.20): count= 1165, weight=0.037
  Bin [0.20, 0.40): count=  806, weight=0.054
  Bin [0.40, 0.60): count=  320, weight=0.136
  Bin [0.60, 0.80): count=  107, weight=0.404
  Bin [0.80, 1.00): count=    9, weight=4.368
-------------------------------------------

  Pred range: [0.1057, 0.5509], std: 0.0775
  RMSE : 0.1586, R2: 0.1605, MAE: 0.1311, Spearman rho: 0.4571, Spearman p: 3.3198e-32, Pearson r: 0.4730, Pearson p: 1.1668e-34
  Pred range: [0.1428, 0.6161], std: 0.0843
  RMSE : 0.1696, R2: 0.0404, MAE: 0.1440, Spearman rho: 0.4792, Spearman p: 1.1750e-35, Pearson r: 0.4987, Pearson p: 6.2932e-39
  Pred range: [0.0918, 0.5255], std: 0.0771
  RMSE : 0.1498, R2: 0.2513, MAE: 0.1165, Spearman rho: 0.4815, Spearman p: 4.9121e-36, Pearson r: 0.5048, Pearson p: 5.5406e-40
  Pred range: [0.1031, 0.5784], std: 0.0798
  RMSE : 0.1530, R2: 0.2182, MAE: 0.1248, Spearman rho: 0.4820, Spearman p: 4.0690e-36, Pearson r: 0.5074, Pearson p: 1.9104e-40
  Pred range: [0.0524, 0.6584], std: 0.0894
  RMSE : 0.1603, R2: 0.1422, MAE: 0.1337, Spearman rho: 0.4837, Spearman p: 2.1143e-36, Pearson r: 0.5048, Pearson p: 5.4331e-40
  Pred range: [0.0854, 0.6240], std: 0.0860
  RMSE : 0.1561, R2: 0.1870, MAE: 0.1287, Spearman rho: 0.4848, Spearman p: 1.4112e-36, Pearson r: 0.5049, Pearson p: 5.3133e-40
  Pred range: [0.0569, 0.6299], std: 0.0936
  RMSE : 0.1511, R2: 0.2375, MAE: 0.1222, Spearman rho: 0.4965, Spearman p: 1.5004e-38, Pearson r: 0.5195, Pearson p: 1.2387e-42
  Pred range: [0.0768, 0.6182], std: 0.0902
  RMSE : 0.1538, R2: 0.2106, MAE: 0.1261, Spearman rho: 0.4953, Spearman p: 2.4379e-38, Pearson r: 0.5163, Pearson p: 4.7532e-42
  Pred range: [0.0999, 0.6767], std: 0.0956
  RMSE : 0.1620, R2: 0.1238, MAE: 0.1356, Spearman rho: 0.4980, Spearman p: 8.4904e-39, Pearson r: 0.5216, Pearson p: 5.0166e-43
  Pred range: [0.0600, 0.6517], std: 0.0918
  RMSE : 0.1551, R2: 0.1966, MAE: 0.1275, Spearman rho: 0.4908, Spearman p: 1.4088e-37, Pearson r: 0.5157, Pearson p: 6.2049e-42
