[I 2026-04-29 00:59:53,564] Trial 43 finished with value: 0.08847213275085385 and parameters: {'learning_rate': 0.0004992837715717032, 'batch_size': 4, 'num_epochs': 12, 'weight_decay': 1.766966340349935e-05, 'layers_PRS': 3, 'layers_SCZ15': 3, 'layers_ADHD9': 3, 'layers_ASD9': 5, 'layers_ACE15': 5, 'layers_ACE18': 1, 'layers_SUD18': 3, 'layers_SES': 4, 'layers_SEX': 1, 'dropout': 0.30090624901280316, 'se_reduction': 2, 'hidden_dim_min': 12, 'base_loss': 'huber', 'huber_delta': 0.021309686440697525, 'focal_gamma': 2.993281655295632, 'n_bins': 11, 'scheduler_patience': 2, 'scheduler_factor': 0.4172591274400401, 'early_stopping_patience': 7}. Best is trial 32 with value: 0.08834048484537571.
Train: 2407 rows (1613 IDs),Test: 598 rows (404 IDs) 

n_features_x : 6, n_features_per_modality: [16, 23, 19, 17, 7, 4, 4, 4, 1, 4]

--- ImbalancedRegressionLoss initialized ---
  Bins: 11, Focal gamma: 2.9129044876608456, Base loss: huber
  Bin [0.00, 0.09): count= 1010, weight=0.003
  Bin [0.09, 0.18): count=  706, weight=0.004
  Bin [0.18, 0.27): count=  478, weight=0.006
  Bin [0.27, 0.36): count=  159, weight=0.018
  Bin [0.36, 0.45): count=   33, weight=0.085
  Bin [0.45, 0.55): count=   16, weight=0.170
  Bin [0.55, 0.64): count=    4, weight=0.579
  Bin [0.64, 0.73): count=    1, weight=1.448
  Bin [0.73, 0.82): count=    0, weight=2.896
  Bin [0.82, 0.91): count=    0, weight=2.896
  Bin [0.91, 1.00): count=    0, weight=2.896
-------------------------------------------

  Pred range: [0.0571, 0.3385], std: 0.0505
  RMSE : 0.0944, R2: 0.1193, MAE: 0.0767, Spearman rho: 0.4287, Spearman p: 4.0069e-28, Pearson r: 0.4394, Pearson p: 1.2783e-29
  Pred range: [0.0564, 0.3886], std: 0.0560
  RMSE : 0.0961, R2: 0.0873, MAE: 0.0782, Spearman rho: 0.4427, Spearman p: 4.3632e-30, Pearson r: 0.4589, Pearson p: 1.7471e-32
  Pred range: [0.0262, 0.3394], std: 0.0519
  RMSE : 0.0887, R2: 0.2222, MAE: 0.0707, Spearman rho: 0.4637, Spearman p: 3.3072e-33, Pearson r: 0.4778, Pearson p: 1.9348e-35
  Pred range: [0.0137, 0.3108], std: 0.0505
  RMSE : 0.0883, R2: 0.2298, MAE: 0.0696, Spearman rho: 0.4719, Spearman p: 1.6968e-34, Pearson r: 0.4834, Pearson p: 2.3980e-36
  Pred range: [0.0228, 0.3528], std: 0.0525
  RMSE : 0.0897, R2: 0.2054, MAE: 0.0716, Spearman rho: 0.4546, Spearman p: 7.7664e-32, Pearson r: 0.4662, Pearson p: 1.3291e-33
  Pred range: [0.0133, 0.3184], std: 0.0480
  RMSE : 0.0898, R2: 0.2039, MAE: 0.0724, Spearman rho: 0.4469, Spearman p: 1.0735e-30, Pearson r: 0.4616, Pearson p: 6.8645e-33
  Pred range: [0.0238, 0.3916], std: 0.0575
  RMSE : 0.0930, R2: 0.1461, MAE: 0.0748, Spearman rho: 0.4657, Spearman p: 1.5814e-33, Pearson r: 0.4744, Pearson p: 7.0079e-35
  Pred range: [0.0022, 0.3497], std: 0.0551
  RMSE : 0.0887, R2: 0.2218, MAE: 0.0705, Spearman rho: 0.4690, Spearman p: 4.9484e-34, Pearson r: 0.4782, Pearson p: 1.7231e-35
  Pred range: [0.0068, 0.3537], std: 0.0518
  RMSE : 0.0896, R2: 0.2073, MAE: 0.0721, Spearman rho: 0.4665, Spearman p: 1.2102e-33, Pearson r: 0.4767, Pearson p: 2.9493e-35
  Pred range: [-0.0226, 0.3255], std: 0.0503
  RMSE : 0.0886, R2: 0.2251, MAE: 0.0706, Spearman rho: 0.4675, Spearman p: 8.4059e-34, Pearson r: 0.4755, Pearson p: 4.5256e-35
[I 2026-04-29 01:01:27,885] Trial 44 finished with value: 0.08828183897632164 and parameters: {'learning_rate': 0.0005019060959050434, 'batch_size': 4, 'num_epochs': 10, 'weight_decay': 1.97432838105615e-05, 'layers_PRS': 2, 'layers_SCZ15': 4, 'layers_ADHD9': 4, 'layers_ASD9': 5, 'layers_ACE15': 5, 'layers_ACE18': 1, 'layers_SUD18': 2, 'layers_SES': 4, 'layers_SEX': 1, 'dropout': 0.1928228216274375, 'se_reduction': 2, 'hidden_dim_min': 13, 'base_loss': 'huber', 'huber_delta': 0.02178954155692172, 'focal_gamma': 2.9129044876608456, 'n_bins': 11, 'scheduler_patience': 2, 'scheduler_factor': 0.40706704827056944, 'early_stopping_patience': 7}. Best is trial 44 with value: 0.08828183897632164.
Train: 2407 rows (1613 IDs),Test: 598 rows (404 IDs) 

n_features_x : 6, n_features_per_modality: [16, 23, 19, 17, 7, 4, 4, 4, 1, 4]

--- ImbalancedRegressionLoss initialized ---
  Bins: 11, Focal gamma: 2.9636812294765065, Base loss: huber
  Bin [0.00, 0.09): count= 1010, weight=0.003
  Bin [0.09, 0.18): count=  706, weight=0.004
  Bin [0.18, 0.27): count=  478, weight=0.006
  Bin [0.27, 0.36): count=  159, weight=0.018
  Bin [0.36, 0.45): count=   33, weight=0.085
  Bin [0.45, 0.55): count=   16, weight=0.170
  Bin [0.55, 0.64): count=    4, weight=0.579
  Bin [0.64, 0.73): count=    1, weight=1.448
  Bin [0.73, 0.82): count=    0, weight=2.896
  Bin [0.82, 0.91): count=    0, weight=2.896
  Bin [0.91, 1.00): count=    0, weight=2.896
-------------------------------------------

  Pred range: [0.0718, 0.4024], std: 0.0532
  RMSE : 0.0992, R2: 0.0269, MAE: 0.0805, Spearman rho: 0.4231, Spearman p: 2.2799e-27, Pearson r: 0.4334, Pearson p: 8.9152e-29
  Pred range: [0.0721, 0.4346], std: 0.0555
  RMSE : 0.0985, R2: 0.0405, MAE: 0.0799, Spearman rho: 0.4430, Spearman p: 3.8530e-30, Pearson r: 0.4474, Pearson p: 8.9381e-31
  Pred range: [0.0717, 0.3699], std: 0.0518
  RMSE : 0.0938, R2: 0.1297, MAE: 0.0757, Spearman rho: 0.4548, Spearman p: 7.3550e-32, Pearson r: 0.4559, Pearson p: 4.9748e-32
  Pred range: [0.0643, 0.3931], std: 0.0565
  RMSE : 0.0947, R2: 0.1145, MAE: 0.0762, Spearman rho: 0.4518, Spearman p: 2.0590e-31, Pearson r: 0.4569, Pearson p: 3.5803e-32
  Pred range: [0.0694, 0.3657], std: 0.0492
  RMSE : 0.0935, R2: 0.1365, MAE: 0.0754, Spearman rho: 0.4564, Spearman p: 4.2410e-32, Pearson r: 0.4641, Pearson p: 2.8002e-33
  Pred range: [0.0401, 0.3371], std: 0.0474
  RMSE : 0.0890, R2: 0.2173, MAE: 0.0711, Spearman rho: 0.4639, Spearman p: 2.9913e-33, Pearson r: 0.4747, Pearson p: 6.2661e-35
  Pred range: [0.0654, 0.3995], std: 0.0541
  RMSE : 0.0955, R2: 0.0996, MAE: 0.0772, Spearman rho: 0.4538, Spearman p: 1.0403e-31, Pearson r: 0.4633, Pearson p: 3.7547e-33
  Pred range: [0.0460, 0.3496], std: 0.0481
  RMSE : 0.0900, R2: 0.1995, MAE: 0.0721, Spearman rho: 0.4435, Spearman p: 3.2571e-30, Pearson r: 0.4567, Pearson p: 3.7551e-32
  Pred range: [0.0551, 0.3661], std: 0.0519
  RMSE : 0.0914, R2: 0.1750, MAE: 0.0734, Spearman rho: 0.4622, Spearman p: 5.6313e-33, Pearson r: 0.4738, Pearson p: 8.6003e-35
  Pred range: [0.0485, 0.3758], std: 0.0536
  RMSE : 0.0907, R2: 0.1870, MAE: 0.0726, Spearman rho: 0.4608, Spearman p: 9.1385e-33, Pearson r: 0.4709, Pearson p: 2.4908e-34
[I 2026-04-29 01:02:37,105] Trial 45 finished with value: 0.08899635318051392 and parameters: {'learning_rate': 0.0004630807304545048, 'batch_size': 6, 'num_epochs': 10, 'weight_decay': 1.9875320063211908e-05, 'layers_PRS': 3, 'layers_SCZ15': 4, 'layers_ADHD9': 4, 'layers_ASD9': 5, 'layers_ACE15': 5, 'layers_ACE18': 1, 'layers_SUD18': 3, 'layers_SES': 4, 'layers_SEX': 1, 'dropout': 0.19442604126697807, 'se_reduction': 2, 'hidden_dim_min': 13, 'base_loss': 'huber', 'huber_delta': 0.02180533603534945, 'focal_gamma': 2.9636812294765065, 'n_bins': 11, 'scheduler_patience': 2, 'scheduler_factor': 0.417105041645537, 'early_stopping_patience': 7}. Best is trial 44 with value: 0.08828183897632164.
Train: 2407 rows (1613 IDs),Test: 598 rows (404 IDs) 

n_features_x : 6, n_features_per_modality: [16, 23, 19, 17, 7, 4, 4, 4, 1, 4]

--- ImbalancedRegressionLoss initialized ---
  Bins: 13, Focal gamma: 2.8660437647170616, Base loss: mse
  Bin [0.00, 0.08): count=  828, weight=0.003
  Bin [0.08, 0.15): count=  710, weight=0.004
  Bin [0.15, 0.23): count=  477, weight=0.006
  Bin [0.23, 0.31): count=  288, weight=0.009
  Bin [0.31, 0.38): count=   63, weight=0.042
  Bin [0.38, 0.46): count=   23, weight=0.113
  Bin [0.46, 0.54): count=   10, weight=0.247
  Bin [0.54, 0.62): count=    7, weight=0.340
  Bin [0.62, 0.69): count=    0, weight=2.719
  Bin [0.69, 0.77): count=    1, weight=1.359
  Bin [0.77, 0.85): count=    0, weight=2.719
  Bin [0.85, 0.92): count=    0, weight=2.719
  Bin [0.92, 1.00): count=    0, weight=2.719
-------------------------------------------

  Pred range: [0.0541, 0.3552], std: 0.0408
  RMSE : 0.0953, R2: 0.1017, MAE: 0.0772, Spearman rho: 0.3878, Spearman p: 6.7758e-23, Pearson r: 0.3830, Pearson p: 2.4755e-22
  Pred range: [0.0493, 0.3986], std: 0.0479
  RMSE : 0.0935, R2: 0.1370, MAE: 0.0754, Spearman rho: 0.4042, Spearman p: 6.5482e-25, Pearson r: 0.4104, Pearson p: 1.0607e-25
  Pred range: [0.0811, 0.3565], std: 0.0415
  RMSE : 0.1021, R2: -0.0306, MAE: 0.0841, Spearman rho: 0.4003, Spearman p: 2.0398e-24, Pearson r: 0.4054, Pearson p: 4.6410e-25
  Pred range: [0.0322, 0.4382], std: 0.0561
  RMSE : 0.0993, R2: 0.0250, MAE: 0.0809, Spearman rho: 0.4249, Spearman p: 1.2990e-27, Pearson r: 0.4280, Pearson p: 4.9747e-28
  Pred range: [0.0207, 0.4011], std: 0.0452
  RMSE : 0.0934, R2: 0.1387, MAE: 0.0756, Spearman rho: 0.4250, Spearman p: 1.2750e-27, Pearson r: 0.4294, Pearson p: 3.1444e-28
  Pred range: [0.0629, 0.4468], std: 0.0501
  RMSE : 0.0996, R2: 0.0202, MAE: 0.0818, Spearman rho: 0.4257, Spearman p: 1.0225e-27, Pearson r: 0.4327, Pearson p: 1.1234e-28
[I 2026-04-29 01:02:54,556] Trial 46 pruned. 
Train: 2407 rows (1613 IDs),Test: 598 rows (404 IDs) 

n_features_x : 6, n_features_per_modality: [16, 23, 19, 17, 7, 4, 4, 4, 1, 4]

--- ImbalancedRegressionLoss initialized ---
  Bins: 10, Focal gamma: 2.6381167276961652, Base loss: huber
  Bin [0.00, 0.10): count= 1010, weight=0.003
  Bin [0.10, 0.20): count=  866, weight=0.003
  Bin [0.20, 0.30): count=  386, weight=0.007
  Bin [0.30, 0.40): count=  111, weight=0.026
  Bin [0.40, 0.50): count=   23, weight=0.119
  Bin [0.50, 0.60): count=    9, weight=0.287
  Bin [0.60, 0.70): count=    2, weight=0.955
  Bin [0.70, 0.80): count=    0, weight=2.866
  Bin [0.80, 0.90): count=    0, weight=2.866
  Bin [0.90, 1.00): count=    0, weight=2.866
-------------------------------------------

  Pred range: [0.0478, 0.3303], std: 0.0428
  RMSE : 0.0894, R2: 0.2106, MAE: 0.0716, Spearman rho: 0.4531, Spearman p: 1.3097e-31, Pearson r: 0.4602, Pearson p: 1.1114e-32
  Pred range: [0.0379, 0.3863], std: 0.0570
  RMSE : 0.0885, R2: 0.2258, MAE: 0.0702, Spearman rho: 0.4776, Spearman p: 2.1007e-35, Pearson r: 0.4826, Pearson p: 3.2395e-36
  Pred range: [0.0423, 0.3651], std: 0.0582
  RMSE : 0.0887, R2: 0.2229, MAE: 0.0707, Spearman rho: 0.4889, Spearman p: 2.9325e-37, Pearson r: 0.4972, Pearson p: 1.1747e-38
  Pred range: [0.0290, 0.3297], std: 0.0518
  RMSE : 0.0881, R2: 0.2329, MAE: 0.0704, Spearman rho: 0.4753, Spearman p: 4.9434e-35, Pearson r: 0.4841, Pearson p: 1.8389e-36
  Pred range: [0.0044, 0.3640], std: 0.0536
  RMSE : 0.0903, R2: 0.1936, MAE: 0.0729, Spearman rho: 0.4706, Spearman p: 2.7903e-34, Pearson r: 0.4757, Pearson p: 4.2479e-35
  Pred range: [0.0112, 0.3408], std: 0.0531
  RMSE : 0.0885, R2: 0.2252, MAE: 0.0705, Spearman rho: 0.4736, Spearman p: 9.1078e-35, Pearson r: 0.4775, Pearson p: 2.2020e-35
  Pred range: [0.0215, 0.3691], std: 0.0558
  RMSE : 0.0887, R2: 0.2217, MAE: 0.0706, Spearman rho: 0.4750, Spearman p: 5.5941e-35, Pearson r: 0.4805, Pearson p: 7.1880e-36
  Pred range: [0.0254, 0.3672], std: 0.0554
  RMSE : 0.0906, R2: 0.1889, MAE: 0.0728, Spearman rho: 0.4732, Spearman p: 1.0511e-34, Pearson r: 0.4805, Pearson p: 7.0517e-36
  Pred range: [0.0205, 0.3792], std: 0.0568
  RMSE : 0.0899, R2: 0.2005, MAE: 0.0720, Spearman rho: 0.4819, Spearman p: 4.3252e-36, Pearson r: 0.4855, Pearson p: 1.0872e-36
  Pred range: [0.0135, 0.3534], std: 0.0543
  RMSE : 0.0888, R2: 0.2203, MAE: 0.0709, Spearman rho: 0.4786, Spearman p: 1.4799e-35, Pearson r: 0.4845, Pearson p: 1.5679e-36
  Pred range: [0.0154, 0.3642], std: 0.0548
  RMSE : 0.0896, R2: 0.2075, MAE: 0.0717, Spearman rho: 0.4788, Spearman p: 1.3566e-35, Pearson r: 0.4843, Pearson p: 1.7337e-36
[I 2026-04-29 01:04:27,475] Trial 47 finished with value: 0.08810896773294083 and parameters: {'learning_rate': 0.0005290143613782196, 'batch_size': 4, 'num_epochs': 12, 'weight_decay': 2.9403379028811774e-05, 'layers_PRS': 1, 'layers_SCZ15': 4, 'layers_ADHD9': 5, 'layers_ASD9': 5, 'layers_ACE15': 1, 'layers_ACE18': 1, 'layers_SUD18': 2, 'layers_SES': 4, 'layers_SEX': 1, 'dropout': 0.24404259470937037, 'se_reduction': 2, 'hidden_dim_min': 13, 'base_loss': 'huber', 'huber_delta': 0.03342532350375165, 'focal_gamma': 2.6381167276961652, 'n_bins': 10, 'scheduler_patience': 2, 'scheduler_factor': 0.3731385035657518, 'early_stopping_patience': 7}. Best is trial 47 with value: 0.08810896773294083.
Train: 2407 rows (1613 IDs),Test: 598 rows (404 IDs) 

n_features_x : 6, n_features_per_modality: [16, 23, 19, 17, 7, 4, 4, 4, 1, 4]

--- ImbalancedRegressionLoss initialized ---
  Bins: 10, Focal gamma: 2.266378407738493, Base loss: huber
  Bin [0.00, 0.10): count= 1010, weight=0.003
  Bin [0.10, 0.20): count=  866, weight=0.003
  Bin [0.20, 0.30): count=  386, weight=0.007
  Bin [0.30, 0.40): count=  111, weight=0.026
  Bin [0.40, 0.50): count=   23, weight=0.119
  Bin [0.50, 0.60): count=    9, weight=0.287
  Bin [0.60, 0.70): count=    2, weight=0.955
  Bin [0.70, 0.80): count=    0, weight=2.866
  Bin [0.80, 0.90): count=    0, weight=2.866
  Bin [0.90, 1.00): count=    0, weight=2.866
-------------------------------------------

  Pred range: [0.0253, 0.3637], std: 0.0561
  RMSE : 0.0938, R2: 0.1311, MAE: 0.0745, Spearman rho: 0.4151, Spearman p: 2.6389e-26, Pearson r: 0.4152, Pearson p: 2.5352e-26
  Pred range: [0.0512, 0.4017], std: 0.0575
  RMSE : 0.0942, R2: 0.1240, MAE: 0.0754, Spearman rho: 0.4382, Spearman p: 1.8786e-29, Pearson r: 0.4403, Pearson p: 9.4468e-30
  Pred range: [0.0557, 0.3668], std: 0.0534
  RMSE : 0.0908, R2: 0.1849, MAE: 0.0723, Spearman rho: 0.4569, Spearman p: 3.4948e-32, Pearson r: 0.4587, Pearson p: 1.8660e-32
  Pred range: [0.0535, 0.3769], std: 0.0556
  RMSE : 0.0904, R2: 0.1918, MAE: 0.0718, Spearman rho: 0.4626, Spearman p: 4.8157e-33, Pearson r: 0.4666, Pearson p: 1.1794e-33
  Pred range: [0.0594, 0.3663], std: 0.0526
  RMSE : 0.0906, R2: 0.1889, MAE: 0.0724, Spearman rho: 0.4654, Spearman p: 1.7875e-33, Pearson r: 0.4696, Pearson p: 3.9506e-34
  Pred range: [0.0674, 0.3946], std: 0.0556
  RMSE : 0.0949, R2: 0.1095, MAE: 0.0769, Spearman rho: 0.4633, Spearman p: 3.8190e-33, Pearson r: 0.4692, Pearson p: 4.6465e-34
  Pred range: [0.0465, 0.3765], std: 0.0545
  RMSE : 0.0900, R2: 0.2001, MAE: 0.0717, Spearman rho: 0.4735, Spearman p: 9.4153e-35, Pearson r: 0.4746, Pearson p: 6.2938e-35
  Pred range: [0.0635, 0.4029], std: 0.0579
  RMSE : 0.0954, R2: 0.1002, MAE: 0.0774, Spearman rho: 0.4681, Spearman p: 6.7202e-34, Pearson r: 0.4736, Pearson p: 9.2391e-35
  Pred range: [0.0510, 0.3850], std: 0.0537
  RMSE : 0.0929, R2: 0.1476, MAE: 0.0751, Spearman rho: 0.4699, Spearman p: 3.5029e-34, Pearson r: 0.4758, Pearson p: 4.0839e-35
  Pred range: [0.0519, 0.3931], std: 0.0582
  RMSE : 0.0930, R2: 0.1446, MAE: 0.0746, Spearman rho: 0.4653, Spearman p: 1.8238e-33, Pearson r: 0.4713, Pearson p: 2.1039e-34
  Pred range: [0.0543, 0.3936], std: 0.0569
  RMSE : 0.0940, R2: 0.1276, MAE: 0.0759, Spearman rho: 0.4685, Spearman p: 5.8142e-34, Pearson r: 0.4738, Pearson p: 8.5359e-35
  Pred range: [0.0462, 0.3917], std: 0.0575
  RMSE : 0.0921, R2: 0.1622, MAE: 0.0738, Spearman rho: 0.4699, Spearman p: 3.4879e-34, Pearson r: 0.4737, Pearson p: 8.9910e-35
  Pred range: [0.0427, 0.3924], std: 0.0573
  RMSE : 0.0922, R2: 0.1594, MAE: 0.0740, Spearman rho: 0.4688, Spearman p: 5.2980e-34, Pearson r: 0.4734, Pearson p: 9.7679e-35
[I 2026-04-29 01:05:28,445] Trial 48 finished with value: 0.08996975914706186 and parameters: {'learning_rate': 0.0003111271690167657, 'batch_size': 8, 'num_epochs': 13, 'weight_decay': 3.1383029435560225e-05, 'layers_PRS': 1, 'layers_SCZ15': 4, 'layers_ADHD9': 5, 'layers_ASD9': 5, 'layers_ACE15': 1, 'layers_ACE18': 1, 'layers_SUD18': 2, 'layers_SES': 4, 'layers_SEX': 5, 'dropout': 0.20491931283406783, 'se_reduction': 6, 'hidden_dim_min': 15, 'base_loss': 'huber', 'huber_delta': 0.03566606578528858, 'focal_gamma': 2.266378407738493, 'n_bins': 10, 'scheduler_patience': 3, 'scheduler_factor': 0.3705801434932788, 'early_stopping_patience': 8}. Best is trial 47 with value: 0.08810896773294083.
Train: 2407 rows (1613 IDs),Test: 598 rows (404 IDs) 

n_features_x : 6, n_features_per_modality: [16, 23, 19, 17, 7, 4, 4, 4, 1, 4]

--- ImbalancedRegressionLoss initialized ---
  Bins: 9, Focal gamma: 2.582005822447618, Base loss: huber
  Bin [0.00, 0.11): count= 1180, weight=0.003
  Bin [0.11, 0.22): count=  835, weight=0.004
  Bin [0.22, 0.33): count=  312, weight=0.010
  Bin [0.33, 0.44): count=   59, weight=0.054
  Bin [0.44, 0.56): count=   16, weight=0.190
  Bin [0.56, 0.67): count=    4, weight=0.647
  Bin [0.67, 0.78): count=    1, weight=1.618
  Bin [0.78, 0.89): count=    0, weight=3.237
  Bin [0.89, 1.00): count=    0, weight=3.237
-------------------------------------------

  Pred range: [0.0379, 0.3953], std: 0.0566
  RMSE : 0.0895, R2: 0.2086, MAE: 0.0715, Spearman rho: 0.4705, Spearman p: 2.8721e-34, Pearson r: 0.4797, Pearson p: 9.7601e-36
  Pred range: [0.0793, 0.3874], std: 0.0491
  RMSE : 0.0964, R2: 0.0811, MAE: 0.0788, Spearman rho: 0.4528, Spearman p: 1.4322e-31, Pearson r: 0.4648, Pearson p: 2.1941e-33
  Pred range: [0.0410, 0.3364], std: 0.0510
  RMSE : 0.0897, R2: 0.2056, MAE: 0.0714, Spearman rho: 0.4491, Spearman p: 5.0764e-31, Pearson r: 0.4598, Pearson p: 1.2673e-32
  Pred range: [0.0233, 0.3398], std: 0.0513
  RMSE : 0.0886, R2: 0.2238, MAE: 0.0709, Spearman rho: 0.4687, Spearman p: 5.4528e-34, Pearson r: 0.4779, Pearson p: 1.9089e-35
  Pred range: [0.0449, 0.3792], std: 0.0535
  RMSE : 0.0905, R2: 0.1913, MAE: 0.0728, Spearman rho: 0.4711, Spearman p: 2.2912e-34, Pearson r: 0.4766, Pearson p: 3.0716e-35
  Pred range: [0.0171, 0.3280], std: 0.0540
  RMSE : 0.0899, R2: 0.2012, MAE: 0.0699, Spearman rho: 0.4792, Spearman p: 1.1479e-35, Pearson r: 0.4835, Pearson p: 2.3356e-36
  Pred range: [0.0234, 0.3731], std: 0.0490
  RMSE : 0.0898, R2: 0.2027, MAE: 0.0721, Spearman rho: 0.4552, Spearman p: 6.4037e-32, Pearson r: 0.4626, Pearson p: 4.8898e-33
  Pred range: [0.0309, 0.3758], std: 0.0531
  RMSE : 0.0893, R2: 0.2120, MAE: 0.0712, Spearman rho: 0.4676, Spearman p: 8.2138e-34, Pearson r: 0.4718, Pearson p: 1.7917e-34
  Pred range: [0.0412, 0.3665], std: 0.0533
  RMSE : 0.0908, R2: 0.1855, MAE: 0.0729, Spearman rho: 0.4553, Spearman p: 6.1114e-32, Pearson r: 0.4624, Pearson p: 5.1827e-33
  Pred range: [0.0258, 0.3726], std: 0.0563
  RMSE : 0.0892, R2: 0.2137, MAE: 0.0707, Spearman rho: 0.4657, Spearman p: 1.5786e-33, Pearson r: 0.4730, Pearson p: 1.1707e-34
  Pred range: [0.0269, 0.3728], std: 0.0561
  RMSE : 0.0888, R2: 0.2205, MAE: 0.0703, Spearman rho: 0.4714, Spearman p: 2.0911e-34, Pearson r: 0.4779, Pearson p: 1.8937e-35
