[I 2026-04-27 18:39:16,672] Trial 11 finished with value: 0.15510471942317205 and parameters: {'learning_rate': 0.001753663357191013, 'batch_size': 4, 'num_epochs': 23, 'weight_decay': 0.00044239065831772696, 'layers_PRS': 1, 'layers_SCZ15': 1, 'layers_ADHD9': 5, 'layers_ASD9': 7, 'layers_ACE15': 5, 'layers_ACE18': 7, 'layers_SUD18': 4, 'layers_SES': 1, 'layers_SEX': 5, 'dropout': 0.14676739395437252, 'se_reduction': 6, 'hidden_dim_min': 6, 'base_loss': 'huber', 'huber_delta': 0.08750356028562839, 'focal_gamma': 0.5306680920755618, 'n_bins': 20, 'scheduler_patience': 5, 'scheduler_factor': 0.398428714831487, 'early_stopping_patience': 3}. Best is trial 8 with value: 0.15005696427010315.
Train: 2407 rows (1613 IDs),Test: 598 rows (404 IDs) 

n_features_x : 6, n_features_per_modality: [16, 23, 19, 17, 7, 4, 4, 4, 1, 4]

--- ImbalancedRegressionLoss initialized ---
  Bins: 16, Focal gamma: 1.2618596515475913, Base loss: huber
  Bin [0.00, 0.06): count=  383, weight=0.041
  Bin [0.06, 0.12): count=  377, weight=0.042
  Bin [0.12, 0.19): count=  405, weight=0.039
  Bin [0.19, 0.25): count=  295, weight=0.053
  Bin [0.25, 0.31): count=  239, weight=0.066
  Bin [0.31, 0.38): count=  199, weight=0.079
  Bin [0.38, 0.44): count=  142, weight=0.111
  Bin [0.44, 0.50): count=  122, weight=0.129
  Bin [0.50, 0.56): count=   93, weight=0.168
  Bin [0.56, 0.62): count=   64, weight=0.243
  Bin [0.62, 0.69): count=   36, weight=0.427
  Bin [0.69, 0.75): count=   24, weight=0.633
  Bin [0.75, 0.81): count=   19, weight=0.791
  Bin [0.81, 0.88): count=    5, weight=2.636
  Bin [0.88, 0.94): count=    2, weight=5.271
  Bin [0.94, 1.00): count=    2, weight=5.271
-------------------------------------------

  Pred range: [0.0898, 0.5772], std: 0.0921
  RMSE : 0.1549, R2: 0.1992, MAE: 0.1254, Spearman rho: 0.4759, Spearman p: 3.9281e-35, Pearson r: 0.4819, Pearson p: 4.1919e-36
  Pred range: [0.0816, 0.5580], std: 0.0956
  RMSE : 0.1536, R2: 0.2122, MAE: 0.1242, Spearman rho: 0.4907, Spearman p: 1.4911e-37, Pearson r: 0.5009, Pearson p: 2.6434e-39
  Pred range: [0.0641, 0.5687], std: 0.0925
  RMSE : 0.1543, R2: 0.2054, MAE: 0.1261, Spearman rho: 0.4805, Spearman p: 7.2452e-36, Pearson r: 0.5000, Pearson p: 3.8268e-39
  Pred range: [0.0614, 0.6533], std: 0.1010
  RMSE : 0.1763, R2: -0.0370, MAE: 0.1488, Spearman rho: 0.4740, Spearman p: 7.8991e-35, Pearson r: 0.4955, Pearson p: 2.2923e-38
  Pred range: [0.0182, 0.5792], std: 0.1046
  RMSE : 0.1567, R2: 0.1805, MAE: 0.1271, Spearman rho: 0.4843, Spearman p: 1.7248e-36, Pearson r: 0.5000, Pearson p: 3.8050e-39
  Pred range: [0.0458, 0.6481], std: 0.1067
  RMSE : 0.1600, R2: 0.1460, MAE: 0.1311, Spearman rho: 0.4880, Spearman p: 4.1150e-37, Pearson r: 0.5112, Pearson p: 3.9909e-41
  Pred range: [-0.0091, 0.5777], std: 0.0974
  RMSE : 0.1542, R2: 0.2063, MAE: 0.1238, Spearman rho: 0.4657, Spearman p: 1.6029e-33, Pearson r: 0.4853, Pearson p: 1.1524e-36
[I 2026-04-27 18:40:23,560] Trial 12 finished with value: 0.15362907105406737 and parameters: {'learning_rate': 0.001804643155675677, 'batch_size': 4, 'num_epochs': 30, 'weight_decay': 0.00039360048401381516, 'layers_PRS': 3, 'layers_SCZ15': 2, 'layers_ADHD9': 4, 'layers_ASD9': 4, 'layers_ACE15': 5, 'layers_ACE18': 6, 'layers_SUD18': 4, 'layers_SES': 2, 'layers_SEX': 3, 'dropout': 0.10061584317170189, 'se_reduction': 8, 'hidden_dim_min': 6, 'base_loss': 'huber', 'huber_delta': 0.07982809877687229, 'focal_gamma': 1.2618596515475913, 'n_bins': 16, 'scheduler_patience': 4, 'scheduler_factor': 0.4371960110270048, 'early_stopping_patience': 5}. Best is trial 8 with value: 0.15005696427010315.
Train: 2407 rows (1613 IDs),Test: 598 rows (404 IDs) 

n_features_x : 6, n_features_per_modality: [16, 23, 19, 17, 7, 4, 4, 4, 1, 4]

--- ImbalancedRegressionLoss initialized ---
  Bins: 13, Focal gamma: 0.9160630458237353, Base loss: mse
  Bin [0.00, 0.08): count=  383, weight=0.049
  Bin [0.08, 0.15): count=  578, weight=0.032
  Bin [0.15, 0.23): count=  370, weight=0.051
  Bin [0.23, 0.31): count=  368, weight=0.051
  Bin [0.31, 0.38): count=  199, weight=0.094
  Bin [0.38, 0.46): count=  207, weight=0.090
  Bin [0.46, 0.54): count=  108, weight=0.172
  Bin [0.54, 0.62): count=  106, weight=0.176
  Bin [0.62, 0.69): count=   36, weight=0.508
  Bin [0.69, 0.77): count=   36, weight=0.508
  Bin [0.77, 0.85): count=    9, weight=1.878
  Bin [0.85, 0.92): count=    5, weight=3.130
  Bin [0.92, 1.00): count=    2, weight=6.261
-------------------------------------------

  Pred range: [0.1590, 0.5649], std: 0.0624
  RMSE : 0.1911, R2: -0.2189, MAE: 0.1638, Spearman rho: 0.2999, Spearman p: 6.8002e-14, Pearson r: 0.3225, Pearson p: 6.1182e-16
  Pred range: [0.1628, 0.5959], std: 0.0677
  RMSE : 0.1901, R2: -0.2057, MAE: 0.1636, Spearman rho: 0.3551, Spearman p: 3.2656e-19, Pearson r: 0.3776, Pearson p: 1.0513e-21
  Pred range: [0.1532, 0.6066], std: 0.0705
  RMSE : 0.1810, R2: -0.0937, MAE: 0.1544, Spearman rho: 0.3907, Spearman p: 3.0082e-23, Pearson r: 0.4106, Pearson p: 1.0015e-25
  Pred range: [0.1467, 0.6277], std: 0.0743
  RMSE : 0.1759, R2: -0.0326, MAE: 0.1491, Spearman rho: 0.4156, Spearman p: 2.2341e-26, Pearson r: 0.4352, Pearson p: 4.9816e-29
  Pred range: [0.1408, 0.6400], std: 0.0777
  RMSE : 0.1718, R2: 0.0151, MAE: 0.1449, Spearman rho: 0.4351, Spearman p: 5.1124e-29, Pearson r: 0.4525, Pearson p: 1.5828e-31
  Pred range: [0.1426, 0.6731], std: 0.0830
  RMSE : 0.1753, R2: -0.0252, MAE: 0.1485, Spearman rho: 0.4441, Spearman p: 2.7344e-30, Pearson r: 0.4619, Pearson p: 6.0848e-33
[I 2026-04-27 18:40:55,043] Trial 13 pruned. 
Train: 2407 rows (1613 IDs),Test: 598 rows (404 IDs) 

n_features_x : 6, n_features_per_modality: [16, 23, 19, 17, 7, 4, 4, 4, 1, 4]

--- ImbalancedRegressionLoss initialized ---
  Bins: 16, Focal gamma: 1.8561678818614435, Base loss: mse
  Bin [0.00, 0.06): count=  383, weight=0.041
  Bin [0.06, 0.12): count=  377, weight=0.042
  Bin [0.12, 0.19): count=  405, weight=0.039
  Bin [0.19, 0.25): count=  295, weight=0.053
  Bin [0.25, 0.31): count=  239, weight=0.066
  Bin [0.31, 0.38): count=  199, weight=0.079
  Bin [0.38, 0.44): count=  142, weight=0.111
  Bin [0.44, 0.50): count=  122, weight=0.129
  Bin [0.50, 0.56): count=   93, weight=0.168
  Bin [0.56, 0.62): count=   64, weight=0.243
  Bin [0.62, 0.69): count=   36, weight=0.427
  Bin [0.69, 0.75): count=   24, weight=0.633
  Bin [0.75, 0.81): count=   19, weight=0.791
  Bin [0.81, 0.88): count=    5, weight=2.636
  Bin [0.88, 0.94): count=    2, weight=5.271
  Bin [0.94, 1.00): count=    2, weight=5.271
-------------------------------------------

  Pred range: [0.1003, 0.6057], std: 0.0861
  RMSE : 0.1556, R2: 0.1916, MAE: 0.1255, Spearman rho: 0.4664, Spearman p: 1.2366e-33, Pearson r: 0.4778, Pearson p: 1.9679e-35
  Pred range: [0.1349, 0.6059], std: 0.0834
  RMSE : 0.1606, R2: 0.1395, MAE: 0.1339, Spearman rho: 0.4940, Spearman p: 4.0391e-38, Pearson r: 0.5048, Pearson p: 5.6042e-40
  Pred range: [0.0475, 0.5969], std: 0.0869
  RMSE : 0.1535, R2: 0.2137, MAE: 0.1249, Spearman rho: 0.4922, Spearman p: 8.1537e-38, Pearson r: 0.5035, Pearson p: 9.4172e-40
  Pred range: [0.0957, 0.6892], std: 0.0900
  RMSE : 0.1634, R2: 0.1092, MAE: 0.1366, Spearman rho: 0.4900, Spearman p: 1.9539e-37, Pearson r: 0.4984, Pearson p: 7.2399e-39
  Pred range: [0.0917, 0.6365], std: 0.0876
  RMSE : 0.1545, R2: 0.2032, MAE: 0.1267, Spearman rho: 0.4972, Spearman p: 1.1385e-38, Pearson r: 0.5104, Pearson p: 5.6313e-41
  Pred range: [0.0321, 0.6340], std: 0.0898
  RMSE : 0.1513, R2: 0.2356, MAE: 0.1226, Spearman rho: 0.4951, Spearman p: 2.6556e-38, Pearson r: 0.5102, Pearson p: 6.1604e-41
  Pred range: [0.0058, 0.6231], std: 0.0840
  RMSE : 0.1555, R2: 0.1934, MAE: 0.1276, Spearman rho: 0.4807, Spearman p: 6.7764e-36, Pearson r: 0.4976, Pearson p: 9.8007e-39
  Pred range: [-0.0272, 0.6596], std: 0.0862
  RMSE : 0.1573, R2: 0.1736, MAE: 0.1294, Spearman rho: 0.4693, Spearman p: 4.3386e-34, Pearson r: 0.4822, Pearson p: 3.8083e-36
  Pred range: [-0.0014, 0.7045], std: 0.0985
  RMSE : 0.1532, R2: 0.2169, MAE: 0.1240, Spearman rho: 0.4905, Spearman p: 1.5862e-37, Pearson r: 0.5068, Pearson p: 2.4740e-40
  Pred range: [0.0803, 0.7644], std: 0.0949
  RMSE : 0.1583, R2: 0.1640, MAE: 0.1302, Spearman rho: 0.4856, Spearman p: 1.0321e-36, Pearson r: 0.4963, Pearson p: 1.6755e-38
  Pred range: [0.0253, 0.6859], std: 0.0912
  RMSE : 0.1603, R2: 0.1422, MAE: 0.1331, Spearman rho: 0.4787, Spearman p: 1.4155e-35, Pearson r: 0.4879, Pearson p: 4.2842e-37
  Pred range: [0.0430, 0.6985], std: 0.0953
  RMSE : 0.1538, R2: 0.2102, MAE: 0.1250, Spearman rho: 0.4825, Spearman p: 3.3773e-36, Pearson r: 0.4983, Pearson p: 7.3588e-39
[I 2026-04-27 18:43:07,906] Trial 14 finished with value: 0.15132556466067046 and parameters: {'learning_rate': 0.0006974439133383063, 'batch_size': 4, 'num_epochs': 21, 'weight_decay': 1.2850521303602535e-05, 'layers_PRS': 3, 'layers_SCZ15': 5, 'layers_ADHD9': 5, 'layers_ASD9': 4, 'layers_ACE15': 6, 'layers_ACE18': 5, 'layers_SUD18': 5, 'layers_SES': 3, 'layers_SEX': 2, 'dropout': 0.2825097363939488, 'se_reduction': 7, 'hidden_dim_min': 8, 'base_loss': 'mse', 'huber_delta': 0.06584652813285287, 'focal_gamma': 1.8561678818614435, 'n_bins': 16, 'scheduler_patience': 4, 'scheduler_factor': 0.4898548168500989, 'early_stopping_patience': 6}. Best is trial 8 with value: 0.15005696427010315.
Train: 2407 rows (1613 IDs),Test: 598 rows (404 IDs) 

n_features_x : 6, n_features_per_modality: [16, 23, 19, 17, 7, 4, 4, 4, 1, 4]

--- ImbalancedRegressionLoss initialized ---
  Bins: 8, Focal gamma: 1.2272552187349541, Base loss: huber
  Bin [0.00, 0.12): count=  760, weight=0.039
  Bin [0.12, 0.25): count=  700, weight=0.042
  Bin [0.25, 0.38): count=  438, weight=0.067
  Bin [0.38, 0.50): count=  264, weight=0.111
  Bin [0.50, 0.62): count=  157, weight=0.186
  Bin [0.62, 0.75): count=   60, weight=0.483
  Bin [0.75, 0.88): count=   24, weight=1.179
  Bin [0.88, 1.00): count=    4, weight=5.893
-------------------------------------------

  Pred range: [0.1735, 0.6219], std: 0.0590
  RMSE : 0.1783, R2: -0.0608, MAE: 0.1507, Spearman rho: 0.3449, Spearman p: 3.8291e-18, Pearson r: 0.3520, Pearson p: 6.9343e-19
  Pred range: [0.1652, 0.6244], std: 0.0674
  RMSE : 0.1735, R2: -0.0043, MAE: 0.1461, Spearman rho: 0.4110, Spearman p: 8.9720e-26, Pearson r: 0.4136, Pearson p: 4.0935e-26
  Pred range: [0.1532, 0.6024], std: 0.0709
  RMSE : 0.1665, R2: 0.0746, MAE: 0.1388, Spearman rho: 0.4399, Spearman p: 1.0944e-29, Pearson r: 0.4448, Pearson p: 2.1345e-30
  Pred range: [0.1426, 0.5944], std: 0.0748
  RMSE : 0.1618, R2: 0.1260, MAE: 0.1336, Spearman rho: 0.4580, Spearman p: 2.4443e-32, Pearson r: 0.4629, Pearson p: 4.3357e-33
  Pred range: [0.1425, 0.6179], std: 0.0800
  RMSE : 0.1630, R2: 0.1133, MAE: 0.1353, Spearman rho: 0.4698, Spearman p: 3.6341e-34, Pearson r: 0.4745, Pearson p: 6.7282e-35
  Pred range: [0.1415, 0.6288], std: 0.0828
  RMSE : 0.1628, R2: 0.1156, MAE: 0.1352, Spearman rho: 0.4760, Spearman p: 3.8529e-35, Pearson r: 0.4819, Pearson p: 4.2075e-36
  Pred range: [0.1394, 0.6320], std: 0.0847
  RMSE : 0.1621, R2: 0.1231, MAE: 0.1346, Spearman rho: 0.4817, Spearman p: 4.6476e-36, Pearson r: 0.4879, Pearson p: 4.4256e-37
  Pred range: [0.1318, 0.6177], std: 0.0833
  RMSE : 0.1581, R2: 0.1658, MAE: 0.1301, Spearman rho: 0.4874, Spearman p: 5.3071e-37, Pearson r: 0.4934, Pearson p: 5.2628e-38
  Pred range: [0.1345, 0.6444], std: 0.0869
  RMSE : 0.1606, R2: 0.1390, MAE: 0.1331, Spearman rho: 0.4906, Spearman p: 1.5277e-37, Pearson r: 0.4964, Pearson p: 1.6124e-38
  Pred range: [0.1467, 0.6867], std: 0.0921
  RMSE : 0.1703, R2: 0.0317, MAE: 0.1432, Spearman rho: 0.4908, Spearman p: 1.4369e-37, Pearson r: 0.4972, Pearson p: 1.1594e-38
  Pred range: [0.1304, 0.6480], std: 0.0884
  RMSE : 0.1594, R2: 0.1515, MAE: 0.1319, Spearman rho: 0.4951, Spearman p: 2.6541e-38, Pearson r: 0.5018, Pearson p: 1.8419e-39
  Pred range: [0.1283, 0.6419], std: 0.0876
  RMSE : 0.1585, R2: 0.1612, MAE: 0.1311, Spearman rho: 0.4953, Spearman p: 2.4109e-38, Pearson r: 0.5033, Pearson p: 1.0223e-39
[I 2026-04-27 18:44:38,748] Trial 15 finished with value: 0.15808762938035 and parameters: {'learning_rate': 0.00011492016062240836, 'batch_size': 6, 'num_epochs': 16, 'weight_decay': 0.0009002904338388386, 'layers_PRS': 6, 'layers_SCZ15': 2, 'layers_ADHD9': 7, 'layers_ASD9': 6, 'layers_ACE15': 4, 'layers_ACE18': 3, 'layers_SUD18': 2, 'layers_SES': 2, 'layers_SEX': 2, 'dropout': 0.16653200834781395, 'se_reduction': 5, 'hidden_dim_min': 4, 'base_loss': 'huber', 'huber_delta': 0.12705430209786234, 'focal_gamma': 1.2272552187349541, 'n_bins': 8, 'scheduler_patience': 5, 'scheduler_factor': 0.6973276146989518, 'early_stopping_patience': 4}. Best is trial 8 with value: 0.15005696427010315.
Train: 2407 rows (1613 IDs),Test: 598 rows (404 IDs) 

n_features_x : 6, n_features_per_modality: [16, 23, 19, 17, 7, 4, 4, 4, 1, 4]

--- ImbalancedRegressionLoss initialized ---
  Bins: 18, Focal gamma: 0.5004124189459704, Base loss: huber
  Bin [0.00, 0.06): count=  172, weight=0.058
  Bin [0.06, 0.11): count=  413, weight=0.024
  Bin [0.11, 0.17): count=  376, weight=0.027
  Bin [0.17, 0.22): count=  370, weight=0.027
  Bin [0.22, 0.28): count=  255, weight=0.040
  Bin [0.28, 0.33): count=  223, weight=0.045
  Bin [0.33, 0.39): count=   89, weight=0.112
  Bin [0.39, 0.44): count=  142, weight=0.071
  Bin [0.44, 0.50): count=  122, weight=0.082
  Bin [0.50, 0.56): count=   93, weight=0.108
  Bin [0.56, 0.61): count=   64, weight=0.156
  Bin [0.61, 0.67): count=   36, weight=0.273
  Bin [0.67, 0.72): count=   10, weight=0.920
  Bin [0.72, 0.78): count=   26, weight=0.375
  Bin [0.78, 0.83): count=    9, weight=1.012
  Bin [0.83, 0.89): count=    4, weight=2.023
  Bin [0.89, 0.94): count=    3, weight=2.529
  Bin [0.94, 1.00): count=    0, weight=10.117
-------------------------------------------

  Pred range: [0.0585, 0.5966], std: 0.0914
  RMSE : 0.1544, R2: 0.2038, MAE: 0.1254, Spearman rho: 0.4802, Spearman p: 8.0936e-36, Pearson r: 0.4928, Pearson p: 6.4707e-38
  Pred range: [0.0755, 0.6809], std: 0.1077
  RMSE : 0.1671, R2: 0.0685, MAE: 0.1375, Spearman rho: 0.4632, Spearman p: 3.8785e-33, Pearson r: 0.4879, Pearson p: 4.4246e-37
  Pred range: [0.0130, 0.5683], std: 0.0994
  RMSE : 0.1507, R2: 0.2423, MAE: 0.1180, Spearman rho: 0.4759, Spearman p: 3.9834e-35, Pearson r: 0.4982, Pearson p: 7.7100e-39
  Pred range: [0.0412, 0.6268], std: 0.1119
  RMSE : 0.1564, R2: 0.1839, MAE: 0.1265, Spearman rho: 0.4769, Spearman p: 2.6995e-35, Pearson r: 0.5004, Pearson p: 3.2406e-39
  Pred range: [-0.0828, 0.6491], std: 0.1178
  RMSE : 0.1589, R2: 0.1575, MAE: 0.1273, Spearman rho: 0.4816, Spearman p: 4.6842e-36, Pearson r: 0.4920, Pearson p: 9.0298e-38
  Pred range: [0.0112, 0.5653], std: 0.0998
  RMSE : 0.1511, R2: 0.2376, MAE: 0.1161, Spearman rho: 0.4801, Spearman p: 8.4578e-36, Pearson r: 0.4962, Pearson p: 1.7327e-38
  Pred range: [0.0307, 0.6168], std: 0.1116
  RMSE : 0.1562, R2: 0.1853, MAE: 0.1253, Spearman rho: 0.4805, Spearman p: 7.2458e-36, Pearson r: 0.4969, Pearson p: 1.3264e-38
  Pred range: [-0.1034, 0.5937], std: 0.1107
  RMSE : 0.1516, R2: 0.2326, MAE: 0.1186, Spearman rho: 0.4854, Spearman p: 1.1172e-36, Pearson r: 0.5023, Pearson p: 1.5065e-39
  Pred range: [-0.0236, 0.6310], std: 0.1104
  RMSE : 0.1547, R2: 0.2012, MAE: 0.1242, Spearman rho: 0.4912, Spearman p: 1.2085e-37, Pearson r: 0.5047, Pearson p: 5.7269e-40
[I 2026-04-27 18:46:32,413] Trial 16 finished with value: 0.15066520593558919 and parameters: {'learning_rate': 0.0033949611689336793, 'batch_size': 4, 'num_epochs': 26, 'weight_decay': 2.7128330526885455e-05, 'layers_PRS': 5, 'layers_SCZ15': 7, 'layers_ADHD9': 6, 'layers_ASD9': 3, 'layers_ACE15': 4, 'layers_ACE18': 6, 'layers_SUD18': 4, 'layers_SES': 2, 'layers_SEX': 5, 'dropout': 0.261513795157845, 'se_reduction': 7, 'hidden_dim_min': 12, 'base_loss': 'huber', 'huber_delta': 0.0635517799789366, 'focal_gamma': 0.5004124189459704, 'n_bins': 18, 'scheduler_patience': 4, 'scheduler_factor': 0.35723876493348455, 'early_stopping_patience': 6}. Best is trial 8 with value: 0.15005696427010315.
Train: 2407 rows (1613 IDs),Test: 598 rows (404 IDs) 

n_features_x : 6, n_features_per_modality: [16, 23, 19, 17, 7, 4, 4, 4, 1, 4]

--- ImbalancedRegressionLoss initialized ---
  Bins: 18, Focal gamma: 1.610502379966601, Base loss: huber
  Bin [0.00, 0.06): count=  172, weight=0.058
  Bin [0.06, 0.11): count=  413, weight=0.024
  Bin [0.11, 0.17): count=  376, weight=0.027
  Bin [0.17, 0.22): count=  370, weight=0.027
  Bin [0.22, 0.28): count=  255, weight=0.040
  Bin [0.28, 0.33): count=  223, weight=0.045
  Bin [0.33, 0.39): count=   89, weight=0.112
  Bin [0.39, 0.44): count=  142, weight=0.071
  Bin [0.44, 0.50): count=  122, weight=0.082
  Bin [0.50, 0.56): count=   93, weight=0.108
  Bin [0.56, 0.61): count=   64, weight=0.156
  Bin [0.61, 0.67): count=   36, weight=0.273
  Bin [0.67, 0.72): count=   10, weight=0.920
  Bin [0.72, 0.78): count=   26, weight=0.375
  Bin [0.78, 0.83): count=    9, weight=1.012
  Bin [0.83, 0.89): count=    4, weight=2.023
  Bin [0.89, 0.94): count=    3, weight=2.529
  Bin [0.94, 1.00): count=    0, weight=10.117
-------------------------------------------

  Pred range: [0.0670, 0.6398], std: 0.0966
  RMSE : 0.1560, R2: 0.1878, MAE: 0.1273, Spearman rho: 0.4637, Spearman p: 3.2831e-33, Pearson r: 0.4846, Pearson p: 1.5441e-36
  Pred range: [0.1276, 0.7008], std: 0.1082
  RMSE : 0.1753, R2: -0.0252, MAE: 0.1468, Spearman rho: 0.4798, Spearman p: 9.2096e-36, Pearson r: 0.4983, Pearson p: 7.6291e-39
  Pred range: [0.1163, 0.7022], std: 0.1111
  RMSE : 0.1718, R2: 0.0148, MAE: 0.1437, Spearman rho: 0.4928, Spearman p: 6.5777e-38, Pearson r: 0.5056, Pearson p: 4.0073e-40
  Pred range: [0.0964, 0.7153], std: 0.1226
  RMSE : 0.1696, R2: 0.0396, MAE: 0.1388, Spearman rho: 0.4929, Spearman p: 6.2432e-38, Pearson r: 0.5168, Pearson p: 3.7919e-42
  Pred range: [0.0865, 0.6095], std: 0.1024
  RMSE : 0.1531, R2: 0.2180, MAE: 0.1230, Spearman rho: 0.4895, Spearman p: 2.3126e-37, Pearson r: 0.5075, Pearson p: 1.8698e-40
  Pred range: [0.1135, 0.6396], std: 0.1033
  RMSE : 0.1565, R2: 0.1826, MAE: 0.1289, Spearman rho: 0.4894, Spearman p: 2.3952e-37, Pearson r: 0.5174, Pearson p: 2.9876e-42
  Pred range: [0.0955, 0.6483], std: 0.1019
  RMSE : 0.1655, R2: 0.0853, MAE: 0.1388, Spearman rho: 0.4849, Spearman p: 1.3766e-36, Pearson r: 0.5083, Pearson p: 1.3401e-40
  Pred range: [-0.0770, 0.6280], std: 0.1070
  RMSE : 0.1555, R2: 0.1932, MAE: 0.1262, Spearman rho: 0.4869, Spearman p: 6.3577e-37, Pearson r: 0.5057, Pearson p: 3.8403e-40
  Pred range: [0.0789, 0.5996], std: 0.0985
  RMSE : 0.1524, R2: 0.2246, MAE: 0.1243, Spearman rho: 0.4939, Spearman p: 4.2470e-38, Pearson r: 0.5198, Pearson p: 1.0622e-42
  Pred range: [0.0296, 0.6402], std: 0.1024
  RMSE : 0.1604, R2: 0.1412, MAE: 0.1327, Spearman rho: 0.4770, Spearman p: 2.6039e-35, Pearson r: 0.4981, Pearson p: 7.9735e-39
  Pred range: [0.0961, 0.7501], std: 0.1091
  RMSE : 0.1810, R2: -0.0938, MAE: 0.1527, Spearman rho: 0.4769, Spearman p: 2.7286e-35, Pearson r: 0.5006, Pearson p: 3.0122e-39
  Pred range: [0.0504, 0.6796], std: 0.1114
  RMSE : 0.1635, R2: 0.1076, MAE: 0.1348, Spearman rho: 0.4729, Spearman p: 1.1929e-34, Pearson r: 0.4977, Pearson p: 9.4439e-39
  Pred range: [0.0033, 0.6858], std: 0.1166
  RMSE : 0.1681, R2: 0.0570, MAE: 0.1383, Spearman rho: 0.4671, Spearman p: 9.6205e-34, Pearson r: 0.4927, Pearson p: 6.8339e-38
  Pred range: [0.0098, 0.6598], std: 0.1020
  RMSE : 0.1559, R2: 0.1890, MAE: 0.1264, Spearman rho: 0.4682, Spearman p: 6.4607e-34, Pearson r: 0.4908, Pearson p: 1.4050e-37
  Pred range: [-0.0053, 0.6457], std: 0.1037
  RMSE : 0.1562, R2: 0.1860, MAE: 0.1270, Spearman rho: 0.4686, Spearman p: 5.6930e-34, Pearson r: 0.4965, Pearson p: 1.5588e-38
