[I 2026-04-27 16:16:17,355] A new study created in memory with name: DCMFNet_Pos
Data shape: (4033, 125)
modality sizes for ['SUD15', 'PRS', 'SCZ15', 'ADHD9', 'ASD9', 'ACE15', 'ACE18', 'SUD18', 'SES', 'SEX', '^batch_.*_x_PC'] : [6, 16, 23, 19, 17, 7, 4, 4, 4, 1, 4]
Train: 3005 rows (2017 IDs),Test: 1028 rows (673 IDs) 


============================================================
  Tuning Pos symptom model (100 trials)
============================================================
  0%|          | 0/100 [00:00<?, ?it/s]                                         0%|          | 0/100 [02:29<?, ?it/s]Best trial: 0. Best value: 0.0896451:   0%|          | 0/100 [02:29<?, ?it/s]Best trial: 0. Best value: 0.0896451:   1%|          | 1/100 [02:29<4:06:40, 149.50s/it]                                                                                        Best trial: 0. Best value: 0.0896451:   1%|          | 1/100 [03:45<4:06:40, 149.50s/it]Best trial: 0. Best value: 0.0896451:   1%|          | 1/100 [03:45<4:06:40, 149.50s/it]Best trial: 0. Best value: 0.0896451:   2%|▏         | 2/100 [03:45<2:53:21, 106.14s/it]                                                                                        Best trial: 0. Best value: 0.0896451:   2%|▏         | 2/100 [04:36<2:53:21, 106.14s/it]Best trial: 0. Best value: 0.0896451:   2%|▏         | 2/100 [04:36<2:53:21, 106.14s/it]Best trial: 0. Best value: 0.0896451:   3%|▎         | 3/100 [04:36<2:10:52, 80.95s/it]                                                                                        Best trial: 0. Best value: 0.0896451:   3%|▎         | 3/100 [05:18<2:10:52, 80.95s/it]Best trial: 0. Best value: 0.0896451:   3%|▎         | 3/100 [05:18<2:10:52, 80.95s/it]Best trial: 0. Best value: 0.0896451:   4%|▍         | 4/100 [05:18<1:44:49, 65.52s/it]                                                                                       Best trial: 0. Best value: 0.0896451:   4%|▍         | 4/100 [07:03<1:44:49, 65.52s/it]Best trial: 0. Best value: 0.0896451:   4%|▍         | 4/100 [07:03<1:44:49, 65.52s/it]Best trial: 0. Best value: 0.0896451:   5%|▌         | 5/100 [07:03<2:06:31, 79.91s/it]                                                                                       Best trial: 0. Best value: 0.0896451:   5%|▌         | 5/100 [07:35<2:06:31, 79.91s/it]Best trial: 0. Best value: 0.0896451:   5%|▌         | 5/100 [07:35<2:06:31, 79.91s/it]Best trial: 0. Best value: 0.0896451:   6%|▌         | 6/100 [07:35<1:39:38, 63.60s/it]                                                                                       Best trial: 0. Best value: 0.0896451:   6%|▌         | 6/100 [07:52<1:39:38, 63.60s/it]Best trial: 0. Best value: 0.0896451:   6%|▌         | 6/100 [07:52<1:39:38, 63.60s/it]Best trial: 0. Best value: 0.0896451:   7%|▋         | 7/100 [07:52<1:14:58, 48.38s/it]                                                                                       Best trial: 0. Best value: 0.0896451:   7%|▋         | 7/100 [09:59<1:14:58, 48.38s/it]Best trial: 7. Best value: 0.0890836:   7%|▋         | 7/100 [09:59<1:14:58, 48.38s/it]Best trial: 7. Best value: 0.0890836:   8%|▊         | 8/100 [09:59<1:52:20, 73.27s/it]                                                                                       Best trial: 7. Best value: 0.0890836:   8%|▊         | 8/100 [10:17<1:52:20, 73.27s/it]Best trial: 7. Best value: 0.0890836:   8%|▊         | 8/100 [10:17<1:52:20, 73.27s/it]Best trial: 7. Best value: 0.0890836:   9%|▉         | 9/100 [10:17<1:25:06, 56.12s/it]                                                                                       Best trial: 7. Best value: 0.0890836:   9%|▉         | 9/100 [11:14<1:25:06, 56.12s/it]Best trial: 9. Best value: 0.0880327:   9%|▉         | 9/100 [11:14<1:25:06, 56.12s/it]Best trial: 9. Best value: 0.0880327:  10%|█         | 10/100 [11:14<1:24:40, 56.45s/it]                                                                                        Best trial: 9. Best value: 0.0880327:  10%|█         | 10/100 [11:23<1:24:40, 56.45s/it]Best trial: 9. Best value: 0.0880327:  10%|█         | 10/100 [11:23<1:24:40, 56.45s/it]Best trial: 9. Best value: 0.0880327:  11%|█         | 11/100 [11:23<1:02:00, 41.81s/it]                                                                                        Best trial: 9. Best value: 0.0880327:  11%|█         | 11/100 [12:13<1:02:00, 41.81s/it]Best trial: 9. Best value: 0.0880327:  11%|█         | 11/100 [12:13<1:02:00, 41.81s/it]Best trial: 9. Best value: 0.0880327:  12%|█▏        | 12/100 [12:13<1:04:59, 44.31s/it]                                                                                        Best trial: 9. Best value: 0.0880327:  12%|█▏        | 12/100 [14:11<1:04:59, 44.31s/it]Best trial: 9. Best value: 0.0880327:  12%|█▏        | 12/100 [14:11<1:04:59, 44.31s/it]Best trial: 9. Best value: 0.0880327:  13%|█▎        | 13/100 [14:11<1:36:53, 66.82s/it]                                                                                        Best trial: 9. Best value: 0.0880327:  13%|█▎        | 13/100 [16:29<1:36:53, 66.82s/it]Best trial: 9. Best value: 0.0880327:  13%|█▎        | 13/100 [16:29<1:36:53, 66.82s/it]Best trial: 9. Best value: 0.0880327:  14%|█▍        | 14/100 [16:29<2:06:11, 88.04s/it]                                                                                        Best trial: 9. Best value: 0.0880327:  14%|█▍        | 14/100 [18:45<2:06:11, 88.04s/it]Best trial: 9. Best value: 0.0880327:  14%|█▍        | 14/100 [18:45<2:06:11, 88.04s/it]Best trial: 9. Best value: 0.0880327:  15%|█▌        | 15/100 [18:45<2:25:33, 102.75s/it]                                                                                         Best trial: 9. Best value: 0.0880327:  15%|█▌        | 15/100 [18:55<2:25:33, 102.75s/it]Best trial: 9. Best value: 0.0880327:  15%|█▌        | 15/100 [18:55<2:25:33, 102.75s/it]Best trial: 9. Best value: 0.0880327:  16%|█▌        | 16/100 [18:55<1:44:46, 74.84s/it]                                                                                         Best trial: 9. Best value: 0.0880327:  16%|█▌        | 16/100 [20:08<1:44:46, 74.84s/it]Best trial: 9. Best value: 0.0880327:  16%|█▌        | 16/100 [20:08<1:44:46, 74.84s/it]Best trial: 9. Best value: 0.0880327:  17%|█▋        | 17/100 [20:08<1:42:28, 74.08s/it]                                                                                        Best trial: 9. Best value: 0.0880327:  17%|█▋        | 17/100 [21:19<1:42:28, 74.08s/it]Best trial: 9. Best value: 0.0880327:  17%|█▋        | 17/100 [21:19<1:42:28, 74.08s/it]Best trial: 9. Best value: 0.0880327:  18%|█▊        | 18/100 [21:19<1:40:14, 73.34s/it]                                                                                        Best trial: 9. Best value: 0.0880327:  18%|█▊        | 18/100 [22:47<1:40:14, 73.34s/it]Best trial: 9. Best value: 0.0880327:  18%|█▊        | 18/100 [22:47<1:40:14, 73.34s/it]Best trial: 9. Best value: 0.0880327:  19%|█▉        | 19/100 [22:47<1:44:53, 77.70s/it]                                                                                        Best trial: 9. Best value: 0.0880327:  19%|█▉        | 19/100 [24:22<1:44:53, 77.70s/it]Best trial: 9. Best value: 0.0880327:  19%|█▉        | 19/100 [24:22<1:44:53, 77.70s/it]Best trial: 9. Best value: 0.0880327:  20%|██        | 20/100 [24:22<1:50:23, 82.80s/it]                                                                                        Best trial: 9. Best value: 0.0880327:  20%|██        | 20/100 [24:31<1:50:23, 82.80s/it]Best trial: 9. Best value: 0.0880327:  20%|██        | 20/100 [24:31<1:50:23, 82.80s/it]Best trial: 9. Best value: 0.0880327:  21%|██        | 21/100 [24:31<1:19:51, 60.66s/it]                                                                                        Best trial: 9. Best value: 0.0880327:  21%|██        | 21/100 [25:40<1:19:51, 60.66s/it]Best trial: 9. Best value: 0.0880327:  21%|██        | 21/100 [25:40<1:19:51, 60.66s/it]Best trial: 9. Best value: 0.0880327:  22%|██▏       | 22/100 [25:40<1:22:03, 63.12s/it]                                                                                        Best trial: 9. Best value: 0.0880327:  22%|██▏       | 22/100 [27:28<1:22:03, 63.12s/it]Best trial: 9. Best value: 0.0880327:  22%|██▏       | 22/100 [27:28<1:22:03, 63.12s/it]Best trial: 9. Best value: 0.0880327:  23%|██▎       | 23/100 [27:28<1:38:25, 76.70s/it]                                                                                        Best trial: 9. Best value: 0.0880327:  23%|██▎       | 23/100 [29:56<1:38:25, 76.70s/it]Best trial: 9. Best value: 0.0880327:  23%|██▎       | 23/100 [29:56<1:38:25, 76.70s/it]Best trial: 9. Best value: 0.0880327:  24%|██▍       | 24/100 [29:56<2:04:19, 98.15s/it]                                                                                        Best trial: 9. Best value: 0.0880327:  24%|██▍       | 24/100 [30:54<2:04:19, 98.15s/it]Best trial: 9. Best value: 0.0880327:  24%|██▍       | 24/100 [30:54<2:04:19, 98.15s/it]Best trial: 9. Best value: 0.0880327:  25%|██▌       | 25/100 [30:54<1:47:26, 85.95s/it]                                                                                        Best trial: 9. Best value: 0.0880327:  25%|██▌       | 25/100 [31:57<1:47:26, 85.95s/it]Best trial: 9. Best value: 0.0880327:  25%|██▌       | 25/100 [31:57<1:47:26, 85.95s/it]Best trial: 9. Best value: 0.0880327:  26%|██▌       | 26/100 [31:57<1:37:28, 79.03s/it]                                                                                        Best trial: 9. Best value: 0.0880327:  26%|██▌       | 26/100 [33:01<1:37:28, 79.03s/it]Best trial: 9. Best value: 0.0880327:  26%|██▌       | 26/100 [33:01<1:37:28, 79.03s/it]Best trial: 9. Best value: 0.0880327:  27%|██▋       | 27/100 [33:01<1:30:39, 74.51s/it]                                                                                        Best trial: 9. Best value: 0.0880327:  27%|██▋       | 27/100 [35:05<1:30:39, 74.51s/it]Best trial: 9. Best value: 0.0880327:  27%|██▋       | 27/100 [35:05<1:30:39, 74.51s/it]Best trial: 9. Best value: 0.0880327:  28%|██▊       | 28/100 [35:05<1:47:31, 89.61s/it]                                                                                        Best trial: 9. Best value: 0.0880327:  28%|██▊       | 28/100 [36:08<1:47:31, 89.61s/it]Best trial: 9. Best value: 0.0880327:  28%|██▊       | 28/100 [36:08<1:47:31, 89.61s/it]Best trial: 9. Best value: 0.0880327:  29%|██▉       | 29/100 [36:08<1:36:32, 81.59s/it]                                                                                        Best trial: 9. Best value: 0.0880327:  29%|██▉       | 29/100 [37:42<1:36:32, 81.59s/it]Best trial: 9. Best value: 0.0880327:  29%|██▉       | 29/100 [37:42<1:36:32, 81.59s/it]Best trial: 9. Best value: 0.0880327:  30%|███       | 30/100 [37:42<1:39:26, 85.24s/it]                                                                                        Best trial: 9. Best value: 0.0880327:  30%|███       | 30/100 [38:00<1:39:26, 85.24s/it]Best trial: 9. Best value: 0.0880327:  30%|███       | 30/100 [38:00<1:39:26, 85.24s/it]Best trial: 9. Best value: 0.0880327:  31%|███       | 31/100 [38:00<1:14:41, 64.95s/it]                                                                                        Best trial: 9. Best value: 0.0880327:  31%|███       | 31/100 [40:30<1:14:41, 64.95s/it]Best trial: 9. Best value: 0.0880327:  31%|███       | 31/100 [40:30<1:14:41, 64.95s/it]Best trial: 9. Best value: 0.0880327:  32%|███▏      | 32/100 [40:30<1:42:28, 90.42s/it]                                                                                        Best trial: 9. Best value: 0.0880327:  32%|███▏      | 32/100 [43:06<1:42:28, 90.42s/it]Best trial: 9. Best value: 0.0880327:  32%|███▏      | 32/100 [43:06<1:42:28, 90.42s/it]Best trial: 9. Best value: 0.0880327:  33%|███▎      | 33/100 [43:06<2:03:04, 110.22s/it]                                                                                         Best trial: 9. Best value: 0.0880327:  33%|███▎      | 33/100 [43:51<2:03:04, 110.22s/it]Best trial: 9. Best value: 0.0880327:  33%|███▎      | 33/100 [43:51<2:03:04, 110.22s/it]Best trial: 9. Best value: 0.0880327:  34%|███▍      | 34/100 [43:51<1:39:37, 90.56s/it]                                                                                         Best trial: 9. Best value: 0.0880327:  34%|███▍      | 34/100 [44:58<1:39:37, 90.56s/it]Best trial: 9. Best value: 0.0880327:  34%|███▍      | 34/100 [44:58<1:39:37, 90.56s/it]Best trial: 9. Best value: 0.0880327:  35%|███▌      | 35/100 [44:58<1:30:26, 83.49s/it]                                                                                        Best trial: 9. Best value: 0.0880327:  35%|███▌      | 35/100 [45:26<1:30:26, 83.49s/it]Best trial: 9. Best value: 0.0880327:  35%|███▌      | 35/100 [45:26<1:30:26, 83.49s/it]Best trial: 9. Best value: 0.0880327:  36%|███▌      | 36/100 [45:26<1:11:14, 66.80s/it]                                                                                        Best trial: 9. Best value: 0.0880327:  36%|███▌      | 36/100 [45:49<1:11:14, 66.80s/it]Best trial: 9. Best value: 0.0880327:  36%|███▌      | 36/100 [45:49<1:11:14, 66.80s/it]Best trial: 9. Best value: 0.0880327:  37%|███▋      | 37/100 [45:49<56:21, 53.67s/it]                                                                                        Best trial: 9. Best value: 0.0880327:  37%|███▋      | 37/100 [46:49<56:21, 53.67s/it]Best trial: 9. Best value: 0.0880327:  37%|███▋      | 37/100 [46:49<56:21, 53.67s/it]Best trial: 9. Best value: 0.0880327:  38%|███▊      | 38/100 [46:49<57:40, 55.81s/it]                                                                                      Best trial: 9. Best value: 0.0880327:  38%|███▊      | 38/100 [47:00<57:40, 55.81s/it]Best trial: 9. Best value: 0.0880327:  38%|███▊      | 38/100 [47:00<57:40, 55.81s/it]Best trial: 9. Best value: 0.0880327:  39%|███▉      | 39/100 [47:00<43:02, 42.34s/it]                                                                                      Best trial: 9. Best value: 0.0880327:  39%|███▉      | 39/100 [47:33<43:02, 42.34s/it]Best trial: 9. Best value: 0.0880327:  39%|███▉      | 39/100 [47:33<43:02, 42.34s/it]Best trial: 9. Best value: 0.0880327:  40%|████      | 40/100 [47:33<39:29, 39.50s/it]                                                                                      Best trial: 9. Best value: 0.0880327:  40%|████      | 40/100 [47:56<39:29, 39.50s/it]Best trial: 9. Best value: 0.0880327:  40%|████      | 40/100 [47:56<39:29, 39.50s/it]Best trial: 9. Best value: 0.0880327:  41%|████      | 41/100 [47:56<33:57, 34.53s/it]                                                                                      Best trial: 9. Best value: 0.0880327:  41%|████      | 41/100 [48:58<33:57, 34.53s/it]Best trial: 9. Best value: 0.0880327:  41%|████      | 41/100 [48:58<33:57, 34.53s/it]Best trial: 9. Best value: 0.0880327:  42%|████▏     | 42/100 [48:58<41:11, 42.62s/it]                                                                                      Best trial: 9. Best value: 0.0880327:  42%|████▏     | 42/100 [50:57<41:11, 42.62s/it]Best trial: 9. Best value: 0.0880327:  42%|████▏     | 42/100 [50:57<41:11, 42.62s/it]Best trial: 9. Best value: 0.0880327:  43%|████▎     | 43/100 [50:57<1:02:24, 65.69s/it]                                                                                        Best trial: 9. Best value: 0.0880327:  43%|████▎     | 43/100 [52:17<1:02:24, 65.69s/it]Best trial: 9. Best value: 0.0880327:  43%|████▎     | 43/100 [52:17<1:02:24, 65.69s/it]Best trial: 9. Best value: 0.0880327:  44%|████▍     | 44/100 [52:17<1:05:22, 70.04s/it]                                                                                        Best trial: 9. Best value: 0.0880327:  44%|████▍     | 44/100 [53:50<1:05:22, 70.04s/it]Best trial: 9. Best value: 0.0880327:  44%|████▍     | 44/100 [53:50<1:05:22, 70.04s/it]Best trial: 9. Best value: 0.0880327:  45%|████▌     | 45/100 [53:50<1:10:28, 76.88s/it]                                                                                        Best trial: 9. Best value: 0.0880327:  45%|████▌     | 45/100 [56:06<1:10:28, 76.88s/it]Best trial: 9. Best value: 0.0880327:  45%|████▌     | 45/100 [56:06<1:10:28, 76.88s/it]Best trial: 9. Best value: 0.0880327:  46%|████▌     | 46/100 [56:06<1:25:10, 94.64s/it]                                                                                        Best trial: 9. Best value: 0.0880327:  46%|████▌     | 46/100 [59:20<1:25:10, 94.64s/it]Best trial: 9. Best value: 0.0880327:  46%|████▌     | 46/100 [59:20<1:25:10, 94.64s/it]Best trial: 9. Best value: 0.0880327:  47%|████▋     | 47/100 [59:20<1:49:46, 124.27s/it]                                                                                         Best trial: 9. Best value: 0.0880327:  47%|████▋     | 47/100 [1:00:28<1:49:46, 124.27s/it]Best trial: 9. Best value: 0.0880327:  47%|████▋     | 47/100 [1:00:28<1:49:46, 124.27s/it]Best trial: 9. Best value: 0.0880327:  48%|████▊     | 48/100 [1:00:28<1:33:14, 107.58s/it]                                                                                           Best trial: 9. Best value: 0.0880327:  48%|████▊     | 48/100 [1:01:43<1:33:14, 107.58s/it]Best trial: 9. Best value: 0.0880327:  48%|████▊     | 48/100 [1:01:43<1:33:14, 107.58s/it]Best trial: 9. Best value: 0.0880327:  49%|████▉     | 49/100 [1:01:43<1:23:03, 97.71s/it]                                                                                           Best trial: 9. Best value: 0.0880327:  49%|████▉     | 49/100 [1:02:01<1:23:03, 97.71s/it]Best trial: 9. Best value: 0.0880327:  49%|████▉     | 49/100 [1:02:01<1:23:03, 97.71s/it]Best trial: 9. Best value: 0.0880327:  50%|█████     | 50/100 [1:02:01<1:01:31, 73.82s/it]                                                                                          Best trial: 9. Best value: 0.0880327:  50%|█████     | 50/100 [1:02:54<1:01:31, 73.82s/it]Best trial: 9. Best value: 0.0880327:  50%|█████     | 50/100 [1:02:54<1:01:31, 73.82s/it]Best trial: 9. Best value: 0.0880327:  51%|█████     | 51/100 [1:02:54<55:08, 67.51s/it]                                                                                          Best trial: 9. Best value: 0.0880327:  51%|█████     | 51/100 [1:04:08<55:08, 67.51s/it]Best trial: 9. Best value: 0.0880327:  51%|█████     | 51/100 [1:04:08<55:08, 67.51s/it]Best trial: 9. Best value: 0.0880327:  52%|█████▏    | 52/100 [1:04:08<55:32, 69.42s/it]                                                                                        Best trial: 9. Best value: 0.0880327:  52%|█████▏    | 52/100 [1:05:13<55:32, 69.42s/it]Best trial: 9. Best value: 0.0880327:  52%|█████▏    | 52/100 [1:05:13<55:32, 69.42s/it]Best trial: 9. Best value: 0.0880327:  53%|█████▎    | 53/100 [1:05:13<53:30, 68.31s/it]                                                                                        Best trial: 9. Best value: 0.0880327:  53%|█████▎    | 53/100 [1:06:24<53:30, 68.31s/it]Best trial: 53. Best value: 0.0880229:  53%|█████▎    | 53/100 [1:06:24<53:30, 68.31s/it]Best trial: 53. Best value: 0.0880229:  54%|█████▍    | 54/100 [1:06:24<52:53, 68.99s/it]                                                                                         Best trial: 53. Best value: 0.0880229:  54%|█████▍    | 54/100 [1:06:33<52:53, 68.99s/it]Best trial: 53. Best value: 0.0880229:  54%|█████▍    | 54/100 [1:06:33<52:53, 68.99s/it]Best trial: 53. Best value: 0.0880229:  55%|█████▌    | 55/100 [1:06:33<38:12, 50.95s/it]                                                                                         Best trial: 53. Best value: 0.0880229:  55%|█████▌    | 55/100 [1:07:56<38:12, 50.95s/it]Best trial: 53. Best value: 0.0880229:  55%|█████▌    | 55/100 [1:07:56<38:12, 50.95s/it]Best trial: 53. Best value: 0.0880229:  56%|█████▌    | 56/100 [1:07:56<44:25, 60.57s/it]                                                                                         Best trial: 53. Best value: 0.0880229:  56%|█████▌    | 56/100 [1:09:04<44:25, 60.57s/it]Best trial: 53. Best value: 0.0880229:  56%|█████▌    | 56/100 [1:09:04<44:25, 60.57s/it]Best trial: 53. Best value: 0.0880229:  57%|█████▋    | 57/100 [1:09:04<44:58, 62.75s/it]                                                                                         Best trial: 53. Best value: 0.0880229:  57%|█████▋    | 57/100 [1:12:17<44:58, 62.75s/it]Best trial: 53. Best value: 0.0880229:  57%|█████▋    | 57/100 [1:12:17<44:58, 62.75s/it]Best trial: 53. Best value: 0.0880229:  58%|█████▊    | 58/100 [1:12:17<1:11:17, 101.85s/it]                                                                                            Best trial: 53. Best value: 0.0880229:  58%|█████▊    | 58/100 [1:13:15<1:11:17, 101.85s/it]Best trial: 53. Best value: 0.0880229:  58%|█████▊    | 58/100 [1:13:15<1:11:17, 101.85s/it]Best trial: 53. Best value: 0.0880229:  59%|█████▉    | 59/100 [1:13:15<1:00:34, 88.64s/it]                                                                                            Best trial: 53. Best value: 0.0880229:  59%|█████▉    | 59/100 [1:13:47<1:00:34, 88.64s/it]Best trial: 53. Best value: 0.0880229:  59%|█████▉    | 59/100 [1:13:47<1:00:34, 88.64s/it]Best trial: 53. Best value: 0.0880229:  60%|██████    | 60/100 [1:13:47<47:55, 71.88s/it]                                                                                           Best trial: 53. Best value: 0.0880229:  60%|███