[I 2026-04-28 01:28:27,792] Trial 49 pruned. 

Completed in 59.1 minutes
Trials: 38 complete, 12 pruned

============================================================
  Best Neg trial
============================================================
  RMSE: 0.1481

  Copy these into hyperparameters.json:
  ----------------------------------------
  learning_rate = 0.0004855152971163052
  batch_size = 4
  num_epochs = 12
  weight_decay = 1.3785146058868597e-05
  depth_complex = 4
  depth_moderate = 3
  depth_simple = 2
  dropout = 0.29289702899627734
  se_reduction = 7
  hidden_dim_min = 8
  base_loss = 'huber'
  huber_delta = 0.10727768027372797
  focal_gamma = 2.158356912573688
  n_bins = 9
  scheduler_patience = 4
  scheduler_factor = 0.43874458411714623
  early_stopping_patience = 5
  ----------------------------------------

Best hyperparameters saved to 'Neg_best_params.txt'
All trial results saved to 'Neg_optuna_results.csv'
Visualizations saved as Neg_*.html
