[I 2026-04-27 17:19:11,680] Trial 50 finished with value: 0.08868391925668186 and parameters: {'learning_rate': 0.0020600286239964376, 'batch_size': 4, 'num_epochs': 25, 'weight_decay': 0.0019967952642720123, 'layers_PRS': 1, 'layers_SCZ15': 6, 'layers_ADHD9': 5, 'layers_ASD9': 6, 'layers_ACE15': 3, 'layers_ACE18': 3, 'layers_SUD18': 1, 'layers_SES': 6, 'layers_SEX': 3, 'dropout': 0.36881095104593997, 'se_reduction': 8, 'hidden_dim_min': 6, 'base_loss': 'huber', 'huber_delta': 0.09688210283076831, 'focal_gamma': 0.5223371073381349, 'n_bins': 5, 'scheduler_patience': 5, 'scheduler_factor': 0.6474145274199413, 'early_stopping_patience': 3}. Best is trial 9 with value: 0.08803266597627345.
Train: 2407 rows (1613 IDs),Test: 598 rows (404 IDs) 

n_features_x : 6, n_features_per_modality: [16, 23, 19, 17, 7, 4, 4, 4, 1, 4]

--- ImbalancedRegressionLoss initialized ---
  Bins: 8, Focal gamma: 1.00153374324016, Base loss: huber
  Bin [0.00, 0.12): count= 1180, weight=0.003
  Bin [0.12, 0.25): count=  933, weight=0.003
  Bin [0.25, 0.38): count=  253, weight=0.012
  Bin [0.38, 0.50): count=   30, weight=0.098
  Bin [0.50, 0.62): count=   10, weight=0.277
  Bin [0.62, 0.75): count=    1, weight=1.521
  Bin [0.75, 0.88): count=    0, weight=3.043
  Bin [0.88, 1.00): count=    0, weight=3.043
-------------------------------------------

  Pred range: [0.0437, 0.4141], std: 0.0611
  RMSE : 0.1012, R2: -0.0125, MAE: 0.0832, Spearman rho: 0.4413, Spearman p: 6.8927e-30, Pearson r: 0.4487, Pearson p: 5.7778e-31
  Pred range: [0.0297, 0.4048], std: 0.0615
  RMSE : 0.0926, R2: 0.1536, MAE: 0.0742, Spearman rho: 0.4625, Spearman p: 5.0570e-33, Pearson r: 0.4681, Pearson p: 6.8877e-34
  Pred range: [0.0319, 0.3981], std: 0.0591
  RMSE : 0.0902, R2: 0.1955, MAE: 0.0720, Spearman rho: 0.4736, Spearman p: 9.2023e-35, Pearson r: 0.4789, Pearson p: 1.3228e-35
  Pred range: [0.0277, 0.3930], std: 0.0582
  RMSE : 0.0891, R2: 0.2159, MAE: 0.0706, Spearman rho: 0.4804, Spearman p: 7.3963e-36, Pearson r: 0.4851, Pearson p: 1.2782e-36
  Pred range: [0.0220, 0.3386], std: 0.0528
  RMSE : 0.0887, R2: 0.2230, MAE: 0.0691, Spearman rho: 0.4845, Spearman p: 1.6025e-36, Pearson r: 0.4889, Pearson p: 2.9102e-37
  Pred range: [0.0426, 0.4111], std: 0.0603
  RMSE : 0.0914, R2: 0.1738, MAE: 0.0730, Spearman rho: 0.4770, Spearman p: 2.6186e-35, Pearson r: 0.4808, Pearson p: 6.3250e-36
  Pred range: [0.0412, 0.3888], std: 0.0566
  RMSE : 0.0894, R2: 0.2108, MAE: 0.0710, Spearman rho: 0.4761, Spearman p: 3.6645e-35, Pearson r: 0.4804, Pearson p: 7.3489e-36
  Pred range: [0.0243, 0.3850], std: 0.0589
  RMSE : 0.0890, R2: 0.2168, MAE: 0.0704, Spearman rho: 0.4767, Spearman p: 2.9218e-35, Pearson r: 0.4827, Pearson p: 3.1859e-36
  Pred range: [0.0489, 0.4292], std: 0.0634
  RMSE : 0.0934, R2: 0.1376, MAE: 0.0746, Spearman rho: 0.4742, Spearman p: 7.4999e-35, Pearson r: 0.4782, Pearson p: 1.6901e-35
[I 2026-04-27 17:20:25,566] Trial 51 finished with value: 0.08867161578506022 and parameters: {'learning_rate': 0.00033412774809024604, 'batch_size': 4, 'num_epochs': 20, 'weight_decay': 4.278941190366314e-05, 'layers_PRS': 5, 'layers_SCZ15': 3, 'layers_ADHD9': 2, 'layers_ASD9': 2, 'layers_ACE15': 4, 'layers_ACE18': 2, 'layers_SUD18': 3, 'layers_SES': 4, 'layers_SEX': 1, 'dropout': 0.38410703823118963, 'se_reduction': 4, 'hidden_dim_min': 7, 'base_loss': 'huber', 'huber_delta': 0.02031950150058899, 'focal_gamma': 1.00153374324016, 'n_bins': 8, 'scheduler_patience': 4, 'scheduler_factor': 0.659349369908872, 'early_stopping_patience': 4}. Best is trial 9 with value: 0.08803266597627345.
Train: 2407 rows (1613 IDs),Test: 598 rows (404 IDs) 

n_features_x : 6, n_features_per_modality: [16, 23, 19, 17, 7, 4, 4, 4, 1, 4]

--- ImbalancedRegressionLoss initialized ---
  Bins: 9, Focal gamma: 0.8807922546897556, Base loss: huber
  Bin [0.00, 0.11): count= 1180, weight=0.003
  Bin [0.11, 0.22): count=  835, weight=0.004
  Bin [0.22, 0.33): count=  312, weight=0.010
  Bin [0.33, 0.44): count=   59, weight=0.054
  Bin [0.44, 0.56): count=   16, weight=0.190
  Bin [0.56, 0.67): count=    4, weight=0.647
  Bin [0.67, 0.78): count=    1, weight=1.618
  Bin [0.78, 0.89): count=    0, weight=3.237
  Bin [0.89, 1.00): count=    0, weight=3.237
-------------------------------------------

  Pred range: [0.0277, 0.4558], std: 0.0679
  RMSE : 0.0933, R2: 0.1397, MAE: 0.0743, Spearman rho: 0.4475, Spearman p: 8.6614e-31, Pearson r: 0.4610, Pearson p: 8.4504e-33
  Pred range: [0.0250, 0.4054], std: 0.0614
  RMSE : 0.0920, R2: 0.1642, MAE: 0.0738, Spearman rho: 0.4728, Spearman p: 1.2477e-34, Pearson r: 0.4833, Pearson p: 2.4629e-36
  Pred range: [0.0247, 0.3892], std: 0.0599
  RMSE : 0.0890, R2: 0.2170, MAE: 0.0709, Spearman rho: 0.4848, Spearman p: 1.3964e-36, Pearson r: 0.4958, Pearson p: 2.0563e-38
  Pred range: [0.0334, 0.3712], std: 0.0585
  RMSE : 0.0894, R2: 0.2102, MAE: 0.0715, Spearman rho: 0.4824, Spearman p: 3.5672e-36, Pearson r: 0.4967, Pearson p: 1.4392e-38
  Pred range: [0.0306, 0.3888], std: 0.0599
  RMSE : 0.0921, R2: 0.1614, MAE: 0.0742, Spearman rho: 0.4739, Spearman p: 8.2446e-35, Pearson r: 0.4853, Pearson p: 1.1852e-36
  Pred range: [0.0703, 0.4598], std: 0.0656
  RMSE : 0.1076, R2: -0.1431, MAE: 0.0890, Spearman rho: 0.4726, Spearman p: 1.3178e-34, Pearson r: 0.4819, Pearson p: 4.1870e-36
  Pred range: [0.0459, 0.4118], std: 0.0631
  RMSE : 0.0923, R2: 0.1584, MAE: 0.0738, Spearman rho: 0.4775, Spearman p: 2.1859e-35, Pearson r: 0.4849, Pearson p: 1.3649e-36
  Pred range: [0.0448, 0.3701], std: 0.0576
  RMSE : 0.0919, R2: 0.1662, MAE: 0.0740, Spearman rho: 0.4706, Spearman p: 2.7825e-34, Pearson r: 0.4807, Pearson p: 6.5593e-36
[I 2026-04-27 17:21:31,290] Trial 52 finished with value: 0.0890139844996685 and parameters: {'learning_rate': 0.0008417280330851839, 'batch_size': 4, 'num_epochs': 21, 'weight_decay': 0.0002037913839951671, 'layers_PRS': 5, 'layers_SCZ15': 4, 'layers_ADHD9': 2, 'layers_ASD9': 2, 'layers_ACE15': 1, 'layers_ACE18': 3, 'layers_SUD18': 3, 'layers_SES': 5, 'layers_SEX': 1, 'dropout': 0.3989774625322736, 'se_reduction': 4, 'hidden_dim_min': 2, 'base_loss': 'huber', 'huber_delta': 0.016040809626687365, 'focal_gamma': 0.8807922546897556, 'n_bins': 9, 'scheduler_patience': 3, 'scheduler_factor': 0.6991518908577359, 'early_stopping_patience': 5}. Best is trial 9 with value: 0.08803266597627345.
Train: 2407 rows (1613 IDs),Test: 598 rows (404 IDs) 

n_features_x : 6, n_features_per_modality: [16, 23, 19, 17, 7, 4, 4, 4, 1, 4]

--- ImbalancedRegressionLoss initialized ---
  Bins: 10, Focal gamma: 0.6711440922179704, Base loss: huber
  Bin [0.00, 0.10): count= 1010, weight=0.003
  Bin [0.10, 0.20): count=  866, weight=0.003
  Bin [0.20, 0.30): count=  386, weight=0.007
  Bin [0.30, 0.40): count=  111, weight=0.026
  Bin [0.40, 0.50): count=   23, weight=0.119
  Bin [0.50, 0.60): count=    9, weight=0.287
  Bin [0.60, 0.70): count=    2, weight=0.955
  Bin [0.70, 0.80): count=    0, weight=2.866
  Bin [0.80, 0.90): count=    0, weight=2.866
  Bin [0.90, 1.00): count=    0, weight=2.866
-------------------------------------------

  Pred range: [0.0509, 0.5087], std: 0.0726
  RMSE : 0.1070, R2: -0.1318, MAE: 0.0865, Spearman rho: 0.4462, Spearman p: 1.3342e-30, Pearson r: 0.4546, Pearson p: 7.7980e-32
  Pred range: [0.0553, 0.4170], std: 0.0647
  RMSE : 0.1003, R2: 0.0052, MAE: 0.0817, Spearman rho: 0.4614, Spearman p: 7.2599e-33, Pearson r: 0.4727, Pearson p: 1.2842e-34
  Pred range: [0.0275, 0.4139], std: 0.0664
  RMSE : 0.0918, R2: 0.1665, MAE: 0.0725, Spearman rho: 0.4650, Spearman p: 2.0205e-33, Pearson r: 0.4684, Pearson p: 6.0029e-34
  Pred range: [0.0189, 0.3812], std: 0.0618
  RMSE : 0.0880, R2: 0.2344, MAE: 0.0690, Spearman rho: 0.4975, Spearman p: 1.0473e-38, Pearson r: 0.4997, Pearson p: 4.2881e-39
  Pred range: [0.0325, 0.3607], std: 0.0590
  RMSE : 0.0888, R2: 0.2201, MAE: 0.0703, Spearman rho: 0.4812, Spearman p: 5.4914e-36, Pearson r: 0.4861, Pearson p: 8.5746e-37
  Pred range: [0.0515, 0.4332], std: 0.0664
  RMSE : 0.1008, R2: -0.0032, MAE: 0.0819, Spearman rho: 0.4657, Spearman p: 1.6069e-33, Pearson r: 0.4725, Pearson p: 1.3635e-34
  Pred range: [0.0951, 0.4424], std: 0.0587
  RMSE : 0.1131, R2: -0.2634, MAE: 0.0942, Spearman rho: 0.4591, Spearman p: 1.6285e-32, Pearson r: 0.4655, Pearson p: 1.7093e-33
  Pred range: [0.0541, 0.4192], std: 0.0661
  RMSE : 0.0997, R2: 0.0182, MAE: 0.0813, Spearman rho: 0.4679, Spearman p: 7.3087e-34, Pearson r: 0.4772, Pearson p: 2.4620e-35
[I 2026-04-27 17:22:41,845] Trial 53 finished with value: 0.08802287430437908 and parameters: {'learning_rate': 0.001274358578027605, 'batch_size': 4, 'num_epochs': 20, 'weight_decay': 0.00042250453175940016, 'layers_PRS': 6, 'layers_SCZ15': 4, 'layers_ADHD9': 1, 'layers_ASD9': 1, 'layers_ACE15': 4, 'layers_ACE18': 4, 'layers_SUD18': 4, 'layers_SES': 5, 'layers_SEX': 1, 'dropout': 0.45420823754113554, 'se_reduction': 5, 'hidden_dim_min': 9, 'base_loss': 'huber', 'huber_delta': 0.010178798928125538, 'focal_gamma': 0.6711440922179704, 'n_bins': 10, 'scheduler_patience': 2, 'scheduler_factor': 0.629619300204312, 'early_stopping_patience': 4}. Best is trial 53 with value: 0.08802287430437908.
Train: 2407 rows (1613 IDs),Test: 598 rows (404 IDs) 

n_features_x : 6, n_features_per_modality: [16, 23, 19, 17, 7, 4, 4, 4, 1, 4]

--- ImbalancedRegressionLoss initialized ---
  Bins: 10, Focal gamma: 0.6352096897149139, Base loss: huber
  Bin [0.00, 0.10): count= 1010, weight=0.003
  Bin [0.10, 0.20): count=  866, weight=0.003
  Bin [0.20, 0.30): count=  386, weight=0.007
  Bin [0.30, 0.40): count=  111, weight=0.026
  Bin [0.40, 0.50): count=   23, weight=0.119
  Bin [0.50, 0.60): count=    9, weight=0.287
  Bin [0.60, 0.70): count=    2, weight=0.955
  Bin [0.70, 0.80): count=    0, weight=2.866
  Bin [0.80, 0.90): count=    0, weight=2.866
  Bin [0.90, 1.00): count=    0, weight=2.866
-------------------------------------------

  Pred range: [0.0784, 0.4688], std: 0.0611
  RMSE : 0.1254, R2: -0.5546, MAE: 0.1052, Spearman rho: 0.3883, Spearman p: 5.9599e-23, Pearson r: 0.3919, Pearson p: 2.1614e-23
  Pred range: [0.1004, 0.5560], std: 0.0714
  RMSE : 0.1435, R2: -1.0362, MAE: 0.1222, Spearman rho: 0.4274, Spearman p: 5.9333e-28, Pearson r: 0.4345, Pearson p: 6.2340e-29
  Pred range: [0.0673, 0.4826], std: 0.0661
  RMSE : 0.1071, R2: -0.1338, MAE: 0.0876, Spearman rho: 0.4443, Spearman p: 2.5092e-30, Pearson r: 0.4512, Pearson p: 2.5034e-31
  Pred range: [0.0452, 0.4693], std: 0.0672
  RMSE : 0.1078, R2: -0.1480, MAE: 0.0885, Spearman rho: 0.4588, Spearman p: 1.8511e-32, Pearson r: 0.4682, Pearson p: 6.4981e-34
  Pred range: [0.0820, 0.5332], std: 0.0727
  RMSE : 0.1342, R2: -0.7784, MAE: 0.1131, Spearman rho: 0.4561, Spearman p: 4.6400e-32, Pearson r: 0.4671, Pearson p: 9.7533e-34
  Pred range: [0.0405, 0.4978], std: 0.0694
  RMSE : 0.1126, R2: -0.2537, MAE: 0.0929, Spearman rho: 0.4630, Spearman p: 4.2432e-33, Pearson r: 0.4730, Pearson p: 1.1553e-34
[I 2026-04-27 17:22:50,710] Trial 54 pruned. 
Train: 2407 rows (1613 IDs),Test: 598 rows (404 IDs) 

n_features_x : 6, n_features_per_modality: [16, 23, 19, 17, 7, 4, 4, 4, 1, 4]

--- ImbalancedRegressionLoss initialized ---
  Bins: 11, Focal gamma: 2.1694907096692235, Base loss: huber
  Bin [0.00, 0.09): count= 1010, weight=0.003
  Bin [0.09, 0.18): count=  706, weight=0.004
  Bin [0.18, 0.27): count=  478, weight=0.006
  Bin [0.27, 0.36): count=  159, weight=0.018
  Bin [0.36, 0.45): count=   33, weight=0.085
  Bin [0.45, 0.55): count=   16, weight=0.170
  Bin [0.55, 0.64): count=    4, weight=0.579
  Bin [0.64, 0.73): count=    1, weight=1.448
  Bin [0.73, 0.82): count=    0, weight=2.896
  Bin [0.82, 0.91): count=    0, weight=2.896
  Bin [0.91, 1.00): count=    0, weight=2.896
-------------------------------------------

  Pred range: [0.0290, 0.3921], std: 0.0588
  RMSE : 0.0973, R2: 0.0647, MAE: 0.0786, Spearman rho: 0.4147, Spearman p: 2.9922e-26, Pearson r: 0.4340, Pearson p: 7.3697e-29
  Pred range: [0.0275, 0.3447], std: 0.0518
  RMSE : 0.0901, R2: 0.1984, MAE: 0.0716, Spearman rho: 0.4347, Spearman p: 5.7877e-29, Pearson r: 0.4518, Pearson p: 2.0208e-31
  Pred range: [0.0313, 0.3689], std: 0.0592
  RMSE : 0.0912, R2: 0.1786, MAE: 0.0725, Spearman rho: 0.4567, Spearman p: 3.8156e-32, Pearson r: 0.4657, Pearson p: 1.6110e-33
  Pred range: [0.0551, 0.3926], std: 0.0532
  RMSE : 0.0966, R2: 0.0780, MAE: 0.0790, Spearman rho: 0.4506, Spearman p: 3.0355e-31, Pearson r: 0.4652, Pearson p: 1.8891e-33
  Pred range: [0.0447, 0.3701], std: 0.0530
  RMSE : 0.0894, R2: 0.2109, MAE: 0.0713, Spearman rho: 0.4600, Spearman p: 1.1920e-32, Pearson r: 0.4706, Pearson p: 2.7057e-34
  Pred range: [0.0368, 0.3551], std: 0.0516
  RMSE : 0.0891, R2: 0.2151, MAE: 0.0704, Spearman rho: 0.4584, Spearman p: 2.1192e-32, Pearson r: 0.4666, Pearson p: 1.1583e-33
  Pred range: [0.0434, 0.3674], std: 0.0540
  RMSE : 0.0899, R2: 0.2010, MAE: 0.0719, Spearman rho: 0.4557, Spearman p: 5.4189e-32, Pearson r: 0.4656, Pearson p: 1.6691e-33
  Pred range: [0.0342, 0.3968], std: 0.0549
  RMSE : 0.0910, R2: 0.1809, MAE: 0.0733, Spearman rho: 0.4605, Spearman p: 1.0028e-32, Pearson r: 0.4707, Pearson p: 2.7043e-34
  Pred range: [0.0213, 0.3592], std: 0.0501
  RMSE : 0.0893, R2: 0.2127, MAE: 0.0715, Spearman rho: 0.4561, Spearman p: 4.6833e-32, Pearson r: 0.4665, Pearson p: 1.2198e-33
[I 2026-04-27 17:24:13,726] Trial 55 finished with value: 0.08912480918601691 and parameters: {'learning_rate': 0.0005701307432094203, 'batch_size': 4, 'num_epochs': 22, 'weight_decay': 0.0003408624018184163, 'layers_PRS': 7, 'layers_SCZ15': 3, 'layers_ADHD9': 1, 'layers_ASD9': 1, 'layers_ACE15': 4, 'layers_ACE18': 5, 'layers_SUD18': 4, 'layers_SES': 5, 'layers_SEX': 1, 'dropout': 0.4624016168442166, 'se_reduction': 5, 'hidden_dim_min': 5, 'base_loss': 'huber', 'huber_delta': 0.02857775977961142, 'focal_gamma': 2.1694907096692235, 'n_bins': 11, 'scheduler_patience': 4, 'scheduler_factor': 0.5609867274393066, 'early_stopping_patience': 3}. Best is trial 53 with value: 0.08802287430437908.
Train: 2407 rows (1613 IDs),Test: 598 rows (404 IDs) 

n_features_x : 6, n_features_per_modality: [16, 23, 19, 17, 7, 4, 4, 4, 1, 4]

--- ImbalancedRegressionLoss initialized ---
  Bins: 19, Focal gamma: 0.7789471938124096, Base loss: huber
  Bin [0.00, 0.05): count=  650, weight=0.004
  Bin [0.05, 0.11): count=  360, weight=0.007
  Bin [0.11, 0.16): count=  528, weight=0.005
  Bin [0.16, 0.21): count=  338, weight=0.008
  Bin [0.21, 0.26): count=  318, weight=0.008
  Bin [0.26, 0.32): count=  109, weight=0.023
  Bin [0.32, 0.37): count=   50, weight=0.050
  Bin [0.37, 0.42): count=   29, weight=0.085
  Bin [0.42, 0.47): count=    7, weight=0.320
  Bin [0.47, 0.53): count=   10, weight=0.232
  Bin [0.53, 0.58): count=    6, weight=0.365
  Bin [0.58, 0.63): count=    1, weight=1.278
  Bin [0.63, 0.68): count=    0, weight=2.556
  Bin [0.68, 0.74): count=    1, weight=1.278
  Bin [0.74, 0.79): count=    0, weight=2.556
  Bin [0.79, 0.84): count=    0, weight=2.556
  Bin [0.84, 0.89): count=    0, weight=2.556
  Bin [0.89, 0.95): count=    0, weight=2.556
  Bin [0.95, 1.00): count=    0, weight=2.556
-------------------------------------------

  Pred range: [0.0635, 0.3951], std: 0.0562
  RMSE : 0.0976, R2: 0.0579, MAE: 0.0797, Spearman rho: 0.4420, Spearman p: 5.4666e-30, Pearson r: 0.4524, Pearson p: 1.6821e-31
  Pred range: [0.0310, 0.3503], std: 0.0550
  RMSE : 0.0894, R2: 0.2101, MAE: 0.0716, Spearman rho: 0.4638, Spearman p: 3.1998e-33, Pearson r: 0.4791, Pearson p: 1.2077e-35
  Pred range: [0.0216, 0.3434], std: 0.0549
  RMSE : 0.0887, R2: 0.2228, MAE: 0.0703, Spearman rho: 0.4830, Spearman p: 2.8341e-36, Pearson r: 0.4864, Pearson p: 7.5766e-37
  Pred range: [0.0327, 0.3559], std: 0.0584
  RMSE : 0.0897, R2: 0.2055, MAE: 0.0720, Spearman rho: 0.4861, Spearman p: 8.5297e-37, Pearson r: 0.4962, Pearson p: 1.7549e-38
  Pred range: [0.0193, 0.3885], std: 0.0675
  RMSE : 0.0897, R2: 0.2044, MAE: 0.0702, Spearman rho: 0.4886, Spearman p: 3.2832e-37, Pearson r: 0.4940, Pearson p: 4.0592e-38
  Pred range: [0.0194, 0.3820], std: 0.0566
  RMSE : 0.0896, R2: 0.2064, MAE: 0.0716, Spearman rho: 0.4779, Spearman p: 1.9138e-35, Pearson r: 0.4833, Pearson p: 2.5067e-36
  Pred range: [0.0596, 0.3602], std: 0.0532
  RMSE : 0.0937, R2: 0.1322, MAE: 0.0761, Spearman rho: 0.4587, Spearman p: 1.9086e-32, Pearson r: 0.4689, Pearson p: 5.0877e-34
[I 2026-04-27 17:25:21,557] Trial 56 finished with value: 0.0886817769054907 and parameters: {'learning_rate': 0.0014143180514692342, 'batch_size': 4, 'num_epochs': 24, 'weight_decay': 0.0010579852170387839, 'layers_PRS': 6, 'layers_SCZ15': 2, 'layers_ADHD9': 4, 'layers_ASD9': 3, 'layers_ACE15': 5, 'layers_ACE18': 5, 'layers_SUD18': 5, 'layers_SES': 3, 'layers_SEX': 1, 'dropout': 0.4481520741559699, 'se_reduction': 8, 'hidden_dim_min': 6, 'base_loss': 'huber', 'huber_delta': 0.04557532207417793, 'focal_gamma': 0.7789471938124096, 'n_bins': 19, 'scheduler_patience': 3, 'scheduler_factor': 0.642456892641497, 'early_stopping_patience': 4}. Best is trial 53 with value: 0.08802287430437908.
Train: 2407 rows (1613 IDs),Test: 598 rows (404 IDs) 

n_features_x : 6, n_features_per_modality: [16, 23, 19, 17, 7, 4, 4, 4, 1, 4]

--- ImbalancedRegressionLoss initialized ---
  Bins: 12, Focal gamma: 2.540759019058621, Base loss: huber
  Bin [0.00, 0.08): count=  828, weight=0.003
  Bin [0.08, 0.17): count=  710, weight=0.004
  Bin [0.17, 0.25): count=  575, weight=0.005
  Bin [0.25, 0.33): count=  214, weight=0.013
  Bin [0.33, 0.42): count=   55, weight=0.051
  Bin [0.42, 0.50): count=   14, weight=0.191
  Bin [0.50, 0.58): count=    9, weight=0.286
  Bin [0.58, 0.67): count=    1, weight=1.431
  Bin [0.67, 0.75): count=    1, weight=1.431
  Bin [0.75, 0.83): count=    0, weight=2.862
  Bin [0.83, 0.92): count=    0, weight=2.862
  Bin [0.92, 1.00): count=    0, weight=2.862
-------------------------------------------

  Pred range: [0.0379, 0.3639], std: 0.0548
  RMSE : 0.0918, R2: 0.1676, MAE: 0.0728, Spearman rho: 0.4265, Spearman p: 7.8537e-28, Pearson r: 0.4339, Pearson p: 7.6486e-29
  Pred range: [0.0433, 0.3505], std: 0.0475
  RMSE : 0.0897, R2: 0.2049, MAE: 0.0713, Spearman rho: 0.4495, Spearman p: 4.4990e-31, Pearson r: 0.4576, Pearson p: 2.7319e-32
  Pred range: [0.0392, 0.3515], std: 0.0500
  RMSE : 0.0894, R2: 0.2109, MAE: 0.0711, Spearman rho: 0.4554, Spearman p: 5.8916e-32, Pearson r: 0.4633, Pearson p: 3.7182e-33
  Pred range: [0.0271, 0.3168], std: 0.0501
  RMSE : 0.0901, R2: 0.1974, MAE: 0.0701, Spearman rho: 0.4736, Spearman p: 9.1302e-35, Pearson r: 0.4780, Pearson p: 1.8235e-35
  Pred range: [0.0483, 0.3473], std: 0.0509
  RMSE : 0.0893, R2: 0.2111, MAE: 0.0712, Spearman rho: 0.4720, Spearman p: 1.6797e-34, Pearson r: 0.4760, Pearson p: 3.8244e-35
  Pred range: [0.0330, 0.3107], std: 0.0493
  RMSE : 0.0893, R2: 0.2119, MAE: 0.0701, Spearman rho: 0.4651, Spearman p: 1.9715e-33, Pearson r: 0.4698, Pearson p: 3.7075e-34
  Pred range: [0.0583, 0.3788], std: 0.0548
  RMSE : 0.0922, R2: 0.1601, MAE: 0.0738, Spearman rho: 0.4691, Spearman p: 4.7284e-34, Pearson r: 0.4709, Pearson p: 2.4889e-34
  Pred range: [0.0710, 0.3842], std: 0.0548
  RMSE : 0.0977, R2: 0.0558, MAE: 0.0800, Spearman rho: 0.4687, Spearman p: 5.4668e-34, Pearson r: 0.4750, Pearson p: 5.4288e-35
  Pred range: [0.0361, 0.3085], std: 0.0461
  RMSE : 0.0890, R2: 0.2167, MAE: 0.0704, Spearman rho: 0.4658, Spearman p: 1.5242e-33, Pearson r: 0.4730, Pearson p: 1.1588e-34
  Pred range: [0.0596, 0.3766], std: 0.0562
  RMSE : 0.0926, R2: 0.1528, MAE: 0.0744, Spearman rho: 0.4714, Spearman p: 2.0853e-34, Pearson r: 0.4763, Pearson p: 3.4733e-35
  Pred range: [0.0624, 0.3783], std: 0.0532
  RMSE : 0.0917, R2: 0.1686, MAE: 0.0738, Spearman rho: 0.4758, Spearman p: 4.1699e-35, Pearson r: 0.4797, Pearson p: 9.6037e-36
  Pred range: [0.0375, 0.3117], std: 0.0463
  RMSE : 0.0886, R2: 0.2234, MAE: 0.0695, Spearman rho: 0.4878, Spearman p: 4.5640e-37, Pearson r: 0.4870, Pearson p: 6.2464e-37
  Pred range: [0.0446, 0.3609], std: 0.0551
  RMSE : 0.0892, R2: 0.2133, MAE: 0.0710, Spearman rho: 0.4767, Spearman p: 2.9098e-35, Pearson r: 0.4804, Pearson p: 7.4999e-36
  Pred range: [0.0526, 0.3850], std: 0.0574
  RMSE : 0.0919, R2: 0.1660, MAE: 0.0736, Spearman rho: 0.4762, Spearman p: 3.5582e-35, Pearson r: 0.4791, Pearson p: 1.2293e-35
  Pred range: [0.0522, 0.3393], std: 0.0489
  RMSE : 0.0887, R2: 0.2227, MAE: 0.0706, Spearman rho: 0.4758, Spearman p: 4.0686e-35, Pearson r: 0.4791, Pearson p: 1.2094e-35
  Pred range: [0.0431, 0.3280], std: 0.0492
  RMSE : 0.0883, R2: 0.2298, MAE: 0.0697, Spearman rho: 0.4758, Spearman p: 4.0483e-35, Pearson r: 0.4798, Pearson p: 9.4889e-36
  Pred range: [0.0399, 0.3219], std: 0.0484
  RMSE : 0.0883, R2: 0.2288, MAE: 0.0696, Spearman rho: 0.4774, Spearman p: 2.2703e-35, Pearson r: 0.4816, Pearson p: 4.7411e-36
  Pred range: [0.0443, 0.3286], std: 0.0483
  RMSE : 0.0881, R2: 0.2337, MAE: 0.0699, Spearman rho: 0.4793, Spearman p: 1.1409e-35, Pearson r: 0.4834, Pearson p: 2.4034e-36
