[I 2026-04-27 17:55:07,316] Trial 78 finished with value: 0.08863653390367589 and parameters: {'learning_rate': 0.00039899293365962, 'batch_size': 4, 'num_epochs': 17, 'weight_decay': 0.0018199704748282075, 'layers_PRS': 7, 'layers_SCZ15': 4, 'layers_ADHD9': 1, 'layers_ASD9': 3, 'layers_ACE15': 4, 'layers_ACE18': 3, 'layers_SUD18': 7, 'layers_SES': 6, 'layers_SEX': 2, 'dropout': 0.18876386607617515, 'se_reduction': 4, 'hidden_dim_min': 2, 'base_loss': 'huber', 'huber_delta': 0.04149455180248829, 'focal_gamma': 0.8901467533946152, 'n_bins': 12, 'scheduler_patience': 2, 'scheduler_factor': 0.6053160394948869, 'early_stopping_patience': 4}. Best is trial 66 with value: 0.08778944019020135.
Train: 2407 rows (1613 IDs),Test: 598 rows (404 IDs) 

n_features_x : 6, n_features_per_modality: [16, 23, 19, 17, 7, 4, 4, 4, 1, 4]

--- ImbalancedRegressionLoss initialized ---
  Bins: 9, Focal gamma: 1.1097112322060807, Base loss: huber
  Bin [0.00, 0.11): count= 1180, weight=0.003
  Bin [0.11, 0.22): count=  835, weight=0.004
  Bin [0.22, 0.33): count=  312, weight=0.010
  Bin [0.33, 0.44): count=   59, weight=0.054
  Bin [0.44, 0.56): count=   16, weight=0.190
  Bin [0.56, 0.67): count=    4, weight=0.647
  Bin [0.67, 0.78): count=    1, weight=1.618
  Bin [0.78, 0.89): count=    0, weight=3.237
  Bin [0.89, 1.00): count=    0, weight=3.237
-------------------------------------------

  Pred range: [0.0342, 0.4135], std: 0.0633
  RMSE : 0.0963, R2: 0.0836, MAE: 0.0770, Spearman rho: 0.4132, Spearman p: 4.5909e-26, Pearson r: 0.4249, Pearson p: 1.2907e-27
  Pred range: [0.0558, 0.3985], std: 0.0575
  RMSE : 0.0961, R2: 0.0881, MAE: 0.0774, Spearman rho: 0.4362, Spearman p: 3.6113e-29, Pearson r: 0.4441, Pearson p: 2.7471e-30
  Pred range: [0.0381, 0.3936], std: 0.0596
  RMSE : 0.0915, R2: 0.1726, MAE: 0.0728, Spearman rho: 0.4581, Spearman p: 2.3514e-32, Pearson r: 0.4628, Pearson p: 4.4494e-33
  Pred range: [0.0553, 0.4610], std: 0.0650
  RMSE : 0.1017, R2: -0.0227, MAE: 0.0827, Spearman rho: 0.4560, Spearman p: 4.8344e-32, Pearson r: 0.4632, Pearson p: 3.9381e-33
  Pred range: [0.0437, 0.4356], std: 0.0616
  RMSE : 0.1025, R2: -0.0376, MAE: 0.0836, Spearman rho: 0.4503, Spearman p: 3.4034e-31, Pearson r: 0.4572, Pearson p: 3.1867e-32
  Pred range: [0.0457, 0.4446], std: 0.0648
  RMSE : 0.1010, R2: -0.0077, MAE: 0.0821, Spearman rho: 0.4600, Spearman p: 1.2107e-32, Pearson r: 0.4681, Pearson p: 6.8934e-34
[I 2026-04-27 17:55:40,744] Trial 79 finished with value: 0.09150477361115324 and parameters: {'learning_rate': 0.0006665938096457564, 'batch_size': 8, 'num_epochs': 15, 'weight_decay': 0.0001315713432206191, 'layers_PRS': 4, 'layers_SCZ15': 7, 'layers_ADHD9': 3, 'layers_ASD9': 1, 'layers_ACE15': 5, 'layers_ACE18': 1, 'layers_SUD18': 6, 'layers_SES': 4, 'layers_SEX': 2, 'dropout': 0.48715479344844737, 'se_reduction': 3, 'hidden_dim_min': 8, 'base_loss': 'huber', 'huber_delta': 0.05771256410529414, 'focal_gamma': 1.1097112322060807, 'n_bins': 9, 'scheduler_patience': 2, 'scheduler_factor': 0.6494002349726765, 'early_stopping_patience': 3}. Best is trial 66 with value: 0.08778944019020135.
Train: 2407 rows (1613 IDs),Test: 598 rows (404 IDs) 

n_features_x : 6, n_features_per_modality: [16, 23, 19, 17, 7, 4, 4, 4, 1, 4]

--- ImbalancedRegressionLoss initialized ---
  Bins: 11, Focal gamma: 1.4802607411851734, Base loss: huber
  Bin [0.00, 0.09): count= 1010, weight=0.003
  Bin [0.09, 0.18): count=  706, weight=0.004
  Bin [0.18, 0.27): count=  478, weight=0.006
  Bin [0.27, 0.36): count=  159, weight=0.018
  Bin [0.36, 0.45): count=   33, weight=0.085
  Bin [0.45, 0.55): count=   16, weight=0.170
  Bin [0.55, 0.64): count=    4, weight=0.579
  Bin [0.64, 0.73): count=    1, weight=1.448
  Bin [0.73, 0.82): count=    0, weight=2.896
  Bin [0.82, 0.91): count=    0, weight=2.896
  Bin [0.91, 1.00): count=    0, weight=2.896
-------------------------------------------

  Pred range: [0.0421, 0.3378], std: 0.0503
  RMSE : 0.0895, R2: 0.2092, MAE: 0.0710, Spearman rho: 0.4454, Spearman p: 1.7353e-30, Pearson r: 0.4592, Pearson p: 1.5940e-32
  Pred range: [0.0418, 0.3547], std: 0.0530
  RMSE : 0.0891, R2: 0.2157, MAE: 0.0713, Spearman rho: 0.4613, Spearman p: 7.5788e-33, Pearson r: 0.4754, Pearson p: 4.7746e-35
  Pred range: [0.0443, 0.3852], std: 0.0597
  RMSE : 0.0915, R2: 0.1726, MAE: 0.0733, Spearman rho: 0.4707, Spearman p: 2.7023e-34, Pearson r: 0.4796, Pearson p: 1.0026e-35
  Pred range: [0.0498, 0.3677], std: 0.0534
  RMSE : 0.0917, R2: 0.1687, MAE: 0.0740, Spearman rho: 0.4646, Spearman p: 2.3446e-33, Pearson r: 0.4750, Pearson p: 5.5781e-35
  Pred range: [0.0486, 0.4237], std: 0.0596
  RMSE : 0.0943, R2: 0.1221, MAE: 0.0762, Spearman rho: 0.4766, Spearman p: 3.0954e-35, Pearson r: 0.4814, Pearson p: 5.1867e-36
  Pred range: [0.0423, 0.3928], std: 0.0579
  RMSE : 0.0934, R2: 0.1385, MAE: 0.0755, Spearman rho: 0.4764, Spearman p: 3.3529e-35, Pearson r: 0.4823, Pearson p: 3.5921e-36
  Pred range: [0.0309, 0.3855], std: 0.0570
  RMSE : 0.0919, R2: 0.1663, MAE: 0.0737, Spearman rho: 0.4664, Spearman p: 1.2668e-33, Pearson r: 0.4731, Pearson p: 1.0932e-34
  Pred range: [0.0085, 0.3776], std: 0.0543
  RMSE : 0.0897, R2: 0.2049, MAE: 0.0718, Spearman rho: 0.4586, Spearman p: 1.9484e-32, Pearson r: 0.4684, Pearson p: 5.9926e-34
[I 2026-04-27 17:56:56,347] Trial 80 finished with value: 0.08908616324662681 and parameters: {'learning_rate': 0.0004851398095012186, 'batch_size': 4, 'num_epochs': 19, 'weight_decay': 2.10367362549167e-05, 'layers_PRS': 6, 'layers_SCZ15': 3, 'layers_ADHD9': 2, 'layers_ASD9': 2, 'layers_ACE15': 4, 'layers_ACE18': 2, 'layers_SUD18': 4, 'layers_SES': 6, 'layers_SEX': 3, 'dropout': 0.47556822354338885, 'se_reduction': 5, 'hidden_dim_min': 10, 'base_loss': 'huber', 'huber_delta': 0.07544359015702709, 'focal_gamma': 1.4802607411851734, 'n_bins': 11, 'scheduler_patience': 2, 'scheduler_factor': 0.49959218020135443, 'early_stopping_patience': 6}. Best is trial 66 with value: 0.08778944019020135.
Train: 2407 rows (1613 IDs),Test: 598 rows (404 IDs) 

n_features_x : 6, n_features_per_modality: [16, 23, 19, 17, 7, 4, 4, 4, 1, 4]

--- ImbalancedRegressionLoss initialized ---
  Bins: 7, Focal gamma: 0.566406540128575, Base loss: huber
  Bin [0.00, 0.14): count= 1370, weight=0.002
  Bin [0.14, 0.29): count=  892, weight=0.003
  Bin [0.29, 0.43): count=  120, weight=0.024
  Bin [0.43, 0.57): count=   23, weight=0.122
  Bin [0.57, 0.71): count=    2, weight=0.978
  Bin [0.71, 0.86): count=    0, weight=2.935
  Bin [0.86, 1.00): count=    0, weight=2.935
-------------------------------------------

  Pred range: [0.0458, 0.3548], std: 0.0501
  RMSE : 0.0898, R2: 0.2038, MAE: 0.0708, Spearman rho: 0.4440, Spearman p: 2.7630e-30, Pearson r: 0.4540, Pearson p: 9.5419e-32
  Pred range: [0.0715, 0.4139], std: 0.0543
  RMSE : 0.0969, R2: 0.0728, MAE: 0.0786, Spearman rho: 0.4430, Spearman p: 3.9023e-30, Pearson r: 0.4500, Pearson p: 3.7925e-31
  Pred range: [0.0358, 0.3676], std: 0.0518
  RMSE : 0.0905, R2: 0.1899, MAE: 0.0709, Spearman rho: 0.4399, Spearman p: 1.0856e-29, Pearson r: 0.4432, Pearson p: 3.6664e-30
  Pred range: [0.0475, 0.3862], std: 0.0636
  RMSE : 0.0953, R2: 0.1031, MAE: 0.0764, Spearman rho: 0.4574, Spearman p: 3.0013e-32, Pearson r: 0.4612, Pearson p: 7.7655e-33
  Pred range: [0.0559, 0.4619], std: 0.0644
  RMSE : 0.0962, R2: 0.0853, MAE: 0.0765, Spearman rho: 0.4496, Spearman p: 4.3132e-31, Pearson r: 0.4468, Pearson p: 1.0912e-30
[I 2026-04-27 17:57:54,130] Trial 81 finished with value: 0.08976298309236547 and parameters: {'learning_rate': 0.0018503854324244358, 'batch_size': 4, 'num_epochs': 23, 'weight_decay': 0.006827666344204987, 'layers_PRS': 6, 'layers_SCZ15': 3, 'layers_ADHD9': 7, 'layers_ASD9': 1, 'layers_ACE15': 4, 'layers_ACE18': 4, 'layers_SUD18': 3, 'layers_SES': 6, 'layers_SEX': 3, 'dropout': 0.2787561189614721, 'se_reduction': 4, 'hidden_dim_min': 4, 'base_loss': 'huber', 'huber_delta': 0.023991354282020413, 'focal_gamma': 0.566406540128575, 'n_bins': 7, 'scheduler_patience': 4, 'scheduler_factor': 0.6353056476527473, 'early_stopping_patience': 4}. Best is trial 66 with value: 0.08778944019020135.
Train: 2407 rows (1613 IDs),Test: 598 rows (404 IDs) 

n_features_x : 6, n_features_per_modality: [16, 23, 19, 17, 7, 4, 4, 4, 1, 4]

--- ImbalancedRegressionLoss initialized ---
  Bins: 8, Focal gamma: 0.5866652829326688, Base loss: huber
  Bin [0.00, 0.12): count= 1180, weight=0.003
  Bin [0.12, 0.25): count=  933, weight=0.003
  Bin [0.25, 0.38): count=  253, weight=0.012
  Bin [0.38, 0.50): count=   30, weight=0.098
  Bin [0.50, 0.62): count=   10, weight=0.277
  Bin [0.62, 0.75): count=    1, weight=1.521
  Bin [0.75, 0.88): count=    0, weight=3.043
  Bin [0.88, 1.00): count=    0, weight=3.043
-------------------------------------------

  Pred range: [0.0189, 0.3737], std: 0.0581
  RMSE : 0.0892, R2: 0.2139, MAE: 0.0706, Spearman rho: 0.4658, Spearman p: 1.5507e-33, Pearson r: 0.4760, Pearson p: 3.8648e-35
  Pred range: [0.0366, 0.3484], std: 0.0540
  RMSE : 0.0906, R2: 0.1894, MAE: 0.0723, Spearman rho: 0.4596, Spearman p: 1.3642e-32, Pearson r: 0.4687, Pearson p: 5.5147e-34
  Pred range: [0.0423, 0.3702], std: 0.0587
  RMSE : 0.0909, R2: 0.1832, MAE: 0.0726, Spearman rho: 0.4622, Spearman p: 5.6065e-33, Pearson r: 0.4707, Pearson p: 2.6455e-34
  Pred range: [0.0443, 0.3786], std: 0.0595
  RMSE : 0.0902, R2: 0.1966, MAE: 0.0715, Spearman rho: 0.4763, Spearman p: 3.4467e-35, Pearson r: 0.4788, Pearson p: 1.3786e-35
  Pred range: [0.0316, 0.3499], std: 0.0559
  RMSE : 0.0887, R2: 0.2227, MAE: 0.0696, Spearman rho: 0.4747, Spearman p: 6.0715e-35, Pearson r: 0.4789, Pearson p: 1.2915e-35
  Pred range: [0.0404, 0.3645], std: 0.0586
  RMSE : 0.0891, R2: 0.2154, MAE: 0.0708, Spearman rho: 0.4789, Spearman p: 1.3211e-35, Pearson r: 0.4853, Pearson p: 1.1917e-36
  Pred range: [0.0534, 0.3679], std: 0.0533
  RMSE : 0.0900, R2: 0.1994, MAE: 0.0717, Spearman rho: 0.4742, Spearman p: 7.3799e-35, Pearson r: 0.4793, Pearson p: 1.1357e-35
  Pred range: [0.0525, 0.3391], std: 0.0509
  RMSE : 0.0884, R2: 0.2273, MAE: 0.0705, Spearman rho: 0.4778, Spearman p: 1.9973e-35, Pearson r: 0.4855, Pearson p: 1.0734e-36
  Pred range: [0.0364, 0.3123], std: 0.0507
  RMSE : 0.0886, R2: 0.2237, MAE: 0.0695, Spearman rho: 0.4744, Spearman p: 6.8369e-35, Pearson r: 0.4806, Pearson p: 6.8274e-36
  Pred range: [0.0444, 0.3931], std: 0.0587
  RMSE : 0.0895, R2: 0.2086, MAE: 0.0707, Spearman rho: 0.4794, Spearman p: 1.0637e-35, Pearson r: 0.4837, Pearson p: 2.1718e-36
  Pred range: [0.0378, 0.4337], std: 0.0675
  RMSE : 0.0928, R2: 0.1498, MAE: 0.0735, Spearman rho: 0.4741, Spearman p: 7.6020e-35, Pearson r: 0.4786, Pearson p: 1.4390e-35
  Pred range: [0.0604, 0.3801], std: 0.0554
  RMSE : 0.0932, R2: 0.1419, MAE: 0.0752, Spearman rho: 0.4713, Spearman p: 2.1057e-34, Pearson r: 0.4768, Pearson p: 2.8678e-35
[I 2026-04-27 18:00:03,072] Trial 82 finished with value: 0.08842699839445263 and parameters: {'learning_rate': 0.0010940393706878415, 'batch_size': 4, 'num_epochs': 22, 'weight_decay': 0.008130924928750536, 'layers_PRS': 6, 'layers_SCZ15': 2, 'layers_ADHD9': 6, 'layers_ASD9': 1, 'layers_ACE15': 4, 'layers_ACE18': 4, 'layers_SUD18': 2, 'layers_SES': 6, 'layers_SEX': 4, 'dropout': 0.31483963681123606, 'se_reduction': 4, 'hidden_dim_min': 6, 'base_loss': 'huber', 'huber_delta': 0.06467130070640884, 'focal_gamma': 0.5866652829326688, 'n_bins': 8, 'scheduler_patience': 4, 'scheduler_factor': 0.686939305055284, 'early_stopping_patience': 4}. Best is trial 66 with value: 0.08778944019020135.
Train: 2407 rows (1613 IDs),Test: 598 rows (404 IDs) 

n_features_x : 6, n_features_per_modality: [16, 23, 19, 17, 7, 4, 4, 4, 1, 4]

--- ImbalancedRegressionLoss initialized ---
  Bins: 8, Focal gamma: 0.6574186648777218, Base loss: huber
  Bin [0.00, 0.12): count= 1180, weight=0.003
  Bin [0.12, 0.25): count=  933, weight=0.003
  Bin [0.25, 0.38): count=  253, weight=0.012
  Bin [0.38, 0.50): count=   30, weight=0.098
  Bin [0.50, 0.62): count=   10, weight=0.277
  Bin [0.62, 0.75): count=    1, weight=1.521
  Bin [0.75, 0.88): count=    0, weight=3.043
  Bin [0.88, 1.00): count=    0, weight=3.043
-------------------------------------------

  Pred range: [0.0318, 0.3600], std: 0.0588
  RMSE : 0.0909, R2: 0.1830, MAE: 0.0716, Spearman rho: 0.4454, Spearman p: 1.7550e-30, Pearson r: 0.4494, Pearson p: 4.5209e-31
  Pred range: [0.0475, 0.3695], std: 0.0576
  RMSE : 0.0921, R2: 0.1620, MAE: 0.0741, Spearman rho: 0.4676, Spearman p: 8.2078e-34, Pearson r: 0.4740, Pearson p: 8.0751e-35
  Pred range: [0.0483, 0.4023], std: 0.0570
  RMSE : 0.0919, R2: 0.1650, MAE: 0.0733, Spearman rho: 0.4444, Spearman p: 2.4294e-30, Pearson r: 0.4503, Pearson p: 3.4136e-31
  Pred range: [0.0317, 0.3815], std: 0.0589
  RMSE : 0.0899, R2: 0.2019, MAE: 0.0707, Spearman rho: 0.4628, Spearman p: 4.5239e-33, Pearson r: 0.4684, Pearson p: 6.2002e-34
  Pred range: [0.0568, 0.3806], std: 0.0571
  RMSE : 0.0917, R2: 0.1693, MAE: 0.0737, Spearman rho: 0.4686, Spearman p: 5.7102e-34, Pearson r: 0.4765, Pearson p: 3.1524e-35
  Pred range: [0.0520, 0.3858], std: 0.0580
  RMSE : 0.0918, R2: 0.1673, MAE: 0.0734, Spearman rho: 0.4609, Spearman p: 8.6495e-33, Pearson r: 0.4685, Pearson p: 5.7959e-34
  Pred range: [0.0372, 0.4009], std: 0.0591
  RMSE : 0.0900, R2: 0.1992, MAE: 0.0714, Spearman rho: 0.4623, Spearman p: 5.3174e-33, Pearson r: 0.4685, Pearson p: 5.8296e-34
  Pred range: [0.0464, 0.3271], std: 0.0525
  RMSE : 0.0897, R2: 0.2044, MAE: 0.0717, Spearman rho: 0.4686, Spearman p: 5.6603e-34, Pearson r: 0.4757, Pearson p: 4.1954e-35
  Pred range: [0.0365, 0.3315], std: 0.0576
  RMSE : 0.0898, R2: 0.2035, MAE: 0.0715, Spearman rho: 0.4774, Spearman p: 2.2600e-35, Pearson r: 0.4839, Pearson p: 1.9899e-36
  Pred range: [0.0533, 0.3836], std: 0.0619
  RMSE : 0.0949, R2: 0.1102, MAE: 0.0767, Spearman rho: 0.4733, Spearman p: 1.0373e-34, Pearson r: 0.4812, Pearson p: 5.5215e-36
  Pred range: [0.0725, 0.4259], std: 0.0590
  RMSE : 0.1017, R2: -0.0212, MAE: 0.0834, Spearman rho: 0.4643, Spearman p: 2.6670e-33, Pearson r: 0.4703, Pearson p: 3.0391e-34
  Pred range: [0.0537, 0.3665], std: 0.0524
  RMSE : 0.0903, R2: 0.1936, MAE: 0.0723, Spearman rho: 0.4733, Spearman p: 1.0377e-34, Pearson r: 0.4799, Pearson p: 9.0462e-36
[I 2026-04-27 18:02:26,193] Trial 83 finished with value: 0.08972804767042133 and parameters: {'learning_rate': 0.0008916476785943738, 'batch_size': 4, 'num_epochs': 20, 'weight_decay': 0.005570499139739473, 'layers_PRS': 7, 'layers_SCZ15': 5, 'layers_ADHD9': 4, 'layers_ASD9': 1, 'layers_ACE15': 5, 'layers_ACE18': 4, 'layers_SUD18': 2, 'layers_SES': 7, 'layers_SEX': 4, 'dropout': 0.49890526412634684, 'se_reduction': 4, 'hidden_dim_min': 3, 'base_loss': 'huber', 'huber_delta': 0.05116928523824281, 'focal_gamma': 0.6574186648777218, 'n_bins': 8, 'scheduler_patience': 4, 'scheduler_factor': 0.6119508573182836, 'early_stopping_patience': 4}. Best is trial 66 with value: 0.08778944019020135.
Train: 2407 rows (1613 IDs),Test: 598 rows (404 IDs) 

n_features_x : 6, n_features_per_modality: [16, 23, 19, 17, 7, 4, 4, 4, 1, 4]

--- ImbalancedRegressionLoss initialized ---
  Bins: 10, Focal gamma: 0.8247299413212899, Base loss: huber
  Bin [0.00, 0.10): count= 1010, weight=0.003
  Bin [0.10, 0.20): count=  866, weight=0.003
  Bin [0.20, 0.30): count=  386, weight=0.007
  Bin [0.30, 0.40): count=  111, weight=0.026
  Bin [0.40, 0.50): count=   23, weight=0.119
  Bin [0.50, 0.60): count=    9, weight=0.287
  Bin [0.60, 0.70): count=    2, weight=0.955
  Bin [0.70, 0.80): count=    0, weight=2.866
  Bin [0.80, 0.90): count=    0, weight=2.866
  Bin [0.90, 1.00): count=    0, weight=2.866
-------------------------------------------

  Pred range: [0.0580, 0.3532], std: 0.0534
  RMSE : 0.0934, R2: 0.1374, MAE: 0.0751, Spearman rho: 0.4502, Spearman p: 3.5553e-31, Pearson r: 0.4581, Pearson p: 2.3578e-32
  Pred range: [0.0562, 0.4009], std: 0.0589
  RMSE : 0.0940, R2: 0.1271, MAE: 0.0755, Spearman rho: 0.4425, Spearman p: 4.6016e-30, Pearson r: 0.4536, Pearson p: 1.1140e-31
  Pred range: [0.0283, 0.3895], std: 0.0606
  RMSE : 0.0909, R2: 0.1834, MAE: 0.0723, Spearman rho: 0.4699, Spearman p: 3.5260e-34, Pearson r: 0.4767, Pearson p: 2.9198e-35
  Pred range: [0.0836, 0.3823], std: 0.0547
  RMSE : 0.1037, R2: -0.0617, MAE: 0.0853, Spearman rho: 0.4626, Spearman p: 4.7885e-33, Pearson r: 0.4695, Pearson p: 4.0899e-34
  Pred range: [0.0394, 0.4289], std: 0.0626
  RMSE : 0.0924, R2: 0.1558, MAE: 0.0732, Spearman rho: 0.4592, Spearman p: 1.5757e-32, Pearson r: 0.4658, Pearson p: 1.5254e-33
  Pred range: [0.0441, 0.3715], std: 0.0547
  RMSE : 0.0882, R2: 0.2316, MAE: 0.0702, Spearman rho: 0.4830, Spearman p: 2.8020e-36, Pearson r: 0.4879, Pearson p: 4.2914e-37
  Pred range: [0.0525, 0.3799], std: 0.0591
  RMSE : 0.0913, R2: 0.1755, MAE: 0.0732, Spearman rho: 0.4813, Spearman p: 5.2837e-36, Pearson r: 0.4887, Pearson p: 3.1580e-37
  Pred range: [0.0137, 0.3542], std: 0.0574
  RMSE : 0.0906, R2: 0.1887, MAE: 0.0704, Spearman rho: 0.4635, Spearman p: 3.5332e-33, Pearson r: 0.4729, Pearson p: 1.2002e-34
  Pred range: [0.0655, 0.3866], std: 0.0546
  RMSE : 0.0927, R2: 0.1502, MAE: 0.0749, Spearman rho: 0.4823, Spearman p: 3.6123e-36, Pearson r: 0.4863, Pearson p: 8.1133e-37
  Pred range: [0.0736, 0.4078], std: 0.0533
  RMSE : 0.0950, R2: 0.1077, MAE: 0.0773, Spearman rho: 0.4803, Spearman p: 7.6360e-36, Pearson r: 0.4804, Pearson p: 7.4217e-36
  Pred range: [0.0732, 0.4215], std: 0.0579
  RMSE : 0.0994, R2: 0.0228, MAE: 0.0812, Spearman rho: 0.4701, Spearman p: 3.3107e-34, Pearson r: 0.4748, Pearson p: 5.9427e-35
[I 2026-04-27 18:04:14,335] Trial 84 finished with value: 0.08817904620099201 and parameters: {'learning_rate': 0.0014535042378618305, 'batch_size': 4, 'num_epochs': 21, 'weight_decay': 0.0044137405895172815, 'layers_PRS': 5, 'layers_SCZ15': 1, 'layers_ADHD9': 5, 'layers_ASD9': 1, 'layers_ACE15': 3, 'layers_ACE18': 4, 'layers_SUD18': 6, 'layers_SES': 6, 'layers_SEX': 3, 'dropout': 0.2554252421882529, 'se_reduction': 5, 'hidden_dim_min': 7, 'base_loss': 'huber', 'huber_delta': 0.12142755061906282, 'focal_gamma': 0.8247299413212899, 'n_bins': 10, 'scheduler_patience': 4, 'scheduler_factor': 0.6687623243712799, 'early_stopping_patience': 5}. Best is trial 66 with value: 0.08778944019020135.
Train: 2407 rows (1613 IDs),Test: 598 rows (404 IDs) 

n_features_x : 6, n_features_per_modality: [16, 23, 19, 17, 7, 4, 4, 4, 1, 4]

--- ImbalancedRegressionLoss initialized ---
  Bins: 10, Focal gamma: 0.8302812286762504, Base loss: huber
  Bin [0.00, 0.10): count= 1010, weight=0.003
  Bin [0.10, 0.20): count=  866, weight=0.003
  Bin [0.20, 0.30): count=  386, weight=0.007
  Bin [0.30, 0.40): count=  111, weight=0.026
  Bin [0.40, 0.50): count=   23, weight=0.119
  Bin [0.50, 0.60): count=    9, weight=0.287
  Bin [0.60, 0.70): count=    2, weight=0.955
  Bin [0.70, 0.80): count=    0, weight=2.866
  Bin [0.80, 0.90): count=    0, weight=2.866
  Bin [0.90, 1.00): count=    0, weight=2.866
-------------------------------------------

  Pred range: [0.0207, 0.3136], std: 0.0454
  RMSE : 0.0916, R2: 0.1703, MAE: 0.0737, Spearman rho: 0.4048, Spearman p: 5.5299e-25, Pearson r: 0.4180, Pearson p: 1.0752e-26
  Pred range: [0.0739, 0.4594], std: 0.0624
  RMSE : 0.1059, R2: -0.1090, MAE: 0.0863, Spearman rho: 0.4348, Spearman p: 5.6886e-29, Pearson r: 0.4420, Pearson p: 5.4985e-30
  Pred range: [0.0461, 0.5160], std: 0.0705
  RMSE : 0.1071, R2: -0.1341, MAE: 0.0858, Spearman rho: 0.4102, Spearman p: 1.1466e-25, Pearson r: 0.4134, Pearson p: 4.3652e-26
  Pred range: [0.0284, 0.3269], std: 0.0504
  RMSE : 0.0897, R2: 0.2043, MAE: 0.0714, Spearman rho: 0.4438, Spearman p: 3.0017e-30, Pearson r: 0.4581, Pearson p: 2.3478e-32
  Pred range: [0.0489, 0.3912], std: 0.0621
  RMSE : 0.0933, R2: 0.1390, MAE: 0.0743, Spearman rho: 0.4567, Spearman p: 3.7490e-32, Pearson r: 0.4631, Pearson p: 4.1052e-33
  Pred range: [0.0075, 0.3451], std: 0.0623
  RMSE : 0.0924, R2: 0.1563, MAE: 0.0721, Spearman rho: 0.4405, Spearman p: 8.8215e-30, Pearson r: 0.4389, Pearson p: 1.4849e-29
  Pred range: [0.0860, 0.4385], std: 0.0590
  RMSE : 0.1100, R2: -0.1956, MAE: 0.0913, Spearman rho: 0.4667, Spearman p: 1.1100e-33, Pearson r: 0.4661, Pearson p: 1.3757e-33
  Pred range: [0.0305, 0.4114], std: 0.0680
  RMSE : 0.0959, R2: 0.0907, MAE: 0.0763, Spearman rho: 0.4273, Spearman p: 6.1584e-28, Pearson r: 0.4256, Pearson p: 1.0335e-27
  Pred range: [0.0237, 0.3951], std: 0.0621
  RMSE : 0.0905, R2: 0.1913, MAE: 0.0718, Spearman rho: 0.4823, Spearman p: 3.6521e-36, Pearson r: 0.4883, Pearson p: 3.7081e-37
