[I 2026-04-27 17:46:03,831] Trial 71 pruned. 
Train: 2407 rows (1613 IDs),Test: 598 rows (404 IDs) 

n_features_x : 6, n_features_per_modality: [16, 23, 19, 17, 7, 4, 4, 4, 1, 4]

--- ImbalancedRegressionLoss initialized ---
  Bins: 14, Focal gamma: 0.9305199971332339, Base loss: huber
  Bin [0.00, 0.07): count=  828, weight=0.003
  Bin [0.07, 0.14): count=  542, weight=0.005
  Bin [0.14, 0.21): count=  506, weight=0.005
  Bin [0.21, 0.29): count=  386, weight=0.007
  Bin [0.29, 0.36): count=   91, weight=0.029
  Bin [0.36, 0.43): count=   29, weight=0.090
  Bin [0.43, 0.50): count=   12, weight=0.207
  Bin [0.50, 0.57): count=   11, weight=0.224
  Bin [0.57, 0.64): count=    1, weight=1.343
  Bin [0.64, 0.71): count=    1, weight=1.343
  Bin [0.71, 0.79): count=    0, weight=2.686
  Bin [0.79, 0.86): count=    0, weight=2.686
  Bin [0.86, 0.93): count=    0, weight=2.686
  Bin [0.93, 1.00): count=    0, weight=2.686
-------------------------------------------

  Pred range: [0.0270, 0.3905], std: 0.0595
  RMSE : 0.0917, R2: 0.1697, MAE: 0.0717, Spearman rho: 0.4344, Spearman p: 6.4761e-29, Pearson r: 0.4398, Pearson p: 1.1099e-29
  Pred range: [0.0592, 0.4105], std: 0.0624
  RMSE : 0.0972, R2: 0.0663, MAE: 0.0785, Spearman rho: 0.4482, Spearman p: 6.9617e-31, Pearson r: 0.4556, Pearson p: 5.5746e-32
  Pred range: [0.0515, 0.3690], std: 0.0565
  RMSE : 0.0916, R2: 0.1707, MAE: 0.0735, Spearman rho: 0.4591, Spearman p: 1.6276e-32, Pearson r: 0.4686, Pearson p: 5.6566e-34
  Pred range: [0.0736, 0.4595], std: 0.0616
  RMSE : 0.1102, R2: -0.2000, MAE: 0.0913, Spearman rho: 0.4533, Spearman p: 1.2101e-31, Pearson r: 0.4642, Pearson p: 2.6902e-33
  Pred range: [0.0749, 0.4391], std: 0.0607
  RMSE : 0.1062, R2: -0.1135, MAE: 0.0875, Spearman rho: 0.4554, Spearman p: 5.8307e-32, Pearson r: 0.4665, Pearson p: 1.2101e-33
  Pred range: [0.0341, 0.3513], std: 0.0578
  RMSE : 0.0892, R2: 0.2140, MAE: 0.0705, Spearman rho: 0.4671, Spearman p: 9.5699e-34, Pearson r: 0.4758, Pearson p: 4.1840e-35
  Pred range: [0.0352, 0.3872], std: 0.0545
  RMSE : 0.0889, R2: 0.2187, MAE: 0.0701, Spearman rho: 0.4691, Spearman p: 4.8094e-34, Pearson r: 0.4732, Pearson p: 1.0703e-34
  Pred range: [0.0535, 0.4163], std: 0.0600
  RMSE : 0.0945, R2: 0.1171, MAE: 0.0760, Spearman rho: 0.4544, Spearman p: 8.3873e-32, Pearson r: 0.4603, Pearson p: 1.0853e-32
  Pred range: [0.0307, 0.3790], std: 0.0563
  RMSE : 0.0886, R2: 0.2243, MAE: 0.0695, Spearman rho: 0.4745, Spearman p: 6.5667e-35, Pearson r: 0.4808, Pearson p: 6.4244e-36
  Pred range: [0.0522, 0.4261], std: 0.0645
  RMSE : 0.0958, R2: 0.0932, MAE: 0.0770, Spearman rho: 0.4653, Spearman p: 1.8407e-33, Pearson r: 0.4764, Pearson p: 3.3589e-35
  Pred range: [0.0491, 0.4092], std: 0.0628
  RMSE : 0.0942, R2: 0.1233, MAE: 0.0755, Spearman rho: 0.4613, Spearman p: 7.5964e-33, Pearson r: 0.4712, Pearson p: 2.2066e-34
  Pred range: [0.0467, 0.3880], std: 0.0578
  RMSE : 0.0908, R2: 0.1858, MAE: 0.0727, Spearman rho: 0.4672, Spearman p: 9.2173e-34, Pearson r: 0.4727, Pearson p: 1.2847e-34
[I 2026-04-27 17:47:51,824] Trial 72 finished with value: 0.08859782740210319 and parameters: {'learning_rate': 0.0010440437406708763, 'batch_size': 6, 'num_epochs': 12, 'weight_decay': 0.0025551629769866593, 'layers_PRS': 7, 'layers_SCZ15': 4, 'layers_ADHD9': 7, 'layers_ASD9': 2, 'layers_ACE15': 5, 'layers_ACE18': 3, 'layers_SUD18': 5, 'layers_SES': 5, 'layers_SEX': 2, 'dropout': 0.4455411769987341, 'se_reduction': 2, 'hidden_dim_min': 8, 'base_loss': 'huber', 'huber_delta': 0.05128463336218561, 'focal_gamma': 0.9305199971332339, 'n_bins': 14, 'scheduler_patience': 2, 'scheduler_factor': 0.42533813615102456, 'early_stopping_patience': 5}. Best is trial 66 with value: 0.08778944019020135.
Train: 2407 rows (1613 IDs),Test: 598 rows (404 IDs) 

n_features_x : 6, n_features_per_modality: [16, 23, 19, 17, 7, 4, 4, 4, 1, 4]

--- ImbalancedRegressionLoss initialized ---
  Bins: 13, Focal gamma: 0.8072673992305056, Base loss: huber
  Bin [0.00, 0.08): count=  828, weight=0.003
  Bin [0.08, 0.15): count=  710, weight=0.004
  Bin [0.15, 0.23): count=  477, weight=0.006
  Bin [0.23, 0.31): count=  288, weight=0.009
  Bin [0.31, 0.38): count=   63, weight=0.042
  Bin [0.38, 0.46): count=   23, weight=0.113
  Bin [0.46, 0.54): count=   10, weight=0.247
  Bin [0.54, 0.62): count=    7, weight=0.340
  Bin [0.62, 0.69): count=    0, weight=2.719
  Bin [0.69, 0.77): count=    1, weight=1.359
  Bin [0.77, 0.85): count=    0, weight=2.719
  Bin [0.85, 0.92): count=    0, weight=2.719
  Bin [0.92, 1.00): count=    0, weight=2.719
-------------------------------------------

  Pred range: [0.0525, 0.3888], std: 0.0629
  RMSE : 0.0998, R2: 0.0165, MAE: 0.0797, Spearman rho: 0.4327, Spearman p: 1.1058e-28, Pearson r: 0.4221, Pearson p: 3.0632e-27
  Pred range: [0.0430, 0.3719], std: 0.0604
  RMSE : 0.0927, R2: 0.1502, MAE: 0.0737, Spearman rho: 0.4611, Spearman p: 8.1483e-33, Pearson r: 0.4548, Pearson p: 7.2827e-32
  Pred range: [0.0477, 0.3877], std: 0.0607
  RMSE : 0.0920, R2: 0.1639, MAE: 0.0733, Spearman rho: 0.4777, Spearman p: 2.0056e-35, Pearson r: 0.4760, Pearson p: 3.7861e-35
  Pred range: [0.0558, 0.3835], std: 0.0607
  RMSE : 0.0943, R2: 0.1213, MAE: 0.0759, Spearman rho: 0.4734, Spearman p: 1.0119e-34, Pearson r: 0.4758, Pearson p: 4.1435e-35
  Pred range: [0.0675, 0.4161], std: 0.0616
  RMSE : 0.0984, R2: 0.0424, MAE: 0.0800, Spearman rho: 0.4760, Spearman p: 3.7915e-35, Pearson r: 0.4809, Pearson p: 6.2556e-36
  Pred range: [0.0575, 0.3981], std: 0.0600
  RMSE : 0.0943, R2: 0.1211, MAE: 0.0762, Spearman rho: 0.4810, Spearman p: 6.0015e-36, Pearson r: 0.4870, Pearson p: 6.1733e-37
[I 2026-04-27 17:48:41,630] Trial 73 pruned. 
Train: 2407 rows (1613 IDs),Test: 598 rows (404 IDs) 

n_features_x : 6, n_features_per_modality: [16, 23, 19, 17, 7, 4, 4, 4, 1, 4]

--- ImbalancedRegressionLoss initialized ---
  Bins: 18, Focal gamma: 1.3175642882512584, Base loss: huber
  Bin [0.00, 0.06): count=  650, weight=0.004
  Bin [0.06, 0.11): count=  530, weight=0.005
  Bin [0.11, 0.17): count=  358, weight=0.007
  Bin [0.17, 0.22): count=  477, weight=0.005
  Bin [0.22, 0.28): count=  179, weight=0.014
  Bin [0.28, 0.33): count=  133, weight=0.019
  Bin [0.33, 0.39): count=   39, weight=0.064
  Bin [0.39, 0.44): count=   20, weight=0.122
  Bin [0.44, 0.50): count=   10, weight=0.233
  Bin [0.50, 0.56): count=    6, weight=0.366
  Bin [0.56, 0.61): count=    4, weight=0.512
  Bin [0.61, 0.67): count=    0, weight=2.561
  Bin [0.67, 0.72): count=    1, weight=1.281
  Bin [0.72, 0.78): count=    0, weight=2.561
  Bin [0.78, 0.83): count=    0, weight=2.561
  Bin [0.83, 0.89): count=    0, weight=2.561
  Bin [0.89, 0.94): count=    0, weight=2.561
  Bin [0.94, 1.00): count=    0, weight=2.561
-------------------------------------------

  Pred range: [0.0314, 0.3573], std: 0.0574
  RMSE : 0.0903, R2: 0.1940, MAE: 0.0712, Spearman rho: 0.4487, Spearman p: 5.8243e-31, Pearson r: 0.4591, Pearson p: 1.6684e-32
  Pred range: [0.0607, 0.3703], std: 0.0556
  RMSE : 0.0958, R2: 0.0928, MAE: 0.0776, Spearman rho: 0.4535, Spearman p: 1.1301e-31, Pearson r: 0.4624, Pearson p: 5.1192e-33
  Pred range: [0.0329, 0.3736], std: 0.0579
  RMSE : 0.0903, R2: 0.1933, MAE: 0.0718, Spearman rho: 0.4567, Spearman p: 3.7882e-32, Pearson r: 0.4664, Pearson p: 1.2523e-33
  Pred range: [0.0389, 0.4020], std: 0.0553
  RMSE : 0.0950, R2: 0.1090, MAE: 0.0772, Spearman rho: 0.4699, Spearman p: 3.5741e-34, Pearson r: 0.4799, Pearson p: 8.8485e-36
  Pred range: [0.0100, 0.3700], std: 0.0553
  RMSE : 0.0895, R2: 0.2091, MAE: 0.0714, Spearman rho: 0.4710, Spearman p: 2.3837e-34, Pearson r: 0.4818, Pearson p: 4.4407e-36
  Pred range: [0.0248, 0.3865], std: 0.0577
  RMSE : 0.0926, R2: 0.1533, MAE: 0.0746, Spearman rho: 0.4729, Spearman p: 1.1728e-34, Pearson r: 0.4818, Pearson p: 4.3430e-36
  Pred range: [0.0160, 0.3770], std: 0.0596
  RMSE : 0.0908, R2: 0.1858, MAE: 0.0724, Spearman rho: 0.4702, Spearman p: 3.1447e-34, Pearson r: 0.4782, Pearson p: 1.6805e-35
  Pred range: [0.0265, 0.4217], std: 0.0599
  RMSE : 0.0956, R2: 0.0970, MAE: 0.0775, Spearman rho: 0.4720, Spearman p: 1.6434e-34, Pearson r: 0.4810, Pearson p: 6.0616e-36
  Pred range: [0.0226, 0.4058], std: 0.0602
  RMSE : 0.0931, R2: 0.1430, MAE: 0.0750, Spearman rho: 0.4732, Spearman p: 1.0795e-34, Pearson r: 0.4822, Pearson p: 3.7616e-36
  Pred range: [0.0108, 0.3860], std: 0.0586
  RMSE : 0.0905, R2: 0.1903, MAE: 0.0724, Spearman rho: 0.4746, Spearman p: 6.4349e-35, Pearson r: 0.4830, Pearson p: 2.8259e-36
[I 2026-04-27 17:50:08,843] Trial 74 finished with value: 0.08946345532000373 and parameters: {'learning_rate': 0.0008466602753678703, 'batch_size': 6, 'num_epochs': 18, 'weight_decay': 7.496766825608781e-05, 'layers_PRS': 7, 'layers_SCZ15': 5, 'layers_ADHD9': 6, 'layers_ASD9': 2, 'layers_ACE15': 2, 'layers_ACE18': 4, 'layers_SUD18': 6, 'layers_SES': 7, 'layers_SEX': 1, 'dropout': 0.3965367389883162, 'se_reduction': 3, 'hidden_dim_min': 10, 'base_loss': 'huber', 'huber_delta': 0.010570588639611772, 'focal_gamma': 1.3175642882512584, 'n_bins': 18, 'scheduler_patience': 2, 'scheduler_factor': 0.3969732850216092, 'early_stopping_patience': 5}. Best is trial 66 with value: 0.08778944019020135.
Train: 2407 rows (1613 IDs),Test: 598 rows (404 IDs) 

n_features_x : 6, n_features_per_modality: [16, 23, 19, 17, 7, 4, 4, 4, 1, 4]

--- ImbalancedRegressionLoss initialized ---
  Bins: 15, Focal gamma: 2.99418231985467, Base loss: huber
  Bin [0.00, 0.07): count=  828, weight=0.003
  Bin [0.07, 0.13): count=  542, weight=0.005
  Bin [0.13, 0.20): count=  506, weight=0.006
  Bin [0.20, 0.27): count=  318, weight=0.009
  Bin [0.27, 0.33): count=  133, weight=0.021
  Bin [0.33, 0.40): count=   46, weight=0.060
  Bin [0.40, 0.47): count=   16, weight=0.166
  Bin [0.47, 0.53): count=   10, weight=0.256
  Bin [0.53, 0.60): count=    6, weight=0.402
  Bin [0.60, 0.67): count=    1, weight=1.407
  Bin [0.67, 0.73): count=    1, weight=1.407
  Bin [0.73, 0.80): count=    0, weight=2.815
  Bin [0.80, 0.87): count=    0, weight=2.815
  Bin [0.87, 0.93): count=    0, weight=2.815
  Bin [0.93, 1.00): count=    0, weight=2.815
-------------------------------------------

  Pred range: [0.0684, 0.3418], std: 0.0461
  RMSE : 0.0982, R2: 0.0475, MAE: 0.0798, Spearman rho: 0.3779, Spearman p: 9.7911e-22, Pearson r: 0.3988, Pearson p: 3.1150e-24
  Pred range: [0.0693, 0.3379], std: 0.0466
  RMSE : 0.0952, R2: 0.1043, MAE: 0.0772, Spearman rho: 0.4132, Spearman p: 4.6066e-26, Pearson r: 0.4315, Pearson p: 1.6076e-28
  Pred range: [0.0614, 0.3364], std: 0.0477
  RMSE : 0.0924, R2: 0.1559, MAE: 0.0745, Spearman rho: 0.4363, Spearman p: 3.4576e-29, Pearson r: 0.4532, Pearson p: 1.2448e-31
  Pred range: [0.0585, 0.3430], std: 0.0486
  RMSE : 0.0913, R2: 0.1764, MAE: 0.0734, Spearman rho: 0.4417, Spearman p: 5.9476e-30, Pearson r: 0.4574, Pearson p: 2.9951e-32
  Pred range: [0.0607, 0.3482], std: 0.0502
  RMSE : 0.0915, R2: 0.1730, MAE: 0.0736, Spearman rho: 0.4464, Spearman p: 1.2474e-30, Pearson r: 0.4590, Pearson p: 1.6972e-32
  Pred range: [0.0593, 0.3346], std: 0.0482
  RMSE : 0.0905, R2: 0.1909, MAE: 0.0728, Spearman rho: 0.4482, Spearman p: 6.9381e-31, Pearson r: 0.4611, Pearson p: 8.0502e-33
  Pred range: [0.0654, 0.3525], std: 0.0499
  RMSE : 0.0924, R2: 0.1563, MAE: 0.0748, Spearman rho: 0.4539, Spearman p: 9.9610e-32, Pearson r: 0.4661, Pearson p: 1.4071e-33
  Pred range: [0.0668, 0.3494], std: 0.0503
  RMSE : 0.0925, R2: 0.1541, MAE: 0.0750, Spearman rho: 0.4560, Spearman p: 4.7784e-32, Pearson r: 0.4689, Pearson p: 5.0303e-34
  Pred range: [0.0603, 0.3390], std: 0.0485
  RMSE : 0.0900, R2: 0.1996, MAE: 0.0724, Spearman rho: 0.4586, Spearman p: 1.9682e-32, Pearson r: 0.4706, Pearson p: 2.7935e-34
  Pred range: [0.0554, 0.3382], std: 0.0479
  RMSE : 0.0891, R2: 0.2158, MAE: 0.0711, Spearman rho: 0.4622, Spearman p: 5.6097e-33, Pearson r: 0.4730, Pearson p: 1.1636e-34
  Pred range: [0.0596, 0.3502], std: 0.0500
  RMSE : 0.0906, R2: 0.1893, MAE: 0.0729, Spearman rho: 0.4564, Spearman p: 4.1929e-32, Pearson r: 0.4665, Pearson p: 1.2185e-33
  Pred range: [0.0669, 0.3607], std: 0.0491
  RMSE : 0.0919, R2: 0.1657, MAE: 0.0743, Spearman rho: 0.4550, Spearman p: 6.8256e-32, Pearson r: 0.4637, Pearson p: 3.2723e-33
  Pred range: [0.0670, 0.3571], std: 0.0508
  RMSE : 0.0924, R2: 0.1565, MAE: 0.0747, Spearman rho: 0.4579, Spearman p: 2.4733e-32, Pearson r: 0.4674, Pearson p: 8.7568e-34
  Pred range: [0.0774, 0.3823], std: 0.0525
  RMSE : 0.0970, R2: 0.0711, MAE: 0.0790, Spearman rho: 0.4529, Spearman p: 1.3940e-31, Pearson r: 0.4631, Pearson p: 4.0084e-33
[I 2026-04-27 17:52:11,822] Trial 75 finished with value: 0.08908321511975507 and parameters: {'learning_rate': 0.0002971564359724532, 'batch_size': 6, 'num_epochs': 14, 'weight_decay': 0.002917500315558363, 'layers_PRS': 3, 'layers_SCZ15': 4, 'layers_ADHD9': 7, 'layers_ASD9': 3, 'layers_ACE15': 5, 'layers_ACE18': 7, 'layers_SUD18': 6, 'layers_SES': 2, 'layers_SEX': 2, 'dropout': 0.43837348386765157, 'se_reduction': 3, 'hidden_dim_min': 8, 'base_loss': 'huber', 'huber_delta': 0.034192668555545244, 'focal_gamma': 2.99418231985467, 'n_bins': 15, 'scheduler_patience': 2, 'scheduler_factor': 0.6206522546349583, 'early_stopping_patience': 5}. Best is trial 66 with value: 0.08778944019020135.
Train: 2407 rows (1613 IDs),Test: 598 rows (404 IDs) 

n_features_x : 6, n_features_per_modality: [16, 23, 19, 17, 7, 4, 4, 4, 1, 4]

--- ImbalancedRegressionLoss initialized ---
  Bins: 5, Focal gamma: 1.0088701534237297, Base loss: mse
  Bin [0.00, 0.20): count= 1876, weight=0.002
  Bin [0.20, 0.40): count=  497, weight=0.007
  Bin [0.40, 0.60): count=   32, weight=0.111
  Bin [0.60, 0.80): count=    2, weight=1.220
  Bin [0.80, 1.00): count=    0, weight=3.660
-------------------------------------------

  Pred range: [0.0661, 0.4519], std: 0.0626
  RMSE : 0.1044, R2: -0.0775, MAE: 0.0858, Spearman rho: 0.4365, Spearman p: 3.2616e-29, Pearson r: 0.4427, Pearson p: 4.3064e-30
  Pred range: [0.0232, 0.3215], std: 0.0480
  RMSE : 0.0897, R2: 0.2055, MAE: 0.0708, Spearman rho: 0.4496, Spearman p: 4.3469e-31, Pearson r: 0.4539, Pearson p: 9.8149e-32
  Pred range: [0.0557, 0.3932], std: 0.0552
  RMSE : 0.0953, R2: 0.1025, MAE: 0.0776, Spearman rho: 0.4500, Spearman p: 3.6954e-31, Pearson r: 0.4567, Pearson p: 3.7442e-32
  Pred range: [0.0454, 0.4347], std: 0.0597
  RMSE : 0.0947, R2: 0.1131, MAE: 0.0766, Spearman rho: 0.4565, Spearman p: 4.0935e-32, Pearson r: 0.4635, Pearson p: 3.4441e-33
  Pred range: [0.0759, 0.4570], std: 0.0603
  RMSE : 0.1185, R2: -0.3866, MAE: 0.0993, Spearman rho: 0.4288, Spearman p: 3.8325e-28, Pearson r: 0.4409, Pearson p: 7.7527e-30
  Pred range: [0.0241, 0.3875], std: 0.0546
  RMSE : 0.0964, R2: 0.0812, MAE: 0.0789, Spearman rho: 0.4334, Spearman p: 8.9792e-29, Pearson r: 0.4438, Pearson p: 2.9970e-30
  Pred range: [0.0360, 0.4403], std: 0.0581
  RMSE : 0.1052, R2: -0.0944, MAE: 0.0870, Spearman rho: 0.4330, Spearman p: 1.0177e-28, Pearson r: 0.4438, Pearson p: 3.0365e-30
  Pred range: [0.0419, 0.4461], std: 0.0589
  RMSE : 0.1064, R2: -0.1192, MAE: 0.0880, Spearman rho: 0.4310, Spearman p: 1.9079e-28, Pearson r: 0.4410, Pearson p: 7.4188e-30
[I 2026-04-27 17:52:34,235] Trial 76 finished with value: 0.0896644669374334 and parameters: {'learning_rate': 0.0012851878912025039, 'batch_size': 16, 'num_epochs': 10, 'weight_decay': 0.0009068140398841999, 'layers_PRS': 6, 'layers_SCZ15': 5, 'layers_ADHD9': 1, 'layers_ASD9': 2, 'layers_ACE15': 3, 'layers_ACE18': 3, 'layers_SUD18': 5, 'layers_SES': 6, 'layers_SEX': 3, 'dropout': 0.4590309841949834, 'se_reduction': 4, 'hidden_dim_min': 11, 'base_loss': 'mse', 'huber_delta': 0.017385809277450766, 'focal_gamma': 1.0088701534237297, 'n_bins': 5, 'scheduler_patience': 2, 'scheduler_factor': 0.565285941374798, 'early_stopping_patience': 6}. Best is trial 66 with value: 0.08778944019020135.
Train: 2407 rows (1613 IDs),Test: 598 rows (404 IDs) 

n_features_x : 6, n_features_per_modality: [16, 23, 19, 17, 7, 4, 4, 4, 1, 4]

--- ImbalancedRegressionLoss initialized ---
  Bins: 16, Focal gamma: 0.7069227401692453, Base loss: huber
  Bin [0.00, 0.06): count=  650, weight=0.004
  Bin [0.06, 0.12): count=  530, weight=0.005
  Bin [0.12, 0.19): count=  536, weight=0.005
  Bin [0.19, 0.25): count=  397, weight=0.007
  Bin [0.25, 0.31): count=  190, weight=0.014
  Bin [0.31, 0.38): count=   63, weight=0.042
  Bin [0.38, 0.44): count=   20, weight=0.127
  Bin [0.44, 0.50): count=   10, weight=0.242
  Bin [0.50, 0.56): count=    6, weight=0.380
  Bin [0.56, 0.62): count=    4, weight=0.532
  Bin [0.62, 0.69): count=    0, weight=2.662
  Bin [0.69, 0.75): count=    1, weight=1.331
  Bin [0.75, 0.81): count=    0, weight=2.662
  Bin [0.81, 0.88): count=    0, weight=2.662
  Bin [0.88, 0.94): count=    0, weight=2.662
  Bin [0.94, 1.00): count=    0, weight=2.662
-------------------------------------------

  Pred range: [0.0466, 0.3337], std: 0.0427
  RMSE : 0.1022, R2: -0.0312, MAE: 0.0827, Spearman rho: 0.2851, Spearman p: 1.2056e-12, Pearson r: 0.2978, Pearson p: 1.0316e-13
  Pred range: [0.0451, 0.3754], std: 0.0520
  RMSE : 0.0998, R2: 0.0154, MAE: 0.0801, Spearman rho: 0.3689, Spearman p: 1.0178e-20, Pearson r: 0.3726, Pearson p: 3.9741e-21
  Pred range: [0.0327, 0.3641], std: 0.0543
  RMSE : 0.0951, R2: 0.1068, MAE: 0.0754, Spearman rho: 0.4046, Spearman p: 5.8274e-25, Pearson r: 0.4052, Pearson p: 4.9418e-25
  Pred range: [0.0277, 0.3601], std: 0.0555
  RMSE : 0.0937, R2: 0.1315, MAE: 0.0742, Spearman rho: 0.4207, Spearman p: 4.7799e-27, Pearson r: 0.4215, Pearson p: 3.6934e-27
  Pred range: [0.0249, 0.3571], std: 0.0566
  RMSE : 0.0929, R2: 0.1473, MAE: 0.0735, Spearman rho: 0.4338, Spearman p: 7.7714e-29, Pearson r: 0.4340, Pearson p: 7.4309e-29
  Pred range: [0.0275, 0.3647], std: 0.0578
  RMSE : 0.0937, R2: 0.1331, MAE: 0.0745, Spearman rho: 0.4417, Spearman p: 6.0866e-30, Pearson r: 0.4430, Pearson p: 3.8868e-30
[I 2026-04-27 17:53:25,943] Trial 77 pruned. 
Train: 2407 rows (1613 IDs),Test: 598 rows (404 IDs) 

n_features_x : 6, n_features_per_modality: [16, 23, 19, 17, 7, 4, 4, 4, 1, 4]

--- ImbalancedRegressionLoss initialized ---
  Bins: 12, Focal gamma: 0.8901467533946152, Base loss: huber
  Bin [0.00, 0.08): count=  828, weight=0.003
  Bin [0.08, 0.17): count=  710, weight=0.004
  Bin [0.17, 0.25): count=  575, weight=0.005
  Bin [0.25, 0.33): count=  214, weight=0.013
  Bin [0.33, 0.42): count=   55, weight=0.051
  Bin [0.42, 0.50): count=   14, weight=0.191
  Bin [0.50, 0.58): count=    9, weight=0.286
  Bin [0.58, 0.67): count=    1, weight=1.431
  Bin [0.67, 0.75): count=    1, weight=1.431
  Bin [0.75, 0.83): count=    0, weight=2.862
  Bin [0.83, 0.92): count=    0, weight=2.862
  Bin [0.92, 1.00): count=    0, weight=2.862
-------------------------------------------

  Pred range: [0.0499, 0.3854], std: 0.0542
  RMSE : 0.0940, R2: 0.1273, MAE: 0.0739, Spearman rho: 0.4069, Spearman p: 2.9762e-25, Pearson r: 0.3975, Pearson p: 4.4515e-24
  Pred range: [0.0498, 0.3835], std: 0.0590
  RMSE : 0.0936, R2: 0.1335, MAE: 0.0741, Spearman rho: 0.4476, Spearman p: 8.4410e-31, Pearson r: 0.4417, Pearson p: 5.9564e-30
  Pred range: [0.0533, 0.3772], std: 0.0569
  RMSE : 0.0929, R2: 0.1472, MAE: 0.0741, Spearman rho: 0.4601, Spearman p: 1.1729e-32, Pearson r: 0.4582, Pearson p: 2.2458e-32
  Pred range: [0.0568, 0.4097], std: 0.0606
  RMSE : 0.0963, R2: 0.0844, MAE: 0.0774, Spearman rho: 0.4606, Spearman p: 9.8057e-33, Pearson r: 0.4637, Pearson p: 3.2434e-33
  Pred range: [0.0321, 0.3461], std: 0.0536
  RMSE : 0.0886, R2: 0.2236, MAE: 0.0699, Spearman rho: 0.4748, Spearman p: 5.8994e-35, Pearson r: 0.4765, Pearson p: 3.1245e-35
  Pred range: [0.0408, 0.3699], std: 0.0574
  RMSE : 0.0899, R2: 0.2013, MAE: 0.0713, Spearman rho: 0.4725, Spearman p: 1.3697e-34, Pearson r: 0.4768, Pearson p: 2.8821e-35
  Pred range: [0.0469, 0.3649], std: 0.0562
  RMSE : 0.0905, R2: 0.1906, MAE: 0.0723, Spearman rho: 0.4727, Spearman p: 1.2947e-34, Pearson r: 0.4782, Pearson p: 1.7161e-35
  Pred range: [0.0536, 0.3972], std: 0.0616
  RMSE : 0.0953, R2: 0.1018, MAE: 0.0770, Spearman rho: 0.4745, Spearman p: 6.7164e-35, Pearson r: 0.4810, Pearson p: 6.0351e-36
  Pred range: [0.0474, 0.3903], std: 0.0597
  RMSE : 0.0921, R2: 0.1614, MAE: 0.0738, Spearman rho: 0.4774, Spearman p: 2.2681e-35, Pearson r: 0.4820, Pearson p: 4.0800e-36
