[I 2026-04-27 23:59:37,166] Trial 30 pruned. 
Train: 2407 rows (1613 IDs),Test: 598 rows (404 IDs) 

n_features_x : 6, n_features_per_modality: [16, 23, 19, 17, 7, 4, 4, 4, 1, 4]

--- ImbalancedRegressionLoss initialized ---
  Bins: 8, Focal gamma: 1.5750929204334796, Base loss: huber
  Bin [0.00, 0.12): count= 1180, weight=0.003
  Bin [0.12, 0.25): count=  933, weight=0.003
  Bin [0.25, 0.38): count=  253, weight=0.012
  Bin [0.38, 0.50): count=   30, weight=0.098
  Bin [0.50, 0.62): count=   10, weight=0.277
  Bin [0.62, 0.75): count=    1, weight=1.521
  Bin [0.75, 0.88): count=    0, weight=3.043
  Bin [0.88, 1.00): count=    0, weight=3.043
-------------------------------------------

  Pred range: [0.0495, 0.4139], std: 0.0581
  RMSE : 0.0945, R2: 0.1173, MAE: 0.0759, Spearman rho: 0.4483, Spearman p: 6.6756e-31, Pearson r: 0.4555, Pearson p: 5.8087e-32
  Pred range: [0.0463, 0.3391], std: 0.0505
  RMSE : 0.0907, R2: 0.1878, MAE: 0.0722, Spearman rho: 0.4411, Spearman p: 7.2345e-30, Pearson r: 0.4469, Pearson p: 1.0667e-30
  Pred range: [0.0871, 0.4697], std: 0.0590
  RMSE : 0.1126, R2: -0.2521, MAE: 0.0930, Spearman rho: 0.4374, Spearman p: 2.4567e-29, Pearson r: 0.4412, Pearson p: 7.1369e-30
  Pred range: [0.0567, 0.3971], std: 0.0539
  RMSE : 0.0917, R2: 0.1686, MAE: 0.0730, Spearman rho: 0.4444, Spearman p: 2.4754e-30, Pearson r: 0.4526, Pearson p: 1.5468e-31
  Pred range: [0.0723, 0.4644], std: 0.0555
  RMSE : 0.0972, R2: 0.0669, MAE: 0.0786, Spearman rho: 0.4311, Spearman p: 1.8618e-28, Pearson r: 0.4387, Pearson p: 1.5783e-29
  Pred range: [0.0579, 0.3577], std: 0.0500
  RMSE : 0.0896, R2: 0.2068, MAE: 0.0716, Spearman rho: 0.4663, Spearman p: 1.2752e-33, Pearson r: 0.4756, Pearson p: 4.4221e-35
  Pred range: [0.0455, 0.4148], std: 0.0571
  RMSE : 0.0913, R2: 0.1756, MAE: 0.0725, Spearman rho: 0.4540, Spearman p: 9.7572e-32, Pearson r: 0.4575, Pearson p: 2.8572e-32
  Pred range: [0.0860, 0.4566], std: 0.0601
  RMSE : 0.1082, R2: -0.1572, MAE: 0.0893, Spearman rho: 0.4594, Spearman p: 1.4978e-32, Pearson r: 0.4651, Pearson p: 1.9664e-33
  Pred range: [0.0576, 0.3362], std: 0.0495
  RMSE : 0.0902, R2: 0.1962, MAE: 0.0725, Spearman rho: 0.4724, Spearman p: 1.4212e-34, Pearson r: 0.4786, Pearson p: 1.4790e-35
  Pred range: [0.0562, 0.3488], std: 0.0511
  RMSE : 0.0896, R2: 0.2067, MAE: 0.0717, Spearman rho: 0.4778, Spearman p: 1.9874e-35, Pearson r: 0.4831, Pearson p: 2.6789e-36
  Pred range: [0.0601, 0.3593], std: 0.0498
  RMSE : 0.0906, R2: 0.1881, MAE: 0.0727, Spearman rho: 0.4645, Spearman p: 2.4926e-33, Pearson r: 0.4707, Pearson p: 2.6564e-34
  Pred range: [0.0522, 0.3371], std: 0.0512
  RMSE : 0.0894, R2: 0.2103, MAE: 0.0712, Spearman rho: 0.4684, Spearman p: 5.9979e-34, Pearson r: 0.4751, Pearson p: 5.2429e-35
  Pred range: [0.0493, 0.3406], std: 0.0497
  RMSE : 0.0889, R2: 0.2191, MAE: 0.0704, Spearman rho: 0.4660, Spearman p: 1.4529e-33, Pearson r: 0.4725, Pearson p: 1.4020e-34
  Pred range: [0.0557, 0.3145], std: 0.0482
  RMSE : 0.0891, R2: 0.2159, MAE: 0.0710, Spearman rho: 0.4686, Spearman p: 5.6563e-34, Pearson r: 0.4767, Pearson p: 2.9720e-35
  Pred range: [0.0537, 0.3484], std: 0.0522
  RMSE : 0.0899, R2: 0.2013, MAE: 0.0715, Spearman rho: 0.4684, Spearman p: 6.1366e-34, Pearson r: 0.4732, Pearson p: 1.0773e-34
  Pred range: [0.0552, 0.3733], std: 0.0522
  RMSE : 0.0908, R2: 0.1845, MAE: 0.0725, Spearman rho: 0.4604, Spearman p: 1.0377e-32, Pearson r: 0.4636, Pearson p: 3.3703e-33
  Pred range: [0.0533, 0.3383], std: 0.0485
  RMSE : 0.0889, R2: 0.2185, MAE: 0.0706, Spearman rho: 0.4698, Spearman p: 3.7214e-34, Pearson r: 0.4750, Pearson p: 5.5931e-35
  Pred range: [0.0498, 0.3456], std: 0.0509
  RMSE : 0.0890, R2: 0.2170, MAE: 0.0706, Spearman rho: 0.4714, Spearman p: 2.0782e-34, Pearson r: 0.4761, Pearson p: 3.6872e-35
  Pred range: [0.0525, 0.3560], std: 0.0515
  RMSE : 0.0897, R2: 0.2043, MAE: 0.0714, Spearman rho: 0.4679, Spearman p: 7.2755e-34, Pearson r: 0.4731, Pearson p: 1.0938e-34
  Pred range: [0.0532, 0.3554], std: 0.0513
  RMSE : 0.0897, R2: 0.2046, MAE: 0.0715, Spearman rho: 0.4688, Spearman p: 5.3418e-34, Pearson r: 0.4743, Pearson p: 7.0695e-35
  Pred range: [0.0391, 0.3120], std: 0.0476
  RMSE : 0.0885, R2: 0.2264, MAE: 0.0695, Spearman rho: 0.4746, Spearman p: 6.3829e-35, Pearson r: 0.4805, Pearson p: 7.2719e-36
  Pred range: [0.0579, 0.3522], std: 0.0498
  RMSE : 0.0899, R2: 0.2007, MAE: 0.0719, Spearman rho: 0.4684, Spearman p: 6.1393e-34, Pearson r: 0.4748, Pearson p: 5.9359e-35
  Pred range: [0.0561, 0.3592], std: 0.0513
  RMSE : 0.0901, R2: 0.1985, MAE: 0.0719, Spearman rho: 0.4689, Spearman p: 5.1474e-34, Pearson r: 0.4747, Pearson p: 6.2409e-35
  Pred range: [0.0587, 0.3570], std: 0.0511
  RMSE : 0.0904, R2: 0.1926, MAE: 0.0723, Spearman rho: 0.4687, Spearman p: 5.3957e-34, Pearson r: 0.4740, Pearson p: 7.9251e-35
  Pred range: [0.0561, 0.3522], std: 0.0507
  RMSE : 0.0897, R2: 0.2046, MAE: 0.0715, Spearman rho: 0.4700, Spearman p: 3.3744e-34, Pearson r: 0.4749, Pearson p: 5.7370e-35
  Pred range: [0.0568, 0.3524], std: 0.0507
  RMSE : 0.0898, R2: 0.2039, MAE: 0.0716, Spearman rho: 0.4706, Spearman p: 2.7302e-34, Pearson r: 0.4756, Pearson p: 4.3784e-35
  Pred range: [0.0550, 0.3524], std: 0.0508
  RMSE : 0.0895, R2: 0.2088, MAE: 0.0712, Spearman rho: 0.4704, Spearman p: 2.9847e-34, Pearson r: 0.4754, Pearson p: 4.7032e-35
[I 2026-04-28 00:03:04,342] Trial 31 finished with value: 0.08847852224743749 and parameters: {'learning_rate': 0.0013786919053568993, 'batch_size': 4, 'num_epochs': 27, 'weight_decay': 0.005065497125204005, 'depth_complex': 4, 'depth_moderate': 3, 'depth_simple': 1, 'dropout': 0.38674331661965444, 'se_reduction': 5, 'hidden_dim_min': 3, 'base_loss': 'huber', 'huber_delta': 0.026457876396902218, 'focal_gamma': 1.5750929204334796, 'n_bins': 8, 'scheduler_patience': 2, 'scheduler_factor': 0.557318495283272, 'early_stopping_patience': 8}. Best is trial 22 with value: 0.08764163086185245.
Train: 2407 rows (1613 IDs),Test: 598 rows (404 IDs) 

n_features_x : 6, n_features_per_modality: [16, 23, 19, 17, 7, 4, 4, 4, 1, 4]

--- ImbalancedRegressionLoss initialized ---
  Bins: 7, Focal gamma: 1.7979279083045054, Base loss: huber
  Bin [0.00, 0.14): count= 1370, weight=0.002
  Bin [0.14, 0.29): count=  892, weight=0.003
  Bin [0.29, 0.43): count=  120, weight=0.024
  Bin [0.43, 0.57): count=   23, weight=0.122
  Bin [0.57, 0.71): count=    2, weight=0.978
  Bin [0.71, 0.86): count=    0, weight=2.935
  Bin [0.86, 1.00): count=    0, weight=2.935
-------------------------------------------

  Pred range: [0.0511, 0.3853], std: 0.0533
  RMSE : 0.0916, R2: 0.1705, MAE: 0.0729, Spearman rho: 0.4628, Spearman p: 4.4067e-33, Pearson r: 0.4634, Pearson p: 3.5812e-33
  Pred range: [0.0276, 0.3778], std: 0.0534
  RMSE : 0.0909, R2: 0.1828, MAE: 0.0718, Spearman rho: 0.4359, Spearman p: 3.9409e-29, Pearson r: 0.4407, Pearson p: 8.2611e-30
  Pred range: [0.0449, 0.3204], std: 0.0524
  RMSE : 0.0898, R2: 0.2033, MAE: 0.0707, Spearman rho: 0.4521, Spearman p: 1.8594e-31, Pearson r: 0.4564, Pearson p: 4.1745e-32
  Pred range: [0.0686, 0.3873], std: 0.0547
  RMSE : 0.0956, R2: 0.0968, MAE: 0.0776, Spearman rho: 0.4598, Spearman p: 1.2902e-32, Pearson r: 0.4627, Pearson p: 4.6977e-33
  Pred range: [-0.0108, 0.3451], std: 0.0569
  RMSE : 0.0942, R2: 0.1238, MAE: 0.0725, Spearman rho: 0.4510, Spearman p: 2.6584e-31, Pearson r: 0.4551, Pearson p: 6.5320e-32
  Pred range: [0.0652, 0.4949], std: 0.0753
  RMSE : 0.1111, R2: -0.2198, MAE: 0.0908, Spearman rho: 0.4658, Spearman p: 1.5335e-33, Pearson r: 0.4682, Pearson p: 6.6568e-34
  Pred range: [0.0483, 0.3378], std: 0.0472
  RMSE : 0.0900, R2: 0.2002, MAE: 0.0718, Spearman rho: 0.4466, Spearman p: 1.1882e-30, Pearson r: 0.4567, Pearson p: 3.7260e-32
  Pred range: [0.0486, 0.3592], std: 0.0512
  RMSE : 0.0901, R2: 0.1977, MAE: 0.0713, Spearman rho: 0.4376, Spearman p: 2.2857e-29, Pearson r: 0.4491, Pearson p: 5.0473e-31
  Pred range: [0.0137, 0.3784], std: 0.0620
  RMSE : 0.0901, R2: 0.1982, MAE: 0.0695, Spearman rho: 0.4727, Spearman p: 1.2797e-34, Pearson r: 0.4747, Pearson p: 6.1092e-35
  Pred range: [0.0836, 0.4193], std: 0.0557
  RMSE : 0.1008, R2: -0.0035, MAE: 0.0825, Spearman rho: 0.4638, Spearman p: 3.1723e-33, Pearson r: 0.4706, Pearson p: 2.7893e-34
  Pred range: [0.0448, 0.3986], std: 0.0581
  RMSE : 0.0903, R2: 0.1947, MAE: 0.0717, Spearman rho: 0.4668, Spearman p: 1.0910e-33, Pearson r: 0.4732, Pearson p: 1.0509e-34
[I 2026-04-28 00:04:28,520] Trial 32 finished with value: 0.08978877769968724 and parameters: {'learning_rate': 0.0033028715819536964, 'batch_size': 4, 'num_epochs': 22, 'weight_decay': 0.0035430754444583912, 'depth_complex': 4, 'depth_moderate': 3, 'depth_simple': 1, 'dropout': 0.3102680248404077, 'se_reduction': 5, 'hidden_dim_min': 3, 'base_loss': 'huber', 'huber_delta': 0.029115460719940506, 'focal_gamma': 1.7979279083045054, 'n_bins': 7, 'scheduler_patience': 2, 'scheduler_factor': 0.5666408905428697, 'early_stopping_patience': 8}. Best is trial 22 with value: 0.08764163086185245.
Train: 2407 rows (1613 IDs),Test: 598 rows (404 IDs) 

n_features_x : 6, n_features_per_modality: [16, 23, 19, 17, 7, 4, 4, 4, 1, 4]

--- ImbalancedRegressionLoss initialized ---
  Bins: 10, Focal gamma: 1.6877827600042379, Base loss: huber
  Bin [0.00, 0.10): count= 1010, weight=0.003
  Bin [0.10, 0.20): count=  866, weight=0.003
  Bin [0.20, 0.30): count=  386, weight=0.007
  Bin [0.30, 0.40): count=  111, weight=0.026
  Bin [0.40, 0.50): count=   23, weight=0.119
  Bin [0.50, 0.60): count=    9, weight=0.287
  Bin [0.60, 0.70): count=    2, weight=0.955
  Bin [0.70, 0.80): count=    0, weight=2.866
  Bin [0.80, 0.90): count=    0, weight=2.866
  Bin [0.90, 1.00): count=    0, weight=2.866
-------------------------------------------

  Pred range: [0.0714, 0.3911], std: 0.0532
  RMSE : 0.1075, R2: -0.1418, MAE: 0.0884, Spearman rho: 0.4180, Spearman p: 1.0751e-26, Pearson r: 0.4231, Pearson p: 2.2888e-27
  Pred range: [0.0706, 0.4031], std: 0.0496
  RMSE : 0.0977, R2: 0.0558, MAE: 0.0789, Spearman rho: 0.4035, Spearman p: 8.0407e-25, Pearson r: 0.3965, Pearson p: 5.9822e-24
  Pred range: [0.0847, 0.4421], std: 0.0606
  RMSE : 0.1121, R2: -0.2428, MAE: 0.0927, Spearman rho: 0.4229, Spearman p: 2.3842e-27, Pearson r: 0.4291, Pearson p: 3.4590e-28
  Pred range: [0.0493, 0.3336], std: 0.0418
  RMSE : 0.0905, R2: 0.1898, MAE: 0.0715, Spearman rho: 0.4381, Spearman p: 1.9708e-29, Pearson r: 0.4362, Pearson p: 3.5499e-29
  Pred range: [0.0440, 0.2832], std: 0.0434
  RMSE : 0.0897, R2: 0.2047, MAE: 0.0702, Spearman rho: 0.4598, Spearman p: 1.2670e-32, Pearson r: 0.4624, Pearson p: 5.1282e-33
  Pred range: [0.0845, 0.4329], std: 0.0538
  RMSE : 0.1012, R2: -0.0122, MAE: 0.0826, Spearman rho: 0.4381, Spearman p: 1.9377e-29, Pearson r: 0.4419, Pearson p: 5.5323e-30
  Pred range: [0.0729, 0.3564], std: 0.0432
  RMSE : 0.0951, R2: 0.1064, MAE: 0.0766, Spearman rho: 0.4363, Spearman p: 3.5085e-29, Pearson r: 0.4395, Pearson p: 1.2525e-29
  Pred range: [0.0865, 0.4274], std: 0.0554
  RMSE : 0.1059, R2: -0.1076, MAE: 0.0869, Spearman rho: 0.4416, Spearman p: 6.2181e-30, Pearson r: 0.4484, Pearson p: 6.4857e-31
  Pred range: [0.0745, 0.4037], std: 0.0551
  RMSE : 0.1022, R2: -0.0312, MAE: 0.0837, Spearman rho: 0.4379, Spearman p: 2.0833e-29, Pearson r: 0.4473, Pearson p: 9.4034e-31
  Pred range: [0.0726, 0.4069], std: 0.0555
  RMSE : 0.0993, R2: 0.0261, MAE: 0.0807, Spearman rho: 0.4436, Spearman p: 3.2070e-30, Pearson r: 0.4491, Pearson p: 5.1353e-31
  Pred range: [0.0696, 0.3771], std: 0.0501
  RMSE : 0.0933, R2: 0.1393, MAE: 0.0751, Spearman rho: 0.4373, Spearman p: 2.5128e-29, Pearson r: 0.4458, Pearson p: 1.5524e-30
  Pred range: [0.0726, 0.3624], std: 0.0492
  RMSE : 0.0979, R2: 0.0530, MAE: 0.0799, Spearman rho: 0.4394, Spearman p: 1.2662e-29, Pearson r: 0.4474, Pearson p: 8.8651e-31
[I 2026-04-28 00:05:25,003] Trial 33 finished with value: 0.08970993380311901 and parameters: {'learning_rate': 0.0020202765597777234, 'batch_size': 6, 'num_epochs': 27, 'weight_decay': 0.005665070592778988, 'depth_complex': 3, 'depth_moderate': 3, 'depth_simple': 1, 'dropout': 0.4050300781140405, 'se_reduction': 7, 'hidden_dim_min': 5, 'base_loss': 'huber', 'huber_delta': 0.010916328139684142, 'focal_gamma': 1.6877827600042379, 'n_bins': 10, 'scheduler_patience': 2, 'scheduler_factor': 0.5225893943077475, 'early_stopping_patience': 7}. Best is trial 22 with value: 0.08764163086185245.
Train: 2407 rows (1613 IDs),Test: 598 rows (404 IDs) 

n_features_x : 6, n_features_per_modality: [16, 23, 19, 17, 7, 4, 4, 4, 1, 4]

--- ImbalancedRegressionLoss initialized ---
  Bins: 8, Focal gamma: 1.4235351787078112, Base loss: mse
  Bin [0.00, 0.12): count= 1180, weight=0.003
  Bin [0.12, 0.25): count=  933, weight=0.003
  Bin [0.25, 0.38): count=  253, weight=0.012
  Bin [0.38, 0.50): count=   30, weight=0.098
  Bin [0.50, 0.62): count=   10, weight=0.277
  Bin [0.62, 0.75): count=    1, weight=1.521
  Bin [0.75, 0.88): count=    0, weight=3.043
  Bin [0.88, 1.00): count=    0, weight=3.043
-------------------------------------------

  Pred range: [0.0265, 0.3419], std: 0.0502
  RMSE : 0.0907, R2: 0.1873, MAE: 0.0710, Spearman rho: 0.4401, Spearman p: 1.0209e-29, Pearson r: 0.4562, Pearson p: 4.5371e-32
  Pred range: [0.0234, 0.3862], std: 0.0548
  RMSE : 0.0955, R2: 0.0980, MAE: 0.0776, Spearman rho: 0.4485, Spearman p: 6.1792e-31, Pearson r: 0.4569, Pearson p: 3.4788e-32
  Pred range: [0.0249, 0.4183], std: 0.0584
  RMSE : 0.0940, R2: 0.1277, MAE: 0.0754, Spearman rho: 0.4397, Spearman p: 1.1660e-29, Pearson r: 0.4463, Pearson p: 1.2957e-30
  Pred range: [0.0636, 0.3986], std: 0.0495
  RMSE : 0.0957, R2: 0.0942, MAE: 0.0777, Spearman rho: 0.4423, Spearman p: 4.9123e-30, Pearson r: 0.4478, Pearson p: 7.9406e-31
  Pred range: [0.0282, 0.3576], std: 0.0459
  RMSE : 0.0894, R2: 0.2104, MAE: 0.0716, Spearman rho: 0.4532, Spearman p: 1.2701e-31, Pearson r: 0.4616, Pearson p: 6.7631e-33
  Pred range: [0.0377, 0.4262], std: 0.0554
  RMSE : 0.0975, R2: 0.0601, MAE: 0.0794, Spearman rho: 0.4597, Spearman p: 1.3366e-32, Pearson r: 0.4656, Pearson p: 1.6463e-33
  Pred range: [0.0131, 0.3695], std: 0.0489
  RMSE : 0.0894, R2: 0.2096, MAE: 0.0712, Spearman rho: 0.4548, Spearman p: 7.2372e-32, Pearson r: 0.4597, Pearson p: 1.3267e-32
  Pred range: [0.0368, 0.4493], std: 0.0546
  RMSE : 0.0980, R2: 0.0500, MAE: 0.0799, Spearman rho: 0.4457, Spearman p: 1.6025e-30, Pearson r: 0.4558, Pearson p: 5.1724e-32
  Pred range: [0.0233, 0.4050], std: 0.0538
  RMSE : 0.0931, R2: 0.1427, MAE: 0.0753, Spearman rho: 0.4527, Spearman p: 1.5156e-31, Pearson r: 0.4611, Pearson p: 8.0671e-33
  Pred range: [0.0260, 0.3988], std: 0.0517
  RMSE : 0.0918, R2: 0.1667, MAE: 0.0740, Spearman rho: 0.4499, Spearman p: 3.9175e-31, Pearson r: 0.4597, Pearson p: 1.3258e-32
  Pred range: [0.0118, 0.3756], std: 0.0529
  RMSE : 0.0895, R2: 0.2079, MAE: 0.0713, Spearman rho: 0.4557, Spearman p: 5.3860e-32, Pearson r: 0.4648, Pearson p: 2.2301e-33
  Pred range: [0.0300, 0.3936], std: 0.0539
  RMSE : 0.0910, R2: 0.1820, MAE: 0.0729, Spearman rho: 0.4565, Spearman p: 4.0653e-32, Pearson r: 0.4656, Pearson p: 1.6664e-33
  Pred range: [0.0265, 0.3977], std: 0.0553
  RMSE : 0.0911, R2: 0.1791, MAE: 0.0729, Spearman rho: 0.4568, Spearman p: 3.6081e-32, Pearson r: 0.4657, Pearson p: 1.5805e-33
[I 2026-04-28 00:07:27,184] Trial 34 finished with value: 0.08939022680599645 and parameters: {'learning_rate': 0.0013212261200894046, 'batch_size': 4, 'num_epochs': 29, 'weight_decay': 0.0002777923595711988, 'depth_complex': 7, 'depth_moderate': 2, 'depth_simple': 1, 'dropout': 0.4370254927436198, 'se_reduction': 5, 'hidden_dim_min': 2, 'base_loss': 'mse', 'huber_delta': 0.02351656995031126, 'focal_gamma': 1.4235351787078112, 'n_bins': 8, 'scheduler_patience': 2, 'scheduler_factor': 0.5847211867995658, 'early_stopping_patience': 8}. Best is trial 22 with value: 0.08764163086185245.
Train: 2407 rows (1613 IDs),Test: 598 rows (404 IDs) 

n_features_x : 6, n_features_per_modality: [16, 23, 19, 17, 7, 4, 4, 4, 1, 4]

--- ImbalancedRegressionLoss initialized ---
  Bins: 6, Focal gamma: 2.0602610560717816, Base loss: huber
  Bin [0.00, 0.17): count= 1538, weight=0.002
  Bin [0.17, 0.33): count=  789, weight=0.005
  Bin [0.33, 0.50): count=   69, weight=0.053
  Bin [0.50, 0.67): count=   10, weight=0.339
  Bin [0.67, 0.83): count=    1, weight=1.867
  Bin [0.83, 1.00): count=    0, weight=3.733
-------------------------------------------

  Pred range: [0.0188, 0.3282], std: 0.0488
  RMSE : 0.0941, R2: 0.1257, MAE: 0.0749, Spearman rho: 0.3737, Spearman p: 2.9250e-21, Pearson r: 0.3866, Pearson p: 9.3781e-23
  Pred range: [0.0318, 0.4390], std: 0.0616
  RMSE : 0.0976, R2: 0.0583, MAE: 0.0785, Spearman rho: 0.4178, Spearman p: 1.1539e-26, Pearson r: 0.4283, Pearson p: 4.5519e-28
  Pred range: [0.0357, 0.4285], std: 0.0618
  RMSE : 0.0965, R2: 0.0796, MAE: 0.0778, Spearman rho: 0.4392, Spearman p: 1.3375e-29, Pearson r: 0.4524, Pearson p: 1.6780e-31
  Pred range: [0.0394, 0.3611], std: 0.0523
  RMSE : 0.0918, R2: 0.1679, MAE: 0.0740, Spearman rho: 0.4551, Spearman p: 6.4799e-32, Pearson r: 0.4639, Pearson p: 3.0406e-33
  Pred range: [0.0415, 0.3985], std: 0.0561
  RMSE : 0.0917, R2: 0.1694, MAE: 0.0732, Spearman rho: 0.4490, Spearman p: 5.2592e-31, Pearson r: 0.4592, Pearson p: 1.5880e-32
  Pred range: [0.0395, 0.3667], std: 0.0531
  RMSE : 0.0898, R2: 0.2029, MAE: 0.0715, Spearman rho: 0.4508, Spearman p: 2.8120e-31, Pearson r: 0.4631, Pearson p: 3.9914e-33
  Pred range: [0.0509, 0.4029], std: 0.0571
  RMSE : 0.0912, R2: 0.1784, MAE: 0.0726, Spearman rho: 0.4503, Spearman p: 3.4144e-31, Pearson r: 0.4603, Pearson p: 1.0963e-32
  Pred range: [0.0680, 0.4129], std: 0.0582
  RMSE : 0.0988, R2: 0.0353, MAE: 0.0805, Spearman rho: 0.4560, Spearman p: 4.8289e-32, Pearson r: 0.4670, Pearson p: 1.0155e-33
  Pred range: [-0.0009, 0.3604], std: 0.0523
  RMSE : 0.0891, R2: 0.2161, MAE: 0.0708, Spearman rho: 0.4585, Spearman p: 2.0261e-32, Pearson r: 0.4696, Pearson p: 3.9740e-34
  Pred range: [0.0550, 0.4217], std: 0.0601
  RMSE : 0.0956, R2: 0.0971, MAE: 0.0769, Spearman rho: 0.4537, Spearman p: 1.0464e-31, Pearson r: 0.4636, Pearson p: 3.4276e-33
  Pred range: [0.0320, 0.3844], std: 0.0529
  RMSE : 0.0909, R2: 0.1834, MAE: 0.0729, Spearman rho: 0.4601, Spearman p: 1.1676e-32, Pearson r: 0.4711, Pearson p: 2.2636e-34
  Pred range: [0.0115, 0.3584], std: 0.0538
  RMSE : 0.0892, R2: 0.2138, MAE: 0.0699, Spearman rho: 0.4627, Spearman p: 4.6626e-33, Pearson r: 0.4726, Pearson p: 1.3486e-34
  Pred range: [0.0269, 0.4145], std: 0.0610
  RMSE : 0.0930, R2: 0.1460, MAE: 0.0745, Spearman rho: 0.4635, Spearman p: 3.5333e-33, Pearson r: 0.4735, Pearson p: 9.7246e-35
  Pred range: [0.0153, 0.3814], std: 0.0551
  RMSE : 0.0898, R2: 0.2033, MAE: 0.0716, Spearman rho: 0.4627, Spearman p: 4.6253e-33, Pearson r: 0.4734, Pearson p: 9.8316e-35
  Pred range: [0.0195, 0.3823], std: 0.0533
  RMSE : 0.0902, R2: 0.1965, MAE: 0.0721, Spearman rho: 0.4608, Spearman p: 9.0137e-33, Pearson r: 0.4713, Pearson p: 2.1664e-34
  Pred range: [0.0349, 0.3964], std: 0.0554
  RMSE : 0.0919, R2: 0.1658, MAE: 0.0739, Spearman rho: 0.4587, Spearman p: 1.9018e-32, Pearson r: 0.4698, Pearson p: 3.6245e-34
[I 2026-04-28 00:08:42,560] Trial 35 finished with value: 0.08906864554969446 and parameters: {'learning_rate': 0.0005106048505994233, 'batch_size': 6, 'num_epochs': 25, 'weight_decay': 9.338094727980264e-05, 'depth_complex': 3, 'depth_moderate': 3, 'depth_simple': 1, 'dropout': 0.2774031570799171, 'se_reduction': 6, 'hidden_dim_min': 3, 'base_loss': 'huber', 'huber_delta': 0.055375427893641894, 'focal_gamma': 2.0602610560717816, 'n_bins': 6, 'scheduler_patience': 3, 'scheduler_factor': 0.5281119423954221, 'early_stopping_patience': 7}. Best is trial 22 with value: 0.08764163086185245.
Train: 2407 rows (1613 IDs),Test: 598 rows (404 IDs) 

n_features_x : 6, n_features_per_modality: [16, 23, 19, 17, 7, 4, 4, 4, 1, 4]

--- ImbalancedRegressionLoss initialized ---
  Bins: 9, Focal gamma: 1.8629810717803803, Base loss: mse
  Bin [0.00, 0.11): count= 1180, weight=0.003
  Bin [0.11, 0.22): count=  835, weight=0.004
  Bin [0.22, 0.33): count=  312, weight=0.010
  Bin [0.33, 0.44): count=   59, weight=0.054
  Bin [0.44, 0.56): count=   16, weight=0.190
  Bin [0.56, 0.67): count=    4, weight=0.647
  Bin [0.67, 0.78): count=    1, weight=1.618
  Bin [0.78, 0.89): count=    0, weight=3.237
  Bin [0.89, 1.00): count=    0, weight=3.237
-------------------------------------------

  Pred range: [-0.1015, 0.1469], std: 0.0374
  RMSE : 0.1654, R2: -1.7043, MAE: 0.1285, Spearman rho: -0.1672, Spearman p: 3.9517e-05, Pearson r: -0.1720, Pearson p: 2.3540e-05
  Pred range: [-0.0867, 0.1672], std: 0.0370
  RMSE : 0.1545, R2: -1.3586, MAE: 0.1186, Spearman rho: -0.1506, Spearman p: 2.1851e-04, Pearson r: -0.1524, Pearson p: 1.8361e-04
  Pred range: [-0.0728, 0.1867], std: 0.0368
  RMSE : 0.1446, R2: -1.0660, MAE: 0.1103, Spearman rho: -0.1323, Spearman p: 1.1837e-03, Pearson r: -0.1313, Pearson p: 1.2882e-03
  Pred range: [-0.0590, 0.2060], std: 0.0367
  RMSE : 0.1356, R2: -0.8182, MAE: 0.1035, Spearman rho: -0.1147, Spearman p: 4.9981e-03, Pearson r: -0.1109, Pearson p: 6.6420e-03
  Pred range: [-0.0456, 0.2248], std: 0.0369
  RMSE : 0.1278, R2: -0.6150, MAE: 0.0980, Spearman rho: -0.0974, Spearman p: 1.7206e-02, Pearson r: -0.0906, Pearson p: 2.6797e-02
  Pred range: [-0.0325, 0.2431], std: 0.0372
  RMSE : 0.1212, R2: -0.4527, MAE: 0.0935, Spearman rho: -0.0782, Spearman p: 5.5894e-02, Pearson r: -0.0696, Pearson p: 8.8964e-02
