[I 2026-04-27 23:13:59,758] Trial 0 finished with value: 0.08985099037684136 and parameters: {'learning_rate': 0.00043319274411937256, 'batch_size': 8, 'num_epochs': 28, 'weight_decay': 0.003509945797622322, 'depth_complex': 7, 'depth_moderate': 5, 'depth_simple': 1, 'dropout': 0.4106701197770125, 'se_reduction': 8, 'hidden_dim_min': 9, 'base_loss': 'mse', 'huber_delta': 0.09874244827414681, 'focal_gamma': 2.5466641293736214, 'n_bins': 14, 'scheduler_patience': 4, 'scheduler_factor': 0.5530391917792882, 'early_stopping_patience': 7}. Best is trial 0 with value: 0.08985099037684136.
Train: 2407 rows (1613 IDs),Test: 598 rows (404 IDs) 

n_features_x : 6, n_features_per_modality: [16, 23, 19, 17, 7, 4, 4, 4, 1, 4]

--- ImbalancedRegressionLoss initialized ---
  Bins: 15, Focal gamma: 1.7710431120460253, Base loss: mse
  Bin [0.00, 0.07): count=  828, weight=0.003
  Bin [0.07, 0.13): count=  542, weight=0.005
  Bin [0.13, 0.20): count=  506, weight=0.006
  Bin [0.20, 0.27): count=  318, weight=0.009
  Bin [0.27, 0.33): count=  133, weight=0.021
  Bin [0.33, 0.40): count=   46, weight=0.060
  Bin [0.40, 0.47): count=   16, weight=0.166
  Bin [0.47, 0.53): count=   10, weight=0.256
  Bin [0.53, 0.60): count=    6, weight=0.402
  Bin [0.60, 0.67): count=    1, weight=1.407
  Bin [0.67, 0.73): count=    1, weight=1.407
  Bin [0.73, 0.80): count=    0, weight=2.815
  Bin [0.80, 0.87): count=    0, weight=2.815
  Bin [0.87, 0.93): count=    0, weight=2.815
  Bin [0.93, 1.00): count=    0, weight=2.815
-------------------------------------------

  Pred range: [0.0456, 0.3490], std: 0.0412
  RMSE : 0.1127, R2: -0.2562, MAE: 0.0914, Spearman rho: 0.0878, Spearman p: 3.1805e-02, Pearson r: 0.0611, Pearson p: 1.3553e-01
  Pred range: [0.0592, 0.3415], std: 0.0403
  RMSE : 0.1090, R2: -0.1733, MAE: 0.0881, Spearman rho: 0.1650, Spearman p: 5.0261e-05, Pearson r: 0.1445, Pearson p: 3.9466e-04
  Pred range: [0.0615, 0.3389], std: 0.0408
  RMSE : 0.1061, R2: -0.1122, MAE: 0.0856, Spearman rho: 0.2305, Spearman p: 1.1926e-08, Pearson r: 0.2110, Pearson p: 1.9003e-07
  Pred range: [0.0593, 0.3508], std: 0.0412
  RMSE : 0.1024, R2: -0.0353, MAE: 0.0822, Spearman rho: 0.2763, Spearman p: 6.1457e-12, Pearson r: 0.2590, Pearson p: 1.2771e-10
  Pred range: [0.0610, 0.3591], std: 0.0418
  RMSE : 0.1007, R2: -0.0018, MAE: 0.0808, Spearman rho: 0.3059, Spearman p: 2.0313e-14, Pearson r: 0.2915, Pearson p: 3.5744e-13
  Pred range: [0.0624, 0.3716], std: 0.0429
  RMSE : 0.0996, R2: 0.0203, MAE: 0.0799, Spearman rho: 0.3313, Spearman p: 8.7074e-17, Pearson r: 0.3193, Pearson p: 1.2347e-15
  Pred range: [0.0658, 0.3884], std: 0.0439
  RMSE : 0.1002, R2: 0.0070, MAE: 0.0807, Spearman rho: 0.3474, Spearman p: 2.0934e-18, Pearson r: 0.3377, Pearson p: 2.0358e-17
  Pred range: [0.0658, 0.3974], std: 0.0450
  RMSE : 0.1001, R2: 0.0105, MAE: 0.0806, Spearman rho: 0.3613, Spearman p: 7.0874e-20, Pearson r: 0.3530, Pearson p: 5.5089e-19
  Pred range: [0.0638, 0.3964], std: 0.0451
  RMSE : 0.0989, R2: 0.0340, MAE: 0.0796, Spearman rho: 0.3719, Spearman p: 4.7106e-21, Pearson r: 0.3646, Pearson p: 3.0538e-20
  Pred range: [0.0676, 0.4065], std: 0.0460
  RMSE : 0.1000, R2: 0.0118, MAE: 0.0808, Spearman rho: 0.3812, Spearman p: 4.0162e-22, Pearson r: 0.3741, Pearson p: 2.6643e-21
  Pred range: [0.0624, 0.3938], std: 0.0453
  RMSE : 0.0975, R2: 0.0602, MAE: 0.0785, Spearman rho: 0.3870, Spearman p: 8.4556e-23, Pearson r: 0.3812, Pearson p: 3.9997e-22
  Pred range: [0.0638, 0.3961], std: 0.0460
  RMSE : 0.0981, R2: 0.0497, MAE: 0.0791, Spearman rho: 0.3933, Spearman p: 1.4632e-23, Pearson r: 0.3893, Pearson p: 4.5214e-23
  Pred range: [0.0595, 0.3824], std: 0.0453
  RMSE : 0.0959, R2: 0.0911, MAE: 0.0770, Spearman rho: 0.4004, Spearman p: 1.9692e-24, Pearson r: 0.3972, Pearson p: 4.8544e-24
[I 2026-04-27 23:15:44,696] Trial 1 finished with value: 0.09590346426132662 and parameters: {'learning_rate': 3.6657961963820536e-05, 'batch_size': 6, 'num_epochs': 13, 'weight_decay': 0.00010497566327233807, 'depth_complex': 7, 'depth_moderate': 3, 'depth_simple': 3, 'dropout': 0.41635111769960365, 'se_reduction': 7, 'hidden_dim_min': 12, 'base_loss': 'mse', 'huber_delta': 0.123545149037139, 'focal_gamma': 1.7710431120460253, 'n_bins': 15, 'scheduler_patience': 4, 'scheduler_factor': 0.5204153730101284, 'early_stopping_patience': 8}. Best is trial 0 with value: 0.08985099037684136.
Train: 2407 rows (1613 IDs),Test: 598 rows (404 IDs) 

n_features_x : 6, n_features_per_modality: [16, 23, 19, 17, 7, 4, 4, 4, 1, 4]

--- ImbalancedRegressionLoss initialized ---
  Bins: 16, Focal gamma: 2.01259899739126, Base loss: mse
  Bin [0.00, 0.06): count=  650, weight=0.004
  Bin [0.06, 0.12): count=  530, weight=0.005
  Bin [0.12, 0.19): count=  536, weight=0.005
  Bin [0.19, 0.25): count=  397, weight=0.007
  Bin [0.25, 0.31): count=  190, weight=0.014
  Bin [0.31, 0.38): count=   63, weight=0.042
  Bin [0.38, 0.44): count=   20, weight=0.127
  Bin [0.44, 0.50): count=   10, weight=0.242
  Bin [0.50, 0.56): count=    6, weight=0.380
  Bin [0.56, 0.62): count=    4, weight=0.532
  Bin [0.62, 0.69): count=    0, weight=2.662
  Bin [0.69, 0.75): count=    1, weight=1.331
  Bin [0.75, 0.81): count=    0, weight=2.662
  Bin [0.81, 0.88): count=    0, weight=2.662
  Bin [0.88, 0.94): count=    0, weight=2.662
  Bin [0.94, 1.00): count=    0, weight=2.662
-------------------------------------------

  Pred range: [0.0539, 0.4008], std: 0.0570
  RMSE : 0.1106, R2: -0.2086, MAE: 0.0905, Spearman rho: 0.3148, Spearman p: 3.1696e-15, Pearson r: 0.3155, Pearson p: 2.7604e-15
  Pred range: [0.0568, 0.3962], std: 0.0582
  RMSE : 0.1129, R2: -0.2592, MAE: 0.0928, Spearman rho: 0.3417, Spearman p: 8.0089e-18, Pearson r: 0.3467, Pearson p: 2.4775e-18
  Pred range: [0.0477, 0.3783], std: 0.0575
  RMSE : 0.1060, R2: -0.1103, MAE: 0.0868, Spearman rho: 0.3571, Spearman p: 1.9785e-19, Pearson r: 0.3673, Pearson p: 1.5504e-20
  Pred range: [0.0470, 0.3777], std: 0.0581
  RMSE : 0.1045, R2: -0.0784, MAE: 0.0854, Spearman rho: 0.3708, Spearman p: 6.2125e-21, Pearson r: 0.3824, Pearson p: 2.9114e-22
  Pred range: [0.0555, 0.4038], std: 0.0604
  RMSE : 0.1094, R2: -0.1823, MAE: 0.0899, Spearman rho: 0.3784, Spearman p: 8.6061e-22, Pearson r: 0.3912, Pearson p: 2.6047e-23
  Pred range: [0.0611, 0.4122], std: 0.0611
  RMSE : 0.1116, R2: -0.2305, MAE: 0.0919, Spearman rho: 0.3823, Spearman p: 3.0423e-22, Pearson r: 0.3962, Pearson p: 6.4663e-24
  Pred range: [0.0566, 0.3957], std: 0.0583
  RMSE : 0.1051, R2: -0.0926, MAE: 0.0862, Spearman rho: 0.3872, Spearman p: 8.0415e-23, Pearson r: 0.4013, Pearson p: 1.5069e-24
  Pred range: [0.0630, 0.4127], std: 0.0602
  RMSE : 0.1091, R2: -0.1768, MAE: 0.0899, Spearman rho: 0.3930, Spearman p: 1.6196e-23, Pearson r: 0.4070, Pearson p: 2.8738e-25
[I 2026-04-27 23:15:57,709] Trial 2 finished with value: 0.10446287795807889 and parameters: {'learning_rate': 0.00014219260135674332, 'batch_size': 16, 'num_epochs': 28, 'weight_decay': 0.0002874989675602719, 'depth_complex': 3, 'depth_moderate': 2, 'depth_simple': 1, 'dropout': 0.2503884037878428, 'se_reduction': 8, 'hidden_dim_min': 9, 'base_loss': 'mse', 'huber_delta': 0.1942100399733726, 'focal_gamma': 2.01259899739126, 'n_bins': 16, 'scheduler_patience': 4, 'scheduler_factor': 0.40885390113949727, 'early_stopping_patience': 4}. Best is trial 0 with value: 0.08985099037684136.
Train: 2407 rows (1613 IDs),Test: 598 rows (404 IDs) 

n_features_x : 6, n_features_per_modality: [16, 23, 19, 17, 7, 4, 4, 4, 1, 4]

--- ImbalancedRegressionLoss initialized ---
  Bins: 10, Focal gamma: 2.8099301377625263, Base loss: mse
  Bin [0.00, 0.10): count= 1010, weight=0.003
  Bin [0.10, 0.20): count=  866, weight=0.003
  Bin [0.20, 0.30): count=  386, weight=0.007
  Bin [0.30, 0.40): count=  111, weight=0.026
  Bin [0.40, 0.50): count=   23, weight=0.119
  Bin [0.50, 0.60): count=    9, weight=0.287
  Bin [0.60, 0.70): count=    2, weight=0.955
  Bin [0.70, 0.80): count=    0, weight=2.866
  Bin [0.80, 0.90): count=    0, weight=2.866
  Bin [0.90, 1.00): count=    0, weight=2.866
-------------------------------------------

  Pred range: [-0.0242, 0.2797], std: 0.0442
  RMSE : 0.1220, R2: -0.4717, MAE: 0.0994, Spearman rho: -0.2334, Spearman p: 7.6150e-09, Pearson r: -0.2387, Pearson p: 3.3914e-09
  Pred range: [0.0041, 0.2881], std: 0.0413
  RMSE : 0.1210, R2: -0.4458, MAE: 0.0989, Spearman rho: -0.2010, Spearman p: 7.2346e-07, Pearson r: -0.2016, Pearson p: 6.6720e-07
  Pred range: [0.0290, 0.2921], std: 0.0388
  RMSE : 0.1194, R2: -0.4089, MAE: 0.0978, Spearman rho: -0.1623, Spearman p: 6.6992e-05, Pearson r: -0.1597, Pearson p: 8.7847e-05
  Pred range: [0.0420, 0.2932], std: 0.0367
  RMSE : 0.1172, R2: -0.3567, MAE: 0.0960, Spearman rho: -0.1204, Spearman p: 3.1952e-03, Pearson r: -0.1142, Pearson p: 5.1823e-03
  Pred range: [0.0494, 0.2948], std: 0.0351
  RMSE : 0.1148, R2: -0.3033, MAE: 0.0940, Spearman rho: -0.0745, Spearman p: 6.8696e-02, Pearson r: -0.0677, Pearson p: 9.7965e-02
  Pred range: [0.0553, 0.2952], std: 0.0340
  RMSE : 0.1124, R2: -0.2488, MAE: 0.0919, Spearman rho: -0.0259, Spearman p: 5.2766e-01, Pearson r: -0.0191, Pearson p: 6.4152e-01
  Pred range: [0.0631, 0.2990], std: 0.0335
  RMSE : 0.1110, R2: -0.2166, MAE: 0.0908, Spearman rho: 0.0246, Spearman p: 5.4798e-01, Pearson r: 0.0319, Pearson p: 4.3566e-01
  Pred range: [0.0686, 0.2990], std: 0.0333
  RMSE : 0.1090, R2: -0.1730, MAE: 0.0890, Spearman rho: 0.0725, Spearman p: 7.6469e-02, Pearson r: 0.0782, Pearson p: 5.5899e-02
  Pred range: [0.0735, 0.2985], std: 0.0334
  RMSE : 0.1072, R2: -0.1346, MAE: 0.0874, Spearman rho: 0.1122, Spearman p: 6.0041e-03, Pearson r: 0.1201, Pearson p: 3.2683e-03
  Pred range: [0.0751, 0.2986], std: 0.0339
  RMSE : 0.1056, R2: -0.1024, MAE: 0.0861, Spearman rho: 0.1498, Spearman p: 2.3614e-04, Pearson r: 0.1598, Pearson p: 8.7143e-05
  Pred range: [0.0762, 0.3008], std: 0.0345
  RMSE : 0.1047, R2: -0.0834, MAE: 0.0853, Spearman rho: 0.1800, Spearman p: 9.4485e-06, Pearson r: 0.1934, Pearson p: 1.8952e-06
  Pred range: [0.0760, 0.2996], std: 0.0351
  RMSE : 0.1033, R2: -0.0541, MAE: 0.0840, Spearman rho: 0.2062, Spearman p: 3.6677e-07, Pearson r: 0.2212, Pearson p: 4.5976e-08
  Pred range: [0.0770, 0.3113], std: 0.0360
  RMSE : 0.1026, R2: -0.0401, MAE: 0.0834, Spearman rho: 0.2290, Spearman p: 1.4729e-08, Pearson r: 0.2458, Pearson p: 1.1092e-09
  Pred range: [0.0764, 0.3162], std: 0.0365
  RMSE : 0.1012, R2: -0.0118, MAE: 0.0820, Spearman rho: 0.2483, Spearman p: 7.4182e-10, Pearson r: 0.2656, Pearson p: 4.1115e-11
  Pred range: [0.0791, 0.3318], std: 0.0378
  RMSE : 0.1017, R2: -0.0213, MAE: 0.0826, Spearman rho: 0.2667, Spearman p: 3.3941e-11, Pearson r: 0.2841, Pearson p: 1.4479e-12
  Pred range: [0.0789, 0.3369], std: 0.0383
  RMSE : 0.1005, R2: 0.0014, MAE: 0.0815, Spearman rho: 0.2799, Spearman p: 3.1859e-12, Pearson r: 0.2987, Pearson p: 8.6191e-14
  Pred range: [0.0790, 0.3420], std: 0.0389
  RMSE : 0.0997, R2: 0.0178, MAE: 0.0807, Spearman rho: 0.2938, Spearman p: 2.2778e-13, Pearson r: 0.3115, Pearson p: 6.3472e-15
  Pred range: [0.0789, 0.3466], std: 0.0393
  RMSE : 0.0989, R2: 0.0337, MAE: 0.0799, Spearman rho: 0.3070, Spearman p: 1.6290e-14, Pearson r: 0.3228, Pearson p: 5.7666e-16
  Pred range: [0.0792, 0.3521], std: 0.0398
  RMSE : 0.0988, R2: 0.0361, MAE: 0.0798, Spearman rho: 0.3194, Spearman p: 1.2003e-15, Pearson r: 0.3330, Pearson p: 5.9506e-17
  Pred range: [0.0796, 0.3588], std: 0.0404
  RMSE : 0.0986, R2: 0.0391, MAE: 0.0798, Spearman rho: 0.3292, Spearman p: 1.3895e-16, Pearson r: 0.3418, Pearson p: 7.9337e-18
  Pred range: [0.0798, 0.3626], std: 0.0406
  RMSE : 0.0982, R2: 0.0463, MAE: 0.0795, Spearman rho: 0.3362, Spearman p: 2.9081e-17, Pearson r: 0.3486, Pearson p: 1.5715e-18
  Pred range: [0.0787, 0.3642], std: 0.0408
  RMSE : 0.0976, R2: 0.0584, MAE: 0.0789, Spearman rho: 0.3432, Spearman p: 5.6596e-18, Pearson r: 0.3551, Pearson p: 3.3098e-19
  Pred range: [0.0801, 0.3718], std: 0.0415
  RMSE : 0.0978, R2: 0.0555, MAE: 0.0791, Spearman rho: 0.3509, Spearman p: 9.1848e-19, Pearson r: 0.3622, Pearson p: 5.6370e-20
  Pred range: [0.0807, 0.3759], std: 0.0418
  RMSE : 0.0978, R2: 0.0544, MAE: 0.0793, Spearman rho: 0.3577, Spearman p: 1.7370e-19, Pearson r: 0.3685, Pearson p: 1.1355e-20
[I 2026-04-27 23:18:23,538] Trial 3 finished with value: 0.09761527632406712 and parameters: {'learning_rate': 1.2690152797377404e-05, 'batch_size': 6, 'num_epochs': 24, 'weight_decay': 2.6600087518431253e-05, 'depth_complex': 5, 'depth_moderate': 2, 'depth_simple': 2, 'dropout': 0.46940133932704065, 'se_reduction': 3, 'hidden_dim_min': 4, 'base_loss': 'mse', 'huber_delta': 0.17771438564906436, 'focal_gamma': 2.8099301377625263, 'n_bins': 10, 'scheduler_patience': 5, 'scheduler_factor': 0.6532267147776882, 'early_stopping_patience': 6}. Best is trial 0 with value: 0.08985099037684136.
Train: 2407 rows (1613 IDs),Test: 598 rows (404 IDs) 

n_features_x : 6, n_features_per_modality: [16, 23, 19, 17, 7, 4, 4, 4, 1, 4]

--- ImbalancedRegressionLoss initialized ---
  Bins: 8, Focal gamma: 2.4742701643686646, Base loss: huber
  Bin [0.00, 0.12): count= 1180, weight=0.003
  Bin [0.12, 0.25): count=  933, weight=0.003
  Bin [0.25, 0.38): count=  253, weight=0.012
  Bin [0.38, 0.50): count=   30, weight=0.098
  Bin [0.50, 0.62): count=   10, weight=0.277
  Bin [0.62, 0.75): count=    1, weight=1.521
  Bin [0.75, 0.88): count=    0, weight=3.043
  Bin [0.88, 1.00): count=    0, weight=3.043
-------------------------------------------

  Pred range: [0.0545, 0.3557], std: 0.0530
  RMSE : 0.0908, R2: 0.1844, MAE: 0.0728, Spearman rho: 0.4664, Spearman p: 1.2308e-33, Pearson r: 0.4696, Pearson p: 3.9940e-34
  Pred range: [0.0556, 0.3495], std: 0.0461
  RMSE : 0.0915, R2: 0.1725, MAE: 0.0740, Spearman rho: 0.4459, Spearman p: 1.4698e-30, Pearson r: 0.4543, Pearson p: 8.6733e-32
  Pred range: [0.0455, 0.3393], std: 0.0458
  RMSE : 0.0900, R2: 0.1995, MAE: 0.0718, Spearman rho: 0.4464, Spearman p: 1.2433e-30, Pearson r: 0.4544, Pearson p: 8.2221e-32
  Pred range: [0.0387, 0.3370], std: 0.0481
  RMSE : 0.0897, R2: 0.2043, MAE: 0.0702, Spearman rho: 0.4571, Spearman p: 3.2564e-32, Pearson r: 0.4645, Pearson p: 2.4843e-33
  Pred range: [0.0445, 0.3344], std: 0.0483
  RMSE : 0.0898, R2: 0.2032, MAE: 0.0708, Spearman rho: 0.4483, Spearman p: 6.7425e-31, Pearson r: 0.4522, Pearson p: 1.7700e-31
  Pred range: [0.0714, 0.3540], std: 0.0491
  RMSE : 0.0941, R2: 0.1245, MAE: 0.0766, Spearman rho: 0.4609, Spearman p: 8.7277e-33, Pearson r: 0.4661, Pearson p: 1.3774e-33
  Pred range: [0.1029, 0.4145], std: 0.0456
  RMSE : 0.1055, R2: -0.0990, MAE: 0.0871, Spearman rho: 0.4355, Spearman p: 4.5793e-29, Pearson r: 0.4411, Pearson p: 7.2872e-30
  Pred range: [0.0251, 0.3045], std: 0.0469
  RMSE : 0.0917, R2: 0.1687, MAE: 0.0721, Spearman rho: 0.4210, Spearman p: 4.3461e-27, Pearson r: 0.4311, Pearson p: 1.8629e-28
  Pred range: [0.0813, 0.3887], std: 0.0471
  RMSE : 0.0970, R2: 0.0706, MAE: 0.0794, Spearman rho: 0.4345, Spearman p: 6.3168e-29, Pearson r: 0.4434, Pearson p: 3.4150e-30
  Pred range: [0.0491, 0.3528], std: 0.0512
  RMSE : 0.0915, R2: 0.1734, MAE: 0.0729, Spearman rho: 0.4276, Spearman p: 5.5351e-28, Pearson r: 0.4304, Pearson p: 2.3294e-28
[I 2026-04-27 23:19:41,881] Trial 4 finished with value: 0.08973483034669663 and parameters: {'learning_rate': 0.001493544794782136, 'batch_size': 6, 'num_epochs': 28, 'weight_decay': 0.004058805056428194, 'depth_complex': 6, 'depth_moderate': 5, 'depth_simple': 1, 'dropout': 0.22310141195773575, 'se_reduction': 8, 'hidden_dim_min': 14, 'base_loss': 'huber', 'huber_delta': 0.17384176701827955, 'focal_gamma': 2.4742701643686646, 'n_bins': 8, 'scheduler_patience': 5, 'scheduler_factor': 0.4911892158005789, 'early_stopping_patience': 6}. Best is trial 4 with value: 0.08973483034669663.
Train: 2407 rows (1613 IDs),Test: 598 rows (404 IDs) 

n_features_x : 6, n_features_per_modality: [16, 23, 19, 17, 7, 4, 4, 4, 1, 4]

--- ImbalancedRegressionLoss initialized ---
  Bins: 9, Focal gamma: 0.9175550234158174, Base loss: huber
  Bin [0.00, 0.11): count= 1180, weight=0.003
  Bin [0.11, 0.22): count=  835, weight=0.004
  Bin [0.22, 0.33): count=  312, weight=0.010
  Bin [0.33, 0.44): count=   59, weight=0.054
  Bin [0.44, 0.56): count=   16, weight=0.190
  Bin [0.56, 0.67): count=    4, weight=0.647
  Bin [0.67, 0.78): count=    1, weight=1.618
  Bin [0.78, 0.89): count=    0, weight=3.237
  Bin [0.89, 1.00): count=    0, weight=3.237
-------------------------------------------

  Pred range: [-0.1146, 0.1952], std: 0.0352
  RMSE : 0.1216, R2: -0.4602, MAE: 0.0925, Spearman rho: -0.0299, Spearman p: 4.6497e-01, Pearson r: -0.0600, Pearson p: 1.4283e-01
  Pred range: [0.0124, 0.3125], std: 0.0376
  RMSE : 0.1075, R2: -0.1418, MAE: 0.0874, Spearman rho: 0.0918, Spearman p: 2.4818e-02, Pearson r: 0.0674, Pearson p: 9.9420e-02
  Pred range: [0.0911, 0.3870], std: 0.0420
  RMSE : 0.1237, R2: -0.5131, MAE: 0.1028, Spearman rho: 0.1603, Spearman p: 8.2301e-05, Pearson r: 0.1446, Pearson p: 3.8947e-04
  Pred range: [0.0969, 0.4177], std: 0.0447
  RMSE : 0.1312, R2: -0.7005, MAE: 0.1100, Spearman rho: 0.2053, Spearman p: 4.1249e-07, Pearson r: 0.1927, Pearson p: 2.0556e-06
  Pred range: [0.0951, 0.4307], std: 0.0463
  RMSE : 0.1323, R2: -0.7302, MAE: 0.1113, Spearman rho: 0.2345, Spearman p: 6.4527e-09, Pearson r: 0.2236, Pearson p: 3.2796e-08
[I 2026-04-27 23:19:48,357] Trial 5 finished with value: 0.10749090317699761 and parameters: {'learning_rate': 6.171912708216038e-05, 'batch_size': 32, 'num_epochs': 29, 'weight_decay': 4.803750460342091e-05, 'depth_complex': 4, 'depth_moderate': 2, 'depth_simple': 3, 'dropout': 0.4398591220927167, 'se_reduction': 5, 'hidden_dim_min': 13, 'base_loss': 'huber', 'huber_delta': 0.13789135798096894, 'focal_gamma': 0.9175550234158174, 'n_bins': 9, 'scheduler_patience': 2, 'scheduler_factor': 0.5439026186712852, 'early_stopping_patience': 3}. Best is trial 4 with value: 0.08973483034669663.
Train: 2407 rows (1613 IDs),Test: 598 rows (404 IDs) 

n_features_x : 6, n_features_per_modality: [16, 23, 19, 17, 7, 4, 4, 4, 1, 4]

--- ImbalancedRegressionLoss initialized ---
  Bins: 17, Focal gamma: 0.6324385123419619, Base loss: huber
  Bin [0.00, 0.06): count=  650, weight=0.004
  Bin [0.06, 0.12): count=  530, weight=0.005
  Bin [0.12, 0.18): count=  536, weight=0.005
  Bin [0.18, 0.24): count=  299, weight=0.009
  Bin [0.24, 0.29): count=  247, weight=0.011
  Bin [0.29, 0.35): count=   91, weight=0.029
  Bin [0.35, 0.41): count=   20, weight=0.127
  Bin [0.41, 0.47): count=   16, weight=0.157
  Bin [0.47, 0.53): count=   10, weight=0.243
  Bin [0.53, 0.59): count=    6, weight=0.382
  Bin [0.59, 0.65): count=    1, weight=1.336
  Bin [0.65, 0.71): count=    1, weight=1.336
  Bin [0.71, 0.76): count=    0, weight=2.671
  Bin [0.76, 0.82): count=    0, weight=2.671
  Bin [0.82, 0.88): count=    0, weight=2.671
  Bin [0.88, 0.94): count=    0, weight=2.671
  Bin [0.94, 1.00): count=    0, weight=2.671
-------------------------------------------

  Pred range: [0.0466, 0.4681], std: 0.0482
  RMSE : 0.1315, R2: -0.7085, MAE: 0.1096, Spearman rho: 0.1226, Spearman p: 2.6700e-03, Pearson r: 0.1400, Pearson p: 5.9398e-04
  Pred range: [0.0419, 0.4859], std: 0.0557
  RMSE : 0.1248, R2: -0.5384, MAE: 0.1038, Spearman rho: 0.2749, Spearman p: 7.9364e-12, Pearson r: 0.2934, Pearson p: 2.4616e-13
  Pred range: [0.0344, 0.4612], std: 0.0580
  RMSE : 0.1148, R2: -0.3026, MAE: 0.0950, Spearman rho: 0.3407, Spearman p: 1.0148e-17, Pearson r: 0.3596, Pearson p: 1.0678e-19
  Pred range: [0.0366, 0.4786], std: 0.0657
  RMSE : 0.1170, R2: -0.3539, MAE: 0.0970, Spearman rho: 0.3781, Spearman p: 9.2631e-22, Pearson r: 0.3947, Pearson p: 1.0058e-23
  Pred range: [0.0371, 0.4989], std: 0.0693
  RMSE : 0.1161, R2: -0.3328, MAE: 0.0962, Spearman rho: 0.3998, Spearman p: 2.3046e-24, Pearson r: 0.4161, Pearson p: 1.9587e-26
  Pred range: [0.0406, 0.4833], std: 0.0665
  RMSE : 0.1109, R2: -0.2164, MAE: 0.0914, Spearman rho: 0.4040, Spearman p: 6.9053e-25, Pearson r: 0.4216, Pearson p: 3.6248e-27
