[I 2026-04-28 00:49:31,274] Trial 12 finished with value: 0.149770678871223 and parameters: {'learning_rate': 0.000370337422616285, 'batch_size': 4, 'num_epochs': 26, 'weight_decay': 5.389594173051031e-05, 'depth_complex': 3, 'depth_moderate': 4, 'depth_simple': 2, 'dropout': 0.3711315503574886, 'se_reduction': 4, 'hidden_dim_min': 9, 'base_loss': 'mse', 'huber_delta': 0.1407726170591743, 'focal_gamma': 1.3120059705886895, 'n_bins': 5, 'scheduler_patience': 5, 'scheduler_factor': 0.5709134487904552, 'early_stopping_patience': 7}. Best is trial 10 with value: 0.14958902474585228.
Train: 2407 rows (1613 IDs),Test: 598 rows (404 IDs) 

n_features_x : 6, n_features_per_modality: [16, 23, 19, 17, 7, 4, 4, 4, 1, 4]

--- ImbalancedRegressionLoss initialized ---
  Bins: 12, Focal gamma: 1.125886117770198, Base loss: mse
  Bin [0.00, 0.08): count=  383, weight=0.051
  Bin [0.08, 0.17): count=  578, weight=0.034
  Bin [0.17, 0.25): count=  499, weight=0.039
  Bin [0.25, 0.33): count=  349, weight=0.055
  Bin [0.33, 0.42): count=  162, weight=0.119
  Bin [0.42, 0.50): count=  191, weight=0.101
  Bin [0.50, 0.58): count=  129, weight=0.149
  Bin [0.58, 0.67): count=   47, weight=0.404
  Bin [0.67, 0.75): count=   41, weight=0.462
  Bin [0.75, 0.83): count=   21, weight=0.882
  Bin [0.83, 0.92): count=    5, weight=3.235
  Bin [0.92, 1.00): count=    2, weight=6.469
-------------------------------------------

  Pred range: [0.0908, 0.5630], std: 0.0791
  RMSE : 0.1534, R2: 0.2149, MAE: 0.1247, Spearman rho: 0.4788, Spearman p: 1.3667e-35, Pearson r: 0.4985, Pearson p: 6.9041e-39
  Pred range: [0.1243, 0.6575], std: 0.0959
  RMSE : 0.1613, R2: 0.1321, MAE: 0.1344, Spearman rho: 0.5020, Spearman p: 1.7416e-39, Pearson r: 0.5198, Pearson p: 1.0986e-42
  Pred range: [0.0991, 0.6047], std: 0.0931
  RMSE : 0.1543, R2: 0.2057, MAE: 0.1265, Spearman rho: 0.4951, Spearman p: 2.6425e-38, Pearson r: 0.5183, Pearson p: 2.0347e-42
  Pred range: [0.0649, 0.6162], std: 0.0982
  RMSE : 0.1547, R2: 0.2012, MAE: 0.1269, Spearman rho: 0.5015, Spearman p: 2.0520e-39, Pearson r: 0.5254, Pearson p: 9.8091e-44
  Pred range: [0.1326, 0.7627], std: 0.1077
  RMSE : 0.1868, R2: -0.1651, MAE: 0.1589, Spearman rho: 0.4919, Spearman p: 9.2225e-38, Pearson r: 0.5170, Pearson p: 3.5257e-42
  Pred range: [0.0824, 0.7198], std: 0.1056
  RMSE : 0.1645, R2: 0.0970, MAE: 0.1367, Spearman rho: 0.4901, Spearman p: 1.8843e-37, Pearson r: 0.5170, Pearson p: 3.5032e-42
  Pred range: [0.1013, 0.7192], std: 0.1006
  RMSE : 0.1761, R2: -0.0348, MAE: 0.1491, Spearman rho: 0.4858, Spearman p: 9.5444e-37, Pearson r: 0.5145, Pearson p: 1.0098e-41
  Pred range: [0.0390, 0.6619], std: 0.0991
  RMSE : 0.1554, R2: 0.1943, MAE: 0.1276, Spearman rho: 0.4927, Spearman p: 6.6922e-38, Pearson r: 0.5198, Pearson p: 1.0930e-42
[I 2026-04-28 00:50:12,643] Trial 13 finished with value: 0.1533615700675902 and parameters: {'learning_rate': 0.0008585085403605012, 'batch_size': 8, 'num_epochs': 27, 'weight_decay': 3.676177288552206e-05, 'depth_complex': 4, 'depth_moderate': 5, 'depth_simple': 2, 'dropout': 0.35978691739392044, 'se_reduction': 5, 'hidden_dim_min': 9, 'base_loss': 'mse', 'huber_delta': 0.13242126828167025, 'focal_gamma': 1.125886117770198, 'n_bins': 12, 'scheduler_patience': 5, 'scheduler_factor': 0.580416784487472, 'early_stopping_patience': 7}. Best is trial 10 with value: 0.14958902474585228.
Train: 2407 rows (1613 IDs),Test: 598 rows (404 IDs) 

n_features_x : 6, n_features_per_modality: [16, 23, 19, 17, 7, 4, 4, 4, 1, 4]

--- ImbalancedRegressionLoss initialized ---
  Bins: 10, Focal gamma: 1.0586229256452626, Base loss: mse
  Bin [0.00, 0.10): count=  585, weight=0.037
  Bin [0.10, 0.20): count=  580, weight=0.038
  Bin [0.20, 0.30): count=  421, weight=0.052
  Bin [0.30, 0.40): count=  385, weight=0.057
  Bin [0.40, 0.50): count=  191, weight=0.114
  Bin [0.50, 0.60): count=  129, weight=0.168
  Bin [0.60, 0.70): count=   74, weight=0.292
  Bin [0.70, 0.80): count=   33, weight=0.644
  Bin [0.80, 0.90): count=    6, weight=3.127
  Bin [0.90, 1.00): count=    3, weight=5.472
-------------------------------------------

  Pred range: [0.1353, 0.6957], std: 0.0929
  RMSE : 0.1856, R2: -0.1494, MAE: 0.1576, Spearman rho: 0.4648, Spearman p: 2.1722e-33, Pearson r: 0.4700, Pearson p: 3.4646e-34
  Pred range: [0.1068, 0.6495], std: 0.0928
  RMSE : 0.1576, R2: 0.1714, MAE: 0.1295, Spearman rho: 0.5010, Spearman p: 2.5186e-39, Pearson r: 0.5079, Pearson p: 1.5806e-40
  Pred range: [0.1303, 0.6364], std: 0.0850
  RMSE : 0.1609, R2: 0.1355, MAE: 0.1349, Spearman rho: 0.5050, Spearman p: 5.0846e-40, Pearson r: 0.5182, Pearson p: 2.1384e-42
  Pred range: [0.1168, 0.6912], std: 0.0931
  RMSE : 0.1662, R2: 0.0777, MAE: 0.1399, Spearman rho: 0.5024, Spearman p: 1.4409e-39, Pearson r: 0.5185, Pearson p: 1.9142e-42
  Pred range: [0.0446, 0.6586], std: 0.0933
  RMSE : 0.1523, R2: 0.2262, MAE: 0.1232, Spearman rho: 0.4908, Spearman p: 1.4400e-37, Pearson r: 0.5144, Pearson p: 1.0504e-41
  Pred range: [0.1301, 0.6915], std: 0.0946
  RMSE : 0.1670, R2: 0.0693, MAE: 0.1403, Spearman rho: 0.4940, Spearman p: 4.0239e-38, Pearson r: 0.5174, Pearson p: 3.0100e-42
  Pred range: [0.0532, 0.6973], std: 0.1005
  RMSE : 0.1559, R2: 0.1889, MAE: 0.1272, Spearman rho: 0.4872, Spearman p: 5.7130e-37, Pearson r: 0.5068, Pearson p: 2.4280e-40
  Pred range: [0.0864, 0.6668], std: 0.0916
  RMSE : 0.1590, R2: 0.1557, MAE: 0.1323, Spearman rho: 0.4909, Spearman p: 1.3447e-37, Pearson r: 0.5208, Pearson p: 6.9504e-43
  Pred range: [0.0877, 0.6165], std: 0.0903
  RMSE : 0.1500, R2: 0.2491, MAE: 0.1205, Spearman rho: 0.4838, Spearman p: 2.1053e-36, Pearson r: 0.5147, Pearson p: 9.4223e-42
  Pred range: [0.0688, 0.6548], std: 0.0984
  RMSE : 0.1505, R2: 0.2437, MAE: 0.1214, Spearman rho: 0.4894, Spearman p: 2.4155e-37, Pearson r: 0.5201, Pearson p: 9.5569e-43
  Pred range: [0.0391, 0.7109], std: 0.1119
  RMSE : 0.1533, R2: 0.2155, MAE: 0.1232, Spearman rho: 0.4897, Spearman p: 2.1922e-37, Pearson r: 0.5165, Pearson p: 4.3020e-42
  Pred range: [0.0700, 0.6198], std: 0.0912
  RMSE : 0.1501, R2: 0.2478, MAE: 0.1199, Spearman rho: 0.4756, Spearman p: 4.4043e-35, Pearson r: 0.5063, Pearson p: 3.0137e-40
  Pred range: [0.0967, 0.7868], std: 0.1097
  RMSE : 0.1731, R2: -0.0003, MAE: 0.1453, Spearman rho: 0.4790, Spearman p: 1.2427e-35, Pearson r: 0.5066, Pearson p: 2.6948e-40
  Pred range: [0.0357, 0.7352], std: 0.1109
  RMSE : 0.1575, R2: 0.1717, MAE: 0.1281, Spearman rho: 0.4748, Spearman p: 6.0318e-35, Pearson r: 0.5016, Pearson p: 1.9834e-39
  Pred range: [0.0586, 0.7439], std: 0.1026
  RMSE : 0.1636, R2: 0.1062, MAE: 0.1363, Spearman rho: 0.4709, Spearman p: 2.4779e-34, Pearson r: 0.5028, Pearson p: 1.2534e-39
  Pred range: [0.0944, 0.7718], std: 0.1072
  RMSE : 0.1668, R2: 0.0715, MAE: 0.1386, Spearman rho: 0.4803, Spearman p: 7.6500e-36, Pearson r: 0.5070, Pearson p: 2.2693e-40
[I 2026-04-28 00:52:28,767] Trial 14 finished with value: 0.14999149665969477 and parameters: {'learning_rate': 0.0006392736171712127, 'batch_size': 4, 'num_epochs': 20, 'weight_decay': 4.062448344638171e-05, 'depth_complex': 4, 'depth_moderate': 3, 'depth_simple': 2, 'dropout': 0.33053974666138164, 'se_reduction': 4, 'hidden_dim_min': 11, 'base_loss': 'mse', 'huber_delta': 0.13345951421871002, 'focal_gamma': 1.0586229256452626, 'n_bins': 10, 'scheduler_patience': 5, 'scheduler_factor': 0.6010768310787035, 'early_stopping_patience': 7}. Best is trial 10 with value: 0.14958902474585228.
Train: 2407 rows (1613 IDs),Test: 598 rows (404 IDs) 

n_features_x : 6, n_features_per_modality: [16, 23, 19, 17, 7, 4, 4, 4, 1, 4]

--- ImbalancedRegressionLoss initialized ---
  Bins: 7, Focal gamma: 1.78541480665507, Base loss: mse
  Bin [0.00, 0.14): count=  760, weight=0.038
  Bin [0.14, 0.29): count=  826, weight=0.035
  Bin [0.29, 0.43): count=  454, weight=0.063
  Bin [0.43, 0.57): count=  215, weight=0.133
  Bin [0.57, 0.71): count=  110, weight=0.258
  Bin [0.71, 0.86): count=   38, weight=0.736
  Bin [0.86, 1.00): count=    4, weight=5.738
-------------------------------------------

  Pred range: [0.1404, 0.5854], std: 0.0636
  RMSE : 0.1710, R2: 0.0245, MAE: 0.1448, Spearman rho: 0.4393, Spearman p: 1.3120e-29, Pearson r: 0.4587, Pearson p: 1.8642e-32
  Pred range: [0.1312, 0.5707], std: 0.0732
  RMSE : 0.1627, R2: 0.1162, MAE: 0.1365, Spearman rho: 0.4795, Spearman p: 1.0392e-35, Pearson r: 0.4987, Pearson p: 6.4320e-39
  Pred range: [0.1268, 0.5886], std: 0.0805
  RMSE : 0.1601, R2: 0.1441, MAE: 0.1338, Spearman rho: 0.4984, Spearman p: 7.3445e-39, Pearson r: 0.5142, Pearson p: 1.1594e-41
  Pred range: [0.1086, 0.5786], std: 0.0792
  RMSE : 0.1528, R2: 0.2210, MAE: 0.1251, Spearman rho: 0.5039, Spearman p: 8.0496e-40, Pearson r: 0.5215, Pearson p: 5.2128e-43
  Pred range: [0.1027, 0.6028], std: 0.0833
  RMSE : 0.1529, R2: 0.2192, MAE: 0.1254, Spearman rho: 0.5063, Spearman p: 2.9551e-40, Pearson r: 0.5236, Pearson p: 2.0739e-43
  Pred range: [0.1195, 0.6471], std: 0.0895
  RMSE : 0.1584, R2: 0.1621, MAE: 0.1316, Spearman rho: 0.5068, Spearman p: 2.4466e-40, Pearson r: 0.5226, Pearson p: 3.2230e-43
  Pred range: [0.0911, 0.5974], std: 0.0848
  RMSE : 0.1499, R2: 0.2501, MAE: 0.1210, Spearman rho: 0.5056, Spearman p: 3.9859e-40, Pearson r: 0.5237, Pearson p: 1.9898e-43
  Pred range: [0.1073, 0.6346], std: 0.0902
  RMSE : 0.1538, R2: 0.2105, MAE: 0.1263, Spearman rho: 0.5056, Spearman p: 4.0147e-40, Pearson r: 0.5256, Pearson p: 8.9683e-44
  Pred range: [0.1026, 0.6409], std: 0.0902
  RMSE : 0.1544, R2: 0.2047, MAE: 0.1269, Spearman rho: 0.5039, Spearman p: 7.7948e-40, Pearson r: 0.5240, Pearson p: 1.7656e-43
  Pred range: [0.1106, 0.6417], std: 0.0888
  RMSE : 0.1563, R2: 0.1844, MAE: 0.1294, Spearman rho: 0.5026, Spearman p: 1.3539e-39, Pearson r: 0.5250, Pearson p: 1.1771e-43
  Pred range: [0.1086, 0.6423], std: 0.0874
  RMSE : 0.1571, R2: 0.1764, MAE: 0.1305, Spearman rho: 0.5013, Spearman p: 2.2744e-39, Pearson r: 0.5240, Pearson p: 1.7937e-43
  Pred range: [0.1103, 0.6722], std: 0.0905
  RMSE : 0.1608, R2: 0.1366, MAE: 0.1345, Spearman rho: 0.4990, Spearman p: 5.6660e-39, Pearson r: 0.5229, Pearson p: 2.8026e-43
  Pred range: [0.0952, 0.6275], std: 0.0875
  RMSE : 0.1522, R2: 0.2266, MAE: 0.1243, Spearman rho: 0.4988, Spearman p: 6.1153e-39, Pearson r: 0.5234, Pearson p: 2.3542e-43
  Pred range: [0.1019, 0.6563], std: 0.0912
  RMSE : 0.1563, R2: 0.1845, MAE: 0.1293, Spearman rho: 0.5012, Spearman p: 2.3482e-39, Pearson r: 0.5237, Pearson p: 2.0459e-43
[I 2026-04-28 00:54:28,262] Trial 15 finished with value: 0.14989173180608822 and parameters: {'learning_rate': 0.00012028650585432426, 'batch_size': 4, 'num_epochs': 23, 'weight_decay': 0.00012772813963601601, 'depth_complex': 3, 'depth_moderate': 4, 'depth_simple': 2, 'dropout': 0.27302920540267134, 'se_reduction': 3, 'hidden_dim_min': 7, 'base_loss': 'mse', 'huber_delta': 0.05591874316318993, 'focal_gamma': 1.78541480665507, 'n_bins': 7, 'scheduler_patience': 5, 'scheduler_factor': 0.5327396468245624, 'early_stopping_patience': 7}. Best is trial 10 with value: 0.14958902474585228.
Train: 2407 rows (1613 IDs),Test: 598 rows (404 IDs) 

n_features_x : 6, n_features_per_modality: [16, 23, 19, 17, 7, 4, 4, 4, 1, 4]

--- ImbalancedRegressionLoss initialized ---
  Bins: 20, Focal gamma: 0.6943280756004422, Base loss: mse
  Bin [0.00, 0.05): count=  172, weight=0.053
  Bin [0.05, 0.10): count=  413, weight=0.022
  Bin [0.10, 0.15): count=  175, weight=0.052
  Bin [0.15, 0.20): count=  405, weight=0.023
  Bin [0.20, 0.25): count=  295, weight=0.031
  Bin [0.25, 0.30): count=  126, weight=0.072
  Bin [0.30, 0.35): count=  223, weight=0.041
  Bin [0.35, 0.40): count=  162, weight=0.056
  Bin [0.40, 0.45): count=   69, weight=0.131
  Bin [0.45, 0.50): count=  122, weight=0.074
  Bin [0.50, 0.55): count=   93, weight=0.097
  Bin [0.55, 0.60): count=   36, weight=0.247
  Bin [0.60, 0.65): count=   47, weight=0.190
  Bin [0.65, 0.70): count=   27, weight=0.326
  Bin [0.70, 0.75): count=   14, weight=0.609
  Bin [0.75, 0.80): count=   19, weight=0.457
  Bin [0.80, 0.85): count=    5, weight=1.523
  Bin [0.85, 0.90): count=    1, weight=4.570
  Bin [0.90, 0.95): count=    3, weight=2.285
  Bin [0.95, 1.00): count=    0, weight=9.140
-------------------------------------------

  Pred range: [0.1435, 0.6122], std: 0.0761
  RMSE : 0.1701, R2: 0.0341, MAE: 0.1427, Spearman rho: 0.4481, Spearman p: 7.1512e-31, Pearson r: 0.4612, Pearson p: 7.7916e-33
  Pred range: [0.1193, 0.6655], std: 0.0932
  RMSE : 0.1601, R2: 0.1442, MAE: 0.1322, Spearman rho: 0.4897, Spearman p: 2.2034e-37, Pearson r: 0.5021, Pearson p: 1.6233e-39
  Pred range: [0.1243, 0.6956], std: 0.0950
  RMSE : 0.1589, R2: 0.1577, MAE: 0.1309, Spearman rho: 0.4908, Spearman p: 1.4441e-37, Pearson r: 0.5092, Pearson p: 9.1964e-41
  Pred range: [0.1418, 0.7120], std: 0.0995
  RMSE : 0.1703, R2: 0.0325, MAE: 0.1434, Spearman rho: 0.4975, Spearman p: 1.0296e-38, Pearson r: 0.5171, Pearson p: 3.4556e-42
  Pred range: [0.1098, 0.6701], std: 0.0979
  RMSE : 0.1550, R2: 0.1980, MAE: 0.1267, Spearman rho: 0.4999, Spearman p: 4.0322e-39, Pearson r: 0.5203, Pearson p: 8.5759e-43
  Pred range: [0.1275, 0.7098], std: 0.0986
  RMSE : 0.1722, R2: 0.0106, MAE: 0.1449, Spearman rho: 0.4944, Spearman p: 3.4510e-38, Pearson r: 0.5167, Pearson p: 3.9853e-42
  Pred range: [0.1130, 0.7217], std: 0.1033
  RMSE : 0.1644, R2: 0.0976, MAE: 0.1367, Spearman rho: 0.4947, Spearman p: 3.1385e-38, Pearson r: 0.5172, Pearson p: 3.2230e-42
  Pred range: [0.0663, 0.6986], std: 0.0997
  RMSE : 0.1649, R2: 0.0928, MAE: 0.1378, Spearman rho: 0.4941, Spearman p: 3.9412e-38, Pearson r: 0.5165, Pearson p: 4.3917e-42
  Pred range: [-0.0052, 0.6485], std: 0.0949
  RMSE : 0.1493, R2: 0.2556, MAE: 0.1181, Spearman rho: 0.4878, Spearman p: 4.5298e-37, Pearson r: 0.5115, Pearson p: 3.5164e-41
  Pred range: [0.0216, 0.7261], std: 0.1033
  RMSE : 0.1584, R2: 0.1629, MAE: 0.1299, Spearman rho: 0.4886, Spearman p: 3.3841e-37, Pearson r: 0.5145, Pearson p: 1.0056e-41
  Pred range: [-0.0173, 0.6960], std: 0.1026
  RMSE : 0.1587, R2: 0.1596, MAE: 0.1303, Spearman rho: 0.4893, Spearman p: 2.5166e-37, Pearson r: 0.5111, Pearson p: 4.1767e-41
  Pred range: [0.0373, 0.7442], std: 0.1023
  RMSE : 0.1711, R2: 0.0234, MAE: 0.1435, Spearman rho: 0.4869, Spearman p: 6.2598e-37, Pearson r: 0.5100, Pearson p: 6.4712e-41
  Pred range: [-0.0062, 0.7145], std: 0.1065
  RMSE : 0.1561, R2: 0.1864, MAE: 0.1263, Spearman rho: 0.4918, Spearman p: 9.5788e-38, Pearson r: 0.5120, Pearson p: 2.8180e-41
  Pred range: [-0.0248, 0.6970], std: 0.1001
  RMSE : 0.1533, R2: 0.2155, MAE: 0.1233, Spearman rho: 0.4816, Spearman p: 4.7066e-36, Pearson r: 0.5063, Pearson p: 2.9498e-40
[I 2026-04-28 00:56:24,478] Trial 16 finished with value: 0.14933282226777683 and parameters: {'learning_rate': 0.0002845984319734429, 'batch_size': 4, 'num_epochs': 17, 'weight_decay': 2.6433463185241317e-05, 'depth_complex': 4, 'depth_moderate': 3, 'depth_simple': 2, 'dropout': 0.22581926227531776, 'se_reduction': 5, 'hidden_dim_min': 12, 'base_loss': 'mse', 'huber_delta': 0.1980188002510526, 'focal_gamma': 0.6943280756004422, 'n_bins': 20, 'scheduler_patience': 5, 'scheduler_factor': 0.6336660982551714, 'early_stopping_patience': 5}. Best is trial 16 with value: 0.14933282226777683.
Train: 2407 rows (1613 IDs),Test: 598 rows (404 IDs) 

n_features_x : 6, n_features_per_modality: [16, 23, 19, 17, 7, 4, 4, 4, 1, 4]

--- ImbalancedRegressionLoss initialized ---
  Bins: 14, Focal gamma: 0.501018693183592, Base loss: mse
  Bin [0.00, 0.07): count=  383, weight=0.042
  Bin [0.07, 0.14): count=  377, weight=0.043
  Bin [0.14, 0.21): count=  571, weight=0.028
  Bin [0.21, 0.29): count=  255, weight=0.063
  Bin [0.29, 0.36): count=  223, weight=0.072
  Bin [0.36, 0.43): count=  231, weight=0.070
  Bin [0.43, 0.50): count=  122, weight=0.131
  Bin [0.50, 0.57): count=   93, weight=0.172
  Bin [0.57, 0.64): count=   83, weight=0.192
  Bin [0.64, 0.71): count=   27, weight=0.577
  Bin [0.71, 0.79): count=   26, weight=0.598
  Bin [0.79, 0.86): count=   12, weight=1.243
  Bin [0.86, 0.93): count=    2, weight=5.384
  Bin [0.93, 1.00): count=    2, weight=5.384
-------------------------------------------

  Pred range: [0.1245, 0.7386], std: 0.0937
  RMSE : 0.1794, R2: -0.0746, MAE: 0.1522, Spearman rho: 0.4707, Spearman p: 2.6738e-34, Pearson r: 0.4748, Pearson p: 5.8561e-35
  Pred range: [0.0721, 0.6562], std: 0.0946
  RMSE : 0.1627, R2: 0.1162, MAE: 0.1354, Spearman rho: 0.4765, Spearman p: 3.1404e-35, Pearson r: 0.4933, Pearson p: 5.3145e-38
  Pred range: [0.0513, 0.6871], std: 0.0949
  RMSE : 0.1748, R2: -0.0205, MAE: 0.1483, Spearman rho: 0.4815, Spearman p: 4.9927e-36, Pearson r: 0.4923, Pearson p: 8.0293e-38
  Pred range: [0.0126, 0.8555], std: 0.1188
  RMSE : 0.1733, R2: -0.0026, MAE: 0.1431, Spearman rho: 0.4857, Spearman p: 9.9591e-37, Pearson r: 0.5044, Pearson p: 6.4936e-40
  Pred range: [-0.0129, 0.7892], std: 0.1136
  RMSE : 0.1683, R2: 0.0542, MAE: 0.1395, Spearman rho: 0.4820, Spearman p: 4.0195e-36, Pearson r: 0.5066, Pearson p: 2.6145e-40
  Pred range: [0.0296, 0.7443], std: 0.1118
  RMSE : 0.1727, R2: 0.0049, MAE: 0.1439, Spearman rho: 0.4811, Spearman p: 5.7700e-36, Pearson r: 0.5035, Pearson p: 9.4145e-40
  Pred range: [-0.0130, 0.7903], std: 0.1176
  RMSE : 0.1686, R2: 0.0515, MAE: 0.1389, Spearman rho: 0.4763, Spearman p: 3.3658e-35, Pearson r: 0.5022, Pearson p: 1.6101e-39
[I 2026-04-28 00:56:54,767] Trial 17 finished with value: 0.16272355552340786 and parameters: {'learning_rate': 0.0018386045492383872, 'batch_size': 8, 'num_epochs': 17, 'weight_decay': 2.147424602605023e-05, 'depth_complex': 4, 'depth_moderate': 3, 'depth_simple': 2, 'dropout': 0.22085138845334037, 'se_reduction': 6, 'hidden_dim_min': 12, 'base_loss': 'mse', 'huber_delta': 0.19156524470703673, 'focal_gamma': 0.501018693183592, 'n_bins': 14, 'scheduler_patience': 3, 'scheduler_factor': 0.6993486236794109, 'early_stopping_patience': 5}. Best is trial 16 with value: 0.14933282226777683.
Train: 2407 rows (1613 IDs),Test: 598 rows (404 IDs) 

n_features_x : 6, n_features_per_modality: [16, 23, 19, 17, 7, 4, 4, 4, 1, 4]

--- ImbalancedRegressionLoss initialized ---
  Bins: 20, Focal gamma: 0.8519763876388854, Base loss: mse
  Bin [0.00, 0.05): count=  172, weight=0.053
  Bin [0.05, 0.10): count=  413, weight=0.022
  Bin [0.10, 0.15): count=  175, weight=0.052
  Bin [0.15, 0.20): count=  405, weight=0.023
  Bin [0.20, 0.25): count=  295, weight=0.031
  Bin [0.25, 0.30): count=  126, weight=0.072
  Bin [0.30, 0.35): count=  223, weight=0.041
  Bin [0.35, 0.40): count=  162, weight=0.056
  Bin [0.40, 0.45): count=   69, weight=0.131
  Bin [0.45, 0.50): count=  122, weight=0.074
  Bin [0.50, 0.55): count=   93, weight=0.097
  Bin [0.55, 0.60): count=   36, weight=0.247
  Bin [0.60, 0.65): count=   47, weight=0.190
  Bin [0.65, 0.70): count=   27, weight=0.326
  Bin [0.70, 0.75): count=   14, weight=0.609
  Bin [0.75, 0.80): count=   19, weight=0.457
  Bin [0.80, 0.85): count=    5, weight=1.523
  Bin [0.85, 0.90): count=    1, weight=4.570
  Bin [0.90, 0.95): count=    3, weight=2.285
  Bin [0.95, 1.00): count=    0, weight=9.140
-------------------------------------------

  Pred range: [0.1164, 0.6703], std: 0.0877
  RMSE : 0.2051, R2: -0.4037, MAE: 0.1744, Spearman rho: 0.2823, Spearman p: 2.0380e-12, Pearson r: 0.2918, Pearson p: 3.3244e-13
  Pred range: [0.1225, 0.6901], std: 0.0877
  RMSE : 0.2048, R2: -0.3997, MAE: 0.1753, Spearman rho: 0.3327, Spearman p: 6.3230e-17, Pearson r: 0.3420, Pearson p: 7.4931e-18
  Pred range: [0.1313, 0.7181], std: 0.0891
  RMSE : 0.2105, R2: -0.4790, MAE: 0.1816, Spearman rho: 0.3695, Spearman p: 8.7312e-21, Pearson r: 0.3784, Pearson p: 8.6195e-22
  Pred range: [0.1257, 0.6929], std: 0.0869
  RMSE : 0.1966, R2: -0.2904, MAE: 0.1687, Spearman rho: 0.4035, Spearman p: 8.1550e-25, Pearson r: 0.4114, Pearson p: 7.8846e-26
  Pred range: [0.1140, 0.6468], std: 0.0827
  RMSE : 0.1771, R2: -0.0475, MAE: 0.1502, Spearman rho: 0.4290, Spearman p: 3.6358e-28, Pearson r: 0.4367, Pearson p: 3.0518e-29
  Pred range: [0.1204, 0.6736], std: 0.0896
  RMSE : 0.1854, R2: -0.1477, MAE: 0.1583, Spearman rho: 0.4467, Spearman p: 1.1512e-30, Pearson r: 0.4554, Pearson p: 5.9919e-32
