[I 2026-04-27 19:06:00,122] Trial 29 finished with value: 0.1537431789742091 and parameters: {'learning_rate': 0.00019755260810170783, 'batch_size': 6, 'num_epochs': 20, 'weight_decay': 1.7788089315578835e-05, 'layers_PRS': 2, 'layers_SCZ15': 5, 'layers_ADHD9': 6, 'layers_ASD9': 5, 'layers_ACE15': 5, 'layers_ACE18': 2, 'layers_SUD18': 3, 'layers_SES': 7, 'layers_SEX': 1, 'dropout': 0.12961240391604928, 'se_reduction': 4, 'hidden_dim_min': 5, 'base_loss': 'huber', 'huber_delta': 0.1184734711568374, 'focal_gamma': 1.6347737968897882, 'n_bins': 14, 'scheduler_patience': 3, 'scheduler_factor': 0.6040436053070186, 'early_stopping_patience': 7}. Best is trial 24 with value: 0.14944143605522978.
Train: 2407 rows (1613 IDs),Test: 598 rows (404 IDs) 

n_features_x : 6, n_features_per_modality: [16, 23, 19, 17, 7, 4, 4, 4, 1, 4]

--- ImbalancedRegressionLoss initialized ---
  Bins: 19, Focal gamma: 1.510656157773084, Base loss: huber
  Bin [0.00, 0.05): count=  172, weight=0.055
  Bin [0.05, 0.11): count=  413, weight=0.023
  Bin [0.11, 0.16): count=  376, weight=0.025
  Bin [0.16, 0.21): count=  204, weight=0.046
  Bin [0.21, 0.26): count=  295, weight=0.032
  Bin [0.26, 0.32): count=  239, weight=0.039
  Bin [0.32, 0.37): count=  199, weight=0.047
  Bin [0.37, 0.42): count=   73, weight=0.128
  Bin [0.42, 0.47): count=  134, weight=0.070
  Bin [0.47, 0.53): count=  108, weight=0.087
  Bin [0.53, 0.58): count=   78, weight=0.120
  Bin [0.58, 0.63): count=   28, weight=0.327
  Bin [0.63, 0.68): count=   36, weight=0.256
  Bin [0.68, 0.74): count=   24, weight=0.379
  Bin [0.74, 0.79): count=   19, weight=0.474
  Bin [0.79, 0.84): count=    2, weight=3.157
  Bin [0.84, 0.89): count=    4, weight=1.894
  Bin [0.89, 0.95): count=    3, weight=2.368
  Bin [0.95, 1.00): count=    0, weight=9.472
-------------------------------------------

  Pred range: [0.1025, 0.6141], std: 0.0867
  RMSE : 0.1687, R2: 0.0499, MAE: 0.1407, Spearman rho: 0.4355, Spearman p: 4.4821e-29, Pearson r: 0.4490, Pearson p: 5.2035e-31
  Pred range: [0.0961, 0.6313], std: 0.0895
  RMSE : 0.1629, R2: 0.1147, MAE: 0.1348, Spearman rho: 0.4592, Spearman p: 1.6053e-32, Pearson r: 0.4700, Pearson p: 3.4524e-34
  Pred range: [0.0775, 0.6120], std: 0.0906
  RMSE : 0.1535, R2: 0.2132, MAE: 0.1228, Spearman rho: 0.4710, Spearman p: 2.4024e-34, Pearson r: 0.4836, Pearson p: 2.2129e-36
  Pred range: [0.0735, 0.5877], std: 0.0896
  RMSE : 0.1529, R2: 0.2193, MAE: 0.1228, Spearman rho: 0.4766, Spearman p: 3.0673e-35, Pearson r: 0.4905, Pearson p: 1.5771e-37
  Pred range: [0.0747, 0.5940], std: 0.0919
  RMSE : 0.1525, R2: 0.2233, MAE: 0.1228, Spearman rho: 0.4848, Spearman p: 1.4404e-36, Pearson r: 0.4993, Pearson p: 5.0667e-39
  Pred range: [0.0854, 0.6343], std: 0.0971
  RMSE : 0.1601, R2: 0.1445, MAE: 0.1320, Spearman rho: 0.4836, Spearman p: 2.2248e-36, Pearson r: 0.4983, Pearson p: 7.6258e-39
  Pred range: [0.0752, 0.6322], std: 0.0999
  RMSE : 0.1575, R2: 0.1718, MAE: 0.1289, Spearman rho: 0.4849, Spearman p: 1.3910e-36, Pearson r: 0.5012, Pearson p: 2.3147e-39
  Pred range: [0.0837, 0.6335], std: 0.0990
  RMSE : 0.1606, R2: 0.1393, MAE: 0.1324, Spearman rho: 0.4844, Spearman p: 1.6239e-36, Pearson r: 0.5005, Pearson p: 3.1688e-39
  Pred range: [0.0764, 0.6370], std: 0.1016
  RMSE : 0.1596, R2: 0.1494, MAE: 0.1313, Spearman rho: 0.4859, Spearman p: 9.2844e-37, Pearson r: 0.5038, Pearson p: 8.1185e-40
  Pred range: [0.0391, 0.6127], std: 0.0971
  RMSE : 0.1529, R2: 0.2195, MAE: 0.1232, Spearman rho: 0.4792, Spearman p: 1.1583e-35, Pearson r: 0.4987, Pearson p: 6.3538e-39
  Pred range: [0.0715, 0.6481], std: 0.1005
  RMSE : 0.1615, R2: 0.1295, MAE: 0.1334, Spearman rho: 0.4826, Spearman p: 3.2071e-36, Pearson r: 0.5012, Pearson p: 2.3549e-39
  Pred range: [0.0607, 0.6304], std: 0.1014
  RMSE : 0.1563, R2: 0.1845, MAE: 0.1273, Spearman rho: 0.4852, Spearman p: 1.2393e-36, Pearson r: 0.5032, Pearson p: 1.0592e-39
[I 2026-04-27 19:07:30,114] Trial 30 finished with value: 0.15253854182468304 and parameters: {'learning_rate': 0.0005051229570848395, 'batch_size': 6, 'num_epochs': 27, 'weight_decay': 0.0007458040898684148, 'layers_PRS': 1, 'layers_SCZ15': 5, 'layers_ADHD9': 6, 'layers_ASD9': 4, 'layers_ACE15': 6, 'layers_ACE18': 4, 'layers_SUD18': 3, 'layers_SES': 6, 'layers_SEX': 3, 'dropout': 0.1828744415562479, 'se_reduction': 8, 'hidden_dim_min': 7, 'base_loss': 'huber', 'huber_delta': 0.14006974108260203, 'focal_gamma': 1.510656157773084, 'n_bins': 19, 'scheduler_patience': 4, 'scheduler_factor': 0.47381085469975, 'early_stopping_patience': 7}. Best is trial 24 with value: 0.14944143605522978.
Train: 2407 rows (1613 IDs),Test: 598 rows (404 IDs) 

n_features_x : 6, n_features_per_modality: [16, 23, 19, 17, 7, 4, 4, 4, 1, 4]

--- ImbalancedRegressionLoss initialized ---
  Bins: 15, Focal gamma: 2.26306214808341, Base loss: huber
  Bin [0.00, 0.07): count=  383, weight=0.040
  Bin [0.07, 0.13): count=  377, weight=0.041
  Bin [0.13, 0.20): count=  405, weight=0.038
  Bin [0.20, 0.27): count=  295, weight=0.052
  Bin [0.27, 0.33): count=  349, weight=0.044
  Bin [0.33, 0.40): count=  162, weight=0.094
  Bin [0.40, 0.47): count=  134, weight=0.114
  Bin [0.47, 0.53): count=  108, weight=0.141
  Bin [0.53, 0.60): count=   78, weight=0.194
  Bin [0.60, 0.67): count=   47, weight=0.320
  Bin [0.67, 0.73): count=   41, weight=0.365
  Bin [0.73, 0.80): count=   19, weight=0.767
  Bin [0.80, 0.87): count=    5, weight=2.558
  Bin [0.87, 0.93): count=    2, weight=5.116
  Bin [0.93, 1.00): count=    2, weight=5.116
-------------------------------------------

  Pred range: [0.1046, 0.5907], std: 0.0886
  RMSE : 0.1659, R2: 0.0812, MAE: 0.1389, Spearman rho: 0.4554, Spearman p: 5.9911e-32, Pearson r: 0.4782, Pearson p: 1.6926e-35
  Pred range: [0.0546, 0.5405], std: 0.0852
  RMSE : 0.1484, R2: 0.2653, MAE: 0.1148, Spearman rho: 0.4957, Spearman p: 2.1147e-38, Pearson r: 0.5164, Pearson p: 4.5710e-42
  Pred range: [0.1143, 0.6720], std: 0.0986
  RMSE : 0.1687, R2: 0.0505, MAE: 0.1419, Spearman rho: 0.4897, Spearman p: 2.1794e-37, Pearson r: 0.5125, Pearson p: 2.2925e-41
  Pred range: [0.0920, 0.6841], std: 0.0969
  RMSE : 0.1591, R2: 0.1552, MAE: 0.1314, Spearman rho: 0.4811, Spearman p: 5.7686e-36, Pearson r: 0.5035, Pearson p: 9.4367e-40
  Pred range: [0.0761, 0.6665], std: 0.0996
  RMSE : 0.1517, R2: 0.2318, MAE: 0.1226, Spearman rho: 0.4900, Spearman p: 1.9043e-37, Pearson r: 0.5157, Pearson p: 6.2078e-42
  Pred range: [-0.0278, 0.5600], std: 0.0896
  RMSE : 0.1499, R2: 0.2500, MAE: 0.1144, Spearman rho: 0.4882, Spearman p: 3.8559e-37, Pearson r: 0.5094, Pearson p: 8.3907e-41
  Pred range: [0.0920, 0.6387], std: 0.0891
  RMSE : 0.1585, R2: 0.1613, MAE: 0.1315, Spearman rho: 0.4804, Spearman p: 7.4725e-36, Pearson r: 0.5031, Pearson p: 1.0781e-39
  Pred range: [0.0296, 0.6589], std: 0.0983
  RMSE : 0.1529, R2: 0.2199, MAE: 0.1237, Spearman rho: 0.4893, Spearman p: 2.4907e-37, Pearson r: 0.5092, Pearson p: 9.2093e-41
  Pred range: [0.0297, 0.7018], std: 0.1023
  RMSE : 0.1578, R2: 0.1686, MAE: 0.1297, Spearman rho: 0.4899, Spearman p: 2.0418e-37, Pearson r: 0.5105, Pearson p: 5.3347e-41
  Pred range: [0.0519, 0.6645], std: 0.0938
  RMSE : 0.1566, R2: 0.1810, MAE: 0.1290, Spearman rho: 0.4857, Spearman p: 1.0114e-36, Pearson r: 0.5067, Pearson p: 2.5350e-40
[I 2026-04-27 19:08:36,203] Trial 31 finished with value: 0.14835994978477499 and parameters: {'learning_rate': 0.0008177834437084604, 'batch_size': 6, 'num_epochs': 28, 'weight_decay': 5.1428592909155356e-05, 'layers_PRS': 3, 'layers_SCZ15': 3, 'layers_ADHD9': 3, 'layers_ASD9': 4, 'layers_ACE15': 5, 'layers_ACE18': 7, 'layers_SUD18': 2, 'layers_SES': 4, 'layers_SEX': 1, 'dropout': 0.17010785061133354, 'se_reduction': 4, 'hidden_dim_min': 4, 'base_loss': 'huber', 'huber_delta': 0.0954141415887391, 'focal_gamma': 2.26306214808341, 'n_bins': 15, 'scheduler_patience': 4, 'scheduler_factor': 0.5460089991775618, 'early_stopping_patience': 8}. Best is trial 31 with value: 0.14835994978477499.
Train: 2407 rows (1613 IDs),Test: 598 rows (404 IDs) 

n_features_x : 6, n_features_per_modality: [16, 23, 19, 17, 7, 4, 4, 4, 1, 4]

--- ImbalancedRegressionLoss initialized ---
  Bins: 15, Focal gamma: 2.4488026039963775, Base loss: huber
  Bin [0.00, 0.07): count=  383, weight=0.040
  Bin [0.07, 0.13): count=  377, weight=0.041
  Bin [0.13, 0.20): count=  405, weight=0.038
  Bin [0.20, 0.27): count=  295, weight=0.052
  Bin [0.27, 0.33): count=  349, weight=0.044
  Bin [0.33, 0.40): count=  162, weight=0.094
  Bin [0.40, 0.47): count=  134, weight=0.114
  Bin [0.47, 0.53): count=  108, weight=0.141
  Bin [0.53, 0.60): count=   78, weight=0.194
  Bin [0.60, 0.67): count=   47, weight=0.320
  Bin [0.67, 0.73): count=   41, weight=0.365
  Bin [0.73, 0.80): count=   19, weight=0.767
  Bin [0.80, 0.87): count=    5, weight=2.558
  Bin [0.87, 0.93): count=    2, weight=5.116
  Bin [0.93, 1.00): count=    2, weight=5.116
-------------------------------------------

  Pred range: [0.0925, 0.5308], std: 0.0797
  RMSE : 0.1514, R2: 0.2353, MAE: 0.1191, Spearman rho: 0.4769, Spearman p: 2.7479e-35, Pearson r: 0.4898, Pearson p: 2.0607e-37
  Pred range: [0.0798, 0.6394], std: 0.0990
  RMSE : 0.1532, R2: 0.2161, MAE: 0.1237, Spearman rho: 0.4861, Spearman p: 8.8134e-37, Pearson r: 0.5066, Pearson p: 2.6532e-40
  Pred range: [0.0745, 0.7105], std: 0.1126
  RMSE : 0.1754, R2: -0.0274, MAE: 0.1461, Spearman rho: 0.4882, Spearman p: 3.8109e-37, Pearson r: 0.5014, Pearson p: 2.1915e-39
  Pred range: [0.0762, 0.6777], std: 0.0953
  RMSE : 0.1674, R2: 0.0651, MAE: 0.1402, Spearman rho: 0.4833, Spearman p: 2.4821e-36, Pearson r: 0.4996, Pearson p: 4.5224e-39
  Pred range: [0.0431, 0.6130], std: 0.0943
  RMSE : 0.1589, R2: 0.1575, MAE: 0.1306, Spearman rho: 0.4804, Spearman p: 7.4607e-36, Pearson r: 0.5002, Pearson p: 3.5102e-39
  Pred range: [0.0407, 0.6554], std: 0.1040
  RMSE : 0.1550, R2: 0.1984, MAE: 0.1261, Spearman rho: 0.4868, Spearman p: 6.5555e-37, Pearson r: 0.5135, Pearson p: 1.5274e-41
  Pred range: [-0.0186, 0.5969], std: 0.0934
  RMSE : 0.1501, R2: 0.2478, MAE: 0.1197, Spearman rho: 0.4854, Spearman p: 1.1363e-36, Pearson r: 0.5092, Pearson p: 8.9983e-41
  Pred range: [-0.0044, 0.6337], std: 0.0963
  RMSE : 0.1601, R2: 0.1448, MAE: 0.1327, Spearman rho: 0.4928, Spearman p: 6.6530e-38, Pearson r: 0.5138, Pearson p: 1.3831e-41
  Pred range: [-0.0036, 0.6293], std: 0.0978
  RMSE : 0.1499, R2: 0.2501, MAE: 0.1180, Spearman rho: 0.4783, Spearman p: 1.6467e-35, Pearson r: 0.5055, Pearson p: 4.2350e-40
  Pred range: [0.0022, 0.6643], std: 0.1036
  RMSE : 0.1649, R2: 0.0920, MAE: 0.1373, Spearman rho: 0.4876, Spearman p: 4.9478e-37, Pearson r: 0.5078, Pearson p: 1.6190e-40
  Pred range: [0.0132, 0.7365], std: 0.1063
  RMSE : 0.1728, R2: 0.0036, MAE: 0.1446, Spearman rho: 0.4841, Spearman p: 1.8644e-36, Pearson r: 0.5097, Pearson p: 7.3904e-41
  Pred range: [-0.0352, 0.7088], std: 0.1008
  RMSE : 0.1534, R2: 0.2142, MAE: 0.1241, Spearman rho: 0.4789, Spearman p: 1.3162e-35, Pearson r: 0.5076, Pearson p: 1.7680e-40
  Pred range: [0.0419, 0.7412], std: 0.1053
  RMSE : 0.1739, R2: -0.0096, MAE: 0.1462, Spearman rho: 0.4878, Spearman p: 4.4578e-37, Pearson r: 0.5108, Pearson p: 4.7896e-41
  Pred range: [-0.0082, 0.7054], std: 0.1045
  RMSE : 0.1608, R2: 0.1365, MAE: 0.1318, Spearman rho: 0.4851, Spearman p: 1.2525e-36, Pearson r: 0.5037, Pearson p: 8.4964e-40
  Pred range: [0.0346, 0.7462], std: 0.1044
  RMSE : 0.1692, R2: 0.0445, MAE: 0.1409, Spearman rho: 0.4811, Spearman p: 5.6557e-36, Pearson r: 0.5045, Pearson p: 6.2731e-40
  Pred range: [-0.0012, 0.7522], std: 0.1079
  RMSE : 0.1637, R2: 0.1056, MAE: 0.1348, Spearman rho: 0.4852, Spearman p: 1.1975e-36, Pearson r: 0.5110, Pearson p: 4.3897e-41
  Pred range: [-0.0691, 0.6107], std: 0.0916
  RMSE : 0.1509, R2: 0.2401, MAE: 0.1161, Spearman rho: 0.4672, Spearman p: 9.4804e-34, Pearson r: 0.4953, Pearson p: 2.4423e-38
[I 2026-04-27 19:10:43,065] Trial 32 finished with value: 0.14988954470788063 and parameters: {'learning_rate': 0.0022369208844574304, 'batch_size': 6, 'num_epochs': 29, 'weight_decay': 4.352525064169281e-05, 'layers_PRS': 3, 'layers_SCZ15': 4, 'layers_ADHD9': 2, 'layers_ASD9': 5, 'layers_ACE15': 5, 'layers_ACE18': 7, 'layers_SUD18': 2, 'layers_SES': 5, 'layers_SEX': 2, 'dropout': 0.1317715766723, 'se_reduction': 3, 'hidden_dim_min': 3, 'base_loss': 'huber', 'huber_delta': 0.09895704732599689, 'focal_gamma': 2.4488026039963775, 'n_bins': 15, 'scheduler_patience': 4, 'scheduler_factor': 0.6009339971279153, 'early_stopping_patience': 8}. Best is trial 31 with value: 0.14835994978477499.
Train: 2407 rows (1613 IDs),Test: 598 rows (404 IDs) 

n_features_x : 6, n_features_per_modality: [16, 23, 19, 17, 7, 4, 4, 4, 1, 4]

--- ImbalancedRegressionLoss initialized ---
  Bins: 15, Focal gamma: 2.5386597168033793, Base loss: huber
  Bin [0.00, 0.07): count=  383, weight=0.040
  Bin [0.07, 0.13): count=  377, weight=0.041
  Bin [0.13, 0.20): count=  405, weight=0.038
  Bin [0.20, 0.27): count=  295, weight=0.052
  Bin [0.27, 0.33): count=  349, weight=0.044
  Bin [0.33, 0.40): count=  162, weight=0.094
  Bin [0.40, 0.47): count=  134, weight=0.114
  Bin [0.47, 0.53): count=  108, weight=0.141
  Bin [0.53, 0.60): count=   78, weight=0.194
  Bin [0.60, 0.67): count=   47, weight=0.320
  Bin [0.67, 0.73): count=   41, weight=0.365
  Bin [0.73, 0.80): count=   19, weight=0.767
  Bin [0.80, 0.87): count=    5, weight=2.558
  Bin [0.87, 0.93): count=    2, weight=5.116
  Bin [0.93, 1.00): count=    2, weight=5.116
-------------------------------------------

  Pred range: [0.1170, 0.6775], std: 0.0962
  RMSE : 0.1630, R2: 0.1136, MAE: 0.1350, Spearman rho: 0.4736, Spearman p: 9.3792e-35, Pearson r: 0.4736, Pearson p: 9.1453e-35
  Pred range: [0.1370, 0.6155], std: 0.0844
  RMSE : 0.1613, R2: 0.1317, MAE: 0.1347, Spearman rho: 0.4863, Spearman p: 7.8732e-37, Pearson r: 0.4869, Pearson p: 6.3686e-37
  Pred range: [0.0178, 0.6067], std: 0.0915
  RMSE : 0.1508, R2: 0.2410, MAE: 0.1168, Spearman rho: 0.4845, Spearman p: 1.5702e-36, Pearson r: 0.4924, Pearson p: 7.7249e-38
  Pred range: [0.0508, 0.6328], std: 0.0909
  RMSE : 0.1557, R2: 0.1905, MAE: 0.1281, Spearman rho: 0.4976, Spearman p: 9.9343e-39, Pearson r: 0.5082, Pearson p: 1.4035e-40
  Pred range: [0.0793, 0.6603], std: 0.0950
  RMSE : 0.1571, R2: 0.1764, MAE: 0.1298, Spearman rho: 0.4996, Spearman p: 4.4960e-39, Pearson r: 0.5124, Pearson p: 2.4517e-41
  Pred range: [0.0711, 0.6709], std: 0.0967
  RMSE : 0.1569, R2: 0.1780, MAE: 0.1293, Spearman rho: 0.4940, Spearman p: 4.0422e-38, Pearson r: 0.5086, Pearson p: 1.1621e-40
  Pred range: [0.0196, 0.6594], std: 0.1017
  RMSE : 0.1508, R2: 0.2410, MAE: 0.1207, Spearman rho: 0.4903, Spearman p: 1.7526e-37, Pearson r: 0.5125, Pearson p: 2.3416e-41
  Pred range: [0.0853, 0.6406], std: 0.0905
  RMSE : 0.1543, R2: 0.2052, MAE: 0.1262, Spearman rho: 0.4833, Spearman p: 2.5482e-36, Pearson r: 0.5053, Pearson p: 4.5270e-40
  Pred range: [0.0257, 0.6481], std: 0.0925
  RMSE : 0.1533, R2: 0.2151, MAE: 0.1250, Spearman rho: 0.4876, Spearman p: 4.8581e-37, Pearson r: 0.5064, Pearson p: 2.8335e-40
  Pred range: [0.0293, 0.6806], std: 0.0953
  RMSE : 0.1566, R2: 0.1810, MAE: 0.1293, Spearman rho: 0.4890, Spearman p: 2.8750e-37, Pearson r: 0.5095, Pearson p: 8.1494e-41
  Pred range: [0.0632, 0.7088], std: 0.0981
  RMSE : 0.1614, R2: 0.1301, MAE: 0.1348, Spearman rho: 0.4904, Spearman p: 1.6838e-37, Pearson r: 0.5124, Pearson p: 2.4755e-41
  Pred range: [0.0195, 0.7041], std: 0.0982
  RMSE : 0.1584, R2: 0.1623, MAE: 0.1309, Spearman rho: 0.4848, Spearman p: 1.4326e-36, Pearson r: 0.5055, Pearson p: 4.1124e-40
  Pred range: [0.0343, 0.7219], std: 0.1070
  RMSE : 0.1579, R2: 0.1674, MAE: 0.1291, Spearman rho: 0.4913, Spearman p: 1.1499e-37, Pearson r: 0.5129, Pearson p: 1.9957e-41
  Pred range: [0.0080, 0.6942], std: 0.1013
  RMSE : 0.1546, R2: 0.2022, MAE: 0.1254, Spearman rho: 0.4878, Spearman p: 4.5192e-37, Pearson r: 0.5098, Pearson p: 7.1447e-41
  Pred range: [0.0370, 0.7078], std: 0.1027
  RMSE : 0.1602, R2: 0.1435, MAE: 0.1319, Spearman rho: 0.4895, Spearman p: 2.3925e-37, Pearson r: 0.5093, Pearson p: 8.6662e-41
[I 2026-04-27 19:12:30,827] Trial 33 finished with value: 0.15078982714237832 and parameters: {'learning_rate': 0.000898306818216568, 'batch_size': 6, 'num_epochs': 29, 'weight_decay': 4.199961153559452e-05, 'layers_PRS': 3, 'layers_SCZ15': 4, 'layers_ADHD9': 2, 'layers_ASD9': 6, 'layers_ACE15': 4, 'layers_ACE18': 7, 'layers_SUD18': 1, 'layers_SES': 5, 'layers_SEX': 1, 'dropout': 0.12626061714937037, 'se_reduction': 3, 'hidden_dim_min': 3, 'base_loss': 'huber', 'huber_delta': 0.09710333569380124, 'focal_gamma': 2.5386597168033793, 'n_bins': 15, 'scheduler_patience': 4, 'scheduler_factor': 0.593943656720411, 'early_stopping_patience': 8}. Best is trial 31 with value: 0.14835994978477499.
Train: 2407 rows (1613 IDs),Test: 598 rows (404 IDs) 

n_features_x : 6, n_features_per_modality: [16, 23, 19, 17, 7, 4, 4, 4, 1, 4]

--- ImbalancedRegressionLoss initialized ---
  Bins: 13, Focal gamma: 2.5284879215794627, Base loss: huber
  Bin [0.00, 0.08): count=  383, weight=0.049
  Bin [0.08, 0.15): count=  578, weight=0.032
  Bin [0.15, 0.23): count=  370, weight=0.051
  Bin [0.23, 0.31): count=  368, weight=0.051
  Bin [0.31, 0.38): count=  199, weight=0.094
  Bin [0.38, 0.46): count=  207, weight=0.090
  Bin [0.46, 0.54): count=  108, weight=0.172
  Bin [0.54, 0.62): count=  106, weight=0.176
  Bin [0.62, 0.69): count=   36, weight=0.508
  Bin [0.69, 0.77): count=   36, weight=0.508
  Bin [0.77, 0.85): count=    9, weight=1.878
  Bin [0.85, 0.92): count=    5, weight=3.130
  Bin [0.92, 1.00): count=    2, weight=6.261
-------------------------------------------

  Pred range: [0.1575, 0.6672], std: 0.0864
  RMSE : 0.1744, R2: -0.0154, MAE: 0.1481, Spearman rho: 0.4624, Spearman p: 5.1432e-33, Pearson r: 0.4736, Pearson p: 9.1597e-35
  Pred range: [0.1321, 0.7358], std: 0.0950
  RMSE : 0.1810, R2: -0.0933, MAE: 0.1540, Spearman rho: 0.4704, Spearman p: 2.9404e-34, Pearson r: 0.4944, Pearson p: 3.4754e-38
  Pred range: [0.0506, 0.7053], std: 0.1025
  RMSE : 0.1692, R2: 0.0447, MAE: 0.1413, Spearman rho: 0.4814, Spearman p: 5.1514e-36, Pearson r: 0.5090, Pearson p: 1.0013e-40
  Pred range: [0.1296, 0.7412], std: 0.1011
  RMSE : 0.1852, R2: -0.1446, MAE: 0.1570, Spearman rho: 0.4533, Spearman p: 1.2077e-31, Pearson r: 0.4803, Pearson p: 7.8641e-36
  Pred range: [0.0925, 0.7859], std: 0.1193
  RMSE : 0.1900, R2: -0.2049, MAE: 0.1591, Spearman rho: 0.4720, Spearman p: 1.6757e-34, Pearson r: 0.5038, Pearson p: 8.1746e-40
  Pred range: [-0.0078, 0.8005], std: 0.1137
  RMSE : 0.1942, R2: -0.2589, MAE: 0.1644, Spearman rho: 0.4515, Spearman p: 2.2520e-31, Pearson r: 0.4799, Pearson p: 9.0647e-36
[I 2026-04-27 19:12:40,960] Trial 34 pruned. 
Train: 2407 rows (1613 IDs),Test: 598 rows (404 IDs) 

n_features_x : 6, n_features_per_modality: [16, 23, 19, 17, 7, 4, 4, 4, 1, 4]

--- ImbalancedRegressionLoss initialized ---
  Bins: 15, Focal gamma: 2.90162346046622, Base loss: huber
  Bin [0.00, 0.07): count=  383, weight=0.040
  Bin [0.07, 0.13): count=  377, weight=0.041
  Bin [0.13, 0.20): count=  405, weight=0.038
  Bin [0.20, 0.27): count=  295, weight=0.052
  Bin [0.27, 0.33): count=  349, weight=0.044
  Bin [0.33, 0.40): count=  162, weight=0.094
  Bin [0.40, 0.47): count=  134, weight=0.114
  Bin [0.47, 0.53): count=  108, weight=0.141
  Bin [0.53, 0.60): count=   78, weight=0.194
  Bin [0.60, 0.67): count=   47, weight=0.320
  Bin [0.67, 0.73): count=   41, weight=0.365
  Bin [0.73, 0.80): count=   19, weight=0.767
  Bin [0.80, 0.87): count=    5, weight=2.558
  Bin [0.87, 0.93): count=    2, weight=5.116
  Bin [0.93, 1.00): count=    2, weight=5.116
-------------------------------------------

  Pred range: [0.1677, 0.8165], std: 0.1040
  RMSE : 0.1912, R2: -0.2206, MAE: 0.1624, Spearman rho: 0.4433, Spearman p: 3.5205e-30, Pearson r: 0.4629, Pearson p: 4.4037e-33
  Pred range: [0.0922, 0.5395], std: 0.0743
  RMSE : 0.1554, R2: 0.1939, MAE: 0.1285, Spearman rho: 0.4773, Spearman p: 2.3758e-35, Pearson r: 0.5010, Pearson p: 2.5147e-39
  Pred range: [0.1299, 0.5947], std: 0.0811
  RMSE : 0.1582, R2: 0.1645, MAE: 0.1315, Spearman rho: 0.4751, Spearman p: 5.3772e-35, Pearson r: 0.5026, Pearson p: 1.3404e-39
  Pred range: [0.0040, 0.5627], std: 0.0843
  RMSE : 0.1497, R2: 0.2518, MAE: 0.1200, Spearman rho: 0.4808, Spearman p: 6.5000e-36, Pearson r: 0.5109, Pearson p: 4.4811e-41
  Pred range: [0.0187, 0.6175], std: 0.0913
  RMSE : 0.1583, R2: 0.1637, MAE: 0.1314, Spearman rho: 0.4834, Spearman p: 2.4021e-36, Pearson r: 0.5102, Pearson p: 6.1147e-41
  Pred range: [0.1058, 0.6604], std: 0.0874
  RMSE : 0.1716, R2: 0.0166, MAE: 0.1460, Spearman rho: 0.4733, Spearman p: 1.0381e-34, Pearson r: 0.5043, Pearson p: 6.7292e-40
  Pred range: [0.0542, 0.6422], std: 0.0881
  RMSE : 0.1616, R2: 0.1289, MAE: 0.1356, Spearman rho: 0.4729, Spearman p: 1.2033e-34, Pearson r: 0.5055, Pearson p: 4.1268e-40
  Pred range: [0.0297, 0.7125], std: 0.0946
  RMSE : 0.1644, R2: 0.0978, MAE: 0.1373, Spearman rho: 0.4620, Spearman p: 5.9405e-33, Pearson r: 0.4914, Pearson p: 1.1382e-37
  Pred range: [0.0628, 0.7103], std: 0.0959
  RMSE : 0.1633, R2: 0.1098, MAE: 0.1366, Spearman rho: 0.4741, Spearman p: 7.7497e-35, Pearson r: 0.5082, Pearson p: 1.3839e-40
  Pred range: [0.0656, 0.7238], std: 0.0960
  RMSE : 0.1633, R2: 0.1103, MAE: 0.1366, Spearman rho: 0.4738, Spearman p: 8.5294e-35, Pearson r: 0.5136, Pearson p: 1.5014e-41
  Pred range: [0.0391, 0.7091], std: 0.0976
  RMSE : 0.1594, R2: 0.1518, MAE: 0.1322, Spearman rho: 0.4728, Spearman p: 1.2600e-34, Pearson r: 0.5124, Pearson p: 2.3867e-41
  Pred range: [0.0452, 0.7447], std: 0.1009
  RMSE : 0.1688, R2: 0.0490, MAE: 0.1417, Spearman rho: 0.4777, Spearman p: 2.0469e-35, Pearson r: 0.5118, Pearson p: 3.1302e-41
