[I 2026-04-27 18:30:09,655] Trial 5 finished with value: 0.15751239904727854 and parameters: {'learning_rate': 0.00036408891602579877, 'batch_size': 8, 'num_epochs': 24, 'weight_decay': 0.002523117337178114, 'layers_PRS': 5, 'layers_SCZ15': 3, 'layers_ADHD9': 3, 'layers_ASD9': 5, 'layers_ACE15': 7, 'layers_ACE18': 3, 'layers_SUD18': 1, 'layers_SES': 4, 'layers_SEX': 4, 'dropout': 0.20228615829286745, 'se_reduction': 2, 'hidden_dim_min': 10, 'base_loss': 'mse', 'huber_delta': 0.178338332023309, 'focal_gamma': 2.150412740437883, 'n_bins': 9, 'scheduler_patience': 3, 'scheduler_factor': 0.6376572979741372, 'early_stopping_patience': 8}. Best is trial 0 with value: 0.1533309179634956.
Train: 2407 rows (1613 IDs),Test: 598 rows (404 IDs) 

n_features_x : 6, n_features_per_modality: [16, 23, 19, 17, 7, 4, 4, 4, 1, 4]

--- ImbalancedRegressionLoss initialized ---
  Bins: 16, Focal gamma: 0.6209159508948687, Base loss: huber
  Bin [0.00, 0.06): count=  383, weight=0.041
  Bin [0.06, 0.12): count=  377, weight=0.042
  Bin [0.12, 0.19): count=  405, weight=0.039
  Bin [0.19, 0.25): count=  295, weight=0.053
  Bin [0.25, 0.31): count=  239, weight=0.066
  Bin [0.31, 0.38): count=  199, weight=0.079
  Bin [0.38, 0.44): count=  142, weight=0.111
  Bin [0.44, 0.50): count=  122, weight=0.129
  Bin [0.50, 0.56): count=   93, weight=0.168
  Bin [0.56, 0.62): count=   64, weight=0.243
  Bin [0.62, 0.69): count=   36, weight=0.427
  Bin [0.69, 0.75): count=   24, weight=0.633
  Bin [0.75, 0.81): count=   19, weight=0.791
  Bin [0.81, 0.88): count=    5, weight=2.636
  Bin [0.88, 0.94): count=    2, weight=5.271
  Bin [0.94, 1.00): count=    2, weight=5.271
-------------------------------------------

  Pred range: [0.0435, 0.6011], std: 0.0862
  RMSE : 0.1602, R2: 0.1439, MAE: 0.1299, Spearman rho: 0.4401, Spearman p: 1.0097e-29, Pearson r: 0.4499, Pearson p: 3.8618e-31
  Pred range: [0.0650, 0.6268], std: 0.0969
  RMSE : 0.1659, R2: 0.0817, MAE: 0.1374, Spearman rho: 0.4634, Spearman p: 3.6068e-33, Pearson r: 0.4755, Pearson p: 4.6674e-35
  Pred range: [0.0587, 0.6355], std: 0.0983
  RMSE : 0.1612, R2: 0.1325, MAE: 0.1327, Spearman rho: 0.4765, Spearman p: 3.1232e-35, Pearson r: 0.4898, Pearson p: 2.1179e-37
  Pred range: [0.0583, 0.6392], std: 0.1018
  RMSE : 0.1582, R2: 0.1649, MAE: 0.1294, Spearman rho: 0.4836, Spearman p: 2.2500e-36, Pearson r: 0.4987, Pearson p: 6.3490e-39
  Pred range: [0.0742, 0.6788], std: 0.1061
  RMSE : 0.1669, R2: 0.0698, MAE: 0.1389, Spearman rho: 0.4869, Spearman p: 6.4030e-37, Pearson r: 0.5034, Pearson p: 9.9265e-40
  Pred range: [0.0701, 0.6597], std: 0.1048
  RMSE : 0.1608, R2: 0.1371, MAE: 0.1327, Spearman rho: 0.4900, Spearman p: 1.9541e-37, Pearson r: 0.5078, Pearson p: 1.6250e-40
  Pred range: [0.0606, 0.6884], std: 0.1089
  RMSE : 0.1626, R2: 0.1170, MAE: 0.1342, Spearman rho: 0.4918, Spearman p: 9.8316e-38, Pearson r: 0.5100, Pearson p: 6.6573e-41
  Pred range: [0.0546, 0.6135], std: 0.1008
  RMSE : 0.1547, R2: 0.2007, MAE: 0.1260, Spearman rho: 0.4918, Spearman p: 9.5494e-38, Pearson r: 0.5083, Pearson p: 1.3123e-40
  Pred range: [0.0652, 0.6722], std: 0.1055
  RMSE : 0.1637, R2: 0.1058, MAE: 0.1358, Spearman rho: 0.4908, Spearman p: 1.4339e-37, Pearson r: 0.5084, Pearson p: 1.2516e-40
  Pred range: [0.0756, 0.7187], std: 0.1128
  RMSE : 0.1733, R2: -0.0030, MAE: 0.1448, Spearman rho: 0.4901, Spearman p: 1.8789e-37, Pearson r: 0.5089, Pearson p: 1.0478e-40
  Pred range: [0.0438, 0.6589], std: 0.1061
  RMSE : 0.1602, R2: 0.1431, MAE: 0.1321, Spearman rho: 0.4869, Spearman p: 6.4224e-37, Pearson r: 0.5063, Pearson p: 3.0366e-40
  Pred range: [0.0162, 0.6252], std: 0.1051
  RMSE : 0.1535, R2: 0.2130, MAE: 0.1240, Spearman rho: 0.4869, Spearman p: 6.4638e-37, Pearson r: 0.5054, Pearson p: 4.3990e-40
  Pred range: [0.0187, 0.6057], std: 0.1024
  RMSE : 0.1523, R2: 0.2257, MAE: 0.1224, Spearman rho: 0.4881, Spearman p: 4.0044e-37, Pearson r: 0.5051, Pearson p: 4.8399e-40
  Pred range: [0.0276, 0.5962], std: 0.1030
  RMSE : 0.1528, R2: 0.2209, MAE: 0.1231, Spearman rho: 0.4873, Spearman p: 5.3869e-37, Pearson r: 0.5052, Pearson p: 4.6038e-40
  Pred range: [0.0205, 0.6020], std: 0.1031
  RMSE : 0.1527, R2: 0.2214, MAE: 0.1228, Spearman rho: 0.4848, Spearman p: 1.3950e-36, Pearson r: 0.5030, Pearson p: 1.1326e-39
  Pred range: [0.0234, 0.5826], std: 0.0999
  RMSE : 0.1525, R2: 0.2242, MAE: 0.1221, Spearman rho: 0.4815, Spearman p: 4.9983e-36, Pearson r: 0.4975, Pearson p: 1.0110e-38
  Pred range: [0.0341, 0.6313], std: 0.1067
  RMSE : 0.1565, R2: 0.1821, MAE: 0.1275, Spearman rho: 0.4858, Spearman p: 9.8827e-37, Pearson r: 0.5028, Pearson p: 1.2554e-39
  Pred range: [0.0533, 0.6709], std: 0.1091
  RMSE : 0.1657, R2: 0.0832, MAE: 0.1374, Spearman rho: 0.4836, Spearman p: 2.2142e-36, Pearson r: 0.5017, Pearson p: 1.9452e-39
  Pred range: [0.0315, 0.6402], std: 0.1081
  RMSE : 0.1580, R2: 0.1670, MAE: 0.1289, Spearman rho: 0.4852, Spearman p: 1.2153e-36, Pearson r: 0.5016, Pearson p: 1.9742e-39
  Pred range: [0.0356, 0.6371], std: 0.1088
  RMSE : 0.1591, R2: 0.1552, MAE: 0.1302, Spearman rho: 0.4856, Spearman p: 1.0540e-36, Pearson r: 0.5019, Pearson p: 1.7830e-39
[I 2026-04-27 18:32:12,625] Trial 6 finished with value: 0.1523022778622016 and parameters: {'learning_rate': 0.0004180079233083432, 'batch_size': 6, 'num_epochs': 23, 'weight_decay': 8.843802925605919e-05, 'layers_PRS': 2, 'layers_SCZ15': 1, 'layers_ADHD9': 5, 'layers_ASD9': 5, 'layers_ACE15': 3, 'layers_ACE18': 5, 'layers_SUD18': 2, 'layers_SES': 3, 'layers_SEX': 4, 'dropout': 0.1557756953102156, 'se_reduction': 8, 'hidden_dim_min': 2, 'base_loss': 'huber', 'huber_delta': 0.02270124267236906, 'focal_gamma': 0.6209159508948687, 'n_bins': 16, 'scheduler_patience': 3, 'scheduler_factor': 0.5577773594829698, 'early_stopping_patience': 7}. Best is trial 6 with value: 0.1523022778622016.
Train: 2407 rows (1613 IDs),Test: 598 rows (404 IDs) 

n_features_x : 6, n_features_per_modality: [16, 23, 19, 17, 7, 4, 4, 4, 1, 4]

--- ImbalancedRegressionLoss initialized ---
  Bins: 11, Focal gamma: 0.7029414707103807, Base loss: mse
  Bin [0.00, 0.09): count=  585, weight=0.034
  Bin [0.09, 0.18): count=  580, weight=0.034
  Bin [0.18, 0.27): count=  421, weight=0.047
  Bin [0.27, 0.36): count=  312, weight=0.064
  Bin [0.36, 0.45): count=  207, weight=0.096
  Bin [0.45, 0.55): count=  108, weight=0.183
  Bin [0.55, 0.64): count=  125, weight=0.159
  Bin [0.64, 0.73): count=   41, weight=0.476
  Bin [0.73, 0.82): count=   21, weight=0.909
  Bin [0.82, 0.91): count=    4, weight=3.999
  Bin [0.91, 1.00): count=    3, weight=4.998
-------------------------------------------

  Pred range: [0.0893, 0.5838], std: 0.0743
  RMSE : 0.1705, R2: 0.0293, MAE: 0.1431, Spearman rho: 0.4239, Spearman p: 1.7900e-27, Pearson r: 0.4288, Pearson p: 3.7729e-28
  Pred range: [0.0949, 0.5955], std: 0.0825
  RMSE : 0.1663, R2: 0.0768, MAE: 0.1396, Spearman rho: 0.4641, Spearman p: 2.8425e-33, Pearson r: 0.4763, Pearson p: 3.4036e-35
  Pred range: [0.0953, 0.5876], std: 0.0833
  RMSE : 0.1575, R2: 0.1722, MAE: 0.1301, Spearman rho: 0.4864, Spearman p: 7.6101e-37, Pearson r: 0.5007, Pearson p: 2.8988e-39
  Pred range: [0.1107, 0.6354], std: 0.0871
  RMSE : 0.1663, R2: 0.0767, MAE: 0.1403, Spearman rho: 0.4882, Spearman p: 3.9490e-37, Pearson r: 0.5070, Pearson p: 2.2570e-40
  Pred range: [0.1102, 0.6365], std: 0.0883
  RMSE : 0.1616, R2: 0.1280, MAE: 0.1352, Spearman rho: 0.4966, Spearman p: 1.4872e-38, Pearson r: 0.5155, Pearson p: 6.5188e-42
  Pred range: [0.1103, 0.6353], std: 0.0890
  RMSE : 0.1571, R2: 0.1759, MAE: 0.1303, Spearman rho: 0.5011, Spearman p: 2.4474e-39, Pearson r: 0.5213, Pearson p: 5.6332e-43
  Pred range: [0.1062, 0.6187], std: 0.0891
  RMSE : 0.1526, R2: 0.2229, MAE: 0.1249, Spearman rho: 0.5062, Spearman p: 3.1109e-40, Pearson r: 0.5268, Pearson p: 5.0447e-44
  Pred range: [0.1274, 0.6850], std: 0.0939
  RMSE : 0.1667, R2: 0.0722, MAE: 0.1407, Spearman rho: 0.5043, Spearman p: 6.6328e-40, Pearson r: 0.5261, Pearson p: 7.0065e-44
  Pred range: [0.1061, 0.6108], std: 0.0861
  RMSE : 0.1511, R2: 0.2382, MAE: 0.1231, Spearman rho: 0.5062, Spearman p: 3.1173e-40, Pearson r: 0.5289, Pearson p: 2.2421e-44
  Pred range: [0.1174, 0.6647], std: 0.0933
  RMSE : 0.1579, R2: 0.1674, MAE: 0.1314, Spearman rho: 0.5068, Spearman p: 2.4224e-40, Pearson r: 0.5292, Pearson p: 1.6816e-44
  Pred range: [0.1183, 0.6478], std: 0.0912
  RMSE : 0.1574, R2: 0.1731, MAE: 0.1310, Spearman rho: 0.5049, Spearman p: 5.3784e-40, Pearson r: 0.5297, Pearson p: 1.4013e-44
  Pred range: [0.1179, 0.6550], std: 0.0922
  RMSE : 0.1570, R2: 0.1773, MAE: 0.1303, Spearman rho: 0.5026, Spearman p: 1.3312e-39, Pearson r: 0.5285, Pearson p: 2.5223e-44
  Pred range: [0.1289, 0.6936], std: 0.0954
  RMSE : 0.1649, R2: 0.0927, MAE: 0.1387, Spearman rho: 0.5021, Spearman p: 1.6234e-39, Pearson r: 0.5272, Pearson p: 4.4842e-44
[I 2026-04-27 18:34:20,202] Trial 7 finished with value: 0.151067979482815 and parameters: {'learning_rate': 0.00014225533444471803, 'batch_size': 4, 'num_epochs': 25, 'weight_decay': 0.00011270299638688537, 'layers_PRS': 1, 'layers_SCZ15': 2, 'layers_ADHD9': 5, 'layers_ASD9': 6, 'layers_ACE15': 6, 'layers_ACE18': 3, 'layers_SUD18': 4, 'layers_SES': 3, 'layers_SEX': 4, 'dropout': 0.2174813099809203, 'se_reduction': 7, 'hidden_dim_min': 9, 'base_loss': 'mse', 'huber_delta': 0.05998967151057687, 'focal_gamma': 0.7029414707103807, 'n_bins': 11, 'scheduler_patience': 5, 'scheduler_factor': 0.42256120676234166, 'early_stopping_patience': 4}. Best is trial 7 with value: 0.151067979482815.
Train: 2407 rows (1613 IDs),Test: 598 rows (404 IDs) 

n_features_x : 6, n_features_per_modality: [16, 23, 19, 17, 7, 4, 4, 4, 1, 4]

--- ImbalancedRegressionLoss initialized ---
  Bins: 19, Focal gamma: 0.619887061578649, Base loss: huber
  Bin [0.00, 0.05): count=  172, weight=0.055
  Bin [0.05, 0.11): count=  413, weight=0.023
  Bin [0.11, 0.16): count=  376, weight=0.025
  Bin [0.16, 0.21): count=  204, weight=0.046
  Bin [0.21, 0.26): count=  295, weight=0.032
  Bin [0.26, 0.32): count=  239, weight=0.039
  Bin [0.32, 0.37): count=  199, weight=0.047
  Bin [0.37, 0.42): count=   73, weight=0.128
  Bin [0.42, 0.47): count=  134, weight=0.070
  Bin [0.47, 0.53): count=  108, weight=0.087
  Bin [0.53, 0.58): count=   78, weight=0.120
  Bin [0.58, 0.63): count=   28, weight=0.327
  Bin [0.63, 0.68): count=   36, weight=0.256
  Bin [0.68, 0.74): count=   24, weight=0.379
  Bin [0.74, 0.79): count=   19, weight=0.474
  Bin [0.79, 0.84): count=    2, weight=3.157
  Bin [0.84, 0.89): count=    4, weight=1.894
  Bin [0.89, 0.95): count=    3, weight=2.368
  Bin [0.95, 1.00): count=    0, weight=9.472
-------------------------------------------

  Pred range: [0.1003, 0.6569], std: 0.0997
  RMSE : 0.1577, R2: 0.1697, MAE: 0.1303, Spearman rho: 0.5040, Spearman p: 7.6320e-40, Pearson r: 0.5177, Pearson p: 2.6204e-42
  Pred range: [0.0789, 0.5630], std: 0.0880
  RMSE : 0.1575, R2: 0.1718, MAE: 0.1307, Spearman rho: 0.4991, Spearman p: 5.4283e-39, Pearson r: 0.5139, Pearson p: 1.3127e-41
  Pred range: [0.0768, 0.5860], std: 0.0931
  RMSE : 0.1525, R2: 0.2236, MAE: 0.1245, Spearman rho: 0.4946, Spearman p: 3.1700e-38, Pearson r: 0.5145, Pearson p: 1.0255e-41
  Pred range: [0.0632, 0.6171], std: 0.1060
  RMSE : 0.1552, R2: 0.1956, MAE: 0.1262, Spearman rho: 0.4984, Spearman p: 7.1452e-39, Pearson r: 0.5151, Pearson p: 7.9706e-42
  Pred range: [0.0972, 0.6958], std: 0.1097
  RMSE : 0.1728, R2: 0.0034, MAE: 0.1443, Spearman rho: 0.4826, Spearman p: 3.2474e-36, Pearson r: 0.5064, Pearson p: 2.8567e-40
  Pred range: [0.0707, 0.6932], std: 0.1142
  RMSE : 0.1601, R2: 0.1443, MAE: 0.1305, Spearman rho: 0.4959, Spearman p: 1.9278e-38, Pearson r: 0.5149, Pearson p: 8.5311e-42
  Pred range: [0.0757, 0.6750], std: 0.1122
  RMSE : 0.1578, R2: 0.1685, MAE: 0.1277, Spearman rho: 0.4809, Spearman p: 6.2842e-36, Pearson r: 0.5050, Pearson p: 5.0033e-40
  Pred range: [0.0280, 0.6052], std: 0.0978
  RMSE : 0.1501, R2: 0.2484, MAE: 0.1182, Spearman rho: 0.4783, Spearman p: 1.6088e-35, Pearson r: 0.5045, Pearson p: 6.2710e-40
  Pred range: [-0.0145, 0.7191], std: 0.1218
  RMSE : 0.1550, R2: 0.1985, MAE: 0.1229, Spearman rho: 0.4865, Spearman p: 7.3276e-37, Pearson r: 0.5084, Pearson p: 1.2555e-40
  Pred range: [0.0455, 0.6236], std: 0.1024
  RMSE : 0.1520, R2: 0.2291, MAE: 0.1215, Spearman rho: 0.4819, Spearman p: 4.2958e-36, Pearson r: 0.5040, Pearson p: 7.6708e-40
  Pred range: [0.0930, 0.6814], std: 0.1078
  RMSE : 0.1709, R2: 0.0256, MAE: 0.1419, Spearman rho: 0.4826, Spearman p: 3.2971e-36, Pearson r: 0.5028, Pearson p: 1.2356e-39
  Pred range: [-0.0471, 0.7141], std: 0.1202
  RMSE : 0.1554, R2: 0.1938, MAE: 0.1235, Spearman rho: 0.4835, Spearman p: 2.3526e-36, Pearson r: 0.5039, Pearson p: 8.0359e-40
  Pred range: [0.0500, 0.6524], std: 0.1170
  RMSE : 0.1540, R2: 0.2082, MAE: 0.1224, Spearman rho: 0.4834, Spearman p: 2.4507e-36, Pearson r: 0.5095, Pearson p: 8.0485e-41
  Pred range: [0.0048, 0.6623], std: 0.1083
  RMSE : 0.1557, R2: 0.1907, MAE: 0.1257, Spearman rho: 0.4812, Spearman p: 5.5638e-36, Pearson r: 0.5034, Pearson p: 9.5533e-40
  Pred range: [0.0180, 0.6937], std: 0.1165
  RMSE : 0.1621, R2: 0.1226, MAE: 0.1318, Spearman rho: 0.4840, Spearman p: 1.9318e-36, Pearson r: 0.5078, Pearson p: 1.6132e-40
[I 2026-04-27 18:36:22,405] Trial 8 finished with value: 0.15005696427010315 and parameters: {'learning_rate': 0.001616927129732411, 'batch_size': 6, 'num_epochs': 23, 'weight_decay': 0.00011031762560922959, 'layers_PRS': 7, 'layers_SCZ15': 5, 'layers_ADHD9': 4, 'layers_ASD9': 4, 'layers_ACE15': 5, 'layers_ACE18': 6, 'layers_SUD18': 3, 'layers_SES': 2, 'layers_SEX': 2, 'dropout': 0.22987567258731803, 'se_reduction': 6, 'hidden_dim_min': 5, 'base_loss': 'huber', 'huber_delta': 0.18774047205022604, 'focal_gamma': 0.619887061578649, 'n_bins': 19, 'scheduler_patience': 4, 'scheduler_factor': 0.6145591895974115, 'early_stopping_patience': 7}. Best is trial 8 with value: 0.15005696427010315.
Train: 2407 rows (1613 IDs),Test: 598 rows (404 IDs) 

n_features_x : 6, n_features_per_modality: [16, 23, 19, 17, 7, 4, 4, 4, 1, 4]

--- ImbalancedRegressionLoss initialized ---
  Bins: 10, Focal gamma: 1.0241692272707779, Base loss: mse
  Bin [0.00, 0.10): count=  585, weight=0.037
  Bin [0.10, 0.20): count=  580, weight=0.038
  Bin [0.20, 0.30): count=  421, weight=0.052
  Bin [0.30, 0.40): count=  385, weight=0.057
  Bin [0.40, 0.50): count=  191, weight=0.114
  Bin [0.50, 0.60): count=  129, weight=0.168
  Bin [0.60, 0.70): count=   74, weight=0.292
  Bin [0.70, 0.80): count=   33, weight=0.644
  Bin [0.80, 0.90): count=    6, weight=3.127
  Bin [0.90, 1.00): count=    3, weight=5.472
-------------------------------------------

  Pred range: [0.0158, 0.2545], std: 0.0318
  RMSE : 0.2182, R2: -0.5888, MAE: 0.1557, Spearman rho: 0.1158, Spearman p: 4.5795e-03, Pearson r: 0.0951, Pearson p: 2.0034e-02
  Pred range: [0.0896, 0.4865], std: 0.0525
  RMSE : 0.1702, R2: 0.0332, MAE: 0.1357, Spearman rho: 0.2276, Spearman p: 1.8252e-08, Pearson r: 0.2207, Pearson p: 4.9561e-08
  Pred range: [0.1074, 0.5686], std: 0.0605
  RMSE : 0.1787, R2: -0.0661, MAE: 0.1491, Spearman rho: 0.2639, Spearman p: 5.4785e-11, Pearson r: 0.2583, Pearson p: 1.4409e-10
  Pred range: [0.1109, 0.5884], std: 0.0629
  RMSE : 0.1808, R2: -0.0907, MAE: 0.1518, Spearman rho: 0.2925, Spearman p: 2.9407e-13, Pearson r: 0.2863, Pearson p: 9.5115e-13
  Pred range: [0.1096, 0.5844], std: 0.0634
  RMSE : 0.1785, R2: -0.0638, MAE: 0.1498, Spearman rho: 0.3181, Spearman p: 1.5717e-15, Pearson r: 0.3100, Pearson p: 8.6372e-15
  Pred range: [0.1104, 0.5901], std: 0.0646
  RMSE : 0.1786, R2: -0.0652, MAE: 0.1502, Spearman rho: 0.3304, Spearman p: 1.0799e-16, Pearson r: 0.3227, Pearson p: 5.8547e-16
[I 2026-04-27 18:37:40,876] Trial 9 pruned. 
Train: 2407 rows (1613 IDs),Test: 598 rows (404 IDs) 

n_features_x : 6, n_features_per_modality: [16, 23, 19, 17, 7, 4, 4, 4, 1, 4]

--- ImbalancedRegressionLoss initialized ---
  Bins: 20, Focal gamma: 1.3671767443453353, Base loss: huber
  Bin [0.00, 0.05): count=  172, weight=0.053
  Bin [0.05, 0.10): count=  413, weight=0.022
  Bin [0.10, 0.15): count=  175, weight=0.052
  Bin [0.15, 0.20): count=  405, weight=0.023
  Bin [0.20, 0.25): count=  295, weight=0.031
  Bin [0.25, 0.30): count=  126, weight=0.072
  Bin [0.30, 0.35): count=  223, weight=0.041
  Bin [0.35, 0.40): count=  162, weight=0.056
  Bin [0.40, 0.45): count=   69, weight=0.131
  Bin [0.45, 0.50): count=  122, weight=0.074
  Bin [0.50, 0.55): count=   93, weight=0.097
  Bin [0.55, 0.60): count=   36, weight=0.247
  Bin [0.60, 0.65): count=   47, weight=0.190
  Bin [0.65, 0.70): count=   27, weight=0.326
  Bin [0.70, 0.75): count=   14, weight=0.609
  Bin [0.75, 0.80): count=   19, weight=0.457
  Bin [0.80, 0.85): count=    5, weight=1.523
  Bin [0.85, 0.90): count=    1, weight=4.570
  Bin [0.90, 0.95): count=    3, weight=2.285
  Bin [0.95, 1.00): count=    0, weight=9.140
-------------------------------------------

  Pred range: [0.1149, 0.5640], std: 0.0813
  RMSE : 0.1561, R2: 0.1865, MAE: 0.1268, Spearman rho: 0.4646, Spearman p: 2.3599e-33, Pearson r: 0.4720, Pearson p: 1.6516e-34
  Pred range: [0.1028, 0.5890], std: 0.0900
  RMSE : 0.1577, R2: 0.1699, MAE: 0.1296, Spearman rho: 0.4833, Spearman p: 2.5366e-36, Pearson r: 0.4951, Pearson p: 2.6889e-38
  Pred range: [0.0894, 0.6111], std: 0.0944
  RMSE : 0.1574, R2: 0.1730, MAE: 0.1289, Spearman rho: 0.4854, Spearman p: 1.1205e-36, Pearson r: 0.4980, Pearson p: 8.3092e-39
  Pred range: [0.1378, 0.7509], std: 0.1106
  RMSE : 0.1951, R2: -0.2710, MAE: 0.1662, Spearman rho: 0.4863, Spearman p: 7.9936e-37, Pearson r: 0.4980, Pearson p: 8.5346e-39
  Pred range: [0.0473, 0.6246], std: 0.1022
  RMSE : 0.1617, R2: 0.1269, MAE: 0.1332, Spearman rho: 0.4853, Spearman p: 1.1690e-36, Pearson r: 0.5009, Pearson p: 2.7123e-39
  Pred range: [0.0798, 0.6783], std: 0.1069
  RMSE : 0.1741, R2: -0.0116, MAE: 0.1457, Spearman rho: 0.4858, Spearman p: 9.5751e-37, Pearson r: 0.5055, Pearson p: 4.1441e-40
[I 2026-04-27 18:38:33,286] Trial 10 finished with value: 0.1561099318688267 and parameters: {'learning_rate': 0.0012131865857227479, 'batch_size': 6, 'num_epochs': 13, 'weight_decay': 0.0008420694383612471, 'layers_PRS': 4, 'layers_SCZ15': 7, 'layers_ADHD9': 1, 'layers_ASD9': 7, 'layers_ACE15': 1, 'layers_ACE18': 7, 'layers_SUD18': 7, 'layers_SES': 1, 'layers_SEX': 7, 'dropout': 0.45101194423583363, 'se_reduction': 6, 'hidden_dim_min': 3, 'base_loss': 'huber', 'huber_delta': 0.10262543504816803, 'focal_gamma': 1.3671767443453353, 'n_bins': 20, 'scheduler_patience': 5, 'scheduler_factor': 0.30334053278841433, 'early_stopping_patience': 5}. Best is trial 8 with value: 0.15005696427010315.
Train: 2407 rows (1613 IDs),Test: 598 rows (404 IDs) 

n_features_x : 6, n_features_per_modality: [16, 23, 19, 17, 7, 4, 4, 4, 1, 4]

--- ImbalancedRegressionLoss initialized ---
  Bins: 20, Focal gamma: 0.5306680920755618, Base loss: huber
  Bin [0.00, 0.05): count=  172, weight=0.053
  Bin [0.05, 0.10): count=  413, weight=0.022
  Bin [0.10, 0.15): count=  175, weight=0.052
  Bin [0.15, 0.20): count=  405, weight=0.023
  Bin [0.20, 0.25): count=  295, weight=0.031
  Bin [0.25, 0.30): count=  126, weight=0.072
  Bin [0.30, 0.35): count=  223, weight=0.041
  Bin [0.35, 0.40): count=  162, weight=0.056
  Bin [0.40, 0.45): count=   69, weight=0.131
  Bin [0.45, 0.50): count=  122, weight=0.074
  Bin [0.50, 0.55): count=   93, weight=0.097
  Bin [0.55, 0.60): count=   36, weight=0.247
  Bin [0.60, 0.65): count=   47, weight=0.190
  Bin [0.65, 0.70): count=   27, weight=0.326
  Bin [0.70, 0.75): count=   14, weight=0.609
  Bin [0.75, 0.80): count=   19, weight=0.457
  Bin [0.80, 0.85): count=    5, weight=1.523
  Bin [0.85, 0.90): count=    1, weight=4.570
  Bin [0.90, 0.95): count=    3, weight=2.285
  Bin [0.95, 1.00): count=    0, weight=9.140
-------------------------------------------

  Pred range: [0.0775, 0.6808], std: 0.0987
  RMSE : 0.1551, R2: 0.1970, MAE: 0.1252, Spearman rho: 0.4910, Spearman p: 1.3046e-37, Pearson r: 0.5006, Pearson p: 3.0355e-39
  Pred range: [0.0416, 0.6805], std: 0.1085
  RMSE : 0.1626, R2: 0.1178, MAE: 0.1337, Spearman rho: 0.4823, Spearman p: 3.6729e-36, Pearson r: 0.5009, Pearson p: 2.6165e-39
  Pred range: [0.0862, 0.7224], std: 0.1138
  RMSE : 0.1720, R2: 0.0123, MAE: 0.1421, Spearman rho: 0.4898, Spearman p: 2.0572e-37, Pearson r: 0.5056, Pearson p: 4.0128e-40
  Pred range: [0.0324, 0.6427], std: 0.1089
  RMSE : 0.1567, R2: 0.1802, MAE: 0.1259, Spearman rho: 0.4815, Spearman p: 4.9191e-36, Pearson r: 0.4965, Pearson p: 1.5430e-38
