[I 2026-04-28 00:08:49,010] Trial 36 pruned. 
Train: 2407 rows (1613 IDs),Test: 598 rows (404 IDs) 

n_features_x : 6, n_features_per_modality: [16, 23, 19, 17, 7, 4, 4, 4, 1, 4]

--- ImbalancedRegressionLoss initialized ---
  Bins: 8, Focal gamma: 2.3101582010287434, Base loss: huber
  Bin [0.00, 0.12): count= 1180, weight=0.003
  Bin [0.12, 0.25): count=  933, weight=0.003
  Bin [0.25, 0.38): count=  253, weight=0.012
  Bin [0.38, 0.50): count=   30, weight=0.098
  Bin [0.50, 0.62): count=   10, weight=0.277
  Bin [0.62, 0.75): count=    1, weight=1.521
  Bin [0.75, 0.88): count=    0, weight=3.043
  Bin [0.88, 1.00): count=    0, weight=3.043
-------------------------------------------

  Pred range: [-0.0318, 0.2775], std: 0.0438
  RMSE : 0.1164, R2: -0.3396, MAE: 0.0942, Spearman rho: -0.1905, Spearman p: 2.7225e-06, Pearson r: -0.1691, Pearson p: 3.2484e-05
  Pred range: [0.0079, 0.2863], std: 0.0385
  RMSE : 0.1121, R2: -0.2421, MAE: 0.0915, Spearman rho: -0.1198, Spearman p: 3.3526e-03, Pearson r: -0.0950, Pearson p: 2.0162e-02
  Pred range: [0.0360, 0.2877], std: 0.0352
  RMSE : 0.1085, R2: -0.1642, MAE: 0.0887, Spearman rho: -0.0409, Spearman p: 3.1806e-01, Pearson r: -0.0169, Pearson p: 6.7977e-01
  Pred range: [0.0549, 0.2844], std: 0.0336
  RMSE : 0.1052, R2: -0.0932, MAE: 0.0857, Spearman rho: 0.0363, Spearman p: 3.7617e-01, Pearson r: 0.0570, Pearson p: 1.6411e-01
  Pred range: [0.0630, 0.2908], std: 0.0337
  RMSE : 0.1035, R2: -0.0585, MAE: 0.0842, Spearman rho: 0.1149, Spearman p: 4.8917e-03, Pearson r: 0.1300, Pearson p: 1.4444e-03
  Pred range: [0.0599, 0.2820], std: 0.0335
  RMSE : 0.1009, R2: -0.0067, MAE: 0.0817, Spearman rho: 0.1649, Spearman p: 5.0599e-05, Pearson r: 0.1788, Pearson p: 1.0875e-05
[I 2026-04-28 00:09:42,688] Trial 37 pruned. 
Train: 2407 rows (1613 IDs),Test: 598 rows (404 IDs) 

n_features_x : 6, n_features_per_modality: [16, 23, 19, 17, 7, 4, 4, 4, 1, 4]

--- ImbalancedRegressionLoss initialized ---
  Bins: 10, Focal gamma: 2.6195523761369377, Base loss: huber
  Bin [0.00, 0.10): count= 1010, weight=0.003
  Bin [0.10, 0.20): count=  866, weight=0.003
  Bin [0.20, 0.30): count=  386, weight=0.007
  Bin [0.30, 0.40): count=  111, weight=0.026
  Bin [0.40, 0.50): count=   23, weight=0.119
  Bin [0.50, 0.60): count=    9, weight=0.287
  Bin [0.60, 0.70): count=    2, weight=0.955
  Bin [0.70, 0.80): count=    0, weight=2.866
  Bin [0.80, 0.90): count=    0, weight=2.866
  Bin [0.90, 1.00): count=    0, weight=2.866
-------------------------------------------

  Pred range: [0.0833, 0.4152], std: 0.0462
  RMSE : 0.1026, R2: -0.0410, MAE: 0.0847, Spearman rho: 0.3533, Spearman p: 5.1234e-19, Pearson r: 0.3746, Pearson p: 2.3190e-21
  Pred range: [-0.0205, 0.3803], std: 0.0584
  RMSE : 0.0937, R2: 0.1330, MAE: 0.0747, Spearman rho: 0.4069, Spearman p: 3.0265e-25, Pearson r: 0.4237, Pearson p: 1.9025e-27
  Pred range: [0.0755, 0.4118], std: 0.0544
  RMSE : 0.1017, R2: -0.0216, MAE: 0.0830, Spearman rho: 0.4205, Spearman p: 5.0349e-27, Pearson r: 0.4288, Pearson p: 3.8755e-28
  Pred range: [0.0776, 0.4867], std: 0.0717
  RMSE : 0.1134, R2: -0.2706, MAE: 0.0920, Spearman rho: 0.4530, Spearman p: 1.3320e-31, Pearson r: 0.4518, Pearson p: 2.0137e-31
  Pred range: [0.0259, 0.3880], std: 0.0551
  RMSE : 0.0906, R2: 0.1897, MAE: 0.0715, Spearman rho: 0.4438, Spearman p: 3.0250e-30, Pearson r: 0.4506, Pearson p: 3.0649e-31
  Pred range: [0.0217, 0.4756], std: 0.0579
  RMSE : 0.1128, R2: -0.2570, MAE: 0.0937, Spearman rho: 0.4323, Spearman p: 1.2741e-28, Pearson r: 0.4309, Pearson p: 1.9920e-28
  Pred range: [0.0284, 0.3319], std: 0.0444
  RMSE : 0.0973, R2: 0.0637, MAE: 0.0786, Spearman rho: 0.4087, Spearman p: 1.7836e-25, Pearson r: 0.4043, Pearson p: 6.4641e-25
  Pred range: [-0.0243, 0.4005], std: 0.0601
  RMSE : 0.0967, R2: 0.0766, MAE: 0.0783, Spearman rho: 0.3777, Spearman p: 1.0207e-21, Pearson r: 0.3928, Pearson p: 1.6810e-23
  Pred range: [0.0425, 0.5180], std: 0.0706
  RMSE : 0.1054, R2: -0.0986, MAE: 0.0825, Spearman rho: 0.4080, Spearman p: 2.1423e-25, Pearson r: 0.3908, Pearson p: 2.9812e-23
  Pred range: [0.0717, 0.4188], std: 0.0538
  RMSE : 0.0975, R2: 0.0604, MAE: 0.0794, Spearman rho: 0.4346, Spearman p: 5.9569e-29, Pearson r: 0.4420, Pearson p: 5.3972e-30
  Pred range: [-0.0079, 0.3781], std: 0.0553
  RMSE : 0.0907, R2: 0.1872, MAE: 0.0712, Spearman rho: 0.4454, Spearman p: 1.7735e-30, Pearson r: 0.4557, Pearson p: 5.2940e-32
  Pred range: [0.0548, 0.3772], std: 0.0511
  RMSE : 0.0908, R2: 0.1849, MAE: 0.0730, Spearman rho: 0.4447, Spearman p: 2.2515e-30, Pearson r: 0.4528, Pearson p: 1.4537e-31
[I 2026-04-28 00:10:30,080] Trial 38 finished with value: 0.09055348649461453 and parameters: {'learning_rate': 0.00558137018021928, 'batch_size': 8, 'num_epochs': 25, 'weight_decay': 0.003984598849222891, 'depth_complex': 4, 'depth_moderate': 3, 'depth_simple': 1, 'dropout': 0.45751077038926047, 'se_reduction': 8, 'hidden_dim_min': 3, 'base_loss': 'huber', 'huber_delta': 0.07416626952721855, 'focal_gamma': 2.6195523761369377, 'n_bins': 10, 'scheduler_patience': 4, 'scheduler_factor': 0.6518434403274379, 'early_stopping_patience': 7}. Best is trial 22 with value: 0.08764163086185245.
Train: 2407 rows (1613 IDs),Test: 598 rows (404 IDs) 

n_features_x : 6, n_features_per_modality: [16, 23, 19, 17, 7, 4, 4, 4, 1, 4]

--- ImbalancedRegressionLoss initialized ---
  Bins: 20, Focal gamma: 1.0931062412995636, Base loss: mse
  Bin [0.00, 0.05): count=  650, weight=0.004
  Bin [0.05, 0.10): count=  360, weight=0.007
  Bin [0.10, 0.15): count=  360, weight=0.007
  Bin [0.15, 0.20): count=  506, weight=0.005
  Bin [0.20, 0.25): count=  237, weight=0.011
  Bin [0.25, 0.30): count=  149, weight=0.017
  Bin [0.30, 0.35): count=   91, weight=0.028
  Bin [0.35, 0.40): count=   20, weight=0.125
  Bin [0.40, 0.45): count=   13, weight=0.187
  Bin [0.45, 0.50): count=   10, weight=0.238
  Bin [0.50, 0.55): count=    6, weight=0.374
  Bin [0.55, 0.60): count=    3, weight=0.655
  Bin [0.60, 0.65): count=    1, weight=1.310
  Bin [0.65, 0.70): count=    1, weight=1.310
  Bin [0.70, 0.75): count=    0, weight=2.620
  Bin [0.75, 0.80): count=    0, weight=2.620
  Bin [0.80, 0.85): count=    0, weight=2.620
  Bin [0.85, 0.90): count=    0, weight=2.620
  Bin [0.90, 0.95): count=    0, weight=2.620
  Bin [0.95, 1.00): count=    0, weight=2.620
-------------------------------------------

  Pred range: [0.0738, 0.3992], std: 0.0524
  RMSE : 0.1004, R2: 0.0047, MAE: 0.0815, Spearman rho: 0.4125, Spearman p: 5.6893e-26, Pearson r: 0.4078, Pearson p: 2.2691e-25
  Pred range: [0.0737, 0.4805], std: 0.0576
  RMSE : 0.1110, R2: -0.2171, MAE: 0.0915, Spearman rho: 0.4477, Spearman p: 8.1427e-31, Pearson r: 0.4458, Pearson p: 1.5171e-30
  Pred range: [0.0459, 0.3897], std: 0.0552
  RMSE : 0.0920, R2: 0.1633, MAE: 0.0732, Spearman rho: 0.4355, Spearman p: 4.4696e-29, Pearson r: 0.4365, Pearson p: 3.2801e-29
  Pred range: [0.0353, 0.4232], std: 0.0520
  RMSE : 0.0930, R2: 0.1454, MAE: 0.0751, Spearman rho: 0.4433, Spearman p: 3.5504e-30, Pearson r: 0.4501, Pearson p: 3.6226e-31
  Pred range: [0.0485, 0.3843], std: 0.0490
  RMSE : 0.0912, R2: 0.1782, MAE: 0.0728, Spearman rho: 0.4332, Spearman p: 9.3126e-29, Pearson r: 0.4366, Pearson p: 3.1818e-29
  Pred range: [0.0605, 0.4535], std: 0.0529
  RMSE : 0.1090, R2: -0.1742, MAE: 0.0902, Spearman rho: 0.4402, Spearman p: 9.7964e-30, Pearson r: 0.4452, Pearson p: 1.8695e-30
  Pred range: [0.0369, 0.4409], std: 0.0585
  RMSE : 0.0976, R2: 0.0596, MAE: 0.0791, Spearman rho: 0.4462, Spearman p: 1.3664e-30, Pearson r: 0.4521, Pearson p: 1.8228e-31
  Pred range: [0.0238, 0.4374], std: 0.0513
  RMSE : 0.1030, R2: -0.0493, MAE: 0.0849, Spearman rho: 0.4337, Spearman p: 8.0811e-29, Pearson r: 0.4408, Pearson p: 7.9940e-30
  Pred range: [0.0523, 0.4316], std: 0.0540
  RMSE : 0.0965, R2: 0.0793, MAE: 0.0782, Spearman rho: 0.4383, Spearman p: 1.7970e-29, Pearson r: 0.4489, Pearson p: 5.3784e-31
[I 2026-04-28 00:11:11,572] Trial 39 pruned. 
Train: 2407 rows (1613 IDs),Test: 598 rows (404 IDs) 

n_features_x : 6, n_features_per_modality: [16, 23, 19, 17, 7, 4, 4, 4, 1, 4]

--- ImbalancedRegressionLoss initialized ---
  Bins: 11, Focal gamma: 0.5565459444193497, Base loss: huber
  Bin [0.00, 0.09): count= 1010, weight=0.003
  Bin [0.09, 0.18): count=  706, weight=0.004
  Bin [0.18, 0.27): count=  478, weight=0.006
  Bin [0.27, 0.36): count=  159, weight=0.018
  Bin [0.36, 0.45): count=   33, weight=0.085
  Bin [0.45, 0.55): count=   16, weight=0.170
  Bin [0.55, 0.64): count=    4, weight=0.579
  Bin [0.64, 0.73): count=    1, weight=1.448
  Bin [0.73, 0.82): count=    0, weight=2.896
  Bin [0.82, 0.91): count=    0, weight=2.896
  Bin [0.91, 1.00): count=    0, weight=2.896
-------------------------------------------

  Pred range: [0.0508, 0.4596], std: 0.0633
  RMSE : 0.1013, R2: -0.0131, MAE: 0.0819, Spearman rho: 0.4278, Spearman p: 5.2724e-28, Pearson r: 0.4337, Pearson p: 8.1137e-29
  Pred range: [0.0665, 0.4187], std: 0.0576
  RMSE : 0.0982, R2: 0.0477, MAE: 0.0800, Spearman rho: 0.4532, Spearman p: 1.2534e-31, Pearson r: 0.4612, Pearson p: 7.8347e-33
  Pred range: [0.0370, 0.3767], std: 0.0562
  RMSE : 0.0888, R2: 0.2206, MAE: 0.0701, Spearman rho: 0.4696, Spearman p: 3.9144e-34, Pearson r: 0.4771, Pearson p: 2.5886e-35
  Pred range: [0.0631, 0.4204], std: 0.0594
  RMSE : 0.0979, R2: 0.0520, MAE: 0.0800, Spearman rho: 0.4669, Spearman p: 1.0423e-33, Pearson r: 0.4741, Pearson p: 7.6952e-35
  Pred range: [0.0514, 0.3701], std: 0.0543
  RMSE : 0.0895, R2: 0.2078, MAE: 0.0718, Spearman rho: 0.4800, Spearman p: 8.7313e-36, Pearson r: 0.4869, Pearson p: 6.3582e-37
  Pred range: [0.0408, 0.3707], std: 0.0584
  RMSE : 0.0896, R2: 0.2067, MAE: 0.0713, Spearman rho: 0.4737, Spearman p: 8.8572e-35, Pearson r: 0.4824, Pearson p: 3.5778e-36
  Pred range: [0.0562, 0.3913], std: 0.0579
  RMSE : 0.0924, R2: 0.1565, MAE: 0.0745, Spearman rho: 0.4742, Spearman p: 7.5126e-35, Pearson r: 0.4814, Pearson p: 5.0377e-36
[I 2026-04-28 00:12:14,665] Trial 40 finished with value: 0.08881156354325903 and parameters: {'learning_rate': 0.0006634281080141707, 'batch_size': 4, 'num_epochs': 23, 'weight_decay': 0.002288673561220516, 'depth_complex': 5, 'depth_moderate': 4, 'depth_simple': 1, 'dropout': 0.41896260940844104, 'se_reduction': 7, 'hidden_dim_min': 2, 'base_loss': 'huber', 'huber_delta': 0.050373155535041, 'focal_gamma': 0.5565459444193497, 'n_bins': 11, 'scheduler_patience': 3, 'scheduler_factor': 0.5979906934699063, 'early_stopping_patience': 4}. Best is trial 22 with value: 0.08764163086185245.
Train: 2407 rows (1613 IDs),Test: 598 rows (404 IDs) 

n_features_x : 6, n_features_per_modality: [16, 23, 19, 17, 7, 4, 4, 4, 1, 4]

--- ImbalancedRegressionLoss initialized ---
  Bins: 5, Focal gamma: 2.571867478680573, Base loss: huber
  Bin [0.00, 0.20): count= 1876, weight=0.002
  Bin [0.20, 0.40): count=  497, weight=0.007
  Bin [0.40, 0.60): count=   32, weight=0.111
  Bin [0.60, 0.80): count=    2, weight=1.220
  Bin [0.80, 1.00): count=    0, weight=3.660
-------------------------------------------

  Pred range: [0.0337, 0.3873], std: 0.0544
  RMSE : 0.0934, R2: 0.1381, MAE: 0.0747, Spearman rho: 0.4223, Spearman p: 2.9163e-27, Pearson r: 0.4218, Pearson p: 3.3602e-27
  Pred range: [0.0380, 0.3785], std: 0.0531
  RMSE : 0.0918, R2: 0.1681, MAE: 0.0736, Spearman rho: 0.4453, Spearman p: 1.8089e-30, Pearson r: 0.4512, Pearson p: 2.5288e-31
  Pred range: [0.0551, 0.3866], std: 0.0529
  RMSE : 0.0928, R2: 0.1498, MAE: 0.0747, Spearman rho: 0.4473, Spearman p: 9.2392e-31, Pearson r: 0.4558, Pearson p: 5.1322e-32
  Pred range: [0.0570, 0.4085], std: 0.0545
  RMSE : 0.0918, R2: 0.1669, MAE: 0.0737, Spearman rho: 0.4499, Spearman p: 3.9028e-31, Pearson r: 0.4551, Pearson p: 6.4683e-32
  Pred range: [0.0425, 0.3737], std: 0.0548
  RMSE : 0.0901, R2: 0.1969, MAE: 0.0720, Spearman rho: 0.4585, Spearman p: 2.0302e-32, Pearson r: 0.4649, Pearson p: 2.1525e-33
  Pred range: [0.0532, 0.3637], std: 0.0530
  RMSE : 0.0920, R2: 0.1627, MAE: 0.0744, Spearman rho: 0.4543, Spearman p: 8.7759e-32, Pearson r: 0.4645, Pearson p: 2.4166e-33
  Pred range: [0.0694, 0.3773], std: 0.0519
  RMSE : 0.0946, R2: 0.1152, MAE: 0.0770, Spearman rho: 0.4592, Spearman p: 1.6125e-32, Pearson r: 0.4715, Pearson p: 2.0040e-34
  Pred range: [0.0346, 0.3341], std: 0.0491
  RMSE : 0.0897, R2: 0.2051, MAE: 0.0722, Spearman rho: 0.4576, Spearman p: 2.7971e-32, Pearson r: 0.4685, Pearson p: 5.8353e-34
  Pred range: [0.0592, 0.3872], std: 0.0520
  RMSE : 0.0958, R2: 0.0937, MAE: 0.0782, Spearman rho: 0.4668, Spearman p: 1.0666e-33, Pearson r: 0.4766, Pearson p: 3.1166e-35
  Pred range: [0.0501, 0.3674], std: 0.0525
  RMSE : 0.0902, R2: 0.1966, MAE: 0.0724, Spearman rho: 0.4675, Spearman p: 8.3655e-34, Pearson r: 0.4755, Pearson p: 4.6586e-35
  Pred range: [0.0589, 0.3808], std: 0.0518
  RMSE : 0.0917, R2: 0.1688, MAE: 0.0741, Spearman rho: 0.4592, Spearman p: 1.6115e-32, Pearson r: 0.4700, Pearson p: 3.4496e-34
  Pred range: [0.0572, 0.3846], std: 0.0552
  RMSE : 0.0924, R2: 0.1571, MAE: 0.0746, Spearman rho: 0.4731, Spearman p: 1.0986e-34, Pearson r: 0.4821, Pearson p: 3.9434e-36
  Pred range: [0.0764, 0.3990], std: 0.0533
  RMSE : 0.0981, R2: 0.0497, MAE: 0.0802, Spearman rho: 0.4666, Spearman p: 1.1553e-33, Pearson r: 0.4746, Pearson p: 6.5164e-35
  Pred range: [0.0469, 0.3573], std: 0.0491
  RMSE : 0.0886, R2: 0.2244, MAE: 0.0707, Spearman rho: 0.4691, Spearman p: 4.6563e-34, Pearson r: 0.4777, Pearson p: 2.0388e-35
  Pred range: [0.0491, 0.3497], std: 0.0505
  RMSE : 0.0893, R2: 0.2114, MAE: 0.0716, Spearman rho: 0.4649, Spearman p: 2.1194e-33, Pearson r: 0.4735, Pearson p: 9.6388e-35
  Pred range: [0.0572, 0.3829], std: 0.0530
  RMSE : 0.0925, R2: 0.1543, MAE: 0.0747, Spearman rho: 0.4708, Spearman p: 2.5942e-34, Pearson r: 0.4763, Pearson p: 3.3663e-35
  Pred range: [0.0511, 0.3710], std: 0.0524
  RMSE : 0.0917, R2: 0.1691, MAE: 0.0740, Spearman rho: 0.4694, Spearman p: 4.1830e-34, Pearson r: 0.4765, Pearson p: 3.1326e-35
  Pred range: [0.0421, 0.3505], std: 0.0530
  RMSE : 0.0899, R2: 0.2006, MAE: 0.0722, Spearman rho: 0.4707, Spearman p: 2.6993e-34, Pearson r: 0.4768, Pearson p: 2.8850e-35
  Pred range: [0.0383, 0.3377], std: 0.0497
  RMSE : 0.0883, R2: 0.2303, MAE: 0.0699, Spearman rho: 0.4745, Spearman p: 6.6195e-35, Pearson r: 0.4801, Pearson p: 8.4279e-36
  Pred range: [0.0508, 0.3532], std: 0.0508
  RMSE : 0.0894, R2: 0.2094, MAE: 0.0718, Spearman rho: 0.4717, Spearman p: 1.8289e-34, Pearson r: 0.4800, Pearson p: 8.7058e-36
  Pred range: [0.0420, 0.3471], std: 0.0493
  RMSE : 0.0883, R2: 0.2288, MAE: 0.0704, Spearman rho: 0.4750, Spearman p: 5.4649e-35, Pearson r: 0.4815, Pearson p: 4.8901e-36
  Pred range: [0.0289, 0.3320], std: 0.0486
  RMSE : 0.0886, R2: 0.2250, MAE: 0.0699, Spearman rho: 0.4752, Spearman p: 5.0521e-35, Pearson r: 0.4804, Pearson p: 7.3992e-36
  Pred range: [0.0455, 0.3520], std: 0.0491
  RMSE : 0.0886, R2: 0.2240, MAE: 0.0708, Spearman rho: 0.4743, Spearman p: 7.1129e-35, Pearson r: 0.4801, Pearson p: 8.4132e-36
  Pred range: [0.0376, 0.3408], std: 0.0490
  RMSE : 0.0884, R2: 0.2277, MAE: 0.0704, Spearman rho: 0.4718, Spearman p: 1.8088e-34, Pearson r: 0.4778, Pearson p: 1.9991e-35
  Pred range: [0.0535, 0.3653], std: 0.0517
  RMSE : 0.0906, R2: 0.1891, MAE: 0.0729, Spearman rho: 0.4746, Spearman p: 6.3718e-35, Pearson r: 0.4807, Pearson p: 6.5775e-36
  Pred range: [0.0448, 0.3538], std: 0.0504
  RMSE : 0.0885, R2: 0.2252, MAE: 0.0706, Spearman rho: 0.4764, Spearman p: 3.3026e-35, Pearson r: 0.4823, Pearson p: 3.6349e-36
[I 2026-04-28 00:15:31,688] Trial 41 finished with value: 0.08825678053731485 and parameters: {'learning_rate': 0.0005799684683490188, 'batch_size': 4, 'num_epochs': 30, 'weight_decay': 0.0013622169627593005, 'depth_complex': 3, 'depth_moderate': 4, 'depth_simple': 1, 'dropout': 0.2714676851311161, 'se_reduction': 7, 'hidden_dim_min': 5, 'base_loss': 'huber', 'huber_delta': 0.12205251001255822, 'focal_gamma': 2.571867478680573, 'n_bins': 5, 'scheduler_patience': 3, 'scheduler_factor': 0.6656186206901888, 'early_stopping_patience': 7}. Best is trial 22 with value: 0.08764163086185245.
Train: 2407 rows (1613 IDs),Test: 598 rows (404 IDs) 

n_features_x : 6, n_features_per_modality: [16, 23, 19, 17, 7, 4, 4, 4, 1, 4]

--- ImbalancedRegressionLoss initialized ---
  Bins: 5, Focal gamma: 2.768949079890156, Base loss: huber
  Bin [0.00, 0.20): count= 1876, weight=0.002
  Bin [0.20, 0.40): count=  497, weight=0.007
  Bin [0.40, 0.60): count=   32, weight=0.111
  Bin [0.60, 0.80): count=    2, weight=1.220
  Bin [0.80, 1.00): count=    0, weight=3.660
-------------------------------------------

  Pred range: [0.0344, 0.3475], std: 0.0502
  RMSE : 0.0951, R2: 0.1062, MAE: 0.0761, Spearman rho: 0.3372, Spearman p: 2.2916e-17, Pearson r: 0.3642, Pearson p: 3.4283e-20
  Pred range: [0.0571, 0.4053], std: 0.0538
  RMSE : 0.0958, R2: 0.0936, MAE: 0.0772, Spearman rho: 0.3831, Spearman p: 2.4385e-22, Pearson r: 0.4053, Pearson p: 4.7700e-25
  Pred range: [0.0455, 0.3541], std: 0.0519
  RMSE : 0.0922, R2: 0.1606, MAE: 0.0740, Spearman rho: 0.4113, Spearman p: 8.1343e-26, Pearson r: 0.4317, Pearson p: 1.5311e-28
  Pred range: [0.0292, 0.3477], std: 0.0497
  RMSE : 0.0904, R2: 0.1918, MAE: 0.0722, Spearman rho: 0.4244, Spearman p: 1.5201e-27, Pearson r: 0.4440, Pearson p: 2.8457e-30
  Pred range: [0.0157, 0.3326], std: 0.0483
  RMSE : 0.0900, R2: 0.2002, MAE: 0.0709, Spearman rho: 0.4400, Spearman p: 1.0571e-29, Pearson r: 0.4565, Pearson p: 4.1016e-32
  Pred range: [0.0448, 0.3782], std: 0.0536
  RMSE : 0.0919, R2: 0.1649, MAE: 0.0741, Spearman rho: 0.4368, Spearman p: 2.9936e-29, Pearson r: 0.4550, Pearson p: 6.7736e-32
  Pred range: [0.0276, 0.3810], std: 0.0524
  RMSE : 0.0911, R2: 0.1803, MAE: 0.0734, Spearman rho: 0.4439, Spearman p: 2.8913e-30, Pearson r: 0.4609, Pearson p: 8.6121e-33
  Pred range: [0.0031, 0.3396], std: 0.0464
  RMSE : 0.0895, R2: 0.2077, MAE: 0.0710, Spearman rho: 0.4465, Spearman p: 1.2088e-30, Pearson r: 0.4609, Pearson p: 8.8963e-33
  Pred range: [0.0267, 0.3531], std: 0.0483
  RMSE : 0.0892, R2: 0.2144, MAE: 0.0709, Spearman rho: 0.4487, Spearman p: 5.7744e-31, Pearson r: 0.4634, Pearson p: 3.6711e-33
  Pred range: [0.0368, 0.3528], std: 0.0488
  RMSE : 0.0889, R2: 0.2184, MAE: 0.0704, Spearman rho: 0.4536, Spearman p: 1.0988e-31, Pearson r: 0.4685, Pearson p: 5.8634e-34
  Pred range: [0.0271, 0.3567], std: 0.0493
  RMSE : 0.0889, R2: 0.2187, MAE: 0.0708, Spearman rho: 0.4567, Spearman p: 3.7369e-32, Pearson r: 0.4685, Pearson p: 5.8466e-34
  Pred range: [0.0352, 0.3811], std: 0.0496
  RMSE : 0.0915, R2: 0.1734, MAE: 0.0741, Spearman rho: 0.4536, Spearman p: 1.1102e-31, Pearson r: 0.4648, Pearson p: 2.2383e-33
  Pred range: [0.0279, 0.3502], std: 0.0475
  RMSE : 0.0887, R2: 0.2219, MAE: 0.0707, Spearman rho: 0.4591, Spearman p: 1.6280e-32, Pearson r: 0.4710, Pearson p: 2.3568e-34
  Pred range: [0.0364, 0.3735], std: 0.0497
  RMSE : 0.0894, R2: 0.2096, MAE: 0.0717, Spearman rho: 0.4544, Spearman p: 8.3503e-32, Pearson r: 0.4680, Pearson p: 7.1474e-34
  Pred range: [0.0274, 0.3422], std: 0.0506
  RMSE : 0.0892, R2: 0.2140, MAE: 0.0702, Spearman rho: 0.4603, Spearman p: 1.0735e-32, Pearson r: 0.4720, Pearson p: 1.6332e-34
  Pred range: [0.0410, 0.3631], std: 0.0501
  RMSE : 0.0897, R2: 0.2047, MAE: 0.0721, Spearman rho: 0.4583, Spearman p: 2.1523e-32, Pearson r: 0.4712, Pearson p: 2.2400e-34
  Pred range: [0.0444, 0.3705], std: 0.0514
  RMSE : 0.0901, R2: 0.1985, MAE: 0.0725, Spearman rho: 0.4647, Spearman p: 2.2834e-33, Pearson r: 0.4769, Pearson p: 2.7743e-35
  Pred range: [0.0483, 0.3762], std: 0.0525
  RMSE : 0.0902, R2: 0.1953, MAE: 0.0725, Spearman rho: 0.4614, Spearman p: 7.3475e-33, Pearson r: 0.4731, Pearson p: 1.0991e-34
  Pred range: [0.0399, 0.3720], std: 0.0516
  RMSE : 0.0902, R2: 0.1966, MAE: 0.0725, Spearman rho: 0.4618, Spearman p: 6.3659e-33, Pearson r: 0.4723, Pearson p: 1.4752e-34
  Pred range: [0.0357, 0.3591], std: 0.0504
  RMSE : 0.0891, R2: 0.2161, MAE: 0.0712, Spearman rho: 0.4646, Spearman p: 2.3569e-33, Pearson r: 0.4746, Pearson p: 6.3961e-35
