[I 2026-04-28 00:31:35,903] Trial 0 finished with value: 0.16419618132989797 and parameters: {'learning_rate': 5.047417923444748e-05, 'batch_size': 6, 'num_epochs': 25, 'weight_decay': 1.0530659062710535e-05, 'depth_complex': 7, 'depth_moderate': 3, 'depth_simple': 2, 'dropout': 0.2502590827423966, 'se_reduction': 8, 'hidden_dim_min': 15, 'base_loss': 'mse', 'huber_delta': 0.16224267571120357, 'focal_gamma': 2.6309710644613897, 'n_bins': 17, 'scheduler_patience': 2, 'scheduler_factor': 0.667119049436923, 'early_stopping_patience': 4}. Best is trial 0 with value: 0.16419618132989797.
Train: 2407 rows (1613 IDs),Test: 598 rows (404 IDs) 

n_features_x : 6, n_features_per_modality: [16, 23, 19, 17, 7, 4, 4, 4, 1, 4]

--- ImbalancedRegressionLoss initialized ---
  Bins: 11, Focal gamma: 2.1594474709205516, Base loss: huber
  Bin [0.00, 0.09): count=  585, weight=0.034
  Bin [0.09, 0.18): count=  580, weight=0.034
  Bin [0.18, 0.27): count=  421, weight=0.047
  Bin [0.27, 0.36): count=  312, weight=0.064
  Bin [0.36, 0.45): count=  207, weight=0.096
  Bin [0.45, 0.55): count=  108, weight=0.183
  Bin [0.55, 0.64): count=  125, weight=0.159
  Bin [0.64, 0.73): count=   41, weight=0.476
  Bin [0.73, 0.82): count=   21, weight=0.909
  Bin [0.82, 0.91): count=    4, weight=3.999
  Bin [0.91, 1.00): count=    3, weight=4.998
-------------------------------------------

  Pred range: [-0.0248, 0.2913], std: 0.0476
  RMSE : 0.2145, R2: -0.5363, MAE: 0.1550, Spearman rho: 0.0032, Spearman p: 9.3771e-01, Pearson r: 0.0262, Pearson p: 5.2317e-01
  Pred range: [0.0677, 0.5664], std: 0.0652
  RMSE : 0.1761, R2: -0.0351, MAE: 0.1425, Spearman rho: 0.1463, Spearman p: 3.3026e-04, Pearson r: 0.1670, Pearson p: 4.0423e-05
  Pred range: [0.0984, 0.6559], std: 0.0714
  RMSE : 0.1862, R2: -0.1571, MAE: 0.1559, Spearman rho: 0.2023, Spearman p: 6.0704e-07, Pearson r: 0.2179, Pearson p: 7.3707e-08
  Pred range: [0.0996, 0.6209], std: 0.0682
  RMSE : 0.1791, R2: -0.0708, MAE: 0.1492, Spearman rho: 0.2338, Spearman p: 7.2208e-09, Pearson r: 0.2468, Pearson p: 9.4789e-10
  Pred range: [0.1105, 0.6302], std: 0.0690
  RMSE : 0.1801, R2: -0.0830, MAE: 0.1512, Spearman rho: 0.2679, Spearman p: 2.7629e-11, Pearson r: 0.2769, Pearson p: 5.5216e-12
  Pred range: [0.1129, 0.6129], std: 0.0681
  RMSE : 0.1754, R2: -0.0267, MAE: 0.1467, Spearman rho: 0.2961, Spearman p: 1.4550e-13, Pearson r: 0.3040, Pearson p: 2.9614e-14
  Pred range: [0.1168, 0.6074], std: 0.0684
  RMSE : 0.1731, R2: 0.0001, MAE: 0.1447, Spearman rho: 0.3205, Spearman p: 9.4284e-16, Pearson r: 0.3273, Pearson p: 2.1352e-16
  Pred range: [0.1277, 0.6252], std: 0.0716
  RMSE : 0.1757, R2: -0.0307, MAE: 0.1479, Spearman rho: 0.3402, Spearman p: 1.1332e-17, Pearson r: 0.3491, Pearson p: 1.4014e-18
  Pred range: [0.1233, 0.6045], std: 0.0711
  RMSE : 0.1714, R2: 0.0191, MAE: 0.1437, Spearman rho: 0.3561, Spearman p: 2.5776e-19, Pearson r: 0.3663, Pearson p: 2.0092e-20
  Pred range: [0.1213, 0.6000], std: 0.0723
  RMSE : 0.1701, R2: 0.0340, MAE: 0.1426, Spearman rho: 0.3693, Spearman p: 9.3290e-21, Pearson r: 0.3820, Pearson p: 3.2671e-22
  Pred range: [0.1170, 0.5856], std: 0.0725
  RMSE : 0.1675, R2: 0.0630, MAE: 0.1400, Spearman rho: 0.3804, Spearman p: 5.0267e-22, Pearson r: 0.3950, Pearson p: 9.2191e-24
  Pred range: [0.1181, 0.5968], std: 0.0750
  RMSE : 0.1689, R2: 0.0474, MAE: 0.1417, Spearman rho: 0.3887, Spearman p: 5.2129e-23, Pearson r: 0.4049, Pearson p: 5.3257e-25
  Pred range: [0.1138, 0.5841], std: 0.0755
  RMSE : 0.1670, R2: 0.0692, MAE: 0.1398, Spearman rho: 0.3961, Spearman p: 6.7586e-24, Pearson r: 0.4143, Pearson p: 3.3030e-26
  Pred range: [0.1156, 0.5999], std: 0.0783
  RMSE : 0.1685, R2: 0.0518, MAE: 0.1416, Spearman rho: 0.4018, Spearman p: 1.3058e-24, Pearson r: 0.4219, Pearson p: 3.2635e-27
  Pred range: [0.1105, 0.5842], std: 0.0784
  RMSE : 0.1657, R2: 0.0834, MAE: 0.1386, Spearman rho: 0.4082, Spearman p: 2.0611e-25, Pearson r: 0.4291, Pearson p: 3.4826e-28
[I 2026-04-28 00:33:02,401] Trial 1 finished with value: 0.16571346722799887 and parameters: {'learning_rate': 2.3381852153766186e-05, 'batch_size': 6, 'num_epochs': 15, 'weight_decay': 1.6426506356757344e-05, 'depth_complex': 5, 'depth_moderate': 3, 'depth_simple': 1, 'dropout': 0.1770281736507002, 'se_reduction': 7, 'hidden_dim_min': 6, 'base_loss': 'huber', 'huber_delta': 0.0195531582687754, 'focal_gamma': 2.1594474709205516, 'n_bins': 11, 'scheduler_patience': 3, 'scheduler_factor': 0.32110226455786345, 'early_stopping_patience': 8}. Best is trial 0 with value: 0.16419618132989797.
Train: 2407 rows (1613 IDs),Test: 598 rows (404 IDs) 

n_features_x : 6, n_features_per_modality: [16, 23, 19, 17, 7, 4, 4, 4, 1, 4]

--- ImbalancedRegressionLoss initialized ---
  Bins: 17, Focal gamma: 1.622595236582262, Base loss: huber
  Bin [0.00, 0.06): count=  172, weight=0.058
  Bin [0.06, 0.12): count=  413, weight=0.024
  Bin [0.12, 0.18): count=  376, weight=0.027
  Bin [0.18, 0.24): count=  370, weight=0.027
  Bin [0.24, 0.29): count=  255, weight=0.039
  Bin [0.29, 0.35): count=  223, weight=0.045
  Bin [0.35, 0.41): count=  162, weight=0.061
  Bin [0.41, 0.47): count=  134, weight=0.074
  Bin [0.47, 0.53): count=  108, weight=0.092
  Bin [0.53, 0.59): count=   78, weight=0.127
  Bin [0.59, 0.65): count=   47, weight=0.208
  Bin [0.65, 0.71): count=   27, weight=0.357
  Bin [0.71, 0.76): count=   26, weight=0.370
  Bin [0.76, 0.82): count=    9, weight=0.999
  Bin [0.82, 0.88): count=    4, weight=1.999
  Bin [0.88, 0.94): count=    3, weight=2.499
  Bin [0.94, 1.00): count=    0, weight=9.995
-------------------------------------------

  Pred range: [0.1473, 0.6131], std: 0.0826
  RMSE : 0.1684, R2: 0.0536, MAE: 0.1414, Spearman rho: 0.4506, Spearman p: 3.0256e-31, Pearson r: 0.4656, Pearson p: 1.6407e-33
  Pred range: [0.1604, 0.7362], std: 0.1025
  RMSE : 0.1968, R2: -0.2927, MAE: 0.1686, Spearman rho: 0.4680, Spearman p: 6.9979e-34, Pearson r: 0.4912, Pearson p: 1.2156e-37
  Pred range: [0.1403, 0.7518], std: 0.1078
  RMSE : 0.2051, R2: -0.4043, MAE: 0.1767, Spearman rho: 0.4869, Spearman p: 6.4635e-37, Pearson r: 0.5070, Pearson p: 2.2316e-40
  Pred range: [0.1199, 0.7504], std: 0.1082
  RMSE : 0.1894, R2: -0.1970, MAE: 0.1612, Spearman rho: 0.4828, Spearman p: 3.0564e-36, Pearson r: 0.5069, Pearson p: 2.3081e-40
  Pred range: [0.1080, 0.6949], std: 0.1019
  RMSE : 0.1735, R2: -0.0050, MAE: 0.1462, Spearman rho: 0.4878, Spearman p: 4.5113e-37, Pearson r: 0.5120, Pearson p: 2.8990e-41
  Pred range: [0.1287, 0.7732], std: 0.1057
  RMSE : 0.1921, R2: -0.2320, MAE: 0.1640, Spearman rho: 0.4822, Spearman p: 3.7412e-36, Pearson r: 0.5083, Pearson p: 1.3342e-40
  Pred range: [0.0873, 0.7089], std: 0.1039
  RMSE : 0.1684, R2: 0.0535, MAE: 0.1407, Spearman rho: 0.4774, Spearman p: 2.3006e-35, Pearson r: 0.5077, Pearson p: 1.6881e-40
[I 2026-04-28 00:33:13,266] Trial 2 finished with value: 0.16838312047975254 and parameters: {'learning_rate': 0.003598851903155482, 'batch_size': 32, 'num_epochs': 13, 'weight_decay': 0.0015686230055826497, 'depth_complex': 6, 'depth_moderate': 4, 'depth_simple': 1, 'dropout': 0.3989664029554659, 'se_reduction': 8, 'hidden_dim_min': 4, 'base_loss': 'huber', 'huber_delta': 0.024222202488842312, 'focal_gamma': 1.622595236582262, 'n_bins': 17, 'scheduler_patience': 5, 'scheduler_factor': 0.6597854279079691, 'early_stopping_patience': 6}. Best is trial 0 with value: 0.16419618132989797.
Train: 2407 rows (1613 IDs),Test: 598 rows (404 IDs) 

n_features_x : 6, n_features_per_modality: [16, 23, 19, 17, 7, 4, 4, 4, 1, 4]

--- ImbalancedRegressionLoss initialized ---
  Bins: 5, Focal gamma: 2.3552523381834165, Base loss: huber
  Bin [0.00, 0.20): count= 1165, weight=0.037
  Bin [0.20, 0.40): count=  806, weight=0.054
  Bin [0.40, 0.60): count=  320, weight=0.136
  Bin [0.60, 0.80): count=  107, weight=0.404
  Bin [0.80, 1.00): count=    9, weight=4.368
-------------------------------------------

  Pred range: [0.0777, 0.5631], std: 0.0719
  RMSE : 0.1739, R2: -0.0096, MAE: 0.1414, Spearman rho: 0.2976, Spearman p: 1.0735e-13, Pearson r: 0.2922, Pearson p: 3.0985e-13
  Pred range: [0.0849, 0.5885], std: 0.0762
  RMSE : 0.1748, R2: -0.0201, MAE: 0.1442, Spearman rho: 0.3426, Spearman p: 6.5628e-18, Pearson r: 0.3439, Pearson p: 4.8614e-18
  Pred range: [0.0830, 0.5714], std: 0.0765
  RMSE : 0.1698, R2: 0.0376, MAE: 0.1393, Spearman rho: 0.3698, Spearman p: 8.1587e-21, Pearson r: 0.3739, Pearson p: 2.7712e-21
  Pred range: [0.0824, 0.5750], std: 0.0786
  RMSE : 0.1673, R2: 0.0662, MAE: 0.1369, Spearman rho: 0.3876, Spearman p: 7.0758e-23, Pearson r: 0.3947, Pearson p: 9.9083e-24
  Pred range: [0.0836, 0.5639], std: 0.0795
  RMSE : 0.1664, R2: 0.0758, MAE: 0.1363, Spearman rho: 0.3968, Spearman p: 5.4096e-24, Pearson r: 0.4070, Pearson p: 2.8636e-25
  Pred range: [0.0886, 0.5909], std: 0.0831
  RMSE : 0.1688, R2: 0.0485, MAE: 0.1396, Spearman rho: 0.4059, Spearman p: 4.0205e-25, Pearson r: 0.4170, Pearson p: 1.4618e-26
  Pred range: [0.0856, 0.5638], std: 0.0813
  RMSE : 0.1645, R2: 0.0972, MAE: 0.1347, Spearman rho: 0.4136, Spearman p: 4.0786e-26, Pearson r: 0.4248, Pearson p: 1.3530e-27
  Pred range: [0.0883, 0.5770], std: 0.0829
  RMSE : 0.1651, R2: 0.0905, MAE: 0.1358, Spearman rho: 0.4212, Spearman p: 4.1318e-27, Pearson r: 0.4319, Pearson p: 1.4109e-28
  Pred range: [0.0886, 0.5797], std: 0.0831
  RMSE : 0.1642, R2: 0.1002, MAE: 0.1350, Spearman rho: 0.4270, Spearman p: 6.6989e-28, Pearson r: 0.4378, Pearson p: 2.1484e-29
  Pred range: [0.0903, 0.5876], std: 0.0840
  RMSE : 0.1644, R2: 0.0976, MAE: 0.1355, Spearman rho: 0.4314, Spearman p: 1.6569e-28, Pearson r: 0.4420, Pearson p: 5.4905e-30
  Pred range: [0.0915, 0.5893], std: 0.0832
  RMSE : 0.1636, R2: 0.1066, MAE: 0.1347, Spearman rho: 0.4351, Spearman p: 5.1434e-29, Pearson r: 0.4458, Pearson p: 1.5573e-30
  Pred range: [0.0901, 0.5800], std: 0.0820
  RMSE : 0.1615, R2: 0.1292, MAE: 0.1324, Spearman rho: 0.4384, Spearman p: 1.7850e-29, Pearson r: 0.4493, Pearson p: 4.7535e-31
  Pred range: [0.0934, 0.5888], std: 0.0827
  RMSE : 0.1628, R2: 0.1154, MAE: 0.1342, Spearman rho: 0.4409, Spearman p: 7.8988e-30, Pearson r: 0.4524, Pearson p: 1.6703e-31
  Pred range: [0.0968, 0.6033], std: 0.0847
  RMSE : 0.1643, R2: 0.0985, MAE: 0.1361, Spearman rho: 0.4458, Spearman p: 1.5496e-30, Pearson r: 0.4564, Pearson p: 4.1291e-32
  Pred range: [0.0945, 0.5976], std: 0.0843
  RMSE : 0.1625, R2: 0.1188, MAE: 0.1341, Spearman rho: 0.4497, Spearman p: 4.1254e-31, Pearson r: 0.4605, Pearson p: 1.0245e-32
  Pred range: [0.0940, 0.5855], std: 0.0825
  RMSE : 0.1606, R2: 0.1390, MAE: 0.1320, Spearman rho: 0.4523, Spearman p: 1.6924e-31, Pearson r: 0.4626, Pearson p: 4.7370e-33
  Pred range: [0.0946, 0.5857], std: 0.0822
  RMSE : 0.1604, R2: 0.1415, MAE: 0.1318, Spearman rho: 0.4538, Spearman p: 1.0125e-31, Pearson r: 0.4644, Pearson p: 2.5117e-33
  Pred range: [0.0946, 0.5893], std: 0.0830
  RMSE : 0.1603, R2: 0.1425, MAE: 0.1318, Spearman rho: 0.4568, Spearman p: 3.6812e-32, Pearson r: 0.4670, Pearson p: 9.9574e-34
  Pred range: [0.0938, 0.5811], std: 0.0819
  RMSE : 0.1591, R2: 0.1547, MAE: 0.1305, Spearman rho: 0.4592, Spearman p: 1.5988e-32, Pearson r: 0.4692, Pearson p: 4.6511e-34
  Pred range: [0.0926, 0.5801], std: 0.0824
  RMSE : 0.1586, R2: 0.1599, MAE: 0.1299, Spearman rho: 0.4610, Spearman p: 8.3301e-33, Pearson r: 0.4711, Pearson p: 2.2741e-34
  Pred range: [0.0992, 0.6031], std: 0.0852
  RMSE : 0.1625, R2: 0.1189, MAE: 0.1346, Spearman rho: 0.4614, Spearman p: 7.2575e-33, Pearson r: 0.4722, Pearson p: 1.5186e-34
  Pred range: [0.1029, 0.6173], std: 0.0871
  RMSE : 0.1650, R2: 0.0916, MAE: 0.1373, Spearman rho: 0.4624, Spearman p: 5.2119e-33, Pearson r: 0.4737, Pearson p: 8.8601e-35
  Pred range: [0.0954, 0.5840], std: 0.0833
  RMSE : 0.1588, R2: 0.1581, MAE: 0.1305, Spearman rho: 0.4664, Spearman p: 1.2583e-33, Pearson r: 0.4768, Pearson p: 2.8441e-35
  Pred range: [0.0939, 0.5794], std: 0.0831
  RMSE : 0.1580, R2: 0.1670, MAE: 0.1294, Spearman rho: 0.4676, Spearman p: 8.2264e-34, Pearson r: 0.4783, Pearson p: 1.6535e-35
  Pred range: [0.0960, 0.5857], std: 0.0832
  RMSE : 0.1583, R2: 0.1638, MAE: 0.1300, Spearman rho: 0.4681, Spearman p: 6.7414e-34, Pearson r: 0.4798, Pearson p: 9.4826e-36
  Pred range: [0.1019, 0.6109], std: 0.0865
  RMSE : 0.1622, R2: 0.1222, MAE: 0.1346, Spearman rho: 0.4685, Spearman p: 5.9772e-34, Pearson r: 0.4806, Pearson p: 6.8536e-36
  Pred range: [0.0971, 0.5890], std: 0.0835
  RMSE : 0.1581, R2: 0.1661, MAE: 0.1298, Spearman rho: 0.4719, Spearman p: 1.7206e-34, Pearson r: 0.4827, Pearson p: 3.1699e-36
  Pred range: [0.1007, 0.6028], std: 0.0853
  RMSE : 0.1603, R2: 0.1423, MAE: 0.1326, Spearman rho: 0.4717, Spearman p: 1.8221e-34, Pearson r: 0.4830, Pearson p: 2.7729e-36
  Pred range: [0.1000, 0.6028], std: 0.0852
  RMSE : 0.1595, R2: 0.1509, MAE: 0.1317, Spearman rho: 0.4732, Spearman p: 1.0665e-34, Pearson r: 0.4848, Pearson p: 1.4159e-36
  Pred range: [0.0975, 0.5926], std: 0.0841
  RMSE : 0.1578, R2: 0.1691, MAE: 0.1296, Spearman rho: 0.4740, Spearman p: 7.8687e-35, Pearson r: 0.4859, Pearson p: 9.3386e-37
[I 2026-04-28 00:37:51,169] Trial 3 finished with value: 0.1577703419641654 and parameters: {'learning_rate': 5.762669070905026e-05, 'batch_size': 6, 'num_epochs': 30, 'weight_decay': 0.0008132365024906249, 'depth_complex': 6, 'depth_moderate': 5, 'depth_simple': 3, 'dropout': 0.2916211012784494, 'se_reduction': 2, 'hidden_dim_min': 13, 'base_loss': 'huber', 'huber_delta': 0.10415524994563614, 'focal_gamma': 2.3552523381834165, 'n_bins': 5, 'scheduler_patience': 4, 'scheduler_factor': 0.5290879516957319, 'early_stopping_patience': 6}. Best is trial 3 with value: 0.1577703419641654.
Train: 2407 rows (1613 IDs),Test: 598 rows (404 IDs) 

n_features_x : 6, n_features_per_modality: [16, 23, 19, 17, 7, 4, 4, 4, 1, 4]

--- ImbalancedRegressionLoss initialized ---
  Bins: 16, Focal gamma: 0.6013301885298384, Base loss: huber
  Bin [0.00, 0.06): count=  383, weight=0.041
  Bin [0.06, 0.12): count=  377, weight=0.042
  Bin [0.12, 0.19): count=  405, weight=0.039
  Bin [0.19, 0.25): count=  295, weight=0.053
  Bin [0.25, 0.31): count=  239, weight=0.066
  Bin [0.31, 0.38): count=  199, weight=0.079
  Bin [0.38, 0.44): count=  142, weight=0.111
  Bin [0.44, 0.50): count=  122, weight=0.129
  Bin [0.50, 0.56): count=   93, weight=0.168
  Bin [0.56, 0.62): count=   64, weight=0.243
  Bin [0.62, 0.69): count=   36, weight=0.427
  Bin [0.69, 0.75): count=   24, weight=0.633
  Bin [0.75, 0.81): count=   19, weight=0.791
  Bin [0.81, 0.88): count=    5, weight=2.636
  Bin [0.88, 0.94): count=    2, weight=5.271
  Bin [0.94, 1.00): count=    2, weight=5.271
-------------------------------------------

  Pred range: [0.0456, 0.6302], std: 0.1004
  RMSE : 0.1557, R2: 0.1908, MAE: 0.1270, Spearman rho: 0.4601, Spearman p: 1.1656e-32, Pearson r: 0.4909, Pearson p: 1.3851e-37
  Pred range: [0.1124, 0.8008], std: 0.1155
  RMSE : 0.1980, R2: -0.3086, MAE: 0.1690, Spearman rho: 0.4812, Spearman p: 5.4248e-36, Pearson r: 0.5079, Pearson p: 1.5350e-40
  Pred range: [0.0788, 0.8408], std: 0.1339
  RMSE : 0.1865, R2: -0.1614, MAE: 0.1549, Spearman rho: 0.4886, Spearman p: 3.3327e-37, Pearson r: 0.5212, Pearson p: 5.9695e-43
  Pred range: [-0.0674, 0.5877], std: 0.1099
  RMSE : 0.1566, R2: 0.1810, MAE: 0.1243, Spearman rho: 0.4453, Spearman p: 1.8455e-30, Pearson r: 0.4614, Pearson p: 7.3699e-33
  Pred range: [0.0716, 0.7327], std: 0.1152
  RMSE : 0.1595, R2: 0.1512, MAE: 0.1301, Spearman rho: 0.4800, Spearman p: 8.6209e-36, Pearson r: 0.5111, Pearson p: 4.1672e-41
  Pred range: [0.1347, 0.8650], std: 0.1372
  RMSE : 0.2184, R2: -0.5923, MAE: 0.1848, Spearman rho: 0.4838, Spearman p: 2.1071e-36, Pearson r: 0.5106, Pearson p: 5.0976e-41
  Pred range: [0.1066, 0.7956], std: 0.1153
  RMSE : 0.1949, R2: -0.2676, MAE: 0.1655, Spearman rho: 0.4678, Spearman p: 7.6129e-34, Pearson r: 0.4989, Pearson p: 5.9491e-39
  Pred range: [0.0675, 0.7509], std: 0.1198
  RMSE : 0.1771, R2: -0.0475, MAE: 0.1472, Spearman rho: 0.4706, Spearman p: 2.7915e-34, Pearson r: 0.5026, Pearson p: 1.3659e-39
  Pred range: [0.1090, 0.7698], std: 0.1203
  RMSE : 0.1911, R2: -0.2192, MAE: 0.1608, Spearman rho: 0.4768, Spearman p: 2.8454e-35, Pearson r: 0.5077, Pearson p: 1.7018e-40
[I 2026-04-28 00:38:10,881] Trial 4 finished with value: 0.1556957487836869 and parameters: {'learning_rate': 0.007244115796683524, 'batch_size': 16, 'num_epochs': 30, 'weight_decay': 0.000502519296023492, 'depth_complex': 4, 'depth_moderate': 2, 'depth_simple': 3, 'dropout': 0.10164665613575097, 'se_reduction': 7, 'hidden_dim_min': 14, 'base_loss': 'huber', 'huber_delta': 0.08642601343248792, 'focal_gamma': 0.6013301885298384, 'n_bins': 16, 'scheduler_patience': 2, 'scheduler_factor': 0.47264974787253694, 'early_stopping_patience': 8}. Best is trial 4 with value: 0.1556957487836869.
Train: 2407 rows (1613 IDs),Test: 598 rows (404 IDs) 

n_features_x : 6, n_features_per_modality: [16, 23, 19, 17, 7, 4, 4, 4, 1, 4]

--- ImbalancedRegressionLoss initialized ---
  Bins: 7, Focal gamma: 2.294822505204592, Base loss: mse
  Bin [0.00, 0.14): count=  760, weight=0.038
  Bin [0.14, 0.29): count=  826, weight=0.035
  Bin [0.29, 0.43): count=  454, weight=0.063
  Bin [0.43, 0.57): count=  215, weight=0.133
  Bin [0.57, 0.71): count=  110, weight=0.258
  Bin [0.71, 0.86): count=   38, weight=0.736
  Bin [0.86, 1.00): count=    4, weight=5.738
-------------------------------------------

  Pred range: [0.1099, 0.5500], std: 0.0613
  RMSE : 0.1683, R2: 0.0546, MAE: 0.1369, Spearman rho: 0.3100, Spearman p: 8.7123e-15, Pearson r: 0.3201, Pearson p: 1.0196e-15
  Pred range: [0.1121, 0.5697], std: 0.0709
  RMSE : 0.1653, R2: 0.0874, MAE: 0.1355, Spearman rho: 0.3867, Spearman p: 9.1345e-23, Pearson r: 0.3915, Pearson p: 2.4510e-23
  Pred range: [0.1162, 0.5755], std: 0.0757
  RMSE : 0.1628, R2: 0.1153, MAE: 0.1331, Spearman rho: 0.4174, Spearman p: 1.2854e-26, Pearson r: 0.4220, Pearson p: 3.2289e-27
  Pred range: [0.1101, 0.5128], std: 0.0722
  RMSE : 0.1553, R2: 0.1944, MAE: 0.1232, Spearman rho: 0.4446, Spearman p: 2.3322e-30, Pearson r: 0.4491, Pearson p: 5.1648e-31
  Pred range: [0.1234, 0.5255], std: 0.0722
  RMSE : 0.1563, R2: 0.1841, MAE: 0.1267, Spearman rho: 0.4578, Spearman p: 2.6188e-32, Pearson r: 0.4648, Pearson p: 2.1711e-33
  Pred range: [0.1339, 0.5764], std: 0.0778
  RMSE : 0.1608, R2: 0.1374, MAE: 0.1336, Spearman rho: 0.4708, Spearman p: 2.5890e-34, Pearson r: 0.4808, Pearson p: 6.4734e-36
  Pred range: [0.1319, 0.5886], std: 0.0800
  RMSE : 0.1602, R2: 0.1432, MAE: 0.1334, Spearman rho: 0.4797, Spearman p: 9.5936e-36, Pearson r: 0.4922, Pearson p: 8.3059e-38
  Pred range: [0.1400, 0.6516], std: 0.0889
  RMSE : 0.1686, R2: 0.0514, MAE: 0.1424, Spearman rho: 0.4814, Spearman p: 5.1479e-36, Pearson r: 0.4979, Pearson p: 8.9436e-39
  Pred range: [0.1152, 0.5714], std: 0.0800
  RMSE : 0.1518, R2: 0.2309, MAE: 0.1227, Spearman rho: 0.4844, Spearman p: 1.6648e-36, Pearson r: 0.5057, Pearson p: 3.8560e-40
  Pred range: [0.1226, 0.5953], std: 0.0850
  RMSE : 0.1532, R2: 0.2166, MAE: 0.1249, Spearman rho: 0.4854, Spearman p: 1.1411e-36, Pearson r: 0.5078, Pearson p: 1.6168e-40
  Pred range: [0.1306, 0.5932], std: 0.0841
  RMSE : 0.1562, R2: 0.1855, MAE: 0.1288, Spearman rho: 0.4851, Spearman p: 1.2535e-36, Pearson r: 0.5064, Pearson p: 2.8645e-40
  Pred range: [0.1363, 0.5947], std: 0.0850
  RMSE : 0.1590, R2: 0.1559, MAE: 0.1324, Spearman rho: 0.4901, Spearman p: 1.8878e-37, Pearson r: 0.5106, Pearson p: 5.0598e-41
  Pred range: [0.1282, 0.5894], std: 0.0879
  RMSE : 0.1553, R2: 0.1953, MAE: 0.1278, Spearman rho: 0.4926, Spearman p: 7.1122e-38, Pearson r: 0.5162, Pearson p: 4.9494e-42
  Pred range: [0.1364, 0.6626], std: 0.0952
  RMSE : 0.1646, R2: 0.0961, MAE: 0.1379, Spearman rho: 0.4903, Spearman p: 1.6950e-37, Pearson r: 0.5122, Pearson p: 2.5946e-41
  Pred range: [0.1169, 0.6301], std: 0.0909
  RMSE : 0.1579, R2: 0.1676, MAE: 0.1309, Spearman rho: 0.4890, Spearman p: 2.8196e-37, Pearson r: 0.5128, Pearson p: 2.0372e-41
  Pred range: [0.1087, 0.5852], std: 0.0862
  RMSE : 0.1529, R2: 0.2195, MAE: 0.1248, Spearman rho: 0.4885, Spearman p: 3.3983e-37, Pearson r: 0.5124, Pearson p: 2.3951e-41
  Pred range: [0.0964, 0.5965], std: 0.0874
  RMSE : 0.1528, R2: 0.2206, MAE: 0.1246, Spearman rho: 0.4875, Spearman p: 5.0078e-37, Pearson r: 0.5125, Pearson p: 2.3620e-41
