[I 2026-04-27 23:29:19,283] Trial 11 finished with value: 0.08856971439066418 and parameters: {'learning_rate': 0.0028398275800759964, 'batch_size': 4, 'num_epochs': 18, 'weight_decay': 0.0010675727441560924, 'depth_complex': 4, 'depth_moderate': 3, 'depth_simple': 2, 'dropout': 0.32553352880633524, 'se_reduction': 6, 'hidden_dim_min': 6, 'base_loss': 'huber', 'huber_delta': 0.027482158924898734, 'focal_gamma': 2.9835752908753337, 'n_bins': 12, 'scheduler_patience': 3, 'scheduler_factor': 0.640380787136512, 'early_stopping_patience': 5}. Best is trial 8 with value: 0.08787048956906457.
Train: 2407 rows (1613 IDs),Test: 598 rows (404 IDs) 

n_features_x : 6, n_features_per_modality: [16, 23, 19, 17, 7, 4, 4, 4, 1, 4]

--- ImbalancedRegressionLoss initialized ---
  Bins: 5, Focal gamma: 1.3138918464157232, Base loss: huber
  Bin [0.00, 0.20): count= 1876, weight=0.002
  Bin [0.20, 0.40): count=  497, weight=0.007
  Bin [0.40, 0.60): count=   32, weight=0.111
  Bin [0.60, 0.80): count=    2, weight=1.220
  Bin [0.80, 1.00): count=    0, weight=3.660
-------------------------------------------

  Pred range: [-0.0597, 0.2766], std: 0.0510
  RMSE : 0.1185, R2: -0.3867, MAE: 0.0911, Spearman rho: 0.4462, Spearman p: 1.3466e-30, Pearson r: 0.4582, Pearson p: 2.2400e-32
  Pred range: [0.0173, 0.4015], std: 0.0591
  RMSE : 0.0935, R2: 0.1363, MAE: 0.0748, Spearman rho: 0.4196, Spearman p: 6.6480e-27, Pearson r: 0.4289, Pearson p: 3.6928e-28
  Pred range: [0.0361, 0.4940], std: 0.0746
  RMSE : 0.1035, R2: -0.0583, MAE: 0.0819, Spearman rho: 0.4363, Spearman p: 3.4592e-29, Pearson r: 0.4350, Pearson p: 5.2654e-29
  Pred range: [0.0403, 0.4124], std: 0.0606
  RMSE : 0.0995, R2: 0.0223, MAE: 0.0800, Spearman rho: 0.4126, Spearman p: 5.5451e-26, Pearson r: 0.4191, Pearson p: 7.8448e-27
  Pred range: [0.0135, 0.3746], std: 0.0673
  RMSE : 0.0915, R2: 0.1723, MAE: 0.0717, Spearman rho: 0.4868, Spearman p: 6.5566e-37, Pearson r: 0.4777, Pearson p: 2.0471e-35
  Pred range: [-0.0383, 0.3259], std: 0.0585
  RMSE : 0.0984, R2: 0.0435, MAE: 0.0747, Spearman rho: 0.4601, Spearman p: 1.1656e-32, Pearson r: 0.4684, Pearson p: 6.1565e-34
  Pred range: [0.0283, 0.5388], std: 0.0764
  RMSE : 0.0983, R2: 0.0448, MAE: 0.0773, Spearman rho: 0.4435, Spearman p: 3.3169e-30, Pearson r: 0.4475, Pearson p: 8.7470e-31
  Pred range: [0.0015, 0.4195], std: 0.0681
  RMSE : 0.0907, R2: 0.1878, MAE: 0.0708, Spearman rho: 0.4698, Spearman p: 3.7280e-34, Pearson r: 0.4772, Pearson p: 2.4320e-35
  Pred range: [0.1024, 0.4935], std: 0.0656
  RMSE : 0.1330, R2: -0.7492, MAE: 0.1129, Spearman rho: 0.4437, Spearman p: 3.0429e-30, Pearson r: 0.4502, Pearson p: 3.5172e-31
  Pred range: [0.0257, 0.3724], std: 0.0594
  RMSE : 0.0909, R2: 0.1838, MAE: 0.0735, Spearman rho: 0.4932, Spearman p: 5.6095e-38, Pearson r: 0.4951, Pearson p: 2.6146e-38
  Pred range: [-0.0325, 0.3149], std: 0.0558
  RMSE : 0.0915, R2: 0.1722, MAE: 0.0705, Spearman rho: 0.4573, Spearman p: 3.0308e-32, Pearson r: 0.4628, Pearson p: 4.5538e-33
  Pred range: [0.0667, 0.4307], std: 0.0610
  RMSE : 0.1084, R2: -0.1616, MAE: 0.0886, Spearman rho: 0.4277, Spearman p: 5.3987e-28, Pearson r: 0.4353, Pearson p: 4.8660e-29
  Pred range: [0.0318, 0.3520], std: 0.0573
  RMSE : 0.0890, R2: 0.2167, MAE: 0.0701, Spearman rho: 0.4755, Spearman p: 4.6606e-35, Pearson r: 0.4770, Pearson p: 2.5995e-35
  Pred range: [0.0043, 0.3899], std: 0.0668
  RMSE : 0.0912, R2: 0.1780, MAE: 0.0701, Spearman rho: 0.4665, Spearman p: 1.2096e-33, Pearson r: 0.4680, Pearson p: 6.9729e-34
  Pred range: [0.0344, 0.4045], std: 0.0639
  RMSE : 0.0956, R2: 0.0965, MAE: 0.0777, Spearman rho: 0.4665, Spearman p: 1.2232e-33, Pearson r: 0.4738, Pearson p: 8.7418e-35
  Pred range: [0.0302, 0.4280], std: 0.0606
  RMSE : 0.1030, R2: -0.0477, MAE: 0.0840, Spearman rho: 0.4659, Spearman p: 1.5147e-33, Pearson r: 0.4575, Pearson p: 2.8335e-32
  Pred range: [0.0175, 0.3428], std: 0.0566
  RMSE : 0.0889, R2: 0.2184, MAE: 0.0699, Spearman rho: 0.4815, Spearman p: 4.8597e-36, Pearson r: 0.4780, Pearson p: 1.7912e-35
  Pred range: [0.0448, 0.4050], std: 0.0524
  RMSE : 0.1098, R2: -0.1908, MAE: 0.0919, Spearman rho: 0.4381, Spearman p: 1.9604e-29, Pearson r: 0.4510, Pearson p: 2.6637e-31
  Pred range: [-0.0380, 0.3486], std: 0.0561
  RMSE : 0.0935, R2: 0.1354, MAE: 0.0722, Spearman rho: 0.4543, Spearman p: 8.5504e-32, Pearson r: 0.4613, Pearson p: 7.5569e-33
[I 2026-04-27 23:32:07,473] Trial 12 finished with value: 0.08893419715642129 and parameters: {'learning_rate': 0.003917036285644105, 'batch_size': 4, 'num_epochs': 19, 'weight_decay': 0.00019952881722489087, 'depth_complex': 4, 'depth_moderate': 3, 'depth_simple': 3, 'dropout': 0.34824509853807273, 'se_reduction': 5, 'hidden_dim_min': 5, 'base_loss': 'huber', 'huber_delta': 0.012702473560827193, 'focal_gamma': 1.3138918464157232, 'n_bins': 5, 'scheduler_patience': 3, 'scheduler_factor': 0.6794839219733854, 'early_stopping_patience': 5}. Best is trial 8 with value: 0.08787048956906457.
Train: 2407 rows (1613 IDs),Test: 598 rows (404 IDs) 

n_features_x : 6, n_features_per_modality: [16, 23, 19, 17, 7, 4, 4, 4, 1, 4]

--- ImbalancedRegressionLoss initialized ---
  Bins: 11, Focal gamma: 2.408142525316849, Base loss: huber
  Bin [0.00, 0.09): count= 1010, weight=0.003
  Bin [0.09, 0.18): count=  706, weight=0.004
  Bin [0.18, 0.27): count=  478, weight=0.006
  Bin [0.27, 0.36): count=  159, weight=0.018
  Bin [0.36, 0.45): count=   33, weight=0.085
  Bin [0.45, 0.55): count=   16, weight=0.170
  Bin [0.55, 0.64): count=    4, weight=0.579
  Bin [0.64, 0.73): count=    1, weight=1.448
  Bin [0.73, 0.82): count=    0, weight=2.896
  Bin [0.82, 0.91): count=    0, weight=2.896
  Bin [0.91, 1.00): count=    0, weight=2.896
-------------------------------------------

  Pred range: [0.0031, 0.2914], std: 0.0494
  RMSE : 0.0906, R2: 0.1883, MAE: 0.0700, Spearman rho: 0.4534, Spearman p: 1.1690e-31, Pearson r: 0.4598, Pearson p: 1.2887e-32
  Pred range: [0.0621, 0.4156], std: 0.0548
  RMSE : 0.0942, R2: 0.1235, MAE: 0.0756, Spearman rho: 0.4259, Spearman p: 9.6180e-28, Pearson r: 0.4393, Pearson p: 1.2946e-29
  Pred range: [0.0174, 0.3114], std: 0.0518
  RMSE : 0.0901, R2: 0.1971, MAE: 0.0709, Spearman rho: 0.4452, Spearman p: 1.8898e-30, Pearson r: 0.4493, Pearson p: 4.8260e-31
  Pred range: [0.0540, 0.4377], std: 0.0610
  RMSE : 0.1000, R2: 0.0124, MAE: 0.0815, Spearman rho: 0.4461, Spearman p: 1.3897e-30, Pearson r: 0.4480, Pearson p: 7.3341e-31
  Pred range: [0.0343, 0.4057], std: 0.0563
  RMSE : 0.0909, R2: 0.1834, MAE: 0.0713, Spearman rho: 0.4408, Spearman p: 8.1186e-30, Pearson r: 0.4460, Pearson p: 1.4559e-30
  Pred range: [0.0429, 0.3134], std: 0.0496
  RMSE : 0.0897, R2: 0.2056, MAE: 0.0709, Spearman rho: 0.4510, Spearman p: 2.6947e-31, Pearson r: 0.4552, Pearson p: 6.3514e-32
  Pred range: [0.0445, 0.3463], std: 0.0528
  RMSE : 0.0889, R2: 0.2183, MAE: 0.0704, Spearman rho: 0.4616, Spearman p: 6.9508e-33, Pearson r: 0.4719, Pearson p: 1.7255e-34
  Pred range: [0.0580, 0.3380], std: 0.0495
  RMSE : 0.0913, R2: 0.1768, MAE: 0.0735, Spearman rho: 0.4608, Spearman p: 9.2228e-33, Pearson r: 0.4705, Pearson p: 2.8790e-34
  Pred range: [0.0250, 0.2668], std: 0.0428
  RMSE : 0.0946, R2: 0.1161, MAE: 0.0730, Spearman rho: 0.4522, Spearman p: 1.7563e-31, Pearson r: 0.4546, Pearson p: 7.9151e-32
  Pred range: [0.0316, 0.3098], std: 0.0437
  RMSE : 0.0949, R2: 0.1092, MAE: 0.0742, Spearman rho: 0.4262, Spearman p: 8.6972e-28, Pearson r: 0.4324, Pearson p: 1.2270e-28
  Pred range: [0.0333, 0.2832], std: 0.0419
  RMSE : 0.0922, R2: 0.1593, MAE: 0.0717, Spearman rho: 0.4734, Spearman p: 9.9147e-35, Pearson r: 0.4722, Pearson p: 1.5512e-34
  Pred range: [0.0773, 0.3143], std: 0.0415
  RMSE : 0.0920, R2: 0.1640, MAE: 0.0745, Spearman rho: 0.4566, Spearman p: 3.9099e-32, Pearson r: 0.4624, Pearson p: 5.2326e-33
  Pred range: [0.0572, 0.2690], std: 0.0380
  RMSE : 0.0885, R2: 0.2252, MAE: 0.0708, Spearman rho: 0.4807, Spearman p: 6.6643e-36, Pearson r: 0.4883, Pearson p: 3.7474e-37
  Pred range: [0.0424, 0.2380], std: 0.0350
  RMSE : 0.0936, R2: 0.1346, MAE: 0.0733, Spearman rho: 0.4444, Spearman p: 2.4817e-30, Pearson r: 0.4560, Pearson p: 4.7624e-32
  Pred range: [0.0569, 0.3169], std: 0.0448
  RMSE : 0.0898, R2: 0.2033, MAE: 0.0718, Spearman rho: 0.4512, Spearman p: 2.5333e-31, Pearson r: 0.4606, Pearson p: 9.6884e-33
  Pred range: [0.0469, 0.3247], std: 0.0532
  RMSE : 0.0895, R2: 0.2080, MAE: 0.0711, Spearman rho: 0.4647, Spearman p: 2.3009e-33, Pearson r: 0.4711, Pearson p: 2.2628e-34
  Pred range: [0.0658, 0.3782], std: 0.0567
  RMSE : 0.0971, R2: 0.0690, MAE: 0.0790, Spearman rho: 0.4649, Spearman p: 2.1455e-33, Pearson r: 0.4693, Pearson p: 4.3744e-34
  Pred range: [0.0697, 0.3313], std: 0.0454
  RMSE : 0.0910, R2: 0.1822, MAE: 0.0733, Spearman rho: 0.4610, Spearman p: 8.5278e-33, Pearson r: 0.4688, Pearson p: 5.3109e-34
  Pred range: [0.0565, 0.3177], std: 0.0447
  RMSE : 0.0888, R2: 0.2200, MAE: 0.0709, Spearman rho: 0.4691, Spearman p: 4.6621e-34, Pearson r: 0.4760, Pearson p: 3.7581e-35
  Pred range: [0.0609, 0.3459], std: 0.0490
  RMSE : 0.0907, R2: 0.1866, MAE: 0.0729, Spearman rho: 0.4570, Spearman p: 3.3601e-32, Pearson r: 0.4652, Pearson p: 1.8952e-33
[I 2026-04-27 23:34:38,158] Trial 13 finished with value: 0.08854807159688294 and parameters: {'learning_rate': 0.0021563051275702407, 'batch_size': 4, 'num_epochs': 23, 'weight_decay': 0.009458104849786476, 'depth_complex': 3, 'depth_moderate': 4, 'depth_simple': 1, 'dropout': 0.3412162278141214, 'se_reduction': 6, 'hidden_dim_min': 6, 'base_loss': 'huber', 'huber_delta': 0.05943439137376937, 'focal_gamma': 2.408142525316849, 'n_bins': 11, 'scheduler_patience': 2, 'scheduler_factor': 0.627000174512185, 'early_stopping_patience': 7}. Best is trial 8 with value: 0.08787048956906457.
Train: 2407 rows (1613 IDs),Test: 598 rows (404 IDs) 

n_features_x : 6, n_features_per_modality: [16, 23, 19, 17, 7, 4, 4, 4, 1, 4]

--- ImbalancedRegressionLoss initialized ---
  Bins: 7, Focal gamma: 2.2054785460268036, Base loss: huber
  Bin [0.00, 0.14): count= 1370, weight=0.002
  Bin [0.14, 0.29): count=  892, weight=0.003
  Bin [0.29, 0.43): count=  120, weight=0.024
  Bin [0.43, 0.57): count=   23, weight=0.122
  Bin [0.57, 0.71): count=    2, weight=0.978
  Bin [0.71, 0.86): count=    0, weight=2.935
  Bin [0.86, 1.00): count=    0, weight=2.935
-------------------------------------------

  Pred range: [0.0549, 0.2993], std: 0.0441
  RMSE : 0.0890, R2: 0.2170, MAE: 0.0707, Spearman rho: 0.4699, Spearman p: 3.4871e-34, Pearson r: 0.4693, Pearson p: 4.4149e-34
  Pred range: [0.0723, 0.3346], std: 0.0465
  RMSE : 0.0929, R2: 0.1471, MAE: 0.0752, Spearman rho: 0.4608, Spearman p: 9.0913e-33, Pearson r: 0.4680, Pearson p: 7.1047e-34
  Pred range: [0.0768, 0.3728], std: 0.0542
  RMSE : 0.0993, R2: 0.0263, MAE: 0.0813, Spearman rho: 0.4613, Spearman p: 7.5960e-33, Pearson r: 0.4668, Pearson p: 1.0849e-33
  Pred range: [0.0428, 0.3596], std: 0.0566
  RMSE : 0.0927, R2: 0.1503, MAE: 0.0742, Spearman rho: 0.4607, Spearman p: 9.5141e-33, Pearson r: 0.4589, Pearson p: 1.7795e-32
  Pred range: [0.0719, 0.4172], std: 0.0541
  RMSE : 0.0970, R2: 0.0699, MAE: 0.0784, Spearman rho: 0.4512, Spearman p: 2.5244e-31, Pearson r: 0.4516, Pearson p: 2.2073e-31
  Pred range: [0.0346, 0.3247], std: 0.0519
  RMSE : 0.0889, R2: 0.2182, MAE: 0.0706, Spearman rho: 0.4687, Spearman p: 5.4084e-34, Pearson r: 0.4729, Pearson p: 1.2051e-34
  Pred range: [0.0467, 0.3434], std: 0.0528
  RMSE : 0.0891, R2: 0.2153, MAE: 0.0708, Spearman rho: 0.4673, Spearman p: 9.1260e-34, Pearson r: 0.4738, Pearson p: 8.6821e-35
  Pred range: [0.0523, 0.3370], std: 0.0510
  RMSE : 0.0890, R2: 0.2169, MAE: 0.0708, Spearman rho: 0.4703, Spearman p: 3.0155e-34, Pearson r: 0.4764, Pearson p: 3.3224e-35
  Pred range: [0.0448, 0.3226], std: 0.0492
  RMSE : 0.0880, R2: 0.2341, MAE: 0.0694, Spearman rho: 0.4808, Spearman p: 6.4803e-36, Pearson r: 0.4839, Pearson p: 2.0041e-36
  Pred range: [0.0405, 0.3679], std: 0.0548
  RMSE : 0.0888, R2: 0.2211, MAE: 0.0702, Spearman rho: 0.4739, Spearman p: 8.1378e-35, Pearson r: 0.4791, Pearson p: 1.2308e-35
  Pred range: [0.0337, 0.2943], std: 0.0460
  RMSE : 0.0899, R2: 0.2007, MAE: 0.0698, Spearman rho: 0.4796, Spearman p: 1.0068e-35, Pearson r: 0.4831, Pearson p: 2.7207e-36
  Pred range: [0.0567, 0.3383], std: 0.0495
  RMSE : 0.0891, R2: 0.2151, MAE: 0.0710, Spearman rho: 0.4749, Spearman p: 5.7433e-35, Pearson r: 0.4771, Pearson p: 2.5016e-35
  Pred range: [0.0656, 0.3557], std: 0.0509
  RMSE : 0.0921, R2: 0.1610, MAE: 0.0744, Spearman rho: 0.4686, Spearman p: 5.6024e-34, Pearson r: 0.4726, Pearson p: 1.3378e-34
  Pred range: [0.0497, 0.3186], std: 0.0478
  RMSE : 0.0886, R2: 0.2249, MAE: 0.0702, Spearman rho: 0.4705, Spearman p: 2.8178e-34, Pearson r: 0.4751, Pearson p: 5.3441e-35
  Pred range: [0.0566, 0.3431], std: 0.0492
  RMSE : 0.0897, R2: 0.2049, MAE: 0.0716, Spearman rho: 0.4627, Spearman p: 4.6359e-33, Pearson r: 0.4690, Pearson p: 4.9843e-34
  Pred range: [0.0487, 0.3315], std: 0.0497
  RMSE : 0.0888, R2: 0.2211, MAE: 0.0705, Spearman rho: 0.4688, Spearman p: 5.2727e-34, Pearson r: 0.4746, Pearson p: 6.4033e-35
[I 2026-04-27 23:36:38,000] Trial 14 finished with value: 0.08803786554080568 and parameters: {'learning_rate': 0.0011396214835748856, 'batch_size': 4, 'num_epochs': 24, 'weight_decay': 0.007595082663313613, 'depth_complex': 3, 'depth_moderate': 4, 'depth_simple': 1, 'dropout': 0.27375288195519076, 'se_reduction': 7, 'hidden_dim_min': 2, 'base_loss': 'huber', 'huber_delta': 0.05542203729032966, 'focal_gamma': 2.2054785460268036, 'n_bins': 7, 'scheduler_patience': 2, 'scheduler_factor': 0.5960047758832603, 'early_stopping_patience': 7}. Best is trial 8 with value: 0.08787048956906457.
Train: 2407 rows (1613 IDs),Test: 598 rows (404 IDs) 

n_features_x : 6, n_features_per_modality: [16, 23, 19, 17, 7, 4, 4, 4, 1, 4]

--- ImbalancedRegressionLoss initialized ---
  Bins: 7, Focal gamma: 2.147582876138241, Base loss: huber
  Bin [0.00, 0.14): count= 1370, weight=0.002
  Bin [0.14, 0.29): count=  892, weight=0.003
  Bin [0.29, 0.43): count=  120, weight=0.024
  Bin [0.43, 0.57): count=   23, weight=0.122
  Bin [0.57, 0.71): count=    2, weight=0.978
  Bin [0.71, 0.86): count=    0, weight=2.935
  Bin [0.86, 1.00): count=    0, weight=2.935
-------------------------------------------

  Pred range: [0.0495, 0.3900], std: 0.0613
  RMSE : 0.0987, R2: 0.0382, MAE: 0.0798, Spearman rho: 0.4024, Spearman p: 1.1066e-24, Pearson r: 0.4205, Pearson p: 5.0146e-27
  Pred range: [0.0661, 0.4113], std: 0.0640
  RMSE : 0.1044, R2: -0.0773, MAE: 0.0848, Spearman rho: 0.4280, Spearman p: 4.9720e-28, Pearson r: 0.4426, Pearson p: 4.3986e-30
  Pred range: [0.0608, 0.4003], std: 0.0602
  RMSE : 0.0978, R2: 0.0558, MAE: 0.0789, Spearman rho: 0.4348, Spearman p: 5.5897e-29, Pearson r: 0.4481, Pearson p: 7.1054e-31
  Pred range: [0.0678, 0.4283], std: 0.0615
  RMSE : 0.1002, R2: 0.0082, MAE: 0.0811, Spearman rho: 0.4369, Spearman p: 2.8642e-29, Pearson r: 0.4507, Pearson p: 2.9370e-31
  Pred range: [0.0536, 0.4432], std: 0.0637
  RMSE : 0.0961, R2: 0.0873, MAE: 0.0768, Spearman rho: 0.4470, Spearman p: 1.0340e-30, Pearson r: 0.4562, Pearson p: 4.5713e-32
  Pred range: [0.0536, 0.4197], std: 0.0588
  RMSE : 0.0934, R2: 0.1383, MAE: 0.0747, Spearman rho: 0.4477, Spearman p: 8.0139e-31, Pearson r: 0.4550, Pearson p: 6.7578e-32
  Pred range: [0.0553, 0.3942], std: 0.0568
  RMSE : 0.0946, R2: 0.1157, MAE: 0.0762, Spearman rho: 0.4573, Spearman p: 3.0256e-32, Pearson r: 0.4634, Pearson p: 3.6161e-33
  Pred range: [0.0751, 0.4103], std: 0.0576
  RMSE : 0.1006, R2: 0.0003, MAE: 0.0819, Spearman rho: 0.4530, Spearman p: 1.3342e-31, Pearson r: 0.4609, Pearson p: 8.8233e-33
[I 2026-04-27 23:36:54,993] Trial 15 pruned. 
Train: 2407 rows (1613 IDs),Test: 598 rows (404 IDs) 

n_features_x : 6, n_features_per_modality: [16, 23, 19, 17, 7, 4, 4, 4, 1, 4]

--- ImbalancedRegressionLoss initialized ---
  Bins: 7, Focal gamma: 1.4206370810468671, Base loss: huber
  Bin [0.00, 0.14): count= 1370, weight=0.002
  Bin [0.14, 0.29): count=  892, weight=0.003
  Bin [0.29, 0.43): count=  120, weight=0.024
  Bin [0.43, 0.57): count=   23, weight=0.122
  Bin [0.57, 0.71): count=    2, weight=0.978
  Bin [0.71, 0.86): count=    0, weight=2.935
  Bin [0.86, 1.00): count=    0, weight=2.935
-------------------------------------------

  Pred range: [0.0305, 0.3930], std: 0.0530
  RMSE : 0.0947, R2: 0.1144, MAE: 0.0744, Spearman rho: 0.3678, Spearman p: 1.3569e-20, Pearson r: 0.3758, Pearson p: 1.7095e-21
  Pred range: [0.0341, 0.4103], std: 0.0586
  RMSE : 0.0923, R2: 0.1585, MAE: 0.0725, Spearman rho: 0.4333, Spearman p: 9.2172e-29, Pearson r: 0.4354, Pearson p: 4.5962e-29
  Pred range: [0.0194, 0.3687], std: 0.0516
  RMSE : 0.0907, R2: 0.1877, MAE: 0.0719, Spearman rho: 0.4422, Spearman p: 5.1156e-30, Pearson r: 0.4427, Pearson p: 4.3556e-30
  Pred range: [0.0214, 0.3801], std: 0.0542
  RMSE : 0.0904, R2: 0.1916, MAE: 0.0719, Spearman rho: 0.4629, Spearman p: 4.3328e-33, Pearson r: 0.4606, Pearson p: 9.7783e-33
  Pred range: [0.0085, 0.3859], std: 0.0545
  RMSE : 0.0902, R2: 0.1963, MAE: 0.0717, Spearman rho: 0.4678, Spearman p: 7.6670e-34, Pearson r: 0.4642, Pearson p: 2.7415e-33
  Pred range: [0.0295, 0.4083], std: 0.0590
  RMSE : 0.0926, R2: 0.1522, MAE: 0.0737, Spearman rho: 0.4619, Spearman p: 6.0613e-33, Pearson r: 0.4598, Pearson p: 1.2670e-32
  Pred range: [0.0074, 0.3598], std: 0.0542
  RMSE : 0.0893, R2: 0.2123, MAE: 0.0704, Spearman rho: 0.4687, Spearman p: 5.5668e-34, Pearson r: 0.4665, Pearson p: 1.1888e-33
  Pred range: [0.0074, 0.3769], std: 0.0547
  RMSE : 0.0912, R2: 0.1780, MAE: 0.0728, Spearman rho: 0.4652, Spearman p: 1.9347e-33, Pearson r: 0.4605, Pearson p: 1.0047e-32
  Pred range: [-0.0139, 0.3434], std: 0.0513
  RMSE : 0.0891, R2: 0.2156, MAE: 0.0707, Spearman rho: 0.4670, Spearman p: 9.9627e-34, Pearson r: 0.4669, Pearson p: 1.0272e-33
  Pred range: [-0.0251, 0.3603], std: 0.0540
  RMSE : 0.0894, R2: 0.2107, MAE: 0.0707, Spearman rho: 0.4621, Spearman p: 5.8163e-33, Pearson r: 0.4649, Pearson p: 2.1521e-33
  Pred range: [-0.0164, 0.3562], std: 0.0543
  RMSE : 0.0888, R2: 0.2212, MAE: 0.0700, Spearman rho: 0.4712, Spearman p: 2.2464e-34, Pearson r: 0.4749, Pearson p: 5.7142e-35
  Pred range: [0.0125, 0.3818], std: 0.0563
  RMSE : 0.0914, R2: 0.1745, MAE: 0.0731, Spearman rho: 0.4667, Spearman p: 1.1408e-33, Pearson r: 0.4672, Pearson p: 9.3548e-34
  Pred range: [-0.0013, 0.3601], std: 0.0556
  RMSE : 0.0896, R2: 0.2068, MAE: 0.0711, Spearman rho: 0.4721, Spearman p: 1.6258e-34, Pearson r: 0.4747, Pearson p: 6.2815e-35
  Pred range: [-0.0018, 0.3656], std: 0.0570
  RMSE : 0.0910, R2: 0.1820, MAE: 0.0727, Spearman rho: 0.4671, Spearman p: 9.5704e-34, Pearson r: 0.4726, Pearson p: 1.3187e-34
  Pred range: [-0.0032, 0.3722], std: 0.0571
  RMSE : 0.0903, R2: 0.1941, MAE: 0.0719, Spearman rho: 0.4683, Spearman p: 6.4257e-34, Pearson r: 0.4736, Pearson p: 9.2512e-35
  Pred range: [-0.0040, 0.3845], std: 0.0597
  RMSE : 0.0903, R2: 0.1941, MAE: 0.0715, Spearman rho: 0.4687, Spearman p: 5.4705e-34, Pearson r: 0.4735, Pearson p: 9.7068e-35
  Pred range: [-0.0115, 0.3754], std: 0.0584
  RMSE : 0.0895, R2: 0.2085, MAE: 0.0706, Spearman rho: 0.4658, Spearman p: 1.5238e-33, Pearson r: 0.4718, Pearson p: 1.7633e-34
[I 2026-04-27 23:39:40,662] Trial 16 finished with value: 0.08877534626966004 and parameters: {'learning_rate': 0.0001532327293687706, 'batch_size': 4, 'num_epochs': 22, 'weight_decay': 1.2090389499202954e-05, 'depth_complex': 5, 'depth_moderate': 4, 'depth_simple': 1, 'dropout': 0.2640490779276665, 'se_reduction': 2, 'hidden_dim_min': 2, 'base_loss': 'huber', 'huber_delta': 0.061577490343088376, 'focal_gamma': 1.4206370810468671, 'n_bins': 7, 'scheduler_patience': 2, 'scheduler_factor': 0.45269942446041433, 'early_stopping_patience': 6}. Best is trial 8 with value: 0.08787048956906457.
Train: 2407 rows (1613 IDs),Test: 598 rows (404 IDs) 

n_features_x : 6, n_features_per_modality: [16, 23, 19, 17, 7, 4, 4, 4, 1, 4]

--- ImbalancedRegressionLoss initialized ---
  Bins: 6, Focal gamma: 2.167598866141164, Base loss: huber
  Bin [0.00, 0.17): count= 1538, weight=0.002
  Bin [0.17, 0.33): count=  789, weight=0.005
  Bin [0.33, 0.50): count=   69, weight=0.053
  Bin [0.50, 0.67): count=   10, weight=0.339
  Bin [0.67, 0.83): count=    1, weight=1.867
  Bin [0.83, 1.00): count=    0, weight=3.733
-------------------------------------------

  Pred range: [0.0136, 0.5324], std: 0.0782
  RMSE : 0.0991, R2: 0.0297, MAE: 0.0756, Spearman rho: 0.4189, Spearman p: 8.2950e-27, Pearson r: 0.4081, Pearson p: 2.1115e-25
  Pred range: [0.0738, 0.3869], std: 0.0533
  RMSE : 0.0989, R2: 0.0327, MAE: 0.0813, Spearman rho: 0.4219, Spearman p: 3.2755e-27, Pearson r: 0.4343, Pearson p: 6.7046e-29
  Pred range: [0.0627, 0.5791], std: 0.0757
  RMSE : 0.1137, R2: -0.2766, MAE: 0.0907, Spearman rho: 0.4225, Spearman p: 2.7022e-27, Pearson r: 0.4095, Pearson p: 1.3739e-25
  Pred range: [0.0177, 0.6235], std: 0.0741
  RMSE : 0.1062, R2: -0.1150, MAE: 0.0799, Spearman rho: 0.3614, Spearman p: 6.9016e-20, Pearson r: 0.3004, Pearson p: 6.1936e-14
  Pred range: [0.0842, 0.5247], std: 0.0655
  RMSE : 0.1112, R2: -0.2228, MAE: 0.0906, Spearman rho: 0.4278, Spearman p: 5.2219e-28, Pearson r: 0.4260, Pearson p: 9.1562e-28
  Pred range: [0.0264, 0.3017], std: 0.0493
  RMSE : 0.0966, R2: 0.0778, MAE: 0.0778, Spearman rho: 0.3999, Spearman p: 2.2814e-24, Pearson r: 0.3922, Pearson p: 1.9918e-23
