[I 2026-04-27 19:29:59,815] Trial 53 finished with value: 0.15283651010208804 and parameters: {'learning_rate': 0.0005626708204234796, 'batch_size': 6, 'num_epochs': 30, 'weight_decay': 6.423779251962655e-05, 'layers_PRS': 2, 'layers_SCZ15': 3, 'layers_ADHD9': 1, 'layers_ASD9': 5, 'layers_ACE15': 5, 'layers_ACE18': 6, 'layers_SUD18': 3, 'layers_SES': 6, 'layers_SEX': 2, 'dropout': 0.1528293217575392, 'se_reduction': 3, 'hidden_dim_min': 2, 'base_loss': 'huber', 'huber_delta': 0.10624076497263414, 'focal_gamma': 2.741089203591843, 'n_bins': 16, 'scheduler_patience': 4, 'scheduler_factor': 0.4862336553724815, 'early_stopping_patience': 8}. Best is trial 31 with value: 0.14835994978477499.
Train: 2407 rows (1613 IDs),Test: 598 rows (404 IDs) 

n_features_x : 6, n_features_per_modality: [16, 23, 19, 17, 7, 4, 4, 4, 1, 4]

--- ImbalancedRegressionLoss initialized ---
  Bins: 15, Focal gamma: 2.121416952519134, Base loss: huber
  Bin [0.00, 0.07): count=  383, weight=0.040
  Bin [0.07, 0.13): count=  377, weight=0.041
  Bin [0.13, 0.20): count=  405, weight=0.038
  Bin [0.20, 0.27): count=  295, weight=0.052
  Bin [0.27, 0.33): count=  349, weight=0.044
  Bin [0.33, 0.40): count=  162, weight=0.094
  Bin [0.40, 0.47): count=  134, weight=0.114
  Bin [0.47, 0.53): count=  108, weight=0.141
  Bin [0.53, 0.60): count=   78, weight=0.194
  Bin [0.60, 0.67): count=   47, weight=0.320
  Bin [0.67, 0.73): count=   41, weight=0.365
  Bin [0.73, 0.80): count=   19, weight=0.767
  Bin [0.80, 0.87): count=    5, weight=2.558
  Bin [0.87, 0.93): count=    2, weight=5.116
  Bin [0.93, 1.00): count=    2, weight=5.116
-------------------------------------------

  Pred range: [0.1420, 0.7011], std: 0.0943
  RMSE : 0.1790, R2: -0.0697, MAE: 0.1520, Spearman rho: 0.4645, Spearman p: 2.4593e-33, Pearson r: 0.4751, Pearson p: 5.2749e-35
  Pred range: [0.1348, 0.6718], std: 0.0945
  RMSE : 0.1696, R2: 0.0396, MAE: 0.1431, Spearman rho: 0.4922, Spearman p: 8.1318e-38, Pearson r: 0.5106, Pearson p: 5.1369e-41
  Pred range: [0.0801, 0.6288], std: 0.0908
  RMSE : 0.1510, R2: 0.2394, MAE: 0.1216, Spearman rho: 0.4912, Spearman p: 1.2129e-37, Pearson r: 0.5121, Pearson p: 2.7594e-41
  Pred range: [0.1044, 0.7237], std: 0.1036
  RMSE : 0.1640, R2: 0.1019, MAE: 0.1362, Spearman rho: 0.4936, Spearman p: 4.8733e-38, Pearson r: 0.5122, Pearson p: 2.6995e-41
  Pred range: [0.0997, 0.6372], std: 0.0961
  RMSE : 0.1516, R2: 0.2327, MAE: 0.1228, Spearman rho: 0.4949, Spearman p: 2.8828e-38, Pearson r: 0.5199, Pearson p: 1.0398e-42
  Pred range: [0.0383, 0.6609], std: 0.0979
  RMSE : 0.1512, R2: 0.2370, MAE: 0.1204, Spearman rho: 0.4853, Spearman p: 1.1574e-36, Pearson r: 0.5012, Pearson p: 2.3284e-39
  Pred range: [0.0108, 0.6981], std: 0.1016
  RMSE : 0.1580, R2: 0.1671, MAE: 0.1292, Spearman rho: 0.4923, Spearman p: 7.8611e-38, Pearson r: 0.5096, Pearson p: 7.7223e-41
  Pred range: [0.0855, 0.7551], std: 0.1017
  RMSE : 0.1765, R2: -0.0394, MAE: 0.1496, Spearman rho: 0.4893, Spearman p: 2.5452e-37, Pearson r: 0.5141, Pearson p: 1.1961e-41
  Pred range: [0.0043, 0.6723], std: 0.1012
  RMSE : 0.1495, R2: 0.2537, MAE: 0.1188, Spearman rho: 0.4922, Spearman p: 8.3954e-38, Pearson r: 0.5156, Pearson p: 6.3255e-42
  Pred range: [0.0299, 0.6802], std: 0.0968
  RMSE : 0.1545, R2: 0.2032, MAE: 0.1264, Spearman rho: 0.4879, Spearman p: 4.3839e-37, Pearson r: 0.5118, Pearson p: 3.1647e-41
  Pred range: [0.0279, 0.6832], std: 0.1000
  RMSE : 0.1546, R2: 0.2027, MAE: 0.1264, Spearman rho: 0.4897, Spearman p: 2.1823e-37, Pearson r: 0.5145, Pearson p: 1.0005e-41
  Pred range: [0.0283, 0.6678], std: 0.0988
  RMSE : 0.1496, R2: 0.2530, MAE: 0.1192, Spearman rho: 0.4949, Spearman p: 2.8882e-38, Pearson r: 0.5165, Pearson p: 4.3076e-42
  Pred range: [0.0453, 0.7219], std: 0.1075
  RMSE : 0.1545, R2: 0.2034, MAE: 0.1250, Spearman rho: 0.4970, Spearman p: 1.2628e-38, Pearson r: 0.5185, Pearson p: 1.8581e-42
  Pred range: [0.0340, 0.6903], std: 0.1067
  RMSE : 0.1506, R2: 0.2434, MAE: 0.1197, Spearman rho: 0.4903, Spearman p: 1.7237e-37, Pearson r: 0.5148, Pearson p: 8.9683e-42
  Pred range: [0.0463, 0.7389], std: 0.1042
  RMSE : 0.1571, R2: 0.1764, MAE: 0.1286, Spearman rho: 0.4931, Spearman p: 5.8316e-38, Pearson r: 0.5147, Pearson p: 9.1449e-42
[I 2026-04-27 19:32:05,607] Trial 54 finished with value: 0.14952492808188933 and parameters: {'learning_rate': 0.0012437621598420105, 'batch_size': 6, 'num_epochs': 28, 'weight_decay': 2.6086166400574706e-05, 'layers_PRS': 4, 'layers_SCZ15': 4, 'layers_ADHD9': 3, 'layers_ASD9': 4, 'layers_ACE15': 5, 'layers_ACE18': 7, 'layers_SUD18': 7, 'layers_SES': 4, 'layers_SEX': 4, 'dropout': 0.1747834552600555, 'se_reduction': 4, 'hidden_dim_min': 5, 'base_loss': 'huber', 'huber_delta': 0.0929537575263446, 'focal_gamma': 2.121416952519134, 'n_bins': 15, 'scheduler_patience': 4, 'scheduler_factor': 0.5244359182063485, 'early_stopping_patience': 6}. Best is trial 31 with value: 0.14835994978477499.
Train: 2407 rows (1613 IDs),Test: 598 rows (404 IDs) 

n_features_x : 6, n_features_per_modality: [16, 23, 19, 17, 7, 4, 4, 4, 1, 4]

--- ImbalancedRegressionLoss initialized ---
  Bins: 17, Focal gamma: 1.9670781200292422, Base loss: huber
  Bin [0.00, 0.06): count=  172, weight=0.058
  Bin [0.06, 0.12): count=  413, weight=0.024
  Bin [0.12, 0.18): count=  376, weight=0.027
  Bin [0.18, 0.24): count=  370, weight=0.027
  Bin [0.24, 0.29): count=  255, weight=0.039
  Bin [0.29, 0.35): count=  223, weight=0.045
  Bin [0.35, 0.41): count=  162, weight=0.061
  Bin [0.41, 0.47): count=  134, weight=0.074
  Bin [0.47, 0.53): count=  108, weight=0.092
  Bin [0.53, 0.59): count=   78, weight=0.127
  Bin [0.59, 0.65): count=   47, weight=0.208
  Bin [0.65, 0.71): count=   27, weight=0.357
  Bin [0.71, 0.76): count=   26, weight=0.370
  Bin [0.76, 0.82): count=    9, weight=0.999
  Bin [0.82, 0.88): count=    4, weight=1.999
  Bin [0.88, 0.94): count=    3, weight=2.499
  Bin [0.94, 1.00): count=    0, weight=9.995
-------------------------------------------

  Pred range: [0.1237, 0.6744], std: 0.0862
  RMSE : 0.1956, R2: -0.2773, MAE: 0.1669, Spearman rho: 0.3961, Spearman p: 6.6003e-24, Pearson r: 0.4168, Pearson p: 1.5654e-26
  Pred range: [0.1197, 0.7401], std: 0.1015
  RMSE : 0.1881, R2: -0.1807, MAE: 0.1591, Spearman rho: 0.4525, Spearman p: 1.6172e-31, Pearson r: 0.4733, Pearson p: 1.0192e-34
  Pred range: [0.1228, 0.7808], std: 0.1113
  RMSE : 0.1967, R2: -0.2913, MAE: 0.1667, Spearman rho: 0.4725, Spearman p: 1.3903e-34, Pearson r: 0.4911, Pearson p: 1.2515e-37
  Pred range: [0.0967, 0.7025], std: 0.1011
  RMSE : 0.1653, R2: 0.0875, MAE: 0.1369, Spearman rho: 0.4774, Spearman p: 2.3179e-35, Pearson r: 0.4966, Pearson p: 1.4607e-38
  Pred range: [0.1019, 0.6978], std: 0.1007
  RMSE : 0.1665, R2: 0.0744, MAE: 0.1387, Spearman rho: 0.4806, Spearman p: 6.9855e-36, Pearson r: 0.5036, Pearson p: 8.8495e-40
  Pred range: [0.1101, 0.7523], std: 0.1042
  RMSE : 0.1693, R2: 0.0435, MAE: 0.1412, Spearman rho: 0.4768, Spearman p: 2.8739e-35, Pearson r: 0.5021, Pearson p: 1.6763e-39
[I 2026-04-27 19:32:16,246] Trial 55 pruned. 
Train: 2407 rows (1613 IDs),Test: 598 rows (404 IDs) 

n_features_x : 6, n_features_per_modality: [16, 23, 19, 17, 7, 4, 4, 4, 1, 4]

--- ImbalancedRegressionLoss initialized ---
  Bins: 13, Focal gamma: 2.0539503211164423, Base loss: mse
  Bin [0.00, 0.08): count=  383, weight=0.049
  Bin [0.08, 0.15): count=  578, weight=0.032
  Bin [0.15, 0.23): count=  370, weight=0.051
  Bin [0.23, 0.31): count=  368, weight=0.051
  Bin [0.31, 0.38): count=  199, weight=0.094
  Bin [0.38, 0.46): count=  207, weight=0.090
  Bin [0.46, 0.54): count=  108, weight=0.172
  Bin [0.54, 0.62): count=  106, weight=0.176
  Bin [0.62, 0.69): count=   36, weight=0.508
  Bin [0.69, 0.77): count=   36, weight=0.508
  Bin [0.77, 0.85): count=    9, weight=1.878
  Bin [0.85, 0.92): count=    5, weight=3.130
  Bin [0.92, 1.00): count=    2, weight=6.261
-------------------------------------------

  Pred range: [0.1601, 0.6989], std: 0.0915
  RMSE : 0.2183, R2: -0.5911, MAE: 0.1906, Spearman rho: 0.4388, Spearman p: 1.5286e-29, Pearson r: 0.4643, Pearson p: 2.6330e-33
  Pred range: [-0.0229, 0.5952], std: 0.0901
  RMSE : 0.1667, R2: 0.0729, MAE: 0.1400, Spearman rho: 0.4481, Spearman p: 7.0805e-31, Pearson r: 0.4724, Pearson p: 1.4428e-34
  Pred range: [0.0745, 0.6505], std: 0.0946
  RMSE : 0.1595, R2: 0.1506, MAE: 0.1330, Spearman rho: 0.4855, Spearman p: 1.0926e-36, Pearson r: 0.5114, Pearson p: 3.6837e-41
  Pred range: [0.0399, 0.6829], std: 0.1057
  RMSE : 0.1873, R2: -0.1713, MAE: 0.1597, Spearman rho: 0.4905, Spearman p: 1.6272e-37, Pearson r: 0.5063, Pearson p: 2.9591e-40
  Pred range: [-0.0065, 0.7252], std: 0.0941
  RMSE : 0.1678, R2: 0.0605, MAE: 0.1411, Spearman rho: 0.4655, Spearman p: 1.7139e-33, Pearson r: 0.4784, Pearson p: 1.5741e-35
  Pred range: [0.0610, 0.7092], std: 0.0831
  RMSE : 0.1568, R2: 0.1793, MAE: 0.1303, Spearman rho: 0.4601, Spearman p: 1.1785e-32, Pearson r: 0.4893, Pearson p: 2.5111e-37
  Pred range: [0.0330, 0.6914], std: 0.0787
  RMSE : 0.1689, R2: 0.0473, MAE: 0.1446, Spearman rho: 0.4717, Spearman p: 1.8433e-34, Pearson r: 0.4901, Pearson p: 1.8470e-37
  Pred range: [-0.0789, 0.6630], std: 0.0984
  RMSE : 0.1566, R2: 0.1818, MAE: 0.1272, Spearman rho: 0.4389, Spearman p: 1.5093e-29, Pearson r: 0.4727, Pearson p: 1.2962e-34
  Pred range: [0.1327, 0.6649], std: 0.0973
  RMSE : 0.1666, R2: 0.0737, MAE: 0.1400, Spearman rho: 0.4762, Spearman p: 3.6016e-35, Pearson r: 0.5053, Pearson p: 4.4827e-40
  Pred range: [0.0637, 0.6257], std: 0.0910
  RMSE : 0.1542, R2: 0.2066, MAE: 0.1240, Spearman rho: 0.4318, Spearman p: 1.4639e-28, Pearson r: 0.4656, Pearson p: 1.6612e-33
  Pred range: [0.0360, 0.7124], std: 0.1052
  RMSE : 0.1567, R2: 0.1804, MAE: 0.1271, Spearman rho: 0.4454, Spearman p: 1.7714e-30, Pearson r: 0.4907, Pearson p: 1.4946e-37
  Pred range: [0.0431, 0.6675], std: 0.0962
  RMSE : 0.1577, R2: 0.1697, MAE: 0.1288, Spearman rho: 0.4413, Spearman p: 6.8352e-30, Pearson r: 0.4879, Pearson p: 4.3847e-37
  Pred range: [0.0697, 0.7054], std: 0.1012
  RMSE : 0.1788, R2: -0.0673, MAE: 0.1511, Spearman rho: 0.4228, Spearman p: 2.4886e-27, Pearson r: 0.4541, Pearson p: 9.3775e-32
  Pred range: [-0.0342, 0.6275], std: 0.0893
  RMSE : 0.1629, R2: 0.1143, MAE: 0.1349, Spearman rho: 0.4129, Spearman p: 5.0997e-26, Pearson r: 0.4514, Pearson p: 2.3389e-31
  Pred range: [0.0148, 0.7357], std: 0.0974
  RMSE : 0.1726, R2: 0.0058, MAE: 0.1440, Spearman rho: 0.4165, Spearman p: 1.7285e-26, Pearson r: 0.4353, Pearson p: 4.8109e-29
  Pred range: [-0.0061, 0.7886], std: 0.1163
  RMSE : 0.1676, R2: 0.0622, MAE: 0.1361, Spearman rho: 0.4470, Spearman p: 1.0384e-30, Pearson r: 0.4723, Pearson p: 1.4720e-34
[I 2026-04-27 19:34:13,865] Trial 56 finished with value: 0.15417495570473663 and parameters: {'learning_rate': 0.004507081672818017, 'batch_size': 6, 'num_epochs': 26, 'weight_decay': 1.9920348808741347e-05, 'layers_PRS': 1, 'layers_SCZ15': 4, 'layers_ADHD9': 4, 'layers_ASD9': 4, 'layers_ACE15': 4, 'layers_ACE18': 6, 'layers_SUD18': 7, 'layers_SES': 3, 'layers_SEX': 4, 'dropout': 0.17632237490137595, 'se_reduction': 5, 'hidden_dim_min': 8, 'base_loss': 'mse', 'huber_delta': 0.08890708785377115, 'focal_gamma': 2.0539503211164423, 'n_bins': 13, 'scheduler_patience': 4, 'scheduler_factor': 0.4466106638118388, 'early_stopping_patience': 6}. Best is trial 31 with value: 0.14835994978477499.
Train: 2407 rows (1613 IDs),Test: 598 rows (404 IDs) 

n_features_x : 6, n_features_per_modality: [16, 23, 19, 17, 7, 4, 4, 4, 1, 4]

--- ImbalancedRegressionLoss initialized ---
  Bins: 11, Focal gamma: 2.109440176536092, Base loss: huber
  Bin [0.00, 0.09): count=  585, weight=0.034
  Bin [0.09, 0.18): count=  580, weight=0.034
  Bin [0.18, 0.27): count=  421, weight=0.047
  Bin [0.27, 0.36): count=  312, weight=0.064
  Bin [0.36, 0.45): count=  207, weight=0.096
  Bin [0.45, 0.55): count=  108, weight=0.183
  Bin [0.55, 0.64): count=  125, weight=0.159
  Bin [0.64, 0.73): count=   41, weight=0.476
  Bin [0.73, 0.82): count=   21, weight=0.909
  Bin [0.82, 0.91): count=    4, weight=3.999
  Bin [0.91, 1.00): count=    3, weight=4.998
-------------------------------------------

  Pred range: [0.1076, 0.5812], std: 0.0856
  RMSE : 0.1547, R2: 0.2016, MAE: 0.1255, Spearman rho: 0.4659, Spearman p: 1.4843e-33, Pearson r: 0.4853, Pearson p: 1.1780e-36
  Pred range: [0.1203, 0.7285], std: 0.1060
  RMSE : 0.1649, R2: 0.0929, MAE: 0.1369, Spearman rho: 0.4924, Spearman p: 7.6351e-38, Pearson r: 0.5097, Pearson p: 7.5491e-41
  Pred range: [0.0987, 0.6489], std: 0.0915
  RMSE : 0.1519, R2: 0.2301, MAE: 0.1229, Spearman rho: 0.4897, Spearman p: 2.1852e-37, Pearson r: 0.5091, Pearson p: 9.5213e-41
  Pred range: [0.1033, 0.6287], std: 0.0922
  RMSE : 0.1541, R2: 0.2076, MAE: 0.1263, Spearman rho: 0.4915, Spearman p: 1.0783e-37, Pearson r: 0.5133, Pearson p: 1.6891e-41
  Pred range: [0.0469, 0.5695], std: 0.0873
  RMSE : 0.1494, R2: 0.2549, MAE: 0.1190, Spearman rho: 0.4971, Spearman p: 1.2037e-38, Pearson r: 0.5157, Pearson p: 6.2162e-42
  Pred range: [0.0175, 0.6142], std: 0.0914
  RMSE : 0.1491, R2: 0.2580, MAE: 0.1160, Spearman rho: 0.4908, Spearman p: 1.4472e-37, Pearson r: 0.5083, Pearson p: 1.3199e-40
  Pred range: [0.0655, 0.6506], std: 0.0972
  RMSE : 0.1500, R2: 0.2495, MAE: 0.1189, Spearman rho: 0.4949, Spearman p: 2.8308e-38, Pearson r: 0.5125, Pearson p: 2.3489e-41
  Pred range: [0.0706, 0.6742], std: 0.0934
  RMSE : 0.1553, R2: 0.1951, MAE: 0.1266, Spearman rho: 0.4853, Spearman p: 1.1844e-36, Pearson r: 0.5021, Pearson p: 1.6542e-39
  Pred range: [0.0863, 0.7059], std: 0.0941
  RMSE : 0.1594, R2: 0.1516, MAE: 0.1319, Spearman rho: 0.4900, Spearman p: 1.9500e-37, Pearson r: 0.5099, Pearson p: 6.8846e-41
  Pred range: [0.0329, 0.6955], std: 0.1004
  RMSE : 0.1503, R2: 0.2464, MAE: 0.1187, Spearman rho: 0.4927, Spearman p: 6.7358e-38, Pearson r: 0.5097, Pearson p: 7.3868e-41
  Pred range: [0.0454, 0.7475], std: 0.1077
  RMSE : 0.1598, R2: 0.1476, MAE: 0.1307, Spearman rho: 0.4912, Spearman p: 1.2024e-37, Pearson r: 0.5117, Pearson p: 3.2474e-41
  Pred range: [0.0174, 0.6739], std: 0.0923
  RMSE : 0.1519, R2: 0.2296, MAE: 0.1221, Spearman rho: 0.4814, Spearman p: 5.1729e-36, Pearson r: 0.5054, Pearson p: 4.3272e-40
[I 2026-04-27 19:36:29,963] Trial 57 finished with value: 0.1490961319991578 and parameters: {'learning_rate': 0.00045700150553769754, 'batch_size': 4, 'num_epochs': 27, 'weight_decay': 1.3088093454476609e-05, 'layers_PRS': 5, 'layers_SCZ15': 5, 'layers_ADHD9': 3, 'layers_ASD9': 4, 'layers_ACE15': 4, 'layers_ACE18': 4, 'layers_SUD18': 7, 'layers_SES': 3, 'layers_SEX': 3, 'dropout': 0.19232860345784883, 'se_reduction': 4, 'hidden_dim_min': 6, 'base_loss': 'huber', 'huber_delta': 0.128025511370853, 'focal_gamma': 2.109440176536092, 'n_bins': 11, 'scheduler_patience': 5, 'scheduler_factor': 0.4811959008306621, 'early_stopping_patience': 6}. Best is trial 31 with value: 0.14835994978477499.
Train: 2407 rows (1613 IDs),Test: 598 rows (404 IDs) 

n_features_x : 6, n_features_per_modality: [16, 23, 19, 17, 7, 4, 4, 4, 1, 4]

--- ImbalancedRegressionLoss initialized ---
  Bins: 9, Focal gamma: 2.1534680338600167, Base loss: huber
  Bin [0.00, 0.11): count=  585, weight=0.041
  Bin [0.11, 0.22): count=  746, weight=0.032
  Bin [0.22, 0.33): count=  478, weight=0.050
  Bin [0.33, 0.44): count=  231, weight=0.104
  Bin [0.44, 0.56): count=  215, weight=0.112
  Bin [0.56, 0.67): count=  100, weight=0.239
  Bin [0.67, 0.78): count=   36, weight=0.653
  Bin [0.78, 0.89): count=   13, weight=1.726
  Bin [0.89, 1.00): count=    3, weight=6.041
-------------------------------------------

  Pred range: [0.1256, 0.6081], std: 0.0873
  RMSE : 0.1628, R2: 0.1148, MAE: 0.1336, Spearman rho: 0.4492, Spearman p: 4.9540e-31, Pearson r: 0.4437, Pearson p: 3.0614e-30
  Pred range: [0.1220, 0.6530], std: 0.0937
  RMSE : 0.1699, R2: 0.0368, MAE: 0.1425, Spearman rho: 0.4724, Spearman p: 1.4323e-34, Pearson r: 0.4734, Pearson p: 9.8887e-35
  Pred range: [0.0875, 0.5887], std: 0.0920
  RMSE : 0.1512, R2: 0.2365, MAE: 0.1203, Spearman rho: 0.4972, Spearman p: 1.1554e-38, Pearson r: 0.5038, Pearson p: 8.2669e-40
  Pred range: [0.0749, 0.6400], std: 0.0998
  RMSE : 0.1546, R2: 0.2025, MAE: 0.1253, Spearman rho: 0.4985, Spearman p: 6.9905e-39, Pearson r: 0.5112, Pearson p: 4.0820e-41
  Pred range: [0.0937, 0.6247], std: 0.0978
  RMSE : 0.1595, R2: 0.1513, MAE: 0.1314, Spearman rho: 0.4990, Spearman p: 5.6022e-39, Pearson r: 0.5115, Pearson p: 3.4777e-41
  Pred range: [0.0778, 0.6079], std: 0.0945
  RMSE : 0.1514, R2: 0.2345, MAE: 0.1214, Spearman rho: 0.4972, Spearman p: 1.1537e-38, Pearson r: 0.5100, Pearson p: 6.4628e-41
  Pred range: [0.0694, 0.6487], std: 0.0986
  RMSE : 0.1539, R2: 0.2098, MAE: 0.1248, Spearman rho: 0.4960, Spearman p: 1.8666e-38, Pearson r: 0.5123, Pearson p: 2.5237e-41
  Pred range: [0.0445, 0.6575], std: 0.0982
  RMSE : 0.1531, R2: 0.2173, MAE: 0.1233, Spearman rho: 0.4919, Spearman p: 9.3112e-38, Pearson r: 0.5061, Pearson p: 3.2827e-40
  Pred range: [0.0618, 0.6544], std: 0.0980
  RMSE : 0.1528, R2: 0.2203, MAE: 0.1231, Spearman rho: 0.4911, Spearman p: 1.2681e-37, Pearson r: 0.5083, Pearson p: 1.3325e-40
[I 2026-04-27 19:38:14,174] Trial 58 finished with value: 0.1512414225203237 and parameters: {'learning_rate': 0.00038343613171757567, 'batch_size': 4, 'num_epochs': 25, 'weight_decay': 1.3510052036439171e-05, 'layers_PRS': 5, 'layers_SCZ15': 5, 'layers_ADHD9': 3, 'layers_ASD9': 3, 'layers_ACE15': 5, 'layers_ACE18': 4, 'layers_SUD18': 6, 'layers_SES': 3, 'layers_SEX': 3, 'dropout': 0.26990766050958376, 'se_reduction': 4, 'hidden_dim_min': 6, 'base_loss': 'huber', 'huber_delta': 0.08274528962228826, 'focal_gamma': 2.1534680338600167, 'n_bins': 9, 'scheduler_patience': 5, 'scheduler_factor': 0.5224118558962333, 'early_stopping_patience': 6}. Best is trial 31 with value: 0.14835994978477499.
Train: 2407 rows (1613 IDs),Test: 598 rows (404 IDs) 

n_features_x : 6, n_features_per_modality: [16, 23, 19, 17, 7, 4, 4, 4, 1, 4]

--- ImbalancedRegressionLoss initialized ---
  Bins: 11, Focal gamma: 1.7831077578572927, Base loss: huber
  Bin [0.00, 0.09): count=  585, weight=0.034
  Bin [0.09, 0.18): count=  580, weight=0.034
  Bin [0.18, 0.27): count=  421, weight=0.047
  Bin [0.27, 0.36): count=  312, weight=0.064
  Bin [0.36, 0.45): count=  207, weight=0.096
  Bin [0.45, 0.55): count=  108, weight=0.183
  Bin [0.55, 0.64): count=  125, weight=0.159
  Bin [0.64, 0.73): count=   41, weight=0.476
  Bin [0.73, 0.82): count=   21, weight=0.909
  Bin [0.82, 0.91): count=    4, weight=3.999
  Bin [0.91, 1.00): count=    3, weight=4.998
-------------------------------------------

  Pred range: [0.0984, 0.6279], std: 0.0829
  RMSE : 0.1539, R2: 0.2090, MAE: 0.1233, Spearman rho: 0.4631, Spearman p: 4.1036e-33, Pearson r: 0.4802, Pearson p: 8.1588e-36
  Pred range: [0.0931, 0.5594], std: 0.0820
  RMSE : 0.1501, R2: 0.2481, MAE: 0.1184, Spearman rho: 0.4800, Spearman p: 8.8215e-36, Pearson r: 0.5039, Pearson p: 7.8505e-40
  Pred range: [0.1106, 0.6216], std: 0.0934
  RMSE : 0.1552, R2: 0.1963, MAE: 0.1269, Spearman rho: 0.4970, Spearman p: 1.2602e-38, Pearson r: 0.5148, Pearson p: 8.8702e-42
  Pred range: [0.0924, 0.6385], std: 0.0990
  RMSE : 0.1541, R2: 0.2071, MAE: 0.1247, Spearman rho: 0.4962, Spearman p: 1.7154e-38, Pearson r: 0.5124, Pearson p: 2.4814e-41
  Pred range: [0.0995, 0.6269], std: 0.0974
  RMSE : 0.1531, R2: 0.2171, MAE: 0.1242, Spearman rho: 0.5035, Spearman p: 9.4128e-40, Pearson r: 0.5209, Pearson p: 6.7543e-43
  Pred range: [0.0982, 0.6074], std: 0.0953
  RMSE : 0.1528, R2: 0.2206, MAE: 0.1240, Spearman rho: 0.5006, Spearman p: 3.0057e-39, Pearson r: 0.5182, Pearson p: 2.0851e-42
  Pred range: [0.0980, 0.6204], std: 0.0969
  RMSE : 0.1530, R2: 0.2185, MAE: 0.1242, Spearman rho: 0.5001, Spearman p: 3.6991e-39, Pearson r: 0.5176, Pearson p: 2.7185e-42
